[{"date":20210307,"state":"GU","positive":7749,"probableCases":209,"negative":112887,"pending":null,"totalTestResultsSource":"posNeg","totalTestResults":120636,"hospitalizedCurrently":2,"hospitalizedCumulative":null,"inIcuCurrently":1,"inIcuCumulative":null,"onVentilatorCurrently":1,"onVentilatorCumulative":null,"recovered":7590,"lastUpdateEt":"3/7/2021 01:45","dateModified":"2021-03-07T01:45:00Z","checkTimeEt":"03/06 20:45","death":133,"hospitalized":null,"hospitalizedDischarged":null,"dateChecked":"2021-03-07T01:45:00Z","totalTestsViral":120426,"positiveTestsViral":null,"negativeTestsViral":null,"positiveCasesViral":7540,"deathConfirmed":null,"deathProbable":null,"totalTestEncountersViral":null,"totalTestsPeopleViral":null,"totalTestsAntibody":358,"positiveTestsAntibody":27,"negativeTestsAntibody":null,"totalTestsPeopleAntibody":null,"positiveTestsPeopleAntibody":null,"negativeTestsPeopleAntibody":null,"totalTestsPeopleAntigen":null,"positiveTestsPeopleAntigen":null,"totalTestsAntigen":9299,"positiveTestsAntigen":248,"fips":"66","positiveIncrease":0,"negativeIncrease":0,"total":120636,"totalTestResultsIncrease":0,"posNeg":120636,"dataQualityGrade":null,"deathIncrease":0,"hospitalizedIncrease":0,"hash":"b6fe9a2c36aa6e5b1f0b14dd057d23c6968b10a4","commercialScore":0,"negativeRegularScore":0,"negativeScore":0,"positiveScore":0,"score":0,"grade":""},{"date":20210306,"state":"GU","positive":7749,"probableCases":209,"negative":112887,"pending":null,"totalTestResultsSource":"posNeg","totalTestResults":120636,"hospitalizedCurrently":2,"hospitalizedCumulative":null,"inIcuCurrently":1,"inIcuCumulative":null,"onVentilatorCurrently":1,"onVentilatorCumulative":null,"recovered":7590,"lastUpdateEt":"3/6/2021 04:30","dateModified":"2021-03-06T04:30:00Z","checkTimeEt":"03/05 23:30","death":133,"hospitalized":null,"hospitalizedDischarged":null,"dateChecked":"2021-03-06T04:30:00Z","totalTestsViral":120426,"positiveTestsViral":null,"negativeTestsViral":null,"positiveCasesViral":7540,"deathConfirmed":null,"deathProbable":null,"totalTestEncountersViral":null,"totalTestsPeopleViral":null,"totalTestsAntibody":358,"positiveTestsAntibody":27,"negativeTestsAntibody":null,"totalTestsPeopleAntibody":null,"positiveTestsPeopleAntibody":null,"negativeTestsPeopleAntibody":null,"totalTestsPeopleAntigen":null,"positiveTestsPeopleAntigen":null,"totalTestsAntigen":9299,"positiveTestsAntigen":248,"fips":"66","positiveIncrease":1,"negativeIncrease":0,"total":120636,"totalTestResultsIncrease":1,"posNeg":120636,"dataQualityGrade":null,"deathIncrease":0,"hospitalizedIncrease":0,"hash":"3cbff9634f41aa86b1d49747dfdfffa10dec13d1","commercialScore":0,"negativeRegularScore":0,"negativeScore":0,"positiveScore":0,"score":0,"grade":""},{"date":20210305,"state":"GU","positive":7748,"probableCases":209,"negative":112887,"pending":null,"totalTestResultsSource":"posNeg","totalTestResults":120635,"hospitalizedCurrently":2,"hospitalizedCumulative":null,"inIcuCurrently":1,"inIcuCumulative":null,"onVentilatorCurrently":1,"onVentilatorCumulative":null,"recovered":7590,"lastUpdateEt":"3/5/2021 05:15","dateModified":"2021-03-05T05:15:00Z","checkTimeEt":"03/05 00:15","death":133,"hospitalized":null,"hospitalizedDischarged":null,"dateChecked":"2021-03-05T05:15:00Z","totalTestsViral":120426,"positiveTestsViral":null,"negativeTestsViral":null,"positiveCasesViral":7539,"deathConfirmed":null,"deathProbable":null,"totalTestEncountersViral":null,"totalTestsPeopleViral":null,"totalTestsAntibody":358,"positiveTestsAntibody":27,"negativeTestsAntibody":null,"totalTestsPeopleAntibody":null,"positiveTestsPeopleAntibody":null,"negativeTestsPeopleAntibody":null,"totalTestsPeopleAntigen":null,"positiveTestsPeopleAntigen":null,"totalTestsAntigen":9299,"positiveTestsAntigen":248,"fips":"66","positiveIncrease":1,"negativeIncrease":538,"total":120635,"totalTestResultsIncrease":539,"posNeg":120635,"dataQualityGrade":null,"deathIncrease":2,"hospitalizedIncrease":0,"hash":"524583f9e978db31d34ee7f054a60d5ecb9725b9","commercialScore":0,"negativeRegularScore":0,"negativeScore":0,"positiveScore":0,"score":0,"grade":""},{"date":20210304,"state":"GU","positive":7747,"probableCases":209,"negative":112349,"pending":null,"totalTestResultsSource":"posNeg","totalTestResults":120096,"hospitalizedCurrently":5,"hospitalizedCumulative":null,"inIcuCurrently":1,"inIcuCumulative":null,"onVentilatorCurrently":1,"onVentilatorCumulative":null,"recovered":7590,"lastUpdateEt":"3/4/2021 04:00","dateModified":"2021-03-04T04:00:00Z","checkTimeEt":"03/03 23:00","death":131,"hospitalized":null,"hospitalizedDischarged":null,"dateChecked":"2021-03-04T04:00:00Z","totalTestsViral":119887,"positiveTestsViral":null,"negativeTestsViral":null,"positiveCasesViral":7538,"deathConfirmed":null,"deathProbable":null,"totalTestEncountersViral":null,"totalTestsPeopleViral":null,"totalTestsAntibody":357,"positiveTestsAntibody":24,"negativeTestsAntibody":null,"totalTestsPeopleAntibody":null,"positiveTestsPeopleAntibody":null,"negativeTestsPeopleAntibody":null,"totalTestsPeopleAntigen":null,"positiveTestsPeopleAntigen":null,"totalTestsAntigen":9262,"positiveTestsAntigen":248,"fips":"66","positiveIncrease":2,"negativeIncrease":424,"total":120096,"totalTestResultsIncrease":426,"posNeg":120096,"dataQualityGrade":null,"deathIncrease":0,"hospitalizedIncrease":0,"hash":"ba6670d27b205a453db70ed72732636f857d0a82","commercialScore":0,"negativeRegularScore":0,"negativeScore":0,"positiveScore":0,"score":0,"grade":""},{"date":20210303,"state":"GU","positive":7745,"probableCases":209,"negative":111925,"pending":null,"totalTestResultsSource":"posNeg","totalTestResults":119670,"hospitalizedCurrently":4,"hospitalizedCumulative":null,"inIcuCurrently":1,"inIcuCumulative":null,"onVentilatorCurrently":1,"onVentilatorCumulative":null,"recovered":7583,"lastUpdateEt":"3/3/2021 04:45","dateModified":"2021-03-03T04:45:00Z","checkTimeEt":"03/02 23:45","death":131,"hospitalized":null,"hospitalizedDischarged":null,"dateChecked":"2021-03-03T04:45:00Z","totalTestsViral":119461,"positiveTestsViral":null,"negativeTestsViral":null,"positiveCasesViral":7536,"deathConfirmed":null,"deathProbable":null,"totalTestEncountersViral":null,"totalTestsPeopleViral":null,"totalTestsAntibody":356,"positiveTestsAntibody":24,"negativeTestsAntibody":null,"totalTestsPeopleAntibody":null,"positiveTestsPeopleAntibody":null,"negativeTestsPeopleAntibody":null,"totalTestsPeopleAntigen":null,"positiveTestsPeopleAntigen":null,"totalTestsAntigen":9234,"positiveTestsAntigen":248,"fips":"66","positiveIncrease":3,"negativeIncrease":378,"total":119670,"totalTestResultsIncrease":381,"posNeg":119670,"dataQualityGrade":null,"deathIncrease":0,"hospitalizedIncrease":0,"hash":"806fc84c298b64d28a38ac7e3c73fd649048f14c","commercialScore":0,"negativeRegularScore":0,"negativeScore":0,"positiveScore":0,"score":0,"grade":""},{"date":20210302,"state":"GU","positive":7742,"probableCases":209,"negative":111547,"pending":null,"totalTestResultsSource":"posNeg","totalTestResults":119289,"hospitalizedCurrently":4,"hospitalizedCumulative":null,"inIcuCurrently":2,"inIcuCumulative":null,"onVentilatorCurrently":1,"onVentilatorCumulative":null,"recovered":7580,"lastUpdateEt":"3/2/2021 06:00","dateModified":"2021-03-02T06:00:00Z","checkTimeEt":"03/02 01:00","death":131,"hospitalized":null,"hospitalizedDischarged":null,"dateChecked":"2021-03-02T06:00:00Z","totalTestsViral":119080,"positiveTestsViral":null,"negativeTestsViral":null,"positiveCasesViral":7533,"deathConfirmed":null,"deathProbable":null,"totalTestEncountersViral":null,"totalTestsPeopleViral":null,"totalTestsAntibody":356,"positiveTestsAntibody":24,"negativeTestsAntibody":null,"totalTestsPeopleAntibody":null,"positiveTestsPeopleAntibody":null,"negativeTestsPeopleAntibody":null,"totalTestsPeopleAntigen":null,"positiveTestsPeopleAntigen":null,"totalTestsAntigen":9204,"positiveTestsAntigen":248,"fips":"66","positiveIncrease":5,"negativeIncrease":1680,"total":119289,"totalTestResultsIncrease":1685,"posNeg":119289,"dataQualityGrade":null,"deathIncrease":0,"hospitalizedIncrease":0,"hash":"00433d3eea8eff01a380277c5648ac3e76a49483","commercialScore":0,"negativeRegularScore":0,"negativeScore":0,"positiveScore":0,"score":0,"grade":""},{"date":20210301,"state":"GU","positive":7737,"probableCases":209,"negative":109867,"pending":null,"totalTestResultsSource":"posNeg","totalTestResults":117604,"hospitalizedCurrently":3,"hospitalizedCumulative":null,"inIcuCurrently":2,"inIcuCumulative":null,"onVentilatorCurrently":1,"onVentilatorCumulative":null,"recovered":7564,"lastUpdateEt":"3/1/2021 06:30","dateModified":"2021-03-01T06:30:00Z","checkTimeEt":"03/01 01:30","death":131,"hospitalized":null,"hospitalizedDischarged":null,"dateChecked":"2021-03-01T06:30:00Z","totalTestsViral":117392,"positiveTestsViral":null,"negativeTestsViral":null,"positiveCasesViral":7528,"deathConfirmed":null,"deathProbable":null,"totalTestEncountersViral":null,"totalTestsPeopleViral":null,"totalTestsAntibody":352,"positiveTestsAntibody":24,"negativeTestsAntibody":null,"totalTestsPeopleAntibody":null,"positiveTestsPeopleAntibody":null,"negativeTestsPeopleAntibody":null,"totalTestsPeopleAntigen":null,"positiveTestsPeopleAntigen":null,"totalTestsAntigen":9111,"positiveTestsAntigen":248,"fips":"66","positiveIncrease":1,"negativeIncrease":0,"total":117604,"totalTestResultsIncrease":1,"posNeg":117604,"dataQualityGrade":null,"deathIncrease":0,"hospitalizedIncrease":0,"hash":"059b1d6fbe9a26e51401758c6676c340ff0d67d9","commercialScore":0,"negativeRegularScore":0,"negativeScore":0,"positiveScore":0,"score":0,"grade":""},{"date":20210228,"state":"GU","positive":7736,"probableCases":209,"negative":109867,"pending":null,"totalTestResultsSource":"posNeg","totalTestResults":117603,"hospitalizedCurrently":4,"hospitalizedCumulative":null,"inIcuCurrently":1,"inIcuCumulative":null,"onVentilatorCurrently":1,"onVentilatorCumulative":null,"recovered":7564,"lastUpdateEt":"2/27/2021 22:45","dateModified":"2021-02-27T22:45:00Z","checkTimeEt":"02/27 17:45","death":131,"hospitalized":null,"hospitalizedDischarged":null,"dateChecked":"2021-02-27T22:45:00Z","totalTestsViral":117392,"positiveTestsViral":null,"negativeTestsViral":null,"positiveCasesViral":7527,"deathConfirmed":null,"deathProbable":null,"totalTestEncountersViral":null,"totalTestsPeopleViral":null,"totalTestsAntibody":352,"positiveTestsAntibody":24,"negativeTestsAntibody":null,"totalTestsPeopleAntibody":null,"positiveTestsPeopleAntibody":null,"negativeTestsPeopleAntibody":null,"totalTestsPeopleAntigen":null,"positiveTestsPeopleAntigen":null,"totalTestsAntigen":9111,"positiveTestsAntigen":248,"fips":"66","positiveIncrease":1,"negativeIncrease":0,"total":117603,"totalTestResultsIncrease":1,"posNeg":117603,"dataQualityGrade":null,"deathIncrease":0,"hospitalizedIncrease":0,"hash":"644a6aca832663004222caee635a99b8b792a9b8","commercialScore":0,"negativeRegularScore":0,"negativeScore":0,"positiveScore":0,"score":0,"grade":""},{"date":20210227,"state":"GU","positive":7735,"probableCases":209,"negative":109867,"pending":null,"totalTestResultsSource":"posNeg","totalTestResults":117602,"hospitalizedCurrently":4,"hospitalizedCumulative":null,"inIcuCurrently":1,"inIcuCumulative":null,"onVentilatorCurrently":1,"onVentilatorCumulative":null,"recovered":7564,"lastUpdateEt":"2/27/2021 03:30","dateModified":"2021-02-27T03:30:00Z","checkTimeEt":"02/26 22:30","death":131,"hospitalized":null,"hospitalizedDischarged":null,"dateChecked":"2021-02-27T03:30:00Z","totalTestsViral":117392,"positiveTestsViral":null,"negativeTestsViral":null,"positiveCasesViral":7526,"deathConfirmed":null,"deathProbable":null,"totalTestEncountersViral":null,"totalTestsPeopleViral":null,"totalTestsAntibody":352,"positiveTestsAntibody":24,"negativeTestsAntibody":null,"totalTestsPeopleAntibody":null,"positiveTestsPeopleAntibody":null,"negativeTestsPeopleAntibody":null,"totalTestsPeopleAntigen":null,"positiveTestsPeopleAntigen":null,"totalTestsAntigen":9111,"positiveTestsAntigen":248,"fips":"66","positiveIncrease":1,"negativeIncrease":0,"total":117602,"totalTestResultsIncrease":1,"posNeg":117602,"dataQualityGrade":null,"deathIncrease":1,"hospitalizedIncrease":0,"hash":"4e0af643c16ca89564ede65d1bb65955503552cb","commercialScore":0,"negativeRegularScore":0,"negativeScore":0,"positiveScore":0,"score":0,"grade":""},{"date":20210226,"state":"GU","positive":7734,"probableCases":209,"negative":109867,"pending":null,"totalTestResultsSource":"posNeg","totalTestResults":117601,"hospitalizedCurrently":4,"hospitalizedCumulative":null,"inIcuCurrently":1,"inIcuCumulative":null,"onVentilatorCurrently":1,"onVentilatorCumulative":null,"recovered":7564,"lastUpdateEt":"2/26/2021 04:30","dateModified":"2021-02-26T04:30:00Z","checkTimeEt":"02/25 23:30","death":130,"hospitalized":null,"hospitalizedDischarged":null,"dateChecked":"2021-02-26T04:30:00Z","totalTestsViral":117392,"positiveTestsViral":null,"negativeTestsViral":null,"positiveCasesViral":7525,"deathConfirmed":null,"deathProbable":null,"totalTestEncountersViral":null,"totalTestsPeopleViral":null,"totalTestsAntibody":352,"positiveTestsAntibody":24,"negativeTestsAntibody":null,"totalTestsPeopleAntibody":null,"positiveTestsPeopleAntibody":null,"negativeTestsPeopleAntibody":null,"totalTestsPeopleAntigen":null,"positiveTestsPeopleAntigen":null,"totalTestsAntigen":9111,"positiveTestsAntigen":248,"fips":"66","positiveIncrease":4,"negativeIncrease":332,"total":117601,"totalTestResultsIncrease":336,"posNeg":117601,"dataQualityGrade":null,"deathIncrease":0,"hospitalizedIncrease":0,"hash":"2ab8dace9367b39c401658d58d2bc9bd96e0cc06","commercialScore":0,"negativeRegularScore":0,"negativeScore":0,"positiveScore":0,"score":0,"grade":""},{"date":20210225,"state":"GU","positive":7730,"probableCases":209,"negative":109535,"pending":null,"totalTestResultsSource":"posNeg","totalTestResults":117265,"hospitalizedCurrently":4,"hospitalizedCumulative":null,"inIcuCurrently":1,"inIcuCumulative":null,"onVentilatorCurrently":1,"onVentilatorCumulative":null,"recovered":7559,"lastUpdateEt":"2/25/2021 04:00","dateModified":"2021-02-25T04:00:00Z","checkTimeEt":"02/24 23:00","death":130,"hospitalized":null,"hospitalizedDischarged":null,"dateChecked":"2021-02-25T04:00:00Z","totalTestsViral":117056,"positiveTestsViral":null,"negativeTestsViral":null,"positiveCasesViral":7521,"deathConfirmed":null,"deathProbable":null,"totalTestEncountersViral":null,"totalTestsPeopleViral":null,"totalTestsAntibody":352,"positiveTestsAntibody":23,"negativeTestsAntibody":null,"totalTestsPeopleAntibody":null,"positiveTestsPeopleAntibody":null,"negativeTestsPeopleAntibody":null,"totalTestsPeopleAntigen":null,"positiveTestsPeopleAntigen":null,"totalTestsAntigen":9085,"positiveTestsAntigen":248,"fips":"66","positiveIncrease":1,"negativeIncrease":371,"total":117265,"totalTestResultsIncrease":372,"posNeg":117265,"dataQualityGrade":null,"deathIncrease":0,"hospitalizedIncrease":0,"hash":"5061f22ebc2e070a4040f528a35a320df6732baf","commercialScore":0,"negativeRegularScore":0,"negativeScore":0,"positiveScore":0,"score":0,"grade":""},{"date":20210224,"state":"GU","positive":7729,"probableCases":209,"negative":109164,"pending":null,"totalTestResultsSource":"posNeg","totalTestResults":116893,"hospitalizedCurrently":6,"hospitalizedCumulative":null,"inIcuCurrently":2,"inIcuCumulative":null,"onVentilatorCurrently":2,"onVentilatorCumulative":null,"recovered":7555,"lastUpdateEt":"2/24/2021 04:00","dateModified":"2021-02-24T04:00:00Z","checkTimeEt":"02/23 23:00","death":130,"hospitalized":null,"hospitalizedDischarged":null,"dateChecked":"2021-02-24T04:00:00Z","totalTestsViral":116684,"positiveTestsViral":null,"negativeTestsViral":null,"positiveCasesViral":7520,"deathConfirmed":null,"deathProbable":null,"totalTestEncountersViral":null,"totalTestsPeopleViral":null,"totalTestsAntibody":352,"positiveTestsAntibody":23,"negativeTestsAntibody":null,"totalTestsPeopleAntibody":null,"positiveTestsPeopleAntibody":null,"negativeTestsPeopleAntibody":null,"totalTestsPeopleAntigen":null,"positiveTestsPeopleAntigen":null,"totalTestsAntigen":9047,"positiveTestsAntigen":248,"fips":"66","positiveIncrease":2,"negativeIncrease":431,"total":116893,"totalTestResultsIncrease":433,"posNeg":116893,"dataQualityGrade":null,"deathIncrease":0,"hospitalizedIncrease":0,"hash":"fd68d3f2f928e5e716b5671052a99c95e41c8ba5","commercialScore":0,"negativeRegularScore":0,"negativeScore":0,"positiveScore":0,"score":0,"grade":""},{"date":20210223,"state":"GU","positive":7727,"probableCases":209,"negative":108733,"pending":null,"totalTestResultsSource":"posNeg","totalTestResults":116460,"hospitalizedCurrently":4,"hospitalizedCumulative":null,"inIcuCurrently":2,"inIcuCumulative":null,"onVentilatorCurrently":2,"onVentilatorCumulative":null,"recovered":7555,"lastUpdateEt":"2/23/2021 03:45","dateModified":"2021-02-23T03:45:00Z","checkTimeEt":"02/22 22:45","death":130,"hospitalized":null,"hospitalizedDischarged":null,"dateChecked":"2021-02-23T03:45:00Z","totalTestsViral":116251,"positiveTestsViral":null,"negativeTestsViral":null,"positiveCasesViral":7518,"deathConfirmed":null,"deathProbable":null,"totalTestEncountersViral":null,"totalTestsPeopleViral":null,"totalTestsAntibody":351,"positiveTestsAntibody":23,"negativeTestsAntibody":null,"totalTestsPeopleAntibody":null,"positiveTestsPeopleAntibody":null,"negativeTestsPeopleAntibody":null,"totalTestsPeopleAntigen":null,"positiveTestsPeopleAntigen":null,"totalTestsAntigen":9034,"positiveTestsAntigen":248,"fips":"66","positiveIncrease":0,"negativeIncrease":592,"total":116460,"totalTestResultsIncrease":592,"posNeg":116460,"dataQualityGrade":null,"deathIncrease":0,"hospitalizedIncrease":0,"hash":"71288597bdb3d63a12b082e280283d40bbeef7d9","commercialScore":0,"negativeRegularScore":0,"negativeScore":0,"positiveScore":0,"score":0,"grade":""},{"date":20210222,"state":"GU","positive":7727,"probableCases":209,"negative":108141,"pending":null,"totalTestResultsSource":"posNeg","totalTestResults":115868,"hospitalizedCurrently":5,"hospitalizedCumulative":null,"inIcuCurrently":2,"inIcuCumulative":null,"onVentilatorCurrently":2,"onVentilatorCumulative":null,"recovered":7544,"lastUpdateEt":"2/22/2021 06:00","dateModified":"2021-02-22T06:00:00Z","checkTimeEt":"02/22 01:00","death":130,"hospitalized":null,"hospitalizedDischarged":null,"dateChecked":"2021-02-22T06:00:00Z","totalTestsViral":115659,"positiveTestsViral":null,"negativeTestsViral":null,"positiveCasesViral":7518,"deathConfirmed":null,"deathProbable":null,"totalTestEncountersViral":null,"totalTestsPeopleViral":null,"totalTestsAntibody":351,"positiveTestsAntibody":23,"negativeTestsAntibody":null,"totalTestsPeopleAntibody":null,"positiveTestsPeopleAntibody":null,"negativeTestsPeopleAntibody":null,"totalTestsPeopleAntigen":null,"positiveTestsPeopleAntigen":null,"totalTestsAntigen":9021,"positiveTestsAntigen":248,"fips":"66","positiveIncrease":7,"negativeIncrease":1147,"total":115868,"totalTestResultsIncrease":1154,"posNeg":115868,"dataQualityGrade":null,"deathIncrease":0,"hospitalizedIncrease":0,"hash":"cc2315ce3ca58dd1d614d47745addb5645eddc1b","commercialScore":0,"negativeRegularScore":0,"negativeScore":0,"positiveScore":0,"score":0,"grade":""},{"date":20210221,"state":"GU","positive":7720,"probableCases":209,"negative":106994,"pending":null,"totalTestResultsSource":"posNeg","totalTestResults":114714,"hospitalizedCurrently":5,"hospitalizedCumulative":null,"inIcuCurrently":2,"inIcuCumulative":null,"onVentilatorCurrently":2,"onVentilatorCumulative":null,"recovered":7528,"lastUpdateEt":"2/21/2021 05:30","dateModified":"2021-02-21T05:30:00Z","checkTimeEt":"02/21 00:30","death":130,"hospitalized":null,"hospitalizedDischarged":null,"dateChecked":"2021-02-21T05:30:00Z","totalTestsViral":114500,"positiveTestsViral":null,"negativeTestsViral":null,"positiveCasesViral":7511,"deathConfirmed":null,"deathProbable":null,"totalTestEncountersViral":null,"totalTestsPeopleViral":null,"totalTestsAntibody":349,"positiveTestsAntibody":23,"negativeTestsAntibody":null,"totalTestsPeopleAntibody":null,"positiveTestsPeopleAntibody":null,"negativeTestsPeopleAntibody":null,"totalTestsPeopleAntigen":null,"positiveTestsPeopleAntigen":null,"totalTestsAntigen":9003,"positiveTestsAntigen":248,"fips":"66","positiveIncrease":4,"negativeIncrease":0,"total":114714,"totalTestResultsIncrease":4,"posNeg":114714,"dataQualityGrade":null,"deathIncrease":0,"hospitalizedIncrease":0,"hash":"cf2a772b2a0f6c283f478144f38cd6b83d758dca","commercialScore":0,"negativeRegularScore":0,"negativeScore":0,"positiveScore":0,"score":0,"grade":""},{"date":20210220,"state":"GU","positive":7716,"probableCases":209,"negative":106994,"pending":null,"totalTestResultsSource":"posNeg","totalTestResults":114710,"hospitalizedCurrently":5,"hospitalizedCumulative":null,"inIcuCurrently":2,"inIcuCumulative":null,"onVentilatorCurrently":2,"onVentilatorCumulative":null,"recovered":7528,"lastUpdateEt":"2/20/2021 08:30","dateModified":"2021-02-20T08:30:00Z","checkTimeEt":"02/20 03:30","death":130,"hospitalized":null,"hospitalizedDischarged":null,"dateChecked":"2021-02-20T08:30:00Z","totalTestsViral":114500,"positiveTestsViral":null,"negativeTestsViral":null,"positiveCasesViral":7507,"deathConfirmed":null,"deathProbable":null,"totalTestEncountersViral":null,"totalTestsPeopleViral":null,"totalTestsAntibody":349,"positiveTestsAntibody":23,"negativeTestsAntibody":null,"totalTestsPeopleAntibody":null,"positiveTestsPeopleAntibody":null,"negativeTestsPeopleAntibody":null,"totalTestsPeopleAntigen":null,"positiveTestsPeopleAntigen":null,"totalTestsAntigen":9003,"positiveTestsAntigen":248,"fips":"66","positiveIncrease":1,"negativeIncrease":0,"total":114710,"totalTestResultsIncrease":1,"posNeg":114710,"dataQualityGrade":null,"deathIncrease":0,"hospitalizedIncrease":0,"hash":"69704ab04096cafba08e0e78050c6cfb4dc0662a","commercialScore":0,"negativeRegularScore":0,"negativeScore":0,"positiveScore":0,"score":0,"grade":""},{"date":20210219,"state":"GU","positive":7715,"probableCases":209,"negative":106994,"pending":null,"totalTestResultsSource":"posNeg","totalTestResults":114709,"hospitalizedCurrently":5,"hospitalizedCumulative":null,"inIcuCurrently":2,"inIcuCumulative":null,"onVentilatorCurrently":2,"onVentilatorCumulative":null,"recovered":7528,"lastUpdateEt":"2/19/2021 05:15","dateModified":"2021-02-19T05:15:00Z","checkTimeEt":"02/19 00:15","death":130,"hospitalized":null,"hospitalizedDischarged":null,"dateChecked":"2021-02-19T05:15:00Z","totalTestsViral":114500,"positiveTestsViral":null,"negativeTestsViral":null,"positiveCasesViral":7506,"deathConfirmed":null,"deathProbable":null,"totalTestEncountersViral":null,"totalTestsPeopleViral":null,"totalTestsAntibody":349,"positiveTestsAntibody":23,"negativeTestsAntibody":null,"totalTestsPeopleAntibody":null,"positiveTestsPeopleAntibody":null,"negativeTestsPeopleAntibody":null,"totalTestsPeopleAntigen":null,"positiveTestsPeopleAntigen":null,"totalTestsAntigen":9003,"positiveTestsAntigen":248,"fips":"66","positiveIncrease":10,"negativeIncrease":373,"total":114709,"totalTestResultsIncrease":383,"posNeg":114709,"dataQualityGrade":null,"deathIncrease":0,"hospitalizedIncrease":0,"hash":"8d5705660e6da200b7f16619443f944c5cc62c55","commercialScore":0,"negativeRegularScore":0,"negativeScore":0,"positiveScore":0,"score":0,"grade":""},{"date":20210218,"state":"GU","positive":7705,"probableCases":208,"negative":106621,"pending":null,"totalTestResultsSource":"posNeg","totalTestResults":114326,"hospitalizedCurrently":6,"hospitalizedCumulative":null,"inIcuCurrently":2,"inIcuCumulative":null,"onVentilatorCurrently":2,"onVentilatorCumulative":null,"recovered":7528,"lastUpdateEt":"2/18/2021 06:00","dateModified":"2021-02-18T06:00:00Z","checkTimeEt":"02/18 01:00","death":130,"hospitalized":null,"hospitalizedDischarged":null,"dateChecked":"2021-02-18T06:00:00Z","totalTestsViral":114118,"positiveTestsViral":null,"negativeTestsViral":null,"positiveCasesViral":7497,"deathConfirmed":null,"deathProbable":null,"totalTestEncountersViral":null,"totalTestsPeopleViral":null,"totalTestsAntibody":349,"positiveTestsAntibody":23,"negativeTestsAntibody":null,"totalTestsPeopleAntibody":null,"positiveTestsPeopleAntibody":null,"negativeTestsPeopleAntibody":null,"totalTestsPeopleAntigen":null,"positiveTestsPeopleAntigen":null,"totalTestsAntigen":8864,"positiveTestsAntigen":247,"fips":"66","positiveIncrease":2,"negativeIncrease":390,"total":114326,"totalTestResultsIncrease":392,"posNeg":114326,"dataQualityGrade":null,"deathIncrease":0,"hospitalizedIncrease":0,"hash":"09352ade5e5e44f06537b7752f23313426bbd367","commercialScore":0,"negativeRegularScore":0,"negativeScore":0,"positiveScore":0,"score":0,"grade":""},{"date":20210217,"state":"GU","positive":7703,"probableCases":208,"negative":106231,"pending":null,"totalTestResultsSource":"posNeg","totalTestResults":113934,"hospitalizedCurrently":4,"hospitalizedCumulative":null,"inIcuCurrently":2,"inIcuCumulative":null,"onVentilatorCurrently":2,"onVentilatorCumulative":null,"recovered":7523,"lastUpdateEt":"2/17/2021 04:15","dateModified":"2021-02-17T04:15:00Z","checkTimeEt":"02/16 23:15","death":130,"hospitalized":null,"hospitalizedDischarged":null,"dateChecked":"2021-02-17T04:15:00Z","totalTestsViral":113726,"positiveTestsViral":null,"negativeTestsViral":null,"positiveCasesViral":7495,"deathConfirmed":null,"deathProbable":null,"totalTestEncountersViral":null,"totalTestsPeopleViral":null,"totalTestsAntibody":348,"positiveTestsAntibody":23,"negativeTestsAntibody":null,"totalTestsPeopleAntibody":null,"positiveTestsPeopleAntibody":null,"negativeTestsPeopleAntibody":null,"totalTestsPeopleAntigen":null,"positiveTestsPeopleAntigen":null,"totalTestsAntigen":8853,"positiveTestsAntigen":247,"fips":"66","positiveIncrease":2,"negativeIncrease":478,"total":113934,"totalTestResultsIncrease":480,"posNeg":113934,"dataQualityGrade":null,"deathIncrease":0,"hospitalizedIncrease":0,"hash":"8e3e8a6532a36a0ba7a1f1935c7a3737afecb0d0","commercialScore":0,"negativeRegularScore":0,"negativeScore":0,"positiveScore":0,"score":0,"grade":""},{"date":20210216,"state":"GU","positive":7701,"probableCases":208,"negative":105753,"pending":null,"totalTestResultsSource":"posNeg","totalTestResults":113454,"hospitalizedCurrently":6,"hospitalizedCumulative":null,"inIcuCurrently":2,"inIcuCumulative":null,"onVentilatorCurrently":2,"onVentilatorCumulative":null,"recovered":7500,"lastUpdateEt":"2/16/2021 06:00","dateModified":"2021-02-16T06:00:00Z","checkTimeEt":"02/16 01:00","death":130,"hospitalized":null,"hospitalizedDischarged":null,"dateChecked":"2021-02-16T06:00:00Z","totalTestsViral":113246,"positiveTestsViral":null,"negativeTestsViral":null,"positiveCasesViral":7493,"deathConfirmed":null,"deathProbable":null,"totalTestEncountersViral":null,"totalTestsPeopleViral":null,"totalTestsAntibody":348,"positiveTestsAntibody":23,"negativeTestsAntibody":null,"totalTestsPeopleAntibody":null,"positiveTestsPeopleAntibody":null,"negativeTestsPeopleAntibody":null,"totalTestsPeopleAntigen":null,"positiveTestsPeopleAntigen":null,"totalTestsAntigen":8837,"positiveTestsAntigen":247,"fips":"66","positiveIncrease":2,"negativeIncrease":537,"total":113454,"totalTestResultsIncrease":539,"posNeg":113454,"dataQualityGrade":null,"deathIncrease":0,"hospitalizedIncrease":0,"hash":"7940727542cd92f9492576d4946c2db6ac229101","commercialScore":0,"negativeRegularScore":0,"negativeScore":0,"positiveScore":0,"score":0,"grade":""},{"date":20210215,"state":"GU","positive":7699,"probableCases":208,"negative":105216,"pending":null,"totalTestResultsSource":"posNeg","totalTestResults":112915,"hospitalizedCurrently":6,"hospitalizedCumulative":null,"inIcuCurrently":3,"inIcuCumulative":null,"onVentilatorCurrently":2,"onVentilatorCumulative":null,"recovered":7484,"lastUpdateEt":"2/15/2021 05:15","dateModified":"2021-02-15T05:15:00Z","checkTimeEt":"02/15 00:15","death":130,"hospitalized":null,"hospitalizedDischarged":null,"dateChecked":"2021-02-15T05:15:00Z","totalTestsViral":112707,"positiveTestsViral":null,"negativeTestsViral":null,"positiveCasesViral":7491,"deathConfirmed":null,"deathProbable":null,"totalTestEncountersViral":null,"totalTestsPeopleViral":null,"totalTestsAntibody":347,"positiveTestsAntibody":23,"negativeTestsAntibody":null,"totalTestsPeopleAntibody":null,"positiveTestsPeopleAntibody":null,"negativeTestsPeopleAntibody":null,"totalTestsPeopleAntigen":null,"positiveTestsPeopleAntigen":null,"totalTestsAntigen":8785,"positiveTestsAntigen":247,"fips":"66","positiveIncrease":4,"negativeIncrease":677,"total":112915,"totalTestResultsIncrease":681,"posNeg":112915,"dataQualityGrade":null,"deathIncrease":0,"hospitalizedIncrease":0,"hash":"288d49046aeb7ac75b7735e3342e6805a6ace355","commercialScore":0,"negativeRegularScore":0,"negativeScore":0,"positiveScore":0,"score":0,"grade":""},{"date":20210214,"state":"GU","positive":7695,"probableCases":208,"negative":104539,"pending":null,"totalTestResultsSource":"posNeg","totalTestResults":112234,"hospitalizedCurrently":6,"hospitalizedCumulative":null,"inIcuCurrently":3,"inIcuCumulative":null,"onVentilatorCurrently":2,"onVentilatorCumulative":null,"recovered":7472,"lastUpdateEt":"2/14/2021 06:00","dateModified":"2021-02-14T06:00:00Z","checkTimeEt":"02/14 01:00","death":130,"hospitalized":null,"hospitalizedDischarged":null,"dateChecked":"2021-02-14T06:00:00Z","totalTestsViral":112020,"positiveTestsViral":null,"negativeTestsViral":null,"positiveCasesViral":7487,"deathConfirmed":null,"deathProbable":null,"totalTestEncountersViral":null,"totalTestsPeopleViral":null,"totalTestsAntibody":347,"positiveTestsAntibody":23,"negativeTestsAntibody":null,"totalTestsPeopleAntibody":null,"positiveTestsPeopleAntibody":null,"negativeTestsPeopleAntibody":null,"totalTestsPeopleAntigen":null,"positiveTestsPeopleAntigen":null,"totalTestsAntigen":8727,"positiveTestsAntigen":247,"fips":"66","positiveIncrease":3,"negativeIncrease":0,"total":112234,"totalTestResultsIncrease":3,"posNeg":112234,"dataQualityGrade":null,"deathIncrease":0,"hospitalizedIncrease":0,"hash":"830e8a8675752127de7893bea5ecf89ae7171bb7","commercialScore":0,"negativeRegularScore":0,"negativeScore":0,"positiveScore":0,"score":0,"grade":""},{"date":20210213,"state":"GU","positive":7692,"probableCases":208,"negative":104539,"pending":null,"totalTestResultsSource":"posNeg","totalTestResults":112231,"hospitalizedCurrently":7,"hospitalizedCumulative":null,"inIcuCurrently":4,"inIcuCumulative":null,"onVentilatorCurrently":2,"onVentilatorCumulative":null,"recovered":7472,"lastUpdateEt":"2/13/2021 04:00","dateModified":"2021-02-13T04:00:00Z","checkTimeEt":"02/12 23:00","death":130,"hospitalized":null,"hospitalizedDischarged":null,"dateChecked":"2021-02-13T04:00:00Z","totalTestsViral":112020,"positiveTestsViral":null,"negativeTestsViral":null,"positiveCasesViral":7484,"deathConfirmed":null,"deathProbable":null,"totalTestEncountersViral":null,"totalTestsPeopleViral":null,"totalTestsAntibody":347,"positiveTestsAntibody":23,"negativeTestsAntibody":null,"totalTestsPeopleAntibody":null,"positiveTestsPeopleAntibody":null,"negativeTestsPeopleAntibody":null,"totalTestsPeopleAntigen":null,"positiveTestsPeopleAntigen":null,"totalTestsAntigen":8727,"positiveTestsAntigen":247,"fips":"66","positiveIncrease":3,"negativeIncrease":0,"total":112231,"totalTestResultsIncrease":3,"posNeg":112231,"dataQualityGrade":null,"deathIncrease":0,"hospitalizedIncrease":0,"hash":"f7f85ab0eda8e3ffe6d95c15d6cda093a8164149","commercialScore":0,"negativeRegularScore":0,"negativeScore":0,"positiveScore":0,"score":0,"grade":""},{"date":20210212,"state":"GU","positive":7689,"probableCases":208,"negative":104539,"pending":null,"totalTestResultsSource":"posNeg","totalTestResults":112228,"hospitalizedCurrently":8,"hospitalizedCumulative":null,"inIcuCurrently":4,"inIcuCumulative":null,"onVentilatorCurrently":4,"onVentilatorCumulative":null,"recovered":7472,"lastUpdateEt":"2/12/2021 06:00","dateModified":"2021-02-12T06:00:00Z","checkTimeEt":"02/12 01:00","death":130,"hospitalized":null,"hospitalizedDischarged":null,"dateChecked":"2021-02-12T06:00:00Z","totalTestsViral":112020,"positiveTestsViral":null,"negativeTestsViral":null,"positiveCasesViral":7481,"deathConfirmed":null,"deathProbable":null,"totalTestEncountersViral":null,"totalTestsPeopleViral":null,"totalTestsAntibody":347,"positiveTestsAntibody":23,"negativeTestsAntibody":null,"totalTestsPeopleAntibody":null,"positiveTestsPeopleAntibody":null,"negativeTestsPeopleAntibody":null,"totalTestsPeopleAntigen":null,"positiveTestsPeopleAntigen":null,"totalTestsAntigen":8727,"positiveTestsAntigen":247,"fips":"66","positiveIncrease":3,"negativeIncrease":367,"total":112228,"totalTestResultsIncrease":370,"posNeg":112228,"dataQualityGrade":null,"deathIncrease":0,"hospitalizedIncrease":0,"hash":"aa9691da6e8ff057f60f12a6830cb488cbf0fa46","commercialScore":0,"negativeRegularScore":0,"negativeScore":0,"positiveScore":0,"score":0,"grade":""},{"date":20210211,"state":"GU","positive":7686,"probableCases":208,"negative":104172,"pending":null,"totalTestResultsSource":"posNeg","totalTestResults":111858,"hospitalizedCurrently":10,"hospitalizedCumulative":null,"inIcuCurrently":4,"inIcuCumulative":null,"onVentilatorCurrently":4,"onVentilatorCumulative":null,"recovered":7467,"lastUpdateEt":"2/1/2021 05:45","dateModified":"2021-02-01T05:45:00Z","checkTimeEt":"02/01 00:45","death":130,"hospitalized":null,"hospitalizedDischarged":null,"dateChecked":"2021-02-01T05:45:00Z","totalTestsViral":111650,"positiveTestsViral":null,"negativeTestsViral":null,"positiveCasesViral":7478,"deathConfirmed":null,"deathProbable":null,"totalTestEncountersViral":null,"totalTestsPeopleViral":null,"totalTestsAntibody":347,"positiveTestsAntibody":23,"negativeTestsAntibody":null,"totalTestsPeopleAntibody":null,"positiveTestsPeopleAntibody":null,"negativeTestsPeopleAntibody":null,"totalTestsPeopleAntigen":null,"positiveTestsPeopleAntigen":null,"totalTestsAntigen":8674,"positiveTestsAntigen":246,"fips":"66","positiveIncrease":3,"negativeIncrease":518,"total":111858,"totalTestResultsIncrease":521,"posNeg":111858,"dataQualityGrade":null,"deathIncrease":0,"hospitalizedIncrease":0,"hash":"4185bca3824f44fc1c48be7d434d7d9aec0ec397","commercialScore":0,"negativeRegularScore":0,"negativeScore":0,"positiveScore":0,"score":0,"grade":""},{"date":20210210,"state":"GU","positive":7683,"probableCases":207,"negative":103654,"pending":null,"totalTestResultsSource":"posNeg","totalTestResults":111337,"hospitalizedCurrently":10,"hospitalizedCumulative":null,"inIcuCurrently":3,"inIcuCumulative":null,"onVentilatorCurrently":3,"onVentilatorCumulative":null,"recovered":7460,"lastUpdateEt":"2/10/2021 05:30","dateModified":"2021-02-10T05:30:00Z","checkTimeEt":"02/10 00:30","death":130,"hospitalized":null,"hospitalizedDischarged":null,"dateChecked":"2021-02-10T05:30:00Z","totalTestsViral":111130,"positiveTestsViral":null,"negativeTestsViral":null,"positiveCasesViral":7476,"deathConfirmed":null,"deathProbable":null,"totalTestEncountersViral":null,"totalTestsPeopleViral":null,"totalTestsAntibody":345,"positiveTestsAntibody":23,"negativeTestsAntibody":null,"totalTestsPeopleAntibody":null,"positiveTestsPeopleAntibody":null,"negativeTestsPeopleAntibody":null,"totalTestsPeopleAntigen":null,"positiveTestsPeopleAntigen":null,"totalTestsAntigen":8661,"positiveTestsAntigen":246,"fips":"66","positiveIncrease":10,"negativeIncrease":525,"total":111337,"totalTestResultsIncrease":535,"posNeg":111337,"dataQualityGrade":null,"deathIncrease":0,"hospitalizedIncrease":0,"hash":"549aada6df3a2b7c6e69c60cb474b7a1e6daf6c9","commercialScore":0,"negativeRegularScore":0,"negativeScore":0,"positiveScore":0,"score":0,"grade":""},{"date":20210209,"state":"GU","positive":7673,"probableCases":207,"negative":103129,"pending":null,"totalTestResultsSource":"posNeg","totalTestResults":110802,"hospitalizedCurrently":8,"hospitalizedCumulative":null,"inIcuCurrently":3,"inIcuCumulative":null,"onVentilatorCurrently":3,"onVentilatorCumulative":null,"recovered":7451,"lastUpdateEt":"2/9/2021 07:15","dateModified":"2021-02-09T07:15:00Z","checkTimeEt":"02/09 02:15","death":130,"hospitalized":null,"hospitalizedDischarged":null,"dateChecked":"2021-02-09T07:15:00Z","totalTestsViral":110595,"positiveTestsViral":null,"negativeTestsViral":null,"positiveCasesViral":7466,"deathConfirmed":null,"deathProbable":null,"totalTestEncountersViral":null,"totalTestsPeopleViral":null,"totalTestsAntibody":345,"positiveTestsAntibody":23,"negativeTestsAntibody":null,"totalTestsPeopleAntibody":null,"positiveTestsPeopleAntibody":null,"negativeTestsPeopleAntibody":null,"totalTestsPeopleAntigen":null,"positiveTestsPeopleAntigen":null,"totalTestsAntigen":8518,"positiveTestsAntigen":246,"fips":"66","positiveIncrease":9,"negativeIncrease":399,"total":110802,"totalTestResultsIncrease":408,"posNeg":110802,"dataQualityGrade":null,"deathIncrease":0,"hospitalizedIncrease":0,"hash":"4e437dc725a28b24ad20557017229a8e97012bbb","commercialScore":0,"negativeRegularScore":0,"negativeScore":0,"positiveScore":0,"score":0,"grade":""},{"date":20210208,"state":"GU","positive":7664,"probableCases":207,"negative":102730,"pending":null,"totalTestResultsSource":"posNeg","totalTestResults":110394,"hospitalizedCurrently":9,"hospitalizedCumulative":null,"inIcuCurrently":3,"inIcuCumulative":null,"onVentilatorCurrently":3,"onVentilatorCumulative":null,"recovered":7431,"lastUpdateEt":"2/8/2021 07:15","dateModified":"2021-02-08T07:15:00Z","checkTimeEt":"02/08 02:15","death":130,"hospitalized":null,"hospitalizedDischarged":null,"dateChecked":"2021-02-08T07:15:00Z","totalTestsViral":110187,"positiveTestsViral":null,"negativeTestsViral":null,"positiveCasesViral":7457,"deathConfirmed":null,"deathProbable":null,"totalTestEncountersViral":null,"totalTestsPeopleViral":null,"totalTestsAntibody":344,"positiveTestsAntibody":23,"negativeTestsAntibody":null,"totalTestsPeopleAntibody":null,"positiveTestsPeopleAntibody":null,"negativeTestsPeopleAntibody":null,"totalTestsPeopleAntigen":null,"positiveTestsPeopleAntigen":null,"totalTestsAntigen":8506,"positiveTestsAntigen":246,"fips":"66","positiveIncrease":15,"negativeIncrease":1178,"total":110394,"totalTestResultsIncrease":1193,"posNeg":110394,"dataQualityGrade":null,"deathIncrease":0,"hospitalizedIncrease":0,"hash":"0f9d3eebfdc11f53c97bfdc613eb4fbb8d099619","commercialScore":0,"negativeRegularScore":0,"negativeScore":0,"positiveScore":0,"score":0,"grade":""},{"date":20210207,"state":"GU","positive":7649,"probableCases":207,"negative":101552,"pending":null,"totalTestResultsSource":"posNeg","totalTestResults":109201,"hospitalizedCurrently":9,"hospitalizedCumulative":null,"inIcuCurrently":3,"inIcuCumulative":null,"onVentilatorCurrently":2,"onVentilatorCumulative":null,"recovered":7416,"lastUpdateEt":"2/7/2021 08:00","dateModified":"2021-02-07T08:00:00Z","checkTimeEt":"02/07 03:00","death":130,"hospitalized":null,"hospitalizedDischarged":null,"dateChecked":"2021-02-07T08:00:00Z","totalTestsViral":108981,"positiveTestsViral":null,"negativeTestsViral":null,"positiveCasesViral":7442,"deathConfirmed":null,"deathProbable":null,"totalTestEncountersViral":null,"totalTestsPeopleViral":null,"totalTestsAntibody":343,"positiveTestsAntibody":23,"negativeTestsAntibody":null,"totalTestsPeopleAntibody":null,"positiveTestsPeopleAntibody":null,"negativeTestsPeopleAntibody":null,"totalTestsPeopleAntigen":null,"positiveTestsPeopleAntigen":null,"totalTestsAntigen":8392,"positiveTestsAntigen":246,"fips":"66","positiveIncrease":6,"negativeIncrease":0,"total":109201,"totalTestResultsIncrease":6,"posNeg":109201,"dataQualityGrade":null,"deathIncrease":1,"hospitalizedIncrease":0,"hash":"c0f7340d0209c9b23ca503e0b83e854dd5158729","commercialScore":0,"negativeRegularScore":0,"negativeScore":0,"positiveScore":0,"score":0,"grade":""},{"date":20210206,"state":"GU","positive":7643,"probableCases":207,"negative":101552,"pending":null,"totalTestResultsSource":"posNeg","totalTestResults":109195,"hospitalizedCurrently":8,"hospitalizedCumulative":null,"inIcuCurrently":3,"inIcuCumulative":null,"onVentilatorCurrently":2,"onVentilatorCumulative":null,"recovered":7416,"lastUpdateEt":"2/6/2021 05:15","dateModified":"2021-02-06T05:15:00Z","checkTimeEt":"02/06 00:15","death":129,"hospitalized":null,"hospitalizedDischarged":null,"dateChecked":"2021-02-06T05:15:00Z","totalTestsViral":108981,"positiveTestsViral":null,"negativeTestsViral":null,"positiveCasesViral":7436,"deathConfirmed":null,"deathProbable":null,"totalTestEncountersViral":null,"totalTestsPeopleViral":null,"totalTestsAntibody":343,"positiveTestsAntibody":23,"negativeTestsAntibody":null,"totalTestsPeopleAntibody":null,"positiveTestsPeopleAntibody":null,"negativeTestsPeopleAntibody":null,"totalTestsPeopleAntigen":null,"positiveTestsPeopleAntigen":null,"totalTestsAntigen":8392,"positiveTestsAntigen":246,"fips":"66","positiveIncrease":7,"negativeIncrease":0,"total":109195,"totalTestResultsIncrease":7,"posNeg":109195,"dataQualityGrade":null,"deathIncrease":0,"hospitalizedIncrease":0,"hash":"bceee0dfc364e5d838b46bde98a9eccaba5e6e29","commercialScore":0,"negativeRegularScore":0,"negativeScore":0,"positiveScore":0,"score":0,"grade":""},{"date":20210205,"state":"GU","positive":7636,"probableCases":207,"negative":101552,"pending":null,"totalTestResultsSource":"posNeg","totalTestResults":109188,"hospitalizedCurrently":6,"hospitalizedCumulative":null,"inIcuCurrently":2,"inIcuCumulative":null,"onVentilatorCurrently":2,"onVentilatorCumulative":null,"recovered":7416,"lastUpdateEt":"2/5/2021 06:00","dateModified":"2021-02-05T06:00:00Z","checkTimeEt":"02/05 01:00","death":129,"hospitalized":null,"hospitalizedDischarged":null,"dateChecked":"2021-02-05T06:00:00Z","totalTestsViral":108981,"positiveTestsViral":null,"negativeTestsViral":null,"positiveCasesViral":7429,"deathConfirmed":null,"deathProbable":null,"totalTestEncountersViral":null,"totalTestsPeopleViral":null,"totalTestsAntibody":343,"positiveTestsAntibody":23,"negativeTestsAntibody":null,"totalTestsPeopleAntibody":null,"positiveTestsPeopleAntibody":null,"negativeTestsPeopleAntibody":null,"totalTestsPeopleAntigen":null,"positiveTestsPeopleAntigen":null,"totalTestsAntigen":8392,"positiveTestsAntigen":246,"fips":"66","positiveIncrease":14,"negativeIncrease":355,"total":109188,"totalTestResultsIncrease":369,"posNeg":109188,"dataQualityGrade":null,"deathIncrease":0,"hospitalizedIncrease":0,"hash":"3ee1ab490e43e767b087727c47192306a898122d","commercialScore":0,"negativeRegularScore":0,"negativeScore":0,"positiveScore":0,"score":0,"grade":""},{"date":20210204,"state":"GU","positive":7622,"probableCases":207,"negative":101197,"pending":null,"totalTestResultsSource":"posNeg","totalTestResults":108819,"hospitalizedCurrently":5,"hospitalizedCumulative":null,"inIcuCurrently":2,"inIcuCumulative":null,"onVentilatorCurrently":2,"onVentilatorCumulative":null,"recovered":7410,"lastUpdateEt":"2/4/2021 03:30","dateModified":"2021-02-04T03:30:00Z","checkTimeEt":"02/03 22:30","death":129,"hospitalized":null,"hospitalizedDischarged":null,"dateChecked":"2021-02-04T03:30:00Z","totalTestsViral":108612,"positiveTestsViral":null,"negativeTestsViral":null,"positiveCasesViral":7415,"deathConfirmed":null,"deathProbable":null,"totalTestEncountersViral":null,"totalTestsPeopleViral":null,"totalTestsAntibody":343,"positiveTestsAntibody":22,"negativeTestsAntibody":null,"totalTestsPeopleAntibody":null,"positiveTestsPeopleAntibody":null,"negativeTestsPeopleAntibody":null,"totalTestsPeopleAntigen":null,"positiveTestsPeopleAntigen":null,"totalTestsAntigen":8333,"positiveTestsAntigen":270,"fips":"66","positiveIncrease":4,"negativeIncrease":446,"total":108819,"totalTestResultsIncrease":450,"posNeg":108819,"dataQualityGrade":null,"deathIncrease":0,"hospitalizedIncrease":0,"hash":"b33e94f3c6ad54f36f5317d9c0f40e3e44da68ae","commercialScore":0,"negativeRegularScore":0,"negativeScore":0,"positiveScore":0,"score":0,"grade":""},{"date":20210203,"state":"GU","positive":7618,"probableCases":207,"negative":100751,"pending":null,"totalTestResultsSource":"posNeg","totalTestResults":108369,"hospitalizedCurrently":6,"hospitalizedCumulative":null,"inIcuCurrently":2,"inIcuCumulative":null,"onVentilatorCurrently":2,"onVentilatorCumulative":null,"recovered":7407,"lastUpdateEt":"2/3/2021 03:45","dateModified":"2021-02-03T03:45:00Z","checkTimeEt":"02/02 22:45","death":129,"hospitalized":null,"hospitalizedDischarged":null,"dateChecked":"2021-02-03T03:45:00Z","totalTestsViral":108162,"positiveTestsViral":null,"negativeTestsViral":null,"positiveCasesViral":7411,"deathConfirmed":null,"deathProbable":null,"totalTestEncountersViral":null,"totalTestsPeopleViral":null,"totalTestsAntibody":343,"positiveTestsAntibody":22,"negativeTestsAntibody":null,"totalTestsPeopleAntibody":null,"positiveTestsPeopleAntibody":null,"negativeTestsPeopleAntibody":null,"totalTestsPeopleAntigen":null,"positiveTestsPeopleAntigen":null,"totalTestsAntigen":8321,"positiveTestsAntigen":270,"fips":"66","positiveIncrease":8,"negativeIncrease":529,"total":108369,"totalTestResultsIncrease":537,"posNeg":108369,"dataQualityGrade":null,"deathIncrease":0,"hospitalizedIncrease":0,"hash":"0c10e530a166ffb7899968f26423d8b36532bc7d","commercialScore":0,"negativeRegularScore":0,"negativeScore":0,"positiveScore":0,"score":0,"grade":""},{"date":20210202,"state":"GU","positive":7610,"probableCases":207,"negative":100222,"pending":null,"totalTestResultsSource":"posNeg","totalTestResults":107832,"hospitalizedCurrently":6,"hospitalizedCumulative":null,"inIcuCurrently":2,"inIcuCumulative":null,"onVentilatorCurrently":2,"onVentilatorCumulative":null,"recovered":7381,"lastUpdateEt":"2/2/2021 06:30","dateModified":"2021-02-02T06:30:00Z","checkTimeEt":"02/02 01:30","death":129,"hospitalized":null,"hospitalizedDischarged":null,"dateChecked":"2021-02-02T06:30:00Z","totalTestsViral":107625,"positiveTestsViral":null,"negativeTestsViral":null,"positiveCasesViral":7403,"deathConfirmed":null,"deathProbable":null,"totalTestEncountersViral":null,"totalTestsPeopleViral":null,"totalTestsAntibody":343,"positiveTestsAntibody":22,"negativeTestsAntibody":null,"totalTestsPeopleAntibody":null,"positiveTestsPeopleAntibody":null,"negativeTestsPeopleAntibody":null,"totalTestsPeopleAntigen":null,"positiveTestsPeopleAntigen":null,"totalTestsAntigen":8305,"positiveTestsAntigen":270,"fips":"66","positiveIncrease":2,"negativeIncrease":458,"total":107832,"totalTestResultsIncrease":460,"posNeg":107832,"dataQualityGrade":null,"deathIncrease":0,"hospitalizedIncrease":0,"hash":"160ec45db2509b9aac1511aca7513decfb08e9a7","commercialScore":0,"negativeRegularScore":0,"negativeScore":0,"positiveScore":0,"score":0,"grade":""},{"date":20210201,"state":"GU","positive":7608,"probableCases":207,"negative":99764,"pending":null,"totalTestResultsSource":"posNeg","totalTestResults":107372,"hospitalizedCurrently":6,"hospitalizedCumulative":null,"inIcuCurrently":2,"inIcuCumulative":null,"onVentilatorCurrently":2,"onVentilatorCumulative":null,"recovered":7377,"lastUpdateEt":"2/1/2021 07:00","dateModified":"2021-02-01T07:00:00Z","checkTimeEt":"02/01 02:00","death":129,"hospitalized":null,"hospitalizedDischarged":null,"dateChecked":"2021-02-01T07:00:00Z","totalTestsViral":107165,"positiveTestsViral":null,"negativeTestsViral":null,"positiveCasesViral":7401,"deathConfirmed":null,"deathProbable":null,"totalTestEncountersViral":null,"totalTestsPeopleViral":null,"totalTestsAntibody":343,"positiveTestsAntibody":22,"negativeTestsAntibody":null,"totalTestsPeopleAntibody":null,"positiveTestsPeopleAntibody":null,"negativeTestsPeopleAntibody":null,"totalTestsPeopleAntigen":null,"positiveTestsPeopleAntigen":null,"totalTestsAntigen":8240,"positiveTestsAntigen":270,"fips":"66","positiveIncrease":21,"negativeIncrease":1221,"total":107372,"totalTestResultsIncrease":1242,"posNeg":107372,"dataQualityGrade":null,"deathIncrease":0,"hospitalizedIncrease":0,"hash":"99912850df6384ff54ebb447af5697b1afc608c7","commercialScore":0,"negativeRegularScore":0,"negativeScore":0,"positiveScore":0,"score":0,"grade":""},{"date":20210131,"state":"GU","positive":7587,"probableCases":207,"negative":98543,"pending":null,"totalTestResultsSource":"posNeg","totalTestResults":106130,"hospitalizedCurrently":7,"hospitalizedCumulative":null,"inIcuCurrently":2,"inIcuCumulative":null,"onVentilatorCurrently":2,"onVentilatorCumulative":null,"recovered":7355,"lastUpdateEt":"1/31/2021 05:15","dateModified":"2021-01-31T05:15:00Z","checkTimeEt":"01/31 00:15","death":129,"hospitalized":null,"hospitalizedDischarged":null,"dateChecked":"2021-01-31T05:15:00Z","totalTestsViral":105915,"positiveTestsViral":null,"negativeTestsViral":null,"positiveCasesViral":7380,"deathConfirmed":null,"deathProbable":null,"totalTestEncountersViral":null,"totalTestsPeopleViral":null,"totalTestsAntibody":340,"positiveTestsAntibody":22,"negativeTestsAntibody":null,"totalTestsPeopleAntibody":null,"positiveTestsPeopleAntibody":null,"negativeTestsPeopleAntibody":null,"totalTestsPeopleAntigen":null,"positiveTestsPeopleAntigen":null,"totalTestsAntigen":8139,"positiveTestsAntigen":270,"fips":"66","positiveIncrease":1,"negativeIncrease":0,"total":106130,"totalTestResultsIncrease":1,"posNeg":106130,"dataQualityGrade":null,"deathIncrease":0,"hospitalizedIncrease":0,"hash":"960195c2eda301a6de15336578359c545b9dd288","commercialScore":0,"negativeRegularScore":0,"negativeScore":0,"positiveScore":0,"score":0,"grade":""},{"date":20210130,"state":"GU","positive":7586,"probableCases":207,"negative":98543,"pending":null,"totalTestResultsSource":"posNeg","totalTestResults":106129,"hospitalizedCurrently":8,"hospitalizedCumulative":null,"inIcuCurrently":2,"inIcuCumulative":null,"onVentilatorCurrently":2,"onVentilatorCumulative":null,"recovered":7355,"lastUpdateEt":"1/30/2021 07:30","dateModified":"2021-01-30T07:30:00Z","checkTimeEt":"01/30 02:30","death":129,"hospitalized":null,"hospitalizedDischarged":null,"dateChecked":"2021-01-30T07:30:00Z","totalTestsViral":105915,"positiveTestsViral":null,"negativeTestsViral":null,"positiveCasesViral":7379,"deathConfirmed":null,"deathProbable":null,"totalTestEncountersViral":null,"totalTestsPeopleViral":null,"totalTestsAntibody":340,"positiveTestsAntibody":22,"negativeTestsAntibody":null,"totalTestsPeopleAntibody":null,"positiveTestsPeopleAntibody":null,"negativeTestsPeopleAntibody":null,"totalTestsPeopleAntigen":null,"positiveTestsPeopleAntigen":null,"totalTestsAntigen":8139,"positiveTestsAntigen":270,"fips":"66","positiveIncrease":7,"negativeIncrease":0,"total":106129,"totalTestResultsIncrease":7,"posNeg":106129,"dataQualityGrade":null,"deathIncrease":0,"hospitalizedIncrease":0,"hash":"18d5ab6c2998a408544971437554ca5d24e0091f","commercialScore":0,"negativeRegularScore":0,"negativeScore":0,"positiveScore":0,"score":0,"grade":""},{"date":20210129,"state":"GU","positive":7579,"probableCases":207,"negative":98543,"pending":null,"totalTestResultsSource":"posNeg","totalTestResults":106122,"hospitalizedCurrently":8,"hospitalizedCumulative":null,"inIcuCurrently":2,"inIcuCumulative":null,"onVentilatorCurrently":2,"onVentilatorCumulative":null,"recovered":7355,"lastUpdateEt":"1/29/2021 06:15","dateModified":"2021-01-29T06:15:00Z","checkTimeEt":"01/29 01:15","death":129,"hospitalized":null,"hospitalizedDischarged":null,"dateChecked":"2021-01-29T06:15:00Z","totalTestsViral":105915,"positiveTestsViral":null,"negativeTestsViral":null,"positiveCasesViral":7372,"deathConfirmed":null,"deathProbable":null,"totalTestEncountersViral":null,"totalTestsPeopleViral":null,"totalTestsAntibody":340,"positiveTestsAntibody":22,"negativeTestsAntibody":null,"totalTestsPeopleAntibody":null,"positiveTestsPeopleAntibody":null,"negativeTestsPeopleAntibody":null,"totalTestsPeopleAntigen":null,"positiveTestsPeopleAntigen":null,"totalTestsAntigen":8139,"positiveTestsAntigen":270,"fips":"66","positiveIncrease":7,"negativeIncrease":321,"total":106122,"totalTestResultsIncrease":328,"posNeg":106122,"dataQualityGrade":null,"deathIncrease":0,"hospitalizedIncrease":0,"hash":"89f4fb07898ccc317f8e5b51c8c238cb1c453527","commercialScore":0,"negativeRegularScore":0,"negativeScore":0,"positiveScore":0,"score":0,"grade":""},{"date":20210128,"state":"GU","positive":7572,"probableCases":207,"negative":98222,"pending":null,"totalTestResultsSource":"posNeg","totalTestResults":105794,"hospitalizedCurrently":8,"hospitalizedCumulative":null,"inIcuCurrently":2,"inIcuCumulative":null,"onVentilatorCurrently":2,"onVentilatorCumulative":null,"recovered":7353,"lastUpdateEt":"1/28/2021 04:30","dateModified":"2021-01-28T04:30:00Z","checkTimeEt":"01/27 23:30","death":129,"hospitalized":null,"hospitalizedDischarged":null,"dateChecked":"2021-01-28T04:30:00Z","totalTestsViral":105587,"positiveTestsViral":null,"negativeTestsViral":null,"positiveCasesViral":7365,"deathConfirmed":null,"deathProbable":null,"totalTestEncountersViral":null,"totalTestsPeopleViral":null,"totalTestsAntibody":340,"positiveTestsAntibody":22,"negativeTestsAntibody":null,"totalTestsPeopleAntibody":null,"positiveTestsPeopleAntibody":null,"negativeTestsPeopleAntibody":null,"totalTestsPeopleAntigen":null,"positiveTestsPeopleAntigen":null,"totalTestsAntigen":8100,"positiveTestsAntigen":270,"fips":"66","positiveIncrease":4,"negativeIncrease":403,"total":105794,"totalTestResultsIncrease":407,"posNeg":105794,"dataQualityGrade":null,"deathIncrease":0,"hospitalizedIncrease":0,"hash":"e25112d5523a4935860cca5dd77cc154f885da05","commercialScore":0,"negativeRegularScore":0,"negativeScore":0,"positiveScore":0,"score":0,"grade":""},{"date":20210127,"state":"GU","positive":7568,"probableCases":207,"negative":97819,"pending":null,"totalTestResultsSource":"posNeg","totalTestResults":105387,"hospitalizedCurrently":9,"hospitalizedCumulative":null,"inIcuCurrently":3,"inIcuCumulative":null,"onVentilatorCurrently":2,"onVentilatorCumulative":null,"recovered":7351,"lastUpdateEt":"1/27/2021 06:45","dateModified":"2021-01-27T06:45:00Z","checkTimeEt":"01/27 01:45","death":129,"hospitalized":null,"hospitalizedDischarged":null,"dateChecked":"2021-01-27T06:45:00Z","totalTestsViral":105180,"positiveTestsViral":null,"negativeTestsViral":null,"positiveCasesViral":7361,"deathConfirmed":null,"deathProbable":null,"totalTestEncountersViral":null,"totalTestsPeopleViral":null,"totalTestsAntibody":338,"positiveTestsAntibody":22,"negativeTestsAntibody":null,"totalTestsPeopleAntibody":null,"positiveTestsPeopleAntibody":null,"negativeTestsPeopleAntibody":null,"totalTestsPeopleAntigen":null,"positiveTestsPeopleAntigen":null,"totalTestsAntigen":8087,"positiveTestsAntigen":270,"fips":"66","positiveIncrease":2,"negativeIncrease":502,"total":105387,"totalTestResultsIncrease":504,"posNeg":105387,"dataQualityGrade":null,"deathIncrease":0,"hospitalizedIncrease":0,"hash":"b7694d094e5958c6bdde7d9e706872e79e40b440","commercialScore":0,"negativeRegularScore":0,"negativeScore":0,"positiveScore":0,"score":0,"grade":""},{"date":20210126,"state":"GU","positive":7566,"probableCases":207,"negative":97317,"pending":null,"totalTestResultsSource":"posNeg","totalTestResults":104883,"hospitalizedCurrently":11,"hospitalizedCumulative":null,"inIcuCurrently":2,"inIcuCumulative":null,"onVentilatorCurrently":1,"onVentilatorCumulative":null,"recovered":7335,"lastUpdateEt":"1/26/2021 07:30","dateModified":"2021-01-26T07:30:00Z","checkTimeEt":"01/26 02:30","death":129,"hospitalized":null,"hospitalizedDischarged":null,"dateChecked":"2021-01-26T07:30:00Z","totalTestsViral":104676,"positiveTestsViral":null,"negativeTestsViral":null,"positiveCasesViral":7359,"deathConfirmed":null,"deathProbable":null,"totalTestEncountersViral":null,"totalTestsPeopleViral":null,"totalTestsAntibody":338,"positiveTestsAntibody":22,"negativeTestsAntibody":null,"totalTestsPeopleAntibody":null,"positiveTestsPeopleAntibody":null,"negativeTestsPeopleAntibody":null,"totalTestsPeopleAntigen":null,"positiveTestsPeopleAntigen":null,"totalTestsAntigen":8075,"positiveTestsAntigen":270,"fips":"66","positiveIncrease":12,"negativeIncrease":544,"total":104883,"totalTestResultsIncrease":556,"posNeg":104883,"dataQualityGrade":null,"deathIncrease":0,"hospitalizedIncrease":0,"hash":"a65d3f78a7b4dfb123d972bb5a25390810ce9e69","commercialScore":0,"negativeRegularScore":0,"negativeScore":0,"positiveScore":0,"score":0,"grade":""},{"date":20210125,"state":"GU","positive":7554,"probableCases":207,"negative":96773,"pending":null,"totalTestResultsSource":"posNeg","totalTestResults":104327,"hospitalizedCurrently":10,"hospitalizedCumulative":null,"inIcuCurrently":2,"inIcuCumulative":null,"onVentilatorCurrently":2,"onVentilatorCumulative":null,"recovered":7319,"lastUpdateEt":"1/25/2021 06:45","dateModified":"2021-01-25T06:45:00Z","checkTimeEt":"01/25 01:45","death":129,"hospitalized":null,"hospitalizedDischarged":null,"dateChecked":"2021-01-25T06:45:00Z","totalTestsViral":104120,"positiveTestsViral":null,"negativeTestsViral":null,"positiveCasesViral":7347,"deathConfirmed":null,"deathProbable":null,"totalTestEncountersViral":null,"totalTestsPeopleViral":null,"totalTestsAntibody":338,"positiveTestsAntibody":22,"negativeTestsAntibody":null,"totalTestsPeopleAntibody":null,"positiveTestsPeopleAntibody":null,"negativeTestsPeopleAntibody":null,"totalTestsPeopleAntigen":null,"positiveTestsPeopleAntigen":null,"totalTestsAntigen":8061,"positiveTestsAntigen":270,"fips":"66","positiveIncrease":7,"negativeIncrease":1046,"total":104327,"totalTestResultsIncrease":1053,"posNeg":104327,"dataQualityGrade":null,"deathIncrease":1,"hospitalizedIncrease":0,"hash":"f06322cde358ebcab091069271bb3f5ce3274966","commercialScore":0,"negativeRegularScore":0,"negativeScore":0,"positiveScore":0,"score":0,"grade":""},{"date":20210124,"state":"GU","positive":7547,"probableCases":207,"negative":95727,"pending":null,"totalTestResultsSource":"posNeg","totalTestResults":103274,"hospitalizedCurrently":11,"hospitalizedCumulative":null,"inIcuCurrently":3,"inIcuCumulative":null,"onVentilatorCurrently":3,"onVentilatorCumulative":null,"recovered":7293,"lastUpdateEt":"1/24/2021 07:00","dateModified":"2021-01-24T07:00:00Z","checkTimeEt":"01/24 02:00","death":128,"hospitalized":null,"hospitalizedDischarged":null,"dateChecked":"2021-01-24T07:00:00Z","totalTestsViral":103067,"positiveTestsViral":null,"negativeTestsViral":null,"positiveCasesViral":7340,"deathConfirmed":null,"deathProbable":null,"totalTestEncountersViral":null,"totalTestsPeopleViral":null,"totalTestsAntibody":337,"positiveTestsAntibody":22,"negativeTestsAntibody":null,"totalTestsPeopleAntibody":null,"positiveTestsPeopleAntibody":null,"negativeTestsPeopleAntibody":null,"totalTestsPeopleAntigen":null,"positiveTestsPeopleAntigen":null,"totalTestsAntigen":8012,"positiveTestsAntigen":270,"fips":"66","positiveIncrease":0,"negativeIncrease":0,"total":103274,"totalTestResultsIncrease":0,"posNeg":103274,"dataQualityGrade":null,"deathIncrease":0,"hospitalizedIncrease":0,"hash":"15307768c338ea8e91ef8e2912f34c33a130e2d0","commercialScore":0,"negativeRegularScore":0,"negativeScore":0,"positiveScore":0,"score":0,"grade":""},{"date":20210123,"state":"GU","positive":7547,"probableCases":207,"negative":95727,"pending":null,"totalTestResultsSource":"posNeg","totalTestResults":103274,"hospitalizedCurrently":9,"hospitalizedCumulative":null,"inIcuCurrently":3,"inIcuCumulative":null,"onVentilatorCurrently":3,"onVentilatorCumulative":null,"recovered":7293,"lastUpdateEt":"1/23/2021 07:30","dateModified":"2021-01-23T07:30:00Z","checkTimeEt":"01/23 02:30","death":128,"hospitalized":null,"hospitalizedDischarged":null,"dateChecked":"2021-01-23T07:30:00Z","totalTestsViral":103067,"positiveTestsViral":null,"negativeTestsViral":null,"positiveCasesViral":7340,"deathConfirmed":null,"deathProbable":null,"totalTestEncountersViral":null,"totalTestsPeopleViral":null,"totalTestsAntibody":337,"positiveTestsAntibody":22,"negativeTestsAntibody":null,"totalTestsPeopleAntibody":null,"positiveTestsPeopleAntibody":null,"negativeTestsPeopleAntibody":null,"totalTestsPeopleAntigen":null,"positiveTestsPeopleAntigen":null,"totalTestsAntigen":8012,"positiveTestsAntigen":270,"fips":"66","positiveIncrease":0,"negativeIncrease":0,"total":103274,"totalTestResultsIncrease":0,"posNeg":103274,"dataQualityGrade":null,"deathIncrease":0,"hospitalizedIncrease":0,"hash":"06dc8f8bb38db90b9283eed638bffeec774ed674","commercialScore":0,"negativeRegularScore":0,"negativeScore":0,"positiveScore":0,"score":0,"grade":""},{"date":20210122,"state":"GU","positive":7547,"probableCases":207,"negative":95727,"pending":null,"totalTestResultsSource":"posNeg","totalTestResults":103274,"hospitalizedCurrently":10,"hospitalizedCumulative":null,"inIcuCurrently":3,"inIcuCumulative":null,"onVentilatorCurrently":3,"onVentilatorCumulative":null,"recovered":7293,"lastUpdateEt":"1/22/2021 06:00","dateModified":"2021-01-22T06:00:00Z","checkTimeEt":"01/22 01:00","death":128,"hospitalized":null,"hospitalizedDischarged":null,"dateChecked":"2021-01-22T06:00:00Z","totalTestsViral":103067,"positiveTestsViral":null,"negativeTestsViral":null,"positiveCasesViral":7340,"deathConfirmed":null,"deathProbable":null,"totalTestEncountersViral":null,"totalTestsPeopleViral":null,"totalTestsAntibody":337,"positiveTestsAntibody":22,"negativeTestsAntibody":null,"totalTestsPeopleAntibody":null,"positiveTestsPeopleAntibody":null,"negativeTestsPeopleAntibody":null,"totalTestsPeopleAntigen":null,"positiveTestsPeopleAntigen":null,"totalTestsAntigen":8012,"positiveTestsAntigen":270,"fips":"66","positiveIncrease":19,"negativeIncrease":322,"total":103274,"totalTestResultsIncrease":341,"posNeg":103274,"dataQualityGrade":null,"deathIncrease":0,"hospitalizedIncrease":0,"hash":"692bdcca4ba130b11c378cc1692c7ce0ff8f2bc8","commercialScore":0,"negativeRegularScore":0,"negativeScore":0,"positiveScore":0,"score":0,"grade":""},{"date":20210121,"state":"GU","positive":7528,"probableCases":207,"negative":95405,"pending":null,"totalTestResultsSource":"posNeg","totalTestResults":102933,"hospitalizedCurrently":8,"hospitalizedCumulative":null,"inIcuCurrently":3,"inIcuCumulative":null,"onVentilatorCurrently":3,"onVentilatorCumulative":null,"recovered":7279,"lastUpdateEt":"1/21/2021 06:45","dateModified":"2021-01-21T06:45:00Z","checkTimeEt":"01/21 01:45","death":128,"hospitalized":null,"hospitalizedDischarged":null,"dateChecked":"2021-01-21T06:45:00Z","totalTestsViral":102726,"positiveTestsViral":null,"negativeTestsViral":null,"positiveCasesViral":7321,"deathConfirmed":null,"deathProbable":null,"totalTestEncountersViral":null,"totalTestsPeopleViral":null,"totalTestsAntibody":337,"positiveTestsAntibody":22,"negativeTestsAntibody":null,"totalTestsPeopleAntibody":null,"positiveTestsPeopleAntibody":null,"negativeTestsPeopleAntibody":null,"totalTestsPeopleAntigen":null,"positiveTestsPeopleAntigen":null,"totalTestsAntigen":7983,"positiveTestsAntigen":264,"fips":"66","positiveIncrease":7,"negativeIncrease":614,"total":102933,"totalTestResultsIncrease":621,"posNeg":102933,"dataQualityGrade":null,"deathIncrease":0,"hospitalizedIncrease":0,"hash":"0b138a59cb0d9f92f54c67e2005754cb53e0673b","commercialScore":0,"negativeRegularScore":0,"negativeScore":0,"positiveScore":0,"score":0,"grade":""},{"date":20210120,"state":"GU","positive":7521,"probableCases":207,"negative":94791,"pending":null,"totalTestResultsSource":"posNeg","totalTestResults":102312,"hospitalizedCurrently":9,"hospitalizedCumulative":null,"inIcuCurrently":3,"inIcuCumulative":null,"onVentilatorCurrently":3,"onVentilatorCumulative":null,"recovered":7274,"lastUpdateEt":"1/20/2021 03:45","dateModified":"2021-01-20T03:45:00Z","checkTimeEt":"01/19 22:45","death":128,"hospitalized":null,"hospitalizedDischarged":null,"dateChecked":"2021-01-20T03:45:00Z","totalTestsViral":102105,"positiveTestsViral":null,"negativeTestsViral":null,"positiveCasesViral":7314,"deathConfirmed":null,"deathProbable":null,"totalTestEncountersViral":null,"totalTestsPeopleViral":null,"totalTestsAntibody":337,"positiveTestsAntibody":22,"negativeTestsAntibody":null,"totalTestsPeopleAntibody":null,"positiveTestsPeopleAntibody":null,"negativeTestsPeopleAntibody":null,"totalTestsPeopleAntigen":null,"positiveTestsPeopleAntigen":null,"totalTestsAntigen":7960,"positiveTestsAntigen":264,"fips":"66","positiveIncrease":6,"negativeIncrease":524,"total":102312,"totalTestResultsIncrease":530,"posNeg":102312,"dataQualityGrade":null,"deathIncrease":0,"hospitalizedIncrease":0,"hash":"a64ba530ab957d0e7dc0e0ac64d9cd030644d668","commercialScore":0,"negativeRegularScore":0,"negativeScore":0,"positiveScore":0,"score":0,"grade":""},{"date":20210119,"state":"GU","positive":7515,"probableCases":206,"negative":94267,"pending":null,"totalTestResultsSource":"posNeg","totalTestResults":101782,"hospitalizedCurrently":8,"hospitalizedCumulative":null,"inIcuCurrently":3,"inIcuCumulative":null,"onVentilatorCurrently":3,"onVentilatorCumulative":null,"recovered":7251,"lastUpdateEt":"1/19/2021 08:30","dateModified":"2021-01-19T08:30:00Z","checkTimeEt":"01/19 03:30","death":128,"hospitalized":null,"hospitalizedDischarged":null,"dateChecked":"2021-01-19T08:30:00Z","totalTestsViral":101576,"positiveTestsViral":null,"negativeTestsViral":null,"positiveCasesViral":7309,"deathConfirmed":null,"deathProbable":null,"totalTestEncountersViral":null,"totalTestsPeopleViral":null,"totalTestsAntibody":337,"positiveTestsAntibody":22,"negativeTestsAntibody":null,"totalTestsPeopleAntibody":null,"positiveTestsPeopleAntibody":null,"negativeTestsPeopleAntibody":null,"totalTestsPeopleAntigen":null,"positiveTestsPeopleAntigen":null,"totalTestsAntigen":7924,"positiveTestsAntigen":264,"fips":"66","positiveIncrease":30,"negativeIncrease":1274,"total":101782,"totalTestResultsIncrease":1304,"posNeg":101782,"dataQualityGrade":null,"deathIncrease":0,"hospitalizedIncrease":0,"hash":"85ecd325043f08c7fbde77b7fc26357b9fa026e8","commercialScore":0,"negativeRegularScore":0,"negativeScore":0,"positiveScore":0,"score":0,"grade":""},{"date":20210118,"state":"GU","positive":7485,"probableCases":198,"negative":92993,"pending":null,"totalTestResultsSource":"posNeg","totalTestResults":100478,"hospitalizedCurrently":7,"hospitalizedCumulative":null,"inIcuCurrently":3,"inIcuCumulative":null,"onVentilatorCurrently":3,"onVentilatorCumulative":null,"recovered":7220,"lastUpdateEt":"1/18/2021 07:45","dateModified":"2021-01-18T07:45:00Z","checkTimeEt":"01/18 02:45","death":128,"hospitalized":null,"hospitalizedDischarged":null,"dateChecked":"2021-01-18T07:45:00Z","totalTestsViral":100269,"positiveTestsViral":null,"negativeTestsViral":null,"positiveCasesViral":7287,"deathConfirmed":null,"deathProbable":null,"totalTestEncountersViral":null,"totalTestsPeopleViral":null,"totalTestsAntibody":337,"positiveTestsAntibody":22,"negativeTestsAntibody":null,"totalTestsPeopleAntibody":null,"positiveTestsPeopleAntibody":null,"negativeTestsPeopleAntibody":null,"totalTestsPeopleAntigen":null,"positiveTestsPeopleAntigen":null,"totalTestsAntigen":7258,"positiveTestsAntigen":264,"fips":"66","positiveIncrease":1,"negativeIncrease":0,"total":100478,"totalTestResultsIncrease":1,"posNeg":100478,"dataQualityGrade":null,"deathIncrease":1,"hospitalizedIncrease":0,"hash":"64506cc228ad3ab5285ce0c852b2f3c11ee776fd","commercialScore":0,"negativeRegularScore":0,"negativeScore":0,"positiveScore":0,"score":0,"grade":""},{"date":20210117,"state":"GU","positive":7484,"probableCases":198,"negative":92993,"pending":null,"totalTestResultsSource":"posNeg","totalTestResults":100477,"hospitalizedCurrently":7,"hospitalizedCumulative":null,"inIcuCurrently":4,"inIcuCumulative":null,"onVentilatorCurrently":4,"onVentilatorCumulative":null,"recovered":7220,"lastUpdateEt":"1/17/2021 07:00","dateModified":"2021-01-17T07:00:00Z","checkTimeEt":"01/17 02:00","death":127,"hospitalized":null,"hospitalizedDischarged":null,"dateChecked":"2021-01-17T07:00:00Z","totalTestsViral":100269,"positiveTestsViral":null,"negativeTestsViral":null,"positiveCasesViral":7286,"deathConfirmed":null,"deathProbable":null,"totalTestEncountersViral":null,"totalTestsPeopleViral":null,"totalTestsAntibody":337,"positiveTestsAntibody":22,"negativeTestsAntibody":null,"totalTestsPeopleAntibody":null,"positiveTestsPeopleAntibody":null,"negativeTestsPeopleAntibody":null,"totalTestsPeopleAntigen":null,"positiveTestsPeopleAntigen":null,"totalTestsAntigen":7258,"positiveTestsAntigen":264,"fips":"66","positiveIncrease":3,"negativeIncrease":0,"total":100477,"totalTestResultsIncrease":3,"posNeg":100477,"dataQualityGrade":null,"deathIncrease":1,"hospitalizedIncrease":0,"hash":"f52370e3f9afde741f55d421416b3e70db6401b9","commercialScore":0,"negativeRegularScore":0,"negativeScore":0,"positiveScore":0,"score":0,"grade":""},{"date":20210116,"state":"GU","positive":7481,"probableCases":198,"negative":92993,"pending":null,"totalTestResultsSource":"posNeg","totalTestResults":100474,"hospitalizedCurrently":8,"hospitalizedCumulative":null,"inIcuCurrently":5,"inIcuCumulative":null,"onVentilatorCurrently":4,"onVentilatorCumulative":null,"recovered":7220,"lastUpdateEt":"1/16/2021 08:45","dateModified":"2021-01-16T08:45:00Z","checkTimeEt":"01/16 03:45","death":126,"hospitalized":null,"hospitalizedDischarged":null,"dateChecked":"2021-01-16T08:45:00Z","totalTestsViral":100269,"positiveTestsViral":null,"negativeTestsViral":null,"positiveCasesViral":7283,"deathConfirmed":null,"deathProbable":null,"totalTestEncountersViral":null,"totalTestsPeopleViral":null,"totalTestsAntibody":337,"positiveTestsAntibody":19,"negativeTestsAntibody":null,"totalTestsPeopleAntibody":null,"positiveTestsPeopleAntibody":null,"negativeTestsPeopleAntibody":null,"totalTestsPeopleAntigen":null,"positiveTestsPeopleAntigen":null,"totalTestsAntigen":7258,"positiveTestsAntigen":253,"fips":"66","positiveIncrease":7,"negativeIncrease":0,"total":100474,"totalTestResultsIncrease":7,"posNeg":100474,"dataQualityGrade":null,"deathIncrease":1,"hospitalizedIncrease":0,"hash":"d5c3e2c5fa30a730692fb83cc04038e58b4013da","commercialScore":0,"negativeRegularScore":0,"negativeScore":0,"positiveScore":0,"score":0,"grade":""},{"date":20210115,"state":"GU","positive":7474,"probableCases":198,"negative":92993,"pending":null,"totalTestResultsSource":"posNeg","totalTestResults":100467,"hospitalizedCurrently":6,"hospitalizedCumulative":null,"inIcuCurrently":4,"inIcuCumulative":null,"onVentilatorCurrently":3,"onVentilatorCumulative":null,"recovered":7220,"lastUpdateEt":"1/15/2021 04:45","dateModified":"2021-01-15T04:45:00Z","checkTimeEt":"01/14 23:45","death":125,"hospitalized":null,"hospitalizedDischarged":null,"dateChecked":"2021-01-15T04:45:00Z","totalTestsViral":100269,"positiveTestsViral":null,"negativeTestsViral":null,"positiveCasesViral":7276,"deathConfirmed":null,"deathProbable":null,"totalTestEncountersViral":null,"totalTestsPeopleViral":null,"totalTestsAntibody":337,"positiveTestsAntibody":19,"negativeTestsAntibody":null,"totalTestsPeopleAntibody":null,"positiveTestsPeopleAntibody":null,"negativeTestsPeopleAntibody":null,"totalTestsPeopleAntigen":null,"positiveTestsPeopleAntigen":null,"totalTestsAntigen":7258,"positiveTestsAntigen":253,"fips":"66","positiveIncrease":17,"negativeIncrease":227,"total":100467,"totalTestResultsIncrease":244,"posNeg":100467,"dataQualityGrade":null,"deathIncrease":1,"hospitalizedIncrease":0,"hash":"5b51040733d8495d7799bd98e357f4b402943d6d","commercialScore":0,"negativeRegularScore":0,"negativeScore":0,"positiveScore":0,"score":0,"grade":""},{"date":20210114,"state":"GU","positive":7457,"probableCases":194,"negative":92766,"pending":null,"totalTestResultsSource":"posNeg","totalTestResults":100223,"hospitalizedCurrently":6,"hospitalizedCumulative":null,"inIcuCurrently":3,"inIcuCumulative":null,"onVentilatorCurrently":3,"onVentilatorCumulative":null,"recovered":7218,"lastUpdateEt":"1/14/2021 07:15","dateModified":"2021-01-14T07:15:00Z","checkTimeEt":"01/14 02:15","death":124,"hospitalized":null,"hospitalizedDischarged":null,"dateChecked":"2021-01-14T07:15:00Z","totalTestsViral":100029,"positiveTestsViral":null,"negativeTestsViral":null,"positiveCasesViral":7263,"deathConfirmed":null,"deathProbable":null,"totalTestEncountersViral":null,"totalTestsPeopleViral":null,"totalTestsAntibody":337,"positiveTestsAntibody":19,"negativeTestsAntibody":null,"totalTestsPeopleAntibody":null,"positiveTestsPeopleAntibody":null,"negativeTestsPeopleAntibody":null,"totalTestsPeopleAntigen":null,"positiveTestsPeopleAntigen":null,"totalTestsAntigen":7058,"positiveTestsAntigen":253,"fips":"66","positiveIncrease":13,"negativeIncrease":391,"total":100223,"totalTestResultsIncrease":404,"posNeg":100223,"dataQualityGrade":null,"deathIncrease":0,"hospitalizedIncrease":0,"hash":"0ac96c579b33d36b08840107d433bc8d51e64797","commercialScore":0,"negativeRegularScore":0,"negativeScore":0,"positiveScore":0,"score":0,"grade":""},{"date":20210113,"state":"GU","positive":7444,"probableCases":194,"negative":92375,"pending":null,"totalTestResultsSource":"posNeg","totalTestResults":99819,"hospitalizedCurrently":7,"hospitalizedCumulative":null,"inIcuCurrently":3,"inIcuCumulative":null,"onVentilatorCurrently":3,"onVentilatorCumulative":null,"recovered":7208,"lastUpdateEt":"1/13/2021 05:00","dateModified":"2021-01-13T05:00:00Z","checkTimeEt":"01/13 00:00","death":124,"hospitalized":null,"hospitalizedDischarged":null,"dateChecked":"2021-01-13T05:00:00Z","totalTestsViral":99625,"positiveTestsViral":null,"negativeTestsViral":null,"positiveCasesViral":7250,"deathConfirmed":null,"deathProbable":null,"totalTestEncountersViral":null,"totalTestsPeopleViral":null,"totalTestsAntibody":337,"positiveTestsAntibody":19,"negativeTestsAntibody":null,"totalTestsPeopleAntibody":null,"positiveTestsPeopleAntibody":null,"negativeTestsPeopleAntibody":null,"totalTestsPeopleAntigen":null,"positiveTestsPeopleAntigen":null,"totalTestsAntigen":7013,"positiveTestsAntigen":253,"fips":"66","positiveIncrease":21,"negativeIncrease":295,"total":99819,"totalTestResultsIncrease":316,"posNeg":99819,"dataQualityGrade":null,"deathIncrease":0,"hospitalizedIncrease":0,"hash":"40d24d9dca3dc917b9d527c76ec8eb3919d2d27c","commercialScore":0,"negativeRegularScore":0,"negativeScore":0,"positiveScore":0,"score":0,"grade":""},{"date":20210112,"state":"GU","positive":7423,"probableCases":190,"negative":92080,"pending":null,"totalTestResultsSource":"posNeg","totalTestResults":99503,"hospitalizedCurrently":9,"hospitalizedCumulative":null,"inIcuCurrently":4,"inIcuCumulative":null,"onVentilatorCurrently":4,"onVentilatorCumulative":null,"recovered":7189,"lastUpdateEt":"1/12/2021 05:00","dateModified":"2021-01-12T05:00:00Z","checkTimeEt":"01/12 00:00","death":124,"hospitalized":null,"hospitalizedDischarged":null,"dateChecked":"2021-01-12T05:00:00Z","totalTestsViral":99319,"positiveTestsViral":null,"negativeTestsViral":null,"positiveCasesViral":7239,"deathConfirmed":null,"deathProbable":null,"totalTestEncountersViral":null,"totalTestsPeopleViral":null,"totalTestsAntibody":337,"positiveTestsAntibody":19,"negativeTestsAntibody":null,"totalTestsPeopleAntibody":null,"positiveTestsPeopleAntibody":null,"negativeTestsPeopleAntibody":null,"totalTestsPeopleAntigen":null,"positiveTestsPeopleAntigen":null,"totalTestsAntigen":6813,"positiveTestsAntigen":253,"fips":"66","positiveIncrease":0,"negativeIncrease":343,"total":99503,"totalTestResultsIncrease":343,"posNeg":99503,"dataQualityGrade":null,"deathIncrease":0,"hospitalizedIncrease":0,"hash":"47e09ba281d3feedb7b161cd4f0fdcd6f072fc33","commercialScore":0,"negativeRegularScore":0,"negativeScore":0,"positiveScore":0,"score":0,"grade":""},{"date":20210111,"state":"GU","positive":7423,"probableCases":189,"negative":91737,"pending":null,"totalTestResultsSource":"posNeg","totalTestResults":99160,"hospitalizedCurrently":9,"hospitalizedCumulative":null,"inIcuCurrently":4,"inIcuCumulative":null,"onVentilatorCurrently":4,"onVentilatorCumulative":null,"recovered":7164,"lastUpdateEt":"1/11/2021 08:20","dateModified":"2021-01-11T08:20:00Z","checkTimeEt":"01/11 03:20","death":124,"hospitalized":null,"hospitalizedDischarged":null,"dateChecked":"2021-01-11T08:20:00Z","totalTestsViral":98971,"positiveTestsViral":null,"negativeTestsViral":null,"positiveCasesViral":7234,"deathConfirmed":null,"deathProbable":null,"totalTestEncountersViral":null,"totalTestsPeopleViral":null,"totalTestsAntibody":331,"positiveTestsAntibody":19,"negativeTestsAntibody":null,"totalTestsPeopleAntibody":null,"positiveTestsPeopleAntibody":null,"negativeTestsPeopleAntibody":null,"totalTestsPeopleAntigen":null,"positiveTestsPeopleAntigen":null,"totalTestsAntigen":6552,"positiveTestsAntigen":253,"fips":"66","positiveIncrease":11,"negativeIncrease":630,"total":99160,"totalTestResultsIncrease":641,"posNeg":99160,"dataQualityGrade":null,"deathIncrease":0,"hospitalizedIncrease":0,"hash":"55bfa83e6117a1c02744a3452ac31a56722020ed","commercialScore":0,"negativeRegularScore":0,"negativeScore":0,"positiveScore":0,"score":0,"grade":""},{"date":20210110,"state":"GU","positive":7412,"probableCases":186,"negative":91107,"pending":null,"totalTestResultsSource":"posNeg","totalTestResults":98519,"hospitalizedCurrently":11,"hospitalizedCumulative":null,"inIcuCurrently":4,"inIcuCumulative":null,"onVentilatorCurrently":3,"onVentilatorCumulative":null,"recovered":7146,"lastUpdateEt":"1/10/2021 15:15","dateModified":"2021-01-10T15:15:00Z","checkTimeEt":"01/10 10:15","death":124,"hospitalized":null,"hospitalizedDischarged":null,"dateChecked":"2021-01-10T15:15:00Z","totalTestsViral":98320,"positiveTestsViral":null,"negativeTestsViral":null,"positiveCasesViral":7226,"deathConfirmed":null,"deathProbable":null,"totalTestEncountersViral":null,"totalTestsPeopleViral":null,"totalTestsAntibody":331,"positiveTestsAntibody":19,"negativeTestsAntibody":null,"totalTestsPeopleAntibody":null,"positiveTestsPeopleAntibody":null,"negativeTestsPeopleAntibody":null,"totalTestsPeopleAntigen":null,"positiveTestsPeopleAntigen":null,"totalTestsAntigen":6149,"positiveTestsAntigen":253,"fips":"66","positiveIncrease":8,"negativeIncrease":0,"total":98519,"totalTestResultsIncrease":8,"posNeg":98519,"dataQualityGrade":null,"deathIncrease":0,"hospitalizedIncrease":0,"hash":"ca76afe3d345cdac402870f370103aca51cfefc7","commercialScore":0,"negativeRegularScore":0,"negativeScore":0,"positiveScore":0,"score":0,"grade":""},{"date":20210109,"state":"GU","positive":7404,"probableCases":186,"negative":91107,"pending":null,"totalTestResultsSource":"posNeg","totalTestResults":98511,"hospitalizedCurrently":11,"hospitalizedCumulative":null,"inIcuCurrently":4,"inIcuCumulative":null,"onVentilatorCurrently":3,"onVentilatorCumulative":null,"recovered":7146,"lastUpdateEt":"1/9/2021 03:45","dateModified":"2021-01-09T03:45:00Z","checkTimeEt":"01/08 22:45","death":124,"hospitalized":null,"hospitalizedDischarged":null,"dateChecked":"2021-01-09T03:45:00Z","totalTestsViral":98320,"positiveTestsViral":null,"negativeTestsViral":null,"positiveCasesViral":7218,"deathConfirmed":null,"deathProbable":null,"totalTestEncountersViral":null,"totalTestsPeopleViral":null,"totalTestsAntibody":331,"positiveTestsAntibody":19,"negativeTestsAntibody":null,"totalTestsPeopleAntibody":null,"positiveTestsPeopleAntibody":null,"negativeTestsPeopleAntibody":null,"totalTestsPeopleAntigen":null,"positiveTestsPeopleAntigen":null,"totalTestsAntigen":6149,"positiveTestsAntigen":253,"fips":"66","positiveIncrease":5,"negativeIncrease":0,"total":98511,"totalTestResultsIncrease":5,"posNeg":98511,"dataQualityGrade":null,"deathIncrease":0,"hospitalizedIncrease":0,"hash":"01eb7ae8da13f0d7e92239f9b9a80fe108d898f7","commercialScore":0,"negativeRegularScore":0,"negativeScore":0,"positiveScore":0,"score":0,"grade":""},{"date":20210108,"state":"GU","positive":7399,"probableCases":186,"negative":91107,"pending":null,"totalTestResultsSource":"posNeg","totalTestResults":98506,"hospitalizedCurrently":10,"hospitalizedCumulative":null,"inIcuCurrently":3,"inIcuCumulative":null,"onVentilatorCurrently":2,"onVentilatorCumulative":null,"recovered":7146,"lastUpdateEt":"1/8/2021 08:15","dateModified":"2021-01-08T08:15:00Z","checkTimeEt":"01/08 03:15","death":124,"hospitalized":null,"hospitalizedDischarged":null,"dateChecked":"2021-01-08T08:15:00Z","totalTestsViral":98320,"positiveTestsViral":null,"negativeTestsViral":null,"positiveCasesViral":7213,"deathConfirmed":null,"deathProbable":null,"totalTestEncountersViral":null,"totalTestsPeopleViral":null,"totalTestsAntibody":331,"positiveTestsAntibody":19,"negativeTestsAntibody":null,"totalTestsPeopleAntibody":null,"positiveTestsPeopleAntibody":null,"negativeTestsPeopleAntibody":null,"totalTestsPeopleAntigen":null,"positiveTestsPeopleAntigen":null,"totalTestsAntigen":6149,"positiveTestsAntigen":253,"fips":"66","positiveIncrease":13,"negativeIncrease":223,"total":98506,"totalTestResultsIncrease":236,"posNeg":98506,"dataQualityGrade":null,"deathIncrease":0,"hospitalizedIncrease":0,"hash":"47a1bce92c55023758d2da3b564cbc77c9bd6ab8","commercialScore":0,"negativeRegularScore":0,"negativeScore":0,"positiveScore":0,"score":0,"grade":""},{"date":20210107,"state":"GU","positive":7386,"probableCases":186,"negative":90884,"pending":null,"totalTestResultsSource":"posNeg","totalTestResults":98270,"hospitalizedCurrently":12,"hospitalizedCumulative":null,"inIcuCurrently":2,"inIcuCumulative":null,"onVentilatorCurrently":1,"onVentilatorCumulative":null,"recovered":7145,"lastUpdateEt":"1/7/2021 05:15","dateModified":"2021-01-07T05:15:00Z","checkTimeEt":"01/07 00:15","death":124,"hospitalized":null,"hospitalizedDischarged":null,"dateChecked":"2021-01-07T05:15:00Z","totalTestsViral":98084,"positiveTestsViral":null,"negativeTestsViral":null,"positiveCasesViral":7200,"deathConfirmed":null,"deathProbable":null,"totalTestEncountersViral":null,"totalTestsPeopleViral":null,"totalTestsAntibody":331,"positiveTestsAntibody":17,"negativeTestsAntibody":null,"totalTestsPeopleAntibody":null,"positiveTestsPeopleAntibody":null,"negativeTestsPeopleAntibody":null,"totalTestsPeopleAntigen":null,"positiveTestsPeopleAntigen":null,"totalTestsAntigen":6135,"positiveTestsAntigen":243,"fips":"66","positiveIncrease":8,"negativeIncrease":431,"total":98270,"totalTestResultsIncrease":439,"posNeg":98270,"dataQualityGrade":null,"deathIncrease":1,"hospitalizedIncrease":0,"hash":"d7c707b0b4445a8ba8f2f52034dafe455e15a6f6","commercialScore":0,"negativeRegularScore":0,"negativeScore":0,"positiveScore":0,"score":0,"grade":""},{"date":20210106,"state":"GU","positive":7378,"probableCases":186,"negative":90453,"pending":null,"totalTestResultsSource":"posNeg","totalTestResults":97831,"hospitalizedCurrently":11,"hospitalizedCumulative":null,"inIcuCurrently":3,"inIcuCumulative":null,"onVentilatorCurrently":1,"onVentilatorCumulative":null,"recovered":7145,"lastUpdateEt":"1/6/2021 03:45","dateModified":"2021-01-06T03:45:00Z","checkTimeEt":"01/05 22:45","death":123,"hospitalized":null,"hospitalizedDischarged":null,"dateChecked":"2021-01-06T03:45:00Z","totalTestsViral":97645,"positiveTestsViral":null,"negativeTestsViral":null,"positiveCasesViral":7192,"deathConfirmed":null,"deathProbable":null,"totalTestEncountersViral":null,"totalTestsPeopleViral":null,"totalTestsAntibody":329,"positiveTestsAntibody":17,"negativeTestsAntibody":null,"totalTestsPeopleAntibody":null,"positiveTestsPeopleAntibody":null,"negativeTestsPeopleAntibody":null,"totalTestsPeopleAntigen":null,"positiveTestsPeopleAntigen":null,"totalTestsAntigen":6111,"positiveTestsAntigen":243,"fips":"66","positiveIncrease":21,"negativeIncrease":307,"total":97831,"totalTestResultsIncrease":328,"posNeg":97831,"dataQualityGrade":null,"deathIncrease":0,"hospitalizedIncrease":0,"hash":"b383522c99987bd2087bb86b1ea36f705bbf2550","commercialScore":0,"negativeRegularScore":0,"negativeScore":0,"positiveScore":0,"score":0,"grade":""},{"date":20210105,"state":"GU","positive":7357,"probableCases":184,"negative":90146,"pending":null,"totalTestResultsSource":"posNeg","totalTestResults":97503,"hospitalizedCurrently":10,"hospitalizedCumulative":null,"inIcuCurrently":3,"inIcuCumulative":null,"onVentilatorCurrently":2,"onVentilatorCumulative":null,"recovered":7132,"lastUpdateEt":"1/5/2021 03:30","dateModified":"2021-01-05T03:30:00Z","checkTimeEt":"01/04 22:30","death":123,"hospitalized":null,"hospitalizedDischarged":null,"dateChecked":"2021-01-05T03:30:00Z","totalTestsViral":97319,"positiveTestsViral":null,"negativeTestsViral":null,"positiveCasesViral":7173,"deathConfirmed":null,"deathProbable":null,"totalTestEncountersViral":null,"totalTestsPeopleViral":null,"totalTestsAntibody":329,"positiveTestsAntibody":17,"negativeTestsAntibody":null,"totalTestsPeopleAntibody":null,"positiveTestsPeopleAntibody":null,"negativeTestsPeopleAntibody":null,"totalTestsPeopleAntigen":null,"positiveTestsPeopleAntigen":null,"totalTestsAntigen":5883,"positiveTestsAntigen":243,"fips":"66","positiveIncrease":13,"negativeIncrease":654,"total":97503,"totalTestResultsIncrease":667,"posNeg":97503,"dataQualityGrade":null,"deathIncrease":0,"hospitalizedIncrease":0,"hash":"71978542f323e63132bae3a3bfccef6d402a7abd","commercialScore":0,"negativeRegularScore":0,"negativeScore":0,"positiveScore":0,"score":0,"grade":""},{"date":20210104,"state":"GU","positive":7344,"probableCases":181,"negative":89492,"pending":null,"totalTestResultsSource":"posNeg","totalTestResults":96836,"hospitalizedCurrently":8,"hospitalizedCumulative":null,"inIcuCurrently":2,"inIcuCumulative":null,"onVentilatorCurrently":2,"onVentilatorCumulative":null,"recovered":7089,"lastUpdateEt":"1/4/2021 03:45","dateModified":"2021-01-04T03:45:00Z","checkTimeEt":"01/03 22:45","death":123,"hospitalized":null,"hospitalizedDischarged":null,"dateChecked":"2021-01-04T03:45:00Z","totalTestsViral":96655,"positiveTestsViral":null,"negativeTestsViral":null,"positiveCasesViral":7163,"deathConfirmed":null,"deathProbable":null,"totalTestEncountersViral":null,"totalTestsPeopleViral":null,"totalTestsAntibody":326,"positiveTestsAntibody":17,"negativeTestsAntibody":null,"totalTestsPeopleAntibody":null,"positiveTestsPeopleAntibody":null,"negativeTestsPeopleAntibody":null,"totalTestsPeopleAntigen":null,"positiveTestsPeopleAntigen":null,"totalTestsAntigen":5739,"positiveTestsAntigen":243,"fips":"66","positiveIncrease":17,"negativeIncrease":617,"total":96836,"totalTestResultsIncrease":634,"posNeg":96836,"dataQualityGrade":null,"deathIncrease":0,"hospitalizedIncrease":0,"hash":"ef270c8111c8298e242b1db86fd48ec9671165c3","commercialScore":0,"negativeRegularScore":0,"negativeScore":0,"positiveScore":0,"score":0,"grade":""},{"date":20210103,"state":"GU","positive":7327,"probableCases":178,"negative":88875,"pending":null,"totalTestResultsSource":"posNeg","totalTestResults":96202,"hospitalizedCurrently":11,"hospitalizedCumulative":null,"inIcuCurrently":2,"inIcuCumulative":null,"onVentilatorCurrently":2,"onVentilatorCumulative":null,"recovered":7047,"lastUpdateEt":"1/3/2021 05:45","dateModified":"2021-01-03T05:45:00Z","checkTimeEt":"01/03 00:45","death":123,"hospitalized":null,"hospitalizedDischarged":null,"dateChecked":"2021-01-03T05:45:00Z","totalTestsViral":96014,"positiveTestsViral":null,"negativeTestsViral":null,"positiveCasesViral":7149,"deathConfirmed":null,"deathProbable":null,"totalTestEncountersViral":null,"totalTestsPeopleViral":null,"totalTestsAntibody":325,"positiveTestsAntibody":17,"negativeTestsAntibody":null,"totalTestsPeopleAntibody":null,"positiveTestsPeopleAntibody":null,"negativeTestsPeopleAntibody":null,"totalTestsPeopleAntigen":null,"positiveTestsPeopleAntigen":null,"totalTestsAntigen":5645,"positiveTestsAntigen":239,"fips":"66","positiveIncrease":1,"negativeIncrease":0,"total":96202,"totalTestResultsIncrease":1,"posNeg":96202,"dataQualityGrade":null,"deathIncrease":0,"hospitalizedIncrease":0,"hash":"c4a7a6da4ad5b7563cb9db8fcc4fea97d887da5b","commercialScore":0,"negativeRegularScore":0,"negativeScore":0,"positiveScore":0,"score":0,"grade":""},{"date":20210102,"state":"GU","positive":7326,"probableCases":178,"negative":88875,"pending":null,"totalTestResultsSource":"posNeg","totalTestResults":96201,"hospitalizedCurrently":13,"hospitalizedCumulative":null,"inIcuCurrently":3,"inIcuCumulative":null,"onVentilatorCurrently":2,"onVentilatorCumulative":null,"recovered":7047,"lastUpdateEt":"1/2/2021 06:30","dateModified":"2021-01-02T06:30:00Z","checkTimeEt":"01/02 01:30","death":123,"hospitalized":null,"hospitalizedDischarged":null,"dateChecked":"2021-01-02T06:30:00Z","totalTestsViral":96014,"positiveTestsViral":null,"negativeTestsViral":null,"positiveCasesViral":7148,"deathConfirmed":null,"deathProbable":null,"totalTestEncountersViral":null,"totalTestsPeopleViral":null,"totalTestsAntibody":325,"positiveTestsAntibody":17,"negativeTestsAntibody":null,"totalTestsPeopleAntibody":null,"positiveTestsPeopleAntibody":null,"negativeTestsPeopleAntibody":null,"totalTestsPeopleAntigen":null,"positiveTestsPeopleAntigen":null,"totalTestsAntigen":5645,"positiveTestsAntigen":239,"fips":"66","positiveIncrease":0,"negativeIncrease":0,"total":96201,"totalTestResultsIncrease":0,"posNeg":96201,"dataQualityGrade":null,"deathIncrease":1,"hospitalizedIncrease":0,"hash":"832cd90a68c1d23d7a4b9d086f7085d3cb59959a","commercialScore":0,"negativeRegularScore":0,"negativeScore":0,"positiveScore":0,"score":0,"grade":""},{"date":20210101,"state":"GU","positive":7326,"probableCases":178,"negative":88875,"pending":null,"totalTestResultsSource":"posNeg","totalTestResults":96201,"hospitalizedCurrently":13,"hospitalizedCumulative":null,"inIcuCurrently":3,"inIcuCumulative":null,"onVentilatorCurrently":2,"onVentilatorCumulative":null,"recovered":7047,"lastUpdateEt":"1/1/2021 06:45","dateModified":"2021-01-01T06:45:00Z","checkTimeEt":"01/01 01:45","death":122,"hospitalized":null,"hospitalizedDischarged":null,"dateChecked":"2021-01-01T06:45:00Z","totalTestsViral":96014,"positiveTestsViral":null,"negativeTestsViral":null,"positiveCasesViral":7148,"deathConfirmed":null,"deathProbable":null,"totalTestEncountersViral":null,"totalTestsPeopleViral":null,"totalTestsAntibody":325,"positiveTestsAntibody":17,"negativeTestsAntibody":null,"totalTestsPeopleAntibody":null,"positiveTestsPeopleAntibody":null,"negativeTestsPeopleAntibody":null,"totalTestsPeopleAntigen":null,"positiveTestsPeopleAntigen":null,"totalTestsAntigen":5645,"positiveTestsAntigen":239,"fips":"66","positiveIncrease":9,"negativeIncrease":0,"total":96201,"totalTestResultsIncrease":9,"posNeg":96201,"dataQualityGrade":null,"deathIncrease":0,"hospitalizedIncrease":0,"hash":"59b5521ecbfbf15a584463c3076a2b9ed8983768","commercialScore":0,"negativeRegularScore":0,"negativeScore":0,"positiveScore":0,"score":0,"grade":""},{"date":20201231,"state":"GU","positive":7317,"probableCases":178,"negative":88875,"pending":null,"totalTestResultsSource":"posNeg","totalTestResults":96192,"hospitalizedCurrently":14,"hospitalizedCumulative":null,"inIcuCurrently":3,"inIcuCumulative":null,"onVentilatorCurrently":2,"onVentilatorCumulative":null,"recovered":7047,"lastUpdateEt":"12/31/2020 05:15","dateModified":"2020-12-31T05:15:00Z","checkTimeEt":"12/31 00:15","death":122,"hospitalized":null,"hospitalizedDischarged":null,"dateChecked":"2020-12-31T05:15:00Z","totalTestsViral":96014,"positiveTestsViral":null,"negativeTestsViral":null,"positiveCasesViral":7139,"deathConfirmed":null,"deathProbable":null,"totalTestEncountersViral":null,"totalTestsPeopleViral":null,"totalTestsAntibody":325,"positiveTestsAntibody":17,"negativeTestsAntibody":null,"totalTestsPeopleAntibody":null,"positiveTestsPeopleAntibody":null,"negativeTestsPeopleAntibody":null,"totalTestsPeopleAntigen":null,"positiveTestsPeopleAntigen":null,"totalTestsAntigen":5645,"positiveTestsAntigen":239,"fips":"66","positiveIncrease":9,"negativeIncrease":242,"total":96192,"totalTestResultsIncrease":251,"posNeg":96192,"dataQualityGrade":null,"deathIncrease":1,"hospitalizedIncrease":0,"hash":"efd776c86d6740b11f7ca3521554484d7cf9fb2a","commercialScore":0,"negativeRegularScore":0,"negativeScore":0,"positiveScore":0,"score":0,"grade":""},{"date":20201230,"state":"GU","positive":7308,"probableCases":179,"negative":88633,"pending":null,"totalTestResultsSource":"posNeg","totalTestResults":95941,"hospitalizedCurrently":15,"hospitalizedCumulative":null,"inIcuCurrently":3,"inIcuCumulative":null,"onVentilatorCurrently":2,"onVentilatorCumulative":null,"recovered":7018,"lastUpdateEt":"12/30/2020 04:15","dateModified":"2020-12-30T04:15:00Z","checkTimeEt":"12/29 23:15","death":121,"hospitalized":null,"hospitalizedDischarged":null,"dateChecked":"2020-12-30T04:15:00Z","totalTestsViral":95762,"positiveTestsViral":null,"negativeTestsViral":null,"positiveCasesViral":7129,"deathConfirmed":null,"deathProbable":null,"totalTestEncountersViral":null,"totalTestsPeopleViral":null,"totalTestsAntibody":323,"positiveTestsAntibody":17,"negativeTestsAntibody":null,"totalTestsPeopleAntibody":null,"positiveTestsPeopleAntibody":null,"negativeTestsPeopleAntibody":null,"totalTestsPeopleAntigen":null,"positiveTestsPeopleAntigen":null,"totalTestsAntigen":5645,"positiveTestsAntigen":239,"fips":"66","positiveIncrease":15,"negativeIncrease":257,"total":95941,"totalTestResultsIncrease":272,"posNeg":95941,"dataQualityGrade":null,"deathIncrease":0,"hospitalizedIncrease":0,"hash":"e8d06570684891f159d87e9fa6e3a0bb7f26c03c","commercialScore":0,"negativeRegularScore":0,"negativeScore":0,"positiveScore":0,"score":0,"grade":""},{"date":20201229,"state":"GU","positive":7293,"probableCases":179,"negative":88376,"pending":null,"totalTestResultsSource":"posNeg","totalTestResults":95669,"hospitalizedCurrently":19,"hospitalizedCumulative":null,"inIcuCurrently":4,"inIcuCumulative":null,"onVentilatorCurrently":2,"onVentilatorCumulative":null,"recovered":6954,"lastUpdateEt":"12/29/2020 03:15","dateModified":"2020-12-29T03:15:00Z","checkTimeEt":"12/28 22:15","death":121,"hospitalized":null,"hospitalizedDischarged":null,"dateChecked":"2020-12-29T03:15:00Z","totalTestsViral":95490,"positiveTestsViral":null,"negativeTestsViral":null,"positiveCasesViral":7114,"deathConfirmed":null,"deathProbable":null,"totalTestEncountersViral":null,"totalTestsPeopleViral":null,"totalTestsAntibody":323,"positiveTestsAntibody":17,"negativeTestsAntibody":null,"totalTestsPeopleAntibody":null,"positiveTestsPeopleAntibody":null,"negativeTestsPeopleAntibody":null,"totalTestsPeopleAntigen":null,"positiveTestsPeopleAntigen":null,"totalTestsAntigen":5578,"positiveTestsAntigen":239,"fips":"66","positiveIncrease":12,"negativeIncrease":344,"total":95669,"totalTestResultsIncrease":356,"posNeg":95669,"dataQualityGrade":null,"deathIncrease":0,"hospitalizedIncrease":0,"hash":"6df255f5a5822949d074a056228b26d92f0ce63f","commercialScore":0,"negativeRegularScore":0,"negativeScore":0,"positiveScore":0,"score":0,"grade":""},{"date":20201228,"state":"GU","positive":7281,"probableCases":179,"negative":88032,"pending":null,"totalTestResultsSource":"posNeg","totalTestResults":95313,"hospitalizedCurrently":19,"hospitalizedCumulative":null,"inIcuCurrently":5,"inIcuCumulative":null,"onVentilatorCurrently":2,"onVentilatorCumulative":null,"recovered":6908,"lastUpdateEt":"12/28/2020 04:15","dateModified":"2020-12-28T04:15:00Z","checkTimeEt":"12/27 23:15","death":121,"hospitalized":null,"hospitalizedDischarged":null,"dateChecked":"2020-12-28T04:15:00Z","totalTestsViral":95134,"positiveTestsViral":null,"negativeTestsViral":null,"positiveCasesViral":7102,"deathConfirmed":null,"deathProbable":null,"totalTestEncountersViral":null,"totalTestsPeopleViral":null,"totalTestsAntibody":323,"positiveTestsAntibody":17,"negativeTestsAntibody":null,"totalTestsPeopleAntibody":null,"positiveTestsPeopleAntibody":null,"negativeTestsPeopleAntibody":null,"totalTestsPeopleAntigen":null,"positiveTestsPeopleAntigen":null,"totalTestsAntigen":5576,"positiveTestsAntigen":239,"fips":"66","positiveIncrease":11,"negativeIncrease":616,"total":95313,"totalTestResultsIncrease":627,"posNeg":95313,"dataQualityGrade":null,"deathIncrease":0,"hospitalizedIncrease":0,"hash":"192a05a6a3bd069ea5727c179bb85067f1f9b551","commercialScore":0,"negativeRegularScore":0,"negativeScore":0,"positiveScore":0,"score":0,"grade":""},{"date":20201227,"state":"GU","positive":7270,"probableCases":175,"negative":87416,"pending":null,"totalTestResultsSource":"posNeg","totalTestResults":94686,"hospitalizedCurrently":18,"hospitalizedCumulative":null,"inIcuCurrently":7,"inIcuCumulative":null,"onVentilatorCurrently":3,"onVentilatorCumulative":null,"recovered":6743,"lastUpdateEt":"12/27/2020 05:30","dateModified":"2020-12-27T05:30:00Z","checkTimeEt":"12/27 00:30","death":121,"hospitalized":null,"hospitalizedDischarged":null,"dateChecked":"2020-12-27T05:30:00Z","totalTestsViral":94507,"positiveTestsViral":null,"negativeTestsViral":null,"positiveCasesViral":7095,"deathConfirmed":null,"deathProbable":null,"totalTestEncountersViral":null,"totalTestsPeopleViral":null,"totalTestsAntibody":321,"positiveTestsAntibody":17,"negativeTestsAntibody":null,"totalTestsPeopleAntibody":null,"positiveTestsPeopleAntibody":null,"negativeTestsPeopleAntibody":null,"totalTestsPeopleAntigen":null,"positiveTestsPeopleAntigen":null,"totalTestsAntigen":5347,"positiveTestsAntigen":224,"fips":"66","positiveIncrease":1,"negativeIncrease":0,"total":94686,"totalTestResultsIncrease":1,"posNeg":94686,"dataQualityGrade":null,"deathIncrease":0,"hospitalizedIncrease":0,"hash":"28950690e1ffd5e9ca04b554c0085a4911252b85","commercialScore":0,"negativeRegularScore":0,"negativeScore":0,"positiveScore":0,"score":0,"grade":""},{"date":20201226,"state":"GU","positive":7269,"probableCases":175,"negative":87416,"pending":null,"totalTestResultsSource":"posNeg","totalTestResults":94685,"hospitalizedCurrently":18,"hospitalizedCumulative":null,"inIcuCurrently":7,"inIcuCumulative":null,"onVentilatorCurrently":3,"onVentilatorCumulative":null,"recovered":6743,"lastUpdateEt":"12/26/2020 07:15","dateModified":"2020-12-26T07:15:00Z","checkTimeEt":"12/26 02:15","death":121,"hospitalized":null,"hospitalizedDischarged":null,"dateChecked":"2020-12-26T07:15:00Z","totalTestsViral":94507,"positiveTestsViral":null,"negativeTestsViral":null,"positiveCasesViral":7094,"deathConfirmed":null,"deathProbable":null,"totalTestEncountersViral":null,"totalTestsPeopleViral":null,"totalTestsAntibody":321,"positiveTestsAntibody":17,"negativeTestsAntibody":null,"totalTestsPeopleAntibody":null,"positiveTestsPeopleAntibody":null,"negativeTestsPeopleAntibody":null,"totalTestsPeopleAntigen":null,"positiveTestsPeopleAntigen":null,"totalTestsAntigen":5347,"positiveTestsAntigen":224,"fips":"66","positiveIncrease":1,"negativeIncrease":0,"total":94685,"totalTestResultsIncrease":1,"posNeg":94685,"dataQualityGrade":null,"deathIncrease":0,"hospitalizedIncrease":0,"hash":"2f136b20080be1eaceeb789762d27d2fc36278f5","commercialScore":0,"negativeRegularScore":0,"negativeScore":0,"positiveScore":0,"score":0,"grade":""},{"date":20201225,"state":"GU","positive":7268,"probableCases":175,"negative":87416,"pending":null,"totalTestResultsSource":"posNeg","totalTestResults":94684,"hospitalizedCurrently":17,"hospitalizedCumulative":null,"inIcuCurrently":7,"inIcuCumulative":null,"onVentilatorCurrently":3,"onVentilatorCumulative":null,"recovered":6743,"lastUpdateEt":"12/25/2020 04:45","dateModified":"2020-12-25T04:45:00Z","checkTimeEt":"12/24 23:45","death":121,"hospitalized":null,"hospitalizedDischarged":null,"dateChecked":"2020-12-25T04:45:00Z","totalTestsViral":94507,"positiveTestsViral":null,"negativeTestsViral":null,"positiveCasesViral":7093,"deathConfirmed":null,"deathProbable":null,"totalTestEncountersViral":null,"totalTestsPeopleViral":null,"totalTestsAntibody":321,"positiveTestsAntibody":17,"negativeTestsAntibody":null,"totalTestsPeopleAntibody":null,"positiveTestsPeopleAntibody":null,"negativeTestsPeopleAntibody":null,"totalTestsPeopleAntigen":null,"positiveTestsPeopleAntigen":null,"totalTestsAntigen":5347,"positiveTestsAntigen":224,"fips":"66","positiveIncrease":2,"negativeIncrease":0,"total":94684,"totalTestResultsIncrease":2,"posNeg":94684,"dataQualityGrade":null,"deathIncrease":0,"hospitalizedIncrease":0,"hash":"86c589de00318bbd494bfe3df0b836003dd9aa0a","commercialScore":0,"negativeRegularScore":0,"negativeScore":0