[{"date":20210307,"state":"HI","positive":28699,"probableCases":808,"negative":null,"pending":null,"totalTestResultsSource":"totalTestEncountersViral","totalTestResults":1146796,"hospitalizedCurrently":27,"hospitalizedCumulative":2226,"inIcuCurrently":5,"inIcuCumulative":null,"onVentilatorCurrently":3,"onVentilatorCumulative":null,"recovered":null,"lastUpdateEt":"3/5/2021 14:30","dateModified":"2021-03-05T14:30:00Z","checkTimeEt":"03/05 09:30","death":445,"hospitalized":2226,"hospitalizedDischarged":null,"dateChecked":"2021-03-05T14:30:00Z","totalTestsViral":null,"positiveTestsViral":27774,"negativeTestsViral":null,"positiveCasesViral":27891,"deathConfirmed":445,"deathProbable":null,"totalTestEncountersViral":1146796,"totalTestsPeopleViral":null,"totalTestsAntibody":null,"positiveTestsAntibody":null,"negativeTestsAntibody":null,"totalTestsPeopleAntibody":null,"positiveTestsPeopleAntibody":null,"negativeTestsPeopleAntibody":null,"totalTestsPeopleAntigen":null,"positiveTestsPeopleAntigen":null,"totalTestsAntigen":null,"positiveTestsAntigen":null,"fips":"15","positiveIncrease":53,"negativeIncrease":0,"total":28699,"totalTestResultsIncrease":5117,"posNeg":28699,"dataQualityGrade":null,"deathIncrease":1,"hospitalizedIncrease":0,"hash":"4f2c09f953483ffc35e24ac50e0c6c1f10077002","commercialScore":0,"negativeRegularScore":0,"negativeScore":0,"positiveScore":0,"score":0,"grade":""},{"date":20210306,"state":"HI","positive":28646,"probableCases":808,"negative":null,"pending":null,"totalTestResultsSource":"totalTestEncountersViral","totalTestResults":1141679,"hospitalizedCurrently":27,"hospitalizedCumulative":2226,"inIcuCurrently":5,"inIcuCumulative":null,"onVentilatorCurrently":3,"onVentilatorCumulative":null,"recovered":null,"lastUpdateEt":"3/4/2021 14:30","dateModified":"2021-03-04T14:30:00Z","checkTimeEt":"03/04 09:30","death":444,"hospitalized":2226,"hospitalizedDischarged":null,"dateChecked":"2021-03-04T14:30:00Z","totalTestsViral":null,"positiveTestsViral":27726,"negativeTestsViral":null,"positiveCasesViral":27838,"deathConfirmed":444,"deathProbable":null,"totalTestEncountersViral":1141679,"totalTestsPeopleViral":null,"totalTestsAntibody":null,"positiveTestsAntibody":null,"negativeTestsAntibody":null,"totalTestsPeopleAntibody":null,"positiveTestsPeopleAntibody":null,"negativeTestsPeopleAntibody":null,"totalTestsPeopleAntigen":null,"positiveTestsPeopleAntigen":null,"totalTestsAntigen":null,"positiveTestsAntigen":null,"fips":"15","positiveIncrease":85,"negativeIncrease":0,"total":28646,"totalTestResultsIncrease":5284,"posNeg":28646,"dataQualityGrade":null,"deathIncrease":1,"hospitalizedIncrease":1,"hash":"9fa0a9bc60865ee5f8667e0c6fe4fd74040b134b","commercialScore":0,"negativeRegularScore":0,"negativeScore":0,"positiveScore":0,"score":0,"grade":""},{"date":20210305,"state":"HI","positive":28561,"probableCases":808,"negative":null,"pending":null,"totalTestResultsSource":"totalTestEncountersViral","totalTestResults":1136395,"hospitalizedCurrently":28,"hospitalizedCumulative":2225,"inIcuCurrently":5,"inIcuCumulative":null,"onVentilatorCurrently":3,"onVentilatorCumulative":null,"recovered":null,"lastUpdateEt":"3/3/2021 14:30","dateModified":"2021-03-03T14:30:00Z","checkTimeEt":"03/03 09:30","death":443,"hospitalized":2225,"hospitalizedDischarged":null,"dateChecked":"2021-03-03T14:30:00Z","totalTestsViral":null,"positiveTestsViral":27648,"negativeTestsViral":null,"positiveCasesViral":27753,"deathConfirmed":443,"deathProbable":null,"totalTestEncountersViral":1136395,"totalTestsPeopleViral":null,"totalTestsAntibody":null,"positiveTestsAntibody":null,"negativeTestsAntibody":null,"totalTestsPeopleAntibody":null,"positiveTestsPeopleAntibody":null,"negativeTestsPeopleAntibody":null,"totalTestsPeopleAntigen":null,"positiveTestsPeopleAntigen":null,"totalTestsAntigen":null,"positiveTestsAntigen":null,"fips":"15","positiveIncrease":95,"negativeIncrease":0,"total":28561,"totalTestResultsIncrease":5302,"posNeg":28561,"dataQualityGrade":null,"deathIncrease":2,"hospitalizedIncrease":0,"hash":"ade158080b2224bd84c26b1cc0da7a49ca3fce7a","commercialScore":0,"negativeRegularScore":0,"negativeScore":0,"positiveScore":0,"score":0,"grade":""},{"date":20210304,"state":"HI","positive":28466,"probableCases":767,"negative":null,"pending":null,"totalTestResultsSource":"totalTestEncountersViral","totalTestResults":1131093,"hospitalizedCurrently":28,"hospitalizedCumulative":2225,"inIcuCurrently":5,"inIcuCumulative":null,"onVentilatorCurrently":3,"onVentilatorCumulative":null,"recovered":null,"lastUpdateEt":"3/2/2021 14:30","dateModified":"2021-03-02T14:30:00Z","checkTimeEt":"03/02 09:30","death":441,"hospitalized":2225,"hospitalizedDischarged":null,"dateChecked":"2021-03-02T14:30:00Z","totalTestsViral":null,"positiveTestsViral":27595,"negativeTestsViral":null,"positiveCasesViral":27699,"deathConfirmed":441,"deathProbable":null,"totalTestEncountersViral":1131093,"totalTestsPeopleViral":null,"totalTestsAntibody":null,"positiveTestsAntibody":null,"negativeTestsAntibody":null,"totalTestsPeopleAntibody":null,"positiveTestsPeopleAntibody":null,"negativeTestsPeopleAntibody":null,"totalTestsPeopleAntigen":null,"positiveTestsPeopleAntigen":null,"totalTestsAntigen":null,"positiveTestsAntigen":null,"fips":"15","positiveIncrease":59,"negativeIncrease":0,"total":28466,"totalTestResultsIncrease":6227,"posNeg":28466,"dataQualityGrade":null,"deathIncrease":0,"hospitalizedIncrease":-1,"hash":"57c1bf756805543044d26df1250930bed11430fb","commercialScore":0,"negativeRegularScore":0,"negativeScore":0,"positiveScore":0,"score":0,"grade":""},{"date":20210303,"state":"HI","positive":28407,"probableCases":767,"negative":null,"pending":null,"totalTestResultsSource":"totalTestEncountersViral","totalTestResults":1124866,"hospitalizedCurrently":26,"hospitalizedCumulative":2226,"inIcuCurrently":7,"inIcuCumulative":null,"onVentilatorCurrently":3,"onVentilatorCumulative":null,"recovered":null,"lastUpdateEt":"3/1/2021 14:30","dateModified":"2021-03-01T14:30:00Z","checkTimeEt":"03/01 09:30","death":441,"hospitalized":2226,"hospitalizedDischarged":null,"dateChecked":"2021-03-01T14:30:00Z","totalTestsViral":null,"positiveTestsViral":27528,"negativeTestsViral":null,"positiveCasesViral":27640,"deathConfirmed":441,"deathProbable":null,"totalTestEncountersViral":1124866,"totalTestsPeopleViral":null,"totalTestsAntibody":null,"positiveTestsAntibody":null,"negativeTestsAntibody":null,"totalTestsPeopleAntibody":null,"positiveTestsPeopleAntibody":null,"negativeTestsPeopleAntibody":null,"totalTestsPeopleAntigen":null,"positiveTestsPeopleAntigen":null,"totalTestsAntigen":null,"positiveTestsAntigen":null,"fips":"15","positiveIncrease":17,"negativeIncrease":0,"total":28407,"totalTestResultsIncrease":4206,"posNeg":28407,"dataQualityGrade":null,"deathIncrease":2,"hospitalizedIncrease":0,"hash":"a9e1f441658234afef36bc24627906628c50d497","commercialScore":0,"negativeRegularScore":0,"negativeScore":0,"positiveScore":0,"score":0,"grade":""},{"date":20210302,"state":"HI","positive":28390,"probableCases":767,"negative":null,"pending":null,"totalTestResultsSource":"totalTestEncountersViral","totalTestResults":1120660,"hospitalizedCurrently":31,"hospitalizedCumulative":2226,"inIcuCurrently":6,"inIcuCumulative":null,"onVentilatorCurrently":3,"onVentilatorCumulative":null,"recovered":null,"lastUpdateEt":"2/28/2021 14:30","dateModified":"2021-02-28T14:30:00Z","checkTimeEt":"02/28 09:30","death":439,"hospitalized":2226,"hospitalizedDischarged":null,"dateChecked":"2021-02-28T14:30:00Z","totalTestsViral":null,"positiveTestsViral":27514,"negativeTestsViral":null,"positiveCasesViral":27623,"deathConfirmed":439,"deathProbable":null,"totalTestEncountersViral":1120660,"totalTestsPeopleViral":null,"totalTestsAntibody":null,"positiveTestsAntibody":null,"negativeTestsAntibody":null,"totalTestsPeopleAntibody":null,"positiveTestsPeopleAntibody":null,"negativeTestsPeopleAntibody":null,"totalTestsPeopleAntigen":null,"positiveTestsPeopleAntigen":null,"totalTestsAntigen":null,"positiveTestsAntigen":null,"fips":"15","positiveIncrease":35,"negativeIncrease":0,"total":28390,"totalTestResultsIncrease":3503,"posNeg":28390,"dataQualityGrade":null,"deathIncrease":0,"hospitalizedIncrease":12,"hash":"fd50733cd86097289b6a01b3cacffd31576d060d","commercialScore":0,"negativeRegularScore":0,"negativeScore":0,"positiveScore":0,"score":0,"grade":""},{"date":20210301,"state":"HI","positive":28355,"probableCases":767,"negative":null,"pending":null,"totalTestResultsSource":"totalTestEncountersViral","totalTestResults":1117157,"hospitalizedCurrently":31,"hospitalizedCumulative":2214,"inIcuCurrently":3,"inIcuCumulative":null,"onVentilatorCurrently":3,"onVentilatorCumulative":null,"recovered":null,"lastUpdateEt":"2/27/2021 14:30","dateModified":"2021-02-27T14:30:00Z","checkTimeEt":"02/27 09:30","death":439,"hospitalized":2214,"hospitalizedDischarged":null,"dateChecked":"2021-02-27T14:30:00Z","totalTestsViral":null,"positiveTestsViral":27477,"negativeTestsViral":null,"positiveCasesViral":27588,"deathConfirmed":439,"deathProbable":null,"totalTestEncountersViral":1117157,"totalTestsPeopleViral":null,"totalTestsAntibody":null,"positiveTestsAntibody":null,"negativeTestsAntibody":null,"totalTestsPeopleAntibody":null,"positiveTestsPeopleAntibody":null,"negativeTestsPeopleAntibody":null,"totalTestsPeopleAntigen":null,"positiveTestsPeopleAntigen":null,"totalTestsAntigen":null,"positiveTestsAntigen":null,"fips":"15","positiveIncrease":29,"negativeIncrease":0,"total":28355,"totalTestResultsIncrease":4179,"posNeg":28355,"dataQualityGrade":null,"deathIncrease":0,"hospitalizedIncrease":0,"hash":"5c115b65c08029fd38a3a3252755c7f0a37db7fc","commercialScore":0,"negativeRegularScore":0,"negativeScore":0,"positiveScore":0,"score":0,"grade":""},{"date":20210228,"state":"HI","positive":28326,"probableCases":767,"negative":null,"pending":null,"totalTestResultsSource":"totalTestEncountersViral","totalTestResults":1112978,"hospitalizedCurrently":30,"hospitalizedCumulative":2214,"inIcuCurrently":3,"inIcuCumulative":null,"onVentilatorCurrently":3,"onVentilatorCumulative":null,"recovered":null,"lastUpdateEt":"2/26/2021 14:30","dateModified":"2021-02-26T14:30:00Z","checkTimeEt":"02/26 09:30","death":439,"hospitalized":2214,"hospitalizedDischarged":null,"dateChecked":"2021-02-26T14:30:00Z","totalTestsViral":null,"positiveTestsViral":27437,"negativeTestsViral":null,"positiveCasesViral":27559,"deathConfirmed":439,"deathProbable":null,"totalTestEncountersViral":1112978,"totalTestsPeopleViral":null,"totalTestsAntibody":null,"positiveTestsAntibody":null,"negativeTestsAntibody":null,"totalTestsPeopleAntibody":null,"positiveTestsPeopleAntibody":null,"negativeTestsPeopleAntibody":null,"totalTestsPeopleAntigen":null,"positiveTestsPeopleAntigen":null,"totalTestsAntigen":null,"positiveTestsAntigen":null,"fips":"15","positiveIncrease":56,"negativeIncrease":0,"total":28326,"totalTestResultsIncrease":5461,"posNeg":28326,"dataQualityGrade":null,"deathIncrease":0,"hospitalizedIncrease":0,"hash":"8874ebc04f61b618359f541310c1e680d33e6147","commercialScore":0,"negativeRegularScore":0,"negativeScore":0,"positiveScore":0,"score":0,"grade":""},{"date":20210227,"state":"HI","positive":28270,"probableCases":767,"negative":null,"pending":null,"totalTestResultsSource":"totalTestEncountersViral","totalTestResults":1107517,"hospitalizedCurrently":30,"hospitalizedCumulative":2214,"inIcuCurrently":3,"inIcuCumulative":null,"onVentilatorCurrently":3,"onVentilatorCumulative":null,"recovered":null,"lastUpdateEt":"2/25/2021 14:30","dateModified":"2021-02-25T14:30:00Z","checkTimeEt":"02/25 09:30","death":439,"hospitalized":2214,"hospitalizedDischarged":null,"dateChecked":"2021-02-25T14:30:00Z","totalTestsViral":null,"positiveTestsViral":27366,"negativeTestsViral":null,"positiveCasesViral":27503,"deathConfirmed":439,"deathProbable":null,"totalTestEncountersViral":1107517,"totalTestsPeopleViral":null,"totalTestsAntibody":null,"positiveTestsAntibody":null,"negativeTestsAntibody":null,"totalTestsPeopleAntibody":null,"positiveTestsPeopleAntibody":null,"negativeTestsPeopleAntibody":null,"totalTestsPeopleAntigen":null,"positiveTestsPeopleAntigen":null,"totalTestsAntigen":null,"positiveTestsAntigen":null,"fips":"15","positiveIncrease":104,"negativeIncrease":0,"total":28270,"totalTestResultsIncrease":22034,"posNeg":28270,"dataQualityGrade":null,"deathIncrease":2,"hospitalizedIncrease":0,"hash":"98d282cfc3afeb2ee89ea4e944897d997c8c6493","commercialScore":0,"negativeRegularScore":0,"negativeScore":0,"positiveScore":0,"score":0,"grade":""},{"date":20210226,"state":"HI","positive":28166,"probableCases":767,"negative":null,"pending":null,"totalTestResultsSource":"totalTestEncountersViral","totalTestResults":1085483,"hospitalizedCurrently":30,"hospitalizedCumulative":2214,"inIcuCurrently":3,"inIcuCumulative":null,"onVentilatorCurrently":3,"onVentilatorCumulative":null,"recovered":null,"lastUpdateEt":"2/24/2021 14:30","dateModified":"2021-02-24T14:30:00Z","checkTimeEt":"02/24 09:30","death":437,"hospitalized":2214,"hospitalizedDischarged":null,"dateChecked":"2021-02-24T14:30:00Z","totalTestsViral":null,"positiveTestsViral":26939,"negativeTestsViral":null,"positiveCasesViral":27399,"deathConfirmed":437,"deathProbable":null,"totalTestEncountersViral":1085483,"totalTestsPeopleViral":null,"totalTestsAntibody":null,"positiveTestsAntibody":null,"negativeTestsAntibody":null,"totalTestsPeopleAntibody":null,"positiveTestsPeopleAntibody":null,"negativeTestsPeopleAntibody":null,"totalTestsPeopleAntigen":null,"positiveTestsPeopleAntigen":null,"totalTestsAntigen":null,"positiveTestsAntigen":null,"fips":"15","positiveIncrease":78,"negativeIncrease":0,"total":28166,"totalTestResultsIncrease":4768,"posNeg":28166,"dataQualityGrade":null,"deathIncrease":2,"hospitalizedIncrease":5,"hash":"b4c5ca3e5863a0bfff405d26801caaa548083ca4","commercialScore":0,"negativeRegularScore":0,"negativeScore":0,"positiveScore":0,"score":0,"grade":""},{"date":20210225,"state":"HI","positive":28088,"probableCases":730,"negative":null,"pending":null,"totalTestResultsSource":"totalTestEncountersViral","totalTestResults":1080715,"hospitalizedCurrently":34,"hospitalizedCumulative":2209,"inIcuCurrently":5,"inIcuCumulative":null,"onVentilatorCurrently":5,"onVentilatorCumulative":null,"recovered":null,"lastUpdateEt":"2/23/2021 14:30","dateModified":"2021-02-23T14:30:00Z","checkTimeEt":"02/23 09:30","death":435,"hospitalized":2209,"hospitalizedDischarged":null,"dateChecked":"2021-02-23T14:30:00Z","totalTestsViral":null,"positiveTestsViral":26900,"negativeTestsViral":null,"positiveCasesViral":27358,"deathConfirmed":435,"deathProbable":null,"totalTestEncountersViral":1080715,"totalTestsPeopleViral":null,"totalTestsAntibody":null,"positiveTestsAntibody":null,"negativeTestsAntibody":null,"totalTestsPeopleAntibody":null,"positiveTestsPeopleAntibody":null,"negativeTestsPeopleAntibody":null,"totalTestsPeopleAntigen":null,"positiveTestsPeopleAntigen":null,"totalTestsAntigen":null,"positiveTestsAntigen":null,"fips":"15","positiveIncrease":38,"negativeIncrease":0,"total":28088,"totalTestResultsIncrease":5490,"posNeg":28088,"dataQualityGrade":null,"deathIncrease":0,"hospitalizedIncrease":5,"hash":"74fcc51efdbfbba4abea6161129aa99573922328","commercialScore":0,"negativeRegularScore":0,"negativeScore":0,"positiveScore":0,"score":0,"grade":""},{"date":20210224,"state":"HI","positive":28050,"probableCases":730,"negative":null,"pending":null,"totalTestResultsSource":"totalTestEncountersViral","totalTestResults":1075225,"hospitalizedCurrently":37,"hospitalizedCumulative":2204,"inIcuCurrently":6,"inIcuCumulative":null,"onVentilatorCurrently":6,"onVentilatorCumulative":null,"recovered":null,"lastUpdateEt":"2/22/2021 14:30","dateModified":"2021-02-22T14:30:00Z","checkTimeEt":"02/22 09:30","death":435,"hospitalized":2204,"hospitalizedDischarged":null,"dateChecked":"2021-02-22T14:30:00Z","totalTestsViral":null,"positiveTestsViral":26853,"negativeTestsViral":null,"positiveCasesViral":27320,"deathConfirmed":435,"deathProbable":null,"totalTestEncountersViral":1075225,"totalTestsPeopleViral":null,"totalTestsAntibody":null,"positiveTestsAntibody":null,"negativeTestsAntibody":null,"totalTestsPeopleAntibody":null,"positiveTestsPeopleAntibody":null,"negativeTestsPeopleAntibody":null,"totalTestsPeopleAntigen":null,"positiveTestsPeopleAntigen":null,"totalTestsAntigen":null,"positiveTestsAntigen":null,"fips":"15","positiveIncrease":50,"negativeIncrease":0,"total":28050,"totalTestResultsIncrease":5055,"posNeg":28050,"dataQualityGrade":null,"deathIncrease":4,"hospitalizedIncrease":8,"hash":"f468650628d43ebedaabe7052bf8f64a8ec80591","commercialScore":0,"negativeRegularScore":0,"negativeScore":0,"positiveScore":0,"score":0,"grade":""},{"date":20210223,"state":"HI","positive":28000,"probableCases":730,"negative":null,"pending":null,"totalTestResultsSource":"totalTestEncountersViral","totalTestResults":1070170,"hospitalizedCurrently":37,"hospitalizedCumulative":2196,"inIcuCurrently":7,"inIcuCumulative":null,"onVentilatorCurrently":6,"onVentilatorCumulative":null,"recovered":null,"lastUpdateEt":"2/21/2021 14:30","dateModified":"2021-02-21T14:30:00Z","checkTimeEt":"02/21 09:30","death":431,"hospitalized":2196,"hospitalizedDischarged":null,"dateChecked":"2021-02-21T14:30:00Z","totalTestsViral":null,"positiveTestsViral":26785,"negativeTestsViral":null,"positiveCasesViral":27270,"deathConfirmed":431,"deathProbable":null,"totalTestEncountersViral":1070170,"totalTestsPeopleViral":null,"totalTestsAntibody":null,"positiveTestsAntibody":null,"negativeTestsAntibody":null,"totalTestsPeopleAntibody":null,"positiveTestsPeopleAntibody":null,"negativeTestsPeopleAntibody":null,"totalTestsPeopleAntigen":null,"positiveTestsPeopleAntigen":null,"totalTestsAntigen":null,"positiveTestsAntigen":null,"fips":"15","positiveIncrease":47,"negativeIncrease":0,"total":28000,"totalTestResultsIncrease":784,"posNeg":28000,"dataQualityGrade":null,"deathIncrease":0,"hospitalizedIncrease":-14,"hash":"f218b62c5e87d4b9ad942ee7cf294eeaccbdc5c1","commercialScore":0,"negativeRegularScore":0,"negativeScore":0,"positiveScore":0,"score":0,"grade":""},{"date":20210222,"state":"HI","positive":27953,"probableCases":730,"negative":null,"pending":null,"totalTestResultsSource":"totalTestEncountersViral","totalTestResults":1069386,"hospitalizedCurrently":54,"hospitalizedCumulative":2210,"inIcuCurrently":24,"inIcuCumulative":null,"onVentilatorCurrently":23,"onVentilatorCumulative":null,"recovered":null,"lastUpdateEt":"2/21/2021 14:30","dateModified":"2021-02-21T14:30:00Z","checkTimeEt":"02/21 09:30","death":431,"hospitalized":2210,"hospitalizedDischarged":null,"dateChecked":"2021-02-21T14:30:00Z","totalTestsViral":null,"positiveTestsViral":26748,"negativeTestsViral":null,"positiveCasesViral":27223,"deathConfirmed":431,"deathProbable":null,"totalTestEncountersViral":1069386,"totalTestsPeopleViral":null,"totalTestsAntibody":null,"positiveTestsAntibody":null,"negativeTestsAntibody":null,"totalTestsPeopleAntibody":null,"positiveTestsPeopleAntibody":null,"negativeTestsPeopleAntibody":null,"totalTestsPeopleAntigen":null,"positiveTestsPeopleAntigen":null,"totalTestsAntigen":null,"positiveTestsAntigen":null,"fips":"15","positiveIncrease":49,"negativeIncrease":0,"total":27953,"totalTestResultsIncrease":5810,"posNeg":27953,"dataQualityGrade":null,"deathIncrease":0,"hospitalizedIncrease":28,"hash":"1b9ee5de6fb723d8842c03d8ee31e6bacb0edade","commercialScore":0,"negativeRegularScore":0,"negativeScore":0,"positiveScore":0,"score":0,"grade":""},{"date":20210221,"state":"HI","positive":27904,"probableCases":730,"negative":null,"pending":null,"totalTestResultsSource":"totalTestEncountersViral","totalTestResults":1063576,"hospitalizedCurrently":42,"hospitalizedCumulative":2182,"inIcuCurrently":11,"inIcuCumulative":null,"onVentilatorCurrently":7,"onVentilatorCumulative":null,"recovered":null,"lastUpdateEt":"2/19/2021 14:30","dateModified":"2021-02-19T14:30:00Z","checkTimeEt":"02/19 09:30","death":431,"hospitalized":2182,"hospitalizedDischarged":null,"dateChecked":"2021-02-19T14:30:00Z","totalTestsViral":null,"positiveTestsViral":26711,"negativeTestsViral":null,"positiveCasesViral":27174,"deathConfirmed":431,"deathProbable":null,"totalTestEncountersViral":1063576,"totalTestsPeopleViral":null,"totalTestsAntibody":null,"positiveTestsAntibody":null,"negativeTestsAntibody":null,"totalTestsPeopleAntibody":null,"positiveTestsPeopleAntibody":null,"negativeTestsPeopleAntibody":null,"totalTestsPeopleAntigen":null,"positiveTestsPeopleAntigen":null,"totalTestsAntigen":null,"positiveTestsAntigen":null,"fips":"15","positiveIncrease":67,"negativeIncrease":0,"total":27904,"totalTestResultsIncrease":9477,"posNeg":27904,"dataQualityGrade":null,"deathIncrease":1,"hospitalizedIncrease":0,"hash":"fe28eb0cfabdb7a68d5288ce8f05e894ca6e5358","commercialScore":0,"negativeRegularScore":0,"negativeScore":0,"positiveScore":0,"score":0,"grade":""},{"date":20210220,"state":"HI","positive":27837,"probableCases":730,"negative":null,"pending":null,"totalTestResultsSource":"totalTestEncountersViral","totalTestResults":1054099,"hospitalizedCurrently":42,"hospitalizedCumulative":2182,"inIcuCurrently":11,"inIcuCumulative":null,"onVentilatorCurrently":7,"onVentilatorCumulative":null,"recovered":null,"lastUpdateEt":"2/18/2021 14:30","dateModified":"2021-02-18T14:30:00Z","checkTimeEt":"02/18 09:30","death":430,"hospitalized":2182,"hospitalizedDischarged":null,"dateChecked":"2021-02-18T14:30:00Z","totalTestsViral":null,"positiveTestsViral":26648,"negativeTestsViral":null,"positiveCasesViral":27107,"deathConfirmed":430,"deathProbable":null,"totalTestEncountersViral":1054099,"totalTestsPeopleViral":null,"totalTestsAntibody":null,"positiveTestsAntibody":null,"negativeTestsAntibody":null,"totalTestsPeopleAntibody":null,"positiveTestsPeopleAntibody":null,"negativeTestsPeopleAntibody":null,"totalTestsPeopleAntigen":null,"positiveTestsPeopleAntigen":null,"totalTestsAntigen":null,"positiveTestsAntigen":null,"fips":"15","positiveIncrease":59,"negativeIncrease":0,"total":27837,"totalTestResultsIncrease":303,"posNeg":27837,"dataQualityGrade":null,"deathIncrease":0,"hospitalizedIncrease":0,"hash":"7d308bc8e7cd37f25fadf2f90fd4ac1867aeb06b","commercialScore":0,"negativeRegularScore":0,"negativeScore":0,"positiveScore":0,"score":0,"grade":""},{"date":20210219,"state":"HI","positive":27778,"probableCases":730,"negative":null,"pending":null,"totalTestResultsSource":"totalTestEncountersViral","totalTestResults":1053796,"hospitalizedCurrently":42,"hospitalizedCumulative":2182,"inIcuCurrently":11,"inIcuCumulative":null,"onVentilatorCurrently":7,"onVentilatorCumulative":null,"recovered":null,"lastUpdateEt":"2/17/2021 14:30","dateModified":"2021-02-17T14:30:00Z","checkTimeEt":"02/17 09:30","death":430,"hospitalized":2182,"hospitalizedDischarged":null,"dateChecked":"2021-02-17T14:30:00Z","totalTestsViral":null,"positiveTestsViral":26569,"negativeTestsViral":null,"positiveCasesViral":27048,"deathConfirmed":430,"deathProbable":null,"totalTestEncountersViral":1053796,"totalTestsPeopleViral":null,"totalTestsAntibody":null,"positiveTestsAntibody":null,"negativeTestsAntibody":null,"totalTestsPeopleAntibody":null,"positiveTestsPeopleAntibody":null,"negativeTestsPeopleAntibody":null,"totalTestsPeopleAntigen":null,"positiveTestsPeopleAntigen":null,"totalTestsAntigen":null,"positiveTestsAntigen":null,"fips":"15","positiveIncrease":61,"negativeIncrease":0,"total":27778,"totalTestResultsIncrease":4498,"posNeg":27778,"dataQualityGrade":null,"deathIncrease":2,"hospitalizedIncrease":3,"hash":"8a6ae45475f5602a0e04cb9254f743bc95a5fde7","commercialScore":0,"negativeRegularScore":0,"negativeScore":0,"positiveScore":0,"score":0,"grade":""},{"date":20210218,"state":"HI","positive":27717,"probableCases":717,"negative":null,"pending":null,"totalTestResultsSource":"totalTestEncountersViral","totalTestResults":1049298,"hospitalizedCurrently":39,"hospitalizedCumulative":2179,"inIcuCurrently":12,"inIcuCumulative":null,"onVentilatorCurrently":8,"onVentilatorCumulative":null,"recovered":null,"lastUpdateEt":"2/16/2021 14:30","dateModified":"2021-02-16T14:30:00Z","checkTimeEt":"02/16 09:30","death":428,"hospitalized":2179,"hospitalizedDischarged":null,"dateChecked":"2021-02-16T14:30:00Z","totalTestsViral":null,"positiveTestsViral":26534,"negativeTestsViral":null,"positiveCasesViral":27000,"deathConfirmed":428,"deathProbable":null,"totalTestEncountersViral":1049298,"totalTestsPeopleViral":null,"totalTestsAntibody":null,"positiveTestsAntibody":null,"negativeTestsAntibody":null,"totalTestsPeopleAntibody":null,"positiveTestsPeopleAntibody":null,"negativeTestsPeopleAntibody":null,"totalTestsPeopleAntigen":null,"positiveTestsPeopleAntigen":null,"totalTestsAntigen":null,"positiveTestsAntigen":null,"fips":"15","positiveIncrease":65,"negativeIncrease":0,"total":27717,"totalTestResultsIncrease":7642,"posNeg":27717,"dataQualityGrade":null,"deathIncrease":1,"hospitalizedIncrease":5,"hash":"4e27fc9832fe4d0ad719310cd692897e5bb33bcb","commercialScore":0,"negativeRegularScore":0,"negativeScore":0,"positiveScore":0,"score":0,"grade":""},{"date":20210217,"state":"HI","positive":27652,"probableCases":717,"negative":null,"pending":null,"totalTestResultsSource":"totalTestEncountersViral","totalTestResults":1041656,"hospitalizedCurrently":39,"hospitalizedCumulative":2174,"inIcuCurrently":12,"inIcuCumulative":null,"onVentilatorCurrently":8,"onVentilatorCumulative":null,"recovered":null,"lastUpdateEt":"2/15/2021 14:30","dateModified":"2021-02-15T14:30:00Z","checkTimeEt":"02/15 09:30","death":427,"hospitalized":2174,"hospitalizedDischarged":null,"dateChecked":"2021-02-15T14:30:00Z","totalTestsViral":null,"positiveTestsViral":26458,"negativeTestsViral":null,"positiveCasesViral":26935,"deathConfirmed":427,"deathProbable":null,"totalTestEncountersViral":1041656,"totalTestsPeopleViral":null,"totalTestsAntibody":null,"positiveTestsAntibody":null,"negativeTestsAntibody":null,"totalTestsPeopleAntibody":null,"positiveTestsPeopleAntibody":null,"negativeTestsPeopleAntibody":null,"totalTestsPeopleAntigen":null,"positiveTestsPeopleAntigen":null,"totalTestsAntigen":null,"positiveTestsAntigen":null,"fips":"15","positiveIncrease":29,"negativeIncrease":0,"total":27652,"totalTestResultsIncrease":2184,"posNeg":27652,"dataQualityGrade":null,"deathIncrease":1,"hospitalizedIncrease":0,"hash":"158ae237405878fa2ee2f07651fa71f74060213a","commercialScore":0,"negativeRegularScore":0,"negativeScore":0,"positiveScore":0,"score":0,"grade":""},{"date":20210216,"state":"HI","positive":27623,"probableCases":717,"negative":null,"pending":null,"totalTestResultsSource":"totalTestEncountersViral","totalTestResults":1039472,"hospitalizedCurrently":38,"hospitalizedCumulative":2174,"inIcuCurrently":14,"inIcuCumulative":null,"onVentilatorCurrently":9,"onVentilatorCumulative":null,"recovered":null,"lastUpdateEt":"2/14/2021 14:30","dateModified":"2021-02-14T14:30:00Z","checkTimeEt":"02/14 09:30","death":426,"hospitalized":2174,"hospitalizedDischarged":null,"dateChecked":"2021-02-14T14:30:00Z","totalTestsViral":null,"positiveTestsViral":26433,"negativeTestsViral":null,"positiveCasesViral":26906,"deathConfirmed":426,"deathProbable":null,"totalTestEncountersViral":1039472,"totalTestsPeopleViral":null,"totalTestsAntibody":null,"positiveTestsAntibody":null,"negativeTestsAntibody":null,"totalTestsPeopleAntibody":null,"positiveTestsPeopleAntibody":null,"negativeTestsPeopleAntibody":null,"totalTestsPeopleAntigen":null,"positiveTestsPeopleAntigen":null,"totalTestsAntigen":null,"positiveTestsAntigen":null,"fips":"15","positiveIncrease":17,"negativeIncrease":0,"total":27623,"totalTestResultsIncrease":459,"posNeg":27623,"dataQualityGrade":null,"deathIncrease":0,"hospitalizedIncrease":25,"hash":"427a08cce174b8b98109cb631e8d576b099ac519","commercialScore":0,"negativeRegularScore":0,"negativeScore":0,"positiveScore":0,"score":0,"grade":""},{"date":20210215,"state":"HI","positive":27606,"probableCases":717,"negative":null,"pending":null,"totalTestResultsSource":"totalTestEncountersViral","totalTestResults":1039013,"hospitalizedCurrently":40,"hospitalizedCumulative":2149,"inIcuCurrently":13,"inIcuCumulative":null,"onVentilatorCurrently":10,"onVentilatorCumulative":null,"recovered":null,"lastUpdateEt":"2/13/2021 14:30","dateModified":"2021-02-13T14:30:00Z","checkTimeEt":"02/13 09:30","death":426,"hospitalized":2149,"hospitalizedDischarged":null,"dateChecked":"2021-02-13T14:30:00Z","totalTestsViral":null,"positiveTestsViral":26420,"negativeTestsViral":null,"positiveCasesViral":26889,"deathConfirmed":426,"deathProbable":null,"totalTestEncountersViral":1039013,"totalTestsPeopleViral":null,"totalTestsAntibody":null,"positiveTestsAntibody":null,"negativeTestsAntibody":null,"totalTestsPeopleAntibody":null,"positiveTestsPeopleAntibody":null,"negativeTestsPeopleAntibody":null,"totalTestsPeopleAntigen":null,"positiveTestsPeopleAntigen":null,"totalTestsAntigen":null,"positiveTestsAntigen":null,"fips":"15","positiveIncrease":33,"negativeIncrease":0,"total":27606,"totalTestResultsIncrease":4273,"posNeg":27606,"dataQualityGrade":null,"deathIncrease":0,"hospitalizedIncrease":0,"hash":"49ae5d096756d114d8839ca6f5c416cc81e8f240","commercialScore":0,"negativeRegularScore":0,"negativeScore":0,"positiveScore":0,"score":0,"grade":""},{"date":20210214,"state":"HI","positive":27573,"probableCases":717,"negative":null,"pending":null,"totalTestResultsSource":"totalTestEncountersViral","totalTestResults":1034740,"hospitalizedCurrently":40,"hospitalizedCumulative":2149,"inIcuCurrently":13,"inIcuCumulative":null,"onVentilatorCurrently":10,"onVentilatorCumulative":null,"recovered":null,"lastUpdateEt":"2/12/2021 14:30","dateModified":"2021-02-12T14:30:00Z","checkTimeEt":"02/12 09:30","death":426,"hospitalized":2149,"hospitalizedDischarged":null,"dateChecked":"2021-02-12T14:30:00Z","totalTestsViral":null,"positiveTestsViral":26354,"negativeTestsViral":null,"positiveCasesViral":26856,"deathConfirmed":426,"deathProbable":null,"totalTestEncountersViral":1034740,"totalTestsPeopleViral":null,"totalTestsAntibody":null,"positiveTestsAntibody":null,"negativeTestsAntibody":null,"totalTestsPeopleAntibody":null,"positiveTestsPeopleAntibody":null,"negativeTestsPeopleAntibody":null,"totalTestsPeopleAntigen":null,"positiveTestsPeopleAntigen":null,"totalTestsAntigen":null,"positiveTestsAntigen":null,"fips":"15","positiveIncrease":46,"negativeIncrease":0,"total":27573,"totalTestResultsIncrease":5584,"posNeg":27573,"dataQualityGrade":null,"deathIncrease":1,"hospitalizedIncrease":0,"hash":"41cdca2b62d21d9448f9eb7792f60b6a3e48803f","commercialScore":0,"negativeRegularScore":0,"negativeScore":0,"positiveScore":0,"score":0,"grade":""},{"date":20210213,"state":"HI","positive":27527,"probableCases":717,"negative":null,"pending":null,"totalTestResultsSource":"totalTestEncountersViral","totalTestResults":1029156,"hospitalizedCurrently":40,"hospitalizedCumulative":2149,"inIcuCurrently":13,"inIcuCumulative":null,"onVentilatorCurrently":10,"onVentilatorCumulative":null,"recovered":null,"lastUpdateEt":"2/11/2021 14:30","dateModified":"2021-02-11T14:30:00Z","checkTimeEt":"02/11 09:30","death":425,"hospitalized":2149,"hospitalizedDischarged":null,"dateChecked":"2021-02-11T14:30:00Z","totalTestsViral":null,"positiveTestsViral":26354,"negativeTestsViral":null,"positiveCasesViral":26810,"deathConfirmed":425,"deathProbable":null,"totalTestEncountersViral":1029156,"totalTestsPeopleViral":null,"totalTestsAntibody":null,"positiveTestsAntibody":null,"negativeTestsAntibody":null,"totalTestsPeopleAntibody":null,"positiveTestsPeopleAntibody":null,"negativeTestsPeopleAntibody":null,"totalTestsPeopleAntigen":null,"positiveTestsPeopleAntigen":null,"totalTestsAntigen":null,"positiveTestsAntigen":null,"fips":"15","positiveIncrease":67,"negativeIncrease":0,"total":27527,"totalTestResultsIncrease":5604,"posNeg":27527,"dataQualityGrade":null,"deathIncrease":0,"hospitalizedIncrease":0,"hash":"2d7ea01df6888864df9532457aacb485324ba605","commercialScore":0,"negativeRegularScore":0,"negativeScore":0,"positiveScore":0,"score":0,"grade":""},{"date":20210212,"state":"HI","positive":27460,"probableCases":717,"negative":null,"pending":null,"totalTestResultsSource":"totalTestEncountersViral","totalTestResults":1023552,"hospitalizedCurrently":40,"hospitalizedCumulative":2149,"inIcuCurrently":13,"inIcuCumulative":null,"onVentilatorCurrently":10,"onVentilatorCumulative":null,"recovered":null,"lastUpdateEt":"2/10/2021 14:30","dateModified":"2021-02-10T14:30:00Z","checkTimeEt":"02/10 09:30","death":425,"hospitalized":2149,"hospitalizedDischarged":null,"dateChecked":"2021-02-10T14:30:00Z","totalTestsViral":null,"positiveTestsViral":26290,"negativeTestsViral":null,"positiveCasesViral":26743,"deathConfirmed":425,"deathProbable":null,"totalTestEncountersViral":1023552,"totalTestsPeopleViral":null,"totalTestsAntibody":null,"positiveTestsAntibody":null,"negativeTestsAntibody":null,"totalTestsPeopleAntibody":null,"positiveTestsPeopleAntibody":null,"negativeTestsPeopleAntibody":null,"totalTestsPeopleAntigen":null,"positiveTestsPeopleAntigen":null,"totalTestsAntigen":null,"positiveTestsAntigen":null,"fips":"15","positiveIncrease":90,"negativeIncrease":0,"total":27460,"totalTestResultsIncrease":5556,"posNeg":27460,"dataQualityGrade":null,"deathIncrease":1,"hospitalizedIncrease":2,"hash":"b394503a4a228bdfb82d1839453fbc0c8c325534","commercialScore":0,"negativeRegularScore":0,"negativeScore":0,"positiveScore":0,"score":0,"grade":""},{"date":20210211,"state":"HI","positive":27370,"probableCases":695,"negative":null,"pending":null,"totalTestResultsSource":"totalTestEncountersViral","totalTestResults":1017996,"hospitalizedCurrently":49,"hospitalizedCumulative":2147,"inIcuCurrently":14,"inIcuCumulative":null,"onVentilatorCurrently":12,"onVentilatorCumulative":null,"recovered":null,"lastUpdateEt":"2/9/2021 14:30","dateModified":"2021-02-09T14:30:00Z","checkTimeEt":"02/09 09:30","death":424,"hospitalized":2147,"hospitalizedDischarged":null,"dateChecked":"2021-02-09T14:30:00Z","totalTestsViral":null,"positiveTestsViral":26227,"negativeTestsViral":null,"positiveCasesViral":26675,"deathConfirmed":424,"deathProbable":null,"totalTestEncountersViral":1017996,"totalTestsPeopleViral":null,"totalTestsAntibody":null,"positiveTestsAntibody":null,"negativeTestsAntibody":null,"totalTestsPeopleAntibody":null,"positiveTestsPeopleAntibody":null,"negativeTestsPeopleAntibody":null,"totalTestsPeopleAntigen":null,"positiveTestsPeopleAntigen":null,"totalTestsAntigen":null,"positiveTestsAntigen":null,"fips":"15","positiveIncrease":91,"negativeIncrease":0,"total":27370,"totalTestResultsIncrease":5184,"posNeg":27370,"dataQualityGrade":null,"deathIncrease":1,"hospitalizedIncrease":8,"hash":"1f95a470d45c86eddb33b9c3d68021b802a3227d","commercialScore":0,"negativeRegularScore":0,"negativeScore":0,"positiveScore":0,"score":0,"grade":""},{"date":20210210,"state":"HI","positive":27279,"probableCases":695,"negative":null,"pending":null,"totalTestResultsSource":"totalTestEncountersViral","totalTestResults":1012812,"hospitalizedCurrently":58,"hospitalizedCumulative":2139,"inIcuCurrently":16,"inIcuCumulative":null,"onVentilatorCurrently":17,"onVentilatorCumulative":null,"recovered":null,"lastUpdateEt":"2/8/2021 14:30","dateModified":"2021-02-08T14:30:00Z","checkTimeEt":"02/08 09:30","death":423,"hospitalized":2139,"hospitalizedDischarged":null,"dateChecked":"2021-02-08T14:30:00Z","totalTestsViral":null,"positiveTestsViral":26147,"negativeTestsViral":null,"positiveCasesViral":26584,"deathConfirmed":423,"deathProbable":null,"totalTestEncountersViral":1012812,"totalTestsPeopleViral":null,"totalTestsAntibody":null,"positiveTestsAntibody":null,"negativeTestsAntibody":null,"totalTestsPeopleAntibody":null,"positiveTestsPeopleAntibody":null,"negativeTestsPeopleAntibody":null,"totalTestsPeopleAntigen":null,"positiveTestsPeopleAntigen":null,"totalTestsAntigen":null,"positiveTestsAntigen":null,"fips":"15","positiveIncrease":53,"negativeIncrease":0,"total":27279,"totalTestResultsIncrease":4322,"posNeg":27279,"dataQualityGrade":null,"deathIncrease":5,"hospitalizedIncrease":-1,"hash":"67814ebd9f80a8f1412631b50307bf2ccc051906","commercialScore":0,"negativeRegularScore":0,"negativeScore":0,"positiveScore":0,"score":0,"grade":""},{"date":20210209,"state":"HI","positive":27226,"probableCases":695,"negative":null,"pending":null,"totalTestResultsSource":"totalTestEncountersViral","totalTestResults":1008490,"hospitalizedCurrently":63,"hospitalizedCumulative":2140,"inIcuCurrently":16,"inIcuCumulative":null,"onVentilatorCurrently":12,"onVentilatorCumulative":null,"recovered":null,"lastUpdateEt":"2/7/2021 14:30","dateModified":"2021-02-07T14:30:00Z","checkTimeEt":"02/07 09:30","death":418,"hospitalized":2140,"hospitalizedDischarged":null,"dateChecked":"2021-02-07T14:30:00Z","totalTestsViral":null,"positiveTestsViral":26098,"negativeTestsViral":null,"positiveCasesViral":26531,"deathConfirmed":418,"deathProbable":null,"totalTestEncountersViral":1008490,"totalTestsPeopleViral":null,"totalTestsAntibody":null,"positiveTestsAntibody":null,"negativeTestsAntibody":null,"totalTestsPeopleAntibody":null,"positiveTestsPeopleAntibody":null,"negativeTestsPeopleAntibody":null,"totalTestsPeopleAntigen":null,"positiveTestsPeopleAntigen":null,"totalTestsAntigen":null,"positiveTestsAntigen":null,"fips":"15","positiveIncrease":31,"negativeIncrease":0,"total":27226,"totalTestResultsIncrease":2809,"posNeg":27226,"dataQualityGrade":null,"deathIncrease":0,"hospitalizedIncrease":0,"hash":"8449ef40b7b1653e94f2f6fc174d09c0d93a6c91","commercialScore":0,"negativeRegularScore":0,"negativeScore":0,"positiveScore":0,"score":0,"grade":""},{"date":20210208,"state":"HI","positive":27195,"probableCases":695,"negative":null,"pending":null,"totalTestResultsSource":"totalTestEncountersViral","totalTestResults":1005681,"hospitalizedCurrently":82,"hospitalizedCumulative":2140,"inIcuCurrently":22,"inIcuCumulative":null,"onVentilatorCurrently":16,"onVentilatorCumulative":null,"recovered":null,"lastUpdateEt":"2/6/2021 14:30","dateModified":"2021-02-06T14:30:00Z","checkTimeEt":"02/06 09:30","death":418,"hospitalized":2140,"hospitalizedDischarged":null,"dateChecked":"2021-02-06T14:30:00Z","totalTestsViral":null,"positiveTestsViral":26071,"negativeTestsViral":null,"positiveCasesViral":26500,"deathConfirmed":418,"deathProbable":null,"totalTestEncountersViral":1005681,"totalTestsPeopleViral":null,"totalTestsAntibody":null,"positiveTestsAntibody":null,"negativeTestsAntibody":null,"totalTestsPeopleAntibody":null,"positiveTestsPeopleAntibody":null,"negativeTestsPeopleAntibody":null,"totalTestsPeopleAntigen":null,"positiveTestsPeopleAntigen":null,"totalTestsAntigen":null,"positiveTestsAntigen":null,"fips":"15","positiveIncrease":32,"negativeIncrease":0,"total":27195,"totalTestResultsIncrease":3662,"posNeg":27195,"dataQualityGrade":null,"deathIncrease":0,"hospitalizedIncrease":34,"hash":"84f93a3fe9e389be015d1f6d11b90cc1738601a6","commercialScore":0,"negativeRegularScore":0,"negativeScore":0,"positiveScore":0,"score":0,"grade":""},{"date":20210207,"state":"HI","positive":27163,"probableCases":695,"negative":null,"pending":null,"totalTestResultsSource":"totalTestEncountersViral","totalTestResults":1002019,"hospitalizedCurrently":64,"hospitalizedCumulative":2106,"inIcuCurrently":17,"inIcuCumulative":null,"onVentilatorCurrently":13,"onVentilatorCumulative":null,"recovered":null,"lastUpdateEt":"2/5/2021 14:30","dateModified":"2021-02-05T14:30:00Z","checkTimeEt":"02/05 09:30","death":418,"hospitalized":2106,"hospitalizedDischarged":null,"dateChecked":"2021-02-05T14:30:00Z","totalTestsViral":null,"positiveTestsViral":26043,"negativeTestsViral":null,"positiveCasesViral":26468,"deathConfirmed":418,"deathProbable":null,"totalTestEncountersViral":1002019,"totalTestsPeopleViral":null,"totalTestsAntibody":null,"positiveTestsAntibody":null,"negativeTestsAntibody":null,"totalTestsPeopleAntibody":null,"positiveTestsPeopleAntibody":null,"negativeTestsPeopleAntibody":null,"totalTestsPeopleAntigen":null,"positiveTestsPeopleAntigen":null,"totalTestsAntigen":null,"positiveTestsAntigen":null,"fips":"15","positiveIncrease":75,"negativeIncrease":0,"total":27163,"totalTestResultsIncrease":4696,"posNeg":27163,"dataQualityGrade":null,"deathIncrease":2,"hospitalizedIncrease":0,"hash":"5388064a0f7146d0365e328fe2f0818884511c0a","commercialScore":0,"negativeRegularScore":0,"negativeScore":0,"positiveScore":0,"score":0,"grade":""},{"date":20210206,"state":"HI","positive":27088,"probableCases":695,"negative":null,"pending":null,"totalTestResultsSource":"totalTestEncountersViral","totalTestResults":997323,"hospitalizedCurrently":64,"hospitalizedCumulative":2106,"inIcuCurrently":17,"inIcuCumulative":null,"onVentilatorCurrently":13,"onVentilatorCumulative":null,"recovered":null,"lastUpdateEt":"2/4/2021 14:30","dateModified":"2021-02-04T14:30:00Z","checkTimeEt":"02/04 09:30","death":416,"hospitalized":2106,"hospitalizedDischarged":null,"dateChecked":"2021-02-04T14:30:00Z","totalTestsViral":null,"positiveTestsViral":25966,"negativeTestsViral":null,"positiveCasesViral":26393,"deathConfirmed":416,"deathProbable":null,"totalTestEncountersViral":997323,"totalTestsPeopleViral":null,"totalTestsAntibody":null,"positiveTestsAntibody":null,"negativeTestsAntibody":null,"totalTestsPeopleAntibody":null,"positiveTestsPeopleAntibody":null,"negativeTestsPeopleAntibody":null,"totalTestsPeopleAntigen":null,"positiveTestsPeopleAntigen":null,"totalTestsAntigen":null,"positiveTestsAntigen":null,"fips":"15","positiveIncrease":107,"negativeIncrease":0,"total":27088,"totalTestResultsIncrease":9206,"posNeg":27088,"dataQualityGrade":null,"deathIncrease":0,"hospitalizedIncrease":0,"hash":"c590f78a90e988acaaf3aae1382096d907d0ee1a","commercialScore":0,"negativeRegularScore":0,"negativeScore":0,"positiveScore":0,"score":0,"grade":""},{"date":20210205,"state":"HI","positive":26981,"probableCases":695,"negative":null,"pending":null,"totalTestResultsSource":"totalTestEncountersViral","totalTestResults":988117,"hospitalizedCurrently":64,"hospitalizedCumulative":2106,"inIcuCurrently":17,"inIcuCumulative":null,"onVentilatorCurrently":13,"onVentilatorCumulative":null,"recovered":null,"lastUpdateEt":"2/3/2021 14:30","dateModified":"2021-02-03T14:30:00Z","checkTimeEt":"02/03 09:30","death":416,"hospitalized":2106,"hospitalizedDischarged":null,"dateChecked":"2021-02-03T14:30:00Z","totalTestsViral":null,"positiveTestsViral":25847,"negativeTestsViral":null,"positiveCasesViral":26286,"deathConfirmed":416,"deathProbable":null,"totalTestEncountersViral":988117,"totalTestsPeopleViral":null,"totalTestsAntibody":null,"positiveTestsAntibody":null,"negativeTestsAntibody":null,"totalTestsPeopleAntibody":null,"positiveTestsPeopleAntibody":null,"negativeTestsPeopleAntibody":null,"totalTestsPeopleAntigen":null,"positiveTestsPeopleAntigen":null,"totalTestsAntigen":null,"positiveTestsAntigen":null,"fips":"15","positiveIncrease":129,"negativeIncrease":0,"total":26981,"totalTestResultsIncrease":5096,"posNeg":26981,"dataQualityGrade":null,"deathIncrease":0,"hospitalizedIncrease":3,"hash":"293a7e6d1f0b132a74d9662fc5fbbac24748e7db","commercialScore":0,"negativeRegularScore":0,"negativeScore":0,"positiveScore":0,"score":0,"grade":""},{"date":20210204,"state":"HI","positive":26852,"probableCases":665,"negative":null,"pending":null,"totalTestResultsSource":"totalTestEncountersViral","totalTestResults":983021,"hospitalizedCurrently":57,"hospitalizedCumulative":2103,"inIcuCurrently":19,"inIcuCumulative":null,"onVentilatorCurrently":12,"onVentilatorCumulative":null,"recovered":null,"lastUpdateEt":"2/2/2021 14:30","dateModified":"2021-02-02T14:30:00Z","checkTimeEt":"02/02 09:30","death":416,"hospitalized":2103,"hospitalizedDischarged":null,"dateChecked":"2021-02-02T14:30:00Z","totalTestsViral":null,"positiveTestsViral":25764,"negativeTestsViral":null,"positiveCasesViral":26187,"deathConfirmed":416,"deathProbable":null,"totalTestEncountersViral":983021,"totalTestsPeopleViral":null,"totalTestsAntibody":null,"positiveTestsAntibody":null,"negativeTestsAntibody":null,"totalTestsPeopleAntibody":null,"positiveTestsPeopleAntibody":null,"negativeTestsPeopleAntibody":null,"totalTestsPeopleAntigen":null,"positiveTestsPeopleAntigen":null,"totalTestsAntigen":null,"positiveTestsAntigen":null,"fips":"15","positiveIncrease":106,"negativeIncrease":0,"total":26852,"totalTestResultsIncrease":4120,"posNeg":26852,"dataQualityGrade":null,"deathIncrease":2,"hospitalizedIncrease":7,"hash":"3da953f2f575a945e78c583a799486d6ceead92f","commercialScore":0,"negativeRegularScore":0,"negativeScore":0,"positiveScore":0,"score":0,"grade":""},{"date":20210203,"state":"HI","positive":26746,"probableCases":665,"negative":null,"pending":null,"totalTestResultsSource":"totalTestEncountersViral","totalTestResults":978901,"hospitalizedCurrently":55,"hospitalizedCumulative":2096,"inIcuCurrently":21,"inIcuCumulative":null,"onVentilatorCurrently":16,"onVentilatorCumulative":null,"recovered":null,"lastUpdateEt":"2/1/2021 14:30","dateModified":"2021-02-01T14:30:00Z","checkTimeEt":"02/01 09:30","death":414,"hospitalized":2096,"hospitalizedDischarged":null,"dateChecked":"2021-02-01T14:30:00Z","totalTestsViral":null,"positiveTestsViral":25665,"negativeTestsViral":null,"positiveCasesViral":26081,"deathConfirmed":414,"deathProbable":null,"totalTestEncountersViral":978901,"totalTestsPeopleViral":null,"totalTestsAntibody":null,"positiveTestsAntibody":null,"negativeTestsAntibody":null,"totalTestsPeopleAntibody":null,"positiveTestsPeopleAntibody":null,"negativeTestsPeopleAntibody":null,"totalTestsPeopleAntigen":null,"positiveTestsPeopleAntigen":null,"totalTestsAntigen":null,"positiveTestsAntigen":null,"fips":"15","positiveIncrease":74,"negativeIncrease":0,"total":26746,"totalTestResultsIncrease":-16946,"posNeg":26746,"dataQualityGrade":null,"deathIncrease":4,"hospitalizedIncrease":6,"hash":"342811d56d37f89136f2c48e34767dbde73cddfd","commercialScore":0,"negativeRegularScore":0,"negativeScore":0,"positiveScore":0,"score":0,"grade":""},{"date":20210202,"state":"HI","positive":26672,"probableCases":665,"negative":null,"pending":null,"totalTestResultsSource":"totalTestEncountersViral","totalTestResults":995847,"hospitalizedCurrently":61,"hospitalizedCumulative":2090,"inIcuCurrently":19,"inIcuCumulative":null,"onVentilatorCurrently":15,"onVentilatorCumulative":null,"recovered":null,"lastUpdateEt":"1/31/2021 14:30","dateModified":"2021-01-31T14:30:00Z","checkTimeEt":"01/31 09:30","death":410,"hospitalized":2090,"hospitalizedDischarged":null,"dateChecked":"2021-01-31T14:30:00Z","totalTestsViral":null,"positiveTestsViral":25821,"negativeTestsViral":null,"positiveCasesViral":26007,"deathConfirmed":410,"deathProbable":null,"totalTestEncountersViral":995847,"totalTestsPeopleViral":null,"totalTestsAntibody":null,"positiveTestsAntibody":null,"negativeTestsAntibody":null,"totalTestsPeopleAntibody":null,"positiveTestsPeopleAntibody":null,"negativeTestsPeopleAntibody":null,"totalTestsPeopleAntigen":null,"positiveTestsPeopleAntigen":null,"totalTestsAntigen":null,"positiveTestsAntigen":null,"fips":"15","positiveIncrease":64,"negativeIncrease":0,"total":26672,"totalTestResultsIncrease":2541,"posNeg":26672,"dataQualityGrade":null,"deathIncrease":0,"hospitalizedIncrease":4,"hash":"cdb4ff3ea764236b2b14c7328156e99c3c834ada","commercialScore":0,"negativeRegularScore":0,"negativeScore":0,"positiveScore":0,"score":0,"grade":""},{"date":20210201,"state":"HI","positive":26608,"probableCases":665,"negative":null,"pending":null,"totalTestResultsSource":"totalTestEncountersViral","totalTestResults":993306,"hospitalizedCurrently":63,"hospitalizedCumulative":2086,"inIcuCurrently":16,"inIcuCumulative":null,"onVentilatorCurrently":12,"onVentilatorCumulative":null,"recovered":null,"lastUpdateEt":"1/30/2021 14:30","dateModified":"2021-01-30T14:30:00Z","checkTimeEt":"01/30 09:30","death":410,"hospitalized":2086,"hospitalizedDischarged":null,"dateChecked":"2021-01-30T14:30:00Z","totalTestsViral":null,"positiveTestsViral":25806,"negativeTestsViral":null,"positiveCasesViral":25943,"deathConfirmed":410,"deathProbable":null,"totalTestEncountersViral":993306,"totalTestsPeopleViral":null,"totalTestsAntibody":null,"positiveTestsAntibody":null,"negativeTestsAntibody":null,"totalTestsPeopleAntibody":null,"positiveTestsPeopleAntibody":null,"negativeTestsPeopleAntibody":null,"totalTestsPeopleAntigen":null,"positiveTestsPeopleAntigen":null,"totalTestsAntigen":null,"positiveTestsAntigen":null,"fips":"15","positiveIncrease":90,"negativeIncrease":0,"total":26608,"totalTestResultsIncrease":5831,"posNeg":26608,"dataQualityGrade":null,"deathIncrease":0,"hospitalizedIncrease":19,"hash":"3734a7a724e404260bbfff783f689faf335f31a2","commercialScore":0,"negativeRegularScore":0,"negativeScore":0,"positiveScore":0,"score":0,"grade":""},{"date":20210131,"state":"HI","positive":26518,"probableCases":665,"negative":null,"pending":null,"totalTestResultsSource":"totalTestEncountersViral","totalTestResults":987475,"hospitalizedCurrently":73,"hospitalizedCumulative":2067,"inIcuCurrently":19,"inIcuCumulative":null,"onVentilatorCurrently":15,"onVentilatorCumulative":null,"recovered":null,"lastUpdateEt":"1/29/2021 14:30","dateModified":"2021-01-29T14:30:00Z","checkTimeEt":"01/29 09:30","death":410,"hospitalized":2067,"hospitalizedDischarged":null,"dateChecked":"2021-01-29T14:30:00Z","totalTestsViral":null,"positiveTestsViral":25468,"negativeTestsViral":null,"positiveCasesViral":25853,"deathConfirmed":410,"deathProbable":null,"totalTestEncountersViral":987475,"totalTestsPeopleViral":null,"totalTestsAntibody":null,"positiveTestsAntibody":null,"negativeTestsAntibody":null,"totalTestsPeopleAntibody":null,"positiveTestsPeopleAntibody":null,"negativeTestsPeopleAntibody":null,"totalTestsPeopleAntigen":null,"positiveTestsPeopleAntigen":null,"totalTestsAntigen":null,"positiveTestsAntigen":null,"fips":"15","positiveIncrease":82,"negativeIncrease":0,"total":26518,"totalTestResultsIncrease":4569,"posNeg":26518,"dataQualityGrade":null,"deathIncrease":3,"hospitalizedIncrease":0,"hash":"126fa2647131368d639cd14f177029e97d698bc0","commercialScore":0,"negativeRegularScore":0,"negativeScore":0,"positiveScore":0,"score":0,"grade":""},{"date":20210130,"state":"HI","positive":26436,"probableCases":665,"negative":null,"pending":null,"totalTestResultsSource":"totalTestEncountersViral","totalTestResults":982906,"hospitalizedCurrently":73,"hospitalizedCumulative":2067,"inIcuCurrently":19,"inIcuCumulative":null,"onVentilatorCurrently":15,"onVentilatorCumulative":null,"recovered":null,"lastUpdateEt":"1/28/2021 14:30","dateModified":"2021-01-28T14:30:00Z","checkTimeEt":"01/28 09:30","death":407,"hospitalized":2067,"hospitalizedDischarged":null,"dateChecked":"2021-01-28T14:30:00Z","totalTestsViral":null,"positiveTestsViral":25392,"negativeTestsViral":null,"positiveCasesViral":25771,"deathConfirmed":407,"deathProbable":null,"totalTestEncountersViral":982906,"totalTestsPeopleViral":null,"totalTestsAntibody":null,"positiveTestsAntibody":null,"negativeTestsAntibody":null,"totalTestsPeopleAntibody":null,"positiveTestsPeopleAntibody":null,"negativeTestsPeopleAntibody":null,"totalTestsPeopleAntigen":null,"positiveTestsPeopleAntigen":null,"totalTestsAntigen":null,"positiveTestsAntigen":null,"fips":"15","positiveIncrease":115,"negativeIncrease":0,"total":26436,"totalTestResultsIncrease":9472,"posNeg":26436,"dataQualityGrade":null,"deathIncrease":0,"hospitalizedIncrease":3,"hash":"7d9a15ffdc44d450fb1cb19cc15ad38d47c1988e","commercialScore":0,"negativeRegularScore":0,"negativeScore":0,"positiveScore":0,"score":0,"grade":""},{"date":20210129,"state":"HI","positive":26321,"probableCases":665,"negative":null,"pending":null,"totalTestResultsSource":"totalTestEncountersViral","totalTestResults":973434,"hospitalizedCurrently":71,"hospitalizedCumulative":2064,"inIcuCurrently":20,"inIcuCumulative":null,"onVentilatorCurrently":16,"onVentilatorCumulative":null,"recovered":null,"lastUpdateEt":"1/27/2021 14:30","dateModified":"2021-01-27T14:30:00Z","checkTimeEt":"01/27 09:30","death":407,"hospitalized":2064,"hospitalizedDischarged":null,"dateChecked":"2021-01-27T14:30:00Z","totalTestsViral":null,"positiveTestsViral":25289,"negativeTestsViral":null,"positiveCasesViral":25656,"deathConfirmed":407,"deathProbable":null,"totalTestEncountersViral":973434,"totalTestsPeopleViral":null,"totalTestsAntibody":null,"positiveTestsAntibody":null,"negativeTestsAntibody":null,"totalTestsPeopleAntibody":null,"positiveTestsPeopleAntibody":null,"negativeTestsPeopleAntibody":null,"totalTestsPeopleAntigen":null,"positiveTestsPeopleAntigen":null,"totalTestsAntigen":null,"positiveTestsAntigen":null,"fips":"15","positiveIncrease":152,"negativeIncrease":0,"total":26321,"totalTestResultsIncrease":15171,"posNeg":26321,"dataQualityGrade":null,"deathIncrease":1,"hospitalizedIncrease":0,"hash":"5d50994ea93d67d94670ebc1dc004ebb4ba92753","commercialScore":0,"negativeRegularScore":0,"negativeScore":0,"positiveScore":0,"score":0,"grade":""},{"date":20210128,"state":"HI","positive":26169,"probableCases":628,"negative":null,"pending":null,"totalTestResultsSource":"totalTestEncountersViral","totalTestResults":958263,"hospitalizedCurrently":71,"hospitalizedCumulative":2064,"inIcuCurrently":20,"inIcuCumulative":null,"onVentilatorCurrently":16,"onVentilatorCumulative":null,"recovered":null,"lastUpdateEt":"1/26/2021 14:30","dateModified":"2021-01-26T14:30:00Z","checkTimeEt":"01/26 09:30","death":406,"hospitalized":2064,"hospitalizedDischarged":null,"dateChecked":"2021-01-26T14:30:00Z","totalTestsViral":null,"positiveTestsViral":25177,"negativeTestsViral":null,"positiveCasesViral":25541,"deathConfirmed":406,"deathProbable":null,"totalTestEncountersViral":958263,"totalTestsPeopleViral":null,"totalTestsAntibody":null,"positiveTestsAntibody":null,"negativeTestsAntibody":null,"totalTestsPeopleAntibody":null,"positiveTestsPeopleAntibody":null,"negativeTestsPeopleAntibody":null,"totalTestsPeopleAntigen":null,"positiveTestsPeopleAntigen":null,"totalTestsAntigen":null,"positiveTestsAntigen":null,"fips":"15","positiveIncrease":99,"negativeIncrease":0,"total":26169,"totalTestResultsIncrease":5072,"posNeg":26169,"dataQualityGrade":null,"deathIncrease":2,"hospitalizedIncrease":7,"hash":"7b34f71861a49e646b4bf71d61795ff99a13d943","commercialScore":0,"negativeRegularScore":0,"negativeScore":0,"positiveScore":0,"score":0,"grade":""},{"date":20210127,"state":"HI","positive":26070,"probableCases":628,"negative":null,"pending":null,"totalTestResultsSource":"totalTestEncountersViral","totalTestResults":953191,"hospitalizedCurrently":80,"hospitalizedCumulative":2057,"inIcuCurrently":22,"inIcuCumulative":null,"onVentilatorCurrently":25,"onVentilatorCumulative":null,"recovered":null,"lastUpdateEt":"1/25/2021 14:30","dateModified":"2021-01-25T14:30:00Z","checkTimeEt":"01/25 09:30","death":404,"hospitalized":2057,"hospitalizedDischarged":null,"dateChecked":"2021-01-25T14:30:00Z","totalTestsViral":null,"positiveTestsViral":25062,"negativeTestsViral":null,"positiveCasesViral":25442,"deathConfirmed":404,"deathProbable":null,"totalTestEncountersViral":953191,"totalTestsPeopleViral":null,"totalTestsAntibody":null,"positiveTestsAntibody":null,"negativeTestsAntibody":null,"totalTestsPeopleAntibody":null,"positiveTestsPeopleAntibody":null,"negativeTestsPeopleAntibody":null,"totalTestsPeopleAntigen":null,"positiveTestsPeopleAntigen":null,"totalTestsAntigen":null,"positiveTestsAntigen":null,"fips":"15","positiveIncrease":103,"negativeIncrease":0,"total":26070,"totalTestResultsIncrease":4500,"posNeg":26070,"dataQualityGrade":null,"deathIncrease":3,"hospitalizedIncrease":7,"hash":"f769289ff1889b65c10686e57fce119b128730d0","commercialScore":0,"negativeRegularScore":0,"negativeScore":0,"positiveScore":0,"score":0,"grade":""},{"date":20210126,"state":"HI","positive":25967,"probableCases":628,"negative":null,"pending":null,"totalTestResultsSource":"totalTestEncountersViral","totalTestResults":948691,"hospitalizedCurrently":82,"hospitalizedCumulative":2050,"inIcuCurrently":21,"inIcuCumulative":null,"onVentilatorCurrently":18,"onVentilatorCumulative":null,"recovered":null,"lastUpdateEt":"1/24/2021 14:30","dateModified":"2021-01-24T14:30:00Z","checkTimeEt":"01/24 09:30","death":401,"hospitalized":2050,"hospitalizedDischarged":null,"dateChecked":"2021-01-24T14:30:00Z","totalTestsViral":null,"positiveTestsViral":24951,"negativeTestsViral":null,"positiveCasesViral":25339,"deathConfirmed":401,"deathProbable":null,"totalTestEncountersViral":948691,"totalTestsPeopleViral":null,"totalTestsAntibody":null,"positiveTestsAntibody":null,"negativeTestsAntibody":null,"totalTestsPeopleAntibody":null,"positiveTestsPeopleAntibody":null,"negativeTestsPeopleAntibody":null,"totalTestsPeopleAntigen":null,"positiveTestsPeopleAntigen":null,"totalTestsAntigen":null,"positiveTestsAntigen":null,"fips":"15","positiveIncrease":64,"negativeIncrease":0,"total":25967,"totalTestResultsIncrease":2346,"posNeg":25967,"dataQualityGrade":null,"deathIncrease":59,"hospitalizedIncrease":11,"hash":"754e6ad2eccd245b035196060e2921a11ec888ae","commercialScore":0,"negativeRegularScore":0,"negativeScore":0,"positiveScore":0,"score":0,"grade":""},{"date":20210125,"state":"HI","positive":25903,"probableCases":628,"negative":null,"pending":null,"totalTestResultsSource":"totalTestEncountersViral","totalTestResults":946345,"hospitalizedCurrently":89,"hospitalizedCumulative":2039,"inIcuCurrently":21,"inIcuCumulative":null,"onVentilatorCurrently":17,"onVentilatorCumulative":null,"recovered":null,"lastUpdateEt":"1/23/2021 14:30","dateModified":"2021-01-23T14:30:00Z","checkTimeEt":"01/23 09:30","death":342,"hospitalized":2039,"hospitalizedDischarged":null,"dateChecked":"2021-01-23T14:30:00Z","totalTestsViral":null,"positiveTestsViral":24898,"negativeTestsViral":null,"positiveCasesViral":25275,"deathConfirmed":342,"deathProbable":null,"totalTestEncountersViral":946345,"totalTestsPeopleViral":null,"totalTestsAntibody":null,"positiveTestsAntibody":null,"negativeTestsAntibody":null,"totalTestsPeopleAntibody":null,"positiveTestsPeopleAntibody":null,"negativeTestsPeopleAntibody":null,"totalTestsPeopleAntigen":null,"positiveTestsPeopleAntigen":null,"totalTestsAntigen":null,"positiveTestsAntigen":null,"fips":"15","positiveIncrease":121,"negativeIncrease":0,"total":25903,"totalTestResultsIncrease":4042,"posNeg":25903,"dataQualityGrade":null,"deathIncrease":0,"hospitalizedIncrease":25,"hash":"be81750acd3e50ffc4a36c4ae41d562f9aeaa7f3","commercialScore":0,"negativeRegularScore":0,"negativeScore":0,"positiveScore":0,"score":0,"grade":""},{"date":20210124,"state":"HI","positive":25782,"probableCases":628,"negative":null,"pending":null,"totalTestResultsSource":"totalTestEncountersViral","totalTestResults":942303,"hospitalizedCurrently":84,"hospitalizedCumulative":2014,"inIcuCurrently":21,"inIcuCumulative":null,"onVentilatorCurrently":18,"onVentilatorCumulative":null,"recovered":null,"lastUpdateEt":"1/22/2021 14:30","dateModified":"2021-01-22T14:30:00Z","checkTimeEt":"01/22 09:30","death":342,"hospitalized":2014,"hospitalizedDischarged":null,"dateChecked":"2021-01-22T14:30:00Z","totalTestsViral":null,"positiveTestsViral":24783,"negativeTestsViral":null,"positiveCasesViral":25154,"deathConfirmed":342,"deathProbable":null,"totalTestEncountersViral":942303,"totalTestsPeopleViral":null,"totalTestsAntibody":null,"positiveTestsAntibody":null,"negativeTestsAntibody":null,"totalTestsPeopleAntibody":null,"positiveTestsPeopleAntibody":null,"negativeTestsPeopleAntibody":null,"totalTestsPeopleAntigen":null,"positiveTestsPeopleAntigen":null,"totalTestsAntigen":null,"positiveTestsAntigen":null,"fips":"15","positiveIncrease":151,"negativeIncrease":0,"total":25782,"totalTestResultsIncrease":5853,"posNeg":25782,"dataQualityGrade":null,"deathIncrease":6,"hospitalizedIncrease":0,"hash":"d31035e8c70001ab2e71545d1e7383e001fd9645","commercialScore":0,"negativeRegularScore":0,"negativeScore":0,"positiveScore":0,"score":0,"grade":""},{"date":20210123,"state":"HI","positive":25631,"probableCases":628,"negative":null,"pending":null,"totalTestResultsSource":"totalTestEncountersViral","totalTestResults":936450,"hospitalizedCurrently":84,"hospitalizedCumulative":2014,"inIcuCurrently":21,"inIcuCumulative":null,"onVentilatorCurrently":18,"onVentilatorCumulative":null,"recovered":null,"lastUpdateEt":"1/21/2021 14:30","dateModified":"2021-01-21T14:30:00Z","checkTimeEt":"01/21 09:30","death":336,"hospitalized":2014,"hospitalizedDischarged":null,"dateChecked":"2021-01-21T14:30:00Z","totalTestsViral":null,"positiveTestsViral":24633,"negativeTestsViral":null,"positiveCasesViral":25003,"deathConfirmed":336,"deathProbable":null,"totalTestEncountersViral":936450,"totalTestsPeopleViral":null,"totalTestsAntibody":null,"positiveTestsAntibody":null,"negativeTestsAntibody":null,"totalTestsPeopleAntibody":null,"positiveTestsPeopleAntibody":null,"negativeTestsPeopleAntibody":null,"totalTestsPeopleAntigen":null,"positiveTestsPeopleAntigen":null,"totalTestsAntigen":null,"positiveTestsAntigen":null,"fips":"15","positiveIncrease":133,"negativeIncrease":0,"total":25631,"totalTestResultsIncrease":4974,"posNeg":25631,"dataQualityGrade":null,"deathIncrease":4,"hospitalizedIncrease":0,"hash":"4d494358bcaf600fb460fad2757a391dbd322584","commercialScore":0,"negativeRegularScore":0,"negativeScore":0,"positiveScore":0,"score":0,"grade":""},{"date":20210122,"state":"HI","positive":25498,"probableCases":628,"negative":null,"pending":null,"totalTestResultsSource":"totalTestEncountersViral","totalTestResults":931476,"hospitalizedCurrently":84,"hospitalizedCumulative":2014,"inIcuCurrently":21,"inIcuCumulative":null,"onVentilatorCurrently":18,"onVentilatorCumulative":null,"recovered":null,"lastUpdateEt":"1/20/2021 14:30","dateModified":"2021-01-20T14:30:00Z","checkTimeEt":"01/20 09:30","death":332,"hospitalized":2014,"hospitalizedDischarged":null,"dateChecked":"2021-01-20T14:30:00Z","totalTestsViral":null,"positiveTestsViral":24497,"negativeTestsViral":null,"positiveCasesViral":24870,"deathConfirmed":332,"deathProbable":null,"totalTestEncountersViral":931476,"totalTestsPeopleViral":null,"totalTestsAntibody":null,"positiveTestsAntibody":null,"negativeTestsAntibody":null,"totalTestsPeopleAntibody":null,"positiveTestsPeopleAntibody":null,"negativeTestsPeopleAntibody":null,"totalTestsPeopleAntigen":null,"positiveTestsPeopleAntigen":null,"totalTestsAntigen":null,"positiveTestsAntigen":null,"fips":"15","positiveIncrease":169,"negativeIncrease":0,"total":25498,"totalTestResultsIncrease":5065,"posNeg":25498,"dataQualityGrade":null,"deathIncrease":4,"hospitalizedIncrease":9,"hash":"3924034d17093f109da1ba9dfb966f85d17317e4","commercialScore":0,"negativeRegularScore":0,"negativeScore":0,"positiveScore":0,"score":0,"grade":""},{"date":20210121,"state":"HI","positive":25329,"probableCases":590,"negative":null,"pending":null,"totalTestResultsSource":"totalTestEncountersViral","totalTestResults":926411,"hospitalizedCurrently":100,"hospitalizedCumulative":2005,"inIcuCurrently":23,"inIcuCumulative":null,"onVentilatorCurrently":21,"onVentilatorCumulative":null,"recovered":null,"lastUpdateEt":"1/19/2021 14:30","dateModified":"2021-01-19T14:30:00Z","checkTimeEt":"01/19 09:30","death":328,"hospitalized":2005,"hospitalizedDischarged":null,"dateChecked":"2021-01-19T14:30:00Z","totalTestsViral":null,"positiveTestsViral":24377,"negativeTestsViral":null,"positiveCasesViral":24739,"deathConfirmed":328,"deathProbable":null,"totalTestEncountersViral":926411,"totalTestsPeopleViral":null,"totalTestsAntibody":null,"positiveTestsAntibody":null,"negativeTestsAntibody":null,"totalTestsPeopleAntibody":null,"positiveTestsPeopleAntibody":null,"negativeTestsPeopleAntibody":null,"totalTestsPeopleAntigen":null,"positiveTestsPeopleAntigen":null,"totalTestsAntigen":null,"positiveTestsAntigen":null,"fips":"15","positiveIncrease":119,"negativeIncrease":0,"total":25329,"totalTestResultsIncrease":4503,"posNeg":25329,"dataQualityGrade":null,"deathIncrease":3,"hospitalizedIncrease":9,"hash":"e19960c0052d8414757b61519df89de9a802b7a2","commercialScore":0,"negativeRegularScore":0,"negativeScore":0,"positiveScore":0,"score":0,"grade":""},{"date":20210120,"state":"HI","positive":25210,"probableCases":590,"negative":null,"pending":null,"totalTestResultsSource":"totalTestEncountersViral","totalTestResults":921908,"hospitalizedCurrently":102,"hospitalizedCumulative":1996,"inIcuCurrently":21,"inIcuCumulative":null,"onVentilatorCurrently":15,"onVentilatorCumulative":null,"recovered":null,"lastUpdateEt":"1/18/2021 14:30","dateModified":"2021-01-18T14:30:00Z","checkTimeEt":"01/18 09:30","death":325,"hospitalized":1996,"hospitalizedDischarged":null,"dateChecked":"2021-01-18T14:30:00Z","totalTestsViral":null,"positiveTestsViral":24265,"negativeTestsViral":null,"positiveCasesViral":24620,"deathConfirmed":325,"deathProbable":null,"totalTestEncountersViral":921908,"totalTestsPeopleViral":null,"totalTestsAntibody":null,"positiveTestsAntibody":null,"negativeTestsAntibody":null,"totalTestsPeopleAntibody":null,"positiveTestsPeopleAntibody":null,"negativeTestsPeopleAntibody":null,"totalTestsPeopleAntigen":null,"positiveTestsPeopleAntigen":null,"totalTestsAntigen":null,"positiveTestsAntigen":null,"fips":"15","positiveIncrease":74,"negativeIncrease":0,"total":25210,"totalTestResultsIncrease":3547,"posNeg":25210,"dataQualityGrade":null,"deathIncrease":1,"hospitalizedIncrease":13,"hash":"9b87cf6041fc0ddbb37eaeadcef7ec9178b988d7","commercialScore":0,"negativeRegularScore":0,"negativeScore":0,"positiveScore":0,"score":0,"grade":""},{"date":20210119,"state":"HI","positive":25136,"probableCases":590,"negative":null,"pending":null,"totalTestResultsSource":"totalTestEncountersViral","totalTestResults":918361,"hospitalizedCurrently":55,"hospitalizedCumulative":1983,"inIcuCurrently":13,"inIcuCumulative":null,"onVentilatorCurrently":10,"onVentilatorCumulative":null,"recovered":null,"lastUpdateEt":"1/17/2021 14:30","dateModified":"2021-01-17T14:30:00Z","checkTimeEt":"01/17 09:30","death":324,"hospitalized":1983,"hospitalizedDischarged":null,"dateChecked":"2021-01-17T14:30:00Z","totalTestsViral":null,"positiveTestsViral":24196,"negativeTestsViral":null,"positiveCasesViral":24546,"deathConfirmed":324,"deathProbable":null,"totalTestEncountersViral":918361,"totalTestsPeopleViral":null,"totalTestsAntibody":null,"positiveTestsAntibody":null,"negativeTestsAntibody":null,"totalTestsPeopleAntibody":null,"positiveTestsPeopleAntibody":null,"negativeTestsPeopleAntibody":null,"totalTestsPeopleAntigen":null,"positiveTestsPeopleAntigen":null,"totalTestsAntigen":null,"positiveTestsAntigen":null,"fips":"15","positiveIncrease":64,"negativeIncrease":0,"total":25136,"totalTestResultsIncrease":3275,"posNeg":25136,"dataQualityGrade":null,"deathIncrease":2,"hospitalizedIncrease":55,"hash":"0efa9f3ab60a6c9f88fb86f91c892d82711bbdf6","commercialScore":0,"negativeRegularScore":0,"negativeScore":0,"positiveScore":0,"score":0,"grade":""},{"date":20210118,"state":"HI","positive":25072,"probableCases":590,"negative":null,"pending":null,"totalTestResultsSource":"totalTestEncountersViral","totalTestResults":915086,"hospitalizedCurrently":108,"hospitalizedCumulative":1928,"inIcuCurrently":20,"inIcuCumulative":null,"onVentilatorCurrently":18,"onVentilatorCumulative":null,"recovered":null,"lastUpdateEt":"1/16/2021 14:30","dateModified":"2021-01-16T14:30:00Z","checkTimeEt":"01/16 09:30","death":322,"hospitalized":1928,"hospitalizedDischarged":null,"dateChecked":"2021-01-16T14:30:00Z","totalTestsViral":null,"positiveTestsViral":24132,"negativeTestsViral":null,"positiveCasesViral":24482,"deathConfirmed":322,"deathProbable":null,"totalTestEncountersViral":915086,"totalTestsPeopleViral":null,"totalTestsAntibody":null,"positiveTestsAntibody":null,"negativeTestsAntibody":null,"totalTestsPeopleAntibody":null,"positiveTestsPeopleAntibody":null,"negativeTestsPeopleAntibody":null,"totalTestsPeopleAntigen":null,"positiveTestsPeopleAntigen":null,"totalTestsAntigen":null,"positiveTestsAntigen":null,"fips":"15","positiveIncrease":129,"negativeIncrease":0,"total":25072,"totalTestResultsIncrease":4307,"posNeg":25072,"dataQualityGrade":null,"deathIncrease":0,"hospitalizedIncrease":0,"hash":"1abbc560b3a9aebec925530557b87d65ad5cf17f","commercialScore":0,"negativeRegularScore":0,"negativeScore":0,"positiveScore":0,"score":0,"grade":""},{"date":20210117,"state":"HI","positive":24943,"probableCases":590,"negative":null,"pending":null,"totalTestResultsSource":"totalTestEncountersViral","totalTestResults":910779,"hospitalizedCurrently":108,"hospitalizedCumulative":1928,"inIcuCurrently":20,"inIcuCumulative":null,"onVentilatorCurrently":18,"onVentilatorCumulative":null,"recovered":null,"lastUpdateEt":"1/15/2021 14:30","dateModified":"2021-01-15T14:30:00Z","checkTimeEt":"01/15 09:30","death":322,"hospitalized":1928,"hospitalizedDischarged":null,"dateChecked":"2021-01-15T14:30:00Z","totalTestsViral":null,"positiveTestsViral":24006,"negativeTestsViral":null,"positiveCasesViral":24353,"deathConfirmed":322,"deathProbable":null,"totalTestEncountersViral":910779,"totalTestsPeopleViral":null,"totalTestsAntibody":null,"positiveTestsAntibody":null,"negativeTestsAntibody":null,"totalTestsPeopleAntibody":null,"positiveTestsPeopleAntibody":null,"negativeTestsPeopleAntibody":null,"totalTestsPeopleAntigen":null,"positiveTestsPeopleAntigen":null,"totalTestsAntigen":null,"positiveTestsAntigen":null,"fips":"15","positiveIncrease":130,"negativeIncrease":0,"total":24943,"totalTestResultsIncrease":5457,"posNeg":24943,"dataQualityGrade":null,"deathIncrease":2,"hospitalizedIncrease":0,"hash":"62c4c02bc6a4682b6841302c23d3847ce2b5749e","commercialScore":0,"negativeRegularScore":0,"negativeScore":0,"positiveScore":0,"score":0,"grade":""},{"date":20210116,"state":"HI","positive":24813,"probableCases":590,"negative":null,"pending":null,"totalTestResultsSource":"totalTestEncountersViral","totalTestResults":905322,"hospitalizedCurrently":108,"hospitalizedCumulative":1928,"inIcuCurrently":20,"inIcuCumulative":null,"onVentilatorCurrently":18,"onVentilatorCumulative":null,"recovered":null,"lastUpdateEt":"1/14/2021 14:30","dateModified":"2021-01-14T14:30:00Z","checkTimeEt":"01/14 09:30","death":320,"hospitalized":1928,"hospitalizedDischarged":null,"dateChecked":"2021-01-14T14:30:00Z","totalTestsViral":null,"positiveTestsViral":23854,"negativeTestsViral":null,"positiveCasesViral":24223,"deathConfirmed":320,"deathProbable":null,"totalTestEncountersViral":905322,"totalTestsPeopleViral":null,"totalTestsAntibody":null,"positiveTestsAntibody":null,"negativeTestsAntibody":null,"totalTestsPeopleAntibody":null,"positiveTestsPeopleAntibody":null,"negativeTestsPeopleAntibody":null,"totalTestsPeopleAntigen":null,"positiveTestsPeopleAntigen":null,"totalTestsAntigen":null,"positiveTestsAntigen":null,"fips":"15","positiveIncrease":229,"negativeIncrease":0,"total":24813,"totalTestResultsIncrease":10634,"posNeg":24813,"dataQualityGrade":null,"deathIncrease":2,"hospitalizedIncrease":0,"hash":"42141e937516eeb0f61296e9175f321b7225c54a","commercialScore":0,"negativeRegularScore":0,"negativeScore":0,"positiveScore":0,"score":0,"grade":""},{"date":20210115,"state":"HI","positive":24584,"probableCases":526,"negative":null,"pending":null,"totalTestResultsSource":"totalTestEncountersViral","totalTestResults":894688,"hospitalizedCurrently":108,"hospitalizedCumulative":1928,"inIcuCurrently":20,"inIcuCumulative":null,"onVentilatorCurrently":18,"onVentilatorCumulative":null,"recovered":null,"lastUpdateEt":"1/13/2021 14:30","dateModified":"2021-01-13T14:30:00Z","checkTimeEt":"01/13 09:30","death":318,"hospitalized":1928,"hospitalizedDischarged":null,"dateChecked":"2021-01-13T14:30:00Z","totalTestsViral":null,"positiveTestsViral":23695,"negativeTestsViral":null,"positiveCasesViral":24058,"deathConfirmed":318,"deathProbable":null,"totalTestEncountersViral":894688,"totalTestsPeopleViral":null,"totalTestsAntibody":null,"positiveTestsAntibody":null,"negativeTestsAntibody":null,"totalTestsPeopleAntibody":null,"positiveTestsPeopleAntibody":null,"negativeTestsPeopleAntibody":null,"totalTestsPeopleAntigen":null,"positiveTestsPeopleAntigen":null,"totalTestsAntigen":null,"positiveTestsAntigen":null,"fips":"15","positiveIncrease":150,"negativeIncrease":0,"total":24584,"totalTestResultsIncrease":5812,"posNeg":24584,"dataQualityGrade":null,"deathIncrease":0,"hospitalizedIncrease":8,"hash":"4b2140eadd011a2362dbf326cbbdb3c861eb3780","commercialScore":0,"negativeRegularScore":0,"negativeScore":0,"positiveScore":0,"score":0,"grade":""},{"date":20210114,"state":"HI","positive":24434,"probableCases":526,"negative":null,"pending":null,"totalTestResultsSource":"totalTestEncountersViral","totalTestResults":888876,"hospitalizedCurrently":104,"hospitalizedCumulative":1920,"inIcuCurrently":24,"inIcuCumulative":null,"onVentilatorCurrently":19,"onVentilatorCumulative":null,"recovered":null,"lastUpdateEt":"1/12/2021 14:30","dateModified":"2021-01-12T14:30:00Z","checkTimeEt":"01/12 09:30","death":318,"hospitalized":1920,"hospitalizedDischarged":null,"dateChecked":"2021-01-12T14:30:00Z","totalTestsViral":null,"positiveTestsViral":23547,"negativeTestsViral":null,"positiveCasesViral":23908,"deathConfirmed":318,"deathProbable":null,"totalTestEncountersViral":888876,"totalTestsPeopleViral":null,"totalTestsAntibody":null,"positiveTestsAntibody":null,"negativeTestsAntibody":null,"totalTestsPeopleAntibody":null,"positiveTestsPeopleAntibody":null,"negativeTestsPeopleAntibody":null,"totalTestsPeopleAntigen":null,"positiveTestsPeopleAntigen":null,"totalTestsAntigen":null,"positiveTestsAntigen":null,"fips":"15","positiveIncrease":175,"negativeIncrease":0,"total":24434,"totalTestResultsIncrease":5983,"posNeg":24434,"dataQualityGrade":null,"deathIncrease":6,"hospitalizedIncrease":7,"hash":"ec996b56bcdbcf89231cb39aa24e6950c0e71065","commercialScore":0,"negativeRegularScore":0,"negativeScore":0,"positiveScore":0,"score":0,"grade":""},{"date":20210113,"state":"HI","positive":24259,"probableCases":526,"negative":null,"pending":null,"totalTestResultsSource":"totalTestEncountersViral","totalTestResults":882893,"hospitalizedCurrently":114,"hospitalizedCumulative":1913,"inIcuCurrently":26,"inIcuCumulative":null,"onVentilatorCurrently":22,"onVentilatorCumulative":null,"recovered":null,"lastUpdateEt":"1/11/2021 14:30","dateModified":"2021-01-11T14:30:00Z","checkTimeEt":"01/11 09:30","death":312,"hospitalized":1913,"hospitalizedDischarged":null,"dateChecked":"2021-01-11T14:30:00Z","totalTestsViral":null,"positiveTestsViral":23384,"negativeTestsViral":null,"positiveCasesViral":23733,"deathConfirmed":312,"deathProbable":null,"totalTestEncountersViral":882893,"totalTestsPeopleViral":null,"totalTestsAntibody":null,"positiveTestsAntibody":null,"negativeTestsAntibody":null,"totalTestsPeopleAntibody":null,"positiveTestsPeopleAntibody":null,"negativeTestsPeopleAntibody":null,"totalTestsPeopleAntigen":null,"positiveTestsPeopleAntigen":null,"totalTestsAntigen":null,"positiveTestsAntigen":null,"fips":"15","positiveIncrease":106,"negativeIncrease":0,"total":24259,"totalTestResultsIncrease":4819,"posNeg":24259,"dataQualityGrade":null,"deathIncrease":3,"hospitalizedIncrease":11,"hash":"66dc1a41328e6a0a3f87919986022879391f4c18","commercialScore":0,"negativeRegularScore":0,"negativeScore":0,"positiveScore":0,"score":0,"grade":""},{"date":20210112,"state":"HI","positive":24153,"probableCases":526,"negative":null,"pending":null,"totalTestResultsSource":"totalTestEncountersViral","totalTestResults":878074,"hospitalizedCurrently":124,"hospitalizedCumulative":1902,"inIcuCurrently":26,"inIcuCumulative":null,"onVentilatorCurrently":22,"onVentilatorCumulative":null,"recovered":null,"lastUpdateEt":"1/10/2021 14:30","dateModified":"2021-01-10T14:30:00Z","checkTimeEt":"01/10 09:30","death":309,"hospitalized":1902,"hospitalizedDischarged":null,"dateChecked":"2021-01-10T14:30:00Z","totalTestsViral":null,"positiveTestsViral":23283,"negativeTestsViral":null,"positiveCasesViral":23627,"deathConfirmed":309,"deathProbable":null,"totalTestEncountersViral":878074,"totalTestsPeopleViral":null,"totalTestsAntibody":null,"positiveTestsAntibody":null,"negativeTestsAntibody":null,"totalTestsPeopleAntibody":null,"positiveTestsPeopleAntibody":null,"negativeTestsPeopleAntibody":null,"totalTestsPeopleAntigen":null,"positiveTestsPeopleAntigen":null,"totalTestsAntigen":null,"positiveTestsAntigen":null,"fips":"15","positiveIncrease":114,"negativeIncrease":0,"total":24153,"totalTestResultsIncrease":3054,"posNeg":24153,"dataQualityGrade":null,"deathIncrease":0,"hospitalizedIncrease":7,"hash":"02f2d7549fcb7ddc848a51c324ddab0eb544034b","commercialScore":0,"negativeRegularScore":0,"negativeScore":0,"positiveScore":0,"score":0,"grade":""},{"date":20210111,"state":"HI","positive":24039,"probableCases":526,"negative":null,"pending":null,"totalTestResultsSource":"totalTestEncountersViral","totalTestResults":875020,"hospitalizedCurrently":126,"hospitalizedCumulative":1895,"inIcuCurrently":25,"inIcuCumulative":null,"onVentilatorCurrently":21,"onVentilatorCumulative":null,"recovered":null,"lastUpdateEt":"1/9/2021 14:30","dateModified":"2021-01-09T14:30:00Z","checkTimeEt":"01/09 09:30","death":309,"hospitalized":1895,"hospitalizedDischarged":null,"dateChecked":"2021-01-09T14:30:00Z","totalTestsViral":null,"positiveTestsViral":23188,"negativeTestsViral":null,"positiveCasesViral":23513,"deathConfirmed":309,"deathProbable":null,"totalTestEncountersViral":875020,"totalTestsPeopleViral":null,"totalTestsAntibody":null,"positiveTestsAntibody":null,"negativeTestsAntibody":null,"totalTestsPeopleAntibody":null,"positiveTestsPeopleAntibody":null,"negativeTestsPeopleAntibody":null,"totalTestsPeopleAntigen":null,"positiveTestsPeopleAntigen":null,"totalTestsAntigen":null,"positiveTestsAntigen":null,"fips":"15","positiveIncrease":172,"negativeIncrease":0,"total":24039,"totalTestResultsIncrease":5448,"posNeg":24039,"dataQualityGrade":null,"deathIncrease":0,"hospitalizedIncrease":31,"hash":"8a24b640185c7de30ac3b75bfbd32b3afc3f9721","commercialScore":0,"negativeRegularScore":0,"negativeScore":0,"positiveScore":0,"score":0,"grade":""},{"date":20210110,"state":"HI","positive":23867,"probableCases":526,"negative":null,"pending":null,"totalTestResultsSource":"totalTestEncountersViral","totalTestResults":869572,"hospitalizedCurrently":129,"hospitalizedCumulative":1864,"inIcuCurrently":24,"inIcuCumulative":null,"onVentilatorCurrently":20,"onVentilatorCumulative":null,"recovered":null,"lastUpdateEt":"1/8/2021 14:30","dateModified":"2021-01-08T14:30:00Z","checkTimeEt":"01/08 09:30","death":309,"hospitalized":1864,"hospitalizedDischarged":null,"dateChecked":"2021-01-08T14:30:00Z","totalTestsViral":null,"positiveTestsViral":23022,"negativeTestsViral":null,"positiveCasesViral":23341,"deathConfirmed":309,"deathProbable":null,"totalTestEncountersViral":869572,"totalTestsPeopleViral":null,"totalTestsAntibody":null,"positiveTestsAntibody":null,"negativeTestsAntibody":null,"totalTestsPeopleAntibody":null,"positiveTestsPeopleAntibody":null,"negativeTestsPeopleAntibody":null,"totalTestsPeopleAntigen":null,"positiveTestsPeopleAntigen":null,"totalTestsAntigen":null,"positiveTestsAntigen":null,"fips":"15","positiveIncrease":198,"negativeIncrease":0,"total":23867,"totalTestResultsIncrease":6544,"posNeg":23867,"dataQualityGrade":null,"deathIncrease":2,"hospitalizedIncrease":0,"hash":"833af3a6277e8092f6b5e33a899fcb4e0bb71d66","commercialScore":0,"negativeRegularScore":0,"negativeScore":0,"positiveScore":0,"score":0,"grade":""},{"date":20210109,"state":"HI","positive":23669,"probableCases":526,"negative":null,"pending":null,"totalTestResultsSource":"totalTestEncountersViral","totalTestResults":863028,"hospitalizedCurrently":129,"hospitalizedCumulative":1864,"inIcuCurrently":24,"inIcuCumulative":null,"onVentilatorCurrently":20,"onVentilatorCumulative":null,"recovered":null,"lastUpdateEt":"1/7/2021 14:30","dateModified":"2021-01-07T14:30:00Z","checkTimeEt":"01/07 09:30","death":307,"hospitalized":1864,"hospitalizedDischarged":null,"dateChecked":"2021-01-07T14:30:00Z","totalTestsViral":null,"positiveTestsViral":22837,"negativeTestsViral":null,"positiveCasesViral":23143,"deathConfirmed":307,"deathProbable":null,"totalTestEncountersViral":863028,"totalTestsPeopleViral":null,"totalTestsAntibody":null,"positiveTestsAntibody":null,"negativeTestsAntibody":null,"totalTestsPeopleAntibody":null,"positiveTestsPeopleAntibody":null,"negativeTestsPeopleAntibody":null,"totalTestsPeopleAntigen":null,"positiveTestsPeopleAntigen":null,"totalTestsAntigen":null,"positiveTestsAntigen":null,"fips":"15","positiveIncrease":248,"negativeIncrease":0,"total":23669,"totalTestResultsIncrease":6502,"posNeg":23669,"dataQualityGrade":null,"deathIncrease":4,"hospitalizedIncrease":0,"hash":"7f8671ad954c204336775ce71293c8ca7161fa1c","commercialScore":0,"negativeRegularScore":0,"negativeScore":0,"positiveScore":0,"score":0,"grade":""},{"date":20210108,"state":"HI","positive":23421,"probableCases":526,"negative":null,"pending":null,"totalTestResultsSource":"totalTestEncountersViral","totalTestResults":856526,"hospitalizedCurrently":129,"hospitalizedCumulative":1864,"inIcuCurrently":24,"inIcuCumulative":null,"onVentilatorCurrently":20,"onVentilatorCumulative":null,"recovered":null,"lastUpdateEt":"1/6/2021 14:30","dateModified":"2021-01-06T14:30:00Z","checkTimeEt":"01/06 09:30","death":303,"hospitalized":1864,"hospitalizedDischarged":null,"dateChecked":"2021-01-06T14:30:00Z","totalTestsViral":null,"positiveTestsViral":22630,"negativeTestsViral":null,"positiveCasesViral":22895,"deathConfirmed":303,"deathProbable":null,"totalTestEncountersViral":856526,"totalTestsPeopleViral":null,"totalTestsAntibody":null,"positiveTestsAntibody":null,"negativeTestsAntibody":null,"totalTestsPeopleAntibody":null,"positiveTestsPeopleAntibody":null,"negativeTestsPeopleAntibody":null,"totalTestsPeopleAntigen":null,"positiveTestsPeopleAntigen":null,"totalTestsAntigen":null,"positiveTestsAntigen":null,"fips":"15","positiveIncrease":308,"negativeIncrease":0,"total":23421,"totalTestResultsIncrease":6634,"posNeg":23421,"dataQualityGrade":null,"deathIncrease":4,"hospitalizedIncrease":12,"hash":"fd130b66cf21192abcaa0ae178178c583f6f0288","commercialScore":0,"negativeRegularScore":0,"negativeScore":0,"positiveScore":0,"score":0,"grade":""},{"date":20210107,"state":"HI","positive":23113,"probableCases":482,"negative":null,"pending":null,"totalTestResultsSource":"totalTestEncountersViral","totalTestResults":849892,"hospitalizedCurrently":121,"hospitalizedCumulative":1852,"inIcuCurrently":24,"inIcuCumulative":null,"onVentilatorCurrently":24,"onVentilatorCumulative":null,"recovered":null,"lastUpdateEt":"1/5/2021 14:30","dateModified":"2021-01-05T14:30:00Z","checkTimeEt":"01/05 09:30","death":299,"hospitalized":1852,"hospitalizedDischarged":null,"dateChecked":"2021-01-05T14:30:00Z","totalTestsViral":null,"positiveTestsViral":22369,"negativeTestsViral":null,"positiveCasesViral":22631,"deathConfirmed":299,"deathProbable":null,"totalTestEncountersViral":849892,"totalTestsPeopleViral":null,"totalTestsAntibody":null,"positiveTestsAntibody":null,"negativeTestsAntibody":null,"totalTestsPeopleAntibody":null,"positiveTestsPeopleAntibody":null,"negativeTestsPeopleAntibody":null,"totalTestsPeopleAntigen":null,"positiveTestsPeopleAntigen":null,"totalTestsAntigen":null,"positiveTestsAntigen":null,"fips":"15","positiveIncrease":321,"negativeIncrease":0,"total":23113,"totalTestResultsIncrease":13546,"posNeg":23113,"dataQualityGrade":null,"deathIncrease":0,"hospitalizedIncrease":9,"hash":"1876c01273800150c91772136252192402e00dad","commercialScore":0,"negativeRegularScore":0,"negativeScore":0,"positiveScore":0,"score":0,"grade":""},{"date":20210106,"state":"HI","positive":22792,"probableCases":482,"negative":null,"pending":null,"totalTestResultsSource":"totalTestEncountersViral","totalTestResults":836346,"hospitalizedCurrently":123,"hospitalizedCumulative":1843,"inIcuCurrently":21,"inIcuCumulative":null,"onVentilatorCurrently":16,"onVentilatorCumulative":null,"recovered":null,"lastUpdateEt":"1/4/2021 14:30","dateModified":"2021-01-04T14:30:00Z","checkTimeEt":"01/04 09:30","death":299,"hospitalized":1843,"hospitalizedDischarged":null,"dateChecked":"2021-01-04T14:30:00Z","totalTestsViral":null,"positiveTestsViral":22083,"negativeTestsViral":null,"positiveCasesViral":22310,"deathConfirmed":299,"deathProbable":null,"totalTestEncountersViral":836346,"totalTestsPeopleViral":null,"totalTestsAntibody":null,"positiveTestsAntibody":null,"negativeTestsAntibody":null,"totalTestsPeopleAntibody":null,"positiveTestsPeopleAntibody":null,"negativeTestsPeopleAntibody":null,"totalTestsPeopleAntigen":null,"positiveTestsPeopleAntigen":null,"totalTestsAntigen":null,"positiveTestsAntigen":null,"fips":"15","positiveIncrease":142,"negativeIncrease":0,"total":22792,"totalTestResultsIncrease":3870,"posNeg":22792,"dataQualityGrade":null,"deathIncrease":10,"hospitalizedIncrease":26,"hash":"7f4359d7bed52eaaf626e6358c2e928762cb3aba","commercialScore":0,"negativeRegularScore":0,"negativeScore":0,"positiveScore":0,"score":0,"grade":""},{"date":20210105,"state":"HI","positive":22650,"probableCases":482,"negative":null,"pending":null,"totalTestResultsSource":"totalTestEncountersViral","totalTestResults":832476,"hospitalizedCurrently":96,"hospitalizedCumulative":1817,"inIcuCurrently":18,"inIcuCumulative":null,"onVentilatorCurrently":15,"onVentilatorCumulative":null,"recovered":null,"lastUpdateEt":"1/3/2021 14:30","dateModified":"2021-01-03T14:30:00Z","checkTimeEt":"01/03 09:30","death":289,"hospitalized":1817,"hospitalizedDischarged":null,"dateChecked":"2021-01-03T14:30:00Z","totalTestsViral":null,"positiveTestsViral":21969,"negativeTestsViral":null,"positiveCasesViral":22168,"deathConfirmed":289,"deathProbable":null,"totalTestEncountersViral":832476,"totalTestsPeopleViral":null,"totalTestsAntibody":null,"positiveTestsAntibody":null,"negativeTestsAntibody":null,"totalTestsPeopleAntibody":null,"positiveTestsPeopleAntibody":null,"negativeTestsPeopleAntibody":null,"totalTestsPeopleAntigen":null,"positiveTestsPeopleAntigen":null,"totalTestsAntigen":null,"positiveTestsAntigen":null,"fips":"15","positiveIncrease":123,"negativeIncrease":0,"total":22650,"totalTestResultsIncrease":4066,"posNeg":22650,"dataQualityGrade":null,"deathIncrease":0,"hospitalizedIncrease":42,"hash":"92cca115374ef10db61dadff9c6e798c54f8f312","commercialScore":0,"negativeRegularScore":0,"negativeScore":0,"positiveScore":0,"score":0,"grade":""},{"date":20210104,"state":"HI","positive":22527,"probableCases":482,"negative":null,"pending":null,"totalTestResultsSource":"totalTestEncountersViral","totalTestResults":828410,"hospitalizedCurrently":86,"hospitalizedCumulative":1775,"inIcuCurrently":11,"inIcuCumulative":null,"onVentilatorCurrently":9,"onVentilatorCumulative":null,"recovered":null,"lastUpdateEt":"1/2/2021 14:30","dateModified":"2021-01-02T14:30:00Z","checkTimeEt":"01/02 09:30","death":289,"hospitalized":1775,"hospitalizedDischarged":null,"dateChecked":"2021-01-02T14:30:00Z","totalTestsViral":null,"positiveTestsViral":21849,"negativeTestsViral":null,"positiveCasesViral":22045,"deathConfirmed":289,"deathProbable":null,"totalTestEncountersViral":828410,"totalTestsPeopleViral":null,"totalTestsAntibody":null,"positiveTestsAntibody":null,"negativeTestsAntibody":null,"totalTestsPeopleAntibody":null,"positiveTestsPeopleAntibody":null,"negativeTestsPeopleAntibody":null,"totalTestsPeopleAntigen":null,"positiveTestsPeopleAntigen":null,"totalTestsAntigen":null,"positiveTestsAntigen":null,"fips":"15","positiveIncrease":89,"negativeIncrease":0,"total":22527,"totalTestResultsIncrease":2454,"posNeg":22527,"dataQualityGrade":null,"deathIncrease":0,"hospitalizedIncrease":0,"hash":"071a7d33f94a44f2e6995595c17358204e0f0ad9","commercialScore":0,"negativeRegularScore":0,"negativeScore":0,"positiveScore":0,"score":0,"grade":""},{"date":20210103,"state":"HI","positive":22438,"probableCases":482,"negative":null,"pending":null,"totalTestResultsSource":"totalTestEncountersViral","totalTestResults":825956,"hospitalizedCurrently":86,"hospitalizedCumulative":1775,"inIcuCurrently":11,"inIcuCumulative":null,"onVentilatorCurrently":9,"onVentilatorCumulative":null,"recovered":null,"lastUpdateEt":"1/1/2021 14:30","dateModified":"2021-01-01T14:30:00Z","checkTimeEt":"01/01 09:30","death":289,"hospitalized":1775,"hospitalizedDischarged":null,"dateChecked":"2021-01-01T14:30:00Z","totalTestsViral":null,"positiveTestsViral":21766,"negativeTestsViral":null,"positiveCasesViral":21956,"deathConfirmed":289,"deathProbable":null,"totalTestEncountersViral":825956,"totalTestsPeopleViral":null,"totalTestsAntibody":null,"positiveTestsAntibody":null,"negativeTestsAntibody":null,"totalTestsPeopleAntibody":null,"positiveTestsPeopleAntibody":null,"negativeTestsPeopleAntibody":null,"totalTestsPeopleAntigen":null,"positiveTestsPeopleAntigen":null,"totalTestsAntigen":null,"positiveTestsAntigen":null,"fips":"15","positiveIncrease":149,"negativeIncrease":0,"total":22438,"totalTestResultsIncrease":3151,"posNeg":22438,"dataQualityGrade":null,"deathIncrease":0,"hospitalizedIncrease":0,"hash":"2e7167b8bbf28fd12fa541b9cefe291bcd0497dd","commercialScore":0,"negativeRegularScore":0,"negativeScore":0,"positiveScore":0,"score":0,"grade":""},{"date":20210102,"state":"HI","positive":22289,"probableCases":482,"negative":null,"pending":null,"totalTestResultsSource":"totalTestEncountersViral","totalTestResults":822805,"hospitalizedCurrently":86,"hospitalizedCumulative":1775,"inIcuCurrently":11,"inIcuCumulative":null,"onVentilatorCurrently":9,"onVentilatorCumulative":null,"recovered":null,"lastUpdateEt":"12/31/2020 14:30","dateModified":"2020-12-31T14:30:00Z","checkTimeEt":"12/31 09:30","death":289,"hospitalized":1775,"hospitalizedDischarged":null,"dateChecked":"2020-12-31T14:30:00Z","totalTestsViral":null,"positiveTestsViral":21608,"negativeTestsViral":null,"positiveCasesViral":21807,"deathConfirmed":289,"deathProbable":null,"totalTestEncountersViral":822805,"totalTestsPeopleViral":null,"totalTestsAntibody":null,"positiveTestsAntibody":null,"negativeTestsAntibody":null,"totalTestsPeopleAntibody":null,"positiveTestsPeopleAntibody":null,"negativeTestsPeopleAntibody":null,"totalTestsPeopleAntigen":null,"positiveTestsPeopleAntigen":null,"totalTestsAntigen":null,"positiveTestsAntigen":null,"fips":"15","positiveIncrease":169,"negativeIncrease":0,"total":22289,"totalTestResultsIncrease":5994,"posNeg":22289,"dataQualityGrade":null,"deathIncrease":0,"hospitalizedIncrease":0,"hash":"2f701b644423f7ba6b27af358d99f7b914644313","commercialScore":0,"negativeRegularScore":0,"negativeScore":0,"positiveScore":0,"score":0,"grade":""},{"date":20210101,"state":"HI","positive":22120,"probableCases":482,"negative":null,"pending":null,"totalTestResultsSource":"totalTestEncountersViral","totalTestResults":816811,"hospitalizedCurrently":86,"hospitalizedCumulative":1775,"inIcuCurrently":11,"inIcuCumulative":null,"onVentilatorCurrently":9,"onVentilatorCumulative":null,"recovered":null,"lastUpdateEt":"12/30/2020 19:30","dateModified":"2020-12-30T19:30:00Z","checkTimeEt":"12/30 14:30","death":289,"hospitalized":1775,"hospitalizedDischarged":null,"dateChecked":"2020-12-30T19:30:00Z","totalTestsViral":null,"positiveTestsViral":21470,"negativeTestsViral":null,"positiveCasesViral":21638,"deathConfirmed":289,"deathProbable":null,"totalTestEncountersViral":816811,"totalTestsPeopleViral":null,"totalTestsAntibody":null,"positiveTestsAntibody":null,"negativeTestsAntibody":null,"totalTestsPeopleAntibody":null,"positiveTestsPeopleAntibody":null,"negativeTestsPeopleAntibody":null,"totalTestsPeopleAntigen":null,"positiveTestsPeopleAntigen":null,"totalTestsAntigen":null,"positiveTestsAntigen":null,"fips":"15","positiveIncrease":288,"negativeIncrease":0,"total":22120,"totalTestResultsIncrease":4473,"posNeg":22120,"dataQualityGrade":null,"deathIncrease":1,"hospitalizedIncrease":7,"hash":"5f12f1117e3d5dd2107ee9cb6014042214b5ed9d","commercialScore":0,"negativeRegularScore":0,"negativeScore":0,"positiveScore":0,"score":0,"grade":""},{"date":20201231,"state":"HI","positive":21832,"probableCases":435,"negative":null,"pending":null,"totalTestResultsSource":"totalTestEncountersViral","totalTestResults":812338,"hospitalizedCurrently":97,"hospitalizedCumulative":1768,"inIcuCurrently":16,"inIcuCumulative":null,"onVentilatorCurrently":18,"onVentilatorCumulative":null,"recovered":null,"lastUpdateEt":"12/29/2020 17:30","dateModified":"2020-12-29T17:30:00Z","checkTimeEt":"12/29 12:30","death":288,"hospitalized":1768,"hospitalizedDischarged":null,"dateChecked":"2020-12-29T17:30:00Z","totalTestsViral":null,"positiveTestsViral":21233,"negativeTestsViral":null,"positiveCasesViral":21397,"deathConfirmed":288,"deathProbable":null,"totalTestEncountersViral":812338,"totalTestsPeopleViral":null,"totalTestsAntibody":null,"positiveTestsAntibody":null,"negativeTestsAntibody":null,"totalTestsPeopleAntibody":null,"positiveTestsPeopleAntibody":null,"negativeTestsPeopleAntibody":null,"totalTestsPeopleAntigen":null,"positiveTestsPeopleAntigen":null,"totalTestsAntigen":null,"positiveTestsAntigen":null,"fips":"15","positiveIncrease":188,"negativeIncrease":0,"total":21832,"totalTestResultsIncrease":5203,"posNeg":21832,"dataQualityGrade":null,"deathIncrease":3,"hospitalizedIncrease":12,"hash":"157496d7163f3a6b39e55ef20338c7b93e4c63a1","commercialScore":0,"negativeRegularScore":0,"negativeScore":0,"positiveScore":0,"score":0,"grade":""},{"date":20201230,"state":"HI","positive":21644,"probableCases":435,"negative":null,"pending":null,"totalTestResultsSource":"totalTestEncountersViral","totalTestResults":807135,"hospitalizedCurrently":81,"hospitalizedCumulative":1756,"inIcuCurrently":14,"inIcuCumulative":null,"onVentilatorCurrently":12,"onVentilatorCumulative":null,"recovered":null,"lastUpdateEt":"12/28/2020 19:30","dateModified":"2020-12-28T19:30:00Z","checkTimeEt":"12/28 14:30","death":285,"hospitalized":1756,"hospitalizedDischarged":null,"dateChecked":"2020-12-28T19:30:00Z","totalTestsViral":null,"positiveTestsViral":21063,"negativeTestsViral":null,"positiveCasesViral":21209,"deathConfirmed":285,"deathProbable":null,"totalTestEncountersViral":807135,"totalTestsPeopleViral":null,"totalTestsAntibody":null,"positiveTestsAntibody":null,"negativeTestsAntibody":null,"totalTestsPeopleAntibody":null,"positiveTestsPeopleAntibody":null,"negativeTestsPeopleAntibody":null,"totalTestsPeopleAntigen":null,"positiveTestsPeopleAntigen":null,"totalTestsAntigen":null,"positiveTestsAntigen":null,"fips":"15","positiveIncrease":106,"negativeIncrease":0,"total":21644,"totalTestResultsIncrease":3420,"posNeg":21644,"dataQualityGrade":null,"deathIncrease":0,"hospitalizedIncrease":10,"hash":"0d6c36fe66b3b5dd2630958584122ac73286783a","commercialScore":0,"negativeRegularScore":0,"negativeScore":0,"positiveScore":0,"score":0,"grade":""},{"date":20201229,"state":"HI","positive":21538,"probableCases":435,"negative":null,"pending":null,"totalTestResultsSource":"totalTestEncountersViral","totalTestResults":803715,"hospitalizedCurrently":89,"hospitalizedCumulative":1746,"inIcuCurrently":14,"inIcuCumulative":null,"onVentilatorCurrently":11,"onVentilatorCumulative":null,"recovered":null,"lastUpdateEt":"12/27/2020 14:30","dateModified":"2020-12-27T14:30:00Z","checkTimeEt":"12/27 09:30","death":285,"hospitalized":1746,"hospitalizedDischarged":null,"dateChecked":"2020-12-27T14:30:00Z","totalTestsViral":null,"positiveTestsViral":20964,"negativeTestsViral":null,"positiveCasesViral":21103,"deathConfirmed":285,"deathProbable":null,"totalTestEncountersViral":803715,"totalTestsPeopleViral":null,"totalTestsAntibody":null,"positiveTestsAntibody":null,"negativeTestsAntibody":null,"totalTestsPeopleAntibody":null,"positiveTestsPeopleAntibody":null,"negativeTestsPeopleAntibody":null,"totalTestsPeopleAntigen":null,"positiveTestsPeopleAntigen":null,"totalTestsAntigen":null,"positiveTestsAntigen":null,"fips":"15","positiveIncrease":75,"negativeIncrease":0,"total":21538,"totalTestResultsIncrease":3070,"posNeg":21538,"dataQualityGrade":null,"deathIncrease":0,"hospitalizedIncrease":-5,"hash":"4e4055d649b7685759db17182b3859ffde6cb213","commercialScore":0,"negativeRegularScore":0,"negativeScore":0,"positiveScore":0,"score":0,"grade":""},{"date":20201228,"state":"HI","positive":21463,"probableCases":435,"negative":null,"pending":null,"totalTestResultsSource":"totalTestEncountersViral","totalTestResults":800645,"hospitalizedCurrently":125,"hospitalizedCumulative":1751,"inIcuCurrently":23,"inIcuCumulative":null,"onVentilatorCurrently":18,"onVentilatorCumulative":null,"recovered":null,"lastUpdateEt":"12/26/2020 19:30","dateModified":"2020-12-26T19:30:00Z","checkTimeEt":"12/26 14:30","death":285,"hospitalized":1751,"hospitalizedDischarged":null,"dateChecked":"2020-12-26T19:30:00Z","totalTestsViral":null,"positiveTestsViral":20895,"negativeTestsViral":null,"positiveCasesViral":21028,"deathConfirmed":285,"deathProbable":null,"totalTestEncountersViral":800645,"totalTestsPeopleViral":null,"totalTestsAntibody":null,"positiveTestsAntibody":null,"negativeTestsAntibody":null,"totalTestsPeopleAntibody":null,"positiveTestsPeopleAntibody":null,"negativeTestsPeopleAntibody":null,"totalTestsPeopleAntigen":null,"positiveTestsPeopleAntigen":null,"totalTestsAntigen":null,"positiveTestsAntigen":null,"fips":"15","positiveIncrease":45,"negativeIncrease":0,"total":21463,"totalTestResultsIncrease":2343,"posNeg":21463,"dataQualityGrade":null,"deathIncrease":0,"hospitalizedIncrease":40,"hash":"3321b89ea7b6bced01d6a94f72ddfd2eb84deaa0","commercialScore":0,"negativeRegularScore":0,"negativeScore":0,"positiveScore":0,"score":0,"grade":""},{"date":20201227,"state":"HI","positive":21418,"probableCases":435,"negative":null,"pending":null,"totalTestResultsSource":"totalTestEncountersViral","totalTestResults":798302,"hospitalizedCurrently":64,"hospitalizedCumulative":1711,"inIcuCurrently":11,"inIcuCumulative":null,"onVentilatorCurrently":10,"onVentilatorCumulative":null,"recovered":null,"lastUpdateEt":"12/25/2020 19:30","dateModified":"2020-12-25T19:30:00Z","checkTimeEt":"12/25 14:30","death":285,"hospitalized":1711,"hospitalizedDischarged":null,"dateChecked":"2020-12-25T19:30:00Z","totalTestsViral":null,"positiveTestsViral":20854,"negativeTestsViral":null,"positiveCasesViral":20983,"deathConfirmed":285,"deathProbable":null,"totalTestEncountersViral":798302,"totalTestsPeopleViral":null,"totalTestsAntibody":null,"positiveTestsAntibody":null,"negativeTestsAntibody":null,"totalTestsPeopleAntibody":null,"positiveTestsPeopleAntibody":null,"negativeTestsPeopleAntibody":null,"totalTestsPeopleAntigen":null,"positiveTestsPeopleAntigen":null,"totalTestsAntigen":null,"positiveTestsAntigen":null,"fips":"15","positiveIncrease":95,"negativeIncrease":0,"total":21418,"totalTestResultsIncrease":2724,"posNeg":21418,"dataQualityGrade":null,"deathIncrease":0,"hospitalizedIncrease":0,"hash":"3b61de87e5305a37e67a465d1b5e24bb40b1c338","commercialScore":0,"negativeRegularScore":0,"negativeScore":0,"positiveScore":0,"score":0,"grade":""},{"date":20201226,"state":"HI","positive":21323,"probableCases":435,"negative":null,"pending":null,"totalTestResultsSource":"totalTestEncountersViral","totalTestResults":795578,"hospitalizedCurrently":64,"hospitalizedCumulative":1711,"inIcuCurrently":11,"inIcuCumulative":null,"onVentilatorCurrently":10,"onVentilatorCumulative":null,"recovered":null,"lastUpdateEt":"12/25/2020 05:59","dateModified":"2020-12-25T05:59:00Z","checkTimeEt":"12/25 00:59","death":285,"hospitalized":1711,"hospitalizedDischarged":null,"dateChecked":"2020-12-25T05:59:00Z","totalTestsViral":null,"positiveTestsViral":20758,"negativeTestsViral":null,"positiveCasesViral":20888,"deathConfirmed":285,"deathProbable":null,"totalTestEncountersViral":795578,"totalTestsPeopleViral":null,"totalTestsAntibody":null,"positiveTestsAntibo