[{"date":20210307,"state":"IA","positive":282384,"probableCases":null,"negative":1044418,"pending":null,"totalTestResultsSource":"posNeg","totalTestResults":1326802,"hospitalizedCurrently":167,"hospitalizedCumulative":null,"inIcuCurrently":35,"inIcuCumulative":null,"onVentilatorCurrently":6,"onVentilatorCumulative":null,"recovered":320054,"lastUpdateEt":"3/7/2021 00:00","dateModified":"2021-03-07T00:00:00Z","checkTimeEt":"03/06 19:00","death":5558,"hospitalized":null,"hospitalizedDischarged":null,"dateChecked":"2021-03-07T00:00:00Z","totalTestsViral":2753899,"positiveTestsViral":306343,"negativeTestsViral":2432425,"positiveCasesViral":282384,"deathConfirmed":null,"deathProbable":null,"totalTestEncountersViral":null,"totalTestsPeopleViral":1329195,"totalTestsAntibody":null,"positiveTestsAntibody":null,"negativeTestsAntibody":null,"totalTestsPeopleAntibody":113739,"positiveTestsPeopleAntibody":19704,"negativeTestsPeopleAntibody":93984,"totalTestsPeopleAntigen":247999,"positiveTestsPeopleAntigen":57190,"totalTestsAntigen":1390094,"positiveTestsAntigen":60700,"fips":"19","positiveIncrease":257,"negativeIncrease":1299,"total":1326802,"totalTestResultsIncrease":1556,"posNeg":1326802,"dataQualityGrade":null,"deathIncrease":6,"hospitalizedIncrease":0,"hash":"33548da1aa99383ebd1ef74769d8bb1eba36b959","commercialScore":0,"negativeRegularScore":0,"negativeScore":0,"positiveScore":0,"score":0,"grade":""},{"date":20210306,"state":"IA","positive":282127,"probableCases":null,"negative":1043119,"pending":null,"totalTestResultsSource":"posNeg","totalTestResults":1325246,"hospitalizedCurrently":170,"hospitalizedCumulative":null,"inIcuCurrently":38,"inIcuCumulative":null,"onVentilatorCurrently":10,"onVentilatorCumulative":null,"recovered":319780,"lastUpdateEt":"3/6/2021 00:00","dateModified":"2021-03-06T00:00:00Z","checkTimeEt":"03/05 19:00","death":5552,"hospitalized":null,"hospitalizedDischarged":null,"dateChecked":"2021-03-06T00:00:00Z","totalTestsViral":2749435,"positiveTestsViral":306056,"negativeTestsViral":2428315,"positiveCasesViral":282127,"deathConfirmed":null,"deathProbable":null,"totalTestEncountersViral":null,"totalTestsPeopleViral":1327640,"totalTestsAntibody":null,"positiveTestsAntibody":null,"negativeTestsAntibody":null,"totalTestsPeopleAntibody":113559,"positiveTestsPeopleAntibody":19635,"negativeTestsPeopleAntibody":93873,"totalTestsPeopleAntigen":247775,"positiveTestsPeopleAntigen":57133,"totalTestsAntigen":1388623,"positiveTestsAntigen":60633,"fips":"19","positiveIncrease":362,"negativeIncrease":1515,"total":1325246,"totalTestResultsIncrease":1877,"posNeg":1325246,"dataQualityGrade":null,"deathIncrease":3,"hospitalizedIncrease":0,"hash":"1142f60050fea038a820b3444d5d15ccbc344bef","commercialScore":0,"negativeRegularScore":0,"negativeScore":0,"positiveScore":0,"score":0,"grade":""},{"date":20210305,"state":"IA","positive":281765,"probableCases":null,"negative":1041604,"pending":null,"totalTestResultsSource":"posNeg","totalTestResults":1323369,"hospitalizedCurrently":176,"hospitalizedCumulative":null,"inIcuCurrently":39,"inIcuCumulative":null,"onVentilatorCurrently":9,"onVentilatorCumulative":null,"recovered":318996,"lastUpdateEt":"3/5/2021 00:00","dateModified":"2021-03-05T00:00:00Z","checkTimeEt":"03/04 19:00","death":5549,"hospitalized":null,"hospitalizedDischarged":null,"dateChecked":"2021-03-05T00:00:00Z","totalTestsViral":2742341,"positiveTestsViral":305649,"negativeTestsViral":2421684,"positiveCasesViral":281765,"deathConfirmed":null,"deathProbable":null,"totalTestEncountersViral":null,"totalTestsPeopleViral":1325769,"totalTestsAntibody":null,"positiveTestsAntibody":null,"negativeTestsAntibody":null,"totalTestsPeopleAntibody":113413,"positiveTestsPeopleAntibody":19454,"negativeTestsPeopleAntibody":93908,"totalTestsPeopleAntigen":246773,"positiveTestsPeopleAntigen":57011,"totalTestsAntigen":1381718,"positiveTestsAntigen":60505,"fips":"19","positiveIncrease":374,"negativeIncrease":1549,"total":1323369,"totalTestResultsIncrease":1923,"posNeg":1323369,"dataQualityGrade":null,"deathIncrease":13,"hospitalizedIncrease":0,"hash":"a488d06f2e63d4b8d9ac3fbe4d166ec965dac507","commercialScore":0,"negativeRegularScore":0,"negativeScore":0,"positiveScore":0,"score":0,"grade":""},{"date":20210304,"state":"IA","positive":281391,"probableCases":null,"negative":1040055,"pending":null,"totalTestResultsSource":"posNeg","totalTestResults":1321446,"hospitalizedCurrently":184,"hospitalizedCumulative":null,"inIcuCurrently":39,"inIcuCumulative":null,"onVentilatorCurrently":11,"onVentilatorCumulative":null,"recovered":318560,"lastUpdateEt":"3/4/2021 00:00","dateModified":"2021-03-04T00:00:00Z","checkTimeEt":"03/03 19:00","death":5536,"hospitalized":null,"hospitalizedDischarged":null,"dateChecked":"2021-03-04T00:00:00Z","totalTestsViral":2734777,"positiveTestsViral":305285,"negativeTestsViral":2414548,"positiveCasesViral":281391,"deathConfirmed":null,"deathProbable":null,"totalTestEncountersViral":null,"totalTestsPeopleViral":1323845,"totalTestsAntibody":null,"positiveTestsAntibody":null,"negativeTestsAntibody":null,"totalTestsPeopleAntibody":113067,"positiveTestsPeopleAntibody":19240,"negativeTestsPeopleAntibody":93776,"totalTestsPeopleAntigen":245588,"positiveTestsPeopleAntigen":56878,"totalTestsAntigen":1372820,"positiveTestsAntigen":60354,"fips":"19","positiveIncrease":400,"negativeIncrease":2052,"total":1321446,"totalTestResultsIncrease":2452,"posNeg":1321446,"dataQualityGrade":null,"deathIncrease":35,"hospitalizedIncrease":0,"hash":"4b267af6e507dc39c2d8d481c89f4dbaa4e31ce6","commercialScore":0,"negativeRegularScore":0,"negativeScore":0,"positiveScore":0,"score":0,"grade":""},{"date":20210303,"state":"IA","positive":280991,"probableCases":null,"negative":1038003,"pending":null,"totalTestResultsSource":"posNeg","totalTestResults":1318994,"hospitalizedCurrently":191,"hospitalizedCumulative":null,"inIcuCurrently":40,"inIcuCumulative":null,"onVentilatorCurrently":11,"onVentilatorCumulative":null,"recovered":317731,"lastUpdateEt":"3/3/2021 00:00","dateModified":"2021-03-03T00:00:00Z","checkTimeEt":"03/02 19:00","death":5501,"hospitalized":null,"hospitalizedDischarged":null,"dateChecked":"2021-03-03T00:00:00Z","totalTestsViral":2725336,"positiveTestsViral":304861,"negativeTestsViral":2405624,"positiveCasesViral":280991,"deathConfirmed":null,"deathProbable":null,"totalTestEncountersViral":null,"totalTestsPeopleViral":1321384,"totalTestsAntibody":null,"positiveTestsAntibody":null,"negativeTestsAntibody":null,"totalTestsPeopleAntibody":112728,"positiveTestsPeopleAntibody":18996,"negativeTestsPeopleAntibody":93681,"totalTestsPeopleAntigen":244598,"positiveTestsPeopleAntigen":56695,"totalTestsAntigen":1365388,"positiveTestsAntigen":60142,"fips":"19","positiveIncrease":482,"negativeIncrease":1896,"total":1318994,"totalTestResultsIncrease":2378,"posNeg":1318994,"dataQualityGrade":null,"deathIncrease":3,"hospitalizedIncrease":0,"hash":"ddf0209a710941be41fb5c6127d606e073741192","commercialScore":0,"negativeRegularScore":0,"negativeScore":0,"positiveScore":0,"score":0,"grade":""},{"date":20210302,"state":"IA","positive":280509,"probableCases":null,"negative":1036107,"pending":null,"totalTestResultsSource":"posNeg","totalTestResults":1316616,"hospitalizedCurrently":209,"hospitalizedCumulative":null,"inIcuCurrently":39,"inIcuCumulative":null,"onVentilatorCurrently":11,"onVentilatorCumulative":null,"recovered":316185,"lastUpdateEt":"3/2/2021 00:00","dateModified":"2021-03-02T00:00:00Z","checkTimeEt":"03/01 19:00","death":5498,"hospitalized":null,"hospitalizedDischarged":null,"dateChecked":"2021-03-02T00:00:00Z","totalTestsViral":2716525,"positiveTestsViral":304305,"negativeTestsViral":2397458,"positiveCasesViral":280509,"deathConfirmed":null,"deathProbable":null,"totalTestEncountersViral":null,"totalTestsPeopleViral":1319002,"totalTestsAntibody":null,"positiveTestsAntibody":null,"negativeTestsAntibody":null,"totalTestsPeopleAntibody":112261,"positiveTestsPeopleAntibody":18760,"negativeTestsPeopleAntibody":93450,"totalTestsPeopleAntigen":243583,"positiveTestsPeopleAntigen":56553,"totalTestsAntigen":1356153,"positiveTestsAntigen":60009,"fips":"19","positiveIncrease":230,"negativeIncrease":988,"total":1316616,"totalTestResultsIncrease":1218,"posNeg":1316616,"dataQualityGrade":null,"deathIncrease":26,"hospitalizedIncrease":0,"hash":"e490ddd9b01e8b405138c443c4307ffc806c029d","commercialScore":0,"negativeRegularScore":0,"negativeScore":0,"positiveScore":0,"score":0,"grade":""},{"date":20210301,"state":"IA","positive":280279,"probableCases":null,"negative":1035119,"pending":null,"totalTestResultsSource":"posNeg","totalTestResults":1315398,"hospitalizedCurrently":197,"hospitalizedCumulative":null,"inIcuCurrently":48,"inIcuCumulative":null,"onVentilatorCurrently":15,"onVentilatorCumulative":null,"recovered":315443,"lastUpdateEt":"2/28/2021 00:00","dateModified":"2021-02-28T00:00:00Z","checkTimeEt":"02/27 19:00","death":5472,"hospitalized":null,"hospitalizedDischarged":null,"dateChecked":"2021-02-28T00:00:00Z","totalTestsViral":2711184,"positiveTestsViral":304008,"negativeTestsViral":2392446,"positiveCasesViral":280279,"deathConfirmed":null,"deathProbable":null,"totalTestEncountersViral":null,"totalTestsPeopleViral":1317777,"totalTestsAntibody":null,"positiveTestsAntibody":null,"negativeTestsAntibody":null,"totalTestsPeopleAntibody":112011,"positiveTestsPeopleAntibody":18571,"negativeTestsPeopleAntibody":93389,"totalTestsPeopleAntigen":242163,"positiveTestsPeopleAntigen":56368,"totalTestsAntigen":1346025,"positiveTestsAntigen":59842,"fips":"19","positiveIncrease":240,"negativeIncrease":1329,"total":1315398,"totalTestResultsIncrease":1569,"posNeg":1315398,"dataQualityGrade":null,"deathIncrease":1,"hospitalizedIncrease":0,"hash":"9202bb28684fedf3813600cf4aef9248f4ccd283","commercialScore":0,"negativeRegularScore":0,"negativeScore":0,"positiveScore":0,"score":0,"grade":""},{"date":20210228,"state":"IA","positive":280039,"probableCases":null,"negative":1033790,"pending":null,"totalTestResultsSource":"posNeg","totalTestResults":1313829,"hospitalizedCurrently":196,"hospitalizedCumulative":null,"inIcuCurrently":50,"inIcuCumulative":null,"onVentilatorCurrently":19,"onVentilatorCumulative":null,"recovered":315134,"lastUpdateEt":"2/28/2021 00:00","dateModified":"2021-02-28T00:00:00Z","checkTimeEt":"02/27 19:00","death":5471,"hospitalized":null,"hospitalizedDischarged":null,"dateChecked":"2021-02-28T00:00:00Z","totalTestsViral":2706509,"positiveTestsViral":303738,"negativeTestsViral":2388052,"positiveCasesViral":280039,"deathConfirmed":null,"deathProbable":null,"totalTestEncountersViral":null,"totalTestsPeopleViral":1316215,"totalTestsAntibody":null,"positiveTestsAntibody":null,"negativeTestsAntibody":null,"totalTestsPeopleAntibody":111938,"positiveTestsPeopleAntibody":18549,"negativeTestsPeopleAntibody":93338,"totalTestsPeopleAntigen":241907,"positiveTestsPeopleAntigen":56292,"totalTestsAntigen":1343678,"positiveTestsAntigen":59760,"fips":"19","positiveIncrease":295,"negativeIncrease":1527,"total":1313829,"totalTestResultsIncrease":1822,"posNeg":1313829,"dataQualityGrade":null,"deathIncrease":1,"hospitalizedIncrease":0,"hash":"e1767feb02ff3476dadbed8ea4e8f39b36a193cb","commercialScore":0,"negativeRegularScore":0,"negativeScore":0,"positiveScore":0,"score":0,"grade":""},{"date":20210227,"state":"IA","positive":279744,"probableCases":null,"negative":1032263,"pending":null,"totalTestResultsSource":"posNeg","totalTestResults":1312007,"hospitalizedCurrently":181,"hospitalizedCumulative":null,"inIcuCurrently":43,"inIcuCumulative":null,"onVentilatorCurrently":18,"onVentilatorCumulative":null,"recovered":314750,"lastUpdateEt":"2/27/2021 00:00","dateModified":"2021-02-27T00:00:00Z","checkTimeEt":"02/26 19:00","death":5470,"hospitalized":null,"hospitalizedDischarged":null,"dateChecked":"2021-02-27T00:00:00Z","totalTestsViral":2701416,"positiveTestsViral":303407,"negativeTestsViral":2383385,"positiveCasesViral":279744,"deathConfirmed":null,"deathProbable":null,"totalTestEncountersViral":null,"totalTestsPeopleViral":1314393,"totalTestsAntibody":null,"positiveTestsAntibody":null,"negativeTestsAntibody":null,"totalTestsPeopleAntibody":111913,"positiveTestsPeopleAntibody":18534,"negativeTestsPeopleAntibody":93328,"totalTestsPeopleAntigen":241787,"positiveTestsPeopleAntigen":56264,"totalTestsAntigen":1342398,"positiveTestsAntigen":59727,"fips":"19","positiveIncrease":315,"negativeIncrease":1273,"total":1312007,"totalTestResultsIncrease":1588,"posNeg":1312007,"dataQualityGrade":null,"deathIncrease":7,"hospitalizedIncrease":0,"hash":"81df8a67073b75bc001fa0833895e6d9b9bc6504","commercialScore":0,"negativeRegularScore":0,"negativeScore":0,"positiveScore":0,"score":0,"grade":""},{"date":20210226,"state":"IA","positive":279429,"probableCases":null,"negative":1030990,"pending":null,"totalTestResultsSource":"posNeg","totalTestResults":1310419,"hospitalizedCurrently":196,"hospitalizedCumulative":null,"inIcuCurrently":46,"inIcuCumulative":null,"onVentilatorCurrently":18,"onVentilatorCumulative":null,"recovered":313771,"lastUpdateEt":"2/26/2021 00:00","dateModified":"2021-02-26T00:00:00Z","checkTimeEt":"02/25 19:00","death":5463,"hospitalized":null,"hospitalizedDischarged":null,"dateChecked":"2021-02-26T00:00:00Z","totalTestsViral":2695742,"positiveTestsViral":303076,"negativeTestsViral":2378147,"positiveCasesViral":279429,"deathConfirmed":null,"deathProbable":null,"totalTestEncountersViral":null,"totalTestsPeopleViral":1312807,"totalTestsAntibody":null,"positiveTestsAntibody":null,"negativeTestsAntibody":null,"totalTestsPeopleAntibody":111562,"positiveTestsPeopleAntibody":18258,"negativeTestsPeopleAntibody":93253,"totalTestsPeopleAntigen":240854,"positiveTestsPeopleAntigen":56159,"totalTestsAntigen":1336491,"positiveTestsAntigen":59599,"fips":"19","positiveIncrease":546,"negativeIncrease":1377,"total":1310419,"totalTestResultsIncrease":1923,"posNeg":1310419,"dataQualityGrade":null,"deathIncrease":25,"hospitalizedIncrease":0,"hash":"d0e87b4094aac2481f370a2ff36ad7b1cbefff3f","commercialScore":0,"negativeRegularScore":0,"negativeScore":0,"positiveScore":0,"score":0,"grade":""},{"date":20210225,"state":"IA","positive":278883,"probableCases":null,"negative":1029613,"pending":null,"totalTestResultsSource":"posNeg","totalTestResults":1308496,"hospitalizedCurrently":227,"hospitalizedCumulative":null,"inIcuCurrently":55,"inIcuCumulative":null,"onVentilatorCurrently":22,"onVentilatorCumulative":null,"recovered":312817,"lastUpdateEt":"2/25/2021 00:00","dateModified":"2021-02-25T00:00:00Z","checkTimeEt":"02/24 19:00","death":5438,"hospitalized":null,"hospitalizedDischarged":null,"dateChecked":"2021-02-25T00:00:00Z","totalTestsViral":2687335,"positiveTestsViral":302488,"negativeTestsViral":2370413,"positiveCasesViral":278883,"deathConfirmed":null,"deathProbable":null,"totalTestEncountersViral":null,"totalTestsPeopleViral":1310879,"totalTestsAntibody":null,"positiveTestsAntibody":null,"negativeTestsAntibody":null,"totalTestsPeopleAntibody":111268,"positiveTestsPeopleAntibody":18054,"negativeTestsPeopleAntibody":93163,"totalTestsPeopleAntigen":239898,"positiveTestsPeopleAntigen":56023,"totalTestsAntigen":1328035,"positiveTestsAntigen":59448,"fips":"19","positiveIncrease":473,"negativeIncrease":2121,"total":1308496,"totalTestResultsIncrease":2594,"posNeg":1308496,"dataQualityGrade":null,"deathIncrease":23,"hospitalizedIncrease":0,"hash":"68f9e814d2d72a2ee81714f466971776263a3493","commercialScore":0,"negativeRegularScore":0,"negativeScore":0,"positiveScore":0,"score":0,"grade":""},{"date":20210224,"state":"IA","positive":278410,"probableCases":null,"negative":1027492,"pending":null,"totalTestResultsSource":"posNeg","totalTestResults":1305902,"hospitalizedCurrently":233,"hospitalizedCumulative":null,"inIcuCurrently":57,"inIcuCumulative":null,"onVentilatorCurrently":23,"onVentilatorCumulative":null,"recovered":311666,"lastUpdateEt":"2/24/2021 00:00","dateModified":"2021-02-24T00:00:00Z","checkTimeEt":"02/23 19:00","death":5415,"hospitalized":null,"hospitalizedDischarged":null,"dateChecked":"2021-02-24T00:00:00Z","totalTestsViral":2677457,"positiveTestsViral":301944,"negativeTestsViral":2361198,"positiveCasesViral":278410,"deathConfirmed":null,"deathProbable":null,"totalTestEncountersViral":null,"totalTestsPeopleViral":1308273,"totalTestsAntibody":null,"positiveTestsAntibody":null,"negativeTestsAntibody":null,"totalTestsPeopleAntibody":110812,"positiveTestsPeopleAntibody":17836,"negativeTestsPeopleAntibody":92925,"totalTestsPeopleAntigen":238935,"positiveTestsPeopleAntigen":55836,"totalTestsAntigen":1320798,"positiveTestsAntigen":59265,"fips":"19","positiveIncrease":589,"negativeIncrease":2101,"total":1305902,"totalTestResultsIncrease":2690,"posNeg":1305902,"dataQualityGrade":null,"deathIncrease":15,"hospitalizedIncrease":0,"hash":"a254fb7351a480404922d9d50b42c15236937a13","commercialScore":0,"negativeRegularScore":0,"negativeScore":0,"positiveScore":0,"score":0,"grade":""},{"date":20210223,"state":"IA","positive":277821,"probableCases":null,"negative":1025391,"pending":null,"totalTestResultsSource":"posNeg","totalTestResults":1303212,"hospitalizedCurrently":227,"hospitalizedCumulative":null,"inIcuCurrently":58,"inIcuCumulative":null,"onVentilatorCurrently":25,"onVentilatorCumulative":null,"recovered":310864,"lastUpdateEt":"2/23/2021 00:00","dateModified":"2021-02-23T00:00:00Z","checkTimeEt":"02/22 19:00","death":5400,"hospitalized":null,"hospitalizedDischarged":null,"dateChecked":"2021-02-23T00:00:00Z","totalTestsViral":2667365,"positiveTestsViral":301276,"negativeTestsViral":2351828,"positiveCasesViral":277821,"deathConfirmed":null,"deathProbable":null,"totalTestEncountersViral":null,"totalTestsPeopleViral":1305590,"totalTestsAntibody":null,"positiveTestsAntibody":null,"negativeTestsAntibody":null,"totalTestsPeopleAntibody":110653,"positiveTestsPeopleAntibody":17705,"negativeTestsPeopleAntibody":92898,"totalTestsPeopleAntigen":237914,"positiveTestsPeopleAntigen":55682,"totalTestsAntigen":1311504,"positiveTestsAntigen":59115,"fips":"19","positiveIncrease":241,"negativeIncrease":1101,"total":1303212,"totalTestResultsIncrease":1342,"posNeg":1303212,"dataQualityGrade":null,"deathIncrease":26,"hospitalizedIncrease":0,"hash":"ab2b509f9aa652f0473b52281c88078e77eb8519","commercialScore":0,"negativeRegularScore":0,"negativeScore":0,"positiveScore":0,"score":0,"grade":""},{"date":20210222,"state":"IA","positive":277580,"probableCases":null,"negative":1024290,"pending":null,"totalTestResultsSource":"posNeg","totalTestResults":1301870,"hospitalizedCurrently":222,"hospitalizedCumulative":null,"inIcuCurrently":54,"inIcuCumulative":null,"onVentilatorCurrently":25,"onVentilatorCumulative":null,"recovered":309539,"lastUpdateEt":"2/22/2021 00:00","dateModified":"2021-02-22T00:00:00Z","checkTimeEt":"02/21 19:00","death":5374,"hospitalized":null,"hospitalizedDischarged":null,"dateChecked":"2021-02-22T00:00:00Z","totalTestsViral":2661973,"positiveTestsViral":301026,"negativeTestsViral":2346702,"positiveCasesViral":277580,"deathConfirmed":null,"deathProbable":null,"totalTestEncountersViral":null,"totalTestsPeopleViral":1304246,"totalTestsAntibody":null,"positiveTestsAntibody":null,"negativeTestsAntibody":null,"totalTestsPeopleAntibody":110336,"positiveTestsPeopleAntibody":17557,"negativeTestsPeopleAntibody":92729,"totalTestsPeopleAntigen":236660,"positiveTestsPeopleAntigen":55488,"totalTestsAntigen":1299980,"positiveTestsAntigen":58913,"fips":"19","positiveIncrease":312,"negativeIncrease":1387,"total":1301870,"totalTestResultsIncrease":1699,"posNeg":1301870,"dataQualityGrade":null,"deathIncrease":38,"hospitalizedIncrease":0,"hash":"143517370318500aca8935ae142084746204cea5","commercialScore":0,"negativeRegularScore":0,"negativeScore":0,"positiveScore":0,"score":0,"grade":""},{"date":20210221,"state":"IA","positive":277268,"probableCases":null,"negative":1022903,"pending":null,"totalTestResultsSource":"posNeg","totalTestResults":1300171,"hospitalizedCurrently":229,"hospitalizedCumulative":null,"inIcuCurrently":58,"inIcuCumulative":null,"onVentilatorCurrently":27,"onVentilatorCumulative":null,"recovered":309192,"lastUpdateEt":"2/21/2021 00:00","dateModified":"2021-02-21T00:00:00Z","checkTimeEt":"02/20 19:00","death":5336,"hospitalized":null,"hospitalizedDischarged":null,"dateChecked":"2021-02-21T00:00:00Z","totalTestsViral":2657072,"positiveTestsViral":300663,"negativeTestsViral":2342175,"positiveCasesViral":277268,"deathConfirmed":null,"deathProbable":null,"totalTestEncountersViral":null,"totalTestsPeopleViral":1302551,"totalTestsAntibody":null,"positiveTestsAntibody":null,"negativeTestsAntibody":null,"totalTestsPeopleAntibody":110195,"positiveTestsPeopleAntibody":17472,"negativeTestsPeopleAntibody":92673,"totalTestsPeopleAntigen":236184,"positiveTestsPeopleAntigen":55373,"totalTestsAntigen":1296918,"positiveTestsAntigen":58786,"fips":"19","positiveIncrease":302,"negativeIncrease":1262,"total":1300171,"totalTestResultsIncrease":1564,"posNeg":1300171,"dataQualityGrade":null,"deathIncrease":0,"hospitalizedIncrease":0,"hash":"0a8948881b8659ef87848494cfc07fa47e0a05ec","commercialScore":0,"negativeRegularScore":0,"negativeScore":0,"positiveScore":0,"score":0,"grade":""},{"date":20210220,"state":"IA","positive":276966,"probableCases":null,"negative":1021641,"pending":null,"totalTestResultsSource":"posNeg","totalTestResults":1298607,"hospitalizedCurrently":238,"hospitalizedCumulative":null,"inIcuCurrently":56,"inIcuCumulative":null,"onVentilatorCurrently":24,"onVentilatorCumulative":null,"recovered":308712,"lastUpdateEt":"2/20/2021 00:00","dateModified":"2021-02-20T00:00:00Z","checkTimeEt":"02/19 19:00","death":5336,"hospitalized":null,"hospitalizedDischarged":null,"dateChecked":"2021-02-20T00:00:00Z","totalTestsViral":2652280,"positiveTestsViral":300322,"negativeTestsViral":2337743,"positiveCasesViral":276966,"deathConfirmed":null,"deathProbable":null,"totalTestEncountersViral":null,"totalTestsPeopleViral":1300986,"totalTestsAntibody":null,"positiveTestsAntibody":null,"negativeTestsAntibody":null,"totalTestsPeopleAntibody":110164,"positiveTestsPeopleAntibody":17455,"negativeTestsPeopleAntibody":92659,"totalTestsPeopleAntigen":235832,"positiveTestsPeopleAntigen":55262,"totalTestsAntigen":1295002,"positiveTestsAntigen":58671,"fips":"19","positiveIncrease":345,"negativeIncrease":948,"total":1298607,"totalTestResultsIncrease":1293,"posNeg":1298607,"dataQualityGrade":null,"deathIncrease":0,"hospitalizedIncrease":0,"hash":"19bc91f590d393c40f44c030eac7013a6e904887","commercialScore":0,"negativeRegularScore":0,"negativeScore":0,"positiveScore":0,"score":0,"grade":""},{"date":20210219,"state":"IA","positive":276621,"probableCases":null,"negative":1020693,"pending":null,"totalTestResultsSource":"posNeg","totalTestResults":1297314,"hospitalizedCurrently":241,"hospitalizedCumulative":null,"inIcuCurrently":60,"inIcuCumulative":null,"onVentilatorCurrently":26,"onVentilatorCumulative":null,"recovered":307605,"lastUpdateEt":"2/19/2021 00:00","dateModified":"2021-02-19T00:00:00Z","checkTimeEt":"02/18 19:00","death":5336,"hospitalized":null,"hospitalizedDischarged":null,"dateChecked":"2021-02-19T00:00:00Z","totalTestsViral":2646982,"positiveTestsViral":299936,"negativeTestsViral":2332876,"positiveCasesViral":276621,"deathConfirmed":null,"deathProbable":null,"totalTestEncountersViral":null,"totalTestsPeopleViral":1299688,"totalTestsAntibody":null,"positiveTestsAntibody":null,"negativeTestsAntibody":null,"totalTestsPeopleAntibody":109872,"positiveTestsPeopleAntibody":17286,"negativeTestsPeopleAntibody":92536,"totalTestsPeopleAntigen":234889,"positiveTestsPeopleAntigen":55147,"totalTestsAntigen":1287352,"positiveTestsAntigen":58545,"fips":"19","positiveIncrease":392,"negativeIncrease":1366,"total":1297314,"totalTestResultsIncrease":1758,"posNeg":1297314,"dataQualityGrade":null,"deathIncrease":15,"hospitalizedIncrease":0,"hash":"1097ece0a8504dca6e50512e41b6cdbc57890a08","commercialScore":0,"negativeRegularScore":0,"negativeScore":0,"positiveScore":0,"score":0,"grade":""},{"date":20210218,"state":"IA","positive":276229,"probableCases":null,"negative":1019327,"pending":null,"totalTestResultsSource":"posNeg","totalTestResults":1295556,"hospitalizedCurrently":252,"hospitalizedCumulative":null,"inIcuCurrently":59,"inIcuCumulative":null,"onVentilatorCurrently":24,"onVentilatorCumulative":null,"recovered":306399,"lastUpdateEt":"2/18/2021 00:00","dateModified":"2021-02-18T00:00:00Z","checkTimeEt":"02/17 19:00","death":5321,"hospitalized":null,"hospitalizedDischarged":null,"dateChecked":"2021-02-18T00:00:00Z","totalTestsViral":2638855,"positiveTestsViral":299530,"negativeTestsViral":2325188,"positiveCasesViral":276229,"deathConfirmed":null,"deathProbable":null,"totalTestEncountersViral":null,"totalTestsPeopleViral":1297926,"totalTestsAntibody":null,"positiveTestsAntibody":null,"negativeTestsAntibody":null,"totalTestsPeopleAntibody":109519,"positiveTestsPeopleAntibody":17082,"negativeTestsPeopleAntibody":92387,"totalTestsPeopleAntigen":233996,"positiveTestsPeopleAntigen":54992,"totalTestsAntigen":1277680,"positiveTestsAntigen":58388,"fips":"19","positiveIncrease":516,"negativeIncrease":1708,"total":1295556,"totalTestResultsIncrease":2224,"posNeg":1295556,"dataQualityGrade":null,"deathIncrease":15,"hospitalizedIncrease":0,"hash":"181dd27f716ac3173c975b4c50871d1583c8ce25","commercialScore":0,"negativeRegularScore":0,"negativeScore":0,"positiveScore":0,"score":0,"grade":""},{"date":20210217,"state":"IA","positive":275713,"probableCases":null,"negative":1017619,"pending":null,"totalTestResultsSource":"posNeg","totalTestResults":1293332,"hospitalizedCurrently":235,"hospitalizedCumulative":null,"inIcuCurrently":52,"inIcuCumulative":null,"onVentilatorCurrently":20,"onVentilatorCumulative":null,"recovered":305238,"lastUpdateEt":"2/17/2021 00:00","dateModified":"2021-02-17T00:00:00Z","checkTimeEt":"02/16 19:00","death":5306,"hospitalized":null,"hospitalizedDischarged":null,"dateChecked":"2021-02-17T00:00:00Z","totalTestsViral":2630380,"positiveTestsViral":298944,"negativeTestsViral":2317402,"positiveCasesViral":275713,"deathConfirmed":null,"deathProbable":null,"totalTestEncountersViral":null,"totalTestsPeopleViral":1295703,"totalTestsAntibody":null,"positiveTestsAntibody":null,"negativeTestsAntibody":null,"totalTestsPeopleAntibody":108818,"positiveTestsPeopleAntibody":16843,"negativeTestsPeopleAntibody":91925,"totalTestsPeopleAntigen":233113,"positiveTestsPeopleAntigen":54794,"totalTestsAntigen":1270242,"positiveTestsAntigen":58175,"fips":"19","positiveIncrease":466,"negativeIncrease":1933,"total":1293332,"totalTestResultsIncrease":2399,"posNeg":1293332,"dataQualityGrade":null,"deathIncrease":43,"hospitalizedIncrease":0,"hash":"e46c789b465b54a9ddd11502079b03ebcb21ca0b","commercialScore":0,"negativeRegularScore":0,"negativeScore":0,"positiveScore":0,"score":0,"grade":""},{"date":20210216,"state":"IA","positive":275247,"probableCases":null,"negative":1015686,"pending":null,"totalTestResultsSource":"posNeg","totalTestResults":1290933,"hospitalizedCurrently":255,"hospitalizedCumulative":null,"inIcuCurrently":57,"inIcuCumulative":null,"onVentilatorCurrently":25,"onVentilatorCumulative":null,"recovered":303697,"lastUpdateEt":"2/16/2021 00:00","dateModified":"2021-02-16T00:00:00Z","checkTimeEt":"02/15 19:00","death":5263,"hospitalized":null,"hospitalizedDischarged":null,"dateChecked":"2021-02-16T00:00:00Z","totalTestsViral":2622302,"positiveTestsViral":298412,"negativeTestsViral":2309877,"positiveCasesViral":275247,"deathConfirmed":null,"deathProbable":null,"totalTestEncountersViral":null,"totalTestsPeopleViral":1293305,"totalTestsAntibody":null,"positiveTestsAntibody":null,"negativeTestsAntibody":null,"totalTestsPeopleAntibody":108656,"positiveTestsPeopleAntibody":16712,"negativeTestsPeopleAntibody":91894,"totalTestsPeopleAntigen":232344,"positiveTestsPeopleAntigen":54662,"totalTestsAntigen":1260611,"positiveTestsAntigen":58034,"fips":"19","positiveIncrease":292,"negativeIncrease":8318,"total":1290933,"totalTestResultsIncrease":8610,"posNeg":1290933,"dataQualityGrade":null,"deathIncrease":26,"hospitalizedIncrease":0,"hash":"85090064fb3d816e0f2cb30106ef2f7eb7259c3b","commercialScore":0,"negativeRegularScore":0,"negativeScore":0,"positiveScore":0,"score":0,"grade":""},{"date":20210215,"state":"IA","positive":274955,"probableCases":null,"negative":1007368,"pending":null,"totalTestResultsSource":"posNeg","totalTestResults":1282323,"hospitalizedCurrently":242,"hospitalizedCumulative":null,"inIcuCurrently":57,"inIcuCumulative":null,"onVentilatorCurrently":28,"onVentilatorCumulative":null,"recovered":302158,"lastUpdateEt":"2/15/2021 00:00","dateModified":"2021-02-15T00:00:00Z","checkTimeEt":"02/14 19:00","death":5237,"hospitalized":null,"hospitalizedDischarged":null,"dateChecked":"2021-02-15T00:00:00Z","totalTestsViral":2601081,"positiveTestsViral":298099,"negativeTestsViral":2289099,"positiveCasesViral":274955,"deathConfirmed":null,"deathProbable":null,"totalTestEncountersViral":null,"totalTestsPeopleViral":1284680,"totalTestsAntibody":null,"positiveTestsAntibody":null,"negativeTestsAntibody":null,"totalTestsPeopleAntibody":107584,"positiveTestsPeopleAntibody":16436,"negativeTestsPeopleAntibody":91098,"totalTestsPeopleAntigen":230635,"positiveTestsPeopleAntigen":54498,"totalTestsAntigen":1246489,"positiveTestsAntigen":57858,"fips":"19","positiveIncrease":214,"negativeIncrease":1117,"total":1282323,"totalTestResultsIncrease":1331,"posNeg":1282323,"dataQualityGrade":null,"deathIncrease":1,"hospitalizedIncrease":0,"hash":"96808570d2e8e512934d083eaeb6108a0e9fd2c8","commercialScore":0,"negativeRegularScore":0,"negativeScore":0,"positiveScore":0,"score":0,"grade":""},{"date":20210214,"state":"IA","positive":274741,"probableCases":null,"negative":1006251,"pending":null,"totalTestResultsSource":"posNeg","totalTestResults":1280992,"hospitalizedCurrently":240,"hospitalizedCumulative":null,"inIcuCurrently":57,"inIcuCumulative":null,"onVentilatorCurrently":29,"onVentilatorCumulative":null,"recovered":301774,"lastUpdateEt":"2/14/2021 00:00","dateModified":"2021-02-14T00:00:00Z","checkTimeEt":"02/13 19:00","death":5236,"hospitalized":null,"hospitalizedDischarged":null,"dateChecked":"2021-02-14T00:00:00Z","totalTestsViral":2596862,"positiveTestsViral":297817,"negativeTestsViral":2285173,"positiveCasesViral":274741,"deathConfirmed":null,"deathProbable":null,"totalTestEncountersViral":null,"totalTestsPeopleViral":1283347,"totalTestsAntibody":null,"positiveTestsAntibody":null,"negativeTestsAntibody":null,"totalTestsPeopleAntibody":106966,"positiveTestsPeopleAntibody":16331,"negativeTestsPeopleAntibody":90583,"totalTestsPeopleAntigen":230121,"positiveTestsPeopleAntigen":54378,"totalTestsAntigen":1243995,"positiveTestsAntigen":57745,"fips":"19","positiveIncrease":355,"negativeIncrease":1304,"total":1280992,"totalTestResultsIncrease":1659,"posNeg":1280992,"dataQualityGrade":null,"deathIncrease":0,"hospitalizedIncrease":0,"hash":"0871cefbcf851d1672b5add2d43ddce56e46557e","commercialScore":0,"negativeRegularScore":0,"negativeScore":0,"positiveScore":0,"score":0,"grade":""},{"date":20210213,"state":"IA","positive":274386,"probableCases":null,"negative":1004947,"pending":null,"totalTestResultsSource":"posNeg","totalTestResults":1279333,"hospitalizedCurrently":225,"hospitalizedCumulative":null,"inIcuCurrently":55,"inIcuCumulative":null,"onVentilatorCurrently":33,"onVentilatorCumulative":null,"recovered":301196,"lastUpdateEt":"2/13/2021 00:00","dateModified":"2021-02-13T00:00:00Z","checkTimeEt":"02/12 19:00","death":5236,"hospitalized":null,"hospitalizedDischarged":null,"dateChecked":"2021-02-13T00:00:00Z","totalTestsViral":2592151,"positiveTestsViral":297412,"negativeTestsViral":2280957,"positiveCasesViral":274386,"deathConfirmed":null,"deathProbable":null,"totalTestEncountersViral":null,"totalTestsPeopleViral":1281692,"totalTestsAntibody":null,"positiveTestsAntibody":null,"negativeTestsAntibody":null,"totalTestsPeopleAntibody":106700,"positiveTestsPeopleAntibody":16244,"negativeTestsPeopleAntibody":90406,"totalTestsPeopleAntigen":229994,"positiveTestsPeopleAntigen":54333,"totalTestsAntigen":1242704,"positiveTestsAntigen":57698,"fips":"19","positiveIncrease":450,"negativeIncrease":1392,"total":1279333,"totalTestResultsIncrease":1842,"posNeg":1279333,"dataQualityGrade":null,"deathIncrease":13,"hospitalizedIncrease":0,"hash":"a1ed2c49d2bda48eafd9bfafab50e01e61d7c529","commercialScore":0,"negativeRegularScore":0,"negativeScore":0,"positiveScore":0,"score":0,"grade":""},{"date":20210212,"state":"IA","positive":273936,"probableCases":null,"negative":1003555,"pending":null,"totalTestResultsSource":"posNeg","totalTestResults":1277491,"hospitalizedCurrently":249,"hospitalizedCumulative":null,"inIcuCurrently":59,"inIcuCumulative":null,"onVentilatorCurrently":33,"onVentilatorCumulative":null,"recovered":300366,"lastUpdateEt":"2/12/2021 00:00","dateModified":"2021-02-12T00:00:00Z","checkTimeEt":"02/11 19:00","death":5223,"hospitalized":null,"hospitalizedDischarged":null,"dateChecked":"2021-02-12T00:00:00Z","totalTestsViral":2585809,"positiveTestsViral":296909,"negativeTestsViral":2275171,"positiveCasesViral":273936,"deathConfirmed":null,"deathProbable":null,"totalTestEncountersViral":null,"totalTestsPeopleViral":1279853,"totalTestsAntibody":null,"positiveTestsAntibody":null,"negativeTestsAntibody":null,"totalTestsPeopleAntibody":106528,"positiveTestsPeopleAntibody":16144,"negativeTestsPeopleAntibody":90334,"totalTestsPeopleAntigen":229287,"positiveTestsPeopleAntigen":54203,"totalTestsAntigen":1234633,"positiveTestsAntigen":57564,"fips":"19","positiveIncrease":519,"negativeIncrease":1290,"total":1277491,"totalTestResultsIncrease":1809,"posNeg":1277491,"dataQualityGrade":null,"deathIncrease":27,"hospitalizedIncrease":0,"hash":"6a9198fce86d95701824566e63238491d92af912","commercialScore":0,"negativeRegularScore":0,"negativeScore":0,"positiveScore":0,"score":0,"grade":""},{"date":20210211,"state":"IA","positive":273417,"probableCases":null,"negative":1002265,"pending":null,"totalTestResultsSource":"posNeg","totalTestResults":1275682,"hospitalizedCurrently":273,"hospitalizedCumulative":null,"inIcuCurrently":64,"inIcuCumulative":null,"onVentilatorCurrently":26,"onVentilatorCumulative":null,"recovered":299106,"lastUpdateEt":"2/11/2021 00:00","dateModified":"2021-02-11T00:00:00Z","checkTimeEt":"02/10 19:00","death":5196,"hospitalized":null,"hospitalizedDischarged":null,"dateChecked":"2021-02-11T00:00:00Z","totalTestsViral":2577469,"positiveTestsViral":296332,"negativeTestsViral":2267439,"positiveCasesViral":273417,"deathConfirmed":null,"deathProbable":null,"totalTestEncountersViral":null,"totalTestsPeopleViral":1278044,"totalTestsAntibody":null,"positiveTestsAntibody":null,"negativeTestsAntibody":null,"totalTestsPeopleAntibody":105528,"positiveTestsPeopleAntibody":15820,"negativeTestsPeopleAntibody":89660,"totalTestsPeopleAntigen":227836,"positiveTestsPeopleAntigen":54009,"totalTestsAntigen":1222971,"positiveTestsAntigen":57368,"fips":"19","positiveIncrease":593,"negativeIncrease":1762,"total":1275682,"totalTestResultsIncrease":2355,"posNeg":1275682,"dataQualityGrade":null,"deathIncrease":22,"hospitalizedIncrease":0,"hash":"020f539d9d4dd1a6e7aba030c7092354bfd1d6f1","commercialScore":0,"negativeRegularScore":0,"negativeScore":0,"positiveScore":0,"score":0,"grade":""},{"date":20210210,"state":"IA","positive":272824,"probableCases":null,"negative":1000503,"pending":null,"totalTestResultsSource":"posNeg","totalTestResults":1273327,"hospitalizedCurrently":292,"hospitalizedCumulative":null,"inIcuCurrently":67,"inIcuCumulative":null,"onVentilatorCurrently":27,"onVentilatorCumulative":null,"recovered":297805,"lastUpdateEt":"2/10/2021 00:00","dateModified":"2021-02-10T00:00:00Z","checkTimeEt":"02/09 19:00","death":5174,"hospitalized":null,"hospitalizedDischarged":null,"dateChecked":"2021-02-10T00:00:00Z","totalTestsViral":2567481,"positiveTestsViral":295657,"negativeTestsViral":2258224,"positiveCasesViral":272824,"deathConfirmed":null,"deathProbable":null,"totalTestEncountersViral":null,"totalTestsPeopleViral":1275694,"totalTestsAntibody":null,"positiveTestsAntibody":null,"negativeTestsAntibody":null,"totalTestsPeopleAntibody":105073,"positiveTestsPeopleAntibody":15683,"negativeTestsPeopleAntibody":89342,"totalTestsPeopleAntigen":226576,"positiveTestsPeopleAntigen":53749,"totalTestsAntigen":1214772,"positiveTestsAntigen":57113,"fips":"19","positiveIncrease":721,"negativeIncrease":1593,"total":1273327,"totalTestResultsIncrease":2314,"posNeg":1273327,"dataQualityGrade":null,"deathIncrease":29,"hospitalizedIncrease":0,"hash":"91bdeebf18924c23863183b97f79c4a0e747c883","commercialScore":0,"negativeRegularScore":0,"negativeScore":0,"positiveScore":0,"score":0,"grade":""},{"date":20210209,"state":"IA","positive":272103,"probableCases":null,"negative":998910,"pending":null,"totalTestResultsSource":"posNeg","totalTestResults":1271013,"hospitalizedCurrently":327,"hospitalizedCumulative":null,"inIcuCurrently":67,"inIcuCumulative":null,"onVentilatorCurrently":29,"onVentilatorCumulative":null,"recovered":296420,"lastUpdateEt":"2/9/2021 00:00","dateModified":"2021-02-09T00:00:00Z","checkTimeEt":"02/08 19:00","death":5145,"hospitalized":null,"hospitalizedDischarged":null,"dateChecked":"2021-02-09T00:00:00Z","totalTestsViral":2557851,"positiveTestsViral":294857,"negativeTestsViral":2249469,"positiveCasesViral":272103,"deathConfirmed":null,"deathProbable":null,"totalTestEncountersViral":null,"totalTestsPeopleViral":1273386,"totalTestsAntibody":null,"positiveTestsAntibody":null,"negativeTestsAntibody":null,"totalTestsPeopleAntibody":104639,"positiveTestsPeopleAntibody":15478,"negativeTestsPeopleAntibody":89113,"totalTestsPeopleAntigen":225241,"positiveTestsPeopleAntigen":53480,"totalTestsAntigen":1203429,"positiveTestsAntigen":56826,"fips":"19","positiveIncrease":405,"negativeIncrease":1189,"total":1271013,"totalTestResultsIncrease":1594,"posNeg":1271013,"dataQualityGrade":null,"deathIncrease":35,"hospitalizedIncrease":0,"hash":"831ba5108d0db3a31c3bd8b20cd3f08f4ea11bd1","commercialScore":0,"negativeRegularScore":0,"negativeScore":0,"positiveScore":0,"score":0,"grade":""},{"date":20210208,"state":"IA","positive":271698,"probableCases":null,"negative":997721,"pending":null,"totalTestResultsSource":"posNeg","totalTestResults":1269419,"hospitalizedCurrently":318,"hospitalizedCumulative":null,"inIcuCurrently":69,"inIcuCumulative":null,"onVentilatorCurrently":35,"onVentilatorCumulative":null,"recovered":294118,"lastUpdateEt":"2/8/2021 00:00","dateModified":"2021-02-08T00:00:00Z","checkTimeEt":"02/07 19:00","death":5110,"hospitalized":null,"hospitalizedDischarged":null,"dateChecked":"2021-02-08T00:00:00Z","totalTestsViral":2551739,"positiveTestsViral":294404,"negativeTestsViral":2243854,"positiveCasesViral":271698,"deathConfirmed":null,"deathProbable":null,"totalTestEncountersViral":null,"totalTestsPeopleViral":1271781,"totalTestsAntibody":null,"positiveTestsAntibody":null,"negativeTestsAntibody":null,"totalTestsPeopleAntibody":104191,"positiveTestsPeopleAntibody":15252,"negativeTestsPeopleAntibody":88891,"totalTestsPeopleAntigen":223833,"positiveTestsPeopleAntigen":53210,"totalTestsAntigen":1190444,"positiveTestsAntigen":56540,"fips":"19","positiveIncrease":317,"negativeIncrease":941,"total":1269419,"totalTestResultsIncrease":1258,"posNeg":1269419,"dataQualityGrade":null,"deathIncrease":2,"hospitalizedIncrease":0,"hash":"4661f6695ea24be88623955bf173df2f637ccf0b","commercialScore":0,"negativeRegularScore":0,"negativeScore":0,"positiveScore":0,"score":0,"grade":""},{"date":20210207,"state":"IA","positive":271381,"probableCases":null,"negative":996780,"pending":null,"totalTestResultsSource":"posNeg","totalTestResults":1268161,"hospitalizedCurrently":316,"hospitalizedCumulative":null,"inIcuCurrently":68,"inIcuCumulative":null,"onVentilatorCurrently":32,"onVentilatorCumulative":null,"recovered":293597,"lastUpdateEt":"2/7/2021 00:00","dateModified":"2021-02-07T00:00:00Z","checkTimeEt":"02/06 19:00","death":5108,"hospitalized":null,"hospitalizedDischarged":null,"dateChecked":"2021-02-07T00:00:00Z","totalTestsViral":2547600,"positiveTestsViral":294069,"negativeTestsViral":2240056,"positiveCasesViral":271381,"deathConfirmed":null,"deathProbable":null,"totalTestEncountersViral":null,"totalTestsPeopleViral":1270520,"totalTestsAntibody":null,"positiveTestsAntibody":null,"negativeTestsAntibody":null,"totalTestsPeopleAntibody":103979,"positiveTestsPeopleAntibody":15165,"negativeTestsPeopleAntibody":88766,"totalTestsPeopleAntigen":223290,"positiveTestsPeopleAntigen":53063,"totalTestsAntigen":1187711,"positiveTestsAntigen":56369,"fips":"19","positiveIncrease":446,"negativeIncrease":1652,"total":1268161,"totalTestResultsIncrease":2098,"posNeg":1268161,"dataQualityGrade":null,"deathIncrease":0,"hospitalizedIncrease":0,"hash":"a314b72c7b913258b1aa21f5bec3948c591ba41e","commercialScore":0,"negativeRegularScore":0,"negativeScore":0,"positiveScore":0,"score":0,"grade":""},{"date":20210206,"state":"IA","positive":270935,"probableCases":null,"negative":995128,"pending":null,"totalTestResultsSource":"posNeg","totalTestResults":1266063,"hospitalizedCurrently":336,"hospitalizedCumulative":null,"inIcuCurrently":67,"inIcuCumulative":null,"onVentilatorCurrently":30,"onVentilatorCumulative":null,"recovered":293073,"lastUpdateEt":"2/6/2021 00:00","dateModified":"2021-02-06T00:00:00Z","checkTimeEt":"02/05 19:00","death":5108,"hospitalized":null,"hospitalizedDischarged":null,"dateChecked":"2021-02-06T00:00:00Z","totalTestsViral":2541550,"positiveTestsViral":293563,"negativeTestsViral":2234618,"positiveCasesViral":270935,"deathConfirmed":null,"deathProbable":null,"totalTestEncountersViral":null,"totalTestsPeopleViral":1268416,"totalTestsAntibody":null,"positiveTestsAntibody":null,"negativeTestsAntibody":null,"totalTestsPeopleAntibody":103956,"positiveTestsPeopleAntibody":15154,"negativeTestsPeopleAntibody":88754,"totalTestsPeopleAntigen":223218,"positiveTestsPeopleAntigen":53001,"totalTestsAntigen":1185288,"positiveTestsAntigen":56308,"fips":"19","positiveIncrease":302,"negativeIncrease":822,"total":1266063,"totalTestResultsIncrease":1124,"posNeg":1266063,"dataQualityGrade":null,"deathIncrease":41,"hospitalizedIncrease":0,"hash":"b77faebdb03dc3bc5c882fd576562ba075a851bb","commercialScore":0,"negativeRegularScore":0,"negativeScore":0,"positiveScore":0,"score":0,"grade":""},{"date":20210205,"state":"IA","positive":270633,"probableCases":null,"negative":994306,"pending":null,"totalTestResultsSource":"posNeg","totalTestResults":1264939,"hospitalizedCurrently":348,"hospitalizedCumulative":null,"inIcuCurrently":66,"inIcuCumulative":null,"onVentilatorCurrently":31,"onVentilatorCumulative":null,"recovered":291527,"lastUpdateEt":"2/5/2021 00:00","dateModified":"2021-02-05T00:00:00Z","checkTimeEt":"02/04 19:00","death":5067,"hospitalized":null,"hospitalizedDischarged":null,"dateChecked":"2021-02-05T00:00:00Z","totalTestsViral":2536894,"positiveTestsViral":293232,"negativeTestsViral":2230348,"positiveCasesViral":270633,"deathConfirmed":null,"deathProbable":null,"totalTestEncountersViral":null,"totalTestsPeopleViral":1267289,"totalTestsAntibody":null,"positiveTestsAntibody":null,"negativeTestsAntibody":null,"totalTestsPeopleAntibody":103457,"positiveTestsPeopleAntibody":14916,"negativeTestsPeopleAntibody":88493,"totalTestsPeopleAntigen":222308,"positiveTestsPeopleAntigen":52876,"totalTestsAntigen":1175736,"positiveTestsAntigen":56185,"fips":"19","positiveIncrease":649,"negativeIncrease":1857,"total":1264939,"totalTestResultsIncrease":2506,"posNeg":1264939,"dataQualityGrade":null,"deathIncrease":34,"hospitalizedIncrease":0,"hash":"63969591c3e029509f9016fbd1260ec34eb78d1e","commercialScore":0,"negativeRegularScore":0,"negativeScore":0,"positiveScore":0,"score":0,"grade":""},{"date":20210204,"state":"IA","positive":269984,"probableCases":null,"negative":992449,"pending":null,"totalTestResultsSource":"posNeg","totalTestResults":1262433,"hospitalizedCurrently":360,"hospitalizedCumulative":null,"inIcuCurrently":77,"inIcuCumulative":null,"onVentilatorCurrently":31,"onVentilatorCumulative":null,"recovered":289989,"lastUpdateEt":"2/4/2021 00:00","dateModified":"2021-02-04T00:00:00Z","checkTimeEt":"02/03 19:00","death":5033,"hospitalized":null,"hospitalizedDischarged":null,"dateChecked":"2021-02-04T00:00:00Z","totalTestsViral":2527503,"positiveTestsViral":292520,"negativeTestsViral":2221735,"positiveCasesViral":269984,"deathConfirmed":null,"deathProbable":null,"totalTestEncountersViral":null,"totalTestsPeopleViral":1264787,"totalTestsAntibody":null,"positiveTestsAntibody":null,"negativeTestsAntibody":null,"totalTestsPeopleAntibody":103285,"positiveTestsPeopleAntibody":14854,"negativeTestsPeopleAntibody":88383,"totalTestsPeopleAntigen":221403,"positiveTestsPeopleAntigen":52725,"totalTestsAntigen":1165803,"positiveTestsAntigen":56018,"fips":"19","positiveIncrease":700,"negativeIncrease":1548,"total":1262433,"totalTestResultsIncrease":2248,"posNeg":1262433,"dataQualityGrade":null,"deathIncrease":58,"hospitalizedIncrease":0,"hash":"da7ffd535ed500176bdd952647c5e71980f01b16","commercialScore":0,"negativeRegularScore":0,"negativeScore":0,"positiveScore":0,"score":0,"grade":""},{"date":20210203,"state":"IA","positive":269284,"probableCases":null,"negative":990901,"pending":null,"totalTestResultsSource":"posNeg","totalTestResults":1260185,"hospitalizedCurrently":382,"hospitalizedCumulative":null,"inIcuCurrently":86,"inIcuCumulative":null,"onVentilatorCurrently":34,"onVentilatorCumulative":null,"recovered":288259,"lastUpdateEt":"2/3/2021 00:00","dateModified":"2021-02-03T00:00:00Z","checkTimeEt":"02/02 19:00","death":4975,"hospitalized":null,"hospitalizedDischarged":null,"dateChecked":"2021-02-03T00:00:00Z","totalTestsViral":2519240,"positiveTestsViral":291757,"negativeTestsViral":2214317,"positiveCasesViral":269284,"deathConfirmed":null,"deathProbable":null,"totalTestEncountersViral":null,"totalTestsPeopleViral":1262530,"totalTestsAntibody":null,"positiveTestsAntibody":null,"negativeTestsAntibody":null,"totalTestsPeopleAntibody":102726,"positiveTestsPeopleAntibody":14602,"negativeTestsPeopleAntibody":88076,"totalTestsPeopleAntigen":220482,"positiveTestsPeopleAntigen":52546,"totalTestsAntigen":1158058,"positiveTestsAntigen":55837,"fips":"19","positiveIncrease":908,"negativeIncrease":2615,"total":1260185,"totalTestResultsIncrease":3523,"posNeg":1260185,"dataQualityGrade":null,"deathIncrease":56,"hospitalizedIncrease":0,"hash":"48269648461eb20966f188c04f1f2ef90f3ff5b8","commercialScore":0,"negativeRegularScore":0,"negativeScore":0,"positiveScore":0,"score":0,"grade":""},{"date":20210202,"state":"IA","positive":268376,"probableCases":null,"negative":988286,"pending":null,"totalTestResultsSource":"posNeg","totalTestResults":1256662,"hospitalizedCurrently":390,"hospitalizedCumulative":null,"inIcuCurrently":88,"inIcuCumulative":null,"onVentilatorCurrently":31,"onVentilatorCumulative":null,"recovered":286315,"lastUpdateEt":"2/2/2021 00:00","dateModified":"2021-02-02T00:00:00Z","checkTimeEt":"02/01 19:00","death":4919,"hospitalized":null,"hospitalizedDischarged":null,"dateChecked":"2021-02-02T00:00:00Z","totalTestsViral":2506499,"positiveTestsViral":290749,"negativeTestsViral":2202680,"positiveCasesViral":268376,"deathConfirmed":null,"deathProbable":null,"totalTestEncountersViral":null,"totalTestsPeopleViral":1259008,"totalTestsAntibody":null,"positiveTestsAntibody":null,"negativeTestsAntibody":null,"totalTestsPeopleAntibody":102218,"positiveTestsPeopleAntibody":14364,"negativeTestsPeopleAntibody":87806,"totalTestsPeopleAntigen":219208,"positiveTestsPeopleAntigen":52242,"totalTestsAntigen":1146087,"positiveTestsAntigen":55511,"fips":"19","positiveIncrease":463,"negativeIncrease":1011,"total":1256662,"totalTestResultsIncrease":1474,"posNeg":1256662,"dataQualityGrade":null,"deathIncrease":13,"hospitalizedIncrease":0,"hash":"86a22efd7f6c2c967985af4ad10f1bbc708f37bf","commercialScore":0,"negativeRegularScore":0,"negativeScore":0,"positiveScore":0,"score":0,"grade":""},{"date":20210201,"state":"IA","positive":267913,"probableCases":null,"negative":987275,"pending":null,"totalTestResultsSource":"posNeg","totalTestResults":1255188,"hospitalizedCurrently":368,"hospitalizedCumulative":null,"inIcuCurrently":92,"inIcuCumulative":null,"onVentilatorCurrently":28,"onVentilatorCumulative":null,"recovered":283036,"lastUpdateEt":"1/2/2021 00:00","dateModified":"2021-01-02T00:00:00Z","checkTimeEt":"01/01 19:00","death":4906,"hospitalized":null,"hospitalizedDischarged":null,"dateChecked":"2021-01-02T00:00:00Z","totalTestsViral":2499887,"positiveTestsViral":290215,"negativeTestsViral":2196634,"positiveCasesViral":267913,"deathConfirmed":null,"deathProbable":null,"totalTestEncountersViral":null,"totalTestsPeopleViral":1257527,"totalTestsAntibody":null,"positiveTestsAntibody":null,"negativeTestsAntibody":null,"totalTestsPeopleAntibody":101560,"positiveTestsPeopleAntibody":14114,"negativeTestsPeopleAntibody":87398,"totalTestsPeopleAntigen":217424,"positiveTestsPeopleAntigen":51905,"totalTestsAntigen":1131661,"positiveTestsAntigen":55190,"fips":"19","positiveIncrease":355,"negativeIncrease":1145,"total":1255188,"totalTestResultsIncrease":1500,"posNeg":1255188,"dataQualityGrade":null,"deathIncrease":5,"hospitalizedIncrease":0,"hash":"540b672e72709cea618ff5942eb7dba728111d9d","commercialScore":0,"negativeRegularScore":0,"negativeScore":0,"positiveScore":0,"score":0,"grade":""},{"date":20210131,"state":"IA","positive":267558,"probableCases":null,"negative":986130,"pending":null,"totalTestResultsSource":"posNeg","totalTestResults":1253688,"hospitalizedCurrently":358,"hospitalizedCumulative":null,"inIcuCurrently":94,"inIcuCumulative":null,"onVentilatorCurrently":29,"onVentilatorCumulative":null,"recovered":282324,"lastUpdateEt":"1/31/2021 00:00","dateModified":"2021-01-31T00:00:00Z","checkTimeEt":"01/30 19:00","death":4901,"hospitalized":null,"hospitalizedDischarged":null,"dateChecked":"2021-01-31T00:00:00Z","totalTestsViral":2495390,"positiveTestsViral":289845,"negativeTestsViral":2192534,"positiveCasesViral":267558,"deathConfirmed":null,"deathProbable":null,"totalTestEncountersViral":null,"totalTestsPeopleViral":1256026,"totalTestsAntibody":null,"positiveTestsAntibody":null,"negativeTestsAntibody":null,"totalTestsPeopleAntibody":101326,"positiveTestsPeopleAntibody":14024,"negativeTestsPeopleAntibody":87256,"totalTestsPeopleAntigen":216692,"positiveTestsPeopleAntigen":51688,"totalTestsAntigen":1127364,"positiveTestsAntigen":54951,"fips":"19","positiveIncrease":624,"negativeIncrease":1812,"total":1253688,"totalTestResultsIncrease":2436,"posNeg":1253688,"dataQualityGrade":null,"deathIncrease":250,"hospitalizedIncrease":0,"hash":"0bb3f8c9da49e12b931eb8179e44e610499bddc8","commercialScore":0,"negativeRegularScore":0,"negativeScore":0,"positiveScore":0,"score":0,"grade":""},{"date":20210130,"state":"IA","positive":266934,"probableCases":null,"negative":984318,"pending":null,"totalTestResultsSource":"posNeg","totalTestResults":1251252,"hospitalizedCurrently":376,"hospitalizedCumulative":null,"inIcuCurrently":84,"inIcuCumulative":null,"onVentilatorCurrently":31,"onVentilatorCumulative":null,"recovered":281466,"lastUpdateEt":"1/30/2021 00:00","dateModified":"2021-01-30T00:00:00Z","checkTimeEt":"01/29 19:00","death":4651,"hospitalized":null,"hospitalizedDischarged":null,"dateChecked":"2021-01-30T00:00:00Z","totalTestsViral":2488662,"positiveTestsViral":289190,"negativeTestsViral":2186570,"positiveCasesViral":266934,"deathConfirmed":null,"deathProbable":null,"totalTestEncountersViral":null,"totalTestsPeopleViral":1253586,"totalTestsAntibody":null,"positiveTestsAntibody":null,"negativeTestsAntibody":null,"totalTestsPeopleAntibody":101290,"positiveTestsPeopleAntibody":14015,"negativeTestsPeopleAntibody":87229,"totalTestsPeopleAntigen":216558,"positiveTestsPeopleAntigen":51627,"totalTestsAntigen":1125151,"positiveTestsAntigen":54853,"fips":"19","positiveIncrease":654,"negativeIncrease":3730,"total":1251252,"totalTestResultsIncrease":4384,"posNeg":1251252,"dataQualityGrade":null,"deathIncrease":74,"hospitalizedIncrease":0,"hash":"b861df6cf950c0f2d7a792c75ab8d9eb31245ad5","commercialScore":0,"negativeRegularScore":0,"negativeScore":0,"positiveScore":0,"score":0,"grade":""},{"date":20210129,"state":"IA","positive":266280,"probableCases":null,"negative":980588,"pending":null,"totalTestResultsSource":"posNeg","totalTestResults":1246868,"hospitalizedCurrently":383,"hospitalizedCumulative":null,"inIcuCurrently":82,"inIcuCumulative":null,"onVentilatorCurrently":29,"onVentilatorCumulative":null,"recovered":281179,"lastUpdateEt":"1/29/2021 00:00","dateModified":"2021-01-29T00:00:00Z","checkTimeEt":"01/28 19:00","death":4577,"hospitalized":null,"hospitalizedDischarged":null,"dateChecked":"2021-01-29T00:00:00Z","totalTestsViral":2475832,"positiveTestsViral":288437,"negativeTestsViral":2174598,"positiveCasesViral":266280,"deathConfirmed":null,"deathProbable":null,"totalTestEncountersViral":null,"totalTestsPeopleViral":1249196,"totalTestsAntibody":null,"positiveTestsAntibody":null,"negativeTestsAntibody":null,"totalTestsPeopleAntibody":100325,"positiveTestsPeopleAntibody":13685,"negativeTestsPeopleAntibody":86595,"totalTestsPeopleAntigen":215555,"positiveTestsPeopleAntigen":51409,"totalTestsAntigen":1115432,"positiveTestsAntigen":54661,"fips":"19","positiveIncrease":734,"negativeIncrease":1915,"total":1246868,"totalTestResultsIncrease":2649,"posNeg":1246868,"dataQualityGrade":null,"deathIncrease":45,"hospitalizedIncrease":0,"hash":"cda2d0112213a62ae9d99a34565d4f0fb5444a27","commercialScore":0,"negativeRegularScore":0,"negativeScore":0,"positiveScore":0,"score":0,"grade":""},{"date":20210128,"state":"IA","positive":265546,"probableCases":null,"negative":978673,"pending":null,"totalTestResultsSource":"posNeg","totalTestResults":1244219,"hospitalizedCurrently":391,"hospitalizedCumulative":null,"inIcuCurrently":80,"inIcuCumulative":null,"onVentilatorCurrently":32,"onVentilatorCumulative":null,"recovered":279641,"lastUpdateEt":"1/28/2021 00:00","dateModified":"2021-01-28T00:00:00Z","checkTimeEt":"01/27 19:00","death":4532,"hospitalized":null,"hospitalizedDischarged":null,"dateChecked":"2021-01-28T00:00:00Z","totalTestsViral":2465630,"positiveTestsViral":287616,"negativeTestsViral":2165346,"positiveCasesViral":265546,"deathConfirmed":null,"deathProbable":null,"totalTestEncountersViral":null,"totalTestsPeopleViral":1246542,"totalTestsAntibody":null,"positiveTestsAntibody":null,"negativeTestsAntibody":null,"totalTestsPeopleAntibody":100064,"positiveTestsPeopleAntibody":13557,"negativeTestsPeopleAntibody":86462,"totalTestsPeopleAntigen":214221,"positiveTestsPeopleAntigen":51138,"totalTestsAntigen":1102683,"positiveTestsAntigen":54358,"fips":"19","positiveIncrease":963,"negativeIncrease":2177,"total":1244219,"totalTestResultsIncrease":3140,"posNeg":1244219,"dataQualityGrade":null,"deathIncrease":32,"hospitalizedIncrease":0,"hash":"f6e3f6dc25bd1f8cec3c3ae826223a4dae9aef68","commercialScore":0,"negativeRegularScore":0,"negativeScore":0,"positiveScore":0,"score":0,"grade":""},{"date":20210127,"state":"IA","positive":264583,"probableCases":null,"negative":976496,"pending":null,"totalTestResultsSource":"posNeg","totalTestResults":1241079,"hospitalizedCurrently":408,"hospitalizedCumulative":null,"inIcuCurrently":81,"inIcuCumulative":null,"onVentilatorCurrently":37,"onVentilatorCumulative":null,"recovered":277824,"lastUpdateEt":"1/27/2021 00:00","dateModified":"2021-01-27T00:00:00Z","checkTimeEt":"01/26 19:00","death":4500,"hospitalized":null,"hospitalizedDischarged":null,"dateChecked":"2021-01-27T00:00:00Z","totalTestsViral":2454125,"positiveTestsViral":286587,"negativeTestsViral":2154915,"positiveCasesViral":264583,"deathConfirmed":null,"deathProbable":null,"totalTestEncountersViral":null,"totalTestsPeopleViral":1243407,"totalTestsAntibody":null,"positiveTestsAntibody":null,"negativeTestsAntibody":null,"totalTestsPeopleAntibody":99020,"positiveTestsPeopleAntibody":13226,"negativeTestsPeopleAntibody":85750,"totalTestsPeopleAntigen":213029,"positiveTestsPeopleAntigen":50829,"totalTestsAntigen":1093439,"positiveTestsAntigen":54027,"fips":"19","positiveIncrease":731,"negativeIncrease":1866,"total":1241079,"totalTestResultsIncrease":2597,"posNeg":1241079,"dataQualityGrade":null,"deathIncrease":8,"hospitalizedIncrease":0,"hash":"cabb8c0dac6288344d53485e2d376783b7287d7e","commercialScore":0,"negativeRegularScore":0,"negativeScore":0,"positiveScore":0,"score":0,"grade":""},{"date":20210126,"state":"IA","positive":263852,"probableCases":null,"negative":974630,"pending":null,"totalTestResultsSource":"posNeg","totalTestResults":1238482,"hospitalizedCurrently":415,"hospitalizedCumulative":null,"inIcuCurrently":78,"inIcuCumulative":null,"onVentilatorCurrently":37,"onVentilatorCumulative":null,"recovered":276465,"lastUpdateEt":"1/26/2021 00:00","dateModified":"2021-01-26T00:00:00Z","checkTimeEt":"01/25 19:00","death":4492,"hospitalized":null,"hospitalizedDischarged":null,"dateChecked":"2021-01-26T00:00:00Z","totalTestsViral":2444329,"positiveTestsViral":285750,"negativeTestsViral":2146053,"positiveCasesViral":263852,"deathConfirmed":null,"deathProbable":null,"totalTestEncountersViral":null,"totalTestsPeopleViral":1240816,"totalTestsAntibody":null,"positiveTestsAntibody":null,"negativeTestsAntibody":null,"totalTestsPeopleAntibody":98439,"positiveTestsPeopleAntibody":13016,"negativeTestsPeopleAntibody":85379,"totalTestsPeopleAntigen":212097,"positiveTestsPeopleAntigen":50559,"totalTestsAntigen":1084132,"positiveTestsAntigen":53762,"fips":"19","positiveIncrease":591,"negativeIncrease":1367,"total":1238482,"totalTestResultsIncrease":1958,"posNeg":1238482,"dataQualityGrade":null,"deathIncrease":4,"hospitalizedIncrease":0,"hash":"1adc2c69743ecf897cbdbe873bb6424395955866","commercialScore":0,"negativeRegularScore":0,"negativeScore":0,"positiveScore":0,"score":0,"grade":""},{"date":20210125,"state":"IA","positive":263261,"probableCases":null,"negative":973263,"pending":null,"totalTestResultsSource":"posNeg","totalTestResults":1236524,"hospitalizedCurrently":383,"hospitalizedCumulative":null,"inIcuCurrently":78,"inIcuCumulative":null,"onVentilatorCurrently":37,"onVentilatorCumulative":null,"recovered":273751,"lastUpdateEt":"1/25/2021 00:00","dateModified":"2021-01-25T00:00:00Z","checkTimeEt":"01/24 19:00","death":4488,"hospitalized":null,"hospitalizedDischarged":null,"dateChecked":"2021-01-25T00:00:00Z","totalTestsViral":2437176,"positiveTestsViral":285129,"negativeTestsViral":2139510,"positiveCasesViral":263261,"deathConfirmed":null,"deathProbable":null,"totalTestEncountersViral":null,"totalTestsPeopleViral":1238857,"totalTestsAntibody":null,"positiveTestsAntibody":null,"negativeTestsAntibody":null,"totalTestsPeopleAntibody":98127,"positiveTestsPeopleAntibody":12898,"negativeTestsPeopleAntibody":85185,"totalTestsPeopleAntigen":210952,"positiveTestsPeopleAntigen":50254,"totalTestsAntigen":1070588,"positiveTestsAntigen":53417,"fips":"19","positiveIncrease":401,"negativeIncrease":1064,"total":1236524,"totalTestResultsIncrease":1465,"posNeg":1236524,"dataQualityGrade":null,"deathIncrease":0,"hospitalizedIncrease":0,"hash":"a58405d3a125c8756b93d8948fab8a440038040c","commercialScore":0,"negativeRegularScore":0,"negativeScore":0,"positiveScore":0,"score":0,"grade":""},{"date":20210124,"state":"IA","positive":262860,"probableCases":null,"negative":972199,"pending":null,"totalTestResultsSource":"posNeg","totalTestResults":1235059,"hospitalizedCurrently":382,"hospitalizedCumulative":null,"inIcuCurrently":79,"inIcuCumulative":null,"onVentilatorCurrently":36,"onVentilatorCumulative":null,"recovered":274101,"lastUpdateEt":"1/24/2021 00:00","dateModified":"2021-01-24T00:00:00Z","checkTimeEt":"01/23 19:00","death":4488,"hospitalized":null,"hospitalizedDischarged":null,"dateChecked":"2021-01-24T00:00:00Z","totalTestsViral":2432803,"positiveTestsViral":284695,"negativeTestsViral":2135604,"positiveCasesViral":262860,"deathConfirmed":null,"deathProbable":null,"totalTestEncountersViral":null,"totalTestsPeopleViral":1237393,"totalTestsAntibody":null,"positiveTestsAntibody":null,"negativeTestsAntibody":null,"totalTestsPeopleAntibody":97948,"positiveTestsPeopleAntibody":12811,"negativeTestsPeopleAntibody":85093,"totalTestsPeopleAntigen":210197,"positiveTestsPeopleAntigen":50072,"totalTestsAntigen":1067363,"positiveTestsAntigen":53243,"fips":"19","positiveIncrease":711,"negativeIncrease":1885,"total":1235059,"totalTestResultsIncrease":2596,"posNeg":1235059,"dataQualityGrade":null,"deathIncrease":1,"hospitalizedIncrease":0,"hash":"0b5c02c78bcbaca3e656b39b3f49a65c637d25ee","commercialScore":0,"negativeRegularScore":0,"negativeScore":0,"positiveScore":0,"score":0,"grade":""},{"date":20210123,"state":"IA","positive":262149,"probableCases":null,"negative":970314,"pending":null,"totalTestResultsSource":"posNeg","totalTestResults":1232463,"hospitalizedCurrently":419,"hospitalizedCumulative":null,"inIcuCurrently":76,"inIcuCumulative":null,"onVentilatorCurrently":38,"onVentilatorCumulative":null,"recovered":273189,"lastUpdateEt":"1/23/2021 00:00","dateModified":"2021-01-23T00:00:00Z","checkTimeEt":"01/22 19:00","death":4487,"hospitalized":null,"hospitalizedDischarged":null,"dateChecked":"2021-01-23T00:00:00Z","totalTestsViral":2425317,"positiveTestsViral":283898,"negativeTestsViral":2129046,"positiveCasesViral":262149,"deathConfirmed":null,"deathProbable":null,"totalTestEncountersViral":null,"totalTestsPeopleViral":1234793,"totalTestsAntibody":null,"positiveTestsAntibody":null,"negativeTestsAntibody":null,"totalTestsPeopleAntibody":96814,"positiveTestsPeopleAntibody":12532,"negativeTestsPeopleAntibody":84239,"totalTestsPeopleAntigen":210043,"positiveTestsPeopleAntigen":49935,"totalTestsAntigen":1065393,"positiveTestsAntigen":53102,"fips":"19","positiveIncrease":956,"negativeIncrease":2393,"total":1232463,"totalTestResultsIncrease":3349,"posNeg":1232463,"dataQualityGrade":null,"deathIncrease":9,"hospitalizedIncrease":0,"hash":"7598ef4ce4c0f7e3f24299f085ff789947b34a43","commercialScore":0,"negativeRegularScore":0,"negativeScore":0,"positiveScore":0,"score":0,"grade":""},{"date":20210122,"state":"IA","positive":261193,"probableCases":null,"negative":967921,"pending":null,"totalTestResultsSource":"posNeg","totalTestResults":1229114,"hospitalizedCurrently":450,"hospitalizedCumulative":null,"inIcuCurrently":89,"inIcuCumulative":null,"onVentilatorCurrently":34,"onVentilatorCumulative":null,"recovered":273035,"lastUpdateEt":"1/22/2021 00:00","dateModified":"2021-01-22T00:00:00Z","checkTimeEt":"01/21 19:00","death":4478,"hospitalized":null,"hospitalizedDischarged":null,"dateChecked":"2021-01-22T00:00:00Z","totalTestsViral":2414589,"positiveTestsViral":282868,"negativeTestsViral":2119392,"positiveCasesViral":261193,"deathConfirmed":null,"deathProbable":null,"totalTestEncountersViral":null,"totalTestsPeopleViral":1231449,"totalTestsAntibody":null,"positiveTestsAntibody":null,"negativeTestsAntibody":null,"totalTestsPeopleAntibody":96432,"positiveTestsPeopleAntibody":12380,"negativeTestsPeopleAntibody":84010,"totalTestsPeopleAntigen":209236,"positiveTestsPeopleAntigen":49742,"totalTestsAntigen":1055116,"positiveTestsAntigen":52883,"fips":"19","positiveIncrease":966,"negativeIncrease":1797,"total":1229114,"totalTestResultsIncrease":2763,"posNeg":1229114,"dataQualityGrade":null,"deathIncrease":33,"hospitalizedIncrease":0,"hash":"8282cf8d681857d33d8541b242adc25073bfd9aa","commercialScore":0,"negativeRegularScore":0,"negativeScore":0,"positiveScore":0,"score":0,"grade":""},{"date":20210121,"state":"IA","positive":260227,"probableCases":null,"negative":966124,"pending":null,"totalTestResultsSource":"posNeg","totalTestResults":1226351,"hospitalizedCurrently":474,"hospitalizedCumulative":null,"inIcuCurrently":86,"inIcuCumulative":null,"onVentilatorCurrently":36,"onVentilatorCumulative":null,"recovered":272004,"lastUpdateEt":"1/21/2021 00:00","dateModified":"2021-01-21T00:00:00Z","checkTimeEt":"01/20 19:00","death":4445,"hospitalized":null,"hospitalizedDischarged":null,"dateChecked":"2021-01-21T00:00:00Z","totalTestsViral":2403859,"positiveTestsViral":281824,"negativeTestsViral":2109809,"positiveCasesViral":260227,"deathConfirmed":null,"deathProbable":null,"totalTestEncountersViral":null,"totalTestsPeopleViral":1228679,"totalTestsAntibody":null,"positiveTestsAntibody":null,"negativeTestsAntibody":null,"totalTestsPeopleAntibody":95501,"positiveTestsPeopleAntibody":12076,"negativeTestsPeopleAntibody":83383,"totalTestsPeopleAntigen":207629,"positiveTestsPeopleAntigen":49373,"totalTestsAntigen":1043078,"positiveTestsAntigen":52478,"fips":"19","positiveIncrease":1362,"negativeIncrease":2526,"total":1226351,"totalTestResultsIncrease":3888,"posNeg":1226351,"dataQualityGrade":null,"deathIncrease":51,"hospitalizedIncrease":0,"hash":"5d93e1aacfbffb761b43c9533e262a4b83a76c17","commercialScore":0,"negativeRegularScore":0,"negativeScore":0,"positiveScore":0,"score":0,"grade":""},{"date":20210120,"state":"IA","positive":258865,"probableCases":null,"negative":963598,"pending":null,"totalTestResultsSource":"posNeg","totalTestResults":1222463,"hospitalizedCurrently":474,"hospitalizedCumulative":null,"inIcuCurrently":86,"inIcuCumulative":null,"onVentilatorCurrently":36,"onVentilatorCumulative":null,"recovered":270625,"lastUpdateEt":"1/20/2021 00:00","dateModified":"2021-01-20T00:00:00Z","checkTimeEt":"01/19 19:00","death":4394,"hospitalized":null,"hospitalizedDischarged":null,"dateChecked":"2021-01-20T00:00:00Z","totalTestsViral":2389856,"positiveTestsViral":280272,"negativeTestsViral":2097416,"positiveCasesViral":258865,"deathConfirmed":null,"deathProbable":null,"totalTestEncountersViral":null,"totalTestsPeopleViral":1224789,"totalTestsAntibody":null,"positiveTestsAntibody":null,"negativeTestsAntibody":null,"totalTestsPeopleAntibody":93702,"positiveTestsPeopleAntibody":11562,"negativeTestsPeopleAntibody":82100,"totalTestsPeopleAntigen":206525,"positiveTestsPeopleAntigen":49043,"totalTestsAntigen":1034330,"positiveTestsAntigen":52151,"fips":"19","positiveIncrease":717,"negativeIncrease":1295,"total":1222463,"totalTestResultsIncrease":2012,"posNeg":1222463,"dataQualityGrade":null,"deathIncrease":62,"hospitalizedIncrease":0,"hash":"8230c2060754859cc20e97489adaddf2390cf22c","commercialScore":0,"negativeRegularScore":0,"negativeScore":0,"positiveScore":0,"score":0,"grade":""},{"date":20210119,"state":"IA","positive":258148,"probableCases":null,"negative":962303,"pending":null,"totalTestResultsSource":"posNeg","totalTestResults":1220451,"hospitalizedCurrently":490,"hospitalizedCumulative":null,"inIcuCurrently":85,"inIcuCumulative":null,"onVentilatorCurrently":36,"onVentilatorCumulative":null,"recovered":268931,"lastUpdateEt":"1/19/2021 00:00","dateModified":"2021-01-19T00:00:00Z","checkTimeEt":"01/18 19:00","death":4332,"hospitalized":null,"hospitalizedDischarged":null,"dateChecked":"2021-01-19T00:00:00Z","totalTestsViral":2381724,"positiveTestsViral":279548,"negativeTestsViral":2090071,"positiveCasesViral":258148,"deathConfirmed":null,"deathProbable":null,"totalTestEncountersViral":null,"totalTestsPeopleViral":1222770,"totalTestsAntibody":null,"positiveTestsAntibody":null,"negativeTestsAntibody":null,"totalTestsPeopleAntibody":91926,"positiveTestsPeopleAntibody":11104,"negativeTestsPeopleAntibody":80782,"totalTestsPeopleAntigen":204635,"positiveTestsPeopleAntigen":48531,"totalTestsAntigen":1022228,"positiveTestsAntigen":51620,"fips":"19","positiveIncrease":717,"negativeIncrease":1309,"total":1220451,"totalTestResultsIncrease":2026,"posNeg":1220451,"dataQualityGrade":null,"deathIncrease":8,"hospitalizedIncrease":0,"hash":"aaca89996cb9386d6a273b5397e70caa2951184b","commercialScore":0,"negativeRegularScore":0,"negativeScore":0,"positiveScore":0,"score":0,"grade":""},{"date":20210118,"state":"IA","positive":257431,"probableCases":null,"negative":960994,"pending":null,"totalTestResultsSource":"posNeg","totalTestResults":1218425,"hospitalizedCurrently":483,"hospitalizedCumulative":null,"inIcuCurrently":84,"inIcuCumulative":null,"onVentilatorCurrently":38,"onVentilatorCumulative":null,"recovered":266453,"lastUpdateEt":"1/18/2021 00:00","dateModified":"2021-01-18T00:00:00Z","checkTimeEt":"01/17 19:00","death":4324,"hospitalized":null,"hospitalizedDischarged":null,"dateChecked":"2021-01-18T00:00:00Z","totalTestsViral":2374176,"positiveTestsViral":278762,"negativeTestsViral":2083330,"positiveCasesViral":257431,"deathConfirmed":null,"deathProbable":null,"totalTestEncountersViral":null,"totalTestsPeopleViral":1220747,"totalTestsAntibody":null,"positiveTestsAntibody":null,"negativeTestsAntibody":null,"totalTestsPeopleAntibody":91611,"positiveTestsPeopleAntibody":10980,"negativeTestsPeopleAntibody":80591,"totalTestsPeopleAntigen":203355,"positiveTestsPeopleAntigen":48191,"totalTestsAntigen":1007063,"positiveTestsAntigen":51266,"fips":"19","positiveIncrease":480,"negativeIncrease":1252,"total":1218425,"totalTestResultsIncrease":1732,"posNeg":1218425,"dataQualityGrade":null,"deathIncrease":1,"hospitalizedIncrease":0,"hash":"95a36c7654d6fa48cbf038f2866abb4fe1418c58","commercialScore":0,"negativeRegularScore":0,"negativeScore":0,"positiveScore":0,"score":0,"grade":""},{"date":20210117,"state":"IA","positive":256951,"probableCases":null,"negative":959742,"pending":null,"totalTestResultsSource":"posNeg","totalTestResults":1216693,"hospitalizedCurrently":474,"hospitalizedCumulative":null,"inIcuCurrently":93,"inIcuCumulative":null,"onVentilatorCurrently":40,"onVentilatorCumulative":null,"recovered":265923,"lastUpdateEt":"1/17/2021 00:00","dateModified":"2021-01-17T00:00:00Z","checkTimeEt":"01/16 19:00","death":4323,"hospitalized":null,"hospitalizedDischarged":null,"dateChecked":"2021-01-17T00:00:00Z","totalTestsViral":2369373,"positiveTestsViral":278288,"negativeTestsViral":2079011,"positiveCasesViral":256951,"deathConfirmed":null,"deathProbable":null,"totalTestEncountersViral":null,"totalTestsPeopleViral":1219011,"totalTestsAntibody":null,"positiveTestsAntibody":null,"negativeTestsAntibody":null,"totalTestsPeopleAntibody":91585,"positiveTestsPeopleAntibody":10967,"negativeTestsPeopleAntibody":80578,"totalTestsPeopleAntigen":202610,"positiveTestsPeopleAntigen":47954,"totalTestsAntigen":1004137,"positiveTestsAntigen":50995,"fips":"19","positiveIncrease":548,"negativeIncrease":1416,"total":1216693,"totalTestResultsIncrease":1964,"posNeg":1216693,"dataQualityGrade":null,"deathIncrease":2,"hospitalizedIncrease":0,"hash":"1bbdad1fc103f5c595bef4f79747f63f0d51eb42","commercialScore":0,"negativeRegularScore":0,"negativeScore":0,"positiveScore":0,"score":0,"grade":""},{"date":20210116,"state":"IA","positive":256403,"probableCases":null,"negative":958326,"pending":null,"totalTestResultsSource":"posNeg","totalTestResults":1214729,"hospitalizedCurrently":505,"hospitalizedCumulative":null,"inIcuCurrently":91,"inIcuCumulative":null,"onVentilatorCurrently":39,"onVentilatorCumulative":null,"recovered":265320,"lastUpdateEt":"1/16/2021 00:00","dateModified":"2021-01-16T00:00:00Z","checkTimeEt":"01/15 19:00","death":4321,"hospitalized":null,"hospitalizedDischarged":null,"dateChecked":"2021-01-16T00:00:00Z","totalTestsViral":2364055,"positiveTestsViral":277635,"negativeTestsViral":2074377,"positiveCasesViral":256403,"deathConfirmed":null,"deathProbable":null,"totalTestEncountersViral":null,"totalTestsPeopleViral":1217044,"totalTestsAntibody":null,"positiveTestsAntibody":null,"negativeTestsAntibody":null,"totalTestsPeopleAntibody":91534,"positiveTestsPeopleAntibody":10946,"negativeTestsPeopleAntibody":80548,"totalTestsPeopleAntigen":202381,"positiveTestsPeopleAntigen":47868,"totalTestsAntigen":1002439,"positiveTestsAntigen":50909,"fips":"19","positiveIncrease":915,"negativeIncrease":1693,"total":1214729,"totalTestResultsIncrease":2608,"posNeg":1214729,"dataQualityGrade":null,"deathIncrease":64,"hospitalizedIncrease":0,"hash":"4492cec1509ef0960aa8f869cc09a39f59e4793f","commercialScore":0,"negativeRegularScore":0,"negativeScore":0,"positiveScore":0,"score":0,"grade":""},{"date":20210115,"state":"IA","positive":255488,"probableCases":null,"negative":956633,"pending":null,"totalTestResultsSource":"posNeg","totalTestResults":1212121,"hospitalizedCurrently":513,"hospitalizedCumulative":null,"inIcuCurrently":91,"inIcuCumulative":null,"onVentilatorCurrently":35,"onVentilatorCumulative":null,"recovered":263844,"lastUpdateEt":"1/15/2021 00:00","dateModified":"2021-01-15T00:00:00Z","checkTimeEt":"01/14 19:00","death":4257,"hospitalized":null,"hospitalizedDischarged":null,"dateChecked":"2021-01-15T00:00:00Z","totalTestsViral":2355205,"positiveTestsViral":276641,"negativeTestsViral":2066591,"positiveCasesViral":255488,"deathConfirmed":null,"deathProbable":null,"totalTestEncountersViral":null,"totalTestsPeopleViral":1214432,"totalTestsAntibody":null,"positiveTestsAntibody":null,"negativeTestsAntibody":null,"totalTestsPeopleAntibody":91226,"positiveTestsPeopleAntibody":10797,"negativeTestsPeopleAntibody":80389,"totalTestsPeopleAntigen":201353,"positiveTestsPeopleAntigen":47623,"totalTestsAntigen":993311,"positiveTestsAntigen":50653,"fips":"19","positiveIncrease":1035,"negativeIncrease":2208,"total":1212121,"totalTestResultsIncrease":3243,"posNeg":1212121,"dataQualityGrade":null,"deathIncrease":6,"hospitalizedIncrease":0,"hash":"78e29130aa2a8d17ddd41f61ebebd207b37db7f7","commercialScore":0,"negativeRegularScore":0,"negativeScore":0,"positiveScore":0,"score":0,"grade":""},{"date":20210114,"state":"IA","positive":254453,"probableCases":null,"negative":954425,"pending":null,"totalTestResultsSource":"posNeg","totalTestResults":1208878,"hospitalizedCurrently":532,"hospitalizedCumulative":null,"inIcuCurrently":85,"inIcuCumulative":null,"onVentilatorCurrently":35,"onVentilatorCumulative":null,"recovered":262266,"lastUpdateEt":"1/14/2021 00:00","dateModified":"2021-01-14T00:00:00Z","checkTimeEt":"01/13 19:00","death":4251,"hospitalized":null,"hospitalizedDischarged":null,"dateChecked":"2021-01-14T00:00:00Z","totalTestsViral":2343078,"positiveTestsViral":275473,"negativeTestsViral":2055687,"positiveCasesViral":254453,"deathConfirmed":null,"deathProbable":null,"totalTestEncountersViral":null,"totalTestsPeopleViral":1211182,"totalTestsAntibody":null,"positiveTestsAntibody":null,"negativeTestsAntibody":null,"totalTestsPeopleAntibody":90921,"positiveTestsPeopleAntibody":10623,"negativeTestsPeopleAntibody":80258,"totalTestsPeopleAntigen":200217,"positiveTestsPeopleAntigen":47353,"totalTestsAntigen":980719,"positiveTestsAntigen":50390,"fips":"19","positiveIncrease":1146,"negativeIncrease":2510,"total":1208878,"totalTestResultsIncrease":3656,"posNeg":1208878,"dataQualityGrade":null,"deathIncrease":19,"hospitalizedIncrease":0,"hash":"85bad047af6c6f7bb5310d31a12077d4a7ad16cd","commercialScore":0,"negativeRegularScore":0,"negativeScore":0,"positiveScore":0,"score":0,"grade":""},{"date":20210113,"state":"IA","positive":253307,"probableCases":null,"negative":951915,"pending":null,"totalTestResultsSource":"posNeg","totalTestResults":1205222,"hospitalizedCurrently":516,"hospitalizedCumulative":null,"inIcuCurrently":79,"inIcuCumulative":null,"onVentilatorCurrently":30,"onVentilatorCumulative":null,"recovered":260557,"lastUpdateEt":"1/13/2021 00:00","dateModified":"2021-01-13T00:00:00Z","checkTimeEt":"01/12 19:00","death":4232,"hospitalized":null,"hospitalizedDischarged":null,"dateChecked":"2021-01-13T00:00:00Z","totalTestsViral":2331547,"positiveTestsViral":274250,"negativeTestsViral":2045503,"positiveCasesViral":253307,"deathConfirmed":null,"deathProbable":null,"totalTestEncountersViral":null,"totalTestsPeopleViral":1207498,"totalTestsAntibody":null,"positiveTestsAntibody":null,"negativeTestsAntibody":null,"totalTestsPeopleAntibody":90419,"positiveTestsPeopleAntibody":10446,"negativeTestsPeopleAntibody":79933,"totalTestsPeopleAntigen":198901,"positiveTestsPeopleAntigen":47012,"totalTestsAntigen":972075,"positiveTestsAntigen":50025,"fips":"19","positiveIncrease":1441,"negativeIncrease":2310,"total":1205222,"totalTestResultsIncrease":3751,"posNeg":1205222,"dataQualityGrade":null,"deathIncrease":10,"hospitalizedIncrease":0,"hash":"e145e256e9caaf46192212d265aa9dab88f6c20d","commercialScore":0,"negativeRegularScore":0,"negativeScore":0,"positiveScore":0,"score":0,"grade":""},{"date":20210112,"state":"IA","positive":251866,"probableCases":null,"negative":949605,"pending":null,"totalTestResultsSource":"posNeg","totalTestResults":1201471,"hospitalizedCurrently":552,"hospitalizedCumulative":null,"inIcuCurrently":90,"inIcuCumulative":null,"onVentilatorCurrently":30,"onVentilatorCumulative":null,"recovered":258758,"lastUpdateEt":"1/12/2021 00:00","dateModified":"2021-01-12T00:00:00Z","checkTimeEt":"01/11 19:00","death":4222,"hospitalized":null,"hospitalizedDischarged":null,"dateChecked":"2021-01-12T00:00:00Z","totalTestsViral":2319258,"positiveTestsViral":272707,"negativeTestsViral":2034801,"positiveCasesViral":251866,"deathConfirmed":null,"deathProbable":null,"totalTestEncountersViral":null,"totalTestsPeopleViral":1203745,"totalTestsAntibody":null,"positiveTestsAntibody":null,"negativeTestsAntibody":null,"totalTestsPeopleAntibody":90166,"positiveTestsPeopleAntibody":10320,"negativeTestsPeopleAntibody":79806,"totalTestsPeopleAntigen":197154,"positiveTestsPeopleAntigen":46529,"totalTestsAntigen":960489,"positiveTestsAntigen":49499,"fips":"19","positiveIncrease":637,"negativeIncrease":1075,"total":1201471,"totalTestResultsIncrease":1712,"posNeg":1201471,"dataQualityGrade":null,"deathIncrease":83,"hospitalizedIncrease":0,"hash":"c7ef4f53fe85256e2216468acdea2fc7be9ea110","commercialScore":0,"negativeRegularScore":0,"negativeScore":0,"positiveScore":0,"score":0,"grade":""},{"date":20210111,"state":"IA","positive":251229,"probableCases":null,"negative":948530,"pending":null,"totalTestResultsSource":"posNeg","totalTestResults":1199759,"hospitalizedCurrently":555,"hospitalizedCumulative":null,"inIcuCurrently":96,"inIcuCumulative":null,"onVentilatorCurrently":36,"onVentilatorCumulative":null,"recovered":256151,"lastUpdateEt":"1/10/2021 00:00","dateModified":"2021-01-10T00:00:00Z","checkTimeEt":"01/09 19:00","death":4139,"hospitalized":null,"hospitalizedDischarged":null,"dateChecked":"2021-01-10T00:00:00Z","totalTestsViral":2312086,"positiveTestsViral":272000,"negativeTestsViral":2028374,"positiveCasesViral":251229,"deathConfirmed":null,"deathProbable":null,"totalTestEncountersViral":null,"totalTestsPeopleViral":1202038,"totalTestsAntibody":null,"positiveTestsAntibody":null,"negativeTestsAntibody":null,"totalTestsPeopleAntibody":89689,"positiveTestsPeopleAntibody":10106,"negativeTestsPeopleAntibody":79543,"totalTestsPeopleAntigen":195523,"positiveTestsPeopleAntigen":46066,"totalTestsAntigen":945534,"positiveTestsAntigen":49008,"fips":"19","positiveIncrease":476,"negativeIncrease":992,"total":1199759,"totalTestResultsIncrease":1468,"posNeg":1199759,"dataQualityGrade":null,"deathIncrease":1,"hospitalizedIncrease":0,"hash":"0a921ec7fc4a646a99a5b5476ab3cc198e082b64","commercialScore":0,"negativeRegularScore":0,"negativeScore":0,"positiveScore":0,"score":0,"grade":""},{"date":20210110,"state":"IA","positive":250753,"probableCases":null,"negative":947538,"pending":null,"totalTestResultsSource":"posNeg","totalTestResults":1198291,"hospitalizedCurrently":541,"hospitalizedCumulative":null,"inIcuCurrently":105,"inIcuCumulative":null,"onVentilatorCurrently":41,"onVentilatorCumulative":null,"recovered":255593,"lastUpdateEt":"1/10/2021 00:00","dateModified":"2021-01-10T00:00:00Z","checkTimeEt":"01/09 19:00","death":4138,"hospitalized":null,"hospitalizedDischarged":null,"dateChecked":"2021-01-10T00:00:00Z","totalTestsViral":2307113,"positiveTestsViral":271514,"negativeTestsViral":2023893,"positiveCasesViral":250753,"deathConfirmed":null,"deathProbable":null,"totalTestEncountersViral":null,"totalTestsPeopleViral":1200578,"totalTestsAntibody":null,"positiveTestsAntibody":null,"negativeTestsAntibody":null,"totalTestsPeopleAntibody":89582,"positiveTestsPeopleAntibody":10043,"negativeTestsPeopleAntibody":79499,"totalTestsPeopleAntigen":194313,"positiveTestsPeopleAntigen":45727,"totalTestsAntigen":941644,"positiveTestsAntigen":48638,"fips":"19","positiveIncrease":940,"negativeIncrease":1815,"total":1198291,"totalTestResultsIncrease":2755,"posNeg":1198291,"dataQualityGrade":null,"deathIncrease":11,"hospitalizedIncrease":0,"hash":"16d715f412ce5f3a5e4fb904575ac848be39371e","commercialScore":0,"negativeRegularScore":0,"negativeScore":0,"positiveScore":0,"score":0,"grade":""},{"date":20210109,"state":"IA","positive":249813,"probableCases":null,"negative":945723,"pending":null,"totalTestResultsSource":"posNeg","totalTestResults":1195536,"hospitalizedCurrently":549,"hospitalizedCumulative":null,"inIcuCurrently":110,"inIcuCumulative":null,"onVentilatorCurrently":47,"onVentilatorCumulative":null,"recovered":255103,"lastUpdateEt":"1/9/2021 00:00","dateModified":"2021-01-09T00:00:00Z","checkTimeEt":"01/08 19:00","death":4127,"hospitalized":null,"hospitalizedDischarged":null,"dateChecked":"2021-01-09T00:00:00Z","totalTestsViral":2299426,"positiveTestsViral":270502,"negativeTestsViral":2017300,"positiveCasesViral":249813,"deathConfirmed":null,"deathProbable":null,"totalTestEncountersViral":null,"totalTestsPeopleViral":1197812,"totalTestsAntibody":null,"positiveTestsAntibody":null,"negativeTestsAntibody":null,"totalTestsPeopleAntibody":89538,"positiveTestsPeopleAntibody":10029,"negativeTestsPeopleAntibody":79469,"totalTestsPeopleAntigen":193740,"positiveTestsPeopleAntigen":45539,"totalTestsAntigen":939073,"positiveTestsAntigen":48442,"fips":"19","positiveIncrease":1072,"negativeIncrease":1983,"total":1195536,"totalTestResultsIncrease":3055,"posNeg":1195536,"dataQualityGrade":null,"deathIncrease":3,"hospitalizedIncrease":0,"hash":"8c1c4db20b248d5e5b2a4c4c7e8f3e56d028f270","commercialScore":0,"negativeRegularScore":0,"negativeScore":0,"positiveScore":0,"score":0,"grade":""},{"date":20210108,"state":"IA","positive":248741,"probableCases":null,"negative":943740,"pending":null,"totalTestResultsSource":"posNeg","totalTestResults":1192481,"hospitalizedCurrently":579,"hospitalizedCumulative":null,"inIcuCurrently":108,"inIcuCumulative":null,"onVentilatorCurrently":51,"onVentilatorCumulative":null,"recovered":253501,"lastUpdateEt":"1/8/2021 00:00","dateModified":"2021-01-08T00:00:00Z","checkTimeEt":"01/07 19:00","death":4124,"hospitalized":null,"hospitalizedDischarged":null,"dateChecked":"2021-01-08T00:00:00Z","totalTestsViral":2289559,"positiveTestsViral":269326,"negativeTestsViral":2008682,"positiveCasesViral":248741,"deathConfirmed":null,"deathProbable":null,"totalTestEncountersViral":null,"totalTestsPeopleViral":1194751,"totalTestsAntibody":null,"positiveTestsAntibody":null,"negativeTestsAntibody":null,"totalTestsPeopleAntibody":89127,"positiveTestsPeopleAntibody":9833,"negativeTestsPeopleAntibody":79254,"totalTestsPeopleAntigen":192781,"positiveTestsPeopleAntigen":45266,"totalTestsAntigen":928678,"positiveTestsAntigen":48160,"fips":"19","positiveIncrease":1608,"negativeIncrease":1965,"total":1192481,"totalTestResultsIncrease":3573,"posNeg":1192481,"dataQualityGrade":null,"deathIncrease":59,"hospitalizedIncrease":0,"hash":"05743e197885644dfdd36b0f2ae3f507b092a256","commercialScore":0,"negativeRegularScore":0,"negativeScore":0,"positiveScore":0,"score":0,"grade":""},{"date":20210107,"state":"IA","positive":247133,"probableCases":null,"negative":941775,"pending":null,"totalTestResultsSource":"posNeg","totalTestResults":1188908,"hospitalizedCurrently":613,"hospitalizedCumulative":null,"inIcuCurrently":119,"inIcuCumulative":null,"onVentilatorCurrently":52,"onVentilatorCumulative":null,"recovered":251659,"lastUpdateEt":"1/7/2021 00:00","dateModified":"2021-01-07T00:00:00Z","checkTimeEt":"01/06 19:00","death":4065,"hospitalized":null,"hospitalizedDischarged":null,"dateChecked":"2021-01-07T00:00:00Z","totalTestsViral":2275201,"positiveTestsViral":267595,"negativeTestsViral":1996135,"positiveCasesViral":247133,"deathConfirmed":null,"deathProbable":null,"totalTestEncountersViral":null,"totalTestsPeopleViral":1191162,"totalTestsAntibody":null,"positiveTestsAntibody":null,"negativeTestsAntibody":null,"totalTestsPeopleAntibody":88724,"positiveTestsPeopleAntibody":9677,"negativeTestsPeopleAntibody":79007,"totalTestsPeopleAntigen":190342,"positiveTestsPeopleAntigen":44620,"totalTestsAntigen":913003,"positiveTestsAntigen":47470,"fips":"19","positiveIncrease":1294,"negativeIncrease":2136,"total":1188908,"totalTestResultsIncrease":3430,"posNeg":1188908,"dataQualityGrade":null,"deathIncrease":5,"hospitalizedIncrease":0,"hash":"7b41da3b35f9fdc3b78a38d26a41ad1cb87fdfec","commercialScore":0,"negativeRegularScore":0,"negativeScore":0,"positiveScore":0,"score":0,"grade":""},{"date":20210106,"state":"IA","positive":245839,"probableCases":null,"negative":939639,"pending":null,"totalTestResultsSource":"posNeg","totalTestResults":1185478,"hospitalizedCurrently":604,"hospitalizedCumulative":null,"inIcuCurrently":116,"inIcuCumulative":null,"onVentilatorCurrently":54,"onVentilatorCumulative":null,"recovered":249919,"lastUpdateEt":"1/6/2021 00:00","dateModified":"2021-01-06T00:00:00Z","checkTimeEt":"01/05 19:00","death":4060,"hospitalized":null,"hospitalizedDischarged":null,"dateChecked":"2021-01-06T00:00:00Z","totalTestsViral":2264494,"positiveTestsViral":266187,"negativeTestsViral":1986902,"positiveCasesViral":245839,"deathConfirmed":null,"deathProbable":null,"totalTestEncountersViral":null,"totalTestsPeopleViral":1187729,"totalTestsAntibody":null,"positiveTestsAntibody":null,"negativeTestsAntibody":null,"totalTestsPeopleAntibody":88267,"positiveTestsPeopleAntibody":9518,"negativeTestsPeopleAntibody":78709,"totalTestsPeopleAntigen":189129,"positiveTestsPeopleAntigen":44077,"totalTestsAntigen":904912,"positiveTestsAntigen":46889,"fips":"19","positiveIncrease":2010,"negativeIncrease":2224,"total":1185478,"totalTestResultsIncrease":4234,"posNeg":1185478,"dataQualityGrade":null,"deathIncrease":61,"hospitalizedIncrease":0,"hash":"6882e234374dfa18817e5a32e2b6de8a3a8f7e4b","commercialScore":0,"negativeRegularScore":0,"negativeScore":0,"positiveScore":0,"score":0,"grade":""},{"date":20210105,"state":"IA","positive":243829,"probableCases":null,"negative":937415,"pending":null,"totalTestResultsSource":"posNeg","totalTestResults":1181244,"hospitalizedCurrently":582,"hospitalizedCumulative":null,"inIcuCurrently":115,"inIcuCumulative":null,"onVentilatorCurrently":53,"onVentilatorCumulative":null,"recovered":247853,"lastUpdateEt":"1/5/2021 00:00","dateModified":"2021-01-05T00:00:00Z","checkTimeEt":"01/04 19:00","death":3999,"hospitalized":null,"hospitalizedDischarged":null,"dateChecked":"2021-01-05T00:00:00Z","totalTestsViral":2251081,"positiveTestsViral":263998,"negativeTestsViral":1975711,"positiveCasesViral":243829,"deathConfirmed":null,"deathProbable":null,"totalTestEncountersViral":null,"totalTestsPeopleViral":1183491,"totalTestsAntibody":null,"positiveTestsAntibody":null,"negativeTestsAntibody":null,"totalTestsPeopleAntibody":87760,"positiveTestsPeopleAntibody":9315,"negativeTestsPeopleAntibody":78405,"totalTestsPeopleAntigen":187445,"positiveTestsPeopleAntigen":43476,"totalTestsAntigen":894222,"positiveTestsAntigen":46281,"fips":"19","positiveIncrease":1021,"negativeIncrease":602,"total":1181244,"totalTestResultsIncrease":1623,"posNeg":1181244,"dataQualityGrade":null,"deathIncrease":7,"hospitalizedIncrease":0,"hash":"2f7d8501628c8523913f731bd99d6e2704e56c7a","commercialScore":0,"negativeRegularScore":0,"negativeScore":0,"positiveScore":0,"score":0,"grade":""},{"date":20210104,"state":"IA","positive":242808,"probableCases":null,"negative":936813,"pending":null,"totalTestResultsSource":"posNeg","totalTestResults":1179621,"hospitalizedCurrently":571,"hospitalizedCumulative":null,"inIcuCurrently":117,"inIcuCumulative":null,"onVentilatorCurrently":55,"onVentilatorCumulative":null,"recovered":244677,"lastUpdateEt":"1/4/2021 00:00","dateModified":"2021-01-04T00:00:00Z","checkTimeEt":"01/03 19:00","death":3992,"hospitalized":null,"hospitalizedDischarged":null,"dateChecked":"2021-01-04T00:00:00Z","totalTestsViral":2244098,"positiveTestsViral":262936,"negativeTestsViral":1969809,"positiveCasesViral":242808,"deathConfirmed":null,"deathProbable":null,"totalTestEncountersViral":null,"totalTestsPeopleViral":1181863,"totalTestsAntibody":null,"positiveTestsAntibody":null,"negativeTestsAntibody":null,"totalTestsPeopleAntibody":87255,"positiveTestsPeopleAntibody":9087,"negativeTestsPeopleAntibody":78128,"totalTestsPeopleAntigen":184968,"positiveTestsPeopleAntigen":42668,"totalTestsAntigen":875556,"positiveTestsAntigen":45458,"fips":"19","positiveIncrease":701,"negativeIncrease":824,"total":1179621,"totalTestResultsIncrease":1525,"posNeg":1179621,"dataQualityGrade":null,"deathIncrease":46,"hospitalizedIncrease":0,"hash":"c6524f0553eb219be9cea119d41e49c33a92108c","commercialScore":0,"negativeRegularScore":0,"negativeScore":0,"positiveScore":0,"score":0,"grade":""},{"date":20210103,"state":"IA","positive":242107,"probableCases":null,"negative":935989,"pending":null,"totalTestResultsSource":"posNeg","totalTestResults":1178096,"hospitalizedCurrently":577,"hospitalizedCumulative":null,"inIcuCurrently":120,"inIcuCumulative":null,"onVentilatorCurrently":52,"onVentilatorCumulative":null,"recovered":244021,"lastUpdateEt":"1/3/2021 00:00","dateModified":"2021-01-03T00:00:00Z","checkTimeEt":"01/02 19:00","death":3946,"hospitalized":null,"hospitalizedDischarged":null,"dateChecked":"2021-01-03T00:00:00Z","totalTestsViral":2239319,"positiveTestsViral":262206,"negativeTestsViral":1965775,"positiveCasesViral":242107,"deathConfirmed":null,"deathProbable":null,"totalTestEncountersViral":null,"totalTestsPeopleViral":1180337,"totalTestsAntibody":null,"positiveTestsAntibody":null,"negativeTestsAntibody":null,"totalTestsPeopleAntibody":87266,"positiveTestsPeopleAntibody":9083,"negativeTestsPeopleAntibody":78143,"totalTestsPeopleAntigen":184153,"positiveTestsPeopleAntigen":42273,"totalTestsAntigen":872129,"positiveTestsAntigen":45041,"fips":"19","positiveIncrease":865,"negativeIncrease":1311,"total":1178096,"totalTestResultsIncrease":2176,"posNeg":1178096,"dataQualityGrade":null,"deathIncrease":0,"hospitalizedIncrease":0,"hash":"44314652e1560de6c0c81a0066f82abc86a82765","commercialScore":0,"negativeRegularScore":0,"negativeScore":0,"positiveScore":0,"score":0,"grade":""},{"date":20210102,"state":"IA","positive":241242,"probableCases":null,"negative":934678,"pending":null,"totalTestResultsSource":"posNeg","totalTestResults":1175920,"hospitalizedCurrently":572,"hospitalizedCumulative":null,"inIcuCurrently":119,"inIcuCumulative":null,"onVentilatorCurrently":60,"onVentilatorCumulative":null,"recovered":243214,"lastUpdateEt":"1/2/2021 00:00","dateModified":"2021-01-02T00:00:00Z","checkTimeEt":"01/01 19:00","death":3946,"hospitalized":null,"hospitalizedDischarged":null,"dateChecked":"2021-01-02T00:00:00Z","totalTestsViral":2233594,"positiveTestsViral":261270,"negativeTestsViral":1960998,"positiveCasesViral":241242,"deathConfirmed":null,"deathProbable":null,"totalTestEncountersViral":null,"totalTestsPeopleViral":1178164,"totalTestsAntibody":null,"positiveTestsAntibody":null,"negativeTestsAntibody":null,"totalTestsPeopleAntibody":87211,"positiveTestsPeopleAntibody":9062,"negativeTestsPeopleAntibody":78109,"totalTestsPeopleAntigen":183907,"positiveTestsPeopleAntigen":42087,"totalTestsAntigen":870488,"positiveTestsAntigen":44837,"fips":"19","positiveIncrease":476,"negativeIncrease":1038,"total":1175920,"totalTestResultsIncrease":1514,"posNeg":1175920,"dataQualityGrade":null,"deathIncrease":48,"hospitalizedIncrease":0,"hash":"c1f0047d5c7f97497c523bb67615f13a10677569","commercialScore":0,"negativeRegularScore":0,"negativeScore":0,"positiveScore":0,"score":0,"grade":""},{"date":20210101,"state":"IA","positive":240766,"probableCases":null,"negative":933640,"pending":null,"totalTestResultsSource":"posNeg","totalTestResults":1174406,"hospitalizedCurrently":575,"hospitalizedCumulative":null,"inIcuCurrently":117,"inIcuCumulative":null,"onVentilatorCurrently":63,"onVentilatorCumulative":null,"recovered":241229,"lastUpdateEt":"1/1/2021 00:00","dateModified":"2021-01-01T00:00:00Z","checkTimeEt":"12/31 19:00","death":3898,"hospitalized":null,"hospitalizedDischarged":null,"dateChecked":"2021-01-01T00:00:00Z","totalTestsViral":2228904,"positiveTestsViral":260753,"negativeTestsViral":1956842,"positiveCasesViral":240766,"deathConfirmed":null,"deathProbable":null,"totalTestEncountersViral":null,"totalTestsPeopleViral":1176651,"totalTestsAntibody":null,"positiveTestsAntibody":null,"negativeTestsAntibody":null,"totalTestsPeopleAntibody":87174,"positiveTestsPeopleAntibody":9050,"negativeTestsPeopleAntibody":78084,"totalTestsPeopleAntigen":183464,"positiveTestsPeopleAntigen":41898,"totalTestsAntigen":867217,"positiveTestsAntigen":44622,"fips":"19","positiveIncrease":1593,"negativeIncrease":1594,"total":1174406,"totalTestResultsIncrease":3187,"posNeg":1174406,"dataQualityGrade":null,"deathIncrease":7,"hospitalizedIncrease":0,"hash":"57b2d9079026540fe23b72c8f82e0cd11bee7913","commercialScore":0,"negativeRegularScore":0,"negativeScore":0,"positiveScore":0,"score":0,"grade":""},{"date":20201231,"state":"IA","positive":239173,"probableCases":null,"negative":932046,"pending":null,"totalTestResultsSource":"posNeg","totalTestResults":1171219,"hospitalizedCurrently":600,"hospitalizedCumulative":null,"inIcuCurrently":134,"inIcuCumulative":null,"onVentilatorCurrently":69,"onVentilatorCumulative":null,"recovered":238982,"lastUpdateEt":"12/31/2020 00:00","dateModified":"2020-12-31T00:00:00Z","checkTimeEt":"12/30 19:00","death":3891,"hospitalized":null,"hospitalizedDischarged":null,"dateChecked":"2020-12-31T00:00:00Z","totalTestsViral":2218153,"positiveTestsViral":259105,"negativeTestsViral":1947769,"positiveCasesViral":239173,"deathConfirmed":null,"deathProbable":null,"totalTestEncountersViral":null,"totalTestsPeopleViral":1173467,"totalTestsAntibody":null,"positiveTestsAntibody":null,"negativeTestsAntibody":null,"totalTestsPeopleAntibody":86849,"positiveTestsPeopleAntibody":8910,"negativeTestsPeopleAntibody":77899,"totalTestsPeopleAntigen":182537,"positiveTestsPeopleAntigen":41484,"totalTestsAntigen":854563,"positiveTestsAntigen":44174,"fips":"19","positiveIncrease":1323,"negativeIncrease":1726,"total":1171219,"totalTestResultsIncrease":3049,"posNeg":1171219,"dataQualityGrade":null,"deathIncrease":69,"hospitalizedIncrease":0,"hash":"b7e0159fd848a37a7997c76a5e16b9c538b1e0bb","commercialScore":0,"negativeRegularScore":0,"negativeScore":0,"positiveScore":0,"score":0,"grade":""},{"date":20201230,"state":"IA","positive":237850,"probableCases":null,"negative":930320,"pending":null,"totalTestResultsSource":"posNeg","totalTestResults":1168170,"hospitalizedCurrently":612,"hospitalizedCumulative":null,"inIcuCurrently":127,"inIcuCumulative":null,"onVentilatorCurrently":66,"onVentilatorCumulative":null,"recovered":236666,"lastUpdateEt":"12/30/2020 00:00","dateModified":"2020-12-30T00:00:00Z","checkTimeEt":"12/29 19:00","death":3822,"hospitalized":null,"hospitalizedDischarged":null,"dateChecked":"2020-12-30T00:00:00Z","totalTestsViral":2207796,"positiveTestsViral":257617,"negativeTestsViral":1938935,"positiveCasesViral":237850,"deathConfirmed":null,"deathProbable":null,"totalTestEncountersViral":null,"totalTestsPeopleViral":1170415,"totalTestsAntibody":null,"positiveTestsAntibody":null,"negativeTestsAntibody":null,"totalTestsPeopleAntibody":86581,"positiveTestsPeopleAntibody":8760,"negativeTestsPeopleAntibody":77781,"totalTestsPeopleAntigen":181210,"positiveTestsPeopleAntigen":41084,"totalTestsAntigen":844222,"positiveTestsAntigen":43739,"fips":"19","positiveIncrease":1052,"negativeIncrease":1067,"total":1168170,"totalTestResultsIncrease":2119,"posNeg":1168170,"dataQualityGrade":null,"deathIncrease":10,"hospitalizedIncrease":0,"hash":"9db37138cadf7a3829f9458d14f7cc3de615be8a","commercialScore":0,"negativeRegularScore":0,"negativeScore":0,"positiveScore":0,"score":0,"grade":""},{"date":20201229,"state":"IA","positive":236798,"probableCases":null,"negative":929253,"pending":null,"totalTestResultsSource":"posNeg","totalTestResults":1166051,"hospitalizedCurrently":620,"hospitalizedCumulative":null,"inIcuCurrently":117,"inIcuCumulative":null,"onVentilatorCurrently":67,"onVentilatorCumulative":null,"recovered":233736,"lastUpdateEt":"12/29/2020 00:00","dateModified":"2020-12-29T00:00:00Z","checkTimeEt":"12/28 19:00","death":3812,"hospitalized":null,"hospitalizedDischarged":null,"dateChecked":"2020-12-29T00:00:00Z","totalTestsViral":2199346,"positiveTestsViral":256495,"negativeTestsViral":1931640,"positiveCasesViral":236798,"deathConfirmed":null,"deathProbable":null,"totalTestEncountersViral":null,"totalTestsPeopleViral":1168299,"totalTestsAntibody":null,"positiveTestsAntibody":null,"negativeTestsAntibody":null,"totalTestsPeopleAntibody":86217,"positiveTestsPeopleAntibody":8636,"negativeTestsPeopleAntibody":77541,"totalTestsPeopleAntigen":179118,"positiveTestsPeopleAntigen":40439,"totalTestsAntigen":832621,"positiveTestsAntigen":43076,"fips":"19","positiveIncrease":697,"negativeIncrease":519,"total":1166051,"totalTestResultsIncrease":1216,"posNeg":1166051,"dataQualityGrade":null,"deathIncrease":67,"hospitalizedIncrease":0,"hash":"ecbcd4daecb0614e25a0a4a53e2bb6e0b64aa24c","commercialScore":0,"negativeRegularScore":0,"negativeScore":0,"positiveScore":0,"score":0,"grade":""},{"date":20201228,"state":"IA","positive":236101,"probableCases":null,"negative":928734,"pending":null,"totalTestResultsSource":"posNeg","totalTestResults":1164835,"hospitalizedCurrently":586,"hospitalizedCumulative":null,"inIcuCurrently":111,"inIcuCumulative":null,"onVentilatorCurrently":60,"onVentilatorCumulative":null,"recovered":229624,"lastUpdateEt":"12/28/2020 00:00","dateModified":"2020-12-28T00:00:00Z","checkTimeEt":"12/27 19:00","death":3745,"hospitalized":null,"hospitalizedDischarged":null,"dateChecked":"2020-12-28T00:00:00Z","totalTestsViral":2193550,"positiveTestsViral":255770,"negativeTestsViral":1926606,"positiveCasesViral":236101,"deathConfirmed":null,"deathProbable":null,"totalTestEncountersViral":null,"totalTestsPeopleViral":1167075,"totalTestsAntibody":null,"positiveTestsAntibody":null,"negativeTestsAntibody":null,"totalTestsPeopleAntibody":85551,"positiveTestsPeopleAntibody":8330,"negativeTestsPeopleAntibody":77181,"totalTestsPeopleAntigen":177010,"positiveTestsPeopleAntigen":39755,"totalTestsAntigen":814235,"positiveTestsAntigen":42361,"fips":"19","positiveIncrease":562,"negativeIncrease":906,"total":1164835,"totalTestResultsIncrease":1468,"posNeg":1164835,"dataQualityGrade":null,"deathIncrease":0,"hospitalizedIncrease":0,"hash":"51b61642609b90a1346d675cdae1c6d3468cc008","commercialScore":0,"negativeRegularScore":0,"negativeScore":0,"positiveScore":0,"score":0,"grade":""},{"date":20201227,"state":"IA","positive":235539,"probableCases":null,"negative":927828,"pending":null,"totalTestResultsSource":"posNeg","totalTestResults":1163367,"hospitalizedCurrently":553,"hospitalizedCumulative":null,"inIcuCurrently":109,"inIcuCumulative":null,"onVentilatorCurrently":65,"onVentilatorCumulative":null,"recovered":228761,"lastUpdateEt":"12/27/2020 00:00","dateModified":"2020-12-27T00:00:00Z","checkTimeEt":"12/26 19:00","death":3745,"hospitalized":null,"hospitalizedDischarged":null,"dateChecked":"2020-12-27T00:00:00Z","totalTestsViral":2187609,"positiveTestsViral":255146,"negativeTestsViral":1921310,"positiveCasesViral":235539,"deathConfirmed":null,"deathProbable":null,"totalTestEncountersViral":null,"totalTestsPeopleViral":1165614,"totalTestsAntibody":null,"positiveTestsAntibody":null,"negativeTestsAntibody":null,"totalTestsPeopleAntibody":85561,"p