[{"date":20210307,"state":"ID","positive":172931,"probableCases":33057,"negative":505964,"pending":null,"totalTestResultsSource":"totalTestsPeopleViral","totalTestResults":645838,"hospitalizedCurrently":150,"hospitalizedCumulative":7184,"inIcuCurrently":33,"inIcuCumulative":1245,"onVentilatorCurrently":null,"onVentilatorCumulative":null,"recovered":96017,"lastUpdateEt":"3/6/2021 19:00","dateModified":"2021-03-06T19:00:00Z","checkTimeEt":"03/06 14:00","death":1879,"hospitalized":7184,"hospitalizedDischarged":null,"dateChecked":"2021-03-06T19:00:00Z","totalTestsViral":1103725,"positiveTestsViral":null,"negativeTestsViral":null,"positiveCasesViral":139874,"deathConfirmed":1652,"deathProbable":227,"totalTestEncountersViral":null,"totalTestsPeopleViral":645838,"totalTestsAntibody":null,"positiveTestsAntibody":null,"negativeTestsAntibody":null,"totalTestsPeopleAntibody":null,"positiveTestsPeopleAntibody":null,"negativeTestsPeopleAntibody":null,"totalTestsPeopleAntigen":null,"positiveTestsPeopleAntigen":null,"totalTestsAntigen":123809,"positiveTestsAntigen":null,"fips":"16","positiveIncrease":104,"negativeIncrease":535,"total":678895,"totalTestResultsIncrease":396,"posNeg":678895,"dataQualityGrade":null,"deathIncrease":3,"hospitalizedIncrease":5,"hash":"78595a6705d321c83cba079dbee71b6db1897502","commercialScore":0,"negativeRegularScore":0,"negativeScore":0,"positiveScore":0,"score":0,"grade":""},{"date":20210306,"state":"ID","positive":172827,"probableCases":32814,"negative":505429,"pending":null,"totalTestResultsSource":"totalTestsPeopleViral","totalTestResults":645442,"hospitalizedCurrently":150,"hospitalizedCumulative":7179,"inIcuCurrently":33,"inIcuCumulative":1245,"onVentilatorCurrently":null,"onVentilatorCumulative":null,"recovered":95808,"lastUpdateEt":"3/5/2021 19:02","dateModified":"2021-03-05T19:02:00Z","checkTimeEt":"03/05 14:02","death":1876,"hospitalized":7179,"hospitalizedDischarged":null,"dateChecked":"2021-03-05T19:02:00Z","totalTestsViral":1102848,"positiveTestsViral":null,"negativeTestsViral":null,"positiveCasesViral":140013,"deathConfirmed":1649,"deathProbable":227,"totalTestEncountersViral":null,"totalTestsPeopleViral":645442,"totalTestsAntibody":null,"positiveTestsAntibody":null,"negativeTestsAntibody":null,"totalTestsPeopleAntibody":null,"positiveTestsPeopleAntibody":null,"negativeTestsPeopleAntibody":null,"totalTestsPeopleAntigen":null,"positiveTestsPeopleAntigen":null,"totalTestsAntigen":123809,"positiveTestsAntigen":null,"fips":"16","positiveIncrease":240,"negativeIncrease":504,"total":678256,"totalTestResultsIncrease":646,"posNeg":678256,"dataQualityGrade":null,"deathIncrease":0,"hospitalizedIncrease":15,"hash":"35d8f1d09c758c9e752bbc38a6481a8d7608b9c6","commercialScore":0,"negativeRegularScore":0,"negativeScore":0,"positiveScore":0,"score":0,"grade":""},{"date":20210305,"state":"ID","positive":172587,"probableCases":32716,"negative":504925,"pending":null,"totalTestResultsSource":"totalTestsPeopleViral","totalTestResults":644796,"hospitalizedCurrently":139,"hospitalizedCumulative":7164,"inIcuCurrently":32,"inIcuCumulative":1242,"onVentilatorCurrently":null,"onVentilatorCumulative":null,"recovered":95524,"lastUpdateEt":"3/5/2021 11:34","dateModified":"2021-03-05T11:34:00Z","checkTimeEt":"03/05 06:34","death":1876,"hospitalized":7164,"hospitalizedDischarged":null,"dateChecked":"2021-03-05T11:34:00Z","totalTestsViral":1100276,"positiveTestsViral":null,"negativeTestsViral":null,"positiveCasesViral":139871,"deathConfirmed":1649,"deathProbable":227,"totalTestEncountersViral":null,"totalTestsPeopleViral":644796,"totalTestsAntibody":null,"positiveTestsAntibody":null,"negativeTestsAntibody":null,"totalTestsPeopleAntibody":null,"positiveTestsPeopleAntibody":null,"negativeTestsPeopleAntibody":null,"totalTestsPeopleAntigen":null,"positiveTestsPeopleAntigen":null,"totalTestsAntigen":123809,"positiveTestsAntigen":null,"fips":"16","positiveIncrease":299,"negativeIncrease":1234,"total":677512,"totalTestResultsIncrease":1438,"posNeg":677512,"dataQualityGrade":null,"deathIncrease":0,"hospitalizedIncrease":20,"hash":"90b36aabf6016cfef8d9282e4ab91eba6e5ae206","commercialScore":0,"negativeRegularScore":0,"negativeScore":0,"positiveScore":0,"score":0,"grade":""},{"date":20210304,"state":"ID","positive":172288,"probableCases":32621,"negative":503691,"pending":null,"totalTestResultsSource":"totalTestsPeopleViral","totalTestResults":643358,"hospitalizedCurrently":139,"hospitalizedCumulative":7144,"inIcuCurrently":32,"inIcuCumulative":1241,"onVentilatorCurrently":null,"onVentilatorCumulative":null,"recovered":95222,"lastUpdateEt":"3/3/2021 19:25","dateModified":"2021-03-03T19:25:00Z","checkTimeEt":"03/03 14:25","death":1876,"hospitalized":7144,"hospitalizedDischarged":null,"dateChecked":"2021-03-03T19:25:00Z","totalTestsViral":1096824,"positiveTestsViral":null,"negativeTestsViral":null,"positiveCasesViral":139667,"deathConfirmed":1649,"deathProbable":227,"totalTestEncountersViral":null,"totalTestsPeopleViral":643358,"totalTestsAntibody":null,"positiveTestsAntibody":null,"negativeTestsAntibody":null,"totalTestsPeopleAntibody":null,"positiveTestsPeopleAntibody":null,"negativeTestsPeopleAntibody":null,"totalTestsPeopleAntigen":null,"positiveTestsPeopleAntigen":null,"totalTestsAntigen":123809,"positiveTestsAntigen":null,"fips":"16","positiveIncrease":452,"negativeIncrease":1096,"total":675979,"totalTestResultsIncrease":1441,"posNeg":675979,"dataQualityGrade":null,"deathIncrease":5,"hospitalizedIncrease":13,"hash":"e2f9a0ba7e0b3a0a2fa7bd369970320bad2a47a9","commercialScore":0,"negativeRegularScore":0,"negativeScore":0,"positiveScore":0,"score":0,"grade":""},{"date":20210303,"state":"ID","positive":171836,"probableCases":32514,"negative":502595,"pending":null,"totalTestResultsSource":"totalTestsPeopleViral","totalTestResults":641917,"hospitalizedCurrently":121,"hospitalizedCumulative":7131,"inIcuCurrently":32,"inIcuCumulative":1239,"onVentilatorCurrently":null,"onVentilatorCumulative":null,"recovered":94936,"lastUpdateEt":"3/3/2021 10:59","dateModified":"2021-03-03T10:59:00Z","checkTimeEt":"03/03 05:59","death":1871,"hospitalized":7131,"hospitalizedDischarged":null,"dateChecked":"2021-03-03T10:59:00Z","totalTestsViral":1092871,"positiveTestsViral":null,"negativeTestsViral":null,"positiveCasesViral":139322,"deathConfirmed":1645,"deathProbable":226,"totalTestEncountersViral":null,"totalTestsPeopleViral":641917,"totalTestsAntibody":null,"positiveTestsAntibody":null,"negativeTestsAntibody":null,"totalTestsPeopleAntibody":null,"positiveTestsPeopleAntibody":null,"negativeTestsPeopleAntibody":null,"totalTestsPeopleAntigen":null,"positiveTestsPeopleAntigen":null,"totalTestsAntigen":123809,"positiveTestsAntigen":null,"fips":"16","positiveIncrease":374,"negativeIncrease":1239,"total":674431,"totalTestResultsIncrease":1505,"posNeg":674431,"dataQualityGrade":null,"deathIncrease":4,"hospitalizedIncrease":20,"hash":"89eca05f6b3d98f1dff0376399a19fdc0b00f3da","commercialScore":0,"negativeRegularScore":0,"negativeScore":0,"positiveScore":0,"score":0,"grade":""},{"date":20210302,"state":"ID","positive":171462,"probableCases":32406,"negative":501356,"pending":null,"totalTestResultsSource":"totalTestsPeopleViral","totalTestResults":640412,"hospitalizedCurrently":121,"hospitalizedCumulative":7111,"inIcuCurrently":32,"inIcuCumulative":1234,"onVentilatorCurrently":null,"onVentilatorCumulative":null,"recovered":94707,"lastUpdateEt":"3/1/2021 19:04","dateModified":"2021-03-01T19:04:00Z","checkTimeEt":"03/01 14:04","death":1867,"hospitalized":7111,"hospitalizedDischarged":null,"dateChecked":"2021-03-01T19:04:00Z","totalTestsViral":1088968,"positiveTestsViral":null,"negativeTestsViral":null,"positiveCasesViral":139056,"deathConfirmed":1641,"deathProbable":226,"totalTestEncountersViral":null,"totalTestsPeopleViral":640412,"totalTestsAntibody":null,"positiveTestsAntibody":null,"negativeTestsAntibody":null,"totalTestsPeopleAntibody":null,"positiveTestsPeopleAntibody":null,"negativeTestsPeopleAntibody":null,"totalTestsPeopleAntigen":null,"positiveTestsPeopleAntigen":null,"totalTestsAntigen":123809,"positiveTestsAntigen":null,"fips":"16","positiveIncrease":322,"negativeIncrease":1260,"total":672818,"totalTestResultsIncrease":1493,"posNeg":672818,"dataQualityGrade":null,"deathIncrease":7,"hospitalizedIncrease":35,"hash":"3ec59adbcf1d7f94ee1b6b3c0cc32643334d84f2","commercialScore":0,"negativeRegularScore":0,"negativeScore":0,"positiveScore":0,"score":0,"grade":""},{"date":20210301,"state":"ID","positive":171140,"probableCases":32317,"negative":500096,"pending":null,"totalTestResultsSource":"totalTestsPeopleViral","totalTestResults":638919,"hospitalizedCurrently":162,"hospitalizedCumulative":7076,"inIcuCurrently":35,"inIcuCumulative":1231,"onVentilatorCurrently":null,"onVentilatorCumulative":null,"recovered":94230,"lastUpdateEt":"2/27/2021 19:06","dateModified":"2021-02-27T19:06:00Z","checkTimeEt":"02/27 14:06","death":1860,"hospitalized":7076,"hospitalizedDischarged":null,"dateChecked":"2021-02-27T19:06:00Z","totalTestsViral":1083384,"positiveTestsViral":null,"negativeTestsViral":null,"positiveCasesViral":138823,"deathConfirmed":1634,"deathProbable":226,"totalTestEncountersViral":null,"totalTestsPeopleViral":638919,"totalTestsAntibody":null,"positiveTestsAntibody":null,"negativeTestsAntibody":null,"totalTestsPeopleAntibody":null,"positiveTestsPeopleAntibody":null,"negativeTestsPeopleAntibody":null,"totalTestsPeopleAntigen":null,"positiveTestsPeopleAntigen":null,"totalTestsAntigen":123809,"positiveTestsAntigen":null,"fips":"16","positiveIncrease":0,"negativeIncrease":0,"total":671236,"totalTestResultsIncrease":0,"posNeg":671236,"dataQualityGrade":null,"deathIncrease":0,"hospitalizedIncrease":0,"hash":"ed541174e3aaa95276628cfa039c6a4182164f3a","commercialScore":0,"negativeRegularScore":0,"negativeScore":0,"positiveScore":0,"score":0,"grade":""},{"date":20210228,"state":"ID","positive":171140,"probableCases":32317,"negative":500096,"pending":null,"totalTestResultsSource":"totalTestsPeopleViral","totalTestResults":638919,"hospitalizedCurrently":162,"hospitalizedCumulative":7076,"inIcuCurrently":35,"inIcuCumulative":1231,"onVentilatorCurrently":null,"onVentilatorCumulative":null,"recovered":94230,"lastUpdateEt":"2/27/2021 19:06","dateModified":"2021-02-27T19:06:00Z","checkTimeEt":"02/27 14:06","death":1860,"hospitalized":7076,"hospitalizedDischarged":null,"dateChecked":"2021-02-27T19:06:00Z","totalTestsViral":1083384,"positiveTestsViral":null,"negativeTestsViral":null,"positiveCasesViral":138823,"deathConfirmed":1634,"deathProbable":226,"totalTestEncountersViral":null,"totalTestsPeopleViral":638919,"totalTestsAntibody":null,"positiveTestsAntibody":null,"negativeTestsAntibody":null,"totalTestsPeopleAntibody":null,"positiveTestsPeopleAntibody":null,"negativeTestsPeopleAntibody":null,"totalTestsPeopleAntigen":null,"positiveTestsPeopleAntigen":null,"totalTestsAntigen":123809,"positiveTestsAntigen":null,"fips":"16","positiveIncrease":233,"negativeIncrease":865,"total":671236,"totalTestResultsIncrease":1036,"posNeg":671236,"dataQualityGrade":null,"deathIncrease":1,"hospitalizedIncrease":11,"hash":"e72f2a54a0ccc1e04e3c175a7075d049ee555c3c","commercialScore":0,"negativeRegularScore":0,"negativeScore":0,"positiveScore":0,"score":0,"grade":""},{"date":20210227,"state":"ID","positive":170907,"probableCases":32255,"negative":499231,"pending":null,"totalTestResultsSource":"totalTestsPeopleViral","totalTestResults":637883,"hospitalizedCurrently":162,"hospitalizedCumulative":7065,"inIcuCurrently":35,"inIcuCumulative":1229,"onVentilatorCurrently":null,"onVentilatorCumulative":null,"recovered":93975,"lastUpdateEt":"2/26/2021 19:53","dateModified":"2021-02-26T19:53:00Z","checkTimeEt":"02/26 14:53","death":1859,"hospitalized":7065,"hospitalizedDischarged":null,"dateChecked":"2021-02-26T19:53:00Z","totalTestsViral":1080708,"positiveTestsViral":null,"negativeTestsViral":null,"positiveCasesViral":138652,"deathConfirmed":1633,"deathProbable":226,"totalTestEncountersViral":null,"totalTestsPeopleViral":637883,"totalTestsAntibody":null,"positiveTestsAntibody":null,"negativeTestsAntibody":null,"totalTestsPeopleAntibody":null,"positiveTestsPeopleAntibody":null,"negativeTestsPeopleAntibody":null,"totalTestsPeopleAntigen":null,"positiveTestsPeopleAntigen":null,"totalTestsAntigen":123809,"positiveTestsAntigen":null,"fips":"16","positiveIncrease":312,"negativeIncrease":1131,"total":670138,"totalTestResultsIncrease":1350,"posNeg":670138,"dataQualityGrade":null,"deathIncrease":9,"hospitalizedIncrease":8,"hash":"48774a6afb3710b2b893aabc1a8d789ee76de3d3","commercialScore":0,"negativeRegularScore":0,"negativeScore":0,"positiveScore":0,"score":0,"grade":""},{"date":20210226,"state":"ID","positive":170595,"probableCases":32162,"negative":498100,"pending":null,"totalTestResultsSource":"totalTestsPeopleViral","totalTestResults":636533,"hospitalizedCurrently":143,"hospitalizedCumulative":7057,"inIcuCurrently":38,"inIcuCumulative":1228,"onVentilatorCurrently":null,"onVentilatorCumulative":null,"recovered":93679,"lastUpdateEt":"2/25/2021 19:08","dateModified":"2021-02-25T19:08:00Z","checkTimeEt":"02/25 14:08","death":1850,"hospitalized":7057,"hospitalizedDischarged":null,"dateChecked":"2021-02-25T19:08:00Z","totalTestsViral":1075256,"positiveTestsViral":null,"negativeTestsViral":null,"positiveCasesViral":138433,"deathConfirmed":1628,"deathProbable":222,"totalTestEncountersViral":null,"totalTestsPeopleViral":636533,"totalTestsAntibody":null,"positiveTestsAntibody":null,"negativeTestsAntibody":null,"totalTestsPeopleAntibody":null,"positiveTestsPeopleAntibody":null,"negativeTestsPeopleAntibody":null,"totalTestsPeopleAntigen":null,"positiveTestsPeopleAntigen":null,"totalTestsAntigen":123809,"positiveTestsAntigen":null,"fips":"16","positiveIncrease":306,"negativeIncrease":1037,"total":668695,"totalTestResultsIncrease":1219,"posNeg":668695,"dataQualityGrade":null,"deathIncrease":10,"hospitalizedIncrease":13,"hash":"2faa43f0de29f0fd2dc5b646b283992b8e371f71","commercialScore":0,"negativeRegularScore":0,"negativeScore":0,"positiveScore":0,"score":0,"grade":""},{"date":20210225,"state":"ID","positive":170289,"probableCases":32038,"negative":497063,"pending":null,"totalTestResultsSource":"totalTestsPeopleViral","totalTestResults":635314,"hospitalizedCurrently":143,"hospitalizedCumulative":7044,"inIcuCurrently":38,"inIcuCumulative":1229,"onVentilatorCurrently":null,"onVentilatorCumulative":null,"recovered":93252,"lastUpdateEt":"2/25/2021 15:48","dateModified":"2021-02-25T15:48:00Z","checkTimeEt":"02/25 10:48","death":1840,"hospitalized":7044,"hospitalizedDischarged":null,"dateChecked":"2021-02-25T15:48:00Z","totalTestsViral":1070527,"positiveTestsViral":null,"negativeTestsViral":null,"positiveCasesViral":138251,"deathConfirmed":1620,"deathProbable":220,"totalTestEncountersViral":null,"totalTestsPeopleViral":635314,"totalTestsAntibody":null,"positiveTestsAntibody":null,"negativeTestsAntibody":null,"totalTestsPeopleAntibody":null,"positiveTestsPeopleAntibody":null,"negativeTestsPeopleAntibody":null,"totalTestsPeopleAntigen":null,"positiveTestsPeopleAntigen":null,"totalTestsAntigen":123809,"positiveTestsAntigen":null,"fips":"16","positiveIncrease":423,"negativeIncrease":1212,"total":667352,"totalTestResultsIncrease":1456,"posNeg":667352,"dataQualityGrade":null,"deathIncrease":0,"hospitalizedIncrease":11,"hash":"66989ea1e0a17d2167d35b75e6b8c9363f8dfbd7","commercialScore":0,"negativeRegularScore":0,"negativeScore":0,"positiveScore":0,"score":0,"grade":""},{"date":20210224,"state":"ID","positive":169866,"probableCases":31859,"negative":495851,"pending":null,"totalTestResultsSource":"totalTestsPeopleViral","totalTestResults":633858,"hospitalizedCurrently":110,"hospitalizedCumulative":7033,"inIcuCurrently":25,"inIcuCumulative":1227,"onVentilatorCurrently":null,"onVentilatorCumulative":null,"recovered":92859,"lastUpdateEt":"2/23/2021 19:00","dateModified":"2021-02-23T19:00:00Z","checkTimeEt":"02/23 14:00","death":1840,"hospitalized":7033,"hospitalizedDischarged":null,"dateChecked":"2021-02-23T19:00:00Z","totalTestsViral":1066095,"positiveTestsViral":null,"negativeTestsViral":null,"positiveCasesViral":138007,"deathConfirmed":1620,"deathProbable":220,"totalTestEncountersViral":null,"totalTestsPeopleViral":633858,"totalTestsAntibody":null,"positiveTestsAntibody":null,"negativeTestsAntibody":null,"totalTestsPeopleAntibody":null,"positiveTestsPeopleAntibody":null,"negativeTestsPeopleAntibody":null,"totalTestsPeopleAntigen":null,"positiveTestsPeopleAntigen":null,"totalTestsAntigen":123809,"positiveTestsAntigen":null,"fips":"16","positiveIncrease":282,"negativeIncrease":1078,"total":665717,"totalTestResultsIncrease":1297,"posNeg":665717,"dataQualityGrade":null,"deathIncrease":14,"hospitalizedIncrease":26,"hash":"250773c2c22ee225c9d5bc25bb7cd7c27a43fa29","commercialScore":0,"negativeRegularScore":0,"negativeScore":0,"positiveScore":0,"score":0,"grade":""},{"date":20210223,"state":"ID","positive":169584,"probableCases":31796,"negative":494773,"pending":null,"totalTestResultsSource":"totalTestsPeopleViral","totalTestResults":632561,"hospitalizedCurrently":110,"hospitalizedCumulative":7007,"inIcuCurrently":25,"inIcuCumulative":1224,"onVentilatorCurrently":null,"onVentilatorCumulative":null,"recovered":92573,"lastUpdateEt":"2/22/2021 19:00","dateModified":"2021-02-22T19:00:00Z","checkTimeEt":"02/22 14:00","death":1826,"hospitalized":7007,"hospitalizedDischarged":null,"dateChecked":"2021-02-22T19:00:00Z","totalTestsViral":1062630,"positiveTestsViral":null,"negativeTestsViral":null,"positiveCasesViral":137788,"deathConfirmed":1607,"deathProbable":219,"totalTestEncountersViral":null,"totalTestsPeopleViral":632561,"totalTestsAntibody":null,"positiveTestsAntibody":null,"negativeTestsAntibody":null,"totalTestsPeopleAntibody":null,"positiveTestsPeopleAntibody":null,"negativeTestsPeopleAntibody":null,"totalTestsPeopleAntigen":null,"positiveTestsPeopleAntigen":null,"totalTestsAntigen":123809,"positiveTestsAntigen":null,"fips":"16","positiveIncrease":434,"negativeIncrease":1479,"total":664357,"totalTestResultsIncrease":1837,"posNeg":664357,"dataQualityGrade":null,"deathIncrease":0,"hospitalizedIncrease":24,"hash":"48b04558f796b4ab20a5ea2742adfaa8685e5e66","commercialScore":0,"negativeRegularScore":0,"negativeScore":0,"positiveScore":0,"score":0,"grade":""},{"date":20210222,"state":"ID","positive":169150,"probableCases":31720,"negative":493294,"pending":null,"totalTestResultsSource":"totalTestsPeopleViral","totalTestResults":630724,"hospitalizedCurrently":142,"hospitalizedCumulative":6983,"inIcuCurrently":37,"inIcuCumulative":1220,"onVentilatorCurrently":null,"onVentilatorCumulative":null,"recovered":91926,"lastUpdateEt":"2/20/2021 19:00","dateModified":"2021-02-20T19:00:00Z","checkTimeEt":"02/20 14:00","death":1826,"hospitalized":6983,"hospitalizedDischarged":null,"dateChecked":"2021-02-20T19:00:00Z","totalTestsViral":1059842,"positiveTestsViral":null,"negativeTestsViral":null,"positiveCasesViral":137430,"deathConfirmed":1607,"deathProbable":219,"totalTestEncountersViral":null,"totalTestsPeopleViral":630724,"totalTestsAntibody":null,"positiveTestsAntibody":null,"negativeTestsAntibody":null,"totalTestsPeopleAntibody":null,"positiveTestsPeopleAntibody":null,"negativeTestsPeopleAntibody":null,"totalTestsPeopleAntigen":null,"positiveTestsPeopleAntigen":null,"totalTestsAntigen":123809,"positiveTestsAntigen":null,"fips":"16","positiveIncrease":0,"negativeIncrease":0,"total":662444,"totalTestResultsIncrease":0,"posNeg":662444,"dataQualityGrade":null,"deathIncrease":0,"hospitalizedIncrease":0,"hash":"267e723130f8012c9b97f4d637afedca5d4d71b5","commercialScore":0,"negativeRegularScore":0,"negativeScore":0,"positiveScore":0,"score":0,"grade":""},{"date":20210221,"state":"ID","positive":169150,"probableCases":31720,"negative":493294,"pending":null,"totalTestResultsSource":"totalTestsPeopleViral","totalTestResults":630724,"hospitalizedCurrently":142,"hospitalizedCumulative":6983,"inIcuCurrently":37,"inIcuCumulative":1220,"onVentilatorCurrently":null,"onVentilatorCumulative":null,"recovered":91926,"lastUpdateEt":"2/20/2021 19:00","dateModified":"2021-02-20T19:00:00Z","checkTimeEt":"02/20 14:00","death":1826,"hospitalized":6983,"hospitalizedDischarged":null,"dateChecked":"2021-02-20T19:00:00Z","totalTestsViral":1059842,"positiveTestsViral":null,"negativeTestsViral":null,"positiveCasesViral":137430,"deathConfirmed":1607,"deathProbable":219,"totalTestEncountersViral":null,"totalTestsPeopleViral":630724,"totalTestsAntibody":null,"positiveTestsAntibody":null,"negativeTestsAntibody":null,"totalTestsPeopleAntibody":null,"positiveTestsPeopleAntibody":null,"negativeTestsPeopleAntibody":null,"totalTestsPeopleAntigen":null,"positiveTestsPeopleAntigen":null,"totalTestsAntigen":123809,"positiveTestsAntigen":null,"fips":"16","positiveIncrease":197,"negativeIncrease":926,"total":662444,"totalTestResultsIncrease":1077,"posNeg":662444,"dataQualityGrade":null,"deathIncrease":0,"hospitalizedIncrease":10,"hash":"0f1b4b8d84de7ce24683d43d9bed041d9138cdbe","commercialScore":0,"negativeRegularScore":0,"negativeScore":0,"positiveScore":0,"score":0,"grade":""},{"date":20210220,"state":"ID","positive":168953,"probableCases":31674,"negative":492368,"pending":null,"totalTestResultsSource":"totalTestsPeopleViral","totalTestResults":629647,"hospitalizedCurrently":142,"hospitalizedCumulative":6973,"inIcuCurrently":37,"inIcuCumulative":1219,"onVentilatorCurrently":null,"onVentilatorCumulative":null,"recovered":91637,"lastUpdateEt":"2/19/2021 19:00","dateModified":"2021-02-19T19:00:00Z","checkTimeEt":"02/19 14:00","death":1826,"hospitalized":6973,"hospitalizedDischarged":null,"dateChecked":"2021-02-19T19:00:00Z","totalTestsViral":1056739,"positiveTestsViral":null,"negativeTestsViral":null,"positiveCasesViral":137279,"deathConfirmed":1607,"deathProbable":219,"totalTestEncountersViral":null,"totalTestsPeopleViral":629647,"totalTestsAntibody":null,"positiveTestsAntibody":null,"negativeTestsAntibody":null,"totalTestsPeopleAntibody":null,"positiveTestsPeopleAntibody":null,"negativeTestsPeopleAntibody":null,"totalTestsPeopleAntigen":null,"positiveTestsPeopleAntigen":null,"totalTestsAntigen":123809,"positiveTestsAntigen":null,"fips":"16","positiveIncrease":314,"negativeIncrease":1105,"total":661321,"totalTestResultsIncrease":1380,"posNeg":661321,"dataQualityGrade":null,"deathIncrease":0,"hospitalizedIncrease":9,"hash":"5c29ec8a65250947dfedf93d8b47ac9a2b01fa0d","commercialScore":0,"negativeRegularScore":0,"negativeScore":0,"positiveScore":0,"score":0,"grade":""},{"date":20210219,"state":"ID","positive":168639,"probableCases":31635,"negative":491263,"pending":null,"totalTestResultsSource":"totalTestsPeopleViral","totalTestResults":628267,"hospitalizedCurrently":164,"hospitalizedCumulative":6964,"inIcuCurrently":37,"inIcuCumulative":1218,"onVentilatorCurrently":null,"onVentilatorCumulative":null,"recovered":91241,"lastUpdateEt":"2/18/2021 19:00","dateModified":"2021-02-18T19:00:00Z","checkTimeEt":"02/18 14:00","death":1826,"hospitalized":6964,"hospitalizedDischarged":null,"dateChecked":"2021-02-18T19:00:00Z","totalTestsViral":1052070,"positiveTestsViral":null,"negativeTestsViral":null,"positiveCasesViral":137004,"deathConfirmed":1607,"deathProbable":219,"totalTestEncountersViral":null,"totalTestsPeopleViral":628267,"totalTestsAntibody":null,"positiveTestsAntibody":null,"negativeTestsAntibody":null,"totalTestsPeopleAntibody":null,"positiveTestsPeopleAntibody":null,"negativeTestsPeopleAntibody":null,"totalTestsPeopleAntigen":null,"positiveTestsPeopleAntigen":null,"totalTestsAntigen":123809,"positiveTestsAntigen":null,"fips":"16","positiveIncrease":286,"negativeIncrease":1397,"total":659902,"totalTestResultsIncrease":1591,"posNeg":659902,"dataQualityGrade":null,"deathIncrease":9,"hospitalizedIncrease":17,"hash":"aadf33735b78513046fa074f756c77b75af342d3","commercialScore":0,"negativeRegularScore":0,"negativeScore":0,"positiveScore":0,"score":0,"grade":""},{"date":20210218,"state":"ID","positive":168353,"probableCases":31543,"negative":489866,"pending":null,"totalTestResultsSource":"totalTestsPeopleViral","totalTestResults":626676,"hospitalizedCurrently":164,"hospitalizedCumulative":6947,"inIcuCurrently":37,"inIcuCumulative":1214,"onVentilatorCurrently":null,"onVentilatorCumulative":null,"recovered":90706,"lastUpdateEt":"2/17/2021 19:00","dateModified":"2021-02-17T19:00:00Z","checkTimeEt":"02/17 14:00","death":1817,"hospitalized":6947,"hospitalizedDischarged":null,"dateChecked":"2021-02-17T19:00:00Z","totalTestsViral":1047880,"positiveTestsViral":null,"negativeTestsViral":null,"positiveCasesViral":136810,"deathConfirmed":1600,"deathProbable":217,"totalTestEncountersViral":null,"totalTestsPeopleViral":626676,"totalTestsAntibody":null,"positiveTestsAntibody":null,"negativeTestsAntibody":null,"totalTestsPeopleAntibody":null,"positiveTestsPeopleAntibody":null,"negativeTestsPeopleAntibody":null,"totalTestsPeopleAntigen":null,"positiveTestsPeopleAntigen":null,"totalTestsAntigen":78973,"positiveTestsAntigen":null,"fips":"16","positiveIncrease":408,"negativeIncrease":1060,"total":658219,"totalTestResultsIncrease":1357,"posNeg":658219,"dataQualityGrade":null,"deathIncrease":11,"hospitalizedIncrease":14,"hash":"52f9ac74974bfb9073ccdb8cd75790b7ea4a8ccc","commercialScore":0,"negativeRegularScore":0,"negativeScore":0,"positiveScore":0,"score":0,"grade":""},{"date":20210217,"state":"ID","positive":167945,"probableCases":31432,"negative":488806,"pending":null,"totalTestResultsSource":"totalTestsPeopleViral","totalTestResults":625319,"hospitalizedCurrently":177,"hospitalizedCumulative":6933,"inIcuCurrently":38,"inIcuCumulative":1206,"onVentilatorCurrently":null,"onVentilatorCumulative":null,"recovered":90300,"lastUpdateEt":"2/16/2021 19:00","dateModified":"2021-02-16T19:00:00Z","checkTimeEt":"02/16 14:00","death":1806,"hospitalized":6933,"hospitalizedDischarged":null,"dateChecked":"2021-02-16T19:00:00Z","totalTestsViral":1043924,"positiveTestsViral":null,"negativeTestsViral":null,"positiveCasesViral":136513,"deathConfirmed":1589,"deathProbable":217,"totalTestEncountersViral":null,"totalTestsPeopleViral":625319,"totalTestsAntibody":null,"positiveTestsAntibody":null,"negativeTestsAntibody":null,"totalTestsPeopleAntibody":null,"positiveTestsPeopleAntibody":null,"negativeTestsPeopleAntibody":null,"totalTestsPeopleAntigen":null,"positiveTestsPeopleAntigen":null,"totalTestsAntigen":78973,"positiveTestsAntigen":null,"fips":"16","positiveIncrease":462,"negativeIncrease":2602,"total":656751,"totalTestResultsIncrease":2966,"posNeg":656751,"dataQualityGrade":null,"deathIncrease":3,"hospitalizedIncrease":43,"hash":"ba6db79e922e6a879aa8234057978c4314d41df9","commercialScore":0,"negativeRegularScore":0,"negativeScore":0,"positiveScore":0,"score":0,"grade":""},{"date":20210216,"state":"ID","positive":167483,"probableCases":31334,"negative":486204,"pending":null,"totalTestResultsSource":"totalTestsPeopleViral","totalTestResults":622353,"hospitalizedCurrently":180,"hospitalizedCumulative":6890,"inIcuCurrently":45,"inIcuCumulative":1206,"onVentilatorCurrently":null,"onVentilatorCumulative":null,"recovered":89410,"lastUpdateEt":"2/14/2021 19:00","dateModified":"2021-02-14T19:00:00Z","checkTimeEt":"02/14 14:00","death":1803,"hospitalized":6890,"hospitalizedDischarged":null,"dateChecked":"2021-02-14T19:00:00Z","totalTestsViral":1035119,"positiveTestsViral":null,"negativeTestsViral":null,"positiveCasesViral":136149,"deathConfirmed":1587,"deathProbable":216,"totalTestEncountersViral":null,"totalTestsPeopleViral":622353,"totalTestsAntibody":null,"positiveTestsAntibody":null,"negativeTestsAntibody":null,"totalTestsPeopleAntibody":null,"positiveTestsPeopleAntibody":null,"negativeTestsPeopleAntibody":null,"totalTestsPeopleAntigen":null,"positiveTestsPeopleAntigen":null,"totalTestsAntigen":78973,"positiveTestsAntigen":null,"fips":"16","positiveIncrease":0,"negativeIncrease":0,"total":653687,"totalTestResultsIncrease":0,"posNeg":653687,"dataQualityGrade":null,"deathIncrease":0,"hospitalizedIncrease":0,"hash":"786e02ff47be8fe4ca2f8e34dae4fb2fcb40d692","commercialScore":0,"negativeRegularScore":0,"negativeScore":0,"positiveScore":0,"score":0,"grade":""},{"date":20210215,"state":"ID","positive":167483,"probableCases":31334,"negative":486204,"pending":null,"totalTestResultsSource":"totalTestsPeopleViral","totalTestResults":622353,"hospitalizedCurrently":180,"hospitalizedCumulative":6890,"inIcuCurrently":45,"inIcuCumulative":1206,"onVentilatorCurrently":null,"onVentilatorCumulative":null,"recovered":89410,"lastUpdateEt":"2/14/2021 19:00","dateModified":"2021-02-14T19:00:00Z","checkTimeEt":"02/14 14:00","death":1803,"hospitalized":6890,"hospitalizedDischarged":null,"dateChecked":"2021-02-14T19:00:00Z","totalTestsViral":1035119,"positiveTestsViral":null,"negativeTestsViral":null,"positiveCasesViral":136149,"deathConfirmed":1587,"deathProbable":216,"totalTestEncountersViral":null,"totalTestsPeopleViral":622353,"totalTestsAntibody":null,"positiveTestsAntibody":null,"negativeTestsAntibody":null,"totalTestsPeopleAntibody":null,"positiveTestsPeopleAntibody":null,"negativeTestsPeopleAntibody":null,"totalTestsPeopleAntigen":null,"positiveTestsPeopleAntigen":null,"totalTestsAntigen":78973,"positiveTestsAntigen":null,"fips":"16","positiveIncrease":0,"negativeIncrease":0,"total":653687,"totalTestResultsIncrease":0,"posNeg":653687,"dataQualityGrade":null,"deathIncrease":0,"hospitalizedIncrease":0,"hash":"281581faa343c2636fa68213f3d7a095977091ba","commercialScore":0,"negativeRegularScore":0,"negativeScore":0,"positiveScore":0,"score":0,"grade":""},{"date":20210214,"state":"ID","positive":167483,"probableCases":31334,"negative":486204,"pending":null,"totalTestResultsSource":"totalTestsPeopleViral","totalTestResults":622353,"hospitalizedCurrently":180,"hospitalizedCumulative":6890,"inIcuCurrently":45,"inIcuCumulative":1206,"onVentilatorCurrently":null,"onVentilatorCumulative":null,"recovered":89410,"lastUpdateEt":"2/13/2021 19:00","dateModified":"2021-02-13T19:00:00Z","checkTimeEt":"02/13 14:00","death":1803,"hospitalized":6890,"hospitalizedDischarged":null,"dateChecked":"2021-02-13T19:00:00Z","totalTestsViral":1035119,"positiveTestsViral":null,"negativeTestsViral":null,"positiveCasesViral":136149,"deathConfirmed":1587,"deathProbable":216,"totalTestEncountersViral":null,"totalTestsPeopleViral":622353,"totalTestsAntibody":null,"positiveTestsAntibody":null,"negativeTestsAntibody":null,"totalTestsPeopleAntibody":null,"positiveTestsPeopleAntibody":null,"negativeTestsPeopleAntibody":null,"totalTestsPeopleAntigen":null,"positiveTestsPeopleAntigen":null,"totalTestsAntigen":78973,"positiveTestsAntigen":null,"fips":"16","positiveIncrease":258,"negativeIncrease":726,"total":653687,"totalTestResultsIncrease":926,"posNeg":653687,"dataQualityGrade":null,"deathIncrease":7,"hospitalizedIncrease":15,"hash":"836983696463c63c188a3bba6b72ddc0bac69fce","commercialScore":0,"negativeRegularScore":0,"negativeScore":0,"positiveScore":0,"score":0,"grade":""},{"date":20210213,"state":"ID","positive":167225,"probableCases":31276,"negative":485478,"pending":null,"totalTestResultsSource":"totalTestsPeopleViral","totalTestResults":621427,"hospitalizedCurrently":180,"hospitalizedCumulative":6875,"inIcuCurrently":45,"inIcuCumulative":1204,"onVentilatorCurrently":null,"onVentilatorCumulative":null,"recovered":89126,"lastUpdateEt":"2/12/2021 19:00","dateModified":"2021-02-12T19:00:00Z","checkTimeEt":"02/12 14:00","death":1796,"hospitalized":6875,"hospitalizedDischarged":null,"dateChecked":"2021-02-12T19:00:00Z","totalTestsViral":1032823,"positiveTestsViral":null,"negativeTestsViral":null,"positiveCasesViral":135949,"deathConfirmed":1582,"deathProbable":214,"totalTestEncountersViral":null,"totalTestsPeopleViral":621427,"totalTestsAntibody":null,"positiveTestsAntibody":null,"negativeTestsAntibody":null,"totalTestsPeopleAntibody":null,"positiveTestsPeopleAntibody":null,"negativeTestsPeopleAntibody":null,"totalTestsPeopleAntigen":null,"positiveTestsPeopleAntigen":null,"totalTestsAntigen":78973,"positiveTestsAntigen":null,"fips":"16","positiveIncrease":349,"negativeIncrease":1246,"total":652703,"totalTestResultsIncrease":1484,"posNeg":652703,"dataQualityGrade":null,"deathIncrease":5,"hospitalizedIncrease":23,"hash":"2e927955fb87fd54aa5176b6b319082a6834c503","commercialScore":0,"negativeRegularScore":0,"negativeScore":0,"positiveScore":0,"score":0,"grade":""},{"date":20210212,"state":"ID","positive":166876,"probableCases":31165,"negative":484232,"pending":null,"totalTestResultsSource":"totalTestsPeopleViral","totalTestResults":619943,"hospitalizedCurrently":176,"hospitalizedCumulative":6852,"inIcuCurrently":37,"inIcuCumulative":1201,"onVentilatorCurrently":null,"onVentilatorCumulative":null,"recovered":88672,"lastUpdateEt":"2/11/2021 19:00","dateModified":"2021-02-11T19:00:00Z","checkTimeEt":"02/11 14:00","death":1791,"hospitalized":6852,"hospitalizedDischarged":null,"dateChecked":"2021-02-11T19:00:00Z","totalTestsViral":1027856,"positiveTestsViral":null,"negativeTestsViral":null,"positiveCasesViral":135711,"deathConfirmed":1577,"deathProbable":214,"totalTestEncountersViral":null,"totalTestsPeopleViral":619943,"totalTestsAntibody":null,"positiveTestsAntibody":null,"negativeTestsAntibody":null,"totalTestsPeopleAntibody":null,"positiveTestsPeopleAntibody":null,"negativeTestsPeopleAntibody":null,"totalTestsPeopleAntigen":null,"positiveTestsPeopleAntigen":null,"totalTestsAntigen":78973,"positiveTestsAntigen":null,"fips":"16","positiveIncrease":323,"negativeIncrease":1472,"total":651108,"totalTestResultsIncrease":1720,"posNeg":651108,"dataQualityGrade":null,"deathIncrease":0,"hospitalizedIncrease":14,"hash":"2f5661f4047770d78f2c1c28bb990b6e5da0a6f1","commercialScore":0,"negativeRegularScore":0,"negativeScore":0,"positiveScore":0,"score":0,"grade":""},{"date":20210211,"state":"ID","positive":166553,"probableCases":31090,"negative":482760,"pending":null,"totalTestResultsSource":"totalTestsPeopleViral","totalTestResults":618223,"hospitalizedCurrently":176,"hospitalizedCumulative":6838,"inIcuCurrently":37,"inIcuCumulative":1199,"onVentilatorCurrently":null,"onVentilatorCumulative":null,"recovered":88126,"lastUpdateEt":"2/10/2021 19:00","dateModified":"2021-02-10T19:00:00Z","checkTimeEt":"02/10 14:00","death":1791,"hospitalized":6838,"hospitalizedDischarged":null,"dateChecked":"2021-02-10T19:00:00Z","totalTestsViral":1022527,"positiveTestsViral":null,"negativeTestsViral":null,"positiveCasesViral":135463,"deathConfirmed":1577,"deathProbable":214,"totalTestEncountersViral":null,"totalTestsPeopleViral":618223,"totalTestsAntibody":null,"positiveTestsAntibody":null,"negativeTestsAntibody":null,"totalTestsPeopleAntibody":null,"positiveTestsPeopleAntibody":null,"negativeTestsPeopleAntibody":null,"totalTestsPeopleAntigen":null,"positiveTestsPeopleAntigen":null,"totalTestsAntigen":78973,"positiveTestsAntigen":null,"fips":"16","positiveIncrease":458,"negativeIncrease":1021,"total":649313,"totalTestResultsIncrease":1366,"posNeg":649313,"dataQualityGrade":null,"deathIncrease":11,"hospitalizedIncrease":-1,"hash":"a17710ff814d2ab15d1f3ecd69021639f44e526e","commercialScore":0,"negativeRegularScore":0,"negativeScore":0,"positiveScore":0,"score":0,"grade":""},{"date":20210210,"state":"ID","positive":166095,"probableCases":30977,"negative":481739,"pending":null,"totalTestResultsSource":"totalTestsPeopleViral","totalTestResults":616857,"hospitalizedCurrently":178,"hospitalizedCumulative":6839,"inIcuCurrently":39,"inIcuCumulative":1194,"onVentilatorCurrently":null,"onVentilatorCumulative":null,"recovered":87505,"lastUpdateEt":"2/9/2021 19:00","dateModified":"2021-02-09T19:00:00Z","checkTimeEt":"02/09 14:00","death":1780,"hospitalized":6839,"hospitalizedDischarged":null,"dateChecked":"2021-02-09T19:00:00Z","totalTestsViral":1018052,"positiveTestsViral":null,"negativeTestsViral":null,"positiveCasesViral":135118,"deathConfirmed":1567,"deathProbable":213,"totalTestEncountersViral":null,"totalTestsPeopleViral":616857,"totalTestsAntibody":null,"positiveTestsAntibody":null,"negativeTestsAntibody":null,"totalTestsPeopleAntibody":null,"positiveTestsPeopleAntibody":null,"negativeTestsPeopleAntibody":null,"totalTestsPeopleAntigen":null,"positiveTestsPeopleAntigen":null,"totalTestsAntigen":78973,"positiveTestsAntigen":null,"fips":"16","positiveIncrease":437,"negativeIncrease":1287,"total":647834,"totalTestResultsIncrease":1587,"posNeg":647834,"dataQualityGrade":null,"deathIncrease":4,"hospitalizedIncrease":20,"hash":"44c2792b3c648ecf594bf5422f9984990d724e74","commercialScore":0,"negativeRegularScore":0,"negativeScore":0,"positiveScore":0,"score":0,"grade":""},{"date":20210209,"state":"ID","positive":165658,"probableCases":30840,"negative":480452,"pending":null,"totalTestResultsSource":"totalTestsPeopleViral","totalTestResults":615270,"hospitalizedCurrently":178,"hospitalizedCumulative":6819,"inIcuCurrently":39,"inIcuCumulative":1191,"onVentilatorCurrently":null,"onVentilatorCumulative":null,"recovered":86880,"lastUpdateEt":"2/8/2021 19:00","dateModified":"2021-02-08T19:00:00Z","checkTimeEt":"02/08 14:00","death":1776,"hospitalized":6819,"hospitalizedDischarged":null,"dateChecked":"2021-02-08T19:00:00Z","totalTestsViral":1018052,"positiveTestsViral":null,"negativeTestsViral":null,"positiveCasesViral":134818,"deathConfirmed":1562,"deathProbable":214,"totalTestEncountersViral":null,"totalTestsPeopleViral":615270,"totalTestsAntibody":null,"positiveTestsAntibody":null,"negativeTestsAntibody":null,"totalTestsPeopleAntibody":null,"positiveTestsPeopleAntibody":null,"negativeTestsPeopleAntibody":null,"totalTestsPeopleAntigen":null,"positiveTestsPeopleAntigen":null,"totalTestsAntigen":78973,"positiveTestsAntigen":null,"fips":"16","positiveIncrease":449,"negativeIncrease":1685,"total":646110,"totalTestResultsIncrease":2060,"posNeg":646110,"dataQualityGrade":null,"deathIncrease":9,"hospitalizedIncrease":26,"hash":"a0ce339eeeb57f9a5a18dbce55169cee8468785e","commercialScore":0,"negativeRegularScore":0,"negativeScore":0,"positiveScore":0,"score":0,"grade":""},{"date":20210208,"state":"ID","positive":165209,"probableCases":30766,"negative":478767,"pending":null,"totalTestResultsSource":"totalTestsPeopleViral","totalTestResults":613210,"hospitalizedCurrently":207,"hospitalizedCumulative":6793,"inIcuCurrently":41,"inIcuCumulative":1184,"onVentilatorCurrently":null,"onVentilatorCumulative":null,"recovered":86078,"lastUpdateEt":"2/6/2021 19:00","dateModified":"2021-02-06T19:00:00Z","checkTimeEt":"02/06 14:00","death":1767,"hospitalized":6793,"hospitalizedDischarged":null,"dateChecked":"2021-02-06T19:00:00Z","totalTestsViral":1014556,"positiveTestsViral":null,"negativeTestsViral":null,"positiveCasesViral":134443,"deathConfirmed":1553,"deathProbable":214,"totalTestEncountersViral":null,"totalTestsPeopleViral":613210,"totalTestsAntibody":null,"positiveTestsAntibody":null,"negativeTestsAntibody":null,"totalTestsPeopleAntibody":null,"positiveTestsPeopleAntibody":null,"negativeTestsPeopleAntibody":null,"totalTestsPeopleAntigen":null,"positiveTestsPeopleAntigen":null,"totalTestsAntigen":78973,"positiveTestsAntigen":null,"fips":"16","positiveIncrease":0,"negativeIncrease":0,"total":643976,"totalTestResultsIncrease":0,"posNeg":643976,"dataQualityGrade":null,"deathIncrease":0,"hospitalizedIncrease":0,"hash":"89b111d544fe0d697550c4074019cac3f051f149","commercialScore":0,"negativeRegularScore":0,"negativeScore":0,"positiveScore":0,"score":0,"grade":""},{"date":20210207,"state":"ID","positive":165209,"probableCases":30766,"negative":478767,"pending":null,"totalTestResultsSource":"totalTestsPeopleViral","totalTestResults":613210,"hospitalizedCurrently":207,"hospitalizedCumulative":6793,"inIcuCurrently":41,"inIcuCumulative":1184,"onVentilatorCurrently":null,"onVentilatorCumulative":null,"recovered":86078,"lastUpdateEt":"2/6/2021 19:00","dateModified":"2021-02-06T19:00:00Z","checkTimeEt":"02/06 14:00","death":1767,"hospitalized":6793,"hospitalizedDischarged":null,"dateChecked":"2021-02-06T19:00:00Z","totalTestsViral":1014556,"positiveTestsViral":null,"negativeTestsViral":null,"positiveCasesViral":134443,"deathConfirmed":1553,"deathProbable":214,"totalTestEncountersViral":null,"totalTestsPeopleViral":613210,"totalTestsAntibody":null,"positiveTestsAntibody":null,"negativeTestsAntibody":null,"totalTestsPeopleAntibody":null,"positiveTestsPeopleAntibody":null,"negativeTestsPeopleAntibody":null,"totalTestsPeopleAntigen":null,"positiveTestsPeopleAntigen":null,"totalTestsAntigen":78973,"positiveTestsAntigen":null,"fips":"16","positiveIncrease":240,"negativeIncrease":951,"total":643976,"totalTestResultsIncrease":1129,"posNeg":643976,"dataQualityGrade":null,"deathIncrease":9,"hospitalizedIncrease":8,"hash":"6985c857a373574f296792f88242291d640e66c7","commercialScore":0,"negativeRegularScore":0,"negativeScore":0,"positiveScore":0,"score":0,"grade":""},{"date":20210206,"state":"ID","positive":164969,"probableCases":30704,"negative":477816,"pending":null,"totalTestResultsSource":"totalTestsPeopleViral","totalTestResults":612081,"hospitalizedCurrently":199,"hospitalizedCumulative":6785,"inIcuCurrently":41,"inIcuCumulative":1184,"onVentilatorCurrently":null,"onVentilatorCumulative":null,"recovered":85439,"lastUpdateEt":"2/5/2021 19:00","dateModified":"2021-02-05T19:00:00Z","checkTimeEt":"02/05 14:00","death":1758,"hospitalized":6785,"hospitalizedDischarged":null,"dateChecked":"2021-02-05T19:00:00Z","totalTestsViral":1011836,"positiveTestsViral":null,"negativeTestsViral":null,"positiveCasesViral":134265,"deathConfirmed":1544,"deathProbable":214,"totalTestEncountersViral":null,"totalTestsPeopleViral":612081,"totalTestsAntibody":null,"positiveTestsAntibody":null,"negativeTestsAntibody":null,"totalTestsPeopleAntibody":null,"positiveTestsPeopleAntibody":null,"negativeTestsPeopleAntibody":null,"totalTestsPeopleAntigen":null,"positiveTestsPeopleAntigen":null,"totalTestsAntigen":78973,"positiveTestsAntigen":null,"fips":"16","positiveIncrease":404,"negativeIncrease":1119,"total":642785,"totalTestResultsIncrease":1445,"posNeg":642785,"dataQualityGrade":null,"deathIncrease":11,"hospitalizedIncrease":14,"hash":"83dcb049bdaa44748584894c27d8309ac45ea374","commercialScore":0,"negativeRegularScore":0,"negativeScore":0,"positiveScore":0,"score":0,"grade":""},{"date":20210205,"state":"ID","positive":164565,"probableCases":30626,"negative":476697,"pending":null,"totalTestResultsSource":"totalTestsPeopleViral","totalTestResults":610636,"hospitalizedCurrently":203,"hospitalizedCumulative":6771,"inIcuCurrently":47,"inIcuCumulative":1183,"onVentilatorCurrently":null,"onVentilatorCumulative":null,"recovered":84824,"lastUpdateEt":"2/4/2021 19:00","dateModified":"2021-02-04T19:00:00Z","checkTimeEt":"02/04 14:00","death":1747,"hospitalized":6771,"hospitalizedDischarged":null,"dateChecked":"2021-02-04T19:00:00Z","totalTestsViral":1007899,"positiveTestsViral":null,"negativeTestsViral":null,"positiveCasesViral":133939,"deathConfirmed":1533,"deathProbable":214,"totalTestEncountersViral":null,"totalTestsPeopleViral":610636,"totalTestsAntibody":null,"positiveTestsAntibody":null,"negativeTestsAntibody":null,"totalTestsPeopleAntibody":null,"positiveTestsPeopleAntibody":null,"negativeTestsPeopleAntibody":null,"totalTestsPeopleAntigen":null,"positiveTestsPeopleAntigen":null,"totalTestsAntigen":78973,"positiveTestsAntigen":null,"fips":"16","positiveIncrease":402,"negativeIncrease":1432,"total":641262,"totalTestResultsIncrease":1740,"posNeg":641262,"dataQualityGrade":null,"deathIncrease":-1,"hospitalizedIncrease":22,"hash":"c7ee0137083f794c2b83a5432b02971409fee370","commercialScore":0,"negativeRegularScore":0,"negativeScore":0,"positiveScore":0,"score":0,"grade":""},{"date":20210204,"state":"ID","positive":164163,"probableCases":30532,"negative":475265,"pending":null,"totalTestResultsSource":"totalTestsPeopleViral","totalTestResults":608896,"hospitalizedCurrently":203,"hospitalizedCumulative":6749,"inIcuCurrently":47,"inIcuCumulative":1181,"onVentilatorCurrently":null,"onVentilatorCumulative":null,"recovered":84159,"lastUpdateEt":"2/3/2021 19:00","dateModified":"2021-02-03T19:00:00Z","checkTimeEt":"02/03 14:00","death":1748,"hospitalized":6749,"hospitalizedDischarged":null,"dateChecked":"2021-02-03T19:00:00Z","totalTestsViral":1002998,"positiveTestsViral":null,"negativeTestsViral":null,"positiveCasesViral":133631,"deathConfirmed":1534,"deathProbable":214,"totalTestEncountersViral":null,"totalTestsPeopleViral":608896,"totalTestsAntibody":null,"positiveTestsAntibody":null,"negativeTestsAntibody":null,"totalTestsPeopleAntibody":null,"positiveTestsPeopleAntibody":null,"negativeTestsPeopleAntibody":null,"totalTestsPeopleAntigen":null,"positiveTestsPeopleAntigen":null,"totalTestsAntigen":78973,"positiveTestsAntigen":null,"fips":"16","positiveIncrease":507,"negativeIncrease":1388,"total":639428,"totalTestResultsIncrease":1781,"posNeg":639428,"dataQualityGrade":null,"deathIncrease":7,"hospitalizedIncrease":17,"hash":"00d0efc1fc2f8a68037a435bfb6d3062ddaf007d","commercialScore":0,"negativeRegularScore":0,"negativeScore":0,"positiveScore":0,"score":0,"grade":""},{"date":20210203,"state":"ID","positive":163656,"probableCases":30418,"negative":473877,"pending":null,"totalTestResultsSource":"totalTestsPeopleViral","totalTestResults":607115,"hospitalizedCurrently":157,"hospitalizedCumulative":6732,"inIcuCurrently":46,"inIcuCumulative":1176,"onVentilatorCurrently":null,"onVentilatorCumulative":null,"recovered":83336,"lastUpdateEt":"2/2/2021 19:00","dateModified":"2021-02-02T19:00:00Z","checkTimeEt":"02/02 14:00","death":1741,"hospitalized":6732,"hospitalizedDischarged":null,"dateChecked":"2021-02-02T19:00:00Z","totalTestsViral":997625,"positiveTestsViral":null,"negativeTestsViral":null,"positiveCasesViral":133238,"deathConfirmed":1527,"deathProbable":214,"totalTestEncountersViral":null,"totalTestsPeopleViral":607115,"totalTestsAntibody":null,"positiveTestsAntibody":null,"negativeTestsAntibody":null,"totalTestsPeopleAntibody":null,"positiveTestsPeopleAntibody":null,"negativeTestsPeopleAntibody":null,"totalTestsPeopleAntigen":null,"positiveTestsPeopleAntigen":null,"totalTestsAntigen":78973,"positiveTestsAntigen":null,"fips":"16","positiveIncrease":491,"negativeIncrease":1498,"total":637533,"totalTestResultsIncrease":1878,"posNeg":637533,"dataQualityGrade":null,"deathIncrease":6,"hospitalizedIncrease":30,"hash":"9e01f532a7d539e44c021ec53ac26d1f40587a84","commercialScore":0,"negativeRegularScore":0,"negativeScore":0,"positiveScore":0,"score":0,"grade":""},{"date":20210202,"state":"ID","positive":163165,"probableCases":30307,"negative":472379,"pending":null,"totalTestResultsSource":"totalTestsPeopleViral","totalTestResults":605237,"hospitalizedCurrently":157,"hospitalizedCumulative":6702,"inIcuCurrently":46,"inIcuCumulative":1172,"onVentilatorCurrently":null,"onVentilatorCumulative":null,"recovered":82721,"lastUpdateEt":"2/1/2021 19:00","dateModified":"2021-02-01T19:00:00Z","checkTimeEt":"02/01 14:00","death":1735,"hospitalized":6702,"hospitalizedDischarged":null,"dateChecked":"2021-02-01T19:00:00Z","totalTestsViral":993978,"positiveTestsViral":null,"negativeTestsViral":null,"positiveCasesViral":132858,"deathConfirmed":1522,"deathProbable":213,"totalTestEncountersViral":null,"totalTestsPeopleViral":605237,"totalTestsAntibody":null,"positiveTestsAntibody":null,"negativeTestsAntibody":null,"totalTestsPeopleAntibody":null,"positiveTestsPeopleAntibody":null,"negativeTestsPeopleAntibody":null,"totalTestsPeopleAntigen":null,"positiveTestsPeopleAntigen":null,"totalTestsAntigen":78973,"positiveTestsAntigen":null,"fips":"16","positiveIncrease":482,"negativeIncrease":1742,"total":635544,"totalTestResultsIncrease":2122,"posNeg":635544,"dataQualityGrade":null,"deathIncrease":10,"hospitalizedIncrease":28,"hash":"f86ccb187d8824688c93b5bcb1520315ebf90702","commercialScore":0,"negativeRegularScore":0,"negativeScore":0,"positiveScore":0,"score":0,"grade":""},{"date":20210201,"state":"ID","positive":162683,"probableCases":30205,"negative":470637,"pending":null,"totalTestResultsSource":"totalTestsPeopleViral","totalTestResults":603115,"hospitalizedCurrently":225,"hospitalizedCumulative":6674,"inIcuCurrently":57,"inIcuCumulative":1169,"onVentilatorCurrently":null,"onVentilatorCumulative":null,"recovered":81591,"lastUpdateEt":"1/30/2021 19:00","dateModified":"2021-01-30T19:00:00Z","checkTimeEt":"01/30 14:00","death":1725,"hospitalized":6674,"hospitalizedDischarged":null,"dateChecked":"2021-01-30T19:00:00Z","totalTestsViral":990444,"positiveTestsViral":null,"negativeTestsViral":null,"positiveCasesViral":132478,"deathConfirmed":1513,"deathProbable":212,"totalTestEncountersViral":null,"totalTestsPeopleViral":603115,"totalTestsAntibody":null,"positiveTestsAntibody":null,"negativeTestsAntibody":null,"totalTestsPeopleAntibody":null,"positiveTestsPeopleAntibody":null,"negativeTestsPeopleAntibody":null,"totalTestsPeopleAntigen":null,"positiveTestsPeopleAntigen":null,"totalTestsAntigen":78973,"positiveTestsAntigen":null,"fips":"16","positiveIncrease":0,"negativeIncrease":0,"total":633320,"totalTestResultsIncrease":0,"posNeg":633320,"dataQualityGrade":null,"deathIncrease":0,"hospitalizedIncrease":0,"hash":"bf85eb6e9a6b26c243f128f9b7c4e1679ee6f45c","commercialScore":0,"negativeRegularScore":0,"negativeScore":0,"positiveScore":0,"score":0,"grade":""},{"date":20210131,"state":"ID","positive":162683,"probableCases":30205,"negative":470637,"pending":null,"totalTestResultsSource":"totalTestsPeopleViral","totalTestResults":603115,"hospitalizedCurrently":225,"hospitalizedCumulative":6674,"inIcuCurrently":57,"inIcuCumulative":1169,"onVentilatorCurrently":null,"onVentilatorCumulative":null,"recovered":81591,"lastUpdateEt":"1/30/2021 19:00","dateModified":"2021-01-30T19:00:00Z","checkTimeEt":"01/30 14:00","death":1725,"hospitalized":6674,"hospitalizedDischarged":null,"dateChecked":"2021-01-30T19:00:00Z","totalTestsViral":990444,"positiveTestsViral":null,"negativeTestsViral":null,"positiveCasesViral":132478,"deathConfirmed":1513,"deathProbable":212,"totalTestEncountersViral":null,"totalTestsPeopleViral":603115,"totalTestsAntibody":null,"positiveTestsAntibody":null,"negativeTestsAntibody":null,"totalTestsPeopleAntibody":null,"positiveTestsPeopleAntibody":null,"negativeTestsPeopleAntibody":null,"totalTestsPeopleAntigen":null,"positiveTestsPeopleAntigen":null,"totalTestsAntigen":78973,"positiveTestsAntigen":null,"fips":"16","positiveIncrease":328,"negativeIncrease":1208,"total":633320,"totalTestResultsIncrease":1469,"posNeg":633320,"dataQualityGrade":null,"deathIncrease":0,"hospitalizedIncrease":15,"hash":"6335c937329f03735ef0e0d32194f0726d18fef3","commercialScore":0,"negativeRegularScore":0,"negativeScore":0,"positiveScore":0,"score":0,"grade":""},{"date":20210130,"state":"ID","positive":162355,"probableCases":30138,"negative":469429,"pending":null,"totalTestResultsSource":"totalTestsPeopleViral","totalTestResults":601646,"hospitalizedCurrently":225,"hospitalizedCumulative":6659,"inIcuCurrently":57,"inIcuCumulative":1165,"onVentilatorCurrently":null,"onVentilatorCumulative":null,"recovered":81034,"lastUpdateEt":"1/29/2021 19:00","dateModified":"2021-01-29T19:00:00Z","checkTimeEt":"01/29 14:00","death":1725,"hospitalized":6659,"hospitalizedDischarged":null,"dateChecked":"2021-01-29T19:00:00Z","totalTestsViral":987111,"positiveTestsViral":null,"negativeTestsViral":null,"positiveCasesViral":132217,"deathConfirmed":1513,"deathProbable":212,"totalTestEncountersViral":null,"totalTestsPeopleViral":601646,"totalTestsAntibody":null,"positiveTestsAntibody":null,"negativeTestsAntibody":null,"totalTestsPeopleAntibody":null,"positiveTestsPeopleAntibody":null,"negativeTestsPeopleAntibody":null,"totalTestsPeopleAntigen":null,"positiveTestsPeopleAntigen":null,"totalTestsAntigen":78973,"positiveTestsAntigen":null,"fips":"16","positiveIncrease":635,"negativeIncrease":1475,"total":631784,"totalTestResultsIncrease":2010,"posNeg":631784,"dataQualityGrade":null,"deathIncrease":4,"hospitalizedIncrease":30,"hash":"19320fede15a1fa769d93957858fc95576406e70","commercialScore":0,"negativeRegularScore":0,"negativeScore":0,"positiveScore":0,"score":0,"grade":""},{"date":20210129,"state":"ID","positive":161720,"probableCases":30038,"negative":467954,"pending":null,"totalTestResultsSource":"totalTestsPeopleViral","totalTestResults":599636,"hospitalizedCurrently":241,"hospitalizedCumulative":6629,"inIcuCurrently":64,"inIcuCumulative":1157,"onVentilatorCurrently":null,"onVentilatorCumulative":null,"recovered":80252,"lastUpdateEt":"1/28/2021 19:00","dateModified":"2021-01-28T19:00:00Z","checkTimeEt":"01/28 14:00","death":1721,"hospitalized":6629,"hospitalizedDischarged":null,"dateChecked":"2021-01-28T19:00:00Z","totalTestsViral":981362,"positiveTestsViral":null,"negativeTestsViral":null,"positiveCasesViral":131682,"deathConfirmed":1508,"deathProbable":213,"totalTestEncountersViral":null,"totalTestsPeopleViral":599636,"totalTestsAntibody":null,"positiveTestsAntibody":null,"negativeTestsAntibody":null,"totalTestsPeopleAntibody":null,"positiveTestsPeopleAntibody":null,"negativeTestsPeopleAntibody":null,"totalTestsPeopleAntigen":null,"positiveTestsPeopleAntigen":null,"totalTestsAntigen":78973,"positiveTestsAntigen":null,"fips":"16","positiveIncrease":508,"negativeIncrease":1799,"total":629674,"totalTestResultsIncrease":2123,"posNeg":629674,"dataQualityGrade":null,"deathIncrease":7,"hospitalizedIncrease":25,"hash":"a054d659c6e7832e13de15ea53475ce5598d4e6c","commercialScore":0,"negativeRegularScore":0,"negativeScore":0,"positiveScore":0,"score":0,"grade":""},{"date":20210128,"state":"ID","positive":161212,"probableCases":29854,"negative":466155,"pending":null,"totalTestResultsSource":"totalTestsPeopleViral","totalTestResults":597513,"hospitalizedCurrently":241,"hospitalizedCumulative":6604,"inIcuCurrently":64,"inIcuCumulative":1153,"onVentilatorCurrently":null,"onVentilatorCumulative":null,"recovered":79298,"lastUpdateEt":"1/27/2021 19:00","dateModified":"2021-01-27T19:00:00Z","checkTimeEt":"01/27 14:00","death":1714,"hospitalized":6604,"hospitalizedDischarged":null,"dateChecked":"2021-01-27T19:00:00Z","totalTestsViral":975555,"positiveTestsViral":null,"negativeTestsViral":null,"positiveCasesViral":131358,"deathConfirmed":1501,"deathProbable":213,"totalTestEncountersViral":null,"totalTestsPeopleViral":597513,"totalTestsAntibody":null,"positiveTestsAntibody":null,"negativeTestsAntibody":null,"totalTestsPeopleAntibody":null,"positiveTestsPeopleAntibody":null,"negativeTestsPeopleAntibody":null,"totalTestsPeopleAntigen":null,"positiveTestsPeopleAntigen":null,"totalTestsAntigen":78973,"positiveTestsAntigen":null,"fips":"16","positiveIncrease":620,"negativeIncrease":1876,"total":627367,"totalTestResultsIncrease":2326,"posNeg":627367,"dataQualityGrade":null,"deathIncrease":26,"hospitalizedIncrease":44,"hash":"cbfe6a0cd4ae3e5841a5908c748257031398b268","commercialScore":0,"negativeRegularScore":0,"negativeScore":0,"positiveScore":0,"score":0,"grade":""},{"date":20210127,"state":"ID","positive":160592,"probableCases":29684,"negative":464279,"pending":null,"totalTestResultsSource":"totalTestsPeopleViral","totalTestResults":595187,"hospitalizedCurrently":241,"hospitalizedCumulative":6560,"inIcuCurrently":64,"inIcuCumulative":1144,"onVentilatorCurrently":null,"onVentilatorCumulative":null,"recovered":78246,"lastUpdateEt":"1/26/2021 19:00","dateModified":"2021-01-26T19:00:00Z","checkTimeEt":"01/26 14:00","death":1688,"hospitalized":6560,"hospitalizedDischarged":null,"dateChecked":"2021-01-26T19:00:00Z","totalTestsViral":970325,"positiveTestsViral":null,"negativeTestsViral":null,"positiveCasesViral":130908,"deathConfirmed":1481,"deathProbable":207,"totalTestEncountersViral":null,"totalTestsPeopleViral":595187,"totalTestsAntibody":null,"positiveTestsAntibody":null,"negativeTestsAntibody":null,"totalTestsPeopleAntibody":null,"positiveTestsPeopleAntibody":null,"negativeTestsPeopleAntibody":null,"totalTestsPeopleAntigen":null,"positiveTestsPeopleAntigen":null,"totalTestsAntigen":78973,"positiveTestsAntigen":null,"fips":"16","positiveIncrease":559,"negativeIncrease":2151,"total":624871,"totalTestResultsIncrease":2540,"posNeg":624871,"dataQualityGrade":null,"deathIncrease":7,"hospitalizedIncrease":35,"hash":"a07ebcdebb594341d1b0e0aef88a04b95ad5068a","commercialScore":0,"negativeRegularScore":0,"negativeScore":0,"positiveScore":0,"score":0,"grade":""},{"date":20210126,"state":"ID","positive":160033,"probableCases":29514,"negative":462128,"pending":null,"totalTestResultsSource":"totalTestsPeopleViral","totalTestResults":592647,"hospitalizedCurrently":169,"hospitalizedCumulative":6525,"inIcuCurrently":53,"inIcuCumulative":1135,"onVentilatorCurrently":null,"onVentilatorCumulative":null,"recovered":77351,"lastUpdateEt":"1/25/2021 19:00","dateModified":"2021-01-25T19:00:00Z","checkTimeEt":"01/25 14:00","death":1681,"hospitalized":6525,"hospitalizedDischarged":null,"dateChecked":"2021-01-25T19:00:00Z","totalTestsViral":966258,"positiveTestsViral":null,"negativeTestsViral":null,"positiveCasesViral":130519,"deathConfirmed":1475,"deathProbable":206,"totalTestEncountersViral":null,"totalTestsPeopleViral":592647,"totalTestsAntibody":null,"positiveTestsAntibody":null,"negativeTestsAntibody":null,"totalTestsPeopleAntibody":null,"positiveTestsPeopleAntibody":null,"negativeTestsPeopleAntibody":null,"totalTestsPeopleAntigen":null,"positiveTestsPeopleAntigen":null,"totalTestsAntigen":78973,"positiveTestsAntigen":null,"fips":"16","positiveIncrease":527,"negativeIncrease":1266,"total":622161,"totalTestResultsIncrease":1680,"posNeg":622161,"dataQualityGrade":null,"deathIncrease":12,"hospitalizedIncrease":29,"hash":"154aa261fcfc30d01e680083c3a0ab7fca7088d9","commercialScore":0,"negativeRegularScore":0,"negativeScore":0,"positiveScore":0,"score":0,"grade":""},{"date":20210125,"state":"ID","positive":159506,"probableCases":29401,"negative":460862,"pending":null,"totalTestResultsSource":"totalTestsPeopleViral","totalTestResults":590967,"hospitalizedCurrently":252,"hospitalizedCumulative":6496,"inIcuCurrently":67,"inIcuCumulative":1129,"onVentilatorCurrently":null,"onVentilatorCumulative":null,"recovered":76392,"lastUpdateEt":"1/24/2021 19:00","dateModified":"2021-01-24T19:00:00Z","checkTimeEt":"01/24 14:00","death":1669,"hospitalized":6496,"hospitalizedDischarged":null,"dateChecked":"2021-01-24T19:00:00Z","totalTestsViral":961106,"positiveTestsViral":null,"negativeTestsViral":null,"positiveCasesViral":130105,"deathConfirmed":1464,"deathProbable":205,"totalTestEncountersViral":null,"totalTestsPeopleViral":590967,"totalTestsAntibody":null,"positiveTestsAntibody":null,"negativeTestsAntibody":null,"totalTestsPeopleAntibody":null,"positiveTestsPeopleAntibody":null,"negativeTestsPeopleAntibody":null,"totalTestsPeopleAntigen":null,"positiveTestsPeopleAntigen":null,"totalTestsAntigen":78973,"positiveTestsAntigen":null,"fips":"16","positiveIncrease":181,"negativeIncrease":1188,"total":620368,"totalTestResultsIncrease":1338,"posNeg":620368,"dataQualityGrade":null,"deathIncrease":1,"hospitalizedIncrease":15,"hash":"bdcb79b8682969b9bfb15fcedca52d8ac360ab0e","commercialScore":0,"negativeRegularScore":0,"negativeScore":0,"positiveScore":0,"score":0,"grade":""},{"date":20210124,"state":"ID","positive":159325,"probableCases":29370,"negative":459674,"pending":null,"totalTestResultsSource":"totalTestsPeopleViral","totalTestResults":589629,"hospitalizedCurrently":252,"hospitalizedCumulative":6481,"inIcuCurrently":67,"inIcuCumulative":1127,"onVentilatorCurrently":null,"onVentilatorCumulative":null,"recovered":75752,"lastUpdateEt":"1/23/2021 19:00","dateModified":"2021-01-23T19:00:00Z","checkTimeEt":"01/23 14:00","death":1668,"hospitalized":6481,"hospitalizedDischarged":null,"dateChecked":"2021-01-23T19:00:00Z","totalTestsViral":958656,"positiveTestsViral":null,"negativeTestsViral":null,"positiveCasesViral":129955,"deathConfirmed":1464,"deathProbable":204,"totalTestEncountersViral":null,"totalTestsPeopleViral":589629,"totalTestsAntibody":null,"positiveTestsAntibody":null,"negativeTestsAntibody":null,"totalTestsPeopleAntibody":null,"positiveTestsPeopleAntibody":null,"negativeTestsPeopleAntibody":null,"totalTestsPeopleAntigen":null,"positiveTestsPeopleAntigen":null,"totalTestsAntigen":78973,"positiveTestsAntigen":null,"fips":"16","positiveIncrease":527,"negativeIncrease":1359,"total":618999,"totalTestResultsIncrease":1802,"posNeg":618999,"dataQualityGrade":null,"deathIncrease":1,"hospitalizedIncrease":17,"hash":"fca23580718b09069ed2d44206f72d1466bfa067","commercialScore":0,"negativeRegularScore":0,"negativeScore":0,"positiveScore":0,"score":0,"grade":""},{"date":20210123,"state":"ID","positive":158798,"probableCases":29286,"negative":458315,"pending":null,"totalTestResultsSource":"totalTestsPeopleViral","totalTestResults":587827,"hospitalizedCurrently":252,"hospitalizedCumulative":6464,"inIcuCurrently":67,"inIcuCumulative":1127,"onVentilatorCurrently":null,"onVentilatorCumulative":null,"recovered":75041,"lastUpdateEt":"1/22/2021 19:00","dateModified":"2021-01-22T19:00:00Z","checkTimeEt":"01/22 14:00","death":1667,"hospitalized":6464,"hospitalizedDischarged":null,"dateChecked":"2021-01-22T19:00:00Z","totalTestsViral":954658,"positiveTestsViral":null,"negativeTestsViral":null,"positiveCasesViral":129512,"deathConfirmed":1462,"deathProbable":205,"totalTestEncountersViral":null,"totalTestsPeopleViral":587827,"totalTestsAntibody":null,"positiveTestsAntibody":null,"negativeTestsAntibody":null,"totalTestsPeopleAntibody":null,"positiveTestsPeopleAntibody":null,"negativeTestsPeopleAntibody":null,"totalTestsPeopleAntigen":null,"positiveTestsPeopleAntigen":null,"totalTestsAntigen":78973,"positiveTestsAntigen":null,"fips":"16","positiveIncrease":598,"negativeIncrease":2019,"total":617113,"totalTestResultsIncrease":2468,"posNeg":617113,"dataQualityGrade":null,"deathIncrease":13,"hospitalizedIncrease":24,"hash":"039321214928b0d0b614c6eb0c84193a05b4cfe0","commercialScore":0,"negativeRegularScore":0,"negativeScore":0,"positiveScore":0,"score":0,"grade":""},{"date":20210122,"state":"ID","positive":158200,"probableCases":29137,"negative":456296,"pending":null,"totalTestResultsSource":"totalTestsPeopleViral","totalTestResults":585359,"hospitalizedCurrently":286,"hospitalizedCumulative":6440,"inIcuCurrently":71,"inIcuCumulative":1125,"onVentilatorCurrently":null,"onVentilatorCumulative":null,"recovered":74269,"lastUpdateEt":"1/21/2021 19:00","dateModified":"2021-01-21T19:00:00Z","checkTimeEt":"01/21 14:00","death":1654,"hospitalized":6440,"hospitalizedDischarged":null,"dateChecked":"2021-01-21T19:00:00Z","totalTestsViral":947759,"positiveTestsViral":null,"negativeTestsViral":null,"positiveCasesViral":129063,"deathConfirmed":1452,"deathProbable":202,"totalTestEncountersViral":null,"totalTestsPeopleViral":585359,"totalTestsAntibody":null,"positiveTestsAntibody":null,"negativeTestsAntibody":null,"totalTestsPeopleAntibody":null,"positiveTestsPeopleAntibody":null,"negativeTestsPeopleAntibody":null,"totalTestsPeopleAntigen":null,"positiveTestsPeopleAntigen":null,"totalTestsAntigen":78973,"positiveTestsAntigen":null,"fips":"16","positiveIncrease":612,"negativeIncrease":1488,"total":614496,"totalTestResultsIncrease":1918,"posNeg":614496,"dataQualityGrade":null,"deathIncrease":19,"hospitalizedIncrease":34,"hash":"e7f505ac3cd67dca7d75263d0051f8ca0bcc071b","commercialScore":0,"negativeRegularScore":0,"negativeScore":0,"positiveScore":0,"score":0,"grade":""},{"date":20210121,"state":"ID","positive":157588,"probableCases":28955,"negative":454808,"pending":null,"totalTestResultsSource":"totalTestsPeopleViral","totalTestResults":583441,"hospitalizedCurrently":286,"hospitalizedCumulative":6406,"inIcuCurrently":71,"inIcuCumulative":1117,"onVentilatorCurrently":null,"onVentilatorCumulative":null,"recovered":73517,"lastUpdateEt":"1/20/2021 19:00","dateModified":"2021-01-20T19:00:00Z","checkTimeEt":"01/20 14:00","death":1635,"hospitalized":6406,"hospitalizedDischarged":null,"dateChecked":"2021-01-20T19:00:00Z","totalTestsViral":942272,"positiveTestsViral":null,"negativeTestsViral":null,"positiveCasesViral":128633,"deathConfirmed":1436,"deathProbable":199,"totalTestEncountersViral":null,"totalTestsPeopleViral":583441,"totalTestsAntibody":null,"positiveTestsAntibody":null,"negativeTestsAntibody":null,"totalTestsPeopleAntibody":null,"positiveTestsPeopleAntibody":null,"negativeTestsPeopleAntibody":null,"totalTestsPeopleAntigen":null,"positiveTestsPeopleAntigen":null,"totalTestsAntigen":78973,"positiveTestsAntigen":null,"fips":"16","positiveIncrease":810,"negativeIncrease":1576,"total":612396,"totalTestResultsIncrease":2142,"posNeg":612396,"dataQualityGrade":null,"deathIncrease":-2,"hospitalizedIncrease":36,"hash":"1ab93d735766f99922201dd8bbf2e22bce717f26","commercialScore":0,"negativeRegularScore":0,"negativeScore":0,"positiveScore":0,"score":0,"grade":""},{"date":20210120,"state":"ID","positive":156778,"probableCases":28711,"negative":453232,"pending":null,"totalTestResultsSource":"totalTestsPeopleViral","totalTestResults":581299,"hospitalizedCurrently":266,"hospitalizedCumulative":6370,"inIcuCurrently":77,"inIcuCumulative":1114,"onVentilatorCurrently":null,"onVentilatorCumulative":null,"recovered":72711,"lastUpdateEt":"1/19/2021 19:00","dateModified":"2021-01-19T19:00:00Z","checkTimeEt":"01/19 14:00","death":1637,"hospitalized":6370,"hospitalizedDischarged":null,"dateChecked":"2021-01-19T19:00:00Z","totalTestsViral":937399,"positiveTestsViral":null,"negativeTestsViral":null,"positiveCasesViral":128067,"deathConfirmed":1438,"deathProbable":199,"totalTestEncountersViral":null,"totalTestsPeopleViral":581299,"totalTestsAntibody":null,"positiveTestsAntibody":null,"negativeTestsAntibody":null,"totalTestsPeopleAntibody":null,"positiveTestsPeopleAntibody":null,"negativeTestsPeopleAntibody":null,"totalTestsPeopleAntigen":null,"positiveTestsPeopleAntigen":null,"totalTestsAntigen":78973,"positiveTestsAntigen":null,"fips":"16","positiveIncrease":1224,"negativeIncrease":2386,"total":610010,"totalTestResultsIncrease":3361,"posNeg":610010,"dataQualityGrade":null,"deathIncrease":30,"hospitalizedIncrease":63,"hash":"8372e259814113daab8d39fb156f8ba31632d28a","commercialScore":0,"negativeRegularScore":0,"negativeScore":0,"positiveScore":0,"score":0,"grade":""},{"date":20210119,"state":"ID","positive":155554,"probableCases":28462,"negative":450846,"pending":null,"totalTestResultsSource":"totalTestsPeopleViral","totalTestResults":577938,"hospitalizedCurrently":345,"hospitalizedCumulative":6307,"inIcuCurrently":90,"inIcuCumulative":1106,"onVentilatorCurrently":null,"onVentilatorCumulative":null,"recovered":71374,"lastUpdateEt":"1/17/2021 19:00","dateModified":"2021-01-17T19:00:00Z","checkTimeEt":"01/17 14:00","death":1607,"hospitalized":6307,"hospitalizedDischarged":null,"dateChecked":"2021-01-17T19:00:00Z","totalTestsViral":929598,"positiveTestsViral":null,"negativeTestsViral":null,"positiveCasesViral":127092,"deathConfirmed":1415,"deathProbable":192,"totalTestEncountersViral":null,"totalTestsPeopleViral":577938,"totalTestsAntibody":null,"positiveTestsAntibody":null,"negativeTestsAntibody":null,"totalTestsPeopleAntibody":null,"positiveTestsPeopleAntibody":null,"negativeTestsPeopleAntibody":null,"totalTestsPeopleAntigen":null,"positiveTestsPeopleAntigen":null,"totalTestsAntigen":78973,"positiveTestsAntigen":null,"fips":"16","positiveIncrease":0,"negativeIncrease":0,"total":606400,"totalTestResultsIncrease":0,"posNeg":606400,"dataQualityGrade":null,"deathIncrease":0,"hospitalizedIncrease":0,"hash":"2e11fb4667bcf219c2e289cb20bbfaf6bd9f0868","commercialScore":0,"negativeRegularScore":0,"negativeScore":0,"positiveScore":0,"score":0,"grade":""},{"date":20210118,"state":"ID","positive":155554,"probableCases":28462,"negative":450846,"pending":null,"totalTestResultsSource":"totalTestsPeopleViral","totalTestResults":577938,"hospitalizedCurrently":345,"hospitalizedCumulative":6307,"inIcuCurrently":90,"inIcuCumulative":1106,"onVentilatorCurrently":null,"onVentilatorCumulative":null,"recovered":71374,"lastUpdateEt":"1/17/2021 19:00","dateModified":"2021-01-17T19:00:00Z","checkTimeEt":"01/17 14:00","death":1607,"hospitalized":6307,"hospitalizedDischarged":null,"dateChecked":"2021-01-17T19:00:00Z","totalTestsViral":929598,"positiveTestsViral":null,"negativeTestsViral":null,"positiveCasesViral":127092,"deathConfirmed":1415,"deathProbable":192,"totalTestEncountersViral":null,"totalTestsPeopleViral":577938,"totalTestsAntibody":null,"positiveTestsAntibody":null,"negativeTestsAntibody":null,"totalTestsPeopleAntibody":null,"positiveTestsPeopleAntibody":null,"negativeTestsPeopleAntibody":null,"totalTestsPeopleAntigen":null,"positiveTestsPeopleAntigen":null,"totalTestsAntigen":78973,"positiveTestsAntigen":null,"fips":"16","positiveIncrease":278,"negativeIncrease":1783,"total":606400,"totalTestResultsIncrease":1930,"posNeg":606400,"dataQualityGrade":null,"deathIncrease":2,"hospitalizedIncrease":12,"hash":"271d585cdcead197f5146595a663e68a6850cb6e","commercialScore":0,"negativeRegularScore":0,"negativeScore":0,"positiveScore":0,"score":0,"grade":""},{"date":20210117,"state":"ID","positive":155276,"probableCases":28331,"negative":449063,"pending":null,"totalTestResultsSource":"totalTestsPeopleViral","totalTestResults":576008,"hospitalizedCurrently":345,"hospitalizedCumulative":6295,"inIcuCurrently":90,"inIcuCumulative":1103,"onVentilatorCurrently":null,"onVentilatorCumulative":null,"recovered":70736,"lastUpdateEt":"1/16/2021 19:00","dateModified":"2021-01-16T19:00:00Z","checkTimeEt":"01/16 14:00","death":1605,"hospitalized":6295,"hospitalizedDischarged":null,"dateChecked":"2021-01-16T19:00:00Z","totalTestsViral":926337,"positiveTestsViral":null,"negativeTestsViral":null,"positiveCasesViral":126945,"deathConfirmed":1414,"deathProbable":191,"totalTestEncountersViral":null,"totalTestsPeopleViral":576008,"totalTestsAntibody":null,"positiveTestsAntibody":null,"negativeTestsAntibody":null,"totalTestsPeopleAntibody":null,"positiveTestsPeopleAntibody":null,"negativeTestsPeopleAntibody":null,"totalTestsPeopleAntigen":null,"positiveTestsPeopleAntigen":null,"totalTestsAntigen":78973,"positiveTestsAntigen":null,"fips":"16","positiveIncrease":806,"negativeIncrease":1197,"total":604339,"totalTestResultsIncrease":1720,"posNeg":604339,"dataQualityGrade":null,"deathIncrease":2,"hospitalizedIncrease":26,"hash":"36889d9b4cc6dac65e5bcc145597e6524192b769","commercialScore":0,"negativeRegularScore":0,"negativeScore":0,"positiveScore":0,"score":0,"grade":""},{"date":20210116,"state":"ID","positive":154470,"probableCases":28048,"negative":447866,"pending":null,"totalTestResultsSource":"totalTestsPeopleViral","totalTestResults":574288,"hospitalizedCurrently":345,"hospitalizedCumulative":6269,"inIcuCurrently":90,"inIcuCumulative":1098,"onVentilatorCurrently":null,"onVentilatorCumulative":null,"recovered":70163,"lastUpdateEt":"1/15/2021 19:00","dateModified":"2021-01-15T19:00:00Z","checkTimeEt":"01/15 14:00","death":1603,"hospitalized":6269,"hospitalizedDischarged":null,"dateChecked":"2021-01-15T19:00:00Z","totalTestsViral":923207,"positiveTestsViral":null,"negativeTestsViral":null,"positiveCasesViral":126422,"deathConfirmed":1412,"deathProbable":191,"totalTestEncountersViral":null,"totalTestsPeopleViral":574288,"totalTestsAntibody":null,"positiveTestsAntibody":null,"negativeTestsAntibody":null,"totalTestsPeopleAntibody":null,"positiveTestsPeopleAntibody":null,"negativeTestsPeopleAntibody":null,"totalTestsPeopleAntigen":null,"positiveTestsPeopleAntigen":null,"totalTestsAntigen":78973,"positiveTestsAntigen":null,"fips":"16","positiveIncrease":1112,"negativeIncrease":1804,"total":602336,"totalTestResultsIncrease":2475,"posNeg":602336,"dataQualityGrade":null,"deathIncrease":12,"hospitalizedIncrease":44,"hash":"35ca641256f72fd44cf12678a36c288d073f590e","commercialScore":0,"negativeRegularScore":0,"negativeScore":0,"positiveScore":0,"score":0,"grade":""},{"date":20210115,"state":"ID","positive":153358,"probableCases":27607,"negative":446062,"pending":null,"totalTestResultsSource":"totalTestsPeopleViral","totalTestResults":571813,"hospitalizedCurrently":338,"hospitalizedCumulative":6225,"inIcuCurrently":88,"inIcuCumulative":1091,"onVentilatorCurrently":null,"onVentilatorCumulative":null,"recovered":69460,"lastUpdateEt":"1/14/2021 19:00","dateModified":"2021-01-14T19:00:00Z","checkTimeEt":"01/14 14:00","death":1591,"hospitalized":6225,"hospitalizedDischarged":null,"dateChecked":"2021-01-14T19:00:00Z","totalTestsViral":917901,"positiveTestsViral":null,"negativeTestsViral":null,"positiveCasesViral":125751,"deathConfirmed":1401,"deathProbable":190,"totalTestEncountersViral":null,"totalTestsPeopleViral":571813,"totalTestsAntibody":null,"positiveTestsAntibody":null,"negativeTestsAntibody":null,"totalTestsPeopleAntibody":null,"positiveTestsPeopleAntibody":null,"negativeTestsPeopleAntibody":null,"totalTestsPeopleAntigen":null,"positiveTestsPeopleAntigen":null,"totalTestsAntigen":78973,"positiveTestsAntigen":null,"fips":"16","positiveIncrease":994,"negativeIncrease":1899,"total":599420,"totalTestResultsIncrease":2614,"posNeg":599420,"dataQualityGrade":null,"deathIncrease":27,"hospitalizedIncrease":47,"hash":"008f7ec8310e0653ee14d4a94660f69fcf31eb13","commercialScore":0,"negativeRegularScore":0,"negativeScore":0,"positiveScore":0,"score":0,"grade":""},{"date":20210114,"state":"ID","positive":152364,"probableCases":27328,"negative":444163,"pending":null,"totalTestResultsSource":"totalTestsPeopleViral","totalTestResults":569199,"hospitalizedCurrently":338,"hospitalizedCumulative":6178,"inIcuCurrently":88,"inIcuCumulative":1084,"onVentilatorCurrently":null,"onVentilatorCumulative":null,"recovered":68657,"lastUpdateEt":"1/13/2021 19:00","dateModified":"2021-01-13T19:00:00Z","checkTimeEt":"01/13 14:00","death":1564,"hospitalized":6178,"hospitalizedDischarged":null,"dateChecked":"2021-01-13T19:00:00Z","totalTestsViral":909722,"positiveTestsViral":null,"negativeTestsViral":null,"positiveCasesViral":125036,"deathConfirmed":1378,"deathProbable":186,"totalTestEncountersViral":null,"totalTestsPeopleViral":569199,"totalTestsAntibody":null,"positiveTestsAntibody":null,"negativeTestsAntibody":null,"totalTestsPeopleAntibody":null,"positiveTestsPeopleAntibody":null,"negativeTestsPeopleAntibody":null,"totalTestsPeopleAntigen":null,"positiveTestsPeopleAntigen":null,"totalTestsAntigen":78973,"positiveTestsAntigen":null,"fips":"16","positiveIncrease":1091,"negativeIncrease":2186,"total":596527,"totalTestResultsIncrease":2974,"posNeg":596527,"dataQualityGrade":null,"deathIncrease":8,"hospitalizedIncrease":50,"hash":"b6cb4d04263795035548487f2fb04e779b94c462","commercialScore":0,"negativeRegularScore":0,"negativeScore":0,"positiveScore":0,"score":0,"grade":""},{"date":20210113,"state":"ID","positive":151273,"probableCases":27025,"negative":441977,"pending":null,"totalTestResultsSource":"totalTestsPeopleViral","totalTestResults":566225,"hospitalizedCurrently":283,"hospitalizedCumulative":6128,"inIcuCurrently":72,"inIcuCumulative":1076,"onVentilatorCurrently":null,"onVentilatorCumulative":null,"recovered":67633,"lastUpdateEt":"1/12/2021 19:00","dateModified":"2021-01-12T19:00:00Z","checkTimeEt":"01/12 14:00","death":1556,"hospitalized":6128,"hospitalizedDischarged":null,"dateChecked":"2021-01-12T19:00:00Z","totalTestsViral":903361,"positiveTestsViral":null,"negativeTestsViral":null,"positiveCasesViral":124248,"deathConfirmed":1373,"deathProbable":183,"totalTestEncountersViral":null,"totalTestsPeopleViral":566225,"totalTestsAntibody":null,"positiveTestsAntibody":null,"negativeTestsAntibody":null,"totalTestsPeopleAntibody":null,"positiveTestsPeopleAntibody":null,"negativeTestsPeopleAntibody":null,"totalTestsPeopleAntigen":null,"positiveTestsPeopleAntigen":null,"totalTestsAntigen":78973,"positiveTestsAntigen":null,"fips":"16","positiveIncrease":1034,"negativeIncrease":779,"total":593250,"totalTestResultsIncrease":1510,"posNeg":593250,"dataQualityGrade":null,"deathIncrease":12,"hospitalizedIncrease":49,"hash":"a8f062867197d476a61c5b0516eef5ad8862aa42","commercialScore":0,"negativeRegularScore":0,"negativeScore":0,"positiveScore":0,"score":0,"grade":""},{"date":20210112,"state":"ID","positive":150239,"probableCases":26722,"negative":441198,"pending":null,"totalTestResultsSource":"totalTestsPeopleViral","totalTestResults":564715,"hospitalizedCurrently":283,"hospitalizedCumulative":6079,"inIcuCurrently":72,"inIcuCumulative":1076,"onVentilatorCurrently":null,"onVentilatorCumulative":null,"recovered":66796,"lastUpdateEt":"1/11/2021 19:00","dateModified":"2021-01-11T19:00:00Z","checkTimeEt":"01/11 14:00","death":1544,"hospitalized":6079,"hospitalizedDischarged":null,"dateChecked":"2021-01-11T19:00:00Z","totalTestsViral":899887,"positiveTestsViral":null,"negativeTestsViral":null,"positiveCasesViral":123517,"deathConfirmed":1363,"deathProbable":179,"totalTestEncountersViral":null,"totalTestsPeopleViral":564715,"totalTestsAntibody":null,"positiveTestsAntibody":null,"negativeTestsAntibody":null,"totalTestsPeopleAntibody":null,"positiveTestsPeopleAntibody":null,"negativeTestsPeopleAntibody":null,"totalTestsPeopleAntigen":null,"positiveTestsPeopleAntigen":null,"totalTestsAntigen":78973,"positiveTestsAntigen":null,"fips":"16","positiveIncrease":572,"negativeIncrease":1560,"total":591437,"totalTestResultsIncrease":2000,"posNeg":591437,"dataQualityGrade":null,"deathIncrease":10,"hospitalizedIncrease":42,"hash":"e99c8145e69051e5a11024198b169ffd0604bdfa","commercialScore":0,"negativeRegularScore":0,"negativeScore":0,"positiveScore":0,"score":0,"grade":""},{"date":20210111,"state":"ID","positive":149667,"probableCases":26590,"negative":439638,"pending":null,"totalTestResultsSource":"totalTestsPeopleViral","totalTestResults":562715,"hospitalizedCurrently":375,"hospitalizedCumulative":6037,"inIcuCurrently":76,"inIcuCumulative":1074,"onVentilatorCurrently":null,"onVentilatorCumulative":null,"recovered":66012,"lastUpdateEt":"1/10/2021 19:00","dateModified":"2021-01-10T19:00:00Z","checkTimeEt":"01/10 14:00","death":1534,"hospitalized":6037,"hospitalizedDischarged":null,"dateChecked":"2021-01-10T19:00:00Z","totalTestsViral":895449,"positiveTestsViral":null,"negativeTestsViral":null,"positiveCasesViral":123077,"deathConfirmed":1355,"deathProbable":179,"totalTestEncountersViral":null,"totalTestsPeopleViral":562715,"totalTestsAntibody":null,"positiveTestsAntibody":null,"negativeTestsAntibody":null,"totalTestsPeopleAntibody":null,"positiveTestsPeopleAntibody":null,"negativeTestsPeopleAntibody":null,"totalTestsPeopleAntigen":null,"positiveTestsPeopleAntigen":null,"totalTestsAntigen":78973,"positiveTestsAntigen":null,"fips":"16","positiveIncrease":432,"negativeIncrease":1067,"total":589305,"totalTestResultsIncrease":1408,"posNeg":589305,"dataQualityGrade":null,"deathIncrease":6,"hospitalizedIncrease":22,"hash":"8aa3387b069d6069e3eaad035990605a11d9a3ef","commercialScore":0,"negativeRegularScore":0,"negativeScore":0,"positiveScore":0,"score":0,"grade":""},{"date":20210110,"state":"ID","positive":149235,"probableCases":26499,"negative":438571,"pending":null,"totalTestResultsSource":"totalTestsPeopleViral","totalTestResults":561307,"hospitalizedCurrently":375,"hospitalizedCumulative":6015,"inIcuCurrently":76,"inIcuCumulative":1070,"onVentilatorCurrently":null,"onVentilatorCumulative":null,"recovered":64785,"lastUpdateEt":"1/9/2021 19:00","dateModified":"2021-01-09T19:00:00Z","checkTimeEt":"01/09 14:00","death":1528,"hospitalized":6015,"hospitalizedDischarged":null,"dateChecked":"2021-01-09T19:00:00Z","totalTestsViral":893010,"positiveTestsViral":null,"negativeTestsViral":null,"positiveCasesViral":122736,"deathConfirmed":1349,"deathProbable":179,"totalTestEncountersViral":null,"totalTestsPeopleViral":561307,"totalTestsAntibody":null,"positiveTestsAntibody":null,"negativeTestsAntibody":null,"totalTestsPeopleAntibody":null,"positiveTestsPeopleAntibody":null,"negativeTestsPeopleAntibody":null,"totalTestsPeopleAntigen":null,"positiveTestsPeopleAntigen":null,"totalTestsAntigen":78973,"positiveTestsAntigen":null,"fips":"16","positiveIncrease":977,"negativeIncrease":1154,"total":587806,"totalTestResultsIncrease":1936,"posNeg":587806,"dataQualityGrade":null,"deathIncrease":5,"hospitalizedIncrease":20,"hash":"9b4b08312b3d660a85d4cef74af3dff4ff57bf20","commercialScore":0,"negativeRegularScore":0,"negativeScore":0,"positiveScore":0,"score":0,"grade":""},{"date":20210109,"state":"ID","positive":148258,"probableCases":26304,"negative":437417,"pending":null,"totalTestResultsSource":"totalTestsPeopleViral","totalTestResults":559371,"hospitalizedCurrently":375,"hospitalizedCumulative":5995,"inIcuCurrently":76,"inIcuCumulative":1062,"onVentilatorCurrently":null,"onVentilatorCumulative":null,"recovered":64538,"lastUpdateEt":"1/8/2021 19:00","dateModified":"2021-01-08T19:00:00Z","checkTimeEt":"01/08 14:00","death":1523,"hospitalized":5995,"hospitalizedDischarged":null,"dateChecked":"2021-01-08T19:00:00Z","totalTestsViral":888716,"positiveTestsViral":null,"negativeTestsViral":null,"positiveCasesViral":121954,"deathConfirmed":1344,"deathProbable":179,"totalTestEncountersViral":null,"totalTestsPeopleViral":559371,"totalTestsAntibody":null,"positiveTestsAntibody":null,"negativeTestsAntibody":null,"totalTestsPeopleAntibody":null,"positiveTestsPeopleAntibody":null,"negativeTestsPeopleAntibody":null,"totalTestsPeopleAntigen":null,"positiveTestsPeopleAntigen":null,"totalTestsAntigen":78973,"positiveTestsAntigen":null,"fips":"16","positiveIncrease":1085,"negativeIncrease":1389,"total":585675,"totalTestResultsIncrease":2227,"posNeg":585675,"dataQualityGrade":null,"deathIncrease":6,"hospitalizedIncrease":57,"hash":"16af56a2662477117d257b93fe98778b8775061d","commercialScore":0,"negativeRegularScore":0,"negativeScore":0,"positiveScore":0,"score":0,"grade":""},{"date":20210108,"state":"ID","positive":147173,"probableCases":26057,"negative":436028,"pending":null,"totalTestResultsSource":"totalTestsPeopleViral","totalTestResults":557144,"hospitalizedCurrently":366,"hospitalizedCumulative":5938,"inIcuCurrently":77,"inIcuCumulative":1055,"onVentilatorCurrently":null,"onVentilatorCumulative":null,"recovered":63778,"lastUpdateEt":"1/7/2021 19:00","dateModified":"2021-01-07T19:00:00Z","checkTimeEt":"01/07 14:00","death":1517,"hospitalized":5938,"hospitalizedDischarged":null,"dateChecked":"2021-01-07T19:00:00Z","totalTestsViral":881852,"positiveTestsViral":null,"negativeTestsViral":null,"positiveCasesViral":121116,"deathConfirmed":1339,"deathProbable":178,"totalTestEncountersViral":null,"totalTestsPeopleViral":557144,"totalTestsAntibody":null,"positiveTestsAntibody":null,"negativeTestsAntibody":null,"totalTestsPeopleAntibody":null,"positiveTestsPeopleAntibody":null,"negativeTestsPeopleAntibody":null,"totalTestsPeopleAntigen":null,"positiveTestsPeopleAntigen":null,"totalTestsAntigen":78973,"positiveTestsAntigen":null,"fips":"16","positiveIncrease":1067,"negativeIncrease":2126,"total":583201,"totalTestResultsIncrease":2848,"posNeg":583201,"dataQualityGrade":null,"deathIncrease":29,"hospitalizedIncrease":67,"hash":"b8c174af2c40f700d20e6012e9492d06a915d898","commercialScore":0,"negativeRegularScore":0,"negativeScore":0,"positiveScore":0,"score":0,"grade":""},{"date":20210107,"state":"ID","positive":146106,"probableCases":25712,"negative":433902,"pending":null,"totalTestResultsSource":"totalTestsPeopleViral","totalTestResults":554296,"hospitalizedCurrently":366,"hospitalizedCumulative":5871,"inIcuCurrently":77,"inIcuCumulative":1043,"onVentilatorCurrently":null,"onVentilatorCumulative":null,"recovered":63097,"lastUpdateEt":"1/6/2021 19:00","dateModified":"2021-01-06T19:00:00Z","checkTimeEt":"01/06 14:00","death":1488,"hospitalized":5871,"hospitalizedDischarged":null,"dateChecked":"2021-01-06T19:00:00Z","totalTestsViral":876370,"positiveTestsViral":null,"negativeTestsViral":null,"positiveCasesViral":120394,"deathConfirmed":1313,"deathProbable":175,"totalTestEncountersViral":null,"totalTestsPeopleViral":554296,"totalTestsAntibody":null,"positiveTestsAntibody":null,"negativeTestsAntibody":null,"totalTestsPeopleAntibody":null,"positiveTestsPeopleAntibody":null,"negativeTestsPeopleAntibody":null,"totalTestsPeopleAntigen":null,"positiveTestsPeopleAntigen":null,"totalTestsAntigen":52274,"positiveTestsAntigen":null,"fips":"16","positiveIncrease":1263,"negativeIncrease":1337,"total":580008,"totalTestResultsIncrease":2270,"posNeg":580008,"dataQualityGrade":null,"deathIncrease":17,"hospitalizedIncrease":47,"hash":"71bae0b971814db52b9e762bdb6e3ef8b8c28df6","commercialScore":0,"negativeRegularScore":0,"negativeScore":0,"positiveScore":0,"score":0,"grade":""},{"date":20210106,"state":"ID","positive":144843,"probableCases":25382,"negative":432565,"pending":null,"totalTestResultsSource":"totalTestsPeopleViral","totalTestResults":552026,"hospitalizedCurrently":254,"hospitalizedCumulative":5824,"inIcuCurrently":54,"inIcuCumulative":1040,"onVentilatorCurrently":null,"onVentilatorCumulative":null,"recovered":62215,"lastUpdateEt":"1/5/2021 19:00","dateModified":"2021-01-05T19:00:00Z","checkTimeEt":"01/05 14:00","death":1471,"hospitalized":5824,"hospitalizedDischarged":null,"dateChecked":"2021-01-05T19:00:00Z","totalTestsViral":871888,"positiveTestsViral":null,"negativeTestsViral":null,"positiveCasesViral":119461,"deathConfirmed":1298,"deathProbable":173,"totalTestEncountersViral":null,"totalTestsPeopleViral":552026,"totalTestsAntibody":null,"positiveTestsAntibody":null,"negativeTestsAntibody":null,"totalTestsPeopleAntibody":null,"positiveTestsPeopleAntibody":null,"negativeTestsPeopleAntibody":null,"totalTestsPeopleAntigen":null,"positiveTestsPeopleAntigen":null,"totalTestsAntigen":52274,"positiveTestsAntigen":null,"fips":"16","positiveIncrease":1538,"negativeIncrease":735,"total":577408,"totalTestResultsIncrease":1718,"posNeg":577408,"dataQualityGrade":null,"deathIncrease":12,"hospitalizedIncrease":79,"hash":"c8e2bb361b39df2072763e6c0d729d7f596e9692","commercialScore":0,"negativeRegularScore":0,"negativeScore":0,"positiveScore":0,"score":0,"grade":""},{"date":20210105,"state":"ID","positive":143305,"probableCases":24827,"negative":431830,"pending":null,"totalTestResultsSource":"totalTestsPeopleViral","totalTestResults":550308,"hospitalizedCurrently":254,"hospitalizedCumulative":5745,"inIcuCurrently":54,"inIcuCumulative":1036,"onVentilatorCurrently":null,"onVentilatorCumulative":null,"recovered":61493,"lastUpdateEt":"1/4/2021 19:00","dateModified":"2021-01-04T19:00:00Z","checkTimeEt":"01/04 14:00","death":1459,"hospitalized":5745,"hospitalizedDischarged":null,"dateChecked":"2021-01-04T19:00:00Z","totalTestsViral":867462,"positiveTestsViral":null,"negativeTestsViral":null,"positiveCasesViral":118478,"deathConfirmed":1290,"deathProbable":169,"totalTestEncountersViral":null,"totalTestsPeopleViral":550308,"totalTestsAntibody":null,"positiveTestsAntibody":null,"negativeTestsAntibody":null,"totalTestsPeopleAntibody":null,"positiveTestsPeopleAntibody":null,"negativeTestsPeopleAntibody":null,"totalTestsPeopleAntigen":null,"positiveTestsPeopleAntigen":null,"totalTestsAntigen":52274,"positiveTestsAntigen":null,"fips":"16","positiveIncrease":798,"negativeIncrease":629,"total":575135,"totalTestResultsIncrease":1209,"posNeg":575135,"dataQualityGrade":null,"deathIncrease":11,"hospitalizedIncrease":39,"hash":"4c31754e90fde4b7f1170482fc0466c503968ea0","commercialScore":0,"negativeRegularScore":0,"negativeScore":0,"positiveScore":0,"score":0,"grade":""},{"date":20210104,"state":"ID","positive":142507,"probableCases":24609,"negative":431201,"pending":null,"totalTestResultsSource":"totalTestsPeopleViral","totalTestResults":549099,"hospitalizedCurrently":352,"hospitalizedCumulative":5706,"inIcuCurrently":84,"inIcuCumulative":1030,"onVentilatorCurrently":null,"onVentilatorCumulative":null,"recovered":60820,"lastUpdateEt":"1/3/2021 19:00","dateModified":"2021-01-03T19:00:00Z","checkTimeEt":"01/03 14:00","death":1448,"hospitalized":5706,"hospitalizedDischarged":null,"dateChecked":"2021-01-03T19:00:00Z","totalTestsViral":863660,"positiveTestsViral":null,"negativeTestsViral":null,"positiveCasesViral":117898,"deathConfirmed":1281,"deathProbable":167,"totalTestEncountersViral":null,"totalTestsPeopleViral":549099,"totalTestsAntibody":null,"positiveTestsAntibody":null,"negativeTestsAntibody":null,"totalTestsPeopleAntibody":null,"positiveTestsPeopleAntibody":null,"negativeTestsPeopleAntibody":null,"totalTestsPeopleAntigen":null,"positiveTestsPeopleAntigen":null,"totalTestsAntigen":52274,"positiveTestsAntigen":null,"fips":"16","positiveIncrease":308,"negativeIncrease":829,"total":573708,"totalTestResultsIncrease":1091,"posNeg":573708,"dataQualityGrade":null,"deathIncrease":0,"hospitalizedIncrease":19,"hash":"de1e8cfe0c45601d4fe2766f6ba87e5a468defd6","commercialScore":0,"negativeRegularScore":0,"negativeScore":0,"positiveScore":0,"score":0,"grade":""},{"date":20210103,"state":"ID","positive":142199,"probableCases":24563,"negative":430372,"pending":null,"totalTestResultsSource":"totalTestsPeopleViral","totalTestResults":548008,"hospitalizedCurrently":352,"hospitalizedCumulative":5687,"inIcuCurrently":84,"inIcuCumulative":1024,"onVentilatorCurrently":null,"onVentilatorCumulative":null,"recovered":60164,"lastUpdateEt":"1/2/2021 19:00","dateModified":"2021-01-02T19:00:00Z","checkTimeEt":"01/02 14:00","death":1448,"hospitalized":5687,"hospitalizedDischarged":null,"dateChecked":"2021-01-02T19:00:00Z","totalTestsViral":861643,"positiveTestsViral":null,"negativeTestsViral":null,"positiveCasesViral":117636,"deathConfirmed":1281,"deathProbable":167,"totalTestEncountersViral":null,"totalTestsPeopleViral":548008,"totalTestsAntibody":null,"positiveTestsAntibody":null,"negativeTestsAntibody":null,"totalTestsPeopleAntibody":null,"positiveTestsPeopleAntibody":null,"negativeTestsPeopleAntibody":null,"totalTestsPeopleAntigen":null,"positiveTestsPeopleAntigen":null,"totalTestsAntigen":52274,"positiveTestsAntigen":null,"fips":"16","positiveIncrease":1122,"negativeIncrease":1604,"total":572571,"totalTestResultsIncrease":2523,"posNeg":572571,"dataQualityGrade":null,"deathIncrease":12,"hospitalizedIncrease":57,"hash":"a07dee66da3d165defb1cd91b9724a94dde54fed","commercialScore":0,"negativeRegularScore":0,"negativeScore":0,"positiveScore":0,"score":0,"grade":""},{"date":20210102,"state":"ID","positive":141077,"probableCases":24360,"negative":428768,"pending":null,"totalTestResultsSource":"totalTestsPeopleViral","totalTestResults":545485,"hospitalizedCurrently":375,"hospitalizedCumulative":5630,"inIcuCurrently":85,"inIcuCumulative":1018,"onVentilatorCurrently":null,"onVentilatorCumulative":null,"recovered":58649,"lastUpdateEt":"12/31/2020 19:00","dateModified":"2020-12-31T19:00:00Z","checkTimeEt":"12/31 14:00","death":1436,"hospitalized":5630,"hospitalizedDischarged":null,"dateChecked":"2020-12-31T19:00:00Z","totalTestsViral":859851,"positiveTestsViral":null,"negativeTestsViral":null,"positiveCasesViral":116717,"deathConfirmed":1269,"deathProbable":167,"totalTestEncountersViral":null,"totalTestsPeopleViral":545485,"totalTestsAntibody":null,"positiveTestsAntibody":null,"negativeTestsAntibody":null,"totalTestsPeopleAntibody":null,"positiveTestsPeopleAntibody":null,"negativeTestsPeopleAntibody":null,"totalTestsPeopleAntigen":null,"positiveTestsPeopleAntigen":null,"totalTestsAntigen":52274,"positiveTestsAntigen":null,"fips":"16","positiveIncrease":0,"negativeIncrease":0,"total":569845,"totalTestResultsIncrease":0,"posNeg":569845,"dataQualityGrade":null,"deathIncrease":0,"hospitalizedIncrease":0,"hash":"960072397c8bc8e545b90b728ce161a57ade2795","commercialScore":0,"negativeRegularScore":0,"negativeScore":0,"positiveScore":0,"score":0,"grade":""},{"date":20210101,"state":"ID","positive":141077,"probableCases":24360,"negative":428768,"pending":null,"totalTestResultsSource":"totalTestsPeopleViral","totalTestResults":545485,"hospitalizedCurrently":375,"hospitalizedCumulative":5630,"inIcuCurrently":85,"inIcuCumulative":1018,"onVentilatorCurrently":null,"onVentilatorCumulative":null,"recovered":58649,"lastUpdateEt":"12/31/2020 19:00","dateModified":"2020-12-31T19:00:00Z","checkTimeEt":"12/31 14:00","death":1436,"hospitalized":5630,"hospitalizedDischarged":null,"dateChecked":"2020-12-31T19:00:00Z","totalTestsViral":859851,"positiveTestsViral":null,"negativeTestsViral":null,"positiveCasesViral":116717,"deathConfirmed":1269,"deathProbable":167,"totalTestEncountersViral":null,"totalTestsPeopleViral":545485,"totalTestsAntibody":null,"positiveTestsAntibody":null,"negativeTestsAntibody":null,"totalTestsPeopleAntibody":null,"positiveTestsPeopleAntibody":null,"negativeTestsPeopleAntibody":null,"totalTestsPeopleAntigen":null,"positiveTestsPeopleAntigen":null,"totalTestsAntigen":52274,"positiveTestsAntigen":null,"fips":"16","positiveIncrease":1213,"negativeIncrease":1350,"total":569845,"totalTestResultsIncrease":2217,"posNeg":569845,"dataQualityGrade":null,"deathIncrease":33,"hospitalizedIncrease":63,"hash":"ecfb8d5ee5ff6e86d4e2781a793daaef935d6649","commercialScore":0,"negativeRegularScore":0,"negativeScore":0,"positiveScore":0,"score":0,"grade":""},{"date":20201231,"state":"ID","positive":139864,"probableCases":24014,"negative":427418,"pending":null,"totalTestResultsSource":"totalTestsPeopleViral","totalTestResults":543268,"hospitalizedCurrently":375,"hospitalizedCumulative":5567,"inIcuCurrently":85,"inIcuCumulative":1012,"onVentilatorCurrently":null,"onVentilatorCumulative":null,"recovered":57770,"lastUpdateEt":"12/30/2020 19:00","dateModified":"2020-12-30T19:00:00Z","checkTimeEt":"12/30 14:00","death":1403,"hospitalized":5567,"hospitalizedDischarged":null,"dateChecked":"2020-12-30T19:00:00Z","totalTestsViral":855567,"positiveTestsViral":null,"negativeTestsViral":null,"positiveCasesViral":115850,"deathConfirmed":1240,"deathProbable":163,"totalTestEncountersViral":null,"totalTestsPeopleViral":543268,"totalTestsAntibody":null,"positiveTestsAntibody":null,"negativeTestsAntibody":null,"totalTestsPeopleAntibody":null,"positiveTestsPeopleAntibody":null,"negativeTestsPeopleAntibody":null,"totalTestsPeopleAntigen":null,"positiveTestsPeopleAntigen":null,"totalTestsAntigen":52274,"positiveTestsAntigen":null,"fips":"16","positiveIncrease":1340,"negativeIncrease":1781,"total":567282,"totalTestResultsIncrease":2798,"posNeg":567282,"dataQualityGrade":null,"deathIncrease":10,"hospitalizedIncrease":48,"hash":"775eb72f7298eaeb2405d725771110e3b1e23728","commercialScore":0,"negativeRegularScore":0,"negativeScore":0,"positiveScore":0,"score":0,"grade":""},{"date":20201230,"state":"ID","positive":138524,"probableCases":23691,"negative":425637,"pending":null,"totalTestResultsSource":"totalTestsPeopleViral","totalTestResults":540470,"hospitalizedCurrently":280,"hospitalizedCumulative":5519,"inIcuCurrently":77,"inIcuCumulative":1003,"onVentilatorCurrently":null,"onVentilatorCumulative":null,"recovered":56799,"lastUpdateEt":"12/29/2020 19:00","dateModified":"2020-12-29T19:00:00Z","checkTimeEt":"12/29 14:00","death":1393,"hospitalized":5519,"hospitalizedDischarged":null,"dateChecked":"2020-12-29T19:00:00Z","totalTestsViral":850169,"positiveTestsViral":null,"negativeTestsViral":null,"positiveCasesViral":114833,"deathConfirmed":1232,"deathProbable":161,"totalTestEncountersViral":null,"totalTestsPeopleViral":540470,"totalTestsAntibody":null,"positiveTestsAntibody":null,"negativeTestsAntibody":null,"totalTestsPeopleAntibody":null,"positiveTestsPeopleAntibody":null,"negativeTestsPeopleAntibody":null,"totalTestsPeopleAntigen":null,"positiveTestsPeopleAntigen":null,"totalTestsAntigen":52274,"positiveTestsAntigen":null,"fips":"16","positiveIncrease":1514,"negativeIncrease":492,"total":564161,"totalTestResultsIncrease":1590,"posNeg":564161,"dataQualityGrade":null,"deathIncrease":16,"hospitalizedIncrease":43,"hash":"a9fc519f6144356cf95f46c60e8810a58f747697","commercialScore":0,"negativeRegularScore":0,"negativeScore":0,"positiveScore":0,"score":0,"grade":""},{"date":20201229,"state":"ID","positive":137010,"probableCases":23275,"negative":425145,"pending":null,"totalTestResultsSource":"totalTestsPeopleViral","totalTestResults":538880,"hospitalizedCurrently":280,"hospitalizedCumulative":5476,"inIcuCurrently":77,"inIcuCumulative":999,"onVentilatorCurrently":null,"onVentilatorCumulative":null,"recovered":55959,"lastUpdateEt":"12/28/2020 19:00","dateModified":"2020-12-28T19:00:00Z","checkTimeEt":"12/28 14:00","death":1377,"hospitalized":5476,"hospitalizedDischarged":null,"dateChecked":"2020-12-28T19:00:00Z","totalTestsViral":846888,"positiveTestsViral":null,"negativeTestsViral":null,"positiveCasesViral":113735,"deathConfirmed":1216,"deathProbable":161,"totalTestEncountersViral":null,"totalTestsPeopleViral":538880,"totalTestsAntibody":null,"positiveTestsAntibody":null,"negativeTestsAntibody":null,"totalTestsPeopleAntibody":null,"positiveTestsPeopleAntibody":null,"negativeTestsPeopleAntibody":null,"totalTestsPeopleAntigen":null,"positiveTestsPeopleAntigen":null,"totalTestsAntigen":52274,"positiveTestsAntigen":null,"fips":"16","positiveIncrease":795,"negativeIncrease":778,"total":562155,"totalTestResultsIncrease":1344,"posNeg":562155,"dataQualityGrade":null,"deathIncrease":23,"hospitalizedIncrease":51,"hash":"27cd5812c5b4472a2db5a8858d8b03505d0700f2","commercialScore":0,"negativeRegularScore":0,"negativeScore":0,"positiveScore":0,"score":0,"grade":""},{"date":20201228,"state":"ID","positive":136215,"probableCases":23046,"negative":424367,"pending":null,"totalTestResultsSource":"totalTestsPeopleViral","totalTestResults":537536,"hospitalizedCurrently":393,"hospitalizedCumulative":5425,"inIcuCurrently":95,"inIcuCumulative":993,"onVentilatorCurrently":null,"onVentilatorCumulative":null,"recovered":55186,"lastUpdateEt":"12/27/2020 19:00","dateModified":"2020-12-27T19:00:00Z","checkTimeEt":"12/27 14:00","death":1354,"hospitalized":5425,"hospitalizedDischarged":null,"dateChecked":"2020-12-27T19:00:00Z","totalTestsViral":842238,"positiveTestsViral":null,"negativeTestsViral":null,"positiveCasesViral":113169,"deathConfirmed":1195,"deathProbable":159,"totalTestEncountersViral":null,"totalTestsPeopleViral":537536,"totalTestsAntibody":null,"positiveTestsAntibody":null,"negativeTestsAntibody":null,"totalTestsPeopleAntibody":null,"positiveTestsPeopleAntibody":null,"negativeTestsPeopleAntibody":null,"totalTestsPeopleAntigen":null,"positiveTestsPeopleAntigen":null,"totalTestsAntigen":52274,"positiveTestsAntigen":null,"fips":"16","positiveIncrease":428,"negativeIncrease":438,"total":560582,"totalTestResultsIncrease":769,"posNeg":560582,"dataQualityGrade":null,"deathIncrease":0,"hospitalizedIncrease":33,"hash":"a26f88317a9894ce76a4888127481ddadc2e7547","commercialScore":0,"negativeRegularScore":0,"negativeScore":0,"positiveScore":0,"score":0,"grade":""},{"date":20201227,"state":"ID","positive":135787,"probableCases":22949,"negative":423929,"pending":null,"totalTestResultsSource":"totalTestsPeopleViral","totalTestResults":536767,"hospitalizedCurrently":393,"hospitalizedCumulative":5392,"inIcuCurrently":95,"inIcuCumulative":984,"onVentilatorCurrently":null,"onVentilatorCumulative":null,"recovered":54574,"lastUpdateEt":"12/26/2020 19:00","dateModified":"2020-12-26T19:00:00Z","checkTimeEt":"12/26 14:00","death":1354,"hospitalized":5392,"hospitalizedDischarged":null,"dateChecked":"2020-12-26T19:00:00Z","totalTestsViral":840931,"positiveTestsViral":null,"negativeTestsViral":null,"positiveCasesViral":112838,"deathConfirmed":1195,"deathProbable":159,"totalTestEncountersViral":null,"totalTestsPeopleViral":536767,"totalTestsAntibody":null,"positiveTestsAntibody":null,"negativeTestsAntibody":null,"totalTestsPeopleAntibody":null,"positiveTestsPeopleAntibody":null,"negativeTestsPeopleAntibody":null,"totalTestsPeopleAntigen":null,"positiveTestsPeopleAntigen":null,"totalTestsAntigen":52274,"positiveTestsAntigen":null,"fips":"16","positiveIncrease":554,"negative