[{"date":20210307,"state":"LA","positive":433785,"probableCases":61271,"negative":5261679,"pending":null,"totalTestResultsSource":"posNeg","totalTestResults":5695464,"hospitalizedCurrently":532,"hospitalizedCumulative":null,"inIcuCurrently":null,"inIcuCumulative":null,"onVentilatorCurrently":75,"onVentilatorCumulative":null,"recovered":415954,"lastUpdateEt":"3/7/2021 13:00","dateModified":"2021-03-07T13:00:00Z","checkTimeEt":"03/07 08:00","death":9748,"hospitalized":null,"hospitalizedDischarged":null,"dateChecked":"2021-03-07T13:00:00Z","totalTestsViral":5634193,"positiveTestsViral":null,"negativeTestsViral":null,"positiveCasesViral":372514,"deathConfirmed":9033,"deathProbable":715,"totalTestEncountersViral":null,"totalTestsPeopleViral":null,"totalTestsAntibody":null,"positiveTestsAntibody":null,"negativeTestsAntibody":null,"totalTestsPeopleAntibody":null,"positiveTestsPeopleAntibody":null,"negativeTestsPeopleAntibody":null,"totalTestsPeopleAntigen":null,"positiveTestsPeopleAntigen":null,"totalTestsAntigen":469967,"positiveTestsAntigen":null,"fips":"22","positiveIncrease":740,"negativeIncrease":20578,"total":5695464,"totalTestResultsIncrease":21318,"posNeg":5695464,"dataQualityGrade":null,"deathIncrease":32,"hospitalizedIncrease":0,"hash":"7fd45e084947a390edc7e73d1d9039015369dc7f","commercialScore":0,"negativeRegularScore":0,"negativeScore":0,"positiveScore":0,"score":0,"grade":""},{"date":20210306,"state":"LA","positive":433045,"probableCases":61051,"negative":5241101,"pending":null,"totalTestResultsSource":"posNeg","totalTestResults":5674146,"hospitalizedCurrently":538,"hospitalizedCumulative":null,"inIcuCurrently":null,"inIcuCumulative":null,"onVentilatorCurrently":77,"onVentilatorCumulative":null,"recovered":415954,"lastUpdateEt":"3/5/2021 13:00","dateModified":"2021-03-05T13:00:00Z","checkTimeEt":"03/05 08:00","death":9716,"hospitalized":null,"hospitalizedDischarged":null,"dateChecked":"2021-03-05T13:00:00Z","totalTestsViral":5613095,"positiveTestsViral":null,"negativeTestsViral":null,"positiveCasesViral":371994,"deathConfirmed":9007,"deathProbable":709,"totalTestEncountersViral":null,"totalTestsPeopleViral":null,"totalTestsAntibody":null,"positiveTestsAntibody":null,"negativeTestsAntibody":null,"totalTestsPeopleAntibody":null,"positiveTestsPeopleAntibody":null,"negativeTestsPeopleAntibody":null,"totalTestsPeopleAntigen":null,"positiveTestsPeopleAntigen":null,"totalTestsAntigen":466494,"positiveTestsAntigen":null,"fips":"22","positiveIncrease":0,"negativeIncrease":0,"total":5674146,"totalTestResultsIncrease":0,"posNeg":5674146,"dataQualityGrade":null,"deathIncrease":0,"hospitalizedIncrease":0,"hash":"65c7241c65fa94c4b04ee3b495596a630b81b888","commercialScore":0,"negativeRegularScore":0,"negativeScore":0,"positiveScore":0,"score":0,"grade":""},{"date":20210305,"state":"LA","positive":433045,"probableCases":61051,"negative":5241101,"pending":null,"totalTestResultsSource":"posNeg","totalTestResults":5674146,"hospitalizedCurrently":538,"hospitalizedCumulative":null,"inIcuCurrently":null,"inIcuCumulative":null,"onVentilatorCurrently":77,"onVentilatorCumulative":null,"recovered":415954,"lastUpdateEt":"3/5/2021 13:00","dateModified":"2021-03-05T13:00:00Z","checkTimeEt":"03/05 08:00","death":9716,"hospitalized":null,"hospitalizedDischarged":null,"dateChecked":"2021-03-05T13:00:00Z","totalTestsViral":5613095,"positiveTestsViral":null,"negativeTestsViral":null,"positiveCasesViral":371994,"deathConfirmed":9007,"deathProbable":709,"totalTestEncountersViral":null,"totalTestsPeopleViral":null,"totalTestsAntibody":null,"positiveTestsAntibody":null,"negativeTestsAntibody":null,"totalTestsPeopleAntibody":null,"positiveTestsPeopleAntibody":null,"negativeTestsPeopleAntibody":null,"totalTestsPeopleAntigen":null,"positiveTestsPeopleAntigen":null,"totalTestsAntigen":466494,"positiveTestsAntigen":null,"fips":"22","positiveIncrease":518,"negativeIncrease":18643,"total":5674146,"totalTestResultsIncrease":19161,"posNeg":5674146,"dataQualityGrade":null,"deathIncrease":30,"hospitalizedIncrease":0,"hash":"465be64b847f4bf1e732c8cfa05abfdef35f8583","commercialScore":0,"negativeRegularScore":0,"negativeScore":0,"positiveScore":0,"score":0,"grade":""},{"date":20210304,"state":"LA","positive":432527,"probableCases":60897,"negative":5222458,"pending":null,"totalTestResultsSource":"posNeg","totalTestResults":5654985,"hospitalizedCurrently":554,"hospitalizedCumulative":null,"inIcuCurrently":null,"inIcuCumulative":null,"onVentilatorCurrently":74,"onVentilatorCumulative":null,"recovered":415954,"lastUpdateEt":"3/4/2021 13:00","dateModified":"2021-03-04T13:00:00Z","checkTimeEt":"03/04 08:00","death":9686,"hospitalized":null,"hospitalizedDischarged":null,"dateChecked":"2021-03-04T13:00:00Z","totalTestsViral":5594088,"positiveTestsViral":null,"negativeTestsViral":null,"positiveCasesViral":371630,"deathConfirmed":8986,"deathProbable":700,"totalTestEncountersViral":null,"totalTestsPeopleViral":null,"totalTestsAntibody":null,"positiveTestsAntibody":null,"negativeTestsAntibody":null,"totalTestsPeopleAntibody":null,"positiveTestsPeopleAntibody":null,"negativeTestsPeopleAntibody":null,"totalTestsPeopleAntigen":null,"positiveTestsPeopleAntigen":null,"totalTestsAntigen":463554,"positiveTestsAntigen":null,"fips":"22","positiveIncrease":756,"negativeIncrease":24034,"total":5654985,"totalTestResultsIncrease":24790,"posNeg":5654985,"dataQualityGrade":null,"deathIncrease":18,"hospitalizedIncrease":0,"hash":"0c4e9c36e4da7d02481a6511a864a9b99db1b35d","commercialScore":0,"negativeRegularScore":0,"negativeScore":0,"positiveScore":0,"score":0,"grade":""},{"date":20210303,"state":"LA","positive":431771,"probableCases":60671,"negative":5198424,"pending":null,"totalTestResultsSource":"posNeg","totalTestResults":5630195,"hospitalizedCurrently":588,"hospitalizedCumulative":null,"inIcuCurrently":null,"inIcuCumulative":null,"onVentilatorCurrently":78,"onVentilatorCumulative":null,"recovered":415954,"lastUpdateEt":"3/3/2021 13:00","dateModified":"2021-03-03T13:00:00Z","checkTimeEt":"03/03 08:00","death":9668,"hospitalized":null,"hospitalizedDischarged":null,"dateChecked":"2021-03-03T13:00:00Z","totalTestsViral":5569524,"positiveTestsViral":null,"negativeTestsViral":null,"positiveCasesViral":371100,"deathConfirmed":8973,"deathProbable":695,"totalTestEncountersViral":null,"totalTestsPeopleViral":null,"totalTestsAntibody":null,"positiveTestsAntibody":null,"negativeTestsAntibody":null,"totalTestsPeopleAntibody":null,"positiveTestsPeopleAntibody":null,"negativeTestsPeopleAntibody":null,"totalTestsPeopleAntigen":null,"positiveTestsPeopleAntigen":null,"totalTestsAntigen":459742,"positiveTestsAntigen":null,"fips":"22","positiveIncrease":500,"negativeIncrease":20999,"total":5630195,"totalTestResultsIncrease":21499,"posNeg":5630195,"dataQualityGrade":null,"deathIncrease":21,"hospitalizedIncrease":0,"hash":"21e0e037b7380636d0580c9492a45ff8145fc937","commercialScore":0,"negativeRegularScore":0,"negativeScore":0,"positiveScore":0,"score":0,"grade":""},{"date":20210302,"state":"LA","positive":431271,"probableCases":60474,"negative":5177425,"pending":null,"totalTestResultsSource":"posNeg","totalTestResults":5608696,"hospitalizedCurrently":629,"hospitalizedCumulative":null,"inIcuCurrently":null,"inIcuCumulative":null,"onVentilatorCurrently":89,"onVentilatorCumulative":null,"recovered":408463,"lastUpdateEt":"3/2/2021 13:00","dateModified":"2021-03-02T13:00:00Z","checkTimeEt":"03/02 08:00","death":9647,"hospitalized":null,"hospitalizedDischarged":null,"dateChecked":"2021-03-02T13:00:00Z","totalTestsViral":5548222,"positiveTestsViral":null,"negativeTestsViral":null,"positiveCasesViral":370797,"deathConfirmed":8957,"deathProbable":690,"totalTestEncountersViral":null,"totalTestsPeopleViral":null,"totalTestsAntibody":null,"positiveTestsAntibody":null,"negativeTestsAntibody":null,"totalTestsPeopleAntibody":null,"positiveTestsPeopleAntibody":null,"negativeTestsPeopleAntibody":null,"totalTestsPeopleAntigen":null,"positiveTestsPeopleAntigen":null,"totalTestsAntigen":456777,"positiveTestsAntigen":null,"fips":"22","positiveIncrease":767,"negativeIncrease":22425,"total":5608696,"totalTestResultsIncrease":23192,"posNeg":5608696,"dataQualityGrade":null,"deathIncrease":19,"hospitalizedIncrease":0,"hash":"82eb0eb53244edcbaee45cb91c74f7f6bec4da7b","commercialScore":0,"negativeRegularScore":0,"negativeScore":0,"positiveScore":0,"score":0,"grade":""},{"date":20210301,"state":"LA","positive":430504,"probableCases":60257,"negative":5155000,"pending":null,"totalTestResultsSource":"posNeg","totalTestResults":5585504,"hospitalizedCurrently":629,"hospitalizedCumulative":null,"inIcuCurrently":null,"inIcuCumulative":null,"onVentilatorCurrently":91,"onVentilatorCumulative":null,"recovered":408463,"lastUpdateEt":"3/1/2021 13:00","dateModified":"2021-03-01T13:00:00Z","checkTimeEt":"03/01 08:00","death":9628,"hospitalized":null,"hospitalizedDischarged":null,"dateChecked":"2021-03-01T13:00:00Z","totalTestsViral":5525247,"positiveTestsViral":null,"negativeTestsViral":null,"positiveCasesViral":370247,"deathConfirmed":8941,"deathProbable":687,"totalTestEncountersViral":null,"totalTestsPeopleViral":null,"totalTestsAntibody":null,"positiveTestsAntibody":null,"negativeTestsAntibody":null,"totalTestsPeopleAntibody":null,"positiveTestsPeopleAntibody":null,"negativeTestsPeopleAntibody":null,"totalTestsPeopleAntigen":null,"positiveTestsPeopleAntigen":null,"totalTestsAntigen":453562,"positiveTestsAntigen":null,"fips":"22","positiveIncrease":404,"negativeIncrease":7933,"total":5585504,"totalTestResultsIncrease":8337,"posNeg":5585504,"dataQualityGrade":null,"deathIncrease":20,"hospitalizedIncrease":0,"hash":"87fad22252a38bb7791b7160956f2e3a8eb110fc","commercialScore":0,"negativeRegularScore":0,"negativeScore":0,"positiveScore":0,"score":0,"grade":""},{"date":20210228,"state":"LA","positive":430100,"probableCases":60152,"negative":5147067,"pending":null,"totalTestResultsSource":"posNeg","totalTestResults":5577167,"hospitalizedCurrently":630,"hospitalizedCumulative":null,"inIcuCurrently":null,"inIcuCumulative":null,"onVentilatorCurrently":91,"onVentilatorCumulative":null,"recovered":408463,"lastUpdateEt":"2/28/2021 13:00","dateModified":"2021-02-28T13:00:00Z","checkTimeEt":"02/28 08:00","death":9608,"hospitalized":null,"hospitalizedDischarged":null,"dateChecked":"2021-02-28T13:00:00Z","totalTestsViral":5517015,"positiveTestsViral":null,"negativeTestsViral":null,"positiveCasesViral":369948,"deathConfirmed":8923,"deathProbable":685,"totalTestEncountersViral":null,"totalTestsPeopleViral":null,"totalTestsAntibody":null,"positiveTestsAntibody":null,"negativeTestsAntibody":null,"totalTestsPeopleAntibody":null,"positiveTestsPeopleAntibody":null,"negativeTestsPeopleAntibody":null,"totalTestsPeopleAntigen":null,"positiveTestsPeopleAntigen":null,"totalTestsAntigen":452263,"positiveTestsAntigen":null,"fips":"22","positiveIncrease":1508,"negativeIncrease":30981,"total":5577167,"totalTestResultsIncrease":32489,"posNeg":5577167,"dataQualityGrade":null,"deathIncrease":21,"hospitalizedIncrease":0,"hash":"846ce00ccaaac928f669281bba70650af6438c44","commercialScore":0,"negativeRegularScore":0,"negativeScore":0,"positiveScore":0,"score":0,"grade":""},{"date":20210227,"state":"LA","positive":428592,"probableCases":59690,"negative":5116086,"pending":null,"totalTestResultsSource":"posNeg","totalTestResults":5544678,"hospitalizedCurrently":651,"hospitalizedCumulative":null,"inIcuCurrently":null,"inIcuCumulative":null,"onVentilatorCurrently":95,"onVentilatorCumulative":null,"recovered":408463,"lastUpdateEt":"2/26/2021 13:00","dateModified":"2021-02-26T13:00:00Z","checkTimeEt":"02/26 08:00","death":9587,"hospitalized":null,"hospitalizedDischarged":null,"dateChecked":"2021-02-26T13:00:00Z","totalTestsViral":5484988,"positiveTestsViral":null,"negativeTestsViral":null,"positiveCasesViral":368902,"deathConfirmed":8906,"deathProbable":681,"totalTestEncountersViral":null,"totalTestsPeopleViral":null,"totalTestsAntibody":null,"positiveTestsAntibody":null,"negativeTestsAntibody":null,"totalTestsPeopleAntibody":null,"positiveTestsPeopleAntibody":null,"negativeTestsPeopleAntibody":null,"totalTestsPeopleAntigen":null,"positiveTestsPeopleAntigen":null,"totalTestsAntigen":446071,"positiveTestsAntigen":null,"fips":"22","positiveIncrease":0,"negativeIncrease":0,"total":5544678,"totalTestResultsIncrease":0,"posNeg":5544678,"dataQualityGrade":null,"deathIncrease":0,"hospitalizedIncrease":0,"hash":"997f86fadc2da6c2382fe9e1eb7092db8f858a9f","commercialScore":0,"negativeRegularScore":0,"negativeScore":0,"positiveScore":0,"score":0,"grade":""},{"date":20210226,"state":"LA","positive":428592,"probableCases":59690,"negative":5116086,"pending":null,"totalTestResultsSource":"posNeg","totalTestResults":5544678,"hospitalizedCurrently":651,"hospitalizedCumulative":null,"inIcuCurrently":null,"inIcuCumulative":null,"onVentilatorCurrently":95,"onVentilatorCumulative":null,"recovered":408463,"lastUpdateEt":"2/26/2021 13:00","dateModified":"2021-02-26T13:00:00Z","checkTimeEt":"02/26 08:00","death":9587,"hospitalized":null,"hospitalizedDischarged":null,"dateChecked":"2021-02-26T13:00:00Z","totalTestsViral":5484988,"positiveTestsViral":null,"negativeTestsViral":null,"positiveCasesViral":368902,"deathConfirmed":8906,"deathProbable":681,"totalTestEncountersViral":null,"totalTestsPeopleViral":null,"totalTestsAntibody":null,"positiveTestsAntibody":null,"negativeTestsAntibody":null,"totalTestsPeopleAntibody":null,"positiveTestsPeopleAntibody":null,"negativeTestsPeopleAntibody":null,"totalTestsPeopleAntigen":null,"positiveTestsPeopleAntigen":null,"totalTestsAntigen":446071,"positiveTestsAntigen":null,"fips":"22","positiveIncrease":903,"negativeIncrease":22678,"total":5544678,"totalTestResultsIncrease":23581,"posNeg":5544678,"dataQualityGrade":null,"deathIncrease":26,"hospitalizedIncrease":0,"hash":"ff3a2e16ebb23d1892cfa3183281a06ad60972f5","commercialScore":0,"negativeRegularScore":0,"negativeScore":0,"positiveScore":0,"score":0,"grade":""},{"date":20210225,"state":"LA","positive":427689,"probableCases":59471,"negative":5093408,"pending":null,"totalTestResultsSource":"posNeg","totalTestResults":5521097,"hospitalizedCurrently":679,"hospitalizedCumulative":null,"inIcuCurrently":null,"inIcuCumulative":null,"onVentilatorCurrently":100,"onVentilatorCumulative":null,"recovered":408463,"lastUpdateEt":"2/25/2021 13:00","dateModified":"2021-02-25T13:00:00Z","checkTimeEt":"02/25 08:00","death":9561,"hospitalized":null,"hospitalizedDischarged":null,"dateChecked":"2021-02-25T13:00:00Z","totalTestsViral":5461626,"positiveTestsViral":null,"negativeTestsViral":null,"positiveCasesViral":368218,"deathConfirmed":8885,"deathProbable":676,"totalTestEncountersViral":null,"totalTestsPeopleViral":null,"totalTestsAntibody":null,"positiveTestsAntibody":null,"negativeTestsAntibody":null,"totalTestsPeopleAntibody":null,"positiveTestsPeopleAntibody":null,"negativeTestsPeopleAntibody":null,"totalTestsPeopleAntigen":null,"positiveTestsPeopleAntigen":null,"totalTestsAntigen":443438,"positiveTestsAntigen":null,"fips":"22","positiveIncrease":764,"negativeIncrease":52436,"total":5521097,"totalTestResultsIncrease":53200,"posNeg":5521097,"dataQualityGrade":null,"deathIncrease":33,"hospitalizedIncrease":0,"hash":"b3432bb259f0f2585c1e43655014dc95b902619c","commercialScore":0,"negativeRegularScore":0,"negativeScore":0,"positiveScore":0,"score":0,"grade":""},{"date":20210224,"state":"LA","positive":426925,"probableCases":59343,"negative":5040972,"pending":null,"totalTestResultsSource":"posNeg","totalTestResults":5467897,"hospitalizedCurrently":687,"hospitalizedCumulative":null,"inIcuCurrently":null,"inIcuCumulative":null,"onVentilatorCurrently":102,"onVentilatorCumulative":null,"recovered":408463,"lastUpdateEt":"2/24/2021 13:00","dateModified":"2021-02-24T13:00:00Z","checkTimeEt":"02/24 08:00","death":9528,"hospitalized":null,"hospitalizedDischarged":null,"dateChecked":"2021-02-24T13:00:00Z","totalTestsViral":5408554,"positiveTestsViral":null,"negativeTestsViral":null,"positiveCasesViral":367582,"deathConfirmed":8860,"deathProbable":668,"totalTestEncountersViral":null,"totalTestsPeopleViral":null,"totalTestsAntibody":null,"positiveTestsAntibody":null,"negativeTestsAntibody":null,"totalTestsPeopleAntibody":null,"positiveTestsPeopleAntibody":null,"negativeTestsPeopleAntibody":null,"totalTestsPeopleAntigen":null,"positiveTestsPeopleAntigen":null,"totalTestsAntigen":440757,"positiveTestsAntigen":null,"fips":"22","positiveIncrease":877,"negativeIncrease":20853,"total":5467897,"totalTestResultsIncrease":21730,"posNeg":5467897,"dataQualityGrade":null,"deathIncrease":25,"hospitalizedIncrease":0,"hash":"44c031bbb9597881b3cb509d1a41ff8a0530a99b","commercialScore":0,"negativeRegularScore":0,"negativeScore":0,"positiveScore":0,"score":0,"grade":""},{"date":20210223,"state":"LA","positive":426048,"probableCases":59008,"negative":5020119,"pending":null,"totalTestResultsSource":"posNeg","totalTestResults":5446167,"hospitalizedCurrently":715,"hospitalizedCumulative":null,"inIcuCurrently":null,"inIcuCumulative":null,"onVentilatorCurrently":111,"onVentilatorCumulative":null,"recovered":396834,"lastUpdateEt":"2/23/2021 13:00","dateModified":"2021-02-23T13:00:00Z","checkTimeEt":"02/23 08:00","death":9503,"hospitalized":null,"hospitalizedDischarged":null,"dateChecked":"2021-02-23T13:00:00Z","totalTestsViral":5387159,"positiveTestsViral":null,"negativeTestsViral":null,"positiveCasesViral":367040,"deathConfirmed":8834,"deathProbable":669,"totalTestEncountersViral":null,"totalTestsPeopleViral":null,"totalTestsAntibody":null,"positiveTestsAntibody":null,"negativeTestsAntibody":null,"totalTestsPeopleAntibody":null,"positiveTestsPeopleAntibody":null,"negativeTestsPeopleAntibody":null,"totalTestsPeopleAntigen":null,"positiveTestsPeopleAntigen":null,"totalTestsAntigen":435095,"positiveTestsAntigen":null,"fips":"22","positiveIncrease":1404,"negativeIncrease":20820,"total":5446167,"totalTestResultsIncrease":22224,"posNeg":5446167,"dataQualityGrade":null,"deathIncrease":26,"hospitalizedIncrease":0,"hash":"61755b867ea979537ef80c87f234ab884f65a3ca","commercialScore":0,"negativeRegularScore":0,"negativeScore":0,"positiveScore":0,"score":0,"grade":""},{"date":20210222,"state":"LA","positive":424644,"probableCases":58342,"negative":4999299,"pending":null,"totalTestResultsSource":"posNeg","totalTestResults":5423943,"hospitalizedCurrently":740,"hospitalizedCumulative":null,"inIcuCurrently":null,"inIcuCumulative":null,"onVentilatorCurrently":113,"onVentilatorCumulative":null,"recovered":396834,"lastUpdateEt":"2/22/2021 13:00","dateModified":"2021-02-22T13:00:00Z","checkTimeEt":"02/22 08:00","death":9477,"hospitalized":null,"hospitalizedDischarged":null,"dateChecked":"2021-02-22T13:00:00Z","totalTestsViral":5365601,"positiveTestsViral":null,"negativeTestsViral":null,"positiveCasesViral":366302,"deathConfirmed":8808,"deathProbable":669,"totalTestEncountersViral":null,"totalTestsPeopleViral":null,"totalTestsAntibody":null,"positiveTestsAntibody":null,"negativeTestsAntibody":null,"totalTestsPeopleAntibody":null,"positiveTestsPeopleAntibody":null,"negativeTestsPeopleAntibody":null,"totalTestsPeopleAntigen":null,"positiveTestsPeopleAntigen":null,"totalTestsAntigen":429587,"positiveTestsAntigen":null,"fips":"22","positiveIncrease":468,"negativeIncrease":6788,"total":5423943,"totalTestResultsIncrease":7256,"posNeg":5423943,"dataQualityGrade":null,"deathIncrease":11,"hospitalizedIncrease":0,"hash":"44dffd41e2974789895e8fc06ec2c349f77be4b1","commercialScore":0,"negativeRegularScore":0,"negativeScore":0,"positiveScore":0,"score":0,"grade":""},{"date":20210221,"state":"LA","positive":424176,"probableCases":58317,"negative":4992511,"pending":null,"totalTestResultsSource":"posNeg","totalTestResults":5416687,"hospitalizedCurrently":756,"hospitalizedCumulative":null,"inIcuCurrently":null,"inIcuCumulative":null,"onVentilatorCurrently":120,"onVentilatorCumulative":null,"recovered":396834,"lastUpdateEt":"2/21/2021 13:00","dateModified":"2021-02-21T13:00:00Z","checkTimeEt":"02/21 08:00","death":9466,"hospitalized":null,"hospitalizedDischarged":null,"dateChecked":"2021-02-21T13:00:00Z","totalTestsViral":5358370,"positiveTestsViral":null,"negativeTestsViral":null,"positiveCasesViral":365859,"deathConfirmed":8798,"deathProbable":668,"totalTestEncountersViral":null,"totalTestsPeopleViral":null,"totalTestsAntibody":null,"positiveTestsAntibody":null,"negativeTestsAntibody":null,"totalTestsPeopleAntibody":null,"positiveTestsPeopleAntibody":null,"negativeTestsPeopleAntibody":null,"totalTestsPeopleAntigen":null,"positiveTestsPeopleAntigen":null,"totalTestsAntigen":429239,"positiveTestsAntigen":null,"fips":"22","positiveIncrease":1889,"negativeIncrease":24668,"total":5416687,"totalTestResultsIncrease":26557,"posNeg":5416687,"dataQualityGrade":null,"deathIncrease":26,"hospitalizedIncrease":0,"hash":"15ca963d7909645b74ab3779e0301bb50e9c0cee","commercialScore":0,"negativeRegularScore":0,"negativeScore":0,"positiveScore":0,"score":0,"grade":""},{"date":20210220,"state":"LA","positive":422287,"probableCases":57375,"negative":4967843,"pending":null,"totalTestResultsSource":"posNeg","totalTestResults":5390130,"hospitalizedCurrently":806,"hospitalizedCumulative":null,"inIcuCurrently":null,"inIcuCumulative":null,"onVentilatorCurrently":129,"onVentilatorCumulative":null,"recovered":396834,"lastUpdateEt":"2/19/2021 13:00","dateModified":"2021-02-19T13:00:00Z","checkTimeEt":"02/19 08:00","death":9440,"hospitalized":null,"hospitalizedDischarged":null,"dateChecked":"2021-02-19T13:00:00Z","totalTestsViral":5332755,"positiveTestsViral":null,"negativeTestsViral":null,"positiveCasesViral":364912,"deathConfirmed":8778,"deathProbable":662,"totalTestEncountersViral":null,"totalTestsPeopleViral":null,"totalTestsAntibody":null,"positiveTestsAntibody":null,"negativeTestsAntibody":null,"totalTestsPeopleAntibody":null,"positiveTestsPeopleAntibody":null,"negativeTestsPeopleAntibody":null,"totalTestsPeopleAntigen":null,"positiveTestsPeopleAntigen":null,"totalTestsAntigen":422850,"positiveTestsAntigen":null,"fips":"22","positiveIncrease":0,"negativeIncrease":0,"total":5390130,"totalTestResultsIncrease":0,"posNeg":5390130,"dataQualityGrade":null,"deathIncrease":0,"hospitalizedIncrease":0,"hash":"76b4a2929c24ded798739357613077ae55e06c68","commercialScore":0,"negativeRegularScore":0,"negativeScore":0,"positiveScore":0,"score":0,"grade":""},{"date":20210219,"state":"LA","positive":422287,"probableCases":57375,"negative":4967843,"pending":null,"totalTestResultsSource":"posNeg","totalTestResults":5390130,"hospitalizedCurrently":806,"hospitalizedCumulative":null,"inIcuCurrently":null,"inIcuCumulative":null,"onVentilatorCurrently":129,"onVentilatorCumulative":null,"recovered":396834,"lastUpdateEt":"2/19/2021 13:00","dateModified":"2021-02-19T13:00:00Z","checkTimeEt":"02/19 08:00","death":9440,"hospitalized":null,"hospitalizedDischarged":null,"dateChecked":"2021-02-19T13:00:00Z","totalTestsViral":5332755,"positiveTestsViral":null,"negativeTestsViral":null,"positiveCasesViral":364912,"deathConfirmed":8778,"deathProbable":662,"totalTestEncountersViral":null,"totalTestsPeopleViral":null,"totalTestsAntibody":null,"positiveTestsAntibody":null,"negativeTestsAntibody":null,"totalTestsPeopleAntibody":null,"positiveTestsPeopleAntibody":null,"negativeTestsPeopleAntibody":null,"totalTestsPeopleAntigen":null,"positiveTestsPeopleAntigen":null,"totalTestsAntigen":422850,"positiveTestsAntigen":null,"fips":"22","positiveIncrease":441,"negativeIncrease":11420,"total":5390130,"totalTestResultsIncrease":11861,"posNeg":5390130,"dataQualityGrade":null,"deathIncrease":34,"hospitalizedIncrease":0,"hash":"845ea8199a2beb1efc5496189ee3b4f978ae4ec4","commercialScore":0,"negativeRegularScore":0,"negativeScore":0,"positiveScore":0,"score":0,"grade":""},{"date":20210218,"state":"LA","positive":421846,"probableCases":57311,"negative":4956423,"pending":null,"totalTestResultsSource":"posNeg","totalTestResults":5378269,"hospitalizedCurrently":823,"hospitalizedCumulative":null,"inIcuCurrently":null,"inIcuCumulative":null,"onVentilatorCurrently":128,"onVentilatorCumulative":null,"recovered":396834,"lastUpdateEt":"2/18/2021 13:00","dateModified":"2021-02-18T13:00:00Z","checkTimeEt":"02/18 08:00","death":9406,"hospitalized":null,"hospitalizedDischarged":null,"dateChecked":"2021-02-18T13:00:00Z","totalTestsViral":5320958,"positiveTestsViral":null,"negativeTestsViral":null,"positiveCasesViral":364535,"deathConfirmed":8753,"deathProbable":653,"totalTestEncountersViral":null,"totalTestsPeopleViral":null,"totalTestsAntibody":null,"positiveTestsAntibody":null,"negativeTestsAntibody":null,"totalTestsPeopleAntibody":null,"positiveTestsPeopleAntibody":null,"negativeTestsPeopleAntibody":null,"totalTestsPeopleAntigen":null,"positiveTestsPeopleAntigen":null,"totalTestsAntigen":421512,"positiveTestsAntigen":null,"fips":"22","positiveIncrease":828,"negativeIncrease":10349,"total":5378269,"totalTestResultsIncrease":11177,"posNeg":5378269,"dataQualityGrade":null,"deathIncrease":15,"hospitalizedIncrease":0,"hash":"0fc35347ed1513d489403cc2085592b5dc1709a0","commercialScore":0,"negativeRegularScore":0,"negativeScore":0,"positiveScore":0,"score":0,"grade":""},{"date":20210217,"state":"LA","positive":421018,"probableCases":56994,"negative":4946074,"pending":null,"totalTestResultsSource":"posNeg","totalTestResults":5367092,"hospitalizedCurrently":849,"hospitalizedCumulative":null,"inIcuCurrently":null,"inIcuCumulative":null,"onVentilatorCurrently":126,"onVentilatorCumulative":null,"recovered":396834,"lastUpdateEt":"2/17/2021 13:00","dateModified":"2021-02-17T13:00:00Z","checkTimeEt":"02/17 08:00","death":9391,"hospitalized":null,"hospitalizedDischarged":null,"dateChecked":"2021-02-17T13:00:00Z","totalTestsViral":5310098,"positiveTestsViral":null,"negativeTestsViral":null,"positiveCasesViral":364024,"deathConfirmed":8740,"deathProbable":651,"totalTestEncountersViral":null,"totalTestsPeopleViral":null,"totalTestsAntibody":null,"positiveTestsAntibody":null,"negativeTestsAntibody":null,"totalTestsPeopleAntibody":null,"positiveTestsPeopleAntibody":null,"negativeTestsPeopleAntibody":null,"totalTestsPeopleAntigen":null,"positiveTestsPeopleAntigen":null,"totalTestsAntigen":418034,"positiveTestsAntigen":null,"fips":"22","positiveIncrease":624,"negativeIncrease":20670,"total":5367092,"totalTestResultsIncrease":21294,"posNeg":5367092,"dataQualityGrade":null,"deathIncrease":66,"hospitalizedIncrease":0,"hash":"8ce624e667c7d6cbb664508e01b57981c3ffba79","commercialScore":0,"negativeRegularScore":0,"negativeScore":0,"positiveScore":0,"score":0,"grade":""},{"date":20210216,"state":"LA","positive":420394,"probableCases":56925,"negative":4925404,"pending":null,"totalTestResultsSource":"posNeg","totalTestResults":5345798,"hospitalizedCurrently":849,"hospitalizedCumulative":null,"inIcuCurrently":null,"inIcuCumulative":null,"onVentilatorCurrently":137,"onVentilatorCumulative":null,"recovered":380673,"lastUpdateEt":"2/15/2021 13:00","dateModified":"2021-02-15T13:00:00Z","checkTimeEt":"02/15 08:00","death":9325,"hospitalized":null,"hospitalizedDischarged":null,"dateChecked":"2021-02-15T13:00:00Z","totalTestsViral":5288873,"positiveTestsViral":null,"negativeTestsViral":null,"positiveCasesViral":363469,"deathConfirmed":8691,"deathProbable":634,"totalTestEncountersViral":null,"totalTestsPeopleViral":null,"totalTestsAntibody":null,"positiveTestsAntibody":null,"negativeTestsAntibody":null,"totalTestsPeopleAntibody":null,"positiveTestsPeopleAntibody":null,"negativeTestsPeopleAntibody":null,"totalTestsPeopleAntigen":null,"positiveTestsPeopleAntigen":null,"totalTestsAntigen":416361,"positiveTestsAntigen":null,"fips":"22","positiveIncrease":0,"negativeIncrease":0,"total":5345798,"totalTestResultsIncrease":0,"posNeg":5345798,"dataQualityGrade":null,"deathIncrease":0,"hospitalizedIncrease":0,"hash":"d38abe1012bfa9ad27c726f556a4d21ba756669f","commercialScore":0,"negativeRegularScore":0,"negativeScore":0,"positiveScore":0,"score":0,"grade":""},{"date":20210215,"state":"LA","positive":420394,"probableCases":56925,"negative":4925404,"pending":null,"totalTestResultsSource":"posNeg","totalTestResults":5345798,"hospitalizedCurrently":849,"hospitalizedCumulative":null,"inIcuCurrently":null,"inIcuCumulative":null,"onVentilatorCurrently":137,"onVentilatorCumulative":null,"recovered":380673,"lastUpdateEt":"2/15/2021 13:00","dateModified":"2021-02-15T13:00:00Z","checkTimeEt":"02/15 08:00","death":9325,"hospitalized":null,"hospitalizedDischarged":null,"dateChecked":"2021-02-15T13:00:00Z","totalTestsViral":5288873,"positiveTestsViral":null,"negativeTestsViral":null,"positiveCasesViral":363469,"deathConfirmed":8691,"deathProbable":634,"totalTestEncountersViral":null,"totalTestsPeopleViral":null,"totalTestsAntibody":null,"positiveTestsAntibody":null,"negativeTestsAntibody":null,"totalTestsPeopleAntibody":null,"positiveTestsPeopleAntibody":null,"negativeTestsPeopleAntibody":null,"totalTestsPeopleAntigen":null,"positiveTestsPeopleAntigen":null,"totalTestsAntigen":416361,"positiveTestsAntigen":null,"fips":"22","positiveIncrease":503,"negativeIncrease":7261,"total":5345798,"totalTestResultsIncrease":7764,"posNeg":5345798,"dataQualityGrade":null,"deathIncrease":33,"hospitalizedIncrease":0,"hash":"8286f698dd61d439ec6b9a01ac3218afd8020832","commercialScore":0,"negativeRegularScore":0,"negativeScore":0,"positiveScore":0,"score":0,"grade":""},{"date":20210214,"state":"LA","positive":419891,"probableCases":56905,"negative":4918143,"pending":null,"totalTestResultsSource":"posNeg","totalTestResults":5338034,"hospitalizedCurrently":875,"hospitalizedCumulative":null,"inIcuCurrently":null,"inIcuCumulative":null,"onVentilatorCurrently":142,"onVentilatorCumulative":null,"recovered":380673,"lastUpdateEt":"2/14/2021 13:00","dateModified":"2021-02-14T13:00:00Z","checkTimeEt":"02/14 08:00","death":9292,"hospitalized":null,"hospitalizedDischarged":null,"dateChecked":"2021-02-14T13:00:00Z","totalTestsViral":5281129,"positiveTestsViral":null,"negativeTestsViral":null,"positiveCasesViral":362986,"deathConfirmed":8663,"deathProbable":629,"totalTestEncountersViral":null,"totalTestsPeopleViral":null,"totalTestsAntibody":null,"positiveTestsAntibody":null,"negativeTestsAntibody":null,"totalTestsPeopleAntibody":null,"positiveTestsPeopleAntibody":null,"negativeTestsPeopleAntibody":null,"totalTestsPeopleAntigen":null,"positiveTestsPeopleAntigen":null,"totalTestsAntigen":415886,"positiveTestsAntigen":null,"fips":"22","positiveIncrease":1306,"negativeIncrease":30446,"total":5338034,"totalTestResultsIncrease":31752,"posNeg":5338034,"dataQualityGrade":null,"deathIncrease":16,"hospitalizedIncrease":0,"hash":"8997bb8413a683746f66de9f4945f205c2c8a463","commercialScore":0,"negativeRegularScore":0,"negativeScore":0,"positiveScore":0,"score":0,"grade":""},{"date":20210213,"state":"LA","positive":418585,"probableCases":56724,"negative":4887697,"pending":null,"totalTestResultsSource":"posNeg","totalTestResults":5306282,"hospitalizedCurrently":1001,"hospitalizedCumulative":null,"inIcuCurrently":null,"inIcuCumulative":null,"onVentilatorCurrently":151,"onVentilatorCumulative":null,"recovered":380673,"lastUpdateEt":"2/12/2021 13:00","dateModified":"2021-02-12T13:00:00Z","checkTimeEt":"02/12 08:00","death":9276,"hospitalized":null,"hospitalizedDischarged":null,"dateChecked":"2021-02-12T13:00:00Z","totalTestsViral":5249558,"positiveTestsViral":null,"negativeTestsViral":null,"positiveCasesViral":361861,"deathConfirmed":8646,"deathProbable":630,"totalTestEncountersViral":null,"totalTestsPeopleViral":null,"totalTestsAntibody":null,"positiveTestsAntibody":null,"negativeTestsAntibody":null,"totalTestsPeopleAntibody":null,"positiveTestsPeopleAntibody":null,"negativeTestsPeopleAntibody":null,"totalTestsPeopleAntigen":null,"positiveTestsPeopleAntigen":null,"totalTestsAntigen":412988,"positiveTestsAntigen":null,"fips":"22","positiveIncrease":0,"negativeIncrease":0,"total":5306282,"totalTestResultsIncrease":0,"posNeg":5306282,"dataQualityGrade":null,"deathIncrease":0,"hospitalizedIncrease":0,"hash":"30c0c742d59ddb7dacdcbe1a9be141c231f73d34","commercialScore":0,"negativeRegularScore":0,"negativeScore":0,"positiveScore":0,"score":0,"grade":""},{"date":20210212,"state":"LA","positive":418585,"probableCases":56724,"negative":4887697,"pending":null,"totalTestResultsSource":"posNeg","totalTestResults":5306282,"hospitalizedCurrently":1001,"hospitalizedCumulative":null,"inIcuCurrently":null,"inIcuCumulative":null,"onVentilatorCurrently":151,"onVentilatorCumulative":null,"recovered":380673,"lastUpdateEt":"2/12/2021 13:00","dateModified":"2021-02-12T13:00:00Z","checkTimeEt":"02/12 08:00","death":9276,"hospitalized":null,"hospitalizedDischarged":null,"dateChecked":"2021-02-12T13:00:00Z","totalTestsViral":5249558,"positiveTestsViral":null,"negativeTestsViral":null,"positiveCasesViral":361861,"deathConfirmed":8646,"deathProbable":630,"totalTestEncountersViral":null,"totalTestsPeopleViral":null,"totalTestsAntibody":null,"positiveTestsAntibody":null,"negativeTestsAntibody":null,"totalTestsPeopleAntibody":null,"positiveTestsPeopleAntibody":null,"negativeTestsPeopleAntibody":null,"totalTestsPeopleAntigen":null,"positiveTestsPeopleAntigen":null,"totalTestsAntigen":412988,"positiveTestsAntigen":null,"fips":"22","positiveIncrease":1170,"negativeIncrease":27950,"total":5306282,"totalTestResultsIncrease":29120,"posNeg":5306282,"dataQualityGrade":null,"deathIncrease":37,"hospitalizedIncrease":0,"hash":"3031b01626b896a48dfbf5d4afa93d20310eaaa8","commercialScore":0,"negativeRegularScore":0,"negativeScore":0,"positiveScore":0,"score":0,"grade":""},{"date":20210211,"state":"LA","positive":417415,"probableCases":56377,"negative":4859747,"pending":null,"totalTestResultsSource":"posNeg","totalTestResults":5277162,"hospitalizedCurrently":1052,"hospitalizedCumulative":null,"inIcuCurrently":null,"inIcuCumulative":null,"onVentilatorCurrently":151,"onVentilatorCumulative":null,"recovered":380673,"lastUpdateEt":"2/11/2021 13:00","dateModified":"2021-02-11T13:00:00Z","checkTimeEt":"02/11 08:00","death":9239,"hospitalized":null,"hospitalizedDischarged":null,"dateChecked":"2021-02-11T13:00:00Z","totalTestsViral":5220785,"positiveTestsViral":null,"negativeTestsViral":null,"positiveCasesViral":361038,"deathConfirmed":8617,"deathProbable":622,"totalTestEncountersViral":null,"totalTestsPeopleViral":null,"totalTestsAntibody":null,"positiveTestsAntibody":null,"negativeTestsAntibody":null,"totalTestsPeopleAntibody":null,"positiveTestsPeopleAntibody":null,"negativeTestsPeopleAntibody":null,"totalTestsPeopleAntigen":null,"positiveTestsPeopleAntigen":null,"totalTestsAntigen":409399,"positiveTestsAntigen":null,"fips":"22","positiveIncrease":2728,"negativeIncrease":39044,"total":5277162,"totalTestResultsIncrease":41772,"posNeg":5277162,"dataQualityGrade":null,"deathIncrease":27,"hospitalizedIncrease":0,"hash":"48e1deffb7c757138c9eea24b969466a3e14a9a0","commercialScore":0,"negativeRegularScore":0,"negativeScore":0,"positiveScore":0,"score":0,"grade":""},{"date":20210210,"state":"LA","positive":414687,"probableCases":55508,"negative":4820703,"pending":null,"totalTestResultsSource":"posNeg","totalTestResults":5235390,"hospitalizedCurrently":1076,"hospitalizedCumulative":null,"inIcuCurrently":null,"inIcuCumulative":null,"onVentilatorCurrently":151,"onVentilatorCumulative":null,"recovered":380673,"lastUpdateEt":"2/10/2021 13:00","dateModified":"2021-02-10T13:00:00Z","checkTimeEt":"02/10 08:00","death":9212,"hospitalized":null,"hospitalizedDischarged":null,"dateChecked":"2021-02-10T13:00:00Z","totalTestsViral":5179882,"positiveTestsViral":null,"negativeTestsViral":null,"positiveCasesViral":359179,"deathConfirmed":8594,"deathProbable":618,"totalTestEncountersViral":null,"totalTestsPeopleViral":null,"totalTestsAntibody":null,"positiveTestsAntibody":null,"negativeTestsAntibody":null,"totalTestsPeopleAntibody":null,"positiveTestsPeopleAntibody":null,"negativeTestsPeopleAntibody":null,"totalTestsPeopleAntigen":null,"positiveTestsPeopleAntigen":null,"totalTestsAntigen":400029,"positiveTestsAntigen":null,"fips":"22","positiveIncrease":333,"negativeIncrease":10529,"total":5235390,"totalTestResultsIncrease":10862,"posNeg":5235390,"dataQualityGrade":null,"deathIncrease":50,"hospitalizedIncrease":0,"hash":"9f706135d250eb432fa4ad7e78575d228727be46","commercialScore":0,"negativeRegularScore":0,"negativeScore":0,"positiveScore":0,"score":0,"grade":""},{"date":20210209,"state":"LA","positive":414354,"probableCases":55492,"negative":4810174,"pending":null,"totalTestResultsSource":"posNeg","totalTestResults":5224528,"hospitalizedCurrently":1122,"hospitalizedCumulative":null,"inIcuCurrently":null,"inIcuCumulative":null,"onVentilatorCurrently":151,"onVentilatorCumulative":null,"recovered":363457,"lastUpdateEt":"2/9/2021 13:00","dateModified":"2021-02-09T13:00:00Z","checkTimeEt":"02/09 08:00","death":9162,"hospitalized":null,"hospitalizedDischarged":null,"dateChecked":"2021-02-09T13:00:00Z","totalTestsViral":5169036,"positiveTestsViral":null,"negativeTestsViral":null,"positiveCasesViral":358862,"deathConfirmed":8559,"deathProbable":603,"totalTestEncountersViral":null,"totalTestsPeopleViral":null,"totalTestsAntibody":null,"positiveTestsAntibody":null,"negativeTestsAntibody":null,"totalTestsPeopleAntibody":null,"positiveTestsPeopleAntibody":null,"negativeTestsPeopleAntibody":null,"totalTestsPeopleAntigen":null,"positiveTestsPeopleAntigen":null,"totalTestsAntigen":399659,"positiveTestsAntigen":null,"fips":"22","positiveIncrease":1365,"negativeIncrease":26406,"total":5224528,"totalTestResultsIncrease":27771,"posNeg":5224528,"dataQualityGrade":null,"deathIncrease":20,"hospitalizedIncrease":0,"hash":"bcee4a26bace953dae1cf84c4829314e1892cefa","commercialScore":0,"negativeRegularScore":0,"negativeScore":0,"positiveScore":0,"score":0,"grade":""},{"date":20210208,"state":"LA","positive":412989,"probableCases":54994,"negative":4783768,"pending":null,"totalTestResultsSource":"posNeg","totalTestResults":5196757,"hospitalizedCurrently":1144,"hospitalizedCumulative":null,"inIcuCurrently":null,"inIcuCumulative":null,"onVentilatorCurrently":149,"onVentilatorCumulative":null,"recovered":363457,"lastUpdateEt":"2/8/2021 13:00","dateModified":"2021-02-08T13:00:00Z","checkTimeEt":"02/08 08:00","death":9142,"hospitalized":null,"hospitalizedDischarged":null,"dateChecked":"2021-02-08T13:00:00Z","totalTestsViral":5141763,"positiveTestsViral":null,"negativeTestsViral":null,"positiveCasesViral":357995,"deathConfirmed":8541,"deathProbable":601,"totalTestEncountersViral":null,"totalTestsPeopleViral":null,"totalTestsAntibody":null,"positiveTestsAntibody":null,"negativeTestsAntibody":null,"totalTestsPeopleAntibody":null,"positiveTestsPeopleAntibody":null,"negativeTestsPeopleAntibody":null,"totalTestsPeopleAntigen":null,"positiveTestsPeopleAntigen":null,"totalTestsAntigen":393696,"positiveTestsAntigen":null,"fips":"22","positiveIncrease":1177,"negativeIncrease":20741,"total":5196757,"totalTestResultsIncrease":21918,"posNeg":5196757,"dataQualityGrade":null,"deathIncrease":23,"hospitalizedIncrease":0,"hash":"d1a07383adfb83384634c536405d241fcc78c291","commercialScore":0,"negativeRegularScore":0,"negativeScore":0,"positiveScore":0,"score":0,"grade":""},{"date":20210207,"state":"LA","positive":411812,"probableCases":54960,"negative":4763027,"pending":null,"totalTestResultsSource":"posNeg","totalTestResults":5174839,"hospitalizedCurrently":1166,"hospitalizedCumulative":null,"inIcuCurrently":null,"inIcuCumulative":null,"onVentilatorCurrently":143,"onVentilatorCumulative":null,"recovered":363457,"lastUpdateEt":"2/7/2021 13:00","dateModified":"2021-02-07T13:00:00Z","checkTimeEt":"02/07 08:00","death":9119,"hospitalized":null,"hospitalizedDischarged":null,"dateChecked":"2021-02-07T13:00:00Z","totalTestsViral":5119879,"positiveTestsViral":null,"negativeTestsViral":null,"positiveCasesViral":356852,"deathConfirmed":8522,"deathProbable":597,"totalTestEncountersViral":null,"totalTestsPeopleViral":null,"totalTestsAntibody":null,"positiveTestsAntibody":null,"negativeTestsAntibody":null,"totalTestsPeopleAntibody":null,"positiveTestsPeopleAntibody":null,"negativeTestsPeopleAntibody":null,"totalTestsPeopleAntigen":null,"positiveTestsPeopleAntigen":null,"totalTestsAntigen":392574,"positiveTestsAntigen":null,"fips":"22","positiveIncrease":1951,"negativeIncrease":33259,"total":5174839,"totalTestResultsIncrease":35210,"posNeg":5174839,"dataQualityGrade":null,"deathIncrease":43,"hospitalizedIncrease":0,"hash":"dd9fc6399e60625babcac7e6d15a159ca0b5a30f","commercialScore":0,"negativeRegularScore":0,"negativeScore":0,"positiveScore":0,"score":0,"grade":""},{"date":20210206,"state":"LA","positive":409861,"probableCases":54339,"negative":4729768,"pending":null,"totalTestResultsSource":"posNeg","totalTestResults":5139629,"hospitalizedCurrently":1275,"hospitalizedCumulative":null,"inIcuCurrently":null,"inIcuCumulative":null,"onVentilatorCurrently":167,"onVentilatorCumulative":null,"recovered":363457,"lastUpdateEt":"2/5/2021 13:00","dateModified":"2021-02-05T13:00:00Z","checkTimeEt":"02/05 08:00","death":9076,"hospitalized":null,"hospitalizedDischarged":null,"dateChecked":"2021-02-05T13:00:00Z","totalTestsViral":5085290,"positiveTestsViral":null,"negativeTestsViral":null,"positiveCasesViral":355522,"deathConfirmed":8482,"deathProbable":594,"totalTestEncountersViral":null,"totalTestsPeopleViral":null,"totalTestsAntibody":null,"positiveTestsAntibody":null,"negativeTestsAntibody":null,"totalTestsPeopleAntibody":null,"positiveTestsPeopleAntibody":null,"negativeTestsPeopleAntibody":null,"totalTestsPeopleAntigen":null,"positiveTestsPeopleAntigen":null,"totalTestsAntigen":386571,"positiveTestsAntigen":null,"fips":"22","positiveIncrease":0,"negativeIncrease":0,"total":5139629,"totalTestResultsIncrease":0,"posNeg":5139629,"dataQualityGrade":null,"deathIncrease":0,"hospitalizedIncrease":0,"hash":"9340a7f31a64edbb665528ff7f1f0df7b09a3a9e","commercialScore":0,"negativeRegularScore":0,"negativeScore":0,"positiveScore":0,"score":0,"grade":""},{"date":20210205,"state":"LA","positive":409861,"probableCases":54339,"negative":4729768,"pending":null,"totalTestResultsSource":"posNeg","totalTestResults":5139629,"hospitalizedCurrently":1275,"hospitalizedCumulative":null,"inIcuCurrently":null,"inIcuCumulative":null,"onVentilatorCurrently":167,"onVentilatorCumulative":null,"recovered":363457,"lastUpdateEt":"2/5/2021 13:00","dateModified":"2021-02-05T13:00:00Z","checkTimeEt":"02/05 08:00","death":9076,"hospitalized":null,"hospitalizedDischarged":null,"dateChecked":"2021-02-05T13:00:00Z","totalTestsViral":5085290,"positiveTestsViral":null,"negativeTestsViral":null,"positiveCasesViral":355522,"deathConfirmed":8482,"deathProbable":594,"totalTestEncountersViral":null,"totalTestsPeopleViral":null,"totalTestsAntibody":null,"positiveTestsAntibody":null,"negativeTestsAntibody":null,"totalTestsPeopleAntibody":null,"positiveTestsPeopleAntibody":null,"negativeTestsPeopleAntibody":null,"totalTestsPeopleAntigen":null,"positiveTestsPeopleAntigen":null,"totalTestsAntigen":386571,"positiveTestsAntigen":null,"fips":"22","positiveIncrease":866,"negativeIncrease":17741,"total":5139629,"totalTestResultsIncrease":18607,"posNeg":5139629,"dataQualityGrade":null,"deathIncrease":32,"hospitalizedIncrease":0,"hash":"3d4d5af71eed72d0274b2b27f7fce23360ec3df3","commercialScore":0,"negativeRegularScore":0,"negativeScore":0,"positiveScore":0,"score":0,"grade":""},{"date":20210204,"state":"LA","positive":408995,"probableCases":54207,"negative":4712027,"pending":null,"totalTestResultsSource":"posNeg","totalTestResults":5121022,"hospitalizedCurrently":1295,"hospitalizedCumulative":null,"inIcuCurrently":null,"inIcuCumulative":null,"onVentilatorCurrently":162,"onVentilatorCumulative":null,"recovered":363457,"lastUpdateEt":"2/4/2021 13:00","dateModified":"2021-02-04T13:00:00Z","checkTimeEt":"02/04 08:00","death":9044,"hospitalized":null,"hospitalizedDischarged":null,"dateChecked":"2021-02-04T13:00:00Z","totalTestsViral":5066815,"positiveTestsViral":null,"negativeTestsViral":null,"positiveCasesViral":354788,"deathConfirmed":8453,"deathProbable":591,"totalTestEncountersViral":null,"totalTestsPeopleViral":null,"totalTestsAntibody":null,"positiveTestsAntibody":null,"negativeTestsAntibody":null,"totalTestsPeopleAntibody":null,"positiveTestsPeopleAntibody":null,"negativeTestsPeopleAntibody":null,"totalTestsPeopleAntigen":null,"positiveTestsPeopleAntigen":null,"totalTestsAntigen":384783,"positiveTestsAntigen":null,"fips":"22","positiveIncrease":2760,"negativeIncrease":28733,"total":5121022,"totalTestResultsIncrease":31493,"posNeg":5121022,"dataQualityGrade":null,"deathIncrease":38,"hospitalizedIncrease":0,"hash":"9eaaba339a04c2f94de01acf1067a7df0186fc1c","commercialScore":0,"negativeRegularScore":0,"negativeScore":0,"positiveScore":0,"score":0,"grade":""},{"date":20210203,"state":"LA","positive":406235,"probableCases":52728,"negative":4683294,"pending":null,"totalTestResultsSource":"posNeg","totalTestResults":5089529,"hospitalizedCurrently":1386,"hospitalizedCumulative":null,"inIcuCurrently":null,"inIcuCumulative":null,"onVentilatorCurrently":180,"onVentilatorCumulative":null,"recovered":363457,"lastUpdateEt":"2/3/2021 13:00","dateModified":"2021-02-03T13:00:00Z","checkTimeEt":"02/03 08:00","death":9006,"hospitalized":null,"hospitalizedDischarged":null,"dateChecked":"2021-02-03T13:00:00Z","totalTestsViral":5036801,"positiveTestsViral":null,"negativeTestsViral":null,"positiveCasesViral":353507,"deathConfirmed":8421,"deathProbable":585,"totalTestEncountersViral":null,"totalTestsPeopleViral":null,"totalTestsAntibody":null,"positiveTestsAntibody":null,"negativeTestsAntibody":null,"totalTestsPeopleAntibody":null,"positiveTestsPeopleAntibody":null,"negativeTestsPeopleAntibody":null,"totalTestsPeopleAntigen":null,"positiveTestsPeopleAntigen":null,"totalTestsAntigen":375278,"positiveTestsAntigen":null,"fips":"22","positiveIncrease":2041,"negativeIncrease":25050,"total":5089529,"totalTestResultsIncrease":27091,"posNeg":5089529,"dataQualityGrade":null,"deathIncrease":53,"hospitalizedIncrease":0,"hash":"3abf4d1ca4b3ef3f2ebc6c31e07d966e8e992f72","commercialScore":0,"negativeRegularScore":0,"negativeScore":0,"positiveScore":0,"score":0,"grade":""},{"date":20210202,"state":"LA","positive":404194,"probableCases":51917,"negative":4658244,"pending":null,"totalTestResultsSource":"posNeg","totalTestResults":5062438,"hospitalizedCurrently":1440,"hospitalizedCumulative":null,"inIcuCurrently":null,"inIcuCumulative":null,"onVentilatorCurrently":189,"onVentilatorCumulative":null,"recovered":344321,"lastUpdateEt":"2/2/2021 13:00","dateModified":"2021-02-02T13:00:00Z","checkTimeEt":"02/02 08:00","death":8953,"hospitalized":null,"hospitalizedDischarged":null,"dateChecked":"2021-02-02T13:00:00Z","totalTestsViral":5010521,"positiveTestsViral":null,"negativeTestsViral":null,"positiveCasesViral":352277,"deathConfirmed":8375,"deathProbable":578,"totalTestEncountersViral":null,"totalTestsPeopleViral":null,"totalTestsAntibody":null,"positiveTestsAntibody":null,"negativeTestsAntibody":null,"totalTestsPeopleAntibody":null,"positiveTestsPeopleAntibody":null,"negativeTestsPeopleAntibody":null,"totalTestsPeopleAntigen":null,"positiveTestsPeopleAntigen":null,"totalTestsAntigen":367908,"positiveTestsAntigen":null,"fips":"22","positiveIncrease":2603,"negativeIncrease":40874,"total":5062438,"totalTestResultsIncrease":43477,"posNeg":5062438,"dataQualityGrade":null,"deathIncrease":41,"hospitalizedIncrease":0,"hash":"77c24d6c4e6c76df8e1d923b8423a27d54c205f5","commercialScore":0,"negativeRegularScore":0,"negativeScore":0,"positiveScore":0,"score":0,"grade":""},{"date":20210201,"state":"LA","positive":401591,"probableCases":50968,"negative":4617370,"pending":null,"totalTestResultsSource":"posNeg","totalTestResults":5018961,"hospitalizedCurrently":1403,"hospitalizedCumulative":null,"inIcuCurrently":null,"inIcuCumulative":null,"onVentilatorCurrently":187,"onVentilatorCumulative":null,"recovered":344321,"lastUpdateEt":"2/1/2021 13:00","dateModified":"2021-02-01T13:00:00Z","checkTimeEt":"02/01 08:00","death":8912,"hospitalized":null,"hospitalizedDischarged":null,"dateChecked":"2021-02-01T13:00:00Z","totalTestsViral":4967993,"positiveTestsViral":null,"negativeTestsViral":null,"positiveCasesViral":350623,"deathConfirmed":8340,"deathProbable":572,"totalTestEncountersViral":null,"totalTestsPeopleViral":null,"totalTestsAntibody":null,"positiveTestsAntibody":null,"negativeTestsAntibody":null,"totalTestsPeopleAntibody":null,"positiveTestsPeopleAntibody":null,"negativeTestsPeopleAntibody":null,"totalTestsPeopleAntigen":null,"positiveTestsPeopleAntigen":null,"totalTestsAntigen":360086,"positiveTestsAntigen":null,"fips":"22","positiveIncrease":965,"negativeIncrease":10548,"total":5018961,"totalTestResultsIncrease":11513,"posNeg":5018961,"dataQualityGrade":null,"deathIncrease":53,"hospitalizedIncrease":0,"hash":"b8959bbff548a3172c4527152bc04606ca731850","commercialScore":0,"negativeRegularScore":0,"negativeScore":0,"positiveScore":0,"score":0,"grade":""},{"date":20210131,"state":"LA","positive":400626,"probableCases":50929,"negative":4606822,"pending":null,"totalTestResultsSource":"posNeg","totalTestResults":5007448,"hospitalizedCurrently":1416,"hospitalizedCumulative":null,"inIcuCurrently":null,"inIcuCumulative":null,"onVentilatorCurrently":199,"onVentilatorCumulative":null,"recovered":344321,"lastUpdateEt":"1/31/2021 13:00","dateModified":"2021-01-31T13:00:00Z","checkTimeEt":"01/31 08:00","death":8859,"hospitalized":null,"hospitalizedDischarged":null,"dateChecked":"2021-01-31T13:00:00Z","totalTestsViral":4956519,"positiveTestsViral":null,"negativeTestsViral":null,"positiveCasesViral":349697,"deathConfirmed":8291,"deathProbable":568,"totalTestEncountersViral":null,"totalTestsPeopleViral":null,"totalTestsAntibody":null,"positiveTestsAntibody":null,"negativeTestsAntibody":null,"totalTestsPeopleAntibody":null,"positiveTestsPeopleAntibody":null,"negativeTestsPeopleAntibody":null,"totalTestsPeopleAntigen":null,"positiveTestsPeopleAntigen":null,"totalTestsAntigen":359162,"positiveTestsAntigen":null,"fips":"22","positiveIncrease":3350,"negativeIncrease":40046,"total":5007448,"totalTestResultsIncrease":43396,"posNeg":5007448,"dataQualityGrade":null,"deathIncrease":58,"hospitalizedIncrease":0,"hash":"a73660ff8c8af50528182035a047ff95d8db0e27","commercialScore":0,"negativeRegularScore":0,"negativeScore":0,"positiveScore":0,"score":0,"grade":""},{"date":20210130,"state":"LA","positive":397276,"probableCases":50282,"negative":4566776,"pending":null,"totalTestResultsSource":"posNeg","totalTestResults":4964052,"hospitalizedCurrently":1546,"hospitalizedCumulative":null,"inIcuCurrently":null,"inIcuCumulative":null,"onVentilatorCurrently":198,"onVentilatorCumulative":null,"recovered":344321,"lastUpdateEt":"1/29/2021 13:00","dateModified":"2021-01-29T13:00:00Z","checkTimeEt":"01/29 08:00","death":8801,"hospitalized":null,"hospitalizedDischarged":null,"dateChecked":"2021-01-29T13:00:00Z","totalTestsViral":4913770,"positiveTestsViral":null,"negativeTestsViral":null,"positiveCasesViral":346994,"deathConfirmed":8241,"deathProbable":560,"totalTestEncountersViral":null,"totalTestsPeopleViral":null,"totalTestsAntibody":null,"positiveTestsAntibody":null,"negativeTestsAntibody":null,"totalTestsPeopleAntibody":null,"positiveTestsPeopleAntibody":null,"negativeTestsPeopleAntibody":null,"totalTestsPeopleAntigen":null,"positiveTestsPeopleAntigen":null,"totalTestsAntigen":353166,"positiveTestsAntigen":null,"fips":"22","positiveIncrease":0,"negativeIncrease":0,"total":4964052,"totalTestResultsIncrease":0,"posNeg":4964052,"dataQualityGrade":null,"deathIncrease":0,"hospitalizedIncrease":0,"hash":"6465f60e1e3fbf6874a194a63db6c32970f66f3f","commercialScore":0,"negativeRegularScore":0,"negativeScore":0,"positiveScore":0,"score":0,"grade":""},{"date":20210129,"state":"LA","positive":397276,"probableCases":50282,"negative":4566776,"pending":null,"totalTestResultsSource":"posNeg","totalTestResults":4964052,"hospitalizedCurrently":1546,"hospitalizedCumulative":null,"inIcuCurrently":null,"inIcuCumulative":null,"onVentilatorCurrently":198,"onVentilatorCumulative":null,"recovered":344321,"lastUpdateEt":"1/29/2021 13:00","dateModified":"2021-01-29T13:00:00Z","checkTimeEt":"01/29 08:00","death":8801,"hospitalized":null,"hospitalizedDischarged":null,"dateChecked":"2021-01-29T13:00:00Z","totalTestsViral":4913770,"positiveTestsViral":null,"negativeTestsViral":null,"positiveCasesViral":346994,"deathConfirmed":8241,"deathProbable":560,"totalTestEncountersViral":null,"totalTestsPeopleViral":null,"totalTestsAntibody":null,"positiveTestsAntibody":null,"negativeTestsAntibody":null,"totalTestsPeopleAntibody":null,"positiveTestsPeopleAntibody":null,"negativeTestsPeopleAntibody":null,"totalTestsPeopleAntigen":null,"positiveTestsPeopleAntigen":null,"totalTestsAntigen":353166,"positiveTestsAntigen":null,"fips":"22","positiveIncrease":2367,"negativeIncrease":22901,"total":4964052,"totalTestResultsIncrease":25268,"posNeg":4964052,"dataQualityGrade":null,"deathIncrease":58,"hospitalizedIncrease":0,"hash":"1880a0e6496448c98c7cc76252d014d58ac410b5","commercialScore":0,"negativeRegularScore":0,"negativeScore":0,"positiveScore":0,"score":0,"grade":""},{"date":20210128,"state":"LA","positive":394909,"probableCases":49452,"negative":4543875,"pending":null,"totalTestResultsSource":"posNeg","totalTestResults":4938784,"hospitalizedCurrently":1590,"hospitalizedCumulative":null,"inIcuCurrently":null,"inIcuCumulative":null,"onVentilatorCurrently":206,"onVentilatorCumulative":null,"recovered":344321,"lastUpdateEt":"1/28/2021 13:00","dateModified":"2021-01-28T13:00:00Z","checkTimeEt":"01/28 08:00","death":8743,"hospitalized":null,"hospitalizedDischarged":null,"dateChecked":"2021-01-28T13:00:00Z","totalTestsViral":4889332,"positiveTestsViral":null,"negativeTestsViral":null,"positiveCasesViral":345457,"deathConfirmed":8202,"deathProbable":541,"totalTestEncountersViral":null,"totalTestsPeopleViral":null,"totalTestsAntibody":null,"positiveTestsAntibody":null,"negativeTestsAntibody":null,"totalTestsPeopleAntibody":null,"positiveTestsPeopleAntibody":null,"negativeTestsPeopleAntibody":null,"totalTestsPeopleAntigen":null,"positiveTestsPeopleAntigen":null,"totalTestsAntigen":346830,"positiveTestsAntigen":null,"fips":"22","positiveIncrease":2493,"negativeIncrease":28249,"total":4938784,"totalTestResultsIncrease":30742,"posNeg":4938784,"dataQualityGrade":null,"deathIncrease":55,"hospitalizedIncrease":0,"hash":"5356fc91d81855c28180909a0f3777abbab29392","commercialScore":0,"negativeRegularScore":0,"negativeScore":0,"positiveScore":0,"score":0,"grade":""},{"date":20210127,"state":"LA","positive":392416,"probableCases":48833,"negative":4515626,"pending":null,"totalTestResultsSource":"posNeg","totalTestResults":4908042,"hospitalizedCurrently":1625,"hospitalizedCumulative":null,"inIcuCurrently":null,"inIcuCumulative":null,"onVentilatorCurrently":203,"onVentilatorCumulative":null,"recovered":344321,"lastUpdateEt":"1/27/2021 13:00","dateModified":"2021-01-27T13:00:00Z","checkTimeEt":"01/27 08:00","death":8688,"hospitalized":null,"hospitalizedDischarged":null,"dateChecked":"2021-01-27T13:00:00Z","totalTestsViral":4859209,"positiveTestsViral":null,"negativeTestsViral":null,"positiveCasesViral":343583,"deathConfirmed":8152,"deathProbable":536,"totalTestEncountersViral":null,"totalTestsPeopleViral":null,"totalTestsAntibody":null,"positiveTestsAntibody":null,"negativeTestsAntibody":null,"totalTestsPeopleAntibody":null,"positiveTestsPeopleAntibody":null,"negativeTestsPeopleAntibody":null,"totalTestsPeopleAntigen":null,"positiveTestsPeopleAntigen":null,"totalTestsAntigen":341039,"positiveTestsAntigen":null,"fips":"22","positiveIncrease":3854,"negativeIncrease":30276,"total":4908042,"totalTestResultsIncrease":34130,"posNeg":4908042,"dataQualityGrade":null,"deathIncrease":67,"hospitalizedIncrease":0,"hash":"5a832f56bcdc2b2582767781f038fbb5a043cf94","commercialScore":0,"negativeRegularScore":0,"negativeScore":0,"positiveScore":0,"score":0,"grade":""},{"date":20210126,"state":"LA","positive":388562,"probableCases":47351,"negative":4485350,"pending":null,"totalTestResultsSource":"posNeg","totalTestResults":4873912,"hospitalizedCurrently":1646,"hospitalizedCumulative":null,"inIcuCurrently":null,"inIcuCumulative":null,"onVentilatorCurrently":217,"onVentilatorCumulative":null,"recovered":320025,"lastUpdateEt":"1/26/2021 13:00","dateModified":"2021-01-26T13:00:00Z","checkTimeEt":"01/26 08:00","death":8621,"hospitalized":null,"hospitalizedDischarged":null,"dateChecked":"2021-01-26T13:00:00Z","totalTestsViral":4826561,"positiveTestsViral":null,"negativeTestsViral":null,"positiveCasesViral":341211,"deathConfirmed":8090,"deathProbable":531,"totalTestEncountersViral":null,"totalTestsPeopleViral":null,"totalTestsAntibody":null,"positiveTestsAntibody":null,"negativeTestsAntibody":null,"totalTestsPeopleAntibody":null,"positiveTestsPeopleAntibody":null,"negativeTestsPeopleAntibody":null,"totalTestsPeopleAntigen":null,"positiveTestsPeopleAntigen":null,"totalTestsAntigen":332212,"positiveTestsAntigen":null,"fips":"22","positiveIncrease":2620,"negativeIncrease":28636,"total":4873912,"totalTestResultsIncrease":31256,"posNeg":4873912,"dataQualityGrade":null,"deathIncrease":31,"hospitalizedIncrease":0,"hash":"1ebe904b7f38286fc2213a1df346ea2ea036e22c","commercialScore":0,"negativeRegularScore":0,"negativeScore":0,"positiveScore":0,"score":0,"grade":""},{"date":20210125,"state":"LA","positive":385942,"probableCases":46735,"negative":4456714,"pending":null,"totalTestResultsSource":"posNeg","totalTestResults":4842656,"hospitalizedCurrently":1638,"hospitalizedCumulative":null,"inIcuCurrently":null,"inIcuCumulative":null,"onVentilatorCurrently":219,"onVentilatorCumulative":null,"recovered":320025,"lastUpdateEt":"1/25/2021 13:00","dateModified":"2021-01-25T13:00:00Z","checkTimeEt":"01/25 08:00","death":8590,"hospitalized":null,"hospitalizedDischarged":null,"dateChecked":"2021-01-25T13:00:00Z","totalTestsViral":4795921,"positiveTestsViral":null,"negativeTestsViral":null,"positiveCasesViral":339207,"deathConfirmed":8064,"deathProbable":526,"totalTestEncountersViral":null,"totalTestsPeopleViral":null,"totalTestsAntibody":null,"positiveTestsAntibody":null,"negativeTestsAntibody":null,"totalTestsPeopleAntibody":null,"positiveTestsPeopleAntibody":null,"negativeTestsPeopleAntibody":null,"totalTestsPeopleAntigen":null,"positiveTestsPeopleAntigen":null,"totalTestsAntigen":327660,"positiveTestsAntigen":null,"fips":"22","positiveIncrease":2080,"negativeIncrease":25006,"total":4842656,"totalTestResultsIncrease":27086,"posNeg":4842656,"dataQualityGrade":null,"deathIncrease":25,"hospitalizedIncrease":0,"hash":"6de6f6789bed57178232e4c0279f9838ecea8cc7","commercialScore":0,"negativeRegularScore":0,"negativeScore":0,"positiveScore":0,"score":0,"grade":""},{"date":20210124,"state":"LA","positive":383862,"probableCases":46647,"negative":4431708,"pending":null,"totalTestResultsSource":"posNeg","totalTestResults":4815570,"hospitalizedCurrently":1641,"hospitalizedCumulative":null,"inIcuCurrently":null,"inIcuCumulative":null,"onVentilatorCurrently":215,"onVentilatorCumulative":null,"recovered":320025,"lastUpdateEt":"1/24/2021 13:00","dateModified":"2021-01-24T13:00:00Z","checkTimeEt":"01/24 08:00","death":8565,"hospitalized":null,"hospitalizedDischarged":null,"dateChecked":"2021-01-24T13:00:00Z","totalTestsViral":4768923,"positiveTestsViral":null,"negativeTestsViral":null,"positiveCasesViral":337215,"deathConfirmed":8038,"deathProbable":527,"totalTestEncountersViral":null,"totalTestsPeopleViral":null,"totalTestsAntibody":null,"positiveTestsAntibody":null,"negativeTestsAntibody":null,"totalTestsPeopleAntibody":null,"positiveTestsPeopleAntibody":null,"negativeTestsPeopleAntibody":null,"totalTestsPeopleAntigen":null,"positiveTestsPeopleAntigen":null,"totalTestsAntigen":326381,"positiveTestsAntigen":null,"fips":"22","positiveIncrease":3607,"negativeIncrease":36011,"total":4815570,"totalTestResultsIncrease":39618,"posNeg":4815570,"dataQualityGrade":null,"deathIncrease":82,"hospitalizedIncrease":0,"hash":"6e7714593f0a7c14b67c422635b691aa91438ecb","commercialScore":0,"negativeRegularScore":0,"negativeScore":0,"positiveScore":0,"score":0,"grade":""},{"date":20210123,"state":"LA","positive":380255,"probableCases":45486,"negative":4395697,"pending":null,"totalTestResultsSource":"posNeg","totalTestResults":4775952,"hospitalizedCurrently":1747,"hospitalizedCumulative":null,"inIcuCurrently":null,"inIcuCumulative":null,"onVentilatorCurrently":216,"onVentilatorCumulative":null,"recovered":320025,"lastUpdateEt":"1/22/2021 13:00","dateModified":"2021-01-22T13:00:00Z","checkTimeEt":"01/22 08:00","death":8483,"hospitalized":null,"hospitalizedDischarged":null,"dateChecked":"2021-01-22T13:00:00Z","totalTestsViral":4730466,"positiveTestsViral":null,"negativeTestsViral":null,"positiveCasesViral":334769,"deathConfirmed":7964,"deathProbable":519,"totalTestEncountersViral":null,"totalTestsPeopleViral":null,"totalTestsAntibody":null,"positiveTestsAntibody":null,"negativeTestsAntibody":null,"totalTestsPeopleAntibody":null,"positiveTestsPeopleAntibody":null,"negativeTestsPeopleAntibody":null,"totalTestsPeopleAntigen":null,"positiveTestsPeopleAntigen":null,"totalTestsAntigen":317521,"positiveTestsAntigen":null,"fips":"22","positiveIncrease":0,"negativeIncrease":0,"total":4775952,"totalTestResultsIncrease":0,"posNeg":4775952,"dataQualityGrade":null,"deathIncrease":0,"hospitalizedIncrease":0,"hash":"00ceea700f05fae56c4c87fe6292e07c41631b79","commercialScore":0,"negativeRegularScore":0,"negativeScore":0,"positiveScore":0,"score":0,"grade":""},{"date":20210122,"state":"LA","positive":380255,"probableCases":45486,"negative":4395697,"pending":null,"totalTestResultsSource":"posNeg","totalTestResults":4775952,"hospitalizedCurrently":1747,"hospitalizedCumulative":null,"inIcuCurrently":null,"inIcuCumulative":null,"onVentilatorCurrently":216,"onVentilatorCumulative":null,"recovered":320025,"lastUpdateEt":"1/22/2021 13:00","dateModified":"2021-01-22T13:00:00Z","checkTimeEt":"01/22 08:00","death":8483,"hospitalized":null,"hospitalizedDischarged":null,"dateChecked":"2021-01-22T13:00:00Z","totalTestsViral":4730466,"positiveTestsViral":null,"negativeTestsViral":null,"positiveCasesViral":334769,"deathConfirmed":7964,"deathProbable":519,"totalTestEncountersViral":null,"totalTestsPeopleViral":null,"totalTestsAntibody":null,"positiveTestsAntibody":null,"negativeTestsAntibody":null,"totalTestsPeopleAntibody":null,"positiveTestsPeopleAntibody":null,"negativeTestsPeopleAntibody":null,"totalTestsPeopleAntigen":null,"positiveTestsPeopleAntigen":null,"totalTestsAntigen":317521,"positiveTestsAntigen":null,"fips":"22","positiveIncrease":1937,"negativeIncrease":25125,"total":4775952,"totalTestResultsIncrease":27062,"posNeg":4775952,"dataQualityGrade":null,"deathIncrease":41,"hospitalizedIncrease":0,"hash":"5e42dbe9383c79b41a9d5b1481854ebe88abaa2c","commercialScore":0,"negativeRegularScore":0,"negativeScore":0,"positiveScore":0,"score":0,"grade":""},{"date":20210121,"state":"LA","positive":378318,"probableCases":45345,"negative":4370572,"pending":null,"totalTestResultsSource":"posNeg","totalTestResults":4748890,"hospitalizedCurrently":1800,"hospitalizedCumulative":null,"inIcuCurrently":null,"inIcuCumulative":null,"onVentilatorCurrently":233,"onVentilatorCumulative":null,"recovered":320025,"lastUpdateEt":"1/21/2021 13:00","dateModified":"2021-01-21T13:00:00Z","checkTimeEt":"01/21 08:00","death":8442,"hospitalized":null,"hospitalizedDischarged":null,"dateChecked":"2021-01-21T13:00:00Z","totalTestsViral":4703545,"positiveTestsViral":null,"negativeTestsViral":null,"positiveCasesViral":332973,"deathConfirmed":7928,"deathProbable":514,"totalTestEncountersViral":null,"totalTestsPeopleViral":null,"totalTestsAntibody":null,"positiveTestsAntibody":null,"negativeTestsAntibody":null,"totalTestsPeopleAntibody":null,"positiveTestsPeopleAntibody":null,"negativeTestsPeopleAntibody":null,"totalTestsPeopleAntigen":null,"positiveTestsPeopleAntigen":null,"totalTestsAntigen":315365,"positiveTestsAntigen":null,"fips":"22","positiveIncrease":3736,"negativeIncrease":39673,"total":4748890,"totalTestResultsIncrease":43409,"posNeg":4748890,"dataQualityGrade":null,"deathIncrease":59,"hospitalizedIncrease":0,"hash":"f74526b25fa178f49bec11a392ca6ecaee19fc73","commercialScore":0,"negativeRegularScore":0,"negativeScore":0,"positiveScore":0,"score":0,"grade":""},{"date":20210120,"state":"LA","positive":374582,"probableCases":44288,"negative":4330899,"pending":null,"totalTestResultsSource":"posNeg","totalTestResults":4705481,"hospitalizedCurrently":1858,"hospitalizedCumulative":null,"inIcuCurrently":null,"inIcuCumulative":null,"onVentilatorCurrently":243,"onVentilatorCumulative":null,"recovered":320025,"lastUpdateEt":"1/20/2021 13:00","dateModified":"2021-01-20T13:00:00Z","checkTimeEt":"01/20 08:00","death":8383,"hospitalized":null,"hospitalizedDischarged":null,"dateChecked":"2021-01-20T13:00:00Z","totalTestsViral":4661193,"positiveTestsViral":null,"negativeTestsViral":null,"positiveCasesViral":330294,"deathConfirmed":7881,"deathProbable":502,"totalTestEncountersViral":null,"totalTestsPeopleViral":null,"totalTestsAntibody":null,"positiveTestsAntibody":null,"negativeTestsAntibody":null,"totalTestsPeopleAntibody":null,"positiveTestsPeopleAntibody":null,"negativeTestsPeopleAntibody":null,"totalTestsPeopleAntigen":null,"positiveTestsPeopleAntigen":null,"totalTestsAntigen":307053,"positiveTestsAntigen":null,"fips":"22","positiveIncrease":2493,"negativeIncrease":29041,"total":4705481,"totalTestResultsIncrease":31534,"posNeg":4705481,"dataQualityGrade":null,"deathIncrease":59,"hospitalizedIncrease":0,"hash":"1c0111d3e2ad14236a3abb1df219c28edb06f083","commercialScore":0,"negativeRegularScore":0,"negativeScore":0,"positiveScore":0,"score":0,"grade":""},{"date":20210119,"state":"LA","positive":372089,"probableCases":43229,"negative":4301858,"pending":null,"totalTestResultsSource":"posNeg","totalTestResults":4673947,"hospitalizedCurrently":1905,"hospitalizedCumulative":null,"inIcuCurrently":null,"inIcuCumulative":null,"onVentilatorCurrently":249,"onVentilatorCumulative":null,"recovered":298614,"lastUpdateEt":"1/19/2021 13:00","dateModified":"2021-01-19T13:00:00Z","checkTimeEt":"01/19 08:00","death":8324,"hospitalized":null,"hospitalizedDischarged":null,"dateChecked":"2021-01-19T13:00:00Z","totalTestsViral":4630718,"positiveTestsViral":null,"negativeTestsViral":null,"positiveCasesViral":328860,"deathConfirmed":7833,"deathProbable":491,"totalTestEncountersViral":null,"totalTestsPeopleViral":null,"totalTestsAntibody":null,"positiveTestsAntibody":null,"negativeTestsAntibody":null,"totalTestsPeopleAntibody":null,"positiveTestsPeopleAntibody":null,"negativeTestsPeopleAntibody":null,"totalTestsPeopleAntigen":null,"positiveTestsPeopleAntigen":null,"totalTestsAntigen":300098,"positiveTestsAntigen":null,"fips":"22","positiveIncrease":2138,"negativeIncrease":23312,"total":4673947,"totalTestResultsIncrease":25450,"posNeg":4673947,"dataQualityGrade":null,"deathIncrease":71,"hospitalizedIncrease":0,"hash":"e89ea6ad5718601feedf6529e58d22be3b7f35d8","commercialScore":0,"negativeRegularScore":0,"negativeScore":0,"positiveScore":0,"score":0,"grade":""},{"date":20210118,"state":"LA","positive":369951,"probableCases":42897,"negative":4278546,"pending":null,"totalTestResultsSource":"posNeg","totalTestResults":4648497,"hospitalizedCurrently":1894,"hospitalizedCumulative":null,"inIcuCurrently":null,"inIcuCumulative":null,"onVentilatorCurrently":239,"onVentilatorCumulative":null,"recovered":298614,"lastUpdateEt":"1/18/2021 13:00","dateModified":"2021-01-18T13:00:00Z","checkTimeEt":"01/18 08:00","death":8253,"hospitalized":null,"hospitalizedDischarged":null,"dateChecked":"2021-01-18T13:00:00Z","totalTestsViral":4605600,"positiveTestsViral":null,"negativeTestsViral":null,"positiveCasesViral":327054,"deathConfirmed":7784,"deathProbable":469,"totalTestEncountersViral":null,"totalTestsPeopleViral":null,"totalTestsAntibody":null,"positiveTestsAntibody":null,"negativeTestsAntibody":null,"totalTestsPeopleAntibody":null,"positiveTestsPeopleAntibody":null,"negativeTestsPeopleAntibody":null,"totalTestsPeopleAntigen":null,"positiveTestsPeopleAntigen":null,"totalTestsAntigen":297680,"positiveTestsAntigen":null,"fips":"22","positiveIncrease":971,"negativeIncrease":9180,"total":4648497,"totalTestResultsIncrease":10151,"posNeg":4648497,"dataQualityGrade":null,"deathIncrease":50,"hospitalizedIncrease":0,"hash":"838de7c9e4471bc8c47ccc4df00787f2e304d4a1","commercialScore":0,"negativeRegularScore":0,"negativeScore":0,"positiveScore":0,"score":0,"grade":""},{"date":20210117,"state":"LA","positive":368980,"probableCases":42879,"negative":4269366,"pending":null,"totalTestResultsSource":"posNeg","totalTestResults":4638346,"hospitalizedCurrently":1930,"hospitalizedCumulative":null,"inIcuCurrently":null,"inIcuCumulative":null,"onVentilatorCurrently":237,"onVentilatorCumulative":null,"recovered":298614,"lastUpdateEt":"1/17/2021 13:00","dateModified":"2021-01-17T13:00:00Z","checkTimeEt":"01/17 08:00","death":8203,"hospitalized":null,"hospitalizedDischarged":null,"dateChecked":"2021-01-17T13:00:00Z","totalTestsViral":4595467,"positiveTestsViral":null,"negativeTestsViral":null,"positiveCasesViral":326101,"deathConfirmed":7742,"deathProbable":461,"totalTestEncountersViral":null,"totalTestsPeopleViral":null,"totalTestsAntibody":null,"positiveTestsAntibody":null,"negativeTestsAntibody":null,"totalTestsPeopleAntibody":null,"positiveTestsPeopleAntibody":null,"negativeTestsPeopleAntibody":null,"totalTestsPeopleAntigen":null,"positiveTestsPeopleAntigen":null,"totalTestsAntigen":297348,"positiveTestsAntigen":null,"fips":"22","positiveIncrease":4127,"negativeIncrease":40791,"total":4638346,"totalTestResultsIncrease":44918,"posNeg":4638346,"dataQualityGrade":null,"deathIncrease":123,"hospitalizedIncrease":0,"hash":"961f3c3d4731c13df64e2124df6229285db519c4","commercialScore":0,"negativeRegularScore":0,"negativeScore":0,"positiveScore":0,"score":0,"grade":""},{"date":20210116,"state":"LA","positive":364853,"probableCases":42288,"negative":4228575,"pending":null,"totalTestResultsSource":"posNeg","totalTestResults":4593428,"hospitalizedCurrently":2001,"hospitalizedCumulative":null,"inIcuCurrently":null,"inIcuCumulative":null,"onVentilatorCurrently":242,"onVentilatorCumulative":null,"recovered":298614,"lastUpdateEt":"1/15/2021 13:00","dateModified":"2021-01-15T13:00:00Z","checkTimeEt":"01/15 08:00","death":8080,"hospitalized":null,"hospitalizedDischarged":null,"dateChecked":"2021-01-15T13:00:00Z","totalTestsViral":4551140,"positiveTestsViral":null,"negativeTestsViral":null,"positiveCasesViral":322565,"deathConfirmed":7631,"deathProbable":449,"totalTestEncountersViral":null,"totalTestsPeopleViral":null,"totalTestsAntibody":null,"positiveTestsAntibody":null,"negativeTestsAntibody":null,"totalTestsPeopleAntibody":null,"positiveTestsPeopleAntibody":null,"negativeTestsPeopleAntibody":null,"totalTestsPeopleAntigen":null,"positiveTestsPeopleAntigen":null,"totalTestsAntigen":292095,"positiveTestsAntigen":null,"fips":"22","positiveIncrease":0,"negativeIncrease":0,"total":4593428,"totalTestResultsIncrease":0,"posNeg":4593428,"dataQualityGrade":null,"deathIncrease":0,"hospitalizedIncrease":0,"hash":"99b1aae1137ae3fbc4ca3472c5b74654f7b874df","commercialScore":0,"negativeRegularScore":0,"negativeScore":0,"positiveScore":0,"score":0,"grade":""},{"date":20210115,"state":"LA","positive":364853,"probableCases":42288,"negative":4228575,"pending":null,"totalTestResultsSource":"posNeg","totalTestResults":4593428,"hospitalizedCurrently":2001,"hospitalizedCumulative":null,"inIcuCurrently":null,"inIcuCumulative":null,"onVentilatorCurrently":242,"onVentilatorCumulative":null,"recovered":298614,"lastUpdateEt":"1/15/2021 13:00","dateModified":"2021-01-15T13:00:00Z","checkTimeEt":"01/15 08:00","death":8080,"hospitalized":null,"hospitalizedDischarged":null,"dateChecked":"2021-01-15T13:00:00Z","totalTestsViral":4551140,"positiveTestsViral":null,"negativeTestsViral":null,"positiveCasesViral":322565,"deathConfirmed":7631,"deathProbable":449,"totalTestEncountersViral":null,"totalTestsPeopleViral":null,"totalTestsAntibody":null,"positiveTestsAntibody":null,"negativeTestsAntibody":null,"totalTestsPeopleAntibody":null,"positiveTestsPeopleAntibody":null,"negativeTestsPeopleAntibody":null,"totalTestsPeopleAntigen":null,"positiveTestsPeopleAntigen":null,"totalTestsAntigen":292095,"positiveTestsAntigen":null,"fips":"22","positiveIncrease":3705,"negativeIncrease":25774,"total":4593428,"totalTestResultsIncrease":29479,"posNeg":4593428,"dataQualityGrade":null,"deathIncrease":0,"hospitalizedIncrease":0,"hash":"6d137b69fde03ef7ec3fc473de08e6c1bb974231","commercialScore":0,"negativeRegularScore":0,"negativeScore":0,"positiveScore":0,"score":0,"grade":""},{"date":20210114,"state":"LA","positive":361148,"probableCases":40686,"negative":4202801,"pending":null,"totalTestResultsSource":"posNeg","totalTestResults":4563949,"hospitalizedCurrently":1975,"hospitalizedCumulative":null,"inIcuCurrently":null,"inIcuCumulative":null,"onVentilatorCurrently":245,"onVentilatorCumulative":null,"recovered":298614,"lastUpdateEt":"1/14/2021 13:00","dateModified":"2021-01-14T13:00:00Z","checkTimeEt":"01/14 08:00","death":8080,"hospitalized":null,"hospitalizedDischarged":null,"dateChecked":"2021-01-14T13:00:00Z","totalTestsViral":4523263,"positiveTestsViral":null,"negativeTestsViral":null,"positiveCasesViral":320462,"deathConfirmed":7631,"deathProbable":449,"totalTestEncountersViral":null,"totalTestsPeopleViral":null,"totalTestsAntibody":null,"positiveTestsAntibody":null,"negativeTestsAntibody":null,"totalTestsPeopleAntibody":null,"positiveTestsPeopleAntibody":null,"negativeTestsPeopleAntibody":null,"totalTestsPeopleAntigen":null,"positiveTestsPeopleAntigen":null,"totalTestsAntigen":281939,"positiveTestsAntigen":null,"fips":"22","positiveIncrease":5313,"negativeIncrease":30778,"total":4563949,"totalTestResultsIncrease":36091,"posNeg":4563949,"dataQualityGrade":null,"deathIncrease":58,"hospitalizedIncrease":0,"hash":"b597c50b0a02bda8860aae33fa5493f8862d1b1f","commercialScore":0,"negativeRegularScore":0,"negativeScore":0,"positiveScore":0,"score":0,"grade":""},{"date":20210113,"state":"LA","positive":355835,"probableCases":38499,"negative":4172023,"pending":null,"totalTestResultsSource":"posNeg","totalTestResults":4527858,"hospitalizedCurrently":2029,"hospitalizedCumulative":null,"inIcuCurrently":null,"inIcuCumulative":null,"onVentilatorCurrently":235,"onVentilatorCumulative":null,"recovered":298614,"lastUpdateEt":"1/13/2021 13:00","dateModified":"2021-01-13T13:00:00Z","checkTimeEt":"01/13 08:00","death":8022,"hospitalized":null,"hospitalizedDischarged":null,"dateChecked":"2021-01-13T13:00:00Z","totalTestsViral":4489359,"positiveTestsViral":null,"negativeTestsViral":null,"positiveCasesViral":317336,"deathConfirmed":7582,"deathProbable":440,"totalTestEncountersViral":null,"totalTestsPeopleViral":null,"totalTestsAntibody":null,"positiveTestsAntibody":null,"negativeTestsAntibody":null,"totalTestsPeopleAntibody":null,"positiveTestsPeopleAntibody":null,"negativeTestsPeopleAntibody":null,"totalTestsPeopleAntigen":null,"positiveTestsPeopleAntigen":null,"totalTestsAntigen":267725,"positiveTestsAntigen":null,"fips":"22","positiveIncrease":2896,"negativeIncrease":16174,"total":4527858,"totalTestResultsIncrease":19070,"posNeg":4527858,"dataQualityGrade":null,"deathIncrease":51,"hospitalizedIncrease":0,"hash":"5febbb9524bf20c86b559da77576ed49a5451338","commercialScore":0,"negativeRegularScore":0,"negativeScore":0,"positiveScore":0,"score":0,"grade":""},{"date":20210112,"state":"LA","positive":352939,"probableCases":37357,"negative":4155849,"pending":null,"totalTestResultsSource":"posNeg","totalTestResults":4508788,"hospitalizedCurrently":2035,"hospitalizedCumulative":null,"inIcuCurrently":null,"inIcuCumulative":null,"onVentilatorCurrently":244,"onVentilatorCumulative":null,"recovered":280373,"lastUpdateEt":"1/12/2021 13:00","dateModified":"2021-01-12T13:00:00Z","checkTimeEt":"01/12 08:00","death":7971,"hospitalized":null,"hospitalizedDischarged":null,"dateChecked":"2021-01-12T13:00:00Z","totalTestsViral":4471431,"positiveTestsViral":null,"negativeTestsViral":null,"positiveCasesViral":315582,"deathConfirmed":7536,"deathProbable":435,"totalTestEncountersViral":null,"totalTestsPeopleViral":null,"totalTestsAntibody":null,"positiveTestsAntibody":null,"negativeTestsAntibody":null,"totalTestsPeopleAntibody":null,"positiveTestsPeopleAntibody":null,"negativeTestsPeopleAntibody":null,"totalTestsPeopleAntigen":null,"positiveTestsPeopleAntigen":null,"totalTestsAntigen":259866,"positiveTestsAntigen":null,"fips":"22","positiveIncrease":4705,"negativeIncrease":45336,"total":4508788,"totalTestResultsIncrease":50041,"posNeg":4508788,"dataQualityGrade":null,"deathIncrease":53,"hospitalizedIncrease":0,"hash":"a975e9b7726199346f0c060fc913c7385f5c19fa","commercialScore":0,"negativeRegularScore":0,"negativeScore":0,"positiveScore":0,"score":0,"grade":""},{"date":20210111,"state":"LA","positive":348234,"probableCases":35944,"negative":4110513,"pending":null,"totalTestResultsSource":"posNeg","totalTestResults":4458747,"hospitalizedCurrently":1982,"hospitalizedCumulative":null,"inIcuCurrently":null,"inIcuCumulative":null,"onVentilatorCurrently":232,"onVentilatorCumulative":null,"recovered":280373,"lastUpdateEt":"1/11/2021 13:00","dateModified":"2021-01-11T13:00:00Z","checkTimeEt":"01/11 08:00","death":7918,"hospitalized":null,"hospitalizedDischarged":null,"dateChecked":"2021-01-11T13:00:00Z","totalTestsViral":4422803,"positiveTestsViral":null,"negativeTestsViral":null,"positiveCasesViral":312290,"deathConfirmed":7489,"deathProbable":429,"totalTestEncountersViral":null,"totalTestsPeopleViral":null,"totalTestsAntibody":null,"positiveTestsAntibody":null,"negativeTestsAntibody":null,"totalTestsPeopleAntibody":null,"positiveTestsPeopleAntibody":null,"negativeTestsPeopleAntibody":null,"totalTestsPeopleAntigen":null,"positiveTestsPeopleAntigen":null,"totalTestsAntigen":251592,"positiveTestsAntigen":null,"fips":"22","positiveIncrease":1405,"negativeIncrease":11423,"total":4458747,"totalTestResultsIncrease":12828,"posNeg":4458747,"dataQualityGrade":null,"deathIncrease":45,"hospitalizedIncrease":0,"hash":"ab850e73fed527d0085192befa46df0300e0c938","commercialScore":0,"negativeRegularScore":0,"negativeScore":0,"positiveScore":0,"score":0,"grade":""},{"date":20210110,"state":"LA","positive":346829,"probableCases":35872,"negative":4099090,"pending":null,"totalTestResultsSource":"posNeg","totalTestResults":4445919,"hospitalizedCurrently":1960,"hospitalizedCumulative":null,"inIcuCurrently":null,"inIcuCumulative":null,"onVentilatorCurrently":225,"onVentilatorCumulative":null,"recovered":280373,"lastUpdateEt":"1/10/2021 13:00","dateModified":"2021-01-10T13:00:00Z","checkTimeEt":"01/10 08:00","death":7873,"hospitalized":null,"hospitalizedDischarged":null,"dateChecked":"2021-01-10T13:00:00Z","totalTestsViral":4410047,"positiveTestsViral":null,"negativeTestsViral":null,"positiveCasesViral":310957,"deathConfirmed":7447,"deathProbable":426,"totalTestEncountersViral":null,"totalTestsPeopleViral":null,"totalTestsAntibody":null,"positiveTestsAntibody":null,"negativeTestsAntibody":null,"totalTestsPeopleAntibody":null,"positiveTestsPeopleAntibody":null,"negativeTestsPeopleAntibody":null,"totalTestsPeopleAntigen":null,"positiveTestsPeopleAntigen":null,"totalTestsAntigen":251094,"positiveTestsAntigen":null,"fips":"22","positiveIncrease":5398,"negativeIncrease":41263,"total":4445919,"totalTestResultsIncrease":46661,"posNeg":4445919,"dataQualityGrade":null,"deathIncrease":40,"hospitalizedIncrease":0,"hash":"f27819e383a0d793e202484ecf1e8d784a68c5d1","commercialScore":0,"negativeRegularScore":0,"negativeScore":0,"positiveScore":0,"score":0,"grade":""},{"date":20210109,"state":"LA","positive":341431,"probableCases":34989,"negative":4057827,"pending":null,"totalTestResultsSource":"posNeg","totalTestResults":4399258,"hospitalizedCurrently":2069,"hospitalizedCumulative":null,"inIcuCurrently":null,"inIcuCumulative":null,"onVentilatorCurrently":220,"onVentilatorCumulative":null,"recovered":280373,"lastUpdateEt":"1/8/2021 13:00","dateModified":"2021-01-08T13:00:00Z","checkTimeEt":"01/08 08:00","death":7833,"hospitalized":null,"hospitalizedDischarged":null,"dateChecked":"2021-01-08T13:00:00Z","totalTestsViral":4364269,"positiveTestsViral":null,"negativeTestsViral":null,"positiveCasesViral":306442,"deathConfirmed":7411,"deathProbable":422,"totalTestEncountersViral":null,"totalTestsPeopleViral":null,"totalTestsAntibody":null,"positiveTestsAntibody":null,"negativeTestsAntibody":null,"totalTestsPeopleAntibody":null,"positiveTestsPeopleAntibody":null,"negativeTestsPeopleAntibody":null,"totalTestsPeopleAntigen":null,"positiveTestsPeopleAntigen":null,"totalTestsAntigen":244578,"positiveTestsAntigen":null,"fips":"22","positiveIncrease":0,"negativeIncrease":0,"total":4399258,"totalTestResultsIncrease":0,"posNeg":4399258,"dataQualityGrade":null,"deathIncrease":0,"hospitalizedIncrease":0,"hash":"7a6566fcff985aca287e061ee5b7c637db5b60b4","commercialScore":0,"negativeRegularScore":0,"negativeScore":0,"positiveScore":0,"score":0,"grade":""},{"date":20210108,"state":"LA","positive":341431,"probableCases":34989,"negative":4057827,"pending":null,"totalTestResultsSource":"posNeg","totalTestResults":4399258,"hospitalizedCurrently":2069,"hospitalizedCumulative":null,"inIcuCurrently":null,"inIcuCumulative":null,"onVentilatorCurrently":220,"onVentilatorCumulative":null,"recovered":280373,"lastUpdateEt":"1/8/2021 13:00","dateModified":"2021-01-08T13:00:00Z","checkTimeEt":"01/08 08:00","death":7833,"hospitalized":null,"hospitalizedDischarged":null,"dateChecked":"2021-01-08T13:00:00Z","totalTestsViral":4364269,"positiveTestsViral":null,"negativeTestsViral":null,"positiveCasesViral":306442,"deathConfirmed":7411,"deathProbable":422,"totalTestEncountersViral":null,"totalTestsPeopleViral":null,"totalTestsAntibody":null,"positiveTestsAntibody":null,"negativeTestsAntibody":null,"totalTestsPeopleAntibody":null,"positiveTestsPeopleAntibody":null,"negativeTestsPeopleAntibody":null,"totalTestsPeopleAntigen":null,"positiveTestsPeopleAntigen":null,"totalTestsAntigen":244578,"positiveTestsAntigen":null,"fips":"22","positiveIncrease":3377,"negativeIncrease":26432,"total":4399258,"totalTestResultsIncrease":29809,"posNeg":4399258,"dataQualityGrade":null,"deathIncrease":105,"hospitalizedIncrease":0,"hash":"abfea9fc7765f7446d5c6b64bff3eb0ff2267215","commercialScore":0,"negativeRegularScore":0,"negativeScore":0,"positiveScore":0,"score":0,"grade":""},{"date":20210107,"state":"LA","positive":338054,"probableCases":34165,"negative":4031395,"pending":null,"totalTestResultsSource":"posNeg","totalTestResults":4369449,"hospitalizedCurrently":2033,"hospitalizedCumulative":null,"inIcuCurrently":null,"inIcuCumulative":null,"onVentilatorCurrently":219,"onVentilatorCumulative":null,"recovered":280373,"lastUpdateEt":"1/7/2021 13:00","dateModified":"2021-01-07T13:00:00Z","checkTimeEt":"01/07 08:00","death":7728,"hospitalized":null,"hospitalizedDischarged":null,"dateChecked":"2021-01-07T13:00:00Z","totalTestsViral":4335284,"positiveTestsViral":null,"negativeTestsViral":null,"positiveCasesViral":303889,"deathConfirmed":7319,"deathProbable":409,"totalTestEncountersViral":null,"totalTestsPeopleViral":null,"totalTestsAntibody":null,"positiveTestsAntibody":null,"negativeTestsAntibody":null,"totalTestsPeopleAntibody":null,"positiveTestsPeopleAntibody":null,"negativeTestsPeopleAntibody":null,"totalTestsPeopleAntigen":null,"positiveTestsPeopleAntigen":null,"totalTestsAntigen":239754,"positiveTestsAntigen":null,"fips":"22","positiveIncrease":4530,"negativeIncrease":29927,"total":4369449,"totalTestResultsIncrease":34457,"posNeg":4369449,"dataQualityGrade":null,"deathIncrease":47,"hospitalizedIncrease":0,"hash":"5787ec1b336115188e8f72e7afbffbda52023af0","commercialScore":0,"negativeRegularScore":0,"negativeScore":0,"positiveScore":0,"score":0,"grade":""},{"date":20210106,"state":"LA","positive":333524,"probableCases":33557,"negative":4001468,"pending":null,"totalTestResultsSource":"posNeg","totalTestResults":4334992,"hospitalizedCurrently":1993,"hospitalizedCumulative":null,"inIcuCurrently":null,"inIcuCumulative":null,"onVentilatorCurrently":207,"onVentilatorCumulative":null,"recovered":280373,"lastUpdateEt":"1/6/2021 13:00","dateModified":"2021-01-06T13:00:00Z","checkTimeEt":"01/06 08:00","death":7681,"hospitalized":null,"hospitalizedDischarged":null,"dateChecked":"2021-01-06T13:00:00Z","totalTestsViral":4301435,"positiveTestsViral":null,"negativeTestsViral":null,"positiveCasesViral":299967,"deathConfirmed":7273,"deathProbable":408,"totalTestEncountersViral":null,"totalTestsPeopleViral":null,"totalTestsAntibody":null,"positiveTestsAntibody":null,"negativeTestsAntibody":null,"totalTestsPeopleAntibody":null,"positiveTestsPeopleAntibody":null,"negativeTestsPeopleAntibody":null,"totalTestsPeopleAntigen":null,"positiveTestsPeopleAntigen":null,"totalTestsAntigen":235661,"positiveTestsAntigen":null,"fips":"22","positiveIncrease":6876,"negativeIncrease":20361,"total":4334992,"totalTestResultsIncrease":27237,"posNeg":4334992,"dataQualityGrade":null,"deathIncrease":46,"hospitalizedIncrease":0,"hash":"bac340dbc7d53f4ba713f08e190454bb16a1807b","commercialScore":0,"negativeRegularScore":0,"negativeScore":0,"positiveScore":0,"score":0,"grade":""},{"date":20210105,"state":"LA","positive":326648,"probableCases":30823,"negative":3981107,"pending":null,"totalTestResultsSource":"posNeg","totalTestResults":4307755,"hospitalizedCurrently":1974,"hospitalizedCumulative":null,"inIcuCurrently":null,"inIcuCumulative":null,"onVentilatorCurrently":205,"onVentilatorCumulative":null,"recovered":263712,"lastUpdateEt":"1/5/2021 13:00","dateModified":"2021-01-05T13:00:00Z","checkTimeEt":"01/05 08:00","death":7635,"hospitalized":null,"hospitalizedDischarged":null,"dateChecked":"2021-01-05T13:00:00Z","totalTestsViral":4276932,"positiveTestsViral":null,"negativeTestsViral":null,"positiveCasesViral":295825,"deathConfirmed":7241,"deathProbable":394,"totalTestEncountersViral":null,"totalTestsPeopleViral":null,"totalTestsAntibody":null,"positiveTestsAntibody":null,"negativeTestsAntibody":null,"totalTestsPeopleAntibody":null,"positiveTestsPeopleAntibody":null,"negativeTestsPeopleAntibody":null,"totalTestsPeopleAntigen":null,"positiveTestsPeopleAntigen":null,"totalTestsAntigen":223291,"positiveTestsAntigen":null,"fips":"22","positiveIncrease":4467,"negativeIncrease":37529,"total":4307755,"totalTestResultsIncrease":41996,"posNeg":4307755,"dataQualityGrade":null,"deathIncrease":50,"hospitalizedIncrease":0,"hash":"696374b12c74bfaaeadb5ca3db45ca18cb022b0a","commercialScore":0,"negativeRegularScore":0,"negativeScore":0,"positiveScore":0,"score":0,"grade":""},{"date":20210104,"state":"LA","positive":322181,"probableCases":29997,"negative":3943578,"pending":null,"totalTestResultsSource":"posNeg","totalTestResults":4265759,"hospitalizedCurrently":1891,"hospitalizedCumulative":null,"inIcuCurrently":null,"inIcuCumulative":null,"onVentilatorCurrently":207,"onVentilatorCumulative":null,"recovered":263712,"lastUpdateEt":"1/4/2021 13:00","dateModified":"2021-01-04T13:00:00Z","checkTimeEt":"01/04 08:00","death":7585,"hospitalized":null,"hospitalizedDischarged":null,"dateChecked":"2021-01-04T13:00:00Z","totalTestsViral":4235762,"positiveTestsViral":null,"negativeTestsViral":null,"positiveCasesViral":292184,"deathConfirmed":7198,"deathProbable":387,"totalTestEncountersViral":null,"totalTestsPeopleViral":null,"totalTestsAntibody":null,"positiveTestsAntibody":null,"negativeTestsAntibody":null,"totalTestsPeopleAntibody":null,"positiveTestsPeopleAntibody":null,"negativeTestsPeopleAntibody":null,"totalTestsPeopleAntigen":null,"positiveTestsPeopleAntigen":null,"totalTestsAntigen":217869,"positiveTestsAntigen":null,"fips":"22","positiveIncrease":1123,"negativeIncrease":8170,"total":4265759,"totalTestResultsIncrease":9293,"posNeg":4265759,"dataQualityGrade":null,"deathIncrease":48,"hospitalizedIncrease":0,"hash":"fbef716a03ceb11de7a9d1ad9033b5ce57eac1a7","commercialScore":0,"negativeRegularScore":0,"negativeScore":0,"positiveScore":0,"score":0,"grade":""},{"date":20210103,"state":"LA","positive":321058,"probableCases":29979,"negative":3935408,"pending":null,"totalTestResultsSource":"posNeg","totalTestResults":4256466,"hospitalizedCurrently":1833,"hospitalizedCumulative":null,"inIcuCurrently":null,"inIcuCumulative":null,"onVentilatorCurrently":204,"onVentilatorCumulative":null,"recovered":263712,"lastUpdateEt":"1/3/2021 13:00","dateModified":"2021-01-03T13:00:00Z","checkTimeEt":"01/03 08:00","death":7537,"hospitalized":null,"hospitalizedDischarged":null,"dateChecked":"2021-01-03T13:00:00Z","totalTestsViral":4226487,"positiveTestsViral":null,"negativeTestsViral":null,"positiveCasesViral":291079,"deathConfirmed":7162,"deathProbable":375,"totalTestEncountersViral":null,"totalTestsPeopleViral":null,"totalTestsAntibody":null,"positiveTestsAntibody":null,"negativeTestsAntibody":null,"totalTestsPeopleAntibody":null,"positiveTestsPeopleAntibody":null,"negativeTestsPeopleAntibody":null,"totalTestsPeopleAntigen":null,"positiveTestsPeopleAntigen":null,"totalTestsAntigen":217582,"positiveTestsAntigen":null,"fips":"22","positiveIncrease":5783,"negativeIncrease":36501,"total":4256466,"totalTestResultsIncrease":42284,"posNeg":4256466,"dataQualityGrade":null,"deathIncrease":49,"hospitalizedIncrease":0,"hash":"27962edf4d5f547dd52b94d91c166b0e6adfbebc","commercialScore":0,"negativeRegularScore":0,"negativeScore":0,"positiveScore":0,"score":0,"grade":""},{"date":20210102,"state":"LA","positive":315275,"probableCases":29798,"negative":3898907,"pending":null,"totalTestResultsSource":"posNeg","totalTestResults":4214182,"hospitalizedCurrently":1731,"hospitalizedCumulative":null,"inIcuCurrently":null,"inIcuCumulative":null,"onVentilatorCurrently":202,"onVentilatorCumulative":null,"recovered":263712,"lastUpdateEt":"12/31/2020 13:00","dateModified":"2020-12-31T13:00:00Z","checkTimeEt":"12/31 08:00","death":7488,"hospitalized":null,"hospitalizedDischarged":null,"dateChecked":"2020-12-31T13:00:00Z","totalTestsViral":4184384,"positiveTestsViral":null,"negativeTestsViral":null,"positiveCasesViral":285477,"deathConfirmed":7115,"deathProbable":373,"totalTestEncountersViral":null,"totalTestsPeopleViral":null,"totalTestsAntibody":null,"positiveTestsAntibody":null,"negativeTestsAntibody":null,"totalTestsPeopleAntibody":null,"positiveTestsPeopleAntibody":null,"negativeTestsPeopleAntibody":null,"totalTestsPeopleAntigen":null,"positiveTestsPeopleAntigen":null,"totalTestsAntigen":215765,"positiveTestsAntigen":null,"fips":"22","positiveIncrease":0,"negativeIncrease":0,"total":4214182,"totalTestResultsIncrease":0,"posNeg":4214182,"dataQualityGrade":null,"deathIncrease":0,"hospitalizedIncrease":0,"hash":"fc756f38a155b19dd250ad85e0553fdabe4bf9e6","commercialScore":0,"negativeRegularScore":0,"negativeScore":0,"positiveScore":0,"score":0,"grade":""},{"date":20210101,"state":"LA","positive":315275,"probableCases":29798,"negative":3898907,"pending":null,"totalTestResultsSource":"posNeg","totalTestResults":4214182,"hospitalizedCurrently":1731,"hospitalizedCumulative":null,"inIcuCurrently":null,"inIcuCumulative":null,"onVentilatorCurrently":202,"onVentilatorCumulative":null,"recovered":263712,"lastUpdateEt":"12/31/2020 13:00","dateModified":"2020-12-31T13:00:00Z","checkTimeEt":"12/31 08:00","death":7488,"hospitalized":null,"hospitalizedDischarged":null,"dateChecked":"2020-12-31T13:00:00Z","totalTestsViral":4184384,"positiveTestsViral":null,"negativeTestsViral":null,"positiveCasesViral":285477,"deathConfirmed":7115,"deathProbable":373,"totalTestEncountersViral":null,"totalTestsPeopleViral":null,"totalTestsAntibody":null,"positiveTestsAntibody":null,"negativeTestsAntibody":null,"totalTestsPeopleAntibody":null,"positiveTestsPeopleAntibody":null,"negativeTestsPeopleAntibody":null,"totalTestsPeopleAntigen":null,"positiveTestsPeopleAntigen":null,"totalTestsAntigen":215765,"positiveTestsAntigen":null,"fips":"22","positiveIncrease":0,"negativeIncrease":0,"total":4214182,"totalTestResultsIncrease":0,"posNeg":4214182,"dataQualityGrade":null,"deathIncrease":0,"hospitalizedIncrease":0,"hash":"1cf5ee57567fc91d6a2ce88984122e3572e6a043","commercialScore":0,"negativeRegularScore":0,"negativeScore":0,"positiveScore":0,"score":0,"grade":""},{"date":20201231,"state":"LA","positive":315275,"probableCases":29798,"negative":3898907,"pending":null,"totalTestResultsSource":"posNeg","totalTestResults":4214182,"hospitalizedCurrently":1731,"hospitalizedCumulative":null,"inIcuCurrently":null,"inIcuCumulative":null,"onVentilatorCurrently":202,"onVentilatorCumulative":null,"recovered":263712,"lastUpdateEt":"12/31/2020 13:00","dateModified":"2020-12-31T13:00:00Z","checkTimeEt":"12/31 08:00","death":7488,"hospitalized":null,"hospitalizedDischarged":null,"dateChecked":"2020-12-31T13:00:00Z","totalTestsViral":4184384,"positiveTestsViral":null,"negativeTestsViral":null,"positiveCasesViral":285477,"deathConfirmed":7115,"deathProbable":373,"totalTestEncountersViral":null,"totalTestsPeopleViral":null,"totalTestsAntibody":null,"positiveTestsAntibody":null,"negativeTestsAntibody":null,"totalTestsPeopleAntibody":null,"positiveTestsPeopleAntibody":null,"negativeTestsPeopleAntibody":null,"totalTestsPeopleAntigen":null,"positiveTestsPeopleAntigen":null,"totalTestsAntigen":215765,"positiveTestsAntigen":null,"fips":"22","positiveIncrease":4046,"negativeIncrease":25368,"total":4214182,"totalTestResultsIncrease":29414,"posNeg":4214182,"dataQualityGrade":null,"deathIncrease":40,"hospitalizedIncrease":0,"hash":"89c8b7e882f51e3de9e1e42e4869e30fba5139a4","commercialScore":0,"negativeRegularScore":0,"negativeScore":0,"positiveScore":0,"score":0,"grade":""},{"date":20201230,"state":"LA","positive":311229,"probableCases":29081,"negative":3873539,"pending":null,"totalTestResultsSource":"posNeg","totalTestResults":4184768,"hospitalizedCurrently":1717,"hospitalizedCumulative":null,"inIcuCurrently":null,"inIcuCumulative":null,"onVentilatorCurrently":210,"onVentilatorCumulative":null,"recovered":263712,"lastUpdateEt":"12/30/2020 13:00","dateModified":"2020-12-30T13:00:00Z","checkTimeEt":"12/30 08:00","death":7448,"hospitalized":null,"hospitalizedDischarged":null,"dateChecked":"2020-12-30T13:00:00Z","totalTestsViral":4155687,"positiveTestsViral":null,"negativeTestsViral":null,"positiveCasesViral":282148,"deathConfirmed":7078,"deathProbable":370,"totalTestEncountersViral":null,"totalTestsPeopleViral":null,"totalTestsAntibody":null,"positiveTestsAntibody":null,"negativeTestsAntibody":null,"totalTestsPeopleAntibody":null,"positiveTestsPeopleAntibody":null,"negativeTestsPeopleAntibody":null,"totalTestsPeopleAntigen":null,"positiveTestsPeopleAntigen":null,"totalTestsAntigen":211855,"positiveTestsAntigen":null,"fips":"22","positiveIncrease":6744,"negativeIncrease":35916,"total":4184768,"totalTestResultsIncrease":42660,"posNeg":4184768,"dataQualityGrade":null,"deathIncrease":51,"hospitalizedIncrease":0,"hash":"adf29a4ce865a6ce323f858c9b6ef0b5f2201440","commercialScore":0,"negativeRegularScore":0,"negativeScore":0,"positiveScore":0,"score":0,"grade":""},{"date":20201229,"state":"LA","positive":304485,"probableCases":26598,"negative":3837623,"pending":null,"totalTestResultsSource":"posNeg","totalTestResults":4142108,"hospitalizedCurrently":1689,"hospitalizedCumulative":null,"inIcuCurrently":null,"inIcuCumulative":null,"onVentilatorCurrently":218,"onVentilatorCumulative":null,"recovered":247501,"lastUpdateEt":"12/29/2020 13:00","dateModified":"2020-12-29T13:00:00Z","checkTimeEt":"12/29 08:00","death":7397,"hospitalized":null,"hospitalizedDischarged":null,"dateChecked":"2020-12-29T13:00:00Z","totalTestsViral":4115510,"positiveTestsViral":null,"negativeTestsViral":null,"positiveCasesViral":277887,"deathConfirmed":7034,"deathProbable":363,"totalTestEncountersViral":null,"totalTestsPeopleViral":null,"totalTestsAntibody":null,"positiveTestsAntibody":null,"negativeTestsAntibody":null,"totalTestsPeopleAntibody":null,"positiveTestsPeopleAntibody":null,"negativeTestsPeopleAntibody":null,"totalTestsPeopleAntigen":null,"positiveTestsPeopleAntigen":null,"totalTestsAntigen":199923,"positiveTestsAntigen":null,"fips":"22","positiveIncrease":3946,"negativeIncrease":29998,"total":4142108,"totalTestResultsIncrease":33944,"posNeg":4142108,"dataQualityGrade":null,"deathIncrease":61,"hospitalizedIncrease":0,"hash":"b1ff24d4c0557f0934f52d899ad57ee8d861c6da","commercialScore":0,"negativeRegularScore":0,"negativeScore":0,"positiveScore":0,"score":0,"grade":""},{"date":20201228,"state":"LA","positive":300539,"probableCases":25758,"negative":3807625,"pending":null,"totalTestResultsSource":"posNeg","totalTestResults":4108164,"hospitalizedCurrently":1597,"hospitalizedCumulative":null,"inIcuCurrently":null,"inIcuCumulative":null,"onVentilatorCurrently":201,"onVentilatorCumulative":null,"recovered":247501,"lastUpdateEt":"12/28/2020 13:00","dateModified":"2020-12-28T13:00:00Z","checkTimeEt":"12/28 08:00","death":7336,"hospitalized":null,"hospitalizedDischarged":null,"dateChecked":"2020-12-28T13:00:00Z","totalTestsViral":4082406,"positiveTestsViral":null,"negativeTestsViral":null,"positiveCasesViral":274781,"deathConfirmed":6980,"deathProbable":356,"totalTestEncountersViral":null,"totalTestsPeopleViral":null,"totalTestsAntibody":null,"positiveTestsAntibody":null,"negativeTestsAntibody":null,"totalTestsPeopleAntibody":null,"positiveTestsPeopleAntibody":null,"negativeTestsPeopleAntibody":null,"totalTestsPeopleAntigen":null,"positiveTestsPeopleAntigen":null,"totalTestsAntigen":195671,"positiveTestsAntigen":null,"fips":"22","positiveIncrease":817,"negativeIncrease":4695,"total":4108164,"totalTestResultsIncrease":5512,"posNeg":4108164,"dataQualityGrade":null,"deathIncrease":45,"hospitalizedIncrease":0,"hash":"74620c12aa530732d9fa449f03e8e112ea8fbb14","commercialScore":0,"negativeRegularScore":0,"negativeScore":0,"positiveScore":0,"score":0,"grade":""},{"date":20201227,"state":"LA","positive":299722,"probableCases":25674,"negative":3802930,"pending":null,"totalTestResultsSource":"posNeg","totalTestResults":4102652,"hospitalizedCurrently":1530,"hospitalizedCumulative":null,"inIcuCurrently":null,"inIcuCumulative":null,"onVentilatorCurrently":191,"onVentilatorCumulative":null,"recovered":247501,"lastUpdateEt":"12/27/2020 13:00","dateModified":"2020-12-27T13:00:00Z","checkTimeEt":"12/27 08:00","death":7291,"hospitalized":null,"hospitalizedDischarged":null,"dateChecked":"2020-12-27T13:00:00Z","totalTestsViral":4076978,"positiveTestsViral":null,"negativeTestsViral":null,"positiveCasesViral":274048,"deathConfirmed":6936,"deathProbable":355,"totalTestEncountersViral":null,"totalTestsPeopleViral":null,"totalTestsAntibody":null,"positiveTestsAntibody":null,"negativeTestsAntibody":null,"totalTestsPeopleAntibody":null,"positiveTestsPeopleAntibody":null,"negativeTestsPeopleAntibody":null,"totalTestsPeopleAntigen":null,"positiveTestsPeopleAntigen":null,"totalTestsAntigen":195221,"positiveTestsAntigen":null,"fips":"22","positiveIncrease":3223,"negativeIncrease":23607,"total":4102652,"totalTestResultsIncrease":26830,"posNeg":4102652,"dataQualityGrade":null,"deathIncrease":19,"hospitalizedIncrease":0,"hash":"61fafbd27c66f78fbad71a1aead3a88ac78aa615","commercialScore":0,"negativeRegularScore":0,"negativeScore":0,"positiveScore":0,"score":0,"grade":""},{"date":20201226,"state":"LA","positive":296499,"probableCases":25322,"negative":3779323,"pending":null,"totalTestResultsSource":"posNeg","totalTestResults":4075822,"hospitalizedCurrently":1633,"hospitalizedCumulative":null,"inIcuCurrently":null,"inIcu