[{"date":20210307,"state":"RI","positive":128781,"probableCases":null,"negative":677570,"pending":null,"totalTestResultsSource":"totalTestEncountersViral","totalTestResults":3123348,"hospitalizedCurrently":141,"hospitalizedCumulative":9020,"inIcuCurrently":25,"inIcuCumulative":null,"onVentilatorCurrently":16,"onVentilatorCumulative":null,"recovered":null,"lastUpdateEt":"3/8/2021 16:31","dateModified":"2021-03-08T16:31:00Z","checkTimeEt":"03/08 11:31","death":2547,"hospitalized":9020,"hospitalizedDischarged":7865,"dateChecked":"2021-03-08T16:31:00Z","totalTestsViral":null,"positiveTestsViral":153260,"negativeTestsViral":2970088,"positiveCasesViral":null,"deathConfirmed":null,"deathProbable":null,"totalTestEncountersViral":3123348,"totalTestsPeopleViral":806351,"totalTestsAntibody":null,"positiveTestsAntibody":null,"negativeTestsAntibody":null,"totalTestsPeopleAntibody":null,"positiveTestsPeopleAntibody":null,"negativeTestsPeopleAntibody":null,"totalTestsPeopleAntigen":null,"positiveTestsPeopleAntigen":null,"totalTestsAntigen":null,"positiveTestsAntigen":null,"fips":"44","positiveIncrease":265,"negativeIncrease":1421,"total":806351,"totalTestResultsIncrease":13513,"posNeg":806351,"dataQualityGrade":null,"deathIncrease":0,"hospitalizedIncrease":0,"hash":"604774c9b6670cbf0a7060307078cfd0e6504e4d","commercialScore":0,"negativeRegularScore":0,"negativeScore":0,"positiveScore":0,"score":0,"grade":""},{"date":20210306,"state":"RI","positive":128516,"probableCases":null,"negative":676149,"pending":null,"totalTestResultsSource":"totalTestEncountersViral","totalTestResults":3109835,"hospitalizedCurrently":141,"hospitalizedCumulative":9020,"inIcuCurrently":25,"inIcuCumulative":null,"onVentilatorCurrently":16,"onVentilatorCumulative":null,"recovered":null,"lastUpdateEt":"3/8/2021 16:31","dateModified":"2021-03-08T16:31:00Z","checkTimeEt":"03/08 11:31","death":2547,"hospitalized":9020,"hospitalizedDischarged":7865,"dateChecked":"2021-03-08T16:31:00Z","totalTestsViral":null,"positiveTestsViral":152964,"negativeTestsViral":2956871,"positiveCasesViral":null,"deathConfirmed":null,"deathProbable":null,"totalTestEncountersViral":3109835,"totalTestsPeopleViral":804665,"totalTestsAntibody":null,"positiveTestsAntibody":null,"negativeTestsAntibody":null,"totalTestsPeopleAntibody":null,"positiveTestsPeopleAntibody":null,"negativeTestsPeopleAntibody":null,"totalTestsPeopleAntigen":null,"positiveTestsPeopleAntigen":null,"totalTestsAntigen":null,"positiveTestsAntigen":null,"fips":"44","positiveIncrease":395,"negativeIncrease":1634,"total":804665,"totalTestResultsIncrease":21854,"posNeg":804665,"dataQualityGrade":null,"deathIncrease":6,"hospitalizedIncrease":0,"hash":"6020697a20d21adb669d1e36a90b1ef18b9346ea","commercialScore":0,"negativeRegularScore":0,"negativeScore":0,"positiveScore":0,"score":0,"grade":""},{"date":20210305,"state":"RI","positive":128121,"probableCases":null,"negative":674515,"pending":null,"totalTestResultsSource":"totalTestEncountersViral","totalTestResults":3087981,"hospitalizedCurrently":141,"hospitalizedCumulative":9020,"inIcuCurrently":25,"inIcuCumulative":null,"onVentilatorCurrently":16,"onVentilatorCumulative":null,"recovered":null,"lastUpdateEt":"3/5/2021 13:00","dateModified":"2021-03-05T13:00:00Z","checkTimeEt":"03/05 08:00","death":2541,"hospitalized":9020,"hospitalizedDischarged":7865,"dateChecked":"2021-03-05T13:00:00Z","totalTestsViral":null,"positiveTestsViral":152549,"negativeTestsViral":2935432,"positiveCasesViral":null,"deathConfirmed":null,"deathProbable":null,"totalTestEncountersViral":3087981,"totalTestsPeopleViral":802636,"totalTestsAntibody":null,"positiveTestsAntibody":null,"negativeTestsAntibody":null,"totalTestsPeopleAntibody":null,"positiveTestsPeopleAntibody":null,"negativeTestsPeopleAntibody":null,"totalTestsPeopleAntigen":null,"positiveTestsPeopleAntigen":null,"totalTestsAntigen":null,"positiveTestsAntigen":null,"fips":"44","positiveIncrease":394,"negativeIncrease":1387,"total":802636,"totalTestResultsIncrease":22869,"posNeg":802636,"dataQualityGrade":null,"deathIncrease":2,"hospitalizedIncrease":18,"hash":"b002a515c1592d2d9cfff080b3fca225487b8670","commercialScore":0,"negativeRegularScore":0,"negativeScore":0,"positiveScore":0,"score":0,"grade":""},{"date":20210304,"state":"RI","positive":127727,"probableCases":null,"negative":673128,"pending":null,"totalTestResultsSource":"totalTestEncountersViral","totalTestResults":3065112,"hospitalizedCurrently":148,"hospitalizedCumulative":9002,"inIcuCurrently":23,"inIcuCumulative":null,"onVentilatorCurrently":16,"onVentilatorCumulative":null,"recovered":null,"lastUpdateEt":"3/4/2021 13:00","dateModified":"2021-03-04T13:00:00Z","checkTimeEt":"03/04 08:00","death":2539,"hospitalized":9002,"hospitalizedDischarged":7842,"dateChecked":"2021-03-04T13:00:00Z","totalTestsViral":null,"positiveTestsViral":152103,"negativeTestsViral":2913009,"positiveCasesViral":null,"deathConfirmed":null,"deathProbable":null,"totalTestEncountersViral":3065112,"totalTestsPeopleViral":800855,"totalTestsAntibody":null,"positiveTestsAntibody":null,"negativeTestsAntibody":null,"totalTestsPeopleAntibody":null,"positiveTestsPeopleAntibody":null,"negativeTestsPeopleAntibody":null,"totalTestsPeopleAntigen":null,"positiveTestsPeopleAntigen":null,"totalTestsAntigen":null,"positiveTestsAntigen":null,"fips":"44","positiveIncrease":442,"negativeIncrease":1586,"total":800855,"totalTestResultsIncrease":23431,"posNeg":800855,"dataQualityGrade":null,"deathIncrease":5,"hospitalizedIncrease":20,"hash":"9dcc40e6841242b569873d367bf66c24a258fb86","commercialScore":0,"negativeRegularScore":0,"negativeScore":0,"positiveScore":0,"score":0,"grade":""},{"date":20210303,"state":"RI","positive":127285,"probableCases":null,"negative":671542,"pending":null,"totalTestResultsSource":"totalTestEncountersViral","totalTestResults":3041681,"hospitalizedCurrently":147,"hospitalizedCumulative":8982,"inIcuCurrently":23,"inIcuCumulative":null,"onVentilatorCurrently":14,"onVentilatorCumulative":null,"recovered":null,"lastUpdateEt":"3/3/2021 13:00","dateModified":"2021-03-03T13:00:00Z","checkTimeEt":"03/03 08:00","death":2534,"hospitalized":8982,"hospitalizedDischarged":7823,"dateChecked":"2021-03-03T13:00:00Z","totalTestsViral":null,"positiveTestsViral":151620,"negativeTestsViral":2890061,"positiveCasesViral":null,"deathConfirmed":null,"deathProbable":null,"totalTestEncountersViral":3041681,"totalTestsPeopleViral":798827,"totalTestsAntibody":null,"positiveTestsAntibody":null,"negativeTestsAntibody":null,"totalTestsPeopleAntibody":null,"positiveTestsPeopleAntibody":null,"negativeTestsPeopleAntibody":null,"totalTestsPeopleAntigen":null,"positiveTestsPeopleAntigen":null,"totalTestsAntigen":null,"positiveTestsAntigen":null,"fips":"44","positiveIncrease":436,"negativeIncrease":1258,"total":798827,"totalTestResultsIncrease":19375,"posNeg":798827,"dataQualityGrade":null,"deathIncrease":9,"hospitalizedIncrease":16,"hash":"2454d5b38bde91cbda75fc3882f43bf5fc11c87f","commercialScore":0,"negativeRegularScore":0,"negativeScore":0,"positiveScore":0,"score":0,"grade":""},{"date":20210302,"state":"RI","positive":126849,"probableCases":null,"negative":670284,"pending":null,"totalTestResultsSource":"totalTestEncountersViral","totalTestResults":3022306,"hospitalizedCurrently":157,"hospitalizedCumulative":8966,"inIcuCurrently":25,"inIcuCumulative":null,"onVentilatorCurrently":17,"onVentilatorCumulative":null,"recovered":null,"lastUpdateEt":"3/2/2021 13:00","dateModified":"2021-03-02T13:00:00Z","checkTimeEt":"03/02 08:00","death":2525,"hospitalized":8966,"hospitalizedDischarged":7801,"dateChecked":"2021-03-02T13:00:00Z","totalTestsViral":null,"positiveTestsViral":151143,"negativeTestsViral":2871163,"positiveCasesViral":null,"deathConfirmed":null,"deathProbable":null,"totalTestEncountersViral":3022306,"totalTestsPeopleViral":797133,"totalTestsAntibody":null,"positiveTestsAntibody":null,"negativeTestsAntibody":null,"totalTestsPeopleAntibody":null,"positiveTestsPeopleAntibody":null,"negativeTestsPeopleAntibody":null,"totalTestsPeopleAntigen":null,"positiveTestsPeopleAntigen":null,"totalTestsAntigen":null,"positiveTestsAntigen":null,"fips":"44","positiveIncrease":261,"negativeIncrease":1152,"total":797133,"totalTestResultsIncrease":10995,"posNeg":797133,"dataQualityGrade":null,"deathIncrease":8,"hospitalizedIncrease":19,"hash":"b1a2a4255b709754eb8426918962483a3341c100","commercialScore":0,"negativeRegularScore":0,"negativeScore":0,"positiveScore":0,"score":0,"grade":""},{"date":20210301,"state":"RI","positive":126588,"probableCases":null,"negative":669132,"pending":null,"totalTestResultsSource":"totalTestEncountersViral","totalTestResults":3011311,"hospitalizedCurrently":162,"hospitalizedCumulative":8947,"inIcuCurrently":28,"inIcuCumulative":null,"onVentilatorCurrently":18,"onVentilatorCumulative":null,"recovered":null,"lastUpdateEt":"3/1/2021 13:00","dateModified":"2021-03-01T13:00:00Z","checkTimeEt":"03/01 08:00","death":2517,"hospitalized":8947,"hospitalizedDischarged":7780,"dateChecked":"2021-03-01T13:00:00Z","totalTestsViral":null,"positiveTestsViral":150827,"negativeTestsViral":2860484,"positiveCasesViral":null,"deathConfirmed":null,"deathProbable":null,"totalTestEncountersViral":3011311,"totalTestsPeopleViral":795720,"totalTestsAntibody":null,"positiveTestsAntibody":null,"negativeTestsAntibody":null,"totalTestsPeopleAntibody":null,"positiveTestsPeopleAntibody":null,"negativeTestsPeopleAntibody":null,"totalTestsPeopleAntigen":null,"positiveTestsPeopleAntigen":null,"totalTestsAntigen":null,"positiveTestsAntigen":null,"fips":"44","positiveIncrease":152,"negativeIncrease":690,"total":795720,"totalTestResultsIncrease":5788,"posNeg":795720,"dataQualityGrade":null,"deathIncrease":3,"hospitalizedIncrease":47,"hash":"e5a5e58ea7add7e56c606a578e184ea67b11c7ae","commercialScore":0,"negativeRegularScore":0,"negativeScore":0,"positiveScore":0,"score":0,"grade":""},{"date":20210228,"state":"RI","positive":126436,"probableCases":null,"negative":668442,"pending":null,"totalTestResultsSource":"totalTestEncountersViral","totalTestResults":3005523,"hospitalizedCurrently":168,"hospitalizedCumulative":8900,"inIcuCurrently":34,"inIcuCumulative":null,"onVentilatorCurrently":19,"onVentilatorCumulative":null,"recovered":null,"lastUpdateEt":"3/1/2021 16:42","dateModified":"2021-03-01T16:42:00Z","checkTimeEt":"03/01 11:42","death":2514,"hospitalized":8900,"hospitalizedDischarged":7731,"dateChecked":"2021-03-01T16:42:00Z","totalTestsViral":null,"positiveTestsViral":150645,"negativeTestsViral":2854878,"positiveCasesViral":null,"deathConfirmed":null,"deathProbable":null,"totalTestEncountersViral":3005523,"totalTestsPeopleViral":794878,"totalTestsAntibody":null,"positiveTestsAntibody":null,"negativeTestsAntibody":null,"totalTestsPeopleAntibody":null,"positiveTestsPeopleAntibody":null,"negativeTestsPeopleAntibody":null,"totalTestsPeopleAntigen":null,"positiveTestsPeopleAntigen":null,"totalTestsAntigen":null,"positiveTestsAntigen":null,"fips":"44","positiveIncrease":343,"negativeIncrease":1637,"total":794878,"totalTestResultsIncrease":15080,"posNeg":794878,"dataQualityGrade":null,"deathIncrease":2,"hospitalizedIncrease":0,"hash":"1404b898ceef76b3551b1932ded59d4e26994397","commercialScore":0,"negativeRegularScore":0,"negativeScore":0,"positiveScore":0,"score":0,"grade":""},{"date":20210227,"state":"RI","positive":126093,"probableCases":null,"negative":666805,"pending":null,"totalTestResultsSource":"totalTestEncountersViral","totalTestResults":2990443,"hospitalizedCurrently":168,"hospitalizedCumulative":8900,"inIcuCurrently":34,"inIcuCumulative":null,"onVentilatorCurrently":19,"onVentilatorCumulative":null,"recovered":null,"lastUpdateEt":"3/1/2021 16:42","dateModified":"2021-03-01T16:42:00Z","checkTimeEt":"03/01 11:42","death":2512,"hospitalized":8900,"hospitalizedDischarged":7731,"dateChecked":"2021-03-01T16:42:00Z","totalTestsViral":null,"positiveTestsViral":150268,"negativeTestsViral":2840175,"positiveCasesViral":null,"deathConfirmed":null,"deathProbable":null,"totalTestEncountersViral":2990443,"totalTestsPeopleViral":792898,"totalTestsAntibody":null,"positiveTestsAntibody":null,"negativeTestsAntibody":null,"totalTestsPeopleAntibody":null,"positiveTestsPeopleAntibody":null,"negativeTestsPeopleAntibody":null,"totalTestsPeopleAntigen":null,"positiveTestsPeopleAntigen":null,"totalTestsAntigen":null,"positiveTestsAntigen":null,"fips":"44","positiveIncrease":471,"negativeIncrease":1226,"total":792898,"totalTestResultsIncrease":21802,"posNeg":792898,"dataQualityGrade":null,"deathIncrease":10,"hospitalizedIncrease":0,"hash":"3be358a4960f03e9986531cfc617abd747706aaa","commercialScore":0,"negativeRegularScore":0,"negativeScore":0,"positiveScore":0,"score":0,"grade":""},{"date":20210226,"state":"RI","positive":125622,"probableCases":null,"negative":665579,"pending":null,"totalTestResultsSource":"totalTestEncountersViral","totalTestResults":2968641,"hospitalizedCurrently":168,"hospitalizedCumulative":8900,"inIcuCurrently":34,"inIcuCumulative":null,"onVentilatorCurrently":19,"onVentilatorCumulative":null,"recovered":null,"lastUpdateEt":"2/26/2021 13:00","dateModified":"2021-02-26T13:00:00Z","checkTimeEt":"02/26 08:00","death":2502,"hospitalized":8900,"hospitalizedDischarged":7731,"dateChecked":"2021-02-26T13:00:00Z","totalTestsViral":null,"positiveTestsViral":149782,"negativeTestsViral":2818859,"positiveCasesViral":null,"deathConfirmed":null,"deathProbable":null,"totalTestEncountersViral":2968641,"totalTestsPeopleViral":791201,"totalTestsAntibody":null,"positiveTestsAntibody":null,"negativeTestsAntibody":null,"totalTestsPeopleAntibody":null,"positiveTestsPeopleAntibody":null,"negativeTestsPeopleAntibody":null,"totalTestsPeopleAntigen":null,"positiveTestsPeopleAntigen":null,"totalTestsAntigen":null,"positiveTestsAntigen":null,"fips":"44","positiveIncrease":437,"negativeIncrease":1632,"total":791201,"totalTestResultsIncrease":21945,"posNeg":791201,"dataQualityGrade":null,"deathIncrease":6,"hospitalizedIncrease":25,"hash":"7c994a1c2bb2930e8c0faf3fde49ca3c348f98d5","commercialScore":0,"negativeRegularScore":0,"negativeScore":0,"positiveScore":0,"score":0,"grade":""},{"date":20210225,"state":"RI","positive":125185,"probableCases":null,"negative":663947,"pending":null,"totalTestResultsSource":"totalTestEncountersViral","totalTestResults":2946696,"hospitalizedCurrently":163,"hospitalizedCumulative":8875,"inIcuCurrently":34,"inIcuCumulative":null,"onVentilatorCurrently":17,"onVentilatorCumulative":null,"recovered":null,"lastUpdateEt":"2/25/2021 13:00","dateModified":"2021-02-25T13:00:00Z","checkTimeEt":"02/25 08:00","death":2496,"hospitalized":8875,"hospitalizedDischarged":7713,"dateChecked":"2021-02-25T13:00:00Z","totalTestsViral":null,"positiveTestsViral":149262,"negativeTestsViral":2797434,"positiveCasesViral":null,"deathConfirmed":null,"deathProbable":null,"totalTestEncountersViral":2946696,"totalTestsPeopleViral":789132,"totalTestsAntibody":null,"positiveTestsAntibody":null,"negativeTestsAntibody":null,"totalTestsPeopleAntibody":null,"positiveTestsPeopleAntibody":null,"negativeTestsPeopleAntibody":null,"totalTestsPeopleAntigen":null,"positiveTestsPeopleAntigen":null,"totalTestsAntigen":null,"positiveTestsAntigen":null,"fips":"44","positiveIncrease":467,"negativeIncrease":1811,"total":789132,"totalTestResultsIncrease":24685,"posNeg":789132,"dataQualityGrade":null,"deathIncrease":9,"hospitalizedIncrease":25,"hash":"a4896ca81e146e7b46b1560a89194d8c475511d4","commercialScore":0,"negativeRegularScore":0,"negativeScore":0,"positiveScore":0,"score":0,"grade":""},{"date":20210224,"state":"RI","positive":124718,"probableCases":null,"negative":662136,"pending":null,"totalTestResultsSource":"totalTestEncountersViral","totalTestResults":2922011,"hospitalizedCurrently":168,"hospitalizedCumulative":8850,"inIcuCurrently":32,"inIcuCumulative":null,"onVentilatorCurrently":16,"onVentilatorCumulative":null,"recovered":null,"lastUpdateEt":"2/24/2021 13:00","dateModified":"2021-02-24T13:00:00Z","checkTimeEt":"02/24 08:00","death":2487,"hospitalized":8850,"hospitalizedDischarged":7685,"dateChecked":"2021-02-24T13:00:00Z","totalTestsViral":null,"positiveTestsViral":148754,"negativeTestsViral":2773257,"positiveCasesViral":null,"deathConfirmed":null,"deathProbable":null,"totalTestEncountersViral":2922011,"totalTestsPeopleViral":786854,"totalTestsAntibody":null,"positiveTestsAntibody":null,"negativeTestsAntibody":null,"totalTestsPeopleAntibody":null,"positiveTestsPeopleAntibody":null,"negativeTestsPeopleAntibody":null,"totalTestsPeopleAntigen":null,"positiveTestsPeopleAntigen":null,"totalTestsAntigen":null,"positiveTestsAntigen":null,"fips":"44","positiveIncrease":456,"negativeIncrease":1600,"total":786854,"totalTestResultsIncrease":19189,"posNeg":786854,"dataQualityGrade":null,"deathIncrease":11,"hospitalizedIncrease":15,"hash":"94c6c803fb3f3a8f93d8778c4cce07643d7b3d3d","commercialScore":0,"negativeRegularScore":0,"negativeScore":0,"positiveScore":0,"score":0,"grade":""},{"date":20210223,"state":"RI","positive":124262,"probableCases":null,"negative":660536,"pending":null,"totalTestResultsSource":"totalTestEncountersViral","totalTestResults":2902822,"hospitalizedCurrently":170,"hospitalizedCumulative":8835,"inIcuCurrently":32,"inIcuCumulative":null,"onVentilatorCurrently":19,"onVentilatorCumulative":null,"recovered":null,"lastUpdateEt":"2/23/2021 13:00","dateModified":"2021-02-23T13:00:00Z","checkTimeEt":"02/23 08:00","death":2476,"hospitalized":8835,"hospitalizedDischarged":7668,"dateChecked":"2021-02-23T13:00:00Z","totalTestsViral":null,"positiveTestsViral":148283,"negativeTestsViral":2754539,"positiveCasesViral":null,"deathConfirmed":null,"deathProbable":null,"totalTestEncountersViral":2902822,"totalTestsPeopleViral":784798,"totalTestsAntibody":null,"positiveTestsAntibody":null,"negativeTestsAntibody":null,"totalTestsPeopleAntibody":null,"positiveTestsPeopleAntibody":null,"negativeTestsPeopleAntibody":null,"totalTestsPeopleAntigen":null,"positiveTestsPeopleAntigen":null,"totalTestsAntigen":null,"positiveTestsAntigen":null,"fips":"44","positiveIncrease":282,"negativeIncrease":1470,"total":784798,"totalTestResultsIncrease":11383,"posNeg":784798,"dataQualityGrade":null,"deathIncrease":10,"hospitalizedIncrease":20,"hash":"1c0f8663c4d9da98cdb512406c24aa79950b6468","commercialScore":0,"negativeRegularScore":0,"negativeScore":0,"positiveScore":0,"score":0,"grade":""},{"date":20210222,"state":"RI","positive":123980,"probableCases":null,"negative":659066,"pending":null,"totalTestResultsSource":"totalTestEncountersViral","totalTestResults":2891439,"hospitalizedCurrently":186,"hospitalizedCumulative":8815,"inIcuCurrently":27,"inIcuCumulative":null,"onVentilatorCurrently":18,"onVentilatorCumulative":null,"recovered":null,"lastUpdateEt":"2/22/2021 13:00","dateModified":"2021-02-22T13:00:00Z","checkTimeEt":"02/22 08:00","death":2466,"hospitalized":8815,"hospitalizedDischarged":7648,"dateChecked":"2021-02-22T13:00:00Z","totalTestsViral":null,"positiveTestsViral":147884,"negativeTestsViral":2743555,"positiveCasesViral":null,"deathConfirmed":null,"deathProbable":null,"totalTestEncountersViral":2891439,"totalTestsPeopleViral":783046,"totalTestsAntibody":null,"positiveTestsAntibody":null,"negativeTestsAntibody":null,"totalTestsPeopleAntibody":null,"positiveTestsPeopleAntibody":null,"negativeTestsPeopleAntibody":null,"totalTestsPeopleAntigen":null,"positiveTestsPeopleAntigen":null,"totalTestsAntigen":null,"positiveTestsAntigen":null,"fips":"44","positiveIncrease":159,"negativeIncrease":787,"total":783046,"totalTestResultsIncrease":6094,"posNeg":783046,"dataQualityGrade":null,"deathIncrease":3,"hospitalizedIncrease":-55,"hash":"6aacf72bf158309ed9b47531d44fbfdfb50744c0","commercialScore":0,"negativeRegularScore":0,"negativeScore":0,"positiveScore":0,"score":0,"grade":""},{"date":20210221,"state":"RI","positive":123821,"probableCases":null,"negative":658279,"pending":null,"totalTestResultsSource":"totalTestEncountersViral","totalTestResults":2885345,"hospitalizedCurrently":177,"hospitalizedCumulative":8870,"inIcuCurrently":29,"inIcuCumulative":null,"onVentilatorCurrently":18,"onVentilatorCumulative":null,"recovered":null,"lastUpdateEt":"2/22/2021 16:42","dateModified":"2021-02-22T16:42:00Z","checkTimeEt":"02/22 11:42","death":2463,"hospitalized":8870,"hospitalizedDischarged":7705,"dateChecked":"2021-02-22T16:42:00Z","totalTestsViral":null,"positiveTestsViral":147691,"negativeTestsViral":2737654,"positiveCasesViral":null,"deathConfirmed":null,"deathProbable":null,"totalTestEncountersViral":2885345,"totalTestsPeopleViral":782100,"totalTestsAntibody":null,"positiveTestsAntibody":null,"negativeTestsAntibody":null,"totalTestsPeopleAntibody":null,"positiveTestsPeopleAntibody":null,"negativeTestsPeopleAntibody":null,"totalTestsPeopleAntigen":null,"positiveTestsPeopleAntigen":null,"totalTestsAntigen":null,"positiveTestsAntigen":null,"fips":"44","positiveIncrease":273,"negativeIncrease":1336,"total":782100,"totalTestResultsIncrease":10911,"posNeg":782100,"dataQualityGrade":null,"deathIncrease":1,"hospitalizedIncrease":0,"hash":"041f5c2c3781342162d1bb63c51089b0893343dc","commercialScore":0,"negativeRegularScore":0,"negativeScore":0,"positiveScore":0,"score":0,"grade":""},{"date":20210220,"state":"RI","positive":123548,"probableCases":null,"negative":656943,"pending":null,"totalTestResultsSource":"totalTestEncountersViral","totalTestResults":2874434,"hospitalizedCurrently":177,"hospitalizedCumulative":8870,"inIcuCurrently":29,"inIcuCumulative":null,"onVentilatorCurrently":18,"onVentilatorCumulative":null,"recovered":null,"lastUpdateEt":"2/22/2021 16:42","dateModified":"2021-02-22T16:42:00Z","checkTimeEt":"02/22 11:42","death":2462,"hospitalized":8870,"hospitalizedDischarged":7705,"dateChecked":"2021-02-22T16:42:00Z","totalTestsViral":null,"positiveTestsViral":147351,"negativeTestsViral":2727083,"positiveCasesViral":null,"deathConfirmed":null,"deathProbable":null,"totalTestEncountersViral":2874434,"totalTestsPeopleViral":780491,"totalTestsAntibody":null,"positiveTestsAntibody":null,"negativeTestsAntibody":null,"totalTestsPeopleAntibody":null,"positiveTestsPeopleAntibody":null,"negativeTestsPeopleAntibody":null,"totalTestsPeopleAntigen":null,"positiveTestsPeopleAntigen":null,"totalTestsAntigen":null,"positiveTestsAntigen":null,"fips":"44","positiveIncrease":403,"negativeIncrease":1249,"total":780491,"totalTestResultsIncrease":20650,"posNeg":780491,"dataQualityGrade":null,"deathIncrease":86,"hospitalizedIncrease":0,"hash":"e5797e73d2f77124b6c89ae1ace459a436534d21","commercialScore":0,"negativeRegularScore":0,"negativeScore":0,"positiveScore":0,"score":0,"grade":""},{"date":20210219,"state":"RI","positive":123145,"probableCases":null,"negative":655694,"pending":null,"totalTestResultsSource":"totalTestEncountersViral","totalTestResults":2853784,"hospitalizedCurrently":177,"hospitalizedCumulative":8870,"inIcuCurrently":29,"inIcuCumulative":null,"onVentilatorCurrently":18,"onVentilatorCumulative":null,"recovered":null,"lastUpdateEt":"2/19/2021 13:00","dateModified":"2021-02-19T13:00:00Z","checkTimeEt":"02/19 08:00","death":2376,"hospitalized":8870,"hospitalizedDischarged":7705,"dateChecked":"2021-02-19T13:00:00Z","totalTestsViral":null,"positiveTestsViral":146886,"negativeTestsViral":2706898,"positiveCasesViral":null,"deathConfirmed":null,"deathProbable":null,"totalTestEncountersViral":2853784,"totalTestsPeopleViral":778839,"totalTestsAntibody":null,"positiveTestsAntibody":null,"negativeTestsAntibody":null,"totalTestsPeopleAntibody":null,"positiveTestsPeopleAntibody":null,"negativeTestsPeopleAntibody":null,"totalTestsPeopleAntigen":null,"positiveTestsPeopleAntigen":null,"totalTestsAntigen":null,"positiveTestsAntigen":null,"fips":"44","positiveIncrease":286,"negativeIncrease":1386,"total":778839,"totalTestResultsIncrease":21423,"posNeg":778839,"dataQualityGrade":null,"deathIncrease":9,"hospitalizedIncrease":24,"hash":"84cba21786e3de6f5f02edaefcd3e5a41c847d31","commercialScore":0,"negativeRegularScore":0,"negativeScore":0,"positiveScore":0,"score":0,"grade":""},{"date":20210218,"state":"RI","positive":122859,"probableCases":null,"negative":654308,"pending":null,"totalTestResultsSource":"totalTestEncountersViral","totalTestResults":2832361,"hospitalizedCurrently":180,"hospitalizedCumulative":8846,"inIcuCurrently":32,"inIcuCumulative":null,"onVentilatorCurrently":18,"onVentilatorCumulative":null,"recovered":null,"lastUpdateEt":"2/18/2021 13:00","dateModified":"2021-02-18T13:00:00Z","checkTimeEt":"02/18 08:00","death":2367,"hospitalized":8846,"hospitalizedDischarged":7679,"dateChecked":"2021-02-18T13:00:00Z","totalTestsViral":null,"positiveTestsViral":146502,"negativeTestsViral":2685859,"positiveCasesViral":null,"deathConfirmed":null,"deathProbable":null,"totalTestEncountersViral":2832361,"totalTestsPeopleViral":777167,"totalTestsAntibody":null,"positiveTestsAntibody":null,"negativeTestsAntibody":null,"totalTestsPeopleAntibody":null,"positiveTestsPeopleAntibody":null,"negativeTestsPeopleAntibody":null,"totalTestsPeopleAntigen":null,"positiveTestsPeopleAntigen":null,"totalTestsAntigen":null,"positiveTestsAntigen":null,"fips":"44","positiveIncrease":419,"negativeIncrease":1508,"total":777167,"totalTestResultsIncrease":22035,"posNeg":777167,"dataQualityGrade":null,"deathIncrease":15,"hospitalizedIncrease":35,"hash":"9feca594c835dba9b94fad4a39f005898e4e27d0","commercialScore":0,"negativeRegularScore":0,"negativeScore":0,"positiveScore":0,"score":0,"grade":""},{"date":20210217,"state":"RI","positive":122440,"probableCases":null,"negative":652800,"pending":null,"totalTestResultsSource":"totalTestEncountersViral","totalTestResults":2810326,"hospitalizedCurrently":193,"hospitalizedCumulative":8811,"inIcuCurrently":30,"inIcuCumulative":null,"onVentilatorCurrently":19,"onVentilatorCumulative":null,"recovered":null,"lastUpdateEt":"2/17/2021 13:00","dateModified":"2021-02-17T13:00:00Z","checkTimeEt":"02/17 08:00","death":2352,"hospitalized":8811,"hospitalizedDischarged":7633,"dateChecked":"2021-02-17T13:00:00Z","totalTestsViral":null,"positiveTestsViral":146052,"negativeTestsViral":2664274,"positiveCasesViral":null,"deathConfirmed":null,"deathProbable":null,"totalTestEncountersViral":2810326,"totalTestsPeopleViral":775240,"totalTestsAntibody":null,"positiveTestsAntibody":null,"negativeTestsAntibody":null,"totalTestsPeopleAntibody":null,"positiveTestsPeopleAntibody":null,"negativeTestsPeopleAntibody":null,"totalTestsPeopleAntigen":null,"positiveTestsPeopleAntigen":null,"totalTestsAntigen":null,"positiveTestsAntigen":null,"fips":"44","positiveIncrease":368,"negativeIncrease":1773,"total":775240,"totalTestResultsIncrease":19330,"posNeg":775240,"dataQualityGrade":null,"deathIncrease":8,"hospitalizedIncrease":25,"hash":"452c747c696ca98f9c0f6bcb0284f095c6d50c14","commercialScore":0,"negativeRegularScore":0,"negativeScore":0,"positiveScore":0,"score":0,"grade":""},{"date":20210216,"state":"RI","positive":122072,"probableCases":null,"negative":651027,"pending":null,"totalTestResultsSource":"totalTestEncountersViral","totalTestResults":2790996,"hospitalizedCurrently":197,"hospitalizedCumulative":8786,"inIcuCurrently":36,"inIcuCumulative":null,"onVentilatorCurrently":20,"onVentilatorCumulative":null,"recovered":null,"lastUpdateEt":"2/16/2021 13:00","dateModified":"2021-02-16T13:00:00Z","checkTimeEt":"02/16 08:00","death":2344,"hospitalized":8786,"hospitalizedDischarged":7607,"dateChecked":"2021-02-16T13:00:00Z","totalTestsViral":null,"positiveTestsViral":145600,"negativeTestsViral":2645396,"positiveCasesViral":null,"deathConfirmed":null,"deathProbable":null,"totalTestEncountersViral":2790996,"totalTestsPeopleViral":773099,"totalTestsAntibody":null,"positiveTestsAntibody":null,"negativeTestsAntibody":null,"totalTestsPeopleAntibody":null,"positiveTestsPeopleAntibody":null,"negativeTestsPeopleAntibody":null,"totalTestsPeopleAntigen":null,"positiveTestsPeopleAntigen":null,"totalTestsAntigen":null,"positiveTestsAntigen":null,"fips":"44","positiveIncrease":285,"negativeIncrease":1107,"total":773099,"totalTestResultsIncrease":10557,"posNeg":773099,"dataQualityGrade":null,"deathIncrease":10,"hospitalizedIncrease":32,"hash":"cf0d170590269ab76020ab24cc30ab665512c043","commercialScore":0,"negativeRegularScore":0,"negativeScore":0,"positiveScore":0,"score":0,"grade":""},{"date":20210215,"state":"RI","positive":121787,"probableCases":null,"negative":649920,"pending":null,"totalTestResultsSource":"totalTestEncountersViral","totalTestResults":2780439,"hospitalizedCurrently":181,"hospitalizedCumulative":8754,"inIcuCurrently":35,"inIcuCumulative":null,"onVentilatorCurrently":16,"onVentilatorCumulative":null,"recovered":null,"lastUpdateEt":"2/15/2021 13:00","dateModified":"2021-02-15T13:00:00Z","checkTimeEt":"02/15 08:00","death":2334,"hospitalized":8754,"hospitalizedDischarged":7591,"dateChecked":"2021-02-15T13:00:00Z","totalTestsViral":null,"positiveTestsViral":145248,"negativeTestsViral":2635191,"positiveCasesViral":null,"deathConfirmed":null,"deathProbable":null,"totalTestEncountersViral":2780439,"totalTestsPeopleViral":771707,"totalTestsAntibody":null,"positiveTestsAntibody":null,"negativeTestsAntibody":null,"totalTestsPeopleAntibody":null,"positiveTestsPeopleAntibody":null,"negativeTestsPeopleAntibody":null,"totalTestsPeopleAntigen":null,"positiveTestsPeopleAntigen":null,"totalTestsAntigen":null,"positiveTestsAntigen":null,"fips":"44","positiveIncrease":203,"negativeIncrease":780,"total":771707,"totalTestResultsIncrease":5975,"posNeg":771707,"dataQualityGrade":null,"deathIncrease":2,"hospitalizedIncrease":65,"hash":"1c2155aa7a19c3e97df81db5a44fc90f42981bbb","commercialScore":0,"negativeRegularScore":0,"negativeScore":0,"positiveScore":0,"score":0,"grade":""},{"date":20210214,"state":"RI","positive":121584,"probableCases":null,"negative":649140,"pending":null,"totalTestResultsSource":"totalTestEncountersViral","totalTestResults":2774464,"hospitalizedCurrently":222,"hospitalizedCumulative":8689,"inIcuCurrently":39,"inIcuCumulative":null,"onVentilatorCurrently":20,"onVentilatorCumulative":null,"recovered":null,"lastUpdateEt":"2/15/2021 16:42","dateModified":"2021-02-15T16:42:00Z","checkTimeEt":"02/15 11:42","death":2332,"hospitalized":8689,"hospitalizedDischarged":7496,"dateChecked":"2021-02-15T16:42:00Z","totalTestsViral":null,"positiveTestsViral":145010,"negativeTestsViral":2629454,"positiveCasesViral":null,"deathConfirmed":null,"deathProbable":null,"totalTestEncountersViral":2774464,"totalTestsPeopleViral":770724,"totalTestsAntibody":null,"positiveTestsAntibody":null,"negativeTestsAntibody":null,"totalTestsPeopleAntibody":null,"positiveTestsPeopleAntibody":null,"negativeTestsPeopleAntibody":null,"totalTestsPeopleAntigen":null,"positiveTestsPeopleAntigen":null,"totalTestsAntigen":null,"positiveTestsAntigen":null,"fips":"44","positiveIncrease":320,"negativeIncrease":1525,"total":770724,"totalTestResultsIncrease":14090,"posNeg":770724,"dataQualityGrade":null,"deathIncrease":3,"hospitalizedIncrease":0,"hash":"e821022b320337aba5156f3de1498639d28b0af1","commercialScore":0,"negativeRegularScore":0,"negativeScore":0,"positiveScore":0,"score":0,"grade":""},{"date":20210213,"state":"RI","positive":121264,"probableCases":null,"negative":647615,"pending":null,"totalTestResultsSource":"totalTestEncountersViral","totalTestResults":2760374,"hospitalizedCurrently":222,"hospitalizedCumulative":8689,"inIcuCurrently":39,"inIcuCumulative":null,"onVentilatorCurrently":20,"onVentilatorCumulative":null,"recovered":null,"lastUpdateEt":"2/15/2021 16:42","dateModified":"2021-02-15T16:42:00Z","checkTimeEt":"02/15 11:42","death":2329,"hospitalized":8689,"hospitalizedDischarged":7496,"dateChecked":"2021-02-15T16:42:00Z","totalTestsViral":null,"positiveTestsViral":144637,"negativeTestsViral":2615737,"positiveCasesViral":null,"deathConfirmed":null,"deathProbable":null,"totalTestEncountersViral":2760374,"totalTestsPeopleViral":768879,"totalTestsAntibody":null,"positiveTestsAntibody":null,"negativeTestsAntibody":null,"totalTestsPeopleAntibody":null,"positiveTestsPeopleAntibody":null,"negativeTestsPeopleAntibody":null,"totalTestsPeopleAntigen":null,"positiveTestsPeopleAntigen":null,"totalTestsAntigen":null,"positiveTestsAntigen":null,"fips":"44","positiveIncrease":443,"negativeIncrease":1448,"total":768879,"totalTestResultsIncrease":23401,"posNeg":768879,"dataQualityGrade":null,"deathIncrease":39,"hospitalizedIncrease":0,"hash":"278262ba689a24fc24a4e41ed489f0ae6b1292d5","commercialScore":0,"negativeRegularScore":0,"negativeScore":0,"positiveScore":0,"score":0,"grade":""},{"date":20210212,"state":"RI","positive":120821,"probableCases":null,"negative":646167,"pending":null,"totalTestResultsSource":"totalTestEncountersViral","totalTestResults":2736973,"hospitalizedCurrently":222,"hospitalizedCumulative":8689,"inIcuCurrently":39,"inIcuCumulative":null,"onVentilatorCurrently":20,"onVentilatorCumulative":null,"recovered":null,"lastUpdateEt":"2/12/2021 13:00","dateModified":"2021-02-12T13:00:00Z","checkTimeEt":"02/12 08:00","death":2290,"hospitalized":8689,"hospitalizedDischarged":7496,"dateChecked":"2021-02-12T13:00:00Z","totalTestsViral":null,"positiveTestsViral":144182,"negativeTestsViral":2592791,"positiveCasesViral":null,"deathConfirmed":null,"deathProbable":null,"totalTestEncountersViral":2736973,"totalTestsPeopleViral":766988,"totalTestsAntibody":null,"positiveTestsAntibody":null,"negativeTestsAntibody":null,"totalTestsPeopleAntibody":null,"positiveTestsPeopleAntibody":null,"negativeTestsPeopleAntibody":null,"totalTestsPeopleAntigen":null,"positiveTestsPeopleAntigen":null,"totalTestsAntigen":null,"positiveTestsAntigen":null,"fips":"44","positiveIncrease":440,"negativeIncrease":1860,"total":766988,"totalTestResultsIncrease":22782,"posNeg":766988,"dataQualityGrade":null,"deathIncrease":16,"hospitalizedIncrease":32,"hash":"5a5097a953df13fe1623a33dff68b8cf98f7948b","commercialScore":0,"negativeRegularScore":0,"negativeScore":0,"positiveScore":0,"score":0,"grade":""},{"date":20210211,"state":"RI","positive":120381,"probableCases":null,"negative":644307,"pending":null,"totalTestResultsSource":"totalTestEncountersViral","totalTestResults":2714191,"hospitalizedCurrently":238,"hospitalizedCumulative":8657,"inIcuCurrently":45,"inIcuCumulative":null,"onVentilatorCurrently":22,"onVentilatorCumulative":null,"recovered":null,"lastUpdateEt":"2/11/2021 13:00","dateModified":"2021-02-11T13:00:00Z","checkTimeEt":"02/11 08:00","death":2274,"hospitalized":8657,"hospitalizedDischarged":7453,"dateChecked":"2021-02-11T13:00:00Z","totalTestsViral":null,"positiveTestsViral":143674,"negativeTestsViral":2570517,"positiveCasesViral":null,"deathConfirmed":null,"deathProbable":null,"totalTestEncountersViral":2714191,"totalTestsPeopleViral":764688,"totalTestsAntibody":null,"positiveTestsAntibody":null,"negativeTestsAntibody":null,"totalTestsPeopleAntibody":null,"positiveTestsPeopleAntibody":null,"negativeTestsPeopleAntibody":null,"totalTestsPeopleAntigen":null,"positiveTestsPeopleAntigen":null,"totalTestsAntigen":null,"positiveTestsAntigen":null,"fips":"44","positiveIncrease":488,"negativeIncrease":1795,"total":764688,"totalTestResultsIncrease":23169,"posNeg":764688,"dataQualityGrade":null,"deathIncrease":15,"hospitalizedIncrease":42,"hash":"403f68545cfadb6ac9e7ef8d7715337ef6ffad31","commercialScore":0,"negativeRegularScore":0,"negativeScore":0,"positiveScore":0,"score":0,"grade":""},{"date":20210210,"state":"RI","positive":119893,"probableCases":null,"negative":642512,"pending":null,"totalTestResultsSource":"totalTestEncountersViral","totalTestResults":2691022,"hospitalizedCurrently":238,"hospitalizedCumulative":8615,"inIcuCurrently":42,"inIcuCumulative":null,"onVentilatorCurrently":22,"onVentilatorCumulative":null,"recovered":null,"lastUpdateEt":"2/10/2021 13:00","dateModified":"2021-02-10T13:00:00Z","checkTimeEt":"02/10 08:00","death":2259,"hospitalized":8615,"hospitalizedDischarged":7416,"dateChecked":"2021-02-10T13:00:00Z","totalTestsViral":null,"positiveTestsViral":143111,"negativeTestsViral":2547911,"positiveCasesViral":null,"deathConfirmed":null,"deathProbable":null,"totalTestEncountersViral":2691022,"totalTestsPeopleViral":762405,"totalTestsAntibody":null,"positiveTestsAntibody":null,"negativeTestsAntibody":null,"totalTestsPeopleAntibody":null,"positiveTestsPeopleAntibody":null,"negativeTestsPeopleAntibody":null,"totalTestsPeopleAntigen":null,"positiveTestsPeopleAntigen":null,"totalTestsAntigen":null,"positiveTestsAntigen":null,"fips":"44","positiveIncrease":459,"negativeIncrease":1384,"total":762405,"totalTestResultsIncrease":17674,"posNeg":762405,"dataQualityGrade":null,"deathIncrease":11,"hospitalizedIncrease":28,"hash":"0219653e1118a7f1363fec81187241854f23293e","commercialScore":0,"negativeRegularScore":0,"negativeScore":0,"positiveScore":0,"score":0,"grade":""},{"date":20210209,"state":"RI","positive":119434,"probableCases":null,"negative":641128,"pending":null,"totalTestResultsSource":"totalTestEncountersViral","totalTestResults":2673348,"hospitalizedCurrently":242,"hospitalizedCumulative":8587,"inIcuCurrently":44,"inIcuCumulative":null,"onVentilatorCurrently":20,"onVentilatorCumulative":null,"recovered":null,"lastUpdateEt":"2/9/2021 13:00","dateModified":"2021-02-09T13:00:00Z","checkTimeEt":"02/09 08:00","death":2248,"hospitalized":8587,"hospitalizedDischarged":7385,"dateChecked":"2021-02-09T13:00:00Z","totalTestsViral":null,"positiveTestsViral":142593,"negativeTestsViral":2530755,"positiveCasesViral":null,"deathConfirmed":null,"deathProbable":null,"totalTestEncountersViral":2673348,"totalTestsPeopleViral":760562,"totalTestsAntibody":null,"positiveTestsAntibody":null,"negativeTestsAntibody":null,"totalTestsPeopleAntibody":null,"positiveTestsPeopleAntibody":null,"negativeTestsPeopleAntibody":null,"totalTestsPeopleAntigen":null,"positiveTestsPeopleAntigen":null,"totalTestsAntigen":null,"positiveTestsAntigen":null,"fips":"44","positiveIncrease":330,"negativeIncrease":-33962,"total":760562,"totalTestResultsIncrease":5498,"posNeg":760562,"dataQualityGrade":null,"deathIncrease":12,"hospitalizedIncrease":38,"hash":"e0be657d9970557fd4b21ad4de9daa11f6b3d003","commercialScore":0,"negativeRegularScore":0,"negativeScore":0,"positiveScore":0,"score":0,"grade":""},{"date":20210208,"state":"RI","positive":119104,"probableCases":null,"negative":675090,"pending":null,"totalTestResultsSource":"totalTestEncountersViral","totalTestResults":2667850,"hospitalizedCurrently":241,"hospitalizedCumulative":8549,"inIcuCurrently":42,"inIcuCumulative":null,"onVentilatorCurrently":20,"onVentilatorCumulative":null,"recovered":null,"lastUpdateEt":"2/8/2021 13:00","dateModified":"2021-02-08T13:00:00Z","checkTimeEt":"02/08 08:00","death":2236,"hospitalized":8549,"hospitalizedDischarged":7354,"dateChecked":"2021-02-08T13:00:00Z","totalTestsViral":null,"positiveTestsViral":142319,"negativeTestsViral":2525531,"positiveCasesViral":null,"deathConfirmed":null,"deathProbable":null,"totalTestEncountersViral":2667850,"totalTestsPeopleViral":794194,"totalTestsAntibody":null,"positiveTestsAntibody":null,"negativeTestsAntibody":null,"totalTestsPeopleAntibody":null,"positiveTestsPeopleAntibody":null,"negativeTestsPeopleAntibody":null,"totalTestsPeopleAntigen":null,"positiveTestsPeopleAntigen":null,"totalTestsAntigen":null,"positiveTestsAntigen":null,"fips":"44","positiveIncrease":211,"negativeIncrease":3437,"total":794194,"totalTestResultsIncrease":5088,"posNeg":794194,"dataQualityGrade":null,"deathIncrease":8,"hospitalizedIncrease":81,"hash":"2bbb3d39e50ebeea2c65a784015071f6196c439f","commercialScore":0,"negativeRegularScore":0,"negativeScore":0,"positiveScore":0,"score":0,"grade":""},{"date":20210207,"state":"RI","positive":118893,"probableCases":null,"negative":671653,"pending":null,"totalTestResultsSource":"totalTestEncountersViral","totalTestResults":2662762,"hospitalizedCurrently":288,"hospitalizedCumulative":8468,"inIcuCurrently":41,"inIcuCumulative":null,"onVentilatorCurrently":20,"onVentilatorCumulative":null,"recovered":null,"lastUpdateEt":"2/8/2021 16:42","dateModified":"2021-02-08T16:42:00Z","checkTimeEt":"02/08 11:42","death":2228,"hospitalized":8468,"hospitalizedDischarged":7233,"dateChecked":"2021-02-08T16:42:00Z","totalTestsViral":null,"positiveTestsViral":142088,"negativeTestsViral":2520674,"positiveCasesViral":null,"deathConfirmed":null,"deathProbable":null,"totalTestEncountersViral":2662762,"totalTestsPeopleViral":790546,"totalTestsAntibody":null,"positiveTestsAntibody":null,"negativeTestsAntibody":null,"totalTestsPeopleAntibody":null,"positiveTestsPeopleAntibody":null,"negativeTestsPeopleAntibody":null,"totalTestsPeopleAntigen":null,"positiveTestsPeopleAntigen":null,"totalTestsAntigen":null,"positiveTestsAntigen":null,"fips":"44","positiveIncrease":372,"negativeIncrease":11005,"total":790546,"totalTestResultsIncrease":17710,"posNeg":790546,"dataQualityGrade":null,"deathIncrease":5,"hospitalizedIncrease":0,"hash":"19751b22bf479293d4c00cec675bf5b56909e69c","commercialScore":0,"negativeRegularScore":0,"negativeScore":0,"positiveScore":0,"score":0,"grade":""},{"date":20210206,"state":"RI","positive":118521,"probableCases":null,"negative":660648,"pending":null,"totalTestResultsSource":"totalTestEncountersViral","totalTestResults":2645052,"hospitalizedCurrently":288,"hospitalizedCumulative":8468,"inIcuCurrently":41,"inIcuCumulative":null,"onVentilatorCurrently":20,"onVentilatorCumulative":null,"recovered":null,"lastUpdateEt":"2/8/2021 16:42","dateModified":"2021-02-08T16:42:00Z","checkTimeEt":"02/08 11:42","death":2223,"hospitalized":8468,"hospitalizedDischarged":7233,"dateChecked":"2021-02-08T16:42:00Z","totalTestsViral":null,"positiveTestsViral":141671,"negativeTestsViral":2503381,"positiveCasesViral":null,"deathConfirmed":null,"deathProbable":null,"totalTestEncountersViral":2645052,"totalTestsPeopleViral":779169,"totalTestsAntibody":null,"positiveTestsAntibody":null,"negativeTestsAntibody":null,"totalTestsPeopleAntibody":null,"positiveTestsPeopleAntibody":null,"negativeTestsPeopleAntibody":null,"totalTestsPeopleAntigen":null,"positiveTestsPeopleAntigen":null,"totalTestsAntigen":null,"positiveTestsAntigen":null,"fips":"44","positiveIncrease":630,"negativeIncrease":25801,"total":779169,"totalTestResultsIncrease":33795,"posNeg":779169,"dataQualityGrade":null,"deathIncrease":11,"hospitalizedIncrease":0,"hash":"52bde3c4fdf50ceab15fe8a520af912d62b8aa70","commercialScore":0,"negativeRegularScore":0,"negativeScore":0,"positiveScore":0,"score":0,"grade":""},{"date":20210205,"state":"RI","positive":117891,"probableCases":null,"negative":634847,"pending":null,"totalTestResultsSource":"totalTestEncountersViral","totalTestResults":2611257,"hospitalizedCurrently":288,"hospitalizedCumulative":8468,"inIcuCurrently":41,"inIcuCumulative":null,"onVentilatorCurrently":20,"onVentilatorCumulative":null,"recovered":null,"lastUpdateEt":"2/5/2021 13:00","dateModified":"2021-02-05T13:00:00Z","checkTimeEt":"02/05 08:00","death":2212,"hospitalized":8468,"hospitalizedDischarged":7233,"dateChecked":"2021-02-05T13:00:00Z","totalTestsViral":null,"positiveTestsViral":140457,"negativeTestsViral":2470800,"positiveCasesViral":null,"deathConfirmed":null,"deathProbable":null,"totalTestEncountersViral":2611257,"totalTestsPeopleViral":752738,"totalTestsAntibody":null,"positiveTestsAntibody":null,"negativeTestsAntibody":null,"totalTestsPeopleAntibody":null,"positiveTestsPeopleAntibody":null,"negativeTestsPeopleAntibody":null,"totalTestsPeopleAntigen":null,"positiveTestsPeopleAntigen":null,"totalTestsAntigen":null,"positiveTestsAntigen":null,"fips":"44","positiveIncrease":600,"negativeIncrease":1897,"total":752738,"totalTestResultsIncrease":22174,"posNeg":752738,"dataQualityGrade":null,"deathIncrease":3,"hospitalizedIncrease":56,"hash":"19f14d53d8ab509400d7b19c4b336c196db3030e","commercialScore":0,"negativeRegularScore":0,"negativeScore":0,"positiveScore":0,"score":0,"grade":""},{"date":20210204,"state":"RI","positive":117291,"probableCases":null,"negative":632950,"pending":null,"totalTestResultsSource":"totalTestEncountersViral","totalTestResults":2589083,"hospitalizedCurrently":290,"hospitalizedCumulative":8412,"inIcuCurrently":43,"inIcuCumulative":null,"onVentilatorCurrently":23,"onVentilatorCumulative":null,"recovered":null,"lastUpdateEt":"2/4/2021 13:00","dateModified":"2021-02-04T13:00:00Z","checkTimeEt":"02/04 08:00","death":2209,"hospitalized":8412,"hospitalizedDischarged":7182,"dateChecked":"2021-02-04T13:00:00Z","totalTestsViral":null,"positiveTestsViral":139763,"negativeTestsViral":2449320,"positiveCasesViral":null,"deathConfirmed":null,"deathProbable":null,"totalTestEncountersViral":2589083,"totalTestsPeopleViral":750241,"totalTestsAntibody":null,"positiveTestsAntibody":null,"negativeTestsAntibody":null,"totalTestsPeopleAntibody":null,"positiveTestsPeopleAntibody":null,"negativeTestsPeopleAntibody":null,"totalTestsPeopleAntigen":null,"positiveTestsPeopleAntigen":null,"totalTestsAntigen":null,"positiveTestsAntigen":null,"fips":"44","positiveIncrease":587,"negativeIncrease":1850,"total":750241,"totalTestResultsIncrease":20760,"posNeg":750241,"dataQualityGrade":null,"deathIncrease":11,"hospitalizedIncrease":43,"hash":"0981579375af07eb04188aac5212f075a8228993","commercialScore":0,"negativeRegularScore":0,"negativeScore":0,"positiveScore":0,"score":0,"grade":""},{"date":20210203,"state":"RI","positive":116704,"probableCases":null,"negative":631100,"pending":null,"totalTestResultsSource":"totalTestEncountersViral","totalTestResults":2568323,"hospitalizedCurrently":298,"hospitalizedCumulative":8369,"inIcuCurrently":42,"inIcuCumulative":null,"onVentilatorCurrently":23,"onVentilatorCumulative":null,"recovered":null,"lastUpdateEt":"2/3/2021 13:00","dateModified":"2021-02-03T13:00:00Z","checkTimeEt":"02/03 08:00","death":2198,"hospitalized":8369,"hospitalizedDischarged":7136,"dateChecked":"2021-02-03T13:00:00Z","totalTestsViral":null,"positiveTestsViral":139091,"negativeTestsViral":2429232,"positiveCasesViral":null,"deathConfirmed":null,"deathProbable":null,"totalTestEncountersViral":2568323,"totalTestsPeopleViral":747804,"totalTestsAntibody":null,"positiveTestsAntibody":null,"negativeTestsAntibody":null,"totalTestsPeopleAntibody":null,"positiveTestsPeopleAntibody":null,"negativeTestsPeopleAntibody":null,"totalTestsPeopleAntigen":null,"positiveTestsPeopleAntigen":null,"totalTestsAntigen":null,"positiveTestsAntigen":null,"fips":"44","positiveIncrease":513,"negativeIncrease":1646,"total":747804,"totalTestResultsIncrease":14579,"posNeg":747804,"dataQualityGrade":null,"deathIncrease":12,"hospitalizedIncrease":38,"hash":"a557200c8840b21720dc36b924debb8417852a62","commercialScore":0,"negativeRegularScore":0,"negativeScore":0,"positiveScore":0,"score":0,"grade":""},{"date":20210202,"state":"RI","positive":116191,"probableCases":null,"negative":629454,"pending":null,"totalTestResultsSource":"totalTestEncountersViral","totalTestResults":2553744,"hospitalizedCurrently":307,"hospitalizedCumulative":8331,"inIcuCurrently":41,"inIcuCumulative":null,"onVentilatorCurrently":25,"onVentilatorCumulative":null,"recovered":null,"lastUpdateEt":"2/2/2021 13:00","dateModified":"2021-02-02T13:00:00Z","checkTimeEt":"02/02 08:00","death":2186,"hospitalized":8331,"hospitalizedDischarged":7096,"dateChecked":"2021-02-02T13:00:00Z","totalTestsViral":null,"positiveTestsViral":138536,"negativeTestsViral":2415208,"positiveCasesViral":null,"deathConfirmed":null,"deathProbable":null,"totalTestEncountersViral":2553744,"totalTestsPeopleViral":745645,"totalTestsAntibody":null,"positiveTestsAntibody":null,"negativeTestsAntibody":null,"totalTestsPeopleAntibody":null,"positiveTestsPeopleAntibody":null,"negativeTestsPeopleAntibody":null,"totalTestsPeopleAntigen":null,"positiveTestsPeopleAntigen":null,"totalTestsAntigen":null,"positiveTestsAntigen":null,"fips":"44","positiveIncrease":235,"negativeIncrease":660,"total":745645,"totalTestResultsIncrease":8240,"posNeg":745645,"dataQualityGrade":null,"deathIncrease":13,"hospitalizedIncrease":35,"hash":"86ea47a67eeac511a081177bbc11a3931ee2f108","commercialScore":0,"negativeRegularScore":0,"negativeScore":0,"positiveScore":0,"score":0,"grade":""},{"date":20210201,"state":"RI","positive":115956,"probableCases":null,"negative":628794,"pending":null,"totalTestResultsSource":"totalTestEncountersViral","totalTestResults":2545504,"hospitalizedCurrently":316,"hospitalizedCumulative":8296,"inIcuCurrently":47,"inIcuCumulative":null,"onVentilatorCurrently":29,"onVentilatorCumulative":null,"recovered":null,"lastUpdateEt":"2/1/2021 13:00","dateModified":"2021-02-01T13:00:00Z","checkTimeEt":"02/01 08:00","death":2173,"hospitalized":8296,"hospitalizedDischarged":7054,"dateChecked":"2021-02-01T13:00:00Z","totalTestsViral":null,"positiveTestsViral":138279,"negativeTestsViral":2407225,"positiveCasesViral":null,"deathConfirmed":null,"deathProbable":null,"totalTestEncountersViral":2545504,"totalTestsPeopleViral":744750,"totalTestsAntibody":null,"positiveTestsAntibody":null,"negativeTestsAntibody":null,"totalTestsPeopleAntibody":null,"positiveTestsPeopleAntibody":null,"negativeTestsPeopleAntibody":null,"totalTestsPeopleAntigen":null,"positiveTestsPeopleAntigen":null,"totalTestsAntigen":null,"positiveTestsAntigen":null,"fips":"44","positiveIncrease":249,"negativeIncrease":975,"total":744750,"totalTestResultsIncrease":6710,"posNeg":744750,"dataQualityGrade":null,"deathIncrease":5,"hospitalizedIncrease":117,"hash":"46dc1debeb8c531f163061881ff7cedc39c1ee89","commercialScore":0,"negativeRegularScore":0,"negativeScore":0,"positiveScore":0,"score":0,"grade":""},{"date":20210131,"state":"RI","positive":115707,"probableCases":null,"negative":627819,"pending":null,"totalTestResultsSource":"totalTestEncountersViral","totalTestResults":2538794,"hospitalizedCurrently":324,"hospitalizedCumulative":8179,"inIcuCurrently":50,"inIcuCumulative":null,"onVentilatorCurrently":31,"onVentilatorCumulative":null,"recovered":null,"lastUpdateEt":"2/1/2021 16:42","dateModified":"2021-02-01T16:42:00Z","checkTimeEt":"02/01 11:42","death":2168,"hospitalized":8179,"hospitalizedDischarged":6941,"dateChecked":"2021-02-01T16:42:00Z","totalTestsViral":null,"positiveTestsViral":137983,"negativeTestsViral":2400811,"positiveCasesViral":null,"deathConfirmed":null,"deathProbable":null,"totalTestEncountersViral":2538794,"totalTestsPeopleViral":743526,"totalTestsAntibody":null,"positiveTestsAntibody":null,"negativeTestsAntibody":null,"totalTestsPeopleAntibody":null,"positiveTestsPeopleAntibody":null,"negativeTestsPeopleAntibody":null,"totalTestsPeopleAntigen":null,"positiveTestsPeopleAntigen":null,"totalTestsAntigen":null,"positiveTestsAntigen":null,"fips":"44","positiveIncrease":569,"negativeIncrease":2295,"total":743526,"totalTestResultsIncrease":16768,"posNeg":743526,"dataQualityGrade":null,"deathIncrease":4,"hospitalizedIncrease":0,"hash":"5dd8a941163952b71b35c065629e1f58a99d0ef1","commercialScore":0,"negativeRegularScore":0,"negativeScore":0,"positiveScore":0,"score":0,"grade":""},{"date":20210130,"state":"RI","positive":115138,"probableCases":null,"negative":625524,"pending":null,"totalTestResultsSource":"totalTestEncountersViral","totalTestResults":2522026,"hospitalizedCurrently":324,"hospitalizedCumulative":8179,"inIcuCurrently":50,"inIcuCumulative":null,"onVentilatorCurrently":31,"onVentilatorCumulative":null,"recovered":null,"lastUpdateEt":"2/1/2021 16:42","dateModified":"2021-02-01T16:42:00Z","checkTimeEt":"02/01 11:42","death":2164,"hospitalized":8179,"hospitalizedDischarged":6941,"dateChecked":"2021-02-01T16:42:00Z","totalTestsViral":null,"positiveTestsViral":137294,"negativeTestsViral":2384732,"positiveCasesViral":null,"deathConfirmed":null,"deathProbable":null,"totalTestEncountersViral":2522026,"totalTestsPeopleViral":740662,"totalTestsAntibody":null,"positiveTestsAntibody":null,"negativeTestsAntibody":null,"totalTestsPeopleAntibody":null,"positiveTestsPeopleAntibody":null,"negativeTestsPeopleAntibody":null,"totalTestsPeopleAntigen":null,"positiveTestsPeopleAntigen":null,"totalTestsAntigen":null,"positiveTestsAntigen":null,"fips":"44","positiveIncrease":700,"negativeIncrease":2072,"total":740662,"totalTestResultsIncrease":24755,"posNeg":740662,"dataQualityGrade":null,"deathIncrease":10,"hospitalizedIncrease":0,"hash":"a818e2d8bf4dbd8e5f66bffac9e0d32c949cb678","commercialScore":0,"negativeRegularScore":0,"negativeScore":0,"positiveScore":0,"score":0,"grade":""},{"date":20210129,"state":"RI","positive":114438,"probableCases":null,"negative":623452,"pending":null,"totalTestResultsSource":"totalTestEncountersViral","totalTestResults":2497271,"hospitalizedCurrently":324,"hospitalizedCumulative":8179,"inIcuCurrently":50,"inIcuCumulative":null,"onVentilatorCurrently":31,"onVentilatorCumulative":null,"recovered":null,"lastUpdateEt":"1/29/2021 13:00","dateModified":"2021-01-29T13:00:00Z","checkTimeEt":"01/29 08:00","death":2154,"hospitalized":8179,"hospitalizedDischarged":6941,"dateChecked":"2021-01-29T13:00:00Z","totalTestsViral":null,"positiveTestsViral":136503,"negativeTestsViral":2360768,"positiveCasesViral":null,"deathConfirmed":null,"deathProbable":null,"totalTestEncountersViral":2497271,"totalTestsPeopleViral":737890,"totalTestsAntibody":null,"positiveTestsAntibody":null,"negativeTestsAntibody":null,"totalTestsPeopleAntibody":null,"positiveTestsPeopleAntibody":null,"negativeTestsPeopleAntibody":null,"totalTestsPeopleAntigen":null,"positiveTestsPeopleAntigen":null,"totalTestsAntigen":null,"positiveTestsAntigen":null,"fips":"44","positiveIncrease":684,"negativeIncrease":2893,"total":737890,"totalTestResultsIncrease":23241,"posNeg":737890,"dataQualityGrade":null,"deathIncrease":10,"hospitalizedIncrease":48,"hash":"6556758a45cc1a3134ee197ba1deac8811216800","commercialScore":0,"negativeRegularScore":0,"negativeScore":0,"positiveScore":0,"score":0,"grade":""},{"date":20210128,"state":"RI","positive":113754,"probableCases":null,"negative":620559,"pending":null,"totalTestResultsSource":"totalTestEncountersViral","totalTestResults":2474030,"hospitalizedCurrently":335,"hospitalizedCumulative":8131,"inIcuCurrently":47,"inIcuCumulative":null,"onVentilatorCurrently":31,"onVentilatorCumulative":null,"recovered":null,"lastUpdateEt":"1/28/2021 13:00","dateModified":"2021-01-28T13:00:00Z","checkTimeEt":"01/28 08:00","death":2144,"hospitalized":8131,"hospitalizedDischarged":6885,"dateChecked":"2021-01-28T13:00:00Z","totalTestsViral":null,"positiveTestsViral":135724,"negativeTestsViral":2338306,"positiveCasesViral":null,"deathConfirmed":null,"deathProbable":null,"totalTestEncountersViral":2474030,"totalTestsPeopleViral":734313,"totalTestsAntibody":null,"positiveTestsAntibody":null,"negativeTestsAntibody":null,"totalTestsPeopleAntibody":null,"positiveTestsPeopleAntibody":null,"negativeTestsPeopleAntibody":null,"totalTestsPeopleAntigen":null,"positiveTestsPeopleAntigen":null,"totalTestsAntigen":null,"positiveTestsAntigen":null,"fips":"44","positiveIncrease":745,"negativeIncrease":2939,"total":734313,"totalTestResultsIncrease":22883,"posNeg":734313,"dataQualityGrade":null,"deathIncrease":9,"hospitalizedIncrease":33,"hash":"7643ab76be3197b5d1e82188aedc2a16f677ce46","commercialScore":0,"negativeRegularScore":0,"negativeScore":0,"positiveScore":0,"score":0,"grade":""},{"date":20210127,"state":"RI","positive":113009,"probableCases":null,"negative":617620,"pending":null,"totalTestResultsSource":"totalTestEncountersViral","totalTestResults":2451147,"hospitalizedCurrently":334,"hospitalizedCumulative":8098,"inIcuCurrently":50,"inIcuCumulative":null,"onVentilatorCurrently":35,"onVentilatorCumulative":null,"recovered":null,"lastUpdateEt":"1/27/2021 13:00","dateModified":"2021-01-27T13:00:00Z","checkTimeEt":"01/27 08:00","death":2135,"hospitalized":8098,"hospitalizedDischarged":6862,"dateChecked":"2021-01-27T13:00:00Z","totalTestsViral":null,"positiveTestsViral":134852,"negativeTestsViral":2316295,"positiveCasesViral":null,"deathConfirmed":null,"deathProbable":null,"totalTestEncountersViral":2451147,"totalTestsPeopleViral":730629,"totalTestsAntibody":null,"positiveTestsAntibody":null,"negativeTestsAntibody":null,"totalTestsPeopleAntibody":null,"positiveTestsPeopleAntibody":null,"negativeTestsPeopleAntibody":null,"totalTestsPeopleAntigen":null,"positiveTestsPeopleAntigen":null,"totalTestsAntigen":null,"positiveTestsAntigen":null,"fips":"44","positiveIncrease":613,"negativeIncrease":2953,"total":730629,"totalTestResultsIncrease":19224,"posNeg":730629,"dataQualityGrade":null,"deathIncrease":9,"hospitalizedIncrease":35,"hash":"1fd264231cd5a2bf33d447f70678075fc951b55e","commercialScore":0,"negativeRegularScore":0,"negativeScore":0,"positiveScore":0,"score":0,"grade":""},{"date":20210126,"state":"RI","positive":112396,"probableCases":null,"negative":614667,"pending":null,"totalTestResultsSource":"totalTestEncountersViral","totalTestResults":2431923,"hospitalizedCurrently":346,"hospitalizedCumulative":8063,"inIcuCurrently":51,"inIcuCumulative":null,"onVentilatorCurrently":35,"onVentilatorCumulative":null,"recovered":null,"lastUpdateEt":"1/26/2021 13:00","dateModified":"2021-01-26T13:00:00Z","checkTimeEt":"01/26 08:00","death":2126,"hospitalized":8063,"hospitalizedDischarged":6827,"dateChecked":"2021-01-26T13:00:00Z","totalTestsViral":null,"positiveTestsViral":134139,"negativeTestsViral":2297784,"positiveCasesViral":null,"deathConfirmed":null,"deathProbable":null,"totalTestEncountersViral":2431923,"totalTestsPeopleViral":727063,"totalTestsAntibody":null,"positiveTestsAntibody":null,"negativeTestsAntibody":null,"totalTestsPeopleAntibody":null,"positiveTestsPeopleAntibody":null,"negativeTestsPeopleAntibody":null,"totalTestsPeopleAntigen":null,"positiveTestsPeopleAntigen":null,"totalTestsAntigen":null,"positiveTestsAntigen":null,"fips":"44","positiveIncrease":642,"negativeIncrease":2054,"total":727063,"totalTestResultsIncrease":13904,"posNeg":727063,"dataQualityGrade":null,"deathIncrease":16,"hospitalizedIncrease":57,"hash":"0f773370aa3879d3c4eacd3e737bf3e7f5262a89","commercialScore":0,"negativeRegularScore":0,"negativeScore":0,"positiveScore":0,"score":0,"grade":""},{"date":20210125,"state":"RI","positive":111754,"probableCases":null,"negative":612613,"pending":null,"totalTestResultsSource":"totalTestEncountersViral","totalTestResults":2418019,"hospitalizedCurrently":347,"hospitalizedCumulative":8006,"inIcuCurrently":50,"inIcuCumulative":null,"onVentilatorCurrently":33,"onVentilatorCumulative":null,"recovered":null,"lastUpdateEt":"1/25/2021 13:00","dateModified":"2021-01-25T13:00:00Z","checkTimeEt":"01/25 08:00","death":2110,"hospitalized":8006,"hospitalizedDischarged":6778,"dateChecked":"2021-01-25T13:00:00Z","totalTestsViral":null,"positiveTestsViral":133427,"negativeTestsViral":2284592,"positiveCasesViral":null,"deathConfirmed":null,"deathProbable":null,"totalTestEncountersViral":2418019,"totalTestsPeopleViral":724367,"totalTestsAntibody":null,"positiveTestsAntibody":null,"negativeTestsAntibody":null,"totalTestsPeopleAntibody":null,"positiveTestsPeopleAntibody":null,"negativeTestsPeopleAntibody":null,"totalTestsPeopleAntigen":null,"positiveTestsPeopleAntigen":null,"totalTestsAntigen":null,"positiveTestsAntigen":null,"fips":"44","positiveIncrease":301,"negativeIncrease":1164,"total":724367,"totalTestResultsIncrease":7994,"posNeg":724367,"dataQualityGrade":null,"deathIncrease":9,"hospitalizedIncrease":162,"hash":"779b3e844aba375daa1d789871d19b5e7ecc32cc","commercialScore":0,"negativeRegularScore":0,"negativeScore":0,"positiveScore":0,"score":0,"grade":""},{"date":20210124,"state":"RI","positive":111453,"probableCases":null,"negative":611449,"pending":null,"totalTestResultsSource":"totalTestEncountersViral","totalTestResults":2410025,"hospitalizedCurrently":352,"hospitalizedCumulative":7844,"inIcuCurrently":43,"inIcuCumulative":null,"onVentilatorCurrently":31,"onVentilatorCumulative":null,"recovered":null,"lastUpdateEt":"1/25/2021 16:42","dateModified":"2021-01-25T16:42:00Z","checkTimeEt":"01/25 11:42","death":2101,"hospitalized":7844,"hospitalizedDischarged":6626,"dateChecked":"2021-01-25T16:42:00Z","totalTestsViral":null,"positiveTestsViral":133057,"negativeTestsViral":2276968,"positiveCasesViral":null,"deathConfirmed":null,"deathProbable":null,"totalTestEncountersViral":2410025,"totalTestsPeopleViral":722902,"totalTestsAntibody":null,"positiveTestsAntibody":null,"negativeTestsAntibody":null,"totalTestsPeopleAntibody":null,"positiveTestsPeopleAntibody":null,"negativeTestsPeopleAntibody":null,"totalTestsPeopleAntigen":null,"positiveTestsPeopleAntigen":null,"totalTestsAntigen":null,"positiveTestsAntigen":null,"fips":"44","positiveIncrease":742,"negativeIncrease":3108,"total":722902,"totalTestResultsIncrease":19787,"posNeg":722902,"dataQualityGrade":null,"deathIncrease":4,"hospitalizedIncrease":0,"hash":"064c04a95ca76d1e1315f422a573386798e2e805","commercialScore":0,"negativeRegularScore":0,"negativeScore":0,"positiveScore":0,"score":0,"grade":""},{"date":20210123,"state":"RI","positive":110711,"probableCases":null,"negative":608341,"pending":null,"totalTestResultsSource":"totalTestEncountersViral","totalTestResults":2390238,"hospitalizedCurrently":352,"hospitalizedCumulative":7844,"inIcuCurrently":43,"inIcuCumulative":null,"onVentilatorCurrently":31,"onVentilatorCumulative":null,"recovered":null,"lastUpdateEt":"1/25/2021 16:42","dateModified":"2021-01-25T16:42:00Z","checkTimeEt":"01/25 11:42","death":2097,"hospitalized":7844,"hospitalizedDischarged":6626,"dateChecked":"2021-01-25T16:42:00Z","totalTestsViral":null,"positiveTestsViral":132156,"negativeTestsViral":2258082,"positiveCasesViral":null,"deathConfirmed":null,"deathProbable":null,"totalTestEncountersViral":2390238,"totalTestsPeopleViral":719052,"totalTestsAntibody":null,"positiveTestsAntibody":null,"negativeTestsAntibody":null,"totalTestsPeopleAntibody":null,"positiveTestsPeopleAntibody":null,"negativeTestsPeopleAntibody":null,"totalTestsPeopleAntigen":null,"positiveTestsPeopleAntigen":null,"totalTestsAntigen":null,"positiveTestsAntigen":null,"fips":"44","positiveIncrease":976,"negativeIncrease":2638,"total":719052,"totalTestResultsIncrease":27107,"posNeg":719052,"dataQualityGrade":null,"deathIncrease":14,"hospitalizedIncrease":0,"hash":"7217a20fe4a5c1309f3bc4bb150d9b7bace3869a","commercialScore":0,"negativeRegularScore":0,"negativeScore":0,"positiveScore":0,"score":0,"grade":""},{"date":20210122,"state":"RI","positive":109735,"probableCases":null,"negative":605703,"pending":null,"totalTestResultsSource":"totalTestEncountersViral","totalTestResults":2363131,"hospitalizedCurrently":352,"hospitalizedCumulative":7844,"inIcuCurrently":43,"inIcuCumulative":null,"onVentilatorCurrently":31,"onVentilatorCumulative":null,"recovered":null,"lastUpdateEt":"1/22/2021 13:00","dateModified":"2021-01-22T13:00:00Z","checkTimeEt":"01/22 08:00","death":2083,"hospitalized":7844,"hospitalizedDischarged":6626,"dateChecked":"2021-01-22T13:00:00Z","totalTestsViral":null,"positiveTestsViral":131027,"negativeTestsViral":2232104,"positiveCasesViral":null,"deathConfirmed":null,"deathProbable":null,"totalTestEncountersViral":2363131,"totalTestsPeopleViral":715438,"totalTestsAntibody":null,"positiveTestsAntibody":null,"negativeTestsAntibody":null,"totalTestsPeopleAntibody":null,"positiveTestsPeopleAntibody":null,"negativeTestsPeopleAntibody":null,"totalTestsPeopleAntigen":null,"positiveTestsPeopleAntigen":null,"totalTestsAntigen":null,"positiveTestsAntigen":null,"fips":"44","positiveIncrease":949,"negativeIncrease":3266,"total":715438,"totalTestResultsIncrease":22450,"posNeg":715438,"dataQualityGrade":null,"deathIncrease":7,"hospitalizedIncrease":57,"hash":"e7990f4758d797afb56c6eac2d4e47e846b1719c","commercialScore":0,"negativeRegularScore":0,"negativeScore":0,"positiveScore":0,"score":0,"grade":""},{"date":20210121,"state":"RI","positive":108786,"probableCases":null,"negative":602437,"pending":null,"totalTestResultsSource":"totalTestEncountersViral","totalTestResults":2340681,"hospitalizedCurrently":379,"hospitalizedCumulative":7787,"inIcuCurrently":51,"inIcuCumulative":null,"onVentilatorCurrently":36,"onVentilatorCumulative":null,"recovered":null,"lastUpdateEt":"1/21/2021 13:00","dateModified":"2021-01-21T13:00:00Z","checkTimeEt":"01/21 08:00","death":2076,"hospitalized":7787,"hospitalizedDischarged":6553,"dateChecked":"2021-01-21T13:00:00Z","totalTestsViral":null,"positiveTestsViral":129882,"negativeTestsViral":2210799,"positiveCasesViral":null,"deathConfirmed":null,"deathProbable":null,"totalTestEncountersViral":2340681,"totalTestsPeopleViral":711223,"totalTestsAntibody":null,"positiveTestsAntibody":null,"negativeTestsAntibody":null,"totalTestsPeopleAntibody":null,"positiveTestsPeopleAntibody":null,"negativeTestsPeopleAntibody":null,"totalTestsPeopleAntigen":null,"positiveTestsPeopleAntigen":null,"totalTestsAntigen":null,"positiveTestsAntigen":null,"fips":"44","positiveIncrease":910,"negativeIncrease":3115,"total":711223,"totalTestResultsIncrease":26772,"posNeg":711223,"dataQualityGrade":null,"deathIncrease":18,"hospitalizedIncrease":67,"hash":"4694aef6f70fff60e94dbfbdbd7737d102944bc8","commercialScore":0,"negativeRegularScore":0,"negativeScore":0,"positiveScore":0,"score":0,"grade":""},{"date":20210120,"state":"RI","positive":107876,"probableCases":null,"negative":599322,"pending":null,"totalTestResultsSource":"totalTestEncountersViral","totalTestResults":2313909,"hospitalizedCurrently":379,"hospitalizedCumulative":7720,"inIcuCurrently":48,"inIcuCumulative":null,"onVentilatorCurrently":36,"onVentilatorCumulative":null,"recovered":null,"lastUpdateEt":"1/20/2021 13:00","dateModified":"2021-01-20T13:00:00Z","checkTimeEt":"01/20 08:00","death":2058,"hospitalized":7720,"hospitalizedDischarged":6495,"dateChecked":"2021-01-20T13:00:00Z","totalTestsViral":null,"positiveTestsViral":128772,"negativeTestsViral":2185137,"positiveCasesViral":null,"deathConfirmed":null,"deathProbable":null,"totalTestEncountersViral":2313909,"totalTestsPeopleViral":707198,"totalTestsAntibody":null,"positiveTestsAntibody":null,"negativeTestsAntibody":null,"totalTestsPeopleAntibody":null,"positiveTestsPeopleAntibody":null,"negativeTestsPeopleAntibody":null,"totalTestsPeopleAntigen":null,"positiveTestsPeopleAntigen":null,"totalTestsAntigen":null,"positiveTestsAntigen":null,"fips":"44","positiveIncrease":810,"negativeIncrease":2504,"total":707198,"totalTestResultsIncrease":15908,"posNeg":707198,"dataQualityGrade":null,"deathIncrease":13,"hospitalizedIncrease":70,"hash":"f803d0759259a7ce071241c601d3301551fadc1e","commercialScore":0,"negativeRegularScore":0,"negativeScore":0,"positiveScore":0,"score":0,"grade":""},{"date":20210119,"state":"RI","positive":107066,"probableCases":null,"negative":596818,"pending":null,"totalTestResultsSource":"totalTestEncountersViral","totalTestResults":2298001,"hospitalizedCurrently":366,"hospitalizedCumulative":7650,"inIcuCurrently":50,"inIcuCumulative":null,"onVentilatorCurrently":37,"onVentilatorCumulative":null,"recovered":null,"lastUpdateEt":"1/19/2021 13:00","dateModified":"2021-01-19T13:00:00Z","checkTimeEt":"01/19 08:00","death":2045,"hospitalized":7650,"hospitalizedDischarged":6445,"dateChecked":"2021-01-19T13:00:00Z","totalTestsViral":null,"positiveTestsViral":127862,"negativeTestsViral":2170139,"positiveCasesViral":null,"deathConfirmed":null,"deathProbable":null,"totalTestEncountersViral":2298001,"totalTestsPeopleViral":703884,"totalTestsAntibody":null,"positiveTestsAntibody":null,"negativeTestsAntibody":null,"totalTestsPeopleAntibody":null,"positiveTestsPeopleAntibody":null,"negativeTestsPeopleAntibody":null,"totalTestsPeopleAntigen":null,"positiveTestsPeopleAntigen":null,"totalTestsAntigen":null,"positiveTestsAntigen":null,"fips":"44","positiveIncrease":361,"negativeIncrease":1196,"total":703884,"totalTestResultsIncrease":8736,"posNeg":703884,"dataQualityGrade":null,"deathIncrease":12,"hospitalizedIncrease":218,"hash":"b89fc3960d01b95a0718647506d7ee1f6740c9ef","commercialScore":0,"negativeRegularScore":0,"negativeScore":0,"positiveScore":0,"score":0,"grade":""},{"date":20210118,"state":"RI","positive":106705,"probableCases":null,"negative":595622,"pending":null,"totalTestResultsSource":"totalTestEncountersViral","totalTestResults":2289265,"hospitalizedCurrently":384,"hospitalizedCumulative":7432,"inIcuCurrently":51,"inIcuCumulative":null,"onVentilatorCurrently":35,"onVentilatorCumulative":null,"recovered":null,"lastUpdateEt":"1/19/2021 17:28","dateModified":"2021-01-19T17:28:00Z","checkTimeEt":"01/19 12:28","death":2033,"hospitalized":7432,"hospitalizedDischarged":6229,"dateChecked":"2021-01-19T17:28:00Z","totalTestsViral":null,"positiveTestsViral":127399,"negativeTestsViral":2161866,"positiveCasesViral":null,"deathConfirmed":null,"deathProbable":null,"totalTestEncountersViral":2289265,"totalTestsPeopleViral":702327,"totalTestsAntibody":null,"positiveTestsAntibody":null,"negativeTestsAntibody":null,"totalTestsPeopleAntibody":null,"positiveTestsPeopleAntibody":null,"negativeTestsPeopleAntibody":null,"totalTestsPeopleAntigen":null,"positiveTestsPeopleAntigen":null,"totalTestsAntigen":null,"positiveTestsAntigen":null,"fips":"44","positiveIncrease":481,"negativeIncrease":1713,"total":702327,"totalTestResultsIncrease":9479,"posNeg":702327,"dataQualityGrade":null,"deathIncrease":5,"hospitalizedIncrease":0,"hash":"40773df2f9fc5a174ca276bdcea4063023501ac3","commercialScore":0,"negativeRegularScore":0,"negativeScore":0,"positiveScore":0,"score":0,"grade":""},{"date":20210117,"state":"RI","positive":106224,"probableCases":null,"negative":593909,"pending":null,"totalTestResultsSource":"totalTestEncountersViral","totalTestResults":2279786,"hospitalizedCurrently":384,"hospitalizedCumulative":7432,"inIcuCurrently":51,"inIcuCumulative":null,"onVentilatorCurrently":35,"onVentilatorCumulative":null,"recovered":null,"lastUpdateEt":"1/19/2021 17:28","dateModified":"2021-01-19T17:28:00Z","checkTimeEt":"01/19 12:28","death":2028,"hospitalized":7432,"hospitalizedDischarged":6229,"dateChecked":"2021-01-19T17:28:00Z","totalTestsViral":null,"positiveTestsViral":126802,"negativeTestsViral":2152984,"positiveCasesViral":null,"deathConfirmed":null,"deathProbable":null,"totalTestEncountersViral":2279786,"totalTestsPeopleViral":700133,"totalTestsAntibody":null,"positiveTestsAntibody":null,"negativeTestsAntibody":null,"totalTestsPeopleAntibody":null,"positiveTestsPeopleAntibody":null,"negativeTestsPeopleAntibody":null,"totalTestsPeopleAntigen":null,"positiveTestsPeopleAntigen":null,"totalTestsAntigen":null,"positiveTestsAntigen":null,"fips":"44","positiveIncrease":752,"negativeIncrease":2846,"total":700133,"totalTestResultsIncrease":17237,"posNeg":700133,"dataQualityGrade":null,"deathIncrease":9,"hospitalizedIncrease":0,"hash":"967b06f2add22c9777f7dd44a1be520f5630f5e0","commercialScore":0,"negativeRegularScore":0,"negativeScore":0,"positiveScore":0,"score":0,"grade":""},{"date":20210116,"state":"RI","positive":105472,"probableCases":null,"negative":591063,"pending":null,"totalTestResultsSource":"totalTestEncountersViral","totalTestResults":2262549,"hospitalizedCurrently":384,"hospitalizedCumulative":7432,"inIcuCurrently":51,"inIcuCumulative":null,"onVentilatorCurrently":35,"onVentilatorCumulative":null,"recovered":null,"lastUpdateEt":"1/19/2021 17:28","dateModified":"2021-01-19T17:28:00Z","checkTimeEt":"01/19 12:28","death":2019,"hospitalized":7432,"hospitalizedDischarged":6229,"dateChecked":"2021-01-19T17:28:00Z","totalTestsViral":null,"positiveTestsViral":125913,"negativeTestsViral":2136636,"positiveCasesViral":null,"deathConfirmed":null,"deathProbable":null,"totalTestEncountersViral":2262549,"totalTestsPeopleViral":696535,"totalTestsAntibody":null,"positiveTestsAntibody":null,"negativeTestsAntibody":null,"totalTestsPeopleAntibody":null,"positiveTestsPeopleAntibody":null,"negativeTestsPeopleAntibody":null,"totalTestsPeopleAntigen":null,"positiveTestsPeopleAntigen":null,"totalTestsAntigen":null,"positiveTestsAntigen":null,"fips":"44","positiveIncrease":1029,"negativeIncrease":2354,"total":696535,"totalTestResultsIncrease":20254,"posNeg":696535,"dataQualityGrade":null,"deathIncrease":14,"hospitalizedIncrease":0,"hash":"067c1a1c1c8785f97e2f6fdcb0132a3e12e25676","commercialScore":0,"negativeRegularScore":0,"negativeScore":0,"positiveScore":0,"score":0,"grade":""},{"date":20210115,"state":"RI","positive":104443,"probableCases":null,"negative":588709,"pending":null,"totalTestResultsSource":"totalTestEncountersViral","totalTestResults":2242295,"hospitalizedCurrently":384,"hospitalizedCumulative":7432,"inIcuCurrently":51,"inIcuCumulative":null,"onVentilatorCurrently":35,"onVentilatorCumulative":null,"recovered":null,"lastUpdateEt":"1/15/2021 13:00","dateModified":"2021-01-15T13:00:00Z","checkTimeEt":"01/15 08:00","death":2005,"hospitalized":7432,"hospitalizedDischarged":6229,"dateChecked":"2021-01-15T13:00:00Z","totalTestsViral":null,"positiveTestsViral":124747,"negativeTestsViral":2117548,"positiveCasesViral":null,"deathConfirmed":null,"deathProbable":null,"totalTestEncountersViral":2242295,"totalTestsPeopleViral":693152,"totalTestsAntibody":null,"positiveTestsAntibody":null,"negativeTestsAntibody":null,"totalTestsPeopleAntibody":null,"positiveTestsPeopleAntibody":null,"negativeTestsPeopleAntibody":null,"totalTestsPeopleAntigen":null,"positiveTestsPeopleAntigen":null,"totalTestsAntigen":null,"positiveTestsAntigen":null,"fips":"44","positiveIncrease":1057,"negativeIncrease":3519,"total":693152,"totalTestResultsIncrease":22490,"posNeg":693152,"dataQualityGrade":null,"deathIncrease":9,"hospitalizedIncrease":66,"hash":"dc1fe50eb64e3296ac741db63a5e97f701e74e5a","commercialScore":0,"negativeRegularScore":0,"negativeScore":0,"positiveScore":0,"score":0,"grade":""},{"date":20210114,"state":"RI","positive":103386,"probableCases":null,"negative":585190,"pending":null,"totalTestResultsSource":"totalTestEncountersViral","totalTestResults":2219805,"hospitalizedCurrently":375,"hospitalizedCumulative":7366,"inIcuCurrently":53,"inIcuCumulative":null,"onVentilatorCurrently":34,"onVentilatorCumulative":null,"recovered":null,"lastUpdateEt":"1/14/2021 13:00","dateModified":"2021-01-14T13:00:00Z","checkTimeEt":"01/14 08:00","death":1996,"hospitalized":7366,"hospitalizedDischarged":6175,"dateChecked":"2021-01-14T13:00:00Z","totalTestsViral":null,"positiveTestsViral":123555,"negativeTestsViral":2096250,"positiveCasesViral":null,"deathConfirmed":null,"deathProbable":null,"totalTestEncountersViral":2219805,"totalTestsPeopleViral":688576,"totalTestsAntibody":null,"positiveTestsAntibody":null,"negativeTestsAntibody":null,"totalTestsPeopleAntibody":null,"positiveTestsPeopleAntibody":null,"negativeTestsPeopleAntibody":null,"totalTestsPeopleAntigen":null,"positiveTestsPeopleAntigen":null,"totalTestsAntigen":null,"positiveTestsAntigen":null,"fips":"44","positiveIncrease":901,"negativeIncrease":3467,"total":688576,"totalTestResultsIncrease":20175,"posNeg":688576,"dataQualityGrade":null,"deathIncrease":9,"hospitalizedIncrease":56,"hash":"3c46320c4509477ccbe8af58e8b9d3a9f7ac5cc5","commercialScore":0,"negativeRegularScore":0,"negativeScore":0,"positiveScore":0,"score":0,"grade":""},{"date":20210113,"state":"RI","positive":102485,"probableCases":null,"negative":581723,"pending":null,"totalTestResultsSource":"totalTestEncountersViral","totalTestResults":2199630,"hospitalizedCurrently":402,"hospitalizedCumulative":7310,"inIcuCurrently":49,"inIcuCumulative":null,"onVentilatorCurrently":35,"onVentilatorCumulative":null,"recovered":null,"lastUpdateEt":"1/13/2021 13:00","dateModified":"2021-01-13T13:00:00Z","checkTimeEt":"01/13 08:00","death":1987,"hospitalized":7310,"hospitalizedDischarged":6101,"dateChecked":"2021-01-13T13:00:00Z","totalTestsViral":null,"positiveTestsViral":122522,"negativeTestsViral":2077108,"positiveCasesViral":null,"deathConfirmed":null,"deathProbable":null,"totalTestEncountersViral":2199630,"totalTestsPeopleViral":684208,"totalTestsAntibody":null,"positiveTestsAntibody":null,"negativeTestsAntibody":null,"totalTestsPeopleAntibody":null,"positiveTestsPeopleAntibody":null,"negativeTestsPeopleAntibody":null,"totalTestsPeopleAntigen":null,"positiveTestsPeopleAntigen":null,"totalTestsAntigen":null,"positiveTestsAntigen":null,"fips":"44","positiveIncrease":1092,"negativeIncrease":3226,"total":684208,"totalTestResultsIncrease":19809,"posNeg":684208,"dataQualityGrade":null,"deathIncrease":17,"hospitalizedIncrease":69,"hash":"e89f8a383b0d7caa3994253ff353df22cafa7a6f","commercialScore":0,"negativeRegularScore":0,"negativeScore":0,"positiveScore":0,"score":0,"grade":""},{"date":20210112,"state":"RI","positive":101393,"probableCases":null,"negative":578497,"pending":null,"totalTestResultsSource":"totalTestEncountersViral","totalTestResults":2179821,"hospitalizedCurrently":402,"hospitalizedCumulative":7241,"inIcuCurrently":53,"inIcuCumulative":null,"onVentilatorCurrently":34,"onVentilatorCumulative":null,"recovered":null,"lastUpdateEt":"1/12/2021 13:00","dateModified":"2021-01-12T13:00:00Z","checkTimeEt":"01/12 08:00","death":1970,"hospitalized":7241,"hospitalizedDischarged":6042,"dateChecked":"2021-01-12T13:00:00Z","totalTestsViral":null,"positiveTestsViral":121227,"negativeTestsViral":2058594,"positiveCasesViral":null,"deathConfirmed":null,"deathProbable":null,"totalTestEncountersViral":2179821,"totalTestsPeopleViral":679890,"totalTestsAntibody":null,"positiveTestsAntibody":null,"negativeTestsAntibody":null,"totalTestsPeopleAntibody":null,"positiveTestsPeopleAntibody":null,"negativeTestsPeopleAntibody":null,"totalTestsPeopleAntigen":null,"positiveTestsPeopleAntigen":null,"totalTestsAntigen":null,"positiveTestsAntigen":null,"fips":"44","positiveIncrease":786,"negativeIncrease":2695,"total":679890,"totalTestResultsIncrease":13001,"posNeg":679890,"dataQualityGrade":null,"deathIncrease":23,"hospitalizedIncrease":50,"hash":"59ef88c147cb7f37098fb87c4c0a3e13eb70cd4b","commercialScore":0,"negativeRegularScore":0,"negativeScore":0,"positiveScore":0,"score":0,"grade":""},{"date":20210111,"state":"RI","positive":100607,"probableCases":null,"negative":575802,"pending":null,"totalTestResultsSource":"totalTestEncountersViral","totalTestResults":2166820,"hospitalizedCurrently":399,"hospitalizedCumulative":7191,"inIcuCurrently":47,"inIcuCumulative":null,"onVentilatorCurrently":33,"onVentilatorCumulative":null,"recovered":null,"lastUpdateEt":"1/11/2021 13:00","dateModified":"2021-01-11T13:00:00Z","checkTimeEt":"01/11 08:00","death":1947,"hospitalized":7191,"hospitalizedDischarged":6000,"dateChecked":"2021-01-11T13:00:00Z","totalTestsViral":null,"positiveTestsViral":120360,"negativeTestsViral":2046460,"positiveCasesViral":null,"deathConfirmed":null,"deathProbable":null,"totalTestEncountersViral":2166820,"totalTestsPeopleViral":676409,"totalTestsAntibody":null,"positiveTestsAntibody":null,"negativeTestsAntibody":null,"totalTestsPeopleAntibody":null,"positiveTestsPeopleAntibody":null,"negativeTestsPeopleAntibody":null,"totalTestsPeopleAntigen":null,"positiveTestsPeopleAntigen":null,"totalTestsAntigen":null,"positiveTestsAntigen":null,"fips":"44","positiveIncrease":568,"negativeIncrease":1975,"total":676409,"totalTestResultsIncrease":8328,"posNeg":676409,"dataQualityGrade":null,"deathIncrease":7,"hospitalizedIncrease":164,"hash":"a63ee931d46965c23de4542e21fc5ada357d7f02","commercialScore":0,"negativeRegularScore":0,"negativeScore":0,"positiveScore":0,"score":0,"grade":""},{"date":20210110,"state":"RI","positive":100039,"probableCases":null,"negative":573827,"pending":null,"totalTestResultsSource":"totalTestEncountersViral","totalTestResults":2158492,"hospitalizedCurrently":390,"hospitalizedCumulative":7027,"inIcuCurrently":55,"inIcuCumulative":null,"onVentilatorCurrently":39,"onVentilatorCumulative":null,"recovered":null,"lastUpdateEt":"1/11/2021 18:43","dateModified":"2021-01-11T18:43:00Z","checkTimeEt":"01/11 13:43","death":1940,"hospitalized":7027,"hospitalizedDischarged":5860,"dateChecked":"2021-01-11T18:43:00Z","totalTestsViral":null,"positiveTestsViral":119688,"negativeTestsViral":2038804,"positiveCasesViral":null,"deathConfirmed":null,"deathProbable":null,"totalTestEncountersViral":2158492,"totalTestsPeopleViral":673866,"totalTestsAntibody":null,"positiveTestsAntibody":null,"negativeTestsAntibody":null,"totalTestsPeopleAntibody":null,"positiveTestsPeopleAntibody":null,"negativeTestsPeopleAntibody":null,"totalTestsPeopleAntigen":null,"positiveTestsPeopleAntigen":null,"totalTestsAntigen":null,"positiveTestsAntigen":null,"fips":"44","positiveIncrease":1038,"negativeIncrease":3398,"total":673866,"totalTestResultsIncrease":18188,"posNeg":673866,"dataQualityGrade":null,"deathIncrease":10,"hospitalizedIncrease":0,"hash":"b821e2c6b244230c0853b48ddf115a9858902ee4","commercialScore":0,"negativeRegularScore":0,"negativeScore":0,"positiveScore":0,"score":0,"grade":""},{"date":20210109,"state":"RI","positive":99001,"probableCases":null,"negative":570429,"pending":null,"totalTestResultsSource":"totalTestEncountersViral","totalTestResults":2140304,"hospitalizedCurrently":390,"hospitalizedCumulative":7027,"inIcuCurrently":55,"inIcuCumulative":null,"onVentilatorCurrently":39,"onVentilatorCumulative":null,"recovered":null,"lastUpdateEt":"1/11/2021 18:43","dateModified":"2021-01-11T18:43:00Z","checkTimeEt":"01/11 13:43","death":1930,"hospitalized":7027,"hospitalizedDischarged":5860,"dateChecked":"2021-01-11T18:43:00Z","totalTestsViral":null,"positiveTestsViral":118445,"negativeTestsViral":2021859,"positiveCasesViral":null,"deathConfirmed":null,"deathProbable":null,"totalTestEncountersViral":2140304,"totalTestsPeopleViral":669430,"totalTestsAntibody":null,"positiveTestsAntibody":null,"negativeTestsAntibody":null,"totalTestsPeopleAntibody":null,"positiveTestsPeopleAntibody":null,"negativeTestsPeopleAntibody":null,"totalTestsPeopleAntigen":null,"positiveTestsPeopleAntigen":null,"totalTestsAntigen":null,"positiveTestsAntigen":null,"fips":"44","positiveIncrease":1387,"negativeIncrease":2773,"total":669430,"totalTestResultsIncrease":24337,"posNeg":669430,"dataQualityGrade":null,"deathIncrease":14,"hospitalizedIncrease":0,"hash":"281be2e7c797407e6cdbd30b0bf1c45a7eff7f8d","commercialScore":0,"negativeRegularScore":0,"negativeScore":0,"positiveScore":0,"score":0,"grade":""},{"date":20210108,"state":"RI","positive":97614,"probableCases":null,"negative":567656,"pending":null,"totalTestResultsSource":"totalTestEncountersViral","totalTestResults":2115967,"hospitalizedCurrently":390,"hospitalizedCumulative":7027,"inIcuCurrently":55,"inIcuCumulative":null,"onVentilatorCurrently":39,"onVentilatorCumulative":null,"recovered":null,"lastUpdateEt":"1/8/2021 13:00","dateModified":"2021-01-08T13:00:00Z","checkTimeEt":"01/08 08:00","death":1916,"hospitalized":7027,"hospitalizedDischarged":5860,"dateChecked":"2021-01-08T13:00:00Z","totalTestsViral":null,"positiveTestsViral":116884,"negativeTestsViral":1999083,"positiveCasesViral":null,"deathConfirmed":null,"deathProbable":null,"totalTestEncountersViral":2115967,"totalTestsPeopleViral":665270,"totalTestsAntibody":null,"positiveTestsAntibody":null,"negativeTestsAntibody":null,"totalTestsPeopleAntibody":null,"positiveTestsPeopleAntibody":null,"negativeTestsPeopleAntibody":null,"totalTestsPeopleAntigen":null,"positiveTestsPeopleAntigen":null,"totalTestsAntigen":null,"positiveTestsAntigen":null,"fips":"44","positiveIncrease":1023,"negativeIncrease":2557,"total":665270,"totalTestResultsIncrease":16222,"posNeg":665270,"dataQualityGrade":null,"deathIncrease":6,"hospitalizedIncrease":71,"hash":"1cc397e9422563aeb00e211c83d46980a8355960","commercialScore":0,"negativeRegularScore":0,"negativeScore":0,"positiveScore":0,"score":0,"grade":""},{"date":20210107,"state":"RI","positive":96591,"probableCases":null,"negative":565099,"pending":null,"totalTestResultsSource":"totalTestEncountersViral","totalTestResults":2099745,"hospitalizedCurrently":397,"hospitalizedCumulative":6956,"inIcuCurrently":59,"inIcuCumulative":null,"onVentilatorCurrently":40,"onVentilatorCumulative":null,"recovered":null,"lastUpdateEt":"1/7/2021 13:00","dateModified":"2021-01-07T13:00:00Z","checkTimeEt":"01/07 08:00","death":1910,"hospitalized":6956,"hospitalizedDischarged":5794,"dateChecked":"2021-01-07T13:00:00Z","totalTestsViral":null,"positiveTestsViral":115715,"negativeTestsViral":1984030,"positiveCasesViral":null,"deathConfirmed":null,"deathProbable":null,"totalTestEncountersViral":2099745,"totalTestsPeopleViral":661690,"totalTestsAntibody":null,"positiveTestsAntibody":null,"negativeTestsAntibody":null,"totalTestsPeopleAntibody":null,"positiveTestsPeopleAntibody":null,"negativeTestsPeopleAntibody":null,"totalTestsPeopleAntigen":null,"positiveTestsPeopleAntigen":null,"totalTestsAntigen":null,"positiveTestsAntigen":null,"fips":"44","positiveIncrease":1128,"negativeIncrease":2465,"total":661690,"totalTestResultsIncrease":19820,"posNeg":661690,"dataQualityGrade":null,"deathIncrease":20,"hospitalizedIncrease":51,"hash":"b17a8acb6bbbfe24f08deb1324bba1bde4873bca","commercialScore":0,"negativeRegularScore":0,"negativeScore":0,"positiveScore":0,"score":0,"grade":""},{"date":20210106,"state":"RI","positive":95463,"probableCases":null,"negative":562634,"pending":null,"totalTestResultsSource":"totalTestEncountersViral","totalTestResults":2079925,"hospitalizedCurrently":405,"hospitalizedCumulative":6905,"inIcuCurrently":59,"inIcuCumulative":null,"onVentilatorCurrently":40,"onVentilatorCumulative":null,"recovered":null,"lastUpdateEt":"1/6/2021 13:00","dateModified":"2021-01-06T13:00:00Z","checkTimeEt":"01/06 08:00","death":1890,"hospitalized":6905,"hospitalizedDischarged":5743,"dateChecked":"2021-01-06T13:00:00Z","totalTestsViral":null,"positiveTestsViral":114397,"negativeTestsViral":1965528,"positiveCasesViral":null,"deathConfirmed":null,"deathProbable":null,"totalTestEncountersViral":2079925,"totalTestsPeopleViral":658097,"totalTestsAntibody":null,"positiveTestsAntibody":null,"negativeTestsAntibody":null,"totalTestsPeopleAntibody":null,"positiveTestsPeopleAntibody":null,"negativeTestsPeopleAntibody":null,"totalTestsPeopleAntigen":null,"positiveTestsPeopleAntigen":null,"totalTestsAntigen":null,"positiveTestsAntigen":null,"fips":"44","positiveIncrease":1611,"negativeIncrease":2945,"total":658097,"totalTestResultsIncrease":20481,"posNeg":658097,"dataQualityGrade":null,"deathIncrease":20,"hospitalizedIncrease":68,"hash":"c856200b0f961aed8a54d411e8ed312ef223f697","commercialScore":0,"negativeRegularScore":0,"negativeScore":0,"positiveScore":0,"score":0,"grade":""},{"date":20210105,"state":"RI","positive":93852,"probableCases":null,"negative":559689,"pending":null,"totalTestResultsSource":"totalTestEncountersViral","totalTestResults":2059444,"hospitalizedCurrently":409,"hospitalizedCumulative":6837,"inIcuCurrently":56,"inIcuCumulative":null,"onVentilatorCurrently":40,"onVentilatorCumulative":null,"recovered":null,"lastUpdateEt":"1/5/2021 13:00","dateModified":"2021-01-05T13:00:00Z","checkTimeEt":"01/05 08:00","death":1870,"hospitalized":6837,"hospitalizedDischarged":5682,"dateChecked":"2021-01-05T13:00:00Z","totalTestsViral":null,"positiveTestsViral":112563,"negativeTestsViral":1946881,"positiveCasesViral":null,"deathConfirmed":null,"deathProbable":null,"totalTestEncountersViral":2059444,"totalTestsPeopleViral":653541,"totalTestsAntibody":null,"positiveTestsAntibody":null,"negativeTestsAntibody":null,"totalTestsPeopleAntibody":null,"positiveTestsPeopleAntibody":null,"negativeTestsPeopleAntibody":null,"totalTestsPeopleAntigen":null,"positiveTestsPeopleAntigen":null,"totalTestsAntigen":null,"positiveTestsAntigen":null,"fips":"44","positiveIncrease":1144,"negativeIncrease":2411,"total":653541,"totalTestResultsIncrease":13069,"posNeg":653541,"dataQualityGrade":null,"deathIncrease":15,"hospitalizedIncrease":50,"hash":"c8c0ceda832689f016501631b7ebd9bebbe1ef69","commercialScore":0,"negativeRegularScore":0,"negativeScore":0,"positiveScore":0,"score":0,"grade":""},{"date":20210104,"state":"RI","positive":92708,"probableCases":null,"negative":557278,"pending":null,"totalTestResultsSource":"totalTestEncountersViral","totalTestResults":2046375,"hospitalizedCurrently":415,"hospitalizedCumulative":6787,"inIcuCurrently":53,"inIcuCumulative":null,"onVentilatorCurrently":40,"onVentilatorCumulative":null,"recovered":null,"lastUpdateEt":"1/4/2021 13:00","dateModified":"2021-01-04T13:00:00Z","checkTimeEt":"01/04 08:00","death":1855,"hospitalized":6787,"hospitalizedDischarged":5636,"dateChecked":"2021-01-04T13:00:00Z","totalTestsViral":null,"positiveTestsViral":111253,"negativeTestsViral":1935122,"positiveCasesViral":null,"deathConfirmed":null,"deathProbable":null,"totalTestEncountersViral":2046375,"totalTestsPeopleViral":649986,"totalTestsAntibody":null,"positiveTestsAntibody":null,"negativeTestsAntibody":null,"totalTestsPeopleAntibody":null,"positiveTestsPeopleAntibody":null,"negativeTestsPeopleAntibody":null,"totalTestsPeopleAntigen":null,"positiveTestsPeopleAntigen":null,"totalTestsAntigen":null,"positiveTestsAntigen":null,"fips":"44","positiveIncrease":633,"negativeIncrease":2111,"total":649986,"totalTestResultsIncrease":8691,"posNeg":649986,"dataQualityGrade":null,"deathIncrease":12,"hospitalizedIncrease":281,"hash":"59bd0f1af0104119a3559933e70b4839ec726406","commercialScore":0,"negativeRegularScore":0,"negativeScore":0,"positiveScore":0,"score":0,"grade":""},{"date":20210103,"state":"RI","positive":92075,"probableCases":null,"negative":555167,"pending":null,"totalTestResultsSource":"totalTestEncountersViral","totalTestResults":2037684,"hospitalizedCurrently":426,"hospitalizedCumulative":6506,"inIcuCurrently":61,"inIcuCumulative":null,"onVentilatorCurrently":47,"onVentilatorCumulative":null,"recovered":null,"lastUpdateEt":"1/4/2021 16:31","dateModified":"2021-01-04T16:31:00Z","checkTimeEt":"01/04 11:31","death":1843,"hospitalized":6506,"hospitalizedDischarged":5381,"dateChecked":"2021-01-04T16:31:00Z","totalTestsViral":null,"positiveTestsViral":110523,"negativeTestsViral":1927161,"positiveCasesViral":null,"deathConfirmed":null,"deathProbable":null,"totalTestEncountersViral":2037684,"totalTestsPeopleViral":647242,"totalTestsAntibody":null,"positiveTestsAntibody":null,"negativeTestsAntibody":null,"totalTestsPeopleAntibody":null,"positiveTestsPeopleAntibody":null,"negativeTestsPeopleAntibody":null,"totalTestsPeopleAntigen":null,"positiveTestsPeopleAntigen":null,"totalTestsAntigen":null,"positiveTestsAntigen":null,"fips":"44","positiveIncrease":888,"negativeIncrease":2178,"total":647242,"totalTestResultsIncrease":10629,"posNeg":647242,"dataQualityGrade":null,"deathIncrease":10,"hospitalizedIncrease":0,"hash":"7c29583f3ef55b45cf7002feeee80fe045ba4632","commercialScore":0,"negativeRegularScore":0,"negativeScore":0,"positiveScore":0,"score":0,"grade":""},{"date":20210102,"state":"RI","positive":91187,"probableCases":null,"negative":552989,"pending":null,"totalTestResultsSource":"totalTestEncountersViral","totalTestResults":2027055,"hospitalizedCurrently":426,"hospitalizedCumulative":6506,"inIcuCurrently":61,"inIcuCumulative":null,"onVentilatorCurrently":47,"onVentilatorCumulative":null,"recovered":null,"lastUpdateEt":"1/4/2021 16:31","dateModified":"2021-01-04T16:31:00Z","checkTimeEt":"01/04 11:31","death":1833,"hospitalized":6506,"hospitalizedDischarged":5381,"dateChecked":"2021-01-04T16:31:00Z","totalTestsViral":null,"positiveTestsViral":109530,"negativeTestsViral":1917525,"positiveCasesViral":null,"deathConfirmed":null,"deathProbable":null,"totalTestEncountersViral":2027055,"totalTestsPeopleViral":644176,"totalTestsAntibody":null,"positiveTestsAntibody":null,"negativeTestsAntibody":null,"totalTestsPeopleAntibody":null,"positiveTestsPeopleAntibody":null,"negativeTestsPeopleAntibody":null,"totalTestsPeopleAntigen":null,"positiveTestsPeopleAntigen":null,"totalTestsAntigen":null,"positiveTestsAntigen":null,"fips":"44","positiveIncrease":783,"negativeIncrease":1961,"total":644176,"totalTestResultsIncrease":11599,"posNeg":644176,"dataQualityGrade":null,"deathIncrease":10,"hospitalizedIncrease":0,"hash":"b75e6fe1c05b54664bb06d3a4ce5bdc440fa528b","commercialScore":0,"negativeRegularScore":0,"negativeScore":0,"positiveScore":0,"score":0,"grade":""},{"date":20210101,"state":"RI","positive":90404,"probableCases":null,"negative":551028,"pending":null,"totalTestResultsSource":"totalTestEncountersViral","totalTestResults":2015456,"hospitalizedCurrently":426,"hospitalizedCumulative":6506,"inIcuCurrently":61,"inIcuCumulative":null,"onVentilatorCurrently":47,"onVentilatorCumulative":null,"recovered":null,"lastUpdateEt":"1/4/2021 16:31","dateModified":"2021-01-04T16:31:00Z","checkTimeEt":"01/04 11:31","death":1823,"hospitalized":6506,"hospitalizedDischarged":5381,"dateChecked":"2021-01-04T16:31:00Z","totalTestsViral":null,"positiveTestsViral":108618,"negativeTestsViral":1906838,"positiveCasesViral":null,"deathConfirmed":null,"deathProbable":null,"totalTestEncountersViral":2015456,"totalTestsPeopleViral":641432,"totalTestsAntibody":null,"positiveTestsAntibody":null,"negativeTestsAntibody":null,"totalTestsPeopleAntibody":null,"positiveTestsPeopleAntibody":null,"negativeTestsPeopleAntibody":null,"totalTestsPeopleAntigen":null,"positiveTestsPeopleAntigen":null,"totalTestsAntigen":null,"positiveTestsAntigen":null,"fips":"44","positiveIncrease":863,"negativeIncrease":2904,"total":641432,"totalTestResultsIncrease":14674,"posNeg":641432,"dataQualityGrade":null,"deathIncrease":14,"hospitalizedIncrease":0,"hash":"a76be85ec1a0880f0def7d09ed4c34d1bbf29262","commercialScore":0,"negativeRegularScore":0,"negativeScore":0,"positiveScore":0,"score":0,"grade":""},{"date":20201231,"state":"RI","positive":89541,"probableCases":null,"negative":548124,"pending":null,"totalTestResultsSource":"totalTestEncountersViral","totalTestResults":2000782,"hospitalizedCurrently":426,"hospitalizedCumulative":6506,"inIcuCurrently":61,"inIcuCumulative":null,"onVentilatorCurrently":47,"onVentilatorCumulative":null,"recovered":null,"lastUpdateEt":"1/4/2021 16:31","dateModified":"2021-01-04T16:31:00Z","checkTimeEt":"01/04 11:31","death":1809,"hospitalized":6506,"hospitalizedDischarged":5381,"dateChecked":"2021-01-04T16:31:00Z","totalTestsViral":null,"positiveTestsViral":107635,"negativeTestsViral":1893147,"positiveCasesViral":null,"deathConfirmed":null,"deathProbable":null,"totalTestEncountersViral":2000782,"totalTestsPeopleViral":637665,"totalTestsAntibody":null,"positiveTestsAntibody":null,"negativeTestsAntibody":null,"totalTestsPeopleAntibody":null,"positiveTestsPeopleAntibody":null,"negativeTestsPeopleAntibody":null,"totalTestsPeopleAntigen":null,"positiveTestsPeopleAntigen":null,"totalTestsAntigen":null,"positiveTestsAntigen":null,"fips":"44","positiveIncrease":1592,"negativeIncrease":2460,"total":637665,"totalTestResultsIncrease":26284,"posNeg":637665,"dataQualityGrade":null,"deathIncrease":32,"hospitalizedIncrease":0,"hash":"48bb7c49c3f0a0ce7d8729864b1aa40d064e3d71","commercialScore":0,"negativeRegularScore":0,"negativeScore":0,"positiveScore":0,"score":0,"grade":""},{"date":20201230,"state":"RI","positive":87949,"probableCases":null,"negative":545664,"pending":null,"totalTestResultsSource":"totalTestEncountersViral","totalTestResults":1974498,"hospitalizedCurrently":426,"hospitalizedCumulative":6506,"inIcuCurrently":61,"inIcuCumulative":null,"onVentilatorCurrently":47,"onVentilatorCumulative":null,"recovered":null,"lastUpdateEt":"12/30/2020 13:00","dateModified":"2020-12-30T13:00:00Z","checkTimeEt":"12/30 08:00","death":1777,"hospitalized":6506,"hospitalizedDischarged":5381,"dateChecked":"2020-12-30T13:00:00Z","totalTestsViral":null,"positiveTestsViral":105661,"negativeTestsViral":1868837,"positiveCasesViral":null,"deathConfirmed":null,"deathProbable":null,"totalTestEncountersViral":1974498,"totalTestsPeopleViral":633613,"totalTestsAntibody":null,"positiveTestsAntibody":null,"negativeTestsAntibody":null,"totalTestsPeopleAntibody":null,"positiveTestsPeopleAntibody":null,"negativeTestsPeopleAntibody":null,"totalTestsPeopleAntigen":null,"positiveTestsPeopleAntigen":null,"totalTestsAntigen":null,"positiveTestsAntigen":null,"fips":"44","positiveIncrease":1160,"negativeIncrease":1581,"total":633613,"totalTestResultsIncrease":13252,"posNeg":633613,"dataQualityGrade":null,"deathIncrease":17,"hospitalizedIncrease":53,"hash":"0bc2f8aa955e5c0c810ebecc98520719a051aa32","commercialScore":0,"negativeRegularScore":0,"negativeScore":0,"positiveScore":0,"score":0,"grade":""},{"date":20201229,"state":"RI","positive":86789,"probableCases":null,"negative":544083,"pending":null,"totalTestResultsSource":"totalTestEncountersViral","totalTestResults":1961246,"hospitalizedCurrently":423,"hospitalizedCumulative":6453,"inIcuCurrently":55,"inIcuCumulative":null,"onVentilatorCurrently":46,"onVentilatorCumulative":null,"recovered":null,"lastUpdateEt":"12/29/2020 13:00","dateModified":"2020-12-29T13:00:00Z","checkTimeEt":"12/29 08:00","death":1760,"hospitalized":6453,"hospitalizedDischarged":5335,"dateChecked":"2020-12-29T13:00:00Z","totalTestsViral":null,"positiveTestsViral":104505,"negativeTestsViral":1856741,"positiveCasesViral":null,"deathConfirmed":null,"deathProbable":null,"totalTestEncountersViral":1961246,"totalTestsPeopleViral":630872,"totalTestsAntibody":null,"positiveTestsAntibody":null,"negativeTestsAntibody":null,"totalTestsPeopleAntibody":null,"positiveTestsPeopleAntibody":null,"negativeTestsPeopleAntibody":null,"totalTestsPeopleAntigen":null,"positiveTestsPeopleAntigen":null,"totalTestsAntigen":null,"positiveTestsAntigen":null,"fips":"44","positiveIncrease":1187,"negativeIncrease":2423,"total":630872,"totalTestResultsIncrease":13139,"posNeg":630872,"dataQualityGrade":null,"deathIncrease":18,"hospitalizedIncrease":50,"hash":"fee3b461362e00f06192caeb6545de949c0efaef","commercialScore":0,"negativeRegularScore":0,"negativeScore":0,"positiveScore":0,"score":0,"grade":""},{"date":20201228,"state":"RI","positive":85602,"probableCases":null,"negative":541660,"pending":null,"totalTestResultsSource":"totalTestEncountersViral","totalTestResults":1948107,"hospitalizedCurrently":412,"hospitalizedCumulative":6403,"inIcuCurrently":54,"inIcuCumulative":null,"onVentilatorCurrently":47,"onVentilatorCumulative":null,"recovered":null,"lastUpdateEt":"12/28/2020 13:00","dateModified":"2020-12-28T13:00:00Z","checkTimeEt":"12/28 08:00","death":1742,"hospitalized":6403,"hospitalizedDischarged":5306,"dateChecked":"2020-12-28T13:00:00Z","totalTestsViral":null,"positiveTestsViral":103151,"negativeTestsViral":1844956,"positiveCasesViral":null,"deathConfirmed":null,"deathProbable":null,"totalTestEncountersViral":1948107,"totalTestsPeopleViral":627262,"totalTestsAntibody":null,"positiveTestsAntibody":null,"negativeTestsAntibody":null,"totalTestsPeopleAntibody":null,"positiveTestsPeopleAntibody":null,"negativeTestsPeopleAntibody":null,"totalTestsPeopleAntigen":null,"positiveTestsPeopleAntigen":null,"totalTestsAntigen":null,"positiveTestsAntigen":null,"fips":"44","positiveIncrease":661,"negativeIncrease":1935,"total":627262,"totalTestResultsIncrease":8118,"posNeg":627262,"dataQualityGrade":null,"deathIncrease":3,"hospitalizedIncrease":272,"hash":"9111fc57c18ddaae02635f4b0c6d91e070e6e9fb","commercialScore":0,"negativeRegularScore":0,"negativeScore":0,"positiveScore":0,"score":0,"grade":""},{"date":20201227,"state":"RI","positive":84941,"probableCases":null,"negative":539725,"pending":null,"totalTestResultsSource":"totalTestEncountersViral","totalTestResults":1939989,"hospitalizedCurrently":442,"hospitalizedCumulative":6131,"inIcuCurrently":49,"inIcuCumulative":null,"onVentilatorCurrently":35,"onVentilatorCumulative":null,"recovered":null,"lastUpdateEt":"12/28/2020 16:31","dateModified":"2020-12-28T16:31:00Z","checkTimeEt":"12/28 11:31","death":1739,"hospitalized":6131,"hospitalizedDischarged":5041,"dateChecked":"2020-12-28T16:31:00Z","totalTestsViral":null,"positiveTestsViral":102386,"negativeTestsViral":1837603,"positiveCasesViral":null,"deathConfirmed":null,"deathProbable":null,"totalTestEncountersViral":1939989,"totalTestsPeopleVir