[{"date":20210307,"state":"UT","positive":374850,"probableCases":null,"negative":1560293,"pending":null,"totalTestResultsSource":"totalTestsViral","totalTestResults":2910121,"hospitalizedCurrently":212,"hospitalizedCumulative":14891,"inIcuCurrently":73,"inIcuCumulative":2344,"onVentilatorCurrently":null,"onVentilatorCumulative":822,"recovered":358958,"lastUpdateEt":"3/7/2021 09:35","dateModified":"2021-03-07T09:35:00Z","checkTimeEt":"03/07 04:35","death":1976,"hospitalized":14891,"hospitalizedDischarged":null,"dateChecked":"2021-03-07T09:35:00Z","totalTestsViral":2910121,"positiveTestsViral":345990,"negativeTestsViral":2564131,"positiveCasesViral":null,"deathConfirmed":null,"deathProbable":null,"totalTestEncountersViral":null,"totalTestsPeopleViral":1876802,"totalTestsAntibody":null,"positiveTestsAntibody":null,"negativeTestsAntibody":null,"totalTestsPeopleAntibody":null,"positiveTestsPeopleAntibody":null,"negativeTestsPeopleAntibody":null,"totalTestsPeopleAntigen":371319,"positiveTestsPeopleAntigen":57683,"totalTestsAntigen":1002177,"positiveTestsAntigen":60158,"fips":"49","positiveIncrease":412,"negativeIncrease":3204,"total":1935143,"totalTestResultsIncrease":6828,"posNeg":1935143,"dataQualityGrade":null,"deathIncrease":1,"hospitalizedIncrease":24,"hash":"d759cc6bb12e652ba45ca3a0dbd31f3b951eae34","commercialScore":0,"negativeRegularScore":0,"negativeScore":0,"positiveScore":0,"score":0,"grade":""},{"date":20210306,"state":"UT","positive":374438,"probableCases":null,"negative":1557089,"pending":null,"totalTestResultsSource":"totalTestsViral","totalTestResults":2903293,"hospitalizedCurrently":216,"hospitalizedCumulative":14867,"inIcuCurrently":77,"inIcuCumulative":2344,"onVentilatorCurrently":null,"onVentilatorCumulative":822,"recovered":358249,"lastUpdateEt":"3/6/2021 09:37","dateModified":"2021-03-06T09:37:00Z","checkTimeEt":"03/06 04:37","death":1975,"hospitalized":14867,"hospitalizedDischarged":null,"dateChecked":"2021-03-06T09:37:00Z","totalTestsViral":2903293,"positiveTestsViral":345677,"negativeTestsViral":2557616,"positiveCasesViral":null,"deathConfirmed":null,"deathProbable":null,"totalTestEncountersViral":null,"totalTestsPeopleViral":1873342,"totalTestsAntibody":null,"positiveTestsAntibody":null,"negativeTestsAntibody":null,"totalTestsPeopleAntibody":null,"positiveTestsPeopleAntibody":null,"negativeTestsPeopleAntibody":null,"totalTestsPeopleAntigen":370352,"positiveTestsPeopleAntigen":57529,"totalTestsAntigen":1000187,"positiveTestsAntigen":60002,"fips":"49","positiveIncrease":570,"negativeIncrease":3556,"total":1931527,"totalTestResultsIncrease":8211,"posNeg":1931527,"dataQualityGrade":null,"deathIncrease":5,"hospitalizedIncrease":26,"hash":"db25fac46c2c2b795d3d7b794655b8bb4e6e67d9","commercialScore":0,"negativeRegularScore":0,"negativeScore":0,"positiveScore":0,"score":0,"grade":""},{"date":20210305,"state":"UT","positive":373868,"probableCases":null,"negative":1553533,"pending":null,"totalTestResultsSource":"totalTestsViral","totalTestResults":2895082,"hospitalizedCurrently":238,"hospitalizedCumulative":14841,"inIcuCurrently":85,"inIcuCumulative":2339,"onVentilatorCurrently":null,"onVentilatorCumulative":820,"recovered":357312,"lastUpdateEt":"3/5/2021 09:18","dateModified":"2021-03-05T09:18:00Z","checkTimeEt":"03/05 04:18","death":1970,"hospitalized":14841,"hospitalizedDischarged":null,"dateChecked":"2021-03-05T09:18:00Z","totalTestsViral":2895082,"positiveTestsViral":345264,"negativeTestsViral":2549818,"positiveCasesViral":null,"deathConfirmed":null,"deathProbable":null,"totalTestEncountersViral":null,"totalTestsPeopleViral":1869438,"totalTestsAntibody":null,"positiveTestsAntibody":null,"negativeTestsAntibody":null,"totalTestsPeopleAntibody":null,"positiveTestsPeopleAntibody":null,"negativeTestsPeopleAntibody":null,"totalTestsPeopleAntigen":367204,"positiveTestsPeopleAntigen":57308,"totalTestsAntigen":989804,"positiveTestsAntigen":59774,"fips":"49","positiveIncrease":1160,"negativeIncrease":3773,"total":1927401,"totalTestResultsIncrease":8713,"posNeg":1927401,"dataQualityGrade":null,"deathIncrease":15,"hospitalizedIncrease":58,"hash":"4eae079aeae22d02461a6f281cbe686a90aebc97","commercialScore":0,"negativeRegularScore":0,"negativeScore":0,"positiveScore":0,"score":0,"grade":""},{"date":20210304,"state":"UT","positive":372708,"probableCases":null,"negative":1549760,"pending":null,"totalTestResultsSource":"totalTestsViral","totalTestResults":2886369,"hospitalizedCurrently":247,"hospitalizedCumulative":14783,"inIcuCurrently":92,"inIcuCumulative":2331,"onVentilatorCurrently":null,"onVentilatorCumulative":818,"recovered":355033,"lastUpdateEt":"3/3/2021 09:08","dateModified":"2021-03-03T09:08:00Z","checkTimeEt":"03/03 04:08","death":1955,"hospitalized":14783,"hospitalizedDischarged":null,"dateChecked":"2021-03-03T09:08:00Z","totalTestsViral":2886369,"positiveTestsViral":344845,"negativeTestsViral":2541524,"positiveCasesViral":null,"deathConfirmed":null,"deathProbable":null,"totalTestEncountersViral":null,"totalTestsPeopleViral":1865313,"totalTestsAntibody":null,"positiveTestsAntibody":null,"negativeTestsAntibody":null,"totalTestsPeopleAntibody":null,"positiveTestsPeopleAntibody":null,"negativeTestsPeopleAntibody":null,"totalTestsPeopleAntigen":364728,"positiveTestsPeopleAntigen":57124,"totalTestsAntigen":981583,"positiveTestsAntigen":59586,"fips":"49","positiveIncrease":0,"negativeIncrease":4202,"total":1922468,"totalTestResultsIncrease":10193,"posNeg":1922468,"dataQualityGrade":null,"deathIncrease":0,"hospitalizedIncrease":0,"hash":"5360af74c652fda7029b4b3362fe1b5e17f21631","commercialScore":0,"negativeRegularScore":0,"negativeScore":0,"positiveScore":0,"score":0,"grade":""},{"date":20210303,"state":"UT","positive":372708,"probableCases":null,"negative":1545558,"pending":null,"totalTestResultsSource":"totalTestsViral","totalTestResults":2876176,"hospitalizedCurrently":247,"hospitalizedCumulative":14783,"inIcuCurrently":92,"inIcuCumulative":2331,"onVentilatorCurrently":null,"onVentilatorCumulative":818,"recovered":355033,"lastUpdateEt":"3/3/2021 09:08","dateModified":"2021-03-03T09:08:00Z","checkTimeEt":"03/03 04:08","death":1955,"hospitalized":14783,"hospitalizedDischarged":null,"dateChecked":"2021-03-03T09:08:00Z","totalTestsViral":2876176,"positiveTestsViral":344317,"negativeTestsViral":2531859,"positiveCasesViral":null,"deathConfirmed":null,"deathProbable":null,"totalTestEncountersViral":null,"totalTestsPeopleViral":1860677,"totalTestsAntibody":null,"positiveTestsAntibody":null,"negativeTestsAntibody":null,"totalTestsPeopleAntibody":null,"positiveTestsPeopleAntibody":null,"negativeTestsPeopleAntibody":null,"totalTestsPeopleAntigen":362078,"positiveTestsPeopleAntigen":56948,"totalTestsAntigen":973413,"positiveTestsAntigen":59406,"fips":"49","positiveIncrease":729,"negativeIncrease":4413,"total":1918266,"totalTestResultsIncrease":10703,"posNeg":1918266,"dataQualityGrade":null,"deathIncrease":6,"hospitalizedIncrease":30,"hash":"6e8905313551624f76126c4377b55f8254a2b287","commercialScore":0,"negativeRegularScore":0,"negativeScore":0,"positiveScore":0,"score":0,"grade":""},{"date":20210302,"state":"UT","positive":371979,"probableCases":null,"negative":1541145,"pending":null,"totalTestResultsSource":"totalTestsViral","totalTestResults":2865473,"hospitalizedCurrently":237,"hospitalizedCumulative":14753,"inIcuCurrently":92,"inIcuCumulative":2324,"onVentilatorCurrently":null,"onVentilatorCumulative":818,"recovered":353737,"lastUpdateEt":"3/2/2021 09:39","dateModified":"2021-03-02T09:39:00Z","checkTimeEt":"03/02 04:39","death":1949,"hospitalized":14753,"hospitalizedDischarged":null,"dateChecked":"2021-03-02T09:39:00Z","totalTestsViral":2865473,"positiveTestsViral":343810,"negativeTestsViral":2521663,"positiveCasesViral":null,"deathConfirmed":null,"deathProbable":null,"totalTestEncountersViral":null,"totalTestsPeopleViral":1855832,"totalTestsAntibody":null,"positiveTestsAntibody":null,"negativeTestsAntibody":null,"totalTestsPeopleAntibody":null,"positiveTestsPeopleAntibody":null,"negativeTestsPeopleAntibody":null,"totalTestsPeopleAntigen":358674,"positiveTestsPeopleAntigen":56633,"totalTestsAntigen":962849,"positiveTestsAntigen":59080,"fips":"49","positiveIncrease":487,"negativeIncrease":3142,"total":1913124,"totalTestResultsIncrease":6285,"posNeg":1913124,"dataQualityGrade":null,"deathIncrease":9,"hospitalizedIncrease":29,"hash":"9782156f28540ba2b6e00305d5749949e031f82d","commercialScore":0,"negativeRegularScore":0,"negativeScore":0,"positiveScore":0,"score":0,"grade":""},{"date":20210301,"state":"UT","positive":371492,"probableCases":null,"negative":1538003,"pending":null,"totalTestResultsSource":"totalTestsViral","totalTestResults":2859188,"hospitalizedCurrently":238,"hospitalizedCumulative":14724,"inIcuCurrently":89,"inIcuCumulative":2309,"onVentilatorCurrently":null,"onVentilatorCumulative":813,"recovered":352814,"lastUpdateEt":"3/1/2021 10:46","dateModified":"2021-03-01T10:46:00Z","checkTimeEt":"03/01 05:46","death":1940,"hospitalized":14724,"hospitalizedDischarged":null,"dateChecked":"2021-03-01T10:46:00Z","totalTestsViral":2859188,"positiveTestsViral":343473,"negativeTestsViral":2515715,"positiveCasesViral":null,"deathConfirmed":null,"deathProbable":null,"totalTestEncountersViral":null,"totalTestsPeopleViral":1852407,"totalTestsAntibody":null,"positiveTestsAntibody":null,"negativeTestsAntibody":null,"totalTestsPeopleAntibody":null,"positiveTestsPeopleAntibody":null,"negativeTestsPeopleAntibody":null,"totalTestsPeopleAntigen":356517,"positiveTestsPeopleAntigen":56440,"totalTestsAntigen":954594,"positiveTestsAntigen":58884,"fips":"49","positiveIncrease":257,"negativeIncrease":2400,"total":1909495,"totalTestResultsIncrease":5273,"posNeg":1909495,"dataQualityGrade":null,"deathIncrease":5,"hospitalizedIncrease":29,"hash":"727abb561fc69b651a2d40d1494947d3eb526e49","commercialScore":0,"negativeRegularScore":0,"negativeScore":0,"positiveScore":0,"score":0,"grade":""},{"date":20210228,"state":"UT","positive":371235,"probableCases":null,"negative":1535603,"pending":null,"totalTestResultsSource":"totalTestsViral","totalTestResults":2853915,"hospitalizedCurrently":230,"hospitalizedCumulative":14695,"inIcuCurrently":84,"inIcuCumulative":2308,"onVentilatorCurrently":null,"onVentilatorCumulative":813,"recovered":352303,"lastUpdateEt":"2/28/2021 09:00","dateModified":"2021-02-28T09:00:00Z","checkTimeEt":"02/28 04:00","death":1935,"hospitalized":14695,"hospitalizedDischarged":null,"dateChecked":"2021-02-28T09:00:00Z","totalTestsViral":2853915,"positiveTestsViral":343189,"negativeTestsViral":2510726,"positiveCasesViral":null,"deathConfirmed":null,"deathProbable":null,"totalTestEncountersViral":null,"totalTestsPeopleViral":1849765,"totalTestsAntibody":null,"positiveTestsAntibody":null,"negativeTestsAntibody":null,"totalTestsPeopleAntibody":null,"positiveTestsPeopleAntibody":null,"negativeTestsPeopleAntibody":null,"totalTestsPeopleAntigen":356026,"positiveTestsPeopleAntigen":56419,"totalTestsAntigen":953350,"positiveTestsAntigen":58863,"fips":"49","positiveIncrease":465,"negativeIncrease":3044,"total":1906838,"totalTestResultsIncrease":6209,"posNeg":1906838,"dataQualityGrade":null,"deathIncrease":6,"hospitalizedIncrease":31,"hash":"18621699551b50af4c8159a7f9185d4626a25a8f","commercialScore":0,"negativeRegularScore":0,"negativeScore":0,"positiveScore":0,"score":0,"grade":""},{"date":20210227,"state":"UT","positive":370770,"probableCases":null,"negative":1532559,"pending":null,"totalTestResultsSource":"totalTestsViral","totalTestResults":2847706,"hospitalizedCurrently":252,"hospitalizedCumulative":14664,"inIcuCurrently":89,"inIcuCumulative":2308,"onVentilatorCurrently":null,"onVentilatorCumulative":813,"recovered":351396,"lastUpdateEt":"2/27/2021 10:41","dateModified":"2021-02-27T10:41:00Z","checkTimeEt":"02/27 05:41","death":1929,"hospitalized":14664,"hospitalizedDischarged":null,"dateChecked":"2021-02-27T10:41:00Z","totalTestsViral":2847706,"positiveTestsViral":342802,"negativeTestsViral":2504904,"positiveCasesViral":null,"deathConfirmed":null,"deathProbable":null,"totalTestEncountersViral":null,"totalTestsPeopleViral":1846405,"totalTestsAntibody":null,"positiveTestsAntibody":null,"negativeTestsAntibody":null,"totalTestsPeopleAntibody":null,"positiveTestsPeopleAntibody":null,"negativeTestsPeopleAntibody":null,"totalTestsPeopleAntigen":355021,"positiveTestsPeopleAntigen":56300,"totalTestsAntigen":951137,"positiveTestsAntigen":58739,"fips":"49","positiveIncrease":686,"negativeIncrease":3465,"total":1903329,"totalTestResultsIncrease":8715,"posNeg":1903329,"dataQualityGrade":null,"deathIncrease":22,"hospitalizedIncrease":36,"hash":"be3dff3de0dac7b42fb0d50a8fa8476740e95d76","commercialScore":0,"negativeRegularScore":0,"negativeScore":0,"positiveScore":0,"score":0,"grade":""},{"date":20210226,"state":"UT","positive":370084,"probableCases":null,"negative":1529094,"pending":null,"totalTestResultsSource":"totalTestsViral","totalTestResults":2838991,"hospitalizedCurrently":254,"hospitalizedCumulative":14628,"inIcuCurrently":94,"inIcuCumulative":2303,"onVentilatorCurrently":null,"onVentilatorCumulative":811,"recovered":350198,"lastUpdateEt":"2/26/2021 11:08","dateModified":"2021-02-26T11:08:00Z","checkTimeEt":"02/26 06:08","death":1907,"hospitalized":14628,"hospitalizedDischarged":null,"dateChecked":"2021-02-26T11:08:00Z","totalTestsViral":2838991,"positiveTestsViral":342295,"negativeTestsViral":2496696,"positiveCasesViral":null,"deathConfirmed":null,"deathProbable":null,"totalTestEncountersViral":null,"totalTestsPeopleViral":1842550,"totalTestsAntibody":null,"positiveTestsAntibody":null,"negativeTestsAntibody":null,"totalTestsPeopleAntibody":null,"positiveTestsPeopleAntibody":null,"negativeTestsPeopleAntibody":null,"totalTestsPeopleAntigen":352124,"positiveTestsPeopleAntigen":56004,"totalTestsAntigen":942128,"positiveTestsAntigen":58434,"fips":"49","positiveIncrease":651,"negativeIncrease":3536,"total":1899178,"totalTestResultsIncrease":9086,"posNeg":1899178,"dataQualityGrade":null,"deathIncrease":17,"hospitalizedIncrease":31,"hash":"124bf83223b11ea739a9ee173f88ba6b07226acb","commercialScore":0,"negativeRegularScore":0,"negativeScore":0,"positiveScore":0,"score":0,"grade":""},{"date":20210225,"state":"UT","positive":369433,"probableCases":null,"negative":1525558,"pending":null,"totalTestResultsSource":"totalTestsViral","totalTestResults":2829905,"hospitalizedCurrently":248,"hospitalizedCumulative":14597,"inIcuCurrently":87,"inIcuCumulative":2295,"onVentilatorCurrently":null,"onVentilatorCumulative":810,"recovered":348982,"lastUpdateEt":"2/25/2021 10:05","dateModified":"2021-02-25T10:05:00Z","checkTimeEt":"02/25 05:05","death":1890,"hospitalized":14597,"hospitalizedDischarged":null,"dateChecked":"2021-02-25T10:05:00Z","totalTestsViral":2829905,"positiveTestsViral":341734,"negativeTestsViral":2488171,"positiveCasesViral":null,"deathConfirmed":null,"deathProbable":null,"totalTestEncountersViral":null,"totalTestsPeopleViral":1838541,"totalTestsAntibody":null,"positiveTestsAntibody":null,"negativeTestsAntibody":null,"totalTestsPeopleAntibody":null,"positiveTestsPeopleAntibody":null,"negativeTestsPeopleAntibody":null,"totalTestsPeopleAntigen":350635,"positiveTestsPeopleAntigen":55884,"totalTestsAntigen":935615,"positiveTestsAntigen":58304,"fips":"49","positiveIncrease":832,"negativeIncrease":4183,"total":1894991,"totalTestResultsIncrease":10605,"posNeg":1894991,"dataQualityGrade":null,"deathIncrease":11,"hospitalizedIncrease":43,"hash":"3203aba133fb7b9871c5e6b27ed5ff21094c9239","commercialScore":0,"negativeRegularScore":0,"negativeScore":0,"positiveScore":0,"score":0,"grade":""},{"date":20210224,"state":"UT","positive":368601,"probableCases":null,"negative":1521375,"pending":null,"totalTestResultsSource":"totalTestsViral","totalTestResults":2819300,"hospitalizedCurrently":252,"hospitalizedCumulative":14554,"inIcuCurrently":91,"inIcuCumulative":2288,"onVentilatorCurrently":null,"onVentilatorCumulative":807,"recovered":347721,"lastUpdateEt":"2/24/2021 09:34","dateModified":"2021-02-24T09:34:00Z","checkTimeEt":"02/24 04:34","death":1879,"hospitalized":14554,"hospitalizedDischarged":null,"dateChecked":"2021-02-24T09:34:00Z","totalTestsViral":2819300,"positiveTestsViral":341007,"negativeTestsViral":2478293,"positiveCasesViral":null,"deathConfirmed":null,"deathProbable":null,"totalTestEncountersViral":null,"totalTestsPeopleViral":1833776,"totalTestsAntibody":null,"positiveTestsAntibody":null,"negativeTestsAntibody":null,"totalTestsPeopleAntibody":null,"positiveTestsPeopleAntibody":null,"negativeTestsPeopleAntibody":null,"totalTestsPeopleAntigen":346818,"positiveTestsPeopleAntigen":55574,"totalTestsAntigen":925044,"positiveTestsAntigen":57982,"fips":"49","positiveIncrease":812,"negativeIncrease":4362,"total":1889976,"totalTestResultsIncrease":9940,"posNeg":1889976,"dataQualityGrade":null,"deathIncrease":14,"hospitalizedIncrease":34,"hash":"74fd79922a1bc3639cc973ee08018751aafb9803","commercialScore":0,"negativeRegularScore":0,"negativeScore":0,"positiveScore":0,"score":0,"grade":""},{"date":20210223,"state":"UT","positive":367789,"probableCases":null,"negative":1517013,"pending":null,"totalTestResultsSource":"totalTestsViral","totalTestResults":2809360,"hospitalizedCurrently":271,"hospitalizedCumulative":14520,"inIcuCurrently":95,"inIcuCumulative":2280,"onVentilatorCurrently":null,"onVentilatorCumulative":801,"recovered":346157,"lastUpdateEt":"2/23/2021 09:23","dateModified":"2021-02-23T09:23:00Z","checkTimeEt":"02/23 04:23","death":1865,"hospitalized":14520,"hospitalizedDischarged":null,"dateChecked":"2021-02-23T09:23:00Z","totalTestsViral":2809360,"positiveTestsViral":340401,"negativeTestsViral":2468959,"positiveCasesViral":null,"deathConfirmed":null,"deathProbable":null,"totalTestEncountersViral":null,"totalTestsPeopleViral":1828894,"totalTestsAntibody":null,"positiveTestsAntibody":null,"negativeTestsAntibody":null,"totalTestsPeopleAntibody":null,"positiveTestsPeopleAntibody":null,"negativeTestsPeopleAntibody":null,"totalTestsPeopleAntigen":344069,"positiveTestsPeopleAntigen":55291,"totalTestsAntigen":915595,"positiveTestsAntigen":57692,"fips":"49","positiveIncrease":716,"negativeIncrease":3273,"total":1884802,"totalTestResultsIncrease":8242,"posNeg":1884802,"dataQualityGrade":null,"deathIncrease":12,"hospitalizedIncrease":54,"hash":"9afe81140cd13ffa990734eb94552fb74fb0f84d","commercialScore":0,"negativeRegularScore":0,"negativeScore":0,"positiveScore":0,"score":0,"grade":""},{"date":20210222,"state":"UT","positive":367073,"probableCases":null,"negative":1513740,"pending":null,"totalTestResultsSource":"totalTestsViral","totalTestResults":2801118,"hospitalizedCurrently":265,"hospitalizedCumulative":14466,"inIcuCurrently":99,"inIcuCumulative":2270,"onVentilatorCurrently":null,"onVentilatorCumulative":796,"recovered":344965,"lastUpdateEt":"2/22/2021 09:10","dateModified":"2021-02-22T09:10:00Z","checkTimeEt":"02/22 04:10","death":1853,"hospitalized":14466,"hospitalizedDischarged":null,"dateChecked":"2021-02-22T09:10:00Z","totalTestsViral":2801118,"positiveTestsViral":339861,"negativeTestsViral":2461257,"positiveCasesViral":null,"deathConfirmed":null,"deathProbable":null,"totalTestEncountersViral":null,"totalTestsPeopleViral":1825158,"totalTestsAntibody":null,"positiveTestsAntibody":null,"negativeTestsAntibody":null,"totalTestsPeopleAntibody":null,"positiveTestsPeopleAntibody":null,"negativeTestsPeopleAntibody":null,"totalTestsPeopleAntigen":341347,"positiveTestsPeopleAntigen":55010,"totalTestsAntigen":905357,"positiveTestsAntigen":57399,"fips":"49","positiveIncrease":338,"negativeIncrease":2330,"total":1880813,"totalTestResultsIncrease":4774,"posNeg":1880813,"dataQualityGrade":null,"deathIncrease":1,"hospitalizedIncrease":21,"hash":"298718b2864148bba68d3877c1129a031a0244fb","commercialScore":0,"negativeRegularScore":0,"negativeScore":0,"positiveScore":0,"score":0,"grade":""},{"date":20210221,"state":"UT","positive":366735,"probableCases":null,"negative":1511410,"pending":null,"totalTestResultsSource":"totalTestsViral","totalTestResults":2796344,"hospitalizedCurrently":263,"hospitalizedCumulative":14445,"inIcuCurrently":100,"inIcuCumulative":2269,"onVentilatorCurrently":null,"onVentilatorCumulative":796,"recovered":344387,"lastUpdateEt":"2/21/2021 10:25","dateModified":"2021-02-21T10:25:00Z","checkTimeEt":"02/21 05:25","death":1852,"hospitalized":14445,"hospitalizedDischarged":null,"dateChecked":"2021-02-21T10:25:00Z","totalTestsViral":2796344,"positiveTestsViral":339548,"negativeTestsViral":2456796,"positiveCasesViral":null,"deathConfirmed":null,"deathProbable":null,"totalTestEncountersViral":null,"totalTestsPeopleViral":1822541,"totalTestsAntibody":null,"positiveTestsAntibody":null,"negativeTestsAntibody":null,"totalTestsPeopleAntibody":null,"positiveTestsPeopleAntibody":null,"negativeTestsPeopleAntibody":null,"totalTestsPeopleAntigen":341072,"positiveTestsPeopleAntigen":54964,"totalTestsAntigen":904200,"positiveTestsAntigen":57347,"fips":"49","positiveIncrease":701,"negativeIncrease":3535,"total":1878145,"totalTestResultsIncrease":7462,"posNeg":1878145,"dataQualityGrade":null,"deathIncrease":10,"hospitalizedIncrease":24,"hash":"0d1069eb56d68c9c363d8c9fe91426b4c3caee1d","commercialScore":0,"negativeRegularScore":0,"negativeScore":0,"positiveScore":0,"score":0,"grade":""},{"date":20210220,"state":"UT","positive":366034,"probableCases":null,"negative":1507875,"pending":null,"totalTestResultsSource":"totalTestsViral","totalTestResults":2788882,"hospitalizedCurrently":260,"hospitalizedCumulative":14421,"inIcuCurrently":99,"inIcuCumulative":2269,"onVentilatorCurrently":null,"onVentilatorCumulative":796,"recovered":343202,"lastUpdateEt":"2/20/2021 10:40","dateModified":"2021-02-20T10:40:00Z","checkTimeEt":"02/20 05:40","death":1842,"hospitalized":14421,"hospitalizedDischarged":null,"dateChecked":"2021-02-20T10:40:00Z","totalTestsViral":2788882,"positiveTestsViral":338973,"negativeTestsViral":2449909,"positiveCasesViral":null,"deathConfirmed":null,"deathProbable":null,"totalTestEncountersViral":null,"totalTestsPeopleViral":1818506,"totalTestsAntibody":null,"positiveTestsAntibody":null,"negativeTestsAntibody":null,"totalTestsPeopleAntibody":null,"positiveTestsPeopleAntibody":null,"negativeTestsPeopleAntibody":null,"totalTestsPeopleAntigen":339630,"positiveTestsPeopleAntigen":54796,"totalTestsAntigen":901208,"positiveTestsAntigen":57171,"fips":"49","positiveIncrease":778,"negativeIncrease":3531,"total":1873909,"totalTestResultsIncrease":8812,"posNeg":1873909,"dataQualityGrade":null,"deathIncrease":8,"hospitalizedIncrease":39,"hash":"70f3e22ea3d10f99d5f3c09c55ba95fa1b8aaabb","commercialScore":0,"negativeRegularScore":0,"negativeScore":0,"positiveScore":0,"score":0,"grade":""},{"date":20210219,"state":"UT","positive":365256,"probableCases":null,"negative":1504344,"pending":null,"totalTestResultsSource":"totalTestsViral","totalTestResults":2780070,"hospitalizedCurrently":276,"hospitalizedCumulative":14382,"inIcuCurrently":103,"inIcuCumulative":2265,"onVentilatorCurrently":null,"onVentilatorCumulative":793,"recovered":341731,"lastUpdateEt":"2/19/2021 09:53","dateModified":"2021-02-19T09:53:00Z","checkTimeEt":"02/19 04:53","death":1834,"hospitalized":14382,"hospitalizedDischarged":null,"dateChecked":"2021-02-19T09:53:00Z","totalTestsViral":2780070,"positiveTestsViral":338365,"negativeTestsViral":2441705,"positiveCasesViral":null,"deathConfirmed":null,"deathProbable":null,"totalTestEncountersViral":null,"totalTestsPeopleViral":1814457,"totalTestsAntibody":null,"positiveTestsAntibody":null,"negativeTestsAntibody":null,"totalTestsPeopleAntibody":null,"positiveTestsPeopleAntibody":null,"negativeTestsPeopleAntibody":null,"totalTestsPeopleAntigen":336787,"positiveTestsPeopleAntigen":54511,"totalTestsAntigen":890374,"positiveTestsAntigen":56874,"fips":"49","positiveIncrease":857,"negativeIncrease":3345,"total":1869600,"totalTestResultsIncrease":7950,"posNeg":1869600,"dataQualityGrade":null,"deathIncrease":21,"hospitalizedIncrease":39,"hash":"5ab6c56e6a7ff95af1b81f74055191df7ebaf1b7","commercialScore":0,"negativeRegularScore":0,"negativeScore":0,"positiveScore":0,"score":0,"grade":""},{"date":20210218,"state":"UT","positive":364399,"probableCases":null,"negative":1500999,"pending":null,"totalTestResultsSource":"totalTestsViral","totalTestResults":2772120,"hospitalizedCurrently":291,"hospitalizedCumulative":14343,"inIcuCurrently":105,"inIcuCumulative":2255,"onVentilatorCurrently":null,"onVentilatorCumulative":788,"recovered":340227,"lastUpdateEt":"2/18/2021 10:18","dateModified":"2021-02-18T10:18:00Z","checkTimeEt":"02/18 05:18","death":1813,"hospitalized":14343,"hospitalizedDischarged":null,"dateChecked":"2021-02-18T10:18:00Z","totalTestsViral":2772120,"positiveTestsViral":337751,"negativeTestsViral":2434369,"positiveCasesViral":null,"deathConfirmed":null,"deathProbable":null,"totalTestEncountersViral":null,"totalTestsPeopleViral":1810571,"totalTestsAntibody":null,"positiveTestsAntibody":null,"negativeTestsAntibody":null,"totalTestsPeopleAntibody":null,"positiveTestsPeopleAntibody":null,"negativeTestsPeopleAntibody":null,"totalTestsPeopleAntigen":334138,"positiveTestsPeopleAntigen":54230,"totalTestsAntigen":880328,"positiveTestsAntigen":56587,"fips":"49","positiveIncrease":1151,"negativeIncrease":4502,"total":1865398,"totalTestResultsIncrease":11992,"posNeg":1865398,"dataQualityGrade":null,"deathIncrease":7,"hospitalizedIncrease":49,"hash":"dfcdbe314d6a3e88858c01fe80ff67be155d8b2b","commercialScore":0,"negativeRegularScore":0,"negativeScore":0,"positiveScore":0,"score":0,"grade":""},{"date":20210217,"state":"UT","positive":363248,"probableCases":null,"negative":1496497,"pending":null,"totalTestResultsSource":"totalTestsViral","totalTestResults":2760128,"hospitalizedCurrently":290,"hospitalizedCumulative":14294,"inIcuCurrently":99,"inIcuCumulative":2248,"onVentilatorCurrently":null,"onVentilatorCumulative":784,"recovered":338469,"lastUpdateEt":"2/17/2021 10:11","dateModified":"2021-02-17T10:11:00Z","checkTimeEt":"02/17 05:11","death":1806,"hospitalized":14294,"hospitalizedDischarged":null,"dateChecked":"2021-02-17T10:11:00Z","totalTestsViral":2760128,"positiveTestsViral":336849,"negativeTestsViral":2423279,"positiveCasesViral":null,"deathConfirmed":null,"deathProbable":null,"totalTestEncountersViral":null,"totalTestsPeopleViral":1805277,"totalTestsAntibody":null,"positiveTestsAntibody":null,"negativeTestsAntibody":null,"totalTestsPeopleAntibody":null,"positiveTestsPeopleAntibody":null,"negativeTestsPeopleAntibody":null,"totalTestsPeopleAntigen":331311,"positiveTestsPeopleAntigen":53890,"totalTestsAntigen":871265,"positiveTestsAntigen":56228,"fips":"49","positiveIncrease":901,"negativeIncrease":3812,"total":1859745,"totalTestResultsIncrease":9213,"posNeg":1859745,"dataQualityGrade":null,"deathIncrease":9,"hospitalizedIncrease":55,"hash":"667d9c27b84fcad4ca43c57a63b45e1d0ffacb4d","commercialScore":0,"negativeRegularScore":0,"negativeScore":0,"positiveScore":0,"score":0,"grade":""},{"date":20210216,"state":"UT","positive":362347,"probableCases":null,"negative":1492685,"pending":null,"totalTestResultsSource":"totalTestsViral","totalTestResults":2750915,"hospitalizedCurrently":297,"hospitalizedCumulative":14239,"inIcuCurrently":106,"inIcuCumulative":2231,"onVentilatorCurrently":null,"onVentilatorCumulative":779,"recovered":336460,"lastUpdateEt":"2/16/2021 09:22","dateModified":"2021-02-16T09:22:00Z","checkTimeEt":"02/16 04:22","death":1797,"hospitalized":14239,"hospitalizedDischarged":null,"dateChecked":"2021-02-16T09:22:00Z","totalTestsViral":2750915,"positiveTestsViral":336151,"negativeTestsViral":2414764,"positiveCasesViral":null,"deathConfirmed":null,"deathProbable":null,"totalTestEncountersViral":null,"totalTestsPeopleViral":1800842,"totalTestsAntibody":null,"positiveTestsAntibody":null,"negativeTestsAntibody":null,"totalTestsPeopleAntibody":null,"positiveTestsPeopleAntibody":null,"negativeTestsPeopleAntibody":null,"totalTestsPeopleAntigen":328683,"positiveTestsPeopleAntigen":53598,"totalTestsAntigen":860192,"positiveTestsAntigen":55929,"fips":"49","positiveIncrease":591,"negativeIncrease":2278,"total":1855032,"totalTestResultsIncrease":5681,"posNeg":1855032,"dataQualityGrade":null,"deathIncrease":1,"hospitalizedIncrease":30,"hash":"586ff15f2a55d4a3d03874226355915d29ce11a4","commercialScore":0,"negativeRegularScore":0,"negativeScore":0,"positiveScore":0,"score":0,"grade":""},{"date":20210215,"state":"UT","positive":361756,"probableCases":null,"negative":1490407,"pending":null,"totalTestResultsSource":"totalTestsViral","totalTestResults":2745234,"hospitalizedCurrently":298,"hospitalizedCumulative":14209,"inIcuCurrently":104,"inIcuCumulative":2228,"onVentilatorCurrently":null,"onVentilatorCumulative":778,"recovered":335049,"lastUpdateEt":"2/15/2021 09:56","dateModified":"2021-02-15T09:56:00Z","checkTimeEt":"02/15 04:56","death":1796,"hospitalized":14209,"hospitalizedDischarged":null,"dateChecked":"2021-02-15T09:56:00Z","totalTestsViral":2745234,"positiveTestsViral":335696,"negativeTestsViral":2409538,"positiveCasesViral":null,"deathConfirmed":null,"deathProbable":null,"totalTestEncountersViral":null,"totalTestsPeopleViral":1798157,"totalTestsAntibody":null,"positiveTestsAntibody":null,"negativeTestsAntibody":null,"totalTestsPeopleAntibody":null,"positiveTestsPeopleAntibody":null,"negativeTestsPeopleAntibody":null,"totalTestsPeopleAntigen":327353,"positiveTestsPeopleAntigen":53353,"totalTestsAntigen":855888,"positiveTestsAntigen":55672,"fips":"49","positiveIncrease":462,"negativeIncrease":2588,"total":1852163,"totalTestResultsIncrease":5736,"posNeg":1852163,"dataQualityGrade":null,"deathIncrease":2,"hospitalizedIncrease":20,"hash":"e13116d3ae5ccb96c886992531d80c304352c83f","commercialScore":0,"negativeRegularScore":0,"negativeScore":0,"positiveScore":0,"score":0,"grade":""},{"date":20210214,"state":"UT","positive":361294,"probableCases":null,"negative":1487819,"pending":null,"totalTestResultsSource":"totalTestsViral","totalTestResults":2739498,"hospitalizedCurrently":307,"hospitalizedCumulative":14189,"inIcuCurrently":111,"inIcuCumulative":2227,"onVentilatorCurrently":null,"onVentilatorCumulative":777,"recovered":334201,"lastUpdateEt":"2/14/2021 10:32","dateModified":"2021-02-14T10:32:00Z","checkTimeEt":"02/14 05:32","death":1794,"hospitalized":14189,"hospitalizedDischarged":null,"dateChecked":"2021-02-14T10:32:00Z","totalTestsViral":2739498,"positiveTestsViral":335235,"negativeTestsViral":2404263,"positiveCasesViral":null,"deathConfirmed":null,"deathProbable":null,"totalTestEncountersViral":null,"totalTestsPeopleViral":1795160,"totalTestsAntibody":null,"positiveTestsAntibody":null,"negativeTestsAntibody":null,"totalTestsPeopleAntibody":null,"positiveTestsPeopleAntibody":null,"negativeTestsPeopleAntibody":null,"totalTestsPeopleAntigen":327037,"positiveTestsPeopleAntigen":53295,"totalTestsAntigen":854980,"positiveTestsAntigen":55612,"fips":"49","positiveIncrease":710,"negativeIncrease":2986,"total":1849113,"totalTestResultsIncrease":6690,"posNeg":1849113,"dataQualityGrade":null,"deathIncrease":4,"hospitalizedIncrease":38,"hash":"b6c45281c009cca959472e4de9828b27f652de67","commercialScore":0,"negativeRegularScore":0,"negativeScore":0,"positiveScore":0,"score":0,"grade":""},{"date":20210213,"state":"UT","positive":360584,"probableCases":null,"negative":1484833,"pending":null,"totalTestResultsSource":"totalTestsViral","totalTestResults":2732808,"hospitalizedCurrently":333,"hospitalizedCumulative":14151,"inIcuCurrently":116,"inIcuCumulative":2225,"onVentilatorCurrently":null,"onVentilatorCumulative":776,"recovered":332702,"lastUpdateEt":"2/13/2021 10:22","dateModified":"2021-02-13T10:22:00Z","checkTimeEt":"02/13 05:22","death":1790,"hospitalized":14151,"hospitalizedDischarged":null,"dateChecked":"2021-02-13T10:22:00Z","totalTestsViral":2732808,"positiveTestsViral":334688,"negativeTestsViral":2398120,"positiveCasesViral":null,"deathConfirmed":null,"deathProbable":null,"totalTestEncountersViral":null,"totalTestsPeopleViral":1791707,"totalTestsAntibody":null,"positiveTestsAntibody":null,"negativeTestsAntibody":null,"totalTestsPeopleAntibody":null,"positiveTestsPeopleAntibody":null,"negativeTestsPeopleAntibody":null,"totalTestsPeopleAntigen":325855,"positiveTestsPeopleAntigen":53095,"totalTestsAntigen":851984,"positiveTestsAntigen":55400,"fips":"49","positiveIncrease":943,"negativeIncrease":3591,"total":1845417,"totalTestResultsIncrease":9475,"posNeg":1845417,"dataQualityGrade":null,"deathIncrease":5,"hospitalizedIncrease":48,"hash":"4b22384633f225d24f27f60f0d7468be65f31468","commercialScore":0,"negativeRegularScore":0,"negativeScore":0,"positiveScore":0,"score":0,"grade":""},{"date":20210212,"state":"UT","positive":359641,"probableCases":null,"negative":1481242,"pending":null,"totalTestResultsSource":"totalTestsViral","totalTestResults":2723333,"hospitalizedCurrently":345,"hospitalizedCumulative":14103,"inIcuCurrently":118,"inIcuCumulative":2217,"onVentilatorCurrently":null,"onVentilatorCumulative":770,"recovered":330949,"lastUpdateEt":"2/12/2021 09:56","dateModified":"2021-02-12T09:56:00Z","checkTimeEt":"02/12 04:56","death":1785,"hospitalized":14103,"hospitalizedDischarged":null,"dateChecked":"2021-02-12T09:56:00Z","totalTestsViral":2723333,"positiveTestsViral":333961,"negativeTestsViral":2389372,"positiveCasesViral":null,"deathConfirmed":null,"deathProbable":null,"totalTestEncountersViral":null,"totalTestsPeopleViral":1787484,"totalTestsAntibody":null,"positiveTestsAntibody":null,"negativeTestsAntibody":null,"totalTestsPeopleAntibody":null,"positiveTestsPeopleAntibody":null,"negativeTestsPeopleAntibody":null,"totalTestsPeopleAntigen":323275,"positiveTestsPeopleAntigen":52778,"totalTestsAntigen":843226,"positiveTestsAntigen":55066,"fips":"49","positiveIncrease":1060,"negativeIncrease":4175,"total":1840883,"totalTestResultsIncrease":11135,"posNeg":1840883,"dataQualityGrade":null,"deathIncrease":11,"hospitalizedIncrease":49,"hash":"564b076a717368db9d7b56548eba106c416ba247","commercialScore":0,"negativeRegularScore":0,"negativeScore":0,"positiveScore":0,"score":0,"grade":""},{"date":20210211,"state":"UT","positive":358581,"probableCases":null,"negative":1477067,"pending":null,"totalTestResultsSource":"totalTestsViral","totalTestResults":2712198,"hospitalizedCurrently":363,"hospitalizedCumulative":14054,"inIcuCurrently":128,"inIcuCumulative":2212,"onVentilatorCurrently":null,"onVentilatorCumulative":766,"recovered":328315,"lastUpdateEt":"2/11/2021 10:23","dateModified":"2021-02-11T10:23:00Z","checkTimeEt":"02/11 05:23","death":1774,"hospitalized":14054,"hospitalizedDischarged":null,"dateChecked":"2021-02-11T10:23:00Z","totalTestsViral":2712198,"positiveTestsViral":333108,"negativeTestsViral":2379090,"positiveCasesViral":null,"deathConfirmed":null,"deathProbable":null,"totalTestEncountersViral":null,"totalTestsPeopleViral":1782562,"totalTestsAntibody":null,"positiveTestsAntibody":null,"negativeTestsAntibody":null,"totalTestsPeopleAntibody":null,"positiveTestsPeopleAntibody":null,"negativeTestsPeopleAntibody":null,"totalTestsPeopleAntigen":321054,"positiveTestsPeopleAntigen":52517,"totalTestsAntigen":834266,"positiveTestsAntigen":54791,"fips":"49","positiveIncrease":1242,"negativeIncrease":4998,"total":1835648,"totalTestResultsIncrease":11904,"posNeg":1835648,"dataQualityGrade":null,"deathIncrease":9,"hospitalizedIncrease":47,"hash":"b225ccb6b0a6e3f369cadeeff414e10b44cf5110","commercialScore":0,"negativeRegularScore":0,"negativeScore":0,"positiveScore":0,"score":0,"grade":""},{"date":20210210,"state":"UT","positive":357339,"probableCases":null,"negative":1472069,"pending":null,"totalTestResultsSource":"totalTestsViral","totalTestResults":2700294,"hospitalizedCurrently":365,"hospitalizedCumulative":14007,"inIcuCurrently":131,"inIcuCumulative":2202,"onVentilatorCurrently":null,"onVentilatorCumulative":763,"recovered":326237,"lastUpdateEt":"2/10/2021 10:10","dateModified":"2021-02-10T10:10:00Z","checkTimeEt":"02/10 05:10","death":1765,"hospitalized":14007,"hospitalizedDischarged":null,"dateChecked":"2021-02-10T10:10:00Z","totalTestsViral":2700294,"positiveTestsViral":332097,"negativeTestsViral":2368197,"positiveCasesViral":null,"deathConfirmed":null,"deathProbable":null,"totalTestEncountersViral":null,"totalTestsPeopleViral":1776684,"totalTestsAntibody":null,"positiveTestsAntibody":null,"negativeTestsAntibody":null,"totalTestsPeopleAntibody":null,"positiveTestsPeopleAntibody":null,"negativeTestsPeopleAntibody":null,"totalTestsPeopleAntigen":318125,"positiveTestsPeopleAntigen":52127,"totalTestsAntigen":821952,"positiveTestsAntigen":54383,"fips":"49","positiveIncrease":1299,"negativeIncrease":4527,"total":1829408,"totalTestResultsIncrease":11452,"posNeg":1829408,"dataQualityGrade":null,"deathIncrease":17,"hospitalizedIncrease":57,"hash":"f1575b9d33d7754c1046900280f58f525d5795ad","commercialScore":0,"negativeRegularScore":0,"negativeScore":0,"positiveScore":0,"score":0,"grade":""},{"date":20210209,"state":"UT","positive":356040,"probableCases":null,"negative":1467542,"pending":null,"totalTestResultsSource":"totalTestsViral","totalTestResults":2688842,"hospitalizedCurrently":359,"hospitalizedCumulative":13950,"inIcuCurrently":124,"inIcuCumulative":2194,"onVentilatorCurrently":null,"onVentilatorCumulative":754,"recovered":324102,"lastUpdateEt":"2/9/2021 07:38","dateModified":"2021-02-09T07:38:00Z","checkTimeEt":"02/09 02:38","death":1748,"hospitalized":13950,"hospitalizedDischarged":null,"dateChecked":"2021-02-09T07:38:00Z","totalTestsViral":2688842,"positiveTestsViral":331123,"negativeTestsViral":2357719,"positiveCasesViral":null,"deathConfirmed":null,"deathProbable":null,"totalTestEncountersViral":null,"totalTestsPeopleViral":1771304,"totalTestsAntibody":null,"positiveTestsAntibody":null,"negativeTestsAntibody":null,"totalTestsPeopleAntibody":null,"positiveTestsPeopleAntibody":null,"negativeTestsPeopleAntibody":null,"totalTestsPeopleAntigen":314517,"positiveTestsPeopleAntigen":51649,"totalTestsAntigen":810070,"positiveTestsAntigen":53886,"fips":"49","positiveIncrease":918,"negativeIncrease":2054,"total":1823582,"totalTestResultsIncrease":5426,"posNeg":1823582,"dataQualityGrade":null,"deathIncrease":10,"hospitalizedIncrease":61,"hash":"61f1cfd4362c13b9d35630f89f93b46d92b5c965","commercialScore":0,"negativeRegularScore":0,"negativeScore":0,"positiveScore":0,"score":0,"grade":""},{"date":20210208,"state":"UT","positive":355122,"probableCases":null,"negative":1465488,"pending":null,"totalTestResultsSource":"totalTestsViral","totalTestResults":2683416,"hospitalizedCurrently":353,"hospitalizedCumulative":13889,"inIcuCurrently":112,"inIcuCumulative":2173,"onVentilatorCurrently":null,"onVentilatorCumulative":751,"recovered":322825,"lastUpdateEt":"2/8/2021 10:24","dateModified":"2021-02-08T10:24:00Z","checkTimeEt":"02/08 05:24","death":1738,"hospitalized":13889,"hospitalizedDischarged":null,"dateChecked":"2021-02-08T10:24:00Z","totalTestsViral":2683416,"positiveTestsViral":330568,"negativeTestsViral":2352848,"positiveCasesViral":null,"deathConfirmed":null,"deathProbable":null,"totalTestEncountersViral":null,"totalTestsPeopleViral":1768780,"totalTestsAntibody":null,"positiveTestsAntibody":null,"negativeTestsAntibody":null,"totalTestsPeopleAntibody":null,"positiveTestsPeopleAntibody":null,"negativeTestsPeopleAntibody":null,"totalTestsPeopleAntigen":310908,"positiveTestsPeopleAntigen":51223,"totalTestsAntigen":797087,"positiveTestsAntigen":53450,"fips":"49","positiveIncrease":514,"negativeIncrease":2943,"total":1820610,"totalTestResultsIncrease":6337,"posNeg":1820610,"dataQualityGrade":null,"deathIncrease":2,"hospitalizedIncrease":27,"hash":"9c348807c1f4de896ad1d24eedd4c2cb6f112d7e","commercialScore":0,"negativeRegularScore":0,"negativeScore":0,"positiveScore":0,"score":0,"grade":""},{"date":20210207,"state":"UT","positive":354608,"probableCases":null,"negative":1462545,"pending":null,"totalTestResultsSource":"totalTestsViral","totalTestResults":2677079,"hospitalizedCurrently":391,"hospitalizedCumulative":13862,"inIcuCurrently":120,"inIcuCumulative":2170,"onVentilatorCurrently":null,"onVentilatorCumulative":750,"recovered":321756,"lastUpdateEt":"2/7/2021 11:08","dateModified":"2021-02-07T11:08:00Z","checkTimeEt":"02/07 06:08","death":1736,"hospitalized":13862,"hospitalizedDischarged":null,"dateChecked":"2021-02-07T11:08:00Z","totalTestsViral":2677079,"positiveTestsViral":330053,"negativeTestsViral":2347026,"positiveCasesViral":null,"deathConfirmed":null,"deathProbable":null,"totalTestEncountersViral":null,"totalTestsPeopleViral":1765389,"totalTestsAntibody":null,"positiveTestsAntibody":null,"negativeTestsAntibody":null,"totalTestsPeopleAntibody":null,"positiveTestsPeopleAntibody":null,"negativeTestsPeopleAntibody":null,"totalTestsPeopleAntigen":310646,"positiveTestsPeopleAntigen":51166,"totalTestsAntigen":796208,"positiveTestsAntigen":53389,"fips":"49","positiveIncrease":908,"negativeIncrease":3620,"total":1817153,"totalTestResultsIncrease":8083,"posNeg":1817153,"dataQualityGrade":null,"deathIncrease":3,"hospitalizedIncrease":34,"hash":"04b2f9d9d81cee7e450808ae78b9dd1ea890ad23","commercialScore":0,"negativeRegularScore":0,"negativeScore":0,"positiveScore":0,"score":0,"grade":""},{"date":20210206,"state":"UT","positive":353700,"probableCases":null,"negative":1458925,"pending":null,"totalTestResultsSource":"totalTestsViral","totalTestResults":2668996,"hospitalizedCurrently":419,"hospitalizedCumulative":13828,"inIcuCurrently":123,"inIcuCumulative":2169,"onVentilatorCurrently":null,"onVentilatorCumulative":749,"recovered":320182,"lastUpdateEt":"2/6/2021 10:49","dateModified":"2021-02-06T10:49:00Z","checkTimeEt":"02/06 05:49","death":1733,"hospitalized":13828,"hospitalizedDischarged":null,"dateChecked":"2021-02-06T10:49:00Z","totalTestsViral":2668996,"positiveTestsViral":329346,"negativeTestsViral":2339650,"positiveCasesViral":null,"deathConfirmed":null,"deathProbable":null,"totalTestEncountersViral":null,"totalTestsPeopleViral":1761163,"totalTestsAntibody":null,"positiveTestsAntibody":null,"negativeTestsAntibody":null,"totalTestsPeopleAntibody":null,"positiveTestsPeopleAntibody":null,"negativeTestsPeopleAntibody":null,"totalTestsPeopleAntigen":309027,"positiveTestsPeopleAntigen":50920,"totalTestsAntigen":792696,"positiveTestsAntigen":53132,"fips":"49","positiveIncrease":1211,"negativeIncrease":4274,"total":1812625,"totalTestResultsIncrease":10924,"posNeg":1812625,"dataQualityGrade":null,"deathIncrease":5,"hospitalizedIncrease":73,"hash":"549beefae80a30354fb6fb9b7ee5d19e185cb16d","commercialScore":0,"negativeRegularScore":0,"negativeScore":0,"positiveScore":0,"score":0,"grade":""},{"date":20210205,"state":"UT","positive":352489,"probableCases":null,"negative":1454651,"pending":null,"totalTestResultsSource":"totalTestsViral","totalTestResults":2658072,"hospitalizedCurrently":433,"hospitalizedCumulative":13755,"inIcuCurrently":117,"inIcuCumulative":2162,"onVentilatorCurrently":null,"onVentilatorCumulative":742,"recovered":318034,"lastUpdateEt":"2/5/2021 10:33","dateModified":"2021-02-05T10:33:00Z","checkTimeEt":"02/05 05:33","death":1728,"hospitalized":13755,"hospitalizedDischarged":null,"dateChecked":"2021-02-05T10:33:00Z","totalTestsViral":2658072,"positiveTestsViral":328346,"negativeTestsViral":2329726,"positiveCasesViral":null,"deathConfirmed":null,"deathProbable":null,"totalTestEncountersViral":null,"totalTestsPeopleViral":1756019,"totalTestsAntibody":null,"positiveTestsAntibody":null,"negativeTestsAntibody":null,"totalTestsPeopleAntibody":null,"positiveTestsPeopleAntibody":null,"negativeTestsPeopleAntibody":null,"totalTestsPeopleAntigen":305907,"positiveTestsPeopleAntigen":50560,"totalTestsAntigen":780098,"positiveTestsAntigen":52754,"fips":"49","positiveIncrease":1216,"negativeIncrease":4057,"total":1807140,"totalTestResultsIncrease":11328,"posNeg":1807140,"dataQualityGrade":null,"deathIncrease":17,"hospitalizedIncrease":58,"hash":"3f2d22b292e9a73013b15b8796e8fe1a31743935","commercialScore":0,"negativeRegularScore":0,"negativeScore":0,"positiveScore":0,"score":0,"grade":""},{"date":20210204,"state":"UT","positive":351273,"probableCases":null,"negative":1450594,"pending":null,"totalTestResultsSource":"totalTestsViral","totalTestResults":2646744,"hospitalizedCurrently":449,"hospitalizedCumulative":13697,"inIcuCurrently":125,"inIcuCumulative":2158,"onVentilatorCurrently":null,"onVentilatorCumulative":742,"recovered":315614,"lastUpdateEt":"2/4/2021 11:02","dateModified":"2021-02-04T11:02:00Z","checkTimeEt":"02/04 06:02","death":1711,"hospitalized":13697,"hospitalizedDischarged":null,"dateChecked":"2021-02-04T11:02:00Z","totalTestsViral":2646744,"positiveTestsViral":327393,"negativeTestsViral":2319351,"positiveCasesViral":null,"deathConfirmed":null,"deathProbable":null,"totalTestEncountersViral":null,"totalTestsPeopleViral":1751100,"totalTestsAntibody":null,"positiveTestsAntibody":null,"negativeTestsAntibody":null,"totalTestsPeopleAntibody":null,"positiveTestsPeopleAntibody":null,"negativeTestsPeopleAntibody":null,"totalTestsPeopleAntigen":303130,"positiveTestsPeopleAntigen":50209,"totalTestsAntigen":770263,"positiveTestsAntigen":52386,"fips":"49","positiveIncrease":1273,"negativeIncrease":4397,"total":1801867,"totalTestResultsIncrease":10759,"posNeg":1801867,"dataQualityGrade":null,"deathIncrease":14,"hospitalizedIncrease":49,"hash":"7f0e51b944bf5a4a6691ce1791ea2fef85a12e7c","commercialScore":0,"negativeRegularScore":0,"negativeScore":0,"positiveScore":0,"score":0,"grade":""},{"date":20210203,"state":"UT","positive":350000,"probableCases":null,"negative":1446197,"pending":null,"totalTestResultsSource":"totalTestsViral","totalTestResults":2635985,"hospitalizedCurrently":413,"hospitalizedCumulative":13648,"inIcuCurrently":119,"inIcuCumulative":2146,"onVentilatorCurrently":null,"onVentilatorCumulative":736,"recovered":312872,"lastUpdateEt":"2/3/2021 10:03","dateModified":"2021-02-03T10:03:00Z","checkTimeEt":"02/03 05:03","death":1697,"hospitalized":13648,"hospitalizedDischarged":null,"dateChecked":"2021-02-03T10:03:00Z","totalTestsViral":2635985,"positiveTestsViral":326398,"negativeTestsViral":2309587,"positiveCasesViral":null,"deathConfirmed":null,"deathProbable":null,"totalTestEncountersViral":null,"totalTestsPeopleViral":1745845,"totalTestsAntibody":null,"positiveTestsAntibody":null,"negativeTestsAntibody":null,"totalTestsPeopleAntibody":null,"positiveTestsPeopleAntibody":null,"negativeTestsPeopleAntibody":null,"totalTestsPeopleAntigen":298966,"positiveTestsPeopleAntigen":49806,"totalTestsAntigen":757818,"positiveTestsAntigen":51959,"fips":"49","positiveIncrease":1591,"negativeIncrease":4767,"total":1796197,"totalTestResultsIncrease":12545,"posNeg":1796197,"dataQualityGrade":null,"deathIncrease":12,"hospitalizedIncrease":72,"hash":"07c484b679e47d3d143f727c0221685a924774e1","commercialScore":0,"negativeRegularScore":0,"negativeScore":0,"positiveScore":0,"score":0,"grade":""},{"date":20210202,"state":"UT","positive":348409,"probableCases":null,"negative":1441430,"pending":null,"totalTestResultsSource":"totalTestsViral","totalTestResults":2623440,"hospitalizedCurrently":485,"hospitalizedCumulative":13576,"inIcuCurrently":130,"inIcuCumulative":2136,"onVentilatorCurrently":null,"onVentilatorCumulative":734,"recovered":309977,"lastUpdateEt":"2/2/2021 09:30","dateModified":"2021-02-02T09:30:00Z","checkTimeEt":"02/02 04:30","death":1685,"hospitalized":13576,"hospitalizedDischarged":null,"dateChecked":"2021-02-02T09:30:00Z","totalTestsViral":2623440,"positiveTestsViral":325159,"negativeTestsViral":2298281,"positiveCasesViral":null,"deathConfirmed":null,"deathProbable":null,"totalTestEncountersViral":null,"totalTestsPeopleViral":1739975,"totalTestsAntibody":null,"positiveTestsAntibody":null,"negativeTestsAntibody":null,"totalTestsPeopleAntibody":null,"positiveTestsPeopleAntibody":null,"negativeTestsPeopleAntibody":null,"totalTestsPeopleAntigen":295687,"positiveTestsPeopleAntigen":49315,"totalTestsAntigen":746132,"positiveTestsAntigen":51451,"fips":"49","positiveIncrease":1201,"negativeIncrease":3224,"total":1789839,"totalTestResultsIncrease":9622,"posNeg":1789839,"dataQualityGrade":null,"deathIncrease":17,"hospitalizedIncrease":61,"hash":"09930ec0b3c235b1ea2a4b3c7dea32d7a5fa71c4","commercialScore":0,"negativeRegularScore":0,"negativeScore":0,"positiveScore":0,"score":0,"grade":""},{"date":20210201,"state":"UT","positive":347208,"probableCases":null,"negative":1438206,"pending":null,"totalTestResultsSource":"totalTestsViral","totalTestResults":2613818,"hospitalizedCurrently":488,"hospitalizedCumulative":13515,"inIcuCurrently":129,"inIcuCumulative":2115,"onVentilatorCurrently":null,"onVentilatorCumulative":731,"recovered":307848,"lastUpdateEt":"2/1/2021 10:43","dateModified":"2021-02-01T10:43:00Z","checkTimeEt":"02/01 05:43","death":1668,"hospitalized":13515,"hospitalizedDischarged":null,"dateChecked":"2021-02-01T10:43:00Z","totalTestsViral":2613818,"positiveTestsViral":324317,"negativeTestsViral":2289501,"positiveCasesViral":null,"deathConfirmed":null,"deathProbable":null,"totalTestEncountersViral":null,"totalTestsPeopleViral":1736035,"totalTestsAntibody":null,"positiveTestsAntibody":null,"negativeTestsAntibody":null,"totalTestsPeopleAntibody":null,"positiveTestsPeopleAntibody":null,"negativeTestsPeopleAntibody":null,"totalTestsPeopleAntigen":292128,"positiveTestsPeopleAntigen":48785,"totalTestsAntigen":733183,"positiveTestsAntigen":50888,"fips":"49","positiveIncrease":584,"negativeIncrease":2738,"total":1785414,"totalTestResultsIncrease":6460,"posNeg":1785414,"dataQualityGrade":null,"deathIncrease":3,"hospitalizedIncrease":47,"hash":"4d05395dde6f5e95081d3cea9a4d47bea2fea107","commercialScore":0,"negativeRegularScore":0,"negativeScore":0,"positiveScore":0,"score":0,"grade":""},{"date":20210131,"state":"UT","positive":346624,"probableCases":null,"negative":1435468,"pending":null,"totalTestResultsSource":"totalTestsViral","totalTestResults":2607358,"hospitalizedCurrently":519,"hospitalizedCumulative":13468,"inIcuCurrently":131,"inIcuCumulative":2114,"onVentilatorCurrently":null,"onVentilatorCumulative":731,"recovered":306385,"lastUpdateEt":"1/31/2021 09:16","dateModified":"2021-01-31T09:16:00Z","checkTimeEt":"01/31 04:16","death":1665,"hospitalized":13468,"hospitalizedDischarged":null,"dateChecked":"2021-01-31T09:16:00Z","totalTestsViral":2607358,"positiveTestsViral":323674,"negativeTestsViral":2283684,"positiveCasesViral":null,"deathConfirmed":null,"deathProbable":null,"totalTestEncountersViral":null,"totalTestsPeopleViral":1732726,"totalTestsAntibody":null,"positiveTestsAntibody":null,"negativeTestsAntibody":null,"totalTestsPeopleAntibody":null,"positiveTestsPeopleAntibody":null,"negativeTestsPeopleAntibody":null,"totalTestsPeopleAntigen":291921,"positiveTestsPeopleAntigen":48735,"totalTestsAntigen":732319,"positiveTestsAntigen":50836,"fips":"49","positiveIncrease":1194,"negativeIncrease":3953,"total":1782092,"totalTestResultsIncrease":8955,"posNeg":1782092,"dataQualityGrade":null,"deathIncrease":2,"hospitalizedIncrease":41,"hash":"2e03dbd93915afe17ee0dde58158d18a30a032d5","commercialScore":0,"negativeRegularScore":0,"negativeScore":0,"positiveScore":0,"score":0,"grade":""},{"date":20210130,"state":"UT","positive":345430,"probableCases":null,"negative":1431515,"pending":null,"totalTestResultsSource":"totalTestsViral","totalTestResults":2598403,"hospitalizedCurrently":522,"hospitalizedCumulative":13427,"inIcuCurrently":139,"inIcuCumulative":2113,"onVentilatorCurrently":null,"onVentilatorCumulative":731,"recovered":304074,"lastUpdateEt":"1/30/2021 08:29","dateModified":"2021-01-30T08:29:00Z","checkTimeEt":"01/30 03:29","death":1663,"hospitalized":13427,"hospitalizedDischarged":null,"dateChecked":"2021-01-30T08:29:00Z","totalTestsViral":2598403,"positiveTestsViral":322722,"negativeTestsViral":2275681,"positiveCasesViral":null,"deathConfirmed":null,"deathProbable":null,"totalTestEncountersViral":null,"totalTestsPeopleViral":1727999,"totalTestsAntibody":null,"positiveTestsAntibody":null,"negativeTestsAntibody":null,"totalTestsPeopleAntibody":null,"positiveTestsPeopleAntibody":null,"negativeTestsPeopleAntibody":null,"totalTestsPeopleAntigen":290176,"positiveTestsPeopleAntigen":48395,"totalTestsAntigen":728412,"positiveTestsAntigen":50479,"fips":"49","positiveIncrease":1468,"negativeIncrease":4642,"total":1776945,"totalTestResultsIncrease":12012,"posNeg":1776945,"dataQualityGrade":null,"deathIncrease":8,"hospitalizedIncrease":74,"hash":"59c3b80bccfdfb80c75360313c6beca375b0cc4b","commercialScore":0,"negativeRegularScore":0,"negativeScore":0,"positiveScore":0,"score":0,"grade":""},{"date":20210129,"state":"UT","positive":343962,"probableCases":null,"negative":1426873,"pending":null,"totalTestResultsSource":"totalTestsViral","totalTestResults":2586391,"hospitalizedCurrently":533,"hospitalizedCumulative":13353,"inIcuCurrently":148,"inIcuCumulative":2103,"onVentilatorCurrently":null,"onVentilatorCumulative":727,"recovered":301462,"lastUpdateEt":"1/29/2021 09:09","dateModified":"2021-01-29T09:09:00Z","checkTimeEt":"01/29 04:09","death":1655,"hospitalized":13353,"hospitalizedDischarged":null,"dateChecked":"2021-01-29T09:09:00Z","totalTestsViral":2586391,"positiveTestsViral":321527,"negativeTestsViral":2264864,"positiveCasesViral":null,"deathConfirmed":null,"deathProbable":null,"totalTestEncountersViral":null,"totalTestsPeopleViral":1722308,"totalTestsAntibody":null,"positiveTestsAntibody":null,"negativeTestsAntibody":null,"totalTestsPeopleAntibody":null,"positiveTestsPeopleAntibody":null,"negativeTestsPeopleAntibody":null,"totalTestsPeopleAntigen":287099,"positiveTestsPeopleAntigen":47918,"totalTestsAntigen":717995,"positiveTestsAntigen":49984,"fips":"49","positiveIncrease":1517,"negativeIncrease":4886,"total":1770835,"totalTestResultsIncrease":12480,"posNeg":1770835,"dataQualityGrade":null,"deathIncrease":35,"hospitalizedIncrease":74,"hash":"dadb38bc7ff0884127263945eb4d0a46f6070950","commercialScore":0,"negativeRegularScore":0,"negativeScore":0,"positiveScore":0,"score":0,"grade":""},{"date":20210128,"state":"UT","positive":342445,"probableCases":null,"negative":1421987,"pending":null,"totalTestResultsSource":"totalTestsViral","totalTestResults":2573911,"hospitalizedCurrently":536,"hospitalizedCumulative":13279,"inIcuCurrently":157,"inIcuCumulative":2092,"onVentilatorCurrently":null,"onVentilatorCumulative":725,"recovered":297638,"lastUpdateEt":"1/28/2021 10:14","dateModified":"2021-01-28T10:14:00Z","checkTimeEt":"01/28 05:14","death":1620,"hospitalized":13279,"hospitalizedDischarged":null,"dateChecked":"2021-01-28T10:14:00Z","totalTestsViral":2573911,"positiveTestsViral":320323,"negativeTestsViral":2253588,"positiveCasesViral":null,"deathConfirmed":null,"deathProbable":null,"totalTestEncountersViral":null,"totalTestsPeopleViral":1716405,"totalTestsAntibody":null,"positiveTestsAntibody":null,"negativeTestsAntibody":null,"totalTestsPeopleAntibody":null,"positiveTestsPeopleAntibody":null,"negativeTestsPeopleAntibody":null,"totalTestsPeopleAntigen":283618,"positiveTestsPeopleAntigen":47491,"totalTestsAntigen":708021,"positiveTestsAntigen":49531,"fips":"49","positiveIncrease":1761,"negativeIncrease":5188,"total":1764432,"totalTestResultsIncrease":16033,"posNeg":1764432,"dataQualityGrade":null,"deathIncrease":0,"hospitalizedIncrease":62,"hash":"3a8d33d10666e8ffd1e7641b0801207c8d5203d4","commercialScore":0,"negativeRegularScore":0,"negativeScore":0,"positiveScore":0,"score":0,"grade":""},{"date":20210127,"state":"UT","positive":340684,"probableCases":null,"negative":1416799,"pending":null,"totalTestResultsSource":"totalTestsViral","totalTestResults":2557878,"hospitalizedCurrently":537,"hospitalizedCumulative":13217,"inIcuCurrently":161,"inIcuCumulative":2082,"onVentilatorCurrently":null,"onVentilatorCumulative":719,"recovered":293030,"lastUpdateEt":"1/27/2021 10:09","dateModified":"2021-01-27T10:09:00Z","checkTimeEt":"01/27 05:09","death":1620,"hospitalized":13217,"hospitalizedDischarged":null,"dateChecked":"2021-01-27T10:09:00Z","totalTestsViral":2557878,"positiveTestsViral":318759,"negativeTestsViral":2239119,"positiveCasesViral":null,"deathConfirmed":null,"deathProbable":null,"totalTestEncountersViral":null,"totalTestsPeopleViral":1709903,"totalTestsAntibody":null,"positiveTestsAntibody":null,"negativeTestsAntibody":null,"totalTestsPeopleAntibody":null,"positiveTestsPeopleAntibody":null,"negativeTestsPeopleAntibody":null,"totalTestsPeopleAntigen":279203,"positiveTestsPeopleAntigen":46996,"totalTestsAntigen":693217,"positiveTestsAntigen":49010,"fips":"49","positiveIncrease":2009,"negativeIncrease":4603,"total":1757483,"totalTestResultsIncrease":12865,"posNeg":1757483,"dataQualityGrade":null,"deathIncrease":7,"hospitalizedIncrease":80,"hash":"775645e0f46546a75b863319b7ae0ade5f98bff8","commercialScore":0,"negativeRegularScore":0,"negativeScore":0,"positiveScore":0,"score":0,"grade":""},{"date":20210126,"state":"UT","positive":338675,"probableCases":null,"negative":1412196,"pending":null,"totalTestResultsSource":"totalTestsViral","totalTestResults":2545013,"hospitalizedCurrently":540,"hospitalizedCumulative":13137,"inIcuCurrently":158,"inIcuCumulative":2074,"onVentilatorCurrently":null,"onVentilatorCumulative":716,"recovered":289231,"lastUpdateEt":"1/26/2021 11:33","dateModified":"2021-01-26T11:33:00Z","checkTimeEt":"01/26 06:33","death":1613,"hospitalized":13137,"hospitalizedDischarged":null,"dateChecked":"2021-01-26T11:33:00Z","totalTestsViral":2545013,"positiveTestsViral":317211,"negativeTestsViral":2227802,"positiveCasesViral":null,"deathConfirmed":null,"deathProbable":null,"totalTestEncountersViral":null,"totalTestsPeopleViral":1703950,"totalTestsAntibody":null,"positiveTestsAntibody":null,"negativeTestsAntibody":null,"totalTestsPeopleAntibody":null,"positiveTestsPeopleAntibody":null,"negativeTestsPeopleAntibody":null,"totalTestsPeopleAntigen":275000,"positiveTestsPeopleAntigen":46462,"totalTestsAntigen":680933,"positiveTestsAntigen":48458,"fips":"49","positiveIncrease":1411,"negativeIncrease":3212,"total":1750871,"totalTestResultsIncrease":8707,"posNeg":1750871,"dataQualityGrade":null,"deathIncrease":16,"hospitalizedIncrease":83,"hash":"e8916e039827944a6f5125ed62c079b3e0b98b85","commercialScore":0,"negativeRegularScore":0,"negativeScore":0,"positiveScore":0,"score":0,"grade":""},{"date":20210125,"state":"UT","positive":337264,"probableCases":null,"negative":1408984,"pending":null,"totalTestResultsSource":"totalTestsViral","totalTestResults":2536306,"hospitalizedCurrently":528,"hospitalizedCumulative":13054,"inIcuCurrently":179,"inIcuCumulative":2054,"onVentilatorCurrently":null,"onVentilatorCumulative":709,"recovered":285852,"lastUpdateEt":"1/25/2021 10:52","dateModified":"2021-01-25T10:52:00Z","checkTimeEt":"01/25 05:52","death":1597,"hospitalized":13054,"hospitalizedDischarged":null,"dateChecked":"2021-01-25T10:52:00Z","totalTestsViral":2536306,"positiveTestsViral":316360,"negativeTestsViral":2219946,"positiveCasesViral":null,"deathConfirmed":null,"deathProbable":null,"totalTestEncountersViral":null,"totalTestsPeopleViral":1699988,"totalTestsAntibody":null,"positiveTestsAntibody":null,"negativeTestsAntibody":null,"totalTestsPeopleAntibody":null,"positiveTestsPeopleAntibody":null,"negativeTestsPeopleAntibody":null,"totalTestsPeopleAntigen":269671,"positiveTestsPeopleAntigen":45731,"totalTestsAntigen":666441,"positiveTestsAntigen":47698,"fips":"49","positiveIncrease":859,"negativeIncrease":2796,"total":1746248,"totalTestResultsIncrease":6510,"posNeg":1746248,"dataQualityGrade":null,"deathIncrease":2,"hospitalizedIncrease":38,"hash":"06f46114b5848078e86f5a28e3a0a1b739029e31","commercialScore":0,"negativeRegularScore":0,"negativeScore":0,"positiveScore":0,"score":0,"grade":""},{"date":20210124,"state":"UT","positive":336405,"probableCases":null,"negative":1406188,"pending":null,"totalTestResultsSource":"totalTestsViral","totalTestResults":2529796,"hospitalizedCurrently":523,"hospitalizedCumulative":13016,"inIcuCurrently":182,"inIcuCumulative":2054,"onVentilatorCurrently":null,"onVentilatorCumulative":708,"recovered":283690,"lastUpdateEt":"1/24/2021 10:58","dateModified":"2021-01-24T10:58:00Z","checkTimeEt":"01/24 05:58","death":1595,"hospitalized":13016,"hospitalizedDischarged":null,"dateChecked":"2021-01-24T10:58:00Z","totalTestsViral":2529796,"positiveTestsViral":315569,"negativeTestsViral":2214227,"positiveCasesViral":null,"deathConfirmed":null,"deathProbable":null,"totalTestEncountersViral":null,"totalTestsPeopleViral":1696488,"totalTestsAntibody":null,"positiveTestsAntibody":null,"negativeTestsAntibody":null,"totalTestsPeopleAntibody":null,"positiveTestsPeopleAntibody":null,"negativeTestsPeopleAntibody":null,"totalTestsPeopleAntigen":268997,"positiveTestsPeopleAntigen":45568,"totalTestsAntigen":664408,"positiveTestsAntigen":47527,"fips":"49","positiveIncrease":1516,"negativeIncrease":4554,"total":1742593,"totalTestResultsIncrease":10827,"posNeg":1742593,"dataQualityGrade":null,"deathIncrease":13,"hospitalizedIncrease":68,"hash":"c016d53dc8aeb506a21163f7ad6b1c95fd75bfb5","commercialScore":0,"negativeRegularScore":0,"negativeScore":0,"positiveScore":0,"score":0,"grade":""},{"date":20210123,"state":"UT","positive":334889,"probableCases":null,"negative":1401634,"pending":null,"totalTestResultsSource":"totalTestsViral","totalTestResults":2518969,"hospitalizedCurrently":548,"hospitalizedCumulative":12948,"inIcuCurrently":196,"inIcuCumulative":2052,"onVentilatorCurrently":null,"onVentilatorCumulative":707,"recovered":281854,"lastUpdateEt":"1/23/2021 10:49","dateModified":"2021-01-23T10:49:00Z","checkTimeEt":"01/23 05:49","death":1582,"hospitalized":12948,"hospitalizedDischarged":null,"dateChecked":"2021-01-23T10:49:00Z","totalTestsViral":2518969,"positiveTestsViral":314279,"negativeTestsViral":2204690,"positiveCasesViral":null,"deathConfirmed":null,"deathProbable":null,"totalTestEncountersViral":null,"totalTestsPeopleViral":1690825,"totalTestsAntibody":null,"positiveTestsAntibody":null,"negativeTestsAntibody":null,"totalTestsPeopleAntibody":null,"positiveTestsPeopleAntibody":null,"negativeTestsPeopleAntibody":null,"totalTestsPeopleAntigen":267329,"positiveTestsPeopleAntigen":45209,"totalTestsAntigen":660660,"positiveTestsAntigen":47153,"fips":"49","positiveIncrease":1771,"negativeIncrease":2526,"total":1736523,"totalTestResultsIncrease":8415,"posNeg":1736523,"dataQualityGrade":null,"deathIncrease":11,"hospitalizedIncrease":64,"hash":"7a49db1018b17dabfa99a0ea25fcf4450fa7e078","commercialScore":0,"negativeRegularScore":0,"negativeScore":0,"positiveScore":0,"score":0,"grade":""},{"date":20210122,"state":"UT","positive":333118,"probableCases":null,"negative":1399108,"pending":null,"totalTestResultsSource":"totalTestsViral","totalTestResults":2510554,"hospitalizedCurrently":549,"hospitalizedCumulative":12884,"inIcuCurrently":192,"inIcuCumulative":2044,"onVentilatorCurrently":null,"onVentilatorCumulative":698,"recovered":279908,"lastUpdateEt":"1/22/2021 09:02","dateModified":"2021-01-22T09:02:00Z","checkTimeEt":"01/22 04:02","death":1571,"hospitalized":12884,"hospitalizedDischarged":null,"dateChecked":"2021-01-22T09:02:00Z","totalTestsViral":2510554,"positiveTestsViral":312953,"negativeTestsViral":2197601,"positiveCasesViral":null,"deathConfirmed":null,"deathProbable":null,"totalTestEncountersViral":null,"totalTestsPeopleViral":1687143,"totalTestsAntibody":null,"positiveTestsAntibody":null,"negativeTestsAntibody":null,"totalTestsPeopleAntibody":null,"positiveTestsPeopleAntibody":null,"negativeTestsPeopleAntibody":null,"totalTestsPeopleAntigen":261010,"positiveTestsPeopleAntigen":44503,"totalTestsAntigen":644117,"positiveTestsAntigen":46402,"fips":"49","positiveIncrease":2649,"negativeIncrease":3949,"total":1732226,"totalTestResultsIncrease":12392,"posNeg":1732226,"dataQualityGrade":null,"deathIncrease":24,"hospitalizedIncrease":81,"hash":"78acd02c30b9adc0f63e58e046d2449607febfed","commercialScore":0,"negativeRegularScore":0,"negativeScore":0,"positiveScore":0,"score":0,"grade":""},{"date":20210121,"state":"UT","positive":330469,"probableCases":null,"negative":1395159,"pending":null,"totalTestResultsSource":"totalTestsViral","totalTestResults":2498162,"hospitalizedCurrently":590,"hospitalizedCumulative":12803,"inIcuCurrently":209,"inIcuCumulative":2028,"onVentilatorCurrently":null,"onVentilatorCumulative":694,"recovered":276793,"lastUpdateEt":"1/21/2021 10:26","dateModified":"2021-01-21T10:26:00Z","checkTimeEt":"01/21 05:26","death":1547,"hospitalized":12803,"hospitalizedDischarged":null,"dateChecked":"2021-01-21T10:26:00Z","totalTestsViral":2498162,"positiveTestsViral":311235,"negativeTestsViral":2186927,"positiveCasesViral":null,"deathConfirmed":null,"deathProbable":null,"totalTestEncountersViral":null,"totalTestsPeopleViral":1681691,"totalTestsAntibody":null,"positiveTestsAntibody":null,"negativeTestsAntibody":null,"totalTestsPeopleAntibody":null,"positiveTestsPeopleAntibody":null,"negativeTestsPeopleAntibody":null,"totalTestsPeopleAntigen":253888,"positiveTestsPeopleAntigen":43418,"totalTestsAntigen":628565,"positiveTestsAntigen":45275,"fips":"49","positiveIncrease":2089,"negativeIncrease":4443,"total":1725628,"totalTestResultsIncrease":12686,"posNeg":1725628,"dataQualityGrade":null,"deathIncrease":30,"hospitalizedIncrease":74,"hash":"5c0c4c096a4c81a2bef3f05c2295f02de740af14","commercialScore":0,"negativeRegularScore":0,"negativeScore":0,"positiveScore":0,"score":0,"grade":""},{"date":20210120,"state":"UT","positive":328380,"probableCases":null,"negative":1390716,"pending":null,"totalTestResultsSource":"totalTestsViral","totalTestResults":2485476,"hospitalizedCurrently":604,"hospitalizedCumulative":12729,"inIcuCurrently":210,"inIcuCumulative":2023,"onVentilatorCurrently":null,"onVentilatorCumulative":687,"recovered":272113,"lastUpdateEt":"1/20/2021 10:06","dateModified":"2021-01-20T10:06:00Z","checkTimeEt":"01/20 05:06","death":1517,"hospitalized":12729,"hospitalizedDischarged":null,"dateChecked":"2021-01-20T10:06:00Z","totalTestsViral":2485476,"positiveTestsViral":309614,"negativeTestsViral":2175862,"positiveCasesViral":null,"deathConfirmed":null,"deathProbable":null,"totalTestEncountersViral":null,"totalTestsPeopleViral":1675795,"totalTestsAntibody":null,"positiveTestsAntibody":null,"negativeTestsAntibody":null,"totalTestsPeopleAntibody":null,"positiveTestsPeopleAntibody":null,"negativeTestsPeopleAntibody":null,"totalTestsPeopleAntigen":246991,"positiveTestsPeopleAntigen":42831,"totalTestsAntigen":610661,"positiveTestsAntigen":44661,"fips":"49","positiveIncrease":2159,"negativeIncrease":4820,"total":1719096,"totalTestResultsIncrease":12579,"posNeg":1719096,"dataQualityGrade":null,"deathIncrease":10,"hospitalizedIncrease":84,"hash":"da9b1ebecaa7d992c4227a4adbe7bac8d378e02f","commercialScore":0,"negativeRegularScore":0,"negativeScore":0,"positiveScore":0,"score":0,"grade":""},{"date":20210119,"state":"UT","positive":326221,"probableCases":null,"negative":1385896,"pending":null,"totalTestResultsSource":"totalTestsViral","totalTestResults":2472897,"hospitalizedCurrently":638,"hospitalizedCumulative":12645,"inIcuCurrently":216,"inIcuCumulative":1994,"onVentilatorCurrently":null,"onVentilatorCumulative":681,"recovered":269487,"lastUpdateEt":"1/19/2021 09:55","dateModified":"2021-01-19T09:55:00Z","checkTimeEt":"01/19 04:55","death":1507,"hospitalized":12645,"hospitalizedDischarged":null,"dateChecked":"2021-01-19T09:55:00Z","totalTestsViral":2472897,"positiveTestsViral":307786,"negativeTestsViral":2165111,"positiveCasesViral":null,"deathConfirmed":null,"deathProbable":null,"totalTestEncountersViral":null,"totalTestsPeopleViral":1669320,"totalTestsAntibody":null,"positiveTestsAntibody":null,"negativeTestsAntibody":null,"totalTestsPeopleAntibody":null,"positiveTestsPeopleAntibody":null,"negativeTestsPeopleAntibody":null,"totalTestsPeopleAntigen":242550,"positiveTestsPeopleAntigen":42336,"totalTestsAntigen":596393,"positiveTestsAntigen":44139,"fips":"49","positiveIncrease":1302,"negativeIncrease":2760,"total":1712117,"totalTestResultsIncrease":7224,"posNeg":1712117,"dataQualityGrade":null,"deathIncrease":7,"hospitalizedIncrease":69,"hash":"c4e353a904e4bb014f1155a257dd31d5bd87d31f","commercialScore":0,"negativeRegularScore":0,"negativeScore":0,"positiveScore":0,"score":0,"grade":""},{"date":20210118,"state":"UT","positive":324919,"probableCases":null,"negative":1383136,"pending":null,"totalTestResultsSource":"totalTestsViral","totalTestResults":2465673,"hospitalizedCurrently":619,"hospitalizedCumulative":12576,"inIcuCurrently":214,"inIcuCumulative":1980,"onVentilatorCurrently":null,"onVentilatorCumulative":679,"recovered":266752,"lastUpdateEt":"1/18/2021 11:10","dateModified":"2021-01-18T11:10:00Z","checkTimeEt":"01/18 06:10","death":1500,"hospitalized":12576,"hospitalizedDischarged":null,"dateChecked":"2021-01-18T11:10:00Z","totalTestsViral":2465673,"positiveTestsViral":306661,"negativeTestsViral":2159012,"positiveCasesViral":null,"deathConfirmed":null,"deathProbable":null,"totalTestEncountersViral":null,"totalTestsPeopleViral":1665558,"totalTestsAntibody":null,"positiveTestsAntibody":null,"negativeTestsAntibody":null,"totalTestsPeopleAntibody":null,"positiveTestsPeopleAntibody":null,"negativeTestsPeopleAntibody":null,"totalTestsPeopleAntigen":241351,"positiveTestsPeopleAntigen":42015,"totalTestsAntigen":591764,"positiveTestsAntigen":43808,"fips":"49","positiveIncrease":1082,"negativeIncrease":2855,"total":1708055,"totalTestResultsIncrease":6940,"posNeg":1708055,"dataQualityGrade":null,"deathIncrease":7,"hospitalizedIncrease":58,"hash":"9093e6ad4ef94d10feb5b8fd54d244547bf3936f","commercialScore":0,"negativeRegularScore":0,"negativeScore":0,"positiveScore":0,"score":0,"grade":""},{"date":20210117,"state":"UT","positive":323837,"probableCases":null,"negative":1380281,"pending":null,"totalTestResultsSource":"totalTestsViral","totalTestResults":2458733,"hospitalizedCurrently":594,"hospitalizedCumulative":12518,"inIcuCurrently":226,"inIcuCumulative":1980,"onVentilatorCurrently":null,"onVentilatorCumulative":679,"recovered":265051,"lastUpdateEt":"1/17/2021 11:21","dateModified":"2021-01-17T11:21:00Z","checkTimeEt":"01/17 06:21","death":1493,"hospitalized":12518,"hospitalizedDischarged":null,"dateChecked":"2021-01-17T11:21:00Z","totalTestsViral":2458733,"positiveTestsViral":305744,"negativeTestsViral":2152989,"positiveCasesViral":null,"deathConfirmed":null,"deathProbable":null,"totalTestEncountersViral":null,"totalTestsPeopleViral":1661906,"totalTestsAntibody":null,"positiveTestsAntibody":null,"negativeTestsAntibody":null,"totalTestsPeopleAntibody":null,"positiveTestsPeopleAntibody":null,"negativeTestsPeopleAntibody":null,"totalTestsPeopleAntigen":240354,"positiveTestsPeopleAntigen":41752,"totalTestsAntigen":589651,"positiveTestsAntigen":43529,"fips":"49","positiveIncrease":1585,"negativeIncrease":3836,"total":1704118,"totalTestResultsIncrease":9859,"posNeg":1704118,"dataQualityGrade":null,"deathIncrease":8,"hospitalizedIncrease":66,"hash":"b6afeb036e7ed316c5bf106d145adf353a876cfc","commercialScore":0,"negativeRegularScore":0,"negativeScore":0,"positiveScore":0,"score":0,"grade":""},{"date":20210116,"state":"UT","positive":322252,"probableCases":null,"negative":1376445,"pending":null,"totalTestResultsSource":"totalTestsViral","totalTestResults":2448874,"hospitalizedCurrently":627,"hospitalizedCumulative":12452,"inIcuCurrently":231,"inIcuCumulative":1979,"onVentilatorCurrently":null,"onVentilatorCumulative":678,"recovered":264246,"lastUpdateEt":"1/16/2021 11:10","dateModified":"2021-01-16T11:10:00Z","checkTimeEt":"01/16 06:10","death":1485,"hospitalized":12452,"hospitalizedDischarged":null,"dateChecked":"2021-01-16T11:10:00Z","totalTestsViral":2448874,"positiveTestsViral":304248,"negativeTestsViral":2144626,"positiveCasesViral":null,"deathConfirmed":null,"deathProbable":null,"totalTestEncountersViral":null,"totalTestsPeopleViral":1656763,"totalTestsAntibody":null,"positiveTestsAntibody":null,"negativeTestsAntibody":null,"totalTestsPeopleAntibody":null,"positiveTestsPeopleAntibody":null,"negativeTestsPeopleAntibody":null,"totalTestsPeopleAntigen":238298,"positiveTestsPeopleAntigen":41470,"totalTestsAntigen":584783,"positiveTestsAntigen":43229,"fips":"49","positiveIncrease":2150,"negativeIncrease":4289,"total":1698697,"totalTestResultsIncrease":12569,"posNeg":1698697,"dataQualityGrade":null,"deathIncrease":13,"hospitalizedIncrease":101,"hash":"ff12631d976820d4373823e106a32621b4b46468","commercialScore":0,"negativeRegularScore":0,"negativeScore":0,"positiveScore":0,"score":0,"grade":""},{"date":20210115,"state":"UT","positive":320102,"probableCases":null,"negative":1372156,"pending":null,"totalTestResultsSource":"totalTestsViral","totalTestResults":2436305,"hospitalizedCurrently":635,"hospitalizedCumulative":12351,"inIcuCurrently":210,"inIcuCumulative":1967,"onVentilatorCurrently":null,"onVentilatorCumulative":677,"recovered":263256,"lastUpdateEt":"1/15/2021 09:57","dateModified":"2021-01-15T09:57:00Z","checkTimeEt":"01/15 04:57","death":1472,"hospitalized":12351,"hospitalizedDischarged":null,"dateChecked":"2021-01-15T09:57:00Z","totalTestsViral":2436305,"positiveTestsViral":302396,"negativeTestsViral":2133909,"positiveCasesViral":null,"deathConfirmed":null,"deathProbable":null,"totalTestEncountersViral":null,"totalTestsPeopleViral":1650854,"totalTestsAntibody":null,"positiveTestsAntibody":null,"negativeTestsAntibody":null,"totalTestsPeopleAntibody":null,"positiveTestsPeopleAntibody":null,"negativeTestsPeopleAntibody":null,"totalTestsPeopleAntigen":233747,"positiveTestsPeopleAntigen":41028,"totalTestsAntigen":571424,"positiveTestsAntigen":42752,"fips":"49","positiveIncrease":2543,"negativeIncrease":5377,"total":1692258,"totalTestResultsIncrease":14503,"posNeg":1692258,"dataQualityGrade":null,"deathIncrease":12,"hospitalizedIncrease":102,"hash":"8e77f4d8f5e867395b409ddd5fee0bb623c647ea","commercialScore":0,"negativeRegularScore":0,"negativeScore":0,"positiveScore":0,"score":0,"grade":""},{"date":20210114,"state":"UT","positive":317559,"probableCases":null,"negative":1366779,"pending":null,"totalTestResultsSource":"totalTestsViral","totalTestResults":2421802,"hospitalizedCurrently":614,"hospitalizedCumulative":12249,"inIcuCurrently":194,"inIcuCumulative":1957,"onVentilatorCurrently":null,"onVentilatorCumulative":675,"recovered":260728,"lastUpdateEt":"1/14/2021 10:58","dateModified":"2021-01-14T10:58:00Z","checkTimeEt":"01/14 05:58","death":1460,"hospitalized":12249,"hospitalizedDischarged":null,"dateChecked":"2021-01-14T10:58:00Z","totalTestsViral":2421802,"positiveTestsViral":300381,"negativeTestsViral":2121421,"positiveCasesViral":null,"deathConfirmed":null,"deathProbable":null,"totalTestEncountersViral":null,"totalTestsPeopleViral":1643713,"totalTestsAntibody":null,"positiveTestsAntibody":null,"negativeTestsAntibody":null,"totalTestsPeopleAntibody":null,"positiveTestsPeopleAntibody":null,"negativeTestsPeopleAntibody":null,"totalTestsPeopleAntigen":227903,"positiveTestsPeopleAntigen":40351,"totalTestsAntigen":559136,"positiveTestsAntigen":42040,"fips":"49","positiveIncrease":2742,"negativeIncrease":5274,"total":1684338,"totalTestResultsIncrease":14810,"posNeg":1684338,"dataQualityGrade":null,"deathIncrease":11,"hospitalizedIncrease":89,"hash":"e7d8256b698c11d29c5bae69b85507ed30316dd3","commercialScore":0,"negativeRegularScore":0,"negativeScore":0,"positiveScore":0,"score":0,"grade":""},{"date":20210113,"state":"UT","positive":314817,"probableCases":null,"negative":1361505,"pending":null,"totalTestResultsSource":"totalTestsViral","totalTestResults":2406992,"hospitalizedCurrently":612,"hospitalizedCumulative":12160,"inIcuCurrently":194,"inIcuCumulative":1945,"onVentilatorCurrently":null,"onVentilatorCumulative":673,"recovered":257824,"lastUpdateEt":"1/13/2021 10:34","dateModified":"2021-01-13T10:34:00Z","checkTimeEt":"01/13 05:34","death":1449,"hospitalized":12160,"hospitalizedDischarged":null,"dateChecked":"2021-01-13T10:34:00Z","totalTestsViral":2406992,"positiveTestsViral":298324,"negativeTestsViral":2108668,"positiveCasesViral":null,"deathConfirmed":null,"deathProbable":null,"totalTestEncountersViral":null,"totalTestsPeopleViral":1636641,"totalTestsAntibody":null,"positiveTestsAntibody":null,"negativeTestsAntibody":null,"totalTestsPeopleAntibody":null,"positiveTestsPeopleAntibody":null,"negativeTestsPeopleAntibody":null,"totalTestsPeopleAntigen":218744,"positiveTestsPeopleAntigen":39404,"totalTestsAntigen":538572,"positiveTestsAntigen":41058,"fips":"49","positiveIncrease":5188,"negativeIncrease":4704,"total":1676322,"totalTestResultsIncrease":12444,"posNeg":1676322,"dataQualityGrade":null,"deathIncrease":27,"hospitalizedIncrease":101,"hash":"afcac10b7f9bc15ea3acd5aff5b40ac5da80b6e4","commercialScore":0,"negativeRegularScore":0,"negativeScore":0,"positiveScore":0,"score":0,"grade":""},{"date":20210112,"state":"UT","positive":309629,"probableCases":null,"negative":1356801,"pending":null,"totalTestResultsSource":"totalTestsViral","totalTestResults":2394548,"hospitalizedCurrently":605,"hospitalizedCumulative":12059,"inIcuCurrently":187,"inIcuCumulative":1933,"onVentilatorCurrently":null,"onVentilatorCumulative":668,"recovered":253415,"lastUpdateEt":"1/12/2021 11:36","dateModified":"2021-01-12T11:36:00Z","checkTimeEt":"01/12 06:36","death":1422,"hospitalized":12059,"hospitalizedDischarged":null,"dateChecked":"2021-01-12T11:36:00Z","totalTestsViral":2394548,"positiveTestsViral":296407,"negativeTestsViral":2098141,"positiveCasesViral":null,"deathConfirmed":null,"deathProbable":null,"totalTestEncountersViral":null,"totalTestsPeopleViral":1630279,"totalTestsAntibody":null,"positiveTestsAntibody":null,"negativeTestsAntibody":null,"totalTestsPeopleAntibody":null,"positiveTestsPeopleAntibody":null,"negativeTestsPeopleAntibody":null,"totalTestsPeopleAntigen":212834,"positiveTestsPeopleAntigen":38501,"totalTestsAntigen":527054,"positiveTestsAntigen":40124,"fips":"49","positiveIncrease":2146,"negativeIncrease":4785,"total":1666430,"totalTestResultsIncrease":12698,"posNeg":1666430,"dataQualityGrade":null,"deathIncrease":26,"hospitalizedIncrease":119,"hash":"ec23431821592188905885d755e60c663083509c","commercialScore":0,"negativeRegularScore":0,"negativeScore":0,"positiveScore":0,"score":0,"grade":""},{"date":20210111,"state":"UT","positive":307483,"probableCases":null,"negative":1352016,"pending":null,"totalTestResultsSource":"totalTestsViral","totalTestResults":2381850,"hospitalizedCurrently":595,"hospitalizedCumulative":11940,"inIcuCurrently":194,"inIcuCumulative":1909,"onVentilatorCurrently":null,"onVentilatorCumulative":664,"recovered":251170,"lastUpdateEt":"1/11/2021 10:49","dateModified":"2021-01-11T10:49:00Z","checkTimeEt":"01/11 05:49","death":1396,"hospitalized":11940,"hospitalizedDischarged":null,"dateChecked":"2021-01-11T10:49:00Z","totalTestsViral":2381850,"positiveTestsViral":294508,"negativeTestsViral":2087342,"positiveCasesViral":null,"deathConfirmed":null,"deathProbable":null,"totalTestEncountersViral":null,"totalTestsPeopleViral":1623779,"totalTestsAntibody":null,"positiveTestsAntibody":null,"negativeTestsAntibody":null,"totalTestsPeopleAntibody":null,"positiveTestsPeopleAntibody":null,"negativeTestsPeopleAntibody":null,"totalTestsPeopleAntigen":207343,"positiveTestsPeopleAntigen":37694,"totalTestsAntigen":513177,"positiveTestsAntigen":39280,"fips":"49","positiveIncrease":1484,"negativeIncrease":3089,"total":1659499,"totalTestResultsIncrease":7852,"posNeg":1659499,"dataQualityGrade":null,"deathIncrease":4,"hospitalizedIncrease":74,"hash":"dc60b1f475f73b7668ae5e1743e5d07f4bb31cab","commercialScore":0,"negativeRegularScore":0,"negativeScore":0,"positiveScore":0,"score":0,"grade":""},{"date":20210110,"state":"UT","positive":305999,"probableCases":null,"negative":1348927,"pending":null,"totalTestResultsSource":"totalTestsViral","totalTestResults":2373998,"hospitalizedCurrently":588,"hospitalizedCumulative":11866,"inIcuCurrently":189,"inIcuCumulative":1902,"onVentilatorCurrently":null,"onVentilatorCumulative":663,"recovered":249390,"lastUpdateEt":"1/10/2021 10:20","dateModified":"2021-01-10T10:20:00Z","checkTimeEt":"01/10 05:20","death":1392,"hospitalized":11866,"hospitalizedDischarged":null,"dateChecked":"2021-01-10T10:20:00Z","totalTestsViral":2373998,"positiveTestsViral":293261,"negativeTestsViral":2080737,"positiveCasesViral":null,"deathConfirmed":null,"deathProbable":null,"totalTestEncountersViral":null,"totalTestsPeopleViral":1619623,"totalTestsAntibody":null,"positiveTestsAntibody":null,"negativeTestsAntibody":null,"totalTestsPeopleAntibody":null,"positiveTestsPeopleAntibody":null,"negativeTestsPeopleAntibody":null,"totalTestsPeopleAntigen":206762,"positiveTestsPeopleAntigen":37479,"totalTestsAntigen":511430,"positiveTestsAntigen":39058,"fips":"49","positiveIncrease":2276,"negativeIncrease":5080,"total":1654926,"totalTestResultsIncrease":11978,"posNeg":1654926,"dataQualityGrade":null,"deathIncrease":2,"hospitalizedIncrease":88,"hash":"51ab7b4b534bd4b8884040b94c499533c1110e3b","commercialScore":0,"negativeRegularScore":0,"negativeScore":0,"positiveScore":0,"score":0,"grade":""},{"date":20210109,"state":"UT","positive":303723,"probableCases":null,"negative":1343847,"pending":null,"totalTestResultsSource":"totalTestsViral","totalTestResults":2362020,"hospitalizedCurrently":592,"hospitalizedCumulative":11778,"inIcuCurrently":181,"inIcuCumulative":1897,"onVentilatorCurrently":null,"onVentilatorCumulative":660,"recovered":247390,"lastUpdateEt":"1/9/2021 10:48","dateModified":"2021-01-09T10:48:00Z","checkTimeEt":"01/09 05:48","death":1390,"hospitalized":11778,"hospitalizedDischarged":null,"dateChecked":"2021-01-09T10:48:00Z","totalTestsViral":2362020,"positiveTestsViral":291253,"negativeTestsViral":2070767,"positiveCasesViral":null,"deathConfirmed":null,"deathProbable":null,"totalTestEncountersViral":null,"totalTestsPeopleViral":1612742,"totalTestsAntibody":null,"positiveTestsAntibody":null,"negativeTestsAntibody":null,"totalTestsPeopleAntibody":null,"positiveTestsPeopleAntibody":null,"negativeTestsPeopleAntibody":null,"totalTestsPeopleAntigen":203587,"positiveTestsPeopleAntigen":37009,"totalTestsAntigen":505422,"positiveTestsAntigen":38567,"fips":"49","positiveIncrease":2613,"negativeIncrease":4665,"total":1647570,"totalTestResultsIncrease":12654,"posNeg":1647570,"dataQualityGrade":null,"deathIncrease":9,"hospitalizedIncrease":99,"hash":"fbfc966a03f6f82207454918a584640c09ec0843","commercialScore":0,"negativeRegularScore":0,"negativeScore":0,"positiveScore":0,"score":0,"grade":""},{"date":20210108,"state":"UT","positive":301110,"probableCases":null,"negative":1339182,"pending":null,"totalTestResultsSource":"totalTestsViral","totalTestResults":2349366,"hospitalizedCurrently":610,"hospitalizedCumulative":11679,"inIcuCurrently":196,"inIcuCumulative":1889,"onVentilatorCurrently":null,"onVentilatorCumulative":657,"recovered":244990,"lastUpdateEt":"1/8/2021 10:19","dateModified":"2021-01-08T10:19:00Z","checkTimeEt":"01/08 05:19","death":1381,"hospitalized":11679,"hospitalizedDischarged":null,"dateChecked":"2021-01-08T10:19:00Z","totalTestsViral":2349366,"positiveTestsViral":289077,"negativeTestsViral":2060289,"positiveCasesViral":null,"deathConfirmed":null,"deathProbable":null,"totalTestEncountersViral":null,"totalTestsPeopleViral":1606141,"totalTestsAntibody":null,"positiveTestsAntibody":null,"negativeTestsAntibody":null,"totalTestsPeopleAntibody":null,"positiveTestsPeopleAntibody":null,"negativeTestsPeopleAntibody":null,"totalTestsPeopleAntigen":197084,"positiveTestsPeopleAntigen":36256,"totalTestsAntigen":489562,"positiveTestsAntigen":37782,"fips":"49","positiveIncrease":3793,"negativeIncrease":6083,"total":1640292,"totalTestResultsIncrease":16979,"posNeg":1640292,"dataQualityGrade":null,"deathIncrease":22,"hospitalizedIncrease":101,"hash":"355cc53c1c17430ade929d5956c6df996085dee6","commercialScore":0,"negativeRegularScore":0,"negativeScore":0,"positiveScore":0,"score":0,"grade":""},{"date":20210107,"state":"UT","positive":297317,"probableCases":null,"negative":1333099,"pending":null,"totalTestResultsSource":"totalTestsViral","totalTestResults":2332387,"hospitalizedCurrently":594,"hospitalizedCumulative":11578,"inIcuCurrently":187,"inIcuCumulative":1880,"onVentilatorCurrently":null,"onVentilatorCumulative":654,"recovered":242361,"lastUpdateEt":"1/7/2021 09:56","dateModified":"2021-01-07T09:56:00Z","checkTimeEt":"01/07 04:56","death":1359,"hospitalized":11578,"hospitalizedDischarged":null,"dateChecked":"2021-01-07T09:56:00Z","totalTestsViral":2332387,"positiveTestsViral":285798,"negativeTestsViral":2046589,"positiveCasesViral":null,"deathConfirmed":null,"deathProbable":null,"totalTestEncountersViral":null,"totalTestsPeopleViral":1597087,"totalTestsAntibody":null,"positiveTestsAntibody":null,"negativeTestsAntibody":null,"totalTestsPeopleAntibody":null,"positiveTestsPeopleAntibody":null,"negativeTestsPeopleAntibody":null,"totalTestsPeopleAntigen":193102,"positiveTestsPeopleAntigen":35532,"totalTestsAntigen":480288,"positiveTestsAntigen":37038,"fips":"49","positiveIncrease":4597,"negativeIncrease":6890,"total":1630416,"totalTestResultsIncrease":20004,"posNeg":1630416,"dataQualityGrade":null,"deathIncrease":29,"hospitalizedIncrease":115,"hash":"ee663b4b2d573854396df999ed8e203f5fca7b43","commercialScore":0,"negativeRegularScore":0,"negativeScore":0,"positiveScore":0,"score":0,"grade":""},{"date":20210106,"state":"UT","positive":292720,"probableCases":null,"negative":1326209,"pending":null,"totalTestResultsSource":"totalTestsViral","totalTestResults":2312383,"hospitalizedCurrently":589,"hospitalizedCumulative":11463,"inIcuCurrently":192,"inIcuCumulative":1866,"onVentilatorCurrently":null,"onVentilatorCumulative":651,"recovered":239203,"lastUpdateEt":"1/6/2021 09:40","dateModified":"2021-01-06T09:40:00Z","checkTimeEt":"01/06 04:40","death":1330,"hospitalized":11463,"hospitalizedDischarged":null,"dateChecked":"2021-01-06T09:40:00Z","totalTestsViral":2312383,"positiveTestsViral":281936,"negativeTestsViral":2030447,"positiveCasesViral":null,"deathConfirmed":null,"deathProbable":null,"totalTestEncountersViral":null,"totalTestsPeopleViral":1586582,"totalTestsAntibody":null,"positiveTestsAntibody":null,"negativeTestsAntibody":null,"totalTestsPeopleAntibody":null,"positiveTestsPeopleAntibody":null,"negativeTestsPeopleAntibody":null,"totalTestsPeopleAntigen":188053,"positiveTestsPeopleAntigen":34606,"totalTestsAntigen":465950,"positiveTestsAntigen":36049,"fips":"49","positiveIncrease":3769,"negativeIncrease":5654,"total":1618929,"totalTestResultsIncrease":16987,"posNeg":1618929,"dataQualityGrade":null,"deathIncrease":18,"hospitalizedIncrease":107,"hash":"6cd071cd51e71885d866da831c4dfa2e2bc0afe6","commercialScore":0,"negativeRegularScore":0,"negativeScore":0,"positiveScore":0,"score":0,"grade":""},{"date":20210105,"state":"UT","positive":288951,"probableCases":null,"negative":1320555,"pending":null,"totalTestResultsSource":"totalTestsViral","totalTestResults":2295396,"hospitalizedCurrently":578,"hospitalizedCumulative":11356,"inIcuCurrently":177,"inIcuCumulative":1859,"onVentilatorCurrently":null,"onVentilatorCumulative":650,"recovered":236196,"lastUpdateEt":"1/5/2021 11:03","dateModified":"2021-01-05T11:03:00Z","checkTimeEt":"01/05 06:03","death":1312,"hospitalized":11356,"hospitalizedDischarged":null,"dateChecked":"2021-01-05T11:03:00Z","totalTestsViral":2295396,"positiveTestsViral":278646,"negativeTestsViral":2016750,"positiveCasesViral":null,"deathConfirmed":null,"deathProbable":null,"totalTestEncountersViral":null,"totalTestsPeopleViral":1577868,"totalTestsAntibody":null,"positiveTestsAntibody":null,"negativeTestsAntibody":null,"totalTestsPeopleAntibody":null,"positiveTestsPeopleAntibody":null,"negativeTestsPeopleAntibody":null,"totalTestsPeopleAntigen":184310,"positiveTestsPeopleAntigen":33769,"totalTestsAntigen":454560,"positiveTestsAntigen":35188,"fips":"49","positiveIncrease":3318,"negativeIncrease":3579,"total":1609506,"totalTestResultsIncrease":10709,"posNeg":1609506,"dataQualityGrade":null,"deathIncrease":7,"hospitalizedIncrease":116,"hash":"7cd3c0606d5309d0de3e247f3db6a197266f4854","commercialScore":0,"negativeRegularScore":0,"negativeScore":0,"positiveScore":0,"score":0,"grade":""},{"date":20210104,"state":"UT","positive":285633,"probableCases":null,"negative":1316976,"pending":null,"totalTestResultsSource":"totalTestsViral","totalTestResults":2284687,"hospitalizedCurrently":551,"hospitalizedCumulative":11240,"inIcuCurrently":167,"inIcuCumulative":1837,"onVentilatorCurrently":null,"onVentilatorCumulative":647,"recovered":234298,"lastUpdateEt":"1/4/2021 10:34","dateModified":"2021-01-04T10:34:00Z","checkTimeEt":"01/04 05:34","death":1305,"hospitalized":11240,"hospitalizedDischarged":null,"dateChecked":"2021-01-04T10:34:00Z","totalTestsViral":2284687,"positiveTestsViral":276257,"negativeTestsViral":2008430,"positiveCasesViral":null,"deathConfirmed":null,"deathProbable":null,"totalTestEncountersViral":null,"totalTestsPeopleViral":1572029,"totalTestsAntibody":null,"positiveTestsAntibody":null,"negativeTestsAntibody":null,"totalTestsPeopleAntibody":null,"positiveTestsPeopleAntibody":null,"negativeTestsPeopleAntibody":null,"totalTestsPeopleAntigen":180295,"positiveTestsPeopleAntigen":32643,"totalTestsAntigen":441464,"positiveTestsAntigen":34033,"fips":"49","positiveIncrease":2160,"negativeIncrease":3667,"total":1602609,"totalTestResultsIncrease":9849,"posNeg":1602609,"dataQualityGrade":null,"deathIncrease":4,"hospitalizedIncrease":81,"hash":"be5392bbeee7ccc572b67292082d6757f486f925","commercialScore":0,"negativeRegularScore":0,"negativeScore":0,"positiveScore":0,"score":0,"grade":""},{"date":20210103,"state":"UT","positive":283473,"probableCases":null,"negative":1313309,"pending":null,"totalTestResultsSource":"totalTestsViral","totalTestResults":2274838,"hospitalizedCurrently":548,"hospitalizedCumulative":11159,"inIcuCurrently":164,"inIcuCumulative":1830,"onVentilatorCurrently":null,"onVentilatorCumulative":643,"recovered":232355,"lastUpdateEt":"1/3/2021 09:23","dateModified":"2021-01-03T09:23:00Z","checkTimeEt":"01/03 04:23","death":1301,"hospitalized":11159,"hospitalizedDischarged":null,"dateChecked":"2021-01-03T09:23:00Z","totalTestsViral":2274838,"positiveTestsViral":274104,"negativeTestsViral":2000734,"positiveCasesViral":null,"deathConfirmed":null,"deathProbable":null,"totalTestEncountersViral":null,"totalTestsPeopleViral":1566342,"totalTestsAntibody":null,"positiveTestsAntibody":null,"negativeTestsAntibody":null,"totalTestsPeopleAntibody":null,"positiveTestsPeopleAntibody":null,"negativeTestsPeopleAntibody":null,"totalTestsPeopleAntigen":179363,"positiveTestsPeopleAntigen":32296,"totalTestsAntigen":439364,"positiveTestsAntigen":33680,"fips":"49","positiveIncrease":1819,"negativeIncrease":2359,"total":1596782,"totalTestResultsIncrease":6651,"posNeg":1596782,"dataQualityGrade":null,"deathIncrease":7,"hospitalizedIncrease":58,"hash":"77e8499397d84bdf89c6daf076f0db83cd5aba47","commercialScore":0,"negativeRegularScore":0,"negativeScore":0,"positiveScore":0,"score":0,"grade":""},{"date":20210102,"state":"UT","positive":281654,"probableCases":null,"negative":1310950,"pending":null,"totalTestResultsSource":"totalTestsViral","totalTestResults":2268187,"hospitalizedCurrently":552,"hospitalizedCumulative":11101,"inIcuCurrently":158,"inIcuCumulative":1828,"onVentilatorCurrently":null,"onVentilatorCumulative":643,"recovered":230287,"lastUpdateEt":"1/2/2021 10:47","dateModified":"2021-01-02T10:47:00Z","checkTimeEt":"01/02 05:47","death":1294,"hospitalized":11101,"hospitalizedDischarged":null,"dateChecked":"2021-01-02T10:47:00Z","totalTestsViral":2268187,"positiveTestsViral":272594,"negativeTestsViral":1995593,"positiveCasesViral":null,"deathConfirmed":null,"deathProbable":null,"totalTestEncountersViral":null,"totalTestsPeopleViral":1562560,"totalTestsAntibody":null,"positiveTestsAntibody":null,"negativeTestsAntibody":null,"totalTestsPeopleAntibody":null,"positiveTestsPeopleAntibody":null,"negativeTestsPeopleAntibody":null,"totalTestsPeopleAntigen":178343,"positiveTestsPeopleAntigen":31944,"totalTestsAntigen":436906,"positiveTestsAntigen":33317,"fips":"49","positiveIncrease":5042,"negativeIncrease":8459,"total":1592604,"totalTestResultsIncrease":22884,"posNeg":1592604,"dataQualityGrade":null,"deathIncrease":25,"hospitalizedIncrease":145,"hash":"de7907faa00cc8eaccd75c62439145534e18a513","commercialScore":0,"negativeRegularScore":0,"negativeScore":0,"positiveScore":0,"score":0,"grade":""},{"date":20210101,"state":"UT","positive":276612,"probableCases":null,"negative":1302491,"pending":null,"totalTestResultsSource":"totalTestsViral","totalTestResults":2245303,"hospitalizedCurrently":565,"hospitalizedCumulative":10956,"inIcuCurrently":158,"inIcuCumulative":1824,"onVentilatorCurrently":null,"onVentilatorCumulative":641,"recovered":224439,"lastUpdateEt":"12/31/2020 09:56","dateModified":"2020-12-31T09:56:00Z","checkTimeEt":"12/31 04:56","death":1269,"hospitalized":10956,"hospitalizedDischarged":null,"dateChecked":"2020-12-31T09:56:00Z","totalTestsViral":2245303,"positiveTestsViral":267800,"negativeTestsViral":1977503,"positiveCasesViral":null,"deathConfirmed":null,"deathProbable":null,"totalTestEncountersViral":null,"totalTestsPeopleViral":1549731,"totalTestsAntibody":null,"positiveTestsAntibody":null,"negativeTestsAntibody":null,"totalTestsPeopleAntibody":null,"positiveTestsPeopleAntibody":null,"negativeTestsPeopleAntibody":null,"totalTestsPeopleAntigen":176272,"positiveTestsPeopleAntigen":31285,"totalTestsAntigen":428308,"positiveTestsAntigen":32636,"fips":"49","positiveIncrease":0,"negativeIncrease":0,"total":1579103,"totalTestResultsIncrease":0,"posNeg":1579103,"dataQualityGrade":null,"deathIncrease":0,"hospitalizedIncrease":0,"hash":"bd3a53eca4b9fbaa97a1be7f170d13d23ece6b20","commercialScore":0,"negativeRegularScore":0,"negativeScore":0,"positiveScore":0,"score":0,"grade":""},{"date":20201231,"state":"UT","positive":276612,"probableCases":null,"negative":1302491,"pending":null,"totalTestResultsSource":"totalTestsViral","totalTestResults":2245303,"hospitalizedCurrently":565,"hospitalizedCumulative":10956,"inIcuCurrently":158,"inIcuCumulative":1824,"onVentilatorCurrently":null,"onVentilatorCumulative":641,"recovered":224439,"lastUpdateEt":"12/31/2020 09:56","dateModified":"2020-12-31T09:56:00Z","checkTimeEt":"12/31 04:56","death":1269,"hospitalized":10956,"hospitalizedDischarged":null,"dateChecked":"2020-12-31T09:56:00Z","totalTestsViral":2245303,"positiveTestsViral":267800,"negativeTestsViral":1977503,"positiveCasesViral":null,"deathConfirmed":null,"deathProbable":null,"totalTestEncountersViral":null,"totalTestsPeopleViral":1549731,"totalTestsAntibody":null,"positiveTestsAntibody":null,"negativeTestsAntibody":null,"totalTestsPeopleAntibody":null,"positiveTestsPeopleAntibody":null,"negativeTestsPeopleAntibody":null,"totalTestsPeopleAntigen":176272,"positiveTestsPeopleAntigen":31285,"totalTestsAntigen":428308,"positiveTestsAntigen":32636,"fips":"49","positiveIncrease":4672,"negativeIncrease":5624,"total":1579103,"totalTestResultsIncrease":17418,"posNeg":1579103,"dataQualityGrade":null,"deathIncrease":13,"hospitalizedIncrease":83,"hash":"32c1130f95125629b78c21d586129ad18f456284","commercialScore":0,"negativeRegularScore":0,"negativeScore":0,"positiveScore":0,"score":0,"grade":""},{"date":20201230,"state":"UT","positive":271940,"probableCases":null,"negative":1296867,"pending":null,"totalTestResultsSource":"totalTestsViral","totalTestResults":2227885,"hospitalizedCurrently":537,"hospitalizedCumulative":10873,"inIcuCurrently":156,"inIcuCumulative":1813,"onVentilatorCurrently":null,"onVentilatorCumulative":633,"recovered":221055,"lastUpdateEt":"12/29/2020 11:42","dateModified":"2020-12-29T11:42:00Z","checkTimeEt":"12/29 06:42","death":1256,"hospitalized":10873,"hospitalizedDischarged":null,"dateChecked":"2020-12-29T11:42:00Z","totalTestsViral":2227885,"positiveTestsViral":263878,"negativeTestsViral":1964007,"positiveCasesViral":null,"deathConfirmed":null,"deathProbable":null,"totalTestEncountersViral":null,"totalTestsPeopleViral":1540411,"totalTestsAntibody":null,"positiveTestsAntibody":null,"negativeTestsAntibody":null,"totalTestsPeopleAntibody":null,"positiveTestsPeopleAntibody":null,"negativeTestsPeopleAntibody":null,"totalTestsPeopleAntigen":174180,"positiveTestsPeopleAntigen":30583,"totalTestsAntigen":421857,"positiveTestsAntigen":31909,"fips":"49","positiveIncrease":2614,"negativeIncrease":4593,"total":1568807,"totalTestResultsIncrease":13816,"posNeg":1568807,"dataQualityGrade":null,"deathIncrease":21,"hospitalizedIncrease":110,"hash":"c619f37bd42842e01f82589b0bea4befbf614f05","commercialScore":0,"negativeRegularScore":0,"negativeScore":0,"positiveScore":0,"score":0,"grade":""},{"date":20201229,"state":"UT","positive":269326,"probableCases":null,"negative":1292274,"pending":null,"totalTestResultsSource":"totalTestsViral","totalTestResults":2214069,"hospitalizedCurrently":548,"hospitalizedCumulative":10763,"inIcuCurrently":164,"inIcuCumulative":1806,"onVentilatorCurrently":null,"onVentilatorCumulative":631,"recovered":218522,"lastUpdateEt":"12/29/2020 11:42","dateModified":"2020-12-29T11:42:00Z","checkTimeEt":"12/29 06:42","death":1235,"hospitalized":10763,"hospitalizedDischarged":null,"dateChecked":"2020-12-29T11:42:00Z","totalTestsViral":2214069,"positiveTestsViral":261358,"negativeTestsViral":1952711,"positiveCasesViral":null,"deathConfirmed":null,"deathProbable":null,"totalTestEncountersViral":null,"totalTestsPeopleViral":1533487,"totalTestsAntibody":null,"positiveTestsAntibody":null,"negativeTestsAntibody":null,"totalTestsPeopleAntibody":null,"positiveTestsPeopleAntibody":null,"negativeTestsPeopleAntibody":null,"totalTestsPeopleAntigen":171965,"positiveTestsPeopleAntigen":29797,"totalTestsAntigen":413901,"positiveTestsAntigen":31086,"fips":"49","positiveIncrease":2736,"negativeIncrease":3104,"total":1561600,"totalTestResultsIncrease":10464,"posNeg":1561600,"dataQualityGrade":null,"deathIncrease":16,"hospitalizedIncrease":120,"hash":"561ff16e50f17cfe86e9fb41a30438aa664bc1ce","commercialScore":0,"negativeRegularScore":0,"negativeScore":0,"positiveScore":0,"score":0,"grade":""},{"date":20201228,"state":"UT","positive":266590,"probableCases":null,"negative":1289170,"pending":null,"totalTestResultsSource":"totalTestsViral","totalTestResults":2203605,"hospitalizedCurrently":532,"hospitalizedCumulative":10643,"inIcuCurrently":168,"inIcuCumulative":1784,"onVentilatorCurrently":null,"onVentilatorCumulative":625,"recovered":216242,"lastUpdateEt":"12/28/2020 09:48","dateModified":"2020-12-28T09:48:00Z","checkTimeEt":"12/28 04:48","death":1219,"hospitalized":10643,"hospitalizedDischarged":null,"dateChecked":"2020-12-28T09:48:00Z","totalTestsViral":2203605,"positiveTestsViral":259264,"negativeTestsViral":1944341,"positiveCasesViral":null,"deathConfirmed":null,"deathProbable":null,"totalTestEncountersViral":null,"totalTestsPeopleViral":1528455,"totalTestsAntibody":null,"positiveTestsAntibody":null,"negativeTestsAntibody":null,"totalTestsPeopleAntibody":null,"positiveTestsPeopleAntibody":null,"negativeTestsPeopleAntibody":null,"totalTestsPeopleAntigen":169650,"positiveTestsPeopleAntigen":29033,"totalTestsAntigen":406081,"positiveTestsAntigen":30293,"fips":"49","positiveIncrease":1716,"negativeIncrease":2948,"total":1555760,"totalTestResultsIncrease":7720,"posNeg":1555760,"dataQualityGrade":null,"deathIncrease":5,"hospitalizedIncrease":59,"hash":"f57c393f6026141ca123af4786a8df3d4a630de6","commercialScore":0,"negativeRegularScore":0,"negativeScore":0,"positiveScore":0,"score":0,"grade":""},{"date":20201227,"state":"UT","positive":264874,"probableCases":null,"negative":1286222,"pending":null,"totalTestResultsSource":"totalTestsViral","totalTestResults":2195885,"hospitalizedCurrently":517,"hospitalizedCumulative":10584,"inIcuCurr