[{"date":20210307,"state":"AK","positive":56886,"probableCases":null,"negative":null,"pending":null,"totalTestResultsSource":"totalTestsViral","totalTestResults":1731628,"hospitalizedCurrently":33,"hospitalizedCumulative":1293,"inIcuCurrently":null,"inIcuCumulative":null,"onVentilatorCurrently":2,"onVentilatorCumulative":null,"recovered":null,"lastUpdateEt":"3/5/2021 03:59","dateModified":"2021-03-05T03:59:00Z","checkTimeEt":"03/04 22:59","death":305,"hospitalized":1293,"hospitalizedDischarged":null,"dateChecked":"2021-03-05T03:59:00Z","totalTestsViral":1731628,"positiveTestsViral":68693,"negativeTestsViral":1660758,"positiveCasesViral":null,"deathConfirmed":null,"deathProbable":null,"totalTestEncountersViral":null,"totalTestsPeopleViral":null,"totalTestsAntibody":null,"positiveTestsAntibody":null,"negativeTestsAntibody":null,"totalTestsPeopleAntibody":null,"positiveTestsPeopleAntibody":null,"negativeTestsPeopleAntibody":null,"totalTestsPeopleAntigen":null,"positiveTestsPeopleAntigen":null,"totalTestsAntigen":null,"positiveTestsAntigen":null,"fips":"02","positiveIncrease":0,"negativeIncrease":0,"total":56886,"totalTestResultsIncrease":0,"posNeg":56886,"dataQualityGrade":null,"deathIncrease":0,"hospitalizedIncrease":0,"hash":"dc4bccd4bb885349d7e94d6fed058e285d4be164","commercialScore":0,"negativeRegularScore":0,"negativeScore":0,"positiveScore":0,"score":0,"grade":""},{"date":20210306,"state":"AK","positive":56886,"probableCases":null,"negative":null,"pending":null,"totalTestResultsSource":"totalTestsViral","totalTestResults":1731628,"hospitalizedCurrently":33,"hospitalizedCumulative":1293,"inIcuCurrently":null,"inIcuCumulative":null,"onVentilatorCurrently":2,"onVentilatorCumulative":null,"recovered":null,"lastUpdateEt":"3/5/2021 03:59","dateModified":"2021-03-05T03:59:00Z","checkTimeEt":"03/04 22:59","death":305,"hospitalized":1293,"hospitalizedDischarged":null,"dateChecked":"2021-03-05T03:59:00Z","totalTestsViral":1731628,"positiveTestsViral":68693,"negativeTestsViral":1660758,"positiveCasesViral":null,"deathConfirmed":null,"deathProbable":null,"totalTestEncountersViral":null,"totalTestsPeopleViral":null,"totalTestsAntibody":null,"positiveTestsAntibody":null,"negativeTestsAntibody":null,"totalTestsPeopleAntibody":null,"positiveTestsPeopleAntibody":null,"negativeTestsPeopleAntibody":null,"totalTestsPeopleAntigen":null,"positiveTestsPeopleAntigen":null,"totalTestsAntigen":null,"positiveTestsAntigen":null,"fips":"02","positiveIncrease":0,"negativeIncrease":0,"total":56886,"totalTestResultsIncrease":0,"posNeg":56886,"dataQualityGrade":null,"deathIncrease":0,"hospitalizedIncrease":0,"hash":"749716d5cc5eb3b785af328a6c27e951ea62ffc2","commercialScore":0,"negativeRegularScore":0,"negativeScore":0,"positiveScore":0,"score":0,"grade":""},{"date":20210305,"state":"AK","positive":56886,"probableCases":null,"negative":null,"pending":null,"totalTestResultsSource":"totalTestsViral","totalTestResults":1731628,"hospitalizedCurrently":33,"hospitalizedCumulative":1293,"inIcuCurrently":null,"inIcuCumulative":null,"onVentilatorCurrently":2,"onVentilatorCumulative":null,"recovered":null,"lastUpdateEt":"3/5/2021 03:59","dateModified":"2021-03-05T03:59:00Z","checkTimeEt":"03/04 22:59","death":305,"hospitalized":1293,"hospitalizedDischarged":null,"dateChecked":"2021-03-05T03:59:00Z","totalTestsViral":1731628,"positiveTestsViral":68693,"negativeTestsViral":1660758,"positiveCasesViral":null,"deathConfirmed":null,"deathProbable":null,"totalTestEncountersViral":null,"totalTestsPeopleViral":null,"totalTestsAntibody":null,"positiveTestsAntibody":null,"negativeTestsAntibody":null,"totalTestsPeopleAntibody":null,"positiveTestsPeopleAntibody":null,"negativeTestsPeopleAntibody":null,"totalTestsPeopleAntigen":null,"positiveTestsPeopleAntigen":null,"totalTestsAntigen":null,"positiveTestsAntigen":null,"fips":"02","positiveIncrease":141,"negativeIncrease":0,"total":56886,"totalTestResultsIncrease":7144,"posNeg":56886,"dataQualityGrade":null,"deathIncrease":2,"hospitalizedIncrease":3,"hash":"7c69ab3363700e0bfc193bc3374d28a89a0d1102","commercialScore":0,"negativeRegularScore":0,"negativeScore":0,"positiveScore":0,"score":0,"grade":""},{"date":20210304,"state":"AK","positive":56745,"probableCases":null,"negative":null,"pending":null,"totalTestResultsSource":"totalTestsViral","totalTestResults":1724484,"hospitalizedCurrently":32,"hospitalizedCumulative":1290,"inIcuCurrently":null,"inIcuCumulative":null,"onVentilatorCurrently":2,"onVentilatorCumulative":null,"recovered":null,"lastUpdateEt":"3/4/2021 03:59","dateModified":"2021-03-04T03:59:00Z","checkTimeEt":"03/03 22:59","death":303,"hospitalized":1290,"hospitalizedDischarged":null,"dateChecked":"2021-03-04T03:59:00Z","totalTestsViral":1724484,"positiveTestsViral":68549,"negativeTestsViral":1653763,"positiveCasesViral":null,"deathConfirmed":null,"deathProbable":null,"totalTestEncountersViral":null,"totalTestsPeopleViral":null,"totalTestsAntibody":null,"positiveTestsAntibody":null,"negativeTestsAntibody":null,"totalTestsPeopleAntibody":null,"positiveTestsPeopleAntibody":null,"negativeTestsPeopleAntibody":null,"totalTestsPeopleAntigen":null,"positiveTestsPeopleAntigen":null,"totalTestsAntigen":null,"positiveTestsAntigen":null,"fips":"02","positiveIncrease":140,"negativeIncrease":0,"total":56745,"totalTestResultsIncrease":13466,"posNeg":56745,"dataQualityGrade":null,"deathIncrease":0,"hospitalizedIncrease":5,"hash":"bc7a5cc276540e2ec8f649ab256aa42f63777463","commercialScore":0,"negativeRegularScore":0,"negativeScore":0,"positiveScore":0,"score":0,"grade":""},{"date":20210303,"state":"AK","positive":56605,"probableCases":null,"negative":null,"pending":null,"totalTestResultsSource":"totalTestsViral","totalTestResults":1711018,"hospitalizedCurrently":26,"hospitalizedCumulative":1285,"inIcuCurrently":null,"inIcuCumulative":null,"onVentilatorCurrently":2,"onVentilatorCumulative":null,"recovered":null,"lastUpdateEt":"3/3/2021 03:59","dateModified":"2021-03-03T03:59:00Z","checkTimeEt":"03/02 22:59","death":303,"hospitalized":1285,"hospitalizedDischarged":null,"dateChecked":"2021-03-03T03:59:00Z","totalTestsViral":1711018,"positiveTestsViral":68343,"negativeTestsViral":1640525,"positiveCasesViral":null,"deathConfirmed":null,"deathProbable":null,"totalTestEncountersViral":null,"totalTestsPeopleViral":null,"totalTestsAntibody":null,"positiveTestsAntibody":null,"negativeTestsAntibody":null,"totalTestsPeopleAntibody":null,"positiveTestsPeopleAntibody":null,"negativeTestsPeopleAntibody":null,"totalTestsPeopleAntigen":null,"positiveTestsPeopleAntigen":null,"totalTestsAntigen":null,"positiveTestsAntigen":null,"fips":"02","positiveIncrease":177,"negativeIncrease":0,"total":56605,"totalTestResultsIncrease":6358,"posNeg":56605,"dataQualityGrade":null,"deathIncrease":1,"hospitalizedIncrease":-1,"hash":"06e88c66f6d974e25a99aebd3d4be26ac862a54b","commercialScore":0,"negativeRegularScore":0,"negativeScore":0,"positiveScore":0,"score":0,"grade":""},{"date":20210302,"state":"AK","positive":56428,"probableCases":null,"negative":null,"pending":null,"totalTestResultsSource":"totalTestsViral","totalTestResults":1704660,"hospitalizedCurrently":26,"hospitalizedCumulative":1286,"inIcuCurrently":null,"inIcuCumulative":null,"onVentilatorCurrently":6,"onVentilatorCumulative":null,"recovered":null,"lastUpdateEt":"3/2/2021 03:59","dateModified":"2021-03-02T03:59:00Z","checkTimeEt":"03/01 22:59","death":302,"hospitalized":1286,"hospitalizedDischarged":null,"dateChecked":"2021-03-02T03:59:00Z","totalTestsViral":1704660,"positiveTestsViral":68132,"negativeTestsViral":1634388,"positiveCasesViral":null,"deathConfirmed":null,"deathProbable":null,"totalTestEncountersViral":null,"totalTestsPeopleViral":null,"totalTestsAntibody":null,"positiveTestsAntibody":null,"negativeTestsAntibody":null,"totalTestsPeopleAntibody":null,"positiveTestsPeopleAntibody":null,"negativeTestsPeopleAntibody":null,"totalTestsPeopleAntigen":null,"positiveTestsPeopleAntigen":null,"totalTestsAntigen":null,"positiveTestsAntigen":null,"fips":"02","positiveIncrease":89,"negativeIncrease":0,"total":56428,"totalTestResultsIncrease":6629,"posNeg":56428,"dataQualityGrade":null,"deathIncrease":2,"hospitalizedIncrease":7,"hash":"dc1ca679901fe84c85e0c108882ea79504d66030","commercialScore":0,"negativeRegularScore":0,"negativeScore":0,"positiveScore":0,"score":0,"grade":""},{"date":20210301,"state":"AK","positive":56339,"probableCases":null,"negative":null,"pending":null,"totalTestResultsSource":"totalTestsViral","totalTestResults":1698031,"hospitalizedCurrently":25,"hospitalizedCumulative":1279,"inIcuCurrently":null,"inIcuCumulative":null,"onVentilatorCurrently":5,"onVentilatorCumulative":null,"recovered":null,"lastUpdateEt":"3/1/2021 03:59","dateModified":"2021-03-01T03:59:00Z","checkTimeEt":"02/28 22:59","death":300,"hospitalized":1279,"hospitalizedDischarged":null,"dateChecked":"2021-03-01T03:59:00Z","totalTestsViral":1698031,"positiveTestsViral":67948,"negativeTestsViral":1627988,"positiveCasesViral":null,"deathConfirmed":null,"deathProbable":null,"totalTestEncountersViral":null,"totalTestsPeopleViral":null,"totalTestsAntibody":null,"positiveTestsAntibody":null,"negativeTestsAntibody":null,"totalTestsPeopleAntibody":null,"positiveTestsPeopleAntibody":null,"negativeTestsPeopleAntibody":null,"totalTestsPeopleAntigen":null,"positiveTestsPeopleAntigen":null,"totalTestsAntigen":null,"positiveTestsAntigen":null,"fips":"02","positiveIncrease":350,"negativeIncrease":0,"total":56339,"totalTestResultsIncrease":18356,"posNeg":56339,"dataQualityGrade":null,"deathIncrease":10,"hospitalizedIncrease":2,"hash":"775b3fe18a9a67c8d008bae6a870b3b66923e5fc","commercialScore":0,"negativeRegularScore":0,"negativeScore":0,"positiveScore":0,"score":0,"grade":""},{"date":20210228,"state":"AK","positive":55989,"probableCases":null,"negative":null,"pending":null,"totalTestResultsSource":"totalTestsViral","totalTestResults":1679675,"hospitalizedCurrently":43,"hospitalizedCumulative":1277,"inIcuCurrently":null,"inIcuCumulative":null,"onVentilatorCurrently":5,"onVentilatorCumulative":null,"recovered":null,"lastUpdateEt":"2/26/2021 03:59","dateModified":"2021-02-26T03:59:00Z","checkTimeEt":"02/25 22:59","death":290,"hospitalized":1277,"hospitalizedDischarged":null,"dateChecked":"2021-02-26T03:59:00Z","totalTestsViral":1679675,"positiveTestsViral":67580,"negativeTestsViral":1610023,"positiveCasesViral":null,"deathConfirmed":null,"deathProbable":null,"totalTestEncountersViral":null,"totalTestsPeopleViral":null,"totalTestsAntibody":null,"positiveTestsAntibody":null,"negativeTestsAntibody":null,"totalTestsPeopleAntibody":null,"positiveTestsPeopleAntibody":null,"negativeTestsPeopleAntibody":null,"totalTestsPeopleAntigen":null,"positiveTestsPeopleAntigen":null,"totalTestsAntigen":null,"positiveTestsAntigen":null,"fips":"02","positiveIncrease":0,"negativeIncrease":0,"total":55989,"totalTestResultsIncrease":0,"posNeg":55989,"dataQualityGrade":null,"deathIncrease":0,"hospitalizedIncrease":0,"hash":"6d01ab8f9ee9605ca15805c4665d29ad9e8b6bd4","commercialScore":0,"negativeRegularScore":0,"negativeScore":0,"positiveScore":0,"score":0,"grade":""},{"date":20210227,"state":"AK","positive":55989,"probableCases":null,"negative":null,"pending":null,"totalTestResultsSource":"totalTestsViral","totalTestResults":1679675,"hospitalizedCurrently":43,"hospitalizedCumulative":1277,"inIcuCurrently":null,"inIcuCumulative":null,"onVentilatorCurrently":5,"onVentilatorCumulative":null,"recovered":null,"lastUpdateEt":"2/26/2021 03:59","dateModified":"2021-02-26T03:59:00Z","checkTimeEt":"02/25 22:59","death":290,"hospitalized":1277,"hospitalizedDischarged":null,"dateChecked":"2021-02-26T03:59:00Z","totalTestsViral":1679675,"positiveTestsViral":67580,"negativeTestsViral":1610023,"positiveCasesViral":null,"deathConfirmed":null,"deathProbable":null,"totalTestEncountersViral":null,"totalTestsPeopleViral":null,"totalTestsAntibody":null,"positiveTestsAntibody":null,"negativeTestsAntibody":null,"totalTestsPeopleAntibody":null,"positiveTestsPeopleAntibody":null,"negativeTestsPeopleAntibody":null,"totalTestsPeopleAntigen":null,"positiveTestsPeopleAntigen":null,"totalTestsAntigen":null,"positiveTestsAntigen":null,"fips":"02","positiveIncrease":0,"negativeIncrease":0,"total":55989,"totalTestResultsIncrease":0,"posNeg":55989,"dataQualityGrade":null,"deathIncrease":0,"hospitalizedIncrease":0,"hash":"22ba940bf484b87e67e142f5f1b88e1507f06ed4","commercialScore":0,"negativeRegularScore":0,"negativeScore":0,"positiveScore":0,"score":0,"grade":""},{"date":20210226,"state":"AK","positive":55989,"probableCases":null,"negative":null,"pending":null,"totalTestResultsSource":"totalTestsViral","totalTestResults":1679675,"hospitalizedCurrently":43,"hospitalizedCumulative":1277,"inIcuCurrently":null,"inIcuCumulative":null,"onVentilatorCurrently":5,"onVentilatorCumulative":null,"recovered":null,"lastUpdateEt":"2/26/2021 03:59","dateModified":"2021-02-26T03:59:00Z","checkTimeEt":"02/25 22:59","death":290,"hospitalized":1277,"hospitalizedDischarged":null,"dateChecked":"2021-02-26T03:59:00Z","totalTestsViral":1679675,"positiveTestsViral":67580,"negativeTestsViral":1610023,"positiveCasesViral":null,"deathConfirmed":null,"deathProbable":null,"totalTestEncountersViral":null,"totalTestsPeopleViral":null,"totalTestsAntibody":null,"positiveTestsAntibody":null,"negativeTestsAntibody":null,"totalTestsPeopleAntibody":null,"positiveTestsPeopleAntibody":null,"negativeTestsPeopleAntibody":null,"totalTestsPeopleAntigen":null,"positiveTestsPeopleAntigen":null,"totalTestsAntigen":null,"positiveTestsAntigen":null,"fips":"02","positiveIncrease":103,"negativeIncrease":0,"total":55989,"totalTestResultsIncrease":8632,"posNeg":55989,"dataQualityGrade":null,"deathIncrease":0,"hospitalizedIncrease":6,"hash":"5044f52853a381071810a041914daeddb72d2494","commercialScore":0,"negativeRegularScore":0,"negativeScore":0,"positiveScore":0,"score":0,"grade":""},{"date":20210225,"state":"AK","positive":55886,"probableCases":null,"negative":null,"pending":null,"totalTestResultsSource":"totalTestsViral","totalTestResults":1671043,"hospitalizedCurrently":45,"hospitalizedCumulative":1271,"inIcuCurrently":null,"inIcuCumulative":null,"onVentilatorCurrently":5,"onVentilatorCumulative":null,"recovered":null,"lastUpdateEt":"2/25/2021 03:59","dateModified":"2021-02-25T03:59:00Z","checkTimeEt":"02/24 22:59","death":290,"hospitalized":1271,"hospitalizedDischarged":null,"dateChecked":"2021-02-25T03:59:00Z","totalTestsViral":1671043,"positiveTestsViral":67403,"negativeTestsViral":1601583,"positiveCasesViral":null,"deathConfirmed":null,"deathProbable":null,"totalTestEncountersViral":null,"totalTestsPeopleViral":null,"totalTestsAntibody":null,"positiveTestsAntibody":null,"negativeTestsAntibody":null,"totalTestsPeopleAntibody":null,"positiveTestsPeopleAntibody":null,"negativeTestsPeopleAntibody":null,"totalTestsPeopleAntigen":null,"positiveTestsPeopleAntigen":null,"totalTestsAntigen":null,"positiveTestsAntigen":null,"fips":"02","positiveIncrease":150,"negativeIncrease":0,"total":55886,"totalTestResultsIncrease":8887,"posNeg":55886,"dataQualityGrade":null,"deathIncrease":0,"hospitalizedIncrease":11,"hash":"21a34ec5db88409cfbf700bde95d11af3de7f1aa","commercialScore":0,"negativeRegularScore":0,"negativeScore":0,"positiveScore":0,"score":0,"grade":""},{"date":20210224,"state":"AK","positive":55736,"probableCases":null,"negative":null,"pending":null,"totalTestResultsSource":"totalTestsViral","totalTestResults":1662156,"hospitalizedCurrently":46,"hospitalizedCumulative":1260,"inIcuCurrently":null,"inIcuCumulative":null,"onVentilatorCurrently":4,"onVentilatorCumulative":null,"recovered":null,"lastUpdateEt":"2/24/2021 03:59","dateModified":"2021-02-24T03:59:00Z","checkTimeEt":"02/23 22:59","death":290,"hospitalized":1260,"hospitalizedDischarged":null,"dateChecked":"2021-02-24T03:59:00Z","totalTestsViral":1662156,"positiveTestsViral":67232,"negativeTestsViral":1592879,"positiveCasesViral":null,"deathConfirmed":null,"deathProbable":null,"totalTestEncountersViral":null,"totalTestsPeopleViral":null,"totalTestsAntibody":null,"positiveTestsAntibody":null,"negativeTestsAntibody":null,"totalTestsPeopleAntibody":null,"positiveTestsPeopleAntibody":null,"negativeTestsPeopleAntibody":null,"totalTestsPeopleAntigen":null,"positiveTestsPeopleAntigen":null,"totalTestsAntigen":null,"positiveTestsAntigen":null,"fips":"02","positiveIncrease":176,"negativeIncrease":0,"total":55736,"totalTestResultsIncrease":8731,"posNeg":55736,"dataQualityGrade":null,"deathIncrease":0,"hospitalizedIncrease":0,"hash":"67b3b6ca1627ea40d08871803b2659b08b55daae","commercialScore":0,"negativeRegularScore":0,"negativeScore":0,"positiveScore":0,"score":0,"grade":""},{"date":20210223,"state":"AK","positive":55560,"probableCases":null,"negative":null,"pending":null,"totalTestResultsSource":"totalTestsViral","totalTestResults":1653425,"hospitalizedCurrently":38,"hospitalizedCumulative":1260,"inIcuCurrently":null,"inIcuCumulative":null,"onVentilatorCurrently":5,"onVentilatorCumulative":null,"recovered":null,"lastUpdateEt":"2/23/2021 03:59","dateModified":"2021-02-23T03:59:00Z","checkTimeEt":"02/22 22:59","death":290,"hospitalized":1260,"hospitalizedDischarged":null,"dateChecked":"2021-02-23T03:59:00Z","totalTestsViral":1653425,"positiveTestsViral":67036,"negativeTestsViral":1584367,"positiveCasesViral":null,"deathConfirmed":null,"deathProbable":null,"totalTestEncountersViral":null,"totalTestsPeopleViral":null,"totalTestsAntibody":null,"positiveTestsAntibody":null,"negativeTestsAntibody":null,"totalTestsPeopleAntibody":null,"positiveTestsPeopleAntibody":null,"negativeTestsPeopleAntibody":null,"totalTestsPeopleAntigen":null,"positiveTestsPeopleAntigen":null,"totalTestsAntigen":null,"positiveTestsAntigen":null,"fips":"02","positiveIncrease":53,"negativeIncrease":0,"total":55560,"totalTestResultsIncrease":4640,"posNeg":55560,"dataQualityGrade":null,"deathIncrease":0,"hospitalizedIncrease":9,"hash":"8e9b55832d194e6faf511a32f4d3362caac0960e","commercialScore":0,"negativeRegularScore":0,"negativeScore":0,"positiveScore":0,"score":0,"grade":""},{"date":20210222,"state":"AK","positive":55507,"probableCases":null,"negative":null,"pending":null,"totalTestResultsSource":"totalTestsViral","totalTestResults":1648785,"hospitalizedCurrently":39,"hospitalizedCumulative":1251,"inIcuCurrently":null,"inIcuCumulative":null,"onVentilatorCurrently":5,"onVentilatorCumulative":null,"recovered":null,"lastUpdateEt":"2/22/2021 03:59","dateModified":"2021-02-22T03:59:00Z","checkTimeEt":"02/21 22:59","death":290,"hospitalized":1251,"hospitalizedDischarged":null,"dateChecked":"2021-02-22T03:59:00Z","totalTestsViral":1648785,"positiveTestsViral":66945,"negativeTestsViral":1579837,"positiveCasesViral":null,"deathConfirmed":null,"deathProbable":null,"totalTestEncountersViral":null,"totalTestsPeopleViral":null,"totalTestsAntibody":null,"positiveTestsAntibody":null,"negativeTestsAntibody":null,"totalTestsPeopleAntibody":null,"positiveTestsPeopleAntibody":null,"negativeTestsPeopleAntibody":null,"totalTestsPeopleAntigen":null,"positiveTestsPeopleAntigen":null,"totalTestsAntigen":null,"positiveTestsAntigen":null,"fips":"02","positiveIncrease":309,"negativeIncrease":0,"total":55507,"totalTestResultsIncrease":18956,"posNeg":55507,"dataQualityGrade":null,"deathIncrease":1,"hospitalizedIncrease":8,"hash":"d16719bcd536c718ee212fa36ec5c4d1634ae456","commercialScore":0,"negativeRegularScore":0,"negativeScore":0,"positiveScore":0,"score":0,"grade":""},{"date":20210221,"state":"AK","positive":55198,"probableCases":null,"negative":null,"pending":null,"totalTestResultsSource":"totalTestsViral","totalTestResults":1629829,"hospitalizedCurrently":34,"hospitalizedCumulative":1243,"inIcuCurrently":null,"inIcuCumulative":null,"onVentilatorCurrently":4,"onVentilatorCumulative":null,"recovered":null,"lastUpdateEt":"2/19/2021 03:59","dateModified":"2021-02-19T03:59:00Z","checkTimeEt":"02/18 22:59","death":289,"hospitalized":1243,"hospitalizedDischarged":null,"dateChecked":"2021-02-19T03:59:00Z","totalTestsViral":1629829,"positiveTestsViral":66577,"negativeTestsViral":1561281,"positiveCasesViral":null,"deathConfirmed":null,"deathProbable":null,"totalTestEncountersViral":null,"totalTestsPeopleViral":null,"totalTestsAntibody":null,"positiveTestsAntibody":null,"negativeTestsAntibody":null,"totalTestsPeopleAntibody":null,"positiveTestsPeopleAntibody":null,"negativeTestsPeopleAntibody":null,"totalTestsPeopleAntigen":null,"positiveTestsPeopleAntigen":null,"totalTestsAntigen":null,"positiveTestsAntigen":null,"fips":"02","positiveIncrease":0,"negativeIncrease":0,"total":55198,"totalTestResultsIncrease":0,"posNeg":55198,"dataQualityGrade":null,"deathIncrease":0,"hospitalizedIncrease":0,"hash":"c5d59c6e6425b2831a663bdf37da6b807d96def3","commercialScore":0,"negativeRegularScore":0,"negativeScore":0,"positiveScore":0,"score":0,"grade":""},{"date":20210220,"state":"AK","positive":55198,"probableCases":null,"negative":null,"pending":null,"totalTestResultsSource":"totalTestsViral","totalTestResults":1629829,"hospitalizedCurrently":34,"hospitalizedCumulative":1243,"inIcuCurrently":null,"inIcuCumulative":null,"onVentilatorCurrently":4,"onVentilatorCumulative":null,"recovered":null,"lastUpdateEt":"2/19/2021 03:59","dateModified":"2021-02-19T03:59:00Z","checkTimeEt":"02/18 22:59","death":289,"hospitalized":1243,"hospitalizedDischarged":null,"dateChecked":"2021-02-19T03:59:00Z","totalTestsViral":1629829,"positiveTestsViral":66577,"negativeTestsViral":1561281,"positiveCasesViral":null,"deathConfirmed":null,"deathProbable":null,"totalTestEncountersViral":null,"totalTestsPeopleViral":null,"totalTestsAntibody":null,"positiveTestsAntibody":null,"negativeTestsAntibody":null,"totalTestsPeopleAntibody":null,"positiveTestsPeopleAntibody":null,"negativeTestsPeopleAntibody":null,"totalTestsPeopleAntigen":null,"positiveTestsPeopleAntigen":null,"totalTestsAntigen":null,"positiveTestsAntigen":null,"fips":"02","positiveIncrease":0,"negativeIncrease":0,"total":55198,"totalTestResultsIncrease":0,"posNeg":55198,"dataQualityGrade":null,"deathIncrease":0,"hospitalizedIncrease":0,"hash":"1e85af0b5a8d444d4c1c6ffe2e591c0304971ab2","commercialScore":0,"negativeRegularScore":0,"negativeScore":0,"positiveScore":0,"score":0,"grade":""},{"date":20210219,"state":"AK","positive":55198,"probableCases":null,"negative":null,"pending":null,"totalTestResultsSource":"totalTestsViral","totalTestResults":1629829,"hospitalizedCurrently":34,"hospitalizedCumulative":1243,"inIcuCurrently":null,"inIcuCumulative":null,"onVentilatorCurrently":4,"onVentilatorCumulative":null,"recovered":null,"lastUpdateEt":"2/19/2021 03:59","dateModified":"2021-02-19T03:59:00Z","checkTimeEt":"02/18 22:59","death":289,"hospitalized":1243,"hospitalizedDischarged":null,"dateChecked":"2021-02-19T03:59:00Z","totalTestsViral":1629829,"positiveTestsViral":66577,"negativeTestsViral":1561281,"positiveCasesViral":null,"deathConfirmed":null,"deathProbable":null,"totalTestEncountersViral":null,"totalTestsPeopleViral":null,"totalTestsAntibody":null,"positiveTestsAntibody":null,"negativeTestsAntibody":null,"totalTestsPeopleAntibody":null,"positiveTestsPeopleAntibody":null,"negativeTestsPeopleAntibody":null,"totalTestsPeopleAntigen":null,"positiveTestsPeopleAntigen":null,"totalTestsAntigen":null,"positiveTestsAntigen":null,"fips":"02","positiveIncrease":189,"negativeIncrease":0,"total":55198,"totalTestResultsIncrease":10370,"posNeg":55198,"dataQualityGrade":null,"deathIncrease":1,"hospitalizedIncrease":0,"hash":"ac4229ce35fa13d674c97a3332009e3e73d2257b","commercialScore":0,"negativeRegularScore":0,"negativeScore":0,"positiveScore":0,"score":0,"grade":""},{"date":20210218,"state":"AK","positive":55009,"probableCases":null,"negative":null,"pending":null,"totalTestResultsSource":"totalTestsViral","totalTestResults":1619459,"hospitalizedCurrently":37,"hospitalizedCumulative":1243,"inIcuCurrently":null,"inIcuCumulative":null,"onVentilatorCurrently":3,"onVentilatorCumulative":null,"recovered":null,"lastUpdateEt":"2/18/2021 03:59","dateModified":"2021-02-18T03:59:00Z","checkTimeEt":"02/17 22:59","death":288,"hospitalized":1243,"hospitalizedDischarged":null,"dateChecked":"2021-02-18T03:59:00Z","totalTestsViral":1619459,"positiveTestsViral":66411,"negativeTestsViral":1551117,"positiveCasesViral":null,"deathConfirmed":null,"deathProbable":null,"totalTestEncountersViral":null,"totalTestsPeopleViral":null,"totalTestsAntibody":null,"positiveTestsAntibody":null,"negativeTestsAntibody":null,"totalTestsPeopleAntibody":null,"positiveTestsPeopleAntibody":null,"negativeTestsPeopleAntibody":null,"totalTestsPeopleAntigen":null,"positiveTestsPeopleAntigen":null,"totalTestsAntigen":null,"positiveTestsAntigen":null,"fips":"02","positiveIncrease":210,"negativeIncrease":0,"total":55009,"totalTestResultsIncrease":7488,"posNeg":55009,"dataQualityGrade":null,"deathIncrease":0,"hospitalizedIncrease":5,"hash":"8b10f7dd94bfd5b1ddd586e750d0b8881efab421","commercialScore":0,"negativeRegularScore":0,"negativeScore":0,"positiveScore":0,"score":0,"grade":""},{"date":20210217,"state":"AK","positive":54799,"probableCases":null,"negative":null,"pending":null,"totalTestResultsSource":"totalTestsViral","totalTestResults":1611971,"hospitalizedCurrently":32,"hospitalizedCumulative":1238,"inIcuCurrently":null,"inIcuCumulative":null,"onVentilatorCurrently":2,"onVentilatorCumulative":null,"recovered":null,"lastUpdateEt":"2/17/2021 03:59","dateModified":"2021-02-17T03:59:00Z","checkTimeEt":"02/16 22:59","death":288,"hospitalized":1238,"hospitalizedDischarged":null,"dateChecked":"2021-02-17T03:59:00Z","totalTestsViral":1611971,"positiveTestsViral":66264,"negativeTestsViral":1543783,"positiveCasesViral":null,"deathConfirmed":null,"deathProbable":null,"totalTestEncountersViral":null,"totalTestsPeopleViral":null,"totalTestsAntibody":null,"positiveTestsAntibody":null,"negativeTestsAntibody":null,"totalTestsPeopleAntibody":null,"positiveTestsPeopleAntibody":null,"negativeTestsPeopleAntibody":null,"totalTestsPeopleAntigen":null,"positiveTestsPeopleAntigen":null,"totalTestsAntigen":null,"positiveTestsAntigen":null,"fips":"02","positiveIncrease":63,"negativeIncrease":0,"total":54799,"totalTestResultsIncrease":6144,"posNeg":54799,"dataQualityGrade":null,"deathIncrease":1,"hospitalizedIncrease":5,"hash":"96a61e021c5ff72ae4f831f4ffbeac80e993d96f","commercialScore":0,"negativeRegularScore":0,"negativeScore":0,"positiveScore":0,"score":0,"grade":""},{"date":20210216,"state":"AK","positive":54736,"probableCases":null,"negative":null,"pending":null,"totalTestResultsSource":"totalTestsViral","totalTestResults":1605827,"hospitalizedCurrently":43,"hospitalizedCumulative":1233,"inIcuCurrently":null,"inIcuCumulative":null,"onVentilatorCurrently":2,"onVentilatorCumulative":null,"recovered":null,"lastUpdateEt":"2/16/2021 03:59","dateModified":"2021-02-16T03:59:00Z","checkTimeEt":"02/15 22:59","death":287,"hospitalized":1233,"hospitalizedDischarged":null,"dateChecked":"2021-02-16T03:59:00Z","totalTestsViral":1605827,"positiveTestsViral":66077,"negativeTestsViral":1537830,"positiveCasesViral":null,"deathConfirmed":null,"deathProbable":null,"totalTestEncountersViral":null,"totalTestsPeopleViral":null,"totalTestsAntibody":null,"positiveTestsAntibody":null,"negativeTestsAntibody":null,"totalTestsPeopleAntibody":null,"positiveTestsPeopleAntibody":null,"negativeTestsPeopleAntibody":null,"totalTestsPeopleAntigen":null,"positiveTestsPeopleAntigen":null,"totalTestsAntigen":null,"positiveTestsAntigen":null,"fips":"02","positiveIncrease":454,"negativeIncrease":0,"total":54736,"totalTestResultsIncrease":21279,"posNeg":54736,"dataQualityGrade":null,"deathIncrease":5,"hospitalizedIncrease":3,"hash":"4382a871d22ec982fc4ac57442e3069916a6fc12","commercialScore":0,"negativeRegularScore":0,"negativeScore":0,"positiveScore":0,"score":0,"grade":""},{"date":20210215,"state":"AK","positive":54282,"probableCases":null,"negative":null,"pending":null,"totalTestResultsSource":"totalTestsViral","totalTestResults":1584548,"hospitalizedCurrently":35,"hospitalizedCumulative":1230,"inIcuCurrently":null,"inIcuCumulative":null,"onVentilatorCurrently":5,"onVentilatorCumulative":null,"recovered":null,"lastUpdateEt":"2/12/2021 03:59","dateModified":"2021-02-12T03:59:00Z","checkTimeEt":"02/11 22:59","death":282,"hospitalized":1230,"hospitalizedDischarged":null,"dateChecked":"2021-02-12T03:59:00Z","totalTestsViral":1584548,"positiveTestsViral":65613,"negativeTestsViral":1517076,"positiveCasesViral":null,"deathConfirmed":null,"deathProbable":null,"totalTestEncountersViral":null,"totalTestsPeopleViral":null,"totalTestsAntibody":null,"positiveTestsAntibody":null,"negativeTestsAntibody":null,"totalTestsPeopleAntibody":null,"positiveTestsPeopleAntibody":null,"negativeTestsPeopleAntibody":null,"totalTestsPeopleAntigen":null,"positiveTestsPeopleAntigen":null,"totalTestsAntigen":null,"positiveTestsAntigen":null,"fips":"02","positiveIncrease":0,"negativeIncrease":0,"total":54282,"totalTestResultsIncrease":0,"posNeg":54282,"dataQualityGrade":null,"deathIncrease":0,"hospitalizedIncrease":0,"hash":"fbdcf64542f36adae78ca378b8ceb3d94fe8d24e","commercialScore":0,"negativeRegularScore":0,"negativeScore":0,"positiveScore":0,"score":0,"grade":""},{"date":20210214,"state":"AK","positive":54282,"probableCases":null,"negative":null,"pending":null,"totalTestResultsSource":"totalTestsViral","totalTestResults":1584548,"hospitalizedCurrently":35,"hospitalizedCumulative":1230,"inIcuCurrently":null,"inIcuCumulative":null,"onVentilatorCurrently":5,"onVentilatorCumulative":null,"recovered":null,"lastUpdateEt":"2/12/2021 03:59","dateModified":"2021-02-12T03:59:00Z","checkTimeEt":"02/11 22:59","death":282,"hospitalized":1230,"hospitalizedDischarged":null,"dateChecked":"2021-02-12T03:59:00Z","totalTestsViral":1584548,"positiveTestsViral":65613,"negativeTestsViral":1517076,"positiveCasesViral":null,"deathConfirmed":null,"deathProbable":null,"totalTestEncountersViral":null,"totalTestsPeopleViral":null,"totalTestsAntibody":null,"positiveTestsAntibody":null,"negativeTestsAntibody":null,"totalTestsPeopleAntibody":null,"positiveTestsPeopleAntibody":null,"negativeTestsPeopleAntibody":null,"totalTestsPeopleAntigen":null,"positiveTestsPeopleAntigen":null,"totalTestsAntigen":null,"positiveTestsAntigen":null,"fips":"02","positiveIncrease":0,"negativeIncrease":0,"total":54282,"totalTestResultsIncrease":0,"posNeg":54282,"dataQualityGrade":null,"deathIncrease":0,"hospitalizedIncrease":0,"hash":"1de98aa72a395729e4d91c49a23acde2f503c0b8","commercialScore":0,"negativeRegularScore":0,"negativeScore":0,"positiveScore":0,"score":0,"grade":""},{"date":20210213,"state":"AK","positive":54282,"probableCases":null,"negative":null,"pending":null,"totalTestResultsSource":"totalTestsViral","totalTestResults":1584548,"hospitalizedCurrently":35,"hospitalizedCumulative":1230,"inIcuCurrently":null,"inIcuCumulative":null,"onVentilatorCurrently":5,"onVentilatorCumulative":null,"recovered":null,"lastUpdateEt":"2/12/2021 03:59","dateModified":"2021-02-12T03:59:00Z","checkTimeEt":"02/11 22:59","death":282,"hospitalized":1230,"hospitalizedDischarged":null,"dateChecked":"2021-02-12T03:59:00Z","totalTestsViral":1584548,"positiveTestsViral":65613,"negativeTestsViral":1517076,"positiveCasesViral":null,"deathConfirmed":null,"deathProbable":null,"totalTestEncountersViral":null,"totalTestsPeopleViral":null,"totalTestsAntibody":null,"positiveTestsAntibody":null,"negativeTestsAntibody":null,"totalTestsPeopleAntibody":null,"positiveTestsPeopleAntibody":null,"negativeTestsPeopleAntibody":null,"totalTestsPeopleAntigen":null,"positiveTestsPeopleAntigen":null,"totalTestsAntigen":null,"positiveTestsAntigen":null,"fips":"02","positiveIncrease":0,"negativeIncrease":0,"total":54282,"totalTestResultsIncrease":0,"posNeg":54282,"dataQualityGrade":null,"deathIncrease":0,"hospitalizedIncrease":0,"hash":"69bc93c817c26e15cb1c9c8aa38d73fafd1e638a","commercialScore":0,"negativeRegularScore":0,"negativeScore":0,"positiveScore":0,"score":0,"grade":""},{"date":20210212,"state":"AK","positive":54282,"probableCases":null,"negative":null,"pending":null,"totalTestResultsSource":"totalTestsViral","totalTestResults":1584548,"hospitalizedCurrently":35,"hospitalizedCumulative":1230,"inIcuCurrently":null,"inIcuCumulative":null,"onVentilatorCurrently":5,"onVentilatorCumulative":null,"recovered":null,"lastUpdateEt":"2/12/2021 03:59","dateModified":"2021-02-12T03:59:00Z","checkTimeEt":"02/11 22:59","death":282,"hospitalized":1230,"hospitalizedDischarged":null,"dateChecked":"2021-02-12T03:59:00Z","totalTestsViral":1584548,"positiveTestsViral":65613,"negativeTestsViral":1517076,"positiveCasesViral":null,"deathConfirmed":null,"deathProbable":null,"totalTestEncountersViral":null,"totalTestsPeopleViral":null,"totalTestsAntibody":null,"positiveTestsAntibody":null,"negativeTestsAntibody":null,"totalTestsPeopleAntibody":null,"positiveTestsPeopleAntibody":null,"negativeTestsPeopleAntibody":null,"totalTestsPeopleAntigen":null,"positiveTestsPeopleAntigen":null,"totalTestsAntigen":null,"positiveTestsAntigen":null,"fips":"02","positiveIncrease":148,"negativeIncrease":0,"total":54282,"totalTestResultsIncrease":7192,"posNeg":54282,"dataQualityGrade":null,"deathIncrease":2,"hospitalizedIncrease":3,"hash":"60508920416c9cda3aedadbc86fbcd96f3df50f0","commercialScore":0,"negativeRegularScore":0,"negativeScore":0,"positiveScore":0,"score":0,"grade":""},{"date":20210211,"state":"AK","positive":54134,"probableCases":null,"negative":null,"pending":null,"totalTestResultsSource":"totalTestsViral","totalTestResults":1577356,"hospitalizedCurrently":33,"hospitalizedCumulative":1227,"inIcuCurrently":null,"inIcuCumulative":null,"onVentilatorCurrently":6,"onVentilatorCumulative":null,"recovered":null,"lastUpdateEt":"2/11/2021 03:59","dateModified":"2021-02-11T03:59:00Z","checkTimeEt":"02/10 22:59","death":280,"hospitalized":1227,"hospitalizedDischarged":null,"dateChecked":"2021-02-11T03:59:00Z","totalTestsViral":1577356,"positiveTestsViral":65457,"negativeTestsViral":1510067,"positiveCasesViral":null,"deathConfirmed":null,"deathProbable":null,"totalTestEncountersViral":null,"totalTestsPeopleViral":null,"totalTestsAntibody":null,"positiveTestsAntibody":null,"negativeTestsAntibody":null,"totalTestsPeopleAntibody":null,"positiveTestsPeopleAntibody":null,"negativeTestsPeopleAntibody":null,"totalTestsPeopleAntigen":null,"positiveTestsPeopleAntigen":null,"totalTestsAntigen":null,"positiveTestsAntigen":null,"fips":"02","positiveIncrease":143,"negativeIncrease":0,"total":54134,"totalTestResultsIncrease":9353,"posNeg":54134,"dataQualityGrade":null,"deathIncrease":0,"hospitalizedIncrease":3,"hash":"a06f51bbd234e397c67f3e3e0a060e687993ea0a","commercialScore":0,"negativeRegularScore":0,"negativeScore":0,"positiveScore":0,"score":0,"grade":""},{"date":20210210,"state":"AK","positive":53991,"probableCases":null,"negative":null,"pending":null,"totalTestResultsSource":"totalTestsViral","totalTestResults":1568003,"hospitalizedCurrently":34,"hospitalizedCumulative":1224,"inIcuCurrently":null,"inIcuCumulative":null,"onVentilatorCurrently":6,"onVentilatorCumulative":null,"recovered":null,"lastUpdateEt":"2/10/2021 03:59","dateModified":"2021-02-10T03:59:00Z","checkTimeEt":"02/09 22:59","death":280,"hospitalized":1224,"hospitalizedDischarged":null,"dateChecked":"2021-02-10T03:59:00Z","totalTestsViral":1568003,"positiveTestsViral":65272,"negativeTestsViral":1500923,"positiveCasesViral":null,"deathConfirmed":null,"deathProbable":null,"totalTestEncountersViral":null,"totalTestsPeopleViral":null,"totalTestsAntibody":null,"positiveTestsAntibody":null,"negativeTestsAntibody":null,"totalTestsPeopleAntibody":null,"positiveTestsPeopleAntibody":null,"negativeTestsPeopleAntibody":null,"totalTestsPeopleAntigen":null,"positiveTestsPeopleAntigen":null,"totalTestsAntigen":null,"positiveTestsAntigen":null,"fips":"02","positiveIncrease":182,"negativeIncrease":0,"total":53991,"totalTestResultsIncrease":6754,"posNeg":53991,"dataQualityGrade":null,"deathIncrease":0,"hospitalizedIncrease":1,"hash":"eec441c4a0ce048c36fb663eb4069687d027edd4","commercialScore":0,"negativeRegularScore":0,"negativeScore":0,"positiveScore":0,"score":0,"grade":""},{"date":20210209,"state":"AK","positive":53809,"probableCases":null,"negative":null,"pending":null,"totalTestResultsSource":"totalTestsViral","totalTestResults":1561249,"hospitalizedCurrently":35,"hospitalizedCumulative":1223,"inIcuCurrently":null,"inIcuCumulative":null,"onVentilatorCurrently":6,"onVentilatorCumulative":null,"recovered":null,"lastUpdateEt":"2/9/2021 03:59","dateModified":"2021-02-09T03:59:00Z","checkTimeEt":"02/08 22:59","death":280,"hospitalized":1223,"hospitalizedDischarged":null,"dateChecked":"2021-02-09T03:59:00Z","totalTestsViral":1561249,"positiveTestsViral":65100,"negativeTestsViral":1494355,"positiveCasesViral":null,"deathConfirmed":null,"deathProbable":null,"totalTestEncountersViral":null,"totalTestsPeopleViral":null,"totalTestsAntibody":null,"positiveTestsAntibody":null,"negativeTestsAntibody":null,"totalTestsPeopleAntibody":null,"positiveTestsPeopleAntibody":null,"negativeTestsPeopleAntibody":null,"totalTestsPeopleAntigen":null,"positiveTestsPeopleAntigen":null,"totalTestsAntigen":null,"positiveTestsAntigen":null,"fips":"02","positiveIncrease":115,"negativeIncrease":0,"total":53809,"totalTestResultsIncrease":5717,"posNeg":53809,"dataQualityGrade":null,"deathIncrease":1,"hospitalizedIncrease":4,"hash":"a39c9a37c4d2ea035144b7916132374ee16de293","commercialScore":0,"negativeRegularScore":0,"negativeScore":0,"positiveScore":0,"score":0,"grade":""},{"date":20210208,"state":"AK","positive":53694,"probableCases":null,"negative":null,"pending":null,"totalTestResultsSource":"totalTestsViral","totalTestResults":1555532,"hospitalizedCurrently":39,"hospitalizedCumulative":1219,"inIcuCurrently":null,"inIcuCumulative":null,"onVentilatorCurrently":9,"onVentilatorCumulative":null,"recovered":null,"lastUpdateEt":"2/8/2021 03:59","dateModified":"2021-02-08T03:59:00Z","checkTimeEt":"02/07 22:59","death":279,"hospitalized":1219,"hospitalizedDischarged":null,"dateChecked":"2021-02-08T03:59:00Z","totalTestsViral":1555532,"positiveTestsViral":64862,"negativeTestsViral":1488905,"positiveCasesViral":null,"deathConfirmed":null,"deathProbable":null,"totalTestEncountersViral":null,"totalTestsPeopleViral":null,"totalTestsAntibody":null,"positiveTestsAntibody":null,"negativeTestsAntibody":null,"totalTestsPeopleAntibody":null,"positiveTestsPeopleAntibody":null,"negativeTestsPeopleAntibody":null,"totalTestsPeopleAntigen":null,"positiveTestsPeopleAntigen":null,"totalTestsAntigen":null,"positiveTestsAntigen":null,"fips":"02","positiveIncrease":415,"negativeIncrease":0,"total":53694,"totalTestResultsIncrease":18621,"posNeg":53694,"dataQualityGrade":null,"deathIncrease":0,"hospitalizedIncrease":0,"hash":"efba8bbf816318de32c48a0b929199fc63243499","commercialScore":0,"negativeRegularScore":0,"negativeScore":0,"positiveScore":0,"score":0,"grade":""},{"date":20210207,"state":"AK","positive":53279,"probableCases":null,"negative":null,"pending":null,"totalTestResultsSource":"totalTestsViral","totalTestResults":1536911,"hospitalizedCurrently":44,"hospitalizedCumulative":1219,"inIcuCurrently":null,"inIcuCumulative":null,"onVentilatorCurrently":11,"onVentilatorCumulative":null,"recovered":null,"lastUpdateEt":"2/5/2021 03:59","dateModified":"2021-02-05T03:59:00Z","checkTimeEt":"02/04 22:59","death":279,"hospitalized":1219,"hospitalizedDischarged":null,"dateChecked":"2021-02-05T03:59:00Z","totalTestsViral":1536911,"positiveTestsViral":64404,"negativeTestsViral":1470760,"positiveCasesViral":null,"deathConfirmed":null,"deathProbable":null,"totalTestEncountersViral":null,"totalTestsPeopleViral":null,"totalTestsAntibody":null,"positiveTestsAntibody":null,"negativeTestsAntibody":null,"totalTestsPeopleAntibody":null,"positiveTestsPeopleAntibody":null,"negativeTestsPeopleAntibody":null,"totalTestsPeopleAntigen":null,"positiveTestsPeopleAntigen":null,"totalTestsAntigen":null,"positiveTestsAntigen":null,"fips":"02","positiveIncrease":0,"negativeIncrease":0,"total":53279,"totalTestResultsIncrease":0,"posNeg":53279,"dataQualityGrade":null,"deathIncrease":0,"hospitalizedIncrease":0,"hash":"5b9c4c4f9bdd6ecb7641490fc45a5024bdd53255","commercialScore":0,"negativeRegularScore":0,"negativeScore":0,"positiveScore":0,"score":0,"grade":""},{"date":20210206,"state":"AK","positive":53279,"probableCases":null,"negative":null,"pending":null,"totalTestResultsSource":"totalTestsViral","totalTestResults":1536911,"hospitalizedCurrently":44,"hospitalizedCumulative":1219,"inIcuCurrently":null,"inIcuCumulative":null,"onVentilatorCurrently":11,"onVentilatorCumulative":null,"recovered":null,"lastUpdateEt":"2/5/2021 03:59","dateModified":"2021-02-05T03:59:00Z","checkTimeEt":"02/04 22:59","death":279,"hospitalized":1219,"hospitalizedDischarged":null,"dateChecked":"2021-02-05T03:59:00Z","totalTestsViral":1536911,"positiveTestsViral":64404,"negativeTestsViral":1470760,"positiveCasesViral":null,"deathConfirmed":null,"deathProbable":null,"totalTestEncountersViral":null,"totalTestsPeopleViral":null,"totalTestsAntibody":null,"positiveTestsAntibody":null,"negativeTestsAntibody":null,"totalTestsPeopleAntibody":null,"positiveTestsPeopleAntibody":null,"negativeTestsPeopleAntibody":null,"totalTestsPeopleAntigen":null,"positiveTestsPeopleAntigen":null,"totalTestsAntigen":null,"positiveTestsAntigen":null,"fips":"02","positiveIncrease":0,"negativeIncrease":0,"total":53279,"totalTestResultsIncrease":0,"posNeg":53279,"dataQualityGrade":null,"deathIncrease":0,"hospitalizedIncrease":0,"hash":"72343e752cdb1995349a1338b5667a275cabd6f1","commercialScore":0,"negativeRegularScore":0,"negativeScore":0,"positiveScore":0,"score":0,"grade":""},{"date":20210205,"state":"AK","positive":53279,"probableCases":null,"negative":null,"pending":null,"totalTestResultsSource":"totalTestsViral","totalTestResults":1536911,"hospitalizedCurrently":44,"hospitalizedCumulative":1219,"inIcuCurrently":null,"inIcuCumulative":null,"onVentilatorCurrently":11,"onVentilatorCumulative":null,"recovered":null,"lastUpdateEt":"2/5/2021 03:59","dateModified":"2021-02-05T03:59:00Z","checkTimeEt":"02/04 22:59","death":279,"hospitalized":1219,"hospitalizedDischarged":null,"dateChecked":"2021-02-05T03:59:00Z","totalTestsViral":1536911,"positiveTestsViral":64404,"negativeTestsViral":1470760,"positiveCasesViral":null,"deathConfirmed":null,"deathProbable":null,"totalTestEncountersViral":null,"totalTestsPeopleViral":null,"totalTestsAntibody":null,"positiveTestsAntibody":null,"negativeTestsAntibody":null,"totalTestsPeopleAntibody":null,"positiveTestsPeopleAntibody":null,"negativeTestsPeopleAntibody":null,"totalTestsPeopleAntigen":null,"positiveTestsPeopleAntigen":null,"totalTestsAntigen":null,"positiveTestsAntigen":null,"fips":"02","positiveIncrease":165,"negativeIncrease":0,"total":53279,"totalTestResultsIncrease":7345,"posNeg":53279,"dataQualityGrade":null,"deathIncrease":0,"hospitalizedIncrease":5,"hash":"03ae1d67b7c07ee9f81ed3c14f8675d10528584c","commercialScore":0,"negativeRegularScore":0,"negativeScore":0,"positiveScore":0,"score":0,"grade":""},{"date":20210204,"state":"AK","positive":53114,"probableCases":null,"negative":null,"pending":null,"totalTestResultsSource":"totalTestsViral","totalTestResults":1529566,"hospitalizedCurrently":43,"hospitalizedCumulative":1214,"inIcuCurrently":null,"inIcuCumulative":null,"onVentilatorCurrently":10,"onVentilatorCumulative":null,"recovered":null,"lastUpdateEt":"2/4/2021 03:59","dateModified":"2021-02-04T03:59:00Z","checkTimeEt":"02/03 22:59","death":279,"hospitalized":1214,"hospitalizedDischarged":null,"dateChecked":"2021-02-04T03:59:00Z","totalTestsViral":1529566,"positiveTestsViral":64183,"negativeTestsViral":1463638,"positiveCasesViral":null,"deathConfirmed":null,"deathProbable":null,"totalTestEncountersViral":null,"totalTestsPeopleViral":null,"totalTestsAntibody":null,"positiveTestsAntibody":null,"negativeTestsAntibody":null,"totalTestsPeopleAntibody":null,"positiveTestsPeopleAntibody":null,"negativeTestsPeopleAntibody":null,"totalTestsPeopleAntigen":null,"positiveTestsPeopleAntigen":null,"totalTestsAntigen":null,"positiveTestsAntigen":null,"fips":"02","positiveIncrease":158,"negativeIncrease":0,"total":53114,"totalTestResultsIncrease":9360,"posNeg":53114,"dataQualityGrade":null,"deathIncrease":0,"hospitalizedIncrease":1,"hash":"baae7e6605b4bb94f994c17abb85e5f6864a9aad","commercialScore":0,"negativeRegularScore":0,"negativeScore":0,"positiveScore":0,"score":0,"grade":""},{"date":20210203,"state":"AK","positive":52956,"probableCases":null,"negative":null,"pending":null,"totalTestResultsSource":"totalTestsViral","totalTestResults":1520206,"hospitalizedCurrently":42,"hospitalizedCumulative":1213,"inIcuCurrently":null,"inIcuCumulative":null,"onVentilatorCurrently":10,"onVentilatorCumulative":null,"recovered":null,"lastUpdateEt":"2/3/2021 03:59","dateModified":"2021-02-03T03:59:00Z","checkTimeEt":"02/02 22:59","death":279,"hospitalized":1213,"hospitalizedDischarged":null,"dateChecked":"2021-02-03T03:59:00Z","totalTestsViral":1520206,"positiveTestsViral":63692,"negativeTestsViral":1454776,"positiveCasesViral":null,"deathConfirmed":null,"deathProbable":null,"totalTestEncountersViral":null,"totalTestsPeopleViral":null,"totalTestsAntibody":null,"positiveTestsAntibody":null,"negativeTestsAntibody":null,"totalTestsPeopleAntibody":null,"positiveTestsPeopleAntibody":null,"negativeTestsPeopleAntibody":null,"totalTestsPeopleAntigen":null,"positiveTestsPeopleAntigen":null,"totalTestsAntigen":null,"positiveTestsAntigen":null,"fips":"02","positiveIncrease":181,"negativeIncrease":0,"total":52956,"totalTestResultsIncrease":8421,"posNeg":52956,"dataQualityGrade":null,"deathIncrease":0,"hospitalizedIncrease":4,"hash":"203c9e7a045719599de6a176778affc9acb349f4","commercialScore":0,"negativeRegularScore":0,"negativeScore":0,"positiveScore":0,"score":0,"grade":""},{"date":20210202,"state":"AK","positive":52775,"probableCases":null,"negative":null,"pending":null,"totalTestResultsSource":"totalTestsViral","totalTestResults":1511785,"hospitalizedCurrently":49,"hospitalizedCumulative":1209,"inIcuCurrently":null,"inIcuCumulative":null,"onVentilatorCurrently":10,"onVentilatorCumulative":null,"recovered":null,"lastUpdateEt":"2/2/2021 03:59","dateModified":"2021-02-02T03:59:00Z","checkTimeEt":"02/01 22:59","death":279,"hospitalized":1209,"hospitalizedDischarged":null,"dateChecked":"2021-02-02T03:59:00Z","totalTestsViral":1511785,"positiveTestsViral":63485,"negativeTestsViral":1446577,"positiveCasesViral":null,"deathConfirmed":null,"deathProbable":null,"totalTestEncountersViral":null,"totalTestsPeopleViral":null,"totalTestsAntibody":null,"positiveTestsAntibody":null,"negativeTestsAntibody":null,"totalTestsPeopleAntibody":null,"positiveTestsPeopleAntibody":null,"negativeTestsPeopleAntibody":null,"totalTestsPeopleAntigen":null,"positiveTestsPeopleAntigen":null,"totalTestsAntigen":null,"positiveTestsAntigen":null,"fips":"02","positiveIncrease":107,"negativeIncrease":0,"total":52775,"totalTestResultsIncrease":4123,"posNeg":52775,"dataQualityGrade":null,"deathIncrease":17,"hospitalizedIncrease":4,"hash":"4635db34a5e1a4bc2fc4fb076933d38bd911d75b","commercialScore":0,"negativeRegularScore":0,"negativeScore":0,"positiveScore":0,"score":0,"grade":""},{"date":20210201,"state":"AK","positive":52668,"probableCases":null,"negative":null,"pending":null,"totalTestResultsSource":"totalTestsViral","totalTestResults":1507662,"hospitalizedCurrently":43,"hospitalizedCumulative":1205,"inIcuCurrently":null,"inIcuCumulative":null,"onVentilatorCurrently":10,"onVentilatorCumulative":null,"recovered":null,"lastUpdateEt":"2/1/2021 03:59","dateModified":"2021-02-01T03:59:00Z","checkTimeEt":"01/31 22:59","death":262,"hospitalized":1205,"hospitalizedDischarged":null,"dateChecked":"2021-02-01T03:59:00Z","totalTestsViral":1507662,"positiveTestsViral":63384,"negativeTestsViral":1442574,"positiveCasesViral":null,"deathConfirmed":null,"deathProbable":null,"totalTestEncountersViral":null,"totalTestsPeopleViral":null,"totalTestsAntibody":null,"positiveTestsAntibody":null,"negativeTestsAntibody":null,"totalTestsPeopleAntibody":null,"positiveTestsPeopleAntibody":null,"negativeTestsPeopleAntibody":null,"totalTestsPeopleAntigen":null,"positiveTestsPeopleAntigen":null,"totalTestsAntigen":null,"positiveTestsAntigen":null,"fips":"02","positiveIncrease":70,"negativeIncrease":0,"total":52668,"totalTestResultsIncrease":7337,"posNeg":52668,"dataQualityGrade":null,"deathIncrease":0,"hospitalizedIncrease":0,"hash":"5aab393882c716836ef3f895b114c443a63ba6d0","commercialScore":0,"negativeRegularScore":0,"negativeScore":0,"positiveScore":0,"score":0,"grade":""},{"date":20210131,"state":"AK","positive":52598,"probableCases":null,"negative":null,"pending":null,"totalTestResultsSource":"totalTestsViral","totalTestResults":1500325,"hospitalizedCurrently":42,"hospitalizedCumulative":1205,"inIcuCurrently":null,"inIcuCumulative":null,"onVentilatorCurrently":9,"onVentilatorCumulative":null,"recovered":null,"lastUpdateEt":"1/31/2021 03:59","dateModified":"2021-01-31T03:59:00Z","checkTimeEt":"01/30 22:59","death":262,"hospitalized":1205,"hospitalizedDischarged":null,"dateChecked":"2021-01-31T03:59:00Z","totalTestsViral":1500325,"positiveTestsViral":63202,"negativeTestsViral":1435424,"positiveCasesViral":null,"deathConfirmed":null,"deathProbable":null,"totalTestEncountersViral":null,"totalTestsPeopleViral":null,"totalTestsAntibody":null,"positiveTestsAntibody":null,"negativeTestsAntibody":null,"totalTestsPeopleAntibody":null,"positiveTestsPeopleAntibody":null,"negativeTestsPeopleAntibody":null,"totalTestsPeopleAntigen":null,"positiveTestsPeopleAntigen":null,"totalTestsAntigen":null,"positiveTestsAntigen":null,"fips":"02","positiveIncrease":128,"negativeIncrease":0,"total":52598,"totalTestResultsIncrease":4440,"posNeg":52598,"dataQualityGrade":null,"deathIncrease":0,"hospitalizedIncrease":0,"hash":"b5e172a9cc81480043d0b4f731acdde02485a643","commercialScore":0,"negativeRegularScore":0,"negativeScore":0,"positiveScore":0,"score":0,"grade":""},{"date":20210130,"state":"AK","positive":52470,"probableCases":null,"negative":null,"pending":null,"totalTestResultsSource":"totalTestsViral","totalTestResults":1495885,"hospitalizedCurrently":39,"hospitalizedCumulative":1205,"inIcuCurrently":null,"inIcuCumulative":null,"onVentilatorCurrently":10,"onVentilatorCumulative":null,"recovered":null,"lastUpdateEt":"1/30/2021 03:59","dateModified":"2021-01-30T03:59:00Z","checkTimeEt":"01/29 22:59","death":262,"hospitalized":1205,"hospitalizedDischarged":null,"dateChecked":"2021-01-30T03:59:00Z","totalTestsViral":1495885,"positiveTestsViral":63117,"negativeTestsViral":1431069,"positiveCasesViral":null,"deathConfirmed":null,"deathProbable":null,"totalTestEncountersViral":null,"totalTestsPeopleViral":null,"totalTestsAntibody":null,"positiveTestsAntibody":null,"negativeTestsAntibody":null,"totalTestsPeopleAntibody":null,"positiveTestsPeopleAntibody":null,"negativeTestsPeopleAntibody":null,"totalTestsPeopleAntigen":null,"positiveTestsPeopleAntigen":null,"totalTestsAntigen":null,"positiveTestsAntigen":null,"fips":"02","positiveIncrease":135,"negativeIncrease":0,"total":52470,"totalTestResultsIncrease":6119,"posNeg":52470,"dataQualityGrade":null,"deathIncrease":0,"hospitalizedIncrease":3,"hash":"0e9150b53f71a70224f3e564fa6f93c1ca0fee52","commercialScore":0,"negativeRegularScore":0,"negativeScore":0,"positiveScore":0,"score":0,"grade":""},{"date":20210129,"state":"AK","positive":52335,"probableCases":null,"negative":null,"pending":null,"totalTestResultsSource":"totalTestsViral","totalTestResults":1489766,"hospitalizedCurrently":48,"hospitalizedCumulative":1202,"inIcuCurrently":null,"inIcuCumulative":null,"onVentilatorCurrently":10,"onVentilatorCumulative":null,"recovered":null,"lastUpdateEt":"1/29/2021 03:59","dateModified":"2021-01-29T03:59:00Z","checkTimeEt":"01/28 22:59","death":262,"hospitalized":1202,"hospitalizedDischarged":null,"dateChecked":"2021-01-29T03:59:00Z","totalTestsViral":1489766,"positiveTestsViral":62949,"negativeTestsViral":1425130,"positiveCasesViral":null,"deathConfirmed":null,"deathProbable":null,"totalTestEncountersViral":null,"totalTestsPeopleViral":null,"totalTestsAntibody":null,"positiveTestsAntibody":null,"negativeTestsAntibody":null,"totalTestsPeopleAntibody":null,"positiveTestsPeopleAntibody":null,"negativeTestsPeopleAntibody":null,"totalTestsPeopleAntigen":null,"positiveTestsPeopleAntigen":null,"totalTestsAntigen":null,"positiveTestsAntigen":null,"fips":"02","positiveIncrease":185,"negativeIncrease":0,"total":52335,"totalTestResultsIncrease":9917,"posNeg":52335,"dataQualityGrade":null,"deathIncrease":0,"hospitalizedIncrease":1,"hash":"6834bfaa81dffad91e3a58767da926a34260fdad","commercialScore":0,"negativeRegularScore":0,"negativeScore":0,"positiveScore":0,"score":0,"grade":""},{"date":20210128,"state":"AK","positive":52150,"probableCases":null,"negative":null,"pending":null,"totalTestResultsSource":"totalTestsViral","totalTestResults":1479849,"hospitalizedCurrently":42,"hospitalizedCumulative":1201,"inIcuCurrently":null,"inIcuCumulative":null,"onVentilatorCurrently":5,"onVentilatorCumulative":null,"recovered":null,"lastUpdateEt":"1/28/2021 03:59","dateModified":"2021-01-28T03:59:00Z","checkTimeEt":"01/27 22:59","death":262,"hospitalized":1201,"hospitalizedDischarged":null,"dateChecked":"2021-01-28T03:59:00Z","totalTestsViral":1479849,"positiveTestsViral":62705,"negativeTestsViral":1415473,"positiveCasesViral":null,"deathConfirmed":null,"deathProbable":null,"totalTestEncountersViral":null,"totalTestsPeopleViral":null,"totalTestsAntibody":null,"positiveTestsAntibody":null,"negativeTestsAntibody":null,"totalTestsPeopleAntibody":null,"positiveTestsPeopleAntibody":null,"negativeTestsPeopleAntibody":null,"totalTestsPeopleAntigen":null,"positiveTestsPeopleAntigen":null,"totalTestsAntigen":null,"positiveTestsAntigen":null,"fips":"02","positiveIncrease":199,"negativeIncrease":0,"total":52150,"totalTestResultsIncrease":12449,"posNeg":52150,"dataQualityGrade":null,"deathIncrease":1,"hospitalizedIncrease":1,"hash":"564e0ae5c6a2fd039261e99f8b3330328762b2fe","commercialScore":0,"negativeRegularScore":0,"negativeScore":0,"positiveScore":0,"score":0,"grade":""},{"date":20210127,"state":"AK","positive":51951,"probableCases":null,"negative":null,"pending":null,"totalTestResultsSource":"totalTestsViral","totalTestResults":1467400,"hospitalizedCurrently":49,"hospitalizedCumulative":1200,"inIcuCurrently":null,"inIcuCumulative":null,"onVentilatorCurrently":5,"onVentilatorCumulative":null,"recovered":null,"lastUpdateEt":"1/27/2021 03:59","dateModified":"2021-01-27T03:59:00Z","checkTimeEt":"01/26 22:59","death":261,"hospitalized":1200,"hospitalizedDischarged":null,"dateChecked":"2021-01-27T03:59:00Z","totalTestsViral":1467400,"positiveTestsViral":62323,"negativeTestsViral":1403422,"positiveCasesViral":null,"deathConfirmed":null,"deathProbable":null,"totalTestEncountersViral":null,"totalTestsPeopleViral":null,"totalTestsAntibody":null,"positiveTestsAntibody":null,"negativeTestsAntibody":null,"totalTestsPeopleAntibody":null,"positiveTestsPeopleAntibody":null,"negativeTestsPeopleAntibody":null,"totalTestsPeopleAntigen":null,"positiveTestsPeopleAntigen":null,"totalTestsAntigen":null,"positiveTestsAntigen":null,"fips":"02","positiveIncrease":173,"negativeIncrease":0,"total":51951,"totalTestResultsIncrease":7211,"posNeg":51951,"dataQualityGrade":null,"deathIncrease":1,"hospitalizedIncrease":6,"hash":"80fb057a475512293fb257ae3e8bc310b516238d","commercialScore":0,"negativeRegularScore":0,"negativeScore":0,"positiveScore":0,"score":0,"grade":""},{"date":20210126,"state":"AK","positive":51778,"probableCases":null,"negative":null,"pending":null,"totalTestResultsSource":"totalTestsViral","totalTestResults":1460189,"hospitalizedCurrently":57,"hospitalizedCumulative":1194,"inIcuCurrently":null,"inIcuCumulative":null,"onVentilatorCurrently":5,"onVentilatorCumulative":null,"recovered":null,"lastUpdateEt":"1/26/2021 03:59","dateModified":"2021-01-26T03:59:00Z","checkTimeEt":"01/25 22:59","death":260,"hospitalized":1194,"hospitalizedDischarged":null,"dateChecked":"2021-01-26T03:59:00Z","totalTestsViral":1460189,"positiveTestsViral":62144,"negativeTestsViral":1396391,"positiveCasesViral":null,"deathConfirmed":null,"deathProbable":null,"totalTestEncountersViral":null,"totalTestsPeopleViral":null,"totalTestsAntibody":null,"positiveTestsAntibody":null,"negativeTestsAntibody":null,"totalTestsPeopleAntibody":null,"positiveTestsPeopleAntibody":null,"negativeTestsPeopleAntibody":null,"totalTestsPeopleAntigen":null,"positiveTestsPeopleAntigen":null,"totalTestsAntigen":null,"positiveTestsAntigen":null,"fips":"02","positiveIncrease":85,"negativeIncrease":0,"total":51778,"totalTestResultsIncrease":3136,"posNeg":51778,"dataQualityGrade":null,"deathIncrease":1,"hospitalizedIncrease":9,"hash":"168172a367c88c32479038e2675229893f435e0d","commercialScore":0,"negativeRegularScore":0,"negativeScore":0,"positiveScore":0,"score":0,"grade":""},{"date":20210125,"state":"AK","positive":51693,"probableCases":null,"negative":null,"pending":null,"totalTestResultsSource":"totalTestsViral","totalTestResults":1457053,"hospitalizedCurrently":54,"hospitalizedCumulative":1185,"inIcuCurrently":null,"inIcuCumulative":null,"onVentilatorCurrently":7,"onVentilatorCumulative":null,"recovered":null,"lastUpdateEt":"1/25/2021 03:59","dateModified":"2021-01-25T03:59:00Z","checkTimeEt":"01/24 22:59","death":259,"hospitalized":1185,"hospitalizedDischarged":null,"dateChecked":"2021-01-25T03:59:00Z","totalTestsViral":1457053,"positiveTestsViral":62017,"negativeTestsViral":1393392,"positiveCasesViral":null,"deathConfirmed":null,"deathProbable":null,"totalTestEncountersViral":null,"totalTestsPeopleViral":null,"totalTestsAntibody":null,"positiveTestsAntibody":null,"negativeTestsAntibody":null,"totalTestsPeopleAntibody":null,"positiveTestsPeopleAntibody":null,"negativeTestsPeopleAntibody":null,"totalTestsPeopleAntigen":null,"positiveTestsPeopleAntigen":null,"totalTestsAntigen":null,"positiveTestsAntigen":null,"fips":"02","positiveIncrease":83,"negativeIncrease":0,"total":51693,"totalTestResultsIncrease":3583,"posNeg":51693,"dataQualityGrade":null,"deathIncrease":0,"hospitalizedIncrease":0,"hash":"25b5df183b2a18df13310ab345e0b8408d4eb916","commercialScore":0,"negativeRegularScore":0,"negativeScore":0,"positiveScore":0,"score":0,"grade":""},{"date":20210124,"state":"AK","positive":51610,"probableCases":null,"negative":null,"pending":null,"totalTestResultsSource":"totalTestsViral","totalTestResults":1453470,"hospitalizedCurrently":57,"hospitalizedCumulative":1185,"inIcuCurrently":null,"inIcuCumulative":null,"onVentilatorCurrently":7,"onVentilatorCumulative":null,"recovered":null,"lastUpdateEt":"1/24/2021 03:59","dateModified":"2021-01-24T03:59:00Z","checkTimeEt":"01/23 22:59","death":259,"hospitalized":1185,"hospitalizedDischarged":null,"dateChecked":"2021-01-24T03:59:00Z","totalTestsViral":1453470,"positiveTestsViral":61912,"negativeTestsViral":1389919,"positiveCasesViral":null,"deathConfirmed":null,"deathProbable":null,"totalTestEncountersViral":null,"totalTestsPeopleViral":null,"totalTestsAntibody":null,"positiveTestsAntibody":null,"negativeTestsAntibody":null,"totalTestsPeopleAntibody":null,"positiveTestsPeopleAntibody":null,"negativeTestsPeopleAntibody":null,"totalTestsPeopleAntigen":null,"positiveTestsPeopleAntigen":null,"totalTestsAntigen":null,"positiveTestsAntigen":null,"fips":"02","positiveIncrease":165,"negativeIncrease":0,"total":51610,"totalTestResultsIncrease":6956,"posNeg":51610,"dataQualityGrade":null,"deathIncrease":0,"hospitalizedIncrease":1,"hash":"acc33a6e97df58bad51e9cbe56a3e86c22d216e7","commercialScore":0,"negativeRegularScore":0,"negativeScore":0,"positiveScore":0,"score":0,"grade":""},{"date":20210123,"state":"AK","positive":51445,"probableCases":null,"negative":null,"pending":null,"totalTestResultsSource":"totalTestsViral","totalTestResults":1446514,"hospitalizedCurrently":56,"hospitalizedCumulative":1184,"inIcuCurrently":null,"inIcuCumulative":null,"onVentilatorCurrently":7,"onVentilatorCumulative":null,"recovered":null,"lastUpdateEt":"1/23/2021 03:59","dateModified":"2021-01-23T03:59:00Z","checkTimeEt":"01/22 22:59","death":259,"hospitalized":1184,"hospitalizedDischarged":null,"dateChecked":"2021-01-23T03:59:00Z","totalTestsViral":1446514,"positiveTestsViral":61718,"negativeTestsViral":1383165,"positiveCasesViral":null,"deathConfirmed":null,"deathProbable":null,"totalTestEncountersViral":null,"totalTestsPeopleViral":null,"totalTestsAntibody":null,"positiveTestsAntibody":null,"negativeTestsAntibody":null,"totalTestsPeopleAntibody":null,"positiveTestsPeopleAntibody":null,"negativeTestsPeopleAntibody":null,"totalTestsPeopleAntigen":null,"positiveTestsPeopleAntigen":null,"totalTestsAntigen":null,"positiveTestsAntigen":null,"fips":"02","positiveIncrease":241,"negativeIncrease":0,"total":51445,"totalTestResultsIncrease":7556,"posNeg":51445,"dataQualityGrade":null,"deathIncrease":5,"hospitalizedIncrease":0,"hash":"87b79ed3d8220fdfea23c62e47d0741e237c3c39","commercialScore":0,"negativeRegularScore":0,"negativeScore":0,"positiveScore":0,"score":0,"grade":""},{"date":20210122,"state":"AK","positive":51204,"probableCases":null,"negative":null,"pending":null,"totalTestResultsSource":"totalTestsViral","totalTestResults":1438958,"hospitalizedCurrently":51,"hospitalizedCumulative":1184,"inIcuCurrently":null,"inIcuCumulative":null,"onVentilatorCurrently":7,"onVentilatorCumulative":null,"recovered":null,"lastUpdateEt":"1/22/2021 03:59","dateModified":"2021-01-22T03:59:00Z","checkTimeEt":"01/21 22:59","death":254,"hospitalized":1184,"hospitalizedDischarged":null,"dateChecked":"2021-01-22T03:59:00Z","totalTestsViral":1438958,"positiveTestsViral":61488,"negativeTestsViral":1375841,"positiveCasesViral":null,"deathConfirmed":null,"deathProbable":null,"totalTestEncountersViral":null,"totalTestsPeopleViral":null,"totalTestsAntibody":null,"positiveTestsAntibody":null,"negativeTestsAntibody":null,"totalTestsPeopleAntibody":null,"positiveTestsPeopleAntibody":null,"negativeTestsPeopleAntibody":null,"totalTestsPeopleAntigen":null,"positiveTestsPeopleAntigen":null,"totalTestsAntigen":null,"positiveTestsAntigen":null,"fips":"02","positiveIncrease":263,"negativeIncrease":0,"total":51204,"totalTestResultsIncrease":7991,"posNeg":51204,"dataQualityGrade":null,"deathIncrease":0,"hospitalizedIncrease":7,"hash":"8a93c7eb71ab4c8293c71ba0e5985eb3480382c9","commercialScore":0,"negativeRegularScore":0,"negativeScore":0,"positiveScore":0,"score":0,"grade":""},{"date":20210121,"state":"AK","positive":50941,"probableCases":null,"negative":null,"pending":null,"totalTestResultsSource":"totalTestsViral","totalTestResults":1430967,"hospitalizedCurrently":58,"hospitalizedCumulative":1177,"inIcuCurrently":null,"inIcuCumulative":null,"onVentilatorCurrently":7,"onVentilatorCumulative":null,"recovered":null,"lastUpdateEt":"1/21/2021 03:59","dateModified":"2021-01-21T03:59:00Z","checkTimeEt":"01/20 22:59","death":254,"hospitalized":1177,"hospitalizedDischarged":null,"dateChecked":"2021-01-21T03:59:00Z","totalTestsViral":1430967,"positiveTestsViral":61170,"negativeTestsViral":1368174,"positiveCasesViral":null,"deathConfirmed":null,"deathProbable":null,"totalTestEncountersViral":null,"totalTestsPeopleViral":null,"totalTestsAntibody":null,"positiveTestsAntibody":null,"negativeTestsAntibody":null,"totalTestsPeopleAntibody":null,"positiveTestsPeopleAntibody":null,"negativeTestsPeopleAntibody":null,"totalTestsPeopleAntigen":null,"positiveTestsPeopleAntigen":null,"totalTestsAntigen":null,"positiveTestsAntigen":null,"fips":"02","positiveIncrease":209,"negativeIncrease":0,"total":50941,"totalTestResultsIncrease":10845,"posNeg":50941,"dataQualityGrade":null,"deathIncrease":1,"hospitalizedIncrease":7,"hash":"dbbaeb7b7e8a295650bac97e0b3dee218f0a7c34","commercialScore":0,"negativeRegularScore":0,"negativeScore":0,"positiveScore":0,"score":0,"grade":""},{"date":20210120,"state":"AK","positive":50732,"probableCases":null,"negative":null,"pending":null,"totalTestResultsSource":"totalTestsViral","totalTestResults":1420122,"hospitalizedCurrently":57,"hospitalizedCumulative":1170,"inIcuCurrently":null,"inIcuCumulative":null,"onVentilatorCurrently":9,"onVentilatorCumulative":null,"recovered":null,"lastUpdateEt":"1/20/2021 03:59","dateModified":"2021-01-20T03:59:00Z","checkTimeEt":"01/19 22:59","death":253,"hospitalized":1170,"hospitalizedDischarged":null,"dateChecked":"2021-01-20T03:59:00Z","totalTestsViral":1420122,"positiveTestsViral":60791,"negativeTestsViral":1357771,"positiveCasesViral":null,"deathConfirmed":null,"deathProbable":null,"totalTestEncountersViral":null,"totalTestsPeopleViral":null,"totalTestsAntibody":null,"positiveTestsAntibody":null,"negativeTestsAntibody":null,"totalTestsPeopleAntibody":null,"positiveTestsPeopleAntibody":null,"negativeTestsPeopleAntibody":null,"totalTestsPeopleAntigen":null,"positiveTestsPeopleAntigen":null,"totalTestsAntigen":null,"positiveTestsAntigen":null,"fips":"02","positiveIncrease":160,"negativeIncrease":0,"total":50732,"totalTestResultsIncrease":5591,"posNeg":50732,"dataQualityGrade":null,"deathIncrease":23,"hospitalizedIncrease":8,"hash":"d9de26404c0b41c46d2c2fec2f46bc918ca9e23e","commercialScore":0,"negativeRegularScore":0,"negativeScore":0,"positiveScore":0,"score":0,"grade":""},{"date":20210119,"state":"AK","positive":50572,"probableCases":null,"negative":null,"pending":null,"totalTestResultsSource":"totalTestsViral","totalTestResults":1414531,"hospitalizedCurrently":61,"hospitalizedCumulative":1162,"inIcuCurrently":null,"inIcuCumulative":null,"onVentilatorCurrently":9,"onVentilatorCumulative":null,"recovered":null,"lastUpdateEt":"1/19/2021 03:59","dateModified":"2021-01-19T03:59:00Z","checkTimeEt":"01/18 22:59","death":230,"hospitalized":1162,"hospitalizedDischarged":null,"dateChecked":"2021-01-19T03:59:00Z","totalTestsViral":1414531,"positiveTestsViral":60601,"negativeTestsViral":1352390,"positiveCasesViral":null,"deathConfirmed":null,"deathProbable":null,"totalTestEncountersViral":null,"totalTestsPeopleViral":null,"totalTestsAntibody":null,"positiveTestsAntibody":null,"negativeTestsAntibody":null,"totalTestsPeopleAntibody":null,"positiveTestsPeopleAntibody":null,"negativeTestsPeopleAntibody":null,"totalTestsPeopleAntigen":null,"positiveTestsPeopleAntigen":null,"totalTestsAntigen":null,"positiveTestsAntigen":null,"fips":"02","positiveIncrease":125,"negativeIncrease":0,"total":50572,"totalTestResultsIncrease":3771,"posNeg":50572,"dataQualityGrade":null,"deathIncrease":1,"hospitalizedIncrease":9,"hash":"afea4f64e7f60b8123c6fef396668397453214d6","commercialScore":0,"negativeRegularScore":0,"negativeScore":0,"positiveScore":0,"score":0,"grade":""},{"date":20210118,"state":"AK","positive":50447,"probableCases":null,"negative":null,"pending":null,"totalTestResultsSource":"totalTestsViral","totalTestResults":1410760,"hospitalizedCurrently":58,"hospitalizedCumulative":1153,"inIcuCurrently":null,"inIcuCumulative":null,"onVentilatorCurrently":8,"onVentilatorCumulative":null,"recovered":null,"lastUpdateEt":"1/18/2021 03:59","dateModified":"2021-01-18T03:59:00Z","checkTimeEt":"01/17 22:59","death":229,"hospitalized":1153,"hospitalizedDischarged":null,"dateChecked":"2021-01-18T03:59:00Z","totalTestsViral":1410760,"positiveTestsViral":60409,"negativeTestsViral":1348813,"positiveCasesViral":null,"deathConfirmed":null,"deathProbable":null,"totalTestEncountersViral":null,"totalTestsPeopleViral":null,"totalTestsAntibody":null,"positiveTestsAntibody":null,"negativeTestsAntibody":null,"totalTestsPeopleAntibody":null,"positiveTestsPeopleAntibody":null,"negativeTestsPeopleAntibody":null,"totalTestsPeopleAntigen":null,"positiveTestsPeopleAntigen":null,"totalTestsAntigen":null,"positiveTestsAntigen":null,"fips":"02","positiveIncrease":151,"negativeIncrease":0,"total":50447,"totalTestResultsIncrease":6004,"posNeg":50447,"dataQualityGrade":null,"deathIncrease":0,"hospitalizedIncrease":0,"hash":"8b93a15e4e70370e5f33dd2b8a0b04a85f8f50ec","commercialScore":0,"negativeRegularScore":0,"negativeScore":0,"positiveScore":0,"score":0,"grade":""},{"date":20210117,"state":"AK","positive":50296,"probableCases":null,"negative":null,"pending":null,"totalTestResultsSource":"totalTestsViral","totalTestResults":1404756,"hospitalizedCurrently":70,"hospitalizedCumulative":1153,"inIcuCurrently":null,"inIcuCumulative":null,"onVentilatorCurrently":8,"onVentilatorCumulative":null,"recovered":null,"lastUpdateEt":"1/17/2021 03:59","dateModified":"2021-01-17T03:59:00Z","checkTimeEt":"01/16 22:59","death":229,"hospitalized":1153,"hospitalizedDischarged":null,"dateChecked":"2021-01-17T03:59:00Z","totalTestsViral":1404756,"positiveTestsViral":60195,"negativeTestsViral":1343030,"positiveCasesViral":null,"deathConfirmed":null,"deathProbable":null,"totalTestEncountersViral":null,"totalTestsPeopleViral":null,"totalTestsAntibody":null,"positiveTestsAntibody":null,"negativeTestsAntibody":null,"totalTestsPeopleAntibody":null,"positiveTestsPeopleAntibody":null,"negativeTestsPeopleAntibody":null,"totalTestsPeopleAntigen":null,"positiveTestsPeopleAntigen":null,"totalTestsAntigen":null,"positiveTestsAntigen":null,"fips":"02","positiveIncrease":279,"negativeIncrease":0,"total":50296,"totalTestResultsIncrease":6107,"posNeg":50296,"dataQualityGrade":null,"deathIncrease":0,"hospitalizedIncrease":1,"hash":"ae041b6d3fb0fbe62c27b0eca0a894eba5f6fa0b","commercialScore":0,"negativeRegularScore":0,"negativeScore":0,"positiveScore":0,"score":0,"grade":""},{"date":20210116,"state":"AK","positive":50017,"probableCases":null,"negative":null,"pending":null,"totalTestResultsSource":"totalTestsViral","totalTestResults":1398649,"hospitalizedCurrently":67,"hospitalizedCumulative":1152,"inIcuCurrently":null,"inIcuCumulative":null,"onVentilatorCurrently":9,"onVentilatorCumulative":null,"recovered":null,"lastUpdateEt":"1/16/2021 03:59","dateModified":"2021-01-16T03:59:00Z","checkTimeEt":"01/15 22:59","death":229,"hospitalized":1152,"hospitalizedDischarged":null,"dateChecked":"2021-01-16T03:59:00Z","totalTestsViral":1398649,"positiveTestsViral":59982,"negativeTestsViral":1337142,"positiveCasesViral":null,"deathConfirmed":null,"deathProbable":null,"totalTestEncountersViral":null,"totalTestsPeopleViral":null,"totalTestsAntibody":null,"positiveTestsAntibody":null,"negativeTestsAntibody":null,"totalTestsPeopleAntibody":null,"positiveTestsPeopleAntibody":null,"negativeTestsPeopleAntibody":null,"totalTestsPeopleAntigen":null,"positiveTestsPeopleAntigen":null,"totalTestsAntigen":null,"positiveTestsAntigen":null,"fips":"02","positiveIncrease":182,"negativeIncrease":0,"total":50017,"totalTestResultsIncrease":9423,"posNeg":50017,"dataQualityGrade":null,"deathIncrease":0,"hospitalizedIncrease":0,"hash":"4af1d040c7a9bfebf6dd744174b7ad3cebddb79a","commercialScore":0,"negativeRegularScore":0,"negativeScore":0,"positiveScore":0,"score":0,"grade":""},{"date":20210115,"state":"AK","positive":49835,"probableCases":null,"negative":null,"pending":null,"totalTestResultsSource":"totalTestsViral","totalTestResults":1389226,"hospitalizedCurrently":77,"hospitalizedCumulative":1152,"inIcuCurrently":null,"inIcuCumulative":null,"onVentilatorCurrently":10,"onVentilatorCumulative":null,"recovered":null,"lastUpdateEt":"1/15/2021 03:59","dateModified":"2021-01-15T03:59:00Z","checkTimeEt":"01/14 22:59","death":229,"hospitalized":1152,"hospitalizedDischarged":null,"dateChecked":"2021-01-15T03:59:00Z","totalTestsViral":1389226,"positiveTestsViral":59624,"negativeTestsViral":1328089,"positiveCasesViral":null,"deathConfirmed":null,"deathProbable":null,"totalTestEncountersViral":null,"totalTestsPeopleViral":null,"totalTestsAntibody":null,"positiveTestsAntibody":null,"negativeTestsAntibody":null,"totalTestsPeopleAntibody":null,"positiveTestsPeopleAntibody":null,"negativeTestsPeopleAntibody":null,"totalTestsPeopleAntigen":null,"positiveTestsPeopleAntigen":null,"totalTestsAntigen":null,"positiveTestsAntigen":null,"fips":"02","positiveIncrease":300,"negativeIncrease":0,"total":49835,"totalTestResultsIncrease":6950,"posNeg":49835,"dataQualityGrade":null,"deathIncrease":1,"hospitalizedIncrease":3,"hash":"6e3996f208d351f9314cc8f074a01268a1d43faf","commercialScore":0,"negativeRegularScore":0,"negativeScore":0,"positiveScore":0,"score":0,"grade":""},{"date":20210114,"state":"AK","positive":49535,"probableCases":null,"negative":null,"pending":null,"totalTestResultsSource":"totalTestsViral","totalTestResults":1382276,"hospitalizedCurrently":81,"hospitalizedCumulative":1149,"inIcuCurrently":null,"inIcuCumulative":null,"onVentilatorCurrently":10,"onVentilatorCumulative":null,"recovered":null,"lastUpdateEt":"1/14/2021 03:59","dateModified":"2021-01-14T03:59:00Z","checkTimeEt":"01/13 22:59","death":228,"hospitalized":1149,"hospitalizedDischarged":null,"dateChecked":"2021-01-14T03:59:00Z","totalTestsViral":1382276,"positiveTestsViral":59332,"negativeTestsViral":1321433,"positiveCasesViral":null,"deathConfirmed":null,"deathProbable":null,"totalTestEncountersViral":null,"totalTestsPeopleViral":null,"totalTestsAntibody":null,"positiveTestsAntibody":null,"negativeTestsAntibody":null,"totalTestsPeopleAntibody":null,"positiveTestsPeopleAntibody":null,"negativeTestsPeopleAntibody":null,"totalTestsPeopleAntigen":null,"positiveTestsPeopleAntigen":null,"totalTestsAntigen":null,"positiveTestsAntigen":null,"fips":"02","positiveIncrease":332,"negativeIncrease":0,"total":49535,"totalTestResultsIncrease":11441,"posNeg":49535,"dataQualityGrade":null,"deathIncrease":2,"hospitalizedIncrease":11,"hash":"68ac9eb99feb89e8e7b984362ffd30b49f8b063a","commercialScore":0,"negativeRegularScore":0,"negativeScore":0,"positiveScore":0,"score":0,"grade":""},{"date":20210113,"state":"AK","positive":49203,"probableCases":null,"negative":null,"pending":null,"totalTestResultsSource":"totalTestsViral","totalTestResults":1370835,"hospitalizedCurrently":68,"hospitalizedCumulative":1138,"inIcuCurrently":null,"inIcuCumulative":null,"onVentilatorCurrently":8,"onVentilatorCumulative":null,"recovered":null,"lastUpdateEt":"1/13/2021 03:59","dateModified":"2021-01-13T03:59:00Z","checkTimeEt":"01/12 22:59","death":226,"hospitalized":1138,"hospitalizedDischarged":null,"dateChecked":"2021-01-13T03:59:00Z","totalTestsViral":1370835,"positiveTestsViral":58985,"negativeTestsViral":1310360,"positiveCasesViral":null,"deathConfirmed":null,"deathProbable":null,"totalTestEncountersViral":null,"totalTestsPeopleViral":null,"totalTestsAntibody":null,"positiveTestsAntibody":null,"negativeTestsAntibody":null,"totalTestsPeopleAntibody":null,"positiveTestsPeopleAntibody":null,"negativeTestsPeopleAntibody":null,"totalTestsPeopleAntigen":null,"positiveTestsPeopleAntigen":null,"totalTestsAntigen":null,"positiveTestsAntigen":null,"fips":"02","positiveIncrease":406,"negativeIncrease":0,"total":49203,"totalTestResultsIncrease":13127,"posNeg":49203,"dataQualityGrade":null,"deathIncrease":2,"hospitalizedIncrease":34,"hash":"ec82b97583c0024143ff6097a39d91c3cb47de39","commercialScore":0,"negativeRegularScore":0,"negativeScore":0,"positiveScore":0,"score":0,"grade":""},{"date":20210112,"state":"AK","positive":48797,"probableCases":null,"negative":null,"pending":null,"totalTestResultsSource":"totalTestsViral","totalTestResults":1357708,"hospitalizedCurrently":79,"hospitalizedCumulative":1104,"inIcuCurrently":null,"inIcuCumulative":null,"onVentilatorCurrently":9,"onVentilatorCumulative":null,"recovered":null,"lastUpdateEt":"1/11/2021 03:59","dateModified":"2021-01-11T03:59:00Z","checkTimeEt":"01/10 22:59","death":224,"hospitalized":1104,"hospitalizedDischarged":null,"dateChecked":"2021-01-11T03:59:00Z","totalTestsViral":1357708,"positiveTestsViral":58423,"negativeTestsViral":1297818,"positiveCasesViral":null,"deathConfirmed":null,"deathProbable":null,"totalTestEncountersViral":null,"totalTestsPeopleViral":null,"totalTestsAntibody":null,"positiveTestsAntibody":null,"negativeTestsAntibody":null,"totalTestsPeopleAntibody":null,"positiveTestsPeopleAntibody":null,"negativeTestsPeopleAntibody":null,"totalTestsPeopleAntigen":null,"positiveTestsPeopleAntigen":null,"totalTestsAntigen":null,"positiveTestsAntigen":null,"fips":"02","positiveIncrease":0,"negativeIncrease":0,"total":48797,"totalTestResultsIncrease":0,"posNeg":48797,"dataQualityGrade":null,"deathIncrease":0,"hospitalizedIncrease":0,"hash":"096c0ad08d8649dfb654b9366795d533fda0a9fd","commercialScore":0,"negativeRegularScore":0,"negativeScore":0,"positiveScore":0,"score":0,"grade":""},{"date":20210111,"state":"AK","positive":48797,"probableCases":null,"negative":null,"pending":null,"totalTestResultsSource":"totalTestsViral","totalTestResults":1357708,"hospitalizedCurrently":79,"hospitalizedCumulative":1104,"inIcuCurrently":null,"inIcuCumulative":null,"onVentilatorCurrently":9,"onVentilatorCumulative":null,"recovered":null,"lastUpdateEt":"1/11/2021 03:59","dateModified":"2021-01-11T03:59:00Z","checkTimeEt":"01/10 22:59","death":224,"hospitalized":1104,"hospitalizedDischarged":null,"dateChecked":"2021-01-11T03:59:00Z","totalTestsViral":1357708,"positiveTestsViral":58423,"negativeTestsViral":1297818,"positiveCasesViral":null,"deathConfirmed":null,"deathProbable":null,"totalTestEncountersViral":null,"totalTestsPeopleViral":null,"totalTestsAntibody":null,"positiveTestsAntibody":null,"negativeTestsAntibody":null,"totalTestsPeopleAntibody":null,"positiveTestsPeopleAntibody":null,"negativeTestsPeopleAntibody":null,"totalTestsPeopleAntigen":null,"positiveTestsPeopleAntigen":null,"totalTestsAntigen":null,"positiveTestsAntigen":null,"fips":"02","positiveIncrease":173,"negativeIncrease":0,"total":48797,"totalTestResultsIncrease":5228,"posNeg":48797,"dataQualityGrade":null,"deathIncrease":0,"hospitalizedIncrease":3,"hash":"2cbae5d93561739f6ebbb44fdbcc1863cf2cf7d1","commercialScore":0,"negativeRegularScore":0,"negativeScore":0,"positiveScore":0,"score":0,"grade":""},{"date":20210110,"state":"AK","positive":48624,"probableCases":null,"negative":null,"pending":null,"totalTestResultsSource":"totalTestsViral","totalTestResults":1352480,"hospitalizedCurrently":82,"hospitalizedCumulative":1101,"inIcuCurrently":null,"inIcuCumulative":null,"onVentilatorCurrently":10,"onVentilatorCumulative":null,"recovered":null,"lastUpdateEt":"1/10/2021 03:59","dateModified":"2021-01-10T03:59:00Z","checkTimeEt":"01/09 22:59","death":224,"hospitalized":1101,"hospitalizedDischarged":null,"dateChecked":"2021-01-10T03:59:00Z","totalTestsViral":1352480,"positiveTestsViral":58210,"negativeTestsViral":1292805,"positiveCasesViral":null,"deathConfirmed":null,"deathProbable":null,"totalTestEncountersViral":null,"totalTestsPeopleViral":null,"totalTestsAntibody":null,"positiveTestsAntibody":null,"negativeTestsAntibody":null,"totalTestsPeopleAntibody":null,"positiveTestsPeopleAntibody":null,"negativeTestsPeopleAntibody":null,"totalTestsPeopleAntigen":null,"positiveTestsPeopleAntigen":null,"totalTestsAntigen":null,"positiveTestsAntigen":null,"fips":"02","positiveIncrease":250,"negativeIncrease":0,"total":48624,"totalTestResultsIncrease":6907,"posNeg":48624,"dataQualityGrade":null,"deathIncrease":0,"hospitalizedIncrease":1,"hash":"c8cce5d8f64008358fc007db70bd3d539e816033","commercialScore":0,"negativeRegularScore":0,"negativeScore":0,"positiveScore":0,"score":0,"grade":""},{"date":20210109,"state":"AK","positive":48374,"probableCases":null,"negative":null,"pending":null,"totalTestResultsSource":"totalTestsViral","totalTestResults":1345573,"hospitalizedCurrently":86,"hospitalizedCumulative":1100,"inIcuCurrently":null,"inIcuCumulative":null,"onVentilatorCurrently":8,"onVentilatorCumulative":null,"recovered":null,"lastUpdateEt":"1/9/2021 03:59","dateModified":"2021-01-09T03:59:00Z","checkTimeEt":"01/08 22:59","death":224,"hospitalized":1100,"hospitalizedDischarged":null,"dateChecked":"2021-01-09T03:59:00Z","totalTestsViral":1345573,"positiveTestsViral":57933,"negativeTestsViral":1286179,"positiveCasesViral":null,"deathConfirmed":null,"deathProbable":null,"totalTestEncountersViral":null,"totalTestsPeopleViral":null,"totalTestsAntibody":null,"positiveTestsAntibody":null,"negativeTestsAntibody":null,"totalTestsPeopleAntibody":null,"positiveTestsPeopleAntibody":null,"negativeTestsPeopleAntibody":null,"totalTestsPeopleAntigen":null,"positiveTestsPeopleAntigen":null,"totalTestsAntigen":null,"positiveTestsAntigen":null,"fips":"02","positiveIncrease":311,"negativeIncrease":0,"total":48374,"totalTestResultsIncrease":7824,"posNeg":48374,"dataQualityGrade":null,"deathIncrease":1,"hospitalizedIncrease":5,"hash":"ccb610984c8477e459c71cdfd436049bba61c91c","commercialScore":0,"negativeRegularScore":0,"negativeScore":0,"positiveScore":0,"score":0,"grade":""},{"date":20210108,"state":"AK","positive":48063,"probableCases":null,"negative":null,"pending":null,"totalTestResultsSource":"totalTestsViral","totalTestResults":1337749,"hospitalizedCurrently":86,"hospitalizedCumulative":1095,"inIcuCurrently":null,"inIcuCumulative":null,"onVentilatorCurrently":8,"onVentilatorCumulative":null,"recovered":null,"lastUpdateEt":"1/8/2021 03:59","dateModified":"2021-01-08T03:59:00Z","checkTimeEt":"01/07 22:59","death":223,"hospitalized":1095,"hospitalizedDischarged":null,"dateChecked":"2021-01-08T03:59:00Z","totalTestsViral":1337749,"positiveTestsViral":57584,"negativeTestsViral":1278710,"positiveCasesViral":null,"deathConfirmed":null,"deathProbable":null,"totalTestEncountersViral":null,"totalTestsPeopleViral":null,"totalTestsAntibody":null,"positiveTestsAntibody":null,"negativeTestsAntibody":null,"totalTestsPeopleAntibody":null,"positiveTestsPeopleAntibody":null,"negativeTestsPeopleAntibody":null,"totalTestsPeopleAntigen":null,"positiveTestsPeopleAntigen":null,"totalTestsAntigen":null,"positiveTestsAntigen":null,"fips":"02","positiveIncrease":403,"negativeIncrease":0,"total":48063,"totalTestResultsIncrease":11207,"posNeg":48063,"dataQualityGrade":null,"deathIncrease":0,"hospitalizedIncrease":11,"hash":"89860cc1e418adc968ac0bf684da3a425413e7f1","commercialScore":0,"negativeRegularScore":0,"negativeScore":0,"positiveScore":0,"score":0,"grade":""},{"date":20210107,"state":"AK","positive":47660,"probableCases":null,"negative":null,"pending":null,"totalTestResultsSource":"totalTestsViral","totalTestResults":1326542,"hospitalizedCurrently":89,"hospitalizedCumulative":1084,"inIcuCurrently":null,"inIcuCumulative":null,"onVentilatorCurrently":8,"onVentilatorCumulative":null,"recovered":null,"lastUpdateEt":"1/7/2021 03:59","dateModified":"2021-01-07T03:59:00Z","checkTimeEt":"01/06 22:59","death":223,"hospitalized":1084,"hospitalizedDischarged":null,"dateChecked":"2021-01-07T03:59:00Z","totalTestsViral":1326542,"positiveTestsViral":57120,"negativeTestsViral":1267982,"positiveCasesViral":null,"deathConfirmed":null,"deathProbable":null,"totalTestEncountersViral":null,"totalTestsPeopleViral":null,"totalTestsAntibody":null,"positiveTestsAntibody":null,"negativeTestsAntibody":null,"totalTestsPeopleAntibody":null,"positiveTestsPeopleAntibody":null,"negativeTestsPeopleAntibody":null,"totalTestsPeopleAntigen":null,"positiveTestsPeopleAntigen":null,"totalTestsAntigen":null,"positiveTestsAntigen":null,"fips":"02","positiveIncrease":326,"negativeIncrease":0,"total":47660,"totalTestResultsIncrease":15527,"posNeg":47660,"dataQualityGrade":null,"deathIncrease":3,"hospitalizedIncrease":10,"hash":"aecae9b48bba7e16f11da1adcf84876882cb8197","commercialScore":0,"negativeRegularScore":0,"negativeScore":0,"positiveScore":0,"score":0,"grade":""},{"date":20210106,"state":"AK","positive":47334,"probableCases":null,"negative":null,"pending":null,"totalTestResultsSource":"totalTestsViral","totalTestResults":1311015,"hospitalizedCurrently":101,"hospitalizedCumulative":1074,"inIcuCurrently":null,"inIcuCumulative":null,"onVentilatorCurrently":6,"onVentilatorCumulative":null,"recovered":null,"lastUpdateEt":"1/6/2021 03:59","dateModified":"2021-01-06T03:59:00Z","checkTimeEt":"01/05 22:59","death":220,"hospitalized":1074,"hospitalizedDischarged":null,"dateChecked":"2021-01-06T03:59:00Z","totalTestsViral":1311015,"positiveTestsViral":56554,"negativeTestsViral":1253043,"positiveCasesViral":null,"deathConfirmed":null,"deathProbable":null,"totalTestEncountersViral":null,"totalTestsPeopleViral":null,"totalTestsAntibody":null,"positiveTestsAntibody":null,"negativeTestsAntibody":null,"totalTestsPeopleAntibody":null,"positiveTestsPeopleAntibody":null,"negativeTestsPeopleAntibody":null,"totalTestsPeopleAntigen":null,"positiveTestsPeopleAntigen":null,"totalTestsAntigen":null,"positiveTestsAntigen":null,"fips":"02","positiveIncrease":328,"negativeIncrease":0,"total":47334,"totalTestResultsIncrease":8156,"posNeg":47334,"dataQualityGrade":null,"deathIncrease":2,"hospitalizedIncrease":18,"hash":"5e16608c722110d2069f8098889f8ace33a67e4f","commercialScore":0,"negativeRegularScore":0,"negativeScore":0,"positiveScore":0,"score":0,"grade":""},{"date":20210105,"state":"AK","positive":47006,"probableCases":null,"negative":null,"pending":null,"totalTestResultsSource":"totalTestsViral","totalTestResults":1302859,"hospitalizedCurrently":93,"hospitalizedCumulative":1056,"inIcuCurrently":null,"inIcuCumulative":null,"onVentilatorCurrently":6,"onVentilatorCumulative":null,"recovered":null,"lastUpdateEt":"1/5/2021 03:59","dateModified":"2021-01-05T03:59:00Z","checkTimeEt":"01/04 22:59","death":218,"hospitalized":1056,"hospitalizedDischarged":null,"dateChecked":"2021-01-05T03:59:00Z","totalTestsViral":1302859,"positiveTestsViral":56193,"negativeTestsViral":1245250,"positiveCasesViral":null,"deathConfirmed":null,"deathProbable":null,"totalTestEncountersViral":null,"totalTestsPeopleViral":null,"totalTestsAntibody":null,"positiveTestsAntibody":null,"negativeTestsAntibody":null,"totalTestsPeopleAntibody":null,"positiveTestsPeopleAntibody":null,"negativeTestsPeopleAntibody":null,"totalTestsPeopleAntigen":null,"positiveTestsPeopleAntigen":null,"totalTestsAntigen":null,"positiveTestsAntigen":null,"fips":"02","positiveIncrease":194,"negativeIncrease":0,"total":47006,"totalTestResultsIncrease":5361,"posNeg":47006,"dataQualityGrade":null,"deathIncrease":0,"hospitalizedIncrease":23,"hash":"2f77691bf62569e9a51fb79ceec78a28cadb4faa","commercialScore":0,"negativeRegularScore":0,"negativeScore":0,"positiveScore":0,"score":0,"grade":""},{"date":20210104,"state":"AK","positive":46812,"probableCases":null,"negative":null,"pending":null,"totalTestResultsSource":"totalTestsViral","totalTestResults":1297498,"hospitalizedCurrently":97,"hospitalizedCumulative":1033,"inIcuCurrently":null,"inIcuCumulative":null,"onVentilatorCurrently":9,"onVentilatorCumulative":null,"recovered":null,"lastUpdateEt":"1/4/2021 03:59","dateModified":"2021-01-04T03:59:00Z","checkTimeEt":"01/03 22:59","death":218,"hospitalized":1033,"hospitalizedDischarged":null,"dateChecked":"2021-01-04T03:59:00Z","totalTestsViral":1297498,"positiveTestsViral":55869,"negativeTestsViral":1240213,"positiveCasesViral":null,"deathConfirmed":null,"deathProbable":null,"totalTestEncountersViral":null,"totalTestsPeopleViral":null,"totalTestsAntibody":null,"positiveTestsAntibody":null,"negativeTestsAntibody":null,"totalTestsPeopleAntibody":null,"positiveTestsPeopleAntibody":null,"negativeTestsPeopleAntibody":null,"totalTestsPeopleAntigen":null,"positiveTestsPeopleAntigen":null,"totalTestsAntigen":null,"positiveTestsAntigen":null,"fips":"02","positiveIncrease":260,"negativeIncrease":0,"total":46812,"totalTestResultsIncrease":3661,"posNeg":46812,"dataQualityGrade":null,"deathIncrease":3,"hospitalizedIncrease":0,"hash":"84239cc04117e10c226eda6fdcff8292b9a17dd7","commercialScore":0,"negativeRegularScore":0,"negativeScore":0,"positiveScore":0,"score":0,"grade":""},{"date":20210103,"state":"AK","positive":46552,"probableCases":null,"negative":null,"pending":null,"totalTestResultsSource":"totalTestsViral","totalTestResults":1293837,"hospitalizedCurrently":87,"hospitalizedCumulative":1033,"inIcuCurrently":null,"inIcuCumulative":null,"onVentilatorCurrently":7,"onVentilatorCumulative":null,"recovered":null,"lastUpdateEt":"1/3/2021 03:59","dateModified":"2021-01-03T03:59:00Z","checkTimeEt":"01/02 22:59","death":215,"hospitalized":1033,"hospitalizedDischarged":null,"dateChecked":"2021-01-03T03:59:00Z","totalTestsViral":1293837,"positiveTestsViral":55664,"negativeTestsViral":1236758,"positiveCasesViral":null,"deathConfirmed":215,"deathProbable":null,"totalTestEncountersViral":null,"totalTestsPeopleViral":null,"totalTestsAntibody":null,"positiveTestsAntibody":null,"negativeTestsAntibody":null,"totalTestsPeopleAntibody":null,"positiveTestsPeopleAntibody":null,"negativeTestsPeopleAntibody":null,"totalTestsPeopleAntigen":null,"positiveTestsPeopleAntigen":null,"totalTestsAntigen":null,"positiveTestsAntigen":null,"fips":"02","positiveIncrease":290,"negativeIncrease":0,"total":46552,"totalTestResultsIncrease":3488,"posNeg":46552,"dataQualityGrade":null,"deathIncrease":0,"hospitalizedIncrease":3,"hash":"235bad6f072b50f1a818293fd856812d2d2eac30","commercialScore":0,"negativeRegularScore":0,"negativeScore":0,"positiveScore":0,"score":0,"grade":""},{"date":20210102,"state":"AK","positive":46262,"probableCases":null,"negative":null,"pending":null,"totalTestResultsSource":"totalTestsViral","totalTestResults":1290349,"hospitalizedCurrently":77,"hospitalizedCumulative":1030,"inIcuCurrently":null,"inIcuCumulative":null,"onVentilatorCurrently":6,"onVentilatorCumulative":null,"recovered":null,"lastUpdateEt":"1/2/2021 03:59","dateModified":"2021-01-02T03:59:00Z","checkTimeEt":"01/01 22:59","death":215,"hospitalized":1030,"hospitalizedDischarged":null,"dateChecked":"2021-01-02T03:59:00Z","totalTestsViral":1290349,"positiveTestsViral":55462,"negativeTestsViral":1233474,"positiveCasesViral":null,"deathConfirmed":215,"deathProbable":null,"totalTestEncountersViral":null,"totalTestsPeopleViral":null,"totalTestsAntibody":null,"positiveTestsAntibody":null,"negativeTestsAntibody":null,"totalTestsPeopleAntibody":null,"positiveTestsPeopleAntibody":null,"negativeTestsPeopleAntibody":null,"totalTestsPeopleAntigen":null,"positiveTestsPeopleAntigen":null,"totalTestsAntigen":null,"positiveTestsAntigen":null,"fips":"02","positiveIncrease":801,"negativeIncrease":0,"total":46262,"totalTestResultsIncrease":14599,"posNeg":46262,"dataQualityGrade":null,"deathIncrease":9,"hospitalizedIncrease":7,"hash":"6cc2ca02f030bcdf5c270f95c21cbe187d3dca97","commercialScore":0,"negativeRegularScore":0,"negativeScore":0,"positiveScore":0,"score":0,"grade":""},{"date":20210101,"state":"AK","positive":45461,"probableCases":null,"negative":null,"pending":null,"totalTestResultsSource":"totalTestsViral","totalTestResults":1275750,"hospitalizedCurrently":79,"hospitalizedCumulative":1023,"inIcuCurrently":null,"inIcuCumulative":null,"onVentilatorCurrently":6,"onVentilatorCumulative":null,"recovered":null,"lastUpdateEt":"12/31/2020 03:59","dateModified":"2020-12-31T03:59:00Z","checkTimeEt":"12/30 22:59","death":206,"hospitalized":1023,"hospitalizedDischarged":null,"dateChecked":"2020-12-31T03:59:00Z","totalTestsViral":1275750,"positiveTestsViral":54763,"negativeTestsViral":1219592,"positiveCasesViral":null,"deathConfirmed":206,"deathProbable":null,"totalTestEncountersViral":null,"totalTestsPeopleViral":null,"totalTestsAntibody":null,"positiveTestsAntibody":null,"negativeTestsAntibody":null,"totalTestsPeopleAntibody":null,"positiveTestsPeopleAntibody":null,"negativeTestsPeopleAntibody":null,"totalTestsPeopleAntigen":null,"positiveTestsPeopleAntigen":null,"totalTestsAntigen":null,"positiveTestsAntigen":null,"fips":"02","positiveIncrease":0,"negativeIncrease":0,"total":45461,"totalTestResultsIncrease":0,"posNeg":45461,"dataQualityGrade":null,"deathIncrease":0,"hospitalizedIncrease":0,"hash":"b950686fa685b23ef2ce4561719c589796c3368c","commercialScore":0,"negativeRegularScore":0,"negativeScore":0,"positiveScore":0,"score":0,"grade":""},{"date":20201231,"state":"AK","positive":45461,"probableCases":null,"negative":null,"pending":null,"totalTestResultsSource":"totalTestsViral","totalTestResults":1275750,"hospitalizedCurrently":79,"hospitalizedCumulative":1023,"inIcuCurrently":null,"inIcuCumulative":null,"onVentilatorCurrently":6,"onVentilatorCumulative":null,"recovered":null,"lastUpdateEt":"12/31/2020 03:59","dateModified":"2020-12-31T03:59:00Z","checkTimeEt":"12/30 22:59","death":206,"hospitalized":1023,"hospitalizedDischarged":null,"dateChecked":"2020-12-31T03:59:00Z","totalTestsViral":1275750,"positiveTestsViral":54763,"negativeTestsViral":1219592,"positiveCasesViral":null,"deathConfirmed":206,"deathProbable":null,"totalTestEncountersViral":null,"totalTestsPeopleViral":null,"totalTestsAntibody":null,"positiveTestsAntibody":null,"negativeTestsAntibody":null,"totalTestsPeopleAntibody":null,"positiveTestsPeopleAntibody":null,"negativeTestsPeopleAntibody":null,"totalTestsPeopleAntigen":null,"positiveTestsPeopleAntigen":null,"totalTestsAntigen":null,"positiveTestsAntigen":null,"fips":"02","positiveIncrease":495,"negativeIncrease":0,"total":45461,"totalTestResultsIncrease":8658,"posNeg":45461,"dataQualityGrade":null,"deathIncrease":3,"hospitalizedIncrease":6,"hash":"18bb857b8a2fc5bcd9e182d9566a2d76a9e0a44d","commercialScore":0,"negativeRegularScore":0,"negativeScore":0,"positiveScore":0,"score":0,"grade":""},{"date":20201230,"state":"AK","positive":44966,"probableCases":null,"negative":null,"pending":null,"totalTestResultsSource":"totalTestsViral","totalTestResults":1267092,"hospitalizedCurrently":75,"hospitalizedCumulative":1017,"inIcuCurrently":null,"inIcuCumulative":null,"onVentilatorCurrently":10,"onVentilatorCumulative":null,"recovered":null,"lastUpdateEt":"12/30/2020 03:59","dateModified":"2020-12-30T03:59:00Z","checkTimeEt":"12/29 22:59","death":203,"hospitalized":1017,"hospitalizedDischarged":null,"dateChecked":"2020-12-30T03:59:00Z","totalTestsViral":1267092,"positiveTestsViral":54317,"negativeTestsViral":1211380,"positiveCasesViral":null,"deathConfirmed":203,"deathProbable":null,"totalTestEncountersViral":null,"totalTestsPeopleViral":null,"totalTestsAntibody":null,"positiveTestsAntibody":null,"negativeTestsAntibody":null,"totalTestsPeopleAntibody":null,"positiveTestsPeopleAntibody":null,"negativeTestsPeopleAntibody":null,"totalTestsPeopleAntigen":null,"positiveTestsPeopleAntigen":null,"totalTestsAntigen":null,"positiveTestsAntigen":null,"fips":"02","positiveIncrease":385,"negativeIncrease":0,"total":44966,"totalTestResultsIncrease":7247,"posNeg":44966,"dataQualityGrade":null,"deathIncrease":2,"hospitalizedIncrease":13,"hash":"d744e792d06cd7da2e40d331809d716a59514c19","commercialScore":0,"negativeRegularScore":0,"negativeScore":0,"positiveScore":0,"score":0,"grade":""},{"date":20201229,"state":"AK","positive":44581,"probableCases":null,"negative":null,"pending":null,"totalTestResultsSource":"totalTestsViral","totalTestResults":1259845,"hospitalizedCurrently":83,"hospitalizedCumulative":1004,"inIcuCurrently":null,"inIcuCumulative":null,"onVentilatorCurrently":10,"onVentilatorCumulative":null,"recovered":null,"lastUpdateEt":"12/29/2020 03:59","dateModified":"2020-12-29T03:59:00Z","checkTimeEt":"12/28 22:59","death":201,"hospitalized":1004,"hospitalizedDischarged":null,"dateChecked":"2020-12-29T03:59:00Z","totalTestsViral":1259845,"positiveTestsViral":53470,"negativeTestsViral":1204992,"positiveCasesViral":null,"deathConfirmed":201,"deathProbable":null,"totalTestEncountersViral":null,"totalTestsPeopleViral":null,"totalTestsAntibody":null,"positiveTestsAntibody":null,"negativeTestsAntibody":null,"totalTestsPeopleAntibody":null,"positiveTestsPeopleAntibody":null,"negativeTestsPeopleAntibody":null,"totalTestsPeopleAntigen":null,"positiveTestsPeopleAntigen":null,"totalTestsAntigen":null,"positiveTestsAntigen":null,"fips":"02","positiveIncrease":175,"negativeIncrease":0,"total":44581,"totalTestResultsIncrease":5448,"posNeg":44581,"dataQualityGrade":null,"deathIncrease":1,"hospitalizedIncrease":10,"hash":"482526ae1a526dd6e3f8f93eb903715cb14d88af","commercialScore":0,"negativeRegularScore":0,"negativeScore":0,"positiveScore":0,"score":0,"grade":""},{"date":20201228,"state":"AK","positive":44406,"probableCases":null,"negative":null,"pending":null,"totalTestResultsSource":"totalTestsViral","totalTestResults":1254397,"hospitalizedCurrently":78,"hospitalizedCumulative":994,"inIcuCurrently":null,"inIcuCumulative":null,"onVentilatorCurrently":10,"onVentilatorCumulative":null,"recovered":null,"lastUpdateEt":"12/28/2020 03:59","dateModified":"2020-12-28T03:59:00Z","checkTimeEt":"12/27 22:59","death":200,"hospitalized":994,"hospitalizedDischarged":null,"dateChecked":"2020-12-28T03:59:00Z","totalTestsViral":1254397,"positiveTestsViral":53213,"negativeTestsViral":1199815,"positiveCasesViral":null,"deathConfirmed":200,"deathProbable":null,"totalTestEncountersViral":null,"totalTestsPeopleViral":null,"totalTestsAntibody":null,"positiveTestsAntibody":null,"negativeTestsAntibody":null,"totalTestsPeopleAntibody":null,"positiveTestsPeopleAntibody":null,"negativeTestsPeopleAntibody":null,"totalTestsPeopleAntigen":null,"positiveTestsPeopleAntigen":null,"totalTestsAntigen":null,"positiveTestsAntigen":null,"fips":"02","positiveIncrease":126,"negativeIncrease":0,"total":44406,"totalTestResultsIncrease":4146,"posNeg":44406,"dataQualityGrade":null,"deathIncrease":0,"hospitalizedIncrease":2,"hash":"db91b32eab559ff5a65850013a9fe52cd44a377a","commercialScore":0,"negativeRegularScore":0,"negativeScore":0,"positiveScore":0,"score":0,"grade":""},{"date":20201227,"state":"AK","positive":44280,"probableCases":null,"negative":null,"pending":null,"totalTestResultsSource":"totalTestsViral","totalTestResults":1250251,"hospitalizedCurrently":71,"hospitalizedCumulative":992,"inIcuCurrently":null,"inIcuCumulative":null,"onVentilatorCurrently":9,"onVentilatorCumulative":null,"recovered":null,"lastUpdateEt":"12/27/2020 03:59","dateModified":"2020-12-27T03:59:00Z","checkTimeEt":"12/26 22:59","death":200,"hospitalized":992,"hospitalizedDischarged":null,"dateChecked":"2020-12-27T03:59:00Z","totalTestsViral":1250251,"positiveTestsViral":53053,"negativeTestsViral":1195838,"positiveCasesViral":null,"deathConfirmed":200,"deathProbable":null,"totalTestEncountersViral":null,"totalTestsPeopleViral":null,"totalTestsAntibody":null,"positiveTestsAntibody":null,"negativeTestsAntibody":null,"totalTestsPeopleAntibody":null,"positiveTestsPeopleAntibody":null,"negativeTestsPeopleAntibody":null,"totalTestsPeopleAntigen":null,"positiveTestsPeopleAntigen":null,"totalTestsAntigen":null,"positiveTestsAntigen":null,"fips":"02","positiveIncrease":290,"negativeIncrease":0,"total":44280,"totalTestResultsIncrease":5188,"posNeg":44280,"dataQualityGrade":null,"deathIncrease":0,"hospitalizedIncrease":1,"hash":"ab7a86648fe50bddc7f18cefe412c39deb05b604","commercialScore":0,"negativeRegularScore":0,"negativeScore":0,"positiveScore":0,"score":0,"grade":""},{"date":20201226,"state":"AK","positive":43990,"probableCases":null,"negative":null,"pending":null,"totalTestResultsSource":"totalTestsViral","totalTestResults":1245063,"hospitalizedCurrently":79,"hospitalizedCumulative":991,"inIcuCurrently":null,"inIcuCumulative":null,"onVentilatorCurrently":10,"onVentilatorCumulative":null,"recovered":null,"lastUpdateEt":"12/26/2020 03:59","dateModified":"2020-12-26T03:59:00Z","checkTimeEt":"12/25 22:59","death":200,"hospitalized":991,"hospitalizedDischarged":null,"dateChecked":"2020-12-26T03:59:00Z","totalTestsViral":1245063,"positiveTestsViral":52716,"negativeTestsViral":1190997,"positiveCasesViral":null,"deathConfirmed":200,"deathProbable":null,"totalTestEncountersViral":null,"totalTestsPeopleViral":null,"totalTestsAntibody":null,"positiveTestsAntibody":null,"negativeTestsAntibody":null,"totalTestsPeopleAntibody":null,"positiveTestsPeopleAntibody":null,"negativeTestsPeopleAntibody":null,"totalTestsPeopleAntigen":null,"positiveTestsPeopleAntigen":null,"totalTes