[{"date":20210307,"state":"IN","positive":667262,"probableCases":null,"negative":2483156,"pending":null,"totalTestResultsSource":"totalTestsViral","totalTestResults":8242367,"hospitalizedCurrently":656,"hospitalizedCumulative":43217,"inIcuCurrently":104,"inIcuCumulative":7600,"onVentilatorCurrently":50,"onVentilatorCumulative":null,"recovered":null,"lastUpdateEt":"3/6/2021 23:59","dateModified":"2021-03-06T23:59:00Z","checkTimeEt":"03/06 18:59","death":12737,"hospitalized":43217,"hospitalizedDischarged":434805,"dateChecked":"2021-03-06T23:59:00Z","totalTestsViral":8242367,"positiveTestsViral":760491,"negativeTestsViral":null,"positiveCasesViral":null,"deathConfirmed":12310,"deathProbable":427,"totalTestEncountersViral":null,"totalTestsPeopleViral":3150418,"totalTestsAntibody":null,"positiveTestsAntibody":null,"negativeTestsAntibody":null,"totalTestsPeopleAntibody":null,"positiveTestsPeopleAntibody":null,"negativeTestsPeopleAntibody":null,"totalTestsPeopleAntigen":null,"positiveTestsPeopleAntigen":null,"totalTestsAntigen":null,"positiveTestsAntigen":null,"fips":"18","positiveIncrease":746,"negativeIncrease":4643,"total":3150418,"totalTestResultsIncrease":29427,"posNeg":3150418,"dataQualityGrade":null,"deathIncrease":11,"hospitalizedIncrease":64,"hash":"dcdfec9f776fcb6e79033397905f447c5fc756bc","commercialScore":0,"negativeRegularScore":0,"negativeScore":0,"positiveScore":0,"score":0,"grade":""},{"date":20210306,"state":"IN","positive":666516,"probableCases":null,"negative":2478513,"pending":null,"totalTestResultsSource":"totalTestsViral","totalTestResults":8212940,"hospitalizedCurrently":663,"hospitalizedCumulative":43153,"inIcuCurrently":118,"inIcuCumulative":7586,"onVentilatorCurrently":60,"onVentilatorCumulative":null,"recovered":null,"lastUpdateEt":"3/5/2021 23:59","dateModified":"2021-03-05T23:59:00Z","checkTimeEt":"03/05 18:59","death":12726,"hospitalized":43153,"hospitalizedDischarged":434718,"dateChecked":"2021-03-05T23:59:00Z","totalTestsViral":8212940,"positiveTestsViral":759598,"negativeTestsViral":null,"positiveCasesViral":null,"deathConfirmed":12299,"deathProbable":427,"totalTestEncountersViral":null,"totalTestsPeopleViral":3145029,"totalTestsAntibody":null,"positiveTestsAntibody":null,"negativeTestsAntibody":null,"totalTestsPeopleAntibody":null,"positiveTestsPeopleAntibody":null,"negativeTestsPeopleAntibody":null,"totalTestsPeopleAntigen":null,"positiveTestsPeopleAntigen":null,"totalTestsAntigen":null,"positiveTestsAntigen":null,"fips":"18","positiveIncrease":1231,"negativeIncrease":5155,"total":3145029,"totalTestResultsIncrease":41718,"posNeg":3145029,"dataQualityGrade":null,"deathIncrease":29,"hospitalizedIncrease":49,"hash":"db8a21855b69af38fdd152c198f59b90b444c59f","commercialScore":0,"negativeRegularScore":0,"negativeScore":0,"positiveScore":0,"score":0,"grade":""},{"date":20210305,"state":"IN","positive":665285,"probableCases":null,"negative":2473358,"pending":null,"totalTestResultsSource":"totalTestsViral","totalTestResults":8171222,"hospitalizedCurrently":730,"hospitalizedCumulative":43104,"inIcuCurrently":123,"inIcuCumulative":7588,"onVentilatorCurrently":64,"onVentilatorCumulative":null,"recovered":null,"lastUpdateEt":"3/4/2021 23:59","dateModified":"2021-03-04T23:59:00Z","checkTimeEt":"03/04 18:59","death":12697,"hospitalized":43104,"hospitalizedDischarged":434018,"dateChecked":"2021-03-04T23:59:00Z","totalTestsViral":8171222,"positiveTestsViral":758078,"negativeTestsViral":null,"positiveCasesViral":null,"deathConfirmed":12263,"deathProbable":434,"totalTestEncountersViral":null,"totalTestsPeopleViral":3138643,"totalTestsAntibody":null,"positiveTestsAntibody":null,"negativeTestsAntibody":null,"totalTestsPeopleAntibody":null,"positiveTestsPeopleAntibody":null,"negativeTestsPeopleAntibody":null,"totalTestsPeopleAntigen":null,"positiveTestsPeopleAntigen":null,"totalTestsAntigen":null,"positiveTestsAntigen":null,"fips":"18","positiveIncrease":839,"negativeIncrease":4481,"total":3138643,"totalTestResultsIncrease":37626,"posNeg":3138643,"dataQualityGrade":null,"deathIncrease":34,"hospitalizedIncrease":60,"hash":"ea4e79bd24d426d990a88b3f44b82f85693718d4","commercialScore":0,"negativeRegularScore":0,"negativeScore":0,"positiveScore":0,"score":0,"grade":""},{"date":20210304,"state":"IN","positive":664446,"probableCases":null,"negative":2468877,"pending":null,"totalTestResultsSource":"totalTestsViral","totalTestResults":8133596,"hospitalizedCurrently":692,"hospitalizedCumulative":43044,"inIcuCurrently":131,"inIcuCumulative":7567,"onVentilatorCurrently":63,"onVentilatorCumulative":null,"recovered":null,"lastUpdateEt":"3/3/2021 23:59","dateModified":"2021-03-03T23:59:00Z","checkTimeEt":"03/03 18:59","death":12663,"hospitalized":43044,"hospitalizedDischarged":433563,"dateChecked":"2021-03-03T23:59:00Z","totalTestsViral":8133596,"positiveTestsViral":757099,"negativeTestsViral":null,"positiveCasesViral":null,"deathConfirmed":12231,"deathProbable":432,"totalTestEncountersViral":null,"totalTestsPeopleViral":3133323,"totalTestsAntibody":null,"positiveTestsAntibody":null,"negativeTestsAntibody":null,"totalTestsPeopleAntibody":null,"positiveTestsPeopleAntibody":null,"negativeTestsPeopleAntibody":null,"totalTestsPeopleAntigen":null,"positiveTestsPeopleAntigen":null,"totalTestsAntigen":null,"positiveTestsAntigen":null,"fips":"18","positiveIncrease":935,"negativeIncrease":4795,"total":3133323,"totalTestResultsIncrease":40539,"posNeg":3133323,"dataQualityGrade":null,"deathIncrease":30,"hospitalizedIncrease":89,"hash":"9934dc9cbf112134e734697aae92b80487198101","commercialScore":0,"negativeRegularScore":0,"negativeScore":0,"positiveScore":0,"score":0,"grade":""},{"date":20210303,"state":"IN","positive":663511,"probableCases":null,"negative":2464082,"pending":null,"totalTestResultsSource":"totalTestsViral","totalTestResults":8093057,"hospitalizedCurrently":731,"hospitalizedCumulative":42955,"inIcuCurrently":131,"inIcuCumulative":7555,"onVentilatorCurrently":65,"onVentilatorCumulative":null,"recovered":null,"lastUpdateEt":"3/2/2021 23:59","dateModified":"2021-03-02T23:59:00Z","checkTimeEt":"03/02 18:59","death":12633,"hospitalized":42955,"hospitalizedDischarged":433108,"dateChecked":"2021-03-02T23:59:00Z","totalTestsViral":8093057,"positiveTestsViral":756009,"negativeTestsViral":null,"positiveCasesViral":null,"deathConfirmed":12200,"deathProbable":433,"totalTestEncountersViral":null,"totalTestsPeopleViral":3127593,"totalTestsAntibody":null,"positiveTestsAntibody":null,"negativeTestsAntibody":null,"totalTestsPeopleAntibody":null,"positiveTestsPeopleAntibody":null,"negativeTestsPeopleAntibody":null,"totalTestsPeopleAntigen":null,"positiveTestsPeopleAntigen":null,"totalTestsAntigen":null,"positiveTestsAntigen":null,"fips":"18","positiveIncrease":761,"negativeIncrease":3803,"total":3127593,"totalTestResultsIncrease":36945,"posNeg":3127593,"dataQualityGrade":null,"deathIncrease":10,"hospitalizedIncrease":93,"hash":"b47a1fc1f4ffb44b91b8ded954ae0f9c9e37588a","commercialScore":0,"negativeRegularScore":0,"negativeScore":0,"positiveScore":0,"score":0,"grade":""},{"date":20210302,"state":"IN","positive":662750,"probableCases":null,"negative":2460279,"pending":null,"totalTestResultsSource":"totalTestsViral","totalTestResults":8056112,"hospitalizedCurrently":765,"hospitalizedCumulative":42862,"inIcuCurrently":123,"inIcuCumulative":7535,"onVentilatorCurrently":64,"onVentilatorCumulative":null,"recovered":null,"lastUpdateEt":"3/1/2021 23:59","dateModified":"2021-03-01T23:59:00Z","checkTimeEt":"03/01 18:59","death":12623,"hospitalized":42862,"hospitalizedDischarged":432665,"dateChecked":"2021-03-01T23:59:00Z","totalTestsViral":8056112,"positiveTestsViral":755102,"negativeTestsViral":null,"positiveCasesViral":null,"deathConfirmed":12192,"deathProbable":431,"totalTestEncountersViral":null,"totalTestsPeopleViral":3123029,"totalTestsAntibody":null,"positiveTestsAntibody":null,"negativeTestsAntibody":null,"totalTestsPeopleAntibody":null,"positiveTestsPeopleAntibody":null,"negativeTestsPeopleAntibody":null,"totalTestsPeopleAntigen":null,"positiveTestsPeopleAntigen":null,"totalTestsAntigen":null,"positiveTestsAntigen":null,"fips":"18","positiveIncrease":537,"negativeIncrease":2297,"total":3123029,"totalTestResultsIncrease":20386,"posNeg":3123029,"dataQualityGrade":null,"deathIncrease":28,"hospitalizedIncrease":47,"hash":"44de836e73d3cb8a4a8163e4779815e9f023d762","commercialScore":0,"negativeRegularScore":0,"negativeScore":0,"positiveScore":0,"score":0,"grade":""},{"date":20210301,"state":"IN","positive":662213,"probableCases":null,"negative":2457982,"pending":null,"totalTestResultsSource":"totalTestsViral","totalTestResults":8035726,"hospitalizedCurrently":763,"hospitalizedCumulative":42815,"inIcuCurrently":124,"inIcuCumulative":7514,"onVentilatorCurrently":66,"onVentilatorCumulative":null,"recovered":null,"lastUpdateEt":"2/28/2021 23:59","dateModified":"2021-02-28T23:59:00Z","checkTimeEt":"02/28 18:59","death":12595,"hospitalized":42815,"hospitalizedDischarged":432197,"dateChecked":"2021-02-28T23:59:00Z","totalTestsViral":8035726,"positiveTestsViral":754471,"negativeTestsViral":null,"positiveCasesViral":null,"deathConfirmed":12162,"deathProbable":433,"totalTestEncountersViral":null,"totalTestsPeopleViral":3120195,"totalTestsAntibody":null,"positiveTestsAntibody":null,"negativeTestsAntibody":null,"totalTestsPeopleAntibody":null,"positiveTestsPeopleAntibody":null,"negativeTestsPeopleAntibody":null,"totalTestsPeopleAntigen":null,"positiveTestsPeopleAntigen":null,"totalTestsAntigen":null,"positiveTestsAntigen":null,"fips":"18","positiveIncrease":540,"negativeIncrease":2454,"total":3120195,"totalTestResultsIncrease":14296,"posNeg":3120195,"dataQualityGrade":null,"deathIncrease":22,"hospitalizedIncrease":40,"hash":"a2e3a8d58b1a3246d4cab1652b2f895e62c1f1bf","commercialScore":0,"negativeRegularScore":0,"negativeScore":0,"positiveScore":0,"score":0,"grade":""},{"date":20210228,"state":"IN","positive":661673,"probableCases":null,"negative":2455528,"pending":null,"totalTestResultsSource":"totalTestsViral","totalTestResults":8021430,"hospitalizedCurrently":778,"hospitalizedCumulative":42775,"inIcuCurrently":116,"inIcuCumulative":7508,"onVentilatorCurrently":67,"onVentilatorCumulative":null,"recovered":null,"lastUpdateEt":"2/27/2021 23:59","dateModified":"2021-02-27T23:59:00Z","checkTimeEt":"02/27 18:59","death":12573,"hospitalized":42775,"hospitalizedDischarged":431636,"dateChecked":"2021-02-27T23:59:00Z","totalTestsViral":8021430,"positiveTestsViral":753811,"negativeTestsViral":null,"positiveCasesViral":null,"deathConfirmed":12142,"deathProbable":431,"totalTestEncountersViral":null,"totalTestsPeopleViral":3117201,"totalTestsAntibody":null,"positiveTestsAntibody":null,"negativeTestsAntibody":null,"totalTestsPeopleAntibody":null,"positiveTestsPeopleAntibody":null,"negativeTestsPeopleAntibody":null,"totalTestsPeopleAntigen":null,"positiveTestsPeopleAntigen":null,"totalTestsAntigen":null,"positiveTestsAntigen":null,"fips":"18","positiveIncrease":731,"negativeIncrease":4296,"total":3117201,"totalTestResultsIncrease":31476,"posNeg":3117201,"dataQualityGrade":null,"deathIncrease":17,"hospitalizedIncrease":39,"hash":"626a625ccd0cd6bc00f2ed06bb38860254f1cd5b","commercialScore":0,"negativeRegularScore":0,"negativeScore":0,"positiveScore":0,"score":0,"grade":""},{"date":20210227,"state":"IN","positive":660942,"probableCases":null,"negative":2451232,"pending":null,"totalTestResultsSource":"totalTestsViral","totalTestResults":7989954,"hospitalizedCurrently":800,"hospitalizedCumulative":42736,"inIcuCurrently":138,"inIcuCumulative":7497,"onVentilatorCurrently":73,"onVentilatorCumulative":null,"recovered":null,"lastUpdateEt":"2/26/2021 23:59","dateModified":"2021-02-26T23:59:00Z","checkTimeEt":"02/26 18:59","death":12556,"hospitalized":42736,"hospitalizedDischarged":431515,"dateChecked":"2021-02-26T23:59:00Z","totalTestsViral":7989954,"positiveTestsViral":752905,"negativeTestsViral":null,"positiveCasesViral":null,"deathConfirmed":12125,"deathProbable":431,"totalTestEncountersViral":null,"totalTestsPeopleViral":3112174,"totalTestsAntibody":null,"positiveTestsAntibody":null,"negativeTestsAntibody":null,"totalTestsPeopleAntibody":null,"positiveTestsPeopleAntibody":null,"negativeTestsPeopleAntibody":null,"totalTestsPeopleAntigen":null,"positiveTestsPeopleAntigen":null,"totalTestsAntigen":null,"positiveTestsAntigen":null,"fips":"18","positiveIncrease":871,"negativeIncrease":4877,"total":3112174,"totalTestResultsIncrease":47002,"posNeg":3112174,"dataQualityGrade":null,"deathIncrease":25,"hospitalizedIncrease":28,"hash":"b7f6773bb40636de626ecd84c542e8e045a1f3ba","commercialScore":0,"negativeRegularScore":0,"negativeScore":0,"positiveScore":0,"score":0,"grade":""},{"date":20210226,"state":"IN","positive":660071,"probableCases":null,"negative":2446355,"pending":null,"totalTestResultsSource":"totalTestsViral","totalTestResults":7942952,"hospitalizedCurrently":781,"hospitalizedCumulative":42708,"inIcuCurrently":151,"inIcuCumulative":7490,"onVentilatorCurrently":79,"onVentilatorCumulative":null,"recovered":null,"lastUpdateEt":"2/25/2021 23:59","dateModified":"2021-02-25T23:59:00Z","checkTimeEt":"02/25 18:59","death":12531,"hospitalized":42708,"hospitalizedDischarged":431198,"dateChecked":"2021-02-25T23:59:00Z","totalTestsViral":7942952,"positiveTestsViral":751829,"negativeTestsViral":null,"positiveCasesViral":null,"deathConfirmed":12098,"deathProbable":433,"totalTestEncountersViral":null,"totalTestsPeopleViral":3106426,"totalTestsAntibody":null,"positiveTestsAntibody":null,"negativeTestsAntibody":null,"totalTestsPeopleAntibody":null,"positiveTestsPeopleAntibody":null,"negativeTestsPeopleAntibody":null,"totalTestsPeopleAntigen":null,"positiveTestsPeopleAntigen":null,"totalTestsAntigen":null,"positiveTestsAntigen":null,"fips":"18","positiveIncrease":944,"negativeIncrease":5371,"total":3106426,"totalTestResultsIncrease":40443,"posNeg":3106426,"dataQualityGrade":null,"deathIncrease":37,"hospitalizedIncrease":36,"hash":"f6fc1c2f86c15a971650e375591adec2892e59e2","commercialScore":0,"negativeRegularScore":0,"negativeScore":0,"positiveScore":0,"score":0,"grade":""},{"date":20210225,"state":"IN","positive":659127,"probableCases":null,"negative":2440984,"pending":null,"totalTestResultsSource":"totalTestsViral","totalTestResults":7902509,"hospitalizedCurrently":889,"hospitalizedCumulative":42672,"inIcuCurrently":147,"inIcuCumulative":7467,"onVentilatorCurrently":80,"onVentilatorCumulative":null,"recovered":null,"lastUpdateEt":"2/24/2021 23:59","dateModified":"2021-02-24T23:59:00Z","checkTimeEt":"02/24 18:59","death":12494,"hospitalized":42672,"hospitalizedDischarged":430655,"dateChecked":"2021-02-24T23:59:00Z","totalTestsViral":7902509,"positiveTestsViral":750751,"negativeTestsViral":null,"positiveCasesViral":null,"deathConfirmed":12065,"deathProbable":429,"totalTestEncountersViral":null,"totalTestsPeopleViral":3100111,"totalTestsAntibody":null,"positiveTestsAntibody":null,"negativeTestsAntibody":null,"totalTestsPeopleAntibody":null,"positiveTestsPeopleAntibody":null,"negativeTestsPeopleAntibody":null,"totalTestsPeopleAntigen":null,"positiveTestsPeopleAntigen":null,"totalTestsAntigen":null,"positiveTestsAntigen":null,"fips":"18","positiveIncrease":1084,"negativeIncrease":5338,"total":3100111,"totalTestResultsIncrease":45517,"posNeg":3100111,"dataQualityGrade":null,"deathIncrease":27,"hospitalizedIncrease":37,"hash":"e4c00855a3a1c5cb46eb04c41c1262c8d6f92432","commercialScore":0,"negativeRegularScore":0,"negativeScore":0,"positiveScore":0,"score":0,"grade":""},{"date":20210224,"state":"IN","positive":658043,"probableCases":null,"negative":2435646,"pending":null,"totalTestResultsSource":"totalTestsViral","totalTestResults":7856992,"hospitalizedCurrently":886,"hospitalizedCumulative":42635,"inIcuCurrently":158,"inIcuCumulative":7445,"onVentilatorCurrently":79,"onVentilatorCumulative":null,"recovered":null,"lastUpdateEt":"2/23/2021 23:59","dateModified":"2021-02-23T23:59:00Z","checkTimeEt":"02/23 18:59","death":12467,"hospitalized":42635,"hospitalizedDischarged":430062,"dateChecked":"2021-02-23T23:59:00Z","totalTestsViral":7856992,"positiveTestsViral":749447,"negativeTestsViral":null,"positiveCasesViral":null,"deathConfirmed":12039,"deathProbable":428,"totalTestEncountersViral":null,"totalTestsPeopleViral":3093689,"totalTestsAntibody":null,"positiveTestsAntibody":null,"negativeTestsAntibody":null,"totalTestsPeopleAntibody":null,"positiveTestsPeopleAntibody":null,"negativeTestsPeopleAntibody":null,"totalTestsPeopleAntigen":null,"positiveTestsPeopleAntigen":null,"totalTestsAntigen":null,"positiveTestsAntigen":null,"fips":"18","positiveIncrease":1006,"negativeIncrease":3954,"total":3093689,"totalTestResultsIncrease":41241,"posNeg":3093689,"dataQualityGrade":null,"deathIncrease":17,"hospitalizedIncrease":78,"hash":"326ac79609db9f344bf84e42b00b589bfc685b5f","commercialScore":0,"negativeRegularScore":0,"negativeScore":0,"positiveScore":0,"score":0,"grade":""},{"date":20210223,"state":"IN","positive":657037,"probableCases":null,"negative":2431692,"pending":null,"totalTestResultsSource":"totalTestsViral","totalTestResults":7815751,"hospitalizedCurrently":873,"hospitalizedCumulative":42557,"inIcuCurrently":159,"inIcuCumulative":7438,"onVentilatorCurrently":75,"onVentilatorCumulative":null,"recovered":null,"lastUpdateEt":"2/22/2021 23:59","dateModified":"2021-02-22T23:59:00Z","checkTimeEt":"02/22 18:59","death":12450,"hospitalized":42557,"hospitalizedDischarged":429382,"dateChecked":"2021-02-22T23:59:00Z","totalTestsViral":7815751,"positiveTestsViral":748268,"negativeTestsViral":null,"positiveCasesViral":null,"deathConfirmed":12025,"deathProbable":425,"totalTestEncountersViral":null,"totalTestsPeopleViral":3088729,"totalTestsAntibody":null,"positiveTestsAntibody":null,"negativeTestsAntibody":null,"totalTestsPeopleAntibody":null,"positiveTestsPeopleAntibody":null,"negativeTestsPeopleAntibody":null,"totalTestsPeopleAntigen":null,"positiveTestsPeopleAntigen":null,"totalTestsAntigen":null,"positiveTestsAntigen":null,"fips":"18","positiveIncrease":679,"negativeIncrease":2496,"total":3088729,"totalTestResultsIncrease":20986,"posNeg":3088729,"dataQualityGrade":null,"deathIncrease":43,"hospitalizedIncrease":57,"hash":"083353802ad17804df148510bfed881bf51e7159","commercialScore":0,"negativeRegularScore":0,"negativeScore":0,"positiveScore":0,"score":0,"grade":""},{"date":20210222,"state":"IN","positive":656358,"probableCases":null,"negative":2429196,"pending":null,"totalTestResultsSource":"totalTestsViral","totalTestResults":7794765,"hospitalizedCurrently":878,"hospitalizedCumulative":42500,"inIcuCurrently":163,"inIcuCumulative":7411,"onVentilatorCurrently":73,"onVentilatorCumulative":null,"recovered":null,"lastUpdateEt":"2/21/2021 23:59","dateModified":"2021-02-21T23:59:00Z","checkTimeEt":"02/21 18:59","death":12407,"hospitalized":42500,"hospitalizedDischarged":428623,"dateChecked":"2021-02-21T23:59:00Z","totalTestsViral":7794765,"positiveTestsViral":747519,"negativeTestsViral":null,"positiveCasesViral":null,"deathConfirmed":11982,"deathProbable":425,"totalTestEncountersViral":null,"totalTestsPeopleViral":3085554,"totalTestsAntibody":null,"positiveTestsAntibody":null,"negativeTestsAntibody":null,"totalTestsPeopleAntibody":null,"positiveTestsPeopleAntibody":null,"negativeTestsPeopleAntibody":null,"totalTestsPeopleAntigen":null,"positiveTestsPeopleAntigen":null,"totalTestsAntigen":null,"positiveTestsAntigen":null,"fips":"18","positiveIncrease":817,"negativeIncrease":844,"total":3085554,"totalTestResultsIncrease":40727,"posNeg":3085554,"dataQualityGrade":null,"deathIncrease":35,"hospitalizedIncrease":55,"hash":"0a1bebab1284cfeb682a3e7e8e563b1b2cb1a951","commercialScore":0,"negativeRegularScore":0,"negativeScore":0,"positiveScore":0,"score":0,"grade":""},{"date":20210221,"state":"IN","positive":655541,"probableCases":null,"negative":2428352,"pending":null,"totalTestResultsSource":"totalTestsViral","totalTestResults":7754038,"hospitalizedCurrently":870,"hospitalizedCumulative":42445,"inIcuCurrently":161,"inIcuCumulative":7408,"onVentilatorCurrently":80,"onVentilatorCumulative":null,"recovered":null,"lastUpdateEt":"2/20/2021 23:59","dateModified":"2021-02-20T23:59:00Z","checkTimeEt":"02/20 18:59","death":12372,"hospitalized":42445,"hospitalizedDischarged":427828,"dateChecked":"2021-02-20T23:59:00Z","totalTestsViral":7754038,"positiveTestsViral":746727,"negativeTestsViral":null,"positiveCasesViral":null,"deathConfirmed":11947,"deathProbable":425,"totalTestEncountersViral":null,"totalTestsPeopleViral":3083893,"totalTestsAntibody":null,"positiveTestsAntibody":null,"negativeTestsAntibody":null,"totalTestsPeopleAntibody":null,"positiveTestsPeopleAntibody":null,"negativeTestsPeopleAntibody":null,"totalTestsPeopleAntigen":null,"positiveTestsPeopleAntigen":null,"totalTestsAntigen":null,"positiveTestsAntigen":null,"fips":"18","positiveIncrease":881,"negativeIncrease":6767,"total":3083893,"totalTestResultsIncrease":32380,"posNeg":3083893,"dataQualityGrade":null,"deathIncrease":36,"hospitalizedIncrease":67,"hash":"69be84155062577a8927bb1ed51c7ae7dd0d9d3e","commercialScore":0,"negativeRegularScore":0,"negativeScore":0,"positiveScore":0,"score":0,"grade":""},{"date":20210220,"state":"IN","positive":654660,"probableCases":null,"negative":2421585,"pending":null,"totalTestResultsSource":"totalTestsViral","totalTestResults":7721658,"hospitalizedCurrently":923,"hospitalizedCumulative":42378,"inIcuCurrently":172,"inIcuCumulative":7391,"onVentilatorCurrently":78,"onVentilatorCumulative":null,"recovered":null,"lastUpdateEt":"2/19/2021 23:59","dateModified":"2021-02-19T23:59:00Z","checkTimeEt":"02/19 18:59","death":12336,"hospitalized":42378,"hospitalizedDischarged":427682,"dateChecked":"2021-02-19T23:59:00Z","totalTestsViral":7721658,"positiveTestsViral":745419,"negativeTestsViral":null,"positiveCasesViral":null,"deathConfirmed":11912,"deathProbable":424,"totalTestEncountersViral":null,"totalTestsPeopleViral":3076245,"totalTestsAntibody":null,"positiveTestsAntibody":null,"negativeTestsAntibody":null,"totalTestsPeopleAntibody":null,"positiveTestsPeopleAntibody":null,"negativeTestsPeopleAntibody":null,"totalTestsPeopleAntigen":null,"positiveTestsPeopleAntigen":null,"totalTestsAntigen":null,"positiveTestsAntigen":null,"fips":"18","positiveIncrease":1415,"negativeIncrease":4964,"total":3076245,"totalTestResultsIncrease":38624,"posNeg":3076245,"dataQualityGrade":null,"deathIncrease":11,"hospitalizedIncrease":45,"hash":"2aaedf00a5fe11ddc0184330b8a32094472de31a","commercialScore":0,"negativeRegularScore":0,"negativeScore":0,"positiveScore":0,"score":0,"grade":""},{"date":20210219,"state":"IN","positive":653245,"probableCases":null,"negative":2416621,"pending":null,"totalTestResultsSource":"totalTestsViral","totalTestResults":7683034,"hospitalizedCurrently":948,"hospitalizedCumulative":42333,"inIcuCurrently":179,"inIcuCumulative":7383,"onVentilatorCurrently":88,"onVentilatorCumulative":null,"recovered":null,"lastUpdateEt":"2/18/2021 23:59","dateModified":"2021-02-18T23:59:00Z","checkTimeEt":"02/18 18:59","death":12325,"hospitalized":42333,"hospitalizedDischarged":427275,"dateChecked":"2021-02-18T23:59:00Z","totalTestsViral":7683034,"positiveTestsViral":743777,"negativeTestsViral":null,"positiveCasesViral":null,"deathConfirmed":11898,"deathProbable":427,"totalTestEncountersViral":null,"totalTestsPeopleViral":3069866,"totalTestsAntibody":null,"positiveTestsAntibody":null,"negativeTestsAntibody":null,"totalTestsPeopleAntibody":null,"positiveTestsPeopleAntibody":null,"negativeTestsPeopleAntibody":null,"totalTestsPeopleAntigen":null,"positiveTestsPeopleAntigen":null,"totalTestsAntigen":null,"positiveTestsAntigen":null,"fips":"18","positiveIncrease":1035,"negativeIncrease":3489,"total":3069866,"totalTestResultsIncrease":32361,"posNeg":3069866,"dataQualityGrade":null,"deathIncrease":44,"hospitalizedIncrease":87,"hash":"b6fc3049148cbbee5b23e1dcf3879fb1afc6a665","commercialScore":0,"negativeRegularScore":0,"negativeScore":0,"positiveScore":0,"score":0,"grade":""},{"date":20210218,"state":"IN","positive":652210,"probableCases":null,"negative":2413132,"pending":null,"totalTestResultsSource":"totalTestsViral","totalTestResults":7650673,"hospitalizedCurrently":966,"hospitalizedCumulative":42246,"inIcuCurrently":178,"inIcuCumulative":7372,"onVentilatorCurrently":90,"onVentilatorCumulative":null,"recovered":null,"lastUpdateEt":"2/17/2021 23:59","dateModified":"2021-02-17T23:59:00Z","checkTimeEt":"02/17 18:59","death":12281,"hospitalized":42246,"hospitalizedDischarged":426507,"dateChecked":"2021-02-17T23:59:00Z","totalTestsViral":7650673,"positiveTestsViral":742550,"negativeTestsViral":null,"positiveCasesViral":null,"deathConfirmed":11854,"deathProbable":427,"totalTestEncountersViral":null,"totalTestsPeopleViral":3065342,"totalTestsAntibody":null,"positiveTestsAntibody":null,"negativeTestsAntibody":null,"totalTestsPeopleAntibody":null,"positiveTestsPeopleAntibody":null,"negativeTestsPeopleAntibody":null,"totalTestsPeopleAntigen":null,"positiveTestsPeopleAntigen":null,"totalTestsAntigen":null,"positiveTestsAntigen":null,"fips":"18","positiveIncrease":757,"negativeIncrease":2577,"total":3065342,"totalTestResultsIncrease":25717,"posNeg":3065342,"dataQualityGrade":null,"deathIncrease":31,"hospitalizedIncrease":160,"hash":"2354bab47432a86f756690fdfe887fda5957b6f8","commercialScore":0,"negativeRegularScore":0,"negativeScore":0,"positiveScore":0,"score":0,"grade":""},{"date":20210217,"state":"IN","positive":651453,"probableCases":null,"negative":2410555,"pending":null,"totalTestResultsSource":"totalTestsViral","totalTestResults":7624956,"hospitalizedCurrently":955,"hospitalizedCumulative":42086,"inIcuCurrently":193,"inIcuCumulative":7336,"onVentilatorCurrently":98,"onVentilatorCumulative":null,"recovered":null,"lastUpdateEt":"2/16/2021 23:59","dateModified":"2021-02-16T23:59:00Z","checkTimeEt":"02/16 18:59","death":12250,"hospitalized":42086,"hospitalizedDischarged":425451,"dateChecked":"2021-02-16T23:59:00Z","totalTestsViral":7624956,"positiveTestsViral":741642,"negativeTestsViral":null,"positiveCasesViral":null,"deathConfirmed":11825,"deathProbable":425,"totalTestEncountersViral":null,"totalTestsPeopleViral":3062008,"totalTestsAntibody":null,"positiveTestsAntibody":null,"negativeTestsAntibody":null,"totalTestsPeopleAntibody":null,"positiveTestsPeopleAntibody":null,"negativeTestsPeopleAntibody":null,"totalTestsPeopleAntigen":null,"positiveTestsPeopleAntigen":null,"totalTestsAntigen":null,"positiveTestsAntigen":null,"fips":"18","positiveIncrease":923,"negativeIncrease":3587,"total":3062008,"totalTestResultsIncrease":31115,"posNeg":3062008,"dataQualityGrade":null,"deathIncrease":19,"hospitalizedIncrease":246,"hash":"b44f7afb7059e75b7b0c422eff66491977a3fb76","commercialScore":0,"negativeRegularScore":0,"negativeScore":0,"positiveScore":0,"score":0,"grade":""},{"date":20210216,"state":"IN","positive":650530,"probableCases":null,"negative":2406968,"pending":null,"totalTestResultsSource":"totalTestsViral","totalTestResults":7593841,"hospitalizedCurrently":1018,"hospitalizedCumulative":41840,"inIcuCurrently":201,"inIcuCumulative":7312,"onVentilatorCurrently":107,"onVentilatorCumulative":null,"recovered":null,"lastUpdateEt":"2/15/2021 23:59","dateModified":"2021-02-15T23:59:00Z","checkTimeEt":"02/15 18:59","death":12231,"hospitalized":41840,"hospitalizedDischarged":424155,"dateChecked":"2021-02-15T23:59:00Z","totalTestsViral":7593841,"positiveTestsViral":740557,"negativeTestsViral":null,"positiveCasesViral":null,"deathConfirmed":11805,"deathProbable":426,"totalTestEncountersViral":null,"totalTestsPeopleViral":3057498,"totalTestsAntibody":null,"positiveTestsAntibody":null,"negativeTestsAntibody":null,"totalTestsPeopleAntibody":null,"positiveTestsPeopleAntibody":null,"negativeTestsPeopleAntibody":null,"totalTestsPeopleAntigen":null,"positiveTestsPeopleAntigen":null,"totalTestsAntigen":null,"positiveTestsAntigen":null,"fips":"18","positiveIncrease":878,"negativeIncrease":2691,"total":3057498,"totalTestResultsIncrease":20208,"posNeg":3057498,"dataQualityGrade":null,"deathIncrease":40,"hospitalizedIncrease":194,"hash":"1940ede3b81f3d9f378d121c1435f3b313be0eda","commercialScore":0,"negativeRegularScore":0,"negativeScore":0,"positiveScore":0,"score":0,"grade":""},{"date":20210215,"state":"IN","positive":649652,"probableCases":null,"negative":2404277,"pending":null,"totalTestResultsSource":"totalTestsViral","totalTestResults":7573633,"hospitalizedCurrently":1066,"hospitalizedCumulative":41646,"inIcuCurrently":200,"inIcuCumulative":7285,"onVentilatorCurrently":104,"onVentilatorCumulative":null,"recovered":null,"lastUpdateEt":"2/14/2021 23:59","dateModified":"2021-02-14T23:59:00Z","checkTimeEt":"02/14 18:59","death":12191,"hospitalized":41646,"hospitalizedDischarged":423216,"dateChecked":"2021-02-14T23:59:00Z","totalTestsViral":7573633,"positiveTestsViral":739554,"negativeTestsViral":null,"positiveCasesViral":null,"deathConfirmed":11765,"deathProbable":426,"totalTestEncountersViral":null,"totalTestsPeopleViral":3053929,"totalTestsAntibody":null,"positiveTestsAntibody":null,"negativeTestsAntibody":null,"totalTestsPeopleAntibody":null,"positiveTestsPeopleAntibody":null,"negativeTestsPeopleAntibody":null,"totalTestsPeopleAntigen":null,"positiveTestsPeopleAntigen":null,"totalTestsAntigen":null,"positiveTestsAntigen":null,"fips":"18","positiveIncrease":777,"negativeIncrease":3324,"total":3053929,"totalTestResultsIncrease":16103,"posNeg":3053929,"dataQualityGrade":null,"deathIncrease":18,"hospitalizedIncrease":42,"hash":"b35787e1b662861f4e6364a5367a22869a3f8a97","commercialScore":0,"negativeRegularScore":0,"negativeScore":0,"positiveScore":0,"score":0,"grade":""},{"date":20210214,"state":"IN","positive":648875,"probableCases":null,"negative":2400953,"pending":null,"totalTestResultsSource":"totalTestsViral","totalTestResults":7557530,"hospitalizedCurrently":1031,"hospitalizedCumulative":41604,"inIcuCurrently":214,"inIcuCumulative":7283,"onVentilatorCurrently":108,"onVentilatorCumulative":null,"recovered":null,"lastUpdateEt":"2/13/2021 23:59","dateModified":"2021-02-13T23:59:00Z","checkTimeEt":"02/13 18:59","death":12173,"hospitalized":41604,"hospitalizedDischarged":422051,"dateChecked":"2021-02-13T23:59:00Z","totalTestsViral":7557530,"positiveTestsViral":738594,"negativeTestsViral":null,"positiveCasesViral":null,"deathConfirmed":11746,"deathProbable":427,"totalTestEncountersViral":null,"totalTestsPeopleViral":3049828,"totalTestsAntibody":null,"positiveTestsAntibody":null,"negativeTestsAntibody":null,"totalTestsPeopleAntibody":null,"positiveTestsPeopleAntibody":null,"negativeTestsPeopleAntibody":null,"totalTestsPeopleAntigen":null,"positiveTestsPeopleAntigen":null,"totalTestsAntigen":null,"positiveTestsAntigen":null,"fips":"18","positiveIncrease":1218,"negativeIncrease":4756,"total":3049828,"totalTestResultsIncrease":40801,"posNeg":3049828,"dataQualityGrade":null,"deathIncrease":24,"hospitalizedIncrease":74,"hash":"c7646dd077e8ef1fc359dfcf7854769dfb3874fa","commercialScore":0,"negativeRegularScore":0,"negativeScore":0,"positiveScore":0,"score":0,"grade":""},{"date":20210213,"state":"IN","positive":647657,"probableCases":null,"negative":2396197,"pending":null,"totalTestResultsSource":"totalTestsViral","totalTestResults":7516729,"hospitalizedCurrently":1079,"hospitalizedCumulative":41530,"inIcuCurrently":211,"inIcuCumulative":7267,"onVentilatorCurrently":109,"onVentilatorCumulative":null,"recovered":null,"lastUpdateEt":"2/12/2021 23:59","dateModified":"2021-02-12T23:59:00Z","checkTimeEt":"02/12 18:59","death":12149,"hospitalized":41530,"hospitalizedDischarged":421850,"dateChecked":"2021-02-12T23:59:00Z","totalTestsViral":7516729,"positiveTestsViral":737120,"negativeTestsViral":null,"positiveCasesViral":null,"deathConfirmed":11722,"deathProbable":427,"totalTestEncountersViral":null,"totalTestsPeopleViral":3043854,"totalTestsAntibody":null,"positiveTestsAntibody":null,"negativeTestsAntibody":null,"totalTestsPeopleAntibody":null,"positiveTestsPeopleAntibody":null,"negativeTestsPeopleAntibody":null,"totalTestsPeopleAntigen":null,"positiveTestsPeopleAntigen":null,"totalTestsAntigen":null,"positiveTestsAntigen":null,"fips":"18","positiveIncrease":1232,"negativeIncrease":6068,"total":3043854,"totalTestResultsIncrease":46516,"posNeg":3043854,"dataQualityGrade":null,"deathIncrease":32,"hospitalizedIncrease":71,"hash":"2ae8c98170d446ba411a7251ecbb7ffa9a5a5600","commercialScore":0,"negativeRegularScore":0,"negativeScore":0,"positiveScore":0,"score":0,"grade":""},{"date":20210212,"state":"IN","positive":646425,"probableCases":null,"negative":2390129,"pending":null,"totalTestResultsSource":"totalTestsViral","totalTestResults":7470213,"hospitalizedCurrently":1178,"hospitalizedCumulative":41459,"inIcuCurrently":227,"inIcuCumulative":7253,"onVentilatorCurrently":119,"onVentilatorCumulative":null,"recovered":null,"lastUpdateEt":"2/11/2021 23:59","dateModified":"2021-02-11T23:59:00Z","checkTimeEt":"02/11 18:59","death":12117,"hospitalized":41459,"hospitalizedDischarged":421304,"dateChecked":"2021-02-11T23:59:00Z","totalTestsViral":7470213,"positiveTestsViral":735665,"negativeTestsViral":null,"positiveCasesViral":null,"deathConfirmed":11690,"deathProbable":427,"totalTestEncountersViral":null,"totalTestsPeopleViral":3036554,"totalTestsAntibody":null,"positiveTestsAntibody":null,"negativeTestsAntibody":null,"totalTestsPeopleAntibody":null,"positiveTestsPeopleAntibody":null,"negativeTestsPeopleAntibody":null,"totalTestsPeopleAntigen":null,"positiveTestsPeopleAntigen":null,"totalTestsAntigen":null,"positiveTestsAntigen":null,"fips":"18","positiveIncrease":1419,"negativeIncrease":5192,"total":3036554,"totalTestResultsIncrease":45132,"posNeg":3036554,"dataQualityGrade":null,"deathIncrease":90,"hospitalizedIncrease":81,"hash":"7f414cbfbd35bf2a053a39bccc87cedfed10bbcb","commercialScore":0,"negativeRegularScore":0,"negativeScore":0,"positiveScore":0,"score":0,"grade":""},{"date":20210211,"state":"IN","positive":645006,"probableCases":null,"negative":2384937,"pending":null,"totalTestResultsSource":"totalTestsViral","totalTestResults":7425081,"hospitalizedCurrently":1226,"hospitalizedCumulative":41378,"inIcuCurrently":239,"inIcuCumulative":7240,"onVentilatorCurrently":118,"onVentilatorCumulative":null,"recovered":null,"lastUpdateEt":"2/10/2021 23:59","dateModified":"2021-02-10T23:59:00Z","checkTimeEt":"02/10 18:59","death":12027,"hospitalized":41378,"hospitalizedDischarged":420225,"dateChecked":"2021-02-10T23:59:00Z","totalTestsViral":7425081,"positiveTestsViral":734071,"negativeTestsViral":null,"positiveCasesViral":null,"deathConfirmed":11604,"deathProbable":423,"totalTestEncountersViral":null,"totalTestsPeopleViral":3029943,"totalTestsAntibody":null,"positiveTestsAntibody":null,"negativeTestsAntibody":null,"totalTestsPeopleAntibody":null,"positiveTestsPeopleAntibody":null,"negativeTestsPeopleAntibody":null,"totalTestsPeopleAntigen":null,"positiveTestsPeopleAntigen":null,"totalTestsAntigen":null,"positiveTestsAntigen":null,"fips":"18","positiveIncrease":1701,"negativeIncrease":6629,"total":3029943,"totalTestResultsIncrease":57871,"posNeg":3029943,"dataQualityGrade":null,"deathIncrease":26,"hospitalizedIncrease":86,"hash":"dcf52cf292cfd870fabdc3e1107dbf06f050d1d9","commercialScore":0,"negativeRegularScore":0,"negativeScore":0,"positiveScore":0,"score":0,"grade":""},{"date":20210210,"state":"IN","positive":643305,"probableCases":null,"negative":2378308,"pending":null,"totalTestResultsSource":"totalTestsViral","totalTestResults":7367210,"hospitalizedCurrently":1273,"hospitalizedCumulative":41292,"inIcuCurrently":262,"inIcuCumulative":7228,"onVentilatorCurrently":138,"onVentilatorCumulative":null,"recovered":null,"lastUpdateEt":"2/9/2021 23:59","dateModified":"2021-02-09T23:59:00Z","checkTimeEt":"02/09 18:59","death":12001,"hospitalized":41292,"hospitalizedDischarged":419043,"dateChecked":"2021-02-09T23:59:00Z","totalTestsViral":7367210,"positiveTestsViral":732027,"negativeTestsViral":null,"positiveCasesViral":null,"deathConfirmed":11578,"deathProbable":423,"totalTestEncountersViral":null,"totalTestsPeopleViral":3021613,"totalTestsAntibody":null,"positiveTestsAntibody":null,"negativeTestsAntibody":null,"totalTestsPeopleAntibody":null,"positiveTestsPeopleAntibody":null,"negativeTestsPeopleAntibody":null,"totalTestsPeopleAntigen":null,"positiveTestsPeopleAntigen":null,"totalTestsAntigen":null,"positiveTestsAntigen":null,"fips":"18","positiveIncrease":1431,"negativeIncrease":4797,"total":3021613,"totalTestResultsIncrease":38386,"posNeg":3021613,"dataQualityGrade":null,"deathIncrease":59,"hospitalizedIncrease":85,"hash":"820226f54ac26e0b8a517afc09d453bc02f84ad2","commercialScore":0,"negativeRegularScore":0,"negativeScore":0,"positiveScore":0,"score":0,"grade":""},{"date":20210209,"state":"IN","positive":641874,"probableCases":null,"negative":2373511,"pending":null,"totalTestResultsSource":"totalTestsViral","totalTestResults":7328824,"hospitalizedCurrently":1265,"hospitalizedCumulative":41207,"inIcuCurrently":274,"inIcuCumulative":7207,"onVentilatorCurrently":142,"onVentilatorCumulative":null,"recovered":null,"lastUpdateEt":"2/8/2021 23:59","dateModified":"2021-02-08T23:59:00Z","checkTimeEt":"02/08 18:59","death":11942,"hospitalized":41207,"hospitalizedDischarged":417785,"dateChecked":"2021-02-08T23:59:00Z","totalTestsViral":7328824,"positiveTestsViral":730482,"negativeTestsViral":null,"positiveCasesViral":null,"deathConfirmed":11526,"deathProbable":416,"totalTestEncountersViral":null,"totalTestsPeopleViral":3015385,"totalTestsAntibody":null,"positiveTestsAntibody":null,"negativeTestsAntibody":null,"totalTestsPeopleAntibody":null,"positiveTestsPeopleAntibody":null,"negativeTestsPeopleAntibody":null,"totalTestsPeopleAntigen":null,"positiveTestsPeopleAntigen":null,"totalTestsAntigen":null,"positiveTestsAntigen":null,"fips":"18","positiveIncrease":1130,"negativeIncrease":3070,"total":3015385,"totalTestResultsIncrease":25604,"posNeg":3015385,"dataQualityGrade":null,"deathIncrease":67,"hospitalizedIncrease":98,"hash":"5938cd7abcb1ba5b98a7e90eded032e4b932a836","commercialScore":0,"negativeRegularScore":0,"negativeScore":0,"positiveScore":0,"score":0,"grade":""},{"date":20210208,"state":"IN","positive":640744,"probableCases":null,"negative":2370441,"pending":null,"totalTestResultsSource":"totalTestsViral","totalTestResults":7303220,"hospitalizedCurrently":1292,"hospitalizedCumulative":41109,"inIcuCurrently":285,"inIcuCumulative":7190,"onVentilatorCurrently":146,"onVentilatorCumulative":null,"recovered":null,"lastUpdateEt":"2/7/2021 23:59","dateModified":"2021-02-07T23:59:00Z","checkTimeEt":"02/07 18:59","death":11875,"hospitalized":41109,"hospitalizedDischarged":416754,"dateChecked":"2021-02-07T23:59:00Z","totalTestsViral":7303220,"positiveTestsViral":729157,"negativeTestsViral":null,"positiveCasesViral":null,"deathConfirmed":11459,"deathProbable":416,"totalTestEncountersViral":null,"totalTestsPeopleViral":3011185,"totalTestsAntibody":null,"positiveTestsAntibody":null,"negativeTestsAntibody":null,"totalTestsPeopleAntibody":null,"positiveTestsPeopleAntibody":null,"negativeTestsPeopleAntibody":null,"totalTestsPeopleAntigen":null,"positiveTestsPeopleAntigen":null,"totalTestsAntigen":null,"positiveTestsAntigen":null,"fips":"18","positiveIncrease":1033,"negativeIncrease":3722,"total":3011185,"totalTestResultsIncrease":17399,"posNeg":3011185,"dataQualityGrade":null,"deathIncrease":58,"hospitalizedIncrease":75,"hash":"5e47f18ed0b8da5a0d589930da990c359e69148c","commercialScore":0,"negativeRegularScore":0,"negativeScore":0,"positiveScore":0,"score":0,"grade":""},{"date":20210207,"state":"IN","positive":639711,"probableCases":null,"negative":2366719,"pending":null,"totalTestResultsSource":"totalTestsViral","totalTestResults":7285821,"hospitalizedCurrently":1287,"hospitalizedCumulative":41034,"inIcuCurrently":290,"inIcuCumulative":7177,"onVentilatorCurrently":153,"onVentilatorCumulative":null,"recovered":null,"lastUpdateEt":"2/6/2021 23:59","dateModified":"2021-02-06T23:59:00Z","checkTimeEt":"02/06 18:59","death":11817,"hospitalized":41034,"hospitalizedDischarged":415656,"dateChecked":"2021-02-06T23:59:00Z","totalTestsViral":7285821,"positiveTestsViral":727970,"negativeTestsViral":null,"positiveCasesViral":null,"deathConfirmed":11401,"deathProbable":416,"totalTestEncountersViral":null,"totalTestsPeopleViral":3006430,"totalTestsAntibody":null,"positiveTestsAntibody":null,"negativeTestsAntibody":null,"totalTestsPeopleAntibody":null,"positiveTestsPeopleAntibody":null,"negativeTestsPeopleAntibody":null,"totalTestsPeopleAntigen":null,"positiveTestsPeopleAntigen":null,"totalTestsAntigen":null,"positiveTestsAntigen":null,"fips":"18","positiveIncrease":1724,"negativeIncrease":5633,"total":3006430,"totalTestResultsIncrease":48517,"posNeg":3006430,"dataQualityGrade":null,"deathIncrease":65,"hospitalizedIncrease":63,"hash":"400ce543890b6d2676cb7bbfab58b45bd91ca8cb","commercialScore":0,"negativeRegularScore":0,"negativeScore":0,"positiveScore":0,"score":0,"grade":""},{"date":20210206,"state":"IN","positive":637987,"probableCases":null,"negative":2361086,"pending":null,"totalTestResultsSource":"totalTestsViral","totalTestResults":7237304,"hospitalizedCurrently":1399,"hospitalizedCumulative":40971,"inIcuCurrently":300,"inIcuCumulative":7158,"onVentilatorCurrently":163,"onVentilatorCumulative":null,"recovered":null,"lastUpdateEt":"2/5/2021 23:59","dateModified":"2021-02-05T23:59:00Z","checkTimeEt":"02/05 18:59","death":11752,"hospitalized":40971,"hospitalizedDischarged":415130,"dateChecked":"2021-02-05T23:59:00Z","totalTestsViral":7237304,"positiveTestsViral":725910,"negativeTestsViral":null,"positiveCasesViral":null,"deathConfirmed":11346,"deathProbable":406,"totalTestEncountersViral":null,"totalTestsPeopleViral":2999073,"totalTestsAntibody":null,"positiveTestsAntibody":null,"negativeTestsAntibody":null,"totalTestsPeopleAntibody":null,"positiveTestsPeopleAntibody":null,"negativeTestsPeopleAntibody":null,"totalTestsPeopleAntigen":null,"positiveTestsPeopleAntigen":null,"totalTestsAntigen":null,"positiveTestsAntigen":null,"fips":"18","positiveIncrease":2816,"negativeIncrease":7188,"total":2999073,"totalTestResultsIncrease":56220,"posNeg":2999073,"dataQualityGrade":null,"deathIncrease":66,"hospitalizedIncrease":80,"hash":"f3acf2f9f0b068d5272c59c68d7e00d54a2c9966","commercialScore":0,"negativeRegularScore":0,"negativeScore":0,"positiveScore":0,"score":0,"grade":""},{"date":20210205,"state":"IN","positive":635171,"probableCases":null,"negative":2353898,"pending":null,"totalTestResultsSource":"totalTestsViral","totalTestResults":7181084,"hospitalizedCurrently":1446,"hospitalizedCumulative":40891,"inIcuCurrently":322,"inIcuCumulative":7148,"onVentilatorCurrently":165,"onVentilatorCumulative":null,"recovered":null,"lastUpdateEt":"2/4/2021 23:59","dateModified":"2021-02-04T23:59:00Z","checkTimeEt":"02/04 18:59","death":11686,"hospitalized":40891,"hospitalizedDischarged":414245,"dateChecked":"2021-02-04T23:59:00Z","totalTestsViral":7181084,"positiveTestsViral":722479,"negativeTestsViral":null,"positiveCasesViral":null,"deathConfirmed":11280,"deathProbable":406,"totalTestEncountersViral":null,"totalTestsPeopleViral":2989069,"totalTestsAntibody":null,"positiveTestsAntibody":null,"negativeTestsAntibody":null,"totalTestsPeopleAntibody":null,"positiveTestsPeopleAntibody":null,"negativeTestsPeopleAntibody":null,"totalTestsPeopleAntigen":null,"positiveTestsPeopleAntigen":null,"totalTestsAntigen":null,"positiveTestsAntigen":null,"fips":"18","positiveIncrease":1481,"negativeIncrease":4562,"total":2989069,"totalTestResultsIncrease":30280,"posNeg":2989069,"dataQualityGrade":null,"deathIncrease":49,"hospitalizedIncrease":117,"hash":"37e28e615c119baea6f14d2b1896e83e3875d572","commercialScore":0,"negativeRegularScore":0,"negativeScore":0,"positiveScore":0,"score":0,"grade":""},{"date":20210204,"state":"IN","positive":633690,"probableCases":null,"negative":2349336,"pending":null,"totalTestResultsSource":"totalTestsViral","totalTestResults":7150804,"hospitalizedCurrently":1541,"hospitalizedCumulative":40774,"inIcuCurrently":331,"inIcuCumulative":7135,"onVentilatorCurrently":175,"onVentilatorCumulative":null,"recovered":null,"lastUpdateEt":"2/3/2021 23:59","dateModified":"2021-02-03T23:59:00Z","checkTimeEt":"02/03 18:59","death":11637,"hospitalized":40774,"hospitalizedDischarged":412819,"dateChecked":"2021-02-03T23:59:00Z","totalTestsViral":7150804,"positiveTestsViral":720786,"negativeTestsViral":null,"positiveCasesViral":null,"deathConfirmed":11231,"deathProbable":406,"totalTestEncountersViral":null,"totalTestsPeopleViral":2983026,"totalTestsAntibody":null,"positiveTestsAntibody":null,"negativeTestsAntibody":null,"totalTestsPeopleAntibody":null,"positiveTestsPeopleAntibody":null,"negativeTestsPeopleAntibody":null,"totalTestsPeopleAntigen":null,"positiveTestsPeopleAntigen":null,"totalTestsAntigen":null,"positiveTestsAntigen":null,"fips":"18","positiveIncrease":2359,"negativeIncrease":7049,"total":2983026,"totalTestResultsIncrease":54480,"posNeg":2983026,"dataQualityGrade":null,"deathIncrease":1546,"hospitalizedIncrease":107,"hash":"8e7fbd2b14ab4ce1deebf2473bd4ec7aa5876cf1","commercialScore":0,"negativeRegularScore":0,"negativeScore":0,"positiveScore":0,"score":0,"grade":""},{"date":20210203,"state":"IN","positive":631331,"probableCases":null,"negative":2342287,"pending":null,"totalTestResultsSource":"totalTestsViral","totalTestResults":7096324,"hospitalizedCurrently":1582,"hospitalizedCumulative":40667,"inIcuCurrently":344,"inIcuCumulative":7116,"onVentilatorCurrently":188,"onVentilatorCumulative":null,"recovered":null,"lastUpdateEt":"2/2/2021 23:59","dateModified":"2021-02-02T23:59:00Z","checkTimeEt":"02/02 18:59","death":10091,"hospitalized":40667,"hospitalizedDischarged":411314,"dateChecked":"2021-02-02T23:59:00Z","totalTestsViral":7096324,"positiveTestsViral":718064,"negativeTestsViral":null,"positiveCasesViral":null,"deathConfirmed":9713,"deathProbable":378,"totalTestEncountersViral":null,"totalTestsPeopleViral":2973618,"totalTestsAntibody":null,"positiveTestsAntibody":null,"negativeTestsAntibody":null,"totalTestsPeopleAntibody":null,"positiveTestsPeopleAntibody":null,"negativeTestsPeopleAntibody":null,"totalTestsPeopleAntigen":null,"positiveTestsPeopleAntigen":null,"totalTestsAntigen":null,"positiveTestsAntigen":null,"fips":"18","positiveIncrease":1428,"negativeIncrease":3599,"total":2973618,"totalTestResultsIncrease":29149,"posNeg":2973618,"dataQualityGrade":null,"deathIncrease":37,"hospitalizedIncrease":97,"hash":"8e1ec8e6174f5dc2acea717d58c07ceb62f5d843","commercialScore":0,"negativeRegularScore":0,"negativeScore":0,"positiveScore":0,"score":0,"grade":""},{"date":20210202,"state":"IN","positive":629903,"probableCases":null,"negative":2338688,"pending":null,"totalTestResultsSource":"totalTestsViral","totalTestResults":7067175,"hospitalizedCurrently":1624,"hospitalizedCumulative":40570,"inIcuCurrently":347,"inIcuCumulative":7097,"onVentilatorCurrently":200,"onVentilatorCumulative":null,"recovered":null,"lastUpdateEt":"2/1/2021 23:59","dateModified":"2021-02-01T23:59:00Z","checkTimeEt":"02/01 18:59","death":10054,"hospitalized":40570,"hospitalizedDischarged":409565,"dateChecked":"2021-02-01T23:59:00Z","totalTestsViral":7067175,"positiveTestsViral":716476,"negativeTestsViral":null,"positiveCasesViral":null,"deathConfirmed":9677,"deathProbable":377,"totalTestEncountersViral":null,"totalTestsPeopleViral":2968591,"totalTestsAntibody":null,"positiveTestsAntibody":null,"negativeTestsAntibody":null,"totalTestsPeopleAntibody":null,"positiveTestsPeopleAntibody":null,"negativeTestsPeopleAntibody":null,"totalTestsPeopleAntigen":null,"positiveTestsPeopleAntigen":null,"totalTestsAntigen":null,"positiveTestsAntigen":null,"fips":"18","positiveIncrease":1512,"negativeIncrease":3498,"total":2968591,"totalTestResultsIncrease":27431,"posNeg":2968591,"dataQualityGrade":null,"deathIncrease":65,"hospitalizedIncrease":133,"hash":"592881548b01790df6367b1b67ac93b0d5911a1a","commercialScore":0,"negativeRegularScore":0,"negativeScore":0,"positiveScore":0,"score":0,"grade":""},{"date":20210201,"state":"IN","positive":628391,"probableCases":null,"negative":2335190,"pending":null,"totalTestResultsSource":"totalTestsViral","totalTestResults":7039744,"hospitalizedCurrently":1594,"hospitalizedCumulative":40437,"inIcuCurrently":374,"inIcuCumulative":7065,"onVentilatorCurrently":201,"onVentilatorCumulative":null,"recovered":null,"lastUpdateEt":"1/31/2021 23:59","dateModified":"2021-01-31T23:59:00Z","checkTimeEt":"01/31 18:59","death":9989,"hospitalized":40437,"hospitalizedDischarged":407664,"dateChecked":"2021-01-31T23:59:00Z","totalTestsViral":7039744,"positiveTestsViral":714746,"negativeTestsViral":null,"positiveCasesViral":null,"deathConfirmed":9613,"deathProbable":376,"totalTestEncountersViral":null,"totalTestsPeopleViral":2963581,"totalTestsAntibody":null,"positiveTestsAntibody":null,"negativeTestsAntibody":null,"totalTestsPeopleAntibody":null,"positiveTestsPeopleAntibody":null,"negativeTestsPeopleAntibody":null,"totalTestsPeopleAntigen":null,"positiveTestsPeopleAntigen":null,"totalTestsAntigen":null,"positiveTestsAntigen":null,"fips":"18","positiveIncrease":1709,"negativeIncrease":4005,"total":2963581,"totalTestResultsIncrease":25221,"posNeg":2963581,"dataQualityGrade":null,"deathIncrease":15,"hospitalizedIncrease":89,"hash":"cb110bf13c69a70306560b0dcf9e765f375debde","commercialScore":0,"negativeRegularScore":0,"negativeScore":0,"positiveScore":0,"score":0,"grade":""},{"date":20210131,"state":"IN","positive":626682,"probableCases":null,"negative":2331185,"pending":null,"totalTestResultsSource":"totalTestsViral","totalTestResults":7014523,"hospitalizedCurrently":1584,"hospitalizedCumulative":40348,"inIcuCurrently":372,"inIcuCumulative":7054,"onVentilatorCurrently":214,"onVentilatorCumulative":null,"recovered":null,"lastUpdateEt":"1/30/2021 23:59","dateModified":"2021-01-30T23:59:00Z","checkTimeEt":"01/30 18:59","death":9974,"hospitalized":40348,"hospitalizedDischarged":405459,"dateChecked":"2021-01-30T23:59:00Z","totalTestsViral":7014523,"positiveTestsViral":712717,"negativeTestsViral":null,"positiveCasesViral":null,"deathConfirmed":9598,"deathProbable":376,"totalTestEncountersViral":null,"totalTestsPeopleViral":2957867,"totalTestsAntibody":null,"positiveTestsAntibody":null,"negativeTestsAntibody":null,"totalTestsPeopleAntibody":null,"positiveTestsPeopleAntibody":null,"negativeTestsPeopleAntibody":null,"totalTestsPeopleAntigen":null,"positiveTestsPeopleAntigen":null,"totalTestsAntigen":null,"positiveTestsAntigen":null,"fips":"18","positiveIncrease":1723,"negativeIncrease":6699,"total":2957867,"totalTestResultsIncrease":38115,"posNeg":2957867,"dataQualityGrade":null,"deathIncrease":7,"hospitalizedIncrease":82,"hash":"242d0259af04e03ba01bcf8f2bdeb0c3fd182a13","commercialScore":0,"negativeRegularScore":0,"negativeScore":0,"positiveScore":0,"score":0,"grade":""},{"date":20210130,"state":"IN","positive":624959,"probableCases":null,"negative":2324486,"pending":null,"totalTestResultsSource":"totalTestsViral","totalTestResults":6976408,"hospitalizedCurrently":1648,"hospitalizedCumulative":40266,"inIcuCurrently":387,"inIcuCumulative":7039,"onVentilatorCurrently":212,"onVentilatorCumulative":null,"recovered":null,"lastUpdateEt":"1/29/2021 23:59","dateModified":"2021-01-29T23:59:00Z","checkTimeEt":"01/29 18:59","death":9967,"hospitalized":40266,"hospitalizedDischarged":404922,"dateChecked":"2021-01-29T23:59:00Z","totalTestsViral":6976408,"positiveTestsViral":710665,"negativeTestsViral":null,"positiveCasesViral":null,"deathConfirmed":9592,"deathProbable":375,"totalTestEncountersViral":null,"totalTestsPeopleViral":2949445,"totalTestsAntibody":null,"positiveTestsAntibody":null,"negativeTestsAntibody":null,"totalTestsPeopleAntibody":null,"positiveTestsPeopleAntibody":null,"negativeTestsPeopleAntibody":null,"totalTestsPeopleAntigen":null,"positiveTestsPeopleAntigen":null,"totalTestsAntigen":null,"positiveTestsAntigen":null,"fips":"18","positiveIncrease":2334,"negativeIncrease":6878,"total":2949445,"totalTestResultsIncrease":47203,"posNeg":2949445,"dataQualityGrade":null,"deathIncrease":42,"hospitalizedIncrease":116,"hash":"154f90a3fae6389217b9083221f59cd951caed31","commercialScore":0,"negativeRegularScore":0,"negativeScore":0,"positiveScore":0,"score":0,"grade":""},{"date":20210129,"state":"IN","positive":622625,"probableCases":null,"negative":2317608,"pending":null,"totalTestResultsSource":"totalTestsViral","totalTestResults":6929205,"hospitalizedCurrently":1725,"hospitalizedCumulative":40150,"inIcuCurrently":399,"inIcuCumulative":7019,"onVentilatorCurrently":219,"onVentilatorCumulative":null,"recovered":null,"lastUpdateEt":"1/28/2021 23:59","dateModified":"2021-01-28T23:59:00Z","checkTimeEt":"01/28 18:59","death":9925,"hospitalized":40150,"hospitalizedDischarged":403634,"dateChecked":"2021-01-28T23:59:00Z","totalTestsViral":6929205,"positiveTestsViral":707942,"negativeTestsViral":null,"positiveCasesViral":null,"deathConfirmed":9549,"deathProbable":376,"totalTestEncountersViral":null,"totalTestsPeopleViral":2940233,"totalTestsAntibody":null,"positiveTestsAntibody":null,"negativeTestsAntibody":null,"totalTestsPeopleAntibody":null,"positiveTestsPeopleAntibody":null,"negativeTestsPeopleAntibody":null,"totalTestsPeopleAntigen":null,"positiveTestsPeopleAntigen":null,"totalTestsAntigen":null,"positiveTestsAntigen":null,"fips":"18","positiveIncrease":2630,"negativeIncrease":7250,"total":2940233,"totalTestResultsIncrease":44714,"posNeg":2940233,"dataQualityGrade":null,"deathIncrease":46,"hospitalizedIncrease":132,"hash":"49d19ac3ea0e0632724dcf906ffedd4f7ac9b141","commercialScore":0,"negativeRegularScore":0,"negativeScore":0,"positiveScore":0,"score":0,"grade":""},{"date":20210128,"state":"IN","positive":619995,"probableCases":null,"negative":2310358,"pending":null,"totalTestResultsSource":"totalTestsViral","totalTestResults":6884491,"hospitalizedCurrently":1915,"hospitalizedCumulative":40018,"inIcuCurrently":420,"inIcuCumulative":6993,"onVentilatorCurrently":232,"onVentilatorCumulative":null,"recovered":null,"lastUpdateEt":"1/27/2021 23:59","dateModified":"2021-01-27T23:59:00Z","checkTimeEt":"01/27 18:59","death":9879,"hospitalized":40018,"hospitalizedDischarged":401700,"dateChecked":"2021-01-27T23:59:00Z","totalTestsViral":6884491,"positiveTestsViral":704889,"negativeTestsViral":null,"positiveCasesViral":null,"deathConfirmed":9504,"deathProbable":375,"totalTestEncountersViral":null,"totalTestsPeopleViral":2930353,"totalTestsAntibody":null,"positiveTestsAntibody":null,"negativeTestsAntibody":null,"totalTestsPeopleAntibody":null,"positiveTestsPeopleAntibody":null,"negativeTestsPeopleAntibody":null,"totalTestsPeopleAntigen":null,"positiveTestsPeopleAntigen":null,"totalTestsAntigen":null,"positiveTestsAntigen":null,"fips":"18","positiveIncrease":2819,"negativeIncrease":7407,"total":2930353,"totalTestResultsIncrease":54195,"posNeg":2930353,"dataQualityGrade":null,"deathIncrease":34,"hospitalizedIncrease":124,"hash":"7cce99e07b6e9750588ed648c8ddeafafef3d0ac","commercialScore":0,"negativeRegularScore":0,"negativeScore":0,"positiveScore":0,"score":0,"grade":""},{"date":20210127,"state":"IN","positive":617176,"probableCases":null,"negative":2302951,"pending":null,"totalTestResultsSource":"totalTestsViral","totalTestResults":6830296,"hospitalizedCurrently":1902,"hospitalizedCumulative":39894,"inIcuCurrently":430,"inIcuCumulative":6974,"onVentilatorCurrently":242,"onVentilatorCumulative":null,"recovered":null,"lastUpdateEt":"1/26/2021 23:59","dateModified":"2021-01-26T23:59:00Z","checkTimeEt":"01/26 18:59","death":9845,"hospitalized":39894,"hospitalizedDischarged":399347,"dateChecked":"2021-01-26T23:59:00Z","totalTestsViral":6830296,"positiveTestsViral":701673,"negativeTestsViral":null,"positiveCasesViral":null,"deathConfirmed":9470,"deathProbable":375,"totalTestEncountersViral":null,"totalTestsPeopleViral":2920127,"totalTestsAntibody":null,"positiveTestsAntibody":null,"negativeTestsAntibody":null,"totalTestsPeopleAntibody":null,"positiveTestsPeopleAntibody":null,"negativeTestsPeopleAntibody":null,"totalTestsPeopleAntigen":null,"positiveTestsPeopleAntigen":null,"totalTestsAntigen":null,"positiveTestsAntigen":null,"fips":"18","positiveIncrease":2230,"negativeIncrease":5714,"total":2920127,"totalTestResultsIncrease":43069,"posNeg":2920127,"dataQualityGrade":null,"deathIncrease":38,"hospitalizedIncrease":141,"hash":"36f7993dee59b39879589ea9c58943991185f68c","commercialScore":0,"negativeRegularScore":0,"negativeScore":0,"positiveScore":0,"score":0,"grade":""},{"date":20210126,"state":"IN","positive":614946,"probableCases":null,"negative":2297237,"pending":null,"totalTestResultsSource":"totalTestsViral","totalTestResults":6787227,"hospitalizedCurrently":1976,"hospitalizedCumulative":39753,"inIcuCurrently":449,"inIcuCumulative":6935,"onVentilatorCurrently":249,"onVentilatorCumulative":null,"recovered":null,"lastUpdateEt":"1/25/2021 23:59","dateModified":"2021-01-25T23:59:00Z","checkTimeEt":"01/25 18:59","death":9807,"hospitalized":39753,"hospitalizedDischarged":396991,"dateChecked":"2021-01-25T23:59:00Z","totalTestsViral":6787227,"positiveTestsViral":699136,"negativeTestsViral":null,"positiveCasesViral":null,"deathConfirmed":9432,"deathProbable":375,"totalTestEncountersViral":null,"totalTestsPeopleViral":2912183,"totalTestsAntibody":null,"positiveTestsAntibody":null,"negativeTestsAntibody":null,"totalTestsPeopleAntibody":null,"positiveTestsPeopleAntibody":null,"negativeTestsPeopleAntibody":null,"totalTestsPeopleAntigen":null,"positiveTestsPeopleAntigen":null,"totalTestsAntigen":null,"positiveTestsAntigen":null,"fips":"18","positiveIncrease":1718,"negativeIncrease":3433,"total":2912183,"totalTestResultsIncrease":25789,"posNeg":2912183,"dataQualityGrade":null,"deathIncrease":79,"hospitalizedIncrease":144,"hash":"28b6806fe6ca5d0e62b294a996e6cd9e5a23b330","commercialScore":0,"negativeRegularScore":0,"negativeScore":0,"positiveScore":0,"score":0,"grade":""},{"date":20210125,"state":"IN","positive":613228,"probableCases":null,"negative":2293804,"pending":null,"totalTestResultsSource":"totalTestsViral","totalTestResults":6761438,"hospitalizedCurrently":2045,"hospitalizedCumulative":39609,"inIcuCurrently":459,"inIcuCumulative":6916,"onVentilatorCurrently":257,"onVentilatorCumulative":null,"recovered":null,"lastUpdateEt":"1/24/2021 23:59","dateModified":"2021-01-24T23:59:00Z","checkTimeEt":"01/24 18:59","death":9728,"hospitalized":39609,"hospitalizedDischarged":394046,"dateChecked":"2021-01-24T23:59:00Z","totalTestsViral":6761438,"positiveTestsViral":697231,"negativeTestsViral":null,"positiveCasesViral":null,"deathConfirmed":9352,"deathProbable":376,"totalTestEncountersViral":null,"totalTestsPeopleViral":2907032,"totalTestsAntibody":null,"positiveTestsAntibody":null,"negativeTestsAntibody":null,"totalTestsPeopleAntibody":null,"positiveTestsPeopleAntibody":null,"negativeTestsPeopleAntibody":null,"totalTestsPeopleAntigen":null,"positiveTestsPeopleAntigen":null,"totalTestsAntigen":null,"positiveTestsAntigen":null,"fips":"18","positiveIncrease":2189,"negativeIncrease":4792,"total":2907032,"totalTestResultsIncrease":23097,"posNeg":2907032,"dataQualityGrade":null,"deathIncrease":12,"hospitalizedIncrease":104,"hash":"5fa771d660765f725287ad6c06adc92ebd9b896c","commercialScore":0,"negativeRegularScore":0,"negativeScore":0,"positiveScore":0,"score":0,"grade":""},{"date":20210124,"state":"IN","positive":611039,"probableCases":null,"negative":2289012,"pending":null,"totalTestResultsSource":"totalTestsViral","totalTestResults":6738341,"hospitalizedCurrently":2118,"hospitalizedCumulative":39505,"inIcuCurrently":478,"inIcuCumulative":6917,"onVentilatorCurrently":243,"onVentilatorCumulative":null,"recovered":null,"lastUpdateEt":"1/23/2021 23:59","dateModified":"2021-01-23T23:59:00Z","checkTimeEt":"01/23 18:59","death":9716,"hospitalized":39505,"hospitalizedDischarged":390699,"dateChecked":"2021-01-23T23:59:00Z","totalTestsViral":6738341,"positiveTestsViral":694707,"negativeTestsViral":null,"positiveCasesViral":null,"deathConfirmed":9340,"deathProbable":376,"totalTestEncountersViral":null,"totalTestsPeopleViral":2900051,"totalTestsAntibody":null,"positiveTestsAntibody":null,"negativeTestsAntibody":null,"totalTestsPeopleAntibody":null,"positiveTestsPeopleAntibody":null,"negativeTestsPeopleAntibody":null,"totalTestsPeopleAntigen":null,"positiveTestsPeopleAntigen":null,"totalTestsAntigen":null,"positiveTestsAntigen":null,"fips":"18","positiveIncrease":2520,"negativeIncrease":6575,"total":2900051,"totalTestResultsIncrease":36864,"posNeg":2900051,"dataQualityGrade":null,"deathIncrease":23,"hospitalizedIncrease":109,"hash":"ba002605df5d6e6489e17aa886f207ebe95bd2c4","commercialScore":0,"negativeRegularScore":0,"negativeScore":0,"positiveScore":0,"score":0,"grade":""},{"date":20210123,"state":"IN","positive":608519,"probableCases":null,"negative":2282437,"pending":null,"totalTestResultsSource":"totalTestsViral","totalTestResults":6701477,"hospitalizedCurrently":2134,"hospitalizedCumulative":39396,"inIcuCurrently":478,"inIcuCumulative":6885,"onVentilatorCurrently":261,"onVentilatorCumulative":null,"recovered":null,"lastUpdateEt":"1/22/2021 23:59","dateModified":"2021-01-22T23:59:00Z","checkTimeEt":"01/22 18:59","death":9693,"hospitalized":39396,"hospitalizedDischarged":389773,"dateChecked":"2021-01-22T23:59:00Z","totalTestsViral":6701477,"positiveTestsViral":691677,"negativeTestsViral":null,"positiveCasesViral":null,"deathConfirmed":9317,"deathProbable":376,"totalTestEncountersViral":null,"totalTestsPeopleViral":2890956,"totalTestsAntibody":null,"positiveTestsAntibody":null,"negativeTestsAntibody":null,"totalTestsPeopleAntibody":null,"positiveTestsPeopleAntibody":null,"negativeTestsPeopleAntibody":null,"totalTestsPeopleAntigen":null,"positiveTestsPeopleAntigen":null,"totalTestsAntigen":null,"positiveTestsAntigen":null,"fips":"18","positiveIncrease":3093,"negativeIncrease":7967,"total":2890956,"totalTestResultsIncrease":48977,"posNeg":2890956,"dataQualityGrade":null,"deathIncrease":51,"hospitalizedIncrease":154,"hash":"deb7c23223d81c816e9d7c0d1020b7a17b7ee3c6","commercialScore":0,"negativeRegularScore":0,"negativeScore":0,"positiveScore":0,"score":0,"grade":""},{"date":20210122,"state":"IN","positive":605426,"probableCases":null,"negative":2274470,"pending":null,"totalTestResultsSource":"totalTestsViral","totalTestResults":6652500,"hospitalizedCurrently":2151,"hospitalizedCumulative":39242,"inIcuCurrently":496,"inIcuCumulative":6849,"onVentilatorCurrently":266,"onVentilatorCumulative":null,"recovered":null,"lastUpdateEt":"1/21/2021 23:59","dateModified":"2021-01-21T23:59:00Z","checkTimeEt":"01/21 18:59","death":9642,"hospitalized":39242,"hospitalizedDischarged":388141,"dateChecked":"2021-01-21T23:59:00Z","totalTestsViral":6652500,"positiveTestsViral":688073,"negativeTestsViral":null,"positiveCasesViral":null,"deathConfirmed":9267,"deathProbable":375,"totalTestEncountersViral":null,"totalTestsPeopleViral":2879896,"totalTestsAntibody":null,"positiveTestsAntibody":null,"negativeTestsAntibody":null,"totalTestsPeopleAntibody":null,"positiveTestsPeopleAntibody":null,"negativeTestsPeopleAntibody":null,"totalTestsPeopleAntigen":null,"positiveTestsPeopleAntigen":null,"totalTestsAntigen":null,"positiveTestsAntigen":null,"fips":"18","positiveIncrease":3489,"negativeIncrease":8417,"total":2879896,"totalTestResultsIncrease":52461,"posNeg":2879896,"dataQualityGrade":null,"deathIncrease":49,"hospitalizedIncrease":197,"hash":"ebbf3931dd1f5e5ca382d129ded09b549dffa5bc","commercialScore":0,"negativeRegularScore":0,"negativeScore":0,"positiveScore":0,"score":0,"grade":""},{"date":20210121,"state":"IN","positive":601937,"probableCases":null,"negative":2266053,"pending":null,"totalTestResultsSource":"totalTestsViral","totalTestResults":6600039,"hospitalizedCurrently":2303,"hospitalizedCumulative":39045,"inIcuCurrently":519,"inIcuCumulative":6811,"onVentilatorCurrently":266,"onVentilatorCumulative":null,"recovered":null,"lastUpdateEt":"1/20/2021 23:59","dateModified":"2021-01-20T23:59:00Z","checkTimeEt":"01/20 18:59","death":9593,"hospitalized":39045,"hospitalizedDischarged":387324,"dateChecked":"2021-01-20T23:59:00Z","totalTestsViral":6600039,"positiveTestsViral":684081,"negativeTestsViral":null,"positiveCasesViral":null,"deathConfirmed":9218,"deathProbable":375,"totalTestEncountersViral":null,"totalTestsPeopleViral":2867990,"totalTestsAntibody":null,"positiveTestsAntibody":null,"negativeTestsAntibody":null,"totalTestsPeopleAntibody":null,"positiveTestsPeopleAntibody":null,"negativeTestsPeopleAntibody":null,"totalTestsPeopleAntigen":null,"positiveTestsPeopleAntigen":null,"totalTestsAntigen":null,"positiveTestsAntigen":null,"fips":"18","positiveIncrease":3624,"negativeIncrease":8375,"total":2867990,"totalTestResultsIncrease":54719,"posNeg":2867990,"dataQualityGrade":null,"deathIncrease":64,"hospitalizedIncrease":188,"hash":"71fe5762bb099137c0b66988ead63b6d0b279d4b","commercialScore":0,"negativeRegularScore":0,"negativeScore":0,"positiveScore":0,"score":0,"grade":""},{"date":20210120,"state":"IN","positive":598313,"probableCases":null,"negative":2257678,"pending":null,"totalTestResultsSource":"totalTestsViral","totalTestResults":6545320,"hospitalizedCurrently":2302,"hospitalizedCumulative":38857,"inIcuCurrently":522,"inIcuCumulative":6799,"onVentilatorCurrently":275,"onVentilatorCumulative":null,"recovered":null,"lastUpdateEt":"1/19/2021 23:59","dateModified":"2021-01-19T23:59:00Z","checkTimeEt":"01/19 18:59","death":9529,"hospitalized":38857,"hospitalizedDischarged":385183,"dateChecked":"2021-01-19T23:59:00Z","totalTestsViral":6545320,"positiveTestsViral":679955,"negativeTestsViral":null,"positiveCasesViral":null,"deathConfirmed":9154,"deathProbable":375,"totalTestEncountersViral":null,"totalTestsPeopleViral":2855991,"totalTestsAntibody":null,"positiveTestsAntibody":null,"negativeTestsAntibody":null,"totalTestsPeopleAntibody":null,"positiveTestsPeopleAntibody":null,"negativeTestsPeopleAntibody":null,"totalTestsPeopleAntigen":null,"positiveTestsPeopleAntigen":null,"totalTestsAntigen":null,"positiveTestsAntigen":null,"fips":"18","positiveIncrease":2877,"negativeIncrease":5482,"total":2855991,"totalTestResultsIncrease":46558,"posNeg":2855991,"dataQualityGrade":null,"deathIncrease":63,"hospitalizedIncrease":162,"hash":"d1099e127ca82d5f20d6dcaf97b449be90b5cfa5","commercialScore":0,"negativeRegularScore":0,"negativeScore":0,"positiveScore":0,"score":0,"grade":""},{"date":20210119,"state":"IN","positive":595436,"probableCases":null,"negative":2252196,"pending":null,"totalTestResultsSource":"totalTestsViral","totalTestResults":6498762,"hospitalizedCurrently":2332,"hospitalizedCumulative":38695,"inIcuCurrently":525,"inIcuCumulative":6764,"onVentilatorCurrently":263,"onVentilatorCumulative":null,"recovered":null,"lastUpdateEt":"1/18/2021 23:59","dateModified":"2021-01-18T23:59:00Z","checkTimeEt":"01/18 18:59","death":9466,"hospitalized":38695,"hospitalizedDischarged":382304,"dateChecked":"2021-01-18T23:59:00Z","totalTestsViral":6498762,"positiveTestsViral":676693,"negativeTestsViral":null,"positiveCasesViral":null,"deathConfirmed":9092,"deathProbable":374,"totalTestEncountersViral":null,"totalTestsPeopleViral":2847632,"totalTestsAntibody":null,"positiveTestsAntibody":null,"negativeTestsAntibody":null,"totalTestsPeopleAntibody":null,"positiveTestsPeopleAntibody":null,"negativeTestsPeopleAntibody":null,"totalTestsPeopleAntigen":null,"positiveTestsPeopleAntigen":null,"totalTestsAntigen":null,"positiveTestsAntigen":null,"fips":"18","positiveIncrease":2727,"negativeIncrease":5400,"total":2847632,"totalTestResultsIncrease":35976,"posNeg":2847632,"dataQualityGrade":null,"deathIncrease":126,"hospitalizedIncrease":151,"hash":"6f7f45cfbd8adbd084e3a1696220013a6e3f52af","commercialScore":0,"negativeRegularScore":0,"negativeScore":0,"positiveScore":0,"score":0,"grade":""},{"date":20210118,"state":"IN","positive":592709,"probableCases":null,"negative":2246796,"pending":null,"totalTestResultsSource":"totalTestsViral","totalTestResults":6462786,"hospitalizedCurrently":2386,"hospitalizedCumulative":38544,"inIcuCurrently":557,"inIcuCumulative":6742,"onVentilatorCurrently":282,"onVentilatorCumulative":null,"recovered":null,"lastUpdateEt":"1/17/2021 23:59","dateModified":"2021-01-17T23:59:00Z","checkTimeEt":"01/17 18:59","death":9340,"hospitalized":38544,"hospitalizedDischarged":379277,"dateChecked":"2021-01-17T23:59:00Z","totalTestsViral":6462786,"positiveTestsViral":673631,"negativeTestsViral":null,"positiveCasesViral":null,"deathConfirmed":8966,"deathProbable":374,"totalTestEncountersViral":null,"totalTestsPeopleViral":2839505,"totalTestsAntibody":null,"positiveTestsAntibody":null,"negativeTestsAntibody":null,"totalTestsPeopleAntibody":null,"positiveTestsPeopleAntibody":null,"negativeTestsPeopleAntibody":null,"totalTestsPeopleAntigen":null,"positiveTestsPeopleAntigen":null,"totalTestsAntigen":null,"positiveTestsAntigen":null,"fips":"18","positiveIncrease":2498,"negativeIncrease":5655,"total":2839505,"totalTestResultsIncrease":31601,"posNeg":2839505,"dataQualityGrade":null,"deathIncrease":30,"hospitalizedIncrease":146,"hash":"d9b36f94dd67e3cf57ca4e87005e55d9a640e5c1","commercialScore":0,"negativeRegularScore":0,"negativeScore":0,"positiveScore":0,"score":0,"grade":""},{"date":20210117,"state":"IN","positive":590211,"probableCases":null,"negative":2241141,"pending":null,"totalTestResultsSource":"totalTestsViral","totalTestResults":6431185,"hospitalizedCurrently":2348,"hospitalizedCumulative":38398,"inIcuCurrently":527,"inIcuCumulative":6719,"onVentilatorCurrently":279,"onVentilatorCumulative":null,"recovered":null,"lastUpdateEt":"1/16/2021 23:59","dateModified":"2021-01-16T23:59:00Z","checkTimeEt":"01/16 18:59","death":9310,"hospitalized":38398,"hospitalizedDischarged":376384,"dateChecked":"2021-01-16T23:59:00Z","totalTestsViral":6431185,"positiveTestsViral":670629,"negativeTestsViral":null,"positiveCasesViral":null,"deathConfirmed":8936,"deathProbable":374,"totalTestEncountersViral":null,"totalTestsPeopleViral":2831352,"totalTestsAntibody":null,"positiveTestsAntibody":null,"negativeTestsAntibody":null,"totalTestsPeopleAntibody":null,"positiveTestsPeopleAntibody":null,"negativeTestsPeopleAntibody":null,"totalTestsPeopleAntigen":null,"positiveTestsPeopleAntigen":null,"totalTestsAntigen":null,"positiveTestsAntigen":null,"fips":"18","positiveIncrease":3162,"negativeIncrease":8326,"total":2831352,"totalTestResultsIncrease":44991,"posNeg":2831352,"dataQualityGrade":null,"deathIncrease":23,"hospitalizedIncrease":132,"hash":"60d45684c3d4730618d55e9a7977836c5de31daf","commercialScore":0,"negativeRegularScore":0,"negativeScore":0,"positiveScore":0,"score":0,"grade":""},{"date":20210116,"state":"IN","positive":587049,"probableCases":null,"negative":2232815,"pending":null,"totalTestResultsSource":"totalTestsViral","totalTestResults":6386194,"hospitalizedCurrently":2404,"hospitalizedCumulative":38266,"inIcuCurrently":525,"inIcuCumulative":6685,"onVentilatorCurrently":269,"onVentilatorCumulative":null,"recovered":null,"lastUpdateEt":"1/15/2021 23:59","dateModified":"2021-01-15T23:59:00Z","checkTimeEt":"01/15 18:59","death":9287,"hospitalized":38266,"hospitalizedDischarged":375699,"dateChecked":"2021-01-15T23:59:00Z","totalTestsViral":6386194,"positiveTestsViral":666864,"negativeTestsViral":null,"positiveCasesViral":null,"deathConfirmed":8913,"deathProbable":374,"totalTestEncountersViral":null,"totalTestsPeopleViral":2819864,"totalTestsAntibody":null,"positiveTestsAntibody":null,"negativeTestsAntibody":null,"totalTestsPeopleAntibody":null,"positiveTestsPeopleAntibody":null,"negativeTestsPeopleAntibody":null,"totalTestsPeopleAntigen":null,"positiveTestsPeopleAntigen":null,"totalTestsAntigen":null,"positiveTestsAntigen":null,"fips":"18","positiveIncrease":3889,"negativeIncrease":9232,"total":2819864,"totalTestResultsIncrease":58171,"posNeg":2819864,"dataQualityGrade":null,"deathIncrease":41,"hospitalizedIncrease":210,"hash":"a88adc6b2c61732efaeaa8b9fb3cb6116391421f","commercialScore":0,"negativeRegularScore":0,"negativeScore":0,"positiveScore":0,"score":0,"grade":""},{"date":20210115,"state":"IN","positive":583160,"probableCases":null,"negative":2223583,"pending":null,"totalTestResultsSource":"totalTestsViral","totalTestResults":6328023,"hospitalizedCurrently":2432,"hospitalizedCumulative":38056,"inIcuCurrently":551,"inIcuCumulative":6641,"onVentilatorCurrently":285,"onVentilatorCumulative":null,"recovered":null,"lastUpdateEt":"1/14/2021 23:59","dateModified":"2021-01-14T23:59:00Z","checkTimeEt":"01/14 18:59","death":9246,"hospitalized":38056,"hospitalizedDischarged":374379,"dateChecked":"2021-01-14T23:59:00Z","totalTestsViral":6328023,"positiveTestsViral":662323,"negativeTestsViral":null,"positiveCasesViral":null,"deathConfirmed":8872,"deathProbable":374,"totalTestEncountersViral":null,"totalTestsPeopleViral":2806743,"totalTestsAntibody":null,"positiveTestsAntibody":null,"negativeTestsAntibody":null,"totalTestsPeopleAntibody":null,"positiveTestsPeopleAntibody":null,"negativeTestsPeopleAntibody":null,"totalTestsPeopleAntigen":null,"positiveTestsPeopleAntigen":null,"totalTestsAntigen":null,"positiveTestsAntigen":null,"fips":"18","positiveIncrease":4666,"negativeIncrease":9786,"total":2806743,"totalTestResultsIncrease":56420,"posNeg":2806743,"dataQualityGrade":null,"deathIncrease":44,"hospitalizedIncrease":188,"hash":"691ff3cb9ad994abe40d0e13c19010a62a15612a","commercialScore":0,"negativeRegularScore":0,"negativeScore":0,"positiveScore":0,"score":0,"grade":""},{"date":20210114,"state":"IN","positive":578494,"probableCases":null,"negative":2213797,"pending":null,"totalTestResultsSource":"totalTestsViral","totalTestResults":6271603,"hospitalizedCurrently":2440,"hospitalizedCumulative":37868,"inIcuCurrently":550,"inIcuCumulative":6610,"onVentilatorCurrently":280,"onVentilatorCumulative":null,"recovered":null,"lastUpdateEt":"1/13/2021 23:59","dateModified":"2021-01-13T23:59:00Z","checkTimeEt":"01/13 18:59","death":9202,"hospitalized":37868,"hospitalizedDischarged":373704,"dateChecked":"2021-01-13T23:59:00Z","totalTestsViral":6271603,"positiveTestsViral":656974,"negativeTestsViral":null,"positiveCasesViral":null,"deathConfirmed":8830,"deathProbable":372,"totalTestEncountersViral":null,"totalTestsPeopleViral":2792291,"totalTestsAntibody":null,"positiveTestsAntibody":null,"negativeTestsAntibody":null,"totalTestsPeopleAntibody":null,"positiveTestsPeopleAntibody":null,"negativeTestsPeopleAntibody":null,"totalTestsPeopleAntigen":null,"positiveTestsPeopleAntigen":null,"totalTestsAntigen":null,"positiveTestsAntigen":null,"fips":"18","positiveIncrease":4375,"negativeIncrease":7925,"total":2792291,"totalTestResultsIncrease":51516,"posNeg":2792291,"dataQualityGrade":null,"deathIncrease":39,"hospitalizedIncrease":189,"hash":"3e2e8e43ef6d0822a02e6666f715ed605e9cd74b","commercialScore":0,"negativeRegularScore":0,"negativeScore":0,"positiveScore":0,"score":0,"grade":""},{"date":20210113,"state":"IN","positive":574119,"probableCases":null,"negative":2205872,"pending":null,"totalTestResultsSource":"totalTestsViral","totalTestResults":6220087,"hospitalizedCurrently":2484,"hospitalizedCumulative":37679,"inIcuCurrently":550,"inIcuCumulative":6583,"onVentilatorCurrently":284,"onVentilatorCumulative":null,"recovered":null,"lastUpdateEt":"1/12/2021 23:59","dateModified":"2021-01-12T23:59:00Z","checkTimeEt":"01/12 18:59","death":9163,"hospitalized":37679,"hospitalizedDischarged":372444,"dateChecked":"2021-01-12T23:59:00Z","totalTestsViral":6220087,"positiveTestsViral":652054,"negativeTestsViral":null,"positiveCasesViral":null,"deathConfirmed":8790,"deathProbable":373,"totalTestEncountersViral":null,"totalTestsPeopleViral":2779991,"totalTestsAntibody":null,"positiveTestsAntibody":null,"negativeTestsAntibody":null,"totalTestsPeopleAntibody":null,"positiveTestsPeopleAntibody":null,"negativeTestsPeopleAntibody":null,"totalTestsPeopleAntigen":null,"positiveTestsPeopleAntigen":null,"totalTestsAntigen":null,"positiveTestsAntigen":null,"fips":"18","positiveIncrease":3642,"negativeIncrease":6192,"total":2779991,"totalTestResultsIncrease":44959,"posNeg":2779991,"dataQualityGrade":null,"deathIncrease":59,"hospitalizedIncrease":174,"hash":"e45abdae7db8fd35dfd6120325ce187d9da6580b","commercialScore":0,"negativeRegularScore":0,"negativeScore":0,"positiveScore":0,"score":0,"grade":""},{"date":20210112,"state":"IN","positive":570477,"probableCases":null,"negative":2199680,"pending":null,"totalTestResultsSource":"totalTestsViral","totalTestResults":6175128,"hospitalizedCurrently":2515,"hospitalizedCumulative":37505,"inIcuCurrently":553,"inIcuCumulative":6540,"onVentilatorCurrently":293,"onVentilatorCumulative":null,"recovered":null,"lastUpdateEt":"1/11/2021 23:59","dateModified":"2021-01-11T23:59:00Z","checkTimeEt":"01/11 18:59","death":9104,"hospitalized":37505,"hospitalizedDischarged":370456,"dateChecked":"2021-01-11T23:59:00Z","totalTestsViral":6175128,"positiveTestsViral":647868,"negativeTestsViral":null,"positiveCasesViral":null,"deathConfirmed":8731,"deathProbable":373,"totalTestEncountersViral":null,"totalTestsPeopleViral":2770157,"totalTestsAntibody":null,"positiveTestsAntibody":null,"negativeTestsAntibody":null,"totalTestsPeopleAntibody":null,"positiveTestsPeopleAntibody":null,"negativeTestsPeopleAntibody":null,"totalTestsPeopleAntigen":null,"positiveTestsPeopleAntigen":null,"totalTestsAntigen":null,"positiveTestsAntigen":null,"fips":"18","positiveIncrease":3139,"negativeIncrease":4445,"total":2770157,"totalTestResultsIncrease":34244,"posNeg":2770157,"dataQualityGrade":null,"deathIncrease":88,"hospitalizedIncrease":217,"hash":"11ebd9fd6f7789c6677f3541abf8d9ceee7433bd","commercialScore":0,"negativeRegularScore":0,"negativeScore":0,"positiveScore":0,"score":0,"grade":""},{"date":20210111,"state":"IN","positive":567338,"probableCases":null,"negative":2195235,"pending":null,"totalTestResultsSource":"totalTestsViral","totalTestResults":6140884,"hospitalizedCurrently":2537,"hospitalizedCumulative":37288,"inIcuCurrently":568,"inIcuCumulative":6510,"onVentilatorCurrently":286,"onVentilatorCumulative":null,"recovered":null,"lastUpdateEt":"1/10/2021 23:59","dateModified":"2021-01-10T23:59:00Z","checkTimeEt":"01/10 18:59","death":9016,"hospitalized":37288,"hospitalizedDischarged":367734,"dateChecked":"2021-01-10T23:59:00Z","totalTestsViral":6140884,"positiveTestsViral":644393,"negativeTestsViral":null,"positiveCasesViral":null,"deathConfirmed":8643,"deathProbable":373,"totalTestEncountersViral":null,"totalTestsPeopleViral":2762573,"totalTestsAntibody":null,"positiveTestsAntibody":null,"negativeTestsAntibody":null,"totalTestsPeopleAntibody":null,"positiveTestsPeopleAntibody":null,"negativeTestsPeopleAntibody":null,"totalTestsPeopleAntigen":null,"positiveTestsPeopleAntigen":null,"totalTestsAntigen":null,"positiveTestsAntigen":null,"fips":"18","positiveIncrease":3685,"negativeIncrease":6364,"total":2762573,"totalTestResultsIncrease":31731,"posNeg":2762573,"dataQualityGrade":null,"deathIncrease":31,"hospitalizedIncrease":163,"hash":"80a1689a97b16d7622823a17e6c7da2f5103347b","commercialScore":0,"negativeRegularScore":0,"negativeScore":0,"positiveScore":0,"score":0,"grade":""},{"date":20210110,"state":"IN","positive":563653,"probableCases":null,"negative":2188871,"pending":null,"totalTestResultsSource":"totalTestsViral","totalTestResults":6109153,"hospitalizedCurrently":2593,"hospitalizedCumulative":37125,"inIcuCurrently":556,"inIcuCumulative":6481,"onVentilatorCurrently":291,"onVentilatorCumulative":null,"recovered":null,"lastUpdateEt":"1/9/2021 23:59","dateModified":"2021-01-09T23:59:00Z","checkTimeEt":"01/09 18:59","death":8985,"hospitalized":37125,"hospitalizedDischarged":364890,"dateChecked":"2021-01-09T23:59:00Z","totalTestsViral":6109153,"positiveTestsViral":640198,"negativeTestsViral":null,"positiveCasesViral":null,"deathConfirmed":8613,"deathProbable":372,"totalTestEncountersViral":null,"totalTestsPeopleViral":2752524,"totalTestsAntibody":null,"positiveTestsAntibody":null,"negativeTestsAntibody":null,"totalTestsPeopleAntibody":null,"positiveTestsPeopleAntibody":null,"negativeTestsPeopleAntibody":null,"totalTestsPeopleAntigen":null,"positiveTestsPeopleAntigen":null,"totalTestsAntigen":null,"positiveTestsAntigen":null,"fips":"18","positiveIncrease":5093,"negativeIncrease":8517,"total":2752524,"totalTestResultsIncrease":47654,"posNeg":2752524,"dataQualityGrade":null,"deathIncrease":19,"hospitalizedIncrease":166,"hash":"b5070af596192210c8e22a63f5e4967b63503021","commercialScore":0,"negativeRegularScore":0,"negativeScore":0,"positiveScore":0,"score":0,"grade":""},{"date":20210109,"state":"IN","positive":558560,"probableCases":null,"negative":2180354,"pending":null,"totalTestResultsSource":"totalTestsViral","totalTestResults":6061499,"hospitalizedCurrently":2678,"hospitalizedCumulative":36959,"inIcuCurrently":579,"inIcuCumulative":6441,"onVentilatorCurrently":299,"onVentilatorCumulative":null,"recovered":null,"lastUpdateEt":"1/8/2021 23:59","dateModified":"2021-01-08T23:59:00Z","checkTimeEt":"01/08 18:59","death":8966,"hospitalized":36959,"hospitalizedDischarged":364221,"dateChecked":"2021-01-08T23:59:00Z","totalTestsViral":6061499,"positiveTestsViral":634311,"negativeTestsViral":null,"positiveCasesViral":null,"deathConfirmed":8595,"deathProbable":371,"totalTestEncountersViral":null,"totalTestsPeopleViral":2738914,"totalTestsAntibody":null,"positiveTestsAntibody":null,"negativeTestsAntibody":null,"totalTestsPeopleAntibody":null,"positiveTestsPeopleAntibody":null,"negativeTestsPeopleAntibody":null,"totalTestsPeopleAntigen":null,"positiveTestsPeopleAntigen":null,"totalTestsAntigen":null,"positiveTestsAntigen":null,"fips":"18","positiveIncrease":5966,"negativeIncrease":8559,"total":2738914,"totalTestResultsIncrease":56096,"posNeg":2738914,"dataQualityGrade":null,"deathIncrease":74,"hospitalizedIncrease":193,"hash":"9e0518a2a1274d6f4b3d983ac28021c5d9fd8adc","commercialScore":0,"negativeRegularScore":0,"negativeScore":0,"positiveScore":0,"score":0,"grade":""},{"date":20210108,"state":"IN","positive":552594,"probableCases":null,"negative":2171795,"pending":null,"totalTestResultsSource":"totalTestsViral","totalTestResults":6005403,"hospitalizedCurrently":2769,"hospitalizedCumulative":36766,"inIcuCurrently":584,"inIcuCumulative":6408,"onVentilatorCurrently":295,"onVentilatorCumulative":null,"recovered":null,"lastUpdateEt":"1/7/2021 23:59","dateModified":"2021-01-07T23:59:00Z","checkTimeEt":"01/07 18:59","death":8892,"hospitalized":36766,"hospitalizedDischarged":362458,"dateChecked":"2021-01-07T23:59:00Z","totalTestsViral":6005403,"positiveTestsViral":627575,"negativeTestsViral":null,"positiveCasesViral":null,"deathConfirmed":8521,"deathProbable":371,"totalTestEncountersViral":null,"totalTestsPeopleViral":2724389,"totalTestsAntibody":null,"positiveTestsAntibody":null,"negativeTestsAntibody":null,"totalTestsPeopleAntibody":null,"positiveTestsPeopleAntibody":null,"negativeTestsPeopleAntibody":null,"totalTestsPeopleAntigen":null,"positiveTestsPeopleAntigen":null,"totalTestsAntigen":null,"positiveTestsAntigen":null,"fips":"18","positiveIncrease":6095,"negativeIncrease":7656,"total":2724389,"totalTestResultsIncrease":54481,"posNeg":2724389,"dataQualityGrade":null,"deathIncrease":69,"hospitalizedIncrease":249,"hash":"1d83cc461c67c97e60dbd34999b92bf971ec1597","commercialScore":0,"negativeRegularScore":0,"negativeScore":0,"positiveScore":0,"score":0,"grade":""},{"date":20210107,"state":"IN","positive":546499,"probableCases":null,"negative":2164139,"pending":null,"totalTestResultsSource":"totalTestsViral","totalTestResults":5950922,"hospitalizedCurrently":2812,"hospitalizedCumulative":36517,"inIcuCurrently":593,"inIcuCumulative":6377,"onVentilatorCurrently":306,"onVentilatorCumulative":null,"recovered":null,"lastUpdateEt":"1/6/2021 23:59","dateModified":"2021-01-06T23:59:00Z","checkTimeEt":"01/06 18:59","death":8823,"hospitalized":36517,"hospitalizedDischarged":360087,"dateChecked":"2021-01-06T23:59:00Z","totalTestsViral":5950922,"positiveTestsViral":620799,"negativeTestsViral":null,"positiveCasesViral":null,"deathConfirmed":8452,"deathProbable":371,"totalTestEncountersViral":null,"totalTestsPeopleViral":2710638,"totalTestsAntibody":null,"positiveTestsAntibody":null,"negativeTestsAntibody":null,"totalTestsPeopleAntibody":null,"positiveTestsPeopleAntibody":null,"negativeTestsPeopleAntibody":null,"totalTestsPeopleAntigen":null,"positiveTestsPeopleAntigen":null,"totalTestsAntigen":null,"positiveTestsAntigen":null,"fips":"18","positiveIncrease":7270,"negativeIncrease":8783,"total":2710638,"totalTestResultsIncrease":56417,"posNeg":2710638,"dataQualityGrade":null,"deathIncrease":80,"hospitalizedIncrease":203,"hash":"354fdab55bc3345f5b0ef5782f924cd2309c34fb","commercialScore":0,"negativeRegularScore":0,"negativeScore":0,"positiveScore":0,"score":0,"grade":""},{"date":20210106,"state":"IN","positive":539229,"probableCases":null,"negative":2155356,"pending":null,"totalTestResultsSource":"totalTestsViral","totalTestResults":5894505,"hospitalizedCurrently":2782,"hospitalizedCumulative":36314,"inIcuCurrently":586,"inIcuCumulative":6355,"onVentilatorCurrently":303,"onVentilatorCumulative":null,"recovered":null,"lastUpdateEt":"1/5/2021 23:59","dateModified":"2021-01-05T23:59:00Z","checkTimeEt":"01/05 18:59","death":8743,"hospitalized":36314,"hospitalizedDischarged":357442,"dateChecked":"2021-01-05T23:59:00Z","totalTestsViral":5894505,"positiveTestsViral":612814,"negativeTestsViral":null,"positiveCasesViral":null,"deathConfirmed":8371,"deathProbable":372,"totalTestEncountersViral":null,"totalTestsPeopleViral":2694585,"totalTestsAntibody":null,"positiveTestsAntibody":null,"negativeTestsAntibody":null,"totalTestsPeopleAntibody":null,"positiveTestsPeopleAntibody":null,"negativeTestsPeopleAntibody":null,"totalTestsPeopleAntigen":null,"positiveTestsPeopleAntigen":null,"totalTestsAntigen":null,"positiveTestsAntigen":null,"fips":"18","positiveIncrease":6146,"negativeIncrease":6700,"total":2694585,"totalTestResultsIncrease":49161,"posNeg":2694585,"dataQualityGrade":null,"deathIncrease":80,"hospitalizedIncrease":193,"hash":"4d59b40246463a126d6ef0a4f036adeccbcd17f1","commercialScore":0,"negativeRegularScore":0,"negativeScore":0,"positiveScore":0,"score":0,"grade":""},{"date":20210105,"state":"IN","positive":533083,"probableCases":null,"negative":2148656,"pending":null,"totalTestResultsSource":"totalTestsViral","totalTestResults":5845344,"hospitalizedCurrently":2907,"hospitalizedCumulative":36121,"inIcuCurrently":591,"inIcuCumulative":6364,"onVentilatorCurrently":326,"onVentilatorCumulative":null,"recovered":null,"lastUpdateEt":"1/4/2021 23:59","dateModified":"2021-01-04T23:59:00Z","checkTimeEt":"01/04 18:59","death":8663,"hospitalized":36121,"hospitalizedDischarged":354859,"dateChecked":"2021-01-04T23:59:00Z","totalTestsViral":5845344,"positiveTestsViral":606160,"negativeTestsViral":null,"positiveCasesViral":null,"deathConfirmed":8292,"deathProbable":371,"totalTestEncountersViral":null,"totalTestsPeopleViral":2681739,"totalTestsAntibody":null,"positiveTestsAntibody":null,"negativeTestsAntibody":null,"totalTestsPeopleAntibody":null,"positiveTestsPeopleAntibody":null,"negativeTestsPeopleAntibody":null,"totalTestsPeopleAntigen":null,"positiveTestsPeopleAntigen":null,"totalTestsAntigen":null,"positiveTestsAntigen":null,"fips":"18","positiveIncrease":3395,"negativeIncrease":3288,"total":2681739,"totalTestResultsIncrease":31318,"posNeg":2681739,"dataQualityGrade":null,"deathIncrease":149,"hospitalizedIncrease":265,"hash":"398f6ec4d94eb57b7dd87723d47f94ed90ad4f16","commercialScore":0,"negativeRegularScore":0,"negativeScore":0,"positiveScore":0,"score":0,"grade":""},{"date":20210104,"state":"IN","positive":529688,"probableCases":null,"negative":2145368,"pending":null,"totalTestResultsSource":"totalTestsViral","totalTestResults":5814026,"hospitalizedCurrently":2836,"hospitalizedCumulative":35856,"inIcuCurrently":649,"inIcuCumulative":6292,"onVentilatorCurrently":321,"onVentilatorCumulative":null,"recovered":null,"lastUpdateEt":"1/3/2021 23:59","dateModified":"2021-01-03T23:59:00Z","checkTimeEt":"01/03 18:59","death":8514,"hospitalized":35856,"hospitalizedDischarged":351569,"dateChecked":"2021-01-03T23:59:00Z","totalTestsViral":5814026,"positiveTestsViral":602535,"negativeTestsViral":null,"positiveCasesViral":null,"deathConfirmed":8150,"deathProbable":364,"totalTestEncountersViral":null,"totalTestsPeopleViral":2675056,"totalTestsAntibody":null,"positiveTestsAntibody":null,"negativeTestsAntibody":null,"totalTestsPeopleAntibody":null,"positiveTestsPeopleAntibody":null,"negativeTestsPeopleAntibody":null,"totalTestsPeopleAntigen":null,"positiveTestsPeopleAntigen":null,"totalTestsAntigen":null,"positiveTestsAntigen":null,"fips":"18","positiveIncrease":3617,"negativeIncrease":3966,"total":2675056,"totalTestResultsIncrease":21329,"posNeg":2675056,"dataQualityGrade":null,"deathIncrease":39,"hospitalizedIncrease":210,"hash":"5480806cfcec1c1fc94a189186f5523843de0aab","commercialScore":0,"negativeRegularScore":0,"negativeScore":0,"positiveScore":0,"score":0,"grade":""},{"date":20210103,"state":"IN","positive":526071,"probableCases":null,"negative":2141402,"pending":null,"totalTestResultsSource":"totalTestsViral","totalTestResults":5792697,"hospitalizedCurrently":2714,"hospitalizedCumulative":35646,"inIcuCurrently":648,"inIcuCumulative":6251,"onVentilatorCurrently":326,"onVentilatorCumulative":null,"recovered":null,"lastUpdateEt":"1/2/2021 23:59","dateModified":"2021-01-02T23:59:00Z","checkTimeEt":"01/02 18:59","death":8475,"hospitalized":35646,"hospitalizedDischarged":348425,"dateChecked":"2021-01-02T23:59:00Z","totalTestsViral":5792697,"positiveTestsViral":598551,"negativeTestsViral":null,"positiveCasesViral":null,"deathConfirmed":8111,"deathProbable":364,"totalTestEncountersViral":null,"totalTestsPeopleViral":2667473,"totalTestsAntibody":null,"positiveTestsAntibody":null,"negativeTestsAntibody":null,"totalTestsPeopleAntibody":null,"positiveTestsPeopleAntibody":null,"negativeTestsPeopleAntibody":null,"totalTestsPeopleAntigen":null,"positiveTestsPeopleAntigen":null,"totalTestsAntigen":null,"positiveTestsAntigen":null,"fips":"18","positiveIncrease":2981,"negativeIncrease":3796,"total":2667473,"totalTestResultsIncrease":23424,"posNeg":2667473,"dataQualityGrade":null,"deathIncrease":65,"hospitalizedIncrease":239,"hash":"7d658966ef7b972ed4049e4b8cdaa2e1a738c618","commercialScore":0,"negativeRegularScore":0,"negativeScore":0,"positiveScore":0,"score":0,"grade":""},{"date":20210102,"state":"IN","positive":523090,"probableCases":null,"negative":2137606,"pending":null,"totalTestResultsSource":"totalTestsViral","totalTestResults":5769273,"hospitalizedCurrently":2655,"hospitalizedCumulative":35407,"inIcuCurrently":663,"inIcuCumulative":6206,"onVentilatorCurrently":342,"onVentilatorCumulative":null,"recovered":null,"lastUpdateEt":"1/1/2021 23:59","dateModified":"2021-01-01T23:59:00Z","checkTimeEt":"01/01 18:59","death":8410,"hospitalized":35407,"hospitalizedDischarged":347401,"dateChecked":"2021-01-01T23:59:00Z","totalTestsViral":5769273,"positiveTestsViral":595137,"negativeTestsViral":null,"positiveCasesViral":null,"deathConfirmed":8055,"deathProbable":355,"totalTestEncountersViral":null,"totalTestsPeopleViral":2660696,"totalTestsAntibody":null,"positiveTestsAntibody":null,"negativeTestsAntibody":null,"totalTestsPeopleAntibody":null,"positiveTestsPeopleAntibody":null,"negativeTestsPeopleAntibody":null,"totalTestsPeopleAntigen":null,"positiveTestsPeopleAntigen":null,"totalTestsAntigen":null,"positiveTestsAntigen":null,"fips":"18","positiveIncrease":5317,"negativeIncrease":5415,"total":2660696,"totalTestResultsIncrease":39230,"posNeg":2660696,"dataQualityGrade":null,"deathIncrease":39,"hospitalizedIncrease":197,"hash":"4d5b096047a6378e819c488d81639977c3a46122","commercialScore":0,"negativeRegularScore":0,"negativeScore":0,"positiveScore":0,"score":0,"grade":""},{"date":20210101,"state":"IN","positive":517773,"probableCases":null,"negative":2132191,"pending":null,"totalTestResultsSource":"totalTestsViral","totalTestResults":5730043,"hospitalizedCurrently":2786,"hospitalizedCumulative":35210,"inIcuCurrently":676,"inIcuCumulative":6194,"onVentilatorCurrently":348,"onVentilatorCumulative":null,"recovered":null,"lastUpdateEt":"12/31/2020 23:59","dateModified":"2020-12-31T23:59:00Z","checkTimeEt":"12/31 18:59","death":8371,"hospitalized":35210,"hospitalizedDischarged":345474,"dateChecked":"2020-12-31T23:59:00Z","totalTestsViral":5730043,"positiveTestsViral":589048,"negativeTestsViral":null,"positiveCasesViral":null,"deathConfirmed":8016,"deathProbable":355,"totalTestEncountersViral":null,"totalTestsPeopleViral":2649964,"totalTestsAntibody":null,"positiveTestsAntibody":null,"negativeTestsAntibody":null,"totalTestsPeopleAntibody":null,"positiveTestsPeopleAntibody":null,"negativeTestsPeopleAntibody":null,"totalTestsPeopleAntigen":null,"positiveTestsPeopleAntigen":null,"totalTestsAntigen":null,"positiveTestsAntigen":null,"fips":"18","positiveIncrease":6288,"negativeIncrease":6981,"total":2649964,"totalTestResultsIncrease":48333,"posNeg":2649964,"dataQualityGrade":null,"deathIncrease":108,"hospitalizedIncrease":211,"hash":"29c9569346c0ddb0a36fedfd43864408e4369042","commercialScore":0,"negativeRegularScore":0,"negativeScore":0,"positiveScore":0,"score":0,"grade":""},{"date":20201231,"state":"IN","positive":511485,"probableCases":null,"negative":2125210,"pending":null,"totalTestResultsSource":"totalTestsViral","totalTestResults":5681710,"hospitalizedCurrently":2842,"hospitalizedCumulative":34999,"inIcuCurrently":633,"inIcuCumulative":6144,"onVentilatorCurrently":353,"onVentilatorCumulative":null,"recovered":null,"lastUpdateEt":"12/30/2020 23:59","dateModified":"2020-12-30T23:59:00Z","checkTimeEt":"12/30 18:59","death":8263,"hospitalized":34999,"hospitalizedDischarged":342578,"dateChecked":"2020-12-30T23:59:00Z","totalTestsViral":5681710,"positiveTestsViral":581967,"negativeTestsViral":null,"positiveCasesViral":null,"deathConfirmed":7911,"deathProbable":352,"totalTestEncountersViral":null,"totalTestsPeopleViral":2636695,"totalTestsAntibody":null,"positiveTestsAntibody":null,"negativeTestsAntibody":null,"totalTestsPeopleAntibody":null,"positiveTestsPeopleAntibody":null,"negativeTestsPeopleAntibody":null,"totalTestsPeopleAntigen":null,"positiveTestsPeopleAntigen":null,"totalTestsAntigen":null,"positiveTestsAntigen":null,"fips":"18","positiveIncrease":6468,"negativeIncrease":7348,"total":2636695,"totalTestResultsIncrease":54368,"posNeg":2636695,"dataQualityGrade":null,"deathIncrease":103,"hospitalizedIncrease":238,"hash":"dda79d084d902210417e84dca1efb6fc4aedff69","commercialScore":0,"negativeRegularScore":0,"negativeScore":0,"positiveScore":0,"score":0,"grade":""},{"date":20201230,"state":"IN","positive":505017,"probableCases":null,"negative":2117862,"pending":null,"totalTestResultsSource":"totalTestsViral","totalTestResults":5627342,"hospitalizedCurrently":2941,"hospitalizedCumulative":34761,"inIcuCurrently":659,"inIcuCumulative":6078,"onVentilatorCurrently":365,"onVentilatorCumulative":null,"recovered":null,"lastUpdateEt":"12/29/2020 23:59","dateModified":"2020-12-29T23:59:00Z","checkTimeEt":"12/29 18:59","death":8160,"hospitalized":34761,"hospitalizedDischarged":339416,"dateChecked":"2020-12-29T23:59:00Z","totalTestsViral":5627342,"positiveTestsViral":455701,"negativeTestsViral":null,"positiveCasesViral":null,"deathConfirmed":7812,"deathProbable":348,"totalTestEncountersViral":null,"totalTestsPeopleViral":2622879,"totalTestsAntibody":null,"positiveTestsAntibody":null,"negativeTestsAntibody":null,"totalTestsPeopleAntibody":null,"positiveTestsPeopleAntibody":null,"negativeTestsPeopleAntibody":null,"totalTestsPeopleAntigen":null,"positiveTestsPeopleAntigen":null,"totalTestsAntigen":null,"positiveTestsAntigen":null,"fips":"18","positiveIncrease":4735,"negativeIncrease":4469,"total":2622879,"totalTestResultsIncrease":42249,"posNeg":2622879,"dataQualityGrade":null,"deathIncrease":109,"hospitalizedIncrease":227,"hash":"171ac9848e9a88ae2c0f8e531effa4dc2460b30f","commercialScore":0,"negativeRegularScore":0,"negativeScore":0,"positiveScore":0,"score":0,"grade":""},{"date":20201229,"state":"IN","positive":500282,"probableCases":null,"negative":2113393,"pending":null,"totalTestResultsSource":"totalTestsViral","totalTestResults":5585093,"hospitalizedCurrently":2951,"hospitalizedCumulative":34534,"inIcuCurrently":646,"inIcuCumulative":6044,"onVentilatorCurrently":363,"onVentilatorCumulative":null,"recovered":null,"lastUpdateEt":"12/28/2020 23:59","dateModified":"2020-12-28T23:59:00Z","checkTimeEt":"12/28 18:59","death":8051,"hospitalized":34534,"hospitalizedDischarged":335678,"dateChecked":"2020-12-28T23:59:00Z","totalTestsViral":5585093,"positiveTestsViral":455701,"negativeTestsViral":null,"positiveCasesViral":null,"deathConfirmed":7703,"deathProbable":348,"totalTestEncountersViral":null,"totalTestsPeopleViral":2613675,"totalTestsAntibody":null,"positiveTestsAntibody":null,"negativeTestsAntibody":null,"totalTestsPeopleAntibody":null,"positiveTestsPeopleAntibody":null,"negativeTestsPeopleAntibody":null,"totalTestsPeopleAntigen":null,"positiveTestsPeopleAntigen":null,"totalTestsAntigen":null,"positiveTestsAntigen":null,"fips":"18","positiveIncrease":3976,"negativeIncrease":4030,"total":2613675,"totalTestResultsIncrease":31548,"posNeg":2613675,"dataQualityGrade":null,"deathIncrease":165,"hospitalizedIncrease":262,"hash":"069affa5510477af7479f106124b7a92154b8374","commercialScore":0,"negativeRegularScore":0,"negativeScore":0,"positiveScore":0,"score":0,"grade":""},{"date":20201228,"state":"IN","positive":496306,"probableCases":null,"negative":2109363,"pending":null,"totalTestResultsSource":"totalTestsViral","totalTestResults":5553545,"hospitalizedCurrently":2866,"hospitalizedCumulative":34272,"inIcuCurrently":632,"inIcuCumulative":5993,"onVentilatorCurrently":364,"onVentilatorCumulative":null,"recovered":null,"lastUpdateEt":"12/27/2020 23:59","dateModified":"2020-12-27T23:59:00Z","checkTimeEt":"12/27 18:59","death":7886,"hospitalized":34272,"hospitalizedDischarged":330642,"dateChecked":"2020-12-27T23:59:00Z","totalTestsViral":5553545,"positiveTestsViral":452139,"negativeTestsViral":null,"positiveCasesViral":null,"deathConfirmed":7539,"deathProbable":347,"totalTestEncountersViral":null,"totalTestsPeopleViral":2605669,"totalTestsAntibody":null,"positiveTestsAntibody":null,"negativeTestsAntibody":null,"totalTestsPeopleAntibody":null,"positiveTestsPeopleAntibody":null,"negativeTestsPeopleAntibody":null,"totalTestsPeopleAntigen":null,"positiveTestsPeopleAntigen":null,"totalTestsAntigen":null,"positiveTestsAntigen":null,"fips":"18","positiveIncrease":2465,"negativeIncrease":2993,"total":2605669,"totalTestResultsIncrease":17489,"posNeg":2605669,"dataQualityGrade":null,"deathIncrease":43,"hospitalizedIncrease":170,"hash":"6c79d5668172dd9d9743326f0f5c8cce2e198367","commercialScore":0,"negativeRegularScore":0,"negativeScore":0,"positiveScore":0,"score":0,"grade":""},{"date":20201227,"state":"IN","positive":493841,"probableCases":null,"negative":2106370,"pending":null,"totalTestResultsSource":"totalTestsViral","totalTestResults":5536056,"hospitalizedCurrently":2811,"hospitalizedCumulative":34102,"inIcuCurrently":638,"inIcuCumulative":5963,"onVentilatorCurrently":360,"onVentilatorCumulative":null,"recovered":null,"lastUpdateEt":"12/26/2020 23:59","dateModified":"2020-12-26T23:59:00Z","checkTimeEt":"12/26 18:59","death":7843,"hospitalized":34102,"hospitalizedDischarged":324634,"dateChecked":"2020-12-26T23:59:00Z","totalTestsViral":5536056,"positiveTestsViral":449547,"negativeTestsViral":null,"positiveCasesViral":null,"deathConfirmed":7496,"deathProbable":3