[{"date":20210307,"state":"NE","positive":203026,"probableCases":null,"negative":771128,"pending":null,"totalTestResultsSource":"totalTestsViral","totalTestResults":2421684,"hospitalizedCurrently":137,"hospitalizedCumulative":6237,"inIcuCurrently":null,"inIcuCumulative":null,"onVentilatorCurrently":null,"onVentilatorCumulative":null,"recovered":157144,"lastUpdateEt":"3/7/2021 11:15","dateModified":"2021-03-07T11:15:00Z","checkTimeEt":"03/07 06:15","death":2113,"hospitalized":6237,"hospitalizedDischarged":null,"dateChecked":"2021-03-07T11:15:00Z","totalTestsViral":2421684,"positiveTestsViral":235965,"negativeTestsViral":2182938,"positiveCasesViral":null,"deathConfirmed":null,"deathProbable":null,"totalTestEncountersViral":null,"totalTestsPeopleViral":974759,"totalTestsAntibody":null,"positiveTestsAntibody":null,"negativeTestsAntibody":null,"totalTestsPeopleAntibody":null,"positiveTestsPeopleAntibody":null,"negativeTestsPeopleAntibody":null,"totalTestsPeopleAntigen":null,"positiveTestsPeopleAntigen":null,"totalTestsAntigen":null,"positiveTestsAntigen":null,"fips":"31","positiveIncrease":373,"negativeIncrease":542,"total":974154,"totalTestResultsIncrease":1,"posNeg":974154,"dataQualityGrade":null,"deathIncrease":0,"hospitalizedIncrease":8,"hash":"3f55dc5e02818a3abbd58e07cf80bdfe4abc60f1","commercialScore":0,"negativeRegularScore":0,"negativeScore":0,"positiveScore":0,"score":0,"grade":""},{"date":20210306,"state":"NE","positive":202653,"probableCases":null,"negative":770586,"pending":null,"totalTestResultsSource":"totalTestsViral","totalTestResults":2421683,"hospitalizedCurrently":136,"hospitalizedCumulative":6229,"inIcuCurrently":null,"inIcuCumulative":null,"onVentilatorCurrently":null,"onVentilatorCumulative":null,"recovered":156825,"lastUpdateEt":"3/5/2021 09:45","dateModified":"2021-03-05T09:45:00Z","checkTimeEt":"03/05 04:45","death":2113,"hospitalized":6229,"hospitalizedDischarged":null,"dateChecked":"2021-03-05T09:45:00Z","totalTestsViral":2421683,"positiveTestsViral":235726,"negativeTestsViral":2183243,"positiveCasesViral":null,"deathConfirmed":null,"deathProbable":null,"totalTestEncountersViral":null,"totalTestsPeopleViral":973781,"totalTestsAntibody":null,"positiveTestsAntibody":null,"negativeTestsAntibody":null,"totalTestsPeopleAntibody":null,"positiveTestsPeopleAntibody":null,"negativeTestsPeopleAntibody":null,"totalTestsPeopleAntigen":null,"positiveTestsPeopleAntigen":null,"totalTestsAntigen":null,"positiveTestsAntigen":null,"fips":"31","positiveIncrease":343,"negativeIncrease":1354,"total":973239,"totalTestResultsIncrease":10138,"posNeg":973239,"dataQualityGrade":null,"deathIncrease":1,"hospitalizedIncrease":3,"hash":"937634fc6a04b345bc793f53d996b217ac1b22f0","commercialScore":0,"negativeRegularScore":0,"negativeScore":0,"positiveScore":0,"score":0,"grade":""},{"date":20210305,"state":"NE","positive":202310,"probableCases":null,"negative":769232,"pending":null,"totalTestResultsSource":"totalTestsViral","totalTestResults":2411545,"hospitalizedCurrently":143,"hospitalizedCumulative":6226,"inIcuCurrently":null,"inIcuCumulative":null,"onVentilatorCurrently":null,"onVentilatorCumulative":null,"recovered":156510,"lastUpdateEt":"3/5/2021 09:45","dateModified":"2021-03-05T09:45:00Z","checkTimeEt":"03/05 04:45","death":2112,"hospitalized":6226,"hospitalizedDischarged":null,"dateChecked":"2021-03-05T09:45:00Z","totalTestsViral":2411545,"positiveTestsViral":235280,"negativeTestsViral":2173557,"positiveCasesViral":null,"deathConfirmed":null,"deathProbable":null,"totalTestEncountersViral":null,"totalTestsPeopleViral":972080,"totalTestsAntibody":null,"positiveTestsAntibody":null,"negativeTestsAntibody":null,"totalTestsPeopleAntibody":null,"positiveTestsPeopleAntibody":null,"negativeTestsPeopleAntibody":null,"totalTestsPeopleAntigen":null,"positiveTestsPeopleAntigen":null,"totalTestsAntigen":null,"positiveTestsAntigen":null,"fips":"31","positiveIncrease":337,"negativeIncrease":1102,"total":971542,"totalTestResultsIncrease":7859,"posNeg":971542,"dataQualityGrade":null,"deathIncrease":20,"hospitalizedIncrease":69,"hash":"0ece264679e1fb2fd0a04a3553b38008462c5c3d","commercialScore":0,"negativeRegularScore":0,"negativeScore":0,"positiveScore":0,"score":0,"grade":""},{"date":20210304,"state":"NE","positive":201973,"probableCases":null,"negative":768130,"pending":null,"totalTestResultsSource":"totalTestsViral","totalTestResults":2403686,"hospitalizedCurrently":151,"hospitalizedCumulative":6157,"inIcuCurrently":null,"inIcuCumulative":null,"onVentilatorCurrently":null,"onVentilatorCumulative":null,"recovered":156048,"lastUpdateEt":"3/4/2021 10:30","dateModified":"2021-03-04T10:30:00Z","checkTimeEt":"03/04 05:30","death":2092,"hospitalized":6157,"hospitalizedDischarged":null,"dateChecked":"2021-03-04T10:30:00Z","totalTestsViral":2403686,"positiveTestsViral":234838,"negativeTestsViral":2166160,"positiveCasesViral":null,"deathConfirmed":null,"deathProbable":null,"totalTestEncountersViral":null,"totalTestsPeopleViral":970639,"totalTestsAntibody":null,"positiveTestsAntibody":null,"negativeTestsAntibody":null,"totalTestsPeopleAntibody":null,"positiveTestsPeopleAntibody":null,"negativeTestsPeopleAntibody":null,"totalTestsPeopleAntigen":null,"positiveTestsPeopleAntigen":null,"totalTestsAntigen":null,"positiveTestsAntigen":null,"fips":"31","positiveIncrease":365,"negativeIncrease":1349,"total":970103,"totalTestResultsIncrease":11285,"posNeg":970103,"dataQualityGrade":null,"deathIncrease":1,"hospitalizedIncrease":10,"hash":"75d8398bb8c4ad0ae14862e45488e96d83a409ff","commercialScore":0,"negativeRegularScore":0,"negativeScore":0,"positiveScore":0,"score":0,"grade":""},{"date":20210303,"state":"NE","positive":201608,"probableCases":null,"negative":766781,"pending":null,"totalTestResultsSource":"totalTestsViral","totalTestResults":2392401,"hospitalizedCurrently":150,"hospitalizedCumulative":6147,"inIcuCurrently":null,"inIcuCumulative":null,"onVentilatorCurrently":null,"onVentilatorCumulative":null,"recovered":155933,"lastUpdateEt":"3/3/2021 10:00","dateModified":"2021-03-03T10:00:00Z","checkTimeEt":"03/03 05:00","death":2091,"hospitalized":6147,"hospitalizedDischarged":null,"dateChecked":"2021-03-03T10:00:00Z","totalTestsViral":2392401,"positiveTestsViral":234408,"negativeTestsViral":2155329,"positiveCasesViral":null,"deathConfirmed":null,"deathProbable":null,"totalTestEncountersViral":null,"totalTestsPeopleViral":968925,"totalTestsAntibody":null,"positiveTestsAntibody":null,"negativeTestsAntibody":null,"totalTestsPeopleAntibody":null,"positiveTestsPeopleAntibody":null,"negativeTestsPeopleAntibody":null,"totalTestsPeopleAntigen":null,"positiveTestsPeopleAntigen":null,"totalTestsAntigen":null,"positiveTestsAntigen":null,"fips":"31","positiveIncrease":262,"negativeIncrease":1105,"total":968389,"totalTestResultsIncrease":10150,"posNeg":968389,"dataQualityGrade":null,"deathIncrease":7,"hospitalizedIncrease":7,"hash":"08e8b5b97a5a8121f246e094138ce0a4f9e2da79","commercialScore":0,"negativeRegularScore":0,"negativeScore":0,"positiveScore":0,"score":0,"grade":""},{"date":20210302,"state":"NE","positive":201346,"probableCases":null,"negative":765676,"pending":null,"totalTestResultsSource":"totalTestsViral","totalTestResults":2382251,"hospitalizedCurrently":154,"hospitalizedCumulative":6140,"inIcuCurrently":null,"inIcuCumulative":null,"onVentilatorCurrently":null,"onVentilatorCumulative":null,"recovered":155712,"lastUpdateEt":"3/2/2021 10:30","dateModified":"2021-03-02T10:30:00Z","checkTimeEt":"03/02 05:30","death":2084,"hospitalized":6140,"hospitalizedDischarged":null,"dateChecked":"2021-03-02T10:30:00Z","totalTestsViral":2382251,"positiveTestsViral":233966,"negativeTestsViral":2145644,"positiveCasesViral":null,"deathConfirmed":null,"deathProbable":null,"totalTestEncountersViral":null,"totalTestsPeopleViral":967551,"totalTestsAntibody":null,"positiveTestsAntibody":null,"negativeTestsAntibody":null,"totalTestsPeopleAntibody":null,"positiveTestsPeopleAntibody":null,"negativeTestsPeopleAntibody":null,"totalTestsPeopleAntigen":null,"positiveTestsPeopleAntigen":null,"totalTestsAntigen":null,"positiveTestsAntigen":null,"fips":"31","positiveIncrease":400,"negativeIncrease":1216,"total":967022,"totalTestResultsIncrease":8520,"posNeg":967022,"dataQualityGrade":null,"deathIncrease":2,"hospitalizedIncrease":34,"hash":"89a2d10043bdad94b09e1687a1e225cf38996c51","commercialScore":0,"negativeRegularScore":0,"negativeScore":0,"positiveScore":0,"score":0,"grade":""},{"date":20210301,"state":"NE","positive":200946,"probableCases":null,"negative":764460,"pending":null,"totalTestResultsSource":"totalTestsViral","totalTestResults":2373731,"hospitalizedCurrently":158,"hospitalizedCumulative":6106,"inIcuCurrently":null,"inIcuCumulative":null,"onVentilatorCurrently":null,"onVentilatorCumulative":null,"recovered":155333,"lastUpdateEt":"3/1/2021 10:15","dateModified":"2021-03-01T10:15:00Z","checkTimeEt":"03/01 05:15","death":2082,"hospitalized":6106,"hospitalizedDischarged":null,"dateChecked":"2021-03-01T10:15:00Z","totalTestsViral":2373731,"positiveTestsViral":233457,"negativeTestsViral":2137624,"positiveCasesViral":null,"deathConfirmed":null,"deathProbable":null,"totalTestEncountersViral":null,"totalTestsPeopleViral":965935,"totalTestsAntibody":null,"positiveTestsAntibody":null,"negativeTestsAntibody":null,"totalTestsPeopleAntibody":null,"positiveTestsPeopleAntibody":null,"negativeTestsPeopleAntibody":null,"totalTestsPeopleAntigen":null,"positiveTestsPeopleAntigen":null,"totalTestsAntigen":null,"positiveTestsAntigen":null,"fips":"31","positiveIncrease":98,"negativeIncrease":456,"total":965406,"totalTestResultsIncrease":2529,"posNeg":965406,"dataQualityGrade":null,"deathIncrease":0,"hospitalizedIncrease":4,"hash":"861130d73a5fe6e772e135ae47a34a670681433e","commercialScore":0,"negativeRegularScore":0,"negativeScore":0,"positiveScore":0,"score":0,"grade":""},{"date":20210228,"state":"NE","positive":200848,"probableCases":null,"negative":764004,"pending":null,"totalTestResultsSource":"totalTestsViral","totalTestResults":2371202,"hospitalizedCurrently":151,"hospitalizedCumulative":6102,"inIcuCurrently":null,"inIcuCumulative":null,"onVentilatorCurrently":null,"onVentilatorCumulative":null,"recovered":154909,"lastUpdateEt":"2/28/2021 10:15","dateModified":"2021-02-28T10:15:00Z","checkTimeEt":"02/28 05:15","death":2082,"hospitalized":6102,"hospitalizedDischarged":null,"dateChecked":"2021-02-28T10:15:00Z","totalTestsViral":2371202,"positiveTestsViral":233302,"negativeTestsViral":2135250,"positiveCasesViral":null,"deathConfirmed":null,"deathProbable":null,"totalTestEncountersViral":null,"totalTestsPeopleViral":965379,"totalTestsAntibody":null,"positiveTestsAntibody":null,"negativeTestsAntibody":null,"totalTestsPeopleAntibody":null,"positiveTestsPeopleAntibody":null,"negativeTestsPeopleAntibody":null,"totalTestsPeopleAntigen":null,"positiveTestsPeopleAntigen":null,"totalTestsAntigen":null,"positiveTestsAntigen":null,"fips":"31","positiveIncrease":167,"negativeIncrease":598,"total":964852,"totalTestResultsIncrease":5076,"posNeg":964852,"dataQualityGrade":null,"deathIncrease":0,"hospitalizedIncrease":3,"hash":"0b1e6546b3ea12ae6fed56a05dec636d58bfe718","commercialScore":0,"negativeRegularScore":0,"negativeScore":0,"positiveScore":0,"score":0,"grade":""},{"date":20210227,"state":"NE","positive":200681,"probableCases":null,"negative":763406,"pending":null,"totalTestResultsSource":"totalTestsViral","totalTestResults":2366126,"hospitalizedCurrently":154,"hospitalizedCumulative":6099,"inIcuCurrently":null,"inIcuCumulative":null,"onVentilatorCurrently":null,"onVentilatorCumulative":null,"recovered":154339,"lastUpdateEt":"2/27/2021 10:30","dateModified":"2021-02-27T10:30:00Z","checkTimeEt":"02/27 05:30","death":2082,"hospitalized":6099,"hospitalizedDischarged":null,"dateChecked":"2021-02-27T10:30:00Z","totalTestsViral":2366126,"positiveTestsViral":233075,"negativeTestsViral":2130434,"positiveCasesViral":null,"deathConfirmed":null,"deathProbable":null,"totalTestEncountersViral":null,"totalTestsPeopleViral":964612,"totalTestsAntibody":null,"positiveTestsAntibody":null,"negativeTestsAntibody":null,"totalTestsPeopleAntibody":null,"positiveTestsPeopleAntibody":null,"negativeTestsPeopleAntibody":null,"totalTestsPeopleAntigen":null,"positiveTestsPeopleAntigen":null,"totalTestsAntigen":null,"positiveTestsAntigen":null,"fips":"31","positiveIncrease":278,"negativeIncrease":1160,"total":964087,"totalTestResultsIncrease":9331,"posNeg":964087,"dataQualityGrade":null,"deathIncrease":4,"hospitalizedIncrease":11,"hash":"7ea400d049f28599ccb64f360f4ca34f6d0af99f","commercialScore":0,"negativeRegularScore":0,"negativeScore":0,"positiveScore":0,"score":0,"grade":""},{"date":20210226,"state":"NE","positive":200403,"probableCases":null,"negative":762246,"pending":null,"totalTestResultsSource":"totalTestsViral","totalTestResults":2356795,"hospitalizedCurrently":166,"hospitalizedCumulative":6088,"inIcuCurrently":null,"inIcuCumulative":null,"onVentilatorCurrently":null,"onVentilatorCumulative":null,"recovered":153937,"lastUpdateEt":"2/26/2021 10:00","dateModified":"2021-02-26T10:00:00Z","checkTimeEt":"02/26 05:00","death":2078,"hospitalized":6088,"hospitalizedDischarged":null,"dateChecked":"2021-02-26T10:00:00Z","totalTestsViral":2356795,"positiveTestsViral":232720,"negativeTestsViral":2121457,"positiveCasesViral":null,"deathConfirmed":null,"deathProbable":null,"totalTestEncountersViral":null,"totalTestsPeopleViral":963170,"totalTestsAntibody":null,"positiveTestsAntibody":null,"negativeTestsAntibody":null,"totalTestsPeopleAntibody":null,"positiveTestsPeopleAntibody":null,"negativeTestsPeopleAntibody":null,"totalTestsPeopleAntigen":null,"positiveTestsPeopleAntigen":null,"totalTestsAntigen":null,"positiveTestsAntigen":null,"fips":"31","positiveIncrease":297,"negativeIncrease":1405,"total":962649,"totalTestResultsIncrease":9342,"posNeg":962649,"dataQualityGrade":null,"deathIncrease":15,"hospitalizedIncrease":6,"hash":"a7099ae97538c3a81315f2b0bd7a862fdfc096be","commercialScore":0,"negativeRegularScore":0,"negativeScore":0,"positiveScore":0,"score":0,"grade":""},{"date":20210225,"state":"NE","positive":200106,"probableCases":null,"negative":760841,"pending":null,"totalTestResultsSource":"totalTestsViral","totalTestResults":2347453,"hospitalizedCurrently":160,"hospitalizedCumulative":6082,"inIcuCurrently":null,"inIcuCumulative":null,"onVentilatorCurrently":null,"onVentilatorCumulative":null,"recovered":153753,"lastUpdateEt":"2/25/2021 10:30","dateModified":"2021-02-25T10:30:00Z","checkTimeEt":"02/25 05:30","death":2063,"hospitalized":6082,"hospitalizedDischarged":null,"dateChecked":"2021-02-25T10:30:00Z","totalTestsViral":2347453,"positiveTestsViral":232314,"negativeTestsViral":2112522,"positiveCasesViral":null,"deathConfirmed":null,"deathProbable":null,"totalTestEncountersViral":null,"totalTestsPeopleViral":961464,"totalTestsAntibody":null,"positiveTestsAntibody":null,"negativeTestsAntibody":null,"totalTestsPeopleAntibody":null,"positiveTestsPeopleAntibody":null,"negativeTestsPeopleAntibody":null,"totalTestsPeopleAntigen":null,"positiveTestsPeopleAntigen":null,"totalTestsAntigen":null,"positiveTestsAntigen":null,"fips":"31","positiveIncrease":324,"negativeIncrease":1126,"total":960947,"totalTestResultsIncrease":12000,"posNeg":960947,"dataQualityGrade":null,"deathIncrease":9,"hospitalizedIncrease":23,"hash":"8ede2d0cea227a7fcd99de24d63b1d87ac9ff9bd","commercialScore":0,"negativeRegularScore":0,"negativeScore":0,"positiveScore":0,"score":0,"grade":""},{"date":20210224,"state":"NE","positive":199782,"probableCases":null,"negative":759715,"pending":null,"totalTestResultsSource":"totalTestsViral","totalTestResults":2335453,"hospitalizedCurrently":178,"hospitalizedCumulative":6059,"inIcuCurrently":null,"inIcuCumulative":null,"onVentilatorCurrently":null,"onVentilatorCumulative":null,"recovered":153585,"lastUpdateEt":"2/24/2021 12:15","dateModified":"2021-02-24T12:15:00Z","checkTimeEt":"02/24 07:15","death":2054,"hospitalized":6059,"hospitalizedDischarged":null,"dateChecked":"2021-02-24T12:15:00Z","totalTestsViral":2335453,"positiveTestsViral":231778,"negativeTestsViral":2101080,"positiveCasesViral":null,"deathConfirmed":null,"deathProbable":null,"totalTestEncountersViral":null,"totalTestsPeopleViral":960014,"totalTestsAntibody":null,"positiveTestsAntibody":null,"negativeTestsAntibody":null,"totalTestsPeopleAntibody":null,"positiveTestsPeopleAntibody":null,"negativeTestsPeopleAntibody":null,"totalTestsPeopleAntigen":null,"positiveTestsPeopleAntigen":null,"totalTestsAntigen":null,"positiveTestsAntigen":null,"fips":"31","positiveIncrease":380,"negativeIncrease":1448,"total":959497,"totalTestResultsIncrease":12443,"posNeg":959497,"dataQualityGrade":null,"deathIncrease":4,"hospitalizedIncrease":11,"hash":"51004b5df8a777594ec10dcc6b8c46077714d6ee","commercialScore":0,"negativeRegularScore":0,"negativeScore":0,"positiveScore":0,"score":0,"grade":""},{"date":20210223,"state":"NE","positive":199402,"probableCases":null,"negative":758267,"pending":null,"totalTestResultsSource":"totalTestsViral","totalTestResults":2323010,"hospitalizedCurrently":166,"hospitalizedCumulative":6048,"inIcuCurrently":null,"inIcuCumulative":null,"onVentilatorCurrently":null,"onVentilatorCumulative":null,"recovered":142336,"lastUpdateEt":"2/23/2021 10:30","dateModified":"2021-02-23T10:30:00Z","checkTimeEt":"02/23 05:30","death":2050,"hospitalized":6048,"hospitalizedDischarged":null,"dateChecked":"2021-02-23T10:30:00Z","totalTestsViral":2323010,"positiveTestsViral":231219,"negativeTestsViral":2089213,"positiveCasesViral":null,"deathConfirmed":null,"deathProbable":null,"totalTestEncountersViral":null,"totalTestsPeopleViral":958180,"totalTestsAntibody":null,"positiveTestsAntibody":null,"negativeTestsAntibody":null,"totalTestsPeopleAntibody":null,"positiveTestsPeopleAntibody":null,"negativeTestsPeopleAntibody":null,"totalTestsPeopleAntigen":null,"positiveTestsPeopleAntigen":null,"totalTestsAntigen":null,"positiveTestsAntigen":null,"fips":"31","positiveIncrease":357,"negativeIncrease":933,"total":957669,"totalTestResultsIncrease":6612,"posNeg":957669,"dataQualityGrade":null,"deathIncrease":3,"hospitalizedIncrease":17,"hash":"cc402d0f430db33b075e1137ca51afc144366bf8","commercialScore":0,"negativeRegularScore":0,"negativeScore":0,"positiveScore":0,"score":0,"grade":""},{"date":20210222,"state":"NE","positive":199045,"probableCases":null,"negative":757334,"pending":null,"totalTestResultsSource":"totalTestsViral","totalTestResults":2316398,"hospitalizedCurrently":161,"hospitalizedCumulative":6031,"inIcuCurrently":null,"inIcuCumulative":null,"onVentilatorCurrently":null,"onVentilatorCumulative":null,"recovered":142336,"lastUpdateEt":"2/22/2021 09:45","dateModified":"2021-02-22T09:45:00Z","checkTimeEt":"02/22 04:45","death":2047,"hospitalized":6031,"hospitalizedDischarged":null,"dateChecked":"2021-02-22T09:45:00Z","totalTestsViral":2316398,"positiveTestsViral":230838,"negativeTestsViral":2082984,"positiveCasesViral":null,"deathConfirmed":null,"deathProbable":null,"totalTestEncountersViral":null,"totalTestsPeopleViral":956892,"totalTestsAntibody":null,"positiveTestsAntibody":null,"negativeTestsAntibody":null,"totalTestsPeopleAntibody":null,"positiveTestsPeopleAntibody":null,"negativeTestsPeopleAntibody":null,"totalTestsPeopleAntigen":null,"positiveTestsPeopleAntigen":null,"totalTestsAntigen":null,"positiveTestsAntigen":null,"fips":"31","positiveIncrease":96,"negativeIncrease":342,"total":956379,"totalTestResultsIncrease":2001,"posNeg":956379,"dataQualityGrade":null,"deathIncrease":0,"hospitalizedIncrease":-3,"hash":"3e5c8ac5817de4bb261e9bba826a5d09b82dd90e","commercialScore":0,"negativeRegularScore":0,"negativeScore":0,"positiveScore":0,"score":0,"grade":""},{"date":20210221,"state":"NE","positive":198949,"probableCases":null,"negative":756992,"pending":null,"totalTestResultsSource":"totalTestsViral","totalTestResults":2314397,"hospitalizedCurrently":163,"hospitalizedCumulative":6034,"inIcuCurrently":null,"inIcuCumulative":null,"onVentilatorCurrently":null,"onVentilatorCumulative":null,"recovered":142336,"lastUpdateEt":"2/21/2021 10:45","dateModified":"2021-02-21T10:45:00Z","checkTimeEt":"02/21 05:45","death":2047,"hospitalized":6034,"hospitalizedDischarged":null,"dateChecked":"2021-02-21T10:45:00Z","totalTestsViral":2314397,"positiveTestsViral":230666,"negativeTestsViral":2081186,"positiveCasesViral":null,"deathConfirmed":null,"deathProbable":null,"totalTestEncountersViral":null,"totalTestsPeopleViral":956452,"totalTestsAntibody":null,"positiveTestsAntibody":null,"negativeTestsAntibody":null,"totalTestsPeopleAntibody":null,"positiveTestsPeopleAntibody":null,"negativeTestsPeopleAntibody":null,"totalTestsPeopleAntigen":null,"positiveTestsPeopleAntigen":null,"totalTestsAntigen":null,"positiveTestsAntigen":null,"fips":"31","positiveIncrease":198,"negativeIncrease":688,"total":955941,"totalTestResultsIncrease":5164,"posNeg":955941,"dataQualityGrade":null,"deathIncrease":0,"hospitalizedIncrease":2,"hash":"b728aa66e550058fa59865fda7f35cb01404268e","commercialScore":0,"negativeRegularScore":0,"negativeScore":0,"positiveScore":0,"score":0,"grade":""},{"date":20210220,"state":"NE","positive":198751,"probableCases":null,"negative":756304,"pending":null,"totalTestResultsSource":"totalTestsViral","totalTestResults":2309233,"hospitalizedCurrently":170,"hospitalizedCumulative":6032,"inIcuCurrently":null,"inIcuCumulative":null,"onVentilatorCurrently":null,"onVentilatorCumulative":null,"recovered":142336,"lastUpdateEt":"2/20/2021 10:45","dateModified":"2021-02-20T10:45:00Z","checkTimeEt":"02/20 05:45","death":2047,"hospitalized":6032,"hospitalizedDischarged":null,"dateChecked":"2021-02-20T10:45:00Z","totalTestsViral":2309233,"positiveTestsViral":230417,"negativeTestsViral":2076255,"positiveCasesViral":null,"deathConfirmed":null,"deathProbable":null,"totalTestEncountersViral":null,"totalTestsPeopleViral":955566,"totalTestsAntibody":null,"positiveTestsAntibody":null,"negativeTestsAntibody":null,"totalTestsPeopleAntibody":null,"positiveTestsPeopleAntibody":null,"negativeTestsPeopleAntibody":null,"totalTestsPeopleAntigen":null,"positiveTestsPeopleAntigen":null,"totalTestsAntigen":null,"positiveTestsAntigen":null,"fips":"31","positiveIncrease":309,"negativeIncrease":964,"total":955055,"totalTestResultsIncrease":7975,"posNeg":955055,"dataQualityGrade":null,"deathIncrease":4,"hospitalizedIncrease":23,"hash":"29844fd2b62f9dca8477067b84df3fe73f6b8be8","commercialScore":0,"negativeRegularScore":0,"negativeScore":0,"positiveScore":0,"score":0,"grade":""},{"date":20210219,"state":"NE","positive":198442,"probableCases":null,"negative":755340,"pending":null,"totalTestResultsSource":"totalTestsViral","totalTestResults":2301258,"hospitalizedCurrently":185,"hospitalizedCumulative":6009,"inIcuCurrently":null,"inIcuCumulative":null,"onVentilatorCurrently":null,"onVentilatorCumulative":null,"recovered":142336,"lastUpdateEt":"2/19/2021 10:15","dateModified":"2021-02-19T10:15:00Z","checkTimeEt":"02/19 05:15","death":2043,"hospitalized":6009,"hospitalizedDischarged":null,"dateChecked":"2021-02-19T10:15:00Z","totalTestsViral":2301258,"positiveTestsViral":229934,"negativeTestsViral":2068787,"positiveCasesViral":null,"deathConfirmed":null,"deathProbable":null,"totalTestEncountersViral":null,"totalTestsPeopleViral":954292,"totalTestsAntibody":null,"positiveTestsAntibody":null,"negativeTestsAntibody":null,"totalTestsPeopleAntibody":null,"positiveTestsPeopleAntibody":null,"negativeTestsPeopleAntibody":null,"totalTestsPeopleAntigen":null,"positiveTestsPeopleAntigen":null,"totalTestsAntigen":null,"positiveTestsAntigen":null,"fips":"31","positiveIncrease":400,"negativeIncrease":1171,"total":953782,"totalTestResultsIncrease":10947,"posNeg":953782,"dataQualityGrade":null,"deathIncrease":18,"hospitalizedIncrease":12,"hash":"245c5a3319cda8fda99bdb0ad2d5bc1e21bce9a9","commercialScore":0,"negativeRegularScore":0,"negativeScore":0,"positiveScore":0,"score":0,"grade":""},{"date":20210218,"state":"NE","positive":198042,"probableCases":null,"negative":754169,"pending":null,"totalTestResultsSource":"totalTestsViral","totalTestResults":2290311,"hospitalizedCurrently":188,"hospitalizedCumulative":5997,"inIcuCurrently":null,"inIcuCumulative":null,"onVentilatorCurrently":null,"onVentilatorCumulative":null,"recovered":142336,"lastUpdateEt":"2/18/2021 11:30","dateModified":"2021-02-18T11:30:00Z","checkTimeEt":"02/18 06:30","death":2025,"hospitalized":5997,"hospitalizedDischarged":null,"dateChecked":"2021-02-18T11:30:00Z","totalTestsViral":2290311,"positiveTestsViral":229423,"negativeTestsViral":2058349,"positiveCasesViral":null,"deathConfirmed":null,"deathProbable":null,"totalTestEncountersViral":null,"totalTestsPeopleViral":952722,"totalTestsAntibody":null,"positiveTestsAntibody":null,"negativeTestsAntibody":null,"totalTestsPeopleAntibody":null,"positiveTestsPeopleAntibody":null,"negativeTestsPeopleAntibody":null,"totalTestsPeopleAntigen":null,"positiveTestsPeopleAntigen":null,"totalTestsAntigen":null,"positiveTestsAntigen":null,"fips":"31","positiveIncrease":296,"negativeIncrease":962,"total":952211,"totalTestResultsIncrease":10386,"posNeg":952211,"dataQualityGrade":null,"deathIncrease":7,"hospitalizedIncrease":16,"hash":"dd1b721a8d4b99d6842ef33639c83e26404eecbd","commercialScore":0,"negativeRegularScore":0,"negativeScore":0,"positiveScore":0,"score":0,"grade":""},{"date":20210217,"state":"NE","positive":197746,"probableCases":null,"negative":753207,"pending":null,"totalTestResultsSource":"totalTestsViral","totalTestResults":2279925,"hospitalizedCurrently":185,"hospitalizedCumulative":5981,"inIcuCurrently":null,"inIcuCumulative":null,"onVentilatorCurrently":null,"onVentilatorCumulative":null,"recovered":142335,"lastUpdateEt":"2/17/2021 11:30","dateModified":"2021-02-17T11:30:00Z","checkTimeEt":"02/17 06:30","death":2018,"hospitalized":5981,"hospitalizedDischarged":null,"dateChecked":"2021-02-17T11:30:00Z","totalTestsViral":2279925,"positiveTestsViral":229051,"negativeTestsViral":2048349,"positiveCasesViral":null,"deathConfirmed":null,"deathProbable":null,"totalTestEncountersViral":null,"totalTestsPeopleViral":951463,"totalTestsAntibody":null,"positiveTestsAntibody":null,"negativeTestsAntibody":null,"totalTestsPeopleAntibody":null,"positiveTestsPeopleAntibody":null,"negativeTestsPeopleAntibody":null,"totalTestsPeopleAntigen":null,"positiveTestsPeopleAntigen":null,"totalTestsAntigen":null,"positiveTestsAntigen":null,"fips":"31","positiveIncrease":299,"negativeIncrease":1520,"total":950953,"totalTestResultsIncrease":22132,"posNeg":950953,"dataQualityGrade":null,"deathIncrease":14,"hospitalizedIncrease":17,"hash":"74659312bb099412719b03cf36985d8054c35318","commercialScore":0,"negativeRegularScore":0,"negativeScore":0,"positiveScore":0,"score":0,"grade":""},{"date":20210216,"state":"NE","positive":197447,"probableCases":null,"negative":751687,"pending":null,"totalTestResultsSource":"totalTestsViral","totalTestResults":2257793,"hospitalizedCurrently":177,"hospitalizedCumulative":5964,"inIcuCurrently":null,"inIcuCumulative":null,"onVentilatorCurrently":null,"onVentilatorCumulative":null,"recovered":142335,"lastUpdateEt":"2/16/2021 10:00","dateModified":"2021-02-16T10:00:00Z","checkTimeEt":"02/16 05:00","death":2004,"hospitalized":5964,"hospitalizedDischarged":null,"dateChecked":"2021-02-16T10:00:00Z","totalTestsViral":2257793,"positiveTestsViral":228110,"negativeTestsViral":2027634,"positiveCasesViral":null,"deathConfirmed":null,"deathProbable":null,"totalTestEncountersViral":null,"totalTestsPeopleViral":949639,"totalTestsAntibody":null,"positiveTestsAntibody":null,"negativeTestsAntibody":null,"totalTestsPeopleAntibody":null,"positiveTestsPeopleAntibody":null,"negativeTestsPeopleAntibody":null,"totalTestsPeopleAntigen":null,"positiveTestsPeopleAntigen":null,"totalTestsAntigen":null,"positiveTestsAntigen":null,"fips":"31","positiveIncrease":119,"negativeIncrease":332,"total":949134,"totalTestResultsIncrease":3235,"posNeg":949134,"dataQualityGrade":null,"deathIncrease":1,"hospitalizedIncrease":2,"hash":"1952e9e96492e429fcf54aee54c57869fa28a9aa","commercialScore":0,"negativeRegularScore":0,"negativeScore":0,"positiveScore":0,"score":0,"grade":""},{"date":20210215,"state":"NE","positive":197328,"probableCases":null,"negative":751355,"pending":null,"totalTestResultsSource":"totalTestsViral","totalTestResults":2254558,"hospitalizedCurrently":195,"hospitalizedCumulative":5962,"inIcuCurrently":null,"inIcuCumulative":null,"onVentilatorCurrently":null,"onVentilatorCumulative":null,"recovered":142335,"lastUpdateEt":"2/15/2021 10:00","dateModified":"2021-02-15T10:00:00Z","checkTimeEt":"02/15 05:00","death":2003,"hospitalized":5962,"hospitalizedDischarged":null,"dateChecked":"2021-02-15T10:00:00Z","totalTestsViral":2254558,"positiveTestsViral":227945,"negativeTestsViral":2024401,"positiveCasesViral":null,"deathConfirmed":null,"deathProbable":null,"totalTestEncountersViral":null,"totalTestsPeopleViral":949187,"totalTestsAntibody":null,"positiveTestsAntibody":null,"negativeTestsAntibody":null,"totalTestsPeopleAntibody":null,"positiveTestsPeopleAntibody":null,"negativeTestsPeopleAntibody":null,"totalTestsPeopleAntigen":null,"positiveTestsPeopleAntigen":null,"totalTestsAntigen":null,"positiveTestsAntigen":null,"fips":"31","positiveIncrease":92,"negativeIncrease":304,"total":948683,"totalTestResultsIncrease":1639,"posNeg":948683,"dataQualityGrade":null,"deathIncrease":1,"hospitalizedIncrease":12,"hash":"ded77630b071ce384e022320e650049677f8e261","commercialScore":0,"negativeRegularScore":0,"negativeScore":0,"positiveScore":0,"score":0,"grade":""},{"date":20210214,"state":"NE","positive":197236,"probableCases":null,"negative":751051,"pending":null,"totalTestResultsSource":"totalTestsViral","totalTestResults":2252919,"hospitalizedCurrently":197,"hospitalizedCumulative":5950,"inIcuCurrently":null,"inIcuCumulative":null,"onVentilatorCurrently":null,"onVentilatorCumulative":null,"recovered":142312,"lastUpdateEt":"2/14/2021 10:45","dateModified":"2021-02-14T10:45:00Z","checkTimeEt":"02/14 05:45","death":2002,"hospitalized":5950,"hospitalizedDischarged":null,"dateChecked":"2021-02-14T10:45:00Z","totalTestsViral":2252919,"positiveTestsViral":227838,"negativeTestsViral":2023233,"positiveCasesViral":null,"deathConfirmed":null,"deathProbable":null,"totalTestEncountersViral":null,"totalTestsPeopleViral":948791,"totalTestsAntibody":null,"positiveTestsAntibody":null,"negativeTestsAntibody":null,"totalTestsPeopleAntibody":null,"positiveTestsPeopleAntibody":null,"negativeTestsPeopleAntibody":null,"totalTestsPeopleAntigen":null,"positiveTestsPeopleAntigen":null,"totalTestsAntigen":null,"positiveTestsAntigen":null,"fips":"31","positiveIncrease":209,"negativeIncrease":781,"total":948287,"totalTestResultsIncrease":5671,"posNeg":948287,"dataQualityGrade":null,"deathIncrease":0,"hospitalizedIncrease":8,"hash":"b227b7e3122d0e887a54ea5c0e921b2b21c15395","commercialScore":0,"negativeRegularScore":0,"negativeScore":0,"positiveScore":0,"score":0,"grade":""},{"date":20210213,"state":"NE","positive":197027,"probableCases":null,"negative":750270,"pending":null,"totalTestResultsSource":"totalTestsViral","totalTestResults":2247248,"hospitalizedCurrently":201,"hospitalizedCumulative":5942,"inIcuCurrently":null,"inIcuCumulative":null,"onVentilatorCurrently":null,"onVentilatorCumulative":null,"recovered":142112,"lastUpdateEt":"2/13/2021 10:45","dateModified":"2021-02-13T10:45:00Z","checkTimeEt":"02/13 05:45","death":2002,"hospitalized":5942,"hospitalizedDischarged":null,"dateChecked":"2021-02-13T10:45:00Z","totalTestsViral":2247248,"positiveTestsViral":227596,"negativeTestsViral":2018183,"positiveCasesViral":null,"deathConfirmed":null,"deathProbable":null,"totalTestEncountersViral":null,"totalTestsPeopleViral":947799,"totalTestsAntibody":null,"positiveTestsAntibody":null,"negativeTestsAntibody":null,"totalTestsPeopleAntibody":null,"positiveTestsPeopleAntibody":null,"negativeTestsPeopleAntibody":null,"totalTestsPeopleAntigen":null,"positiveTestsPeopleAntigen":null,"totalTestsAntigen":null,"positiveTestsAntigen":null,"fips":"31","positiveIncrease":1542,"negativeIncrease":2051,"total":947297,"totalTestResultsIncrease":15802,"posNeg":947297,"dataQualityGrade":null,"deathIncrease":0,"hospitalizedIncrease":6,"hash":"952069f29a2cb62fc5af77e788d35212f8ebdc84","commercialScore":0,"negativeRegularScore":0,"negativeScore":0,"positiveScore":0,"score":0,"grade":""},{"date":20210212,"state":"NE","positive":195485,"probableCases":null,"negative":748219,"pending":null,"totalTestResultsSource":"totalTestsViral","totalTestResults":2231446,"hospitalizedCurrently":216,"hospitalizedCumulative":5936,"inIcuCurrently":null,"inIcuCumulative":null,"onVentilatorCurrently":null,"onVentilatorCumulative":null,"recovered":141783,"lastUpdateEt":"2/12/2021 10:15","dateModified":"2021-02-12T10:15:00Z","checkTimeEt":"02/12 05:15","death":2002,"hospitalized":5936,"hospitalizedDischarged":null,"dateChecked":"2021-02-12T10:15:00Z","totalTestsViral":2231446,"positiveTestsViral":226095,"negativeTestsViral":2003421,"positiveCasesViral":null,"deathConfirmed":null,"deathProbable":null,"totalTestEncountersViral":null,"totalTestsPeopleViral":944189,"totalTestsAntibody":null,"positiveTestsAntibody":null,"negativeTestsAntibody":null,"totalTestsPeopleAntibody":null,"positiveTestsPeopleAntibody":null,"negativeTestsPeopleAntibody":null,"totalTestsPeopleAntigen":null,"positiveTestsPeopleAntigen":null,"totalTestsAntigen":null,"positiveTestsAntigen":null,"fips":"31","positiveIncrease":479,"negativeIncrease":1722,"total":943704,"totalTestResultsIncrease":16875,"posNeg":943704,"dataQualityGrade":null,"deathIncrease":12,"hospitalizedIncrease":5,"hash":"05d7af8c988f645f7ba5f963a71d177a6ab780cf","commercialScore":0,"negativeRegularScore":0,"negativeScore":0,"positiveScore":0,"score":0,"grade":""},{"date":20210211,"state":"NE","positive":195006,"probableCases":null,"negative":746497,"pending":null,"totalTestResultsSource":"totalTestsViral","totalTestResults":2214571,"hospitalizedCurrently":230,"hospitalizedCumulative":5931,"inIcuCurrently":null,"inIcuCumulative":null,"onVentilatorCurrently":null,"onVentilatorCumulative":null,"recovered":141236,"lastUpdateEt":"2/11/2021 10:30","dateModified":"2021-02-11T10:30:00Z","checkTimeEt":"02/11 05:30","death":1990,"hospitalized":5931,"hospitalizedDischarged":null,"dateChecked":"2021-02-11T10:30:00Z","totalTestsViral":2214571,"positiveTestsViral":225461,"negativeTestsViral":1986778,"positiveCasesViral":null,"deathConfirmed":null,"deathProbable":null,"totalTestEncountersViral":null,"totalTestsPeopleViral":941988,"totalTestsAntibody":null,"positiveTestsAntibody":null,"negativeTestsAntibody":null,"totalTestsPeopleAntibody":null,"positiveTestsPeopleAntibody":null,"negativeTestsPeopleAntibody":null,"totalTestsPeopleAntigen":null,"positiveTestsPeopleAntigen":null,"totalTestsAntigen":null,"positiveTestsAntigen":null,"fips":"31","positiveIncrease":374,"negativeIncrease":1573,"total":941503,"totalTestResultsIncrease":9443,"posNeg":941503,"dataQualityGrade":null,"deathIncrease":4,"hospitalizedIncrease":3,"hash":"db62b7742d05e060ca01b5f3d5710bb2b53e3dea","commercialScore":0,"negativeRegularScore":0,"negativeScore":0,"positiveScore":0,"score":0,"grade":""},{"date":20210210,"state":"NE","positive":194632,"probableCases":null,"negative":744924,"pending":null,"totalTestResultsSource":"totalTestsViral","totalTestResults":2205128,"hospitalizedCurrently":240,"hospitalizedCumulative":5928,"inIcuCurrently":null,"inIcuCumulative":null,"onVentilatorCurrently":null,"onVentilatorCumulative":null,"recovered":141239,"lastUpdateEt":"2/10/2021 11:34","dateModified":"2021-02-10T11:34:00Z","checkTimeEt":"02/10 06:34","death":1986,"hospitalized":5928,"hospitalizedDischarged":null,"dateChecked":"2021-02-10T11:34:00Z","totalTestsViral":2205128,"positiveTestsViral":225021,"negativeTestsViral":1977788,"positiveCasesViral":null,"deathConfirmed":null,"deathProbable":null,"totalTestEncountersViral":null,"totalTestsPeopleViral":940043,"totalTestsAntibody":null,"positiveTestsAntibody":null,"negativeTestsAntibody":null,"totalTestsPeopleAntibody":null,"positiveTestsPeopleAntibody":null,"negativeTestsPeopleAntibody":null,"totalTestsPeopleAntigen":null,"positiveTestsPeopleAntigen":null,"totalTestsAntigen":null,"positiveTestsAntigen":null,"fips":"31","positiveIncrease":462,"negativeIncrease":1392,"total":939556,"totalTestResultsIncrease":15069,"posNeg":939556,"dataQualityGrade":null,"deathIncrease":8,"hospitalizedIncrease":11,"hash":"0c8ff0d2bcad69040598a48816da966da13d58a0","commercialScore":0,"negativeRegularScore":0,"negativeScore":0,"positiveScore":0,"score":0,"grade":""},{"date":20210209,"state":"NE","positive":194170,"probableCases":null,"negative":743532,"pending":null,"totalTestResultsSource":"totalTestsViral","totalTestResults":2190059,"hospitalizedCurrently":257,"hospitalizedCumulative":5917,"inIcuCurrently":null,"inIcuCumulative":null,"onVentilatorCurrently":null,"onVentilatorCumulative":null,"recovered":141108,"lastUpdateEt":"2/9/2021 10:15","dateModified":"2021-02-09T10:15:00Z","checkTimeEt":"02/09 05:15","death":1978,"hospitalized":5917,"hospitalizedDischarged":null,"dateChecked":"2021-02-09T10:15:00Z","totalTestsViral":2190059,"positiveTestsViral":224467,"negativeTestsViral":1963281,"positiveCasesViral":null,"deathConfirmed":null,"deathProbable":null,"totalTestEncountersViral":null,"totalTestsPeopleViral":938190,"totalTestsAntibody":null,"positiveTestsAntibody":null,"negativeTestsAntibody":null,"totalTestsPeopleAntibody":null,"positiveTestsPeopleAntibody":null,"negativeTestsPeopleAntibody":null,"totalTestsPeopleAntigen":null,"positiveTestsPeopleAntigen":null,"totalTestsAntigen":null,"positiveTestsAntigen":null,"fips":"31","positiveIncrease":344,"negativeIncrease":757,"total":937702,"totalTestResultsIncrease":6394,"posNeg":937702,"dataQualityGrade":null,"deathIncrease":10,"hospitalizedIncrease":16,"hash":"7632cdb8e15296af06ba2d2f8eedb249bf5ccd4b","commercialScore":0,"negativeRegularScore":0,"negativeScore":0,"positiveScore":0,"score":0,"grade":""},{"date":20210208,"state":"NE","positive":193826,"probableCases":null,"negative":742775,"pending":null,"totalTestResultsSource":"totalTestsViral","totalTestResults":2183665,"hospitalizedCurrently":250,"hospitalizedCumulative":5901,"inIcuCurrently":null,"inIcuCumulative":null,"onVentilatorCurrently":null,"onVentilatorCumulative":null,"recovered":140902,"lastUpdateEt":"2/8/2021 11:00","dateModified":"2021-02-08T11:00:00Z","checkTimeEt":"02/08 06:00","death":1968,"hospitalized":5901,"hospitalizedDischarged":null,"dateChecked":"2021-02-08T11:00:00Z","totalTestsViral":2183665,"positiveTestsViral":224093,"negativeTestsViral":1957270,"positiveCasesViral":null,"deathConfirmed":null,"deathProbable":null,"totalTestEncountersViral":null,"totalTestsPeopleViral":937086,"totalTestsAntibody":null,"positiveTestsAntibody":null,"negativeTestsAntibody":null,"totalTestsPeopleAntibody":null,"positiveTestsPeopleAntibody":null,"negativeTestsPeopleAntibody":null,"totalTestsPeopleAntigen":null,"positiveTestsPeopleAntigen":null,"totalTestsAntigen":null,"positiveTestsAntigen":null,"fips":"31","positiveIncrease":104,"negativeIncrease":366,"total":936601,"totalTestResultsIncrease":2157,"posNeg":936601,"dataQualityGrade":null,"deathIncrease":0,"hospitalizedIncrease":5,"hash":"9a7a1f2ee17547b76dc6f076946dd94bdb18d3af","commercialScore":0,"negativeRegularScore":0,"negativeScore":0,"positiveScore":0,"score":0,"grade":""},{"date":20210207,"state":"NE","positive":193722,"probableCases":null,"negative":742409,"pending":null,"totalTestResultsSource":"totalTestsViral","totalTestResults":2181508,"hospitalizedCurrently":272,"hospitalizedCumulative":5896,"inIcuCurrently":null,"inIcuCumulative":null,"onVentilatorCurrently":null,"onVentilatorCumulative":null,"recovered":140408,"lastUpdateEt":"2/7/2021 11:15","dateModified":"2021-02-07T11:15:00Z","checkTimeEt":"02/07 06:15","death":1968,"hospitalized":5896,"hospitalizedDischarged":null,"dateChecked":"2021-02-07T11:15:00Z","totalTestsViral":2181508,"positiveTestsViral":223900,"negativeTestsViral":1955313,"positiveCasesViral":null,"deathConfirmed":null,"deathProbable":null,"totalTestEncountersViral":null,"totalTestsPeopleViral":936615,"totalTestsAntibody":null,"positiveTestsAntibody":null,"negativeTestsAntibody":null,"totalTestsPeopleAntibody":null,"positiveTestsPeopleAntibody":null,"negativeTestsPeopleAntibody":null,"totalTestsPeopleAntigen":null,"positiveTestsPeopleAntigen":null,"totalTestsAntigen":null,"positiveTestsAntigen":null,"fips":"31","positiveIncrease":301,"negativeIncrease":1057,"total":936131,"totalTestResultsIncrease":10003,"posNeg":936131,"dataQualityGrade":null,"deathIncrease":0,"hospitalizedIncrease":9,"hash":"41dcfee4209be4bd2fd59193c82d92e2259e246d","commercialScore":0,"negativeRegularScore":0,"negativeScore":0,"positiveScore":0,"score":0,"grade":""},{"date":20210206,"state":"NE","positive":193421,"probableCases":null,"negative":741352,"pending":null,"totalTestResultsSource":"totalTestsViral","totalTestResults":2171505,"hospitalizedCurrently":275,"hospitalizedCumulative":5887,"inIcuCurrently":null,"inIcuCumulative":null,"onVentilatorCurrently":null,"onVentilatorCumulative":null,"recovered":139885,"lastUpdateEt":"2/6/2021 10:30","dateModified":"2021-02-06T10:30:00Z","checkTimeEt":"02/06 05:30","death":1968,"hospitalized":5887,"hospitalizedDischarged":null,"dateChecked":"2021-02-06T10:30:00Z","totalTestsViral":2171505,"positiveTestsViral":223487,"negativeTestsViral":1945734,"positiveCasesViral":null,"deathConfirmed":null,"deathProbable":null,"totalTestEncountersViral":null,"totalTestsPeopleViral":935257,"totalTestsAntibody":null,"positiveTestsAntibody":null,"negativeTestsAntibody":null,"totalTestsPeopleAntibody":null,"positiveTestsPeopleAntibody":null,"negativeTestsPeopleAntibody":null,"totalTestsPeopleAntigen":null,"positiveTestsPeopleAntigen":null,"totalTestsAntigen":null,"positiveTestsAntigen":null,"fips":"31","positiveIncrease":352,"negativeIncrease":1362,"total":934773,"totalTestResultsIncrease":12534,"posNeg":934773,"dataQualityGrade":null,"deathIncrease":10,"hospitalizedIncrease":14,"hash":"5443fedfd6efa65e1d2b41ba2d2e1642c645fc71","commercialScore":0,"negativeRegularScore":0,"negativeScore":0,"positiveScore":0,"score":0,"grade":""},{"date":20210205,"state":"NE","positive":193069,"probableCases":null,"negative":739990,"pending":null,"totalTestResultsSource":"totalTestsViral","totalTestResults":2158971,"hospitalizedCurrently":285,"hospitalizedCumulative":5873,"inIcuCurrently":null,"inIcuCumulative":null,"onVentilatorCurrently":null,"onVentilatorCumulative":null,"recovered":139287,"lastUpdateEt":"2/5/2021 10:30","dateModified":"2021-02-05T10:30:00Z","checkTimeEt":"02/05 05:30","death":1958,"hospitalized":5873,"hospitalizedDischarged":null,"dateChecked":"2021-02-05T10:30:00Z","totalTestsViral":2158971,"positiveTestsViral":223003,"negativeTestsViral":1933683,"positiveCasesViral":null,"deathConfirmed":null,"deathProbable":null,"totalTestEncountersViral":null,"totalTestsPeopleViral":933542,"totalTestsAntibody":null,"positiveTestsAntibody":null,"negativeTestsAntibody":null,"totalTestsPeopleAntibody":null,"positiveTestsPeopleAntibody":null,"negativeTestsPeopleAntibody":null,"totalTestsPeopleAntigen":null,"positiveTestsPeopleAntigen":null,"totalTestsAntigen":null,"positiveTestsAntigen":null,"fips":"31","positiveIncrease":520,"negativeIncrease":1919,"total":933059,"totalTestResultsIncrease":12700,"posNeg":933059,"dataQualityGrade":null,"deathIncrease":6,"hospitalizedIncrease":11,"hash":"8bbbeff01d4c0658864b289dcead86bbe69b98f9","commercialScore":0,"negativeRegularScore":0,"negativeScore":0,"positiveScore":0,"score":0,"grade":""},{"date":20210204,"state":"NE","positive":192549,"probableCases":null,"negative":738071,"pending":null,"totalTestResultsSource":"totalTestsViral","totalTestResults":2146271,"hospitalizedCurrently":278,"hospitalizedCumulative":5862,"inIcuCurrently":null,"inIcuCumulative":null,"onVentilatorCurrently":null,"onVentilatorCumulative":null,"recovered":138647,"lastUpdateEt":"2/4/2021 11:00","dateModified":"2021-02-04T11:00:00Z","checkTimeEt":"02/04 06:00","death":1952,"hospitalized":5862,"hospitalizedDischarged":null,"dateChecked":"2021-02-04T11:00:00Z","totalTestsViral":2146271,"positiveTestsViral":222359,"negativeTestsViral":1921652,"positiveCasesViral":null,"deathConfirmed":null,"deathProbable":null,"totalTestEncountersViral":null,"totalTestsPeopleViral":931101,"totalTestsAntibody":null,"positiveTestsAntibody":null,"negativeTestsAntibody":null,"totalTestsPeopleAntibody":null,"positiveTestsPeopleAntibody":null,"negativeTestsPeopleAntibody":null,"totalTestsPeopleAntigen":null,"positiveTestsPeopleAntigen":null,"totalTestsAntigen":null,"positiveTestsAntigen":null,"fips":"31","positiveIncrease":507,"negativeIncrease":1563,"total":930620,"totalTestResultsIncrease":13347,"posNeg":930620,"dataQualityGrade":null,"deathIncrease":21,"hospitalizedIncrease":18,"hash":"f68b2a1c64f61912e46297a338fbe27e6f0da7c9","commercialScore":0,"negativeRegularScore":0,"negativeScore":0,"positiveScore":0,"score":0,"grade":""},{"date":20210203,"state":"NE","positive":192042,"probableCases":null,"negative":736508,"pending":null,"totalTestResultsSource":"totalTestsViral","totalTestResults":2132924,"hospitalizedCurrently":305,"hospitalizedCumulative":5844,"inIcuCurrently":null,"inIcuCumulative":null,"onVentilatorCurrently":null,"onVentilatorCumulative":null,"recovered":137684,"lastUpdateEt":"2/3/2021 10:45","dateModified":"2021-02-03T10:45:00Z","checkTimeEt":"02/03 05:45","death":1931,"hospitalized":5844,"hospitalizedDischarged":null,"dateChecked":"2021-02-03T10:45:00Z","totalTestsViral":2132924,"positiveTestsViral":221689,"negativeTestsViral":1908965,"positiveCasesViral":null,"deathConfirmed":null,"deathProbable":null,"totalTestEncountersViral":null,"totalTestsPeopleViral":929032,"totalTestsAntibody":null,"positiveTestsAntibody":null,"negativeTestsAntibody":null,"totalTestsPeopleAntibody":null,"positiveTestsPeopleAntibody":null,"negativeTestsPeopleAntibody":null,"totalTestsPeopleAntigen":null,"positiveTestsPeopleAntigen":null,"totalTestsAntigen":null,"positiveTestsAntigen":null,"fips":"31","positiveIncrease":605,"negativeIncrease":2229,"total":928550,"totalTestResultsIncrease":22776,"posNeg":928550,"dataQualityGrade":null,"deathIncrease":2,"hospitalizedIncrease":12,"hash":"4816aad84ec7c21aa964a589dbe2297953b96296","commercialScore":0,"negativeRegularScore":0,"negativeScore":0,"positiveScore":0,"score":0,"grade":""},{"date":20210202,"state":"NE","positive":191437,"probableCases":null,"negative":734279,"pending":null,"totalTestResultsSource":"totalTestsViral","totalTestResults":2110148,"hospitalizedCurrently":305,"hospitalizedCumulative":5832,"inIcuCurrently":null,"inIcuCumulative":null,"onVentilatorCurrently":null,"onVentilatorCumulative":null,"recovered":137446,"lastUpdateEt":"2/2/2021 11:28","dateModified":"2021-02-02T11:28:00Z","checkTimeEt":"02/02 06:28","death":1929,"hospitalized":5832,"hospitalizedDischarged":null,"dateChecked":"2021-02-02T11:28:00Z","totalTestsViral":2110148,"positiveTestsViral":220917,"negativeTestsViral":1887002,"positiveCasesViral":null,"deathConfirmed":null,"deathProbable":null,"totalTestEncountersViral":null,"totalTestsPeopleViral":926198,"totalTestsAntibody":null,"positiveTestsAntibody":null,"negativeTestsAntibody":null,"totalTestsPeopleAntibody":null,"positiveTestsPeopleAntibody":null,"negativeTestsPeopleAntibody":null,"totalTestsPeopleAntigen":null,"positiveTestsPeopleAntigen":null,"totalTestsAntigen":null,"positiveTestsAntigen":null,"fips":"31","positiveIncrease":487,"negativeIncrease":931,"total":925716,"totalTestResultsIncrease":7171,"posNeg":925716,"dataQualityGrade":null,"deathIncrease":9,"hospitalizedIncrease":17,"hash":"51f6ca06bef83e5c4e86a545567f89525602ecdb","commercialScore":0,"negativeRegularScore":0,"negativeScore":0,"positiveScore":0,"score":0,"grade":""},{"date":20210201,"state":"NE","positive":190950,"probableCases":null,"negative":733348,"pending":null,"totalTestResultsSource":"totalTestsViral","totalTestResults":2102977,"hospitalizedCurrently":312,"hospitalizedCumulative":5815,"inIcuCurrently":null,"inIcuCumulative":null,"onVentilatorCurrently":null,"onVentilatorCumulative":null,"recovered":136972,"lastUpdateEt":"2/1/2021 11:30","dateModified":"2021-02-01T11:30:00Z","checkTimeEt":"02/01 06:30","death":1920,"hospitalized":5815,"hospitalizedDischarged":null,"dateChecked":"2021-02-01T11:30:00Z","totalTestsViral":2102977,"positiveTestsViral":220260,"negativeTestsViral":1880481,"positiveCasesViral":null,"deathConfirmed":null,"deathProbable":null,"totalTestEncountersViral":null,"totalTestsPeopleViral":924780,"totalTestsAntibody":null,"positiveTestsAntibody":null,"negativeTestsAntibody":null,"totalTestsPeopleAntibody":null,"positiveTestsPeopleAntibody":null,"negativeTestsPeopleAntibody":null,"totalTestsPeopleAntigen":null,"positiveTestsPeopleAntigen":null,"totalTestsAntigen":null,"positiveTestsAntigen":null,"fips":"31","positiveIncrease":237,"negativeIncrease":629,"total":924298,"totalTestResultsIncrease":2854,"posNeg":924298,"dataQualityGrade":null,"deathIncrease":0,"hospitalizedIncrease":11,"hash":"7d0c6832e7c283ef8ec0bd26969fe72cf9b8399d","commercialScore":0,"negativeRegularScore":0,"negativeScore":0,"positiveScore":0,"score":0,"grade":""},{"date":20210131,"state":"NE","positive":190713,"probableCases":null,"negative":732719,"pending":null,"totalTestResultsSource":"totalTestsViral","totalTestResults":2100123,"hospitalizedCurrently":320,"hospitalizedCumulative":5804,"inIcuCurrently":null,"inIcuCumulative":null,"onVentilatorCurrently":null,"onVentilatorCumulative":null,"recovered":136686,"lastUpdateEt":"1/31/2021 12:45","dateModified":"2021-01-31T12:45:00Z","checkTimeEt":"01/31 07:45","death":1920,"hospitalized":5804,"hospitalizedDischarged":null,"dateChecked":"2021-01-31T12:45:00Z","totalTestsViral":2100123,"positiveTestsViral":219936,"negativeTestsViral":1877955,"positiveCasesViral":null,"deathConfirmed":null,"deathProbable":null,"totalTestEncountersViral":null,"totalTestsPeopleViral":923914,"totalTestsAntibody":null,"positiveTestsAntibody":null,"negativeTestsAntibody":null,"totalTestsPeopleAntibody":null,"positiveTestsPeopleAntibody":null,"negativeTestsPeopleAntibody":null,"totalTestsPeopleAntigen":null,"positiveTestsPeopleAntigen":null,"totalTestsAntigen":null,"positiveTestsAntigen":null,"fips":"31","positiveIncrease":143,"negativeIncrease":338,"total":923432,"totalTestResultsIncrease":9161,"posNeg":923432,"dataQualityGrade":null,"deathIncrease":0,"hospitalizedIncrease":8,"hash":"e87a8de54753dec4fbbf23c796f09d1784c20640","commercialScore":0,"negativeRegularScore":0,"negativeScore":0,"positiveScore":0,"score":0,"grade":""},{"date":20210130,"state":"NE","positive":190570,"probableCases":null,"negative":732381,"pending":null,"totalTestResultsSource":"totalTestsViral","totalTestResults":2090962,"hospitalizedCurrently":325,"hospitalizedCumulative":5796,"inIcuCurrently":null,"inIcuCumulative":null,"onVentilatorCurrently":null,"onVentilatorCumulative":null,"recovered":135957,"lastUpdateEt":"1/30/2021 17:15","dateModified":"2021-01-30T17:15:00Z","checkTimeEt":"01/30 12:15","death":1920,"hospitalized":5796,"hospitalizedDischarged":null,"dateChecked":"2021-01-30T17:15:00Z","totalTestsViral":2090962,"positiveTestsViral":219706,"negativeTestsViral":1873158,"positiveCasesViral":null,"deathConfirmed":null,"deathProbable":null,"totalTestEncountersViral":null,"totalTestsPeopleViral":923433,"totalTestsAntibody":null,"positiveTestsAntibody":null,"negativeTestsAntibody":null,"totalTestsPeopleAntibody":null,"positiveTestsPeopleAntibody":null,"negativeTestsPeopleAntibody":null,"totalTestsPeopleAntigen":null,"positiveTestsPeopleAntigen":null,"totalTestsAntigen":null,"positiveTestsAntigen":null,"fips":"31","positiveIncrease":973,"negativeIncrease":3070,"total":922951,"totalTestResultsIncrease":15600,"posNeg":922951,"dataQualityGrade":null,"deathIncrease":-1,"hospitalizedIncrease":21,"hash":"9c0a94a5760e308ddee792c06bc566aa1a27a4de","commercialScore":0,"negativeRegularScore":0,"negativeScore":0,"positiveScore":0,"score":0,"grade":""},{"date":20210129,"state":"NE","positive":189597,"probableCases":null,"negative":729311,"pending":null,"totalTestResultsSource":"totalTestsViral","totalTestResults":2075362,"hospitalizedCurrently":341,"hospitalizedCumulative":5775,"inIcuCurrently":null,"inIcuCumulative":null,"onVentilatorCurrently":null,"onVentilatorCumulative":null,"recovered":134492,"lastUpdateEt":"1/28/2021 23:15","dateModified":"2021-01-28T23:15:00Z","checkTimeEt":"01/28 18:15","death":1921,"hospitalized":5775,"hospitalizedDischarged":null,"dateChecked":"2021-01-28T23:15:00Z","totalTestsViral":2075362,"positiveTestsViral":218517,"negativeTestsViral":1854627,"positiveCasesViral":null,"deathConfirmed":null,"deathProbable":null,"totalTestEncountersViral":null,"totalTestsPeopleViral":919385,"totalTestsAntibody":null,"positiveTestsAntibody":null,"negativeTestsAntibody":null,"totalTestsPeopleAntibody":null,"positiveTestsPeopleAntibody":null,"negativeTestsPeopleAntibody":null,"totalTestsPeopleAntigen":null,"positiveTestsPeopleAntigen":null,"totalTestsAntigen":null,"positiveTestsAntigen":null,"fips":"31","positiveIncrease":813,"negativeIncrease":1785,"total":918908,"totalTestResultsIncrease":11128,"posNeg":918908,"dataQualityGrade":null,"deathIncrease":4,"hospitalizedIncrease":19,"hash":"f9671f0843c28a40285438fd474d20c386ab4f78","commercialScore":0,"negativeRegularScore":0,"negativeScore":0,"positiveScore":0,"score":0,"grade":""},{"date":20210128,"state":"NE","positive":188784,"probableCases":null,"negative":727526,"pending":null,"totalTestResultsSource":"totalTestsViral","totalTestResults":2064234,"hospitalizedCurrently":343,"hospitalizedCumulative":5756,"inIcuCurrently":null,"inIcuCumulative":null,"onVentilatorCurrently":null,"onVentilatorCumulative":null,"recovered":133469,"lastUpdateEt":"1/27/2021 23:15","dateModified":"2021-01-27T23:15:00Z","checkTimeEt":"01/27 18:15","death":1917,"hospitalized":5756,"hospitalizedDischarged":null,"dateChecked":"2021-01-27T23:15:00Z","totalTestsViral":2064234,"positiveTestsViral":217494,"negativeTestsViral":1844539,"positiveCasesViral":null,"deathConfirmed":null,"deathProbable":null,"totalTestEncountersViral":null,"totalTestsPeopleViral":916787,"totalTestsAntibody":null,"positiveTestsAntibody":null,"negativeTestsAntibody":null,"totalTestsPeopleAntibody":null,"positiveTestsPeopleAntibody":null,"negativeTestsPeopleAntibody":null,"totalTestsPeopleAntigen":null,"positiveTestsPeopleAntigen":null,"totalTestsAntigen":null,"positiveTestsAntigen":null,"fips":"31","positiveIncrease":662,"negativeIncrease":1217,"total":916310,"totalTestResultsIncrease":11527,"posNeg":916310,"dataQualityGrade":null,"deathIncrease":12,"hospitalizedIncrease":27,"hash":"1cc27311512019d734ae8286b26139668b37d958","commercialScore":0,"negativeRegularScore":0,"negativeScore":0,"positiveScore":0,"score":0,"grade":""},{"date":20210127,"state":"NE","positive":188122,"probableCases":null,"negative":726309,"pending":null,"totalTestResultsSource":"totalTestsViral","totalTestResults":2052707,"hospitalizedCurrently":360,"hospitalizedCumulative":5729,"inIcuCurrently":null,"inIcuCumulative":null,"onVentilatorCurrently":null,"onVentilatorCumulative":null,"recovered":133206,"lastUpdateEt":"1/27/2021 00:00","dateModified":"2021-01-27T00:00:00Z","checkTimeEt":"01/26 19:00","death":1905,"hospitalized":5729,"hospitalizedDischarged":null,"dateChecked":"2021-01-27T00:00:00Z","totalTestsViral":2052707,"positiveTestsViral":216775,"negativeTestsViral":1833733,"positiveCasesViral":null,"deathConfirmed":null,"deathProbable":null,"totalTestEncountersViral":null,"totalTestsPeopleViral":914909,"totalTestsAntibody":null,"positiveTestsAntibody":null,"negativeTestsAntibody":null,"totalTestsPeopleAntibody":null,"positiveTestsPeopleAntibody":null,"negativeTestsPeopleAntibody":null,"totalTestsPeopleAntigen":null,"positiveTestsPeopleAntigen":null,"totalTestsAntigen":null,"positiveTestsAntigen":null,"fips":"31","positiveIncrease":329,"negativeIncrease":2151,"total":914431,"totalTestResultsIncrease":11920,"posNeg":914431,"dataQualityGrade":null,"deathIncrease":11,"hospitalizedIncrease":27,"hash":"6ea1fcdca9c57af252c41570c6d252c11b57aa4d","commercialScore":0,"negativeRegularScore":0,"negativeScore":0,"positiveScore":0,"score":0,"grade":""},{"date":20210126,"state":"NE","positive":187793,"probableCases":null,"negative":724158,"pending":null,"totalTestResultsSource":"totalTestsViral","totalTestResults":2040787,"hospitalizedCurrently":373,"hospitalizedCumulative":5702,"inIcuCurrently":null,"inIcuCumulative":null,"onVentilatorCurrently":null,"onVentilatorCumulative":null,"recovered":132495,"lastUpdateEt":"1/25/2021 22:15","dateModified":"2021-01-25T22:15:00Z","checkTimeEt":"01/25 17:15","death":1894,"hospitalized":5702,"hospitalizedDischarged":null,"dateChecked":"2021-01-25T22:15:00Z","totalTestsViral":2040787,"positiveTestsViral":216396,"negativeTestsViral":1822202,"positiveCasesViral":null,"deathConfirmed":null,"deathProbable":null,"totalTestEncountersViral":null,"totalTestsPeopleViral":912428,"totalTestsAntibody":null,"positiveTestsAntibody":null,"negativeTestsAntibody":null,"totalTestsPeopleAntibody":null,"positiveTestsPeopleAntibody":null,"negativeTestsPeopleAntibody":null,"totalTestsPeopleAntigen":null,"positiveTestsPeopleAntigen":null,"totalTestsAntigen":null,"positiveTestsAntigen":null,"fips":"31","positiveIncrease":646,"negativeIncrease":4158,"total":911951,"totalTestResultsIncrease":14759,"posNeg":911951,"dataQualityGrade":null,"deathIncrease":15,"hospitalizedIncrease":20,"hash":"463c0c2a13c5a126b8862166f91c10c61836f2a4","commercialScore":0,"negativeRegularScore":0,"negativeScore":0,"positiveScore":0,"score":0,"grade":""},{"date":20210125,"state":"NE","positive":187147,"probableCases":null,"negative":720000,"pending":null,"totalTestResultsSource":"totalTestsViral","totalTestResults":2026028,"hospitalizedCurrently":392,"hospitalizedCumulative":5682,"inIcuCurrently":null,"inIcuCumulative":null,"onVentilatorCurrently":null,"onVentilatorCumulative":null,"recovered":132453,"lastUpdateEt":"1/24/2021 22:15","dateModified":"2021-01-24T22:15:00Z","checkTimeEt":"01/24 17:15","death":1879,"hospitalized":5682,"hospitalizedDischarged":null,"dateChecked":"2021-01-24T22:15:00Z","totalTestsViral":2026028,"positiveTestsViral":215632,"negativeTestsViral":1808706,"positiveCasesViral":null,"deathConfirmed":null,"deathProbable":null,"totalTestEncountersViral":null,"totalTestsPeopleViral":907628,"totalTestsAntibody":null,"positiveTestsAntibody":null,"negativeTestsAntibody":null,"totalTestsPeopleAntibody":null,"positiveTestsPeopleAntibody":null,"negativeTestsPeopleAntibody":null,"totalTestsPeopleAntigen":null,"positiveTestsPeopleAntigen":null,"totalTestsAntigen":null,"positiveTestsAntigen":null,"fips":"31","positiveIncrease":293,"negativeIncrease":1066,"total":907147,"totalTestResultsIncrease":4612,"posNeg":907147,"dataQualityGrade":null,"deathIncrease":0,"hospitalizedIncrease":4,"hash":"e49993ccf0eddf1c611037a0e1359ce2638d71c7","commercialScore":0,"negativeRegularScore":0,"negativeScore":0,"positiveScore":0,"score":0,"grade":""},{"date":20210124,"state":"NE","positive":186854,"probableCases":null,"negative":718934,"pending":null,"totalTestResultsSource":"totalTestsViral","totalTestResults":2021416,"hospitalizedCurrently":390,"hospitalizedCumulative":5678,"inIcuCurrently":null,"inIcuCumulative":null,"onVentilatorCurrently":null,"onVentilatorCumulative":null,"recovered":131828,"lastUpdateEt":"1/23/2021 22:15","dateModified":"2021-01-23T22:15:00Z","checkTimeEt":"01/23 17:15","death":1879,"hospitalized":5678,"hospitalizedDischarged":null,"dateChecked":"2021-01-23T22:15:00Z","totalTestsViral":2021416,"positiveTestsViral":215275,"negativeTestsViral":1803954,"positiveCasesViral":null,"deathConfirmed":null,"deathProbable":null,"totalTestEncountersViral":null,"totalTestsPeopleViral":906268,"totalTestsAntibody":null,"positiveTestsAntibody":null,"negativeTestsAntibody":null,"totalTestsPeopleAntibody":null,"positiveTestsPeopleAntibody":null,"negativeTestsPeopleAntibody":null,"totalTestsPeopleAntigen":null,"positiveTestsPeopleAntigen":null,"totalTestsAntigen":null,"positiveTestsAntigen":null,"fips":"31","positiveIncrease":599,"negativeIncrease":7181,"total":905788,"totalTestResultsIncrease":22978,"posNeg":905788,"dataQualityGrade":null,"deathIncrease":1,"hospitalizedIncrease":8,"hash":"fd435d1df2026629a687e01ef4a77f7a1518e838","commercialScore":0,"negativeRegularScore":0,"negativeScore":0,"positiveScore":0,"score":0,"grade":""},{"date":20210123,"state":"NE","positive":186255,"probableCases":null,"negative":711753,"pending":null,"totalTestResultsSource":"totalTestsViral","totalTestResults":1998438,"hospitalizedCurrently":414,"hospitalizedCumulative":5670,"inIcuCurrently":null,"inIcuCumulative":null,"onVentilatorCurrently":null,"onVentilatorCumulative":null,"recovered":131242,"lastUpdateEt":"1/22/2021 22:15","dateModified":"2021-01-22T22:15:00Z","checkTimeEt":"01/22 17:15","death":1878,"hospitalized":5670,"hospitalizedDischarged":null,"dateChecked":"2021-01-22T22:15:00Z","totalTestsViral":1998438,"positiveTestsViral":214492,"negativeTestsViral":1784925,"positiveCasesViral":null,"deathConfirmed":null,"deathProbable":null,"totalTestEncountersViral":null,"totalTestsPeopleViral":898483,"totalTestsAntibody":null,"positiveTestsAntibody":null,"negativeTestsAntibody":null,"totalTestsPeopleAntibody":null,"positiveTestsPeopleAntibody":null,"negativeTestsPeopleAntibody":null,"totalTestsPeopleAntigen":null,"positiveTestsPeopleAntigen":null,"totalTestsAntigen":null,"positiveTestsAntigen":null,"fips":"31","positiveIncrease":909,"negativeIncrease":1608,"total":898008,"totalTestResultsIncrease":9534,"posNeg":898008,"dataQualityGrade":null,"deathIncrease":10,"hospitalizedIncrease":23,"hash":"58200e14f622f648114bed955b72392deda938e3","commercialScore":0,"negativeRegularScore":0,"negativeScore":0,"positiveScore":0,"score":0,"grade":""},{"date":20210122,"state":"NE","positive":185346,"probableCases":null,"negative":710145,"pending":null,"totalTestResultsSource":"totalTestsViral","totalTestResults":1988904,"hospitalizedCurrently":421,"hospitalizedCumulative":5647,"inIcuCurrently":null,"inIcuCumulative":null,"onVentilatorCurrently":null,"onVentilatorCumulative":null,"recovered":130527,"lastUpdateEt":"1/21/2021 22:15","dateModified":"2021-01-21T22:15:00Z","checkTimeEt":"01/21 17:15","death":1868,"hospitalized":5647,"hospitalizedDischarged":null,"dateChecked":"2021-01-21T22:15:00Z","totalTestsViral":1988904,"positiveTestsViral":213854,"negativeTestsViral":1763365,"positiveCasesViral":null,"deathConfirmed":null,"deathProbable":null,"totalTestEncountersViral":null,"totalTestsPeopleViral":895969,"totalTestsAntibody":null,"positiveTestsAntibody":null,"negativeTestsAntibody":null,"totalTestsPeopleAntibody":null,"positiveTestsPeopleAntibody":null,"negativeTestsPeopleAntibody":null,"totalTestsPeopleAntigen":null,"positiveTestsPeopleAntigen":null,"totalTestsAntigen":null,"positiveTestsAntigen":null,"fips":"31","positiveIncrease":864,"negativeIncrease":1865,"total":895491,"totalTestResultsIncrease":22737,"posNeg":895491,"dataQualityGrade":null,"deathIncrease":6,"hospitalizedIncrease":15,"hash":"80a5aacaac3771ab4ff45c9dda121e4a1992b1ed","commercialScore":0,"negativeRegularScore":0,"negativeScore":0,"positiveScore":0,"score":0,"grade":""},{"date":20210121,"state":"NE","positive":184482,"probableCases":null,"negative":708280,"pending":null,"totalTestResultsSource":"totalTestsViral","totalTestResults":1966167,"hospitalizedCurrently":433,"hospitalizedCumulative":5632,"inIcuCurrently":null,"inIcuCumulative":null,"onVentilatorCurrently":null,"onVentilatorCumulative":null,"recovered":129608,"lastUpdateEt":"1/20/2021 21:45","dateModified":"2021-01-20T21:45:00Z","checkTimeEt":"01/20 16:45","death":1862,"hospitalized":5632,"hospitalizedDischarged":null,"dateChecked":"2021-01-20T21:45:00Z","totalTestsViral":1966167,"positiveTestsViral":212272,"negativeTestsViral":1761252,"positiveCasesViral":null,"deathConfirmed":null,"deathProbable":null,"totalTestEncountersViral":null,"totalTestsPeopleViral":893236,"totalTestsAntibody":null,"positiveTestsAntibody":null,"negativeTestsAntibody":null,"totalTestsPeopleAntibody":null,"positiveTestsPeopleAntibody":null,"negativeTestsPeopleAntibody":null,"totalTestsPeopleAntigen":null,"positiveTestsPeopleAntigen":null,"totalTestsAntigen":null,"positiveTestsAntigen":null,"fips":"31","positiveIncrease":1164,"negativeIncrease":4167,"total":892762,"totalTestResultsIncrease":22156,"posNeg":892762,"dataQualityGrade":null,"deathIncrease":12,"hospitalizedIncrease":42,"hash":"a2da4fd43d6ae1cb6e09cb1647731534bc1a263d","commercialScore":0,"negativeRegularScore":0,"negativeScore":0,"positiveScore":0,"score":0,"grade":""},{"date":20210120,"state":"NE","positive":183318,"probableCases":null,"negative":704113,"pending":null,"totalTestResultsSource":"totalTestsViral","totalTestResults":1944011,"hospitalizedCurrently":438,"hospitalizedCumulative":5590,"inIcuCurrently":null,"inIcuCumulative":null,"onVentilatorCurrently":null,"onVentilatorCumulative":null,"recovered":127221,"lastUpdateEt":"1/19/2021 00:00","dateModified":"2021-01-19T00:00:00Z","checkTimeEt":"01/18 19:00","death":1850,"hospitalized":5590,"hospitalizedDischarged":null,"dateChecked":"2021-01-19T00:00:00Z","totalTestsViral":1944011,"positiveTestsViral":209752,"negativeTestsViral":1732116,"positiveCasesViral":null,"deathConfirmed":null,"deathProbable":null,"totalTestEncountersViral":null,"totalTestsPeopleViral":886764,"totalTestsAntibody":null,"positiveTestsAntibody":null,"negativeTestsAntibody":null,"totalTestsPeopleAntibody":null,"positiveTestsPeopleAntibody":null,"negativeTestsPeopleAntibody":null,"totalTestsPeopleAntigen":null,"positiveTestsPeopleAntigen":null,"totalTestsAntigen":null,"positiveTestsAntigen":null,"fips":"31","positiveIncrease":900,"negativeIncrease":0,"total":887431,"totalTestResultsIncrease":0,"posNeg":887431,"dataQualityGrade":null,"deathIncrease":8,"hospitalizedIncrease":0,"hash":"29abe730c020da48ac44ddc94116ae908a98613e","commercialScore":0,"negativeRegularScore":0,"negativeScore":0,"positiveScore":0,"score":0,"grade":""},{"date":20210119,"state":"NE","positive":182418,"probableCases":null,"negative":704113,"pending":null,"totalTestResultsSource":"totalTestsViral","totalTestResults":1944011,"hospitalizedCurrently":429,"hospitalizedCumulative":5590,"inIcuCurrently":null,"inIcuCumulative":null,"onVentilatorCurrently":null,"onVentilatorCumulative":null,"recovered":127221,"lastUpdateEt":"1/18/2021 21:30","dateModified":"2021-01-18T21:30:00Z","checkTimeEt":"01/18 16:30","death":1842,"hospitalized":5590,"hospitalizedDischarged":null,"dateChecked":"2021-01-18T21:30:00Z","totalTestsViral":1944011,"positiveTestsViral":209752,"negativeTestsViral":1732116,"positiveCasesViral":null,"deathConfirmed":null,"deathProbable":null,"totalTestEncountersViral":null,"totalTestsPeopleViral":886764,"totalTestsAntibody":null,"positiveTestsAntibody":null,"negativeTestsAntibody":null,"totalTestsPeopleAntibody":null,"positiveTestsPeopleAntibody":null,"negativeTestsPeopleAntibody":null,"totalTestsPeopleAntigen":null,"positiveTestsPeopleAntigen":null,"totalTestsAntigen":null,"positiveTestsAntigen":null,"fips":"31","positiveIncrease":440,"negativeIncrease":335,"total":886531,"totalTestResultsIncrease":2267,"posNeg":886531,"dataQualityGrade":null,"deathIncrease":5,"hospitalizedIncrease":15,"hash":"0087baa6ee234925ef8a33d7c0a8626573a3ce7e","commercialScore":0,"negativeRegularScore":0,"negativeScore":0,"positiveScore":0,"score":0,"grade":""},{"date":20210118,"state":"NE","positive":181978,"probableCases":null,"negative":703778,"pending":null,"totalTestResultsSource":"totalTestsViral","totalTestResults":1941744,"hospitalizedCurrently":429,"hospitalizedCumulative":5575,"inIcuCurrently":null,"inIcuCumulative":null,"onVentilatorCurrently":null,"onVentilatorCumulative":null,"recovered":126504,"lastUpdateEt":"1/17/2021 21:30","dateModified":"2021-01-17T21:30:00Z","checkTimeEt":"01/17 16:30","death":1837,"hospitalized":5575,"hospitalizedDischarged":null,"dateChecked":"2021-01-17T21:30:00Z","totalTestsViral":1941744,"positiveTestsViral":209674,"negativeTestsViral":1729927,"positiveCasesViral":null,"deathConfirmed":null,"deathProbable":null,"totalTestEncountersViral":null,"totalTestsPeopleViral":886228,"totalTestsAntibody":null,"positiveTestsAntibody":null,"negativeTestsAntibody":null,"totalTestsPeopleAntibody":null,"positiveTestsPeopleAntibody":null,"negativeTestsPeopleAntibody":null,"totalTestsPeopleAntigen":null,"positiveTestsPeopleAntigen":null,"totalTestsAntigen":null,"positiveTestsAntigen":null,"fips":"31","positiveIncrease":1068,"negativeIncrease":1816,"total":885756,"totalTestResultsIncrease":33052,"posNeg":885756,"dataQualityGrade":null,"deathIncrease":0,"hospitalizedIncrease":10,"hash":"adacf6a142234f494b6a816d8cf874783d19683f","commercialScore":0,"negativeRegularScore":0,"negativeScore":0,"positiveScore":0,"score":0,"grade":""},{"date":20210117,"state":"NE","positive":180910,"probableCases":null,"negative":701962,"pending":null,"totalTestResultsSource":"totalTestsViral","totalTestResults":1908692,"hospitalizedCurrently":457,"hospitalizedCumulative":5565,"inIcuCurrently":null,"inIcuCumulative":null,"onVentilatorCurrently":null,"onVentilatorCumulative":null,"recovered":124963,"lastUpdateEt":"1/15/2021 21:30","dateModified":"2021-01-15T21:30:00Z","checkTimeEt":"01/15 16:30","death":1837,"hospitalized":5565,"hospitalizedDischarged":null,"dateChecked":"2021-01-15T21:30:00Z","totalTestsViral":1908692,"positiveTestsViral":206887,"negativeTestsViral":1699670,"positiveCasesViral":null,"deathConfirmed":null,"deathProbable":null,"totalTestEncountersViral":null,"totalTestsPeopleViral":883344,"totalTestsAntibody":null,"positiveTestsAntibody":null,"negativeTestsAntibody":null,"totalTestsPeopleAntibody":null,"positiveTestsPeopleAntibody":null,"negativeTestsPeopleAntibody":null,"totalTestsPeopleAntigen":null,"positiveTestsPeopleAntigen":null,"totalTestsAntigen":null,"positiveTestsAntigen":null,"fips":"31","positiveIncrease":0,"negativeIncrease":0,"total":882872,"totalTestResultsIncrease":0,"posNeg":882872,"dataQualityGrade":null,"deathIncrease":0,"hospitalizedIncrease":0,"hash":"3ce36e4b6e0582acd9ce4d33af14e8e78e462f81","commercialScore":0,"negativeRegularScore":0,"negativeScore":0,"positiveScore":0,"score":0,"grade":""},{"date":20210116,"state":"NE","positive":180910,"probableCases":null,"negative":701962,"pending":null,"totalTestResultsSource":"totalTestsViral","totalTestResults":1908692,"hospitalizedCurrently":457,"hospitalizedCumulative":5565,"inIcuCurrently":null,"inIcuCumulative":null,"onVentilatorCurrently":null,"onVentilatorCumulative":null,"recovered":124963,"lastUpdateEt":"1/15/2021 21:30","dateModified":"2021-01-15T21:30:00Z","checkTimeEt":"01/15 16:30","death":1837,"hospitalized":5565,"hospitalizedDischarged":null,"dateChecked":"2021-01-15T21:30:00Z","totalTestsViral":1908692,"positiveTestsViral":206887,"negativeTestsViral":1699670,"positiveCasesViral":null,"deathConfirmed":null,"deathProbable":null,"totalTestEncountersViral":null,"totalTestsPeopleViral":883344,"totalTestsAntibody":null,"positiveTestsAntibody":null,"negativeTestsAntibody":null,"totalTestsPeopleAntibody":null,"positiveTestsPeopleAntibody":null,"negativeTestsPeopleAntibody":null,"totalTestsPeopleAntigen":null,"positiveTestsPeopleAntigen":null,"totalTestsAntigen":null,"positiveTestsAntigen":null,"fips":"31","positiveIncrease":779,"negativeIncrease":1455,"total":882872,"totalTestResultsIncrease":14078,"posNeg":882872,"dataQualityGrade":null,"deathIncrease":19,"hospitalizedIncrease":26,"hash":"8f99e8125bc3b8ac413b1b5ec4304ea1f8cba938","commercialScore":0,"negativeRegularScore":0,"negativeScore":0,"positiveScore":0,"score":0,"grade":""},{"date":20210115,"state":"NE","positive":180131,"probableCases":null,"negative":700507,"pending":null,"totalTestResultsSource":"totalTestsViral","totalTestResults":1894614,"hospitalizedCurrently":465,"hospitalizedCumulative":5539,"inIcuCurrently":null,"inIcuCumulative":null,"onVentilatorCurrently":null,"onVentilatorCumulative":null,"recovered":124233,"lastUpdateEt":"1/14/2021 21:30","dateModified":"2021-01-14T21:30:00Z","checkTimeEt":"01/14 16:30","death":1818,"hospitalized":5539,"hospitalizedDischarged":null,"dateChecked":"2021-01-14T21:30:00Z","totalTestsViral":1894614,"positiveTestsViral":205736,"negativeTestsViral":1686804,"positiveCasesViral":null,"deathConfirmed":null,"deathProbable":null,"totalTestEncountersViral":null,"totalTestsPeopleViral":881078,"totalTestsAntibody":null,"positiveTestsAntibody":null,"negativeTestsAntibody":null,"totalTestsPeopleAntibody":null,"positiveTestsPeopleAntibody":null,"negativeTestsPeopleAntibody":null,"totalTestsPeopleAntigen":null,"positiveTestsPeopleAntigen":null,"totalTestsAntigen":null,"positiveTestsAntigen":null,"fips":"31","positiveIncrease":932,"negativeIncrease":899,"total":880638,"totalTestResultsIncrease":7460,"posNeg":880638,"dataQualityGrade":null,"deathIncrease":15,"hospitalizedIncrease":19,"hash":"8d3e2150ee6624b545d098de17054f717968ce3f","commercialScore":0,"negativeRegularScore":0,"negativeScore":0,"positiveScore":0,"score":0,"grade":""},{"date":20210114,"state":"NE","positive":179199,"probableCases":null,"negative":699608,"pending":null,"totalTestResultsSource":"totalTestsViral","totalTestResults":1887154,"hospitalizedCurrently":449,"hospitalizedCumulative":5520,"inIcuCurrently":null,"inIcuCumulative":null,"onVentilatorCurrently":null,"onVentilatorCumulative":null,"recovered":123234,"lastUpdateEt":"1/13/2021 21:45","dateModified":"2021-01-13T21:45:00Z","checkTimeEt":"01/13 16:45","death":1803,"hospitalized":5520,"hospitalizedDischarged":null,"dateChecked":"2021-01-13T21:45:00Z","totalTestsViral":1887154,"positiveTestsViral":205069,"negativeTestsViral":1680017,"positiveCasesViral":null,"deathConfirmed":null,"deathProbable":null,"totalTestEncountersViral":null,"totalTestsPeopleViral":879242,"totalTestsAntibody":null,"positiveTestsAntibody":null,"negativeTestsAntibody":null,"totalTestsPeopleAntibody":null,"positiveTestsPeopleAntibody":null,"negativeTestsPeopleAntibody":null,"totalTestsPeopleAntigen":null,"positiveTestsPeopleAntigen":null,"totalTestsAntigen":null,"positiveTestsAntigen":null,"fips":"31","positiveIncrease":1529,"negativeIncrease":3169,"total":878807,"totalTestResultsIncrease":12447,"posNeg":878807,"dataQualityGrade":null,"deathIncrease":12,"hospitalizedIncrease":23,"hash":"2a97acf8e334032a316148d320e1eee48d855231","commercialScore":0,"negativeRegularScore":0,"negativeScore":0,"positiveScore":0,"score":0,"grade":""},{"date":20210113,"state":"NE","positive":177670,"probableCases":null,"negative":696439,"pending":null,"totalTestResultsSource":"totalTestsViral","totalTestResults":1874707,"hospitalizedCurrently":457,"hospitalizedCumulative":5497,"inIcuCurrently":null,"inIcuCumulative":null,"onVentilatorCurrently":null,"onVentilatorCumulative":null,"recovered":120700,"lastUpdateEt":"1/12/2021 22:30","dateModified":"2021-01-12T22:30:00Z","checkTimeEt":"01/12 17:30","death":1791,"hospitalized":5497,"hospitalizedDischarged":null,"dateChecked":"2021-01-12T22:30:00Z","totalTestsViral":1874707,"positiveTestsViral":204358,"negativeTestsViral":1668291,"positiveCasesViral":null,"deathConfirmed":null,"deathProbable":null,"totalTestEncountersViral":null,"totalTestsPeopleViral":874543,"totalTestsAntibody":null,"positiveTestsAntibody":null,"negativeTestsAntibody":null,"totalTestsPeopleAntibody":null,"positiveTestsPeopleAntibody":null,"negativeTestsPeopleAntibody":null,"totalTestsPeopleAntigen":null,"positiveTestsPeopleAntigen":null,"totalTestsAntigen":null,"positiveTestsAntigen":null,"fips":"31","positiveIncrease":1000,"negativeIncrease":1271,"total":874109,"totalTestResultsIncrease":13341,"posNeg":874109,"dataQualityGrade":null,"deathIncrease":19,"hospitalizedIncrease":22,"hash":"32e857722abc7ce88ad8a9b51d36dc789eaaf08d","commercialScore":0,"negativeRegularScore":0,"negativeScore":0,"positiveScore":0,"score":0,"grade":""},{"date":20210112,"state":"NE","positive":176670,"probableCases":null,"negative":695168,"pending":null,"totalTestResultsSource":"totalTestsViral","totalTestResults":1861366,"hospitalizedCurrently":484,"hospitalizedCumulative":5475,"inIcuCurrently":null,"inIcuCumulative":null,"onVentilatorCurrently":null,"onVentilatorCumulative":null,"recovered":122564,"lastUpdateEt":"1/11/2021 21:45","dateModified":"2021-01-11T21:45:00Z","checkTimeEt":"01/11 16:45","death":1772,"hospitalized":5475,"hospitalizedDischarged":null,"dateChecked":"2021-01-11T21:45:00Z","totalTestsViral":1861366,"positiveTestsViral":203155,"negativeTestsViral":1656163,"positiveCasesViral":null,"deathConfirmed":null,"deathProbable":null,"totalTestEncountersViral":null,"totalTestsPeopleViral":872270,"totalTestsAntibody":null,"positiveTestsAntibody":null,"negativeTestsAntibody":null,"totalTestsPeopleAntibody":null,"positiveTestsPeopleAntibody":null,"negativeTestsPeopleAntibody":null,"totalTestsPeopleAntigen":null,"positiveTestsPeopleAntigen":null,"totalTestsAntigen":null,"positiveTestsAntigen":null,"fips":"31","positiveIncrease":644,"negativeIncrease":727,"total":871838,"totalTestResultsIncrease":9315,"posNeg":871838,"dataQualityGrade":null,"deathIncrease":12,"hospitalizedIncrease":15,"hash":"8c142020d070496916193def6aeba707a129ff6e","commercialScore":0,"negativeRegularScore":0,"negativeScore":0,"positiveScore":0,"score":0,"grade":""},{"date":20210111,"state":"NE","positive":176026,"probableCases":null,"negative":694441,"pending":null,"totalTestResultsSource":"totalTestsViral","totalTestResults":1852051,"hospitalizedCurrently":475,"hospitalizedCumulative":5460,"inIcuCurrently":null,"inIcuCumulative":null,"onVentilatorCurrently":null,"onVentilatorCumulative":null,"recovered":121710,"lastUpdateEt":"1/10/2021 21:30","dateModified":"2021-01-10T21:30:00Z","checkTimeEt":"01/10 16:30","death":1760,"hospitalized":5460,"hospitalizedDischarged":null,"dateChecked":"2021-01-10T21:30:00Z","totalTestsViral":1852051,"positiveTestsViral":202327,"negativeTestsViral":1647683,"positiveCasesViral":null,"deathConfirmed":null,"deathProbable":null,"totalTestEncountersViral":null,"totalTestsPeopleViral":870901,"totalTestsAntibody":null,"positiveTestsAntibody":null,"negativeTestsAntibody":null,"totalTestsPeopleAntibody":null,"positiveTestsPeopleAntibody":null,"negativeTestsPeopleAntibody":null,"totalTestsPeopleAntigen":null,"positiveTestsPeopleAntigen":null,"totalTestsAntigen":null,"positiveTestsAntigen":null,"fips":"31","positiveIncrease":406,"negativeIncrease":928,"total":870467,"totalTestResultsIncrease":3962,"posNeg":870467,"dataQualityGrade":null,"deathIncrease":23,"hospitalizedIncrease":16,"hash":"d6536858b19425948ac031372cf43556e950cda9","commercialScore":0,"negativeRegularScore":0,"negativeScore":0,"positiveScore":0,"score":0,"grade":""},{"date":20210110,"state":"NE","positive":175620,"probableCases":null,"negative":693513,"pending":null,"totalTestResultsSource":"totalTestsViral","totalTestResults":1848089,"hospitalizedCurrently":471,"hospitalizedCumulative":5444,"inIcuCurrently":null,"inIcuCumulative":null,"onVentilatorCurrently":null,"onVentilatorCumulative":null,"recovered":120729,"lastUpdateEt":"1/9/2021 21:45","dateModified":"2021-01-09T21:45:00Z","checkTimeEt":"01/09 16:45","death":1737,"hospitalized":5444,"hospitalizedDischarged":null,"dateChecked":"2021-01-09T21:45:00Z","totalTestsViral":1848089,"positiveTestsViral":201900,"negativeTestsViral":1644150,"positiveCasesViral":null,"deathConfirmed":null,"deathProbable":null,"totalTestEncountersViral":null,"totalTestsPeopleViral":869564,"totalTestsAntibody":null,"positiveTestsAntibody":null,"negativeTestsAntibody":null,"totalTestsPeopleAntibody":null,"positiveTestsPeopleAntibody":null,"negativeTestsPeopleAntibody":null,"totalTestsPeopleAntigen":null,"positiveTestsPeopleAntigen":null,"totalTestsAntigen":null,"positiveTestsAntigen":null,"fips":"31","positiveIncrease":1006,"negativeIncrease":1809,"total":869133,"totalTestResultsIncrease":10418,"posNeg":869133,"dataQualityGrade":null,"deathIncrease":4,"hospitalizedIncrease":10,"hash":"9238c88a19bccd27ad5cca8613d09bb92fb9122d","commercialScore":0,"negativeRegularScore":0,"negativeScore":0,"positiveScore":0,"score":0,"grade":""},{"date":20210109,"state":"NE","positive":174614,"probableCases":null,"negative":691704,"pending":null,"totalTestResultsSource":"totalTestsViral","totalTestResults":1837671,"hospitalizedCurrently":481,"hospitalizedCumulative":5434,"inIcuCurrently":null,"inIcuCumulative":null,"onVentilatorCurrently":null,"onVentilatorCumulative":null,"recovered":119393,"lastUpdateEt":"1/8/2021 21:30","dateModified":"2021-01-08T21:30:00Z","checkTimeEt":"01/08 16:30","death":1733,"hospitalized":5434,"hospitalizedDischarged":null,"dateChecked":"2021-01-08T21:30:00Z","totalTestsViral":1837671,"positiveTestsViral":200730,"negativeTestsViral":1634913,"positiveCasesViral":null,"deathConfirmed":null,"deathProbable":null,"totalTestEncountersViral":null,"totalTestsPeopleViral":866748,"totalTestsAntibody":null,"positiveTestsAntibody":null,"negativeTestsAntibody":null,"totalTestsPeopleAntibody":null,"positiveTestsPeopleAntibody":null,"negativeTestsPeopleAntibody":null,"totalTestsPeopleAntigen":null,"positiveTestsPeopleAntigen":null,"totalTestsAntigen":null,"positiveTestsAntigen":null,"fips":"31","positiveIncrease":1023,"negativeIncrease":1373,"total":866318,"totalTestResultsIncrease":12039,"posNeg":866318,"dataQualityGrade":null,"deathIncrease":-78,"hospitalizedIncrease":20,"hash":"cffc83d3bbc8e6576225bdbdc45ac0cda9ca84c3","commercialScore":0,"negativeRegularScore":0,"negativeScore":0,"positiveScore":0,"score":0,"grade":""},{"date":20210108,"state":"NE","positive":173591,"probableCases":null,"negative":690331,"pending":null,"totalTestResultsSource":"totalTestsViral","totalTestResults":1825632,"hospitalizedCurrently":491,"hospitalizedCumulative":5414,"inIcuCurrently":null,"inIcuCumulative":null,"onVentilatorCurrently":null,"onVentilatorCumulative":null,"recovered":117589,"lastUpdateEt":"1/7/2021 21:45","dateModified":"2021-01-07T21:45:00Z","checkTimeEt":"01/07 16:45","death":1811,"hospitalized":5414,"hospitalizedDischarged":null,"dateChecked":"2021-01-07T21:45:00Z","totalTestsViral":1825632,"positiveTestsViral":199599,"negativeTestsViral":1624042,"positiveCasesViral":null,"deathConfirmed":null,"deathProbable":null,"totalTestEncountersViral":null,"totalTestsPeopleViral":864342,"totalTestsAntibody":null,"positiveTestsAntibody":null,"negativeTestsAntibody":null,"totalTestsPeopleAntibody":null,"positiveTestsPeopleAntibody":null,"negativeTestsPeopleAntibody":null,"totalTestsPeopleAntigen":null,"positiveTestsPeopleAntigen":null,"totalTestsAntigen":null,"positiveTestsAntigen":null,"fips":"31","positiveIncrease":1122,"negativeIncrease":2038,"total":863922,"totalTestResultsIncrease":12110,"posNeg":863922,"dataQualityGrade":null,"deathIncrease":108,"hospitalizedIncrease":28,"hash":"7b1c711f2f433e89a3ba8dab61a2801fd9081ed4","commercialScore":0,"negativeRegularScore":0,"negativeScore":0,"positiveScore":0,"score":0,"grade":""},{"date":20210107,"state":"NE","positive":172469,"probableCases":null,"negative":688293,"pending":null,"totalTestResultsSource":"totalTestsViral","totalTestResults":1813522,"hospitalizedCurrently":506,"hospitalizedCumulative":5386,"inIcuCurrently":null,"inIcuCumulative":null,"onVentilatorCurrently":null,"onVentilatorCumulative":null,"recovered":116295,"lastUpdateEt":"1/6/2021 22:15","dateModified":"2021-01-06T22:15:00Z","checkTimeEt":"01/06 17:15","death":1703,"hospitalized":5386,"hospitalizedDischarged":null,"dateChecked":"2021-01-06T22:15:00Z","totalTestsViral":1813522,"positiveTestsViral":198164,"negativeTestsViral":1613363,"positiveCasesViral":null,"deathConfirmed":null,"deathProbable":null,"totalTestEncountersViral":null,"totalTestsPeopleViral":861182,"totalTestsAntibody":null,"positiveTestsAntibody":null,"negativeTestsAntibody":null,"totalTestsPeopleAntibody":null,"positiveTestsPeopleAntibody":null,"negativeTestsPeopleAntibody":null,"totalTestsPeopleAntigen":null,"positiveTestsPeopleAntigen":null,"totalTestsAntigen":null,"positiveTestsAntigen":null,"fips":"31","positiveIncrease":1436,"negativeIncrease":1952,"total":860762,"totalTestResultsIncrease":17840,"posNeg":860762,"dataQualityGrade":null,"deathIncrease":11,"hospitalizedIncrease":28,"hash":"738eb915baab1917cb679379b52cba5849f95e0e","commercialScore":0,"negativeRegularScore":0,"negativeScore":0,"positiveScore":0,"score":0,"grade":""},{"date":20210106,"state":"NE","positive":171033,"probableCases":null,"negative":686341,"pending":null,"totalTestResultsSource":"totalTestsViral","totalTestResults":1795682,"hospitalizedCurrently":515,"hospitalizedCumulative":5358,"inIcuCurrently":null,"inIcuCumulative":null,"onVentilatorCurrently":null,"onVentilatorCumulative":null,"recovered":114249,"lastUpdateEt":"1/5/2021 22:15","dateModified":"2021-01-05T22:15:00Z","checkTimeEt":"01/05 17:15","death":1692,"hospitalized":5358,"hospitalizedDischarged":null,"dateChecked":"2021-01-05T22:15:00Z","totalTestsViral":1795682,"positiveTestsViral":196373,"negativeTestsViral":1597330,"positiveCasesViral":null,"deathConfirmed":null,"deathProbable":null,"totalTestEncountersViral":null,"totalTestsPeopleViral":857789,"totalTestsAntibody":null,"positiveTestsAntibody":null,"negativeTestsAntibody":null,"totalTestsPeopleAntibody":null,"positiveTestsPeopleAntibody":null,"negativeTestsPeopleAntibody":null,"totalTestsPeopleAntigen":null,"positiveTestsPeopleAntigen":null,"totalTestsAntigen":null,"positiveTestsAntigen":null,"fips":"31","positiveIncrease":1448,"negativeIncrease":1626,"total":857374,"totalTestResultsIncrease":13885,"posNeg":857374,"dataQualityGrade":null,"deathIncrease":10,"hospitalizedIncrease":37,"hash":"17ac3cd7ff1fd33c05443442ba4debb84e5832be","commercialScore":0,"negativeRegularScore":0,"negativeScore":0,"positiveScore":0,"score":0,"grade":""},{"date":20210105,"state":"NE","positive":169585,"probableCases":null,"negative":684715,"pending":null,"totalTestResultsSource":"totalTestsViral","totalTestResults":1781797,"hospitalizedCurrently":527,"hospitalizedCumulative":5321,"inIcuCurrently":null,"inIcuCumulative":null,"onVentilatorCurrently":null,"onVentilatorCumulative":null,"recovered":114249,"lastUpdateEt":"1/4/2021 21:45","dateModified":"2021-01-04T21:45:00Z","checkTimeEt":"01/04 16:45","death":1682,"hospitalized":5321,"hospitalizedDischarged":null,"dateChecked":"2021-01-04T21:45:00Z","totalTestsViral":1781797,"positiveTestsViral":194614,"negativeTestsViral":1585220,"positiveCasesViral":null,"deathConfirmed":null,"deathProbable":null,"totalTestEncountersViral":null,"totalTestsPeopleViral":854716,"totalTestsAntibody":null,"positiveTestsAntibody":null,"negativeTestsAntibody":null,"totalTestsPeopleAntibody":null,"positiveTestsPeopleAntibody":null,"negativeTestsPeopleAntibody":null,"totalTestsPeopleAntigen":null,"positiveTestsPeopleAntigen":null,"totalTestsAntigen":null,"positiveTestsAntigen":null,"fips":"31","positiveIncrease":585,"negativeIncrease":645,"total":854300,"totalTestResultsIncrease":5889,"posNeg":854300,"dataQualityGrade":null,"deathIncrease":10,"hospitalizedIncrease":31,"hash":"2b7ba8c54bb27dbbd50aeefaca61ee3ea6d7903d","commercialScore":0,"negativeRegularScore":0,"negativeScore":0,"positiveScore":0,"score":0,"grade":""},{"date":20210104,"state":"NE","positive":169000,"probableCases":null,"negative":684070,"pending":null,"totalTestResultsSource":"totalTestsViral","totalTestResults":1775908,"hospitalizedCurrently":511,"hospitalizedCumulative":5290,"inIcuCurrently":null,"inIcuCumulative":null,"onVentilatorCurrently":null,"onVentilatorCumulative":null,"recovered":112856,"lastUpdateEt":"1/3/2021 22:00","dateModified":"2021-01-03T22:00:00Z","checkTimeEt":"01/03 17:00","death":1672,"hospitalized":5290,"hospitalizedDischarged":null,"dateChecked":"2021-01-03T22:00:00Z","totalTestsViral":1775908,"positiveTestsViral":193920,"negativeTestsViral":1580032,"positiveCasesViral":null,"deathConfirmed":null,"deathProbable":null,"totalTestEncountersViral":null,"totalTestsPeopleViral":853485,"totalTestsAntibody":null,"positiveTestsAntibody":null,"negativeTestsAntibody":null,"totalTestsPeopleAntibody":null,"positiveTestsPeopleAntibody":null,"negativeTestsPeopleAntibody":null,"totalTestsPeopleAntigen":null,"positiveTestsPeopleAntigen":null,"totalTestsAntigen":null,"positiveTestsAntigen":null,"fips":"31","positiveIncrease":738,"negativeIncrease":1038,"total":853070,"totalTestResultsIncrease":6110,"posNeg":853070,"dataQualityGrade":null,"deathIncrease":3,"hospitalizedIncrease":20,"hash":"9ff91b224f1897f2795336c6fba0437e36551434","commercialScore":0,"negativeRegularScore":0,"negativeScore":0,"positiveScore":0,"score":0,"grade":""},{"date":20210103,"state":"NE","positive":168262,"probableCases":null,"negative":683032,"pending":null,"totalTestResultsSource":"totalTestsViral","totalTestResults":1769798,"hospitalizedCurrently":503,"hospitalizedCumulative":5270,"inIcuCurrently":null,"inIcuCumulative":null,"onVentilatorCurrently":null,"onVentilatorCumulative":null,"recovered":105963,"lastUpdateEt":"1/2/2021 23:00","dateModified":"2021-01-02T23:00:00Z","checkTimeEt":"01/02 18:00","death":1669,"hospitalized":5270,"hospitalizedDischarged":null,"dateChecked":"2021-01-02T23:00:00Z","totalTestsViral":1769798,"positiveTestsViral":193046,"negativeTestsViral":1574795,"positiveCasesViral":null,"deathConfirmed":null,"deathProbable":null,"totalTestEncountersViral":null,"totalTestsPeopleViral":851704,"totalTestsAntibody":null,"positiveTestsAntibody":null,"negativeTestsAntibody":null,"totalTestsPeopleAntibody":null,"positiveTestsPeopleAntibody":null,"negativeTestsPeopleAntibody":null,"totalTestsPeopleAntigen":null,"positiveTestsPeopleAntigen":null,"totalTestsAntigen":null,"positiveTestsAntigen":null,"fips":"31","positiveIncrease":546,"negativeIncrease":795,"total":851294,"totalTestResultsIncrease":3694,"posNeg":851294,"dataQualityGrade":null,"deathIncrease":1,"hospitalizedIncrease":5,"hash":"96284760a559c176b99d946d1cebab1bd2ba95f7","commercialScore":0,"negativeRegularScore":0,"negativeScore":0,"positiveScore":0,"score":0,"grade":""},{"date":20210102,"state":"NE","positive":167716,"probableCases":null,"negative":682237,"pending":null,"totalTestResultsSource":"totalTestsViral","totalTestResults":1766104,"hospitalizedCurrently":517,"hospitalizedCumulative":5265,"inIcuCurrently":null,"inIcuCumulative":null,"onVentilatorCurrently":null,"onVentilatorCumulative":null,"recovered":109705,"lastUpdateEt":"1/1/2021 21:30","dateModified":"2021-01-01T21:30:00Z","checkTimeEt":"01/01 16:30","death":1668,"hospitalized":5265,"hospitalizedDischarged":null,"dateChecked":"2021-01-01T21:30:00Z","totalTestsViral":1766104,"positiveTestsViral":192429,"negativeTestsViral":1571723,"positiveCasesViral":null,"deathConfirmed":null,"deathProbable":null,"totalTestEncountersViral":null,"totalTestsPeopleViral":850362,"totalTestsAntibody":null,"positiveTestsAntibody":null,"negativeTestsAntibody":null,"totalTestsPeopleAntibody":null,"positiveTestsPeopleAntibody":null,"negativeTestsPeopleAntibody":null,"totalTestsPeopleAntigen":null,"positiveTestsPeopleAntigen":null,"totalTestsAntigen":null,"positiveTestsAntigen":null,"fips":"31","positiveIncrease":918,"negativeIncrease":1378,"total":849953,"totalTestResultsIncrease":10284,"posNeg":849953,"dataQualityGrade":null,"deathIncrease":17,"hospitalizedIncrease":11,"hash":"77c76702d2d90efc6cc0e67acc12d88a49f3f1d1","commercialScore":0,"negativeRegularScore":0,"negativeScore":0,"positiveScore":0,"score":0,"grade":""},{"date":20210101,"state":"NE","positive":166798,"probableCases":null,"negative":680859,"pending":null,"totalTestResultsSource":"totalTestsViral","totalTestResults":1755820,"hospitalizedCurrently":534,"hospitalizedCumulative":5254,"inIcuCurrently":null,"inIcuCumulative":null,"onVentilatorCurrently":null,"onVentilatorCumulative":null,"recovered":107694,"lastUpdateEt":"12/31/2020 21:30","dateModified":"2020-12-31T21:30:00Z","checkTimeEt":"12/31 16:30","death":1651,"hospitalized":5254,"hospitalizedDischarged":null,"dateChecked":"2020-12-31T21:30:00Z","totalTestsViral":1755820,"positiveTestsViral":191386,"negativeTestsViral":1562488,"positiveCasesViral":null,"deathConfirmed":null,"deathProbable":null,"totalTestEncountersViral":null,"totalTestsPeopleViral":848067,"totalTestsAntibody":null,"positiveTestsAntibody":null,"negativeTestsAntibody":null,"totalTestsPeopleAntibody":null,"positiveTestsPeopleAntibody":null,"negativeTestsPeopleAntibody":null,"totalTestsPeopleAntigen":null,"positiveTestsPeopleAntigen":null,"totalTestsAntigen":null,"positiveTestsAntigen":null,"fips":"31","positiveIncrease":1501,"negativeIncrease":1624,"total":847657,"totalTestResultsIncrease":12101,"posNeg":847657,"dataQualityGrade":null,"deathIncrease":40,"hospitalizedIncrease":34,"hash":"872a86b693f159f093dfaf9b637aa9c339d762a6","commercialScore":0,"negativeRegularScore":0,"negativeScore":0,"positiveScore":0,"score":0,"grade":""},{"date":20201231,"state":"NE","positive":165297,"probableCases":null,"negative":679235,"pending":null,"totalTestResultsSource":"totalTestsViral","totalTestResults":1743719,"hospitalizedCurrently":544,"hospitalizedCumulative":5220,"inIcuCurrently":null,"inIcuCumulative":null,"onVentilatorCurrently":null,"onVentilatorCumulative":null,"recovered":105574,"lastUpdateEt":"12/30/2020 21:30","dateModified":"2020-12-30T21:30:00Z","checkTimeEt":"12/30 16:30","death":1611,"hospitalized":5220,"hospitalizedDischarged":null,"dateChecked":"2020-12-30T21:30:00Z","totalTestsViral":1743719,"positiveTestsViral":189628,"negativeTestsViral":1552166,"positiveCasesViral":null,"deathConfirmed":null,"deathProbable":null,"totalTestEncountersViral":null,"totalTestsPeopleViral":844942,"totalTestsAntibody":null,"positiveTestsAntibody":null,"negativeTestsAntibody":null,"totalTestsPeopleAntibody":null,"positiveTestsPeopleAntibody":null,"negativeTestsPeopleAntibody":null,"totalTestsPeopleAntigen":null,"positiveTestsPeopleAntigen":null,"totalTestsAntigen":null,"positiveTestsAntigen":null,"fips":"31","positiveIncrease":1516,"negativeIncrease":2224,"total":844532,"totalTestResultsIncrease":17389,"posNeg":844532,"dataQualityGrade":null,"deathIncrease":8,"hospitalizedIncrease":33,"hash":"28cff1803187659bd68cf9c63cef042ee131f991","commercialScore":0,"negativeRegularScore":0,"negativeScore":0,"positiveScore":0,"score":0,"grade":""},{"date":20201230,"state":"NE","positive":163781,"probableCases":null,"negative":677011,"pending":null,"totalTestResultsSource":"totalTestsViral","totalTestResults":1726330,"hospitalizedCurrently":517,"hospitalizedCumulative":5187,"inIcuCurrently":null,"inIcuCumulative":null,"onVentilatorCurrently":null,"onVentilatorCumulative":null,"recovered":105135,"lastUpdateEt":"12/29/2020 22:00","dateModified":"2020-12-29T22:00:00Z","checkTimeEt":"12/29 17:00","death":1603,"hospitalized":5187,"hospitalizedDischarged":null,"dateChecked":"2020-12-29T22:00:00Z","totalTestsViral":1726330,"positiveTestsViral":187806,"negativeTestsViral":1536623,"positiveCasesViral":null,"deathConfirmed":null,"deathProbable":null,"totalTestEncountersViral":null,"totalTestsPeopleViral":841203,"totalTestsAntibody":null,"positiveTestsAntibody":null,"negativeTestsAntibody":null,"totalTestsPeopleAntibody":null,"positiveTestsPeopleAntibody":null,"negativeTestsPeopleAntibody":null,"totalTestsPeopleAntigen":null,"positiveTestsPeopleAntigen":null,"totalTestsAntigen":null,"positiveTestsAntigen":null,"fips":"31","positiveIncrease":932,"negativeIncrease":1062,"total":840792,"totalTestResultsIncrease":8847,"posNeg":840792,"dataQualityGrade":null,"deathIncrease":16,"hospitalizedIncrease":28,"hash":"5926d2b71d45e9c55e467d540610985204648e8c","commercialScore":0,"negativeRegularScore":0,"negativeScore":0,"positiveScore":0,"score":0,"grade":""},{"date":20201229,"state":"NE","positive":162849,"probableCases":null,"negative":675949,"pending":null,"totalTestResultsSource":"totalTestsViral","totalTestResults":1717483,"hospitalizedCurrently":534,"hospitalizedCumulative":5159,"inIcuCurrently":null,"inIcuCumulative":null,"onVentilatorCurrently":null,"onVentilatorCumulative":null,"recovered":103592,"lastUpdateEt":"12/28/2020 21:45","dateModified":"2020-12-28T21:45:00Z","checkTimeEt":"12/28 16:45","death":1587,"hospitalized":5159,"hospitalizedDischarged":null,"dateChecked":"2020-12-28T21:45:00Z","totalTestsViral":1717483,"positiveTestsViral":186686,"negativeTestsViral":1528896,"positiveCasesViral":null,"deathConfirmed":null,"deathProbable":null,"totalTestEncountersViral":null,"totalTestsPeopleViral":839207,"totalTestsAntibody":null,"positiveTestsAntibody":null,"negativeTestsAntibody":null,"totalTestsPeopleAntibody":null,"positiveTestsPeopleAntibody":null,"negativeTestsPeopleAntibody":null,"totalTestsPeopleAntigen":null,"positiveTestsPeopleAntigen":null,"totalTestsAntigen":null,"positiveTestsAntigen":null,"fips":"31","positiveIncrease":875,"negativeIncrease":1644,"total":838798,"totalTestResultsIncrease":11881,"posNeg":838798,"dataQualityGrade":null,"deathIncrease":28,"hospitalizedIncrease":51,"hash":"6cece4c4bc60c4dbdea8485e479bb43efe2f0f9d","commercialScore":0,"negativeRegularScore":0,"negativeScore":0,"positiveScore":0,"score":0,"grade":""},{"date":20201228,"state":"NE","positive":161974,"probableCases":null,"negative":674305,"pending":null,"totalTestResultsSource":"totalTestsViral","totalTestResults":1705602,"hospitalizedCurrently":527,"hospitalizedCumulative":5108,"inIcuCurrently":null,"inIcuCumulative":null,"onVentilatorCurrently":null,"onVentilatorCumulative":null,"recovered":102169,"lastUpdateEt":"12/27/2020 21:15","dateModified":"2020-12-27T21:15:00Z","checkTimeEt":"12/27 16:15","death":1559,"hospitalized":5108,"hospitalizedDischarged":null,"dateChecked":"2020-12-27T21:15:00Z","totalTestsViral":1705602,"positiveTestsViral":185515,"negativeTestsViral":1518201,"positiveCasesViral":null,"deathConfirmed":null,"deathProbable":null,"totalTestEncountersViral":null,"totalTestsPeopleViral":836688,"totalTestsAntibody":null,"positiveTestsAntibody":null,"negativeTestsAntibody":null,"totalTestsPeopleAntibody":null,"positiveTestsPeopleAntibody":null,"negativeTestsPeopleAntibody":null,"totalTestsPeopleAntigen":null,"positiveTestsPeopleAntigen":null,"totalTestsAntigen":null,"positiveTestsAntigen":null,"fips":"31","positiveIncrease":637,"negativeIncrease":857,"total":836279,"totalTestResultsIncrease":4424,"posNeg":836279,"dataQualityGrade":null,"deathIncrease":0,"hospitalizedIncrease":4,"hash":"3e652279231092fba0a50b2f8bf0c8e77ea5e1a7","commercialScore":0,"negativeRegularScore":0,"negativeScore":0,"positiveScore":0,"score":0,"grade":""},{"date":20201227,"state":"NE","positive":161337,"probableCases":null,"negative":673448,"pending":null,"totalTestResultsSource":"totalTestsViral","totalTestResults":1701178,"hospitalizedCurrently":503,"hospitalizedCumulative":5104,"inIcuCurrently":null,"inIcuCumulative":null,"onVentilatorCurrently":null,"onVentilatorCumulative":null,"recovered":102012,"lastUpdateEt":"12/26/2020 21:15","dateModified":"2020-12-26T21:15:00Z","checkTimeEt":"12/26 16:15","death":1559,"hospitalized":5104,"hospitalizedDischarged":null,"dateChecked":"2020-12-26T21:15:00Z","totalTestsViral":1701178,"positiveTestsViral":184851,"negativeTestsViral":1514442,"positiveCasesViral":null,"deathConfirmed":null,"deathProbable":null,"totalTestEncountersViral":null,"totalTestsPeopleViral":835194,"totalTestsAntibody":null,"positiveTestsAntibody":null,"negativeTestsAntibody":null,"totalTestsPeopleAntibody":null,"positiveTestsPeopleAntibody":null,"negativeTestsPeopleAntibody":null,"totalTestsPeopleAntigen":null,"positiveTestsPeopleAntigen":null,"tot