[{"date":20210307,"state":"VI","positive":2714,"probableCases":null,"negative":46167,"pending":80,"totalTestResultsSource":"posNeg","totalTestResults":48881,"hospitalizedCurrently":null,"hospitalizedCumulative":null,"inIcuCurrently":null,"inIcuCumulative":null,"onVentilatorCurrently":null,"onVentilatorCumulative":null,"recovered":2559,"lastUpdateEt":"3/5/2021 11:18","dateModified":"2021-03-05T11:18:00Z","checkTimeEt":"03/05 06:18","death":25,"hospitalized":null,"hospitalizedDischarged":null,"dateChecked":"2021-03-05T11:18:00Z","totalTestsViral":null,"positiveTestsViral":null,"negativeTestsViral":null,"positiveCasesViral":null,"deathConfirmed":25,"deathProbable":null,"totalTestEncountersViral":null,"totalTestsPeopleViral":48961,"totalTestsAntibody":null,"positiveTestsAntibody":null,"negativeTestsAntibody":null,"totalTestsPeopleAntibody":null,"positiveTestsPeopleAntibody":null,"negativeTestsPeopleAntibody":null,"totalTestsPeopleAntigen":null,"positiveTestsPeopleAntigen":null,"totalTestsAntigen":null,"positiveTestsAntigen":null,"fips":"78","positiveIncrease":0,"negativeIncrease":0,"total":48961,"totalTestResultsIncrease":0,"posNeg":48881,"dataQualityGrade":null,"deathIncrease":0,"hospitalizedIncrease":0,"hash":"af836e98493cc7b5474acf9302ffe87d9568a0db","commercialScore":0,"negativeRegularScore":0,"negativeScore":0,"positiveScore":0,"score":0,"grade":""},{"date":20210306,"state":"VI","positive":2714,"probableCases":null,"negative":46167,"pending":80,"totalTestResultsSource":"posNeg","totalTestResults":48881,"hospitalizedCurrently":null,"hospitalizedCumulative":null,"inIcuCurrently":null,"inIcuCumulative":null,"onVentilatorCurrently":null,"onVentilatorCumulative":null,"recovered":2559,"lastUpdateEt":"3/5/2021 11:18","dateModified":"2021-03-05T11:18:00Z","checkTimeEt":"03/05 06:18","death":25,"hospitalized":null,"hospitalizedDischarged":null,"dateChecked":"2021-03-05T11:18:00Z","totalTestsViral":null,"positiveTestsViral":null,"negativeTestsViral":null,"positiveCasesViral":null,"deathConfirmed":25,"deathProbable":null,"totalTestEncountersViral":null,"totalTestsPeopleViral":48961,"totalTestsAntibody":null,"positiveTestsAntibody":null,"negativeTestsAntibody":null,"totalTestsPeopleAntibody":null,"positiveTestsPeopleAntibody":null,"negativeTestsPeopleAntibody":null,"totalTestsPeopleAntigen":null,"positiveTestsPeopleAntigen":null,"totalTestsAntigen":null,"positiveTestsAntigen":null,"fips":"78","positiveIncrease":0,"negativeIncrease":0,"total":48961,"totalTestResultsIncrease":0,"posNeg":48881,"dataQualityGrade":null,"deathIncrease":0,"hospitalizedIncrease":0,"hash":"afd522d5517ef21d3b309fcb1ccf68c4acc19d5c","commercialScore":0,"negativeRegularScore":0,"negativeScore":0,"positiveScore":0,"score":0,"grade":""},{"date":20210305,"state":"VI","positive":2714,"probableCases":null,"negative":46167,"pending":80,"totalTestResultsSource":"posNeg","totalTestResults":48881,"hospitalizedCurrently":null,"hospitalizedCumulative":null,"inIcuCurrently":null,"inIcuCumulative":null,"onVentilatorCurrently":null,"onVentilatorCumulative":null,"recovered":2559,"lastUpdateEt":"3/5/2021 11:18","dateModified":"2021-03-05T11:18:00Z","checkTimeEt":"03/05 06:18","death":25,"hospitalized":null,"hospitalizedDischarged":null,"dateChecked":"2021-03-05T11:18:00Z","totalTestsViral":null,"positiveTestsViral":null,"negativeTestsViral":null,"positiveCasesViral":null,"deathConfirmed":25,"deathProbable":null,"totalTestEncountersViral":null,"totalTestsPeopleViral":48961,"totalTestsAntibody":null,"positiveTestsAntibody":null,"negativeTestsAntibody":null,"totalTestsPeopleAntibody":null,"positiveTestsPeopleAntibody":null,"negativeTestsPeopleAntibody":null,"totalTestsPeopleAntigen":null,"positiveTestsPeopleAntigen":null,"totalTestsAntigen":null,"positiveTestsAntigen":null,"fips":"78","positiveIncrease":10,"negativeIncrease":160,"total":48961,"totalTestResultsIncrease":170,"posNeg":48881,"dataQualityGrade":null,"deathIncrease":0,"hospitalizedIncrease":0,"hash":"a9ff53693c250087fce6e4c6849cebbae1de0a2d","commercialScore":0,"negativeRegularScore":0,"negativeScore":0,"positiveScore":0,"score":0,"grade":""},{"date":20210304,"state":"VI","positive":2704,"probableCases":null,"negative":46007,"pending":113,"totalTestResultsSource":"posNeg","totalTestResults":48711,"hospitalizedCurrently":null,"hospitalizedCumulative":null,"inIcuCurrently":null,"inIcuCumulative":null,"onVentilatorCurrently":null,"onVentilatorCumulative":null,"recovered":2547,"lastUpdateEt":"3/4/2021 08:58","dateModified":"2021-03-04T08:58:00Z","checkTimeEt":"03/04 03:58","death":25,"hospitalized":null,"hospitalizedDischarged":null,"dateChecked":"2021-03-04T08:58:00Z","totalTestsViral":null,"positiveTestsViral":null,"negativeTestsViral":null,"positiveCasesViral":null,"deathConfirmed":25,"deathProbable":null,"totalTestEncountersViral":null,"totalTestsPeopleViral":48824,"totalTestsAntibody":null,"positiveTestsAntibody":null,"negativeTestsAntibody":null,"totalTestsPeopleAntibody":null,"positiveTestsPeopleAntibody":null,"negativeTestsPeopleAntibody":null,"totalTestsPeopleAntigen":null,"positiveTestsPeopleAntigen":null,"totalTestsAntigen":null,"positiveTestsAntigen":null,"fips":"78","positiveIncrease":9,"negativeIncrease":166,"total":48824,"totalTestResultsIncrease":175,"posNeg":48711,"dataQualityGrade":null,"deathIncrease":0,"hospitalizedIncrease":0,"hash":"a12db4148b039b019b1b9100b2272ec8275ee1e2","commercialScore":0,"negativeRegularScore":0,"negativeScore":0,"positiveScore":0,"score":0,"grade":""},{"date":20210303,"state":"VI","positive":2695,"probableCases":null,"negative":45841,"pending":107,"totalTestResultsSource":"posNeg","totalTestResults":48536,"hospitalizedCurrently":null,"hospitalizedCumulative":null,"inIcuCurrently":null,"inIcuCumulative":null,"onVentilatorCurrently":null,"onVentilatorCumulative":null,"recovered":2539,"lastUpdateEt":"3/3/2021 10:33","dateModified":"2021-03-03T10:33:00Z","checkTimeEt":"03/03 05:33","death":25,"hospitalized":null,"hospitalizedDischarged":null,"dateChecked":"2021-03-03T10:33:00Z","totalTestsViral":null,"positiveTestsViral":null,"negativeTestsViral":null,"positiveCasesViral":null,"deathConfirmed":25,"deathProbable":null,"totalTestEncountersViral":null,"totalTestsPeopleViral":48643,"totalTestsAntibody":null,"positiveTestsAntibody":null,"negativeTestsAntibody":null,"totalTestsPeopleAntibody":null,"positiveTestsPeopleAntibody":null,"negativeTestsPeopleAntibody":null,"totalTestsPeopleAntigen":null,"positiveTestsPeopleAntigen":null,"totalTestsAntigen":null,"positiveTestsAntigen":null,"fips":"78","positiveIncrease":49,"negativeIncrease":616,"total":48643,"totalTestResultsIncrease":665,"posNeg":48536,"dataQualityGrade":null,"deathIncrease":0,"hospitalizedIncrease":0,"hash":"c53e5637a136a00c54f40fa15990619fc36360e4","commercialScore":0,"negativeRegularScore":0,"negativeScore":0,"positiveScore":0,"score":0,"grade":""},{"date":20210302,"state":"VI","positive":2646,"probableCases":null,"negative":45225,"pending":110,"totalTestResultsSource":"posNeg","totalTestResults":47871,"hospitalizedCurrently":null,"hospitalizedCumulative":null,"inIcuCurrently":null,"inIcuCumulative":null,"onVentilatorCurrently":null,"onVentilatorCumulative":null,"recovered":2511,"lastUpdateEt":"2/27/2021 12:37","dateModified":"2021-02-27T12:37:00Z","checkTimeEt":"02/27 07:37","death":25,"hospitalized":null,"hospitalizedDischarged":null,"dateChecked":"2021-02-27T12:37:00Z","totalTestsViral":null,"positiveTestsViral":null,"negativeTestsViral":null,"positiveCasesViral":null,"deathConfirmed":null,"deathProbable":null,"totalTestEncountersViral":null,"totalTestsPeopleViral":47981,"totalTestsAntibody":null,"positiveTestsAntibody":null,"negativeTestsAntibody":null,"totalTestsPeopleAntibody":null,"positiveTestsPeopleAntibody":null,"negativeTestsPeopleAntibody":null,"totalTestsPeopleAntigen":null,"positiveTestsPeopleAntigen":null,"totalTestsAntigen":null,"positiveTestsAntigen":null,"fips":"78","positiveIncrease":0,"negativeIncrease":0,"total":47981,"totalTestResultsIncrease":0,"posNeg":47871,"dataQualityGrade":null,"deathIncrease":0,"hospitalizedIncrease":0,"hash":"682f2e6f67f441c76579d6b5565382ff85bec546","commercialScore":0,"negativeRegularScore":0,"negativeScore":0,"positiveScore":0,"score":0,"grade":""},{"date":20210301,"state":"VI","positive":2646,"probableCases":null,"negative":45225,"pending":110,"totalTestResultsSource":"posNeg","totalTestResults":47871,"hospitalizedCurrently":null,"hospitalizedCumulative":null,"inIcuCurrently":null,"inIcuCumulative":null,"onVentilatorCurrently":null,"onVentilatorCumulative":null,"recovered":2511,"lastUpdateEt":"2/27/2021 12:37","dateModified":"2021-02-27T12:37:00Z","checkTimeEt":"02/27 07:37","death":25,"hospitalized":null,"hospitalizedDischarged":null,"dateChecked":"2021-02-27T12:37:00Z","totalTestsViral":null,"positiveTestsViral":null,"negativeTestsViral":null,"positiveCasesViral":null,"deathConfirmed":null,"deathProbable":null,"totalTestEncountersViral":null,"totalTestsPeopleViral":47981,"totalTestsAntibody":null,"positiveTestsAntibody":null,"negativeTestsAntibody":null,"totalTestsPeopleAntibody":null,"positiveTestsPeopleAntibody":null,"negativeTestsPeopleAntibody":null,"totalTestsPeopleAntigen":null,"positiveTestsPeopleAntigen":null,"totalTestsAntigen":null,"positiveTestsAntigen":null,"fips":"78","positiveIncrease":0,"negativeIncrease":0,"total":47981,"totalTestResultsIncrease":0,"posNeg":47871,"dataQualityGrade":null,"deathIncrease":0,"hospitalizedIncrease":0,"hash":"c013be53f06008cac7fa986e67476d8e5162f0e0","commercialScore":0,"negativeRegularScore":0,"negativeScore":0,"positiveScore":0,"score":0,"grade":""},{"date":20210228,"state":"VI","positive":2646,"probableCases":null,"negative":45225,"pending":110,"totalTestResultsSource":"posNeg","totalTestResults":47871,"hospitalizedCurrently":null,"hospitalizedCumulative":null,"inIcuCurrently":null,"inIcuCumulative":null,"onVentilatorCurrently":null,"onVentilatorCumulative":null,"recovered":2511,"lastUpdateEt":"2/27/2021 12:37","dateModified":"2021-02-27T12:37:00Z","checkTimeEt":"02/27 07:37","death":25,"hospitalized":null,"hospitalizedDischarged":null,"dateChecked":"2021-02-27T12:37:00Z","totalTestsViral":null,"positiveTestsViral":null,"negativeTestsViral":null,"positiveCasesViral":null,"deathConfirmed":null,"deathProbable":null,"totalTestEncountersViral":null,"totalTestsPeopleViral":47981,"totalTestsAntibody":null,"positiveTestsAntibody":null,"negativeTestsAntibody":null,"totalTestsPeopleAntibody":null,"positiveTestsPeopleAntibody":null,"negativeTestsPeopleAntibody":null,"totalTestsPeopleAntigen":null,"positiveTestsPeopleAntigen":null,"totalTestsAntigen":null,"positiveTestsAntigen":null,"fips":"78","positiveIncrease":0,"negativeIncrease":0,"total":47981,"totalTestResultsIncrease":0,"posNeg":47871,"dataQualityGrade":null,"deathIncrease":0,"hospitalizedIncrease":0,"hash":"0fa25653dbef26eb783de61b6a8fbfd51a7524f0","commercialScore":0,"negativeRegularScore":0,"negativeScore":0,"positiveScore":0,"score":0,"grade":""},{"date":20210227,"state":"VI","positive":2646,"probableCases":null,"negative":45225,"pending":110,"totalTestResultsSource":"posNeg","totalTestResults":47871,"hospitalizedCurrently":null,"hospitalizedCumulative":null,"inIcuCurrently":null,"inIcuCumulative":null,"onVentilatorCurrently":null,"onVentilatorCumulative":null,"recovered":2511,"lastUpdateEt":"2/27/2021 12:37","dateModified":"2021-02-27T12:37:00Z","checkTimeEt":"02/27 07:37","death":25,"hospitalized":null,"hospitalizedDischarged":null,"dateChecked":"2021-02-27T12:37:00Z","totalTestsViral":null,"positiveTestsViral":null,"negativeTestsViral":null,"positiveCasesViral":null,"deathConfirmed":null,"deathProbable":null,"totalTestEncountersViral":null,"totalTestsPeopleViral":47981,"totalTestsAntibody":null,"positiveTestsAntibody":null,"negativeTestsAntibody":null,"totalTestsPeopleAntibody":null,"positiveTestsPeopleAntibody":null,"negativeTestsPeopleAntibody":null,"totalTestsPeopleAntigen":null,"positiveTestsPeopleAntigen":null,"totalTestsAntigen":null,"positiveTestsAntigen":null,"fips":"78","positiveIncrease":10,"negativeIncrease":151,"total":47981,"totalTestResultsIncrease":161,"posNeg":47871,"dataQualityGrade":null,"deathIncrease":0,"hospitalizedIncrease":0,"hash":"690f3e9a4e8faa268815a736d67275a03741cfc0","commercialScore":0,"negativeRegularScore":0,"negativeScore":0,"positiveScore":0,"score":0,"grade":""},{"date":20210226,"state":"VI","positive":2636,"probableCases":null,"negative":45074,"pending":103,"totalTestResultsSource":"posNeg","totalTestResults":47710,"hospitalizedCurrently":null,"hospitalizedCumulative":null,"inIcuCurrently":null,"inIcuCumulative":null,"onVentilatorCurrently":null,"onVentilatorCumulative":null,"recovered":2501,"lastUpdateEt":"2/26/2021 00:07","dateModified":"2021-02-26T00:07:00Z","checkTimeEt":"02/25 19:07","death":25,"hospitalized":null,"hospitalizedDischarged":null,"dateChecked":"2021-02-26T00:07:00Z","totalTestsViral":null,"positiveTestsViral":null,"negativeTestsViral":null,"positiveCasesViral":null,"deathConfirmed":null,"deathProbable":null,"totalTestEncountersViral":null,"totalTestsPeopleViral":47813,"totalTestsAntibody":null,"positiveTestsAntibody":null,"negativeTestsAntibody":null,"totalTestsPeopleAntibody":null,"positiveTestsPeopleAntibody":null,"negativeTestsPeopleAntibody":null,"totalTestsPeopleAntigen":null,"positiveTestsPeopleAntigen":null,"totalTestsAntigen":null,"positiveTestsAntigen":null,"fips":"78","positiveIncrease":13,"negativeIncrease":424,"total":47813,"totalTestResultsIncrease":437,"posNeg":47710,"dataQualityGrade":null,"deathIncrease":0,"hospitalizedIncrease":0,"hash":"30b278f08ced5ec8006a5ad6c8a16b4e3ceeca49","commercialScore":0,"negativeRegularScore":0,"negativeScore":0,"positiveScore":0,"score":0,"grade":""},{"date":20210225,"state":"VI","positive":2623,"probableCases":null,"negative":44650,"pending":102,"totalTestResultsSource":"posNeg","totalTestResults":47273,"hospitalizedCurrently":null,"hospitalizedCumulative":null,"inIcuCurrently":null,"inIcuCumulative":null,"onVentilatorCurrently":null,"onVentilatorCumulative":null,"recovered":2497,"lastUpdateEt":"2/25/2021 06:23","dateModified":"2021-02-25T06:23:00Z","checkTimeEt":"02/25 01:23","death":25,"hospitalized":null,"hospitalizedDischarged":null,"dateChecked":"2021-02-25T06:23:00Z","totalTestsViral":null,"positiveTestsViral":null,"negativeTestsViral":null,"positiveCasesViral":null,"deathConfirmed":null,"deathProbable":null,"totalTestEncountersViral":null,"totalTestsPeopleViral":47375,"totalTestsAntibody":null,"positiveTestsAntibody":null,"negativeTestsAntibody":null,"totalTestsPeopleAntibody":null,"positiveTestsPeopleAntibody":null,"negativeTestsPeopleAntibody":null,"totalTestsPeopleAntigen":null,"positiveTestsPeopleAntigen":null,"totalTestsAntigen":null,"positiveTestsAntigen":null,"fips":"78","positiveIncrease":10,"negativeIncrease":284,"total":47375,"totalTestResultsIncrease":294,"posNeg":47273,"dataQualityGrade":null,"deathIncrease":0,"hospitalizedIncrease":0,"hash":"bb0f69500dfe46c21d04dea737da6d35698779b8","commercialScore":0,"negativeRegularScore":0,"negativeScore":0,"positiveScore":0,"score":0,"grade":""},{"date":20210224,"state":"VI","positive":2613,"probableCases":null,"negative":44366,"pending":117,"totalTestResultsSource":"posNeg","totalTestResults":46979,"hospitalizedCurrently":null,"hospitalizedCumulative":null,"inIcuCurrently":null,"inIcuCumulative":null,"onVentilatorCurrently":null,"onVentilatorCumulative":null,"recovered":2487,"lastUpdateEt":"2/24/2021 06:11","dateModified":"2021-02-24T06:11:00Z","checkTimeEt":"02/24 01:11","death":25,"hospitalized":null,"hospitalizedDischarged":null,"dateChecked":"2021-02-24T06:11:00Z","totalTestsViral":null,"positiveTestsViral":null,"negativeTestsViral":null,"positiveCasesViral":null,"deathConfirmed":null,"deathProbable":null,"totalTestEncountersViral":null,"totalTestsPeopleViral":47096,"totalTestsAntibody":null,"positiveTestsAntibody":null,"negativeTestsAntibody":null,"totalTestsPeopleAntibody":null,"positiveTestsPeopleAntibody":null,"negativeTestsPeopleAntibody":null,"totalTestsPeopleAntigen":null,"positiveTestsPeopleAntigen":null,"totalTestsAntigen":null,"positiveTestsAntigen":null,"fips":"78","positiveIncrease":24,"negativeIncrease":469,"total":47096,"totalTestResultsIncrease":493,"posNeg":46979,"dataQualityGrade":null,"deathIncrease":0,"hospitalizedIncrease":0,"hash":"c7481d350fe9f23d113fe31d24dddec402ddd394","commercialScore":0,"negativeRegularScore":0,"negativeScore":0,"positiveScore":0,"score":0,"grade":""},{"date":20210223,"state":"VI","positive":2589,"probableCases":null,"negative":43897,"pending":117,"totalTestResultsSource":"posNeg","totalTestResults":46486,"hospitalizedCurrently":null,"hospitalizedCumulative":null,"inIcuCurrently":null,"inIcuCumulative":null,"onVentilatorCurrently":null,"onVentilatorCumulative":null,"recovered":2483,"lastUpdateEt":"2/23/2021 09:57","dateModified":"2021-02-23T09:57:00Z","checkTimeEt":"02/23 04:57","death":25,"hospitalized":null,"hospitalizedDischarged":null,"dateChecked":"2021-02-23T09:57:00Z","totalTestsViral":null,"positiveTestsViral":null,"negativeTestsViral":null,"positiveCasesViral":null,"deathConfirmed":null,"deathProbable":null,"totalTestEncountersViral":null,"totalTestsPeopleViral":46603,"totalTestsAntibody":null,"positiveTestsAntibody":null,"negativeTestsAntibody":null,"totalTestsPeopleAntibody":null,"positiveTestsPeopleAntibody":null,"negativeTestsPeopleAntibody":null,"totalTestsPeopleAntigen":null,"positiveTestsPeopleAntigen":null,"totalTestsAntigen":null,"positiveTestsAntigen":null,"fips":"78","positiveIncrease":10,"negativeIncrease":204,"total":46603,"totalTestResultsIncrease":214,"posNeg":46486,"dataQualityGrade":null,"deathIncrease":0,"hospitalizedIncrease":0,"hash":"9f077af1cfb5bd52060bba9f01bdaec045b96d00","commercialScore":0,"negativeRegularScore":0,"negativeScore":0,"positiveScore":0,"score":0,"grade":""},{"date":20210222,"state":"VI","positive":2579,"probableCases":null,"negative":43693,"pending":108,"totalTestResultsSource":"posNeg","totalTestResults":46272,"hospitalizedCurrently":null,"hospitalizedCumulative":null,"inIcuCurrently":null,"inIcuCumulative":null,"onVentilatorCurrently":null,"onVentilatorCumulative":null,"recovered":2465,"lastUpdateEt":"2/22/2021 13:53","dateModified":"2021-02-22T13:53:00Z","checkTimeEt":"02/22 08:53","death":25,"hospitalized":null,"hospitalizedDischarged":null,"dateChecked":"2021-02-22T13:53:00Z","totalTestsViral":null,"positiveTestsViral":null,"negativeTestsViral":null,"positiveCasesViral":null,"deathConfirmed":null,"deathProbable":null,"totalTestEncountersViral":null,"totalTestsPeopleViral":46380,"totalTestsAntibody":null,"positiveTestsAntibody":null,"negativeTestsAntibody":null,"totalTestsPeopleAntibody":null,"positiveTestsPeopleAntibody":null,"negativeTestsPeopleAntibody":null,"totalTestsPeopleAntigen":null,"positiveTestsPeopleAntigen":null,"totalTestsAntigen":null,"positiveTestsAntigen":null,"fips":"78","positiveIncrease":4,"negativeIncrease":129,"total":46380,"totalTestResultsIncrease":133,"posNeg":46272,"dataQualityGrade":null,"deathIncrease":0,"hospitalizedIncrease":0,"hash":"723fe2629c9f7e97084e9c02cff1b31bb068a434","commercialScore":0,"negativeRegularScore":0,"negativeScore":0,"positiveScore":0,"score":0,"grade":""},{"date":20210221,"state":"VI","positive":2575,"probableCases":null,"negative":43564,"pending":108,"totalTestResultsSource":"posNeg","totalTestResults":46139,"hospitalizedCurrently":null,"hospitalizedCumulative":null,"inIcuCurrently":null,"inIcuCumulative":null,"onVentilatorCurrently":null,"onVentilatorCumulative":null,"recovered":2464,"lastUpdateEt":"2/19/2021 20:02","dateModified":"2021-02-19T20:02:00Z","checkTimeEt":"02/19 15:02","death":25,"hospitalized":null,"hospitalizedDischarged":null,"dateChecked":"2021-02-19T20:02:00Z","totalTestsViral":null,"positiveTestsViral":null,"negativeTestsViral":null,"positiveCasesViral":null,"deathConfirmed":null,"deathProbable":null,"totalTestEncountersViral":null,"totalTestsPeopleViral":46247,"totalTestsAntibody":null,"positiveTestsAntibody":null,"negativeTestsAntibody":null,"totalTestsPeopleAntibody":null,"positiveTestsPeopleAntibody":null,"negativeTestsPeopleAntibody":null,"totalTestsPeopleAntigen":null,"positiveTestsPeopleAntigen":null,"totalTestsAntigen":null,"positiveTestsAntigen":null,"fips":"78","positiveIncrease":0,"negativeIncrease":0,"total":46247,"totalTestResultsIncrease":0,"posNeg":46139,"dataQualityGrade":null,"deathIncrease":0,"hospitalizedIncrease":0,"hash":"0e0229fa87e321a5f1cafab23e332c4bdf8e2105","commercialScore":0,"negativeRegularScore":0,"negativeScore":0,"positiveScore":0,"score":0,"grade":""},{"date":20210220,"state":"VI","positive":2575,"probableCases":null,"negative":43564,"pending":108,"totalTestResultsSource":"posNeg","totalTestResults":46139,"hospitalizedCurrently":null,"hospitalizedCumulative":null,"inIcuCurrently":null,"inIcuCumulative":null,"onVentilatorCurrently":null,"onVentilatorCumulative":null,"recovered":2464,"lastUpdateEt":"2/19/2021 20:02","dateModified":"2021-02-19T20:02:00Z","checkTimeEt":"02/19 15:02","death":25,"hospitalized":null,"hospitalizedDischarged":null,"dateChecked":"2021-02-19T20:02:00Z","totalTestsViral":null,"positiveTestsViral":null,"negativeTestsViral":null,"positiveCasesViral":null,"deathConfirmed":null,"deathProbable":null,"totalTestEncountersViral":null,"totalTestsPeopleViral":46247,"totalTestsAntibody":null,"positiveTestsAntibody":null,"negativeTestsAntibody":null,"totalTestsPeopleAntibody":null,"positiveTestsPeopleAntibody":null,"negativeTestsPeopleAntibody":null,"totalTestsPeopleAntigen":null,"positiveTestsPeopleAntigen":null,"totalTestsAntigen":null,"positiveTestsAntigen":null,"fips":"78","positiveIncrease":10,"negativeIncrease":205,"total":46247,"totalTestResultsIncrease":215,"posNeg":46139,"dataQualityGrade":null,"deathIncrease":0,"hospitalizedIncrease":0,"hash":"7ca160663de572688bb23d17943b6f59863f5fd0","commercialScore":0,"negativeRegularScore":0,"negativeScore":0,"positiveScore":0,"score":0,"grade":""},{"date":20210219,"state":"VI","positive":2565,"probableCases":null,"negative":43359,"pending":108,"totalTestResultsSource":"posNeg","totalTestResults":45924,"hospitalizedCurrently":null,"hospitalizedCumulative":null,"inIcuCurrently":null,"inIcuCumulative":null,"onVentilatorCurrently":null,"onVentilatorCumulative":null,"recovered":2454,"lastUpdateEt":"2/19/2021 13:17","dateModified":"2021-02-19T13:17:00Z","checkTimeEt":"02/19 08:17","death":25,"hospitalized":null,"hospitalizedDischarged":null,"dateChecked":"2021-02-19T13:17:00Z","totalTestsViral":null,"positiveTestsViral":null,"negativeTestsViral":null,"positiveCasesViral":null,"deathConfirmed":null,"deathProbable":null,"totalTestEncountersViral":null,"totalTestsPeopleViral":46032,"totalTestsAntibody":null,"positiveTestsAntibody":null,"negativeTestsAntibody":null,"totalTestsPeopleAntibody":null,"positiveTestsPeopleAntibody":null,"negativeTestsPeopleAntibody":null,"totalTestsPeopleAntigen":null,"positiveTestsPeopleAntigen":null,"totalTestsAntigen":null,"positiveTestsAntigen":null,"fips":"78","positiveIncrease":7,"negativeIncrease":469,"total":46032,"totalTestResultsIncrease":476,"posNeg":45924,"dataQualityGrade":null,"deathIncrease":0,"hospitalizedIncrease":0,"hash":"f79468845d5f07ab79171410b98e2267b1d92181","commercialScore":0,"negativeRegularScore":0,"negativeScore":0,"positiveScore":0,"score":0,"grade":""},{"date":20210218,"state":"VI","positive":2558,"probableCases":null,"negative":42890,"pending":115,"totalTestResultsSource":"posNeg","totalTestResults":45448,"hospitalizedCurrently":null,"hospitalizedCumulative":null,"inIcuCurrently":null,"inIcuCumulative":null,"onVentilatorCurrently":null,"onVentilatorCumulative":null,"recovered":2448,"lastUpdateEt":"2/18/2020 09:48","dateModified":"2020-02-18T09:48:00Z","checkTimeEt":"02/18 04:48","death":25,"hospitalized":null,"hospitalizedDischarged":null,"dateChecked":"2020-02-18T09:48:00Z","totalTestsViral":null,"positiveTestsViral":null,"negativeTestsViral":null,"positiveCasesViral":null,"deathConfirmed":null,"deathProbable":null,"totalTestEncountersViral":null,"totalTestsPeopleViral":45563,"totalTestsAntibody":null,"positiveTestsAntibody":null,"negativeTestsAntibody":null,"totalTestsPeopleAntibody":null,"positiveTestsPeopleAntibody":null,"negativeTestsPeopleAntibody":null,"totalTestsPeopleAntigen":null,"positiveTestsPeopleAntigen":null,"totalTestsAntigen":null,"positiveTestsAntigen":null,"fips":"78","positiveIncrease":13,"negativeIncrease":166,"total":45563,"totalTestResultsIncrease":179,"posNeg":45448,"dataQualityGrade":null,"deathIncrease":0,"hospitalizedIncrease":0,"hash":"7bb9ce8887fa3b2cdf2ba641bda5ad349df90752","commercialScore":0,"negativeRegularScore":0,"negativeScore":0,"positiveScore":0,"score":0,"grade":""},{"date":20210217,"state":"VI","positive":2545,"probableCases":null,"negative":42724,"pending":121,"totalTestResultsSource":"posNeg","totalTestResults":45269,"hospitalizedCurrently":null,"hospitalizedCumulative":null,"inIcuCurrently":null,"inIcuCumulative":null,"onVentilatorCurrently":null,"onVentilatorCumulative":null,"recovered":2441,"lastUpdateEt":"2/17/2021 10:01","dateModified":"2021-02-17T10:01:00Z","checkTimeEt":"02/17 05:01","death":25,"hospitalized":null,"hospitalizedDischarged":null,"dateChecked":"2021-02-17T10:01:00Z","totalTestsViral":null,"positiveTestsViral":null,"negativeTestsViral":null,"positiveCasesViral":null,"deathConfirmed":null,"deathProbable":null,"totalTestEncountersViral":null,"totalTestsPeopleViral":45390,"totalTestsAntibody":null,"positiveTestsAntibody":null,"negativeTestsAntibody":null,"totalTestsPeopleAntibody":null,"positiveTestsPeopleAntibody":null,"negativeTestsPeopleAntibody":null,"totalTestsPeopleAntigen":null,"positiveTestsPeopleAntigen":null,"totalTestsAntigen":null,"positiveTestsAntigen":null,"fips":"78","positiveIncrease":3,"negativeIncrease":134,"total":45390,"totalTestResultsIncrease":137,"posNeg":45269,"dataQualityGrade":null,"deathIncrease":0,"hospitalizedIncrease":0,"hash":"ce08674aa6674adcfa62e3b993add6a332bafa2a","commercialScore":0,"negativeRegularScore":0,"negativeScore":0,"positiveScore":0,"score":0,"grade":""},{"date":20210216,"state":"VI","positive":2542,"probableCases":null,"negative":42590,"pending":101,"totalTestResultsSource":"posNeg","totalTestResults":45132,"hospitalizedCurrently":null,"hospitalizedCumulative":null,"inIcuCurrently":null,"inIcuCumulative":null,"onVentilatorCurrently":null,"onVentilatorCumulative":null,"recovered":2412,"lastUpdateEt":"2/15/2021 09:09","dateModified":"2021-02-15T09:09:00Z","checkTimeEt":"02/15 04:09","death":25,"hospitalized":null,"hospitalizedDischarged":null,"dateChecked":"2021-02-15T09:09:00Z","totalTestsViral":null,"positiveTestsViral":null,"negativeTestsViral":null,"positiveCasesViral":null,"deathConfirmed":null,"deathProbable":null,"totalTestEncountersViral":null,"totalTestsPeopleViral":45233,"totalTestsAntibody":null,"positiveTestsAntibody":null,"negativeTestsAntibody":null,"totalTestsPeopleAntibody":null,"positiveTestsPeopleAntibody":null,"negativeTestsPeopleAntibody":null,"totalTestsPeopleAntigen":null,"positiveTestsPeopleAntigen":null,"totalTestsAntigen":null,"positiveTestsAntigen":null,"fips":"78","positiveIncrease":0,"negativeIncrease":0,"total":45233,"totalTestResultsIncrease":0,"posNeg":45132,"dataQualityGrade":null,"deathIncrease":0,"hospitalizedIncrease":0,"hash":"8b78e8d8343283404a714f72af35c9b242776a91","commercialScore":0,"negativeRegularScore":0,"negativeScore":0,"positiveScore":0,"score":0,"grade":""},{"date":20210215,"state":"VI","positive":2542,"probableCases":null,"negative":42590,"pending":101,"totalTestResultsSource":"posNeg","totalTestResults":45132,"hospitalizedCurrently":null,"hospitalizedCumulative":null,"inIcuCurrently":null,"inIcuCumulative":null,"onVentilatorCurrently":null,"onVentilatorCumulative":null,"recovered":2412,"lastUpdateEt":"2/15/2021 09:09","dateModified":"2021-02-15T09:09:00Z","checkTimeEt":"02/15 04:09","death":25,"hospitalized":null,"hospitalizedDischarged":null,"dateChecked":"2021-02-15T09:09:00Z","totalTestsViral":null,"positiveTestsViral":null,"negativeTestsViral":null,"positiveCasesViral":null,"deathConfirmed":null,"deathProbable":null,"totalTestEncountersViral":null,"totalTestsPeopleViral":45233,"totalTestsAntibody":null,"positiveTestsAntibody":null,"negativeTestsAntibody":null,"totalTestsPeopleAntibody":null,"positiveTestsPeopleAntibody":null,"negativeTestsPeopleAntibody":null,"totalTestsPeopleAntigen":null,"positiveTestsPeopleAntigen":null,"totalTestsAntigen":null,"positiveTestsAntigen":null,"fips":"78","positiveIncrease":18,"negativeIncrease":666,"total":45233,"totalTestResultsIncrease":684,"posNeg":45132,"dataQualityGrade":null,"deathIncrease":0,"hospitalizedIncrease":0,"hash":"edf262ef3bcca39b11ae9effc1a2d33ae849fbcb","commercialScore":0,"negativeRegularScore":0,"negativeScore":0,"positiveScore":0,"score":0,"grade":""},{"date":20210214,"state":"VI","positive":2524,"probableCases":null,"negative":41924,"pending":99,"totalTestResultsSource":"posNeg","totalTestResults":44448,"hospitalizedCurrently":null,"hospitalizedCumulative":null,"inIcuCurrently":null,"inIcuCumulative":null,"onVentilatorCurrently":null,"onVentilatorCumulative":null,"recovered":2399,"lastUpdateEt":"2/12/2021 09:41","dateModified":"2021-02-12T09:41:00Z","checkTimeEt":"02/12 04:41","death":25,"hospitalized":null,"hospitalizedDischarged":null,"dateChecked":"2021-02-12T09:41:00Z","totalTestsViral":null,"positiveTestsViral":null,"negativeTestsViral":null,"positiveCasesViral":null,"deathConfirmed":null,"deathProbable":null,"totalTestEncountersViral":null,"totalTestsPeopleViral":44547,"totalTestsAntibody":null,"positiveTestsAntibody":null,"negativeTestsAntibody":null,"totalTestsPeopleAntibody":null,"positiveTestsPeopleAntibody":null,"negativeTestsPeopleAntibody":null,"totalTestsPeopleAntigen":null,"positiveTestsPeopleAntigen":null,"totalTestsAntigen":null,"positiveTestsAntigen":null,"fips":"78","positiveIncrease":0,"negativeIncrease":0,"total":44547,"totalTestResultsIncrease":0,"posNeg":44448,"dataQualityGrade":null,"deathIncrease":0,"hospitalizedIncrease":0,"hash":"5b2ad137ed91f1a1a1a04c08ac9e2aee10d3cf7d","commercialScore":0,"negativeRegularScore":0,"negativeScore":0,"positiveScore":0,"score":0,"grade":""},{"date":20210213,"state":"VI","positive":2524,"probableCases":null,"negative":41924,"pending":99,"totalTestResultsSource":"posNeg","totalTestResults":44448,"hospitalizedCurrently":null,"hospitalizedCumulative":null,"inIcuCurrently":null,"inIcuCumulative":null,"onVentilatorCurrently":null,"onVentilatorCumulative":null,"recovered":2399,"lastUpdateEt":"2/12/2021 09:41","dateModified":"2021-02-12T09:41:00Z","checkTimeEt":"02/12 04:41","death":25,"hospitalized":null,"hospitalizedDischarged":null,"dateChecked":"2021-02-12T09:41:00Z","totalTestsViral":null,"positiveTestsViral":null,"negativeTestsViral":null,"positiveCasesViral":null,"deathConfirmed":null,"deathProbable":null,"totalTestEncountersViral":null,"totalTestsPeopleViral":44547,"totalTestsAntibody":null,"positiveTestsAntibody":null,"negativeTestsAntibody":null,"totalTestsPeopleAntibody":null,"positiveTestsPeopleAntibody":null,"negativeTestsPeopleAntibody":null,"totalTestsPeopleAntigen":null,"positiveTestsPeopleAntigen":null,"totalTestsAntigen":null,"positiveTestsAntigen":null,"fips":"78","positiveIncrease":0,"negativeIncrease":0,"total":44547,"totalTestResultsIncrease":0,"posNeg":44448,"dataQualityGrade":null,"deathIncrease":0,"hospitalizedIncrease":0,"hash":"abd9a7ce76ffbb8310c5b7f4105431148b5f2dc6","commercialScore":0,"negativeRegularScore":0,"negativeScore":0,"positiveScore":0,"score":0,"grade":""},{"date":20210212,"state":"VI","positive":2524,"probableCases":null,"negative":41924,"pending":99,"totalTestResultsSource":"posNeg","totalTestResults":44448,"hospitalizedCurrently":null,"hospitalizedCumulative":null,"inIcuCurrently":null,"inIcuCumulative":null,"onVentilatorCurrently":null,"onVentilatorCumulative":null,"recovered":2399,"lastUpdateEt":"2/12/2021 09:41","dateModified":"2021-02-12T09:41:00Z","checkTimeEt":"02/12 04:41","death":25,"hospitalized":null,"hospitalizedDischarged":null,"dateChecked":"2021-02-12T09:41:00Z","totalTestsViral":null,"positiveTestsViral":null,"negativeTestsViral":null,"positiveCasesViral":null,"deathConfirmed":null,"deathProbable":null,"totalTestEncountersViral":null,"totalTestsPeopleViral":44547,"totalTestsAntibody":null,"positiveTestsAntibody":null,"negativeTestsAntibody":null,"totalTestsPeopleAntibody":null,"positiveTestsPeopleAntibody":null,"negativeTestsPeopleAntibody":null,"totalTestsPeopleAntigen":null,"positiveTestsPeopleAntigen":null,"totalTestsAntigen":null,"positiveTestsAntigen":null,"fips":"78","positiveIncrease":19,"negativeIncrease":48,"total":44547,"totalTestResultsIncrease":67,"posNeg":44448,"dataQualityGrade":null,"deathIncrease":0,"hospitalizedIncrease":0,"hash":"1db6f688f0465e94a7a94ca0f60425a1d6f3d25f","commercialScore":0,"negativeRegularScore":0,"negativeScore":0,"positiveScore":0,"score":0,"grade":""},{"date":20210211,"state":"VI","positive":2505,"probableCases":null,"negative":41876,"pending":99,"totalTestResultsSource":"posNeg","totalTestResults":44381,"hospitalizedCurrently":null,"hospitalizedCumulative":null,"inIcuCurrently":null,"inIcuCumulative":null,"onVentilatorCurrently":null,"onVentilatorCumulative":null,"recovered":2396,"lastUpdateEt":"2/11/2021 09:27","dateModified":"2021-02-11T09:27:00Z","checkTimeEt":"02/11 04:27","death":25,"hospitalized":null,"hospitalizedDischarged":null,"dateChecked":"2021-02-11T09:27:00Z","totalTestsViral":null,"positiveTestsViral":null,"negativeTestsViral":null,"positiveCasesViral":null,"deathConfirmed":null,"deathProbable":null,"totalTestEncountersViral":null,"totalTestsPeopleViral":44480,"totalTestsAntibody":null,"positiveTestsAntibody":null,"negativeTestsAntibody":null,"totalTestsPeopleAntibody":null,"positiveTestsPeopleAntibody":null,"negativeTestsPeopleAntibody":null,"totalTestsPeopleAntigen":null,"positiveTestsPeopleAntigen":null,"totalTestsAntigen":null,"positiveTestsAntigen":null,"fips":"78","positiveIncrease":20,"negativeIncrease":435,"total":44480,"totalTestResultsIncrease":455,"posNeg":44381,"dataQualityGrade":null,"deathIncrease":1,"hospitalizedIncrease":0,"hash":"8fbd8a9080d6024ecf896b2db82bc6660f4aa494","commercialScore":0,"negativeRegularScore":0,"negativeScore":0,"positiveScore":0,"score":0,"grade":""},{"date":20210210,"state":"VI","positive":2485,"probableCases":null,"negative":41441,"pending":106,"totalTestResultsSource":"posNeg","totalTestResults":43926,"hospitalizedCurrently":null,"hospitalizedCumulative":null,"inIcuCurrently":null,"inIcuCumulative":null,"onVentilatorCurrently":null,"onVentilatorCumulative":null,"recovered":2393,"lastUpdateEt":"2/9/2021 22:15","dateModified":"2021-02-09T22:15:00Z","checkTimeEt":"02/09 17:15","death":24,"hospitalized":null,"hospitalizedDischarged":null,"dateChecked":"2021-02-09T22:15:00Z","totalTestsViral":null,"positiveTestsViral":null,"negativeTestsViral":null,"positiveCasesViral":null,"deathConfirmed":null,"deathProbable":null,"totalTestEncountersViral":null,"totalTestsPeopleViral":44032,"totalTestsAntibody":null,"positiveTestsAntibody":null,"negativeTestsAntibody":null,"totalTestsPeopleAntibody":null,"positiveTestsPeopleAntibody":null,"negativeTestsPeopleAntibody":null,"totalTestsPeopleAntigen":null,"positiveTestsPeopleAntigen":null,"totalTestsAntigen":null,"positiveTestsAntigen":null,"fips":"78","positiveIncrease":12,"negativeIncrease":325,"total":44032,"totalTestResultsIncrease":337,"posNeg":43926,"dataQualityGrade":null,"deathIncrease":0,"hospitalizedIncrease":0,"hash":"14ea70fa4804c3fd639a8a43f35f0d3c48d65c6d","commercialScore":0,"negativeRegularScore":0,"negativeScore":0,"positiveScore":0,"score":0,"grade":""},{"date":20210209,"state":"VI","positive":2473,"probableCases":null,"negative":41116,"pending":103,"totalTestResultsSource":"posNeg","totalTestResults":43589,"hospitalizedCurrently":null,"hospitalizedCumulative":null,"inIcuCurrently":null,"inIcuCumulative":null,"onVentilatorCurrently":null,"onVentilatorCumulative":null,"recovered":2390,"lastUpdateEt":"2/9/2021 09:34","dateModified":"2021-02-09T09:34:00Z","checkTimeEt":"02/09 04:34","death":24,"hospitalized":null,"hospitalizedDischarged":null,"dateChecked":"2021-02-09T09:34:00Z","totalTestsViral":null,"positiveTestsViral":null,"negativeTestsViral":null,"positiveCasesViral":null,"deathConfirmed":null,"deathProbable":null,"totalTestEncountersViral":null,"totalTestsPeopleViral":43692,"totalTestsAntibody":null,"positiveTestsAntibody":null,"negativeTestsAntibody":null,"totalTestsPeopleAntibody":null,"positiveTestsPeopleAntibody":null,"negativeTestsPeopleAntibody":null,"totalTestsPeopleAntigen":null,"positiveTestsPeopleAntigen":null,"totalTestsAntigen":null,"positiveTestsAntigen":null,"fips":"78","positiveIncrease":7,"negativeIncrease":526,"total":43692,"totalTestResultsIncrease":533,"posNeg":43589,"dataQualityGrade":null,"deathIncrease":0,"hospitalizedIncrease":0,"hash":"df52d9595bf032a4860dcb91c772660397c87143","commercialScore":0,"negativeRegularScore":0,"negativeScore":0,"positiveScore":0,"score":0,"grade":""},{"date":20210208,"state":"VI","positive":2466,"probableCases":null,"negative":40590,"pending":104,"totalTestResultsSource":"posNeg","totalTestResults":43056,"hospitalizedCurrently":null,"hospitalizedCumulative":null,"inIcuCurrently":null,"inIcuCumulative":null,"onVentilatorCurrently":null,"onVentilatorCumulative":null,"recovered":2371,"lastUpdateEt":"2/7/2021 09:18","dateModified":"2021-02-07T09:18:00Z","checkTimeEt":"02/07 04:18","death":24,"hospitalized":null,"hospitalizedDischarged":null,"dateChecked":"2021-02-07T09:18:00Z","totalTestsViral":null,"positiveTestsViral":null,"negativeTestsViral":null,"positiveCasesViral":null,"deathConfirmed":null,"deathProbable":null,"totalTestEncountersViral":null,"totalTestsPeopleViral":43160,"totalTestsAntibody":null,"positiveTestsAntibody":null,"negativeTestsAntibody":null,"totalTestsPeopleAntibody":null,"positiveTestsPeopleAntibody":null,"negativeTestsPeopleAntibody":null,"totalTestsPeopleAntigen":null,"positiveTestsPeopleAntigen":null,"totalTestsAntigen":null,"positiveTestsAntigen":null,"fips":"78","positiveIncrease":0,"negativeIncrease":0,"total":43160,"totalTestResultsIncrease":0,"posNeg":43056,"dataQualityGrade":null,"deathIncrease":0,"hospitalizedIncrease":0,"hash":"f7cf773ca75a4a64f9d0eaf61813af40be7d1eee","commercialScore":0,"negativeRegularScore":0,"negativeScore":0,"positiveScore":0,"score":0,"grade":""},{"date":20210207,"state":"VI","positive":2466,"probableCases":null,"negative":40590,"pending":104,"totalTestResultsSource":"posNeg","totalTestResults":43056,"hospitalizedCurrently":null,"hospitalizedCumulative":null,"inIcuCurrently":null,"inIcuCumulative":null,"onVentilatorCurrently":null,"onVentilatorCumulative":null,"recovered":2371,"lastUpdateEt":"2/7/2021 09:18","dateModified":"2021-02-07T09:18:00Z","checkTimeEt":"02/07 04:18","death":24,"hospitalized":null,"hospitalizedDischarged":null,"dateChecked":"2021-02-07T09:18:00Z","totalTestsViral":null,"positiveTestsViral":null,"negativeTestsViral":null,"positiveCasesViral":null,"deathConfirmed":null,"deathProbable":null,"totalTestEncountersViral":null,"totalTestsPeopleViral":43160,"totalTestsAntibody":null,"positiveTestsAntibody":null,"negativeTestsAntibody":null,"totalTestsPeopleAntibody":null,"positiveTestsPeopleAntibody":null,"negativeTestsPeopleAntibody":null,"totalTestsPeopleAntigen":null,"positiveTestsPeopleAntigen":null,"totalTestsAntigen":null,"positiveTestsAntigen":null,"fips":"78","positiveIncrease":17,"negativeIncrease":477,"total":43160,"totalTestResultsIncrease":494,"posNeg":43056,"dataQualityGrade":null,"deathIncrease":0,"hospitalizedIncrease":0,"hash":"782ad7c6d3f5bcfeb10c27fabf0414c5301940f3","commercialScore":0,"negativeRegularScore":0,"negativeScore":0,"positiveScore":0,"score":0,"grade":""},{"date":20210206,"state":"VI","positive":2449,"probableCases":null,"negative":40113,"pending":105,"totalTestResultsSource":"posNeg","totalTestResults":42562,"hospitalizedCurrently":null,"hospitalizedCumulative":null,"inIcuCurrently":null,"inIcuCumulative":null,"onVentilatorCurrently":null,"onVentilatorCumulative":null,"recovered":2359,"lastUpdateEt":"2/5/2021 09:20","dateModified":"2021-02-05T09:20:00Z","checkTimeEt":"02/05 04:20","death":24,"hospitalized":null,"hospitalizedDischarged":null,"dateChecked":"2021-02-05T09:20:00Z","totalTestsViral":null,"positiveTestsViral":null,"negativeTestsViral":null,"positiveCasesViral":null,"deathConfirmed":null,"deathProbable":null,"totalTestEncountersViral":null,"totalTestsPeopleViral":42667,"totalTestsAntibody":null,"positiveTestsAntibody":null,"negativeTestsAntibody":null,"totalTestsPeopleAntibody":null,"positiveTestsPeopleAntibody":null,"negativeTestsPeopleAntibody":null,"totalTestsPeopleAntigen":null,"positiveTestsPeopleAntigen":null,"totalTestsAntigen":null,"positiveTestsAntigen":null,"fips":"78","positiveIncrease":0,"negativeIncrease":0,"total":42667,"totalTestResultsIncrease":0,"posNeg":42562,"dataQualityGrade":null,"deathIncrease":0,"hospitalizedIncrease":0,"hash":"79372bbb1f80e7d5aa4a865c2c46fda843db447d","commercialScore":0,"negativeRegularScore":0,"negativeScore":0,"positiveScore":0,"score":0,"grade":""},{"date":20210205,"state":"VI","positive":2449,"probableCases":null,"negative":40113,"pending":105,"totalTestResultsSource":"posNeg","totalTestResults":42562,"hospitalizedCurrently":null,"hospitalizedCumulative":null,"inIcuCurrently":null,"inIcuCumulative":null,"onVentilatorCurrently":null,"onVentilatorCumulative":null,"recovered":2359,"lastUpdateEt":"2/5/2021 09:20","dateModified":"2021-02-05T09:20:00Z","checkTimeEt":"02/05 04:20","death":24,"hospitalized":null,"hospitalizedDischarged":null,"dateChecked":"2021-02-05T09:20:00Z","totalTestsViral":null,"positiveTestsViral":null,"negativeTestsViral":null,"positiveCasesViral":null,"deathConfirmed":null,"deathProbable":null,"totalTestEncountersViral":null,"totalTestsPeopleViral":42667,"totalTestsAntibody":null,"positiveTestsAntibody":null,"negativeTestsAntibody":null,"totalTestsPeopleAntibody":null,"positiveTestsPeopleAntibody":null,"negativeTestsPeopleAntibody":null,"totalTestsPeopleAntigen":null,"positiveTestsPeopleAntigen":null,"totalTestsAntigen":null,"positiveTestsAntigen":null,"fips":"78","positiveIncrease":19,"negativeIncrease":295,"total":42667,"totalTestResultsIncrease":314,"posNeg":42562,"dataQualityGrade":null,"deathIncrease":0,"hospitalizedIncrease":0,"hash":"b232628824ab5c2ec6d9be58ab0f31b190f41135","commercialScore":0,"negativeRegularScore":0,"negativeScore":0,"positiveScore":0,"score":0,"grade":""},{"date":20210204,"state":"VI","positive":2430,"probableCases":null,"negative":39818,"pending":101,"totalTestResultsSource":"posNeg","totalTestResults":42248,"hospitalizedCurrently":null,"hospitalizedCumulative":null,"inIcuCurrently":null,"inIcuCumulative":null,"onVentilatorCurrently":null,"onVentilatorCumulative":null,"recovered":2336,"lastUpdateEt":"2/3/2021 07:13","dateModified":"2021-02-03T07:13:00Z","checkTimeEt":"02/03 02:13","death":24,"hospitalized":null,"hospitalizedDischarged":null,"dateChecked":"2021-02-03T07:13:00Z","totalTestsViral":null,"positiveTestsViral":null,"negativeTestsViral":null,"positiveCasesViral":null,"deathConfirmed":null,"deathProbable":null,"totalTestEncountersViral":null,"totalTestsPeopleViral":42349,"totalTestsAntibody":null,"positiveTestsAntibody":null,"negativeTestsAntibody":null,"totalTestsPeopleAntibody":null,"positiveTestsPeopleAntibody":null,"negativeTestsPeopleAntibody":null,"totalTestsPeopleAntigen":null,"positiveTestsPeopleAntigen":null,"totalTestsAntigen":null,"positiveTestsAntigen":null,"fips":"78","positiveIncrease":0,"negativeIncrease":0,"total":42349,"totalTestResultsIncrease":0,"posNeg":42248,"dataQualityGrade":null,"deathIncrease":0,"hospitalizedIncrease":0,"hash":"3a2ad1001f3bdba06abb330f191c977d1192a360","commercialScore":0,"negativeRegularScore":0,"negativeScore":0,"positiveScore":0,"score":0,"grade":""},{"date":20210203,"state":"VI","positive":2430,"probableCases":null,"negative":39818,"pending":101,"totalTestResultsSource":"posNeg","totalTestResults":42248,"hospitalizedCurrently":null,"hospitalizedCumulative":null,"inIcuCurrently":null,"inIcuCumulative":null,"onVentilatorCurrently":null,"onVentilatorCumulative":null,"recovered":2336,"lastUpdateEt":"2/3/2021 07:13","dateModified":"2021-02-03T07:13:00Z","checkTimeEt":"02/03 02:13","death":24,"hospitalized":null,"hospitalizedDischarged":null,"dateChecked":"2021-02-03T07:13:00Z","totalTestsViral":null,"positiveTestsViral":null,"negativeTestsViral":null,"positiveCasesViral":null,"deathConfirmed":null,"deathProbable":null,"totalTestEncountersViral":null,"totalTestsPeopleViral":42349,"totalTestsAntibody":null,"positiveTestsAntibody":null,"negativeTestsAntibody":null,"totalTestsPeopleAntibody":null,"positiveTestsPeopleAntibody":null,"negativeTestsPeopleAntibody":null,"totalTestsPeopleAntigen":null,"positiveTestsPeopleAntigen":null,"totalTestsAntigen":null,"positiveTestsAntigen":null,"fips":"78","positiveIncrease":4,"negativeIncrease":118,"total":42349,"totalTestResultsIncrease":122,"posNeg":42248,"dataQualityGrade":null,"deathIncrease":0,"hospitalizedIncrease":0,"hash":"057d23762e344613dd0b573a5f33742ac1d26756","commercialScore":0,"negativeRegularScore":0,"negativeScore":0,"positiveScore":0,"score":0,"grade":""},{"date":20210202,"state":"VI","positive":2426,"probableCases":null,"negative":39700,"pending":97,"totalTestResultsSource":"posNeg","totalTestResults":42126,"hospitalizedCurrently":null,"hospitalizedCumulative":null,"inIcuCurrently":null,"inIcuCumulative":null,"onVentilatorCurrently":null,"onVentilatorCumulative":null,"recovered":2317,"lastUpdateEt":"2/2/2021 10:38","dateModified":"2021-02-02T10:38:00Z","checkTimeEt":"02/02 05:38","death":24,"hospitalized":null,"hospitalizedDischarged":null,"dateChecked":"2021-02-02T10:38:00Z","totalTestsViral":null,"positiveTestsViral":null,"negativeTestsViral":null,"positiveCasesViral":null,"deathConfirmed":null,"deathProbable":null,"totalTestEncountersViral":null,"totalTestsPeopleViral":42223,"totalTestsAntibody":null,"positiveTestsAntibody":null,"negativeTestsAntibody":null,"totalTestsPeopleAntibody":null,"positiveTestsPeopleAntibody":null,"negativeTestsPeopleAntibody":null,"totalTestsPeopleAntigen":null,"positiveTestsPeopleAntigen":null,"totalTestsAntigen":null,"positiveTestsAntigen":null,"fips":"78","positiveIncrease":5,"negativeIncrease":246,"total":42223,"totalTestResultsIncrease":251,"posNeg":42126,"dataQualityGrade":null,"deathIncrease":0,"hospitalizedIncrease":0,"hash":"7b53b58c5d36ecaac5f9c9d3793a5055792ce6f4","commercialScore":0,"negativeRegularScore":0,"negativeScore":0,"positiveScore":0,"score":0,"grade":""},{"date":20210201,"state":"VI","positive":2421,"probableCases":null,"negative":39454,"pending":93,"totalTestResultsSource":"posNeg","totalTestResults":41875,"hospitalizedCurrently":null,"hospitalizedCumulative":null,"inIcuCurrently":null,"inIcuCumulative":null,"onVentilatorCurrently":null,"onVentilatorCumulative":null,"recovered":2306,"lastUpdateEt":"2/1/2021 09:25","dateModified":"2021-02-01T09:25:00Z","checkTimeEt":"02/01 04:25","death":24,"hospitalized":null,"hospitalizedDischarged":null,"dateChecked":"2021-02-01T09:25:00Z","totalTestsViral":null,"positiveTestsViral":null,"negativeTestsViral":null,"positiveCasesViral":null,"deathConfirmed":null,"deathProbable":null,"totalTestEncountersViral":null,"totalTestsPeopleViral":41968,"totalTestsAntibody":null,"positiveTestsAntibody":null,"negativeTestsAntibody":null,"totalTestsPeopleAntibody":null,"positiveTestsPeopleAntibody":null,"negativeTestsPeopleAntibody":null,"totalTestsPeopleAntigen":null,"positiveTestsPeopleAntigen":null,"totalTestsAntigen":null,"positiveTestsAntigen":null,"fips":"78","positiveIncrease":23,"negativeIncrease":364,"total":41968,"totalTestResultsIncrease":387,"posNeg":41875,"dataQualityGrade":null,"deathIncrease":0,"hospitalizedIncrease":0,"hash":"eb202421412d7049099255c7032934ac81f62a54","commercialScore":0,"negativeRegularScore":0,"negativeScore":0,"positiveScore":0,"score":0,"grade":""},{"date":20210131,"state":"VI","positive":2398,"probableCases":null,"negative":39090,"pending":99,"totalTestResultsSource":"posNeg","totalTestResults":41488,"hospitalizedCurrently":null,"hospitalizedCumulative":null,"inIcuCurrently":null,"inIcuCumulative":null,"onVentilatorCurrently":null,"onVentilatorCumulative":null,"recovered":2283,"lastUpdateEt":"1/29/2021 10:16","dateModified":"2021-01-29T10:16:00Z","checkTimeEt":"01/29 05:16","death":24,"hospitalized":null,"hospitalizedDischarged":null,"dateChecked":"2021-01-29T10:16:00Z","totalTestsViral":null,"positiveTestsViral":null,"negativeTestsViral":null,"positiveCasesViral":null,"deathConfirmed":null,"deathProbable":null,"totalTestEncountersViral":null,"totalTestsPeopleViral":41587,"totalTestsAntibody":null,"positiveTestsAntibody":null,"negativeTestsAntibody":null,"totalTestsPeopleAntibody":null,"positiveTestsPeopleAntibody":null,"negativeTestsPeopleAntibody":null,"totalTestsPeopleAntigen":null,"positiveTestsPeopleAntigen":null,"totalTestsAntigen":null,"positiveTestsAntigen":null,"fips":"78","positiveIncrease":0,"negativeIncrease":0,"total":41587,"totalTestResultsIncrease":0,"posNeg":41488,"dataQualityGrade":null,"deathIncrease":0,"hospitalizedIncrease":0,"hash":"aa4ca163767bc86c5dc725f13a319f06c54e0b94","commercialScore":0,"negativeRegularScore":0,"negativeScore":0,"positiveScore":0,"score":0,"grade":""},{"date":20210130,"state":"VI","positive":2398,"probableCases":null,"negative":39090,"pending":99,"totalTestResultsSource":"posNeg","totalTestResults":41488,"hospitalizedCurrently":null,"hospitalizedCumulative":null,"inIcuCurrently":null,"inIcuCumulative":null,"onVentilatorCurrently":null,"onVentilatorCumulative":null,"recovered":2283,"lastUpdateEt":"1/29/2021 10:16","dateModified":"2021-01-29T10:16:00Z","checkTimeEt":"01/29 05:16","death":24,"hospitalized":null,"hospitalizedDischarged":null,"dateChecked":"2021-01-29T10:16:00Z","totalTestsViral":null,"positiveTestsViral":null,"negativeTestsViral":null,"positiveCasesViral":null,"deathConfirmed":null,"deathProbable":null,"totalTestEncountersViral":null,"totalTestsPeopleViral":41587,"totalTestsAntibody":null,"positiveTestsAntibody":null,"negativeTestsAntibody":null,"totalTestsPeopleAntibody":null,"positiveTestsPeopleAntibody":null,"negativeTestsPeopleAntibody":null,"totalTestsPeopleAntigen":null,"positiveTestsPeopleAntigen":null,"totalTestsAntigen":null,"positiveTestsAntigen":null,"fips":"78","positiveIncrease":0,"negativeIncrease":0,"total":41587,"totalTestResultsIncrease":0,"posNeg":41488,"dataQualityGrade":null,"deathIncrease":0,"hospitalizedIncrease":0,"hash":"56aace3de97efaed6e66f3ef7db9c11830919256","commercialScore":0,"negativeRegularScore":0,"negativeScore":0,"positiveScore":0,"score":0,"grade":""},{"date":20210129,"state":"VI","positive":2398,"probableCases":null,"negative":39090,"pending":99,"totalTestResultsSource":"posNeg","totalTestResults":41488,"hospitalizedCurrently":null,"hospitalizedCumulative":null,"inIcuCurrently":null,"inIcuCumulative":null,"onVentilatorCurrently":null,"onVentilatorCumulative":null,"recovered":2283,"lastUpdateEt":"1/29/2021 10:16","dateModified":"2021-01-29T10:16:00Z","checkTimeEt":"01/29 05:16","death":24,"hospitalized":null,"hospitalizedDischarged":null,"dateChecked":"2021-01-29T10:16:00Z","totalTestsViral":null,"positiveTestsViral":null,"negativeTestsViral":null,"positiveCasesViral":null,"deathConfirmed":null,"deathProbable":null,"totalTestEncountersViral":null,"totalTestsPeopleViral":41587,"totalTestsAntibody":null,"positiveTestsAntibody":null,"negativeTestsAntibody":null,"totalTestsPeopleAntibody":null,"positiveTestsPeopleAntibody":null,"negativeTestsPeopleAntibody":null,"totalTestsPeopleAntigen":null,"positiveTestsPeopleAntigen":null,"totalTestsAntigen":null,"positiveTestsAntigen":null,"fips":"78","positiveIncrease":14,"negativeIncrease":523,"total":41587,"totalTestResultsIncrease":537,"posNeg":41488,"dataQualityGrade":null,"deathIncrease":0,"hospitalizedIncrease":0,"hash":"e5b0164ec0d6ec78c2a394e35f338412fa9e6ecf","commercialScore":0,"negativeRegularScore":0,"negativeScore":0,"positiveScore":0,"score":0,"grade":""},{"date":20210128,"state":"VI","positive":2384,"probableCases":null,"negative":38567,"pending":114,"totalTestResultsSource":"posNeg","totalTestResults":40951,"hospitalizedCurrently":null,"hospitalizedCumulative":null,"inIcuCurrently":null,"inIcuCumulative":null,"onVentilatorCurrently":null,"onVentilatorCumulative":null,"recovered":2266,"lastUpdateEt":"1/28/2021 11:09","dateModified":"2021-01-28T11:09:00Z","checkTimeEt":"01/28 06:09","death":24,"hospitalized":null,"hospitalizedDischarged":null,"dateChecked":"2021-01-28T11:09:00Z","totalTestsViral":null,"positiveTestsViral":null,"negativeTestsViral":null,"positiveCasesViral":null,"deathConfirmed":null,"deathProbable":null,"totalTestEncountersViral":null,"totalTestsPeopleViral":41065,"totalTestsAntibody":null,"positiveTestsAntibody":null,"negativeTestsAntibody":null,"totalTestsPeopleAntibody":null,"positiveTestsPeopleAntibody":null,"negativeTestsPeopleAntibody":null,"totalTestsPeopleAntigen":null,"positiveTestsPeopleAntigen":null,"totalTestsAntigen":null,"positiveTestsAntigen":null,"fips":"78","positiveIncrease":11,"negativeIncrease":259,"total":41065,"totalTestResultsIncrease":270,"posNeg":40951,"dataQualityGrade":null,"deathIncrease":0,"hospitalizedIncrease":0,"hash":"a8a4e65b8dcc03333ae3caab2363926c4e283d36","commercialScore":0,"negativeRegularScore":0,"negativeScore":0,"positiveScore":0,"score":0,"grade":""},{"date":20210127,"state":"VI","positive":2373,"probableCases":null,"negative":38308,"pending":100,"totalTestResultsSource":"posNeg","totalTestResults":40681,"hospitalizedCurrently":null,"hospitalizedCumulative":null,"inIcuCurrently":null,"inIcuCumulative":null,"onVentilatorCurrently":null,"onVentilatorCumulative":null,"recovered":2260,"lastUpdateEt":"1/26/2021 20:11","dateModified":"2021-01-26T20:11:00Z","checkTimeEt":"01/26 15:11","death":24,"hospitalized":null,"hospitalizedDischarged":null,"dateChecked":"2021-01-26T20:11:00Z","totalTestsViral":null,"positiveTestsViral":null,"negativeTestsViral":null,"positiveCasesViral":null,"deathConfirmed":null,"deathProbable":null,"totalTestEncountersViral":null,"totalTestsPeopleViral":40781,"totalTestsAntibody":null,"positiveTestsAntibody":null,"negativeTestsAntibody":null,"totalTestsPeopleAntibody":null,"positiveTestsPeopleAntibody":null,"negativeTestsPeopleAntibody":null,"totalTestsPeopleAntigen":null,"positiveTestsPeopleAntigen":null,"totalTestsAntigen":null,"positiveTestsAntigen":null,"fips":"78","positiveIncrease":23,"negativeIncrease":193,"total":40781,"totalTestResultsIncrease":216,"posNeg":40681,"dataQualityGrade":null,"deathIncrease":0,"hospitalizedIncrease":0,"hash":"fc65dd912c28d1c106a73e4934e8578f38580e4c","commercialScore":0,"negativeRegularScore":0,"negativeScore":0,"positiveScore":0,"score":0,"grade":""},{"date":20210126,"state":"VI","positive":2350,"probableCases":null,"negative":38115,"pending":102,"totalTestResultsSource":"posNeg","totalTestResults":40465,"hospitalizedCurrently":null,"hospitalizedCumulative":null,"inIcuCurrently":null,"inIcuCumulative":null,"onVentilatorCurrently":null,"onVentilatorCumulative":null,"recovered":2254,"lastUpdateEt":"1/26/2021 09:34","dateModified":"2021-01-26T09:34:00Z","checkTimeEt":"01/26 04:34","death":24,"hospitalized":null,"hospitalizedDischarged":null,"dateChecked":"2021-01-26T09:34:00Z","totalTestsViral":null,"positiveTestsViral":null,"negativeTestsViral":null,"positiveCasesViral":null,"deathConfirmed":null,"deathProbable":null,"totalTestEncountersViral":null,"totalTestsPeopleViral":40567,"totalTestsAntibody":null,"positiveTestsAntibody":null,"negativeTestsAntibody":null,"totalTestsPeopleAntibody":null,"positiveTestsPeopleAntibody":null,"negativeTestsPeopleAntibody":null,"totalTestsPeopleAntigen":null,"positiveTestsPeopleAntigen":null,"totalTestsAntigen":null,"positiveTestsAntigen":null,"fips":"78","positiveIncrease":9,"negativeIncrease":159,"total":40567,"totalTestResultsIncrease":168,"posNeg":40465,"dataQualityGrade":null,"deathIncrease":0,"hospitalizedIncrease":0,"hash":"e1e3cf91071d72d14b43e35e7a911eec742ae312","commercialScore":0,"negativeRegularScore":0,"negativeScore":0,"positiveScore":0,"score":0,"grade":""},{"date":20210125,"state":"VI","positive":2341,"probableCases":null,"negative":37956,"pending":95,"totalTestResultsSource":"posNeg","totalTestResults":40297,"hospitalizedCurrently":null,"hospitalizedCumulative":null,"inIcuCurrently":null,"inIcuCumulative":null,"onVentilatorCurrently":null,"onVentilatorCumulative":null,"recovered":2234,"lastUpdateEt":"1/23/2021 21:47","dateModified":"2021-01-23T21:47:00Z","checkTimeEt":"01/23 16:47","death":24,"hospitalized":null,"hospitalizedDischarged":null,"dateChecked":"2021-01-23T21:47:00Z","totalTestsViral":null,"positiveTestsViral":null,"negativeTestsViral":null,"positiveCasesViral":null,"deathConfirmed":null,"deathProbable":null,"totalTestEncountersViral":null,"totalTestsPeopleViral":40392,"totalTestsAntibody":null,"positiveTestsAntibody":null,"negativeTestsAntibody":null,"totalTestsPeopleAntibody":null,"positiveTestsPeopleAntibody":null,"negativeTestsPeopleAntibody":null,"totalTestsPeopleAntigen":null,"positiveTestsPeopleAntigen":null,"totalTestsAntigen":null,"positiveTestsAntigen":null,"fips":"78","positiveIncrease":0,"negativeIncrease":0,"total":40392,"totalTestResultsIncrease":0,"posNeg":40297,"dataQualityGrade":null,"deathIncrease":0,"hospitalizedIncrease":0,"hash":"fb76ccc5236903d4f1573a87f1b64d9ef3afb29f","commercialScore":0,"negativeRegularScore":0,"negativeScore":0,"positiveScore":0,"score":0,"grade":""},{"date":20210124,"state":"VI","positive":2341,"probableCases":null,"negative":37956,"pending":95,"totalTestResultsSource":"posNeg","totalTestResults":40297,"hospitalizedCurrently":null,"hospitalizedCumulative":null,"inIcuCurrently":null,"inIcuCumulative":null,"onVentilatorCurrently":null,"onVentilatorCumulative":null,"recovered":2234,"lastUpdateEt":"1/23/2021 21:47","dateModified":"2021-01-23T21:47:00Z","checkTimeEt":"01/23 16:47","death":24,"hospitalized":null,"hospitalizedDischarged":null,"dateChecked":"2021-01-23T21:47:00Z","totalTestsViral":null,"positiveTestsViral":null,"negativeTestsViral":null,"positiveCasesViral":null,"deathConfirmed":null,"deathProbable":null,"totalTestEncountersViral":null,"totalTestsPeopleViral":40392,"totalTestsAntibody":null,"positiveTestsAntibody":null,"negativeTestsAntibody":null,"totalTestsPeopleAntibody":null,"positiveTestsPeopleAntibody":null,"negativeTestsPeopleAntibody":null,"totalTestsPeopleAntigen":null,"positiveTestsPeopleAntigen":null,"totalTestsAntigen":null,"positiveTestsAntigen":null,"fips":"78","positiveIncrease":6,"negativeIncrease":155,"total":40392,"totalTestResultsIncrease":161,"posNeg":40297,"dataQualityGrade":null,"deathIncrease":0,"hospitalizedIncrease":0,"hash":"ccfc0b7142ee43bf4a32e733433e871678a36ddd","commercialScore":0,"negativeRegularScore":0,"negativeScore":0,"positiveScore":0,"score":0,"grade":""},{"date":20210123,"state":"VI","positive":2335,"probableCases":null,"negative":37801,"pending":95,"totalTestResultsSource":"posNeg","totalTestResults":40136,"hospitalizedCurrently":null,"hospitalizedCumulative":null,"inIcuCurrently":null,"inIcuCumulative":null,"onVentilatorCurrently":null,"onVentilatorCumulative":null,"recovered":2213,"lastUpdateEt":"1/23/2021 10:17","dateModified":"2021-01-23T10:17:00Z","checkTimeEt":"01/23 05:17","death":24,"hospitalized":null,"hospitalizedDischarged":null,"dateChecked":"2021-01-23T10:17:00Z","totalTestsViral":null,"positiveTestsViral":null,"negativeTestsViral":null,"positiveCasesViral":null,"deathConfirmed":null,"deathProbable":null,"totalTestEncountersViral":null,"totalTestsPeopleViral":40231,"totalTestsAntibody":null,"positiveTestsAntibody":null,"negativeTestsAntibody":null,"totalTestsPeopleAntibody":null,"positiveTestsPeopleAntibody":null,"negativeTestsPeopleAntibody":null,"totalTestsPeopleAntigen":null,"positiveTestsPeopleAntigen":null,"totalTestsAntigen":null,"positiveTestsAntigen":null,"fips":"78","positiveIncrease":14,"negativeIncrease":73,"total":40231,"totalTestResultsIncrease":87,"posNeg":40136,"dataQualityGrade":null,"deathIncrease":0,"hospitalizedIncrease":0,"hash":"ff9f7ba3b84e284bb2156d777479c017a517ef6d","commercialScore":0,"negativeRegularScore":0,"negativeScore":0,"positiveScore":0,"score":0,"grade":""},{"date":20210122,"state":"VI","positive":2321,"probableCases":null,"negative":37728,"pending":95,"totalTestResultsSource":"posNeg","totalTestResults":40049,"hospitalizedCurrently":null,"hospitalizedCumulative":null,"inIcuCurrently":null,"inIcuCumulative":null,"onVentilatorCurrently":null,"onVentilatorCumulative":null,"recovered":2190,"lastUpdateEt":"1/22/2021 09:25","dateModified":"2021-01-22T09:25:00Z","checkTimeEt":"01/22 04:25","death":24,"hospitalized":null,"hospitalizedDischarged":null,"dateChecked":"2021-01-22T09:25:00Z","totalTestsViral":null,"positiveTestsViral":null,"negativeTestsViral":null,"positiveCasesViral":null,"deathConfirmed":null,"deathProbable":null,"totalTestEncountersViral":null,"totalTestsPeopleViral":40144,"totalTestsAntibody":null,"positiveTestsAntibody":null,"negativeTestsAntibody":null,"totalTestsPeopleAntibody":null,"positiveTestsPeopleAntibody":null,"negativeTestsPeopleAntibody":null,"totalTestsPeopleAntigen":null,"positiveTestsPeopleAntigen":null,"totalTestsAntigen":null,"positiveTestsAntigen":null,"fips":"78","positiveIncrease":16,"negativeIncrease":263,"total":40144,"totalTestResultsIncrease":279,"posNeg":40049,"dataQualityGrade":null,"deathIncrease":0,"hospitalizedIncrease":0,"hash":"fe353256e53c2417195f1ffa951c2efac9d13370","commercialScore":0,"negativeRegularScore":0,"negativeScore":0,"positiveScore":0,"score":0,"grade":""},{"date":20210121,"state":"VI","positive":2305,"probableCases":null,"negative":37465,"pending":107,"totalTestResultsSource":"posNeg","totalTestResults":39770,"hospitalizedCurrently":null,"hospitalizedCumulative":null,"inIcuCurrently":null,"inIcuCumulative":null,"onVentilatorCurrently":null,"onVentilatorCumulative":null,"recovered":2166,"lastUpdateEt":"1/20/2021 22:52","dateModified":"2021-01-20T22:52:00Z","checkTimeEt":"01/20 17:52","death":24,"hospitalized":null,"hospitalizedDischarged":null,"dateChecked":"2021-01-20T22:52:00Z","totalTestsViral":null,"positiveTestsViral":null,"negativeTestsViral":null,"positiveCasesViral":null,"deathConfirmed":null,"deathProbable":null,"totalTestEncountersViral":null,"totalTestsPeopleViral":39877,"totalTestsAntibody":null,"positiveTestsAntibody":null,"negativeTestsAntibody":null,"totalTestsPeopleAntibody":null,"positiveTestsPeopleAntibody":null,"negativeTestsPeopleAntibody":null,"totalTestsPeopleAntigen":null,"positiveTestsPeopleAntigen":null,"totalTestsAntigen":null,"positiveTestsAntigen":null,"fips":"78","positiveIncrease":22,"negativeIncrease":167,"total":39877,"totalTestResultsIncrease":189,"posNeg":39770,"dataQualityGrade":null,"deathIncrease":0,"hospitalizedIncrease":0,"hash":"d5ccd5d11575cfb02934f168508dd498287e6280","commercialScore":0,"negativeRegularScore":0,"negativeScore":0,"positiveScore":0,"score":0,"grade":""},{"date":20210120,"state":"VI","positive":2283,"probableCases":null,"negative":37298,"pending":95,"totalTestResultsSource":"posNeg","totalTestResults":39581,"hospitalizedCurrently":null,"hospitalizedCumulative":null,"inIcuCurrently":null,"inIcuCumulative":null,"onVentilatorCurrently":null,"onVentilatorCumulative":null,"recovered":2159,"lastUpdateEt":"1/19/2021 20:46","dateModified":"2021-01-19T20:46:00Z","checkTimeEt":"01/19 15:46","death":24,"hospitalized":null,"hospitalizedDischarged":null,"dateChecked":"2021-01-19T20:46:00Z","totalTestsViral":null,"positiveTestsViral":null,"negativeTestsViral":null,"positiveCasesViral":null,"deathConfirmed":null,"deathProbable":null,"totalTestEncountersViral":null,"totalTestsPeopleViral":39676,"totalTestsAntibody":null,"positiveTestsAntibody":null,"negativeTestsAntibody":null,"totalTestsPeopleAntibody":null,"positiveTestsPeopleAntibody":null,"negativeTestsPeopleAntibody":null,"totalTestsPeopleAntigen":null,"positiveTestsPeopleAntigen":null,"totalTestsAntigen":null,"positiveTestsAntigen":null,"fips":"78","positiveIncrease":23,"negativeIncrease":179,"total":39676,"totalTestResultsIncrease":202,"posNeg":39581,"dataQualityGrade":null,"deathIncrease":0,"hospitalizedIncrease":0,"hash":"4bda4fb0d30a59942499b6e661eecaf8f9845548","commercialScore":0,"negativeRegularScore":0,"negativeScore":0,"positiveScore":0,"score":0,"grade":""},{"date":20210119,"state":"VI","positive":2260,"probableCases":null,"negative":37119,"pending":112,"totalTestResultsSource":"posNeg","totalTestResults":39379,"hospitalizedCurrently":null,"hospitalizedCumulative":null,"inIcuCurrently":null,"inIcuCumulative":null,"onVentilatorCurrently":null,"onVentilatorCumulative":null,"recovered":2120,"lastUpdateEt":"1/17/2021 11:12","dateModified":"2021-01-17T11:12:00Z","checkTimeEt":"01/17 06:12","death":24,"hospitalized":null,"hospitalizedDischarged":null,"dateChecked":"2021-01-17T11:12:00Z","totalTestsViral":null,"positiveTestsViral":null,"negativeTestsViral":null,"positiveCasesViral":null,"deathConfirmed":null,"deathProbable":null,"totalTestEncountersViral":null,"totalTestsPeopleViral":39491,"totalTestsAntibody":null,"positiveTestsAntibody":null,"negativeTestsAntibody":null,"totalTestsPeopleAntibody":null,"positiveTestsPeopleAntibody":null,"negativeTestsPeopleAntibody":null,"totalTestsPeopleAntigen":null,"positiveTestsPeopleAntigen":null,"totalTestsAntigen":null,"positiveTestsAntigen":null,"fips":"78","positiveIncrease":0,"negativeIncrease":0,"total":39491,"totalTestResultsIncrease":0,"posNeg":39379,"dataQualityGrade":null,"deathIncrease":0,"hospitalizedIncrease":0,"hash":"12b2c89922709ee808c87895e10d96bf0fdf4d69","commercialScore":0,"negativeRegularScore":0,"negativeScore":0,"positiveScore":0,"score":0,"grade":""},{"date":20210118,"state":"VI","positive":2260,"probableCases":null,"negative":37119,"pending":112,"totalTestResultsSource":"posNeg","totalTestResults":39379,"hospitalizedCurrently":null,"hospitalizedCumulative":null,"inIcuCurrently":null,"inIcuCumulative":null,"onVentilatorCurrently":null,"onVentilatorCumulative":null,"recovered":2120,"lastUpdateEt":"1/17/2021 11:12","dateModified":"2021-01-17T11:12:00Z","checkTimeEt":"01/17 06:12","death":24,"hospitalized":null,"hospitalizedDischarged":null,"dateChecked":"2021-01-17T11:12:00Z","totalTestsViral":null,"positiveTestsViral":null,"negativeTestsViral":null,"positiveCasesViral":null,"deathConfirmed":null,"deathProbable":null,"totalTestEncountersViral":null,"totalTestsPeopleViral":39491,"totalTestsAntibody":null,"positiveTestsAntibody":null,"negativeTestsAntibody":null,"totalTestsPeopleAntibody":null,"positiveTestsPeopleAntibody":null,"negativeTestsPeopleAntibody":null,"totalTestsPeopleAntigen":null,"positiveTestsPeopleAntigen":null,"totalTestsAntigen":null,"positiveTestsAntigen":null,"fips":"78","positiveIncrease":0,"negativeIncrease":0,"total":39491,"totalTestResultsIncrease":0,"posNeg":39379,"dataQualityGrade":null,"deathIncrease":0,"hospitalizedIncrease":0,"hash":"9702f734c5d2b36445ee8fac366502557ae94b69","commercialScore":0,"negativeRegularScore":0,"negativeScore":0,"positiveScore":0,"score":0,"grade":""},{"date":20210117,"state":"VI","positive":2260,"probableCases":null,"negative":37119,"pending":112,"totalTestResultsSource":"posNeg","totalTestResults":39379,"hospitalizedCurrently":null,"hospitalizedCumulative":null,"inIcuCurrently":null,"inIcuCumulative":null,"onVentilatorCurrently":null,"onVentilatorCumulative":null,"recovered":2120,"lastUpdateEt":"1/17/2021 11:12","dateModified":"2021-01-17T11:12:00Z","checkTimeEt":"01/17 06:12","death":24,"hospitalized":null,"hospitalizedDischarged":null,"dateChecked":"2021-01-17T11:12:00Z","totalTestsViral":null,"positiveTestsViral":null,"negativeTestsViral":null,"positiveCasesViral":null,"deathConfirmed":null,"deathProbable":null,"totalTestEncountersViral":null,"totalTestsPeopleViral":39491,"totalTestsAntibody":null,"positiveTestsAntibody":null,"negativeTestsAntibody":null,"totalTestsPeopleAntibody":null,"positiveTestsPeopleAntibody":null,"negativeTestsPeopleAntibody":null,"totalTestsPeopleAntigen":null,"positiveTestsPeopleAntigen":null,"totalTestsAntigen":null,"positiveTestsAntigen":null,"fips":"78","positiveIncrease":94,"negativeIncrease":1360,"total":39491,"totalTestResultsIncrease":1454,"posNeg":39379,"dataQualityGrade":null,"deathIncrease":0,"hospitalizedIncrease":0,"hash":"18542517599c0bbb5f6b569c64a569689eddcfb8","commercialScore":0,"negativeRegularScore":0,"negativeScore":0,"positiveScore":0,"score":0,"grade":""},{"date":20210116,"state":"VI","positive":2166,"probableCases":null,"negative":35759,"pending":94,"totalTestResultsSource":"posNeg","totalTestResults":37925,"hospitalizedCurrently":null,"hospitalizedCumulative":null,"inIcuCurrently":null,"inIcuCumulative":null,"onVentilatorCurrently":null,"onVentilatorCumulative":null,"recovered":2008,"lastUpdateEt":"1/12/2021 05:49","dateModified":"2021-01-12T05:49:00Z","checkTimeEt":"01/12 00:49","death":24,"hospitalized":null,"hospitalizedDischarged":null,"dateChecked":"2021-01-12T05:49:00Z","totalTestsViral":null,"positiveTestsViral":null,"negativeTestsViral":null,"positiveCasesViral":null,"deathConfirmed":null,"deathProbable":null,"totalTestEncountersViral":null,"totalTestsPeopleViral":38019,"totalTestsAntibody":null,"positiveTestsAntibody":null,"negativeTestsAntibody":null,"totalTestsPeopleAntibody":null,"positiveTestsPeopleAntibody":null,"negativeTestsPeopleAntibody":null,"totalTestsPeopleAntigen":null,"positiveTestsPeopleAntigen":null,"totalTestsAntigen":null,"positiveTestsAntigen":null,"fips":"78","positiveIncrease":0,"negativeIncrease":0,"total":38019,"totalTestResultsIncrease":0,"posNeg":37925,"dataQualityGrade":null,"deathIncrease":0,"hospitalizedIncrease":0,"hash":"1ae6f0986c2d73c3ccc5779a3d6e43fadf1b2790","commercialScore":0,"negativeRegularScore":0,"negativeScore":0,"positiveScore":0,"score":0,"grade":""},{"date":20210115,"state":"VI","positive":2166,"probableCases":null,"negative":35759,"pending":94,"totalTestResultsSource":"posNeg","totalTestResults":37925,"hospitalizedCurrently":null,"hospitalizedCumulative":null,"inIcuCurrently":null,"inIcuCumulative":null,"onVentilatorCurrently":null,"onVentilatorCumulative":null,"recovered":2008,"lastUpdateEt":"1/12/2021 05:49","dateModified":"2021-01-12T05:49:00Z","checkTimeEt":"01/12 00:49","death":24,"hospitalized":null,"hospitalizedDischarged":null,"dateChecked":"2021-01-12T05:49:00Z","totalTestsViral":null,"positiveTestsViral":null,"negativeTestsViral":null,"positiveCasesViral":null,"deathConfirmed":null,"deathProbable":null,"totalTestEncountersViral":null,"totalTestsPeopleViral":38019,"totalTestsAntibody":null,"positiveTestsAntibody":null,"negativeTestsAntibody":null,"totalTestsPeopleAntibody":null,"positiveTestsPeopleAntibody":null,"negativeTestsPeopleAntibody":null,"totalTestsPeopleAntigen":null,"positiveTestsPeopleAntigen":null,"totalTestsAntigen":null,"positiveTestsAntigen":null,"fips":"78","positiveIncrease":0,"negativeIncrease":0,"total":38019,"totalTestResultsIncrease":0,"posNeg":37925,"dataQualityGrade":null,"deathIncrease":0,"hospitalizedIncrease":0,"hash":"634d65f316c8abdaf22e1afbdf5d6953b71fc024","commercialScore":0,"negativeRegularScore":0,"negativeScore":0,"positiveScore":0,"score":0,"grade":""},{"date":20210114,"state":"VI","positive":2166,"probableCases":null,"negative":35759,"pending":94,"totalTestResultsSource":"posNeg","totalTestResults":37925,"hospitalizedCurrently":null,"hospitalizedCumulative":null,"inIcuCurrently":null,"inIcuCumulative":null,"onVentilatorCurrently":null,"onVentilatorCumulative":null,"recovered":2008,"lastUpdateEt":"1/12/2021 05:49","dateModified":"2021-01-12T05:49:00Z","checkTimeEt":"01/12 00:49","death":24,"hospitalized":null,"hospitalizedDischarged":null,"dateChecked":"2021-01-12T05:49:00Z","totalTestsViral":null,"positiveTestsViral":null,"negativeTestsViral":null,"positiveCasesViral":null,"deathConfirmed":null,"deathProbable":null,"totalTestEncountersViral":null,"totalTestsPeopleViral":38019,"totalTestsAntibody":null,"positiveTestsAntibody":null,"negativeTestsAntibody":null,"totalTestsPeopleAntibody":null,"positiveTestsPeopleAntibody":null,"negativeTestsPeopleAntibody":null,"totalTestsPeopleAntigen":null,"positiveTestsPeopleAntigen":null,"totalTestsAntigen":null,"positiveTestsAntigen":null,"fips":"78","positiveIncrease":0,"negativeIncrease":0,"total":38019,"totalTestResultsIncrease":0,"posNeg":37925,"dataQualityGrade":null,"deathIncrease":0,"hospitalizedIncrease":0,"hash":"058deb1d739aa957f171ed5d3127ab3123ec34cf","commercialScore":0,"negativeRegularScore":0,"negativeScore":0,"positiveScore":0,"score":0,"grade":""},{"date":20210113,"state":"VI","positive":2166,"probableCases":null,"negative":35759,"pending":94,"totalTestResultsSource":"posNeg","totalTestResults":37925,"hospitalizedCurrently":null,"hospitalizedCumulative":null,"inIcuCurrently":null,"inIcuCumulative":null,"onVentilatorCurrently":null,"onVentilatorCumulative":null,"recovered":2008,"lastUpdateEt":"1/12/2021 05:49","dateModified":"2021-01-12T05:49:00Z","checkTimeEt":"01/12 00:49","death":24,"hospitalized":null,"hospitalizedDischarged":null,"dateChecked":"2021-01-12T05:49:00Z","totalTestsViral":null,"positiveTestsViral":null,"negativeTestsViral":null,"positiveCasesViral":null,"deathConfirmed":null,"deathProbable":null,"totalTestEncountersViral":null,"totalTestsPeopleViral":38019,"totalTestsAntibody":null,"positiveTestsAntibody":null,"negativeTestsAntibody":null,"totalTestsPeopleAntibody":null,"positiveTestsPeopleAntibody":null,"negativeTestsPeopleAntibody":null,"totalTestsPeopleAntigen":null,"positiveTestsPeopleAntigen":null,"totalTestsAntigen":null,"positiveTestsAntigen":null,"fips":"78","positiveIncrease":0,"negativeIncrease":0,"total":38019,"totalTestResultsIncrease":0,"posNeg":37925,"dataQualityGrade":null,"deathIncrease":0,"hospitalizedIncrease":0,"hash":"4af9a8a500a21ca6b77af04197d5220c4530d09e","commercialScore":0,"negativeRegularScore":0,"negativeScore":0,"positiveScore":0,"score":0,"grade":""},{"date":20210112,"state":"VI","positive":2166,"probableCases":null,"negative":35759,"pending":94,"totalTestResultsSource":"posNeg","totalTestResults":37925,"hospitalizedCurrently":null,"hospitalizedCumulative":null,"inIcuCurrently":null,"inIcuCumulative":null,"onVentilatorCurrently":null,"onVentilatorCumulative":null,"recovered":2008,"lastUpdateEt":"1/12/2021 18:59","dateModified":"2021-01-12T18:59:00Z","checkTimeEt":"01/12 13:59","death":24,"hospitalized":null,"hospitalizedDischarged":null,"dateChecked":"2021-01-12T18:59:00Z","totalTestsViral":null,"positiveTestsViral":null,"negativeTestsViral":null,"positiveCasesViral":null,"deathConfirmed":null,"deathProbable":null,"totalTestEncountersViral":null,"totalTestsPeopleViral":38019,"totalTestsAntibody":null,"positiveTestsAntibody":null,"negativeTestsAntibody":null,"totalTestsPeopleAntibody":null,"positiveTestsPeopleAntibody":null,"negativeTestsPeopleAntibody":null,"totalTestsPeopleAntigen":null,"positiveTestsPeopleAntigen":null,"totalTestsAntigen":null,"positiveTestsAntigen":null,"fips":"78","positiveIncrease":23,"negativeIncrease":433,"total":38019,"totalTestResultsIncrease":456,"posNeg":37925,"dataQualityGrade":null,"deathIncrease":0,"hospitalizedIncrease":0,"hash":"69f562ccab637ada4df41312fa2d1dd7004d8769","commercialScore":0,"negativeRegularScore":0,"negativeScore":0,"positiveScore":0,"score":0,"grade":""},{"date":20210111,"state":"VI","positive":2143,"probableCases":null,"negative":35326,"pending":87,"totalTestResultsSource":"posNeg","totalTestResults":37469,"hospitalizedCurrently":null,"hospitalizedCumulative":null,"inIcuCurrently":null,"inIcuCumulative":null,"onVentilatorCurrently":null,"onVentilatorCumulative":null,"recovered":1984,"lastUpdateEt":"1/8/2021 18:59","dateModified":"2021-01-08T18:59:00Z","checkTimeEt":"01/08 13:59","death":24,"hospitalized":null,"hospitalizedDischarged":null,"dateChecked":"2021-01-08T18:59:00Z","totalTestsViral":null,"positiveTestsViral":null,"negativeTestsViral":null,"positiveCasesViral":null,"deathConfirmed":null,"deathProbable":null,"totalTestEncountersViral":null,"totalTestsPeopleViral":37556,"totalTestsAntibody":null,"positiveTestsAntibody":null,"negativeTestsAntibody":null,"totalTestsPeopleAntibody":null,"positiveTestsPeopleAntibody":null,"negativeTestsPeopleAntibody":null,"totalTestsPeopleAntigen":null,"positiveTestsPeopleAntigen":null,"totalTestsAntigen":null,"positiveTestsAntigen":null,"fips":"78","positiveIncrease":0,"negativeIncrease":0,"total":37556,"totalTestResultsIncrease":0,"posNeg":37469,"dataQualityGrade":null,"deathIncrease":0,"hospitalizedIncrease":0,"hash":"c7d1b43a14fa3bfcfb128222f414e2170477a969","commercialScore":0,"negativeRegularScore":0,"negativeScore":0,"positiveScore":0,"score":0,"grade":""},{"date":20210110,"state":"VI","positive":2143,"probableCases":null,"negative":35326,"pending":87,"totalTestResultsSource":"posNeg","totalTestResults":37469,"hospitalizedCurrently":null,"hospitalizedCumulative":null,"inIcuCurrently":null,"inIcuCumulative":null,"onVentilatorCurrently":null,"onVentilatorCumulative":null,"recovered":1984,"lastUpdateEt":"1/8/2021 18:59","dateModified":"2021-01-08T18:59:00Z","checkTimeEt":"01/08 13:59","death":24,"hospitalized":null,"hospitalizedDischarged":null,"dateChecked":"2021-01-08T18:59:00Z","totalTestsViral":null,"positiveTestsViral":null,"negativeTestsViral":null,"positiveCasesViral":null,"deathConfirmed":null,"deathProbable":null,"totalTestEncountersViral":null,"totalTestsPeopleViral":37556,"totalTestsAntibody":null,"positiveTestsAntibody":null,"negativeTestsAntibody":null,"totalTestsPeopleAntibody":null,"positiveTestsPeopleAntibody":null,"negativeTestsPeopleAntibody":null,"totalTestsPeopleAntigen":null,"positiveTestsPeopleAntigen":null,"totalTestsAntigen":null,"positiveTestsAntigen":null,"fips":"78","positiveIncrease":0,"negativeIncrease":0,"total":37556,"totalTestResultsIncrease":0,"posNeg":37469,"dataQualityGrade":null,"deathIncrease":0,"hospitalizedIncrease":0,"hash":"a37b20ac1b4b34b9a2039bea341e22730a4a7207","commercialScore":0,"negativeRegularScore":0,"negativeScore":0,"positiveScore":0,"score":0,"grade":""},{"date":20210109,"state":"VI","positive":2143,"probableCases":null,"negative":35326,"pending":87,"totalTestResultsSource":"posNeg","totalTestResults":37469,"hospitalizedCurrently":null,"hospitalizedCumulative":null,"inIcuCurrently":null,"inIcuCumulative":null,"onVentilatorCurrently":null,"onVentilatorCumulative":null,"recovered":1984,"lastUpdateEt":"1/8/2021 18:59","dateModified":"2021-01-08T18:59:00Z","checkTimeEt":"01/08 13:59","death":24,"hospitalized":null,"hospitalizedDischarged":null,"dateChecked":"2021-01-08T18:59:00Z","totalTestsViral":null,"positiveTestsViral":null,"negativeTestsViral":null,"positiveCasesViral":null,"deathConfirmed":null,"deathProbable":null,"totalTestEncountersViral":null,"totalTestsPeopleViral":37556,"totalTestsAntibody":null,"positiveTestsAntibody":null,"negativeTestsAntibody":null,"totalTestsPeopleAntibody":null,"positiveTestsPeopleAntibody":null,"negativeTestsPeopleAntibody":null,"totalTestsPeopleAntigen":null,"positiveTestsPeopleAntigen":null,"totalTestsAntigen":null,"positiveTestsAntigen":null,"fips":"78","positiveIncrease":0,"negativeIncrease":0,"total":37556,"totalTestResultsIncrease":0,"posNeg":37469,"dataQualityGrade":null,"deathIncrease":0,"hospitalizedIncrease":0,"hash":"dbf3ff782ac806d33716d33f104d71654141d969","commercialScore":0,"negativeRegularScore":0,"negativeScore":0,"positiveScore":0,"score":0,"grade":""},{"date":20210108,"state":"VI","positive":2143,"probableCases":null,"negative":35326,"pending":87,"totalTestResultsSource":"posNeg","totalTestResults":37469,"hospitalizedCurrently":null,"hospitalizedCumulative":null,"inIcuCurrently":null,"inIcuCumulative":null,"onVentilatorCurrently":null,"onVentilatorCumulative":null,"recovered":1984,"lastUpdateEt":"1/8/2021 18:59","dateModified":"2021-01-08T18:59:00Z","checkTimeEt":"01/08 13:59","death":24,"hospitalized":null,"hospitalizedDischarged":null,"dateChecked":"2021-01-08T18:59:00Z","totalTestsViral":null,"positiveTestsViral":null,"negativeTestsViral":null,"positiveCasesViral":null,"deathConfirmed":null,"deathProbable":null,"totalTestEncountersViral":null,"totalTestsPeopleViral":37556,"totalTestsAntibody":null,"positiveTestsAntibody":null,"negativeTestsAntibody":null,"totalTestsPeopleAntibody":null,"positiveTestsPeopleAntibody":null,"negativeTestsPeopleAntibody":null,"totalTestsPeopleAntigen":null,"positiveTestsPeopleAntigen":null,"totalTestsAntigen":null,"positiveTestsAntigen":null,"fips":"78","positiveIncrease":37,"negativeIncrease":390,"total":37556,"totalTestResultsIncrease":427,"posNeg":37469,"dataQualityGrade":null,"deathIncrease":0,"hospitalizedIncrease":0,"hash":"f36d63d876d477488cfc28e2b3f84e3f37c6e40f","commercialScore":0,"negativeRegularScore":0,"negativeScore":0,"positiveScore":0,"score":0,"grade":""},{"date":20210107,"state":"VI","positive":2106,"probableCases":null,"negative":34936,"pending":73,"totalTestResultsSource":"posNeg","totalTestResults":37042,"hospitalizedCurrently":null,"hospitalizedCumulative":null,"inIcuCurrently":null,"inIcuCumulative":null,"onVentilatorCurrently":null,"onVentilatorCumulative":null,"recovered":1955,"lastUpdateEt":"1/7/2021 09:03","dateModified":"2021-01-07T09:03:00Z","checkTimeEt":"01/07 04:03","death":24,"hospitalized":null,"hospitalizedDischarged":null,"dateChecked":"2021-01-07T09:03:00Z","totalTestsViral":null,"positiveTestsViral":null,"negativeTestsViral":null,"positiveCasesViral":null,"deathConfirmed":null,"deathProbable":null,"totalTestEncountersViral":null,"totalTestsPeopleViral":37115,"totalTestsAntibody":null,"positiveTestsAntibody":null,"negativeTestsAntibody":null,"totalTestsPeopleAntibody":null,"positiveTestsPeopleAntibody":null,"negativeTestsPeopleAntibody":null,"totalTestsPeopleAntigen":null,"positiveTestsPeopleAntigen":null,"totalTestsAntigen":null,"positiveTestsAntigen":null,"fips":"78","positiveIncrease":23,"negativeIncrease":66,"total":37115,"totalTestResultsIncrease":89,"posNeg":37042,"dataQualityGrade":null,"deathIncrease":0,"hospitalizedIncrease":0,"hash":"5b78ead97684caf6d29207fa9bdff7bd4bc30ed3","commercialScore":0,"negativeRegularScore":0,"negativeScore":0,"positiveScore":0,"score":0,"grade":""},{"date":20210106,"state":"VI","positive":2083,"probableCases":null,"negative":34870,"pending":79,"totalTestResultsSource":"posNeg","totalTestResults":36953,"hospitalizedCurrently":null,"hospitalizedCumulative":null,"inIcuCurrently":null,"inIcuCumulative":null,"onVentilatorCurrently":null,"onVentilatorCumulative":null,"recovered":1955,"lastUpdateEt":"1/5/2021 19:03","dateModified":"2021-01-05T19:03:00Z","checkTimeEt":"01/05 14:03","death":24,"hospitalized":null,"hospitalizedDischarged":null,"dateChecked":"2021-01-05T19:03:00Z","totalTestsViral":null,"positiveTestsViral":null,"negativeTestsViral":null,"positiveCasesViral":null,"deathConfirmed":null,"deathProbable":null,"totalTestEncountersViral":null,"totalTestsPeopleViral":37032,"totalTestsAntibody":null,"positiveTestsAntibody":null,"negativeTestsAntibody":null,"totalTestsPeopleAntibody":null,"positiveTestsPeopleAntibody":null,"negativeTestsPeopleAntibody":null,"totalTestsPeopleAntigen":null,"positiveTestsPeopleAntigen":null,"totalTestsAntigen":null,"positiveTestsAntigen":null,"fips":"78","positiveIncrease":28,"negativeIncrease":228,"total":37032,"totalTestResultsIncrease":256,"posNeg":36953,"dataQualityGrade":null,"deathIncrease":0,"hospitalizedIncrease":0,"hash":"9486d7c5185f0041248400bc8e1c01672930007c","commercialScore":0,"negativeRegularScore":0,"negativeScore":0,"positiveScore":0,"score":0,"grade":""},{"date":20210105,"state":"VI","positive":2055,"probableCases":null,"negative":34642,"pending":87,"totalTestResultsSource":"posNeg","totalTestResults":36697,"hospitalizedCurrently":null,"hospitalizedCumulative":null,"inIcuCurrently":null,"inIcuCumulative":null,"onVentilatorCurrently":null,"onVentilatorCumulative":null,"recovered":1938,"lastUpdateEt":"1/4/2021 20:28","dateModified":"2021-01-04T20:28:00Z","checkTimeEt":"01/04 15:28","death":24,"hospitalized":null,"hospitalizedDischarged":null,"dateChecked":"2021-01-04T20:28:00Z","totalTestsViral":null,"positiveTestsViral":null,"negativeTestsViral":null,"positiveCasesViral":null,"deathConfirmed":null,"deathProbable":null,"totalTestEncountersViral":null,"totalTestsPeopleViral":36784,"totalTestsAntibody":null,"positiveTestsAntibody":null,"negativeTestsAntibody":null,"totalTestsPeopleAntibody":null,"positiveTestsPeopleAntibody":null,"negativeTestsPeopleAntibody":null,"totalTestsPeopleAntigen":null,"positiveTestsPeopleAntigen":null,"totalTestsAntigen":null,"positiveTestsAntigen":null,"fips":"78","positiveIncrease":13,"negativeIncrease":276,"total":36784,"totalTestResultsIncrease":289,"posNeg":36697,"dataQualityGrade":null,"deathIncrease":1,"hospitalizedIncrease":0,"hash":"68bcc8ea852bfa03fb840d0d3b1b864efa4e2c33","commercialScore":0,"negativeRegularScore":0,"negativeScore":0,"positiveScore":0,"score":0,"grade":""},{"date":20210104,"state":"VI","positive":2042,"probableCases":null,"negative":34366,"pending":55,"totalTestResultsSource":"posNeg","totalTestResults":36408,"hospitalizedCurrently":null,"hospitalizedCumulative":null,"inIcuCurrently":null,"inIcuCumulative":null,"onVentilatorCurrently":null,"onVentilatorCumulative":null,"recovered":1920,"lastUpdateEt":"1/2/2021 21:21","dateModified":"2021-01-02T21:21:00Z","checkTimeEt":"01/02 16:21","death":23,"hospitalized":null,"hospitalizedDischarged":null,"dateChecked":"2021-01-02T21:21:00Z","totalTestsViral":null,"positiveTestsViral":null,"negativeTestsViral":null,"positiveCasesViral":null,"deathConfirmed":null,"deathProbable":null,"totalTestEncountersViral":null,"totalTestsPeopleViral":36463,"totalTestsAntibody":null,"positiveTestsAntibody":null,"negativeTestsAntibody":null,"totalTestsPeopleAntibody":null,"positiveTestsPeopleAntibody":null,"negativeTestsPeopleAntibody":null,"totalTestsPeopleAntigen":null,"positiveTestsPeopleAntigen":null,"totalTestsAntigen":null,"positiveTestsAntigen":null,"fips":"78","positiveIncrease":1,"negativeIncrease":0,"total":36463,"totalTestResultsIncrease":1,"posNeg":36408,"dataQualityGrade":null,"deathIncrease":0,"hospitalizedIncrease":0,"hash":"e93f00a5dcf6954fc38345b2b80f6864e9a5117f","commercialScore":0,"negativeRegularScore":0,"negativeScore":0,"positiveScore":0,"score":0,"grade":""},{"date":20210103,"state":"VI","positive":2041,"probableCases":null,"negative":34366,"pending":55,"totalTestResultsSource":"posNeg","totalTestResults":36407,"hospitalizedCurrently":null,"hospitalizedCumulative":null,"inIcuCurrently":null,"inIcuCumulative":null,"onVentilatorCurrently":null,"onVentilatorCumulative":null,"recovered":1920,"lastUpdateEt":"1/2/2021 21:21","dateModified":"2021-01-02T21:21:00Z","checkTimeEt":"01/02 16:21","death":23,"hospitalized":null,"hospitalizedDischarged":null,"dateChecked":"2021-01-02T21:21:00Z","totalTestsViral":null,"positiveTestsViral":null,"negativeTestsViral":null,"positiveCasesViral":null,"deathConfirmed":null,"deathProbable":null,"totalTestEncountersViral":null,"totalTestsPeopleViral":36462,"totalTestsAntibody":null,"positiveTestsAntibody":null,"negativeTestsAntibody":null,"totalTestsPeopleAntibody":null,"positiveTestsPeopleAntibody":null,"negativeTestsPeopleAntibody":null,"totalTestsPeopleAntigen":null,"positiveTestsPeopleAntigen":null,"totalTestsAntigen":null,"positiveTestsAntigen":null,"fips":"78","positiveIncrease":5,"negativeIncrease":190,"total":36462,"totalTestResultsIncrease":195,"posNeg":36407,"dataQualityGrade":null,"deathIncrease":0,"hospitalizedIncrease":0,"hash":"f76cff9382d4fc59cdd35804b7ca6430b06e8516","commercialScore":0,"negativeRegularScore":0,"negativeScore":0,"positiveScore":0,"score":0,"grade":""},{"date":20210102,"state":"VI","positive":2036,"probableCases":null,"negative":34176,"pending":54,"totalTestResultsSource":"posNeg","totalTestResults":36212,"hospitalizedCurrently":null,"hospitalizedCumulative":null,"inIcuCurrently":null,"inIcuCumulative":null,"onVentilatorCurrently":null,"onVentilatorCumulative":null,"recovered":1901,"lastUpdateEt":"1/1/2021 08:59","dateModified":"2021-01-01T08:59:00Z","checkTimeEt":"01/01 03:59","death":23,"hospitalized":null,"hospitalizedDischarged":null,"dateChecked":"2021-01-01T08:59:00Z","totalTestsViral":null,"positiveTestsViral":null,"negativeTestsViral":null,"positiveCasesViral":null,"deathConfirmed":null,"deathProbable":null,"totalTestEncountersViral":null,"totalTestsPeopleViral":36266,"totalTestsAntibody":null,"positiveTestsAntibody":null,"negativeTestsAntibody":null,"totalTestsPeopleAntibody":null,"positiveTestsPeopleAntibody":null,"negativeTestsPeopleAntibody":null,"totalTestsPeopleAntigen":null,"positiveTestsPeopleAntigen":null,"totalTestsAntigen":null,"positiveTestsAntigen":null,"fips":"78","positiveIncrease":0,"negativeIncrease":0,"total":36266,"totalTestResultsIncrease":0,"posNeg":36212,"dataQualityGrade":null,"deathIncrease":0,"hospitalizedIncrease":0,"hash":"df909b30da8b86bb9c614fa6c217d1cdd0284a4f","commercialScore":0,"negativeRegularScore":0,"negativeScore":0,"positiveScore":0,"score":0,"grade":""},{"date":20210101,"state":"VI","positive":2036,"probableCases":null,"negative":34176,"pending":54,"totalTestResultsSource":"posNeg","totalTestResults":36212,"hospitalizedCurrently":null,"hospitalizedCumulative":null,"inIcuCurrently":null,"inIcuCumulative":null,"onVentilatorCurrently":null,"onVentilatorCumulative":null,"recovered":1901,"lastUpdateEt":"1/1/2021 08:59","dateModified":"2021-01-01T08:59:00Z","checkTimeEt":"01/01 03:59","death":23,"hospitalized":null,"hospitalizedDischarged":null,"dateChecked":"2021-01-01T08:59:00Z","totalTestsViral":null,"positiveTestsViral":null,"negativeTestsViral":null,"positiveCasesViral":null,"deathConfirmed":null,"deathProbable":null,"totalTestEncountersViral":null,"totalTestsPeopleViral":36266,"totalTestsAntibody":null,"positiveTestsAntibody":null,"negativeTestsAntibody":null,"totalTestsPeopleAntibody":null,"positiveTestsPeopleAntibody":null,"negativeTestsPeopleAntibody":null,"totalTestsPeopleAntigen":null,"positiveTestsPeopleAntigen":null,"totalTestsAntigen":null,"positiveTestsAntigen":null,"fips":"78","positiveIncrease":5,"negativeIncrease":37,"total":36266,"totalTestResultsIncrease":42,"posNeg":36212,"dataQualityGrade":null,"deathIncrease":0,"hospitalizedIncrease":0,"hash":"4c01ff050bde3f1f87c04c7b0beb337084c6b262","commercialScore":0,"negativeRegularScore":0,"negativeScore":0,"positiveScore":0,"score":0,"grade":""},{"date":20201231,"state":"VI","positive":2031,"probableCases":null,"negative":34139,"pending":71,"totalTestResultsSource":"posNeg","totalTestResults":36170,"hospitalizedCurrently":null,"hospitalizedCumulative":null,"inIcuCurrently":null,"inIcuCumulative":null,"onVentilatorCurrently":null,"onVentilatorCumulative":null,"recovered":1884,"lastUpdateEt":"12/31/2020 09:22","dateModified":"2020-12-31T09:22:00Z","checkTimeEt":"12/31 04:22","death":23,"hospitalized":null,"hospitalizedDischarged":null,"dateChecked":"2020-12-31T09:22:00Z","totalTestsViral":null,"positiveTestsViral":null,"negativeTestsViral":null,"positiveCasesViral":null,"deathConfirmed":null,"deathProbable":null,"totalTestEncountersViral":null,"totalTestsPeopleViral":36241,"totalTestsAntibody":null,"positiveTestsAntibody":null,"negativeTestsAntibody":null,"totalTestsPeopleAntibody":null,"positiveTestsPeopleAntibody":null,"negativeTestsPeopleAntibody":null,"totalTestsPeopleAntigen":null,"positiveTestsPeopleAntigen":null,"totalTestsAntigen":null,"positiveTestsAntigen":null,"fips":"78","positiveIncrease":21,"negativeIncrease":558,"total":36241,"totalTestResultsIncrease":579,"posNeg":36170,"dataQualityGrade":null,"deathIncrease":0,"hospitalizedIncrease":0,"hash":"df7afc607f6536f5f4586031ff5db6ffaa5e9b3a","commercialScore":0,"negativeRegularScore":0,"negativeScore":0,"positiveScore":0,"score":0,"grade":""},{"date":20201230,"state":"VI","positive":2010,"probableCases":null,"negative":33581,"pending":70,"totalTestResultsSource":"posNeg","totalTestResults":35591,"hospitalizedCurrently":null,"hospitalizedCumulative":null,"inIcuCurrently":null,"inIcuCumulative":null,"onVentilatorCurrently":null,"onVentilatorCumulative":null,"recovered":1875,"lastUpdateEt":"12/30/2020 07:34","dateModified":"2020-12-30T07:34:00Z","checkTimeEt":"12/30 02:34","death":23,"hospitalized":null,"hospitalizedDischarged":null,"dateChecked":"2020-12-30T07:34:00Z","totalTestsViral":null,"positiveTestsViral":null,"negativeTestsViral":null,"positiveCasesViral":null,"deathConfirmed":null,"deathProbable":null,"totalTestEncountersViral":null,"totalTestsPeopleViral":35661,"totalTestsAntibody":null,"positiveTestsAntibody":null,"negativeTestsAntibody":null,"totalTestsPeopleAntibody":null,"positiveTestsPeopleAntibody":null,"negativeTestsPeopleAntibody":null,"totalTestsPeopleAntigen":null,"positiveTestsPeopleAntigen":null,"totalTestsAntigen":null,"positiveTestsAntigen":null,"fips":"78","positiveIncrease":31,"negativeIncrease":376,"total":35661,"totalTestResultsIncrease":407,"posNeg":35591,"dataQualityGrade":null,"deathIncrease":0,"hospitalizedIncrease":0,"hash":"e6951744f29aa232c11f820bd40b7ccd98462501","commercialScore":0,"negativeRegularScore":0,"negativeScore":0,"positiveScore":0,"score":0,"grade":""},{"date":20201229,"state":"VI","positive":1979,"probableCases":null,"negative":33205,"pending":85,"totalTestResultsSource":"posNeg","totalTestResults":35184,"hospitalizedCurrently":null,"hospitalizedCumulative":null,"inIcuCurrently":null,"inIcuCumulative":null,"onVentilatorCurrently":null,"onVentilatorCumulative":null,"recovered":1824,"lastUpdateEt":"12/25/2020 13:10","dateModified":"2020-12-25T13:10:00Z","checkTimeEt":"12/25 08:10","death":23,"hospitalized":null,"hospitalizedDischarged":null,"dateChecked":"2020-12-25T13:10:00Z","totalTestsViral":null,"positiveTestsViral":null,"negativeTestsViral":null,"positiveCasesViral":null,"deathConfirmed":null,"deathProbable":null,"totalTestEncountersViral":null,"totalTestsPeopleViral":35269,"totalTestsAntibody":null,"positiveTestsAntibody":null,"negativeTestsAntibody":null,"totalTestsPeopleAntibody":null,"positiveTestsPeopleAntibody":null,"negativeTestsPeopleAntibody":null,"totalTestsPeopleAntigen":null,"positiveTestsPeopleAntigen":null,"totalTestsAntigen":null,"positiveTestsAntigen":null,"fips":"78","positiveIncrease":0,"negativeIncrease":0,"total":35269,"totalTestResultsIncrease":0,"posNeg":35184,"dataQualityGrade":null,"deathIncrease":0,"hospitalizedIncrease":0,"hash":"11a1c1a9360cf9fe10fc2442f772eff75a09beeb","commercialScore":0,"negativeRegularScore":0,"negativeScore":0,"positiveScore":0,"score":0,"grade":""},{"date":20201228,"state":"VI","positive":1979,"probableCases":null,"negative":33205,"pending":85,"totalTestResultsSource":"posNeg","totalTestResults":35184,"hospitalizedCurrently":null,"hospitalizedCumulative":null,"inIcuCurrently":null,"inIcuCumulative":null,"onVentilatorCurrently":null,"onVentilatorCumulative":null,"recovered":1824,"lastUpdateEt":"12/25/2020 13:10","dateModified":"2020-12-25T13:10:00Z","checkTimeEt":"12/25 08:10","death":23,"hospitalized":null,"hospitalizedDischarged":null,"dateChecked":"2020-12-25T13:10:00Z","totalTestsViral":null,"positiveTestsViral":null,"negativeTestsViral":null,"positiveCasesViral":null,"deathConfirmed":null,"deathProbable":null,"totalTestEncountersViral":null,"totalTestsPeopleViral":35269,"totalTestsAntibody":null,"positiveTestsAntibody":null,"negativeTestsAntibody":null,"totalTestsPeopleAntibody":null,"positiveTestsPeopleAntibody":null,"negativeTestsPeopleAntibody":null,"totalTestsPeopleAntigen":null,"positiveTestsPeopleAntigen":null,"totalTestsAntigen":null,"positiveTestsAntigen":null,"fips":"78","positiveIncrease":0,"negativeIncrease":0,"total":35269,"totalTestResultsIncrease":0,"posNeg":35184,"dataQualityGrade":null,"deathIncrease":0,"hospitalizedIncrease":0,"hash":"6fd88510734b7dd82ce79c1b7d18ea578340a51a","commercialScore":0,"negativeRegularScore":0,"negativeScore":0,"positiveScore":0,"score":0,"grade":""},{"date":20201227,"state":"VI","positive":1979,"probableCases":null,"negative":33205,"pending":85,"totalTestResultsSource":"posNeg","totalTestResults":35184,"hospitalizedCurrently":null,"hospitalizedCumulative":null,"inIcuCurrently":null,"inIcuCumulative":null,"onVentilatorCurrently":null,"onVentilatorCumulative":null,"recovered":1824,"lastUpdateEt":"12/25/2020 13:10","dateModified":"2020-12-25T13:10:00Z","checkTimeEt":"12/25 08:10","death":23,"hospitalized":null,"hospitalizedDischarged":null,"dateChecked":"2020-12-25T13:10:00Z","totalTestsViral":null,"positiveTestsViral":null,"negativeTestsViral":null,"positiveCasesViral":null,"deathConfirmed":null,"deathProbable":null,"totalTestEncountersViral":null,"totalTestsPeopleViral":35269,"totalTestsAntibody":null,"positiveTestsAntibody":null,"negativeTestsAntibody":null,"totalTestsPeopleAntibody":null,"positiveTestsPeopleAntibody":null,"negativeTestsPeopleAntibody":null,"totalTestsPeopleAntigen":null,"positiveTestsPeopleAntigen":null,"totalTestsAntigen":null,"positiveTestsAntigen":null,"fips":"78","positiveIncrease":0,"negativeIncrease":0,"total":35269,"totalTestResultsIncrease":0,"posNeg":35184,"dataQualityGrade":null,"deathIncrease":0,"hospitalizedIncrease":0,"hash":"efb5351ca6f54e978709c3900d278025d600139a","commercialScore":0,"negativeRegularScore":0,"negativeScore":0,"positiveScore":0,"score":0,"grade":""},{"date":20201226,"state":"VI","positive":1979,"probableCases":null,"negative":33205,"pending":85,"totalTestResultsSource":"posNeg","totalTestResults":35184,"hospitalizedCurrently":null,"hospitalizedCumulative":null,"inIcuCurrently":null,"inIcuCumulative":null,"onVentilatorCurrently":null,"onVentilatorCumulative":null,"recovered":1824,"lastUpdateEt":"12/25/2020 13:10","dateModified":"2020-12-25T13:10:00Z","checkTimeEt":"12/25 08:10","death":23,"hospitalized":null,"hospitalizedDischarged":null,"dateChecked":"2020-12-25T13:10:00Z","totalTestsViral":null,"positiveTestsViral":null,"negativeTestsViral":null,"positiveCasesViral":null,"deathConfirmed":null,"deathProbable":null,"totalTestEncountersViral":null,"totalTestsPeopleViral":35269,"totalTestsAntibody":null,"positiveTestsAntibody":null,"negativeTestsAntibody":null,"totalTestsPeopleAntibody":null,"positiveTestsPeopleAntibody":null,"negativeTestsPeopleAntibody":null,"totalTestsPeopleAntigen":null,"positiveTestsPeopleAntigen":null,"totalTestsAntigen":null,"positiveTestsAntigen":null,"fips":"78","positiveIncrease":0,"negativeIncrease":0,"total":35269,"totalTestResultsIncrease":0,"posNeg":35184,"dataQualityGrade":null,"deathIncrease":0,"hospitalizedIncrease":0,"hash":"4cce6be3e2d25484c99b731fb892a1b898830a98","commercialScore":0,"negativeRegularScore":0,"negativeScore":0,"positiveScore":0,"score":0,"grade":""},{"date":20201225,"state":"VI","positive":1979,"probableCases":null,"negative":33205,"pending":85,"totalTestResultsSource":"posNeg","totalTestResults":35184,"hospitalizedCurrently":null,"hospitalizedCumulative":null,"inIcuCurrently":null,"inIcuCumulative":null,"onVentilatorCurrently":null,"onVentilatorCumulative":null,"recovered":1824,"lastUpdateEt":"12/25/2020 13:10","dateModified":"2020-12-25T13:10:00Z","checkTimeEt":"12/25 08:10","death":23,"hospitalized":null,"hospitalizedDischarged":null,"dateChecked":"2020-12-25T13:10:00Z","totalTestsViral":null,"positiveTestsViral":null,"negativeTestsViral":null,"positiveCasesViral":null,"deathConfirmed":null,"deathProbable":null,"totalTestEncountersViral":null,"totalTestsPeopleViral":35269,"totalTestsAntibody":null,"positiveTestsAntibody":null,"negativ