[{"date":20210307,"state":"WA","positive":344532,"probableCases":19479,"negative":null,"pending":null,"totalTestResultsSource":"totalTestEncountersViral","totalTestResults":5393756,"hospitalizedCurrently":431,"hospitalizedCumulative":19599,"inIcuCurrently":98,"inIcuCumulative":null,"onVentilatorCurrently":43,"onVentilatorCumulative":null,"recovered":null,"lastUpdateEt":"3/6/2021 02:59","dateModified":"2021-03-06T02:59:00Z","checkTimeEt":"03/05 21:59","death":5041,"hospitalized":19599,"hospitalizedDischarged":null,"dateChecked":"2021-03-06T02:59:00Z","totalTestsViral":null,"positiveTestsViral":324994,"negativeTestsViral":5068404,"positiveCasesViral":325053,"deathConfirmed":null,"deathProbable":null,"totalTestEncountersViral":5393756,"totalTestsPeopleViral":null,"totalTestsAntibody":null,"positiveTestsAntibody":null,"negativeTestsAntibody":null,"totalTestsPeopleAntibody":null,"positiveTestsPeopleAntibody":null,"negativeTestsPeopleAntibody":null,"totalTestsPeopleAntigen":null,"positiveTestsPeopleAntigen":null,"totalTestsAntigen":null,"positiveTestsAntigen":null,"fips":"53","positiveIncrease":664,"negativeIncrease":0,"total":344532,"totalTestResultsIncrease":24040,"posNeg":344532,"dataQualityGrade":null,"deathIncrease":0,"hospitalizedIncrease":43,"hash":"d05df9ca1d090fd6a3f3f864eb442dc471e5861e","commercialScore":0,"negativeRegularScore":0,"negativeScore":0,"positiveScore":0,"score":0,"grade":""},{"date":20210306,"state":"WA","positive":343868,"probableCases":19399,"negative":null,"pending":null,"totalTestResultsSource":"totalTestEncountersViral","totalTestResults":5369716,"hospitalizedCurrently":431,"hospitalizedCumulative":19556,"inIcuCurrently":98,"inIcuCumulative":null,"onVentilatorCurrently":30,"onVentilatorCumulative":null,"recovered":null,"lastUpdateEt":"3/5/2021 02:59","dateModified":"2021-03-05T02:59:00Z","checkTimeEt":"03/04 21:59","death":5041,"hospitalized":19556,"hospitalizedDischarged":null,"dateChecked":"2021-03-05T02:59:00Z","totalTestsViral":null,"positiveTestsViral":324428,"negativeTestsViral":5044931,"positiveCasesViral":324469,"deathConfirmed":null,"deathProbable":null,"totalTestEncountersViral":5369716,"totalTestsPeopleViral":null,"totalTestsAntibody":null,"positiveTestsAntibody":null,"negativeTestsAntibody":null,"totalTestsPeopleAntibody":null,"positiveTestsPeopleAntibody":null,"negativeTestsPeopleAntibody":null,"totalTestsPeopleAntigen":null,"positiveTestsPeopleAntigen":null,"totalTestsAntigen":null,"positiveTestsAntigen":null,"fips":"53","positiveIncrease":778,"negativeIncrease":0,"total":343868,"totalTestResultsIncrease":25314,"posNeg":343868,"dataQualityGrade":null,"deathIncrease":9,"hospitalizedIncrease":56,"hash":"9c3d51898827e2a22da6bd3c711dc1f5e33ac644","commercialScore":0,"negativeRegularScore":0,"negativeScore":0,"positiveScore":0,"score":0,"grade":""},{"date":20210305,"state":"WA","positive":343090,"probableCases":19251,"negative":null,"pending":null,"totalTestResultsSource":"totalTestEncountersViral","totalTestResults":5344402,"hospitalizedCurrently":413,"hospitalizedCumulative":19500,"inIcuCurrently":108,"inIcuCumulative":null,"onVentilatorCurrently":57,"onVentilatorCumulative":null,"recovered":null,"lastUpdateEt":"3/4/2021 02:59","dateModified":"2021-03-04T02:59:00Z","checkTimeEt":"03/03 21:59","death":5032,"hospitalized":19500,"hospitalizedDischarged":null,"dateChecked":"2021-03-04T02:59:00Z","totalTestsViral":null,"positiveTestsViral":323771,"negativeTestsViral":5020273,"positiveCasesViral":323839,"deathConfirmed":null,"deathProbable":null,"totalTestEncountersViral":5344402,"totalTestsPeopleViral":null,"totalTestsAntibody":null,"positiveTestsAntibody":null,"negativeTestsAntibody":null,"totalTestsPeopleAntibody":null,"positiveTestsPeopleAntibody":null,"negativeTestsPeopleAntibody":null,"totalTestsPeopleAntigen":null,"positiveTestsPeopleAntigen":null,"totalTestsAntigen":null,"positiveTestsAntigen":null,"fips":"53","positiveIncrease":854,"negativeIncrease":0,"total":343090,"totalTestResultsIncrease":24021,"posNeg":343090,"dataQualityGrade":null,"deathIncrease":20,"hospitalizedIncrease":34,"hash":"078b9df9fe8e12351c7bd32105879bada84ba66b","commercialScore":0,"negativeRegularScore":0,"negativeScore":0,"positiveScore":0,"score":0,"grade":""},{"date":20210304,"state":"WA","positive":342236,"probableCases":19113,"negative":null,"pending":null,"totalTestResultsSource":"totalTestEncountersViral","totalTestResults":5320381,"hospitalizedCurrently":461,"hospitalizedCumulative":19466,"inIcuCurrently":121,"inIcuCumulative":null,"onVentilatorCurrently":61,"onVentilatorCumulative":null,"recovered":null,"lastUpdateEt":"3/3/2021 02:59","dateModified":"2021-03-03T02:59:00Z","checkTimeEt":"03/02 21:59","death":5012,"hospitalized":19466,"hospitalizedDischarged":null,"dateChecked":"2021-03-03T02:59:00Z","totalTestsViral":null,"positiveTestsViral":323057,"negativeTestsViral":4996968,"positiveCasesViral":323123,"deathConfirmed":null,"deathProbable":null,"totalTestEncountersViral":5320381,"totalTestsPeopleViral":null,"totalTestsAntibody":null,"positiveTestsAntibody":null,"negativeTestsAntibody":null,"totalTestsPeopleAntibody":null,"positiveTestsPeopleAntibody":null,"negativeTestsPeopleAntibody":null,"totalTestsPeopleAntigen":null,"positiveTestsPeopleAntigen":null,"totalTestsAntigen":null,"positiveTestsAntigen":null,"fips":"53","positiveIncrease":795,"negativeIncrease":0,"total":342236,"totalTestResultsIncrease":18873,"posNeg":342236,"dataQualityGrade":null,"deathIncrease":24,"hospitalizedIncrease":33,"hash":"406adfbf28c14b781aa58d405e33340f17ed3235","commercialScore":0,"negativeRegularScore":0,"negativeScore":0,"positiveScore":0,"score":0,"grade":""},{"date":20210303,"state":"WA","positive":341441,"probableCases":18954,"negative":null,"pending":null,"totalTestResultsSource":"totalTestEncountersViral","totalTestResults":5301508,"hospitalizedCurrently":467,"hospitalizedCumulative":19433,"inIcuCurrently":131,"inIcuCumulative":null,"onVentilatorCurrently":64,"onVentilatorCumulative":null,"recovered":null,"lastUpdateEt":"3/2/2021 02:59","dateModified":"2021-03-02T02:59:00Z","checkTimeEt":"03/01 21:59","death":4988,"hospitalized":19433,"hospitalizedDischarged":null,"dateChecked":"2021-03-02T02:59:00Z","totalTestsViral":null,"positiveTestsViral":322430,"negativeTestsViral":4978720,"positiveCasesViral":322487,"deathConfirmed":null,"deathProbable":null,"totalTestEncountersViral":5301508,"totalTestsPeopleViral":null,"totalTestsAntibody":null,"positiveTestsAntibody":null,"negativeTestsAntibody":null,"totalTestsPeopleAntibody":null,"positiveTestsPeopleAntibody":null,"negativeTestsPeopleAntibody":null,"totalTestsPeopleAntigen":null,"positiveTestsPeopleAntigen":null,"totalTestsAntigen":null,"positiveTestsAntigen":null,"fips":"53","positiveIncrease":733,"negativeIncrease":0,"total":341441,"totalTestResultsIncrease":21178,"posNeg":341441,"dataQualityGrade":null,"deathIncrease":19,"hospitalizedIncrease":61,"hash":"3fe4eb4ae0439801b47489f01d076af009c00413","commercialScore":0,"negativeRegularScore":0,"negativeScore":0,"positiveScore":0,"score":0,"grade":""},{"date":20210302,"state":"WA","positive":340708,"probableCases":18827,"negative":null,"pending":null,"totalTestResultsSource":"totalTestEncountersViral","totalTestResults":5280330,"hospitalizedCurrently":473,"hospitalizedCumulative":19372,"inIcuCurrently":125,"inIcuCumulative":null,"onVentilatorCurrently":61,"onVentilatorCumulative":null,"recovered":null,"lastUpdateEt":"3/1/2021 02:59","dateModified":"2021-03-01T02:59:00Z","checkTimeEt":"02/28 21:59","death":4969,"hospitalized":19372,"hospitalizedDischarged":null,"dateChecked":"2021-03-01T02:59:00Z","totalTestsViral":null,"positiveTestsViral":321822,"negativeTestsViral":4958153,"positiveCasesViral":321881,"deathConfirmed":null,"deathProbable":null,"totalTestEncountersViral":5280330,"totalTestsPeopleViral":null,"totalTestsAntibody":null,"positiveTestsAntibody":null,"negativeTestsAntibody":null,"totalTestsPeopleAntibody":null,"positiveTestsPeopleAntibody":null,"negativeTestsPeopleAntibody":null,"totalTestsPeopleAntigen":null,"positiveTestsPeopleAntigen":null,"totalTestsAntigen":null,"positiveTestsAntigen":null,"fips":"53","positiveIncrease":935,"negativeIncrease":0,"total":340708,"totalTestResultsIncrease":45898,"posNeg":340708,"dataQualityGrade":null,"deathIncrease":13,"hospitalizedIncrease":53,"hash":"df2280e8791072f3365a7360178c1b346da9f8f8","commercialScore":0,"negativeRegularScore":0,"negativeScore":0,"positiveScore":0,"score":0,"grade":""},{"date":20210301,"state":"WA","positive":339773,"probableCases":18694,"negative":null,"pending":null,"totalTestResultsSource":"totalTestEncountersViral","totalTestResults":5234432,"hospitalizedCurrently":498,"hospitalizedCumulative":19319,"inIcuCurrently":135,"inIcuCumulative":null,"onVentilatorCurrently":58,"onVentilatorCumulative":null,"recovered":null,"lastUpdateEt":"2/27/2021 02:59","dateModified":"2021-02-27T02:59:00Z","checkTimeEt":"02/26 21:59","death":4956,"hospitalized":19319,"hospitalizedDischarged":null,"dateChecked":"2021-02-27T02:59:00Z","totalTestsViral":null,"positiveTestsViral":321014,"negativeTestsViral":4913062,"positiveCasesViral":321079,"deathConfirmed":null,"deathProbable":null,"totalTestEncountersViral":5234432,"totalTestsPeopleViral":null,"totalTestsAntibody":null,"positiveTestsAntibody":null,"negativeTestsAntibody":null,"totalTestsPeopleAntibody":null,"positiveTestsPeopleAntibody":null,"negativeTestsPeopleAntibody":null,"totalTestsPeopleAntigen":null,"positiveTestsPeopleAntigen":null,"totalTestsAntigen":null,"positiveTestsAntigen":null,"fips":"53","positiveIncrease":0,"negativeIncrease":0,"total":339773,"totalTestResultsIncrease":0,"posNeg":339773,"dataQualityGrade":null,"deathIncrease":0,"hospitalizedIncrease":0,"hash":"d09e21118d736eaffaf6b2a9053715435abe95f1","commercialScore":0,"negativeRegularScore":0,"negativeScore":0,"positiveScore":0,"score":0,"grade":""},{"date":20210228,"state":"WA","positive":339773,"probableCases":18694,"negative":null,"pending":null,"totalTestResultsSource":"totalTestEncountersViral","totalTestResults":5234432,"hospitalizedCurrently":498,"hospitalizedCumulative":19319,"inIcuCurrently":135,"inIcuCumulative":null,"onVentilatorCurrently":58,"onVentilatorCumulative":null,"recovered":null,"lastUpdateEt":"2/26/2021 02:59","dateModified":"2021-02-26T02:59:00Z","checkTimeEt":"02/25 21:59","death":4956,"hospitalized":19319,"hospitalizedDischarged":null,"dateChecked":"2021-02-26T02:59:00Z","totalTestsViral":null,"positiveTestsViral":321014,"negativeTestsViral":4913062,"positiveCasesViral":321079,"deathConfirmed":null,"deathProbable":null,"totalTestEncountersViral":5234432,"totalTestsPeopleViral":null,"totalTestsAntibody":null,"positiveTestsAntibody":null,"negativeTestsAntibody":null,"totalTestsPeopleAntibody":null,"positiveTestsPeopleAntibody":null,"negativeTestsPeopleAntibody":null,"totalTestsPeopleAntigen":null,"positiveTestsPeopleAntigen":null,"totalTestsAntigen":null,"positiveTestsAntigen":null,"fips":"53","positiveIncrease":951,"negativeIncrease":0,"total":339773,"totalTestResultsIncrease":21008,"posNeg":339773,"dataQualityGrade":null,"deathIncrease":0,"hospitalizedIncrease":44,"hash":"10a010d30d841afad37ec751a61addb58228f1ab","commercialScore":0,"negativeRegularScore":0,"negativeScore":0,"positiveScore":0,"score":0,"grade":""},{"date":20210227,"state":"WA","positive":338822,"probableCases":18505,"negative":null,"pending":null,"totalTestResultsSource":"totalTestEncountersViral","totalTestResults":5213424,"hospitalizedCurrently":498,"hospitalizedCumulative":19275,"inIcuCurrently":135,"inIcuCumulative":null,"onVentilatorCurrently":59,"onVentilatorCumulative":null,"recovered":null,"lastUpdateEt":"2/26/2021 02:59","dateModified":"2021-02-26T02:59:00Z","checkTimeEt":"02/25 21:59","death":4956,"hospitalized":19275,"hospitalizedDischarged":null,"dateChecked":"2021-02-26T02:59:00Z","totalTestsViral":null,"positiveTestsViral":320250,"negativeTestsViral":4892820,"positiveCasesViral":320317,"deathConfirmed":null,"deathProbable":null,"totalTestEncountersViral":5213424,"totalTestsPeopleViral":null,"totalTestsAntibody":null,"positiveTestsAntibody":null,"negativeTestsAntibody":null,"totalTestsPeopleAntibody":null,"positiveTestsPeopleAntibody":null,"negativeTestsPeopleAntibody":null,"totalTestsPeopleAntigen":null,"positiveTestsPeopleAntigen":null,"totalTestsAntigen":null,"positiveTestsAntigen":null,"fips":"53","positiveIncrease":1169,"negativeIncrease":0,"total":338822,"totalTestResultsIncrease":20174,"posNeg":338822,"dataQualityGrade":null,"deathIncrease":14,"hospitalizedIncrease":51,"hash":"357c28aa54fd824756c92e1b0f551896020373bf","commercialScore":0,"negativeRegularScore":0,"negativeScore":0,"positiveScore":0,"score":0,"grade":""},{"date":20210226,"state":"WA","positive":337653,"probableCases":18155,"negative":null,"pending":null,"totalTestResultsSource":"totalTestEncountersViral","totalTestResults":5193250,"hospitalizedCurrently":548,"hospitalizedCumulative":19224,"inIcuCurrently":168,"inIcuCumulative":null,"onVentilatorCurrently":62,"onVentilatorCumulative":null,"recovered":null,"lastUpdateEt":"2/25/2021 02:59","dateModified":"2021-02-25T02:59:00Z","checkTimeEt":"02/24 21:59","death":4942,"hospitalized":19224,"hospitalizedDischarged":null,"dateChecked":"2021-02-25T02:59:00Z","totalTestsViral":null,"positiveTestsViral":319438,"negativeTestsViral":4873457,"positiveCasesViral":319498,"deathConfirmed":null,"deathProbable":null,"totalTestEncountersViral":5193250,"totalTestsPeopleViral":null,"totalTestsAntibody":null,"positiveTestsAntibody":null,"negativeTestsAntibody":null,"totalTestsPeopleAntibody":null,"positiveTestsPeopleAntibody":null,"negativeTestsPeopleAntibody":null,"totalTestsPeopleAntigen":null,"positiveTestsPeopleAntigen":null,"totalTestsAntigen":null,"positiveTestsAntigen":null,"fips":"53","positiveIncrease":1088,"negativeIncrease":0,"total":337653,"totalTestResultsIncrease":25737,"posNeg":337653,"dataQualityGrade":null,"deathIncrease":30,"hospitalizedIncrease":13,"hash":"6c5e8145bbbf49cf8bbe87ef83fbe500f5ac2470","commercialScore":0,"negativeRegularScore":0,"negativeScore":0,"positiveScore":0,"score":0,"grade":""},{"date":20210225,"state":"WA","positive":336565,"probableCases":18055,"negative":null,"pending":null,"totalTestResultsSource":"totalTestEncountersViral","totalTestResults":5167513,"hospitalizedCurrently":534,"hospitalizedCumulative":19211,"inIcuCurrently":152,"inIcuCumulative":null,"onVentilatorCurrently":60,"onVentilatorCumulative":null,"recovered":null,"lastUpdateEt":"2/24/2021 02:59","dateModified":"2021-02-24T02:59:00Z","checkTimeEt":"02/23 21:59","death":4912,"hospitalized":19211,"hospitalizedDischarged":null,"dateChecked":"2021-02-24T02:59:00Z","totalTestsViral":null,"positiveTestsViral":318442,"negativeTestsViral":4848716,"positiveCasesViral":318510,"deathConfirmed":null,"deathProbable":null,"totalTestEncountersViral":5167513,"totalTestsPeopleViral":null,"totalTestsAntibody":null,"positiveTestsAntibody":null,"negativeTestsAntibody":null,"totalTestsPeopleAntibody":null,"positiveTestsPeopleAntibody":null,"negativeTestsPeopleAntibody":null,"totalTestsPeopleAntigen":null,"positiveTestsPeopleAntigen":null,"totalTestsAntigen":null,"positiveTestsAntigen":null,"fips":"53","positiveIncrease":872,"negativeIncrease":0,"total":336565,"totalTestResultsIncrease":21996,"posNeg":336565,"dataQualityGrade":null,"deathIncrease":31,"hospitalizedIncrease":51,"hash":"e12f3a3a2eb47278e00669814d984b51b9c6cccf","commercialScore":0,"negativeRegularScore":0,"negativeScore":0,"positiveScore":0,"score":0,"grade":""},{"date":20210224,"state":"WA","positive":335693,"probableCases":17888,"negative":null,"pending":null,"totalTestResultsSource":"totalTestEncountersViral","totalTestResults":5145517,"hospitalizedCurrently":544,"hospitalizedCumulative":19160,"inIcuCurrently":98,"inIcuCumulative":null,"onVentilatorCurrently":58,"onVentilatorCumulative":null,"recovered":null,"lastUpdateEt":"2/23/2021 02:59","dateModified":"2021-02-23T02:59:00Z","checkTimeEt":"02/22 21:59","death":4881,"hospitalized":19160,"hospitalizedDischarged":null,"dateChecked":"2021-02-23T02:59:00Z","totalTestsViral":null,"positiveTestsViral":317740,"negativeTestsViral":4827423,"positiveCasesViral":317805,"deathConfirmed":null,"deathProbable":null,"totalTestEncountersViral":5145517,"totalTestsPeopleViral":null,"totalTestsAntibody":null,"positiveTestsAntibody":null,"negativeTestsAntibody":null,"totalTestsPeopleAntibody":null,"positiveTestsPeopleAntibody":null,"negativeTestsPeopleAntibody":null,"totalTestsPeopleAntigen":null,"positiveTestsPeopleAntigen":null,"totalTestsAntigen":null,"positiveTestsAntigen":null,"fips":"53","positiveIncrease":731,"negativeIncrease":0,"total":335693,"totalTestResultsIncrease":25291,"posNeg":335693,"dataQualityGrade":null,"deathIncrease":24,"hospitalizedIncrease":50,"hash":"631a12d71948112877c86fa72ac3e3d7c2e6270f","commercialScore":0,"negativeRegularScore":0,"negativeScore":0,"positiveScore":0,"score":0,"grade":""},{"date":20210223,"state":"WA","positive":334962,"probableCases":17739,"negative":null,"pending":null,"totalTestResultsSource":"totalTestEncountersViral","totalTestResults":5120226,"hospitalizedCurrently":565,"hospitalizedCumulative":19110,"inIcuCurrently":121,"inIcuCumulative":null,"onVentilatorCurrently":55,"onVentilatorCumulative":null,"recovered":null,"lastUpdateEt":"2/22/2021 02:59","dateModified":"2021-02-22T02:59:00Z","checkTimeEt":"02/21 21:59","death":4857,"hospitalized":19110,"hospitalizedDischarged":null,"dateChecked":"2021-02-22T02:59:00Z","totalTestsViral":null,"positiveTestsViral":317161,"negativeTestsViral":4802711,"positiveCasesViral":317223,"deathConfirmed":null,"deathProbable":null,"totalTestEncountersViral":5120226,"totalTestsPeopleViral":null,"totalTestsAntibody":null,"positiveTestsAntibody":null,"negativeTestsAntibody":null,"totalTestsPeopleAntibody":null,"positiveTestsPeopleAntibody":null,"negativeTestsPeopleAntibody":null,"totalTestsPeopleAntigen":null,"positiveTestsPeopleAntigen":null,"totalTestsAntigen":null,"positiveTestsAntigen":null,"fips":"53","positiveIncrease":1168,"negativeIncrease":0,"total":334962,"totalTestResultsIncrease":46148,"posNeg":334962,"dataQualityGrade":null,"deathIncrease":35,"hospitalizedIncrease":77,"hash":"da415d5852123847b64e2ae345f54b0d21f47901","commercialScore":0,"negativeRegularScore":0,"negativeScore":0,"positiveScore":0,"score":0,"grade":""},{"date":20210222,"state":"WA","positive":333794,"probableCases":17608,"negative":null,"pending":null,"totalTestResultsSource":"totalTestEncountersViral","totalTestResults":5074078,"hospitalizedCurrently":608,"hospitalizedCumulative":19033,"inIcuCurrently":123,"inIcuCumulative":null,"onVentilatorCurrently":54,"onVentilatorCumulative":null,"recovered":null,"lastUpdateEt":"2/20/2021 02:59","dateModified":"2021-02-20T02:59:00Z","checkTimeEt":"02/19 21:59","death":4822,"hospitalized":19033,"hospitalizedDischarged":null,"dateChecked":"2021-02-20T02:59:00Z","totalTestsViral":null,"positiveTestsViral":316119,"negativeTestsViral":4757606,"positiveCasesViral":316186,"deathConfirmed":null,"deathProbable":null,"totalTestEncountersViral":5074078,"totalTestsPeopleViral":null,"totalTestsAntibody":null,"positiveTestsAntibody":null,"negativeTestsAntibody":null,"totalTestsPeopleAntibody":null,"positiveTestsPeopleAntibody":null,"negativeTestsPeopleAntibody":null,"totalTestsPeopleAntigen":null,"positiveTestsPeopleAntigen":null,"totalTestsAntigen":null,"positiveTestsAntigen":null,"fips":"53","positiveIncrease":0,"negativeIncrease":0,"total":333794,"totalTestResultsIncrease":0,"posNeg":333794,"dataQualityGrade":null,"deathIncrease":0,"hospitalizedIncrease":0,"hash":"9de8273864eddb7c1a43d7f4a34917a8b5dd3e00","commercialScore":0,"negativeRegularScore":0,"negativeScore":0,"positiveScore":0,"score":0,"grade":""},{"date":20210221,"state":"WA","positive":333794,"probableCases":17608,"negative":null,"pending":null,"totalTestResultsSource":"totalTestEncountersViral","totalTestResults":5074078,"hospitalizedCurrently":608,"hospitalizedCumulative":19033,"inIcuCurrently":123,"inIcuCumulative":null,"onVentilatorCurrently":54,"onVentilatorCumulative":null,"recovered":null,"lastUpdateEt":"2/20/2021 02:59","dateModified":"2021-02-20T02:59:00Z","checkTimeEt":"02/19 21:59","death":4822,"hospitalized":19033,"hospitalizedDischarged":null,"dateChecked":"2021-02-20T02:59:00Z","totalTestsViral":null,"positiveTestsViral":316119,"negativeTestsViral":4757606,"positiveCasesViral":316186,"deathConfirmed":null,"deathProbable":null,"totalTestEncountersViral":5074078,"totalTestsPeopleViral":null,"totalTestsAntibody":null,"positiveTestsAntibody":null,"negativeTestsAntibody":null,"totalTestsPeopleAntibody":null,"positiveTestsPeopleAntibody":null,"negativeTestsPeopleAntibody":null,"totalTestsPeopleAntigen":null,"positiveTestsPeopleAntigen":null,"totalTestsAntigen":null,"positiveTestsAntigen":null,"fips":"53","positiveIncrease":890,"negativeIncrease":0,"total":333794,"totalTestResultsIncrease":26024,"posNeg":333794,"dataQualityGrade":null,"deathIncrease":0,"hospitalizedIncrease":64,"hash":"5dd0c219e13eb3dd9fc82743b2713c41360aeec4","commercialScore":0,"negativeRegularScore":0,"negativeScore":0,"positiveScore":0,"score":0,"grade":""},{"date":20210220,"state":"WA","positive":332904,"probableCases":17485,"negative":null,"pending":null,"totalTestResultsSource":"totalTestEncountersViral","totalTestResults":5048054,"hospitalizedCurrently":608,"hospitalizedCumulative":18969,"inIcuCurrently":123,"inIcuCumulative":null,"onVentilatorCurrently":59,"onVentilatorCumulative":null,"recovered":null,"lastUpdateEt":"2/19/2021 02:59","dateModified":"2021-02-19T02:59:00Z","checkTimeEt":"02/18 21:59","death":4822,"hospitalized":18969,"hospitalizedDischarged":null,"dateChecked":"2021-02-19T02:59:00Z","totalTestsViral":null,"positiveTestsViral":315364,"negativeTestsViral":4732340,"positiveCasesViral":315419,"deathConfirmed":null,"deathProbable":null,"totalTestEncountersViral":5048054,"totalTestsPeopleViral":null,"totalTestsAntibody":null,"positiveTestsAntibody":null,"negativeTestsAntibody":null,"totalTestsPeopleAntibody":null,"positiveTestsPeopleAntibody":null,"negativeTestsPeopleAntibody":null,"totalTestsPeopleAntigen":null,"positiveTestsPeopleAntigen":null,"totalTestsAntigen":null,"positiveTestsAntigen":null,"fips":"53","positiveIncrease":897,"negativeIncrease":0,"total":332904,"totalTestResultsIncrease":22760,"posNeg":332904,"dataQualityGrade":null,"deathIncrease":19,"hospitalizedIncrease":35,"hash":"8150e925fc2fb429eeb347109e52f7b99ba00f17","commercialScore":0,"negativeRegularScore":0,"negativeScore":0,"positiveScore":0,"score":0,"grade":""},{"date":20210219,"state":"WA","positive":332007,"probableCases":17352,"negative":null,"pending":null,"totalTestResultsSource":"totalTestEncountersViral","totalTestResults":5025294,"hospitalizedCurrently":600,"hospitalizedCumulative":18934,"inIcuCurrently":129,"inIcuCumulative":null,"onVentilatorCurrently":64,"onVentilatorCumulative":null,"recovered":null,"lastUpdateEt":"2/18/2021 02:59","dateModified":"2021-02-18T02:59:00Z","checkTimeEt":"02/17 21:59","death":4803,"hospitalized":18934,"hospitalizedDischarged":null,"dateChecked":"2021-02-18T02:59:00Z","totalTestsViral":null,"positiveTestsViral":314601,"negativeTestsViral":4710363,"positiveCasesViral":314655,"deathConfirmed":null,"deathProbable":null,"totalTestEncountersViral":5025294,"totalTestsPeopleViral":null,"totalTestsAntibody":null,"positiveTestsAntibody":null,"negativeTestsAntibody":null,"totalTestsPeopleAntibody":null,"positiveTestsPeopleAntibody":null,"negativeTestsPeopleAntibody":null,"totalTestsPeopleAntigen":null,"positiveTestsPeopleAntigen":null,"totalTestsAntigen":null,"positiveTestsAntigen":null,"fips":"53","positiveIncrease":1200,"negativeIncrease":0,"total":332007,"totalTestResultsIncrease":27554,"posNeg":332007,"dataQualityGrade":null,"deathIncrease":44,"hospitalizedIncrease":73,"hash":"7abb435652ee2081b037746577fba100fe5fbdb5","commercialScore":0,"negativeRegularScore":0,"negativeScore":0,"positiveScore":0,"score":0,"grade":""},{"date":20210218,"state":"WA","positive":330807,"probableCases":17174,"negative":null,"pending":null,"totalTestResultsSource":"totalTestEncountersViral","totalTestResults":4997740,"hospitalizedCurrently":628,"hospitalizedCumulative":18861,"inIcuCurrently":151,"inIcuCumulative":null,"onVentilatorCurrently":60,"onVentilatorCumulative":null,"recovered":null,"lastUpdateEt":"2/17/2021 02:59","dateModified":"2021-02-17T02:59:00Z","checkTimeEt":"02/16 21:59","death":4759,"hospitalized":18861,"hospitalizedDischarged":null,"dateChecked":"2021-02-17T02:59:00Z","totalTestsViral":null,"positiveTestsViral":313595,"negativeTestsViral":4683820,"positiveCasesViral":313633,"deathConfirmed":null,"deathProbable":null,"totalTestEncountersViral":4997740,"totalTestsPeopleViral":null,"totalTestsAntibody":null,"positiveTestsAntibody":null,"negativeTestsAntibody":null,"totalTestsPeopleAntibody":null,"positiveTestsPeopleAntibody":null,"negativeTestsPeopleAntibody":null,"totalTestsPeopleAntigen":null,"positiveTestsPeopleAntigen":null,"totalTestsAntigen":null,"positiveTestsAntigen":null,"fips":"53","positiveIncrease":1061,"negativeIncrease":0,"total":330807,"totalTestResultsIncrease":30274,"posNeg":330807,"dataQualityGrade":null,"deathIncrease":50,"hospitalizedIncrease":97,"hash":"de2e67b20566c2bc27686fd3861fefa2d55239cf","commercialScore":0,"negativeRegularScore":0,"negativeScore":0,"positiveScore":0,"score":0,"grade":""},{"date":20210217,"state":"WA","positive":329746,"probableCases":16918,"negative":null,"pending":null,"totalTestResultsSource":"totalTestEncountersViral","totalTestResults":4967466,"hospitalizedCurrently":628,"hospitalizedCumulative":18764,"inIcuCurrently":151,"inIcuCumulative":null,"onVentilatorCurrently":55,"onVentilatorCumulative":null,"recovered":null,"lastUpdateEt":"2/16/2021 02:59","dateModified":"2021-02-16T02:59:00Z","checkTimeEt":"02/15 21:59","death":4709,"hospitalized":18764,"hospitalizedDischarged":null,"dateChecked":"2021-02-16T02:59:00Z","totalTestsViral":null,"positiveTestsViral":312773,"negativeTestsViral":4654384,"positiveCasesViral":312828,"deathConfirmed":null,"deathProbable":null,"totalTestEncountersViral":4967466,"totalTestsPeopleViral":null,"totalTestsAntibody":null,"positiveTestsAntibody":null,"negativeTestsAntibody":null,"totalTestsPeopleAntibody":null,"positiveTestsPeopleAntibody":null,"negativeTestsPeopleAntibody":null,"totalTestsPeopleAntigen":null,"positiveTestsPeopleAntigen":null,"totalTestsAntigen":null,"positiveTestsAntigen":null,"fips":"53","positiveIncrease":1699,"negativeIncrease":0,"total":329746,"totalTestResultsIncrease":71312,"posNeg":329746,"dataQualityGrade":null,"deathIncrease":34,"hospitalizedIncrease":121,"hash":"f66c27e147df46d5c4e3629aaaf4783107970880","commercialScore":0,"negativeRegularScore":0,"negativeScore":0,"positiveScore":0,"score":0,"grade":""},{"date":20210216,"state":"WA","positive":328047,"probableCases":16759,"negative":null,"pending":null,"totalTestResultsSource":"totalTestEncountersViral","totalTestResults":4896154,"hospitalizedCurrently":628,"hospitalizedCumulative":18643,"inIcuCurrently":151,"inIcuCumulative":null,"onVentilatorCurrently":57,"onVentilatorCumulative":null,"recovered":null,"lastUpdateEt":"2/13/2021 02:59","dateModified":"2021-02-13T02:59:00Z","checkTimeEt":"02/12 21:59","death":4675,"hospitalized":18643,"hospitalizedDischarged":null,"dateChecked":"2021-02-13T02:59:00Z","totalTestsViral":null,"positiveTestsViral":311237,"negativeTestsViral":4584757,"positiveCasesViral":311288,"deathConfirmed":null,"deathProbable":null,"totalTestEncountersViral":4896154,"totalTestsPeopleViral":null,"totalTestsAntibody":null,"positiveTestsAntibody":null,"negativeTestsAntibody":null,"totalTestsPeopleAntibody":null,"positiveTestsPeopleAntibody":null,"negativeTestsPeopleAntibody":null,"totalTestsPeopleAntigen":null,"positiveTestsPeopleAntigen":null,"totalTestsAntigen":null,"positiveTestsAntigen":null,"fips":"53","positiveIncrease":0,"negativeIncrease":0,"total":328047,"totalTestResultsIncrease":0,"posNeg":328047,"dataQualityGrade":null,"deathIncrease":0,"hospitalizedIncrease":0,"hash":"eefd0dd070d7d40e03e152be7e31e14c5f2ccccc","commercialScore":0,"negativeRegularScore":0,"negativeScore":0,"positiveScore":0,"score":0,"grade":""},{"date":20210215,"state":"WA","positive":328047,"probableCases":16759,"negative":null,"pending":null,"totalTestResultsSource":"totalTestEncountersViral","totalTestResults":4896154,"hospitalizedCurrently":628,"hospitalizedCumulative":18643,"inIcuCurrently":151,"inIcuCumulative":null,"onVentilatorCurrently":62,"onVentilatorCumulative":null,"recovered":null,"lastUpdateEt":"2/13/2021 02:59","dateModified":"2021-02-13T02:59:00Z","checkTimeEt":"02/12 21:59","death":4675,"hospitalized":18643,"hospitalizedDischarged":null,"dateChecked":"2021-02-13T02:59:00Z","totalTestsViral":null,"positiveTestsViral":311237,"negativeTestsViral":4584757,"positiveCasesViral":311288,"deathConfirmed":null,"deathProbable":null,"totalTestEncountersViral":4896154,"totalTestsPeopleViral":null,"totalTestsAntibody":null,"positiveTestsAntibody":null,"negativeTestsAntibody":null,"totalTestsPeopleAntibody":null,"positiveTestsPeopleAntibody":null,"negativeTestsPeopleAntibody":null,"totalTestsPeopleAntigen":null,"positiveTestsPeopleAntigen":null,"totalTestsAntigen":null,"positiveTestsAntigen":null,"fips":"53","positiveIncrease":0,"negativeIncrease":0,"total":328047,"totalTestResultsIncrease":0,"posNeg":328047,"dataQualityGrade":null,"deathIncrease":0,"hospitalizedIncrease":0,"hash":"6236eee677cf8b2eeaee174397e6b3defbf81921","commercialScore":0,"negativeRegularScore":0,"negativeScore":0,"positiveScore":0,"score":0,"grade":""},{"date":20210214,"state":"WA","positive":328047,"probableCases":16759,"negative":null,"pending":null,"totalTestResultsSource":"totalTestEncountersViral","totalTestResults":4896154,"hospitalizedCurrently":628,"hospitalizedCumulative":18643,"inIcuCurrently":151,"inIcuCumulative":null,"onVentilatorCurrently":52,"onVentilatorCumulative":null,"recovered":null,"lastUpdateEt":"2/13/2021 02:59","dateModified":"2021-02-13T02:59:00Z","checkTimeEt":"02/12 21:59","death":4675,"hospitalized":18643,"hospitalizedDischarged":null,"dateChecked":"2021-02-13T02:59:00Z","totalTestsViral":null,"positiveTestsViral":311237,"negativeTestsViral":4584757,"positiveCasesViral":311288,"deathConfirmed":null,"deathProbable":null,"totalTestEncountersViral":4896154,"totalTestsPeopleViral":null,"totalTestsAntibody":null,"positiveTestsAntibody":null,"negativeTestsAntibody":null,"totalTestsPeopleAntibody":null,"positiveTestsPeopleAntibody":null,"negativeTestsPeopleAntibody":null,"totalTestsPeopleAntigen":null,"positiveTestsPeopleAntigen":null,"totalTestsAntigen":null,"positiveTestsAntigen":null,"fips":"53","positiveIncrease":880,"negativeIncrease":0,"total":328047,"totalTestResultsIncrease":29161,"posNeg":328047,"dataQualityGrade":null,"deathIncrease":0,"hospitalizedIncrease":39,"hash":"c4f039713ce446c1405237230a88569759630743","commercialScore":0,"negativeRegularScore":0,"negativeScore":0,"positiveScore":0,"score":0,"grade":""},{"date":20210213,"state":"WA","positive":327167,"probableCases":16626,"negative":null,"pending":null,"totalTestResultsSource":"totalTestEncountersViral","totalTestResults":4866993,"hospitalizedCurrently":628,"hospitalizedCumulative":18604,"inIcuCurrently":151,"inIcuCumulative":null,"onVentilatorCurrently":48,"onVentilatorCumulative":null,"recovered":null,"lastUpdateEt":"2/12/2021 02:59","dateModified":"2021-02-12T02:59:00Z","checkTimeEt":"02/11 21:59","death":4675,"hospitalized":18604,"hospitalizedDischarged":null,"dateChecked":"2021-02-12T02:59:00Z","totalTestsViral":null,"positiveTestsViral":310521,"negativeTestsViral":4556332,"positiveCasesViral":310541,"deathConfirmed":null,"deathProbable":null,"totalTestEncountersViral":4866993,"totalTestsPeopleViral":null,"totalTestsAntibody":null,"positiveTestsAntibody":null,"negativeTestsAntibody":null,"totalTestsPeopleAntibody":null,"positiveTestsPeopleAntibody":null,"negativeTestsPeopleAntibody":null,"totalTestsPeopleAntigen":null,"positiveTestsPeopleAntigen":null,"totalTestsAntigen":null,"positiveTestsAntigen":null,"fips":"53","positiveIncrease":1008,"negativeIncrease":0,"total":327167,"totalTestResultsIncrease":26917,"posNeg":327167,"dataQualityGrade":null,"deathIncrease":42,"hospitalizedIncrease":73,"hash":"69aa829c80dbe05d486bfdf7a831d1a0c5dddf99","commercialScore":0,"negativeRegularScore":0,"negativeScore":0,"positiveScore":0,"score":0,"grade":""},{"date":20210212,"state":"WA","positive":326159,"probableCases":16486,"negative":null,"pending":null,"totalTestResultsSource":"totalTestEncountersViral","totalTestResults":4840076,"hospitalizedCurrently":678,"hospitalizedCumulative":18531,"inIcuCurrently":151,"inIcuCumulative":null,"onVentilatorCurrently":79,"onVentilatorCumulative":null,"recovered":null,"lastUpdateEt":"2/11/2021 02:59","dateModified":"2021-02-11T02:59:00Z","checkTimeEt":"02/10 21:59","death":4633,"hospitalized":18531,"hospitalizedDischarged":null,"dateChecked":"2021-02-11T02:59:00Z","totalTestsViral":null,"positiveTestsViral":309629,"negativeTestsViral":4530317,"positiveCasesViral":309673,"deathConfirmed":null,"deathProbable":null,"totalTestEncountersViral":4840076,"totalTestsPeopleViral":null,"totalTestsAntibody":null,"positiveTestsAntibody":null,"negativeTestsAntibody":null,"totalTestsPeopleAntibody":null,"positiveTestsPeopleAntibody":null,"negativeTestsPeopleAntibody":null,"totalTestsPeopleAntigen":null,"positiveTestsPeopleAntigen":null,"totalTestsAntigen":null,"positiveTestsAntigen":null,"fips":"53","positiveIncrease":1453,"negativeIncrease":0,"total":326159,"totalTestResultsIncrease":25411,"posNeg":326159,"dataQualityGrade":null,"deathIncrease":30,"hospitalizedIncrease":15,"hash":"c1f3ac80d7e4175aab21d1475aa5d74381df7bfb","commercialScore":0,"negativeRegularScore":0,"negativeScore":0,"positiveScore":0,"score":0,"grade":""},{"date":20210211,"state":"WA","positive":324706,"probableCases":16314,"negative":null,"pending":null,"totalTestResultsSource":"totalTestEncountersViral","totalTestResults":4814665,"hospitalizedCurrently":687,"hospitalizedCumulative":18516,"inIcuCurrently":151,"inIcuCumulative":null,"onVentilatorCurrently":61,"onVentilatorCumulative":null,"recovered":null,"lastUpdateEt":"2/10/2021 02:59","dateModified":"2021-02-10T02:59:00Z","checkTimeEt":"02/09 21:59","death":4603,"hospitalized":18516,"hospitalizedDischarged":null,"dateChecked":"2021-02-10T02:59:00Z","totalTestsViral":null,"positiveTestsViral":308338,"negativeTestsViral":4506197,"positiveCasesViral":308392,"deathConfirmed":null,"deathProbable":null,"totalTestEncountersViral":4814665,"totalTestsPeopleViral":null,"totalTestsAntibody":null,"positiveTestsAntibody":null,"negativeTestsAntibody":null,"totalTestsPeopleAntibody":null,"positiveTestsPeopleAntibody":null,"negativeTestsPeopleAntibody":null,"totalTestsPeopleAntigen":null,"positiveTestsPeopleAntigen":null,"totalTestsAntigen":null,"positiveTestsAntigen":null,"fips":"53","positiveIncrease":681,"negativeIncrease":0,"total":324706,"totalTestResultsIncrease":20740,"posNeg":324706,"dataQualityGrade":null,"deathIncrease":45,"hospitalizedIncrease":-14,"hash":"330b0d0e35e7ca6c310797201b8c387beb1a4133","commercialScore":0,"negativeRegularScore":0,"negativeScore":0,"positiveScore":0,"score":0,"grade":""},{"date":20210210,"state":"WA","positive":324025,"probableCases":16158,"negative":null,"pending":null,"totalTestResultsSource":"totalTestEncountersViral","totalTestResults":4793925,"hospitalizedCurrently":704,"hospitalizedCumulative":18530,"inIcuCurrently":160,"inIcuCumulative":null,"onVentilatorCurrently":62,"onVentilatorCumulative":null,"recovered":null,"lastUpdateEt":"2/9/2021 02:59","dateModified":"2021-02-09T02:59:00Z","checkTimeEt":"02/08 21:59","death":4558,"hospitalized":18530,"hospitalizedDischarged":null,"dateChecked":"2021-02-09T02:59:00Z","totalTestsViral":null,"positiveTestsViral":307829,"negativeTestsViral":4485964,"positiveCasesViral":307867,"deathConfirmed":null,"deathProbable":null,"totalTestEncountersViral":4793925,"totalTestsPeopleViral":null,"totalTestsAntibody":null,"positiveTestsAntibody":null,"negativeTestsAntibody":null,"totalTestsPeopleAntibody":null,"positiveTestsPeopleAntibody":null,"negativeTestsPeopleAntibody":null,"totalTestsPeopleAntigen":null,"positiveTestsPeopleAntigen":null,"totalTestsAntigen":null,"positiveTestsAntigen":null,"fips":"53","positiveIncrease":811,"negativeIncrease":0,"total":324025,"totalTestResultsIncrease":22088,"posNeg":324025,"dataQualityGrade":null,"deathIncrease":107,"hospitalizedIncrease":50,"hash":"656ca186400cbf9c3a0d1082ce46cb1c0aa3cbea","commercialScore":0,"negativeRegularScore":0,"negativeScore":0,"positiveScore":0,"score":0,"grade":""},{"date":20210209,"state":"WA","positive":323214,"probableCases":16025,"negative":null,"pending":null,"totalTestResultsSource":"totalTestEncountersViral","totalTestResults":4771837,"hospitalizedCurrently":719,"hospitalizedCumulative":18480,"inIcuCurrently":188,"inIcuCumulative":null,"onVentilatorCurrently":78,"onVentilatorCumulative":null,"recovered":null,"lastUpdateEt":"2/8/2021 02:59","dateModified":"2021-02-08T02:59:00Z","checkTimeEt":"02/07 21:59","death":4451,"hospitalized":18480,"hospitalizedDischarged":null,"dateChecked":"2021-02-08T02:59:00Z","totalTestsViral":null,"positiveTestsViral":307163,"negativeTestsViral":4464543,"positiveCasesViral":307189,"deathConfirmed":null,"deathProbable":null,"totalTestEncountersViral":4771837,"totalTestsPeopleViral":null,"totalTestsAntibody":null,"positiveTestsAntibody":null,"negativeTestsAntibody":null,"totalTestsPeopleAntibody":null,"positiveTestsPeopleAntibody":null,"negativeTestsPeopleAntibody":null,"totalTestsPeopleAntigen":null,"positiveTestsPeopleAntigen":null,"totalTestsAntigen":null,"positiveTestsAntigen":null,"fips":"53","positiveIncrease":3068,"negativeIncrease":0,"total":323214,"totalTestResultsIncrease":54978,"posNeg":323214,"dataQualityGrade":null,"deathIncrease":2,"hospitalizedIncrease":197,"hash":"0fbf2970bb48590dfabcc953586e4a5586dbbf33","commercialScore":0,"negativeRegularScore":0,"negativeScore":0,"positiveScore":0,"score":0,"grade":""},{"date":20210208,"state":"WA","positive":320146,"probableCases":15764,"negative":null,"pending":null,"totalTestResultsSource":"totalTestEncountersViral","totalTestResults":4716859,"hospitalizedCurrently":737,"hospitalizedCumulative":18283,"inIcuCurrently":186,"inIcuCumulative":null,"onVentilatorCurrently":73,"onVentilatorCumulative":null,"recovered":null,"lastUpdateEt":"2/6/2021 02:59","dateModified":"2021-02-06T02:59:00Z","checkTimeEt":"02/05 21:59","death":4449,"hospitalized":18283,"hospitalizedDischarged":null,"dateChecked":"2021-02-06T02:59:00Z","totalTestsViral":null,"positiveTestsViral":304315,"negativeTestsViral":4412414,"positiveCasesViral":304382,"deathConfirmed":null,"deathProbable":null,"totalTestEncountersViral":4716859,"totalTestsPeopleViral":null,"totalTestsAntibody":null,"positiveTestsAntibody":null,"negativeTestsAntibody":null,"totalTestsPeopleAntibody":null,"positiveTestsPeopleAntibody":null,"negativeTestsPeopleAntibody":null,"totalTestsPeopleAntigen":null,"positiveTestsPeopleAntigen":null,"totalTestsAntigen":null,"positiveTestsAntigen":null,"fips":"53","positiveIncrease":0,"negativeIncrease":0,"total":320146,"totalTestResultsIncrease":0,"posNeg":320146,"dataQualityGrade":null,"deathIncrease":0,"hospitalizedIncrease":0,"hash":"fa48fda9e7c63156184e71da417adf889ceb7be7","commercialScore":0,"negativeRegularScore":0,"negativeScore":0,"positiveScore":0,"score":0,"grade":""},{"date":20210207,"state":"WA","positive":320146,"probableCases":15764,"negative":null,"pending":null,"totalTestResultsSource":"totalTestEncountersViral","totalTestResults":4716859,"hospitalizedCurrently":737,"hospitalizedCumulative":18283,"inIcuCurrently":186,"inIcuCumulative":null,"onVentilatorCurrently":73,"onVentilatorCumulative":null,"recovered":null,"lastUpdateEt":"2/6/2021 02:59","dateModified":"2021-02-06T02:59:00Z","checkTimeEt":"02/05 21:59","death":4449,"hospitalized":18283,"hospitalizedDischarged":null,"dateChecked":"2021-02-06T02:59:00Z","totalTestsViral":null,"positiveTestsViral":null,"negativeTestsViral":null,"positiveCasesViral":304382,"deathConfirmed":null,"deathProbable":null,"totalTestEncountersViral":4716859,"totalTestsPeopleViral":null,"totalTestsAntibody":null,"positiveTestsAntibody":null,"negativeTestsAntibody":null,"totalTestsPeopleAntibody":null,"positiveTestsPeopleAntibody":null,"negativeTestsPeopleAntibody":null,"totalTestsPeopleAntigen":null,"positiveTestsPeopleAntigen":null,"totalTestsAntigen":null,"positiveTestsAntigen":null,"fips":"53","positiveIncrease":775,"negativeIncrease":0,"total":320146,"totalTestResultsIncrease":22209,"posNeg":320146,"dataQualityGrade":null,"deathIncrease":0,"hospitalizedIncrease":127,"hash":"0ce8cdf10331e626c8bd3692437b3bf15cb2f443","commercialScore":0,"negativeRegularScore":0,"negativeScore":0,"positiveScore":0,"score":0,"grade":""},{"date":20210206,"state":"WA","positive":319371,"probableCases":15410,"negative":null,"pending":null,"totalTestResultsSource":"totalTestEncountersViral","totalTestResults":4694650,"hospitalizedCurrently":737,"hospitalizedCumulative":18156,"inIcuCurrently":186,"inIcuCumulative":null,"onVentilatorCurrently":73,"onVentilatorCumulative":null,"recovered":null,"lastUpdateEt":"2/5/2021 02:59","dateModified":"2021-02-05T02:59:00Z","checkTimeEt":"02/04 21:59","death":4449,"hospitalized":18156,"hospitalizedDischarged":null,"dateChecked":"2021-02-05T02:59:00Z","totalTestsViral":null,"positiveTestsViral":null,"negativeTestsViral":null,"positiveCasesViral":303961,"deathConfirmed":null,"deathProbable":null,"totalTestEncountersViral":4694650,"totalTestsPeopleViral":null,"totalTestsAntibody":null,"positiveTestsAntibody":null,"negativeTestsAntibody":null,"totalTestsPeopleAntibody":null,"positiveTestsPeopleAntibody":null,"negativeTestsPeopleAntibody":null,"totalTestsPeopleAntigen":null,"positiveTestsPeopleAntigen":null,"totalTestsAntigen":null,"positiveTestsAntigen":null,"fips":"53","positiveIncrease":1493,"negativeIncrease":0,"total":319371,"totalTestResultsIncrease":23835,"posNeg":319371,"dataQualityGrade":null,"deathIncrease":33,"hospitalizedIncrease":85,"hash":"e355815df26d5f08352004368736ee88e638ed08","commercialScore":0,"negativeRegularScore":0,"negativeScore":0,"positiveScore":0,"score":0,"grade":""},{"date":20210205,"state":"WA","positive":317878,"probableCases":15096,"negative":null,"pending":null,"totalTestResultsSource":"totalTestEncountersViral","totalTestResults":4670815,"hospitalizedCurrently":789,"hospitalizedCumulative":18071,"inIcuCurrently":183,"inIcuCumulative":null,"onVentilatorCurrently":80,"onVentilatorCumulative":null,"recovered":null,"lastUpdateEt":"2/4/2021 02:59","dateModified":"2021-02-04T02:59:00Z","checkTimeEt":"02/03 21:59","death":4416,"hospitalized":18071,"hospitalizedDischarged":null,"dateChecked":"2021-02-04T02:59:00Z","totalTestsViral":null,"positiveTestsViral":null,"negativeTestsViral":null,"positiveCasesViral":302782,"deathConfirmed":null,"deathProbable":null,"totalTestEncountersViral":4670815,"totalTestsPeopleViral":null,"totalTestsAntibody":null,"positiveTestsAntibody":null,"negativeTestsAntibody":null,"totalTestsPeopleAntibody":null,"positiveTestsPeopleAntibody":null,"negativeTestsPeopleAntibody":null,"totalTestsPeopleAntigen":null,"positiveTestsPeopleAntigen":null,"totalTestsAntigen":null,"positiveTestsAntigen":null,"fips":"53","positiveIncrease":1584,"negativeIncrease":0,"total":317878,"totalTestResultsIncrease":24987,"posNeg":317878,"dataQualityGrade":null,"deathIncrease":28,"hospitalizedIncrease":84,"hash":"7f45049dafc1302a62de25a83a51598579d0f543","commercialScore":0,"negativeRegularScore":0,"negativeScore":0,"positiveScore":0,"score":0,"grade":""},{"date":20210204,"state":"WA","positive":316294,"probableCases":14922,"negative":null,"pending":null,"totalTestResultsSource":"totalTestEncountersViral","totalTestResults":4645828,"hospitalizedCurrently":789,"hospitalizedCumulative":17987,"inIcuCurrently":183,"inIcuCumulative":null,"onVentilatorCurrently":83,"onVentilatorCumulative":null,"recovered":null,"lastUpdateEt":"2/3/2021 02:59","dateModified":"2021-02-03T02:59:00Z","checkTimeEt":"02/02 21:59","death":4388,"hospitalized":17987,"hospitalizedDischarged":null,"dateChecked":"2021-02-03T02:59:00Z","totalTestsViral":null,"positiveTestsViral":null,"negativeTestsViral":null,"positiveCasesViral":301372,"deathConfirmed":null,"deathProbable":null,"totalTestEncountersViral":4645828,"totalTestsPeopleViral":null,"totalTestsAntibody":null,"positiveTestsAntibody":null,"negativeTestsAntibody":null,"totalTestsPeopleAntibody":null,"positiveTestsPeopleAntibody":null,"negativeTestsPeopleAntibody":null,"totalTestsPeopleAntigen":null,"positiveTestsPeopleAntigen":null,"totalTestsAntigen":null,"positiveTestsAntigen":null,"fips":"53","positiveIncrease":1602,"negativeIncrease":0,"total":316294,"totalTestResultsIncrease":31042,"posNeg":316294,"dataQualityGrade":null,"deathIncrease":72,"hospitalizedIncrease":95,"hash":"bcad286aae6614b4ea36782bbcdae6918eb11373","commercialScore":0,"negativeRegularScore":0,"negativeScore":0,"positiveScore":0,"score":0,"grade":""},{"date":20210203,"state":"WA","positive":314692,"probableCases":14674,"negative":null,"pending":null,"totalTestResultsSource":"totalTestEncountersViral","totalTestResults":4614786,"hospitalizedCurrently":838,"hospitalizedCumulative":17892,"inIcuCurrently":194,"inIcuCumulative":null,"onVentilatorCurrently":89,"onVentilatorCumulative":null,"recovered":null,"lastUpdateEt":"2/2/2021 02:59","dateModified":"2021-02-02T02:59:00Z","checkTimeEt":"02/01 21:59","death":4316,"hospitalized":17892,"hospitalizedDischarged":null,"dateChecked":"2021-02-02T02:59:00Z","totalTestsViral":null,"positiveTestsViral":null,"negativeTestsViral":null,"positiveCasesViral":300018,"deathConfirmed":null,"deathProbable":null,"totalTestEncountersViral":4614786,"totalTestsPeopleViral":null,"totalTestsAntibody":null,"positiveTestsAntibody":null,"negativeTestsAntibody":null,"totalTestsPeopleAntibody":null,"positiveTestsPeopleAntibody":null,"negativeTestsPeopleAntibody":null,"totalTestsPeopleAntigen":null,"positiveTestsPeopleAntigen":null,"totalTestsAntigen":null,"positiveTestsAntigen":null,"fips":"53","positiveIncrease":1357,"negativeIncrease":0,"total":314692,"totalTestResultsIncrease":17196,"posNeg":314692,"dataQualityGrade":null,"deathIncrease":-2,"hospitalizedIncrease":80,"hash":"5c52cb35ff27f057e7091e545bf72ff1433dad42","commercialScore":0,"negativeRegularScore":0,"negativeScore":0,"positiveScore":0,"score":0,"grade":""},{"date":20210202,"state":"WA","positive":313335,"probableCases":14237,"negative":null,"pending":null,"totalTestResultsSource":"totalTestEncountersViral","totalTestResults":4597590,"hospitalizedCurrently":814,"hospitalizedCumulative":17812,"inIcuCurrently":203,"inIcuCumulative":null,"onVentilatorCurrently":90,"onVentilatorCumulative":null,"recovered":null,"lastUpdateEt":"2/1/2021 02:59","dateModified":"2021-02-01T02:59:00Z","checkTimeEt":"01/31 21:59","death":4318,"hospitalized":17812,"hospitalizedDischarged":null,"dateChecked":"2021-02-01T02:59:00Z","totalTestsViral":null,"positiveTestsViral":null,"negativeTestsViral":null,"positiveCasesViral":299098,"deathConfirmed":null,"deathProbable":null,"totalTestEncountersViral":4597590,"totalTestsPeopleViral":null,"totalTestsAntibody":null,"positiveTestsAntibody":null,"negativeTestsAntibody":null,"totalTestsPeopleAntibody":null,"positiveTestsPeopleAntibody":null,"negativeTestsPeopleAntibody":null,"totalTestsPeopleAntigen":null,"positiveTestsPeopleAntigen":null,"totalTestsAntigen":null,"positiveTestsAntigen":null,"fips":"53","positiveIncrease":1738,"negativeIncrease":0,"total":313335,"totalTestResultsIncrease":49351,"posNeg":313335,"dataQualityGrade":null,"deathIncrease":33,"hospitalizedIncrease":106,"hash":"472bbceec837622f51955d95030eedfbffba1ab8","commercialScore":0,"negativeRegularScore":0,"negativeScore":0,"positiveScore":0,"score":0,"grade":""},{"date":20210201,"state":"WA","positive":311597,"probableCases":14084,"negative":null,"pending":null,"totalTestResultsSource":"totalTestEncountersViral","totalTestResults":4548239,"hospitalizedCurrently":797,"hospitalizedCumulative":17706,"inIcuCurrently":193,"inIcuCumulative":null,"onVentilatorCurrently":88,"onVentilatorCumulative":null,"recovered":null,"lastUpdateEt":"1/31/2021 02:59","dateModified":"2021-01-31T02:59:00Z","checkTimeEt":"01/30 21:59","death":4285,"hospitalized":17706,"hospitalizedDischarged":null,"dateChecked":"2021-01-31T02:59:00Z","totalTestsViral":null,"positiveTestsViral":null,"negativeTestsViral":null,"positiveCasesViral":297513,"deathConfirmed":null,"deathProbable":null,"totalTestEncountersViral":4548239,"totalTestsPeopleViral":null,"totalTestsAntibody":null,"positiveTestsAntibody":null,"negativeTestsAntibody":null,"totalTestsPeopleAntibody":null,"positiveTestsPeopleAntibody":null,"negativeTestsPeopleAntibody":null,"totalTestsPeopleAntigen":null,"positiveTestsPeopleAntigen":null,"totalTestsAntigen":null,"positiveTestsAntigen":null,"fips":"53","positiveIncrease":0,"negativeIncrease":0,"total":311597,"totalTestResultsIncrease":0,"posNeg":311597,"dataQualityGrade":null,"deathIncrease":0,"hospitalizedIncrease":0,"hash":"92791f97f0788b3462068049676dde0000e4f0c8","commercialScore":0,"negativeRegularScore":0,"negativeScore":0,"positiveScore":0,"score":0,"grade":""},{"date":20210131,"state":"WA","positive":311597,"probableCases":14084,"negative":null,"pending":null,"totalTestResultsSource":"totalTestEncountersViral","totalTestResults":4548239,"hospitalizedCurrently":797,"hospitalizedCumulative":17706,"inIcuCurrently":193,"inIcuCumulative":null,"onVentilatorCurrently":88,"onVentilatorCumulative":null,"recovered":null,"lastUpdateEt":"1/31/2021 02:59","dateModified":"2021-01-31T02:59:00Z","checkTimeEt":"01/30 21:59","death":4285,"hospitalized":17706,"hospitalizedDischarged":null,"dateChecked":"2021-01-31T02:59:00Z","totalTestsViral":null,"positiveTestsViral":null,"negativeTestsViral":null,"positiveCasesViral":297513,"deathConfirmed":null,"deathProbable":null,"totalTestEncountersViral":4548239,"totalTestsPeopleViral":null,"totalTestsAntibody":null,"positiveTestsAntibody":null,"negativeTestsAntibody":null,"totalTestsPeopleAntibody":null,"positiveTestsPeopleAntibody":null,"negativeTestsPeopleAntibody":null,"totalTestsPeopleAntigen":null,"positiveTestsPeopleAntigen":null,"totalTestsAntigen":null,"positiveTestsAntigen":null,"fips":"53","positiveIncrease":1796,"negativeIncrease":0,"total":311597,"totalTestResultsIncrease":24018,"posNeg":311597,"dataQualityGrade":null,"deathIncrease":0,"hospitalizedIncrease":163,"hash":"83ebdebcdaf7b1fcb3402188a97df52a23847951","commercialScore":0,"negativeRegularScore":0,"negativeScore":0,"positiveScore":0,"score":0,"grade":""},{"date":20210130,"state":"WA","positive":309801,"probableCases":13940,"negative":null,"pending":null,"totalTestResultsSource":"totalTestEncountersViral","totalTestResults":4524221,"hospitalizedCurrently":797,"hospitalizedCumulative":17543,"inIcuCurrently":193,"inIcuCumulative":null,"onVentilatorCurrently":102,"onVentilatorCumulative":null,"recovered":null,"lastUpdateEt":"1/29/2021 02:59","dateModified":"2021-01-29T02:59:00Z","checkTimeEt":"01/28 21:59","death":4285,"hospitalized":17543,"hospitalizedDischarged":null,"dateChecked":"2021-01-29T02:59:00Z","totalTestsViral":null,"positiveTestsViral":null,"negativeTestsViral":null,"positiveCasesViral":295861,"deathConfirmed":null,"deathProbable":null,"totalTestEncountersViral":4524221,"totalTestsPeopleViral":null,"totalTestsAntibody":null,"positiveTestsAntibody":null,"negativeTestsAntibody":null,"totalTestsPeopleAntibody":null,"positiveTestsPeopleAntibody":null,"negativeTestsPeopleAntibody":null,"totalTestsPeopleAntigen":null,"positiveTestsPeopleAntigen":null,"totalTestsAntigen":null,"positiveTestsAntigen":null,"fips":"53","positiveIncrease":1992,"negativeIncrease":0,"total":309801,"totalTestResultsIncrease":28758,"posNeg":309801,"dataQualityGrade":null,"deathIncrease":42,"hospitalizedIncrease":26,"hash":"905df65dbe3b2ebf9ba5b12050e30ba62d38a1fc","commercialScore":0,"negativeRegularScore":0,"negativeScore":0,"positiveScore":0,"score":0,"grade":""},{"date":20210129,"state":"WA","positive":307809,"probableCases":13831,"negative":null,"pending":null,"totalTestResultsSource":"totalTestEncountersViral","totalTestResults":4495463,"hospitalizedCurrently":806,"hospitalizedCumulative":17517,"inIcuCurrently":195,"inIcuCumulative":null,"onVentilatorCurrently":102,"onVentilatorCumulative":null,"recovered":null,"lastUpdateEt":"1/28/2021 02:59","dateModified":"2021-01-28T02:59:00Z","checkTimeEt":"01/27 21:59","death":4243,"hospitalized":17517,"hospitalizedDischarged":null,"dateChecked":"2021-01-28T02:59:00Z","totalTestsViral":null,"positiveTestsViral":null,"negativeTestsViral":null,"positiveCasesViral":293978,"deathConfirmed":null,"deathProbable":null,"totalTestEncountersViral":4495463,"totalTestsPeopleViral":null,"totalTestsAntibody":null,"positiveTestsAntibody":null,"negativeTestsAntibody":null,"totalTestsPeopleAntibody":null,"positiveTestsPeopleAntibody":null,"negativeTestsPeopleAntibody":null,"totalTestsPeopleAntigen":null,"positiveTestsPeopleAntigen":null,"totalTestsAntigen":null,"positiveTestsAntigen":null,"fips":"53","positiveIncrease":2520,"negativeIncrease":0,"total":307809,"totalTestResultsIncrease":25248,"posNeg":307809,"dataQualityGrade":null,"deathIncrease":32,"hospitalizedIncrease":68,"hash":"7ea6a7fa6739a52623885257a32f09abab1eef24","commercialScore":0,"negativeRegularScore":0,"negativeScore":0,"positiveScore":0,"score":0,"grade":""},{"date":20210128,"state":"WA","positive":305289,"probableCases":13588,"negative":null,"pending":null,"totalTestResultsSource":"totalTestEncountersViral","totalTestResults":4470215,"hospitalizedCurrently":823,"hospitalizedCumulative":17449,"inIcuCurrently":197,"inIcuCumulative":null,"onVentilatorCurrently":99,"onVentilatorCumulative":null,"recovered":null,"lastUpdateEt":"1/27/2021 02:59","dateModified":"2021-01-27T02:59:00Z","checkTimeEt":"01/26 21:59","death":4211,"hospitalized":17449,"hospitalizedDischarged":null,"dateChecked":"2021-01-27T02:59:00Z","totalTestsViral":null,"positiveTestsViral":null,"negativeTestsViral":null,"positiveCasesViral":291701,"deathConfirmed":null,"deathProbable":null,"totalTestEncountersViral":4470215,"totalTestsPeopleViral":null,"totalTestsAntibody":null,"positiveTestsAntibody":null,"negativeTestsAntibody":null,"totalTestsPeopleAntibody":null,"positiveTestsPeopleAntibody":null,"negativeTestsPeopleAntibody":null,"totalTestsPeopleAntigen":null,"positiveTestsPeopleAntigen":null,"totalTestsAntigen":null,"positiveTestsAntigen":null,"fips":"53","positiveIncrease":1807,"negativeIncrease":0,"total":305289,"totalTestResultsIncrease":23371,"posNeg":305289,"dataQualityGrade":null,"deathIncrease":44,"hospitalizedIncrease":95,"hash":"2658050249df0efa1f5206b9a4361e3dea75f945","commercialScore":0,"negativeRegularScore":0,"negativeScore":0,"positiveScore":0,"score":0,"grade":""},{"date":20210127,"state":"WA","positive":303482,"probableCases":13314,"negative":null,"pending":null,"totalTestResultsSource":"totalTestEncountersViral","totalTestResults":4446844,"hospitalizedCurrently":869,"hospitalizedCumulative":17354,"inIcuCurrently":184,"inIcuCumulative":null,"onVentilatorCurrently":100,"onVentilatorCumulative":null,"recovered":null,"lastUpdateEt":"1/26/2021 02:59","dateModified":"2021-01-26T02:59:00Z","checkTimeEt":"01/25 21:59","death":4167,"hospitalized":17354,"hospitalizedDischarged":null,"dateChecked":"2021-01-26T02:59:00Z","totalTestsViral":null,"positiveTestsViral":null,"negativeTestsViral":null,"positiveCasesViral":290168,"deathConfirmed":null,"deathProbable":null,"totalTestEncountersViral":4446844,"totalTestsPeopleViral":null,"totalTestsAntibody":null,"positiveTestsAntibody":null,"negativeTestsAntibody":null,"totalTestsPeopleAntibody":null,"positiveTestsPeopleAntibody":null,"negativeTestsPeopleAntibody":null,"totalTestsPeopleAntigen":null,"positiveTestsPeopleAntigen":null,"totalTestsAntigen":null,"positiveTestsAntigen":null,"fips":"53","positiveIncrease":1341,"negativeIncrease":0,"total":303482,"totalTestResultsIncrease":22614,"posNeg":303482,"dataQualityGrade":null,"deathIncrease":19,"hospitalizedIncrease":95,"hash":"d20f4da4e6cc903ac80dbd1d830600e56acb2c29","commercialScore":0,"negativeRegularScore":0,"negativeScore":0,"positiveScore":0,"score":0,"grade":""},{"date":20210126,"state":"WA","positive":302141,"probableCases":13193,"negative":null,"pending":null,"totalTestResultsSource":"totalTestEncountersViral","totalTestResults":4424230,"hospitalizedCurrently":846,"hospitalizedCumulative":17259,"inIcuCurrently":173,"inIcuCumulative":null,"onVentilatorCurrently":82,"onVentilatorCumulative":null,"recovered":null,"lastUpdateEt":"1/25/2021 02:59","dateModified":"2021-01-25T02:59:00Z","checkTimeEt":"01/24 21:59","death":4148,"hospitalized":17259,"hospitalizedDischarged":null,"dateChecked":"2021-01-25T02:59:00Z","totalTestsViral":null,"positiveTestsViral":null,"negativeTestsViral":null,"positiveCasesViral":288948,"deathConfirmed":null,"deathProbable":null,"totalTestEncountersViral":4424230,"totalTestsPeopleViral":null,"totalTestsAntibody":null,"positiveTestsAntibody":null,"negativeTestsAntibody":null,"totalTestsPeopleAntibody":null,"positiveTestsPeopleAntibody":null,"negativeTestsPeopleAntibody":null,"totalTestsPeopleAntigen":null,"positiveTestsPeopleAntigen":null,"totalTestsAntigen":null,"positiveTestsAntigen":null,"fips":"53","positiveIncrease":1943,"negativeIncrease":0,"total":302141,"totalTestResultsIncrease":50584,"posNeg":302141,"dataQualityGrade":null,"deathIncrease":34,"hospitalizedIncrease":130,"hash":"fe1d363e6193784483d4f48737c99718448e8dbb","commercialScore":0,"negativeRegularScore":0,"negativeScore":0,"positiveScore":0,"score":0,"grade":""},{"date":20210125,"state":"WA","positive":300198,"probableCases":13167,"negative":null,"pending":null,"totalTestResultsSource":"totalTestEncountersViral","totalTestResults":4373646,"hospitalizedCurrently":916,"hospitalizedCumulative":17129,"inIcuCurrently":242,"inIcuCumulative":null,"onVentilatorCurrently":100,"onVentilatorCumulative":null,"recovered":null,"lastUpdateEt":"1/23/2021 02:59","dateModified":"2021-01-23T02:59:00Z","checkTimeEt":"01/22 21:59","death":4114,"hospitalized":17129,"hospitalizedDischarged":null,"dateChecked":"2021-01-23T02:59:00Z","totalTestsViral":null,"positiveTestsViral":null,"negativeTestsViral":null,"positiveCasesViral":287031,"deathConfirmed":null,"deathProbable":null,"totalTestEncountersViral":4373646,"totalTestsPeopleViral":null,"totalTestsAntibody":null,"positiveTestsAntibody":null,"negativeTestsAntibody":null,"totalTestsPeopleAntibody":null,"positiveTestsPeopleAntibody":null,"negativeTestsPeopleAntibody":null,"totalTestsPeopleAntigen":null,"positiveTestsPeopleAntigen":null,"totalTestsAntigen":null,"positiveTestsAntigen":null,"fips":"53","positiveIncrease":0,"negativeIncrease":0,"total":300198,"totalTestResultsIncrease":0,"posNeg":300198,"dataQualityGrade":null,"deathIncrease":0,"hospitalizedIncrease":0,"hash":"451394ff45c15698db369a008ad086b69c5db430","commercialScore":0,"negativeRegularScore":0,"negativeScore":0,"positiveScore":0,"score":0,"grade":""},{"date":20210124,"state":"WA","positive":300198,"probableCases":13167,"negative":null,"pending":null,"totalTestResultsSource":"totalTestEncountersViral","totalTestResults":4373646,"hospitalizedCurrently":916,"hospitalizedCumulative":17129,"inIcuCurrently":242,"inIcuCumulative":null,"onVentilatorCurrently":100,"onVentilatorCumulative":null,"recovered":null,"lastUpdateEt":"1/23/2021 02:59","dateModified":"2021-01-23T02:59:00Z","checkTimeEt":"01/22 21:59","death":4114,"hospitalized":17129,"hospitalizedDischarged":null,"dateChecked":"2021-01-23T02:59:00Z","totalTestsViral":null,"positiveTestsViral":null,"negativeTestsViral":null,"positiveCasesViral":287031,"deathConfirmed":null,"deathProbable":null,"totalTestEncountersViral":4373646,"totalTestsPeopleViral":null,"totalTestsAntibody":null,"positiveTestsAntibody":null,"negativeTestsAntibody":null,"totalTestsPeopleAntibody":null,"positiveTestsPeopleAntibody":null,"negativeTestsPeopleAntibody":null,"totalTestsPeopleAntigen":null,"positiveTestsPeopleAntigen":null,"totalTestsAntigen":null,"positiveTestsAntigen":null,"fips":"53","positiveIncrease":1949,"negativeIncrease":0,"total":300198,"totalTestResultsIncrease":23867,"posNeg":300198,"dataQualityGrade":null,"deathIncrease":0,"hospitalizedIncrease":92,"hash":"bf86632bfe277463890608d5b0c705c475c61a2d","commercialScore":0,"negativeRegularScore":0,"negativeScore":0,"positiveScore":0,"score":0,"grade":""},{"date":20210123,"state":"WA","positive":298249,"probableCases":13062,"negative":null,"pending":null,"totalTestResultsSource":"totalTestEncountersViral","totalTestResults":4349779,"hospitalizedCurrently":916,"hospitalizedCumulative":17037,"inIcuCurrently":242,"inIcuCumulative":null,"onVentilatorCurrently":83,"onVentilatorCumulative":null,"recovered":null,"lastUpdateEt":"1/22/2021 02:59","dateModified":"2021-01-22T02:59:00Z","checkTimeEt":"01/21 21:59","death":4114,"hospitalized":17037,"hospitalizedDischarged":null,"dateChecked":"2021-01-22T02:59:00Z","totalTestsViral":null,"positiveTestsViral":null,"negativeTestsViral":null,"positiveCasesViral":285187,"deathConfirmed":null,"deathProbable":null,"totalTestEncountersViral":4349779,"totalTestsPeopleViral":null,"totalTestsAntibody":null,"positiveTestsAntibody":null,"negativeTestsAntibody":null,"totalTestsPeopleAntibody":null,"positiveTestsPeopleAntibody":null,"negativeTestsPeopleAntibody":null,"totalTestsPeopleAntigen":null,"positiveTestsPeopleAntigen":null,"totalTestsAntigen":null,"positiveTestsAntigen":null,"fips":"53","positiveIncrease":2162,"negativeIncrease":0,"total":298249,"totalTestResultsIncrease":23981,"posNeg":298249,"dataQualityGrade":null,"deathIncrease":49,"hospitalizedIncrease":98,"hash":"1ae105704f4842d9c8dd02f701d27f438aa5da66","commercialScore":0,"negativeRegularScore":0,"negativeScore":0,"positiveScore":0,"score":0,"grade":""},{"date":20210122,"state":"WA","positive":296087,"probableCases":12899,"negative":null,"pending":null,"totalTestResultsSource":"totalTestEncountersViral","totalTestResults":4325798,"hospitalizedCurrently":1012,"hospitalizedCumulative":16939,"inIcuCurrently":243,"inIcuCumulative":null,"onVentilatorCurrently":80,"onVentilatorCumulative":null,"recovered":null,"lastUpdateEt":"1/21/2021 02:59","dateModified":"2021-01-21T02:59:00Z","checkTimeEt":"01/20 21:59","death":4065,"hospitalized":16939,"hospitalizedDischarged":null,"dateChecked":"2021-01-21T02:59:00Z","totalTestsViral":null,"positiveTestsViral":null,"negativeTestsViral":null,"positiveCasesViral":283188,"deathConfirmed":null,"deathProbable":null,"totalTestEncountersViral":4325798,"totalTestsPeopleViral":null,"totalTestsAntibody":null,"positiveTestsAntibody":null,"negativeTestsAntibody":null,"totalTestsPeopleAntibody":null,"positiveTestsPeopleAntibody":null,"negativeTestsPeopleAntibody":null,"totalTestsPeopleAntigen":null,"positiveTestsPeopleAntigen":null,"totalTestsAntigen":null,"positiveTestsAntigen":null,"fips":"53","positiveIncrease":2070,"negativeIncrease":0,"total":296087,"totalTestResultsIncrease":28492,"posNeg":296087,"dataQualityGrade":null,"deathIncrease":125,"hospitalizedIncrease":91,"hash":"d02861f78fe2b07675588ac7e42ab4a01ea48c93","commercialScore":0,"negativeRegularScore":0,"negativeScore":0,"positiveScore":0,"score":0,"grade":""},{"date":20210121,"state":"WA","positive":294017,"probableCases":12759,"negative":null,"pending":null,"totalTestResultsSource":"totalTestEncountersViral","totalTestResults":4297306,"hospitalizedCurrently":977,"hospitalizedCumulative":16848,"inIcuCurrently":221,"inIcuCumulative":null,"onVentilatorCurrently":99,"onVentilatorCumulative":null,"recovered":null,"lastUpdateEt":"1/20/2021 02:59","dateModified":"2021-01-20T02:59:00Z","checkTimeEt":"01/19 21:59","death":3940,"hospitalized":16848,"hospitalizedDischarged":null,"dateChecked":"2021-01-20T02:59:00Z","totalTestsViral":null,"positiveTestsViral":null,"negativeTestsViral":null,"positiveCasesViral":281258,"deathConfirmed":null,"deathProbable":null,"totalTestEncountersViral":4297306,"totalTestsPeopleViral":null,"totalTestsAntibody":null,"positiveTestsAntibody":null,"negativeTestsAntibody":null,"totalTestsPeopleAntibody":null,"positiveTestsPeopleAntibody":null,"negativeTestsPeopleAntibody":null,"totalTestsPeopleAntigen":null,"positiveTestsPeopleAntigen":null,"totalTestsAntigen":null,"positiveTestsAntigen":null,"fips":"53","positiveIncrease":2028,"negativeIncrease":0,"total":294017,"totalTestResultsIncrease":31758,"posNeg":294017,"dataQualityGrade":null,"deathIncrease":0,"hospitalizedIncrease":206,"hash":"2f579425dfc9a3b4232826a4ad0b61a5325d7095","commercialScore":0,"negativeRegularScore":0,"negativeScore":0,"positiveScore":0,"score":0,"grade":""},{"date":20210120,"state":"WA","positive":291989,"probableCases":12568,"negative":null,"pending":null,"totalTestResultsSource":"totalTestEncountersViral","totalTestResults":4265548,"hospitalizedCurrently":1012,"hospitalizedCumulative":16642,"inIcuCurrently":243,"inIcuCumulative":null,"onVentilatorCurrently":104,"onVentilatorCumulative":null,"recovered":null,"lastUpdateEt":"1/19/2021 02:59","dateModified":"2021-01-19T02:59:00Z","checkTimeEt":"01/18 21:59","death":3940,"hospitalized":16642,"hospitalizedDischarged":null,"dateChecked":"2021-01-19T02:59:00Z","totalTestsViral":null,"positiveTestsViral":null,"negativeTestsViral":null,"positiveCasesViral":279421,"deathConfirmed":null,"deathProbable":null,"totalTestEncountersViral":4265548,"totalTestsPeopleViral":null,"totalTestsAntibody":null,"positiveTestsAntibody":null,"negativeTestsAntibody":null,"totalTestsPeopleAntibody":null,"positiveTestsPeopleAntibody":null,"negativeTestsPeopleAntibody":null,"totalTestsPeopleAntigen":null,"positiveTestsPeopleAntigen":null,"totalTestsAntigen":null,"positiveTestsAntigen":null,"fips":"53","positiveIncrease":2050,"negativeIncrease":0,"total":291989,"totalTestResultsIncrease":31790,"posNeg":291989,"dataQualityGrade":null,"deathIncrease":37,"hospitalizedIncrease":84,"hash":"85673520113d3f81949768985144f197a54e6e0f","commercialScore":0,"negativeRegularScore":0,"negativeScore":0,"positiveScore":0,"score":0,"grade":""},{"date":20210119,"state":"WA","positive":289939,"probableCases":12535,"negative":null,"pending":null,"totalTestResultsSource":"totalTestEncountersViral","totalTestResults":4233758,"hospitalizedCurrently":1066,"hospitalizedCumulative":16558,"inIcuCurrently":238,"inIcuCumulative":null,"onVentilatorCurrently":158,"onVentilatorCumulative":null,"recovered":null,"lastUpdateEt":"1/17/2021 02:59","dateModified":"2021-01-17T02:59:00Z","checkTimeEt":"01/16 21:59","death":3903,"hospitalized":16558,"hospitalizedDischarged":null,"dateChecked":"2021-01-17T02:59:00Z","totalTestsViral":null,"positiveTestsViral":null,"negativeTestsViral":null,"positiveCasesViral":277404,"deathConfirmed":null,"deathProbable":null,"totalTestEncountersViral":4233758,"totalTestsPeopleViral":null,"totalTestsAntibody":null,"positiveTestsAntibody":null,"negativeTestsAntibody":null,"totalTestsPeopleAntibody":null,"positiveTestsPeopleAntibody":null,"negativeTestsPeopleAntibody":null,"totalTestsPeopleAntigen":null,"positiveTestsPeopleAntigen":null,"totalTestsAntigen":null,"positiveTestsAntigen":null,"fips":"53","positiveIncrease":0,"negativeIncrease":0,"total":289939,"totalTestResultsIncrease":0,"posNeg":289939,"dataQualityGrade":null,"deathIncrease":0,"hospitalizedIncrease":0,"hash":"5b6c9e8e9f968c9b7f7a832804b0e0333e934d24","commercialScore":0,"negativeRegularScore":0,"negativeScore":0,"positiveScore":0,"score":0,"grade":""},{"date":20210118,"state":"WA","positive":289939,"probableCases":12535,"negative":null,"pending":null,"totalTestResultsSource":"totalTestEncountersViral","totalTestResults":4233758,"hospitalizedCurrently":1066,"hospitalizedCumulative":16558,"inIcuCurrently":238,"inIcuCumulative":null,"onVentilatorCurrently":158,"onVentilatorCumulative":null,"recovered":null,"lastUpdateEt":"1/17/2021 02:59","dateModified":"2021-01-17T02:59:00Z","checkTimeEt":"01/16 21:59","death":3903,"hospitalized":16558,"hospitalizedDischarged":null,"dateChecked":"2021-01-17T02:59:00Z","totalTestsViral":null,"positiveTestsViral":null,"negativeTestsViral":null,"positiveCasesViral":277404,"deathConfirmed":null,"deathProbable":null,"totalTestEncountersViral":4233758,"totalTestsPeopleViral":null,"totalTestsAntibody":null,"positiveTestsAntibody":null,"negativeTestsAntibody":null,"totalTestsPeopleAntibody":null,"positiveTestsPeopleAntibody":null,"negativeTestsPeopleAntibody":null,"totalTestsPeopleAntigen":null,"positiveTestsPeopleAntigen":null,"totalTestsAntigen":null,"positiveTestsAntigen":null,"fips":"53","positiveIncrease":3969,"negativeIncrease":0,"total":289939,"totalTestResultsIncrease":53925,"posNeg":289939,"dataQualityGrade":null,"deathIncrease":0,"hospitalizedIncrease":188,"hash":"5d031f02abac992d39fab51939f498def79dba14","commercialScore":0,"negativeRegularScore":0,"negativeScore":0,"positiveScore":0,"score":0,"grade":""},{"date":20210117,"state":"WA","positive":285970,"probableCases":12267,"negative":null,"pending":null,"totalTestResultsSource":"totalTestEncountersViral","totalTestResults":4179833,"hospitalizedCurrently":1066,"hospitalizedCumulative":16370,"inIcuCurrently":238,"inIcuCumulative":null,"onVentilatorCurrently":105,"onVentilatorCumulative":null,"recovered":null,"lastUpdateEt":"1/15/2021 02:59","dateModified":"2021-01-15T02:59:00Z","checkTimeEt":"01/14 21:59","death":3903,"hospitalized":16370,"hospitalizedDischarged":null,"dateChecked":"2021-01-15T02:59:00Z","totalTestsViral":null,"positiveTestsViral":null,"negativeTestsViral":null,"positiveCasesViral":273703,"deathConfirmed":null,"deathProbable":null,"totalTestEncountersViral":4179833,"totalTestsPeopleViral":null,"totalTestsAntibody":null,"positiveTestsAntibody":null,"negativeTestsAntibody":null,"totalTestsPeopleAntibody":null,"positiveTestsPeopleAntibody":null,"negativeTestsPeopleAntibody":null,"totalTestsPeopleAntigen":null,"positiveTestsPeopleAntigen":null,"totalTestsAntigen":null,"positiveTestsAntigen":null,"fips":"53","positiveIncrease":0,"negativeIncrease":0,"total":285970,"totalTestResultsIncrease":0,"posNeg":285970,"dataQualityGrade":null,"deathIncrease":0,"hospitalizedIncrease":0,"hash":"21e8654167d53398ce00a7c3fd90adab2d894ed8","commercialScore":0,"negativeRegularScore":0,"negativeScore":0,"positiveScore":0,"score":0,"grade":""},{"date":20210116,"state":"WA","positive":285970,"probableCases":12267,"negative":null,"pending":null,"totalTestResultsSource":"totalTestEncountersViral","totalTestResults":4179833,"hospitalizedCurrently":1066,"hospitalizedCumulative":16370,"inIcuCurrently":238,"inIcuCumulative":null,"onVentilatorCurrently":105,"onVentilatorCumulative":null,"recovered":null,"lastUpdateEt":"1/15/2021 02:59","dateModified":"2021-01-15T02:59:00Z","checkTimeEt":"01/14 21:59","death":3903,"hospitalized":16370,"hospitalizedDischarged":null,"dateChecked":"2021-01-15T02:59:00Z","totalTestsViral":null,"positiveTestsViral":null,"negativeTestsViral":null,"positiveCasesViral":273703,"deathConfirmed":null,"deathProbable":null,"totalTestEncountersViral":4179833,"totalTestsPeopleViral":null,"totalTestsAntibody":null,"positiveTestsAntibody":null,"negativeTestsAntibody":null,"totalTestsPeopleAntibody":null,"positiveTestsPeopleAntibody":null,"negativeTestsPeopleAntibody":null,"totalTestsPeopleAntigen":null,"positiveTestsPeopleAntigen":null,"totalTestsAntigen":null,"positiveTestsAntigen":null,"fips":"53","positiveIncrease":2193,"negativeIncrease":0,"total":285970,"totalTestResultsIncrease":26619,"posNeg":285970,"dataQualityGrade":null,"deathIncrease":27,"hospitalizedIncrease":290,"hash":"7295dd4972432a45dc9ca10e57ecc4c6bb001b24","commercialScore":0,"negativeRegularScore":0,"negativeScore":0,"positiveScore":0,"score":0,"grade":""},{"date":20210115,"state":"WA","positive":283777,"probableCases":12134,"negative":null,"pending":null,"totalTestResultsSource":"totalTestEncountersViral","totalTestResults":4153214,"hospitalizedCurrently":1105,"hospitalizedCumulative":16080,"inIcuCurrently":202,"inIcuCumulative":null,"onVentilatorCurrently":93,"onVentilatorCumulative":null,"recovered":null,"lastUpdateEt":"1/14/2021 02:59","dateModified":"2021-01-14T02:59:00Z","checkTimeEt":"01/13 21:59","death":3876,"hospitalized":16080,"hospitalizedDischarged":null,"dateChecked":"2021-01-14T02:59:00Z","totalTestsViral":null,"positiveTestsViral":null,"negativeTestsViral":null,"positiveCasesViral":271643,"deathConfirmed":null,"deathProbable":null,"totalTestEncountersViral":4153214,"totalTestsPeopleViral":null,"totalTestsAntibody":null,"positiveTestsAntibody":null,"negativeTestsAntibody":null,"totalTestsPeopleAntibody":null,"positiveTestsPeopleAntibody":null,"negativeTestsPeopleAntibody":null,"totalTestsPeopleAntigen":null,"positiveTestsPeopleAntigen":null,"totalTestsAntigen":null,"positiveTestsAntigen":null,"fips":"53","positiveIncrease":2575,"negativeIncrease":0,"total":283777,"totalTestResultsIncrease":24797,"posNeg":283777,"dataQualityGrade":null,"deathIncrease":38,"hospitalizedIncrease":0,"hash":"975a3018e744f84a243de94a126ba24245146ad5","commercialScore":0,"negativeRegularScore":0,"negativeScore":0,"positiveScore":0,"score":0,"grade":""},{"date":20210114,"state":"WA","positive":281202,"probableCases":12001,"negative":null,"pending":null,"totalTestResultsSource":"totalTestEncountersViral","totalTestResults":4128417,"hospitalizedCurrently":1083,"hospitalizedCumulative":16080,"inIcuCurrently":215,"inIcuCumulative":null,"onVentilatorCurrently":93,"onVentilatorCumulative":null,"recovered":null,"lastUpdateEt":"1/13/2021 02:59","dateModified":"2021-01-13T02:59:00Z","checkTimeEt":"01/12 21:59","death":3838,"hospitalized":16080,"hospitalizedDischarged":null,"dateChecked":"2021-01-13T02:59:00Z","totalTestsViral":null,"positiveTestsViral":null,"negativeTestsViral":null,"positiveCasesViral":269201,"deathConfirmed":null,"deathProbable":null,"totalTestEncountersViral":4128417,"totalTestsPeopleViral":null,"totalTestsAntibody":null,"positiveTestsAntibody":null,"negativeTestsAntibody":null,"totalTestsPeopleAntibody":null,"positiveTestsPeopleAntibody":null,"negativeTestsPeopleAntibody":null,"totalTestsPeopleAntigen":null,"positiveTestsPeopleAntigen":null,"totalTestsAntigen":null,"positiveTestsAntigen":null,"fips":"53","positiveIncrease":2658,"negativeIncrease":0,"total":281202,"totalTestResultsIncrease":17770,"posNeg":281202,"dataQualityGrade":null,"deathIncrease":49,"hospitalizedIncrease":12,"hash":"8b6cee0898f14a89cc54f2d71791533beba6562f","commercialScore":0,"negativeRegularScore":0,"negativeScore":0,"positiveScore":0,"score":0,"grade":""},{"date":20210113,"state":"WA","positive":278544,"probableCases":11843,"negative":null,"pending":null,"totalTestResultsSource":"totalTestEncountersViral","totalTestResults":4110647,"hospitalizedCurrently":1076,"hospitalizedCumulative":16068,"inIcuCurrently":216,"inIcuCumulative":null,"onVentilatorCurrently":111,"onVentilatorCumulative":null,"recovered":null,"lastUpdateEt":"1/12/2021 02:59","dateModified":"2021-01-12T02:59:00Z","checkTimeEt":"01/11 21:59","death":3789,"hospitalized":16068,"hospitalizedDischarged":null,"dateChecked":"2021-01-12T02:59:00Z","totalTestsViral":null,"positiveTestsViral":null,"negativeTestsViral":null,"positiveCasesViral":266701,"deathConfirmed":null,"deathProbable":null,"totalTestEncountersViral":4110647,"totalTestsPeopleViral":null,"totalTestsAntibody":null,"positiveTestsAntibody":null,"negativeTestsAntibody":null,"totalTestsPeopleAntibody":null,"positiveTestsPeopleAntibody":null,"negativeTestsPeopleAntibody":null,"totalTestsPeopleAntigen":null,"positiveTestsPeopleAntigen":null,"totalTestsAntigen":null,"positiveTestsAntigen":null,"fips":"53","positiveIncrease":1858,"negativeIncrease":0,"total":278544,"totalTestResultsIncrease":23116,"posNeg":278544,"dataQualityGrade":null,"deathIncrease":90,"hospitalizedIncrease":90,"hash":"e774ce5bcadf550b8f1b6d5ac12673bb2ccaf680","commercialScore":0,"negativeRegularScore":0,"negativeScore":0,"positiveScore":0,"score":0,"grade":""},{"date":20210112,"state":"WA","positive":276686,"probableCases":11374,"negative":null,"pending":null,"totalTestResultsSource":"totalTestEncountersViral","totalTestResults":4087531,"hospitalizedCurrently":1074,"hospitalizedCumulative":15978,"inIcuCurrently":234,"inIcuCumulative":null,"onVentilatorCurrently":116,"onVentilatorCumulative":null,"recovered":null,"lastUpdateEt":"1/11/2021 02:59","dateModified":"2021-01-11T02:59:00Z","checkTimeEt":"01/10 21:59","death":3699,"hospitalized":15978,"hospitalizedDischarged":null,"dateChecked":"2021-01-11T02:59:00Z","totalTestsViral":null,"positiveTestsViral":null,"negativeTestsViral":null,"positiveCasesViral":265312,"deathConfirmed":null,"deathProbable":null,"totalTestEncountersViral":4087531,"totalTestsPeopleViral":null,"totalTestsAntibody":null,"positiveTestsAntibody":null,"negativeTestsAntibody":null,"totalTestsPeopleAntibody":null,"positiveTestsPeopleAntibody":null,"negativeTestsPeopleAntibody":null,"totalTestsPeopleAntigen":null,"positiveTestsPeopleAntigen":null,"totalTestsAntigen":null,"positiveTestsAntigen":null,"fips":"53","positiveIncrease":5091,"negativeIncrease":0,"total":276686,"totalTestResultsIncrease":52757,"posNeg":276686,"dataQualityGrade":null,"deathIncrease":1,"hospitalizedIncrease":207,"hash":"e9f07425f40384ba66645b48f90d6cbbbbb25274","commercialScore":0,"negativeRegularScore":0,"negativeScore":0,"positiveScore":0,"score":0,"grade":""},{"date":20210111,"state":"WA","positive":271595,"probableCases":11235,"negative":null,"pending":null,"totalTestResultsSource":"totalTestEncountersViral","totalTestResults":4034774,"hospitalizedCurrently":1177,"hospitalizedCumulative":15771,"inIcuCurrently":245,"inIcuCumulative":null,"onVentilatorCurrently":86,"onVentilatorCumulative":null,"recovered":null,"lastUpdateEt":"1/9/2021 02:59","dateModified":"2021-01-09T02:59:00Z","checkTimeEt":"01/08 21:59","death":3698,"hospitalized":15771,"hospitalizedDischarged":null,"dateChecked":"2021-01-09T02:59:00Z","totalTestsViral":null,"positiveTestsViral":null,"negativeTestsViral":null,"positiveCasesViral":260360,"deathConfirmed":null,"deathProbable":null,"totalTestEncountersViral":4034774,"totalTestsPeopleViral":null,"totalTestsAntibody":null,"positiveTestsAntibody":null,"negativeTestsAntibody":null,"totalTestsPeopleAntibody":null,"positiveTestsPeopleAntibody":null,"negativeTestsPeopleAntibody":null,"totalTestsPeopleAntigen":null,"positiveTestsPeopleAntigen":null,"totalTestsAntigen":null,"positiveTestsAntigen":null,"fips":"53","positiveIncrease":0,"negativeIncrease":0,"total":271595,"totalTestResultsIncrease":0,"posNeg":271595,"dataQualityGrade":null,"deathIncrease":0,"hospitalizedIncrease":0,"hash":"99573b4d3be2500cdbad2e55bc405f9b5ef497f1","commercialScore":0,"negativeRegularScore":0,"negativeScore":0,"positiveScore":0,"score":0,"grade":""},{"date":20210110,"state":"WA","positive":271595,"probableCases":11235,"negative":null,"pending":null,"totalTestResultsSource":"totalTestEncountersViral","totalTestResults":4034774,"hospitalizedCurrently":1177,"hospitalizedCumulative":15771,"inIcuCurrently":245,"inIcuCumulative":null,"onVentilatorCurrently":86,"onVentilatorCumulative":null,"recovered":null,"lastUpdateEt":"1/9/2021 02:59","dateModified":"2021-01-09T02:59:00Z","checkTimeEt":"01/08 21:59","death":3698,"hospitalized":15771,"hospitalizedDischarged":null,"dateChecked":"2021-01-09T02:59:00Z","totalTestsViral":null,"positiveTestsViral":null,"negativeTestsViral":null,"positiveCasesViral":260360,"deathConfirmed":null,"deathProbable":null,"totalTestEncountersViral":4034774,"totalTestsPeopleViral":null,"totalTestsAntibody":null,"positiveTestsAntibody":null,"negativeTestsAntibody":null,"totalTestsPeopleAntibody":null,"positiveTestsPeopleAntibody":null,"negativeTestsPeopleAntibody":null,"totalTestsPeopleAntigen":null,"positiveTestsPeopleAntigen":null,"totalTestsAntigen":null,"positiveTestsAntigen":null,"fips":"53","positiveIncrease":2988,"negativeIncrease":0,"total":271595,"totalTestResultsIncrease":24990,"posNeg":271595,"dataQualityGrade":null,"deathIncrease":-1,"hospitalizedIncrease":214,"hash":"31b165574e9596ce781a08d2dfc1387ab2ede98d","commercialScore":0,"negativeRegularScore":0,"negativeScore":0,"positiveScore":0,"score":0,"grade":""},{"date":20210109,"state":"WA","positive":268607,"probableCases":11160,"negative":null,"pending":null,"totalTestResultsSource":"totalTestEncountersViral","totalTestResults":4009784,"hospitalizedCurrently":1177,"hospitalizedCumulative":15557,"inIcuCurrently":245,"inIcuCumulative":null,"onVentilatorCurrently":118,"onVentilatorCumulative":null,"recovered":null,"lastUpdateEt":"1/8/2021 02:59","dateModified":"2021-01-08T02:59:00Z","checkTimeEt":"01/07 21:59","death":3699,"hospitalized":15557,"hospitalizedDischarged":null,"dateChecked":"2021-01-08T02:59:00Z","totalTestsViral":null,"positiveTestsViral":null,"negativeTestsViral":null,"positiveCasesViral":257447,"deathConfirmed":null,"deathProbable":null,"totalTestEncountersViral":4009784,"totalTestsPeopleViral":null,"totalTestsAntibody":null,"positiveTestsAntibody":null,"negativeTestsAntibody":null,"totalTestsPeopleAntibody":null,"positiveTestsPeopleAntibody":null,"negativeTestsPeopleAntibody":null,"totalTestsPeopleAntigen":null,"positiveTestsPeopleAntigen":null,"totalTestsAntigen":null,"positiveTestsAntigen":null,"fips":"53","positiveIncrease":4595,"negativeIncrease":0,"total":268607,"totalTestResultsIncrease":22646,"posNeg":268607,"dataQualityGrade":null,"deathIncrease":65,"hospitalizedIncrease":-11,"hash":"ae50afb581bb3119885e1a29b3054ae0d6b7ad5b","commercialScore":0,"negativeRegularScore":0,"negativeScore":0,"positiveScore":0,"score":0,"grade":""},{"date":20210108,"state":"WA","positive":264012,"probableCases":10611,"negative":null,"pending":null,"totalTestResultsSource":"totalTestEncountersViral","totalTestResults":3987138,"hospitalizedCurrently":1197,"hospitalizedCumulative":15568,"inIcuCurrently":242,"inIcuCumulative":null,"onVentilatorCurrently":104,"onVentilatorCumulative":null,"recovered":null,"lastUpdateEt":"1/7/2021 02:59","dateModified":"2021-01-07T02:59:00Z","checkTimeEt":"01/06 21:59","death":3634,"hospitalized":15568,"hospitalizedDischarged":null,"dateChecked":"2021-01-07T02:59:00Z","totalTestsViral":null,"positiveTestsViral":null,"negativeTestsViral":null,"positiveCasesViral":253401,"deathConfirmed":null,"deathProbable":null,"totalTestEncountersViral":3987138,"totalTestsPeopleViral":null,"totalTestsAntibody":null,"positiveTestsAntibody":null,"negativeTestsAntibody":null,"totalTestsPeopleAntibody":null,"positiveTestsPeopleAntibody":null,"negativeTestsPeopleAntibody":null,"totalTestsPeopleAntigen":null,"positiveTestsPeopleAntigen":null,"totalTestsAntigen":null,"positiveTestsAntigen":null,"fips":"53","positiveIncrease":3260,"negativeIncrease":0,"total":264012,"totalTestResultsIncrease":17549,"posNeg":264012,"dataQualityGrade":null,"deathIncrease":29,"hospitalizedIncrease":153,"hash":"984e1cb0d438f3e97948af6f7ad3c4d33b4a3111","commercialScore":0,"negativeRegularScore":0,"negativeScore":0,"positiveScore":0,"score":0,"grade":""},{"date":20210107,"state":"WA","positive":260752,"probableCases":10446,"negative":null,"pending":null,"totalTestResultsSource":"totalTestEncountersViral","totalTestResults":3969589,"hospitalizedCurrently":1159,"hospitalizedCumulative":15415,"inIcuCurrently":266,"inIcuCumulative":null,"onVentilatorCurrently":109,"onVentilatorCumulative":null,"recovered":null,"lastUpdateEt":"1/6/2021 02:59","dateModified":"2021-01-06T02:59:00Z","checkTimeEt":"01/05 21:59","death":3605,"hospitalized":15415,"hospitalizedDischarged":null,"dateChecked":"2021-01-06T02:59:00Z","totalTestsViral":null,"positiveTestsViral":null,"negativeTestsViral":null,"positiveCasesViral":250306,"deathConfirmed":null,"deathProbable":null,"totalTestEncountersViral":3969589,"totalTestsPeopleViral":null,"totalTestsAntibody":null,"positiveTestsAntibody":null,"negativeTestsAntibody":null,"totalTestsPeopleAntibody":null,"positiveTestsPeopleAntibody":null,"negativeTestsPeopleAntibody":null,"totalTestsPeopleAntigen":null,"positiveTestsPeopleAntigen":null,"totalTestsAntigen":null,"positiveTestsAntigen":null,"fips":"53","positiveIncrease":1985,"negativeIncrease":0,"total":260752,"totalTestResultsIncrease":19957,"posNeg":260752,"dataQualityGrade":null,"deathIncrease":64,"hospitalizedIncrease":88,"hash":"8d1d46ce5e28b9353b663015c75a07e311defbdb","commercialScore":0,"negativeRegularScore":0,"negativeScore":0,"positiveScore":0,"score":0,"grade":""},{"date":20210106,"state":"WA","positive":258767,"probableCases":10187,"negative":null,"pending":null,"totalTestResultsSource":"totalTestEncountersViral","totalTestResults":3949632,"hospitalizedCurrently":1167,"hospitalizedCumulative":15327,"inIcuCurrently":262,"inIcuCumulative":null,"onVentilatorCurrently":121,"onVentilatorCumulative":null,"recovered":null,"lastUpdateEt":"1/5/2021 02:59","dateModified":"2021-01-05T02:59:00Z","checkTimeEt":"01/04 21:59","death":3541,"hospitalized":15327,"hospitalizedDischarged":null,"dateChecked":"2021-01-05T02:59:00Z","totalTestsViral":null,"positiveTestsViral":null,"negativeTestsViral":null,"positiveCasesViral":248580,"deathConfirmed":null,"deathProbable":null,"totalTestEncountersViral":3949632,"totalTestsPeopleViral":null,"totalTestsAntibody":null,"positiveTestsAntibody":null,"negativeTestsAntibody":null,"totalTestsPeopleAntibody":null,"positiveTestsPeopleAntibody":null,"negativeTestsPeopleAntibody":null,"totalTestsPeopleAntigen":null,"positiveTestsPeopleAntigen":null,"totalTestsAntigen":null,"positiveTestsAntigen":null,"fips":"53","positiveIncrease":2332,"negativeIncrease":0,"total":258767,"totalTestResultsIncrease":13872,"posNeg":258767,"dataQualityGrade":null,"deathIncrease":59,"hospitalizedIncrease":167,"hash":"7ca725715a2393cc642d723c49ec8ed727f6fc94","commercialScore":0,"negativeRegularScore":0,"negativeScore":0,"positiveScore":0,"score":0,"grade":""},{"date":20210105,"state":"WA","positive":256435,"probableCases":10059,"negative":null,"pending":null,"totalTestResultsSource":"totalTestEncountersViral","totalTestResults":3935760,"hospitalizedCurrently":1117,"hospitalizedCumulative":15160,"inIcuCurrently":249,"inIcuCumulative":null,"onVentilatorCurrently":109,"onVentilatorCumulative":null,"recovered":null,"lastUpdateEt":"1/4/2021 02:59","dateModified":"2021-01-04T02:59:00Z","checkTimeEt":"01/03 21:59","death":3482,"hospitalized":15160,"hospitalizedDischarged":null,"dateChecked":"2021-01-04T02:59:00Z","totalTestsViral":null,"positiveTestsViral":null,"negativeTestsViral":null,"positiveCasesViral":246376,"deathConfirmed":null,"deathProbable":null,"totalTestEncountersViral":3935760,"totalTestsPeopleViral":null,"totalTestsAntibody":null,"positiveTestsAntibody":null,"negativeTestsAntibody":null,"totalTestsPeopleAntibody":null,"positiveTestsPeopleAntibody":null,"negativeTestsPeopleAntibody":null,"totalTestsPeopleAntigen":null,"positiveTestsPeopleAntigen":null,"totalTestsAntigen":null,"positiveTestsAntigen":null,"fips":"53","positiveIncrease":1039,"negativeIncrease":0,"total":256435,"totalTestResultsIncrease":25788,"posNeg":256435,"dataQualityGrade":null,"deathIncrease":23,"hospitalizedIncrease":49,"hash":"7ba0359667729afb0cf70d10974d23b3d3a6fa4b","commercialScore":0,"negativeRegularScore":0,"negativeScore":0,"positiveScore":0,"score":0,"grade":""},{"date":20210104,"state":"WA","positive":255396,"probableCases":10015,"negative":null,"pending":null,"totalTestResultsSource":"totalTestEncountersViral","totalTestResults":3909972,"hospitalizedCurrently":1138,"hospitalizedCumulative":15111,"inIcuCurrently":248,"inIcuCumulative":null,"onVentilatorCurrently":116,"onVentilatorCumulative":null,"recovered":null,"lastUpdateEt":"1/3/2021 02:59","dateModified":"2021-01-03T02:59:00Z","checkTimeEt":"01/02 21:59","death":3459,"hospitalized":15111,"hospitalizedDischarged":null,"dateChecked":"2021-01-03T02:59:00Z","totalTestsViral":null,"positiveTestsViral":null,"negativeTestsViral":null,"positiveCasesViral":245381,"deathConfirmed":null,"deathProbable":null,"totalTestEncountersViral":3909972,"totalTestsPeopleViral":null,"totalTestsAntibody":null,"positiveTestsAntibody":null,"negativeTestsAntibody":null,"totalTestsPeopleAntibody":null,"positiveTestsPeopleAntibody":null,"negativeTestsPeopleAntibody":null,"totalTestsPeopleAntigen":null,"positiveTestsPeopleAntigen":null,"totalTestsAntigen":null,"positiveTestsAntigen":null,"fips":"53","positiveIncrease":8644,"negativeIncrease":0,"total":255396,"totalTestResultsIncrease":73152,"posNeg":255396,"dataQualityGrade":null,"deathIncrease":-2,"hospitalizedIncrease":363,"hash":"d3aad91a89c1e41e333e6c18fc93c8f428c5e537","commercialScore":0,"negativeRegularScore":0,"negativeScore":0,"positiveScore":0,"score":0,"grade":""},{"date":20210103,"state":"WA","positive":246752,"probableCases":9587,"negative":null,"pending":null,"totalTestResultsSource":"totalTestEncountersViral","totalTestResults":3836820,"hospitalizedCurrently":1138,"hospitalizedCumulative":14748,"inIcuCurrently":248,"inIcuCumulative":null,"onVentilatorCurrently":118,"onVentilatorCumulative":null,"recovered":null,"lastUpdateEt":"12/31/2020 02:59","dateModified":"2020-12-31T02:59:00Z","checkTimeEt":"12/30 21:59","death":3461,"hospitalized":14748,"hospitalizedDischarged":null,"dateChecked":"2020-12-31T02:59:00Z","totalTestsViral":null,"positiveTestsViral":null,"negativeTestsViral":null,"positiveCasesViral":237165,"deathConfirmed":null,"deathProbable":null,"totalTestEncountersViral":3836820,"totalTestsPeopleViral":null,"totalTestsAntibody":null,"positiveTestsAntibody":null,"negativeTestsAntibody":null,"totalTestsPeopleAntibody":null,"positiveTestsPeopleAntibody":null,"negativeTestsPeopleAntibody":null,"totalTestsPeopleAntigen":null,"positiveTestsPeopleAntigen":null,"totalTestsAntigen":null,"positiveTestsAntigen":null,"fips":"53","positiveIncrease":0,"negativeIncrease":0,"total":246752,"totalTestResultsIncrease":0,"posNeg":246752,"dataQualityGrade":null,"deathIncrease":0,"hospitalizedIncrease":0,"hash":"98f364782c0217190bcf73411f88313df64111b2","commercialScore":0,"negativeRegularScore":0,"negativeScore":0,"positiveScore":0,"score":0,"grade":""},{"date":20210102,"state":"WA","positive":246752,"probableCases":9587,"negative":null,"pending":null,"totalTestResultsSource":"totalTestEncountersViral","totalTestResults":3836820,"hospitalizedCurrently":1138,"hospitalizedCumulative":14748,"inIcuCurrently":248,"inIcuCumulative":null,"onVentilatorCurrently":118,"onVentilatorCumulative":null,"recovered":null,"lastUpdateEt":"12/31/2020 02:59","dateModified":"2020-12-31T02:59:00Z","checkTimeEt":"12/30 21:59","death":3461,"hospitalized":14748,"hospitalizedDischarged":null,"dateChecked":"2020-12-31T02:59:00Z","totalTestsViral":null,"positiveTestsViral":null,"negativeTestsViral":null,"positiveCasesViral":237165,"deathConfirmed":null,"deathProbable":null,"totalTestEncountersViral":3836820,"totalTestsPeopleViral":null,"totalTestsAntibody":null,"positiveTestsAntibody":null,"negativeTestsAntibody":null,"totalTestsPeopleAntibody":null,"positiveTestsPeopleAntibody":null,"negativeTestsPeopleAntibody":null,"totalTestsPeopleAntigen":null,"positiveTestsPeopleAntigen":null,"totalTestsAntigen":null,"positiveTestsAntigen":null,"fips":"53","positiveIncrease":0,"negativeIncrease":0,"total":246752,"totalTestResultsIncrease":0,"posNeg":246752,"dataQualityGrade":null,"deathIncrease":0,"hospitalizedIncrease":0,"hash":"aaa87a3f6f8f02b268bd5f6b728a445fedf167fc","commercialScore":0,"negativeRegularScore":0,"negativeScore":0,"positiveScore":0,"score":0,"grade":""},{"date":20210101,"state":"WA","positive":246752,"probableCases":9587,"negative":null,"pending":null,"totalTestResultsSource":"totalTestEncountersViral","totalTestResults":3836820,"hospitalizedCurrently":1138,"hospitalizedCumulative":14748,"inIcuCurrently":248,"inIcuCumulative":null,"onVentilatorCurrently":118,"onVentilatorCumulative":null,"recovered":null,"lastUpdateEt":"12/31/2020 02:59","dateModified":"2020-12-31T02:59:00Z","checkTimeEt":"12/30 21:59","death":3461,"hospitalized":14748,"hospitalizedDischarged":null,"dateChecked":"2020-12-31T02:59:00Z","totalTestsViral":null,"positiveTestsViral":null,"negativeTestsViral":null,"positiveCasesViral":237165,"deathConfirmed":null,"deathProbable":null,"totalTestEncountersViral":3836820,"totalTestsPeopleViral":null,"totalTestsAntibody":null,"positiveTestsAntibody":null,"negativeTestsAntibody":null,"totalTestsPeopleAntibody":null,"positiveTestsPeopleAntibody":null,"negativeTestsPeopleAntibody":null,"totalTestsPeopleAntigen":null,"positiveTestsPeopleAntigen":null,"totalTestsAntigen":null,"positiveTestsAntigen":null,"fips":"53","positiveIncrease":4422,"negativeIncrease":0,"total":246752,"totalTestResultsIncrease":31430,"posNeg":246752,"dataQualityGrade":null,"deathIncrease":41,"hospitalizedIncrease":177,"hash":"39482dbee26883b0e9a52613b78c1d51f7b0c968","commercialScore":0,"negativeRegularScore":0,"negativeScore":0,"positiveScore":0,"score":0,"grade":""},{"date":20201231,"state":"WA","positive":242330,"probableCases":9337,"negative":null,"pending":null,"totalTestResultsSource":"totalTestEncountersViral","totalTestResults":3805390,"hospitalizedCurrently":1088,"hospitalizedCumulative":14571,"inIcuCurrently":235,"inIcuCumulative":null,"onVentilatorCurrently":118,"onVentilatorCumulative":null,"recovered":null,"lastUpdateEt":"12/30/2020 02:59","dateModified":"2020-12-30T02:59:00Z","checkTimeEt":"12/29 21:59","death":3420,"hospitalized":14571,"hospitalizedDischarged":null,"dateChecked":"2020-12-30T02:59:00Z","totalTestsViral":null,"positiveTestsViral":null,"negativeTestsViral":null,"positiveCasesViral":232993,"deathConfirmed":null,"deathProbable":null,"totalTestEncountersViral":3805390,"totalTestsPeopleViral":null,"totalTestsAntibody":null,"positiveTestsAntibody":null,"negativeTestsAntibody":null,"totalTestsPeopleAntibody":null,"positiveTestsPeopleAntibody":null,"negativeTestsPeopleAntibody":null,"totalTestsPeopleAntigen":null,"positiveTestsPeopleAntigen":null,"totalTestsAntigen":null,"positiveTestsAntigen":null,"fips":"53","positiveIncrease":1484,"negativeIncrease":0,"total":242330,"totalTestResultsIncrease":7069,"posNeg":242330,"dataQualityGrade":null,"deathIncrease":51,"hospitalizedIncrease":126,"hash":"8a5757b99b3f85e377588e1e6a0fe29e1b11e16d","commercialScore":0,"negativeRegularScore":0,"negativeScore":0,"positiveScore":0,"score":0,"grade":""},{"date":20201230,"state":"WA","positive":240846,"probableCases":9122,"negative":null,"pending":null,"totalTestResultsSource":"totalTestEncountersViral","totalTestResults":3798321,"hospitalizedCurrently":1201,"hospitalizedCumulative":14445,"inIcuCurrently":245,"inIcuCumulative":null,"onVentilatorCurrently":108,"onVentilatorCumulative":null,"recovered":null,"lastUpdateEt":"12/29/2020 02:59","dateModified":"2020-12-29T02:59:00Z","checkTimeEt":"12/28 21:59","death":3369,"hospitalized":14445,"hospitalizedDischarged":null,"dateChecked":"2020-12-29T02:59:00Z","totalTestsViral":null,"positiveTestsViral":null,"negativeTestsViral":null,"positiveCasesViral":231724,"deathConfirmed":null,"deathProbable":null,"totalTestEncountersViral":3798321,"totalTestsPeopleViral":null,"totalTestsAntibody":null,"positiveTestsAntibody":null,"negativeTestsAntibody":null,"totalTestsPeopleAntibody":null,"positiveTestsPeopleAntibody":null,"negativeTestsPeopleAntibody":null,"totalTestsPeopleAntigen":null,"positiveTestsPeopleAntigen":null,"totalTestsAntigen":null,"positiveTestsAntigen":null,"fips":"53","positiveIncrease":2174,"negativeIncrease":0,"total":240846,"totalTestResultsIncrease":29659,"posNeg":240846,"dataQualityGrade":null,"deathIncrease":174,"hospitalizedIncrease":169,"hash":"3748194e9e18010778fca2d3947e50985c1874ea","commercialScore":0,"negativeRegularScore":0,"negativeScore":0,"positiveScore":0,"score":0,"grade":""},{"date":20201229,"state":"WA","positive":238672,"probableCases":9000,"negative":null,"pending":null,"totalTestResultsSource":"totalTestEncountersViral","totalTestResults":3768662,"hospitalizedCurrently":1280,"hospitalizedCumulative":14276,"inIcuCurrently":265,"inIcuCumulative":null,"onVentilatorCurrently":105,"onVentilatorCumulative":null,"recovered":null,"lastUpdateEt":"12/28/2020 02:59","dateModified":"2020-12-28T02:59:00Z","checkTimeEt":"12/27 21:59","death":3195,"hospitalized":14276,"hospitalizedDischarged":null,"dateChecked":"2020-12-28T02:59:00Z","totalTestsViral":null,"positiveTestsViral":null,"negativeTestsViral":null,"positiveCasesViral":229672,"deathConfirmed":null,"deathProbable":null,"totalTestEncountersViral":3768662,"totalTestsPeopleViral":null,"totalTestsAntibody":null,"positiveTestsAntibody":null,"negativeTestsAntibody":null,"totalTestsPeopleAntibody":null,"positiveTestsPeopleAntibody":null,"negativeTestsPeopleAntibody":null,"totalTestsPeopleAntigen":null,"positiveTestsPeopleAntigen":null,"totalTestsAntigen":null,"positiveTestsAntigen":null,"fips":"53","positiveIncrease":1953,"negativeIncrease":0,"total":238672,"totalTestResultsIncrease":57883,"posNeg":238672,"dataQualityGrade":null,"deathIncrease":11,"hospitalizedIncrease":180,"hash":"33f3eb4c402c6254c5b3c698b2eabbe6c629aaea","commercialScore":0,"negativeRegularScore":0,"negativeScore":0,"positiveScore":0,"score":0,"grade":""},{"date":20201228,"state":"WA","positive":236719,"probableCases":8924,"negative":null,"pending":null,"totalTestResultsSource":"totalTestEncountersViral","totalTestResults":3710779,"hospitalizedCurrently":1200,"hospitalizedCumulative":14096,"inIcuCurrently":243,"inIcuCumulative":null,"onVentilatorCurrently":90,"onVentilatorCumulative":null,"recovered":null,"lastUpdateEt":"12/26/2020 02:59","dateModified":"2020-12-26T02:59:00Z","checkTimeEt":"12/25 21:59","death":3184,"hospitalized":14096,"hospitalizedDischarged":null,"dateChecked":"2020-12-26T02:59:00Z","totalTestsViral":null,"positiveTestsViral":null,"negativeTestsViral":null,"positiveCasesViral":227795,"deathConfirmed":null,"deathProbable":null,"totalTestEncountersViral":3710779,"totalTestsPeopleViral":null,"totalTestsAntibody":null,"positiveTestsAntibody":null,"negativeTestsAntibody":null,"totalTestsPeopleAntibody":null,"positiveTestsPeopleAntibody":null,"negativeTestsPeopleAntibody":null,"totalTestsPeopleAntigen":null,"positiveTestsPeopleAntigen":null,"totalTestsAntigen":null,"positiveTestsAntigen":null,"fips":"53","positiveIncrease":0,"negativeIncrease":0,"total":236719,"totalTestResultsIncrease":0,"posNeg":236719,"dataQualityGrade":null,"deathIncrease":0,"hospitalizedIncrease":0,"hash":"6b12baa961f72dffe8655ba33e51fe8b8cf48b64","commercialScore":0,"negativeRegularScore":0,"negativeScore":0,"positiveScore":0,"score":0,"grade":""},{"date":20201227,"state":"WA","positive":236719,"probableCases":8924,"negative":null,"pending":null,"totalTestResultsSource":"totalTestEncountersViral","totalTestResults":3710779,"hospitalizedCurrently":1200,"hospitalizedCumulative":14096,"inIcuCurrently":243,"inIcuCumulative":null,"onVentilatorCurrently":90,"onVentilatorCumulative":null,"recovered":null,"lastUpdateEt":"12/26/2020 02:59","dateModified":"2020-12-26T02:59:00Z","checkTimeEt":"12/25 21:59","death":3184,"hospitalized":14096,"hospitalizedDischarged":null,"dateChecked":"2020-12-26T02:59:00Z","totalTestsViral":null,"positiveTestsViral":null,"negativeTestsViral":null,"positiveCasesViral":227795,"deathConfirmed":null,"deathProbable":null,"totalTestEncountersViral":3710779,"totalTestsPeopleViral":null,"totalTestsAntibody":null,"positiveTestsAntibody":null,"negativeTestsAntibody":null,"totalTestsPeopleAntibody":null,"positiveTestsPeopleAntibody":null,"negativeTestsPeopleAntibody":null,"totalTestsPeopleAntigen"