[{"date":20210307,"state":"WI","positive":621654,"probableCases":54961,"negative":2647864,"pending":31,"totalTestResultsSource":"totalTestEncountersViral","totalTestResults":7080595,"hospitalizedCurrently":249,"hospitalizedCumulative":26457,"inIcuCurrently":66,"inIcuCumulative":2273,"onVentilatorCurrently":null,"onVentilatorCumulative":null,"recovered":553203,"lastUpdateEt":"3/7/2021 00:00","dateModified":"2021-03-07T00:00:00Z","checkTimeEt":"03/06 19:00","death":7106,"hospitalized":26457,"hospitalizedDischarged":null,"dateChecked":"2021-03-07T00:00:00Z","totalTestsViral":null,"positiveTestsViral":null,"negativeTestsViral":null,"positiveCasesViral":566693,"deathConfirmed":6481,"deathProbable":625,"totalTestEncountersViral":7080595,"totalTestsPeopleViral":3214557,"totalTestsAntibody":null,"positiveTestsAntibody":null,"negativeTestsAntibody":null,"totalTestsPeopleAntibody":null,"positiveTestsPeopleAntibody":null,"negativeTestsPeopleAntibody":null,"totalTestsPeopleAntigen":null,"positiveTestsPeopleAntigen":null,"totalTestsAntigen":null,"positiveTestsAntigen":null,"fips":"55","positiveIncrease":377,"negativeIncrease":3521,"total":3269549,"totalTestResultsIncrease":19193,"posNeg":3269518,"dataQualityGrade":null,"deathIncrease":4,"hospitalizedIncrease":25,"hash":"ea0056371780c0d00c44fa4f40092e7e0708a929","commercialScore":0,"negativeRegularScore":0,"negativeScore":0,"positiveScore":0,"score":0,"grade":""},{"date":20210306,"state":"WI","positive":621277,"probableCases":54913,"negative":2644343,"pending":36,"totalTestResultsSource":"totalTestEncountersViral","totalTestResults":7061402,"hospitalizedCurrently":260,"hospitalizedCumulative":26432,"inIcuCurrently":77,"inIcuCumulative":2271,"onVentilatorCurrently":null,"onVentilatorCumulative":null,"recovered":552642,"lastUpdateEt":"3/6/2021 00:00","dateModified":"2021-03-06T00:00:00Z","checkTimeEt":"03/05 19:00","death":7102,"hospitalized":26432,"hospitalizedDischarged":null,"dateChecked":"2021-03-06T00:00:00Z","totalTestsViral":null,"positiveTestsViral":null,"negativeTestsViral":null,"positiveCasesViral":566364,"deathConfirmed":6478,"deathProbable":624,"totalTestEncountersViral":7061402,"totalTestsPeopleViral":3210707,"totalTestsAntibody":null,"positiveTestsAntibody":null,"negativeTestsAntibody":null,"totalTestsPeopleAntibody":null,"positiveTestsPeopleAntibody":null,"negativeTestsPeopleAntibody":null,"totalTestsPeopleAntigen":null,"positiveTestsPeopleAntigen":null,"totalTestsAntigen":null,"positiveTestsAntigen":null,"fips":"55","positiveIncrease":614,"negativeIncrease":2161,"total":3265656,"totalTestResultsIncrease":24321,"posNeg":3265620,"dataQualityGrade":null,"deathIncrease":8,"hospitalizedIncrease":45,"hash":"75f9bf52b10e890bcf5a51d63b1a4e5834e14ad1","commercialScore":0,"negativeRegularScore":0,"negativeScore":0,"positiveScore":0,"score":0,"grade":""},{"date":20210305,"state":"WI","positive":620663,"probableCases":54505,"negative":2642182,"pending":36,"totalTestResultsSource":"totalTestEncountersViral","totalTestResults":7037081,"hospitalizedCurrently":260,"hospitalizedCumulative":26387,"inIcuCurrently":77,"inIcuCumulative":2268,"onVentilatorCurrently":null,"onVentilatorCumulative":null,"recovered":552311,"lastUpdateEt":"3/5/2021 00:00","dateModified":"2021-03-05T00:00:00Z","checkTimeEt":"03/04 19:00","death":7094,"hospitalized":26387,"hospitalizedDischarged":null,"dateChecked":"2021-03-05T00:00:00Z","totalTestsViral":null,"positiveTestsViral":null,"negativeTestsViral":null,"positiveCasesViral":566158,"deathConfirmed":6477,"deathProbable":617,"totalTestEncountersViral":7037081,"totalTestsPeopleViral":3208340,"totalTestsAntibody":null,"positiveTestsAntibody":null,"negativeTestsAntibody":null,"totalTestsPeopleAntibody":null,"positiveTestsPeopleAntibody":null,"negativeTestsPeopleAntibody":null,"totalTestsPeopleAntigen":null,"positiveTestsPeopleAntigen":null,"totalTestsAntigen":null,"positiveTestsAntigen":null,"fips":"55","positiveIncrease":721,"negativeIncrease":3034,"total":3262881,"totalTestResultsIncrease":28542,"posNeg":3262845,"dataQualityGrade":null,"deathIncrease":12,"hospitalizedIncrease":57,"hash":"95b2a8208a870ba9b97f9f6afe29999c147f011e","commercialScore":0,"negativeRegularScore":0,"negativeScore":0,"positiveScore":0,"score":0,"grade":""},{"date":20210304,"state":"WI","positive":619942,"probableCases":54134,"negative":2639148,"pending":19,"totalTestResultsSource":"totalTestEncountersViral","totalTestResults":7008539,"hospitalizedCurrently":262,"hospitalizedCumulative":26330,"inIcuCurrently":67,"inIcuCumulative":2266,"onVentilatorCurrently":null,"onVentilatorCumulative":null,"recovered":551885,"lastUpdateEt":"3/4/2021 00:00","dateModified":"2021-03-04T00:00:00Z","checkTimeEt":"03/03 19:00","death":7082,"hospitalized":26330,"hospitalizedDischarged":null,"dateChecked":"2021-03-04T00:00:00Z","totalTestsViral":null,"positiveTestsViral":null,"negativeTestsViral":null,"positiveCasesViral":565808,"deathConfirmed":6470,"deathProbable":612,"totalTestEncountersViral":7008539,"totalTestsPeopleViral":3204956,"totalTestsAntibody":null,"positiveTestsAntibody":null,"negativeTestsAntibody":null,"totalTestsPeopleAntibody":null,"positiveTestsPeopleAntibody":null,"negativeTestsPeopleAntibody":null,"totalTestsPeopleAntigen":null,"positiveTestsPeopleAntigen":null,"totalTestsAntigen":null,"positiveTestsAntigen":null,"fips":"55","positiveIncrease":855,"negativeIncrease":4149,"total":3259109,"totalTestResultsIncrease":37986,"posNeg":3259090,"dataQualityGrade":null,"deathIncrease":13,"hospitalizedIncrease":51,"hash":"113b3d81b402d0025b4eac17dbafb840c83b974c","commercialScore":0,"negativeRegularScore":0,"negativeScore":0,"positiveScore":0,"score":0,"grade":""},{"date":20210303,"state":"WI","positive":619087,"probableCases":53956,"negative":2634999,"pending":36,"totalTestResultsSource":"totalTestEncountersViral","totalTestResults":6970553,"hospitalizedCurrently":267,"hospitalizedCumulative":26279,"inIcuCurrently":69,"inIcuCumulative":2264,"onVentilatorCurrently":null,"onVentilatorCumulative":null,"recovered":551329,"lastUpdateEt":"3/3/2021 00:00","dateModified":"2021-03-03T00:00:00Z","checkTimeEt":"03/02 19:00","death":7069,"hospitalized":26279,"hospitalizedDischarged":null,"dateChecked":"2021-03-03T00:00:00Z","totalTestsViral":null,"positiveTestsViral":null,"negativeTestsViral":null,"positiveCasesViral":565131,"deathConfirmed":6458,"deathProbable":611,"totalTestEncountersViral":6970553,"totalTestsPeopleViral":3200130,"totalTestsAntibody":null,"positiveTestsAntibody":null,"negativeTestsAntibody":null,"totalTestsPeopleAntibody":null,"positiveTestsPeopleAntibody":null,"negativeTestsPeopleAntibody":null,"totalTestsPeopleAntigen":null,"positiveTestsPeopleAntigen":null,"totalTestsAntigen":null,"positiveTestsAntigen":null,"fips":"55","positiveIncrease":780,"negativeIncrease":3287,"total":3254122,"totalTestResultsIncrease":31959,"posNeg":3254086,"dataQualityGrade":null,"deathIncrease":19,"hospitalizedIncrease":57,"hash":"2d03e79d7cda7217e2fc625a15d4bfbedc6fd643","commercialScore":0,"negativeRegularScore":0,"negativeScore":0,"positiveScore":0,"score":0,"grade":""},{"date":20210302,"state":"WI","positive":618307,"probableCases":53715,"negative":2631712,"pending":23,"totalTestResultsSource":"totalTestEncountersViral","totalTestResults":6938594,"hospitalizedCurrently":275,"hospitalizedCumulative":26222,"inIcuCurrently":71,"inIcuCumulative":2259,"onVentilatorCurrently":null,"onVentilatorCumulative":null,"recovered":550730,"lastUpdateEt":"3/2/2021 00:00","dateModified":"2021-03-02T00:00:00Z","checkTimeEt":"03/01 19:00","death":7050,"hospitalized":26222,"hospitalizedDischarged":null,"dateChecked":"2021-03-02T00:00:00Z","totalTestsViral":null,"positiveTestsViral":null,"negativeTestsViral":null,"positiveCasesViral":564592,"deathConfirmed":6440,"deathProbable":610,"totalTestEncountersViral":6938594,"totalTestsPeopleViral":3196304,"totalTestsAntibody":null,"positiveTestsAntibody":null,"negativeTestsAntibody":null,"totalTestsPeopleAntibody":null,"positiveTestsPeopleAntibody":null,"negativeTestsPeopleAntibody":null,"totalTestsPeopleAntigen":null,"positiveTestsPeopleAntigen":null,"totalTestsAntigen":null,"positiveTestsAntigen":null,"fips":"55","positiveIncrease":607,"negativeIncrease":2090,"total":3250042,"totalTestResultsIncrease":16676,"posNeg":3250019,"dataQualityGrade":null,"deathIncrease":36,"hospitalizedIncrease":64,"hash":"5c59615798870d7ec4053049fc17c8bb50f6a53a","commercialScore":0,"negativeRegularScore":0,"negativeScore":0,"positiveScore":0,"score":0,"grade":""},{"date":20210301,"state":"WI","positive":617700,"probableCases":53432,"negative":2629622,"pending":44,"totalTestResultsSource":"totalTestEncountersViral","totalTestResults":6921918,"hospitalizedCurrently":287,"hospitalizedCumulative":26158,"inIcuCurrently":73,"inIcuCumulative":2256,"onVentilatorCurrently":null,"onVentilatorCumulative":null,"recovered":550280,"lastUpdateEt":"3/1/2021 00:00","dateModified":"2021-03-01T00:00:00Z","checkTimeEt":"02/28 19:00","death":7014,"hospitalized":26158,"hospitalizedDischarged":null,"dateChecked":"2021-03-01T00:00:00Z","totalTestsViral":null,"positiveTestsViral":null,"negativeTestsViral":null,"positiveCasesViral":564268,"deathConfirmed":6412,"deathProbable":602,"totalTestEncountersViral":6921918,"totalTestsPeopleViral":3193890,"totalTestsAntibody":null,"positiveTestsAntibody":null,"negativeTestsAntibody":null,"totalTestsPeopleAntibody":null,"positiveTestsPeopleAntibody":null,"negativeTestsPeopleAntibody":null,"totalTestsPeopleAntigen":null,"positiveTestsPeopleAntigen":null,"totalTestsAntigen":null,"positiveTestsAntigen":null,"fips":"55","positiveIncrease":333,"negativeIncrease":2826,"total":3247366,"totalTestResultsIncrease":15040,"posNeg":3247322,"dataQualityGrade":null,"deathIncrease":0,"hospitalizedIncrease":31,"hash":"e2ad624b18d84f607152974288e3e36fc0800233","commercialScore":0,"negativeRegularScore":0,"negativeScore":0,"positiveScore":0,"score":0,"grade":""},{"date":20210228,"state":"WI","positive":617367,"probableCases":53407,"negative":2626796,"pending":29,"totalTestResultsSource":"totalTestEncountersViral","totalTestResults":6906878,"hospitalizedCurrently":290,"hospitalizedCumulative":26127,"inIcuCurrently":73,"inIcuCumulative":2254,"onVentilatorCurrently":null,"onVentilatorCumulative":null,"recovered":549668,"lastUpdateEt":"2/28/2021 00:00","dateModified":"2021-02-28T00:00:00Z","checkTimeEt":"02/27 19:00","death":7014,"hospitalized":26127,"hospitalizedDischarged":null,"dateChecked":"2021-02-28T00:00:00Z","totalTestsViral":null,"positiveTestsViral":null,"negativeTestsViral":null,"positiveCasesViral":563960,"deathConfirmed":6412,"deathProbable":602,"totalTestEncountersViral":6906878,"totalTestsPeopleViral":3190756,"totalTestsAntibody":null,"positiveTestsAntibody":null,"negativeTestsAntibody":null,"totalTestsPeopleAntibody":null,"positiveTestsPeopleAntibody":null,"negativeTestsPeopleAntibody":null,"totalTestsPeopleAntigen":null,"positiveTestsPeopleAntigen":null,"totalTestsAntigen":null,"positiveTestsAntigen":null,"fips":"55","positiveIncrease":481,"negativeIncrease":3298,"total":3244192,"totalTestResultsIncrease":20046,"posNeg":3244163,"dataQualityGrade":null,"deathIncrease":0,"hospitalizedIncrease":39,"hash":"1ff58d5b598d4e058979630b9432c31e2f48ea9a","commercialScore":0,"negativeRegularScore":0,"negativeScore":0,"positiveScore":0,"score":0,"grade":""},{"date":20210227,"state":"WI","positive":616886,"probableCases":53390,"negative":2623498,"pending":53,"totalTestResultsSource":"totalTestEncountersViral","totalTestResults":6886832,"hospitalizedCurrently":304,"hospitalizedCumulative":26088,"inIcuCurrently":89,"inIcuCumulative":2254,"onVentilatorCurrently":null,"onVentilatorCumulative":null,"recovered":548884,"lastUpdateEt":"2/27/2021 00:00","dateModified":"2021-02-27T00:00:00Z","checkTimeEt":"02/26 19:00","death":7014,"hospitalized":26088,"hospitalizedDischarged":null,"dateChecked":"2021-02-27T00:00:00Z","totalTestsViral":null,"positiveTestsViral":null,"negativeTestsViral":null,"positiveCasesViral":563496,"deathConfirmed":6412,"deathProbable":602,"totalTestEncountersViral":6886832,"totalTestsPeopleViral":3186994,"totalTestsAntibody":null,"positiveTestsAntibody":null,"negativeTestsAntibody":null,"totalTestsPeopleAntibody":null,"positiveTestsPeopleAntibody":null,"negativeTestsPeopleAntibody":null,"totalTestsPeopleAntigen":null,"positiveTestsPeopleAntigen":null,"totalTestsAntigen":null,"positiveTestsAntigen":null,"fips":"55","positiveIncrease":868,"negativeIncrease":3201,"total":3240437,"totalTestResultsIncrease":26314,"posNeg":3240384,"dataQualityGrade":null,"deathIncrease":15,"hospitalizedIncrease":75,"hash":"0221da674d36eab094cbd554334d320178ba8f82","commercialScore":0,"negativeRegularScore":0,"negativeScore":0,"positiveScore":0,"score":0,"grade":""},{"date":20210226,"state":"WI","positive":616018,"probableCases":53211,"negative":2620297,"pending":53,"totalTestResultsSource":"totalTestEncountersViral","totalTestResults":6860518,"hospitalizedCurrently":304,"hospitalizedCumulative":26013,"inIcuCurrently":89,"inIcuCumulative":2252,"onVentilatorCurrently":null,"onVentilatorCumulative":null,"recovered":548040,"lastUpdateEt":"2/26/2021 00:00","dateModified":"2021-02-26T00:00:00Z","checkTimeEt":"02/25 19:00","death":6999,"hospitalized":26013,"hospitalizedDischarged":null,"dateChecked":"2021-02-26T00:00:00Z","totalTestsViral":null,"positiveTestsViral":null,"negativeTestsViral":null,"positiveCasesViral":562807,"deathConfirmed":6399,"deathProbable":600,"totalTestEncountersViral":6860518,"totalTestsPeopleViral":3183104,"totalTestsAntibody":null,"positiveTestsAntibody":null,"negativeTestsAntibody":null,"totalTestsPeopleAntibody":null,"positiveTestsPeopleAntibody":null,"negativeTestsPeopleAntibody":null,"totalTestsPeopleAntigen":null,"positiveTestsPeopleAntigen":null,"totalTestsAntigen":null,"positiveTestsAntigen":null,"fips":"55","positiveIncrease":793,"negativeIncrease":4842,"total":3236368,"totalTestResultsIncrease":35113,"posNeg":3236315,"dataQualityGrade":null,"deathIncrease":5,"hospitalizedIncrease":59,"hash":"34c9fbaea0237801daaa0f252a0f03c8086876ed","commercialScore":0,"negativeRegularScore":0,"negativeScore":0,"positiveScore":0,"score":0,"grade":""},{"date":20210225,"state":"WI","positive":615225,"probableCases":53074,"negative":2615455,"pending":28,"totalTestResultsSource":"totalTestEncountersViral","totalTestResults":6825405,"hospitalizedCurrently":355,"hospitalizedCumulative":25954,"inIcuCurrently":93,"inIcuCumulative":2251,"onVentilatorCurrently":null,"onVentilatorCumulative":null,"recovered":547168,"lastUpdateEt":"2/25/2021 00:00","dateModified":"2021-02-25T00:00:00Z","checkTimeEt":"02/24 19:00","death":6994,"hospitalized":25954,"hospitalizedDischarged":null,"dateChecked":"2021-02-25T00:00:00Z","totalTestsViral":null,"positiveTestsViral":null,"negativeTestsViral":null,"positiveCasesViral":562151,"deathConfirmed":6394,"deathProbable":600,"totalTestEncountersViral":6825405,"totalTestsPeopleViral":3177606,"totalTestsAntibody":null,"positiveTestsAntibody":null,"negativeTestsAntibody":null,"totalTestsPeopleAntibody":null,"positiveTestsPeopleAntibody":null,"negativeTestsPeopleAntibody":null,"totalTestsPeopleAntigen":null,"positiveTestsPeopleAntigen":null,"totalTestsAntigen":null,"positiveTestsAntigen":null,"fips":"55","positiveIncrease":965,"negativeIncrease":12337,"total":3230708,"totalTestResultsIncrease":88386,"posNeg":3230680,"dataQualityGrade":null,"deathIncrease":58,"hospitalizedIncrease":61,"hash":"234b2e2487dd9cafcc734df812415e3b22176745","commercialScore":0,"negativeRegularScore":0,"negativeScore":0,"positiveScore":0,"score":0,"grade":""},{"date":20210224,"state":"WI","positive":614260,"probableCases":52949,"negative":2603118,"pending":45,"totalTestResultsSource":"totalTestEncountersViral","totalTestResults":6737019,"hospitalizedCurrently":347,"hospitalizedCumulative":25893,"inIcuCurrently":92,"inIcuCumulative":2250,"onVentilatorCurrently":null,"onVentilatorCumulative":null,"recovered":546408,"lastUpdateEt":"2/24/2021 00:00","dateModified":"2021-02-24T00:00:00Z","checkTimeEt":"02/23 19:00","death":6936,"hospitalized":25893,"hospitalizedDischarged":null,"dateChecked":"2021-02-24T00:00:00Z","totalTestsViral":null,"positiveTestsViral":null,"negativeTestsViral":null,"positiveCasesViral":561311,"deathConfirmed":6342,"deathProbable":594,"totalTestEncountersViral":6737019,"totalTestsPeopleViral":3164429,"totalTestsAntibody":null,"positiveTestsAntibody":null,"negativeTestsAntibody":null,"totalTestsPeopleAntibody":null,"positiveTestsPeopleAntibody":null,"negativeTestsPeopleAntibody":null,"totalTestsPeopleAntigen":null,"positiveTestsPeopleAntigen":null,"totalTestsAntigen":null,"positiveTestsAntigen":null,"fips":"55","positiveIncrease":841,"negativeIncrease":4517,"total":3217423,"totalTestResultsIncrease":27260,"posNeg":3217378,"dataQualityGrade":null,"deathIncrease":26,"hospitalizedIncrease":55,"hash":"2abe83f3c24f7d99e1aa82590530f7c0044108df","commercialScore":0,"negativeRegularScore":0,"negativeScore":0,"positiveScore":0,"score":0,"grade":""},{"date":20210223,"state":"WI","positive":613419,"probableCases":52855,"negative":2598601,"pending":45,"totalTestResultsSource":"totalTestEncountersViral","totalTestResults":6709759,"hospitalizedCurrently":347,"hospitalizedCumulative":25838,"inIcuCurrently":92,"inIcuCumulative":2249,"onVentilatorCurrently":null,"onVentilatorCumulative":null,"recovered":545562,"lastUpdateEt":"2/23/2021 00:00","dateModified":"2021-02-23T00:00:00Z","checkTimeEt":"02/22 19:00","death":6910,"hospitalized":25838,"hospitalizedDischarged":null,"dateChecked":"2021-02-23T00:00:00Z","totalTestsViral":null,"positiveTestsViral":null,"negativeTestsViral":null,"positiveCasesViral":560564,"deathConfirmed":6317,"deathProbable":593,"totalTestEncountersViral":6709759,"totalTestsPeopleViral":3159165,"totalTestsAntibody":null,"positiveTestsAntibody":null,"negativeTestsAntibody":null,"totalTestsPeopleAntibody":null,"positiveTestsPeopleAntibody":null,"negativeTestsPeopleAntibody":null,"totalTestsPeopleAntigen":null,"positiveTestsPeopleAntigen":null,"totalTestsAntigen":null,"positiveTestsAntigen":null,"fips":"55","positiveIncrease":707,"negativeIncrease":2987,"total":3212065,"totalTestResultsIncrease":16989,"posNeg":3212020,"dataQualityGrade":null,"deathIncrease":39,"hospitalizedIncrease":63,"hash":"3ef58229e4c5a8d4ac52c87b3f77e77c0e0417b5","commercialScore":0,"negativeRegularScore":0,"negativeScore":0,"positiveScore":0,"score":0,"grade":""},{"date":20210222,"state":"WI","positive":612712,"probableCases":52714,"negative":2595614,"pending":46,"totalTestResultsSource":"totalTestEncountersViral","totalTestResults":6692770,"hospitalizedCurrently":348,"hospitalizedCumulative":25775,"inIcuCurrently":95,"inIcuCumulative":2247,"onVentilatorCurrently":null,"onVentilatorCumulative":null,"recovered":544926,"lastUpdateEt":"2/22/2021 00:00","dateModified":"2021-02-22T00:00:00Z","checkTimeEt":"02/21 19:00","death":6871,"hospitalized":25775,"hospitalizedDischarged":null,"dateChecked":"2021-02-22T00:00:00Z","totalTestsViral":null,"positiveTestsViral":null,"negativeTestsViral":null,"positiveCasesViral":559998,"deathConfirmed":6284,"deathProbable":587,"totalTestEncountersViral":6692770,"totalTestsPeopleViral":3155612,"totalTestsAntibody":null,"positiveTestsAntibody":null,"negativeTestsAntibody":null,"totalTestsPeopleAntibody":null,"positiveTestsPeopleAntibody":null,"negativeTestsPeopleAntibody":null,"totalTestsPeopleAntigen":null,"positiveTestsPeopleAntigen":null,"totalTestsAntigen":null,"positiveTestsAntigen":null,"fips":"55","positiveIncrease":472,"negativeIncrease":3251,"total":3208372,"totalTestResultsIncrease":15157,"posNeg":3208326,"dataQualityGrade":null,"deathIncrease":0,"hospitalizedIncrease":32,"hash":"82481aef601b828cb36c63e68c8aebdba9de07c1","commercialScore":0,"negativeRegularScore":0,"negativeScore":0,"positiveScore":0,"score":0,"grade":""},{"date":20210221,"state":"WI","positive":612240,"probableCases":52665,"negative":2592363,"pending":31,"totalTestResultsSource":"totalTestEncountersViral","totalTestResults":6677613,"hospitalizedCurrently":353,"hospitalizedCumulative":25743,"inIcuCurrently":83,"inIcuCumulative":2242,"onVentilatorCurrently":null,"onVentilatorCumulative":null,"recovered":544250,"lastUpdateEt":"2/21/2021 00:00","dateModified":"2021-02-21T00:00:00Z","checkTimeEt":"02/20 19:00","death":6871,"hospitalized":25743,"hospitalizedDischarged":null,"dateChecked":"2021-02-21T00:00:00Z","totalTestsViral":null,"positiveTestsViral":null,"negativeTestsViral":null,"positiveCasesViral":559575,"deathConfirmed":6284,"deathProbable":587,"totalTestEncountersViral":6677613,"totalTestsPeopleViral":3151938,"totalTestsAntibody":null,"positiveTestsAntibody":null,"negativeTestsAntibody":null,"totalTestsPeopleAntibody":null,"positiveTestsPeopleAntibody":null,"negativeTestsPeopleAntibody":null,"totalTestsPeopleAntigen":null,"positiveTestsPeopleAntigen":null,"totalTestsAntigen":null,"positiveTestsAntigen":null,"fips":"55","positiveIncrease":451,"negativeIncrease":3862,"total":3204634,"totalTestResultsIncrease":24235,"posNeg":3204603,"dataQualityGrade":null,"deathIncrease":0,"hospitalizedIncrease":27,"hash":"c20114a9d48ec91a8bdb7069e32c4490a22849c5","commercialScore":0,"negativeRegularScore":0,"negativeScore":0,"positiveScore":0,"score":0,"grade":""},{"date":20210220,"state":"WI","positive":611789,"probableCases":52617,"negative":2588501,"pending":41,"totalTestResultsSource":"totalTestEncountersViral","totalTestResults":6653378,"hospitalizedCurrently":370,"hospitalizedCumulative":25716,"inIcuCurrently":96,"inIcuCumulative":2240,"onVentilatorCurrently":null,"onVentilatorCumulative":null,"recovered":543411,"lastUpdateEt":"2/20/2021 00:00","dateModified":"2021-02-20T00:00:00Z","checkTimeEt":"02/19 19:00","death":6871,"hospitalized":25716,"hospitalizedDischarged":null,"dateChecked":"2021-02-20T00:00:00Z","totalTestsViral":null,"positiveTestsViral":null,"negativeTestsViral":null,"positiveCasesViral":559172,"deathConfirmed":6284,"deathProbable":587,"totalTestEncountersViral":6653378,"totalTestsPeopleViral":3147673,"totalTestsAntibody":null,"positiveTestsAntibody":null,"negativeTestsAntibody":null,"totalTestsPeopleAntibody":null,"positiveTestsPeopleAntibody":null,"negativeTestsPeopleAntibody":null,"totalTestsPeopleAntigen":null,"positiveTestsPeopleAntigen":null,"totalTestsAntigen":null,"positiveTestsAntigen":null,"fips":"55","positiveIncrease":815,"negativeIncrease":4126,"total":3200331,"totalTestResultsIncrease":25296,"posNeg":3200290,"dataQualityGrade":null,"deathIncrease":19,"hospitalizedIncrease":81,"hash":"2cacc3266a3016da60b8bcb7709e243084026060","commercialScore":0,"negativeRegularScore":0,"negativeScore":0,"positiveScore":0,"score":0,"grade":""},{"date":20210219,"state":"WI","positive":610974,"probableCases":52478,"negative":2584375,"pending":41,"totalTestResultsSource":"totalTestEncountersViral","totalTestResults":6628082,"hospitalizedCurrently":370,"hospitalizedCumulative":25635,"inIcuCurrently":96,"inIcuCumulative":2239,"onVentilatorCurrently":null,"onVentilatorCumulative":null,"recovered":542495,"lastUpdateEt":"2/19/2021 00:00","dateModified":"2021-02-19T00:00:00Z","checkTimeEt":"02/18 19:00","death":6852,"hospitalized":25635,"hospitalizedDischarged":null,"dateChecked":"2021-02-19T00:00:00Z","totalTestsViral":null,"positiveTestsViral":null,"negativeTestsViral":null,"positiveCasesViral":558496,"deathConfirmed":6267,"deathProbable":585,"totalTestEncountersViral":6628082,"totalTestsPeopleViral":3142871,"totalTestsAntibody":null,"positiveTestsAntibody":null,"negativeTestsAntibody":null,"totalTestsPeopleAntibody":null,"positiveTestsPeopleAntibody":null,"negativeTestsPeopleAntibody":null,"totalTestsPeopleAntigen":null,"positiveTestsPeopleAntigen":null,"totalTestsAntigen":null,"positiveTestsAntigen":null,"fips":"55","positiveIncrease":919,"negativeIncrease":4535,"total":3195390,"totalTestResultsIncrease":28691,"posNeg":3195349,"dataQualityGrade":null,"deathIncrease":36,"hospitalizedIncrease":79,"hash":"26e1afd13ad3966b80402db97133dd5e3081069a","commercialScore":0,"negativeRegularScore":0,"negativeScore":0,"positiveScore":0,"score":0,"grade":""},{"date":20210218,"state":"WI","positive":610055,"probableCases":52333,"negative":2579840,"pending":35,"totalTestResultsSource":"totalTestEncountersViral","totalTestResults":6599391,"hospitalizedCurrently":391,"hospitalizedCumulative":25556,"inIcuCurrently":107,"inIcuCumulative":2239,"onVentilatorCurrently":null,"onVentilatorCumulative":null,"recovered":541515,"lastUpdateEt":"2/18/2021 00:00","dateModified":"2021-02-18T00:00:00Z","checkTimeEt":"02/17 19:00","death":6816,"hospitalized":25556,"hospitalizedDischarged":null,"dateChecked":"2021-02-18T00:00:00Z","totalTestsViral":null,"positiveTestsViral":null,"negativeTestsViral":null,"positiveCasesViral":557722,"deathConfirmed":6232,"deathProbable":584,"totalTestEncountersViral":6599391,"totalTestsPeopleViral":3137562,"totalTestsAntibody":null,"positiveTestsAntibody":null,"negativeTestsAntibody":null,"totalTestsPeopleAntibody":null,"positiveTestsPeopleAntibody":null,"negativeTestsPeopleAntibody":null,"totalTestsPeopleAntigen":null,"positiveTestsPeopleAntigen":null,"totalTestsAntigen":null,"positiveTestsAntigen":null,"fips":"55","positiveIncrease":866,"negativeIncrease":4814,"total":3189930,"totalTestResultsIncrease":36012,"posNeg":3189895,"dataQualityGrade":null,"deathIncrease":18,"hospitalizedIncrease":58,"hash":"b5e5645d4099c7ff3a77f43176090578c6174455","commercialScore":0,"negativeRegularScore":0,"negativeScore":0,"positiveScore":0,"score":0,"grade":""},{"date":20210217,"state":"WI","positive":609189,"probableCases":52200,"negative":2575026,"pending":36,"totalTestResultsSource":"totalTestEncountersViral","totalTestResults":6563379,"hospitalizedCurrently":385,"hospitalizedCumulative":25498,"inIcuCurrently":107,"inIcuCumulative":2236,"onVentilatorCurrently":null,"onVentilatorCumulative":null,"recovered":540524,"lastUpdateEt":"2/17/2021 00:00","dateModified":"2021-02-17T00:00:00Z","checkTimeEt":"02/16 19:00","death":6798,"hospitalized":25498,"hospitalizedDischarged":null,"dateChecked":"2021-02-17T00:00:00Z","totalTestsViral":null,"positiveTestsViral":null,"negativeTestsViral":null,"positiveCasesViral":556989,"deathConfirmed":6214,"deathProbable":584,"totalTestEncountersViral":6563379,"totalTestsPeopleViral":3132015,"totalTestsAntibody":null,"positiveTestsAntibody":null,"negativeTestsAntibody":null,"totalTestsPeopleAntibody":null,"positiveTestsPeopleAntibody":null,"negativeTestsPeopleAntibody":null,"totalTestsPeopleAntigen":null,"positiveTestsPeopleAntigen":null,"totalTestsAntigen":null,"positiveTestsAntigen":null,"fips":"55","positiveIncrease":771,"negativeIncrease":4228,"total":3184251,"totalTestResultsIncrease":31540,"posNeg":3184215,"dataQualityGrade":null,"deathIncrease":10,"hospitalizedIncrease":76,"hash":"f86b96b5bcfced93031c8fad122553ffbc779fd6","commercialScore":0,"negativeRegularScore":0,"negativeScore":0,"positiveScore":0,"score":0,"grade":""},{"date":20210216,"state":"WI","positive":608418,"probableCases":52086,"negative":2570798,"pending":43,"totalTestResultsSource":"totalTestEncountersViral","totalTestResults":6531839,"hospitalizedCurrently":411,"hospitalizedCumulative":25422,"inIcuCurrently":117,"inIcuCumulative":2231,"onVentilatorCurrently":null,"onVentilatorCumulative":null,"recovered":539657,"lastUpdateEt":"2/16/2021 00:00","dateModified":"2021-02-16T00:00:00Z","checkTimeEt":"02/15 19:00","death":6788,"hospitalized":25422,"hospitalizedDischarged":null,"dateChecked":"2021-02-16T00:00:00Z","totalTestsViral":null,"positiveTestsViral":null,"negativeTestsViral":null,"positiveCasesViral":556332,"deathConfirmed":6204,"deathProbable":584,"totalTestEncountersViral":6531839,"totalTestsPeopleViral":3127130,"totalTestsAntibody":null,"positiveTestsAntibody":null,"negativeTestsAntibody":null,"totalTestsPeopleAntibody":null,"positiveTestsPeopleAntibody":null,"negativeTestsPeopleAntibody":null,"totalTestsPeopleAntigen":null,"positiveTestsPeopleAntigen":null,"totalTestsAntigen":null,"positiveTestsAntigen":null,"fips":"55","positiveIncrease":779,"negativeIncrease":2594,"total":3179259,"totalTestResultsIncrease":16160,"posNeg":3179216,"dataQualityGrade":null,"deathIncrease":39,"hospitalizedIncrease":82,"hash":"da86d469b2ce4801847fa1b48c354da82ea7cbdb","commercialScore":0,"negativeRegularScore":0,"negativeScore":0,"positiveScore":0,"score":0,"grade":""},{"date":20210215,"state":"WI","positive":607639,"probableCases":51931,"negative":2568204,"pending":31,"totalTestResultsSource":"totalTestEncountersViral","totalTestResults":6515679,"hospitalizedCurrently":413,"hospitalizedCumulative":25340,"inIcuCurrently":118,"inIcuCumulative":2226,"onVentilatorCurrently":null,"onVentilatorCumulative":null,"recovered":538767,"lastUpdateEt":"2/15/2021 00:00","dateModified":"2021-02-15T00:00:00Z","checkTimeEt":"02/14 19:00","death":6749,"hospitalized":25340,"hospitalizedDischarged":null,"dateChecked":"2021-02-15T00:00:00Z","totalTestsViral":null,"positiveTestsViral":null,"negativeTestsViral":null,"positiveCasesViral":555708,"deathConfirmed":6166,"deathProbable":583,"totalTestEncountersViral":6515679,"totalTestsPeopleViral":3123912,"totalTestsAntibody":null,"positiveTestsAntibody":null,"negativeTestsAntibody":null,"totalTestsPeopleAntibody":null,"positiveTestsPeopleAntibody":null,"negativeTestsPeopleAntibody":null,"totalTestsPeopleAntigen":null,"positiveTestsPeopleAntigen":null,"totalTestsAntigen":null,"positiveTestsAntigen":null,"fips":"55","positiveIncrease":426,"negativeIncrease":3681,"total":3175874,"totalTestResultsIncrease":15430,"posNeg":3175843,"dataQualityGrade":null,"deathIncrease":4,"hospitalizedIncrease":38,"hash":"2524c7f80a0c1572794c12c010370caf740781be","commercialScore":0,"negativeRegularScore":0,"negativeScore":0,"positiveScore":0,"score":0,"grade":""},{"date":20210214,"state":"WI","positive":607213,"probableCases":51910,"negative":2564523,"pending":17,"totalTestResultsSource":"totalTestEncountersViral","totalTestResults":6500249,"hospitalizedCurrently":402,"hospitalizedCumulative":25302,"inIcuCurrently":116,"inIcuCumulative":2220,"onVentilatorCurrently":null,"onVentilatorCumulative":null,"recovered":537955,"lastUpdateEt":"2/14/2021 00:00","dateModified":"2021-02-14T00:00:00Z","checkTimeEt":"02/13 19:00","death":6745,"hospitalized":25302,"hospitalizedDischarged":null,"dateChecked":"2021-02-14T00:00:00Z","totalTestsViral":null,"positiveTestsViral":null,"negativeTestsViral":null,"positiveCasesViral":555303,"deathConfirmed":6162,"deathProbable":583,"totalTestEncountersViral":6500249,"totalTestsPeopleViral":3119826,"totalTestsAntibody":null,"positiveTestsAntibody":null,"negativeTestsAntibody":null,"totalTestsPeopleAntibody":null,"positiveTestsPeopleAntibody":null,"negativeTestsPeopleAntibody":null,"totalTestsPeopleAntigen":null,"positiveTestsPeopleAntigen":null,"totalTestsAntigen":null,"positiveTestsAntigen":null,"fips":"55","positiveIncrease":562,"negativeIncrease":3683,"total":3171753,"totalTestResultsIncrease":20460,"posNeg":3171736,"dataQualityGrade":null,"deathIncrease":1,"hospitalizedIncrease":34,"hash":"7d1e614006c9d527902f62dd3f516905309f0f05","commercialScore":0,"negativeRegularScore":0,"negativeScore":0,"positiveScore":0,"score":0,"grade":""},{"date":20210213,"state":"WI","positive":606651,"probableCases":51851,"negative":2560840,"pending":43,"totalTestResultsSource":"totalTestEncountersViral","totalTestResults":6479789,"hospitalizedCurrently":461,"hospitalizedCumulative":25268,"inIcuCurrently":120,"inIcuCumulative":2219,"onVentilatorCurrently":null,"onVentilatorCumulative":null,"recovered":536864,"lastUpdateEt":"2/13/2021 00:00","dateModified":"2021-02-13T00:00:00Z","checkTimeEt":"02/12 19:00","death":6744,"hospitalized":25268,"hospitalizedDischarged":null,"dateChecked":"2021-02-13T00:00:00Z","totalTestsViral":null,"positiveTestsViral":null,"negativeTestsViral":null,"positiveCasesViral":554800,"deathConfirmed":6161,"deathProbable":583,"totalTestEncountersViral":6479789,"totalTestsPeopleViral":3115640,"totalTestsAntibody":null,"positiveTestsAntibody":null,"negativeTestsAntibody":null,"totalTestsPeopleAntibody":null,"positiveTestsPeopleAntibody":null,"negativeTestsPeopleAntibody":null,"totalTestsPeopleAntigen":null,"positiveTestsPeopleAntigen":null,"totalTestsAntigen":null,"positiveTestsAntigen":null,"fips":"55","positiveIncrease":866,"negativeIncrease":3752,"total":3167534,"totalTestResultsIncrease":25645,"posNeg":3167491,"dataQualityGrade":null,"deathIncrease":10,"hospitalizedIncrease":71,"hash":"f04f4602e7aaa40e2f99eb059cae32247902f23a","commercialScore":0,"negativeRegularScore":0,"negativeScore":0,"positiveScore":0,"score":0,"grade":""},{"date":20210212,"state":"WI","positive":605785,"probableCases":51737,"negative":2557088,"pending":43,"totalTestResultsSource":"totalTestEncountersViral","totalTestResults":6454144,"hospitalizedCurrently":461,"hospitalizedCumulative":25197,"inIcuCurrently":120,"inIcuCumulative":2218,"onVentilatorCurrently":null,"onVentilatorCumulative":null,"recovered":535627,"lastUpdateEt":"2/12/2021 00:00","dateModified":"2021-02-12T00:00:00Z","checkTimeEt":"02/11 19:00","death":6734,"hospitalized":25197,"hospitalizedDischarged":null,"dateChecked":"2021-02-12T00:00:00Z","totalTestsViral":null,"positiveTestsViral":null,"negativeTestsViral":null,"positiveCasesViral":554048,"deathConfirmed":6151,"deathProbable":583,"totalTestEncountersViral":6454144,"totalTestsPeopleViral":3111136,"totalTestsAntibody":null,"positiveTestsAntibody":null,"negativeTestsAntibody":null,"totalTestsPeopleAntibody":null,"positiveTestsPeopleAntibody":null,"negativeTestsPeopleAntibody":null,"totalTestsPeopleAntigen":null,"positiveTestsPeopleAntigen":null,"totalTestsAntigen":null,"positiveTestsAntigen":null,"fips":"55","positiveIncrease":1102,"negativeIncrease":4607,"total":3162916,"totalTestResultsIncrease":29891,"posNeg":3162873,"dataQualityGrade":null,"deathIncrease":11,"hospitalizedIncrease":55,"hash":"21a1137f39048b7ae7615d8063883160365b797e","commercialScore":0,"negativeRegularScore":0,"negativeScore":0,"positiveScore":0,"score":0,"grade":""},{"date":20210211,"state":"WI","positive":604683,"probableCases":51573,"negative":2552481,"pending":48,"totalTestResultsSource":"totalTestEncountersViral","totalTestResults":6424253,"hospitalizedCurrently":489,"hospitalizedCumulative":25142,"inIcuCurrently":127,"inIcuCumulative":2217,"onVentilatorCurrently":null,"onVentilatorCumulative":null,"recovered":534164,"lastUpdateEt":"2/11/2021 00:00","dateModified":"2021-02-11T00:00:00Z","checkTimeEt":"02/10 19:00","death":6723,"hospitalized":25142,"hospitalizedDischarged":null,"dateChecked":"2021-02-11T00:00:00Z","totalTestsViral":null,"positiveTestsViral":null,"negativeTestsViral":null,"positiveCasesViral":553110,"deathConfirmed":6140,"deathProbable":583,"totalTestEncountersViral":6424253,"totalTestsPeopleViral":3105591,"totalTestsAntibody":null,"positiveTestsAntibody":null,"negativeTestsAntibody":null,"totalTestsPeopleAntibody":null,"positiveTestsPeopleAntibody":null,"negativeTestsPeopleAntibody":null,"totalTestsPeopleAntigen":null,"positiveTestsPeopleAntigen":null,"totalTestsAntigen":null,"positiveTestsAntigen":null,"fips":"55","positiveIncrease":1428,"negativeIncrease":5905,"total":3157212,"totalTestResultsIncrease":39684,"posNeg":3157164,"dataQualityGrade":null,"deathIncrease":18,"hospitalizedIncrease":52,"hash":"af25b076acb8a88af3fbc42c20e12d218bdf681b","commercialScore":0,"negativeRegularScore":0,"negativeScore":0,"positiveScore":0,"score":0,"grade":""},{"date":20210210,"state":"WI","positive":603255,"probableCases":51384,"negative":2546576,"pending":48,"totalTestResultsSource":"totalTestEncountersViral","totalTestResults":6384569,"hospitalizedCurrently":489,"hospitalizedCumulative":25090,"inIcuCurrently":127,"inIcuCumulative":2214,"onVentilatorCurrently":null,"onVentilatorCumulative":null,"recovered":532793,"lastUpdateEt":"2/10/2021 00:00","dateModified":"2021-02-10T00:00:00Z","checkTimeEt":"02/09 19:00","death":6705,"hospitalized":25090,"hospitalizedDischarged":null,"dateChecked":"2021-02-10T00:00:00Z","totalTestsViral":null,"positiveTestsViral":null,"negativeTestsViral":null,"positiveCasesViral":551871,"deathConfirmed":6129,"deathProbable":576,"totalTestEncountersViral":6384569,"totalTestsPeopleViral":3098447,"totalTestsAntibody":null,"positiveTestsAntibody":null,"negativeTestsAntibody":null,"totalTestsPeopleAntibody":null,"positiveTestsPeopleAntibody":null,"negativeTestsPeopleAntibody":null,"totalTestsPeopleAntigen":null,"positiveTestsPeopleAntigen":null,"totalTestsAntigen":null,"positiveTestsAntigen":null,"fips":"55","positiveIncrease":999,"negativeIncrease":4992,"total":3149879,"totalTestResultsIncrease":32691,"posNeg":3149831,"dataQualityGrade":null,"deathIncrease":42,"hospitalizedIncrease":69,"hash":"a2e6b70aa4ad18fbb792510418b5462b6130687f","commercialScore":0,"negativeRegularScore":0,"negativeScore":0,"positiveScore":0,"score":0,"grade":""},{"date":20210209,"state":"WI","positive":602256,"probableCases":51206,"negative":2541584,"pending":37,"totalTestResultsSource":"totalTestEncountersViral","totalTestResults":6351878,"hospitalizedCurrently":525,"hospitalizedCumulative":25021,"inIcuCurrently":133,"inIcuCumulative":2208,"onVentilatorCurrently":null,"onVentilatorCumulative":null,"recovered":531343,"lastUpdateEt":"2/9/2021 00:00","dateModified":"2021-02-09T00:00:00Z","checkTimeEt":"02/08 19:00","death":6663,"hospitalized":25021,"hospitalizedDischarged":null,"dateChecked":"2021-02-09T00:00:00Z","totalTestsViral":null,"positiveTestsViral":null,"negativeTestsViral":null,"positiveCasesViral":551050,"deathConfirmed":6094,"deathProbable":569,"totalTestEncountersViral":6351878,"totalTestsPeopleViral":3092634,"totalTestsAntibody":null,"positiveTestsAntibody":null,"negativeTestsAntibody":null,"totalTestsPeopleAntibody":null,"positiveTestsPeopleAntibody":null,"negativeTestsPeopleAntibody":null,"totalTestsPeopleAntigen":null,"positiveTestsPeopleAntigen":null,"totalTestsAntigen":null,"positiveTestsAntigen":null,"fips":"55","positiveIncrease":865,"negativeIncrease":3487,"total":3143877,"totalTestResultsIncrease":16626,"posNeg":3143840,"dataQualityGrade":null,"deathIncrease":49,"hospitalizedIncrease":102,"hash":"9277a6cfa5d45aeac2a93ea3a7d72d86d8678188","commercialScore":0,"negativeRegularScore":0,"negativeScore":0,"positiveScore":0,"score":0,"grade":""},{"date":20210208,"state":"WI","positive":601391,"probableCases":51022,"negative":2538097,"pending":35,"totalTestResultsSource":"totalTestEncountersViral","totalTestResults":6335252,"hospitalizedCurrently":572,"hospitalizedCumulative":24919,"inIcuCurrently":134,"inIcuCumulative":2202,"onVentilatorCurrently":null,"onVentilatorCumulative":null,"recovered":530216,"lastUpdateEt":"2/8/2021 00:00","dateModified":"2021-02-08T00:00:00Z","checkTimeEt":"02/07 19:00","death":6614,"hospitalized":24919,"hospitalizedDischarged":null,"dateChecked":"2021-02-08T00:00:00Z","totalTestsViral":null,"positiveTestsViral":null,"negativeTestsViral":null,"positiveCasesViral":550369,"deathConfirmed":6055,"deathProbable":559,"totalTestEncountersViral":6335252,"totalTestsPeopleViral":3088466,"totalTestsAntibody":null,"positiveTestsAntibody":null,"negativeTestsAntibody":null,"totalTestsPeopleAntibody":null,"positiveTestsPeopleAntibody":null,"negativeTestsPeopleAntibody":null,"totalTestsPeopleAntigen":null,"positiveTestsPeopleAntigen":null,"totalTestsAntigen":null,"positiveTestsAntigen":null,"fips":"55","positiveIncrease":609,"negativeIncrease":3175,"total":3139523,"totalTestResultsIncrease":-13449,"posNeg":3139488,"dataQualityGrade":null,"deathIncrease":1,"hospitalizedIncrease":34,"hash":"b8326bc6ab0f845cff6d1424e608af7e766e5409","commercialScore":0,"negativeRegularScore":0,"negativeScore":0,"positiveScore":0,"score":0,"grade":""},{"date":20210207,"state":"WI","positive":600782,"probableCases":50956,"negative":2534922,"pending":11,"totalTestResultsSource":"totalTestEncountersViral","totalTestResults":6348701,"hospitalizedCurrently":570,"hospitalizedCumulative":24885,"inIcuCurrently":144,"inIcuCumulative":2201,"onVentilatorCurrently":null,"onVentilatorCumulative":null,"recovered":529120,"lastUpdateEt":"2/7/2021 00:00","dateModified":"2021-02-07T00:00:00Z","checkTimeEt":"02/06 19:00","death":6613,"hospitalized":24885,"hospitalizedDischarged":null,"dateChecked":"2021-02-07T00:00:00Z","totalTestsViral":null,"positiveTestsViral":null,"negativeTestsViral":null,"positiveCasesViral":549826,"deathConfirmed":6054,"deathProbable":559,"totalTestEncountersViral":6348701,"totalTestsPeopleViral":3084748,"totalTestsAntibody":null,"positiveTestsAntibody":null,"negativeTestsAntibody":null,"totalTestsPeopleAntibody":null,"positiveTestsPeopleAntibody":null,"negativeTestsPeopleAntibody":null,"totalTestsPeopleAntigen":null,"positiveTestsPeopleAntigen":null,"totalTestsAntigen":null,"positiveTestsAntigen":null,"fips":"55","positiveIncrease":766,"negativeIncrease":3856,"total":3135715,"totalTestResultsIncrease":14437,"posNeg":3135704,"dataQualityGrade":null,"deathIncrease":2,"hospitalizedIncrease":61,"hash":"0563b77a7685df09cd5f0a71153217d6d0fefd5f","commercialScore":0,"negativeRegularScore":0,"negativeScore":0,"positiveScore":0,"score":0,"grade":""},{"date":20210206,"state":"WI","positive":600016,"probableCases":50861,"negative":2531066,"pending":35,"totalTestResultsSource":"totalTestEncountersViral","totalTestResults":6334264,"hospitalizedCurrently":593,"hospitalizedCumulative":24824,"inIcuCurrently":164,"inIcuCumulative":2194,"onVentilatorCurrently":null,"onVentilatorCumulative":null,"recovered":527575,"lastUpdateEt":"2/6/2021 00:00","dateModified":"2021-02-06T00:00:00Z","checkTimeEt":"02/05 19:00","death":6611,"hospitalized":24824,"hospitalizedDischarged":null,"dateChecked":"2021-02-06T00:00:00Z","totalTestsViral":null,"positiveTestsViral":null,"negativeTestsViral":null,"positiveCasesViral":549155,"deathConfirmed":6052,"deathProbable":559,"totalTestEncountersViral":6334264,"totalTestsPeopleViral":3080221,"totalTestsAntibody":null,"positiveTestsAntibody":null,"negativeTestsAntibody":null,"totalTestsPeopleAntibody":null,"positiveTestsPeopleAntibody":null,"negativeTestsPeopleAntibody":null,"totalTestsPeopleAntigen":null,"positiveTestsPeopleAntigen":null,"totalTestsAntigen":null,"positiveTestsAntigen":null,"fips":"55","positiveIncrease":1114,"negativeIncrease":3504,"total":3131117,"totalTestResultsIncrease":29609,"posNeg":3131082,"dataQualityGrade":null,"deathIncrease":36,"hospitalizedIncrease":90,"hash":"95597e1ba48f9b9bdea4162785ce3de691ef1f97","commercialScore":0,"negativeRegularScore":0,"negativeScore":0,"positiveScore":0,"score":0,"grade":""},{"date":20210205,"state":"WI","positive":598902,"probableCases":50681,"negative":2527562,"pending":49,"totalTestResultsSource":"totalTestEncountersViral","totalTestResults":6304655,"hospitalizedCurrently":594,"hospitalizedCumulative":24734,"inIcuCurrently":160,"inIcuCumulative":2192,"onVentilatorCurrently":null,"onVentilatorCumulative":null,"recovered":526004,"lastUpdateEt":"2/5/2021 00:00","dateModified":"2021-02-05T00:00:00Z","checkTimeEt":"02/04 19:00","death":6575,"hospitalized":24734,"hospitalizedDischarged":null,"dateChecked":"2021-02-05T00:00:00Z","totalTestsViral":null,"positiveTestsViral":null,"negativeTestsViral":null,"positiveCasesViral":548221,"deathConfirmed":6020,"deathProbable":555,"totalTestEncountersViral":6304655,"totalTestsPeopleViral":3075783,"totalTestsAntibody":null,"positiveTestsAntibody":null,"negativeTestsAntibody":null,"totalTestsPeopleAntibody":null,"positiveTestsPeopleAntibody":null,"negativeTestsPeopleAntibody":null,"totalTestsPeopleAntigen":null,"positiveTestsPeopleAntigen":null,"totalTestsAntigen":null,"positiveTestsAntigen":null,"fips":"55","positiveIncrease":1427,"negativeIncrease":4460,"total":3126513,"totalTestResultsIncrease":25984,"posNeg":3126464,"dataQualityGrade":null,"deathIncrease":30,"hospitalizedIncrease":100,"hash":"261106af2153ae433292453891644ce5a7435ee1","commercialScore":0,"negativeRegularScore":0,"negativeScore":0,"positiveScore":0,"score":0,"grade":""},{"date":20210204,"state":"WI","positive":597475,"probableCases":50520,"negative":2523102,"pending":44,"totalTestResultsSource":"totalTestEncountersViral","totalTestResults":6278671,"hospitalizedCurrently":639,"hospitalizedCumulative":24634,"inIcuCurrently":173,"inIcuCumulative":2186,"onVentilatorCurrently":null,"onVentilatorCumulative":null,"recovered":524120,"lastUpdateEt":"2/4/2021 00:00","dateModified":"2021-02-04T00:00:00Z","checkTimeEt":"02/03 19:00","death":6545,"hospitalized":24634,"hospitalizedDischarged":null,"dateChecked":"2021-02-04T00:00:00Z","totalTestsViral":null,"positiveTestsViral":null,"negativeTestsViral":null,"positiveCasesViral":546955,"deathConfirmed":5992,"deathProbable":553,"totalTestEncountersViral":6278671,"totalTestsPeopleViral":3070057,"totalTestsAntibody":null,"positiveTestsAntibody":null,"negativeTestsAntibody":null,"totalTestsPeopleAntibody":null,"positiveTestsPeopleAntibody":null,"negativeTestsPeopleAntibody":null,"totalTestsPeopleAntigen":null,"positiveTestsPeopleAntigen":null,"totalTestsAntigen":null,"positiveTestsAntigen":null,"fips":"55","positiveIncrease":1719,"negativeIncrease":5656,"total":3120621,"totalTestResultsIncrease":41946,"posNeg":3120577,"dataQualityGrade":null,"deathIncrease":49,"hospitalizedIncrease":80,"hash":"1c47c04c8ec2efdd80d6c5aebd165258bb7797b7","commercialScore":0,"negativeRegularScore":0,"negativeScore":0,"positiveScore":0,"score":0,"grade":""},{"date":20210203,"state":"WI","positive":595756,"probableCases":50319,"negative":2517446,"pending":43,"totalTestResultsSource":"totalTestEncountersViral","totalTestResults":6236725,"hospitalizedCurrently":655,"hospitalizedCumulative":24554,"inIcuCurrently":158,"inIcuCumulative":2186,"onVentilatorCurrently":null,"onVentilatorCumulative":null,"recovered":522361,"lastUpdateEt":"2/3/2021 00:00","dateModified":"2021-02-03T00:00:00Z","checkTimeEt":"02/02 19:00","death":6496,"hospitalized":24554,"hospitalizedDischarged":null,"dateChecked":"2021-02-03T00:00:00Z","totalTestsViral":null,"positiveTestsViral":null,"negativeTestsViral":null,"positiveCasesViral":545437,"deathConfirmed":5951,"deathProbable":545,"totalTestEncountersViral":6236725,"totalTestsPeopleViral":3062883,"totalTestsAntibody":null,"positiveTestsAntibody":null,"negativeTestsAntibody":null,"totalTestsPeopleAntibody":null,"positiveTestsPeopleAntibody":null,"negativeTestsPeopleAntibody":null,"totalTestsPeopleAntigen":null,"positiveTestsPeopleAntigen":null,"totalTestsAntigen":null,"positiveTestsAntigen":null,"fips":"55","positiveIncrease":1539,"negativeIncrease":4689,"total":3113245,"totalTestResultsIncrease":32129,"posNeg":3113202,"dataQualityGrade":null,"deathIncrease":16,"hospitalizedIncrease":94,"hash":"5f8ec346784cf8660acd2a7250989b859bd048d4","commercialScore":0,"negativeRegularScore":0,"negativeScore":0,"positiveScore":0,"score":0,"grade":""},{"date":20210202,"state":"WI","positive":594217,"probableCases":49957,"negative":2512757,"pending":44,"totalTestResultsSource":"totalTestEncountersViral","totalTestResults":6204596,"hospitalizedCurrently":686,"hospitalizedCumulative":24460,"inIcuCurrently":146,"inIcuCumulative":2185,"onVentilatorCurrently":null,"onVentilatorCumulative":null,"recovered":520325,"lastUpdateEt":"2/2/2021 00:00","dateModified":"2021-02-02T00:00:00Z","checkTimeEt":"02/01 19:00","death":6480,"hospitalized":24460,"hospitalizedDischarged":null,"dateChecked":"2021-02-02T00:00:00Z","totalTestsViral":null,"positiveTestsViral":null,"negativeTestsViral":null,"positiveCasesViral":544260,"deathConfirmed":5937,"deathProbable":543,"totalTestEncountersViral":6204596,"totalTestsPeopleViral":3057017,"totalTestsAntibody":null,"positiveTestsAntibody":null,"negativeTestsAntibody":null,"totalTestsPeopleAntibody":null,"positiveTestsPeopleAntibody":null,"negativeTestsPeopleAntibody":null,"totalTestsPeopleAntigen":null,"positiveTestsPeopleAntigen":null,"totalTestsAntigen":null,"positiveTestsAntigen":null,"fips":"55","positiveIncrease":1296,"negativeIncrease":2087,"total":3107018,"totalTestResultsIncrease":43823,"posNeg":3106974,"dataQualityGrade":null,"deathIncrease":44,"hospitalizedIncrease":123,"hash":"62c3900a1c96a354bbbc00a0d316b7dae4d78020","commercialScore":0,"negativeRegularScore":0,"negativeScore":0,"positiveScore":0,"score":0,"grade":""},{"date":20210201,"state":"WI","positive":592921,"probableCases":49756,"negative":2510670,"pending":42,"totalTestResultsSource":"totalTestEncountersViral","totalTestResults":6160773,"hospitalizedCurrently":697,"hospitalizedCumulative":24337,"inIcuCurrently":168,"inIcuCumulative":2181,"onVentilatorCurrently":null,"onVentilatorCumulative":null,"recovered":518801,"lastUpdateEt":"2/1/2021 00:00","dateModified":"2021-02-01T00:00:00Z","checkTimeEt":"01/31 19:00","death":6436,"hospitalized":24337,"hospitalizedDischarged":null,"dateChecked":"2021-02-01T00:00:00Z","totalTestsViral":null,"positiveTestsViral":null,"negativeTestsViral":null,"positiveCasesViral":543165,"deathConfirmed":5897,"deathProbable":539,"totalTestEncountersViral":6160773,"totalTestsPeopleViral":3053835,"totalTestsAntibody":null,"positiveTestsAntibody":null,"negativeTestsAntibody":null,"totalTestsPeopleAntibody":null,"positiveTestsPeopleAntibody":null,"negativeTestsPeopleAntibody":null,"totalTestsPeopleAntigen":null,"positiveTestsPeopleAntigen":null,"totalTestsAntigen":null,"positiveTestsAntigen":null,"fips":"55","positiveIncrease":781,"negativeIncrease":3070,"total":3103633,"totalTestResultsIncrease":-16802,"posNeg":3103591,"dataQualityGrade":null,"deathIncrease":2,"hospitalizedIncrease":39,"hash":"15de601b7e98d0a80c0968294cbc90087d5234aa","commercialScore":0,"negativeRegularScore":0,"negativeScore":0,"positiveScore":0,"score":0,"grade":""},{"date":20210131,"state":"WI","positive":592140,"probableCases":49725,"negative":2507600,"pending":73,"totalTestResultsSource":"totalTestEncountersViral","totalTestResults":6177575,"hospitalizedCurrently":680,"hospitalizedCumulative":24298,"inIcuCurrently":185,"inIcuCumulative":2179,"onVentilatorCurrently":null,"onVentilatorCumulative":null,"recovered":517169,"lastUpdateEt":"1/31/2021 00:00","dateModified":"2021-01-31T00:00:00Z","checkTimeEt":"01/30 19:00","death":6434,"hospitalized":24298,"hospitalizedDischarged":null,"dateChecked":"2021-01-31T00:00:00Z","totalTestsViral":null,"positiveTestsViral":null,"negativeTestsViral":null,"positiveCasesViral":542415,"deathConfirmed":5896,"deathProbable":538,"totalTestEncountersViral":6177575,"totalTestsPeopleViral":3050015,"totalTestsAntibody":null,"positiveTestsAntibody":null,"negativeTestsAntibody":null,"totalTestsPeopleAntibody":null,"positiveTestsPeopleAntibody":null,"negativeTestsPeopleAntibody":null,"totalTestsPeopleAntigen":null,"positiveTestsPeopleAntigen":null,"totalTestsAntigen":null,"positiveTestsAntigen":null,"fips":"55","positiveIncrease":1143,"negativeIncrease":4213,"total":3099813,"totalTestResultsIncrease":22737,"posNeg":3099740,"dataQualityGrade":null,"deathIncrease":4,"hospitalizedIncrease":55,"hash":"ee0a67659c3a7d794821900dc8bc0927786a1008","commercialScore":0,"negativeRegularScore":0,"negativeScore":0,"positiveScore":0,"score":0,"grade":""},{"date":20210130,"state":"WI","positive":590997,"probableCases":49589,"negative":2503387,"pending":73,"totalTestResultsSource":"totalTestEncountersViral","totalTestResults":6154838,"hospitalizedCurrently":680,"hospitalizedCumulative":24243,"inIcuCurrently":185,"inIcuCumulative":2178,"onVentilatorCurrently":null,"onVentilatorCumulative":null,"recovered":515745,"lastUpdateEt":"1/30/2021 00:00","dateModified":"2021-01-30T00:00:00Z","checkTimeEt":"01/29 19:00","death":6430,"hospitalized":24243,"hospitalizedDischarged":null,"dateChecked":"2021-01-30T00:00:00Z","totalTestsViral":null,"positiveTestsViral":null,"negativeTestsViral":null,"positiveCasesViral":541408,"deathConfirmed":5893,"deathProbable":537,"totalTestEncountersViral":6154838,"totalTestsPeopleViral":3044795,"totalTestsAntibody":null,"positiveTestsAntibody":null,"negativeTestsAntibody":null,"totalTestsPeopleAntibody":null,"positiveTestsPeopleAntibody":null,"negativeTestsPeopleAntibody":null,"totalTestsPeopleAntigen":null,"positiveTestsPeopleAntigen":null,"totalTestsAntigen":null,"positiveTestsAntigen":null,"fips":"55","positiveIncrease":1613,"negativeIncrease":4870,"total":3094457,"totalTestResultsIncrease":30427,"posNeg":3094384,"dataQualityGrade":null,"deathIncrease":40,"hospitalizedIncrease":89,"hash":"45844aa527209a6591a7ffdf06f365311970e0f6","commercialScore":0,"negativeRegularScore":0,"negativeScore":0,"positiveScore":0,"score":0,"grade":""},{"date":20210129,"state":"WI","positive":589384,"probableCases":49469,"negative":2498517,"pending":73,"totalTestResultsSource":"totalTestEncountersViral","totalTestResults":6124411,"hospitalizedCurrently":680,"hospitalizedCumulative":24154,"inIcuCurrently":185,"inIcuCumulative":2171,"onVentilatorCurrently":null,"onVentilatorCumulative":null,"recovered":513809,"lastUpdateEt":"1/29/2021 00:00","dateModified":"2021-01-29T00:00:00Z","checkTimeEt":"01/28 19:00","death":6390,"hospitalized":24154,"hospitalizedDischarged":null,"dateChecked":"2021-01-29T00:00:00Z","totalTestsViral":null,"positiveTestsViral":null,"negativeTestsViral":null,"positiveCasesViral":539915,"deathConfirmed":5860,"deathProbable":530,"totalTestEncountersViral":6124411,"totalTestsPeopleViral":3038432,"totalTestsAntibody":null,"positiveTestsAntibody":null,"negativeTestsAntibody":null,"totalTestsPeopleAntibody":null,"positiveTestsPeopleAntibody":null,"negativeTestsPeopleAntibody":null,"totalTestsPeopleAntigen":null,"positiveTestsPeopleAntigen":null,"totalTestsAntigen":null,"positiveTestsAntigen":null,"fips":"55","positiveIncrease":1804,"negativeIncrease":5373,"total":3087974,"totalTestResultsIncrease":31499,"posNeg":3087901,"dataQualityGrade":null,"deathIncrease":56,"hospitalizedIncrease":91,"hash":"c34b6a7bc2632bda581a04d175f616b0bb6481d7","commercialScore":0,"negativeRegularScore":0,"negativeScore":0,"positiveScore":0,"score":0,"grade":""},{"date":20210128,"state":"WI","positive":587580,"probableCases":49232,"negative":2493144,"pending":61,"totalTestResultsSource":"totalTestEncountersViral","totalTestResults":6092912,"hospitalizedCurrently":710,"hospitalizedCumulative":24063,"inIcuCurrently":166,"inIcuCumulative":2170,"onVentilatorCurrently":null,"onVentilatorCumulative":null,"recovered":511859,"lastUpdateEt":"1/28/2021 00:00","dateModified":"2021-01-28T00:00:00Z","checkTimeEt":"01/27 19:00","death":6334,"hospitalized":24063,"hospitalizedDischarged":null,"dateChecked":"2021-01-28T00:00:00Z","totalTestsViral":null,"positiveTestsViral":null,"negativeTestsViral":null,"positiveCasesViral":538348,"deathConfirmed":5811,"deathProbable":523,"totalTestEncountersViral":6092912,"totalTestsPeopleViral":3031492,"totalTestsAntibody":null,"positiveTestsAntibody":null,"negativeTestsAntibody":null,"totalTestsPeopleAntibody":null,"positiveTestsPeopleAntibody":null,"negativeTestsPeopleAntibody":null,"totalTestsPeopleAntigen":null,"positiveTestsPeopleAntigen":null,"totalTestsAntigen":null,"positiveTestsAntigen":null,"fips":"55","positiveIncrease":1980,"negativeIncrease":6184,"total":3080785,"totalTestResultsIncrease":42793,"posNeg":3080724,"dataQualityGrade":null,"deathIncrease":32,"hospitalizedIncrease":87,"hash":"11eeea5e20a4a84860eba8a9fd162e06aaff37f3","commercialScore":0,"negativeRegularScore":0,"negativeScore":0,"positiveScore":0,"score":0,"grade":""},{"date":20210127,"state":"WI","positive":585600,"probableCases":49054,"negative":2486960,"pending":53,"totalTestResultsSource":"totalTestEncountersViral","totalTestResults":6050119,"hospitalizedCurrently":734,"hospitalizedCumulative":23976,"inIcuCurrently":160,"inIcuCumulative":2167,"onVentilatorCurrently":null,"onVentilatorCumulative":null,"recovered":510012,"lastUpdateEt":"1/27/2021 00:00","dateModified":"2021-01-27T00:00:00Z","checkTimeEt":"01/26 19:00","death":6302,"hospitalized":23976,"hospitalizedDischarged":null,"dateChecked":"2021-01-27T00:00:00Z","totalTestsViral":null,"positiveTestsViral":null,"negativeTestsViral":null,"positiveCasesViral":536546,"deathConfirmed":5787,"deathProbable":515,"totalTestEncountersViral":6050119,"totalTestsPeopleViral":3023506,"totalTestsAntibody":null,"positiveTestsAntibody":null,"negativeTestsAntibody":null,"totalTestsPeopleAntibody":null,"positiveTestsPeopleAntibody":null,"negativeTestsPeopleAntibody":null,"totalTestsPeopleAntigen":null,"positiveTestsPeopleAntigen":null,"totalTestsAntigen":null,"positiveTestsAntigen":null,"fips":"55","positiveIncrease":1559,"negativeIncrease":5225,"total":3072613,"totalTestResultsIncrease":29580,"posNeg":3072560,"dataQualityGrade":null,"deathIncrease":38,"hospitalizedIncrease":93,"hash":"9520a0e5628cf3d66afb0c57b3a871fec7d5aea3","commercialScore":0,"negativeRegularScore":0,"negativeScore":0,"positiveScore":0,"score":0,"grade":""},{"date":20210126,"state":"WI","positive":584041,"probableCases":48823,"negative":2481735,"pending":64,"totalTestResultsSource":"totalTestEncountersViral","totalTestResults":6020539,"hospitalizedCurrently":746,"hospitalizedCumulative":23883,"inIcuCurrently":155,"inIcuCumulative":2164,"onVentilatorCurrently":null,"onVentilatorCumulative":null,"recovered":507760,"lastUpdateEt":"1/26/2021 00:00","dateModified":"2021-01-26T00:00:00Z","checkTimeEt":"01/25 19:00","death":6264,"hospitalized":23883,"hospitalizedDischarged":null,"dateChecked":"2021-01-26T00:00:00Z","totalTestsViral":null,"positiveTestsViral":null,"negativeTestsViral":null,"positiveCasesViral":535218,"deathConfirmed":5753,"deathProbable":511,"totalTestEncountersViral":6020539,"totalTestsPeopleViral":3016953,"totalTestsAntibody":null,"positiveTestsAntibody":null,"negativeTestsAntibody":null,"totalTestsPeopleAntibody":null,"positiveTestsPeopleAntibody":null,"negativeTestsPeopleAntibody":null,"totalTestsPeopleAntigen":null,"positiveTestsPeopleAntigen":null,"totalTestsAntigen":null,"positiveTestsAntigen":null,"fips":"55","positiveIncrease":1564,"negativeIncrease":4147,"total":3065840,"totalTestResultsIncrease":17138,"posNeg":3065776,"dataQualityGrade":null,"deathIncrease":65,"hospitalizedIncrease":135,"hash":"2b03745dec34f97f815cd85257c5aef8ad1b14a3","commercialScore":0,"negativeRegularScore":0,"negativeScore":0,"positiveScore":0,"score":0,"grade":""},{"date":20210125,"state":"WI","positive":582477,"probableCases":48560,"negative":2477588,"pending":69,"totalTestResultsSource":"totalTestEncountersViral","totalTestResults":6003401,"hospitalizedCurrently":772,"hospitalizedCumulative":23748,"inIcuCurrently":175,"inIcuCumulative":2158,"onVentilatorCurrently":null,"onVentilatorCumulative":null,"recovered":505987,"lastUpdateEt":"1/25/2021 00:00","dateModified":"2021-01-25T00:00:00Z","checkTimeEt":"01/24 19:00","death":6199,"hospitalized":23748,"hospitalizedDischarged":null,"dateChecked":"2021-01-25T00:00:00Z","totalTestsViral":null,"positiveTestsViral":null,"negativeTestsViral":null,"positiveCasesViral":533917,"deathConfirmed":5699,"deathProbable":500,"totalTestEncountersViral":6003401,"totalTestsPeopleViral":3011505,"totalTestsAntibody":null,"positiveTestsAntibody":null,"negativeTestsAntibody":null,"totalTestsPeopleAntibody":null,"positiveTestsPeopleAntibody":null,"negativeTestsPeopleAntibody":null,"totalTestsPeopleAntigen":null,"positiveTestsPeopleAntigen":null,"totalTestsAntigen":null,"positiveTestsAntigen":null,"fips":"55","positiveIncrease":1100,"negativeIncrease":3253,"total":3060134,"totalTestResultsIncrease":12931,"posNeg":3060065,"dataQualityGrade":null,"deathIncrease":9,"hospitalizedIncrease":56,"hash":"80450fddf041223ff069d28f941c72d60554fb86","commercialScore":0,"negativeRegularScore":0,"negativeScore":0,"positiveScore":0,"score":0,"grade":""},{"date":20210124,"state":"WI","positive":581377,"probableCases":48406,"negative":2474335,"pending":36,"totalTestResultsSource":"totalTestEncountersViral","totalTestResults":5990470,"hospitalizedCurrently":761,"hospitalizedCumulative":23692,"inIcuCurrently":169,"inIcuCumulative":2153,"onVentilatorCurrently":null,"onVentilatorCumulative":null,"recovered":504238,"lastUpdateEt":"1/24/2021 00:00","dateModified":"2021-01-24T00:00:00Z","checkTimeEt":"01/23 19:00","death":6190,"hospitalized":23692,"hospitalizedDischarged":null,"dateChecked":"2021-01-24T00:00:00Z","totalTestsViral":null,"positiveTestsViral":null,"negativeTestsViral":null,"positiveCasesViral":532971,"deathConfirmed":5691,"deathProbable":499,"totalTestEncountersViral":5990470,"totalTestsPeopleViral":3007306,"totalTestsAntibody":null,"positiveTestsAntibody":null,"negativeTestsAntibody":null,"totalTestsPeopleAntibody":null,"positiveTestsPeopleAntibody":null,"negativeTestsPeopleAntibody":null,"totalTestsPeopleAntigen":null,"positiveTestsPeopleAntigen":null,"totalTestsAntigen":null,"positiveTestsAntigen":null,"fips":"55","positiveIncrease":1374,"negativeIncrease":5212,"total":3055748,"totalTestResultsIncrease":23209,"posNeg":3055712,"dataQualityGrade":null,"deathIncrease":6,"hospitalizedIncrease":67,"hash":"b7e65755c597b6a718993cba7a27b22a3b9c6110","commercialScore":0,"negativeRegularScore":0,"negativeScore":0,"positiveScore":0,"score":0,"grade":""},{"date":20210123,"state":"WI","positive":580003,"probableCases":48151,"negative":2469123,"pending":62,"totalTestResultsSource":"totalTestEncountersViral","totalTestResults":5967261,"hospitalizedCurrently":785,"hospitalizedCumulative":23625,"inIcuCurrently":178,"inIcuCumulative":2148,"onVentilatorCurrently":null,"onVentilatorCumulative":null,"recovered":502593,"lastUpdateEt":"1/23/2021 00:00","dateModified":"2021-01-23T00:00:00Z","checkTimeEt":"01/22 19:00","death":6184,"hospitalized":23625,"hospitalizedDischarged":null,"dateChecked":"2021-01-23T00:00:00Z","totalTestsViral":null,"positiveTestsViral":null,"negativeTestsViral":null,"positiveCasesViral":531852,"deathConfirmed":5685,"deathProbable":499,"totalTestEncountersViral":5967261,"totalTestsPeopleViral":3000975,"totalTestsAntibody":null,"positiveTestsAntibody":null,"negativeTestsAntibody":null,"totalTestsPeopleAntibody":null,"positiveTestsPeopleAntibody":null,"negativeTestsPeopleAntibody":null,"totalTestsPeopleAntigen":null,"positiveTestsPeopleAntigen":null,"totalTestsAntigen":null,"positiveTestsAntigen":null,"fips":"55","positiveIncrease":2012,"negativeIncrease":5779,"total":3049188,"totalTestResultsIncrease":29672,"posNeg":3049126,"dataQualityGrade":null,"deathIncrease":49,"hospitalizedIncrease":89,"hash":"5a8bfd125577f39f4aa494ad45533f0019cd828c","commercialScore":0,"negativeRegularScore":0,"negativeScore":0,"positiveScore":0,"score":0,"grade":""},{"date":20210122,"state":"WI","positive":577991,"probableCases":47820,"negative":2463344,"pending":62,"totalTestResultsSource":"totalTestEncountersViral","totalTestResults":5937589,"hospitalizedCurrently":785,"hospitalizedCumulative":23536,"inIcuCurrently":178,"inIcuCumulative":2144,"onVentilatorCurrently":null,"onVentilatorCumulative":null,"recovered":500685,"lastUpdateEt":"1/22/2021 00:00","dateModified":"2021-01-22T00:00:00Z","checkTimeEt":"01/21 19:00","death":6135,"hospitalized":23536,"hospitalizedDischarged":null,"dateChecked":"2021-01-22T00:00:00Z","totalTestsViral":null,"positiveTestsViral":null,"negativeTestsViral":null,"positiveCasesViral":530171,"deathConfirmed":5643,"deathProbable":492,"totalTestEncountersViral":5937589,"totalTestsPeopleViral":2993515,"totalTestsAntibody":null,"positiveTestsAntibody":null,"negativeTestsAntibody":null,"totalTestsPeopleAntibody":null,"positiveTestsPeopleAntibody":null,"negativeTestsPeopleAntibody":null,"totalTestsPeopleAntigen":null,"positiveTestsPeopleAntigen":null,"totalTestsAntigen":null,"positiveTestsAntigen":null,"fips":"55","positiveIncrease":2303,"negativeIncrease":6312,"total":3041397,"totalTestResultsIncrease":40284,"posNeg":3041335,"dataQualityGrade":null,"deathIncrease":45,"hospitalizedIncrease":91,"hash":"9b27300055bdce4052d3f39d377cdf086f14c64a","commercialScore":0,"negativeRegularScore":0,"negativeScore":0,"positiveScore":0,"score":0,"grade":""},{"date":20210121,"state":"WI","positive":575688,"probableCases":47587,"negative":2457032,"pending":57,"totalTestResultsSource":"totalTestEncountersViral","totalTestResults":5897305,"hospitalizedCurrently":808,"hospitalizedCumulative":23445,"inIcuCurrently":173,"inIcuCumulative":2140,"onVentilatorCurrently":null,"onVentilatorCumulative":null,"recovered":498368,"lastUpdateEt":"1/21/2021 00:00","dateModified":"2021-01-21T00:00:00Z","checkTimeEt":"01/20 19:00","death":6090,"hospitalized":23445,"hospitalizedDischarged":null,"dateChecked":"2021-01-21T00:00:00Z","totalTestsViral":null,"positiveTestsViral":null,"negativeTestsViral":null,"positiveCasesViral":528101,"deathConfirmed":5607,"deathProbable":483,"totalTestEncountersViral":5897305,"totalTestsPeopleViral":2985133,"totalTestsAntibody":null,"positiveTestsAntibody":null,"negativeTestsAntibody":null,"totalTestsPeopleAntibody":null,"positiveTestsPeopleAntibody":null,"negativeTestsPeopleAntibody":null,"totalTestsPeopleAntigen":null,"positiveTestsPeopleAntigen":null,"totalTestsAntigen":null,"positiveTestsAntigen":null,"fips":"55","positiveIncrease":2569,"negativeIncrease":6510,"total":3032777,"totalTestResultsIncrease":35774,"posNeg":3032720,"dataQualityGrade":null,"deathIncrease":55,"hospitalizedIncrease":82,"hash":"f1754c3b7e161272f95bc92c998ae1e1a110e8aa","commercialScore":0,"negativeRegularScore":0,"negativeScore":0,"positiveScore":0,"score":0,"grade":""},{"date":20210120,"state":"WI","positive":573119,"probableCases":47195,"negative":2450522,"pending":60,"totalTestResultsSource":"totalTestEncountersViral","totalTestResults":5861531,"hospitalizedCurrently":834,"hospitalizedCumulative":23363,"inIcuCurrently":193,"inIcuCumulative":2138,"onVentilatorCurrently":null,"onVentilatorCumulative":null,"recovered":496297,"lastUpdateEt":"1/20/2021 00:00","dateModified":"2021-01-20T00:00:00Z","checkTimeEt":"01/19 19:00","death":6035,"hospitalized":23363,"hospitalizedDischarged":null,"dateChecked":"2021-01-20T00:00:00Z","totalTestsViral":null,"positiveTestsViral":null,"negativeTestsViral":null,"positiveCasesViral":525924,"deathConfirmed":5562,"deathProbable":473,"totalTestEncountersViral":5861531,"totalTestsPeopleViral":2976446,"totalTestsAntibody":null,"positiveTestsAntibody":null,"negativeTestsAntibody":null,"totalTestsPeopleAntibody":null,"positiveTestsPeopleAntibody":null,"negativeTestsPeopleAntibody":null,"totalTestsPeopleAntigen":null,"positiveTestsPeopleAntigen":null,"totalTestsAntigen":null,"positiveTestsAntigen":null,"fips":"55","positiveIncrease":1851,"negativeIncrease":5123,"total":3023701,"totalTestResultsIncrease":28822,"posNeg":3023641,"dataQualityGrade":null,"deathIncrease":62,"hospitalizedIncrease":119,"hash":"8f6296194b0f5e051873f6454a6bcc2f013160b9","commercialScore":0,"negativeRegularScore":0,"negativeScore":0,"positiveScore":0,"score":0,"grade":""},{"date":20210119,"state":"WI","positive":571268,"probableCases":46866,"negative":2445399,"pending":69,"totalTestResultsSource":"totalTestEncountersViral","totalTestResults":5832709,"hospitalizedCurrently":865,"hospitalizedCumulative":23244,"inIcuCurrently":203,"inIcuCumulative":2136,"onVentilatorCurrently":null,"onVentilatorCumulative":null,"recovered":494029,"lastUpdateEt":"1/19/2021 00:00","dateModified":"2021-01-19T00:00:00Z","checkTimeEt":"01/18 19:00","death":5973,"hospitalized":23244,"hospitalizedDischarged":null,"dateChecked":"2021-01-19T00:00:00Z","totalTestsViral":null,"positiveTestsViral":null,"negativeTestsViral":null,"positiveCasesViral":524402,"deathConfirmed":5512,"deathProbable":461,"totalTestEncountersViral":5832709,"totalTestsPeopleViral":2969801,"totalTestsAntibody":null,"positiveTestsAntibody":null,"negativeTestsAntibody":null,"totalTestsPeopleAntibody":null,"positiveTestsPeopleAntibody":null,"negativeTestsPeopleAntibody":null,"totalTestsPeopleAntigen":null,"positiveTestsPeopleAntigen":null,"totalTestsAntigen":null,"positiveTestsAntigen":null,"fips":"55","positiveIncrease":1933,"negativeIncrease":3556,"total":3016736,"totalTestResultsIncrease":19302,"posNeg":3016667,"dataQualityGrade":null,"deathIncrease":47,"hospitalizedIncrease":114,"hash":"72c695f1561a9730eafd4265c710617b1a7ca911","commercialScore":0,"negativeRegularScore":0,"negativeScore":0,"positiveScore":0,"score":0,"grade":""},{"date":20210118,"state":"WI","positive":569335,"probableCases":46458,"negative":2441843,"pending":52,"totalTestResultsSource":"totalTestEncountersViral","totalTestResults":5813407,"hospitalizedCurrently":875,"hospitalizedCumulative":23130,"inIcuCurrently":209,"inIcuCumulative":2127,"onVentilatorCurrently":null,"onVentilatorCumulative":null,"recovered":491962,"lastUpdateEt":"1/18/2021 00:00","dateModified":"2021-01-18T00:00:00Z","checkTimeEt":"01/17 19:00","death":5926,"hospitalized":23130,"hospitalizedDischarged":null,"dateChecked":"2021-01-18T00:00:00Z","totalTestsViral":null,"positiveTestsViral":null,"negativeTestsViral":null,"positiveCasesViral":522877,"deathConfirmed":5470,"deathProbable":456,"totalTestEncountersViral":5813407,"totalTestsPeopleViral":2964720,"totalTestsAntibody":null,"positiveTestsAntibody":null,"negativeTestsAntibody":null,"totalTestsPeopleAntibody":null,"positiveTestsPeopleAntibody":null,"negativeTestsPeopleAntibody":null,"totalTestsPeopleAntigen":null,"positiveTestsPeopleAntigen":null,"totalTestsAntigen":null,"positiveTestsAntigen":null,"fips":"55","positiveIncrease":1169,"negativeIncrease":4049,"total":3011230,"totalTestResultsIncrease":15335,"posNeg":3011178,"dataQualityGrade":null,"deathIncrease":20,"hospitalizedIncrease":54,"hash":"59ca83ad48a2c5c9d021c9fb6ee82c622994e38c","commercialScore":0,"negativeRegularScore":0,"negativeScore":0,"positiveScore":0,"score":0,"grade":""},{"date":20210117,"state":"WI","positive":568166,"probableCases":46372,"negative":2437794,"pending":54,"totalTestResultsSource":"totalTestEncountersViral","totalTestResults":5798072,"hospitalizedCurrently":953,"hospitalizedCumulative":23076,"inIcuCurrently":227,"inIcuCumulative":2124,"onVentilatorCurrently":null,"onVentilatorCumulative":null,"recovered":490043,"lastUpdateEt":"1/17/2021 00:00","dateModified":"2021-01-17T00:00:00Z","checkTimeEt":"01/16 19:00","death":5906,"hospitalized":23076,"hospitalizedDischarged":null,"dateChecked":"2021-01-17T00:00:00Z","totalTestsViral":null,"positiveTestsViral":null,"negativeTestsViral":null,"positiveCasesViral":521794,"deathConfirmed":5451,"deathProbable":455,"totalTestEncountersViral":5798072,"totalTestsPeopleViral":2959588,"totalTestsAntibody":null,"positiveTestsAntibody":null,"negativeTestsAntibody":null,"totalTestsPeopleAntibody":null,"positiveTestsPeopleAntibody":null,"negativeTestsPeopleAntibody":null,"totalTestsPeopleAntigen":null,"positiveTestsPeopleAntigen":null,"totalTestsAntigen":null,"positiveTestsAntigen":null,"fips":"55","positiveIncrease":1891,"negativeIncrease":5068,"total":3006014,"totalTestResultsIncrease":25805,"posNeg":3005960,"dataQualityGrade":null,"deathIncrease":1,"hospitalizedIncrease":50,"hash":"7949b0708060c1ca59ab167efe00ac4f167a4ebe","commercialScore":0,"negativeRegularScore":0,"negativeScore":0,"positiveScore":0,"score":0,"grade":""},{"date":20210116,"state":"WI","positive":566275,"probableCases":46087,"negative":2432726,"pending":54,"totalTestResultsSource":"totalTestEncountersViral","totalTestResults":5772267,"hospitalizedCurrently":953,"hospitalizedCumulative":23026,"inIcuCurrently":227,"inIcuCumulative":2123,"onVentilatorCurrently":null,"onVentilatorCumulative":null,"recovered":487754,"lastUpdateEt":"1/16/2021 00:00","dateModified":"2021-01-16T00:00:00Z","checkTimeEt":"01/15 19:00","death":5905,"hospitalized":23026,"hospitalizedDischarged":null,"dateChecked":"2021-01-16T00:00:00Z","totalTestsViral":null,"positiveTestsViral":null,"negativeTestsViral":null,"positiveCasesViral":520188,"deathConfirmed":5450,"deathProbable":455,"totalTestEncountersViral":5772267,"totalTestsPeopleViral":2952914,"totalTestsAntibody":null,"positiveTestsAntibody":null,"negativeTestsAntibody":null,"totalTestsPeopleAntibody":null,"positiveTestsPeopleAntibody":null,"negativeTestsPeopleAntibody":null,"totalTestsPeopleAntigen":null,"positiveTestsPeopleAntigen":null,"totalTestsAntigen":null,"positiveTestsAntigen":null,"fips":"55","positiveIncrease":2409,"negativeIncrease":5095,"total":2999055,"totalTestResultsIncrease":26697,"posNeg":2999001,"dataQualityGrade":null,"deathIncrease":135,"hospitalizedIncrease":103,"hash":"61b0f2454d6a772dbb6dc8c00410acb002ac4be1","commercialScore":0,"negativeRegularScore":0,"negativeScore":0,"positiveScore":0,"score":0,"grade":""},{"date":20210115,"state":"WI","positive":563866,"probableCases":45615,"negative":2427631,"pending":53,"totalTestResultsSource":"totalTestEncountersViral","totalTestResults":5745570,"hospitalizedCurrently":998,"hospitalizedCumulative":22923,"inIcuCurrently":229,"inIcuCumulative":2117,"onVentilatorCurrently":null,"onVentilatorCumulative":null,"recovered":485157,"lastUpdateEt":"1/15/2021 00:00","dateModified":"2021-01-15T00:00:00Z","checkTimeEt":"01/14 19:00","death":5770,"hospitalized":22923,"hospitalizedDischarged":null,"dateChecked":"2021-01-15T00:00:00Z","totalTestsViral":null,"positiveTestsViral":null,"negativeTestsViral":null,"positiveCasesViral":518251,"deathConfirmed":5322,"deathProbable":448,"totalTestEncountersViral":5745570,"totalTestsPeopleViral":2945882,"totalTestsAntibody":null,"positiveTestsAntibody":null,"negativeTestsAntibody":null,"totalTestsPeopleAntibody":null,"positiveTestsPeopleAntibody":null,"negativeTestsPeopleAntibody":null,"totalTestsPeopleAntigen":null,"positiveTestsPeopleAntigen":null,"totalTestsAntigen":null,"positiveTestsAntigen":null,"fips":"55","positiveIncrease":2706,"negativeIncrease":5771,"total":2991550,"totalTestResultsIncrease":29446,"posNeg":2991497,"dataQualityGrade":null,"deathIncrease":42,"hospitalizedIncrease":119,"hash":"2d5a2cceae420ef360c51a57168ccbf64e1b54ea","commercialScore":0,"negativeRegularScore":0,"negativeScore":0,"positiveScore":0,"score":0,"grade":""},{"date":20210114,"state":"WI","positive":561160,"probableCases":45178,"negative":2421860,"pending":73,"totalTestResultsSource":"totalTestEncountersViral","totalTestResults":5716124,"hospitalizedCurrently":1025,"hospitalizedCumulative":22804,"inIcuCurrently":224,"inIcuCumulative":2115,"onVentilatorCurrently":null,"onVentilatorCumulative":null,"recovered":482669,"lastUpdateEt":"1/14/2021 00:00","dateModified":"2021-01-14T00:00:00Z","checkTimeEt":"01/13 19:00","death":5728,"hospitalized":22804,"hospitalizedDischarged":null,"dateChecked":"2021-01-14T00:00:00Z","totalTestsViral":null,"positiveTestsViral":null,"negativeTestsViral":null,"positiveCasesViral":515982,"deathConfirmed":5290,"deathProbable":438,"totalTestEncountersViral":5716124,"totalTestsPeopleViral":2937842,"totalTestsAntibody":null,"positiveTestsAntibody":null,"negativeTestsAntibody":null,"totalTestsPeopleAntibody":null,"positiveTestsPeopleAntibody":null,"negativeTestsPeopleAntibody":null,"totalTestsPeopleAntigen":null,"positiveTestsPeopleAntigen":null,"totalTestsAntigen":null,"positiveTestsAntigen":null,"fips":"55","positiveIncrease":3140,"negativeIncrease":6987,"total":2983093,"totalTestResultsIncrease":41690,"posNeg":2983020,"dataQualityGrade":null,"deathIncrease":49,"hospitalizedIncrease":99,"hash":"bab3c2511dc7db74a0a3b40d7a2bcb808926b19c","commercialScore":0,"negativeRegularScore":0,"negativeScore":0,"positiveScore":0,"score":0,"grade":""},{"date":20210113,"state":"WI","positive":558020,"probableCases":44750,"negative":2414873,"pending":66,"totalTestResultsSource":"totalTestEncountersViral","totalTestResults":5674434,"hospitalizedCurrently":988,"hospitalizedCumulative":22705,"inIcuCurrently":225,"inIcuCumulative":2113,"onVentilatorCurrently":null,"onVentilatorCumulative":null,"recovered":480112,"lastUpdateEt":"1/13/2021 00:00","dateModified":"2021-01-13T00:00:00Z","checkTimeEt":"01/12 19:00","death":5679,"hospitalized":22705,"hospitalizedDischarged":null,"dateChecked":"2021-01-13T00:00:00Z","totalTestsViral":null,"positiveTestsViral":null,"negativeTestsViral":null,"positiveCasesViral":513270,"deathConfirmed":5248,"deathProbable":431,"totalTestEncountersViral":5674434,"totalTestsPeopleViral":2928143,"totalTestsAntibody":null,"positiveTestsAntibody":null,"negativeTestsAntibody":null,"totalTestsPeopleAntibody":null,"positiveTestsPeopleAntibody":null,"negativeTestsPeopleAntibody":null,"totalTestsPeopleAntigen":null,"positiveTestsPeopleAntigen":null,"totalTestsAntigen":null,"positiveTestsAntigen":null,"fips":"55","positiveIncrease":2771,"negativeIncrease":5293,"total":2972959,"totalTestResultsIncrease":29499,"posNeg":2972893,"dataQualityGrade":null,"deathIncrease":46,"hospitalizedIncrease":122,"hash":"7a7352c84dce0a6c43cae3d830b2726b16bc1f73","commercialScore":0,"negativeRegularScore":0,"negativeScore":0,"positiveScore":0,"score":0,"grade":""},{"date":20210112,"state":"WI","positive":555249,"probableCases":44113,"negative":2409580,"pending":48,"totalTestResultsSource":"totalTestEncountersViral","totalTestResults":5644935,"hospitalizedCurrently":1017,"hospitalizedCumulative":22583,"inIcuCurrently":221,"inIcuCumulative":2107,"onVentilatorCurrently":null,"onVentilatorCumulative":null,"recovered":477460,"lastUpdateEt":"1/12/2021 00:00","dateModified":"2021-01-12T00:00:00Z","checkTimeEt":"01/11 19:00","death":5633,"hospitalized":22583,"hospitalizedDischarged":null,"dateChecked":"2021-01-12T00:00:00Z","totalTestsViral":null,"positiveTestsViral":null,"negativeTestsViral":null,"positiveCasesViral":511136,"deathConfirmed":5211,"deathProbable":422,"totalTestEncountersViral":5644935,"totalTestsPeopleViral":2920716,"totalTestsAntibody":null,"positiveTestsAntibody":null,"negativeTestsAntibody":null,"totalTestsPeopleAntibody":null,"positiveTestsPeopleAntibody":null,"negativeTestsPeopleAntibody":null,"totalTestsPeopleAntigen":null,"positiveTestsPeopleAntigen":null,"totalTestsAntigen":null,"positiveTestsAntigen":null,"fips":"55","positiveIncrease":3307,"negativeIncrease":3846,"total":2964877,"totalTestResultsIncrease":18049,"posNeg":2964829,"dataQualityGrade":null,"deathIncrease":58,"hospitalizedIncrease":149,"hash":"6f5068867265be70071781f294c9f2dc6b283bdb","commercialScore":0,"negativeRegularScore":0,"negativeScore":0,"positiveScore":0,"score":0,"grade":""},{"date":20210111,"state":"WI","positive":551942,"probableCases":43596,"negative":2405734,"pending":64,"totalTestResultsSource":"totalTestEncountersViral","totalTestResults":5626886,"hospitalizedCurrently":973,"hospitalizedCumulative":22434,"inIcuCurrently":219,"inIcuCumulative":2100,"onVentilatorCurrently":null,"onVentilatorCumulative":null,"recovered":474830,"lastUpdateEt":"1/11/2021 00:00","dateModified":"2021-01-11T00:00:00Z","checkTimeEt":"01/10 19:00","death":5575,"hospitalized":22434,"hospitalizedDischarged":null,"dateChecked":"2021-01-11T00:00:00Z","totalTestsViral":null,"positiveTestsViral":null,"negativeTestsViral":null,"positiveCasesViral":508346,"deathConfirmed":5162,"deathProbable":413,"totalTestEncountersViral":5626886,"totalTestsPeopleViral":2914080,"totalTestsAntibody":null,"positiveTestsAntibody":null,"negativeTestsAntibody":null,"totalTestsPeopleAntibody":null,"positiveTestsPeopleAntibody":null,"negativeTestsPeopleAntibody":null,"totalTestsPeopleAntigen":null,"positiveTestsPeopleAntigen":null,"totalTestsAntigen":null,"positiveTestsAntigen":null,"fips":"55","positiveIncrease":1682,"negativeIncrease":3998,"total":2957740,"totalTestResultsIncrease":18002,"posNeg":2957676,"dataQualityGrade":null,"deathIncrease":5,"hospitalizedIncrease":56,"hash":"712f73e6aaafba9126f102784dcb7940e707152d","commercialScore":0,"negativeRegularScore":0,"negativeScore":0,"positiveScore":0,"score":0,"grade":""},{"date":20210110,"state":"WI","positive":550260,"probableCases":43370,"negative":2401736,"pending":62,"totalTestResultsSource":"totalTestEncountersViral","totalTestResults":5608884,"hospitalizedCurrently":1054,"hospitalizedCumulative":22378,"inIcuCurrently":242,"inIcuCumulative":2098,"onVentilatorCurrently":null,"onVentilatorCumulative":null,"recovered":472862,"lastUpdateEt":"1/10/2021 00:00","dateModified":"2021-01-10T00:00:00Z","checkTimeEt":"01/09 19:00","death":5570,"hospitalized":22378,"hospitalizedDischarged":null,"dateChecked":"2021-01-10T00:00:00Z","totalTestsViral":null,"positiveTestsViral":null,"negativeTestsViral":null,"positiveCasesViral":506890,"deathConfirmed":5157,"deathProbable":413,"totalTestEncountersViral":5608884,"totalTestsPeopleViral":2908626,"totalTestsAntibody":null,"positiveTestsAntibody":null,"negativeTestsAntibody":null,"totalTestsPeopleAntibody":null,"positiveTestsPeopleAntibody":null,"negativeTestsPeopleAntibody":null,"totalTestsPeopleAntigen":null,"positiveTestsPeopleAntigen":null,"totalTestsAntigen":null,"positiveTestsAntigen":null,"fips":"55","positiveIncrease":2126,"negativeIncrease":5630,"total":2952058,"totalTestResultsIncrease":23843,"posNeg":2951996,"dataQualityGrade":null,"deathIncrease":3,"hospitalizedIncrease":52,"hash":"ac212eeeec0f32a05062647c68c54210b0ed342e","commercialScore":0,"negativeRegularScore":0,"negativeScore":0,"positiveScore":0,"score":0,"grade":""},{"date":20210109,"state":"WI","positive":548134,"probableCases":43076,"negative":2396106,"pending":62,"totalTestResultsSource":"totalTestEncountersViral","totalTestResults":5585041,"hospitalizedCurrently":1054,"hospitalizedCumulative":22326,"inIcuCurrently":242,"inIcuCumulative":2093,"onVentilatorCurrently":null,"onVentilatorCumulative":null,"recovered":470385,"lastUpdateEt":"1/9/2021 00:00","dateModified":"2021-01-09T00:00:00Z","checkTimeEt":"01/08 19:00","death":5567,"hospitalized":22326,"hospitalizedDischarged":null,"dateChecked":"2021-01-09T00:00:00Z","totalTestsViral":null,"positiveTestsViral":null,"negativeTestsViral":null,"positiveCasesViral":505058,"deathConfirmed":5155,"deathProbable":412,"totalTestEncountersViral":5585041,"totalTestsPeopleViral":2901164,"totalTestsAntibody":null,"positiveTestsAntibody":null,"negativeTestsAntibody":null,"totalTestsPeopleAntibody":null,"positiveTestsPeopleAntibody":null,"negativeTestsPeopleAntibody":null,"totalTestsPeopleAntigen":null,"positiveTestsPeopleAntigen":null,"totalTestsAntigen":null,"positiveTestsAntigen":null,"fips":"55","positiveIncrease":3516,"negativeIncrease":5568,"total":2944302,"totalTestResultsIncrease":26539,"posNeg":2944240,"dataQualityGrade":null,"deathIncrease":38,"hospitalizedIncrease":120,"hash":"1a229b7db430eb4283122d065fa209ecbf9ebce2","commercialScore":0,"negativeRegularScore":0,"negativeScore":0,"positiveScore":0,"score":0,"grade":""},{"date":20210108,"state":"WI","positive":544618,"probableCases":42606,"negative":2390538,"pending":41,"totalTestResultsSource":"totalTestEncountersViral","totalTestResults":5558502,"hospitalizedCurrently":1077,"hospitalizedCumulative":22206,"inIcuCurrently":244,"inIcuCumulative":2080,"onVentilatorCurrently":null,"onVentilatorCumulative":null,"recovered":467069,"lastUpdateEt":"1/8/2021 00:00","dateModified":"2021-01-08T00:00:00Z","checkTimeEt":"01/07 19:00","death":5529,"hospitalized":22206,"hospitalizedDischarged":null,"dateChecked":"2021-01-08T00:00:00Z","totalTestsViral":null,"positiveTestsViral":null,"negativeTestsViral":null,"positiveCasesViral":502012,"deathConfirmed":5119,"deathProbable":410,"totalTestEncountersViral":5558502,"totalTestsPeopleViral":2892550,"totalTestsAntibody":null,"positiveTestsAntibody":null,"negativeTestsAntibody":null,"totalTestsPeopleAntibody":null,"positiveTestsPeopleAntibody":null,"negativeTestsPeopleAntibody":null,"totalTestsPeopleAntigen":null,"positiveTestsPeopleAntigen":null,"totalTestsAntigen":null,"positiveTestsAntigen":null,"fips":"55","positiveIncrease":4110,"negativeIncrease":7128,"total":2935197,"totalTestResultsIncrease":40683,"posNeg":2935156,"dataQualityGrade":null,"deathIncrease":52,"hospitalizedIncrease":136,"hash":"0e2b86ea71461a0a3c8abad4e267a80895259c4b","commercialScore":0,"negativeRegularScore":0,"negativeScore":0,"positiveScore":0,"score":0,"grade":""},{"date":20210107,"state":"WI","positive":540508,"probableCases":41970,"negative":2383410,"pending":64,"totalTestResultsSource":"totalTestEncountersViral","totalTestResults":5517819,"hospitalizedCurrently":1128,"hospitalizedCumulative":22070,"inIcuCurrently":243,"inIcuCumulative":2080,"onVentilatorCurrently":null,"onVentilatorCumulative":null,"recovered":464443,"lastUpdateEt":"1/7/2021 00:00","dateModified":"2021-01-07T00:00:00Z","checkTimeEt":"01/06 19:00","death":5477,"hospitalized":22070,"hospitalizedDischarged":null,"dateChecked":"2021-01-07T00:00:00Z","totalTestsViral":null,"positiveTestsViral":null,"negativeTestsViral":null,"positiveCasesViral":498538,"deathConfirmed":5079,"deathProbable":398,"totalTestEncountersViral":5517819,"totalTestsPeopleViral":2881948,"totalTestsAntibody":null,"positiveTestsAntibody":null,"negativeTestsAntibody":null,"totalTestsPeopleAntibody":null,"positiveTestsPeopleAntibody":null,"negativeTestsPeopleAntibody":null,"totalTestsPeopleAntigen":null,"positiveTestsPeopleAntigen":null,"totalTestsAntigen":null,"positiveTestsAntigen":null,"fips":"55","positiveIncrease":4509,"negativeIncrease":6357,"total":2923982,"totalTestResultsIncrease":39652,"posNeg":2923918,"dataQualityGrade":null,"deathIncrease":42,"hospitalizedIncrease":99,"hash":"432b7f566c00fd5c2f823d8b698a77496a62f226","commercialScore":0,"negativeRegularScore":0,"negativeScore":0,"positiveScore":0,"score":0,"grade":""},{"date":20210106,"state":"WI","positive":535999,"probableCases":41252,"negative":2377053,"pending":77,"totalTestResultsSource":"totalTestEncountersViral","totalTestResults":5478167,"hospitalizedCurrently":1104,"hospitalizedCumulative":21971,"inIcuCurrently":245,"inIcuCumulative":2074,"onVentilatorCurrently":null,"onVentilatorCumulative":null,"recovered":461729,"lastUpdateEt":"1/6/2021 00:00","dateModified":"2021-01-06T00:00:00Z","checkTimeEt":"01/05 19:00","death":5435,"hospitalized":21971,"hospitalizedDischarged":null,"dateChecked":"2021-01-06T00:00:00Z","totalTestsViral":null,"positiveTestsViral":null,"negativeTestsViral":null,"positiveCasesViral":494747,"deathConfirmed":5039,"deathProbable":396,"totalTestEncountersViral":5478167,"totalTestsPeopleViral":2871800,"totalTestsAntibody":null,"positiveTestsAntibody":null,"negativeTestsAntibody":null,"totalTestsPeopleAntibody":null,"positiveTestsPeopleAntibody":null,"negativeTestsPeopleAntibody":null,"totalTestsPeopleAntigen":null,"positiveTestsPeopleAntigen":null,"totalTestsAntigen":null,"positiveTestsAntigen":null,"fips":"55","positiveIncrease":4109,"negativeIncrease":6568,"total":2913129,"totalTestResultsIncrease":32470,"posNeg":2913052,"dataQualityGrade":null,"deathIncrease":69,"hospitalizedIncrease":175,"hash":"bb85e9a5fbb571ff8382dbfe0d6b650ab6481a26","commercialScore":0,"negativeRegularScore":0,"negativeScore":0,"positiveScore":0,"score":0,"grade":""},{"date":20210105,"state":"WI","positive":531890,"probableCases":40549,"negative":2370485,"pending":62,"totalTestResultsSource":"totalTestEncountersViral","totalTestResults":5445697,"hospitalizedCurrently":1123,"hospitalizedCumulative":21796,"inIcuCurrently":231,"inIcuCumulative":2066,"onVentilatorCurrently":null,"onVentilatorCumulative":null,"recovered":458650,"lastUpdateEt":"1/5/2021 00:00","dateModified":"2021-01-05T00:00:00Z","checkTimeEt":"01/04 19:00","death":5366,"hospitalized":21796,"hospitalizedDischarged":null,"dateChecked":"2021-01-05T00:00:00Z","totalTestsViral":null,"positiveTestsViral":null,"negativeTestsViral":null,"positiveCasesViral":491341,"deathConfirmed":4979,"deathProbable":387,"totalTestEncountersViral":5445697,"totalTestsPeopleViral":2861826,"totalTestsAntibody":null,"positiveTestsAntibody":null,"negativeTestsAntibody":null,"totalTestsPeopleAntibody":null,"positiveTestsPeopleAntibody":null,"negativeTestsPeopleAntibody":null,"totalTestsPeopleAntigen":null,"positiveTestsPeopleAntigen":null,"totalTestsAntigen":null,"positiveTestsAntigen":null,"fips":"55","positiveIncrease":4019,"negativeIncrease":4805,"total":2902437,"totalTestResultsIncrease":22559,"posNeg":2902375,"dataQualityGrade":null,"deathIncrease":97,"hospitalizedIncrease":216,"hash":"070ec6e27c51f103007876427c6f48d7b54044de","commercialScore":0,"negativeRegularScore":0,"negativeScore":0,"positiveScore":0,"score":0,"grade":""},{"date":20210104,"state":"WI","positive":527871,"probableCases":39933,"negative":2365680,"pending":42,"totalTestResultsSource":"totalTestEncountersViral","totalTestResults":5423138,"hospitalizedCurrently":1069,"hospitalizedCumulative":21580,"inIcuCurrently":225,"inIcuCumulative":2058,"onVentilatorCurrently":null,"onVentilatorCumulative":null,"recovered":456529,"lastUpdateEt":"1/4/2021 00:00","dateModified":"2021-01-04T00:00:00Z","checkTimeEt":"01/03 19:00","death":5269,"hospitalized":21580,"hospitalizedDischarged":null,"dateChecked":"2021-01-04T00:00:00Z","totalTestsViral":null,"positiveTestsViral":null,"negativeTestsViral":null,"positiveCasesViral":487938,"deathConfirmed":4884,"deathProbable":385,"totalTestEncountersViral":5423138,"totalTestsPeopleViral":2853618,"totalTestsAntibody":null,"positiveTestsAntibody":null,"negativeTestsAntibody":null,"totalTestsPeopleAntibody":null,"positiveTestsPeopleAntibody":null,"negativeTestsPeopleAntibody":null,"totalTestsPeopleAntigen":null,"positiveTestsPeopleAntigen":null,"totalTestsAntigen":null,"positiveTestsAntigen":null,"fips":"55","positiveIncrease":1626,"negativeIncrease":2505,"total":2893593,"totalTestResultsIncrease":12009,"posNeg":2893551,"dataQualityGrade":null,"deathIncrease":8,"hospitalizedIncrease":51,"hash":"ff550c3b3db4f4def19a507737e5dda4b20def2c","commercialScore":0,"negativeRegularScore":0,"negativeScore":0,"positiveScore":0,"score":0,"grade":""},{"date":20210103,"state":"WI","positive":526245,"probableCases":39714,"negative":2363175,"pending":68,"totalTestResultsSource":"totalTestEncountersViral","totalTestResults":5411129,"hospitalizedCurrently":1018,"hospitalizedCumulative":21529,"inIcuCurrently":230,"inIcuCumulative":2057,"onVentilatorCurrently":null,"onVentilatorCumulative":null,"recovered":454850,"lastUpdateEt":"1/3/2021 00:00","dateModified":"2021-01-03T00:00:00Z","checkTimeEt":"01/02 19:00","death":5261,"hospitalized":21529,"hospitalizedDischarged":null,"dateChecked":"2021-01-03T00:00:00Z","totalTestsViral":null,"positiveTestsViral":null,"negativeTestsViral":null,"positiveCasesViral":486531,"deathConfirmed":4875,"deathProbable":386,"totalTestEncountersViral":5411129,"totalTestsPeopleViral":2849706,"totalTestsAntibody":null,"positiveTestsAntibody":null,"negativeTestsAntibody":null,"totalTestsPeopleAntibody":null,"positiveTestsPeopleAntibody":null,"negativeTestsPeopleAntibody":null,"totalTestsPeopleAntigen":null,"positiveTestsPeopleAntigen":null,"totalTestsAntigen":null,"positiveTestsAntigen":null,"fips":"55","positiveIncrease":2593,"negativeIncrease":2142,"total":2889488,"totalTestResultsIncrease":8455,"posNeg":2889420,"dataQualityGrade":null,"deathIncrease":5,"hospitalizedIncrease":80,"hash":"aa5cb1cff80df10646fc310b5d64749acef8d163","commercialScore":0,"negativeRegularScore":0,"negativeScore":0,"positiveScore":0,"score":0,"grade":""},{"date":20210102,"state":"WI","positive":523652,"probableCases":39567,"negative":2361033,"pending":68,"totalTestResultsSource":"totalTestEncountersViral","totalTestResults":5402674,"hospitalizedCurrently":1018,"hospitalizedCumulative":21449,"inIcuCurrently":230,"inIcuCumulative":2053,"onVentilatorCurrently":null,"onVentilatorCumulative":null,"recovered":452502,"lastUpdateEt":"1/2/2021 00:00","dateModified":"2021-01-02T00:00:00Z","checkTimeEt":"01/01 19:00","death":5256,"hospitalized":21449,"hospitalizedDischarged":null,"dateChecked":"2021-01-02T00:00:00Z","totalTestsViral":null,"positiveTestsViral":null,"negativeTestsViral":null,"positiveCasesViral":484085,"deathConfirmed":4870,"deathProbable":386,"totalTestEncountersViral":5402674,"totalTestsPeopleViral":2845118,"totalTestsAntibody":null,"positiveTestsAntibody":null,"negativeTestsAntibody":null,"totalTestsPeopleAntibody":null,"positiveTestsPeopleAntibody":null,"negativeTestsPeopleAntibody":null,"totalTestsPeopleAntigen":null,"positiveTestsPeopleAntigen":null,"totalTestsAntigen":null,"positiveTestsAntigen":null,"fips":"55","positiveIncrease":1129,"negativeIncrease":3976,"total":2884753,"totalTestResultsIncrease":21846,"posNeg":2884685,"dataQualityGrade":null,"deathIncrease":2,"hospitalizedIncrease":49,"hash":"546630ddb895c394daf4256f71c4bb94ce53b260","commercialScore":0,"negativeRegularScore":0,"negativeScore":0,"positiveScore":0,"score":0,"grade":""},{"date":20210101,"state":"WI","positive":522523,"probableCases":39516,"negative":2357057,"pending":58,"totalTestResultsSource":"totalTestEncountersViral","totalTestResults":5380828,"hospitalizedCurrently":1074,"hospitalizedCumulative":21400,"inIcuCurrently":244,"inIcuCumulative":2051,"onVentilatorCurrently":null,"onVentilatorCumulative":null,"recovered":450358,"lastUpdateEt":"1/1/2021 00:00","dateModified":"2021-01-01T00:00:00Z","checkTimeEt":"12/31 19:00","death":5254,"hospitalized":21400,"hospitalizedDischarged":null,"dateChecked":"2021-01-01T00:00:00Z","totalTestsViral":null,"positiveTestsViral":null,"negativeTestsViral":null,"positiveCasesViral":483007,"deathConfirmed":4869,"deathProbable":385,"totalTestEncountersViral":5380828,"totalTestsPeopleViral":2840064,"totalTestsAntibody":null,"positiveTestsAntibody":null,"negativeTestsAntibody":null,"totalTestsPeopleAntibody":null,"positiveTestsPeopleAntibody":null,"negativeTestsPeopleAntibody":null,"totalTestsPeopleAntigen":null,"positiveTestsPeopleAntigen":null,"totalTestsAntigen":null,"positiveTestsAntigen":null,"fips":"55","positiveIncrease":2085,"negativeIncrease":6388,"total":2879638,"totalTestResultsIncrease":32340,"posNeg":2879580,"dataQualityGrade":null,"deathIncrease":12,"hospitalizedIncrease":50,"hash":"15ea8c8b0ef46a0893e8b3e1bb15b79388e42afa","commercialScore":0,"negativeRegularScore":0,"negativeScore":0,"positiveScore":0,"score":0,"grade":""},{"date":20201231,"state":"WI","positive":520438,"probableCases":39366,"negative":2350669,"pending":58,"totalTestResultsSource":"totalTestEncountersViral","totalTestResults":5348488,"hospitalizedCurrently":1074,"hospitalizedCumulative":21350,"inIcuCurrently":244,"inIcuCumulative":2049,"onVentilatorCurrently":null,"onVentilatorCumulative":null,"recovered":447500,"lastUpdateEt":"12/31/2020 00:00","dateModified":"2020-12-31T00:00:00Z","checkTimeEt":"12/30 19:00","death":5242,"hospitalized":21350,"hospitalizedDischarged":null,"dateChecked":"2020-12-31T00:00:00Z","totalTestsViral":null,"positiveTestsViral":null,"negativeTestsViral":null,"positiveCasesViral":481102,"deathConfirmed":4859,"deathProbable":383,"totalTestEncountersViral":5348488,"totalTestsPeopleViral":2831771,"totalTestsAntibody":null,"positiveTestsAntibody":null,"negativeTestsAntibody":null,"totalTestsPeopleAntibody":null,"positiveTestsPeopleAntibody":null,"negativeTestsPeopleAntibody":null,"totalTestsPeopleAntigen":null,"positiveTestsPeopleAntigen":null,"totalTestsAntigen":null,"positiveTestsAntigen":null,"fips":"55","positiveIncrease":4212,"negativeIncrease":5898,"total":2871165,"totalTestResultsIncrease":39680,"posNeg":2871107,"dataQualityGrade":null,"deathIncrease":50,"hospitalizedIncrease":143,"hash":"1d1145373d1c6dcf02fafffce15746964c7e5433","commercialScore":0,"negativeRegularScore":0,"negativeScore":0,"positiveScore":0,"score":0,"grade":""},{"date":20201230,"state":"WI","positive":516226,"probableCases":38934,"negative":2344771,"pending":58,"totalTestResultsSource":"totalTestEncountersViral","totalTestResults":5308808,"hospitalizedCurrently":1074,"hospitalizedCumulative":21207,"inIcuCurrently":244,"inIcuCumulative":2034,"onVentilatorCurrently":null,"onVentilatorCumulative":null,"recovered":444609,"lastUpdateEt":"12/30/2020 00:00","dateModified":"2020-12-30T00:00:00Z","checkTimeEt":"12/29 19:00","death":5192,"hospitalized":21207,"hospitalizedDischarged":null,"dateChecked":"2020-12-30T00:00:00Z","totalTestsViral":null,"positiveTestsViral":null,"negativeTestsViral":null,"positiveCasesViral":477292,"deathConfirmed":4818,"deathProbable":374,"totalTestEncountersViral":5308808,"totalTestsPeopleViral":2822063,"totalTestsAntibody":null,"positiveTestsAntibody":null,"negativeTestsAntibody":null,"totalTestsPeopleAntibody":null,"positiveTestsPeopleAntibody":null,"negativeTestsPeopleAntibody":null,"totalTestsPeopleAntigen":null,"positiveTestsPeopleAntigen":null,"totalTestsAntigen":null,"positiveTestsAntigen":null,"fips":"55","positiveIncrease":3170,"negativeIncrease":4607,"total":2861055,"totalTestResultsIncrease":25493,"posNeg":2860997,"dataQualityGrade":null,"deathIncrease":40,"hospitalizedIncrease":126,"hash":"bc518f796ac6620d91b9f6086d766d2caebb46c8","commercialScore":0,"negativeRegularScore":0,"negativeScore":0,"positiveScore":0,"score":0,"grade":""},{"date":20201229,"state":"WI","positive":513056,"probableCases":38519,"negative":2340164,"pending":72,"totalTestResultsSource":"totalTestEncountersViral","totalTestResults":5283315,"hospitalizedCurrently":1082,"hospitalizedCumulative":21081,"inIcuCurrently":249,"inIcuCumulative":2031,"onVentilatorCurrently":null,"onVentilatorCumulative":null,"recovered":440857,"lastUpdateEt":"12/29/2020 00:00","dateModified":"2020-12-29T00:00:00Z","checkTimeEt":"12/28 19:00","death":5152,"hospitalized":21081,"hospitalizedDischarged":null,"dateChecked":"2020-12-29T00:00:00Z","totalTestsViral":null,"positiveTestsViral":null,"negativeTestsViral":null,"positiveCasesViral":474537,"deathConfirmed":4783,"deathProbable":369,"totalTestEncountersViral":5283315,"totalTestsPeopleViral":2814701,"totalTestsAntibody":null,"positiveTestsAntibody":null,"negativeTestsAntibody":null,"totalTestsPeopleAntibody":null,"positiveTestsPeopleAntibody":null,"negativeTestsPeopleAntibody":null,"totalTestsPeopleAntigen":null,"positiveTestsPeopleAntigen":null,"totalTestsAntigen":null,"positiveTestsAntigen":null,"fips":"55","positiveIncrease":2919,"negativeIncrease":3633,"total":2853292,"totalTestResultsIncrease":17549,"posNeg":2853220,"dataQualityGrade":null,"deathIncrease":92,"hospitalizedIncrease":170,"hash":"593438252875ed65da8de2322d083eefa574687c","commercialScore":0,"negativeRegularScore":0,"negativeScore":0,"positiveScore":0,"score":0,"grade":""},{"date":20201228,"state":"WI","positive":510137,"probableCases":37984,"negative":2336531,"pending":62,"totalTestResultsSource":"totalTestEncountersViral","totalTestResults":5265766,"hospitalizedCurrently":1113,"hospitalizedCumulative":20911,"inIcuCurrently":237,"inIcuCumulative":2021,"onVentilatorCurrently":null,"onVentilatorCumulative":null,"recovered":438394,"lastUpdateEt":"12/28/2020 00:00","dateModified":"2020-12-28T00:00:00Z","checkTimeEt":"12/27 19:00","death":5060,"hospitalized":20911,"hospitalizedDischarged":null,"dateChecked":"2020-12-28T00:00:00Z","totalTestsViral":null,"positiveTestsViral":null,"negativeTestsViral":null,"positiveCasesViral":472153,"deathConfirmed":4711,"deathProbable":349,"totalTestEncountersViral":5265766,"totalTestsPeopleViral":2808684,"totalTestsAntibody":null,"positiveTestsAntibody":null,"negativeTestsAntibody":null,"totalTestsPeopleAntibody":null,"positiveTestsPeopleAntibody":null,"negativeTestsPeopleAntibody":null,"totalTestsPeopleAntigen":null,"positiveTestsPeopleAntigen":null,"totalTestsAntigen":null,"positiveTestsAntigen":null,"fips":"55","positiveIncrease":1557,"negativeIncrease":3836,"total":2846730,"totalTestResultsIncrease":13074,"posNeg":2846668,"dataQualityGrade":null,"deathIncrease":21,"hospitalizedIncrease":82,"hash":"03b4dfe1b54281fc3e937b4fd466428b2defe82c","commercialScore":0,"negativeRegularScore":0,"negativeScore":0,"positiveScore":0,"score":0,"grade":""},{"date":20201227,"state":"WI","positive":508580,"probableCases":37762,"negative":2332695,"pending":35,"totalTestResultsSource":"totalTestEncountersViral","totalTestResults":5252692,"hospitalizedCurrently":1089,"hospitalizedCumulat