[{"date":20210307,"state":"WY","positive":54764,"probableCases":8367,"negative":182264,"pending":null,"totalTestResultsSource":"totalTestsViral","totalTestResults":649293,"hospitalizedCurrently":21,"hospitalizedCumulative":1391,"inIcuCurrently":null,"inIcuCumulative":null,"onVentilatorCurrently":null,"onVentilatorCumulative":null,"recovered":53550,"lastUpdateEt":"3/5/2021 00:00","dateModified":"2021-03-05T00:00:00Z","checkTimeEt":"03/04 19:00","death":682,"hospitalized":1391,"hospitalizedDischarged":null,"dateChecked":"2021-03-05T00:00:00Z","totalTestsViral":649293,"positiveTestsViral":38993,"negativeTestsViral":602513,"positiveCasesViral":46397,"deathConfirmed":null,"deathProbable":null,"totalTestEncountersViral":null,"totalTestsPeopleViral":228661,"totalTestsAntibody":null,"positiveTestsAntibody":null,"negativeTestsAntibody":null,"totalTestsPeopleAntibody":null,"positiveTestsPeopleAntibody":null,"negativeTestsPeopleAntibody":null,"totalTestsPeopleAntigen":null,"positiveTestsPeopleAntigen":null,"totalTestsAntigen":null,"positiveTestsAntigen":null,"fips":"56","positiveIncrease":0,"negativeIncrease":0,"total":237028,"totalTestResultsIncrease":0,"posNeg":237028,"dataQualityGrade":null,"deathIncrease":0,"hospitalizedIncrease":0,"hash":"9cbc8bdcabbaf1f301ec1e48f8c23a4c65753282","commercialScore":0,"negativeRegularScore":0,"negativeScore":0,"positiveScore":0,"score":0,"grade":""},{"date":20210306,"state":"WY","positive":54764,"probableCases":8367,"negative":182264,"pending":null,"totalTestResultsSource":"totalTestsViral","totalTestResults":649293,"hospitalizedCurrently":21,"hospitalizedCumulative":1391,"inIcuCurrently":null,"inIcuCumulative":null,"onVentilatorCurrently":null,"onVentilatorCumulative":null,"recovered":53550,"lastUpdateEt":"3/5/2021 00:00","dateModified":"2021-03-05T00:00:00Z","checkTimeEt":"03/04 19:00","death":682,"hospitalized":1391,"hospitalizedDischarged":null,"dateChecked":"2021-03-05T00:00:00Z","totalTestsViral":649293,"positiveTestsViral":38993,"negativeTestsViral":602513,"positiveCasesViral":46397,"deathConfirmed":null,"deathProbable":null,"totalTestEncountersViral":null,"totalTestsPeopleViral":228661,"totalTestsAntibody":null,"positiveTestsAntibody":null,"negativeTestsAntibody":null,"totalTestsPeopleAntibody":null,"positiveTestsPeopleAntibody":null,"negativeTestsPeopleAntibody":null,"totalTestsPeopleAntigen":null,"positiveTestsPeopleAntigen":null,"totalTestsAntigen":null,"positiveTestsAntigen":null,"fips":"56","positiveIncrease":0,"negativeIncrease":0,"total":237028,"totalTestResultsIncrease":0,"posNeg":237028,"dataQualityGrade":null,"deathIncrease":0,"hospitalizedIncrease":0,"hash":"1c663524ab25a7f876788a0a2e4dc12a0026ecbd","commercialScore":0,"negativeRegularScore":0,"negativeScore":0,"positiveScore":0,"score":0,"grade":""},{"date":20210305,"state":"WY","positive":54764,"probableCases":8367,"negative":182264,"pending":null,"totalTestResultsSource":"totalTestsViral","totalTestResults":649293,"hospitalizedCurrently":21,"hospitalizedCumulative":1391,"inIcuCurrently":null,"inIcuCumulative":null,"onVentilatorCurrently":null,"onVentilatorCumulative":null,"recovered":53550,"lastUpdateEt":"3/5/2021 00:00","dateModified":"2021-03-05T00:00:00Z","checkTimeEt":"03/04 19:00","death":682,"hospitalized":1391,"hospitalizedDischarged":null,"dateChecked":"2021-03-05T00:00:00Z","totalTestsViral":649293,"positiveTestsViral":38993,"negativeTestsViral":602513,"positiveCasesViral":46397,"deathConfirmed":null,"deathProbable":null,"totalTestEncountersViral":null,"totalTestsPeopleViral":228661,"totalTestsAntibody":null,"positiveTestsAntibody":null,"negativeTestsAntibody":null,"totalTestsPeopleAntibody":null,"positiveTestsPeopleAntibody":null,"negativeTestsPeopleAntibody":null,"totalTestsPeopleAntigen":null,"positiveTestsPeopleAntigen":null,"totalTestsAntigen":null,"positiveTestsAntigen":null,"fips":"56","positiveIncrease":79,"negativeIncrease":307,"total":237028,"totalTestResultsIncrease":3114,"posNeg":237028,"dataQualityGrade":null,"deathIncrease":0,"hospitalizedIncrease":2,"hash":"0bb724dd37746ba6f6cf1a322600bb0cd13b4d98","commercialScore":0,"negativeRegularScore":0,"negativeScore":0,"positiveScore":0,"score":0,"grade":""},{"date":20210304,"state":"WY","positive":54685,"probableCases":8357,"negative":181957,"pending":null,"totalTestResultsSource":"totalTestsViral","totalTestResults":646179,"hospitalizedCurrently":23,"hospitalizedCumulative":1389,"inIcuCurrently":null,"inIcuCumulative":null,"onVentilatorCurrently":null,"onVentilatorCumulative":null,"recovered":53481,"lastUpdateEt":"3/4/2021 00:00","dateModified":"2021-03-04T00:00:00Z","checkTimeEt":"03/03 19:00","death":682,"hospitalized":1389,"hospitalizedDischarged":null,"dateChecked":"2021-03-04T00:00:00Z","totalTestsViral":646179,"positiveTestsViral":38946,"negativeTestsViral":599452,"positiveCasesViral":46328,"deathConfirmed":null,"deathProbable":null,"totalTestEncountersViral":null,"totalTestsPeopleViral":228285,"totalTestsAntibody":null,"positiveTestsAntibody":null,"negativeTestsAntibody":null,"totalTestsPeopleAntibody":null,"positiveTestsPeopleAntibody":null,"negativeTestsPeopleAntibody":null,"totalTestsPeopleAntigen":null,"positiveTestsPeopleAntigen":null,"totalTestsAntigen":null,"positiveTestsAntigen":null,"fips":"56","positiveIncrease":69,"negativeIncrease":276,"total":236642,"totalTestResultsIncrease":2703,"posNeg":236642,"dataQualityGrade":null,"deathIncrease":0,"hospitalizedIncrease":1,"hash":"bafad46ba8420fbbba342b4739be877ac62c0050","commercialScore":0,"negativeRegularScore":0,"negativeScore":0,"positiveScore":0,"score":0,"grade":""},{"date":20210303,"state":"WY","positive":54616,"probableCases":8348,"negative":181681,"pending":null,"totalTestResultsSource":"totalTestsViral","totalTestResults":643476,"hospitalizedCurrently":24,"hospitalizedCumulative":1388,"inIcuCurrently":null,"inIcuCumulative":null,"onVentilatorCurrently":null,"onVentilatorCumulative":null,"recovered":53375,"lastUpdateEt":"3/3/2021 00:00","dateModified":"2021-03-03T00:00:00Z","checkTimeEt":"03/02 19:00","death":682,"hospitalized":1388,"hospitalizedDischarged":null,"dateChecked":"2021-03-03T00:00:00Z","totalTestsViral":643476,"positiveTestsViral":38905,"negativeTestsViral":596799,"positiveCasesViral":46268,"deathConfirmed":null,"deathProbable":null,"totalTestEncountersViral":null,"totalTestsPeopleViral":227949,"totalTestsAntibody":null,"positiveTestsAntibody":null,"negativeTestsAntibody":null,"totalTestsPeopleAntibody":null,"positiveTestsPeopleAntibody":null,"negativeTestsPeopleAntibody":null,"totalTestsPeopleAntigen":null,"positiveTestsPeopleAntigen":null,"totalTestsAntigen":null,"positiveTestsAntigen":null,"fips":"56","positiveIncrease":89,"negativeIncrease":278,"total":236297,"totalTestResultsIncrease":2096,"posNeg":236297,"dataQualityGrade":null,"deathIncrease":0,"hospitalizedIncrease":3,"hash":"716c8498948f8b7ab25227b0beb294adcacf307a","commercialScore":0,"negativeRegularScore":0,"negativeScore":0,"positiveScore":0,"score":0,"grade":""},{"date":20210302,"state":"WY","positive":54527,"probableCases":8337,"negative":181403,"pending":null,"totalTestResultsSource":"totalTestsViral","totalTestResults":641380,"hospitalizedCurrently":24,"hospitalizedCumulative":1385,"inIcuCurrently":null,"inIcuCumulative":null,"onVentilatorCurrently":null,"onVentilatorCumulative":null,"recovered":53339,"lastUpdateEt":"3/2/2021 00:00","dateModified":"2021-03-02T00:00:00Z","checkTimeEt":"03/01 19:00","death":682,"hospitalized":1385,"hospitalizedDischarged":null,"dateChecked":"2021-03-02T00:00:00Z","totalTestsViral":641380,"positiveTestsViral":38847,"negativeTestsViral":594768,"positiveCasesViral":46190,"deathConfirmed":null,"deathProbable":null,"totalTestEncountersViral":null,"totalTestsPeopleViral":227593,"totalTestsAntibody":null,"positiveTestsAntibody":null,"negativeTestsAntibody":null,"totalTestsPeopleAntibody":null,"positiveTestsPeopleAntibody":null,"negativeTestsPeopleAntibody":null,"totalTestsPeopleAntigen":null,"positiveTestsPeopleAntigen":null,"totalTestsAntigen":null,"positiveTestsAntigen":null,"fips":"56","positiveIncrease":56,"negativeIncrease":207,"total":235930,"totalTestResultsIncrease":786,"posNeg":235930,"dataQualityGrade":null,"deathIncrease":11,"hospitalizedIncrease":1,"hash":"76fff3d29fa6c93bfd938e380e3ea483f561a7b8","commercialScore":0,"negativeRegularScore":0,"negativeScore":0,"positiveScore":0,"score":0,"grade":""},{"date":20210301,"state":"WY","positive":54471,"probableCases":8324,"negative":181196,"pending":null,"totalTestResultsSource":"totalTestsViral","totalTestResults":640594,"hospitalizedCurrently":28,"hospitalizedCumulative":1384,"inIcuCurrently":null,"inIcuCumulative":null,"onVentilatorCurrently":null,"onVentilatorCumulative":null,"recovered":53248,"lastUpdateEt":"3/1/2021 00:00","dateModified":"2021-03-01T00:00:00Z","checkTimeEt":"02/28 19:00","death":671,"hospitalized":1384,"hospitalizedDischarged":null,"dateChecked":"2021-03-01T00:00:00Z","totalTestsViral":640594,"positiveTestsViral":38827,"negativeTestsViral":594005,"positiveCasesViral":46147,"deathConfirmed":null,"deathProbable":null,"totalTestEncountersViral":null,"totalTestsPeopleViral":227343,"totalTestsAntibody":null,"positiveTestsAntibody":null,"negativeTestsAntibody":null,"totalTestsPeopleAntibody":null,"positiveTestsPeopleAntibody":null,"negativeTestsPeopleAntibody":null,"totalTestsPeopleAntigen":null,"positiveTestsPeopleAntigen":null,"totalTestsAntigen":null,"positiveTestsAntigen":null,"fips":"56","positiveIncrease":77,"negativeIncrease":370,"total":235667,"totalTestResultsIncrease":3878,"posNeg":235667,"dataQualityGrade":null,"deathIncrease":0,"hospitalizedIncrease":2,"hash":"22c0594820e39b5eb6dbff2eeffaf0872d5123c5","commercialScore":0,"negativeRegularScore":0,"negativeScore":0,"positiveScore":0,"score":0,"grade":""},{"date":20210228,"state":"WY","positive":54394,"probableCases":8318,"negative":180826,"pending":null,"totalTestResultsSource":"totalTestsViral","totalTestResults":636716,"hospitalizedCurrently":25,"hospitalizedCumulative":1382,"inIcuCurrently":null,"inIcuCumulative":null,"onVentilatorCurrently":null,"onVentilatorCumulative":null,"recovered":53132,"lastUpdateEt":"2/28/2021 00:00","dateModified":"2021-02-28T00:00:00Z","checkTimeEt":"02/27 19:00","death":671,"hospitalized":1382,"hospitalizedDischarged":null,"dateChecked":"2021-02-28T00:00:00Z","totalTestsViral":636716,"positiveTestsViral":38734,"negativeTestsViral":590006,"positiveCasesViral":46076,"deathConfirmed":null,"deathProbable":null,"totalTestEncountersViral":null,"totalTestsPeopleViral":226870,"totalTestsAntibody":null,"positiveTestsAntibody":null,"negativeTestsAntibody":null,"totalTestsPeopleAntibody":null,"positiveTestsPeopleAntibody":null,"negativeTestsPeopleAntibody":null,"totalTestsPeopleAntigen":null,"positiveTestsPeopleAntigen":null,"totalTestsAntigen":null,"positiveTestsAntigen":null,"fips":"56","positiveIncrease":44,"negativeIncrease":0,"total":235220,"totalTestResultsIncrease":0,"posNeg":235220,"dataQualityGrade":null,"deathIncrease":0,"hospitalizedIncrease":1,"hash":"982a303a24c06c94955ee7e070b80e2db2db381d","commercialScore":0,"negativeRegularScore":0,"negativeScore":0,"positiveScore":0,"score":0,"grade":""},{"date":20210227,"state":"WY","positive":54350,"probableCases":8306,"negative":180826,"pending":null,"totalTestResultsSource":"totalTestsViral","totalTestResults":636716,"hospitalizedCurrently":25,"hospitalizedCumulative":1381,"inIcuCurrently":null,"inIcuCumulative":null,"onVentilatorCurrently":null,"onVentilatorCumulative":null,"recovered":52998,"lastUpdateEt":"2/26/2021 00:00","dateModified":"2021-02-26T00:00:00Z","checkTimeEt":"02/25 19:00","death":671,"hospitalized":1381,"hospitalizedDischarged":null,"dateChecked":"2021-02-26T00:00:00Z","totalTestsViral":636716,"positiveTestsViral":38734,"negativeTestsViral":590006,"positiveCasesViral":46044,"deathConfirmed":null,"deathProbable":null,"totalTestEncountersViral":null,"totalTestsPeopleViral":226870,"totalTestsAntibody":null,"positiveTestsAntibody":null,"negativeTestsAntibody":null,"totalTestsPeopleAntibody":null,"positiveTestsPeopleAntibody":null,"negativeTestsPeopleAntibody":null,"totalTestsPeopleAntigen":null,"positiveTestsPeopleAntigen":null,"totalTestsAntigen":null,"positiveTestsAntigen":null,"fips":"56","positiveIncrease":0,"negativeIncrease":0,"total":235176,"totalTestResultsIncrease":0,"posNeg":235176,"dataQualityGrade":null,"deathIncrease":0,"hospitalizedIncrease":0,"hash":"1ecfc50f307fa3847adfb8bc0c2c0afb8567a13c","commercialScore":0,"negativeRegularScore":0,"negativeScore":0,"positiveScore":0,"score":0,"grade":""},{"date":20210226,"state":"WY","positive":54350,"probableCases":8306,"negative":180826,"pending":null,"totalTestResultsSource":"totalTestsViral","totalTestResults":636716,"hospitalizedCurrently":25,"hospitalizedCumulative":1381,"inIcuCurrently":null,"inIcuCumulative":null,"onVentilatorCurrently":null,"onVentilatorCumulative":null,"recovered":52998,"lastUpdateEt":"2/26/2021 00:00","dateModified":"2021-02-26T00:00:00Z","checkTimeEt":"02/25 19:00","death":671,"hospitalized":1381,"hospitalizedDischarged":null,"dateChecked":"2021-02-26T00:00:00Z","totalTestsViral":636716,"positiveTestsViral":38734,"negativeTestsViral":590006,"positiveCasesViral":46044,"deathConfirmed":null,"deathProbable":null,"totalTestEncountersViral":null,"totalTestsPeopleViral":226870,"totalTestsAntibody":null,"positiveTestsAntibody":null,"negativeTestsAntibody":null,"totalTestsPeopleAntibody":null,"positiveTestsPeopleAntibody":null,"negativeTestsPeopleAntibody":null,"totalTestsPeopleAntigen":null,"positiveTestsPeopleAntigen":null,"totalTestsAntigen":null,"positiveTestsAntigen":null,"fips":"56","positiveIncrease":148,"negativeIncrease":358,"total":235176,"totalTestResultsIncrease":3090,"posNeg":235176,"dataQualityGrade":null,"deathIncrease":0,"hospitalizedIncrease":4,"hash":"64d18c3e8cf78e5f534cb11416a641c05384a49a","commercialScore":0,"negativeRegularScore":0,"negativeScore":0,"positiveScore":0,"score":0,"grade":""},{"date":20210225,"state":"WY","positive":54202,"probableCases":8277,"negative":180468,"pending":null,"totalTestResultsSource":"totalTestsViral","totalTestResults":633626,"hospitalizedCurrently":20,"hospitalizedCumulative":1377,"inIcuCurrently":null,"inIcuCumulative":null,"onVentilatorCurrently":null,"onVentilatorCumulative":null,"recovered":52879,"lastUpdateEt":"2/25/2021 00:00","dateModified":"2021-02-25T00:00:00Z","checkTimeEt":"02/24 19:00","death":671,"hospitalized":1377,"hospitalizedDischarged":null,"dateChecked":"2021-02-25T00:00:00Z","totalTestsViral":633626,"positiveTestsViral":38686,"negativeTestsViral":586971,"positiveCasesViral":45925,"deathConfirmed":null,"deathProbable":null,"totalTestEncountersViral":null,"totalTestsPeopleViral":226393,"totalTestsAntibody":null,"positiveTestsAntibody":null,"negativeTestsAntibody":null,"totalTestsPeopleAntibody":null,"positiveTestsPeopleAntibody":null,"negativeTestsPeopleAntibody":null,"totalTestsPeopleAntigen":null,"positiveTestsPeopleAntigen":null,"totalTestsAntigen":null,"positiveTestsAntigen":null,"fips":"56","positiveIncrease":214,"negativeIncrease":240,"total":234670,"totalTestResultsIncrease":3788,"posNeg":234670,"dataQualityGrade":null,"deathIncrease":0,"hospitalizedIncrease":3,"hash":"19d068d31678f424ea7f838ba939c938883f8d02","commercialScore":0,"negativeRegularScore":0,"negativeScore":0,"positiveScore":0,"score":0,"grade":""},{"date":20210224,"state":"WY","positive":53988,"probableCases":8187,"negative":180228,"pending":null,"totalTestResultsSource":"totalTestsViral","totalTestResults":629838,"hospitalizedCurrently":25,"hospitalizedCumulative":1374,"inIcuCurrently":null,"inIcuCumulative":null,"onVentilatorCurrently":null,"onVentilatorCumulative":null,"recovered":52679,"lastUpdateEt":"2/24/2021 00:00","dateModified":"2021-02-24T00:00:00Z","checkTimeEt":"02/23 19:00","death":671,"hospitalized":1374,"hospitalizedDischarged":null,"dateChecked":"2021-02-24T00:00:00Z","totalTestsViral":629838,"positiveTestsViral":38597,"negativeTestsViral":583283,"positiveCasesViral":45801,"deathConfirmed":null,"deathProbable":null,"totalTestEncountersViral":null,"totalTestsPeopleViral":226029,"totalTestsAntibody":null,"positiveTestsAntibody":null,"negativeTestsAntibody":null,"totalTestsPeopleAntibody":null,"positiveTestsPeopleAntibody":null,"negativeTestsPeopleAntibody":null,"totalTestsPeopleAntigen":null,"positiveTestsPeopleAntigen":null,"totalTestsAntigen":null,"positiveTestsAntigen":null,"fips":"56","positiveIncrease":44,"negativeIncrease":797,"total":234216,"totalTestResultsIncrease":4802,"posNeg":234216,"dataQualityGrade":null,"deathIncrease":0,"hospitalizedIncrease":1,"hash":"76ad8e4233c919a03e85ddd982edac30140b8910","commercialScore":0,"negativeRegularScore":0,"negativeScore":0,"positiveScore":0,"score":0,"grade":""},{"date":20210223,"state":"WY","positive":53944,"probableCases":8164,"negative":179431,"pending":null,"totalTestResultsSource":"totalTestsViral","totalTestResults":625036,"hospitalizedCurrently":21,"hospitalizedCumulative":1373,"inIcuCurrently":null,"inIcuCumulative":null,"onVentilatorCurrently":null,"onVentilatorCumulative":null,"recovered":52668,"lastUpdateEt":"2/23/2021 00:00","dateModified":"2021-02-23T00:00:00Z","checkTimeEt":"02/22 19:00","death":671,"hospitalized":1373,"hospitalizedDischarged":null,"dateChecked":"2021-02-23T00:00:00Z","totalTestsViral":625036,"positiveTestsViral":38552,"negativeTestsViral":581297,"positiveCasesViral":45780,"deathConfirmed":null,"deathProbable":null,"totalTestEncountersViral":null,"totalTestsPeopleViral":225177,"totalTestsAntibody":null,"positiveTestsAntibody":null,"negativeTestsAntibody":null,"totalTestsPeopleAntibody":null,"positiveTestsPeopleAntibody":null,"negativeTestsPeopleAntibody":null,"totalTestsPeopleAntigen":null,"positiveTestsPeopleAntigen":null,"totalTestsAntigen":null,"positiveTestsAntigen":null,"fips":"56","positiveIncrease":44,"negativeIncrease":0,"total":233375,"totalTestResultsIncrease":0,"posNeg":233375,"dataQualityGrade":null,"deathIncrease":9,"hospitalizedIncrease":1,"hash":"895bd2a53dd024230de8f5c78f1c1e36cb105611","commercialScore":0,"negativeRegularScore":0,"negativeScore":0,"positiveScore":0,"score":0,"grade":""},{"date":20210222,"state":"WY","positive":53900,"probableCases":8154,"negative":179431,"pending":null,"totalTestResultsSource":"totalTestsViral","totalTestResults":625036,"hospitalizedCurrently":21,"hospitalizedCumulative":1372,"inIcuCurrently":null,"inIcuCumulative":null,"onVentilatorCurrently":null,"onVentilatorCumulative":null,"recovered":52567,"lastUpdateEt":"2/22/2021 00:00","dateModified":"2021-02-22T00:00:00Z","checkTimeEt":"02/21 19:00","death":662,"hospitalized":1372,"hospitalizedDischarged":null,"dateChecked":"2021-02-22T00:00:00Z","totalTestsViral":625036,"positiveTestsViral":38508,"negativeTestsViral":578588,"positiveCasesViral":45746,"deathConfirmed":null,"deathProbable":null,"totalTestEncountersViral":null,"totalTestsPeopleViral":225177,"totalTestsAntibody":null,"positiveTestsAntibody":null,"negativeTestsAntibody":null,"totalTestsPeopleAntibody":null,"positiveTestsPeopleAntibody":null,"negativeTestsPeopleAntibody":null,"totalTestsPeopleAntigen":null,"positiveTestsPeopleAntigen":null,"totalTestsAntigen":null,"positiveTestsAntigen":null,"fips":"56","positiveIncrease":105,"negativeIncrease":783,"total":233331,"totalTestResultsIncrease":4648,"posNeg":233331,"dataQualityGrade":null,"deathIncrease":0,"hospitalizedIncrease":3,"hash":"6c216800443d9c8671037da3f07470bc0eb6428d","commercialScore":0,"negativeRegularScore":0,"negativeScore":0,"positiveScore":0,"score":0,"grade":""},{"date":20210221,"state":"WY","positive":53795,"probableCases":8142,"negative":178648,"pending":null,"totalTestResultsSource":"totalTestsViral","totalTestResults":620388,"hospitalizedCurrently":31,"hospitalizedCumulative":1369,"inIcuCurrently":null,"inIcuCumulative":null,"onVentilatorCurrently":null,"onVentilatorCumulative":null,"recovered":52431,"lastUpdateEt":"2/21/2021 00:00","dateModified":"2021-02-21T00:00:00Z","checkTimeEt":"02/20 19:00","death":662,"hospitalized":1369,"hospitalizedDischarged":null,"dateChecked":"2021-02-21T00:00:00Z","totalTestsViral":620388,"positiveTestsViral":38351,"negativeTestsViral":574121,"positiveCasesViral":45653,"deathConfirmed":null,"deathProbable":null,"totalTestEncountersViral":null,"totalTestsPeopleViral":224231,"totalTestsAntibody":null,"positiveTestsAntibody":null,"negativeTestsAntibody":null,"totalTestsPeopleAntibody":null,"positiveTestsPeopleAntibody":null,"negativeTestsPeopleAntibody":null,"totalTestsPeopleAntigen":null,"positiveTestsPeopleAntigen":null,"totalTestsAntigen":null,"positiveTestsAntigen":null,"fips":"56","positiveIncrease":112,"negativeIncrease":0,"total":232443,"totalTestResultsIncrease":0,"posNeg":232443,"dataQualityGrade":null,"deathIncrease":0,"hospitalizedIncrease":2,"hash":"b9bb9c6fed22c0b23ab0cd2ddf0f1538bcc11b20","commercialScore":0,"negativeRegularScore":0,"negativeScore":0,"positiveScore":0,"score":0,"grade":""},{"date":20210220,"state":"WY","positive":53683,"probableCases":8100,"negative":178648,"pending":null,"totalTestResultsSource":"totalTestsViral","totalTestResults":620388,"hospitalizedCurrently":31,"hospitalizedCumulative":1367,"inIcuCurrently":null,"inIcuCumulative":null,"onVentilatorCurrently":null,"onVentilatorCumulative":null,"recovered":52259,"lastUpdateEt":"2/19/2021 00:00","dateModified":"2021-02-19T00:00:00Z","checkTimeEt":"02/18 19:00","death":662,"hospitalized":1367,"hospitalizedDischarged":null,"dateChecked":"2021-02-19T00:00:00Z","totalTestsViral":620388,"positiveTestsViral":38351,"negativeTestsViral":574121,"positiveCasesViral":45583,"deathConfirmed":null,"deathProbable":null,"totalTestEncountersViral":null,"totalTestsPeopleViral":224231,"totalTestsAntibody":null,"positiveTestsAntibody":null,"negativeTestsAntibody":null,"totalTestsPeopleAntibody":null,"positiveTestsPeopleAntibody":null,"negativeTestsPeopleAntibody":null,"totalTestsPeopleAntigen":null,"positiveTestsPeopleAntigen":null,"totalTestsAntigen":null,"positiveTestsAntigen":null,"fips":"56","positiveIncrease":0,"negativeIncrease":0,"total":232331,"totalTestResultsIncrease":0,"posNeg":232331,"dataQualityGrade":null,"deathIncrease":0,"hospitalizedIncrease":0,"hash":"31b330aac593c503b49863bf773a1580f1a615f5","commercialScore":0,"negativeRegularScore":0,"negativeScore":0,"positiveScore":0,"score":0,"grade":""},{"date":20210219,"state":"WY","positive":53683,"probableCases":8100,"negative":178648,"pending":null,"totalTestResultsSource":"totalTestsViral","totalTestResults":620388,"hospitalizedCurrently":31,"hospitalizedCumulative":1367,"inIcuCurrently":null,"inIcuCumulative":null,"onVentilatorCurrently":null,"onVentilatorCumulative":null,"recovered":52259,"lastUpdateEt":"2/19/2021 00:00","dateModified":"2021-02-19T00:00:00Z","checkTimeEt":"02/18 19:00","death":662,"hospitalized":1367,"hospitalizedDischarged":null,"dateChecked":"2021-02-19T00:00:00Z","totalTestsViral":620388,"positiveTestsViral":38351,"negativeTestsViral":574121,"positiveCasesViral":45583,"deathConfirmed":null,"deathProbable":null,"totalTestEncountersViral":null,"totalTestsPeopleViral":224231,"totalTestsAntibody":null,"positiveTestsAntibody":null,"negativeTestsAntibody":null,"totalTestsPeopleAntibody":null,"positiveTestsPeopleAntibody":null,"negativeTestsPeopleAntibody":null,"totalTestsPeopleAntigen":null,"positiveTestsPeopleAntigen":null,"totalTestsAntigen":null,"positiveTestsAntigen":null,"fips":"56","positiveIncrease":152,"negativeIncrease":259,"total":232331,"totalTestResultsIncrease":2920,"posNeg":232331,"dataQualityGrade":null,"deathIncrease":0,"hospitalizedIncrease":3,"hash":"0258ec36e6dac115e9905dab65fdf03f6f122dfd","commercialScore":0,"negativeRegularScore":0,"negativeScore":0,"positiveScore":0,"score":0,"grade":""},{"date":20210218,"state":"WY","positive":53531,"probableCases":8060,"negative":178389,"pending":null,"totalTestResultsSource":"totalTestsViral","totalTestResults":617468,"hospitalizedCurrently":31,"hospitalizedCumulative":1364,"inIcuCurrently":null,"inIcuCumulative":null,"onVentilatorCurrently":null,"onVentilatorCumulative":null,"recovered":52149,"lastUpdateEt":"2/18/2021 00:00","dateModified":"2021-02-18T00:00:00Z","checkTimeEt":"02/17 19:00","death":662,"hospitalized":1364,"hospitalizedDischarged":null,"dateChecked":"2021-02-18T00:00:00Z","totalTestsViral":617468,"positiveTestsViral":38266,"negativeTestsViral":571305,"positiveCasesViral":45471,"deathConfirmed":null,"deathProbable":null,"totalTestEncountersViral":null,"totalTestsPeopleViral":223860,"totalTestsAntibody":null,"positiveTestsAntibody":null,"negativeTestsAntibody":null,"totalTestsPeopleAntibody":null,"positiveTestsPeopleAntibody":null,"negativeTestsPeopleAntibody":null,"totalTestsPeopleAntigen":null,"positiveTestsPeopleAntigen":null,"totalTestsAntigen":null,"positiveTestsAntigen":null,"fips":"56","positiveIncrease":81,"negativeIncrease":347,"total":231920,"totalTestResultsIncrease":2131,"posNeg":231920,"dataQualityGrade":null,"deathIncrease":0,"hospitalizedIncrease":1,"hash":"f2e040405c4c4e9d7110c8b266f73bec8791b768","commercialScore":0,"negativeRegularScore":0,"negativeScore":0,"positiveScore":0,"score":0,"grade":""},{"date":20210217,"state":"WY","positive":53450,"probableCases":8012,"negative":178042,"pending":null,"totalTestResultsSource":"totalTestsViral","totalTestResults":615337,"hospitalizedCurrently":32,"hospitalizedCumulative":1363,"inIcuCurrently":null,"inIcuCumulative":null,"onVentilatorCurrently":null,"onVentilatorCumulative":null,"recovered":52039,"lastUpdateEt":"2/17/2021 00:00","dateModified":"2021-02-17T00:00:00Z","checkTimeEt":"02/16 19:00","death":662,"hospitalized":1363,"hospitalizedDischarged":null,"dateChecked":"2021-02-17T00:00:00Z","totalTestsViral":615337,"positiveTestsViral":38213,"negativeTestsViral":569232,"positiveCasesViral":45438,"deathConfirmed":null,"deathProbable":null,"totalTestEncountersViral":null,"totalTestsPeopleViral":223480,"totalTestsAntibody":null,"positiveTestsAntibody":null,"negativeTestsAntibody":null,"totalTestsPeopleAntibody":null,"positiveTestsPeopleAntibody":null,"negativeTestsPeopleAntibody":null,"totalTestsPeopleAntigen":null,"positiveTestsPeopleAntigen":null,"totalTestsAntigen":null,"positiveTestsAntigen":null,"fips":"56","positiveIncrease":99,"negativeIncrease":227,"total":231492,"totalTestResultsIncrease":981,"posNeg":231492,"dataQualityGrade":null,"deathIncrease":0,"hospitalizedIncrease":2,"hash":"999b5fff1a3a8ed66eb779ca41c2bfc58daa6749","commercialScore":0,"negativeRegularScore":0,"negativeScore":0,"positiveScore":0,"score":0,"grade":""},{"date":20210216,"state":"WY","positive":53351,"probableCases":7964,"negative":177815,"pending":null,"totalTestResultsSource":"totalTestsViral","totalTestResults":614356,"hospitalizedCurrently":34,"hospitalizedCumulative":1361,"inIcuCurrently":null,"inIcuCumulative":null,"onVentilatorCurrently":null,"onVentilatorCumulative":null,"recovered":52000,"lastUpdateEt":"2/16/2021 00:00","dateModified":"2021-02-16T00:00:00Z","checkTimeEt":"02/15 19:00","death":662,"hospitalized":1361,"hospitalizedDischarged":null,"dateChecked":"2021-02-16T00:00:00Z","totalTestsViral":614356,"positiveTestsViral":38169,"negativeTestsViral":568297,"positiveCasesViral":45387,"deathConfirmed":null,"deathProbable":null,"totalTestEncountersViral":null,"totalTestsPeopleViral":223202,"totalTestsAntibody":null,"positiveTestsAntibody":null,"negativeTestsAntibody":null,"totalTestsPeopleAntibody":null,"positiveTestsPeopleAntibody":null,"negativeTestsPeopleAntibody":null,"totalTestsPeopleAntigen":null,"positiveTestsPeopleAntigen":null,"totalTestsAntigen":null,"positiveTestsAntigen":null,"fips":"56","positiveIncrease":215,"negativeIncrease":2768,"total":231166,"totalTestResultsIncrease":9778,"posNeg":231166,"dataQualityGrade":null,"deathIncrease":15,"hospitalizedIncrease":5,"hash":"2475cc22751316c97bbca23d24d0c3f52c1ec3d0","commercialScore":0,"negativeRegularScore":0,"negativeScore":0,"positiveScore":0,"score":0,"grade":""},{"date":20210215,"state":"WY","positive":53136,"probableCases":7911,"negative":175047,"pending":null,"totalTestResultsSource":"totalTestsViral","totalTestResults":604578,"hospitalizedCurrently":44,"hospitalizedCumulative":1356,"inIcuCurrently":null,"inIcuCumulative":null,"onVentilatorCurrently":null,"onVentilatorCumulative":null,"recovered":51716,"lastUpdateEt":"2/14/2021 00:00","dateModified":"2021-02-14T00:00:00Z","checkTimeEt":"02/13 19:00","death":647,"hospitalized":1356,"hospitalizedDischarged":null,"dateChecked":"2021-02-14T00:00:00Z","totalTestsViral":604578,"positiveTestsViral":37735,"negativeTestsViral":559222,"positiveCasesViral":45225,"deathConfirmed":null,"deathProbable":null,"totalTestEncountersViral":null,"totalTestsPeopleViral":220258,"totalTestsAntibody":null,"positiveTestsAntibody":null,"negativeTestsAntibody":null,"totalTestsPeopleAntibody":null,"positiveTestsPeopleAntibody":null,"negativeTestsPeopleAntibody":null,"totalTestsPeopleAntigen":null,"positiveTestsPeopleAntigen":null,"totalTestsAntigen":null,"positiveTestsAntigen":null,"fips":"56","positiveIncrease":0,"negativeIncrease":0,"total":228183,"totalTestResultsIncrease":0,"posNeg":228183,"dataQualityGrade":null,"deathIncrease":0,"hospitalizedIncrease":0,"hash":"bf4b431c523f498ef1c65eef27ec6e480b614a52","commercialScore":0,"negativeRegularScore":0,"negativeScore":0,"positiveScore":0,"score":0,"grade":""},{"date":20210214,"state":"WY","positive":53136,"probableCases":7911,"negative":175047,"pending":null,"totalTestResultsSource":"totalTestsViral","totalTestResults":604578,"hospitalizedCurrently":44,"hospitalizedCumulative":1356,"inIcuCurrently":null,"inIcuCumulative":null,"onVentilatorCurrently":null,"onVentilatorCumulative":null,"recovered":51716,"lastUpdateEt":"2/14/2021 00:00","dateModified":"2021-02-14T00:00:00Z","checkTimeEt":"02/13 19:00","death":647,"hospitalized":1356,"hospitalizedDischarged":null,"dateChecked":"2021-02-14T00:00:00Z","totalTestsViral":604578,"positiveTestsViral":37735,"negativeTestsViral":559222,"positiveCasesViral":45225,"deathConfirmed":null,"deathProbable":null,"totalTestEncountersViral":null,"totalTestsPeopleViral":220258,"totalTestsAntibody":null,"positiveTestsAntibody":null,"negativeTestsAntibody":null,"totalTestsPeopleAntibody":null,"positiveTestsPeopleAntibody":null,"negativeTestsPeopleAntibody":null,"totalTestsPeopleAntigen":null,"positiveTestsPeopleAntigen":null,"totalTestsAntigen":null,"positiveTestsAntigen":null,"fips":"56","positiveIncrease":50,"negativeIncrease":0,"total":228183,"totalTestResultsIncrease":0,"posNeg":228183,"dataQualityGrade":null,"deathIncrease":0,"hospitalizedIncrease":45,"hash":"be8129de3e31d1d204f35a7ad8eff53edb236fd3","commercialScore":0,"negativeRegularScore":0,"negativeScore":0,"positiveScore":0,"score":0,"grade":""},{"date":20210213,"state":"WY","positive":53086,"probableCases":7875,"negative":175047,"pending":null,"totalTestResultsSource":"totalTestsViral","totalTestResults":604578,"hospitalizedCurrently":44,"hospitalizedCumulative":1311,"inIcuCurrently":null,"inIcuCumulative":null,"onVentilatorCurrently":null,"onVentilatorCumulative":null,"recovered":51640,"lastUpdateEt":"2/12/2021 00:00","dateModified":"2021-02-12T00:00:00Z","checkTimeEt":"02/11 19:00","death":647,"hospitalized":1311,"hospitalizedDischarged":null,"dateChecked":"2021-02-12T00:00:00Z","totalTestsViral":604578,"positiveTestsViral":37735,"negativeTestsViral":559222,"positiveCasesViral":45211,"deathConfirmed":null,"deathProbable":null,"totalTestEncountersViral":null,"totalTestsPeopleViral":220258,"totalTestsAntibody":null,"positiveTestsAntibody":null,"negativeTestsAntibody":null,"totalTestsPeopleAntibody":null,"positiveTestsPeopleAntibody":null,"negativeTestsPeopleAntibody":null,"totalTestsPeopleAntigen":null,"positiveTestsPeopleAntigen":null,"totalTestsAntigen":null,"positiveTestsAntigen":null,"fips":"56","positiveIncrease":0,"negativeIncrease":0,"total":228133,"totalTestResultsIncrease":0,"posNeg":228133,"dataQualityGrade":null,"deathIncrease":0,"hospitalizedIncrease":0,"hash":"bd208c00fc36cd0ae9831e979387976ff67846c3","commercialScore":0,"negativeRegularScore":0,"negativeScore":0,"positiveScore":0,"score":0,"grade":""},{"date":20210212,"state":"WY","positive":53086,"probableCases":7875,"negative":175047,"pending":null,"totalTestResultsSource":"totalTestsViral","totalTestResults":604578,"hospitalizedCurrently":44,"hospitalizedCumulative":1311,"inIcuCurrently":null,"inIcuCumulative":null,"onVentilatorCurrently":null,"onVentilatorCumulative":null,"recovered":51640,"lastUpdateEt":"2/12/2021 00:00","dateModified":"2021-02-12T00:00:00Z","checkTimeEt":"02/11 19:00","death":647,"hospitalized":1311,"hospitalizedDischarged":null,"dateChecked":"2021-02-12T00:00:00Z","totalTestsViral":604578,"positiveTestsViral":37735,"negativeTestsViral":559222,"positiveCasesViral":45211,"deathConfirmed":null,"deathProbable":null,"totalTestEncountersViral":null,"totalTestsPeopleViral":220258,"totalTestsAntibody":null,"positiveTestsAntibody":null,"negativeTestsAntibody":null,"totalTestsPeopleAntibody":null,"positiveTestsPeopleAntibody":null,"negativeTestsPeopleAntibody":null,"totalTestsPeopleAntigen":null,"positiveTestsPeopleAntigen":null,"totalTestsAntigen":null,"positiveTestsAntigen":null,"fips":"56","positiveIncrease":107,"negativeIncrease":439,"total":228133,"totalTestResultsIncrease":3475,"posNeg":228133,"dataQualityGrade":null,"deathIncrease":0,"hospitalizedIncrease":2,"hash":"b2e9127b411e3c2f6c704d198ff7e08300b71c00","commercialScore":0,"negativeRegularScore":0,"negativeScore":0,"positiveScore":0,"score":0,"grade":""},{"date":20210211,"state":"WY","positive":52979,"probableCases":7824,"negative":174608,"pending":null,"totalTestResultsSource":"totalTestsViral","totalTestResults":601103,"hospitalizedCurrently":41,"hospitalizedCumulative":1309,"inIcuCurrently":null,"inIcuCumulative":null,"onVentilatorCurrently":null,"onVentilatorCumulative":null,"recovered":51525,"lastUpdateEt":"2/11/2021 00:00","dateModified":"2021-02-11T00:00:00Z","checkTimeEt":"02/10 19:00","death":647,"hospitalized":1309,"hospitalizedDischarged":null,"dateChecked":"2021-02-11T00:00:00Z","totalTestsViral":601103,"positiveTestsViral":37659,"negativeTestsViral":555831,"positiveCasesViral":45155,"deathConfirmed":null,"deathProbable":null,"totalTestEncountersViral":null,"totalTestsPeopleViral":219763,"totalTestsAntibody":null,"positiveTestsAntibody":null,"negativeTestsAntibody":null,"totalTestsPeopleAntibody":null,"positiveTestsPeopleAntibody":null,"negativeTestsPeopleAntibody":null,"totalTestsPeopleAntigen":null,"positiveTestsPeopleAntigen":null,"totalTestsAntigen":null,"positiveTestsAntigen":null,"fips":"56","positiveIncrease":105,"negativeIncrease":279,"total":227587,"totalTestResultsIncrease":3254,"posNeg":227587,"dataQualityGrade":null,"deathIncrease":0,"hospitalizedIncrease":3,"hash":"3f265779b51b1f1fa5547c88da08464110cda390","commercialScore":0,"negativeRegularScore":0,"negativeScore":0,"positiveScore":0,"score":0,"grade":""},{"date":20210210,"state":"WY","positive":52874,"probableCases":7806,"negative":174329,"pending":null,"totalTestResultsSource":"totalTestsViral","totalTestResults":597849,"hospitalizedCurrently":45,"hospitalizedCumulative":1306,"inIcuCurrently":null,"inIcuCumulative":null,"onVentilatorCurrently":null,"onVentilatorCumulative":null,"recovered":51419,"lastUpdateEt":"2/10/2021 00:00","dateModified":"2021-02-10T00:00:00Z","checkTimeEt":"02/09 19:00","death":647,"hospitalized":1306,"hospitalizedDischarged":null,"dateChecked":"2021-02-10T00:00:00Z","totalTestsViral":597849,"positiveTestsViral":37588,"negativeTestsViral":552662,"positiveCasesViral":45068,"deathConfirmed":null,"deathProbable":null,"totalTestEncountersViral":null,"totalTestsPeopleViral":219397,"totalTestsAntibody":null,"positiveTestsAntibody":null,"negativeTestsAntibody":null,"totalTestsPeopleAntibody":null,"positiveTestsPeopleAntibody":null,"negativeTestsPeopleAntibody":null,"totalTestsPeopleAntigen":null,"positiveTestsPeopleAntigen":null,"totalTestsAntigen":null,"positiveTestsAntigen":null,"fips":"56","positiveIncrease":44,"negativeIncrease":344,"total":227203,"totalTestResultsIncrease":1879,"posNeg":227203,"dataQualityGrade":null,"deathIncrease":0,"hospitalizedIncrease":0,"hash":"7c8ad8177c79a23a8db7082a5171467d17068ff9","commercialScore":0,"negativeRegularScore":0,"negativeScore":0,"positiveScore":0,"score":0,"grade":""},{"date":20210209,"state":"WY","positive":52830,"probableCases":7774,"negative":173985,"pending":null,"totalTestResultsSource":"totalTestsViral","totalTestResults":595970,"hospitalizedCurrently":32,"hospitalizedCumulative":1306,"inIcuCurrently":null,"inIcuCumulative":null,"onVentilatorCurrently":null,"onVentilatorCumulative":null,"recovered":51386,"lastUpdateEt":"2/9/2021 00:00","dateModified":"2021-02-09T00:00:00Z","checkTimeEt":"02/08 19:00","death":647,"hospitalized":1306,"hospitalizedDischarged":null,"dateChecked":"2021-02-09T00:00:00Z","totalTestsViral":595970,"positiveTestsViral":47688,"negativeTestsViral":657100,"positiveCasesViral":45056,"deathConfirmed":null,"deathProbable":null,"totalTestEncountersViral":null,"totalTestsPeopleViral":219041,"totalTestsAntibody":null,"positiveTestsAntibody":null,"negativeTestsAntibody":null,"totalTestsPeopleAntibody":null,"positiveTestsPeopleAntibody":null,"negativeTestsPeopleAntibody":null,"totalTestsPeopleAntigen":null,"positiveTestsPeopleAntigen":null,"totalTestsAntigen":null,"positiveTestsAntigen":null,"fips":"56","positiveIncrease":46,"negativeIncrease":234,"total":226815,"totalTestResultsIncrease":-108866,"posNeg":226815,"dataQualityGrade":null,"deathIncrease":23,"hospitalizedIncrease":0,"hash":"196177b1f6926f278b75073223633ee44997ab97","commercialScore":0,"negativeRegularScore":0,"negativeScore":0,"positiveScore":0,"score":0,"grade":""},{"date":20210208,"state":"WY","positive":52784,"probableCases":7737,"negative":173751,"pending":null,"totalTestResultsSource":"totalTestsViral","totalTestResults":704836,"hospitalizedCurrently":41,"hospitalizedCumulative":1306,"inIcuCurrently":null,"inIcuCumulative":null,"onVentilatorCurrently":null,"onVentilatorCumulative":null,"recovered":51291,"lastUpdateEt":"2/8/2021 00:00","dateModified":"2021-02-08T00:00:00Z","checkTimeEt":"02/07 19:00","death":624,"hospitalized":1306,"hospitalizedDischarged":null,"dateChecked":"2021-02-08T00:00:00Z","totalTestsViral":704836,"positiveTestsViral":47688,"negativeTestsViral":657100,"positiveCasesViral":45047,"deathConfirmed":null,"deathProbable":null,"totalTestEncountersViral":null,"totalTestsPeopleViral":218798,"totalTestsAntibody":null,"positiveTestsAntibody":null,"negativeTestsAntibody":null,"totalTestsPeopleAntibody":null,"positiveTestsPeopleAntibody":null,"negativeTestsPeopleAntibody":null,"totalTestsPeopleAntigen":null,"positiveTestsPeopleAntigen":null,"totalTestsAntigen":null,"positiveTestsAntigen":null,"fips":"56","positiveIncrease":157,"negativeIncrease":838,"total":226535,"totalTestResultsIncrease":21422,"posNeg":226535,"dataQualityGrade":null,"deathIncrease":0,"hospitalizedIncrease":4,"hash":"75f5759a2c0c30c43a5dd15ed05d947d6732d44e","commercialScore":0,"negativeRegularScore":0,"negativeScore":0,"positiveScore":0,"score":0,"grade":""},{"date":20210207,"state":"WY","positive":52627,"probableCases":7730,"negative":172913,"pending":null,"totalTestResultsSource":"totalTestsViral","totalTestResults":683414,"hospitalizedCurrently":44,"hospitalizedCumulative":1302,"inIcuCurrently":null,"inIcuCumulative":null,"onVentilatorCurrently":null,"onVentilatorCumulative":null,"recovered":51016,"lastUpdateEt":"2/7/2021 00:00","dateModified":"2021-02-07T00:00:00Z","checkTimeEt":"02/06 19:00","death":624,"hospitalized":1302,"hospitalizedDischarged":null,"dateChecked":"2021-02-07T00:00:00Z","totalTestsViral":683414,"positiveTestsViral":47008,"negativeTestsViral":636359,"positiveCasesViral":44897,"deathConfirmed":null,"deathProbable":null,"totalTestEncountersViral":null,"totalTestsPeopleViral":217824,"totalTestsAntibody":null,"positiveTestsAntibody":null,"negativeTestsAntibody":null,"totalTestsPeopleAntibody":null,"positiveTestsPeopleAntibody":null,"negativeTestsPeopleAntibody":null,"totalTestsPeopleAntigen":null,"positiveTestsPeopleAntigen":null,"totalTestsAntigen":null,"positiveTestsAntigen":null,"fips":"56","positiveIncrease":9,"negativeIncrease":0,"total":225540,"totalTestResultsIncrease":0,"posNeg":225540,"dataQualityGrade":null,"deathIncrease":0,"hospitalizedIncrease":-1,"hash":"f57bad150fb14cb411a7a697f13c45f1fb8a2e94","commercialScore":0,"negativeRegularScore":0,"negativeScore":0,"positiveScore":0,"score":0,"grade":""},{"date":20210206,"state":"WY","positive":52618,"probableCases":7685,"negative":172913,"pending":null,"totalTestResultsSource":"totalTestsViral","totalTestResults":683414,"hospitalizedCurrently":44,"hospitalizedCumulative":1303,"inIcuCurrently":null,"inIcuCumulative":null,"onVentilatorCurrently":null,"onVentilatorCumulative":null,"recovered":51018,"lastUpdateEt":"2/6/2021 00:00","dateModified":"2021-02-06T00:00:00Z","checkTimeEt":"02/05 19:00","death":624,"hospitalized":1303,"hospitalizedDischarged":null,"dateChecked":"2021-02-06T00:00:00Z","totalTestsViral":683414,"positiveTestsViral":47008,"negativeTestsViral":636359,"positiveCasesViral":44933,"deathConfirmed":null,"deathProbable":null,"totalTestEncountersViral":null,"totalTestsPeopleViral":217824,"totalTestsAntibody":null,"positiveTestsAntibody":null,"negativeTestsAntibody":null,"totalTestsPeopleAntibody":null,"positiveTestsPeopleAntibody":null,"negativeTestsPeopleAntibody":null,"totalTestsPeopleAntigen":null,"positiveTestsPeopleAntigen":null,"totalTestsAntigen":null,"positiveTestsAntigen":null,"fips":"56","positiveIncrease":42,"negativeIncrease":0,"total":225531,"totalTestResultsIncrease":0,"posNeg":225531,"dataQualityGrade":null,"deathIncrease":0,"hospitalizedIncrease":1,"hash":"17d7dd1383ccf903bfa3379af1ff77584833d8c7","commercialScore":0,"negativeRegularScore":0,"negativeScore":0,"positiveScore":0,"score":0,"grade":""},{"date":20210205,"state":"WY","positive":52576,"probableCases":7665,"negative":172913,"pending":null,"totalTestResultsSource":"totalTestsViral","totalTestResults":683414,"hospitalizedCurrently":44,"hospitalizedCumulative":1302,"inIcuCurrently":null,"inIcuCumulative":null,"onVentilatorCurrently":null,"onVentilatorCumulative":null,"recovered":50926,"lastUpdateEt":"2/5/2021 00:00","dateModified":"2021-02-05T00:00:00Z","checkTimeEt":"02/04 19:00","death":624,"hospitalized":1302,"hospitalizedDischarged":null,"dateChecked":"2021-02-05T00:00:00Z","totalTestsViral":683414,"positiveTestsViral":47008,"negativeTestsViral":636359,"positiveCasesViral":44911,"deathConfirmed":null,"deathProbable":null,"totalTestEncountersViral":null,"totalTestsPeopleViral":217824,"totalTestsAntibody":null,"positiveTestsAntibody":null,"negativeTestsAntibody":null,"totalTestsPeopleAntibody":null,"positiveTestsPeopleAntibody":null,"negativeTestsPeopleAntibody":null,"totalTestsPeopleAntigen":null,"positiveTestsPeopleAntigen":null,"totalTestsAntigen":null,"positiveTestsAntigen":null,"fips":"56","positiveIncrease":108,"negativeIncrease":487,"total":225489,"totalTestResultsIncrease":12726,"posNeg":225489,"dataQualityGrade":null,"deathIncrease":0,"hospitalizedIncrease":2,"hash":"146475154c69d67b3ad512e2e645a4aec67051d6","commercialScore":0,"negativeRegularScore":0,"negativeScore":0,"positiveScore":0,"score":0,"grade":""},{"date":20210204,"state":"WY","positive":52468,"probableCases":7620,"negative":172426,"pending":null,"totalTestResultsSource":"totalTestsViral","totalTestResults":670688,"hospitalizedCurrently":48,"hospitalizedCumulative":1300,"inIcuCurrently":null,"inIcuCumulative":null,"onVentilatorCurrently":null,"onVentilatorCumulative":null,"recovered":50775,"lastUpdateEt":"2/4/2021 00:00","dateModified":"2021-02-04T00:00:00Z","checkTimeEt":"02/03 19:00","death":624,"hospitalized":1300,"hospitalizedDischarged":null,"dateChecked":"2021-02-04T00:00:00Z","totalTestsViral":670688,"positiveTestsViral":46545,"negativeTestsViral":624095,"positiveCasesViral":44848,"deathConfirmed":null,"deathProbable":null,"totalTestEncountersViral":null,"totalTestsPeopleViral":217274,"totalTestsAntibody":null,"positiveTestsAntibody":null,"negativeTestsAntibody":null,"totalTestsPeopleAntibody":null,"positiveTestsPeopleAntibody":null,"negativeTestsPeopleAntibody":null,"totalTestsPeopleAntigen":null,"positiveTestsPeopleAntigen":null,"totalTestsAntigen":null,"positiveTestsAntigen":null,"fips":"56","positiveIncrease":180,"negativeIncrease":258,"total":224894,"totalTestResultsIncrease":14145,"posNeg":224894,"dataQualityGrade":null,"deathIncrease":0,"hospitalizedIncrease":7,"hash":"c34ec86fe49b0daf7ad2e22a66a52f025ea07402","commercialScore":0,"negativeRegularScore":0,"negativeScore":0,"positiveScore":0,"score":0,"grade":""},{"date":20210203,"state":"WY","positive":52288,"probableCases":7684,"negative":172168,"pending":null,"totalTestResultsSource":"totalTestsViral","totalTestResults":656543,"hospitalizedCurrently":47,"hospitalizedCumulative":1293,"inIcuCurrently":null,"inIcuCumulative":null,"onVentilatorCurrently":null,"onVentilatorCumulative":null,"recovered":50499,"lastUpdateEt":"2/3/2021 00:00","dateModified":"2021-02-03T00:00:00Z","checkTimeEt":"02/02 19:00","death":624,"hospitalized":1293,"hospitalizedDischarged":null,"dateChecked":"2021-02-03T00:00:00Z","totalTestsViral":656543,"positiveTestsViral":46250,"negativeTestsViral":610246,"positiveCasesViral":44604,"deathConfirmed":null,"deathProbable":null,"totalTestEncountersViral":null,"totalTestsPeopleViral":216772,"totalTestsAntibody":null,"positiveTestsAntibody":null,"negativeTestsAntibody":null,"totalTestsPeopleAntibody":null,"positiveTestsPeopleAntibody":null,"negativeTestsPeopleAntibody":null,"totalTestsPeopleAntigen":null,"positiveTestsPeopleAntigen":null,"totalTestsAntigen":null,"positiveTestsAntigen":null,"fips":"56","positiveIncrease":160,"negativeIncrease":343,"total":224456,"totalTestResultsIncrease":9394,"posNeg":224456,"dataQualityGrade":null,"deathIncrease":0,"hospitalizedIncrease":4,"hash":"9db6483102c7a39f72dba05fa879bd35acca8f7e","commercialScore":0,"negativeRegularScore":0,"negativeScore":0,"positiveScore":0,"score":0,"grade":""},{"date":20210202,"state":"WY","positive":52128,"probableCases":7659,"negative":171825,"pending":null,"totalTestResultsSource":"totalTestsViral","totalTestResults":647149,"hospitalizedCurrently":53,"hospitalizedCumulative":1289,"inIcuCurrently":null,"inIcuCumulative":null,"onVentilatorCurrently":null,"onVentilatorCumulative":null,"recovered":50431,"lastUpdateEt":"2/2/2021 00:00","dateModified":"2021-02-02T00:00:00Z","checkTimeEt":"02/01 19:00","death":624,"hospitalized":1289,"hospitalizedDischarged":null,"dateChecked":"2021-02-02T00:00:00Z","totalTestsViral":647149,"positiveTestsViral":46168,"negativeTestsViral":607903,"positiveCasesViral":44469,"deathConfirmed":null,"deathProbable":null,"totalTestEncountersViral":null,"totalTestsPeopleViral":216294,"totalTestsAntibody":null,"positiveTestsAntibody":null,"negativeTestsAntibody":null,"totalTestsPeopleAntibody":null,"positiveTestsPeopleAntibody":null,"negativeTestsPeopleAntibody":null,"totalTestsPeopleAntigen":null,"positiveTestsPeopleAntigen":null,"totalTestsAntigen":null,"positiveTestsAntigen":null,"fips":"56","positiveIncrease":71,"negativeIncrease":-1554,"total":223953,"totalTestResultsIncrease":-4642,"posNeg":223953,"dataQualityGrade":null,"deathIncrease":28,"hospitalizedIncrease":0,"hash":"d4f8539dd99c3032e55fd856ce9e21605d6c9244","commercialScore":0,"negativeRegularScore":0,"negativeScore":0,"positiveScore":0,"score":0,"grade":""},{"date":20210201,"state":"WY","positive":52057,"probableCases":7603,"negative":173379,"pending":null,"totalTestResultsSource":"totalTestsViral","totalTestResults":651791,"hospitalizedCurrently":53,"hospitalizedCumulative":1289,"inIcuCurrently":null,"inIcuCumulative":null,"onVentilatorCurrently":null,"onVentilatorCumulative":null,"recovered":50317,"lastUpdateEt":"2/1/2021 00:00","dateModified":"2021-02-01T00:00:00Z","checkTimeEt":"01/31 19:00","death":596,"hospitalized":1289,"hospitalizedDischarged":null,"dateChecked":"2021-02-01T00:00:00Z","totalTestsViral":651791,"positiveTestsViral":46137,"negativeTestsViral":605608,"positiveCasesViral":44454,"deathConfirmed":null,"deathProbable":null,"totalTestEncountersViral":null,"totalTestsPeopleViral":217833,"totalTestsAntibody":null,"positiveTestsAntibody":null,"negativeTestsAntibody":null,"totalTestsPeopleAntibody":null,"positiveTestsPeopleAntibody":null,"negativeTestsPeopleAntibody":null,"totalTestsPeopleAntigen":null,"positiveTestsPeopleAntigen":null,"totalTestsAntigen":null,"positiveTestsAntigen":null,"fips":"56","positiveIncrease":145,"negativeIncrease":922,"total":225436,"totalTestResultsIncrease":16806,"posNeg":225436,"dataQualityGrade":null,"deathIncrease":0,"hospitalizedIncrease":5,"hash":"bac18a9aede504a1b043a0096fa0d2e0658331fe","commercialScore":0,"negativeRegularScore":0,"negativeScore":0,"positiveScore":0,"score":0,"grade":""},{"date":20210131,"state":"WY","positive":51912,"probableCases":7608,"negative":172457,"pending":null,"totalTestResultsSource":"totalTestsViral","totalTestResults":634985,"hospitalizedCurrently":54,"hospitalizedCumulative":1284,"inIcuCurrently":null,"inIcuCumulative":null,"onVentilatorCurrently":null,"onVentilatorCumulative":null,"recovered":50003,"lastUpdateEt":"1/31/2021 00:00","dateModified":"2021-01-31T00:00:00Z","checkTimeEt":"01/30 19:00","death":596,"hospitalized":1284,"hospitalizedDischarged":null,"dateChecked":"2021-01-31T00:00:00Z","totalTestsViral":634985,"positiveTestsViral":45638,"negativeTestsViral":588897,"positiveCasesViral":44304,"deathConfirmed":null,"deathProbable":null,"totalTestEncountersViral":null,"totalTestsPeopleViral":216573,"totalTestsAntibody":null,"positiveTestsAntibody":null,"negativeTestsAntibody":null,"totalTestsPeopleAntibody":null,"positiveTestsPeopleAntibody":null,"negativeTestsPeopleAntibody":null,"totalTestsPeopleAntigen":null,"positiveTestsPeopleAntigen":null,"totalTestsAntigen":null,"positiveTestsAntigen":null,"fips":"56","positiveIncrease":208,"negativeIncrease":0,"total":224369,"totalTestResultsIncrease":0,"posNeg":224369,"dataQualityGrade":null,"deathIncrease":0,"hospitalizedIncrease":5,"hash":"da22f1f8649cfd5979c8b3fd6f85788e61d78c18","commercialScore":0,"negativeRegularScore":0,"negativeScore":0,"positiveScore":0,"score":0,"grade":""},{"date":20210130,"state":"WY","positive":51704,"probableCases":7582,"negative":172457,"pending":null,"totalTestResultsSource":"totalTestsViral","totalTestResults":634985,"hospitalizedCurrently":54,"hospitalizedCumulative":1279,"inIcuCurrently":null,"inIcuCumulative":null,"onVentilatorCurrently":null,"onVentilatorCumulative":null,"recovered":49981,"lastUpdateEt":"1/30/2021 00:00","dateModified":"2021-01-30T00:00:00Z","checkTimeEt":"01/29 19:00","death":596,"hospitalized":1279,"hospitalizedDischarged":null,"dateChecked":"2021-01-30T00:00:00Z","totalTestsViral":634985,"positiveTestsViral":45638,"negativeTestsViral":588897,"positiveCasesViral":44122,"deathConfirmed":null,"deathProbable":null,"totalTestEncountersViral":null,"totalTestsPeopleViral":216573,"totalTestsAntibody":null,"positiveTestsAntibody":null,"negativeTestsAntibody":null,"totalTestsPeopleAntibody":null,"positiveTestsPeopleAntibody":null,"negativeTestsPeopleAntibody":null,"totalTestsPeopleAntigen":null,"positiveTestsPeopleAntigen":null,"totalTestsAntigen":null,"positiveTestsAntigen":null,"fips":"56","positiveIncrease":14,"negativeIncrease":0,"total":224161,"totalTestResultsIncrease":0,"posNeg":224161,"dataQualityGrade":null,"deathIncrease":0,"hospitalizedIncrease":0,"hash":"775c23a0e4eca6a159f330a8992e3ad462f8bde8","commercialScore":0,"negativeRegularScore":0,"negativeScore":0,"positiveScore":0,"score":0,"grade":""},{"date":20210129,"state":"WY","positive":51690,"probableCases":7574,"negative":172457,"pending":null,"totalTestResultsSource":"totalTestsViral","totalTestResults":634985,"hospitalizedCurrently":54,"hospitalizedCumulative":1279,"inIcuCurrently":null,"inIcuCumulative":null,"onVentilatorCurrently":null,"onVentilatorCumulative":null,"recovered":49785,"lastUpdateEt":"1/29/2021 00:00","dateModified":"2021-01-29T00:00:00Z","checkTimeEt":"01/28 19:00","death":596,"hospitalized":1279,"hospitalizedDischarged":null,"dateChecked":"2021-01-29T00:00:00Z","totalTestsViral":634985,"positiveTestsViral":45638,"negativeTestsViral":588897,"positiveCasesViral":44116,"deathConfirmed":null,"deathProbable":null,"totalTestEncountersViral":null,"totalTestsPeopleViral":216573,"totalTestsAntibody":null,"positiveTestsAntibody":null,"negativeTestsAntibody":null,"totalTestsPeopleAntibody":null,"positiveTestsPeopleAntibody":null,"negativeTestsPeopleAntibody":null,"totalTestsPeopleAntigen":null,"positiveTestsPeopleAntigen":null,"totalTestsAntigen":null,"positiveTestsAntigen":null,"fips":"56","positiveIncrease":260,"negativeIncrease":380,"total":224147,"totalTestResultsIncrease":9603,"posNeg":224147,"dataQualityGrade":null,"deathIncrease":0,"hospitalizedIncrease":7,"hash":"e05e438833e11284caf46e218bf3389792015370","commercialScore":0,"negativeRegularScore":0,"negativeScore":0,"positiveScore":0,"score":0,"grade":""},{"date":20210128,"state":"WY","positive":51430,"probableCases":7546,"negative":172077,"pending":null,"totalTestResultsSource":"totalTestsViral","totalTestResults":625382,"hospitalizedCurrently":64,"hospitalizedCumulative":1272,"inIcuCurrently":null,"inIcuCumulative":null,"onVentilatorCurrently":null,"onVentilatorCumulative":null,"recovered":49592,"lastUpdateEt":"1/28/2021 00:00","dateModified":"2021-01-28T00:00:00Z","checkTimeEt":"01/27 19:00","death":596,"hospitalized":1272,"hospitalizedDischarged":null,"dateChecked":"2021-01-28T00:00:00Z","totalTestsViral":625382,"positiveTestsViral":45277,"negativeTestsViral":579654,"positiveCasesViral":43884,"deathConfirmed":null,"deathProbable":null,"totalTestEncountersViral":null,"totalTestsPeopleViral":215961,"totalTestsAntibody":null,"positiveTestsAntibody":null,"negativeTestsAntibody":null,"totalTestsPeopleAntibody":null,"positiveTestsPeopleAntibody":null,"negativeTestsPeopleAntibody":null,"totalTestsPeopleAntigen":null,"positiveTestsPeopleAntigen":null,"totalTestsAntigen":null,"positiveTestsAntigen":null,"fips":"56","positiveIncrease":62,"negativeIncrease":389,"total":223507,"totalTestResultsIncrease":8705,"posNeg":223507,"dataQualityGrade":null,"deathIncrease":0,"hospitalizedIncrease":2,"hash":"74da2dcb9623b70ee65d9b0728de748417cf8ab0","commercialScore":0,"negativeRegularScore":0,"negativeScore":0,"positiveScore":0,"score":0,"grade":""},{"date":20210127,"state":"WY","positive":51368,"probableCases":7542,"negative":171688,"pending":null,"totalTestResultsSource":"totalTestsViral","totalTestResults":616677,"hospitalizedCurrently":70,"hospitalizedCumulative":1270,"inIcuCurrently":null,"inIcuCumulative":null,"onVentilatorCurrently":null,"onVentilatorCumulative":null,"recovered":49338,"lastUpdateEt":"1/27/2021 00:00","dateModified":"2021-01-27T00:00:00Z","checkTimeEt":"01/26 19:00","death":596,"hospitalized":1270,"hospitalizedDischarged":null,"dateChecked":"2021-01-27T00:00:00Z","totalTestsViral":616677,"positiveTestsViral":45120,"negativeTestsViral":571105,"positiveCasesViral":43826,"deathConfirmed":null,"deathProbable":null,"totalTestEncountersViral":null,"totalTestsPeopleViral":215514,"totalTestsAntibody":null,"positiveTestsAntibody":null,"negativeTestsAntibody":null,"totalTestsPeopleAntibody":null,"positiveTestsPeopleAntibody":null,"negativeTestsPeopleAntibody":null,"totalTestsPeopleAntigen":null,"positiveTestsPeopleAntigen":null,"totalTestsAntigen":null,"positiveTestsAntigen":null,"fips":"56","positiveIncrease":216,"negativeIncrease":2170,"total":223056,"totalTestResultsIncrease":7104,"posNeg":223056,"dataQualityGrade":null,"deathIncrease":0,"hospitalizedIncrease":5,"hash":"6ed43182be22336f51b5ecc5befb6dc11ce497b6","commercialScore":0,"negativeRegularScore":0,"negativeScore":0,"positiveScore":0,"score":0,"grade":""},{"date":20210126,"state":"WY","positive":51152,"probableCases":7501,"negative":169518,"pending":null,"totalTestResultsSource":"totalTestsViral","totalTestResults":609573,"hospitalizedCurrently":71,"hospitalizedCumulative":1265,"inIcuCurrently":null,"inIcuCumulative":null,"onVentilatorCurrently":null,"onVentilatorCumulative":null,"recovered":49268,"lastUpdateEt":"1/26/2021 00:00","dateModified":"2021-01-26T00:00:00Z","checkTimeEt":"01/25 19:00","death":596,"hospitalized":1265,"hospitalizedDischarged":null,"dateChecked":"2021-01-26T00:00:00Z","totalTestsViral":609573,"positiveTestsViral":44908,"negativeTestsViral":564215,"positiveCasesViral":43651,"deathConfirmed":null,"deathProbable":null,"totalTestEncountersViral":null,"totalTestsPeopleViral":213169,"totalTestsAntibody":null,"positiveTestsAntibody":null,"negativeTestsAntibody":null,"totalTestsPeopleAntibody":null,"positiveTestsPeopleAntibody":null,"negativeTestsPeopleAntibody":null,"totalTestsPeopleAntigen":null,"positiveTestsPeopleAntigen":null,"totalTestsAntigen":null,"positiveTestsAntigen":null,"fips":"56","positiveIncrease":90,"negativeIncrease":2147,"total":220670,"totalTestResultsIncrease":35705,"posNeg":220670,"dataQualityGrade":null,"deathIncrease":25,"hospitalizedIncrease":1,"hash":"4ac646ed22a51dc31f818e8e488bebd8ccb674b9","commercialScore":0,"negativeRegularScore":0,"negativeScore":0,"positiveScore":0,"score":0,"grade":""},{"date":20210125,"state":"WY","positive":51062,"probableCases":7463,"negative":167371,"pending":null,"totalTestResultsSource":"totalTestsViral","totalTestResults":573868,"hospitalizedCurrently":66,"hospitalizedCumulative":1264,"inIcuCurrently":null,"inIcuCumulative":null,"onVentilatorCurrently":null,"onVentilatorCumulative":null,"recovered":49008,"lastUpdateEt":"1/25/2021 00:00","dateModified":"2021-01-25T00:00:00Z","checkTimeEt":"01/24 19:00","death":571,"hospitalized":1264,"hospitalizedDischarged":null,"dateChecked":"2021-01-25T00:00:00Z","totalTestsViral":573868,"positiveTestsViral":44303,"negativeTestsViral":551775,"positiveCasesViral":43599,"deathConfirmed":null,"deathProbable":null,"totalTestEncountersViral":null,"totalTestsPeopleViral":210412,"totalTestsAntibody":null,"positiveTestsAntibody":null,"negativeTestsAntibody":null,"totalTestsPeopleAntibody":null,"positiveTestsPeopleAntibody":null,"negativeTestsPeopleAntibody":null,"totalTestsPeopleAntigen":null,"positiveTestsPeopleAntigen":null,"totalTestsAntigen":null,"positiveTestsAntigen":null,"fips":"56","positiveIncrease":164,"negativeIncrease":0,"total":218433,"totalTestResultsIncrease":0,"posNeg":218433,"dataQualityGrade":null,"deathIncrease":0,"hospitalizedIncrease":5,"hash":"fc3b4bbdc5be45b6ce1d392738df9264afe9b700","commercialScore":0,"negativeRegularScore":0,"negativeScore":0,"positiveScore":0,"score":0,"grade":""},{"date":20210124,"state":"WY","positive":50898,"probableCases":7455,"negative":167371,"pending":null,"totalTestResultsSource":"totalTestsViral","totalTestResults":573868,"hospitalizedCurrently":65,"hospitalizedCumulative":1259,"inIcuCurrently":null,"inIcuCumulative":null,"onVentilatorCurrently":null,"onVentilatorCumulative":null,"recovered":48571,"lastUpdateEt":"1/24/2021 00:00","dateModified":"2021-01-24T00:00:00Z","checkTimeEt":"01/23 19:00","death":571,"hospitalized":1259,"hospitalizedDischarged":null,"dateChecked":"2021-01-24T00:00:00Z","totalTestsViral":573868,"positiveTestsViral":43473,"negativeTestsViral":530355,"positiveCasesViral":43443,"deathConfirmed":null,"deathProbable":null,"totalTestEncountersViral":null,"totalTestsPeopleViral":210412,"totalTestsAntibody":null,"positiveTestsAntibody":null,"negativeTestsAntibody":null,"totalTestsPeopleAntibody":null,"positiveTestsPeopleAntibody":null,"negativeTestsPeopleAntibody":null,"totalTestsPeopleAntigen":null,"positiveTestsPeopleAntigen":null,"totalTestsAntigen":null,"positiveTestsAntigen":null,"fips":"56","positiveIncrease":315,"negativeIncrease":0,"total":218269,"totalTestResultsIncrease":0,"posNeg":218269,"dataQualityGrade":null,"deathIncrease":0,"hospitalizedIncrease":8,"hash":"b464ee84e23ca35d3fb5485610afea58582d558b","commercialScore":0,"negativeRegularScore":0,"negativeScore":0,"positiveScore":0,"score":0,"grade":""},{"date":20210123,"state":"WY","positive":50583,"probableCases":7432,"negative":167371,"pending":null,"totalTestResultsSource":"totalTestsViral","totalTestResults":573868,"hospitalizedCurrently":75,"hospitalizedCumulative":1251,"inIcuCurrently":null,"inIcuCumulative":null,"onVentilatorCurrently":null,"onVentilatorCumulative":null,"recovered":48316,"lastUpdateEt":"1/22/2021 00:00","dateModified":"2021-01-22T00:00:00Z","checkTimeEt":"01/21 19:00","death":571,"hospitalized":1251,"hospitalizedDischarged":null,"dateChecked":"2021-01-22T00:00:00Z","totalTestsViral":573868,"positiveTestsViral":43473,"negativeTestsViral":530355,"positiveCasesViral":43151,"deathConfirmed":null,"deathProbable":null,"totalTestEncountersViral":null,"totalTestsPeopleViral":210412,"totalTestsAntibody":null,"positiveTestsAntibody":null,"negativeTestsAntibody":null,"totalTestsPeopleAntibody":null,"positiveTestsPeopleAntibody":null,"negativeTestsPeopleAntibody":null,"totalTestsPeopleAntigen":null,"positiveTestsPeopleAntigen":null,"totalTestsAntigen":null,"positiveTestsAntigen":null,"fips":"56","positiveIncrease":0,"negativeIncrease":0,"total":217954,"totalTestResultsIncrease":0,"posNeg":217954,"dataQualityGrade":null,"deathIncrease":0,"hospitalizedIncrease":0,"hash":"fa1bb1eb809ae144b62a2fdfaa92445188fae7c7","commercialScore":0,"negativeRegularScore":0,"negativeScore":0,"positiveScore":0,"score":0,"grade":""},{"date":20210122,"state":"WY","positive":50583,"probableCases":7432,"negative":167371,"pending":null,"totalTestResultsSource":"totalTestsViral","totalTestResults":573868,"hospitalizedCurrently":75,"hospitalizedCumulative":1251,"inIcuCurrently":null,"inIcuCumulative":null,"onVentilatorCurrently":null,"onVentilatorCumulative":null,"recovered":48316,"lastUpdateEt":"1/22/2021 00:00","dateModified":"2021-01-22T00:00:00Z","checkTimeEt":"01/21 19:00","death":571,"hospitalized":1251,"hospitalizedDischarged":null,"dateChecked":"2021-01-22T00:00:00Z","totalTestsViral":573868,"positiveTestsViral":43473,"negativeTestsViral":530355,"positiveCasesViral":43151,"deathConfirmed":null,"deathProbable":null,"totalTestEncountersViral":null,"totalTestsPeopleViral":210412,"totalTestsAntibody":null,"positiveTestsAntibody":null,"negativeTestsAntibody":null,"totalTestsPeopleAntibody":null,"positiveTestsPeopleAntibody":null,"negativeTestsPeopleAntibody":null,"totalTestsPeopleAntigen":null,"positiveTestsPeopleAntigen":null,"totalTestsAntigen":null,"positiveTestsAntigen":null,"fips":"56","positiveIncrease":159,"negativeIncrease":0,"total":217954,"totalTestResultsIncrease":0,"posNeg":217954,"dataQualityGrade":null,"deathIncrease":21,"hospitalizedIncrease":3,"hash":"fd091b4d116fd2677df660d7de5293c517e98b4e","commercialScore":0,"negativeRegularScore":0,"negativeScore":0,"positiveScore":0,"score":0,"grade":""},{"date":20210121,"state":"WY","positive":50424,"probableCases":7383,"negative":167371,"pending":null,"totalTestResultsSource":"totalTestsViral","totalTestResults":573868,"hospitalizedCurrently":84,"hospitalizedCumulative":1248,"inIcuCurrently":null,"inIcuCumulative":null,"onVentilatorCurrently":null,"onVentilatorCumulative":null,"recovered":47964,"lastUpdateEt":"1/21/2021 00:00","dateModified":"2021-01-21T00:00:00Z","checkTimeEt":"01/20 19:00","death":550,"hospitalized":1248,"hospitalizedDischarged":null,"dateChecked":"2021-01-21T00:00:00Z","totalTestsViral":573868,"positiveTestsViral":43473,"negativeTestsViral":530355,"positiveCasesViral":43041,"deathConfirmed":null,"deathProbable":null,"totalTestEncountersViral":null,"totalTestsPeopleViral":210412,"totalTestsAntibody":null,"positiveTestsAntibody":null,"negativeTestsAntibody":null,"totalTestsPeopleAntibody":null,"positiveTestsPeopleAntibody":null,"negativeTestsPeopleAntibody":null,"totalTestsPeopleAntigen":null,"positiveTestsPeopleAntigen":null,"totalTestsAntigen":null,"positiveTestsAntigen":null,"fips":"56","positiveIncrease":300,"negativeIncrease":512,"total":217795,"totalTestResultsIncrease":6418,"posNeg":217795,"dataQualityGrade":null,"deathIncrease":0,"hospitalizedIncrease":8,"hash":"1ecd024b542b0d276e8675692fe9a6556717fd64","commercialScore":0,"negativeRegularScore":0,"negativeScore":0,"positiveScore":0,"score":0,"grade":""},{"date":20210120,"state":"WY","positive":50124,"probableCases":7336,"negative":166859,"pending":null,"totalTestResultsSource":"totalTestsViral","totalTestResults":567450,"hospitalizedCurrently":81,"hospitalizedCumulative":1240,"inIcuCurrently":null,"inIcuCumulative":null,"onVentilatorCurrently":null,"onVentilatorCumulative":null,"recovered":47693,"lastUpdateEt":"1/20/2021 00:00","dateModified":"2021-01-20T00:00:00Z","checkTimeEt":"01/19 19:00","death":550,"hospitalized":1240,"hospitalizedDischarged":null,"dateChecked":"2021-01-20T00:00:00Z","totalTestsViral":567450,"positiveTestsViral":43188,"negativeTestsViral":524223,"positiveCasesViral":42788,"deathConfirmed":null,"deathProbable":null,"totalTestEncountersViral":null,"totalTestsPeopleViral":209647,"totalTestsAntibody":null,"positiveTestsAntibody":null,"negativeTestsAntibody":null,"totalTestsPeopleAntibody":null,"positiveTestsPeopleAntibody":null,"negativeTestsPeopleAntibody":null,"totalTestsPeopleAntigen":null,"positiveTestsPeopleAntigen":null,"totalTestsAntigen":null,"positiveTestsAntigen":null,"fips":"56","positiveIncrease":202,"negativeIncrease":376,"total":216983,"totalTestResultsIncrease":4413,"posNeg":216983,"dataQualityGrade":null,"deathIncrease":0,"hospitalizedIncrease":4,"hash":"034b57fcade04c20822b861f5d064429cdc41e63","commercialScore":0,"negativeRegularScore":0,"negativeScore":0,"positiveScore":0,"score":0,"grade":""},{"date":20210119,"state":"WY","positive":49922,"probableCases":7284,"negative":166483,"pending":null,"totalTestResultsSource":"totalTestsViral","totalTestResults":563037,"hospitalizedCurrently":88,"hospitalizedCumulative":1236,"inIcuCurrently":null,"inIcuCumulative":null,"onVentilatorCurrently":null,"onVentilatorCumulative":null,"recovered":47583,"lastUpdateEt":"1/19/2021 00:00","dateModified":"2021-01-19T00:00:00Z","checkTimeEt":"01/18 19:00","death":550,"hospitalized":1236,"hospitalizedDischarged":null,"dateChecked":"2021-01-19T00:00:00Z","totalTestsViral":563037,"positiveTestsViral":42994,"negativeTestsViral":520004,"positiveCasesViral":42638,"deathConfirmed":null,"deathProbable":null,"totalTestEncountersViral":null,"totalTestsPeopleViral":209121,"totalTestsAntibody":null,"positiveTestsAntibody":null,"negativeTestsAntibody":null,"totalTestsPeopleAntibody":null,"positiveTestsPeopleAntibody":null,"negativeTestsPeopleAntibody":null,"totalTestsPeopleAntigen":null,"positiveTestsPeopleAntigen":null,"totalTestsAntigen":null,"positiveTestsAntigen":null,"fips":"56","positiveIncrease":214,"negativeIncrease":1682,"total":216405,"totalTestResultsIncrease":13232,"posNeg":216405,"dataQualityGrade":null,"deathIncrease":28,"hospitalizedIncrease":4,"hash":"5ef9d1370d672d35ed6a537623cfe9ee61da1eac","commercialScore":0,"negativeRegularScore":0,"negativeScore":0,"positiveScore":0,"score":0,"grade":""},{"date":20210118,"state":"WY","positive":49708,"probableCases":7193,"negative":164801,"pending":null,"totalTestResultsSource":"totalTestsViral","totalTestResults":549805,"hospitalizedCurrently":85,"hospitalizedCumulative":1232,"inIcuCurrently":null,"inIcuCumulative":null,"onVentilatorCurrently":null,"onVentilatorCumulative":null,"recovered":46908,"lastUpdateEt":"1/18/2021 00:00","dateModified":"2021-01-18T00:00:00Z","checkTimeEt":"01/17 19:00","death":522,"hospitalized":1232,"hospitalizedDischarged":null,"dateChecked":"2021-01-18T00:00:00Z","totalTestsViral":549805,"positiveTestsViral":42087,"negativeTestsViral":507680,"positiveCasesViral":42515,"deathConfirmed":null,"deathProbable":null,"totalTestEncountersViral":null,"totalTestsPeopleViral":206574,"totalTestsAntibody":null,"positiveTestsAntibody":null,"negativeTestsAntibody":null,"totalTestsPeopleAntibody":null,"positiveTestsPeopleAntibody":null,"negativeTestsPeopleAntibody":null,"totalTestsPeopleAntigen":null,"positiveTestsPeopleAntigen":null,"totalTestsAntigen":null,"positiveTestsAntigen":null,"fips":"56","positiveIncrease":345,"negativeIncrease":0,"total":214509,"totalTestResultsIncrease":0,"posNeg":214509,"dataQualityGrade":null,"deathIncrease":0,"hospitalizedIncrease":9,"hash":"20a1ea1662b425e3bff03addea4007959e67b3ae","commercialScore":0,"negativeRegularScore":0,"negativeScore":0,"positiveScore":0,"score":0,"grade":""},{"date":20210117,"state":"WY","positive":49363,"probableCases":7190,"negative":164801,"pending":null,"totalTestResultsSource":"totalTestsViral","totalTestResults":549805,"hospitalizedCurrently":84,"hospitalizedCumulative":1223,"inIcuCurrently":null,"inIcuCumulative":null,"onVentilatorCurrently":null,"onVentilatorCumulative":null,"recovered":46820,"lastUpdateEt":"1/17/2021 00:00","dateModified":"2021-01-17T00:00:00Z","checkTimeEt":"01/16 19:00","death":522,"hospitalized":1223,"hospitalizedDischarged":null,"dateChecked":"2021-01-17T00:00:00Z","totalTestsViral":549805,"positiveTestsViral":42087,"negativeTestsViral":507680,"positiveCasesViral":42173,"deathConfirmed":null,"deathProbable":null,"totalTestEncountersViral":null,"totalTestsPeopleViral":206574,"totalTestsAntibody":null,"positiveTestsAntibody":null,"negativeTestsAntibody":null,"totalTestsPeopleAntibody":null,"positiveTestsPeopleAntibody":null,"negativeTestsPeopleAntibody":null,"totalTestsPeopleAntigen":null,"positiveTestsPeopleAntigen":null,"totalTestsAntigen":null,"positiveTestsAntigen":null,"fips":"56","positiveIncrease":295,"negativeIncrease":0,"total":214164,"totalTestResultsIncrease":0,"posNeg":214164,"dataQualityGrade":null,"deathIncrease":0,"hospitalizedIncrease":8,"hash":"98ab00f5e12a58a30106434f0a61d07b935efe53","commercialScore":0,"negativeRegularScore":0,"negativeScore":0,"positiveScore":0,"score":0,"grade":""},{"date":20210116,"state":"WY","positive":49068,"probableCases":7151,"negative":164801,"pending":null,"totalTestResultsSource":"totalTestsViral","totalTestResults":549805,"hospitalizedCurrently":86,"hospitalizedCumulative":1215,"inIcuCurrently":null,"inIcuCumulative":null,"onVentilatorCurrently":null,"onVentilatorCumulative":null,"recovered":46734,"lastUpdateEt":"1/16/2021 00:00","dateModified":"2021-01-16T00:00:00Z","checkTimeEt":"01/15 19:00","death":522,"hospitalized":1215,"hospitalizedDischarged":null,"dateChecked":"2021-01-16T00:00:00Z","totalTestsViral":549805,"positiveTestsViral":42087,"negativeTestsViral":507680,"positiveCasesViral":41917,"deathConfirmed":null,"deathProbable":null,"totalTestEncountersViral":null,"totalTestsPeopleViral":206574,"totalTestsAntibody":null,"positiveTestsAntibody":null,"negativeTestsAntibody":null,"totalTestsPeopleAntibody":null,"positiveTestsPeopleAntibody":null,"negativeTestsPeopleAntibody":null,"totalTestsPeopleAntigen":null,"positiveTestsPeopleAntigen":null,"totalTestsAntigen":null,"positiveTestsAntigen":null,"fips":"56","positiveIncrease":159,"negativeIncrease":0,"total":213869,"totalTestResultsIncrease":0,"posNeg":213869,"dataQualityGrade":null,"deathIncrease":0,"hospitalizedIncrease":4,"hash":"ca7c2d538dccebebd9cd4745a8097f193333e707","commercialScore":0,"negativeRegularScore":0,"negativeScore":0,"positiveScore":0,"score":0,"grade":""},{"date":20210115,"state":"WY","positive":48909,"probableCases":7136,"negative":164801,"pending":null,"totalTestResultsSource":"totalTestsViral","totalTestResults":549805,"hospitalizedCurrently":89,"hospitalizedCumulative":1211,"inIcuCurrently":null,"inIcuCumulative":null,"onVentilatorCurrently":null,"onVentilatorCumulative":null,"recovered":46502,"lastUpdateEt":"1/15/2021 00:00","dateModified":"2021-01-15T00:00:00Z","checkTimeEt":"01/14 19:00","death":522,"hospitalized":1211,"hospitalizedDischarged":null,"dateChecked":"2021-01-15T00:00:00Z","totalTestsViral":549805,"positiveTestsViral":42087,"negativeTestsViral":507680,"positiveCasesViral":41773,"deathConfirmed":null,"deathProbable":null,"totalTestEncountersViral":null,"totalTestsPeopleViral":206574,"totalTestsAntibody":null,"positiveTestsAntibody":null,"negativeTestsAntibody":null,"totalTestsPeopleAntibody":null,"positiveTestsPeopleAntibody":null,"negativeTestsPeopleAntibody":null,"totalTestsPeopleAntigen":null,"positiveTestsPeopleAntigen":null,"totalTestsAntigen":null,"positiveTestsAntigen":null,"fips":"56","positiveIncrease":208,"negativeIncrease":2173,"total":213710,"totalTestResultsIncrease":7489,"posNeg":213710,"dataQualityGrade":null,"deathIncrease":0,"hospitalizedIncrease":4,"hash":"12ab3e64dd46d09947b4ef035869e57c9e6a89d9","commercialScore":0,"negativeRegularScore":0,"negativeScore":0,"positiveScore":0,"score":0,"grade":""},{"date":20210114,"state":"WY","positive":48701,"probableCases":7073,"negative":162628,"pending":null,"totalTestResultsSource":"totalTestsViral","totalTestResults":542316,"hospitalizedCurrently":89,"hospitalizedCumulative":1207,"inIcuCurrently":null,"inIcuCumulative":null,"onVentilatorCurrently":null,"onVentilatorCumulative":null,"recovered":46127,"lastUpdateEt":"1/14/2021 00:00","dateModified":"2021-01-14T00:00:00Z","checkTimeEt":"01/13 19:00","death":522,"hospitalized":1207,"hospitalizedDischarged":null,"dateChecked":"2021-01-14T00:00:00Z","totalTestsViral":542316,"positiveTestsViral":41241,"negativeTestsViral":501049,"positiveCasesViral":41628,"deathConfirmed":null,"deathProbable":null,"totalTestEncountersViral":null,"totalTestsPeopleViral":204256,"totalTestsAntibody":null,"positiveTestsAntibody":null,"negativeTestsAntibody":null,"totalTestsPeopleAntibody":null,"positiveTestsPeopleAntibody":null,"negativeTestsPeopleAntibody":null,"totalTestsPeopleAntigen":null,"positiveTestsPeopleAntigen":null,"totalTestsAntigen":null,"positiveTestsAntigen":null,"fips":"56","positiveIncrease":412,"negativeIncrease":220,"total":211329,"totalTestResultsIncrease":4637,"posNeg":211329,"dataQualityGrade":null,"deathIncrease":0,"hospitalizedIncrease":10,"hash":"6c12db63b377161a93b429d85c5851ea5c58bc88","commercialScore":0,"negativeRegularScore":0,"negativeScore":0,"positiveScore":0,"score":0,"grade":""},{"date":20210113,"state":"WY","positive":48289,"probableCases":7006,"negative":162408,"pending":null,"totalTestResultsSource":"totalTestsViral","totalTestResults":537679,"hospitalizedCurrently":82,"hospitalizedCumulative":1197,"inIcuCurrently":null,"inIcuCumulative":null,"onVentilatorCurrently":null,"onVentilatorCumulative":null,"recovered":45904,"lastUpdateEt":"1/13/2021 00:00","dateModified":"2021-01-13T00:00:00Z","checkTimeEt":"01/12 19:00","death":522,"hospitalized":1197,"hospitalizedDischarged":null,"dateChecked":"2021-01-13T00:00:00Z","totalTestsViral":537679,"positiveTestsViral":41036,"negativeTestsViral":496617,"positiveCasesViral":41283,"deathConfirmed":null,"deathProbable":null,"totalTestEncountersViral":null,"totalTestsPeopleViral":203691,"totalTestsAntibody":null,"positiveTestsAntibody":null,"negativeTestsAntibody":null,"totalTestsPeopleAntibody":null,"positiveTestsPeopleAntibody":null,"negativeTestsPeopleAntibody":null,"totalTestsPeopleAntigen":null,"positiveTestsPeopleAntigen":null,"totalTestsAntigen":null,"positiveTestsAntigen":null,"fips":"56","positiveIncrease":217,"negativeIncrease":221,"total":210697,"totalTestResultsIncrease":1609,"posNeg":210697,"dataQualityGrade":null,"deathIncrease":0,"hospitalizedIncrease":5,"hash":"028919191b29283b00e18a0348f1c40314b7734d","commercialScore":0,"negativeRegularScore":0,"negativeScore":0,"positiveScore":0,"score":0,"grade":""},{"date":20210112,"state":"WY","positive":48072,"probableCases":6956,"negative":162187,"pending":null,"totalTestResultsSource":"totalTestsViral","totalTestResults":536070,"hospitalizedCurrently":106,"hospitalizedCumulative":1192,"inIcuCurrently":null,"inIcuCumulative":null,"onVentilatorCurrently":null,"onVentilatorCumulative":null,"recovered":45223,"lastUpdateEt":"1/12/2021 00:00","dateModified":"2021-01-12T00:00:00Z","checkTimeEt":"01/11 19:00","death":522,"hospitalized":1192,"hospitalizedDischarged":null,"dateChecked":"2021-01-12T00:00:00Z","totalTestsViral":536070,"positiveTestsViral":40935,"negativeTestsViral":495110,"positiveCasesViral":41116,"deathConfirmed":null,"deathProbable":null,"totalTestEncountersViral":null,"totalTestsPeopleViral":203303,"totalTestsAntibody":null,"positiveTestsAntibody":null,"negativeTestsAntibody":null,"totalTestsPeopleAntibody":null,"positiveTestsPeopleAntibody":null,"negativeTestsPeopleAntibody":null,"totalTestsPeopleAntigen":null,"positiveTestsPeopleAntigen":null,"totalTestsAntigen":null,"positiveTestsAntigen":null,"fips":"56","positiveIncrease":677,"negativeIncrease":-85,"total":210259,"totalTestResultsIncrease":1456,"posNeg":210259,"dataQualityGrade":null,"deathIncrease":33,"hospitalizedIncrease":-24,"hash":"b0e8be3191fc35932ebc6f7f647d617a6d2ab0f6","commercialScore":0,"negativeRegularScore":0,"negativeScore":0,"positiveScore":0,"score":0,"grade":""},{"date":20210111,"state":"WY","positive":47395,"probableCases":6841,"negative":162272,"pending":null,"totalTestResultsSource":"totalTestsViral","totalTestResults":534614,"hospitalizedCurrently":98,"hospitalizedCumulative":1216,"inIcuCurrently":null,"inIcuCumulative":null,"onVentilatorCurrently":null,"onVentilatorCumulative":null,"recovered":44982,"lastUpdateEt":"1/11/2021 00:00","dateModified":"2021-01-11T00:00:00Z","checkTimeEt":"01/10 19:00","death":489,"hospitalized":1216,"hospitalizedDischarged":null,"dateChecked":"2021-01-11T00:00:00Z","totalTestsViral":534614,"positiveTestsViral":40816,"negativeTestsViral":493776,"positiveCasesViral":40554,"deathConfirmed":null,"deathProbable":null,"totalTestEncountersViral":null,"totalTestsPeopleViral":202826,"totalTestsAntibody":null,"positiveTestsAntibody":null,"negativeTestsAntibody":null,"totalTestsPeopleAntibody":null,"positiveTestsPeopleAntibody":null,"negativeTestsPeopleAntibody":null,"totalTestsPeopleAntigen":null,"positiveTestsPeopleAntigen":null,"totalTestsAntigen":null,"positiveTestsAntigen":null,"fips":"56","positiveIncrease":563,"negativeIncrease":581,"total":209667,"totalTestResultsIncrease":6477,"posNeg":209667,"dataQualityGrade":null,"deathIncrease":0,"hospitalizedIncrease":16,"hash":"db093a04bb24f1e50e8d289edd997e1e70b3ca0e","commercialScore":0,"negativeRegularScore":0,"negativeScore":0,"positiveScore":0,"score":0,"grade":""},{"date":20210110,"state":"WY","positive":46832,"probableCases":6819,"negative":161691,"pending":null,"totalTestResultsSource":"totalTestsViral","totalTestResults":528137,"hospitalizedCurrently":108,"hospitalizedCumulative":1200,"inIcuCurrently":null,"inIcuCumulative":null,"onVentilatorCurrently":null,"onVentilatorCumulative":null,"recovered":44556,"lastUpdateEt":"1/10/2021 00:00","dateModified":"2021-01-10T00:00:00Z","checkTimeEt":"01/09 19:00","death":489,"hospitalized":1200,"hospitalizedDischarged":null,"dateChecked":"2021-01-10T00:00:00Z","totalTestsViral":528137,"positiveTestsViral":40391,"negativeTestsViral":487724,"positiveCasesViral":40013,"deathConfirmed":null,"deathProbable":null,"totalTestEncountersViral":null,"totalTestsPeopleViral":201573,"totalTestsAntibody":null,"positiveTestsAntibody":null,"negativeTestsAntibody":null,"totalTestsPeopleAntibody":null,"positiveTestsPeopleAntibody":null,"negativeTestsPeopleAntibody":null,"totalTestsPeopleAntigen":null,"positiveTestsPeopleAntigen":null,"totalTestsAntigen":null,"positiveTestsAntigen":null,"fips":"56","positiveIncrease":113,"negativeIncrease":0,"total":208523,"totalTestResultsIncrease":0,"posNeg":208523,"dataQualityGrade":null,"deathIncrease":0,"hospitalizedIncrease":3,"hash":"2701ccfd686b937f6b316319e115b130f45940e9","commercialScore":0,"negativeRegularScore":0,"negativeScore":0,"positiveScore":0,"score":0,"grade":""},{"date":20210109,"state":"WY","positive":46719,"probableCases":6794,"negative":161691,"pending":null,"totalTestResultsSource":"totalTestsViral","totalTestResults":528137,"hospitalizedCurrently":108,"hospitalizedCumulative":1197,"inIcuCurrently":null,"inIcuCumulative":null,"onVentilatorCurrently":null,"onVentilatorCumulative":null,"recovered":44490,"lastUpdateEt":"1/9/2021 00:00","dateModified":"2021-01-09T00:00:00Z","checkTimeEt":"01/08 19:00","death":489,"hospitalized":1197,"hospitalizedDischarged":null,"dateChecked":"2021-01-09T00:00:00Z","totalTestsViral":528137,"positiveTestsViral":40391,"negativeTestsViral":487724,"positiveCasesViral":39925,"deathConfirmed":null,"deathProbable":null,"totalTestEncountersViral":null,"totalTestsPeopleViral":201573,"totalTestsAntibody":null,"positiveTestsAntibody":null,"negativeTestsAntibody":null,"totalTestsPeopleAntibody":null,"positiveTestsPeopleAntibody":null,"negativeTestsPeopleAntibody":null,"totalTestsPeopleAntigen":null,"positiveTestsPeopleAntigen":null,"totalTestsAntigen":null,"positiveTestsAntigen":null,"fips":"56","positiveIncrease":72,"negativeIncrease":0,"total":208410,"totalTestResultsIncrease":0,"posNeg":208410,"dataQualityGrade":null,"deathIncrease":0,"hospitalizedIncrease":1,"hash":"b34d76ceb9e1157efc546f96c997d1ffd707e4e7","commercialScore":0,"negativeRegularScore":0,"negativeScore":0,"positiveScore":0,"score":0,"grade":""},{"date":20210108,"state":"WY","positive":46647,"probableCases":6765,"negative":161691,"pending":null,"totalTestResultsSource":"totalTestsViral","totalTestResults":528137,"hospitalizedCurrently":108,"hospitalizedCumulative":1196,"inIcuCurrently":null,"inIcuCumulative":null,"onVentilatorCurrently":null,"onVentilatorCumulative":null,"recovered":44279,"lastUpdateEt":"1/8/2021 00:00","dateModified":"2021-01-08T00:00:00Z","checkTimeEt":"01/07 19:00","death":489,"hospitalized":1196,"hospitalizedDischarged":null,"dateChecked":"2021-01-08T00:00:00Z","totalTestsViral":528137,"positiveTestsViral":40391,"negativeTestsViral":487724,"positiveCasesViral":39882,"deathConfirmed":null,"deathProbable":null,"totalTestEncountersViral":null,"totalTestsPeopleViral":201573,"totalTestsAntibody":null,"positiveTestsAntibody":null,"negativeTestsAntibody":null,"totalTestsPeopleAntibody":null,"positiveTestsPeopleAntibody":null,"negativeTestsPeopleAntibody":null,"totalTestsPeopleAntigen":null,"positiveTestsPeopleAntigen":null,"totalTestsAntigen":null,"positiveTestsAntigen":null,"fips":"56","positiveIncrease":479,"negativeIncrease":424,"total":208338,"totalTestResultsIncrease":5449,"posNeg":208338,"dataQualityGrade":null,"deathIncrease":0,"hospitalizedIncrease":12,"hash":"fecea2e7795db547f442b2eb563ef1c67a13c6b4","commercialScore":0,"negativeRegularScore":0,"negativeScore":0,"positiveScore":0,"score":0,"grade":""},{"date":20210107,"state":"WY","positive":46168,"probableCases":6692,"negative":161267,"pending":null,"totalTestResultsSource":"totalTestsViral","totalTestResults":522688,"hospitalizedCurrently":112,"hospitalizedCumulative":1184,"inIcuCurrently":null,"inIcuCumulative":null,"onVentilatorCurrently":null,"onVentilatorCumulative":null,"recovered":43949,"lastUpdateEt":"1/7/2021 00:00","dateModified":"2021-01-07T00:00:00Z","checkTimeEt":"01/06 19:00","death":489,"hospitalized":1184,"hospitalizedDischarged":null,"dateChecked":"2021-01-07T00:00:00Z","totalTestsViral":522688,"positiveTestsViral":40097,"negativeTestsViral":482574,"positiveCasesViral":39476,"deathConfirmed":null,"deathProbable":null,"totalTestEncountersViral":null,"totalTestsPeopleViral":200743,"totalTestsAntibody":null,"positiveTestsAntibody":null,"negativeTestsAntibody":null,"totalTestsPeopleAntibody":null,"positiveTestsPeopleAntibody":null,"negativeTestsPeopleAntibody":null,"totalTestsPeopleAntigen":null,"positiveTestsPeopleAntigen":null,"totalTestsAntigen":null,"positiveTestsAntigen":null,"fips":"56","positiveIncrease":278,"negativeIncrease":200,"total":207435,"totalTestResultsIncrease":4849,"posNeg":207435,"dataQualityGrade":null,"deathIncrease":25,"hospitalizedIncrease":8,"hash":"b71515a6324c9f6fc72c9fa36b4a7ba6cd3bebd9","commercialScore":0,"negativeRegularScore":0,"negativeScore":0,"positiveScore":0,"score":0,"grade":""},{"date":20210106,"state":"WY","positive":45890,"probableCases":6675,"negative":161067,"pending":null,"totalTestResultsSource":"totalTestsViral","totalTestResults":517839,"hospitalizedCurrently":112,"hospitalizedCumulative":1176,"inIcuCurrently":null,"inIcuCumulative":null,"onVentilatorCurrently":null,"onVentilatorCumulative":null,"recovered":43642,"lastUpdateEt":"1/6/2021 00:00","dateModified":"2021-01-06T00:00:00Z","checkTimeEt":"01/05 19:00","death":464,"hospitalized":1176,"hospitalizedDischarged":null,"dateChecked":"2021-01-06T00:00:00Z","totalTestsViral":517839,"positiveTestsViral":39842,"negativeTestsViral":477981,"positiveCasesViral":39215,"deathConfirmed":null,"deathProbable":null,"totalTestEncountersViral":null,"totalTestsPeopleViral":200282,"totalTestsAntibody":null,"positiveTestsAntibody":null,"negativeTestsAntibody":null,"totalTestsPeopleAntibody":null,"positiveTestsPeopleAntibody":null,"negativeTestsPeopleAntibody":null,"totalTestsPeopleAntigen":null,"positiveTestsPeopleAntigen":null,"totalTestsAntigen":null,"positiveTestsAntigen":null,"fips":"56","positiveIncrease":321,"negativeIncrease":240,"total":206957,"totalTestResultsIncrease":2312,"posNeg":206957,"dataQualityGrade":null,"deathIncrease":0,"hospitalizedIncrease":8,"hash":"f674ba89c741e43f2ab4810e76513634c646a959","commercialScore":0,"negativeRegularScore":0,"negativeScore":0,"positiveScore":0,"score":0,"grade":""},{"date":20210105,"state":"WY","positive":45569,"probableCases":6615,"negative":160827,"pending":null,"totalTestResultsSource":"totalTestsViral","totalTestResults":515527,"hospitalizedCurrently":114,"hospitalizedCumulative":1168,"inIcuCurrently":null,"inIcuCumulative":null,"onVentilatorCurrently":null,"onVentilatorCumulative":null,"recovered":43563,"lastUpdateEt":"1/5/2021 00:00","dateModified":"2021-01-05T00:00:00Z","checkTimeEt":"01/04 19:00","death":464,"hospitalized":1168,"hospitalizedDischarged":null,"dateChecked":"2021-01-05T00:00:00Z","totalTestsViral":515527,"positiveTestsViral":38891,"negativeTestsViral":462878,"positiveCasesViral":38954,"deathConfirmed":null,"deathProbable":null,"totalTestEncountersViral":null,"totalTestsPeopleViral":199781,"totalTestsAntibody":null,"positiveTestsAntibody":null,"negativeTestsAntibody":null,"totalTestsPeopleAntibody":null,"positiveTestsPeopleAntibody":null,"negativeTestsPeopleAntibody":null,"totalTestsPeopleAntigen":null,"positiveTestsPeopleAntigen":null,"totalTestsAntigen":null,"positiveTestsAntigen":null,"fips":"56","positiveIncrease":322,"negativeIncrease":154,"total":206396,"totalTestResultsIncrease":1193,"posNeg":206396,"dataQualityGrade":null,"deathIncrease":26,"hospitalizedIncrease":45,"hash":"e7df20ce3630becba48d128913e98c15fe657d20","commercialScore":0,"negativeRegularScore":0,"negativeScore":0,"positiveScore":0,"score":0,"grade":""},{"date":20210104,"state":"WY","positive":45247,"probableCases":6505,"negative":160673,"pending":null,"totalTestResultsSource":"totalTestsViral","totalTestResults":514334,"hospitalizedCurrently":114,"hospitalizedCumulative":1123,"inIcuCurrently":null,"inIcuCumulative":null,"onVentilatorCurrently":null,"onVentilatorCumulative":null,"recovered":43420,"lastUpdateEt":"1/4/2021 00:00","dateModified":"2021-01-04T00:00:00Z","checkTimeEt":"01/03 19:00","death":438,"hospitalized":1123,"hospitalizedDischarged":null,"dateChecked":"2021-01-04T00:00:00Z","totalTestsViral":514334,"positiveTestsViral":38891,"negativeTestsViral":462878,"positiveCasesViral":38742,"deathConfirmed":null,"deathProbable":null,"totalTestEncountersViral":null,"totalTestsPeopleViral":199415,"totalTestsAntibody":null,"positiveTestsAntibody":null,"negativeTestsAntibody":null,"totalTestsPeopleAntibody":null,"positiveTestsPeopleAntibody":null,"negativeTestsPeopleAntibody":null,"totalTestsPeopleAntigen":null,"positiveTestsPeopleAntigen":null,"totalTestsAntigen":null,"positiveTestsAntigen":null,"fips":"56","positiveIncrease":372,"negativeIncrease":1145,"total":205920,"totalTestResultsIncrease":12550,"posNeg":205920,"dataQualityGrade":null,"deathIncrease":0,"hospitalizedIncrease":9,"hash":"8075ea86ea64a0a2b6a118ba4d9a98534b92916f","commercialScore":0,"negativeRegularScore":0,"negativeScore":0,"positiveScore":0,"score":0,"grade":""},{"date":20210103,"state":"WY","positive":44875,"probableCases":6435,"negative":159528,"pending":null,"totalTestResultsSource":"totalTestsViral","totalTestResults":501784,"hospitalizedCurrently":99,"hospitalizedCumulative":1114,"inIcuCurrently":null,"inIcuCumulative":null,"onVentilatorCurrently":null,"onVentilatorCumulative":null,"recovered":43068,"lastUpdateEt":"1/3/2021 00:00","dateModified":"2021-01-03T00:00:00Z","checkTimeEt":"01/02 19:00","death":438,"hospitalized":1114,"hospitalizedDischarged":null,"dateChecked":"2021-01-03T00:00:00Z","totalTestsViral":501784,"positiveTestsViral":38891,"negativeTestsViral":462878,"positiveCasesViral":38440,"deathConfirmed":null,"deathProbable":null,"totalTestEncountersViral":null,"totalTestsPeopleViral":197538,"totalTestsAntibody":null,"positiveTestsAntibody":null,"negativeTestsAntibody":null,"totalTestsPeopleAntibody":null,"positiveTestsPeopleAntibody":null,"negativeTestsPeopleAntibody":null,"totalTestsPeopleAntigen":null,"positiveTestsPeopleAntigen":null,"totalTestsAntigen":null,"positiveTestsAntigen":null,"fips":"56","positiveIncrease":302,"negativeIncrease":0,"total":204403,"totalTestResultsIncrease":0,"posNeg":204403,"dataQualityGrade":null,"deathIncrease":0,"hospitalizedIncrease":8,"hash":"c1ef4cd9607674e0499a321db8dde7aa82c04768","commercialScore":0,"negativeRegularScore":0,"negativeScore":0,"positiveScore":0,"score":0,"grade":""},{"date":20210102,"state":"WY","positive":44573,"probableCases":6410,"negative":159528,"pending":null,"totalTestResultsSource":"totalTestsViral","totalTestResults":501784,"hospitalizedCurrently":95,"hospitalizedCumulative":1106,"inIcuCurrently":null,"inIcuCumulative":null,"onVentilatorCurrently":null,"onVentilatorCumulative":null,"recovered":43037,"lastUpdateEt":"1/2/2021 00:00","dateModified":"2021-01-02T00:00:00Z","checkTimeEt":"01/01 19:00","death":438,"hospitalized":1106,"hospitalizedDischarged":null,"dateChecked":"2021-01-02T00:00:00Z","totalTestsViral":501784,"positiveTestsViral":38891,"negativeTestsViral":462878,"positiveCasesViral":38163,"deathConfirmed":null,"deathProbable":null,"totalTestEncountersViral":null,"totalTestsPeopleViral":197538,"totalTestsAntibody":null,"positiveTestsAntibody":null,"negativeTestsAntibody":null,"totalTestsPeopleAntibody":null,"positiveTestsPeopleAntibody":null,"negativeTestsPeopleAntibody":null,"totalTestsPeopleAntigen":null,"positiveTestsPeopleAntigen":null,"totalTestsAntigen":null,"positiveTestsAntigen":null,"fips":"56","positiveIncrease":164,"negativeIncrease":0,"total":204101,"totalTestResultsIncrease":0,"posNeg":204101,"dataQualityGrade":null,"deathIncrease":0,"hospitalizedIncrease":4,"hash":"33b104b41c66f444c58c32b7a9443b66521165a3","commercialScore":0,"negativeRegularScore":0,"negativeScore":0,"positiveScore":0,"score":0,"grade":""},{"date":20210101,"state":"WY","positive":44409,"probableCases":6399,"negative":159528,"pending":null,"totalTestResultsSource":"totalTestsViral","totalTestResults":501784,"hospitalizedCurrently":113,"hospitalizedCumulative":1102,"inIcuCurrently":null,"inIcuCumulative":null,"onVentilatorCurrently":null,"onVentilatorCumulative":null,"recovered":42570,"lastUpdateEt":"12/31/2020 00:00","dateModified":"2020-12-31T00:00:00Z","checkTimeEt":"12/30 19:00","death":438,"hospitalized":1102,"hospitalizedDischarged":null,"dateChecked":"2020-12-31T00:00:00Z","totalTestsViral":501784,"positiveTestsViral":38891,"negativeTestsViral":462878,"positiveCasesViral":38010,"deathConfirmed":null,"deathProbable":null,"totalTestEncountersViral":null,"totalTestsPeopleViral":197538,"totalTestsAntibody":null,"positiveTestsAntibody":null,"negativeTestsAntibody":null,"totalTestsPeopleAntibody":null,"positiveTestsPeopleAntibody":null,"negativeTestsPeopleAntibody":null,"totalTestsPeopleAntigen":null,"positiveTestsPeopleAntigen":null,"totalTestsAntigen":null,"positiveTestsAntigen":null,"fips":"56","positiveIncrease":0,"negativeIncrease":0,"total":203937,"totalTestResultsIncrease":0,"posNeg":203937,"dataQualityGrade":null,"deathIncrease":0,"hospitalizedIncrease":0,"hash":"c3c0fda5a314e87fb5c3ca146cfca40d107033eb","commercialScore":0,"negativeRegularScore":0,"negativeScore":0,"positiveScore":0,"score":0,"grade":""},{"date":20201231,"state":"WY","positive":44409,"probableCases":6399,"negative":159528,"pending":null,"totalTestResultsSource":"totalTestsViral","totalTestResults":501784,"hospitalizedCurrently":113,"hospitalizedCumulative":1102,"inIcuCurrently":null,"inIcuCumulative":null,"onVentilatorCurrently":null,"onVentilatorCumulative":null,"recovered":42570,"lastUpdateEt":"12/31/2020 00:00","dateModified":"2020-12-31T00:00:00Z","checkTimeEt":"12/30 19:00","death":438,"hospitalized":1102,"hospitalizedDischarged":null,"dateChecked":"2020-12-31T00:00:00Z","totalTestsViral":501784,"positiveTestsViral":38891,"negativeTestsViral":462878,"positiveCasesViral":38010,"deathConfirmed":null,"deathProbable":null,"totalTestEncountersViral":null,"totalTestsPeopleViral":197538,"totalTestsAntibody":null,"positiveTestsAntibody":null,"negativeTestsAntibody":null,"totalTestsPeopleAntibody":null,"positiveTestsPeopleAntibody":null,"negativeTestsPeopleAntibody":null,"totalTestsPeopleAntigen":null,"positiveTestsPeopleAntigen":null,"totalTestsAntigen":null,"positiveTestsAntigen":null,"fips":"56","positiveIncrease":276,"negativeIncrease":598,"total":203937,"totalTestResultsIncrease":3721,"posNeg":203937,"dataQualityGrade":null,"deathIncrease":33,"hospitalizedIncrease":6,"hash":"a145f6e14ea42b6a7ce52c20da43e90e7eaee93c","commercialScore":0,"negativeRegularScore":0,"negativeScore":0,"positiveScore":0,"score":0,"grade":""},{"date":20201230,"state":"WY","positive":44133,"probableCases":6335,"negative":158930,"pending":null,"totalTestResultsSource":"totalTestsViral","totalTestResults":498063,"hospitalizedCurrently":113,"hospitalizedCumulative":1096,"inIcuCurrently":null,"inIcuCumulative":null,"onVentilatorCurrently":null,"onVentilatorCumulative":null,"recovered":42197,"lastUpdateEt":"12/30/2020 00:00","dateModified":"2020-12-30T00:00:00Z","checkTimeEt":"12/29 19:00","death":405,"hospitalized":1096,"hospitalizedDischarged":null,"dateChecked":"2020-12-30T00:00:00Z","totalTestsViral":498063,"positiveTestsViral":38651,"negativeTestsViral":459398,"positiveCasesViral":37798,"deathConfirmed":null,"deathProbable":null,"totalTestEncountersViral":null,"totalTestsPeopleViral":196728,"totalTestsAntibody":null,"positiveTestsAntibody":null,"negativeTestsAntibody":null,"totalTestsPeopleAntibody":null,"positiveTestsPeopleAntibody":null,"negativeTestsPeopleAntibody":null,"totalTestsPeopleAntigen":null,"positiveTestsPeopleAntigen":null,"totalTestsAntigen":null,"positiveTestsAntigen":null,"fips":"56","positiveIncrease":210,"negativeIncrease":522,"total":203063,"totalTestResultsIncrease":3672,"posNeg":203063,"dataQualityGrade":null,"deathIncrease":0,"hospitalizedIncrease":3,"hash":"8973d737b84d05056a7121ca2ca5ad8a3079304f","commercialScore":0,"negativeRegularScore":0,"negativeScore":0,"positiveScore":0,"score":0,"grade":""},{"date":20201229,"state":"WY","positive":43923,"probableCases":6203,"negative":158408,"pending":null,"totalTestResultsSource":"totalTestsViral","totalTestResults":494391,"hospitalizedCurrently":119,"hospitalizedCumulative":1093,"inIcuCurrently":null,"inIcuCumulative":null,"onVentilatorCurrently":null,"onVentilatorCumulative":null,"recovered":42123,"lastUpdateEt":"12/29/2020 16:06","dateModified":"2020-12-29T16:06:00Z","checkTimeEt":"12/29 11:06","death":405,"hospitalized":1093,"hospitalizedDischarged":null,"dateChecked":"2020-12-29T16:06:00Z","totalTestsViral":494391,"positiveTestsViral":38439,"negativeTestsViral":455938,"positiveCasesViral":37720,"deathConfirmed":null,"deathProbable":null,"totalTestEncountersViral":null,"totalTestsPeopleViral":196128,"totalTestsAntibody":null,"positiveTestsAntibody":null,"negativeTestsAntibody":null,"totalTestsPeopleAntibody":null,"positiveTestsPeopleAntibody":null,"negativeTestsPeopleAntibody":null,"totalTestsPeopleAntigen":null,"positiveTestsPeopleAntigen":null,"totalTestsAntigen":null,"positiveTestsAntigen":null,"fips":"56","positiveIncrease":219,"negativeIncrease":231,"total":202331,"totalTestResultsIncrease":1311,"posNeg":202331,"dataQualityGrade":null,"deathIncrease":0,"hospitalizedIncrease":40,"hash":"459cd47fb4597b7a7392260d1da38b99f7571055","commercialScore":0,"negativeRegularScore":0,"negativeScore":0,"positiveScore":0,"score":0,"grade":""},{"date":20201228,"state":"WY","positive":43704,"probableCases":6081,"negative":158177,"pending":null,"totalTestResultsSource":"totalTestsViral","totalTestResults":493080,"hospitalizedCurrently":115,"hospitalizedCumulative":1053,"inIcuCurrently":null,"inIcuCumulative":null,"onVentilatorCurrently":null,"onVentilatorCumulative":null,"recovered":41878,"lastUpdateEt":"12/28/2020 00:00","dateModified":"2020-12-28T00:00:00Z","checkTimeEt":"12/27 19:00","death":405,"hospitalized":1053,"hospitalizedDischarged":null,"dateChecked":"2020-12-28T00:00:00Z","totalTestsViral":493080,"positiveTestsViral":38363,"negativeTestsViral":454706,"positiveCasesViral":37623,"deathConfirmed":null,"deathProbable":null,"totalTestEncountersViral":null,"totalTestsPeopleViral":195800,"totalTestsAntibody":null,"positiveTestsAntibody":null,"negativeTestsAntibody":null,"totalTestsPeopleAntibody":null,"positiveTestsPeopleAntibody":null,"negativeTestsPeopleAntibody":null,"totalTestsPeopleAntigen":null,"positiveTestsPeopleAntigen":null,"totalTestsAntigen":null,"positiveTestsAntigen":null,"fips":"56","positiveIncrease":504,"negativeIncrease":2123,"total":201881,"totalTestResultsIncrease":14729,"posNeg":201881,"dataQualityGrade":null,"deathIncrease":32,"hospitalizedIncrease":13,"hash":"e7a2c68f484fe3c3e7ab256835045a506b53916e","commercialScore":0,"negativeRegularScore":0,"negativeScore":0,"positiveScore":0,"score":0,"grade":""},{"date":20201227,"state":"WY","positive":43200,"probableCases":6033,"negative":156054,"pending":null,"totalTestResultsSource":"totalTestsViral","totalTestResults":478351,"hospitalizedCurrently":146,"hospitalizedCumulative":1040,"inIcuCurrently":null,"inIcuCumulative":null,"onVentilatorCurrently":null,"onVentilatorCumulative":null,"recovered":41346,"lastUpdateEt":"12/27/2020 00:00","dateModified":"2020-12-27T00:00:00Z","checkTimeEt":"12/26 19:00","death":373,"hospitalized":1040,"hospitalizedDischarged":null,"dateChecked":"2020-12-27T00:00:00Z","totalTestsViral":478351,"positiveTestsViral":37502,"negativeTestsViral":440841,"positiveCasesViral":37167,"deathConfirmed":null,"deathProbable":null,"totalTestEncountersViral":null,"totalTestsPeopleViral":192754,"totalTestsAntibody":null,"positiveTestsAntibody":null,"negativeTestsAntibody":null,"totalTestsPeopleAntibody":null,"positiveTestsPeopleAntibody":null,"negativeTestsPeopleAntibody":null,"totalTestsPeopleAntigen":null,"positiveTestsPeopleAntigen":null,"totalTestsAntigen":null,"positiveTestsAntigen":null,"fips":"56","positiveIncrease":54,"negativeIncrease":0,"total":199254,"totalTestResultsIncrease":0,"posNeg":199254,"dataQualityGrade":null,"deathIncrease":0,"hospitalizedIncrease":1,"hash":"a33795c6c380d2dad78d6ad2440b428c73a626b0","commercialScore":0,"negativeRegularScore":0,"negativeScore":0,"positiveScore":0,"score":0,"grade":""},{"date":20201226,"state":"WY","positive":43146,"probableCases":6017,"negative":156054,"pending":null,"totalTestResultsSource":"totalTestsViral","totalTestResults":478351,"hospitalizedCurrently":146,"hospitalizedCumulative":1039,"inIcuCurrently":null,"inIcuCumulative":null,"onVentilatorCurrently":null,"onVentilatorCumulative":null,"recovered":40423,"lastUpdateEt":"12/26/2020 00: