[{"date":20210307,"state":"CT","positive":285330,"probableCases":19621,"negative":null,"pending":null,"totalTestResultsSource":"totalTestsViral","totalTestResults":6520366,"hospitalizedCurrently":428,"hospitalizedCumulative":null,"inIcuCurrently":null,"inIcuCumulative":null,"onVentilatorCurrently":null,"onVentilatorCumulative":null,"recovered":null,"lastUpdateEt":"3/4/2021 23:59","dateModified":"2021-03-04T23:59:00Z","checkTimeEt":"03/04 18:59","death":7704,"hospitalized":null,"hospitalizedDischarged":null,"dateChecked":"2021-03-04T23:59:00Z","totalTestsViral":6520366,"positiveTestsViral":323284,"negativeTestsViral":6188566,"positiveCasesViral":265709,"deathConfirmed":6327,"deathProbable":1377,"totalTestEncountersViral":null,"totalTestsPeopleViral":null,"totalTestsAntibody":null,"positiveTestsAntibody":null,"negativeTestsAntibody":null,"totalTestsPeopleAntibody":null,"positiveTestsPeopleAntibody":null,"negativeTestsPeopleAntibody":null,"totalTestsPeopleAntigen":null,"positiveTestsPeopleAntigen":null,"totalTestsAntigen":396680,"positiveTestsAntigen":22245,"fips":"09","positiveIncrease":0,"negativeIncrease":0,"total":285330,"totalTestResultsIncrease":0,"posNeg":285330,"dataQualityGrade":null,"deathIncrease":0,"hospitalizedIncrease":0,"hash":"38f39494134d22cd0d06e4ce63aa4a4ac10aa930","commercialScore":0,"negativeRegularScore":0,"negativeScore":0,"positiveScore":0,"score":0,"grade":""},{"date":20210306,"state":"CT","positive":285330,"probableCases":19621,"negative":null,"pending":null,"totalTestResultsSource":"totalTestsViral","totalTestResults":6520366,"hospitalizedCurrently":428,"hospitalizedCumulative":null,"inIcuCurrently":null,"inIcuCumulative":null,"onVentilatorCurrently":null,"onVentilatorCumulative":null,"recovered":null,"lastUpdateEt":"3/4/2021 23:59","dateModified":"2021-03-04T23:59:00Z","checkTimeEt":"03/04 18:59","death":7704,"hospitalized":null,"hospitalizedDischarged":null,"dateChecked":"2021-03-04T23:59:00Z","totalTestsViral":6520366,"positiveTestsViral":323284,"negativeTestsViral":6188566,"positiveCasesViral":265709,"deathConfirmed":6327,"deathProbable":1377,"totalTestEncountersViral":null,"totalTestsPeopleViral":null,"totalTestsAntibody":null,"positiveTestsAntibody":null,"negativeTestsAntibody":null,"totalTestsPeopleAntibody":null,"positiveTestsPeopleAntibody":null,"negativeTestsPeopleAntibody":null,"totalTestsPeopleAntigen":null,"positiveTestsPeopleAntigen":null,"totalTestsAntigen":396680,"positiveTestsAntigen":22245,"fips":"09","positiveIncrease":0,"negativeIncrease":0,"total":285330,"totalTestResultsIncrease":0,"posNeg":285330,"dataQualityGrade":null,"deathIncrease":0,"hospitalizedIncrease":0,"hash":"0951e354801a64a05ba03d58d6bdfed350e51930","commercialScore":0,"negativeRegularScore":0,"negativeScore":0,"positiveScore":0,"score":0,"grade":""},{"date":20210305,"state":"CT","positive":285330,"probableCases":19621,"negative":null,"pending":null,"totalTestResultsSource":"totalTestsViral","totalTestResults":6520366,"hospitalizedCurrently":428,"hospitalizedCumulative":null,"inIcuCurrently":null,"inIcuCumulative":null,"onVentilatorCurrently":null,"onVentilatorCumulative":null,"recovered":null,"lastUpdateEt":"3/4/2021 23:59","dateModified":"2021-03-04T23:59:00Z","checkTimeEt":"03/04 18:59","death":7704,"hospitalized":null,"hospitalizedDischarged":null,"dateChecked":"2021-03-04T23:59:00Z","totalTestsViral":6520366,"positiveTestsViral":323284,"negativeTestsViral":6188566,"positiveCasesViral":265709,"deathConfirmed":6327,"deathProbable":1377,"totalTestEncountersViral":null,"totalTestsPeopleViral":null,"totalTestsAntibody":null,"positiveTestsAntibody":null,"negativeTestsAntibody":null,"totalTestsPeopleAntibody":null,"positiveTestsPeopleAntibody":null,"negativeTestsPeopleAntibody":null,"totalTestsPeopleAntigen":null,"positiveTestsPeopleAntigen":null,"totalTestsAntigen":396680,"positiveTestsAntigen":22245,"fips":"09","positiveIncrease":830,"negativeIncrease":0,"total":285330,"totalTestResultsIncrease":41868,"posNeg":285330,"dataQualityGrade":null,"deathIncrease":11,"hospitalizedIncrease":0,"hash":"8a1ae622434681cd6c63327bc0574dee1f12cdc5","commercialScore":0,"negativeRegularScore":0,"negativeScore":0,"positiveScore":0,"score":0,"grade":""},{"date":20210304,"state":"CT","positive":284500,"probableCases":19508,"negative":null,"pending":null,"totalTestResultsSource":"totalTestsViral","totalTestResults":6478498,"hospitalizedCurrently":433,"hospitalizedCumulative":null,"inIcuCurrently":null,"inIcuCumulative":null,"onVentilatorCurrently":null,"onVentilatorCumulative":null,"recovered":null,"lastUpdateEt":"3/3/2021 23:59","dateModified":"2021-03-03T23:59:00Z","checkTimeEt":"03/03 18:59","death":7693,"hospitalized":null,"hospitalizedDischarged":null,"dateChecked":"2021-03-03T23:59:00Z","totalTestsViral":6478498,"positiveTestsViral":322440,"negativeTestsViral":6147613,"positiveCasesViral":264992,"deathConfirmed":6320,"deathProbable":1373,"totalTestEncountersViral":null,"totalTestsPeopleViral":null,"totalTestsAntibody":null,"positiveTestsAntibody":null,"negativeTestsAntibody":null,"totalTestsPeopleAntibody":null,"positiveTestsPeopleAntibody":null,"negativeTestsPeopleAntibody":null,"totalTestsPeopleAntigen":null,"positiveTestsPeopleAntigen":null,"totalTestsAntigen":393486,"positiveTestsAntigen":22088,"fips":"09","positiveIncrease":878,"negativeIncrease":0,"total":284500,"totalTestResultsIncrease":42863,"posNeg":284500,"dataQualityGrade":null,"deathIncrease":15,"hospitalizedIncrease":0,"hash":"5e2d861f439f6e51d56069fcef9e47ab0f1402c7","commercialScore":0,"negativeRegularScore":0,"negativeScore":0,"positiveScore":0,"score":0,"grade":""},{"date":20210303,"state":"CT","positive":283622,"probableCases":19424,"negative":null,"pending":null,"totalTestResultsSource":"totalTestsViral","totalTestResults":6435635,"hospitalizedCurrently":451,"hospitalizedCumulative":null,"inIcuCurrently":null,"inIcuCumulative":null,"onVentilatorCurrently":null,"onVentilatorCumulative":null,"recovered":null,"lastUpdateEt":"3/2/2021 23:59","dateModified":"2021-03-02T23:59:00Z","checkTimeEt":"03/02 18:59","death":7678,"hospitalized":null,"hospitalizedDischarged":null,"dateChecked":"2021-03-02T23:59:00Z","totalTestsViral":6435635,"positiveTestsViral":321537,"negativeTestsViral":6105720,"positiveCasesViral":264198,"deathConfirmed":6306,"deathProbable":1372,"totalTestEncountersViral":null,"totalTestsPeopleViral":null,"totalTestsAntibody":null,"positiveTestsAntibody":null,"negativeTestsAntibody":null,"totalTestsPeopleAntibody":null,"positiveTestsPeopleAntibody":null,"negativeTestsPeopleAntibody":null,"totalTestsPeopleAntigen":null,"positiveTestsPeopleAntigen":null,"totalTestsAntigen":389220,"positiveTestsAntigen":21962,"fips":"09","positiveIncrease":494,"negativeIncrease":0,"total":283622,"totalTestResultsIncrease":17168,"posNeg":283622,"dataQualityGrade":null,"deathIncrease":20,"hospitalizedIncrease":0,"hash":"dd9566d3f2fdc2e5f6a76705c5fc4659d77fc749","commercialScore":0,"negativeRegularScore":0,"negativeScore":0,"positiveScore":0,"score":0,"grade":""},{"date":20210302,"state":"CT","positive":283128,"probableCases":19252,"negative":null,"pending":null,"totalTestResultsSource":"totalTestsViral","totalTestResults":6418467,"hospitalizedCurrently":413,"hospitalizedCumulative":null,"inIcuCurrently":null,"inIcuCumulative":null,"onVentilatorCurrently":null,"onVentilatorCumulative":null,"recovered":null,"lastUpdateEt":"3/1/2021 23:59","dateModified":"2021-03-01T23:59:00Z","checkTimeEt":"03/01 18:59","death":7658,"hospitalized":null,"hospitalizedDischarged":null,"dateChecked":"2021-03-01T23:59:00Z","totalTestsViral":6418467,"positiveTestsViral":321160,"negativeTestsViral":6089025,"positiveCasesViral":263876,"deathConfirmed":6287,"deathProbable":1371,"totalTestEncountersViral":null,"totalTestsPeopleViral":null,"totalTestsAntibody":null,"positiveTestsAntibody":null,"negativeTestsAntibody":null,"totalTestsPeopleAntibody":null,"positiveTestsPeopleAntibody":null,"negativeTestsPeopleAntibody":null,"totalTestsPeopleAntigen":null,"positiveTestsPeopleAntigen":null,"totalTestsAntigen":384222,"positiveTestsAntigen":21744,"fips":"09","positiveIncrease":502,"negativeIncrease":0,"total":283128,"totalTestResultsIncrease":15041,"posNeg":283128,"dataQualityGrade":null,"deathIncrease":7,"hospitalizedIncrease":0,"hash":"8864e5559e9c68362dfebce559987409ec9f582a","commercialScore":0,"negativeRegularScore":0,"negativeScore":0,"positiveScore":0,"score":0,"grade":""},{"date":20210301,"state":"CT","positive":282626,"probableCases":19178,"negative":null,"pending":null,"totalTestResultsSource":"totalTestsViral","totalTestResults":6403426,"hospitalizedCurrently":417,"hospitalizedCumulative":null,"inIcuCurrently":null,"inIcuCumulative":null,"onVentilatorCurrently":null,"onVentilatorCumulative":null,"recovered":null,"lastUpdateEt":"2/28/2021 23:59","dateModified":"2021-02-28T23:59:00Z","checkTimeEt":"02/28 18:59","death":7651,"hospitalized":null,"hospitalizedDischarged":null,"dateChecked":"2021-02-28T23:59:00Z","totalTestsViral":6403426,"positiveTestsViral":320670,"negativeTestsViral":6074561,"positiveCasesViral":263448,"deathConfirmed":6280,"deathProbable":1371,"totalTestEncountersViral":null,"totalTestsPeopleViral":null,"totalTestsAntibody":null,"positiveTestsAntibody":null,"negativeTestsAntibody":null,"totalTestsPeopleAntibody":null,"positiveTestsPeopleAntibody":null,"negativeTestsPeopleAntibody":null,"totalTestsPeopleAntigen":null,"positiveTestsPeopleAntigen":null,"totalTestsAntigen":381930,"positiveTestsAntigen":21643,"fips":"09","positiveIncrease":2680,"negativeIncrease":0,"total":282626,"totalTestResultsIncrease":104149,"posNeg":282626,"dataQualityGrade":null,"deathIncrease":29,"hospitalizedIncrease":0,"hash":"1531b9a08e3e667a3e669a330deead1cad402c13","commercialScore":0,"negativeRegularScore":0,"negativeScore":0,"positiveScore":0,"score":0,"grade":""},{"date":20210228,"state":"CT","positive":279946,"probableCases":18894,"negative":null,"pending":null,"totalTestResultsSource":"totalTestsViral","totalTestResults":6299277,"hospitalizedCurrently":451,"hospitalizedCumulative":null,"inIcuCurrently":null,"inIcuCumulative":null,"onVentilatorCurrently":null,"onVentilatorCumulative":null,"recovered":null,"lastUpdateEt":"2/25/2021 23:59","dateModified":"2021-02-25T23:59:00Z","checkTimeEt":"02/25 18:59","death":7622,"hospitalized":null,"hospitalizedDischarged":null,"dateChecked":"2021-02-25T23:59:00Z","totalTestsViral":6299277,"positiveTestsViral":317614,"negativeTestsViral":5973606,"positiveCasesViral":261052,"deathConfirmed":6254,"deathProbable":1368,"totalTestEncountersViral":null,"totalTestsPeopleViral":null,"totalTestsAntibody":null,"positiveTestsAntibody":null,"negativeTestsAntibody":null,"totalTestsPeopleAntibody":null,"positiveTestsPeopleAntibody":null,"negativeTestsPeopleAntibody":null,"totalTestsPeopleAntigen":null,"positiveTestsPeopleAntigen":null,"totalTestsAntigen":371931,"positiveTestsAntigen":21235,"fips":"09","positiveIncrease":0,"negativeIncrease":0,"total":279946,"totalTestResultsIncrease":0,"posNeg":279946,"dataQualityGrade":null,"deathIncrease":0,"hospitalizedIncrease":0,"hash":"69b411fa5991a9efe9107ab9b01265d06729165e","commercialScore":0,"negativeRegularScore":0,"negativeScore":0,"positiveScore":0,"score":0,"grade":""},{"date":20210227,"state":"CT","positive":279946,"probableCases":18894,"negative":null,"pending":null,"totalTestResultsSource":"totalTestsViral","totalTestResults":6299277,"hospitalizedCurrently":451,"hospitalizedCumulative":null,"inIcuCurrently":null,"inIcuCumulative":null,"onVentilatorCurrently":null,"onVentilatorCumulative":null,"recovered":null,"lastUpdateEt":"2/25/2021 23:59","dateModified":"2021-02-25T23:59:00Z","checkTimeEt":"02/25 18:59","death":7622,"hospitalized":null,"hospitalizedDischarged":null,"dateChecked":"2021-02-25T23:59:00Z","totalTestsViral":6299277,"positiveTestsViral":317614,"negativeTestsViral":5973606,"positiveCasesViral":261052,"deathConfirmed":6254,"deathProbable":1368,"totalTestEncountersViral":null,"totalTestsPeopleViral":null,"totalTestsAntibody":null,"positiveTestsAntibody":null,"negativeTestsAntibody":null,"totalTestsPeopleAntibody":null,"positiveTestsPeopleAntibody":null,"negativeTestsPeopleAntibody":null,"totalTestsPeopleAntigen":null,"positiveTestsPeopleAntigen":null,"totalTestsAntigen":371931,"positiveTestsAntigen":21235,"fips":"09","positiveIncrease":0,"negativeIncrease":0,"total":279946,"totalTestResultsIncrease":0,"posNeg":279946,"dataQualityGrade":null,"deathIncrease":0,"hospitalizedIncrease":0,"hash":"bf89f0b960fdbfa4e65a3968d7216abb9e01182c","commercialScore":0,"negativeRegularScore":0,"negativeScore":0,"positiveScore":0,"score":0,"grade":""},{"date":20210226,"state":"CT","positive":279946,"probableCases":18894,"negative":null,"pending":null,"totalTestResultsSource":"totalTestsViral","totalTestResults":6299277,"hospitalizedCurrently":451,"hospitalizedCumulative":null,"inIcuCurrently":null,"inIcuCumulative":null,"onVentilatorCurrently":null,"onVentilatorCumulative":null,"recovered":null,"lastUpdateEt":"2/25/2021 23:59","dateModified":"2021-02-25T23:59:00Z","checkTimeEt":"02/25 18:59","death":7622,"hospitalized":null,"hospitalizedDischarged":null,"dateChecked":"2021-02-25T23:59:00Z","totalTestsViral":6299277,"positiveTestsViral":317614,"negativeTestsViral":5973606,"positiveCasesViral":261052,"deathConfirmed":6254,"deathProbable":1368,"totalTestEncountersViral":null,"totalTestsPeopleViral":null,"totalTestsAntibody":null,"positiveTestsAntibody":null,"negativeTestsAntibody":null,"totalTestsPeopleAntibody":null,"positiveTestsPeopleAntibody":null,"negativeTestsPeopleAntibody":null,"totalTestsPeopleAntigen":null,"positiveTestsPeopleAntigen":null,"totalTestsAntigen":371931,"positiveTestsAntigen":21235,"fips":"09","positiveIncrease":787,"negativeIncrease":0,"total":279946,"totalTestResultsIncrease":32146,"posNeg":279946,"dataQualityGrade":null,"deathIncrease":8,"hospitalizedIncrease":0,"hash":"06a801e1b7e69398b98d3abdee6b6ea96559a28d","commercialScore":0,"negativeRegularScore":0,"negativeScore":0,"positiveScore":0,"score":0,"grade":""},{"date":20210225,"state":"CT","positive":279159,"probableCases":18734,"negative":null,"pending":null,"totalTestResultsSource":"totalTestsViral","totalTestResults":6267131,"hospitalizedCurrently":485,"hospitalizedCumulative":null,"inIcuCurrently":null,"inIcuCumulative":null,"onVentilatorCurrently":null,"onVentilatorCumulative":null,"recovered":null,"lastUpdateEt":"2/24/2021 23:59","dateModified":"2021-02-24T23:59:00Z","checkTimeEt":"02/24 18:59","death":7614,"hospitalized":null,"hospitalizedDischarged":null,"dateChecked":"2021-02-24T23:59:00Z","totalTestsViral":6267131,"positiveTestsViral":316978,"negativeTestsViral":5942165,"positiveCasesViral":260425,"deathConfirmed":6248,"deathProbable":1366,"totalTestEncountersViral":null,"totalTestsPeopleViral":null,"totalTestsAntibody":null,"positiveTestsAntibody":null,"negativeTestsAntibody":null,"totalTestsPeopleAntibody":null,"positiveTestsPeopleAntibody":null,"negativeTestsPeopleAntibody":null,"totalTestsPeopleAntigen":null,"positiveTestsPeopleAntigen":null,"totalTestsAntigen":368567,"positiveTestsAntigen":21021,"fips":"09","positiveIncrease":975,"negativeIncrease":0,"total":279159,"totalTestResultsIncrease":39700,"posNeg":279159,"dataQualityGrade":null,"deathIncrease":19,"hospitalizedIncrease":0,"hash":"d64e81e7898a3ccd7bbb01d5064ab9d75612fbf6","commercialScore":0,"negativeRegularScore":0,"negativeScore":0,"positiveScore":0,"score":0,"grade":""},{"date":20210224,"state":"CT","positive":278184,"probableCases":18584,"negative":null,"pending":null,"totalTestResultsSource":"totalTestsViral","totalTestResults":6227431,"hospitalizedCurrently":495,"hospitalizedCumulative":null,"inIcuCurrently":null,"inIcuCumulative":null,"onVentilatorCurrently":null,"onVentilatorCumulative":null,"recovered":null,"lastUpdateEt":"2/23/2021 23:59","dateModified":"2021-02-23T23:59:00Z","checkTimeEt":"02/23 18:59","death":7595,"hospitalized":null,"hospitalizedDischarged":null,"dateChecked":"2021-02-23T23:59:00Z","totalTestsViral":6227431,"positiveTestsViral":315971,"negativeTestsViral":5903519,"positiveCasesViral":259600,"deathConfirmed":6230,"deathProbable":1365,"totalTestEncountersViral":null,"totalTestsPeopleViral":null,"totalTestsAntibody":null,"positiveTestsAntibody":null,"negativeTestsAntibody":null,"totalTestsPeopleAntibody":null,"positiveTestsPeopleAntibody":null,"negativeTestsPeopleAntibody":null,"totalTestsPeopleAntigen":null,"positiveTestsPeopleAntigen":null,"totalTestsAntigen":362250,"positiveTestsAntigen":20801,"fips":"09","positiveIncrease":1493,"negativeIncrease":0,"total":278184,"totalTestResultsIncrease":28724,"posNeg":278184,"dataQualityGrade":null,"deathIncrease":23,"hospitalizedIncrease":0,"hash":"97638d93eea72e7bd37805a20c7c1eee82074651","commercialScore":0,"negativeRegularScore":0,"negativeScore":0,"positiveScore":0,"score":0,"grade":""},{"date":20210223,"state":"CT","positive":276691,"probableCases":17846,"negative":null,"pending":null,"totalTestResultsSource":"totalTestsViral","totalTestResults":6198707,"hospitalizedCurrently":511,"hospitalizedCumulative":null,"inIcuCurrently":null,"inIcuCumulative":null,"onVentilatorCurrently":null,"onVentilatorCumulative":null,"recovered":null,"lastUpdateEt":"2/22/2021 23:59","dateModified":"2021-02-22T23:59:00Z","checkTimeEt":"02/22 18:59","death":7572,"hospitalized":null,"hospitalizedDischarged":null,"dateChecked":"2021-02-22T23:59:00Z","totalTestsViral":6198707,"positiveTestsViral":315104,"negativeTestsViral":5875715,"positiveCasesViral":258845,"deathConfirmed":6211,"deathProbable":1361,"totalTestEncountersViral":null,"totalTestsPeopleViral":null,"totalTestsAntibody":null,"positiveTestsAntibody":null,"negativeTestsAntibody":null,"totalTestsPeopleAntibody":null,"positiveTestsPeopleAntibody":null,"negativeTestsPeopleAntibody":null,"totalTestsPeopleAntigen":null,"positiveTestsPeopleAntigen":null,"totalTestsAntigen":343598,"positiveTestsAntigen":19450,"fips":"09","positiveIncrease":1357,"negativeIncrease":0,"total":276691,"totalTestResultsIncrease":21232,"posNeg":276691,"dataQualityGrade":null,"deathIncrease":10,"hospitalizedIncrease":0,"hash":"218adc66e078927ed5db233747a3012584ccdebc","commercialScore":0,"negativeRegularScore":0,"negativeScore":0,"positiveScore":0,"score":0,"grade":""},{"date":20210222,"state":"CT","positive":275334,"probableCases":17041,"negative":null,"pending":null,"totalTestResultsSource":"totalTestsViral","totalTestResults":6177475,"hospitalizedCurrently":500,"hospitalizedCumulative":null,"inIcuCurrently":null,"inIcuCumulative":null,"onVentilatorCurrently":null,"onVentilatorCumulative":null,"recovered":null,"lastUpdateEt":"2/21/2021 23:59","dateModified":"2021-02-21T23:59:00Z","checkTimeEt":"02/21 18:59","death":7562,"hospitalized":null,"hospitalizedDischarged":null,"dateChecked":"2021-02-21T23:59:00Z","totalTestsViral":6177475,"positiveTestsViral":314431,"negativeTestsViral":5855183,"positiveCasesViral":258293,"deathConfirmed":6202,"deathProbable":1360,"totalTestEncountersViral":null,"totalTestsPeopleViral":null,"totalTestsAntibody":null,"positiveTestsAntibody":null,"negativeTestsAntibody":null,"totalTestsPeopleAntibody":null,"positiveTestsPeopleAntibody":null,"negativeTestsPeopleAntibody":null,"totalTestsPeopleAntigen":null,"positiveTestsPeopleAntigen":null,"totalTestsAntigen":330182,"positiveTestsAntigen":18301,"fips":"09","positiveIncrease":2233,"negativeIncrease":0,"total":275334,"totalTestResultsIncrease":80961,"posNeg":275334,"dataQualityGrade":null,"deathIncrease":39,"hospitalizedIncrease":0,"hash":"1ef17bded6727307ef7d89b032fe9091a3b52c36","commercialScore":0,"negativeRegularScore":0,"negativeScore":0,"positiveScore":0,"score":0,"grade":""},{"date":20210221,"state":"CT","positive":273101,"probableCases":16962,"negative":null,"pending":null,"totalTestResultsSource":"totalTestsViral","totalTestResults":6096514,"hospitalizedCurrently":535,"hospitalizedCumulative":null,"inIcuCurrently":null,"inIcuCumulative":null,"onVentilatorCurrently":null,"onVentilatorCumulative":null,"recovered":null,"lastUpdateEt":"2/18/2021 23:59","dateModified":"2021-02-18T23:59:00Z","checkTimeEt":"02/18 18:59","death":7523,"hospitalized":null,"hospitalizedDischarged":null,"dateChecked":"2021-02-18T23:59:00Z","totalTestsViral":6096514,"positiveTestsViral":311736,"negativeTestsViral":5777127,"positiveCasesViral":256139,"deathConfirmed":6166,"deathProbable":1357,"totalTestEncountersViral":null,"totalTestsPeopleViral":null,"totalTestsAntibody":null,"positiveTestsAntibody":null,"negativeTestsAntibody":null,"totalTestsPeopleAntibody":null,"positiveTestsPeopleAntibody":null,"negativeTestsPeopleAntibody":null,"totalTestsPeopleAntigen":null,"positiveTestsPeopleAntigen":null,"totalTestsAntigen":324744,"positiveTestsAntigen":18150,"fips":"09","positiveIncrease":0,"negativeIncrease":0,"total":273101,"totalTestResultsIncrease":0,"posNeg":273101,"dataQualityGrade":null,"deathIncrease":0,"hospitalizedIncrease":0,"hash":"c92f9414bdc1ae637fad71d51f18174ec3a04e9d","commercialScore":0,"negativeRegularScore":0,"negativeScore":0,"positiveScore":0,"score":0,"grade":""},{"date":20210220,"state":"CT","positive":273101,"probableCases":16962,"negative":null,"pending":null,"totalTestResultsSource":"totalTestsViral","totalTestResults":6096514,"hospitalizedCurrently":535,"hospitalizedCumulative":null,"inIcuCurrently":null,"inIcuCumulative":null,"onVentilatorCurrently":null,"onVentilatorCumulative":null,"recovered":null,"lastUpdateEt":"2/18/2021 23:59","dateModified":"2021-02-18T23:59:00Z","checkTimeEt":"02/18 18:59","death":7523,"hospitalized":null,"hospitalizedDischarged":null,"dateChecked":"2021-02-18T23:59:00Z","totalTestsViral":6096514,"positiveTestsViral":311736,"negativeTestsViral":5777127,"positiveCasesViral":256139,"deathConfirmed":6166,"deathProbable":1357,"totalTestEncountersViral":null,"totalTestsPeopleViral":null,"totalTestsAntibody":null,"positiveTestsAntibody":null,"negativeTestsAntibody":null,"totalTestsPeopleAntibody":null,"positiveTestsPeopleAntibody":null,"negativeTestsPeopleAntibody":null,"totalTestsPeopleAntigen":null,"positiveTestsPeopleAntigen":null,"totalTestsAntigen":324744,"positiveTestsAntigen":18150,"fips":"09","positiveIncrease":0,"negativeIncrease":0,"total":273101,"totalTestResultsIncrease":0,"posNeg":273101,"dataQualityGrade":null,"deathIncrease":0,"hospitalizedIncrease":0,"hash":"75b758be70c99f830990f65c76860e5a0a386b1f","commercialScore":0,"negativeRegularScore":0,"negativeScore":0,"positiveScore":0,"score":0,"grade":""},{"date":20210219,"state":"CT","positive":273101,"probableCases":16962,"negative":null,"pending":null,"totalTestResultsSource":"totalTestsViral","totalTestResults":6096514,"hospitalizedCurrently":535,"hospitalizedCumulative":null,"inIcuCurrently":null,"inIcuCumulative":null,"onVentilatorCurrently":null,"onVentilatorCumulative":null,"recovered":null,"lastUpdateEt":"2/18/2021 23:59","dateModified":"2021-02-18T23:59:00Z","checkTimeEt":"02/18 18:59","death":7523,"hospitalized":null,"hospitalizedDischarged":null,"dateChecked":"2021-02-18T23:59:00Z","totalTestsViral":6096514,"positiveTestsViral":311736,"negativeTestsViral":5777127,"positiveCasesViral":256139,"deathConfirmed":6166,"deathProbable":1357,"totalTestEncountersViral":null,"totalTestsPeopleViral":null,"totalTestsAntibody":null,"positiveTestsAntibody":null,"negativeTestsAntibody":null,"totalTestsPeopleAntibody":null,"positiveTestsPeopleAntibody":null,"negativeTestsPeopleAntibody":null,"totalTestsPeopleAntigen":null,"positiveTestsPeopleAntigen":null,"totalTestsAntigen":324744,"positiveTestsAntigen":18150,"fips":"09","positiveIncrease":1198,"negativeIncrease":0,"total":273101,"totalTestResultsIncrease":42964,"posNeg":273101,"dataQualityGrade":null,"deathIncrease":27,"hospitalizedIncrease":0,"hash":"15c8a45fc6c27e4f1d62f93cdf41fc94cf99bac0","commercialScore":0,"negativeRegularScore":0,"negativeScore":0,"positiveScore":0,"score":0,"grade":""},{"date":20210218,"state":"CT","positive":271903,"probableCases":16923,"negative":null,"pending":null,"totalTestResultsSource":"totalTestsViral","totalTestResults":6053550,"hospitalizedCurrently":568,"hospitalizedCumulative":null,"inIcuCurrently":null,"inIcuCumulative":null,"onVentilatorCurrently":null,"onVentilatorCumulative":null,"recovered":null,"lastUpdateEt":"2/17/2021 23:59","dateModified":"2021-02-17T23:59:00Z","checkTimeEt":"02/17 18:59","death":7496,"hospitalized":null,"hospitalizedDischarged":null,"dateChecked":"2021-02-17T23:59:00Z","totalTestsViral":6053550,"positiveTestsViral":310391,"negativeTestsViral":5735579,"positiveCasesViral":254980,"deathConfirmed":6145,"deathProbable":1351,"totalTestEncountersViral":null,"totalTestsPeopleViral":null,"totalTestsAntibody":null,"positiveTestsAntibody":null,"negativeTestsAntibody":null,"totalTestsPeopleAntibody":null,"positiveTestsPeopleAntibody":null,"negativeTestsPeopleAntibody":null,"totalTestsPeopleAntigen":null,"positiveTestsPeopleAntigen":null,"totalTestsAntigen":321303,"positiveTestsAntigen":18068,"fips":"09","positiveIncrease":547,"negativeIncrease":0,"total":271903,"totalTestResultsIncrease":24953,"posNeg":271903,"dataQualityGrade":null,"deathIncrease":20,"hospitalizedIncrease":0,"hash":"5ea6663e752f1dbb164278f81b051bc905d03176","commercialScore":0,"negativeRegularScore":0,"negativeScore":0,"positiveScore":0,"score":0,"grade":""},{"date":20210217,"state":"CT","positive":271356,"probableCases":16836,"negative":null,"pending":null,"totalTestResultsSource":"totalTestsViral","totalTestResults":6028597,"hospitalizedCurrently":584,"hospitalizedCumulative":null,"inIcuCurrently":null,"inIcuCumulative":null,"onVentilatorCurrently":null,"onVentilatorCumulative":null,"recovered":null,"lastUpdateEt":"2/16/2021 23:59","dateModified":"2021-02-16T23:59:00Z","checkTimeEt":"02/16 18:59","death":7476,"hospitalized":null,"hospitalizedDischarged":null,"dateChecked":"2021-02-16T23:59:00Z","totalTestsViral":6028597,"positiveTestsViral":309814,"negativeTestsViral":5711235,"positiveCasesViral":254520,"deathConfirmed":6129,"deathProbable":1347,"totalTestEncountersViral":null,"totalTestsPeopleViral":null,"totalTestsAntibody":null,"positiveTestsAntibody":null,"negativeTestsAntibody":null,"totalTestsPeopleAntibody":null,"positiveTestsPeopleAntibody":null,"negativeTestsPeopleAntibody":null,"totalTestsPeopleAntigen":null,"positiveTestsPeopleAntigen":null,"totalTestsAntigen":319256,"positiveTestsAntigen":17961,"fips":"09","positiveIncrease":534,"negativeIncrease":0,"total":271356,"totalTestResultsIncrease":23666,"posNeg":271356,"dataQualityGrade":null,"deathIncrease":27,"hospitalizedIncrease":0,"hash":"3cde49919557671a3a84103f353207e077ec8634","commercialScore":0,"negativeRegularScore":0,"negativeScore":0,"positiveScore":0,"score":0,"grade":""},{"date":20210216,"state":"CT","positive":270822,"probableCases":16628,"negative":null,"pending":null,"totalTestResultsSource":"totalTestsViral","totalTestResults":6004931,"hospitalizedCurrently":606,"hospitalizedCumulative":null,"inIcuCurrently":null,"inIcuCumulative":null,"onVentilatorCurrently":null,"onVentilatorCumulative":null,"recovered":null,"lastUpdateEt":"2/15/2021 23:59","dateModified":"2021-02-15T23:59:00Z","checkTimeEt":"02/15 18:59","death":7449,"hospitalized":null,"hospitalizedDischarged":null,"dateChecked":"2021-02-15T23:59:00Z","totalTestsViral":6004931,"positiveTestsViral":309330,"negativeTestsViral":5688069,"positiveCasesViral":254194,"deathConfirmed":6106,"deathProbable":1343,"totalTestEncountersViral":null,"totalTestsPeopleViral":null,"totalTestsAntibody":null,"positiveTestsAntibody":null,"negativeTestsAntibody":null,"totalTestsPeopleAntibody":null,"positiveTestsPeopleAntibody":null,"negativeTestsPeopleAntibody":null,"totalTestsPeopleAntigen":null,"positiveTestsPeopleAntigen":null,"totalTestsAntigen":309117,"positiveTestsAntigen":17701,"fips":"09","positiveIncrease":580,"negativeIncrease":0,"total":270822,"totalTestResultsIncrease":18312,"posNeg":270822,"dataQualityGrade":null,"deathIncrease":2,"hospitalizedIncrease":0,"hash":"a7a17d1871c2d100987ffd8c17d4d8728bc769d3","commercialScore":0,"negativeRegularScore":0,"negativeScore":0,"positiveScore":0,"score":0,"grade":""},{"date":20210215,"state":"CT","positive":270242,"probableCases":16586,"negative":null,"pending":null,"totalTestResultsSource":"totalTestsViral","totalTestResults":5986619,"hospitalizedCurrently":618,"hospitalizedCumulative":null,"inIcuCurrently":null,"inIcuCumulative":null,"onVentilatorCurrently":null,"onVentilatorCumulative":null,"recovered":null,"lastUpdateEt":"2/14/2021 23:59","dateModified":"2021-02-14T23:59:00Z","checkTimeEt":"02/14 18:59","death":7447,"hospitalized":null,"hospitalizedDischarged":null,"dateChecked":"2021-02-14T23:59:00Z","totalTestsViral":5986619,"positiveTestsViral":308684,"negativeTestsViral":5670458,"positiveCasesViral":253656,"deathConfirmed":6105,"deathProbable":1342,"totalTestEncountersViral":null,"totalTestsPeopleViral":null,"totalTestsAntibody":null,"positiveTestsAntibody":null,"negativeTestsAntibody":null,"totalTestsPeopleAntibody":null,"positiveTestsPeopleAntibody":null,"negativeTestsPeopleAntibody":null,"totalTestsPeopleAntigen":null,"positiveTestsPeopleAntigen":null,"totalTestsAntigen":306944,"positiveTestsAntigen":17641,"fips":"09","positiveIncrease":2905,"negativeIncrease":0,"total":270242,"totalTestResultsIncrease":88720,"posNeg":270242,"dataQualityGrade":null,"deathIncrease":66,"hospitalizedIncrease":0,"hash":"36c6244a6bd912c2f67e7ebe3c334cc9655165a0","commercialScore":0,"negativeRegularScore":0,"negativeScore":0,"positiveScore":0,"score":0,"grade":""},{"date":20210214,"state":"CT","positive":267337,"probableCases":16422,"negative":null,"pending":null,"totalTestResultsSource":"totalTestsViral","totalTestResults":5897899,"hospitalizedCurrently":674,"hospitalizedCumulative":null,"inIcuCurrently":null,"inIcuCumulative":null,"onVentilatorCurrently":null,"onVentilatorCumulative":null,"recovered":null,"lastUpdateEt":"2/11/2021 23:59","dateModified":"2021-02-11T23:59:00Z","checkTimeEt":"02/11 18:59","death":7381,"hospitalized":null,"hospitalizedDischarged":null,"dateChecked":"2021-02-11T23:59:00Z","totalTestsViral":5897899,"positiveTestsViral":305265,"negativeTestsViral":5585218,"positiveCasesViral":250915,"deathConfirmed":6049,"deathProbable":1332,"totalTestEncountersViral":null,"totalTestsPeopleViral":null,"totalTestsAntibody":null,"positiveTestsAntibody":null,"negativeTestsAntibody":null,"totalTestsPeopleAntibody":null,"positiveTestsPeopleAntibody":null,"negativeTestsPeopleAntibody":null,"totalTestsPeopleAntigen":null,"positiveTestsPeopleAntigen":null,"totalTestsAntigen":299011,"positiveTestsAntigen":17354,"fips":"09","positiveIncrease":0,"negativeIncrease":0,"total":267337,"totalTestResultsIncrease":0,"posNeg":267337,"dataQualityGrade":null,"deathIncrease":0,"hospitalizedIncrease":0,"hash":"ec5d1f75b49b03ec99f1c9f844fdd0c9184515f0","commercialScore":0,"negativeRegularScore":0,"negativeScore":0,"positiveScore":0,"score":0,"grade":""},{"date":20210213,"state":"CT","positive":267337,"probableCases":16422,"negative":null,"pending":null,"totalTestResultsSource":"totalTestsViral","totalTestResults":5897899,"hospitalizedCurrently":674,"hospitalizedCumulative":null,"inIcuCurrently":null,"inIcuCumulative":null,"onVentilatorCurrently":null,"onVentilatorCumulative":null,"recovered":null,"lastUpdateEt":"2/11/2021 23:59","dateModified":"2021-02-11T23:59:00Z","checkTimeEt":"02/11 18:59","death":7381,"hospitalized":null,"hospitalizedDischarged":null,"dateChecked":"2021-02-11T23:59:00Z","totalTestsViral":5897899,"positiveTestsViral":305265,"negativeTestsViral":5585218,"positiveCasesViral":250915,"deathConfirmed":6049,"deathProbable":1332,"totalTestEncountersViral":null,"totalTestsPeopleViral":null,"totalTestsAntibody":null,"positiveTestsAntibody":null,"negativeTestsAntibody":null,"totalTestsPeopleAntibody":null,"positiveTestsPeopleAntibody":null,"negativeTestsPeopleAntibody":null,"totalTestsPeopleAntigen":null,"positiveTestsPeopleAntigen":null,"totalTestsAntigen":299011,"positiveTestsAntigen":17354,"fips":"09","positiveIncrease":0,"negativeIncrease":0,"total":267337,"totalTestResultsIncrease":0,"posNeg":267337,"dataQualityGrade":null,"deathIncrease":0,"hospitalizedIncrease":0,"hash":"5422ee523f236338d8c189fa5087978601b4591f","commercialScore":0,"negativeRegularScore":0,"negativeScore":0,"positiveScore":0,"score":0,"grade":""},{"date":20210212,"state":"CT","positive":267337,"probableCases":16422,"negative":null,"pending":null,"totalTestResultsSource":"totalTestsViral","totalTestResults":5897899,"hospitalizedCurrently":674,"hospitalizedCumulative":null,"inIcuCurrently":null,"inIcuCumulative":null,"onVentilatorCurrently":null,"onVentilatorCumulative":null,"recovered":null,"lastUpdateEt":"2/11/2021 23:59","dateModified":"2021-02-11T23:59:00Z","checkTimeEt":"02/11 18:59","death":7381,"hospitalized":null,"hospitalizedDischarged":null,"dateChecked":"2021-02-11T23:59:00Z","totalTestsViral":5897899,"positiveTestsViral":305265,"negativeTestsViral":5585218,"positiveCasesViral":250915,"deathConfirmed":6049,"deathProbable":1332,"totalTestEncountersViral":null,"totalTestsPeopleViral":null,"totalTestsAntibody":null,"positiveTestsAntibody":null,"negativeTestsAntibody":null,"totalTestsPeopleAntibody":null,"positiveTestsPeopleAntibody":null,"negativeTestsPeopleAntibody":null,"totalTestsPeopleAntigen":null,"positiveTestsPeopleAntigen":null,"totalTestsAntigen":299011,"positiveTestsAntigen":17354,"fips":"09","positiveIncrease":838,"negativeIncrease":0,"total":267337,"totalTestResultsIncrease":33093,"posNeg":267337,"dataQualityGrade":null,"deathIncrease":27,"hospitalizedIncrease":0,"hash":"6de64603aecc671180842f282b2e612174e3e123","commercialScore":0,"negativeRegularScore":0,"negativeScore":0,"positiveScore":0,"score":0,"grade":""},{"date":20210211,"state":"CT","positive":266499,"probableCases":16368,"negative":null,"pending":null,"totalTestResultsSource":"totalTestsViral","totalTestResults":5864806,"hospitalizedCurrently":731,"hospitalizedCumulative":null,"inIcuCurrently":null,"inIcuCumulative":null,"onVentilatorCurrently":null,"onVentilatorCumulative":null,"recovered":null,"lastUpdateEt":"2/10/2021 23:59","dateModified":"2021-02-10T23:59:00Z","checkTimeEt":"02/10 18:59","death":7354,"hospitalized":null,"hospitalizedDischarged":null,"dateChecked":"2021-02-10T23:59:00Z","totalTestsViral":5864806,"positiveTestsViral":304302,"negativeTestsViral":5553087,"positiveCasesViral":250131,"deathConfirmed":6025,"deathProbable":1329,"totalTestEncountersViral":null,"totalTestsPeopleViral":null,"totalTestsAntibody":null,"positiveTestsAntibody":null,"negativeTestsAntibody":null,"totalTestsPeopleAntibody":null,"positiveTestsPeopleAntibody":null,"negativeTestsPeopleAntibody":null,"totalTestsPeopleAntigen":null,"positiveTestsPeopleAntigen":null,"totalTestsAntigen":294317,"positiveTestsAntigen":17255,"fips":"09","positiveIncrease":1003,"negativeIncrease":0,"total":266499,"totalTestResultsIncrease":40185,"posNeg":266499,"dataQualityGrade":null,"deathIncrease":28,"hospitalizedIncrease":0,"hash":"2c7de637624b5f73c2655a836c75d0b5f9cd17a0","commercialScore":0,"negativeRegularScore":0,"negativeScore":0,"positiveScore":0,"score":0,"grade":""},{"date":20210210,"state":"CT","positive":265496,"probableCases":16251,"negative":null,"pending":null,"totalTestResultsSource":"totalTestsViral","totalTestResults":5824621,"hospitalizedCurrently":770,"hospitalizedCumulative":null,"inIcuCurrently":null,"inIcuCumulative":null,"onVentilatorCurrently":null,"onVentilatorCumulative":null,"recovered":null,"lastUpdateEt":"2/9/2021 23:59","dateModified":"2021-02-09T23:59:00Z","checkTimeEt":"02/09 18:59","death":7326,"hospitalized":null,"hospitalizedDischarged":null,"dateChecked":"2021-02-09T23:59:00Z","totalTestsViral":5824621,"positiveTestsViral":303237,"negativeTestsViral":5514000,"positiveCasesViral":249245,"deathConfirmed":5999,"deathProbable":1327,"totalTestEncountersViral":null,"totalTestsPeopleViral":null,"totalTestsAntibody":null,"positiveTestsAntibody":null,"negativeTestsAntibody":null,"totalTestsPeopleAntibody":null,"positiveTestsPeopleAntibody":null,"negativeTestsPeopleAntibody":null,"totalTestsPeopleAntigen":null,"positiveTestsPeopleAntigen":null,"totalTestsAntigen":291264,"positiveTestsAntigen":17090,"fips":"09","positiveIncrease":888,"negativeIncrease":0,"total":265496,"totalTestResultsIncrease":25546,"posNeg":265496,"dataQualityGrade":null,"deathIncrease":28,"hospitalizedIncrease":0,"hash":"bfe077326e76fc1a70accb4b46ccf8cb05eb96a7","commercialScore":0,"negativeRegularScore":0,"negativeScore":0,"positiveScore":0,"score":0,"grade":""},{"date":20210209,"state":"CT","positive":264608,"probableCases":16122,"negative":null,"pending":null,"totalTestResultsSource":"totalTestsViral","totalTestResults":5799075,"hospitalizedCurrently":826,"hospitalizedCumulative":null,"inIcuCurrently":null,"inIcuCumulative":null,"onVentilatorCurrently":null,"onVentilatorCumulative":null,"recovered":null,"lastUpdateEt":"2/8/2021 23:59","dateModified":"2021-02-08T23:59:00Z","checkTimeEt":"02/08 18:59","death":7298,"hospitalized":null,"hospitalizedDischarged":null,"dateChecked":"2021-02-08T23:59:00Z","totalTestsViral":5799075,"positiveTestsViral":302302,"negativeTestsViral":5489419,"positiveCasesViral":248486,"deathConfirmed":5979,"deathProbable":1319,"totalTestEncountersViral":null,"totalTestsPeopleViral":null,"totalTestsAntibody":null,"positiveTestsAntibody":null,"negativeTestsAntibody":null,"totalTestsPeopleAntibody":null,"positiveTestsPeopleAntibody":null,"negativeTestsPeopleAntibody":null,"totalTestsPeopleAntigen":null,"positiveTestsPeopleAntigen":null,"totalTestsAntigen":288150,"positiveTestsAntigen":16943,"fips":"09","positiveIncrease":869,"negativeIncrease":0,"total":264608,"totalTestResultsIncrease":19235,"posNeg":264608,"dataQualityGrade":null,"deathIncrease":16,"hospitalizedIncrease":0,"hash":"0e35d3cf2b1b7e60e45748a4fe01ea424bb6d918","commercialScore":0,"negativeRegularScore":0,"negativeScore":0,"positiveScore":0,"score":0,"grade":""},{"date":20210208,"state":"CT","positive":263739,"probableCases":16058,"negative":null,"pending":null,"totalTestResultsSource":"totalTestsViral","totalTestResults":5779840,"hospitalizedCurrently":815,"hospitalizedCumulative":null,"inIcuCurrently":null,"inIcuCumulative":null,"onVentilatorCurrently":null,"onVentilatorCumulative":null,"recovered":null,"lastUpdateEt":"2/7/2021 23:59","dateModified":"2021-02-07T23:59:00Z","checkTimeEt":"02/07 18:59","death":7282,"hospitalized":null,"hospitalizedDischarged":null,"dateChecked":"2021-02-07T23:59:00Z","totalTestsViral":5779840,"positiveTestsViral":301260,"negativeTestsViral":5471222,"positiveCasesViral":247681,"deathConfirmed":5966,"deathProbable":1316,"totalTestEncountersViral":null,"totalTestsPeopleViral":null,"totalTestsAntibody":null,"positiveTestsAntibody":null,"negativeTestsAntibody":null,"totalTestsPeopleAntibody":null,"positiveTestsPeopleAntibody":null,"negativeTestsPeopleAntibody":null,"totalTestsPeopleAntigen":null,"positiveTestsPeopleAntigen":null,"totalTestsAntigen":284789,"positiveTestsAntigen":16843,"fips":"09","positiveIncrease":4367,"negativeIncrease":0,"total":263739,"totalTestResultsIncrease":112191,"posNeg":263739,"dataQualityGrade":null,"deathIncrease":68,"hospitalizedIncrease":0,"hash":"9a93c5683b0e28427ab94287ad9a91040cc4f437","commercialScore":0,"negativeRegularScore":0,"negativeScore":0,"positiveScore":0,"score":0,"grade":""},{"date":20210207,"state":"CT","positive":259372,"probableCases":15789,"negative":null,"pending":null,"totalTestResultsSource":"totalTestsViral","totalTestResults":5667649,"hospitalizedCurrently":827,"hospitalizedCumulative":null,"inIcuCurrently":null,"inIcuCumulative":null,"onVentilatorCurrently":null,"onVentilatorCumulative":null,"recovered":null,"lastUpdateEt":"2/4/2021 23:59","dateModified":"2021-02-04T23:59:00Z","checkTimeEt":"02/04 18:59","death":7214,"hospitalized":null,"hospitalizedDischarged":null,"dateChecked":"2021-02-04T23:59:00Z","totalTestsViral":5667649,"positiveTestsViral":295992,"negativeTestsViral":5364339,"positiveCasesViral":243583,"deathConfirmed":5895,"deathProbable":1319,"totalTestEncountersViral":null,"totalTestsPeopleViral":null,"totalTestsAntibody":null,"positiveTestsAntibody":null,"negativeTestsAntibody":null,"totalTestsPeopleAntibody":null,"positiveTestsPeopleAntibody":null,"negativeTestsPeopleAntibody":null,"totalTestsPeopleAntigen":null,"positiveTestsPeopleAntigen":null,"totalTestsAntigen":274842,"positiveTestsAntigen":16362,"fips":"09","positiveIncrease":0,"negativeIncrease":0,"total":259372,"totalTestResultsIncrease":0,"posNeg":259372,"dataQualityGrade":null,"deathIncrease":0,"hospitalizedIncrease":0,"hash":"d2aed4415e351041742c762968ad87fe3f375bf4","commercialScore":0,"negativeRegularScore":0,"negativeScore":0,"positiveScore":0,"score":0,"grade":""},{"date":20210206,"state":"CT","positive":259372,"probableCases":15789,"negative":null,"pending":null,"totalTestResultsSource":"totalTestsViral","totalTestResults":5667649,"hospitalizedCurrently":827,"hospitalizedCumulative":null,"inIcuCurrently":null,"inIcuCumulative":null,"onVentilatorCurrently":null,"onVentilatorCumulative":null,"recovered":null,"lastUpdateEt":"2/4/2021 23:59","dateModified":"2021-02-04T23:59:00Z","checkTimeEt":"02/04 18:59","death":7214,"hospitalized":null,"hospitalizedDischarged":null,"dateChecked":"2021-02-04T23:59:00Z","totalTestsViral":5667649,"positiveTestsViral":295992,"negativeTestsViral":5364339,"positiveCasesViral":243583,"deathConfirmed":5895,"deathProbable":1319,"totalTestEncountersViral":null,"totalTestsPeopleViral":null,"totalTestsAntibody":null,"positiveTestsAntibody":null,"negativeTestsAntibody":null,"totalTestsPeopleAntibody":null,"positiveTestsPeopleAntibody":null,"negativeTestsPeopleAntibody":null,"totalTestsPeopleAntigen":null,"positiveTestsPeopleAntigen":null,"totalTestsAntigen":274842,"positiveTestsAntigen":16362,"fips":"09","positiveIncrease":0,"negativeIncrease":0,"total":259372,"totalTestResultsIncrease":0,"posNeg":259372,"dataQualityGrade":null,"deathIncrease":0,"hospitalizedIncrease":0,"hash":"713a878b006560eb538016806dafa1efa9ab2d39","commercialScore":0,"negativeRegularScore":0,"negativeScore":0,"positiveScore":0,"score":0,"grade":""},{"date":20210205,"state":"CT","positive":259372,"probableCases":15789,"negative":null,"pending":null,"totalTestResultsSource":"totalTestsViral","totalTestResults":5667649,"hospitalizedCurrently":827,"hospitalizedCumulative":null,"inIcuCurrently":null,"inIcuCumulative":null,"onVentilatorCurrently":null,"onVentilatorCumulative":null,"recovered":null,"lastUpdateEt":"2/4/2021 23:59","dateModified":"2021-02-04T23:59:00Z","checkTimeEt":"02/04 18:59","death":7214,"hospitalized":null,"hospitalizedDischarged":null,"dateChecked":"2021-02-04T23:59:00Z","totalTestsViral":5667649,"positiveTestsViral":295992,"negativeTestsViral":5364339,"positiveCasesViral":243583,"deathConfirmed":5895,"deathProbable":1319,"totalTestEncountersViral":null,"totalTestsPeopleViral":null,"totalTestsAntibody":null,"positiveTestsAntibody":null,"negativeTestsAntibody":null,"totalTestsPeopleAntibody":null,"positiveTestsPeopleAntibody":null,"negativeTestsPeopleAntibody":null,"totalTestsPeopleAntigen":null,"positiveTestsPeopleAntigen":null,"totalTestsAntigen":274842,"positiveTestsAntigen":16362,"fips":"09","positiveIncrease":1431,"negativeIncrease":0,"total":259372,"totalTestResultsIncrease":43340,"posNeg":259372,"dataQualityGrade":null,"deathIncrease":29,"hospitalizedIncrease":0,"hash":"8898de6cf84a3a60453ea94e860b99af184c8cd0","commercialScore":0,"negativeRegularScore":0,"negativeScore":0,"positiveScore":0,"score":0,"grade":""},{"date":20210204,"state":"CT","positive":257941,"probableCases":15667,"negative":null,"pending":null,"totalTestResultsSource":"totalTestsViral","totalTestResults":5624309,"hospitalizedCurrently":837,"hospitalizedCumulative":null,"inIcuCurrently":null,"inIcuCumulative":null,"onVentilatorCurrently":null,"onVentilatorCumulative":null,"recovered":null,"lastUpdateEt":"2/3/2021 23:59","dateModified":"2021-02-03T23:59:00Z","checkTimeEt":"02/03 18:59","death":7185,"hospitalized":null,"hospitalizedDischarged":null,"dateChecked":"2021-02-03T23:59:00Z","totalTestsViral":5624309,"positiveTestsViral":294361,"negativeTestsViral":5322627,"positiveCasesViral":242274,"deathConfirmed":5872,"deathProbable":1313,"totalTestEncountersViral":null,"totalTestsPeopleViral":null,"totalTestsAntibody":null,"positiveTestsAntibody":null,"negativeTestsAntibody":null,"totalTestsPeopleAntibody":null,"positiveTestsPeopleAntibody":null,"negativeTestsPeopleAntibody":null,"totalTestsPeopleAntigen":null,"positiveTestsPeopleAntigen":null,"totalTestsAntigen":271157,"positiveTestsAntigen":16175,"fips":"09","positiveIncrease":937,"negativeIncrease":0,"total":257941,"totalTestResultsIncrease":26207,"posNeg":257941,"dataQualityGrade":null,"deathIncrease":28,"hospitalizedIncrease":0,"hash":"74b67277df8e6b38bec53fc4880e151191e4316d","commercialScore":0,"negativeRegularScore":0,"negativeScore":0,"positiveScore":0,"score":0,"grade":""},{"date":20210203,"state":"CT","positive":257004,"probableCases":15651,"negative":null,"pending":null,"totalTestResultsSource":"totalTestsViral","totalTestResults":5598102,"hospitalizedCurrently":874,"hospitalizedCumulative":null,"inIcuCurrently":null,"inIcuCumulative":null,"onVentilatorCurrently":null,"onVentilatorCumulative":null,"recovered":null,"lastUpdateEt":"2/2/2021 23:59","dateModified":"2021-02-02T23:59:00Z","checkTimeEt":"02/02 18:59","death":7157,"hospitalized":null,"hospitalizedDischarged":null,"dateChecked":"2021-02-02T23:59:00Z","totalTestsViral":5598102,"positiveTestsViral":293161,"negativeTestsViral":5297652,"positiveCasesViral":241353,"deathConfirmed":5839,"deathProbable":1318,"totalTestEncountersViral":null,"totalTestsPeopleViral":null,"totalTestsAntibody":null,"positiveTestsAntibody":null,"negativeTestsAntibody":null,"totalTestsPeopleAntibody":null,"positiveTestsPeopleAntibody":null,"negativeTestsPeopleAntibody":null,"totalTestsPeopleAntigen":null,"positiveTestsPeopleAntigen":null,"totalTestsAntigen":267549,"positiveTestsAntigen":16128,"fips":"09","positiveIncrease":482,"negativeIncrease":0,"total":257004,"totalTestResultsIncrease":9509,"posNeg":257004,"dataQualityGrade":null,"deathIncrease":24,"hospitalizedIncrease":0,"hash":"0b19cad47172d17c931c4bb3f3cd65e1b88c2d56","commercialScore":0,"negativeRegularScore":0,"negativeScore":0,"positiveScore":0,"score":0,"grade":""},{"date":20210202,"state":"CT","positive":256522,"probableCases":15584,"negative":null,"pending":null,"totalTestResultsSource":"totalTestsViral","totalTestResults":5588593,"hospitalizedCurrently":900,"hospitalizedCumulative":null,"inIcuCurrently":null,"inIcuCumulative":null,"onVentilatorCurrently":null,"onVentilatorCumulative":null,"recovered":null,"lastUpdateEt":"2/1/2021 20:30","dateModified":"2021-02-01T20:30:00Z","checkTimeEt":"02/01 15:30","death":7133,"hospitalized":null,"hospitalizedDischarged":null,"dateChecked":"2021-02-01T20:30:00Z","totalTestsViral":5588593,"positiveTestsViral":292660,"negativeTestsViral":5288674,"positiveCasesViral":240938,"deathConfirmed":5822,"deathProbable":1311,"totalTestEncountersViral":null,"totalTestsPeopleViral":null,"totalTestsAntibody":null,"positiveTestsAntibody":null,"negativeTestsAntibody":null,"totalTestsPeopleAntibody":null,"positiveTestsPeopleAntibody":null,"negativeTestsPeopleAntibody":null,"totalTestsPeopleAntigen":null,"positiveTestsPeopleAntigen":null,"totalTestsAntigen":264276,"positiveTestsAntigen":16028,"fips":"09","positiveIncrease":2568,"negativeIncrease":0,"total":256522,"totalTestResultsIncrease":51862,"posNeg":256522,"dataQualityGrade":null,"deathIncrease":14,"hospitalizedIncrease":0,"hash":"c33e6e442a6b4555ed4247b85bce7813cfc4eda7","commercialScore":0,"negativeRegularScore":0,"negativeScore":0,"positiveScore":0,"score":0,"grade":""},{"date":20210201,"state":"CT","positive":253954,"probableCases":15419,"negative":null,"pending":null,"totalTestResultsSource":"totalTestsViral","totalTestResults":5536731,"hospitalizedCurrently":912,"hospitalizedCumulative":null,"inIcuCurrently":null,"inIcuCumulative":null,"onVentilatorCurrently":null,"onVentilatorCumulative":null,"recovered":null,"lastUpdateEt":"1/31/2021 23:59","dateModified":"2021-01-31T23:59:00Z","checkTimeEt":"01/31 18:59","death":7119,"hospitalized":null,"hospitalizedDischarged":null,"dateChecked":"2021-01-31T23:59:00Z","totalTestsViral":5536731,"positiveTestsViral":289594,"negativeTestsViral":5239888,"positiveCasesViral":238535,"deathConfirmed":5806,"deathProbable":1313,"totalTestEncountersViral":null,"totalTestsPeopleViral":null,"totalTestsAntibody":null,"positiveTestsAntibody":null,"negativeTestsAntibody":null,"totalTestsPeopleAntibody":null,"positiveTestsPeopleAntibody":null,"negativeTestsPeopleAntibody":null,"totalTestsPeopleAntigen":null,"positiveTestsPeopleAntigen":null,"totalTestsAntigen":257183,"positiveTestsAntigen":15705,"fips":"09","positiveIncrease":3931,"negativeIncrease":0,"total":253954,"totalTestResultsIncrease":98,"posNeg":253954,"dataQualityGrade":null,"deathIncrease":73,"hospitalizedIncrease":0,"hash":"9ca60690e1e192f146534a2e3fb42aa7baf232d4","commercialScore":0,"negativeRegularScore":0,"negativeScore":0,"positiveScore":0,"score":0,"grade":""},{"date":20210131,"state":"CT","positive":250023,"probableCases":15209,"negative":null,"pending":null,"totalTestResultsSource":"totalTestsViral","totalTestResults":5536633,"hospitalizedCurrently":985,"hospitalizedCumulative":null,"inIcuCurrently":null,"inIcuCumulative":null,"onVentilatorCurrently":null,"onVentilatorCumulative":null,"recovered":null,"lastUpdateEt":"1/28/2021 23:59","dateModified":"2021-01-28T23:59:00Z","checkTimeEt":"01/28 18:59","death":7046,"hospitalized":null,"hospitalizedDischarged":null,"dateChecked":"2021-01-28T23:59:00Z","totalTestsViral":5536633,"positiveTestsViral":289589,"negativeTestsViral":5239795,"positiveCasesViral":234814,"deathConfirmed":5741,"deathProbable":1305,"totalTestEncountersViral":null,"totalTestsPeopleViral":null,"totalTestsAntibody":null,"positiveTestsAntibody":null,"negativeTestsAntibody":null,"totalTestsPeopleAntibody":null,"positiveTestsPeopleAntibody":null,"negativeTestsPeopleAntibody":null,"totalTestsPeopleAntigen":null,"positiveTestsPeopleAntigen":null,"totalTestsAntigen":249128,"positiveTestsAntigen":15351,"fips":"09","positiveIncrease":0,"negativeIncrease":0,"total":250023,"totalTestResultsIncrease":1952,"posNeg":250023,"dataQualityGrade":null,"deathIncrease":0,"hospitalizedIncrease":0,"hash":"3123fa51f034f9c766cbeb3e6ca982d63e13b6d5","commercialScore":0,"negativeRegularScore":0,"negativeScore":0,"positiveScore":0,"score":0,"grade":""},{"date":20210130,"state":"CT","positive":250023,"probableCases":15209,"negative":null,"pending":null,"totalTestResultsSource":"totalTestsViral","totalTestResults":5534681,"hospitalizedCurrently":985,"hospitalizedCumulative":null,"inIcuCurrently":null,"inIcuCumulative":null,"onVentilatorCurrently":null,"onVentilatorCumulative":null,"recovered":null,"lastUpdateEt":"1/28/2021 23:59","dateModified":"2021-01-28T23:59:00Z","checkTimeEt":"01/28 18:59","death":7046,"hospitalized":null,"hospitalizedDischarged":null,"dateChecked":"2021-01-28T23:59:00Z","totalTestsViral":5534681,"positiveTestsViral":289498,"negativeTestsViral":5237934,"positiveCasesViral":234814,"deathConfirmed":5741,"deathProbable":1305,"totalTestEncountersViral":null,"totalTestsPeopleViral":null,"totalTestsAntibody":null,"positiveTestsAntibody":null,"negativeTestsAntibody":null,"totalTestsPeopleAntibody":null,"positiveTestsPeopleAntibody":null,"negativeTestsPeopleAntibody":null,"totalTestsPeopleAntigen":null,"positiveTestsPeopleAntigen":null,"totalTestsAntigen":249128,"positiveTestsAntigen":15351,"fips":"09","positiveIncrease":0,"negativeIncrease":0,"total":250023,"totalTestResultsIncrease":13839,"posNeg":250023,"dataQualityGrade":null,"deathIncrease":0,"hospitalizedIncrease":0,"hash":"3f54606896a75a12148b57e34376dd9d0a1b272b","commercialScore":0,"negativeRegularScore":0,"negativeScore":0,"positiveScore":0,"score":0,"grade":""},{"date":20210129,"state":"CT","positive":250023,"probableCases":15209,"negative":null,"pending":null,"totalTestResultsSource":"totalTestsViral","totalTestResults":5520842,"hospitalizedCurrently":985,"hospitalizedCumulative":null,"inIcuCurrently":null,"inIcuCumulative":null,"onVentilatorCurrently":null,"onVentilatorCumulative":null,"recovered":null,"lastUpdateEt":"1/28/2021 23:59","dateModified":"2021-01-28T23:59:00Z","checkTimeEt":"01/28 18:59","death":7046,"hospitalized":null,"hospitalizedDischarged":null,"dateChecked":"2021-01-28T23:59:00Z","totalTestsViral":5520842,"positiveTestsViral":288783,"negativeTestsViral":5224810,"positiveCasesViral":234814,"deathConfirmed":5741,"deathProbable":1305,"totalTestEncountersViral":null,"totalTestsPeopleViral":null,"totalTestsAntibody":null,"positiveTestsAntibody":null,"negativeTestsAntibody":null,"totalTestsPeopleAntibody":null,"positiveTestsPeopleAntibody":null,"negativeTestsPeopleAntibody":null,"totalTestsPeopleAntigen":null,"positiveTestsPeopleAntigen":null,"totalTestsAntigen":249128,"positiveTestsAntigen":15351,"fips":"09","positiveIncrease":1258,"negativeIncrease":0,"total":250023,"totalTestResultsIncrease":25370,"posNeg":250023,"dataQualityGrade":null,"deathIncrease":26,"hospitalizedIncrease":0,"hash":"2c60c25caf0b070d6d955aef574f817ecdf91466","commercialScore":0,"negativeRegularScore":0,"negativeScore":0,"positiveScore":0,"score":0,"grade":""},{"date":20210128,"state":"CT","positive":248765,"probableCases":15104,"negative":null,"pending":null,"totalTestResultsSource":"totalTestsViral","totalTestResults":5495472,"hospitalizedCurrently":995,"hospitalizedCumulative":null,"inIcuCurrently":null,"inIcuCumulative":null,"onVentilatorCurrently":null,"onVentilatorCumulative":null,"recovered":null,"lastUpdateEt":"1/27/2021 20:30","dateModified":"2021-01-27T20:30:00Z","checkTimeEt":"01/27 15:30","death":7020,"hospitalized":null,"hospitalizedDischarged":null,"dateChecked":"2021-01-27T20:30:00Z","totalTestsViral":5495472,"positiveTestsViral":287407,"negativeTestsViral":5200823,"positiveCasesViral":233661,"deathConfirmed":5718,"deathProbable":1302,"totalTestEncountersViral":null,"totalTestsPeopleViral":null,"totalTestsAntibody":null,"positiveTestsAntibody":null,"negativeTestsAntibody":null,"totalTestsPeopleAntibody":null,"positiveTestsPeopleAntibody":null,"negativeTestsPeopleAntibody":null,"totalTestsPeopleAntigen":null,"positiveTestsPeopleAntigen":null,"totalTestsAntigen":246797,"positiveTestsAntigen":15185,"fips":"09","positiveIncrease":1426,"negativeIncrease":0,"total":248765,"totalTestResultsIncrease":32888,"posNeg":248765,"dataQualityGrade":null,"deathIncrease":44,"hospitalizedIncrease":0,"hash":"ee1e86c252646e221097eaf4c7f7e88d7ea44f8c","commercialScore":0,"negativeRegularScore":0,"negativeScore":0,"positiveScore":0,"score":0,"grade":""},{"date":20210127,"state":"CT","positive":247339,"probableCases":14985,"negative":null,"pending":null,"totalTestResultsSource":"totalTestsViral","totalTestResults":5462584,"hospitalizedCurrently":1016,"hospitalizedCumulative":null,"inIcuCurrently":null,"inIcuCumulative":null,"onVentilatorCurrently":null,"onVentilatorCumulative":null,"recovered":null,"lastUpdateEt":"1/26/2021 20:30","dateModified":"2021-01-26T20:30:00Z","checkTimeEt":"01/26 15:30","death":6976,"hospitalized":null,"hospitalizedDischarged":null,"dateChecked":"2021-01-26T20:30:00Z","totalTestsViral":5462584,"positiveTestsViral":285869,"negativeTestsViral":5169488,"positiveCasesViral":232354,"deathConfirmed":5679,"deathProbable":1297,"totalTestEncountersViral":null,"totalTestsPeopleViral":null,"totalTestsAntibody":null,"positiveTestsAntibody":null,"negativeTestsAntibody":null,"totalTestsPeopleAntibody":null,"positiveTestsPeopleAntibody":null,"negativeTestsPeopleAntibody":null,"totalTestsPeopleAntigen":null,"positiveTestsPeopleAntigen":null,"totalTestsAntigen":243173,"positiveTestsAntigen":15009,"fips":"09","positiveIncrease":2440,"negativeIncrease":0,"total":247339,"totalTestResultsIncrease":43223,"posNeg":247339,"dataQualityGrade":null,"deathIncrease":42,"hospitalizedIncrease":0,"hash":"09194caa8fcc431fb636e1264d35d4d5848001b6","commercialScore":0,"negativeRegularScore":0,"negativeScore":0,"positiveScore":0,"score":0,"grade":""},{"date":20210126,"state":"CT","positive":244899,"probableCases":14754,"negative":null,"pending":null,"totalTestResultsSource":"totalTestsViral","totalTestResults":5419361,"hospitalizedCurrently":1068,"hospitalizedCumulative":null,"inIcuCurrently":null,"inIcuCumulative":null,"onVentilatorCurrently":null,"onVentilatorCumulative":null,"recovered":null,"lastUpdateEt":"1/25/2021 20:30","dateModified":"2021-01-25T20:30:00Z","checkTimeEt":"01/25 15:30","death":6934,"hospitalized":null,"hospitalizedDischarged":null,"dateChecked":"2021-01-25T20:30:00Z","totalTestsViral":5419361,"positiveTestsViral":284041,"negativeTestsViral":5128108,"positiveCasesViral":230145,"deathConfirmed":5638,"deathProbable":1296,"totalTestEncountersViral":null,"totalTestsPeopleViral":null,"totalTestsAntibody":null,"positiveTestsAntibody":null,"negativeTestsAntibody":null,"totalTestsPeopleAntibody":null,"positiveTestsPeopleAntibody":null,"negativeTestsPeopleAntibody":null,"totalTestsPeopleAntigen":null,"positiveTestsPeopleAntigen":null,"totalTestsAntigen":237037,"positiveTestsAntigen":14675,"fips":"09","positiveIncrease":1267,"negativeIncrease":0,"total":244899,"totalTestResultsIncrease":53659,"posNeg":244899,"dataQualityGrade":null,"deathIncrease":23,"hospitalizedIncrease":0,"hash":"d62069d8efbe4c35175f8953d64d38c8936e629a","commercialScore":0,"negativeRegularScore":0,"negativeScore":0,"positiveScore":0,"score":0,"grade":""},{"date":20210125,"state":"CT","positive":243632,"probableCases":14655,"negative":null,"pending":null,"totalTestResultsSource":"totalTestsViral","totalTestResults":5365702,"hospitalizedCurrently":1068,"hospitalizedCumulative":null,"inIcuCurrently":null,"inIcuCumulative":null,"onVentilatorCurrently":null,"onVentilatorCumulative":null,"recovered":null,"lastUpdateEt":"1/24/2021 20:30","dateModified":"2021-01-24T20:30:00Z","checkTimeEt":"01/24 15:30","death":6911,"hospitalized":null,"hospitalizedDischarged":null,"dateChecked":"2021-01-24T20:30:00Z","totalTestsViral":5365702,"positiveTestsViral":281700,"negativeTestsViral":5076818,"positiveCasesViral":228977,"deathConfirmed":5621,"deathProbable":1290,"totalTestEncountersViral":null,"totalTestsPeopleViral":null,"totalTestsAntibody":null,"positiveTestsAntibody":null,"negativeTestsAntibody":null,"totalTestsPeopleAntibody":null,"positiveTestsPeopleAntibody":null,"negativeTestsPeopleAntibody":null,"totalTestsPeopleAntigen":null,"positiveTestsPeopleAntigen":null,"totalTestsAntigen":233960,"positiveTestsAntigen":14427,"fips":"09","positiveIncrease":5817,"negativeIncrease":0,"total":243632,"totalTestResultsIncrease":17436,"posNeg":243632,"dataQualityGrade":null,"deathIncrease":92,"hospitalizedIncrease":0,"hash":"ee9757f031aa53f1a72143d39d842466b9b2e6dc","commercialScore":0,"negativeRegularScore":0,"negativeScore":0,"positiveScore":0,"score":0,"grade":""},{"date":20210124,"state":"CT","positive":237815,"probableCases":14307,"negative":null,"pending":null,"totalTestResultsSource":"totalTestsViral","totalTestResults":5348266,"hospitalizedCurrently":1058,"hospitalizedCumulative":null,"inIcuCurrently":null,"inIcuCumulative":null,"onVentilatorCurrently":null,"onVentilatorCumulative":null,"recovered":null,"lastUpdateEt":"1/21/2021 20:30","dateModified":"2021-01-21T20:30:00Z","checkTimeEt":"01/21 15:30","death":6819,"hospitalized":null,"hospitalizedDischarged":null,"dateChecked":"2021-01-21T20:30:00Z","totalTestsViral":5348266,"positiveTestsViral":280502,"negativeTestsViral":5060586,"positiveCasesViral":223508,"deathConfirmed":5545,"deathProbable":1274,"totalTestEncountersViral":null,"totalTestsPeopleViral":null,"totalTestsAntibody":null,"positiveTestsAntibody":null,"negativeTestsAntibody":null,"totalTestsPeopleAntibody":null,"positiveTestsPeopleAntibody":null,"negativeTestsPeopleAntibody":null,"totalTestsPeopleAntigen":null,"positiveTestsPeopleAntigen":null,"totalTestsAntigen":221289,"positiveTestsAntigen":14025,"fips":"09","positiveIncrease":0,"negativeIncrease":0,"total":237815,"totalTestResultsIncrease":18679,"posNeg":237815,"dataQualityGrade":null,"deathIncrease":0,"hospitalizedIncrease":0,"hash":"27c75c2d375ebe2acef079537d57077ca17ca698","commercialScore":0,"negativeRegularScore":0,"negativeScore":0,"positiveScore":0,"score":0,"grade":""},{"date":20210123,"state":"CT","positive":237815,"probableCases":14307,"negative":null,"pending":null,"totalTestResultsSource":"totalTestsViral","totalTestResults":5329587,"hospitalizedCurrently":1058,"hospitalizedCumulative":null,"inIcuCurrently":null,"inIcuCumulative":null,"onVentilatorCurrently":null,"onVentilatorCumulative":null,"recovered":null,"lastUpdateEt":"1/21/2021 20:30","dateModified":"2021-01-21T20:30:00Z","checkTimeEt":"01/21 15:30","death":6819,"hospitalized":null,"hospitalizedDischarged":null,"dateChecked":"2021-01-21T20:30:00Z","totalTestsViral":5329587,"positiveTestsViral":278994,"negativeTestsViral":5043440,"positiveCasesViral":223508,"deathConfirmed":5545,"deathProbable":1274,"totalTestEncountersViral":null,"totalTestsPeopleViral":null,"totalTestsAntibody":null,"positiveTestsAntibody":null,"negativeTestsAntibody":null,"totalTestsPeopleAntibody":null,"positiveTestsPeopleAntibody":null,"negativeTestsPeopleAntibody":null,"totalTestsPeopleAntigen":null,"positiveTestsPeopleAntigen":null,"totalTestsAntigen":221289,"positiveTestsAntigen":14025,"fips":"09","positiveIncrease":0,"negativeIncrease":0,"total":237815,"totalTestResultsIncrease":33656,"posNeg":237815,"dataQualityGrade":null,"deathIncrease":0,"hospitalizedIncrease":0,"hash":"23b04f4bb6bc35c2bb0da1ef1efca320b9c4aa29","commercialScore":0,"negativeRegularScore":0,"negativeScore":0,"positiveScore":0,"score":0,"grade":""},{"date":20210122,"state":"CT","positive":237815,"probableCases":14307,"negative":null,"pending":null,"totalTestResultsSource":"totalTestsViral","totalTestResults":5295931,"hospitalizedCurrently":1058,"hospitalizedCumulative":null,"inIcuCurrently":null,"inIcuCumulative":null,"onVentilatorCurrently":null,"onVentilatorCumulative":null,"recovered":null,"lastUpdateEt":"1/21/2021 20:30","dateModified":"2021-01-21T20:30:00Z","checkTimeEt":"01/21 15:30","death":6819,"hospitalized":null,"hospitalizedDischarged":null,"dateChecked":"2021-01-21T20:30:00Z","totalTestsViral":5295931,"positiveTestsViral":276716,"negativeTestsViral":5012080,"positiveCasesViral":223508,"deathConfirmed":5545,"deathProbable":1274,"totalTestEncountersViral":null,"totalTestsPeopleViral":null,"totalTestsAntibody":null,"positiveTestsAntibody":null,"negativeTestsAntibody":null,"totalTestsPeopleAntibody":null,"positiveTestsPeopleAntibody":null,"negativeTestsPeopleAntibody":null,"totalTestsPeopleAntigen":null,"positiveTestsPeopleAntigen":null,"totalTestsAntigen":221289,"positiveTestsAntigen":14025,"fips":"09","positiveIncrease":2019,"negativeIncrease":0,"total":237815,"totalTestResultsIncrease":38323,"posNeg":237815,"dataQualityGrade":null,"deathIncrease":45,"hospitalizedIncrease":0,"hash":"e060c2aad75fc417e183203e158418f4cf4902c8","commercialScore":0,"negativeRegularScore":0,"negativeScore":0,"positiveScore":0,"score":0,"grade":""},{"date":20210121,"state":"CT","positive":235796,"probableCases":14151,"negative":null,"pending":null,"totalTestResultsSource":"totalTestsViral","totalTestResults":5257608,"hospitalizedCurrently":1069,"hospitalizedCumulative":null,"inIcuCurrently":null,"inIcuCumulative":null,"onVentilatorCurrently":null,"onVentilatorCumulative":null,"recovered":null,"lastUpdateEt":"1/20/2021 20:30","dateModified":"2021-01-20T20:30:00Z","checkTimeEt":"01/20 15:30","death":6774,"hospitalized":null,"hospitalizedDischarged":null,"dateChecked":"2021-01-20T20:30:00Z","totalTestsViral":5257608,"positiveTestsViral":274382,"negativeTestsViral":4976108,"positiveCasesViral":221645,"deathConfirmed":5511,"deathProbable":1263,"totalTestEncountersViral":null,"totalTestsPeopleViral":null,"totalTestsAntibody":null,"positiveTestsAntibody":null,"negativeTestsAntibody":null,"totalTestsPeopleAntibody":null,"positiveTestsPeopleAntibody":null,"negativeTestsPeopleAntibody":null,"totalTestsPeopleAntigen":null,"positiveTestsPeopleAntigen":null,"totalTestsAntigen":216470,"positiveTestsAntigen":13800,"fips":"09","positiveIncrease":1662,"negativeIncrease":0,"total":235796,"totalTestResultsIncrease":41416,"posNeg":235796,"dataQualityGrade":null,"deathIncrease":48,"hospitalizedIncrease":0,"hash":"8a8f374c0f98b1e7aa4ba58b0a42b6f37647308e","commercialScore":0,"negativeRegularScore":0,"negativeScore":0,"positiveScore":0,"score":0,"grade":""},{"date":20210120,"state":"CT","positive":234134,"probableCases":14013,"negative":null,"pending":null,"totalTestResultsSource":"totalTestsViral","totalTestResults":5216192,"hospitalizedCurrently":1124,"hospitalizedCumulative":null,"inIcuCurrently":null,"inIcuCumulative":null,"onVentilatorCurrently":null,"onVentilatorCumulative":null,"recovered":null,"lastUpdateEt":"1/19/2021 20:30","dateModified":"2021-01-19T20:30:00Z","checkTimeEt":"01/19 15:30","death":6726,"hospitalized":null,"hospitalizedDischarged":null,"dateChecked":"2021-01-19T20:30:00Z","totalTestsViral":5216192,"positiveTestsViral":272032,"negativeTestsViral":4937069,"positiveCasesViral":220121,"deathConfirmed":5470,"deathProbable":1256,"totalTestEncountersViral":null,"totalTestsPeopleViral":null,"totalTestsAntibody":null,"positiveTestsAntibody":null,"negativeTestsAntibody":null,"totalTestsPeopleAntibody":null,"positiveTestsPeopleAntibody":null,"negativeTestsPeopleAntibody":null,"totalTestsPeopleAntigen":null,"positiveTestsPeopleAntigen":null,"totalTestsAntigen":213226,"positiveTestsAntigen":13651,"fips":"09","positiveIncrease":1915,"negativeIncrease":0,"total":234134,"totalTestResultsIncrease":46305,"posNeg":234134,"dataQualityGrade":null,"deathIncrease":44,"hospitalizedIncrease":0,"hash":"439c25283f45f64e640df56c233b20c3744f205d","commercialScore":0,"negativeRegularScore":0,"negativeScore":0,"positiveScore":0,"score":0,"grade":""},{"date":20210119,"state":"CT","positive":232219,"probableCases":13459,"negative":null,"pending":null,"totalTestResultsSource":"totalTestsViral","totalTestResults":5169887,"hospitalizedCurrently":1141,"hospitalizedCumulative":null,"inIcuCurrently":null,"inIcuCumulative":null,"onVentilatorCurrently":null,"onVentilatorCumulative":null,"recovered":null,"lastUpdateEt":"1/18/2021 20:30","dateModified":"2021-01-18T20:30:00Z","checkTimeEt":"01/18 15:30","death":6682,"hospitalized":null,"hospitalizedDischarged":null,"dateChecked":"2021-01-18T20:30:00Z","totalTestsViral":5169887,"positiveTestsViral":269606,"negativeTestsViral":4893232,"positiveCasesViral":218760,"deathConfirmed":5433,"deathProbable":1249,"totalTestEncountersViral":null,"totalTestsPeopleViral":null,"totalTestsAntibody":null,"positiveTestsAntibody":null,"negativeTestsAntibody":null,"totalTestsPeopleAntibody":null,"positiveTestsPeopleAntibody":null,"negativeTestsPeopleAntibody":null,"totalTestsPeopleAntigen":null,"positiveTestsPeopleAntigen":null,"totalTestsAntigen":204753,"positiveTestsAntigen":12967,"fips":"09","positiveIncrease":2094,"negativeIncrease":0,"total":232219,"totalTestResultsIncrease":41758,"posNeg":232219,"dataQualityGrade":null,"deathIncrease":12,"hospitalizedIncrease":0,"hash":"38378cdb1c72b69e2645353f11f803353ee0ecdb","commercialScore":0,"negativeRegularScore":0,"negativeScore":0,"positiveScore":0,"score":0,"grade":""},{"date":20210118,"state":"CT","positive":230125,"probableCases":13433,"negative":null,"pending":null,"totalTestResultsSource":"totalTestsViral","totalTestResults":5128129,"hospitalizedCurrently":1114,"hospitalizedCumulative":null,"inIcuCurrently":null,"inIcuCumulative":null,"onVentilatorCurrently":null,"onVentilatorCumulative":null,"recovered":null,"lastUpdateEt":"1/17/2021 20:30","dateModified":"2021-01-17T20:30:00Z","checkTimeEt":"01/17 15:30","death":6670,"hospitalized":null,"hospitalizedDischarged":null,"dateChecked":"2021-01-17T20:30:00Z","totalTestsViral":5128129,"positiveTestsViral":267326,"negativeTestsViral":4853775,"positiveCasesViral":216692,"deathConfirmed":5355,"deathProbable":1239,"totalTestEncountersViral":null,"totalTestsPeopleViral":null,"totalTestsAntibody":null,"positiveTestsAntibody":null,"negativeTestsAntibody":null,"totalTestsPeopleAntibody":null,"positiveTestsPeopleAntibody":null,"negativeTestsPeopleAntibody":null,"totalTestsPeopleAntigen":null,"positiveTestsPeopleAntigen":null,"totalTestsAntigen":201942,"positiveTestsAntigen":12856,"fips":"09","positiveIncrease":6703,"negativeIncrease":0,"total":230125,"totalTestResultsIncrease":16759,"posNeg":230125,"dataQualityGrade":null,"deathIncrease":76,"hospitalizedIncrease":0,"hash":"9eed1c90c5e315a9c55a7d640a68bec61e502d4a","commercialScore":0,"negativeRegularScore":0,"negativeScore":0,"positiveScore":0,"score":0,"grade":""},{"date":20210117,"state":"CT","positive":223422,"probableCases":13229,"negative":null,"pending":null,"totalTestResultsSource":"totalTestsViral","totalTestResults":5111370,"hospitalizedCurrently":1098,"hospitalizedCumulative":null,"inIcuCurrently":null,"inIcuCumulative":null,"onVentilatorCurrently":null,"onVentilatorCumulative":null,"recovered":null,"lastUpdateEt":"1/14/2021 20:30","dateModified":"2021-01-14T20:30:00Z","checkTimeEt":"01/14 15:30","death":6594,"hospitalized":null,"hospitalizedDischarged":null,"dateChecked":"2021-01-14T20:30:00Z","totalTestsViral":5111370,"positiveTestsViral":265917,"negativeTestsViral":4838433,"positiveCasesViral":210193,"deathConfirmed":5355,"deathProbable":1239,"totalTestEncountersViral":null,"totalTestsPeopleViral":null,"totalTestsAntibody":null,"positiveTestsAntibody":null,"negativeTestsAntibody":null,"totalTestsPeopleAntibody":null,"positiveTestsPeopleAntibody":null,"negativeTestsPeopleAntibody":null,"totalTestsPeopleAntigen":null,"positiveTestsPeopleAntigen":null,"totalTestsAntigen":190080,"positiveTestsAntigen":12124,"fips":"09","positiveIncrease":0,"negativeIncrease":0,"total":223422,"totalTestResultsIncrease":18056,"posNeg":223422,"dataQualityGrade":null,"deathIncrease":0,"hospitalizedIncrease":0,"hash":"410347a16233026ed2dd136c73799796ffe02e0f","commercialScore":0,"negativeRegularScore":0,"negativeScore":0,"positiveScore":0,"score":0,"grade":""},{"date":20210116,"state":"CT","positive":223422,"probableCases":13229,"negative":null,"pending":null,"totalTestResultsSource":"totalTestsViral","totalTestResults":5093314,"hospitalizedCurrently":1098,"hospitalizedCumulative":null,"inIcuCurrently":null,"inIcuCumulative":null,"onVentilatorCurrently":null,"onVentilatorCumulative":null,"recovered":null,"lastUpdateEt":"1/14/2021 20:30","dateModified":"2021-01-14T20:30:00Z","checkTimeEt":"01/14 15:30","death":6594,"hospitalized":null,"hospitalizedDischarged":null,"dateChecked":"2021-01-14T20:30:00Z","totalTestsViral":5093314,"positiveTestsViral":264343,"negativeTestsViral":4821960,"positiveCasesViral":210193,"deathConfirmed":5355,"deathProbable":1239,"totalTestEncountersViral":null,"totalTestsPeopleViral":null,"totalTestsAntibody":null,"positiveTestsAntibody":null,"negativeTestsAntibody":null,"totalTestsPeopleAntibody":null,"positiveTestsPeopleAntibody":null,"negativeTestsPeopleAntibody":null,"totalTestsPeopleAntigen":null,"positiveTestsPeopleAntigen":null,"totalTestsAntigen":190080,"positiveTestsAntigen":12124,"fips":"09","positiveIncrease":0,"negativeIncrease":0,"total":223422,"totalTestResultsIncrease":33017,"posNeg":223422,"dataQualityGrade":null,"deathIncrease":0,"hospitalizedIncrease":0,"hash":"a2af15f774828d178e514c947682be36945815a9","commercialScore":0,"negativeRegularScore":0,"negativeScore":0,"positiveScore":0,"score":0,"grade":""},{"date":20210115,"state":"CT","positive":223422,"probableCases":13229,"negative":null,"pending":null,"totalTestResultsSource":"totalTestsViral","totalTestResults":5060297,"hospitalizedCurrently":1098,"hospitalizedCumulative":null,"inIcuCurrently":null,"inIcuCumulative":null,"onVentilatorCurrently":null,"onVentilatorCumulative":null,"recovered":null,"lastUpdateEt":"1/14/2021 20:30","dateModified":"2021-01-14T20:30:00Z","checkTimeEt":"01/14 15:30","death":6594,"hospitalized":null,"hospitalizedDischarged":null,"dateChecked":"2021-01-14T20:30:00Z","totalTestsViral":5060297,"positiveTestsViral":261875,"negativeTestsViral":4791447,"positiveCasesViral":210193,"deathConfirmed":5355,"deathProbable":1239,"totalTestEncountersViral":null,"totalTestsPeopleViral":null,"totalTestsAntibody":null,"positiveTestsAntibody":null,"negativeTestsAntibody":null,"totalTestsPeopleAntibody":null,"positiveTestsPeopleAntibody":null,"negativeTestsPeopleAntibody":null,"totalTestsPeopleAntigen":null,"positiveTestsPeopleAntigen":null,"totalTestsAntigen":190080,"positiveTestsAntigen":12124,"fips":"09","positiveIncrease":1878,"negativeIncrease":0,"total":223422,"totalTestResultsIncrease":36233,"posNeg":223422,"dataQualityGrade":null,"deathIncrease":41,"hospitalizedIncrease":0,"hash":"8df0c5c2d7212343766a24871dafad32e9f149d5","commercialScore":0,"negativeRegularScore":0,"negativeScore":0,"positiveScore":0,"score":0,"grade":""},{"date":20210114,"state":"CT","positive":221544,"probableCases":13055,"negative":null,"pending":null,"totalTestResultsSource":"totalTestsViral","totalTestResults":5024064,"hospitalizedCurrently":1118,"hospitalizedCumulative":null,"inIcuCurrently":null,"inIcuCumulative":null,"onVentilatorCurrently":null,"onVentilatorCumulative":null,"recovered":null,"lastUpdateEt":"1/13/2021 20:30","dateModified":"2021-01-13T20:30:00Z","checkTimeEt":"01/13 15:30","death":6553,"hospitalized":null,"hospitalizedDischarged":null,"dateChecked":"2021-01-13T20:30:00Z","totalTestsViral":5024064,"positiveTestsViral":259263,"negativeTestsViral":4757850,"positiveCasesViral":208489,"deathConfirmed":5319,"deathProbable":1234,"totalTestEncountersViral":null,"totalTestsPeopleViral":null,"totalTestsAntibody":null,"positiveTestsAntibody":null,"negativeTestsAntibody":null,"totalTestsPeopleAntibody":null,"positiveTestsPeopleAntibody":null,"negativeTestsPeopleAntibody":null,"totalTestsPeopleAntigen":null,"positiveTestsPeopleAntigen":null,"totalTestsAntigen":186871,"positiveTestsAntigen":11908,"fips":"09","positiveIncrease":968,"negativeIncrease":0,"total":221544,"totalTestResultsIncrease":42449,"posNeg":221544,"dataQualityGrade":null,"deathIncrease":17,"hospitalizedIncrease":0,"hash":"dd4ba2b054ea586889870870574a319a35940109","commercialScore":0,"negativeRegularScore":0,"negativeScore":0,"positiveScore":0,"score":0,"grade":""},{"date":20210113,"state":"CT","positive":220576,"probableCases":12836,"negative":null,"pending":null,"totalTestResultsSource":"totalTestsViral","totalTestResults":4981615,"hospitalizedCurrently":1148,"hospitalizedCumulative":null,"inIcuCurrently":null,"inIcuCumulative":null,"onVentilatorCurrently":null,"onVentilatorCumulative":null,"recovered":null,"lastUpdateEt":"1/12/2021 20:30","dateModified":"2021-01-12T20:30:00Z","checkTimeEt":"01/12 15:30","death":6536,"hospitalized":null,"hospitalizedDischarged":null,"dateChecked":"2021-01-12T20:30:00Z","totalTestsViral":4981615,"positiveTestsViral":256632,"negativeTestsViral":4718071,"positiveCasesViral":207740,"deathConfirmed":5305,"deathProbable":1231,"totalTestEncountersViral":null,"totalTestsPeopleViral":null,"totalTestsAntibody":null,"positiveTestsAntibody":null,"negativeTestsAntibody":null,"totalTestsPeopleAntibody":null,"positiveTestsPeopleAntibody":null,"negativeTestsPeopleAntibody":null,"totalTestsPeopleAntigen":null,"positiveTestsPeopleAntigen":null,"totalTestsAntigen":181632,"positiveTestsAntigen":11642,"fips":"09","positiveIncrease":3529,"negativeIncrease":0,"total":220576,"totalTestResultsIncrease":45116,"posNeg":220576,"dataQualityGrade":null,"deathIncrease":87,"hospitalizedIncrease":0,"hash":"86034bec9f2c2f2ca0d965c82384db762a717741","commercialScore":0,"negativeRegularScore":0,"negativeScore":0,"positiveScore":0,"score":0,"grade":""},{"date":20210112,"state":"CT","positive":217047,"probableCases":12542,"negative":null,"pending":null,"totalTestResultsSource":"totalTestsViral","totalTestResults":4936499,"hospitalizedCurrently":1154,"hospitalizedCumulative":null,"inIcuCurrently":null,"inIcuCumulative":null,"onVentilatorCurrently":null,"onVentilatorCumulative":null,"recovered":null,"lastUpdateEt":"1/11/2021 20:30","dateModified":"2021-01-11T20:30:00Z","checkTimeEt":"01/11 15:30","death":6449,"hospitalized":null,"hospitalizedDischarged":null,"dateChecked":"2021-01-11T20:30:00Z","totalTestsViral":4936499,"positiveTestsViral":253845,"negativeTestsViral":4675758,"positiveCasesViral":204505,"deathConfirmed":5236,"deathProbable":1213,"totalTestEncountersViral":null,"totalTestsPeopleViral":null,"totalTestsAntibody":null,"positiveTestsAntibody":null,"negativeTestsAntibody":null,"totalTestsPeopleAntibody":null,"positiveTestsPeopleAntibody":null,"negativeTestsPeopleAntibody":null,"totalTestsPeopleAntigen":null,"positiveTestsPeopleAntigen":null,"totalTestsAntigen":175036,"positiveTestsAntigen":11299,"fips":"09","positiveIncrease":3689,"negativeIncrease":0,"total":217047,"totalTestResultsIncrease":50607,"posNeg":217047,"dataQualityGrade":null,"deathIncrease":33,"hospitalizedIncrease":0,"hash":"fb6efdb87b12d7187102440e36a545c5552c5036","commercialScore":0,"negativeRegularScore":0,"negativeScore":0,"positiveScore":0,"score":0,"grade":""},{"date":20210111,"state":"CT","positive":213358,"probableCases":12234,"negative":null,"pending":null,"totalTestResultsSource":"totalTestsViral","totalTestResults":4885892,"hospitalizedCurrently":1142,"hospitalizedCumulative":null,"inIcuCurrently":null,"inIcuCumulative":null,"onVentilatorCurrently":null,"onVentilatorCumulative":null,"recovered":null,"lastUpdateEt":"1/10/2021 20:30","dateModified":"2021-01-10T20:30:00Z","checkTimeEt":"01/10 15:30","death":6416,"hospitalized":null,"hospitalizedDischarged":null,"dateChecked":"2021-01-10T20:30:00Z","totalTestsViral":4885892,"positiveTestsViral":250671,"negativeTestsViral":4628348,"positiveCasesViral":201124,"deathConfirmed":5210,"deathProbable":1206,"totalTestEncountersViral":null,"totalTestsPeopleViral":null,"totalTestsAntibody":null,"positiveTestsAntibody":null,"negativeTestsAntibody":null,"totalTestsPeopleAntibody":null,"positiveTestsPeopleAntibody":null,"negativeTestsPeopleAntibody":null,"totalTestsPeopleAntigen":null,"positiveTestsPeopleAntigen":null,"totalTestsAntigen":171097,"positiveTestsAntigen":10919,"fips":"09","positiveIncrease":7364,"negativeIncrease":0,"total":213358,"totalTestResultsIncrease":15246,"posNeg":213358,"dataQualityGrade":null,"deathIncrease":92,"hospitalizedIncrease":0,"hash":"30024661b9df8abdfaf96ad2002fb3a57e408a08","commercialScore":0,"negativeRegularScore":0,"negativeScore":0,"positiveScore":0,"score":0,"grade":""},{"date":20210110,"state":"CT","positive":205994,"probableCases":12003,"negative":null,"pending":null,"totalTestResultsSource":"totalTestsViral","totalTestResults":4870646,"hospitalizedCurrently":1109,"hospitalizedCumulative":null,"inIcuCurrently":null,"inIcuCumulative":null,"onVentilatorCurrently":null,"onVentilatorCumulative":null,"recovered":null,"lastUpdateEt":"1/7/2021 20:30","dateModified":"2021-01-07T20:30:00Z","checkTimeEt":"01/07 15:30","death":6324,"hospitalized":null,"hospitalizedDischarged":null,"dateChecked":"2021-01-07T20:30:00Z","totalTestsViral":4870646,"positiveTestsViral":249197,"negativeTestsViral":4614584,"positiveCasesViral":193991,"deathConfirmed":5127,"deathProbable":1197,"totalTestEncountersViral":null,"totalTestsPeopleViral":null,"totalTestsAntibody":null,"positiveTestsAntibody":null,"negativeTestsAntibody":null,"totalTestsPeopleAntibody":null,"positiveTestsPeopleAntibody":null,"negativeTestsPeopleAntibody":null,"totalTestsPeopleAntigen":null,"positiveTestsPeopleAntigen":null,"totalTestsAntigen":163058,"positiveTestsAntigen":10518,"fips":"09","positiveIncrease":0,"negativeIncrease":0,"total":205994,"totalTestResultsIncrease":19635,"posNeg":205994,"dataQualityGrade":null,"deathIncrease":0,"hospitalizedIncrease":0,"hash":"4001d508706eedeac8fb2dcdabf227803c7e1a1c","commercialScore":0,"negativeRegularScore":0,"negativeScore":0,"positiveScore":0,"score":0,"grade":""},{"date":20210109,"state":"CT","positive":205994,"probableCases":12003,"negative":null,"pending":null,"totalTestResultsSource":"totalTestsViral","totalTestResults":4851011,"hospitalizedCurrently":1109,"hospitalizedCumulative":null,"inIcuCurrently":null,"inIcuCumulative":null,"onVentilatorCurrently":null,"onVentilatorCumulative":null,"recovered":null,"lastUpdateEt":"1/7/2021 20:30","dateModified":"2021-01-07T20:30:00Z","checkTimeEt":"01/07 15:30","death":6324,"hospitalized":null,"hospitalizedDischarged":null,"dateChecked":"2021-01-07T20:30:00Z","totalTestsViral":4851011,"positiveTestsViral":247138,"negativeTestsViral":4597025,"positiveCasesViral":193991,"deathConfirmed":5127,"deathProbable":1197,"totalTestEncountersViral":null,"totalTestsPeopleViral":null,"totalTestsAntibody":null,"positiveTestsAntibody":null,"negativeTestsAntibody":null,"totalTestsPeopleAntibody":null,"positiveTestsPeopleAntibody":null,"negativeTestsPeopleAntibody":null,"totalTestsPeopleAntigen":null,"positiveTestsPeopleAntigen":null,"totalTestsAntigen":163058,"positiveTestsAntigen":10518,"fips":"09","positiveIncrease":0,"negativeIncrease":0,"total":205994,"totalTestResultsIncrease":32281,"posNeg":205994,"dataQualityGrade":null,"deathIncrease":0,"hospitalizedIncrease":0,"hash":"50b77cc44c946244ec022f353222e316967a411f","commercialScore":0,"negativeRegularScore":0,"negativeScore":0,"positiveScore":0,"score":0,"grade":""},{"date":20210108,"state":"CT","positive":205994,"probableCases":12003,"negative":null,"pending":null,"totalTestResultsSource":"totalTestsViral","totalTestResults":4818730,"hospitalizedCurrently":1109,"hospitalizedCumulative":null,"inIcuCurrently":null,"inIcuCumulative":null,"onVentilatorCurrently":null,"onVentilatorCumulative":null,"recovered":null,"lastUpdateEt":"1/7/2021 20:30","dateModified":"2021-01-07T20:30:00Z","checkTimeEt":"01/07 15:30","death":6324,"hospitalized":null,"hospitalizedDischarged":null,"dateChecked":"2021-01-07T20:30:00Z","totalTestsViral":4818730,"positiveTestsViral":244237,"negativeTestsViral":4567672,"positiveCasesViral":193991,"deathConfirmed":5127,"deathProbable":1197,"totalTestEncountersViral":null,"totalTestsPeopleViral":null,"totalTestsAntibody":null,"positiveTestsAntibody":null,"negativeTestsAntibody":null,"totalTestsPeopleAntibody":null,"positiveTestsPeopleAntibody":null,"negativeTestsPeopleAntibody":null,"totalTestsPeopleAntigen":null,"positiveTestsPeopleAntigen":null,"totalTestsAntigen":163058,"positiveTestsAntigen":10518,"fips":"09","positiveIncrease":3236,"negativeIncrease":0,"total":205994,"totalTestResultsIncrease":38425,"posNeg":205994,"dataQualityGrade":null,"deathIncrease":37,"hospitalizedIncrease":0,"hash":"f8e5b4bc74dbbd7df8d9cfce9fecdeec5e10eb30","commercialScore":0,"negativeRegularScore":0,"negativeScore":0,"positiveScore":0,"score":0,"grade":""},{"date":20210107,"state":"CT","positive":202758,"probableCases":11991,"negative":null,"pending":null,"totalTestResultsSource":"totalTestsViral","totalTestResults":4780305,"hospitalizedCurrently":1087,"hospitalizedCumulative":null,"inIcuCurrently":null,"inIcuCumulative":null,"onVentilatorCurrently":null,"onVentilatorCumulative":null,"recovered":null,"lastUpdateEt":"1/6/2021 20:30","dateModified":"2021-01-06T20:30:00Z","checkTimeEt":"01/06 15:30","death":6287,"hospitalized":null,"hospitalizedDischarged":null,"dateChecked":"2021-01-06T20:30:00Z","totalTestsViral":4780305,"positiveTestsViral":241182,"negativeTestsViral":4532364,"positiveCasesViral":190767,"deathConfirmed":5096,"deathProbable":1191,"totalTestEncountersViral":null,"totalTestsPeopleViral":null,"totalTestsAntibody":null,"positiveTestsAntibody":null,"negativeTestsAntibody":null,"totalTestsPeopleAntibody":null,"positiveTestsPeopleAntibody":null,"negativeTestsPeopleAntibody":null,"totalTestsPeopleAntigen":null,"positiveTestsPeopleAntigen":null,"totalTestsAntigen":160663,"positiveTestsAntigen":10455,"fips":"09","positiveIncrease":3304,"negativeIncrease":0,"total":202758,"totalTestResultsIncrease":43574,"posNeg":202758,"dataQualityGrade":null,"deathIncrease":57,"hospitalizedIncrease":0,"hash":"e1ff08f218f2094ae3297863de70003a3ce531eb","commercialScore":0,"negativeRegularScore":0,"negativeScore":0,"positiveScore":0,"score":0,"grade":""},{"date":20210106,"state":"CT","positive":199454,"probableCases":11705,"negative":null,"pending":null,"totalTestResultsSource":"totalTestsViral","totalTestResults":4736731,"hospitalizedCurrently":1139,"hospitalizedCumulative":null,"inIcuCurrently":null,"inIcuCumulative":null,"onVentilatorCurrently":null,"onVentilatorCumulative":null,"recovered":null,"lastUpdateEt":"1/5/2021 20:30","dateModified":"2021-01-05T20:30:00Z","checkTimeEt":"01/05 15:30","death":6230,"hospitalized":null,"hospitalizedDischarged":null,"dateChecked":"2021-01-05T20:30:00Z","totalTestsViral":4736731,"positiveTestsViral":237731,"negativeTestsViral":4492309,"positiveCasesViral":187749,"deathConfirmed":5048,"deathProbable":1182,"totalTestEncountersViral":null,"totalTestsPeopleViral":null,"totalTestsAntibody":null,"positiveTestsAntibody":null,"negativeTestsAntibody":null,"totalTestsPeopleAntibody":null,"positiveTestsPeopleAntibody":null,"negativeTestsPeopleAntibody":null,"totalTestsPeopleAntigen":null,"positiveTestsPeopleAntigen":null,"totalTestsAntigen":152840,"positiveTestsAntigen":10054,"fips":"09","positiveIncrease":2486,"negativeIncrease":0,"total":199454,"totalTestResultsIncrease":46602,"posNeg":199454,"dataQualityGrade":null,"deathIncrease":38,"hospitalizedIncrease":0,"hash":"fda4a3a0eaeb03c36b3554fe5a44a8e969a83e19","commercialScore":0,"negativeRegularScore":0,"negativeScore":0,"positiveScore":0,"score":0,"grade":""},{"date":20210105,"state":"CT","positive":196968,"probableCases":11523,"negative":null,"pending":null,"totalTestResultsSource":"totalTestsViral","totalTestResults":4690129,"hospitalizedCurrently":1149,"hospitalizedCumulative":null,"inIcuCurrently":null,"inIcuCumulative":null,"onVentilatorCurrently":null,"onVentilatorCumulative":null,"recovered":null,"lastUpdateEt":"1/4/2021 20:30","dateModified":"2021-01-04T20:30:00Z","checkTimeEt":"01/04 15:30","death":6192,"hospitalized":null,"hospitalizedDischarged":null,"dateChecked":"2021-01-04T20:30:00Z","totalTestsViral":4690129,"positiveTestsViral":233917,"negativeTestsViral":4449554,"positiveCasesViral":185445,"deathConfirmed":5017,"deathProbable":1175,"totalTestEncountersViral":null,"totalTestsPeopleViral":null,"totalTestsAntibody":null,"positiveTestsAntibody":null,"negativeTestsAntibody":null,"totalTestsPeopleAntibody":null,"positiveTestsPeopleAntibody":null,"negativeTestsPeopleAntibody":null,"totalTestsPeopleAntigen":null,"positiveTestsPeopleAntigen":null,"totalTestsAntigen":149584,"positiveTestsAntigen":9844,"fips":"09","positiveIncrease":2332,"negativeIncrease":0,"total":196968,"totalTestResultsIncrease":51399,"posNeg":196968,"dataQualityGrade":null,"deathIncrease":24,"hospitalizedIncrease":0,"hash":"4195665ea14e0d8ff1e1232b1bdf9d6cb25e3174","commercialScore":0,"negativeRegularScore":0,"negativeScore":0,"positiveScore":0,"score":0,"grade":""},{"date":20210104,"state":"CT","positive":194636,"probableCases":11326,"negative":null,"pending":null,"totalTestResultsSource":"totalTestsViral","totalTestResults":4638730,"hospitalizedCurrently":1111,"hospitalizedCumulative":null,"inIcuCurrently":null,"inIcuCumulative":null,"onVentilatorCurrently":null,"onVentilatorCumulative":null,"recovered":null,"lastUpdateEt":"1/3/2021 20:30","dateModified":"2021-01-03T20:30:00Z","checkTimeEt":"01/03 15:30","death":6168,"hospitalized":null,"hospitalizedDischarged":null,"dateChecked":"2021-01-03T20:30:00Z","totalTestsViral":4638730,"positiveTestsViral":230057,"negativeTestsViral":4402063,"positiveCasesViral":183310,"deathConfirmed":4997,"deathProbable":1171,"totalTestEncountersViral":null,"totalTestsPeopleViral":null,"totalTestsAntibody":null,"positiveTestsAntibody":null,"negativeTestsAntibody":null,"totalTestsPeopleAntibody":null,"positiveTestsPeopleAntibody":null,"negativeTestsPeopleAntibody":null,"totalTestsPeopleAntigen":null,"positiveTestsPeopleAntigen":null,"totalTestsAntigen":145571,"positiveTestsAntigen":9609,"fips":"09","positiveIncrease":4516,"negativeIncrease":0,"total":194636,"totalTestResultsIncrease":17584,"posNeg":194636,"dataQualityGrade":null,"deathIncrease":69,"hospitalizedIncrease":0,"hash":"b3197a834a809d06c07b895b2a2222ba481e2380","commercialScore":0,"negativeRegularScore":0,"negativeScore":0,"positiveScore":0,"score":0,"grade":""},{"date":20210103,"state":"CT","positive":190120,"probableCases":11171,"negative":null,"pending":null,"totalTestResultsSource":"totalTestsViral","totalTestResults":4621146,"hospitalizedCurrently":1056,"hospitalizedCumulative":null,"inIcuCurrently":null,"inIcuCumulative":null,"onVentilatorCurrently":null,"onVentilatorCumulative":null,"recovered":null,"lastUpdateEt":"1/1/2021 20:30","dateModified":"2021-01-01T20:30:00Z","checkTimeEt":"01/01 15:30","death":6099,"hospitalized":null,"hospitalizedDischarged":null,"dateChecked":"2021-01-01T20:30:00Z","totalTestsViral":4621146,"positiveTestsViral":228170,"negativeTestsViral":4386384,"positiveCasesViral":178949,"deathConfirmed":4937,"deathProbable":1162,"totalTestEncountersViral":null,"totalTestsPeopleViral":null,"totalTestsAntibody":null,"positiveTestsAntibody":null,"negativeTestsAntibody":null,"totalTestsPeopleAntibody":null,"positiveTestsPeopleAntibody":null,"negativeTestsPeopleAntibody":null,"totalTestsPeopleAntigen":null,"positiveTestsPeopleAntigen":null,"totalTestsAntigen":137821,"positiveTestsAntigen":9340,"fips":"09","positiveIncrease":0,"negativeIncrease":0,"total":190120,"totalTestResultsIncrease":22317,"posNeg":190120,"dataQualityGrade":null,"deathIncrease":0,"hospitalizedIncrease":0,"hash":"88dda09f6b7072e723ea9ddd200b28fde01cca78","commercialScore":0,"negativeRegularScore":0,"negativeScore":0,"positiveScore":0,"score":0,"grade":""},{"date":20210102,"state":"CT","positive":190120,"probableCases":11171,"negative":null,"pending":null,"totalTestResultsSource":"totalTestsViral","totalTestResults":4598829,"hospitalizedCurrently":1056,"hospitalizedCumulative":null,"inIcuCurrently":null,"inIcuCumulative":null,"onVentilatorCurrently":null,"onVentilatorCumulative":null,"recovered":null,"lastUpdateEt":"1/1/2021 20:30","dateModified":"2021-01-01T20:30:00Z","checkTimeEt":"01/01 15:30","death":6099,"hospitalized":null,"hospitalizedDischarged":null,"dateChecked":"2021-01-01T20:30:00Z","totalTestsViral":4598829,"positiveTestsViral":225736,"negativeTestsViral":4366522,"positiveCasesViral":178949,"deathConfirmed":4937,"deathProbable":1162,"totalTestEncountersViral":null,"totalTestsPeopleViral":null,"totalTestsAntibody":null,"positiveTestsAntibody":null,"negativeTestsAntibody":null,"totalTestsPeopleAntibody":null,"positiveTestsPeopleAntibody":null,"negativeTestsPeopleAntibody":null,"totalTestsPeopleAntigen":null,"positiveTestsPeopleAntigen":null,"totalTestsAntigen":137821,"positiveTestsAntigen":9340,"fips":"09","positiveIncrease":4412,"negativeIncrease":0,"total":190120,"totalTestResultsIncrease":5369,"posNeg":190120,"dataQualityGrade":null,"deathIncrease":104,"hospitalizedIncrease":0,"hash":"c14239def6a5a62dfa7f0475ae80b00dfe5e6b7f","commercialScore":0,"negativeRegularScore":0,"negativeScore":0,"positiveScore":0,"score":0,"grade":""},{"date":20210101,"state":"CT","positive":185708,"probableCases":11029,"negative":null,"pending":null,"totalTestResultsSource":"totalTestsViral","totalTestResults":4593460,"hospitalizedCurrently":1136,"hospitalizedCumulative":null,"inIcuCurrently":null,"inIcuCumulative":null,"onVentilatorCurrently":null,"onVentilatorCumulative":null,"recovered":null,"lastUpdateEt":"12/30/2020 20:30","dateModified":"2020-12-30T20:30:00Z","checkTimeEt":"12/30 15:30","death":5995,"hospitalized":null,"hospitalizedDischarged":null,"dateChecked":"2020-12-30T20:30:00Z","totalTestsViral":4593460,"positiveTestsViral":225168,"negativeTestsViral":4361730,"positiveCasesViral":174679,"deathConfirmed":4854,"deathProbable":1141,"totalTestEncountersViral":null,"totalTestsPeopleViral":null,"totalTestsAntibody":null,"positiveTestsAntibody":null,"negativeTestsAntibody":null,"totalTestsPeopleAntibody":null,"positiveTestsPeopleAntibody":null,"negativeTestsPeopleAntibody":null,"totalTestsPeopleAntigen":null,"positiveTestsPeopleAntigen":null,"totalTestsAntigen":132201,"positiveTestsAntigen":9121,"fips":"09","positiveIncrease":0,"negativeIncrease":0,"total":185708,"totalTestResultsIncrease":28386,"posNeg":185708,"dataQualityGrade":null,"deathIncrease":0,"hospitalizedIncrease":0,"hash":"e039f7b8501f33a48a61ba5f1cdfd01836d48068","commercialScore":0,"negativeRegularScore":0,"negativeScore":0,"positiveScore":0,"score":0,"grade":""},{"date":20201231,"state":"CT","positive":185708,"probableCases":11029,"negative":null,"pending":null,"totalTestResultsSource":"totalTestsViral","totalTestResults":4565074,"hospitalizedCurrently":1136,"hospitalizedCumulative":null,"inIcuCurrently":null,"inIcuCumulative":null,"onVentilatorCurrently":null,"onVentilatorCumulative":null,"recovered":null,"lastUpdateEt":"12/30/2020 20:30","dateModified":"2020-12-30T20:30:00Z","checkTimeEt":"12/30 15:30","death":5995,"hospitalized":null,"hospitalizedDischarged":null,"dateChecked":"2020-12-30T20:30:00Z","totalTestsViral":4565074,"positiveTestsViral":222595,"negativeTestsViral":4335940,"positiveCasesViral":174679,"deathConfirmed":4854,"deathProbable":1141,"totalTestEncountersViral":null,"totalTestsPeopleViral":null,"totalTestsAntibody":null,"positiveTestsAntibody":null,"negativeTestsAntibody":null,"totalTestsPeopleAntibody":null,"positiveTestsPeopleAntibody":null,"negativeTestsPeopleAntibody":null,"totalTestsPeopleAntigen":null,"positiveTestsPeopleAntigen":null,"totalTestsAntigen":132201,"positiveTestsAntigen":9121,"fips":"09","positiveIncrease":2045,"negativeIncrease":0,"total":185708,"totalTestResultsIncrease":41409,"posNeg":185708,"dataQualityGrade":null,"deathIncrease":31,"hospitalizedIncrease":0,"hash":"b86c0f757184ffb06420820b0b06b06e0861f1e3","commercialScore":0,"negativeRegularScore":0,"negativeScore":0,"positiveScore":0,"score":0,"grade":""},{"date":20201230,"state":"CT","positive":183663,"probableCases":10756,"negative":null,"pending":null,"totalTestResultsSource":"totalTestsViral","totalTestResults":4523665,"hospitalizedCurrently":1167,"hospitalizedCumulative":null,"inIcuCurrently":null,"inIcuCumulative":null,"onVentilatorCurrently":null,"onVentilatorCumulative":null,"recovered":null,"lastUpdateEt":"12/29/2020 20:30","dateModified":"2020-12-29T20:30:00Z","checkTimeEt":"12/29 15:30","death":5964,"hospitalized":null,"hospitalizedDischarged":null,"dateChecked":"2020-12-29T20:30:00Z","totalTestsViral":4523665,"positiveTestsViral":219317,"negativeTestsViral":4297866,"positiveCasesViral":172907,"deathConfirmed":4828,"deathProbable":1136,"totalTestEncountersViral":null,"totalTestsPeopleViral":null,"totalTestsAntibody":null,"positiveTestsAntibody":null,"negativeTestsAntibody":null,"totalTestsPeopleAntibody":null,"positiveTestsPeopleAntibody":null,"negativeTestsPeopleAntibody":null,"totalTestsPeopleAntigen":null,"positiveTestsPeopleAntigen":null,"totalTestsAntigen":127711,"positiveTestsAntigen":8783,"fips":"09","positiveIncrease":1696,"negativeIncrease":0,"total":183663,"totalTestResultsIncrease":44596,"posNeg":183663,"dataQualityGrade":null,"deathIncrease":40,"hospitalizedIncrease":0,"hash":"d71328702ca7ca6752051a682b9866de7d54e37c","commercialScore":0,"negativeRegularScore":0,"negativeScore":0,"positiveScore":0,"score":0,"grade":""},{"date":20201229,"state":"CT","positive":181967,"probableCases":10638,"negative":null,"pending":null,"totalTestResultsSource":"totalTestsViral","totalTestResults":4479069,"hospitalizedCurrently":1226,"hospitalizedCumulative":null,"inIcuCurrently":null,"inIcuCumulative":null,"onVentilatorCurrently":null,"onVentilatorCumulative":null,"recovered":null,"lastUpdateEt":"12/28/2020 20:30","dateModified":"2020-12-28T20:30:00Z","checkTimeEt":"12/28 15:30","death":5924,"hospitalized":null,"hospitalizedDischarged":null,"dateChecked":"2020-12-28T20:30:00Z","totalTestsViral":4479069,"positiveTestsViral":215854,"negativeTestsViral":4256777,"positiveCasesViral":171329,"deathConfirmed":4792,"deathProbable":1132,"totalTestEncountersViral":null,"totalTestsPeopleViral":null,"totalTestsAntibody":null,"positiveTestsAntibody":null,"negativeTestsAntibody":null,"totalTestsPeopleAntibody":null,"positiveTestsPeopleAntibody":null,"negativeTestsPeopleAntibody":null,"totalTestsPeopleAntigen":null,"positiveTestsPeopleAntigen":null,"totalTestsAntigen":125114,"positiveTestsAntigen":8632,"fips":"09","positiveIncrease":767,"negativeIncrease":0,"total":181967,"totalTestResultsIncrease":47051,"posNeg":181967,"dataQualityGrade":null,"deathIncrease":20,"hospitalizedIncrease":0,"hash":"761afa4312b41dcab33c443274a22c1729546aa9","commercialScore":0,"negativeRegularScore":0,"negativeScore":0,"positiveScore":0,"score":0,"grade":""},{"date":20201228,"state":"CT","positive":181200,"probableCases":10558,"negative":null,"pending":null,"totalTestResultsSource":"totalTestsViral","totalTestResults":4432018,"hospitalizedCurrently":1219,"hospitalizedCumulative":null,"inIcuCurrently":null,"inIcuCumulative":null,"onVentilatorCurrently":null,"onVentilatorCumulative":null,"recovered":null,"lastUpdateEt":"12/27/2020 20:30","dateModified":"2020-12-27T20:30:00Z","checkTimeEt":"12/27 15:30","death":5904,"hospitalized":null,"hospitalizedDischarged":null,"dateChecked":"2020-12-27T20:30:00Z","totalTestsViral":4432018,"positiveTestsViral":212169,"negativeTestsViral":4213468,"positiveCasesViral":170642,"deathConfirmed":4773,"deathProbable":1131,"totalTestEncountersViral":null,"totalTestsPeopleViral":null,"totalTestsAntibody":null,"positiveTestsAntibody":null,"negativeTestsAntibody":null,"totalTestsPeopleAntibody":null,"positiveTestsPeopleAntibody":null,"negativeTestsPeopleAntibody":null,"totalTestsPeopleAntigen":null,"positiveTestsPeopleAntigen":null,"totalTestsAntigen":123538,"positiveTestsAntigen":8544,"fips":"09","positiveIncrease":8457,"negativeIncrease":0,"total":181200,"totalTestResultsIncrease":15416,"posNeg":181200,"dataQualityGrade":null,"deathIncrease":113,"hospitalizedIncrease":0,"hash":"0b4e1488fbbf50fc71e6f0f32227eaefb74ca917","commercialScore":0,"negativeRegularScore":0,"negativeScore":0,"positiveScore":0,"score":0,"grade":""},{"date":20201227,"state":"CT","positive":172743,"probableCases":10294,"negative":null,"pending":null,"totalTestResultsSource":"totalTestsViral","totalTestResults":4416602,"hospitalizedCurrently":1200,"hospitalizedCumulative":null,"inIcuCurrently":null,"inIcuCumulative":null,"onVentilatorCurrently":null,"onVentilatorCumulative":null,"recovered":null,"lastUpdateEt":"12/23/2020 20:30","dateModified":"2020-12-23T20:30:00Z","checkTimeEt":"12/23 15:30","death":5791,"hospitalized":null,"hospitalizedDischarged":null,"dateChecked":"2020-12-23T20:30:00Z","totalTestsViral":4416602,"positiveTestsViral":210500,"negativeTestsViral":4199743,"positiveCasesViral":162449,"deathConfirmed":4686,"deathProbable":1105,"totalTestEncountersViral":null,"totalTestsPeopleViral":null,"totalTestsAntibody":null,"positiveTestsAntibody":null,"negativeTestsAntibody":null,"totalTestsPeopleAntibody":null,"positiveTestsPeopleAntibody":null,"negativeTestsPeopleAntibody":null,"totalTestsPeopleAntigen":null,"positiveTestsPeopleAntigen":null,"totalTestsAntigen":113686,"positiveTestsAntigen":8079,"fips":"09","positiveIncrease":0,"negativeIncrease":0,"total":172743,"totalTestResultsIncrease":17518,"posNeg":172743,"dataQualityGrade":null,"deathIncreas