[{"date":20210307,"state":"FL","positive":1909209,"probableCases":360372,"negative":9339038,"pending":8544,"totalTestResultsSource":"totalTestEncountersViral","totalTestResults":22339182,"hospitalizedCurrently":3307,"hospitalizedCumulative":82237,"inIcuCurrently":null,"inIcuCumulative":null,"onVentilatorCurrently":null,"onVentilatorCumulative":null,"recovered":null,"lastUpdateEt":"3/6/2021 23:59","dateModified":"2021-03-06T23:59:00Z","checkTimeEt":"03/06 18:59","death":32266,"hospitalized":82237,"hospitalizedDischarged":null,"dateChecked":"2021-03-06T23:59:00Z","totalTestsViral":19482607,"positiveTestsViral":2502506,"negativeTestsViral":16887410,"positiveCasesViral":1548837,"deathConfirmed":null,"deathProbable":null,"totalTestEncountersViral":22339182,"totalTestsPeopleViral":11248247,"totalTestsAntibody":1054711,"positiveTestsAntibody":190026,"negativeTestsAntibody":864153,"totalTestsPeopleAntibody":995580,"positiveTestsPeopleAntibody":178979,"negativeTestsPeopleAntibody":816231,"totalTestsPeopleAntigen":null,"positiveTestsPeopleAntigen":null,"totalTestsAntigen":null,"positiveTestsAntigen":null,"fips":"12","positiveIncrease":4024,"negativeIncrease":19166,"total":11256791,"totalTestResultsIncrease":64599,"posNeg":11248247,"dataQualityGrade":null,"deathIncrease":66,"hospitalizedIncrease":92,"hash":"e69aca367d15584f4db13bd791804be1b017efc7","commercialScore":0,"negativeRegularScore":0,"negativeScore":0,"positiveScore":0,"score":0,"grade":""},{"date":20210306,"state":"FL","positive":1905185,"probableCases":359542,"negative":9319872,"pending":8496,"totalTestResultsSource":"totalTestEncountersViral","totalTestResults":22274583,"hospitalizedCurrently":3352,"hospitalizedCumulative":82145,"inIcuCurrently":null,"inIcuCumulative":null,"onVentilatorCurrently":null,"onVentilatorCumulative":null,"recovered":null,"lastUpdateEt":"3/5/2021 23:59","dateModified":"2021-03-05T23:59:00Z","checkTimeEt":"03/05 18:59","death":32200,"hospitalized":82145,"hospitalizedDischarged":null,"dateChecked":"2021-03-05T23:59:00Z","totalTestsViral":19430475,"positiveTestsViral":2496909,"negativeTestsViral":16841086,"positiveCasesViral":1545643,"deathConfirmed":null,"deathProbable":null,"totalTestEncountersViral":22274583,"totalTestsPeopleViral":11225057,"totalTestsAntibody":1054711,"positiveTestsAntibody":190026,"negativeTestsAntibody":864153,"totalTestsPeopleAntibody":995580,"positiveTestsPeopleAntibody":178979,"negativeTestsPeopleAntibody":816231,"totalTestsPeopleAntigen":null,"positiveTestsPeopleAntigen":null,"totalTestsAntigen":null,"positiveTestsAntigen":null,"fips":"12","positiveIncrease":4587,"negativeIncrease":23282,"total":11233553,"totalTestResultsIncrease":87820,"posNeg":11225057,"dataQualityGrade":null,"deathIncrease":107,"hospitalizedIncrease":243,"hash":"9caf89c49d1befc5c6364bdf8d2d423dc4660db1","commercialScore":0,"negativeRegularScore":0,"negativeScore":0,"positiveScore":0,"score":0,"grade":""},{"date":20210305,"state":"FL","positive":1900598,"probableCases":358198,"negative":9296590,"pending":8453,"totalTestResultsSource":"totalTestEncountersViral","totalTestResults":22186763,"hospitalizedCurrently":3419,"hospitalizedCumulative":81902,"inIcuCurrently":null,"inIcuCumulative":null,"onVentilatorCurrently":null,"onVentilatorCumulative":null,"recovered":null,"lastUpdateEt":"3/4/2021 23:59","dateModified":"2021-03-04T23:59:00Z","checkTimeEt":"03/04 18:59","death":32093,"hospitalized":81902,"hospitalizedDischarged":null,"dateChecked":"2021-03-04T23:59:00Z","totalTestsViral":19371172,"positiveTestsViral":2490463,"negativeTestsViral":16788533,"positiveCasesViral":1542400,"deathConfirmed":null,"deathProbable":null,"totalTestEncountersViral":22186763,"totalTestsPeopleViral":11197188,"totalTestsAntibody":1054711,"positiveTestsAntibody":190026,"negativeTestsAntibody":864153,"totalTestsPeopleAntibody":995580,"positiveTestsPeopleAntibody":178979,"negativeTestsPeopleAntibody":816231,"totalTestsPeopleAntigen":null,"positiveTestsPeopleAntigen":null,"totalTestsAntigen":null,"positiveTestsAntigen":null,"fips":"12","positiveIncrease":5876,"negativeIncrease":26910,"total":11205641,"totalTestResultsIncrease":106925,"posNeg":11197188,"dataQualityGrade":null,"deathIncrease":138,"hospitalizedIncrease":302,"hash":"427326a17365ecae4a02b0baedec6548c934ba80","commercialScore":0,"negativeRegularScore":0,"negativeScore":0,"positiveScore":0,"score":0,"grade":""},{"date":20210304,"state":"FL","positive":1894722,"probableCases":356583,"negative":9269680,"pending":8435,"totalTestResultsSource":"totalTestEncountersViral","totalTestResults":22079838,"hospitalizedCurrently":3566,"hospitalizedCumulative":81600,"inIcuCurrently":null,"inIcuCumulative":null,"onVentilatorCurrently":null,"onVentilatorCumulative":null,"recovered":null,"lastUpdateEt":"3/3/2021 23:59","dateModified":"2021-03-03T23:59:00Z","checkTimeEt":"03/03 18:59","death":31955,"hospitalized":81600,"hospitalizedDischarged":null,"dateChecked":"2021-03-03T23:59:00Z","totalTestsViral":19293295,"positiveTestsViral":2482227,"negativeTestsViral":16719252,"positiveCasesViral":1538139,"deathConfirmed":null,"deathProbable":null,"totalTestEncountersViral":22079838,"totalTestsPeopleViral":11164402,"totalTestsAntibody":1024780,"positiveTestsAntibody":176911,"negativeTestsAntibody":847365,"totalTestsPeopleAntibody":970437,"positiveTestsPeopleAntibody":166506,"negativeTestsPeopleAntibody":803582,"totalTestsPeopleAntigen":null,"positiveTestsPeopleAntigen":null,"totalTestsAntigen":null,"positiveTestsAntigen":null,"fips":"12","positiveIncrease":5997,"negativeIncrease":26450,"total":11172837,"totalTestResultsIncrease":104245,"posNeg":11164402,"dataQualityGrade":null,"deathIncrease":126,"hospitalizedIncrease":322,"hash":"e7940b71727e878efa5c199e23a70246b38f0185","commercialScore":0,"negativeRegularScore":0,"negativeScore":0,"positiveScore":0,"score":0,"grade":""},{"date":20210303,"state":"FL","positive":1888725,"probableCases":354539,"negative":9243230,"pending":8396,"totalTestResultsSource":"totalTestEncountersViral","totalTestResults":21975593,"hospitalizedCurrently":3596,"hospitalizedCumulative":81278,"inIcuCurrently":null,"inIcuCumulative":null,"onVentilatorCurrently":null,"onVentilatorCumulative":null,"recovered":null,"lastUpdateEt":"3/2/2021 23:59","dateModified":"2021-03-02T23:59:00Z","checkTimeEt":"03/02 18:59","death":31829,"hospitalized":81278,"hospitalizedDischarged":null,"dateChecked":"2021-03-02T23:59:00Z","totalTestsViral":19218847,"positiveTestsViral":2474106,"negativeTestsViral":16653274,"positiveCasesViral":1534186,"deathConfirmed":null,"deathProbable":null,"totalTestEncountersViral":21975593,"totalTestsPeopleViral":11131955,"totalTestsAntibody":1024780,"positiveTestsAntibody":176911,"negativeTestsAntibody":847365,"totalTestsPeopleAntibody":970437,"positiveTestsPeopleAntibody":166506,"negativeTestsPeopleAntibody":803582,"totalTestsPeopleAntigen":null,"positiveTestsPeopleAntigen":null,"totalTestsAntigen":null,"positiveTestsAntigen":null,"fips":"12","positiveIncrease":5860,"negativeIncrease":17249,"total":11140351,"totalTestResultsIncrease":73990,"posNeg":11131955,"dataQualityGrade":null,"deathIncrease":133,"hospitalizedIncrease":306,"hash":"41f0c9974fbb8ec8b2e6b26a5954e3c9e97309ed","commercialScore":0,"negativeRegularScore":0,"negativeScore":0,"positiveScore":0,"score":0,"grade":""},{"date":20210302,"state":"FL","positive":1882865,"probableCases":353125,"negative":9225981,"pending":8411,"totalTestResultsSource":"totalTestEncountersViral","totalTestResults":21901603,"hospitalizedCurrently":3674,"hospitalizedCumulative":80972,"inIcuCurrently":null,"inIcuCumulative":null,"onVentilatorCurrently":null,"onVentilatorCumulative":null,"recovered":null,"lastUpdateEt":"3/1/2021 23:59","dateModified":"2021-03-01T23:59:00Z","checkTimeEt":"03/01 18:59","death":31696,"hospitalized":80972,"hospitalizedDischarged":null,"dateChecked":"2021-03-01T23:59:00Z","totalTestsViral":19167318,"positiveTestsViral":2468530,"negativeTestsViral":16607639,"positiveCasesViral":1529740,"deathConfirmed":null,"deathProbable":null,"totalTestEncountersViral":21901603,"totalTestsPeopleViral":11108846,"totalTestsAntibody":1024780,"positiveTestsAntibody":176911,"negativeTestsAntibody":847365,"totalTestsPeopleAntibody":970437,"positiveTestsPeopleAntibody":166506,"negativeTestsPeopleAntibody":803582,"totalTestsPeopleAntigen":null,"positiveTestsPeopleAntigen":null,"totalTestsAntigen":null,"positiveTestsAntigen":null,"fips":"12","positiveIncrease":7047,"negativeIncrease":33192,"total":11117257,"totalTestResultsIncrease":116917,"posNeg":11108846,"dataQualityGrade":null,"deathIncrease":140,"hospitalizedIncrease":313,"hash":"37b11f34c2e9124a73de2a3d8d3786f763c7daac","commercialScore":0,"negativeRegularScore":0,"negativeScore":0,"positiveScore":0,"score":0,"grade":""},{"date":20210301,"state":"FL","positive":1875818,"probableCases":350823,"negative":9192789,"pending":8441,"totalTestResultsSource":"totalTestEncountersViral","totalTestResults":21784686,"hospitalizedCurrently":3686,"hospitalizedCumulative":80659,"inIcuCurrently":null,"inIcuCumulative":null,"onVentilatorCurrently":null,"onVentilatorCumulative":null,"recovered":null,"lastUpdateEt":"2/28/2021 23:59","dateModified":"2021-02-28T23:59:00Z","checkTimeEt":"02/28 18:59","death":31556,"hospitalized":80659,"hospitalizedDischarged":null,"dateChecked":"2021-02-28T23:59:00Z","totalTestsViral":19078033,"positiveTestsViral":2458948,"negativeTestsViral":16528453,"positiveCasesViral":1524995,"deathConfirmed":null,"deathProbable":null,"totalTestEncountersViral":21784686,"totalTestsPeopleViral":11068607,"totalTestsAntibody":1024780,"positiveTestsAntibody":176911,"negativeTestsAntibody":847365,"totalTestsPeopleAntibody":970437,"positiveTestsPeopleAntibody":166506,"negativeTestsPeopleAntibody":803582,"totalTestsPeopleAntigen":null,"positiveTestsPeopleAntigen":null,"totalTestsAntigen":null,"positiveTestsAntigen":null,"fips":"12","positiveIncrease":1664,"negativeIncrease":7255,"total":11077048,"totalTestResultsIncrease":22888,"posNeg":11068607,"dataQualityGrade":null,"deathIncrease":150,"hospitalizedIncrease":87,"hash":"162626541d350a1a350b2b64a7ea3fe1daa30752","commercialScore":0,"negativeRegularScore":0,"negativeScore":0,"positiveScore":0,"score":0,"grade":""},{"date":20210228,"state":"FL","positive":1874154,"probableCases":350795,"negative":9185534,"pending":8433,"totalTestResultsSource":"totalTestEncountersViral","totalTestResults":21761798,"hospitalizedCurrently":3679,"hospitalizedCumulative":80572,"inIcuCurrently":null,"inIcuCumulative":null,"onVentilatorCurrently":null,"onVentilatorCumulative":null,"recovered":null,"lastUpdateEt":"2/27/2021 23:59","dateModified":"2021-02-27T23:59:00Z","checkTimeEt":"02/27 18:59","death":31406,"hospitalized":80572,"hospitalizedDischarged":null,"dateChecked":"2021-02-27T23:59:00Z","totalTestsViral":19055118,"positiveTestsViral":2456389,"negativeTestsViral":16508139,"positiveCasesViral":1523359,"deathConfirmed":null,"deathProbable":null,"totalTestEncountersViral":21761798,"totalTestsPeopleViral":11059688,"totalTestsAntibody":1024780,"positiveTestsAntibody":176911,"negativeTestsAntibody":847365,"totalTestsPeopleAntibody":970437,"positiveTestsPeopleAntibody":166506,"negativeTestsPeopleAntibody":803582,"totalTestsPeopleAntigen":null,"positiveTestsPeopleAntigen":null,"totalTestsAntigen":null,"positiveTestsAntigen":null,"fips":"12","positiveIncrease":5385,"negativeIncrease":22572,"total":11068121,"totalTestResultsIncrease":77453,"posNeg":11059688,"dataQualityGrade":null,"deathIncrease":126,"hospitalizedIncrease":105,"hash":"ef46279de0a9630ba989a3eb1167234320c144df","commercialScore":0,"negativeRegularScore":0,"negativeScore":0,"positiveScore":0,"score":0,"grade":""},{"date":20210227,"state":"FL","positive":1868769,"probableCases":349325,"negative":9162962,"pending":8421,"totalTestResultsSource":"totalTestEncountersViral","totalTestResults":21684345,"hospitalizedCurrently":3728,"hospitalizedCumulative":80467,"inIcuCurrently":null,"inIcuCumulative":null,"onVentilatorCurrently":null,"onVentilatorCumulative":null,"recovered":null,"lastUpdateEt":"2/26/2021 23:59","dateModified":"2021-02-26T23:59:00Z","checkTimeEt":"02/26 18:59","death":31280,"hospitalized":80467,"hospitalizedDischarged":null,"dateChecked":"2021-02-26T23:59:00Z","totalTestsViral":18990710,"positiveTestsViral":2448448,"negativeTestsViral":16451917,"positiveCasesViral":1519444,"deathConfirmed":null,"deathProbable":null,"totalTestEncountersViral":21684345,"totalTestsPeopleViral":11031731,"totalTestsAntibody":1024780,"positiveTestsAntibody":176911,"negativeTestsAntibody":847365,"totalTestsPeopleAntibody":970437,"positiveTestsPeopleAntibody":166506,"negativeTestsPeopleAntibody":803582,"totalTestsPeopleAntigen":null,"positiveTestsPeopleAntigen":null,"totalTestsAntigen":null,"positiveTestsAntigen":null,"fips":"12","positiveIncrease":5316,"negativeIncrease":25314,"total":11040152,"totalTestResultsIncrease":90722,"posNeg":11031731,"dataQualityGrade":null,"deathIncrease":118,"hospitalizedIncrease":229,"hash":"958bca6f49c2d2605c5b494ab178de49a6c2ead7","commercialScore":0,"negativeRegularScore":0,"negativeScore":0,"positiveScore":0,"score":0,"grade":""},{"date":20210226,"state":"FL","positive":1863453,"probableCases":347627,"negative":9137648,"pending":8372,"totalTestResultsSource":"totalTestEncountersViral","totalTestResults":21593623,"hospitalizedCurrently":3864,"hospitalizedCumulative":80238,"inIcuCurrently":null,"inIcuCumulative":null,"onVentilatorCurrently":null,"onVentilatorCumulative":null,"recovered":null,"lastUpdateEt":"2/25/2021 23:59","dateModified":"2021-02-25T23:59:00Z","checkTimeEt":"02/25 18:59","death":31162,"hospitalized":80238,"hospitalizedDischarged":null,"dateChecked":"2021-02-25T23:59:00Z","totalTestsViral":18922497,"positiveTestsViral":2441154,"negativeTestsViral":16391386,"positiveCasesViral":1515826,"deathConfirmed":null,"deathProbable":null,"totalTestEncountersViral":21593623,"totalTestsPeopleViral":11001101,"totalTestsAntibody":1024780,"positiveTestsAntibody":176911,"negativeTestsAntibody":847365,"totalTestsPeopleAntibody":970437,"positiveTestsPeopleAntibody":166506,"negativeTestsPeopleAntibody":803582,"totalTestsPeopleAntigen":null,"positiveTestsPeopleAntigen":null,"totalTestsAntigen":null,"positiveTestsAntigen":null,"fips":"12","positiveIncrease":5783,"negativeIncrease":26855,"total":11009473,"totalTestResultsIncrease":105518,"posNeg":11001101,"dataQualityGrade":null,"deathIncrease":144,"hospitalizedIncrease":282,"hash":"aa1b9fb32416887a09b7fa8a6ce04101cf99ec99","commercialScore":0,"negativeRegularScore":0,"negativeScore":0,"positiveScore":0,"score":0,"grade":""},{"date":20210225,"state":"FL","positive":1857670,"probableCases":346042,"negative":9110793,"pending":8364,"totalTestResultsSource":"totalTestEncountersViral","totalTestResults":21488105,"hospitalizedCurrently":3957,"hospitalizedCumulative":79956,"inIcuCurrently":null,"inIcuCumulative":null,"onVentilatorCurrently":null,"onVentilatorCumulative":null,"recovered":null,"lastUpdateEt":"2/24/2021 23:59","dateModified":"2021-02-24T23:59:00Z","checkTimeEt":"02/24 18:59","death":31018,"hospitalized":79956,"hospitalizedDischarged":null,"dateChecked":"2021-02-24T23:59:00Z","totalTestsViral":18846515,"positiveTestsViral":2432878,"negativeTestsViral":16324065,"positiveCasesViral":1511628,"deathConfirmed":null,"deathProbable":null,"totalTestEncountersViral":21488105,"totalTestsPeopleViral":10968463,"totalTestsAntibody":997190,"positiveTestsAntibody":165482,"negativeTestsAntibody":831212,"totalTestsPeopleAntibody":946648,"positiveTestsPeopleAntibody":155757,"negativeTestsPeopleAntibody":790547,"totalTestsPeopleAntigen":null,"positiveTestsPeopleAntigen":null,"totalTestsAntigen":null,"positiveTestsAntigen":null,"fips":"12","positiveIncrease":6519,"negativeIncrease":29829,"total":10976827,"totalTestResultsIncrease":118508,"posNeg":10968463,"dataQualityGrade":null,"deathIncrease":140,"hospitalizedIncrease":281,"hash":"f1395893c5e4cdb201278ef9a4c81c0c8a99c4f2","commercialScore":0,"negativeRegularScore":0,"negativeScore":0,"positiveScore":0,"score":0,"grade":""},{"date":20210224,"state":"FL","positive":1851151,"probableCases":344284,"negative":9080964,"pending":8322,"totalTestResultsSource":"totalTestEncountersViral","totalTestResults":21369597,"hospitalizedCurrently":4077,"hospitalizedCumulative":79675,"inIcuCurrently":null,"inIcuCumulative":null,"onVentilatorCurrently":null,"onVentilatorCumulative":null,"recovered":null,"lastUpdateEt":"2/23/2021 23:59","dateModified":"2021-02-23T23:59:00Z","checkTimeEt":"02/23 18:59","death":30878,"hospitalized":79675,"hospitalizedDischarged":null,"dateChecked":"2021-02-23T23:59:00Z","totalTestsViral":18763395,"positiveTestsViral":2423735,"negativeTestsViral":16250525,"positiveCasesViral":1506867,"deathConfirmed":null,"deathProbable":null,"totalTestEncountersViral":21369597,"totalTestsPeopleViral":10932115,"totalTestsAntibody":997190,"positiveTestsAntibody":165482,"negativeTestsAntibody":831212,"totalTestsPeopleAntibody":946648,"positiveTestsPeopleAntibody":155757,"negativeTestsPeopleAntibody":790547,"totalTestsPeopleAntigen":null,"positiveTestsPeopleAntigen":null,"totalTestsAntigen":null,"positiveTestsAntigen":null,"fips":"12","positiveIncrease":6923,"negativeIncrease":29359,"total":10940437,"totalTestResultsIncrease":105398,"posNeg":10932115,"dataQualityGrade":null,"deathIncrease":129,"hospitalizedIncrease":265,"hash":"13ea477b59bb0e9baeed55982594212e8a2da4e8","commercialScore":0,"negativeRegularScore":0,"negativeScore":0,"positiveScore":0,"score":0,"grade":""},{"date":20210223,"state":"FL","positive":1844228,"probableCases":341679,"negative":9051605,"pending":8300,"totalTestResultsSource":"totalTestEncountersViral","totalTestResults":21264199,"hospitalizedCurrently":4198,"hospitalizedCumulative":79410,"inIcuCurrently":null,"inIcuCumulative":null,"onVentilatorCurrently":null,"onVentilatorCumulative":null,"recovered":null,"lastUpdateEt":"2/22/2021 23:59","dateModified":"2021-02-22T23:59:00Z","checkTimeEt":"02/22 18:59","death":30749,"hospitalized":79410,"hospitalizedDischarged":null,"dateChecked":"2021-02-22T23:59:00Z","totalTestsViral":18677901,"positiveTestsViral":2413918,"negativeTestsViral":16175417,"positiveCasesViral":1502549,"deathConfirmed":null,"deathProbable":null,"totalTestEncountersViral":21264199,"totalTestsPeopleViral":10895833,"totalTestsAntibody":997190,"positiveTestsAntibody":165482,"negativeTestsAntibody":831212,"totalTestsPeopleAntibody":946648,"positiveTestsPeopleAntibody":155757,"negativeTestsPeopleAntibody":790547,"totalTestsPeopleAntigen":null,"positiveTestsPeopleAntigen":null,"totalTestsAntigen":null,"positiveTestsAntigen":null,"fips":"12","positiveIncrease":5483,"negativeIncrease":21886,"total":10904133,"totalTestResultsIncrease":76769,"posNeg":10895833,"dataQualityGrade":null,"deathIncrease":154,"hospitalizedIncrease":314,"hash":"3a7b77e92dc6004b96b31fb3c5e5e17878376a2a","commercialScore":0,"negativeRegularScore":0,"negativeScore":0,"positiveScore":0,"score":0,"grade":""},{"date":20210222,"state":"FL","positive":1838745,"probableCases":339888,"negative":9029719,"pending":8230,"totalTestResultsSource":"totalTestEncountersViral","totalTestResults":21187430,"hospitalizedCurrently":4175,"hospitalizedCumulative":79096,"inIcuCurrently":null,"inIcuCumulative":null,"onVentilatorCurrently":null,"onVentilatorCumulative":null,"recovered":null,"lastUpdateEt":"2/21/2021 23:59","dateModified":"2021-02-21T23:59:00Z","checkTimeEt":"02/21 18:59","death":30595,"hospitalized":79096,"hospitalizedDischarged":null,"dateChecked":"2021-02-21T23:59:00Z","totalTestsViral":18614193,"positiveTestsViral":2406192,"negativeTestsViral":16119985,"positiveCasesViral":1498857,"deathConfirmed":null,"deathProbable":null,"totalTestEncountersViral":21187430,"totalTestsPeopleViral":10868464,"totalTestsAntibody":997190,"positiveTestsAntibody":165482,"negativeTestsAntibody":831212,"totalTestsPeopleAntibody":946648,"positiveTestsPeopleAntibody":155757,"negativeTestsPeopleAntibody":790547,"totalTestsPeopleAntigen":null,"positiveTestsPeopleAntigen":null,"totalTestsAntigen":null,"positiveTestsAntigen":null,"fips":"12","positiveIncrease":4037,"negativeIncrease":17496,"total":10876694,"totalTestResultsIncrease":54779,"posNeg":10868464,"dataQualityGrade":null,"deathIncrease":161,"hospitalizedIncrease":150,"hash":"6dd5a3ce1732f378a0d306bfae8c960f43fad66a","commercialScore":0,"negativeRegularScore":0,"negativeScore":0,"positiveScore":0,"score":0,"grade":""},{"date":20210221,"state":"FL","positive":1834708,"probableCases":339004,"negative":9012223,"pending":8223,"totalTestResultsSource":"totalTestEncountersViral","totalTestResults":21132651,"hospitalizedCurrently":4160,"hospitalizedCumulative":78946,"inIcuCurrently":null,"inIcuCumulative":null,"onVentilatorCurrently":null,"onVentilatorCumulative":null,"recovered":null,"lastUpdateEt":"2/20/2021 23:59","dateModified":"2021-02-20T23:59:00Z","checkTimeEt":"02/20 18:59","death":30434,"hospitalized":78946,"hospitalizedDischarged":null,"dateChecked":"2021-02-20T23:59:00Z","totalTestsViral":18567270,"positiveTestsViral":2400590,"negativeTestsViral":16078849,"positiveCasesViral":1495704,"deathConfirmed":null,"deathProbable":null,"totalTestEncountersViral":21132651,"totalTestsPeopleViral":10846931,"totalTestsAntibody":997190,"positiveTestsAntibody":165482,"negativeTestsAntibody":831212,"totalTestsPeopleAntibody":946648,"positiveTestsPeopleAntibody":155757,"negativeTestsPeopleAntibody":790547,"totalTestsPeopleAntigen":null,"positiveTestsPeopleAntigen":null,"totalTestsAntigen":null,"positiveTestsAntigen":null,"fips":"12","positiveIncrease":4935,"negativeIncrease":22676,"total":10855154,"totalTestResultsIncrease":72854,"posNeg":10846931,"dataQualityGrade":null,"deathIncrease":95,"hospitalizedIncrease":106,"hash":"12f308d1a41284ca6c3bb9342173e4e72e96d392","commercialScore":0,"negativeRegularScore":0,"negativeScore":0,"positiveScore":0,"score":0,"grade":""},{"date":20210220,"state":"FL","positive":1829773,"probableCases":337773,"negative":8989547,"pending":8193,"totalTestResultsSource":"totalTestEncountersViral","totalTestResults":21059797,"hospitalizedCurrently":4213,"hospitalizedCumulative":78840,"inIcuCurrently":null,"inIcuCumulative":null,"onVentilatorCurrently":null,"onVentilatorCumulative":null,"recovered":null,"lastUpdateEt":"2/19/2021 23:59","dateModified":"2021-02-19T23:59:00Z","checkTimeEt":"02/19 18:59","death":30339,"hospitalized":78840,"hospitalizedDischarged":null,"dateChecked":"2021-02-19T23:59:00Z","totalTestsViral":18510086,"positiveTestsViral":2394125,"negativeTestsViral":16028333,"positiveCasesViral":1492000,"deathConfirmed":null,"deathProbable":null,"totalTestEncountersViral":21059797,"totalTestsPeopleViral":10819320,"totalTestsAntibody":997190,"positiveTestsAntibody":165482,"negativeTestsAntibody":831212,"totalTestsPeopleAntibody":946648,"positiveTestsPeopleAntibody":155757,"negativeTestsPeopleAntibody":790547,"totalTestsPeopleAntigen":null,"positiveTestsPeopleAntigen":null,"totalTestsAntigen":null,"positiveTestsAntigen":null,"fips":"12","positiveIncrease":7129,"negativeIncrease":32585,"total":10827513,"totalTestResultsIncrease":115318,"posNeg":10819320,"dataQualityGrade":null,"deathIncrease":125,"hospitalizedIncrease":250,"hash":"e472ecf02925a529c108e662135bb4ccf98f770a","commercialScore":0,"negativeRegularScore":0,"negativeScore":0,"positiveScore":0,"score":0,"grade":""},{"date":20210219,"state":"FL","positive":1822644,"probableCases":335391,"negative":8956962,"pending":8100,"totalTestResultsSource":"totalTestEncountersViral","totalTestResults":20944479,"hospitalizedCurrently":4298,"hospitalizedCumulative":78590,"inIcuCurrently":null,"inIcuCumulative":null,"onVentilatorCurrently":null,"onVentilatorCumulative":null,"recovered":null,"lastUpdateEt":"2/18/2021 23:59","dateModified":"2021-02-18T23:59:00Z","checkTimeEt":"02/18 18:59","death":30214,"hospitalized":78590,"hospitalizedDischarged":null,"dateChecked":"2021-02-18T23:59:00Z","totalTestsViral":18426875,"positiveTestsViral":2384901,"negativeTestsViral":15954828,"positiveCasesViral":1487253,"deathConfirmed":null,"deathProbable":null,"totalTestEncountersViral":20944479,"totalTestsPeopleViral":10779606,"totalTestsAntibody":997190,"positiveTestsAntibody":165482,"negativeTestsAntibody":831212,"totalTestsPeopleAntibody":946648,"positiveTestsPeopleAntibody":155757,"negativeTestsPeopleAntibody":790547,"totalTestsPeopleAntigen":null,"positiveTestsPeopleAntigen":null,"totalTestsAntigen":null,"positiveTestsAntigen":null,"fips":"12","positiveIncrease":6536,"negativeIncrease":27701,"total":10787706,"totalTestResultsIncrease":101356,"posNeg":10779606,"dataQualityGrade":null,"deathIncrease":224,"hospitalizedIncrease":295,"hash":"854926f49ac3686402088a61e1cd8b5e7ee17582","commercialScore":0,"negativeRegularScore":0,"negativeScore":0,"positiveScore":0,"score":0,"grade":""},{"date":20210218,"state":"FL","positive":1816108,"probableCases":333912,"negative":8929261,"pending":8066,"totalTestResultsSource":"totalTestEncountersViral","totalTestResults":20843123,"hospitalizedCurrently":4367,"hospitalizedCumulative":78295,"inIcuCurrently":null,"inIcuCumulative":null,"onVentilatorCurrently":null,"onVentilatorCumulative":null,"recovered":null,"lastUpdateEt":"2/17/2021 23:59","dateModified":"2021-02-17T23:59:00Z","checkTimeEt":"02/17 18:59","death":29990,"hospitalized":78295,"hospitalizedDischarged":null,"dateChecked":"2021-02-17T23:59:00Z","totalTestsViral":18350554,"positiveTestsViral":2376205,"negativeTestsViral":15887541,"positiveCasesViral":1482196,"deathConfirmed":null,"deathProbable":null,"totalTestEncountersViral":20843123,"totalTestsPeopleViral":10745369,"totalTestsAntibody":969396,"positiveTestsAntibody":154948,"negativeTestsAntibody":813960,"totalTestsPeopleAntibody":922278,"positiveTestsPeopleAntibody":145802,"negativeTestsPeopleAntibody":776136,"totalTestsPeopleAntigen":null,"positiveTestsPeopleAntigen":null,"totalTestsAntigen":null,"positiveTestsAntigen":null,"fips":"12","positiveIncrease":5030,"negativeIncrease":19376,"total":10753435,"totalTestResultsIncrease":73326,"posNeg":10745369,"dataQualityGrade":null,"deathIncrease":166,"hospitalizedIncrease":301,"hash":"b872005c09708d2eef74e84f0e5f181dcab92f6c","commercialScore":0,"negativeRegularScore":0,"negativeScore":0,"positiveScore":0,"score":0,"grade":""},{"date":20210217,"state":"FL","positive":1811078,"probableCases":332444,"negative":8909885,"pending":7982,"totalTestResultsSource":"totalTestEncountersViral","totalTestResults":20769797,"hospitalizedCurrently":4465,"hospitalizedCumulative":77994,"inIcuCurrently":null,"inIcuCumulative":null,"onVentilatorCurrently":null,"onVentilatorCumulative":null,"recovered":null,"lastUpdateEt":"2/16/2021 23:59","dateModified":"2021-02-16T23:59:00Z","checkTimeEt":"02/16 18:59","death":29824,"hospitalized":77994,"hospitalizedDischarged":null,"dateChecked":"2021-02-16T23:59:00Z","totalTestsViral":18300331,"positiveTestsViral":2369671,"negativeTestsViral":15844134,"positiveCasesViral":1478634,"deathConfirmed":null,"deathProbable":null,"totalTestEncountersViral":20769797,"totalTestsPeopleViral":10720963,"totalTestsAntibody":969396,"positiveTestsAntibody":154948,"negativeTestsAntibody":813960,"totalTestsPeopleAntibody":922278,"positiveTestsPeopleAntibody":145802,"negativeTestsPeopleAntibody":776136,"totalTestsPeopleAntigen":null,"positiveTestsPeopleAntigen":null,"totalTestsAntigen":null,"positiveTestsAntigen":null,"fips":"12","positiveIncrease":7185,"negativeIncrease":28762,"total":10728945,"totalTestResultsIncrease":103720,"posNeg":10720963,"dataQualityGrade":null,"deathIncrease":165,"hospitalizedIncrease":308,"hash":"219ec5d412733cf13cf945147dd27e20f6024e0b","commercialScore":0,"negativeRegularScore":0,"negativeScore":0,"positiveScore":0,"score":0,"grade":""},{"date":20210216,"state":"FL","positive":1803893,"probableCases":329510,"negative":8881123,"pending":7939,"totalTestResultsSource":"totalTestEncountersViral","totalTestResults":20666077,"hospitalizedCurrently":4646,"hospitalizedCumulative":77686,"inIcuCurrently":null,"inIcuCumulative":null,"onVentilatorCurrently":null,"onVentilatorCumulative":null,"recovered":null,"lastUpdateEt":"2/15/2021 23:59","dateModified":"2021-02-15T23:59:00Z","checkTimeEt":"02/15 18:59","death":29659,"hospitalized":77686,"hospitalizedDischarged":null,"dateChecked":"2021-02-15T23:59:00Z","totalTestsViral":18222942,"positiveTestsViral":2360095,"negativeTestsViral":15776618,"positiveCasesViral":1474383,"deathConfirmed":null,"deathProbable":null,"totalTestEncountersViral":20666077,"totalTestsPeopleViral":10685016,"totalTestsAntibody":969396,"positiveTestsAntibody":154948,"negativeTestsAntibody":813960,"totalTestsPeopleAntibody":922278,"positiveTestsPeopleAntibody":145802,"negativeTestsPeopleAntibody":776136,"totalTestsPeopleAntigen":null,"positiveTestsPeopleAntigen":null,"totalTestsAntigen":null,"positiveTestsAntigen":null,"fips":"12","positiveIncrease":6165,"negativeIncrease":25432,"total":10692955,"totalTestResultsIncrease":90631,"posNeg":10685016,"dataQualityGrade":null,"deathIncrease":225,"hospitalizedIncrease":314,"hash":"59edaa9a3e675dc3447e8442fa3310147298cc62","commercialScore":0,"negativeRegularScore":0,"negativeScore":0,"positiveScore":0,"score":0,"grade":""},{"date":20210215,"state":"FL","positive":1797728,"probableCases":326889,"negative":8855691,"pending":7897,"totalTestResultsSource":"totalTestEncountersViral","totalTestResults":20575446,"hospitalizedCurrently":4676,"hospitalizedCumulative":77372,"inIcuCurrently":null,"inIcuCumulative":null,"onVentilatorCurrently":null,"onVentilatorCumulative":null,"recovered":null,"lastUpdateEt":"2/14/2021 23:59","dateModified":"2021-02-14T23:59:00Z","checkTimeEt":"02/14 18:59","death":29434,"hospitalized":77372,"hospitalizedDischarged":null,"dateChecked":"2021-02-14T23:59:00Z","totalTestsViral":18152879,"positiveTestsViral":2351480,"negativeTestsViral":15715678,"positiveCasesViral":1470839,"deathConfirmed":null,"deathProbable":null,"totalTestEncountersViral":20575446,"totalTestsPeopleViral":10653419,"totalTestsAntibody":969396,"positiveTestsAntibody":154948,"negativeTestsAntibody":813960,"totalTestsPeopleAntibody":922278,"positiveTestsPeopleAntibody":145802,"negativeTestsPeopleAntibody":776136,"totalTestsPeopleAntigen":null,"positiveTestsPeopleAntigen":null,"totalTestsAntigen":null,"positiveTestsAntigen":null,"fips":"12","positiveIncrease":3573,"negativeIncrease":15019,"total":10661316,"totalTestResultsIncrease":49636,"posNeg":10653419,"dataQualityGrade":null,"deathIncrease":159,"hospitalizedIncrease":117,"hash":"a66ba811cca0f4ae8de4ab8453970bc9e46e5a14","commercialScore":0,"negativeRegularScore":0,"negativeScore":0,"positiveScore":0,"score":0,"grade":""},{"date":20210214,"state":"FL","positive":1794155,"probableCases":326465,"negative":8840672,"pending":7886,"totalTestResultsSource":"totalTestEncountersViral","totalTestResults":20525810,"hospitalizedCurrently":4672,"hospitalizedCumulative":77255,"inIcuCurrently":null,"inIcuCumulative":null,"onVentilatorCurrently":null,"onVentilatorCumulative":null,"recovered":null,"lastUpdateEt":"2/13/2021 23:59","dateModified":"2021-02-13T23:59:00Z","checkTimeEt":"02/13 18:59","death":29275,"hospitalized":77255,"hospitalizedDischarged":null,"dateChecked":"2021-02-13T23:59:00Z","totalTestsViral":18110011,"positiveTestsViral":2346147,"negativeTestsViral":15678301,"positiveCasesViral":1467690,"deathConfirmed":null,"deathProbable":null,"totalTestEncountersViral":20525810,"totalTestsPeopleViral":10634827,"totalTestsAntibody":969396,"positiveTestsAntibody":154948,"negativeTestsAntibody":813960,"totalTestsPeopleAntibody":922278,"positiveTestsPeopleAntibody":145802,"negativeTestsPeopleAntibody":776136,"totalTestsPeopleAntigen":null,"positiveTestsPeopleAntigen":null,"totalTestsAntigen":null,"positiveTestsAntigen":null,"fips":"12","positiveIncrease":5328,"negativeIncrease":24458,"total":10642713,"totalTestResultsIncrease":77846,"posNeg":10634827,"dataQualityGrade":null,"deathIncrease":96,"hospitalizedIncrease":121,"hash":"55545cb8855647cfa5534bf4730701cee4a8341a","commercialScore":0,"negativeRegularScore":0,"negativeScore":0,"positiveScore":0,"score":0,"grade":""},{"date":20210213,"state":"FL","positive":1788827,"probableCases":325309,"negative":8816214,"pending":7856,"totalTestResultsSource":"totalTestEncountersViral","totalTestResults":20447964,"hospitalizedCurrently":4681,"hospitalizedCumulative":77134,"inIcuCurrently":null,"inIcuCumulative":null,"onVentilatorCurrently":null,"onVentilatorCumulative":null,"recovered":null,"lastUpdateEt":"2/12/2021 23:59","dateModified":"2021-02-12T23:59:00Z","checkTimeEt":"02/12 18:59","death":29179,"hospitalized":77134,"hospitalizedDischarged":null,"dateChecked":"2021-02-12T23:59:00Z","totalTestsViral":18044508,"positiveTestsViral":2338601,"negativeTestsViral":15620610,"positiveCasesViral":1463518,"deathConfirmed":null,"deathProbable":null,"totalTestEncountersViral":20447964,"totalTestsPeopleViral":10605041,"totalTestsAntibody":969396,"positiveTestsAntibody":154948,"negativeTestsAntibody":813960,"totalTestsPeopleAntibody":922278,"positiveTestsPeopleAntibody":145802,"negativeTestsPeopleAntibody":776136,"totalTestsPeopleAntigen":null,"positiveTestsPeopleAntigen":null,"totalTestsAntigen":null,"positiveTestsAntigen":null,"fips":"12","positiveIncrease":7377,"negativeIncrease":28940,"total":10612897,"totalTestResultsIncrease":104841,"posNeg":10605041,"dataQualityGrade":null,"deathIncrease":118,"hospitalizedIncrease":261,"hash":"3fddc3c940d10665f78cb57710fab836f222bc05","commercialScore":0,"negativeRegularScore":0,"negativeScore":0,"positiveScore":0,"score":0,"grade":""},{"date":20210212,"state":"FL","positive":1781450,"probableCases":323052,"negative":8787274,"pending":7783,"totalTestResultsSource":"totalTestEncountersViral","totalTestResults":20343123,"hospitalizedCurrently":4825,"hospitalizedCumulative":76873,"inIcuCurrently":null,"inIcuCumulative":null,"onVentilatorCurrently":null,"onVentilatorCumulative":null,"recovered":null,"lastUpdateEt":"2/11/2021 23:59","dateModified":"2021-02-11T23:59:00Z","checkTimeEt":"02/11 18:59","death":29061,"hospitalized":76873,"hospitalizedDischarged":null,"dateChecked":"2021-02-11T23:59:00Z","totalTestsViral":17963576,"positiveTestsViral":2328793,"negativeTestsViral":15549919,"positiveCasesViral":1458398,"deathConfirmed":null,"deathProbable":null,"totalTestEncountersViral":20343123,"totalTestsPeopleViral":10568724,"totalTestsAntibody":969396,"positiveTestsAntibody":154948,"negativeTestsAntibody":813960,"totalTestsPeopleAntibody":922278,"positiveTestsPeopleAntibody":145802,"negativeTestsPeopleAntibody":776136,"totalTestsPeopleAntigen":null,"positiveTestsPeopleAntigen":null,"totalTestsAntigen":null,"positiveTestsAntigen":null,"fips":"12","positiveIncrease":7437,"negativeIncrease":29198,"total":10576507,"totalTestResultsIncrease":109356,"posNeg":10568724,"dataQualityGrade":null,"deathIncrease":190,"hospitalizedIncrease":286,"hash":"3a2d69e62494cd2077d8534e939b43fd5376f838","commercialScore":0,"negativeRegularScore":0,"negativeScore":0,"positiveScore":0,"score":0,"grade":""},{"date":20210211,"state":"FL","positive":1774013,"probableCases":320883,"negative":8758076,"pending":7733,"totalTestResultsSource":"totalTestEncountersViral","totalTestResults":20233767,"hospitalizedCurrently":4906,"hospitalizedCumulative":76587,"inIcuCurrently":null,"inIcuCumulative":null,"onVentilatorCurrently":null,"onVentilatorCumulative":null,"recovered":null,"lastUpdateEt":"2/10/2021 23:59","dateModified":"2021-02-10T23:59:00Z","checkTimeEt":"02/10 18:59","death":28871,"hospitalized":76587,"hospitalizedDischarged":null,"dateChecked":"2021-02-10T23:59:00Z","totalTestsViral":17878252,"positiveTestsViral":2318546,"negativeTestsViral":15475357,"positiveCasesViral":1453130,"deathConfirmed":null,"deathProbable":null,"totalTestEncountersViral":20233767,"totalTestsPeopleViral":10532089,"totalTestsAntibody":941088,"positiveTestsAntibody":144432,"negativeTestsAntibody":796185,"totalTestsPeopleAntibody":897303,"positiveTestsPeopleAntibody":135966,"negativeTestsPeopleAntibody":761003,"totalTestsPeopleAntigen":null,"positiveTestsPeopleAntigen":null,"totalTestsAntigen":null,"positiveTestsAntigen":null,"fips":"12","positiveIncrease":8354,"negativeIncrease":30793,"total":10539822,"totalTestResultsIncrease":122288,"posNeg":10532089,"dataQualityGrade":null,"deathIncrease":180,"hospitalizedIncrease":301,"hash":"2c1ad48301e721232e65982b3ca674e459c23ad9","commercialScore":0,"negativeRegularScore":0,"negativeScore":0,"positiveScore":0,"score":0,"grade":""},{"date":20210210,"state":"FL","positive":1765659,"probableCases":318409,"negative":8727283,"pending":7658,"totalTestResultsSource":"totalTestEncountersViral","totalTestResults":20111479,"hospitalizedCurrently":5129,"hospitalizedCumulative":76286,"inIcuCurrently":null,"inIcuCumulative":null,"onVentilatorCurrently":null,"onVentilatorCumulative":null,"recovered":null,"lastUpdateEt":"2/9/2021 23:59","dateModified":"2021-02-09T23:59:00Z","checkTimeEt":"02/09 18:59","death":28691,"hospitalized":76286,"hospitalizedDischarged":null,"dateChecked":"2021-02-09T23:59:00Z","totalTestsViral":17789844,"positiveTestsViral":2307417,"negativeTestsViral":15398684,"positiveCasesViral":1447250,"deathConfirmed":null,"deathProbable":null,"totalTestEncountersViral":20111479,"totalTestsPeopleViral":10492942,"totalTestsAntibody":941088,"positiveTestsAntibody":144432,"negativeTestsAntibody":796185,"totalTestsPeopleAntibody":897303,"positiveTestsPeopleAntibody":135966,"negativeTestsPeopleAntibody":761003,"totalTestsPeopleAntigen":null,"positiveTestsPeopleAntigen":null,"totalTestsAntigen":null,"positiveTestsAntigen":null,"fips":"12","positiveIncrease":7405,"negativeIncrease":27677,"total":10500600,"totalTestResultsIncrease":101357,"posNeg":10492942,"dataQualityGrade":null,"deathIncrease":165,"hospitalizedIncrease":285,"hash":"75b49b151de6cb74fbf9038a42a72bc55c84a03a","commercialScore":0,"negativeRegularScore":0,"negativeScore":0,"positiveScore":0,"score":0,"grade":""},{"date":20210209,"state":"FL","positive":1758254,"probableCases":315389,"negative":8699606,"pending":7601,"totalTestResultsSource":"totalTestEncountersViral","totalTestResults":20010122,"hospitalizedCurrently":5307,"hospitalizedCumulative":76001,"inIcuCurrently":null,"inIcuCumulative":null,"onVentilatorCurrently":null,"onVentilatorCumulative":null,"recovered":null,"lastUpdateEt":"2/8/2021 23:59","dateModified":"2021-02-08T23:59:00Z","checkTimeEt":"02/08 18:59","death":28526,"hospitalized":76001,"hospitalizedDischarged":null,"dateChecked":"2021-02-08T23:59:00Z","totalTestsViral":17710691,"positiveTestsViral":2297581,"negativeTestsViral":15329888,"positiveCasesViral":1442865,"deathConfirmed":null,"deathProbable":null,"totalTestEncountersViral":20010122,"totalTestsPeopleViral":10457860,"totalTestsAntibody":941088,"positiveTestsAntibody":144432,"negativeTestsAntibody":796185,"totalTestsPeopleAntibody":897303,"positiveTestsPeopleAntibody":135966,"negativeTestsPeopleAntibody":761003,"totalTestsPeopleAntigen":null,"positiveTestsPeopleAntigen":null,"totalTestsAntigen":null,"positiveTestsAntigen":null,"fips":"12","positiveIncrease":6911,"negativeIncrease":24690,"total":10465461,"totalTestResultsIncrease":91141,"posNeg":10457860,"dataQualityGrade":null,"deathIncrease":239,"hospitalizedIncrease":353,"hash":"6add5b6ad6307f4fd5bd03b703113986a99b5e64","commercialScore":0,"negativeRegularScore":0,"negativeScore":0,"positiveScore":0,"score":0,"grade":""},{"date":20210208,"state":"FL","positive":1751343,"probableCases":312800,"negative":8674916,"pending":7551,"totalTestResultsSource":"totalTestEncountersViral","totalTestResults":19918981,"hospitalizedCurrently":5381,"hospitalizedCumulative":75648,"inIcuCurrently":null,"inIcuCumulative":null,"onVentilatorCurrently":null,"onVentilatorCumulative":null,"recovered":null,"lastUpdateEt":"2/7/2021 23:59","dateModified":"2021-02-07T23:59:00Z","checkTimeEt":"02/07 18:59","death":28287,"hospitalized":75648,"hospitalizedDischarged":null,"dateChecked":"2021-02-07T23:59:00Z","totalTestsViral":17637860,"positiveTestsViral":2287907,"negativeTestsViral":15267391,"positiveCasesViral":1438543,"deathConfirmed":null,"deathProbable":null,"totalTestEncountersViral":19918981,"totalTestsPeopleViral":10426259,"totalTestsAntibody":941088,"positiveTestsAntibody":144432,"negativeTestsAntibody":796185,"totalTestsPeopleAntibody":897303,"positiveTestsPeopleAntibody":135966,"negativeTestsPeopleAntibody":761003,"totalTestsPeopleAntigen":null,"positiveTestsPeopleAntigen":null,"totalTestsAntigen":null,"positiveTestsAntigen":null,"fips":"12","positiveIncrease":5599,"negativeIncrease":21924,"total":10433810,"totalTestResultsIncrease":69118,"posNeg":10426259,"dataQualityGrade":null,"deathIncrease":126,"hospitalizedIncrease":133,"hash":"cc8e77dfaab72a91442a02146a5c715a183f8271","commercialScore":0,"negativeRegularScore":0,"negativeScore":0,"positiveScore":0,"score":0,"grade":""},{"date":20210207,"state":"FL","positive":1745744,"probableCases":311233,"negative":8652992,"pending":7543,"totalTestResultsSource":"totalTestEncountersViral","totalTestResults":19849863,"hospitalizedCurrently":5381,"hospitalizedCumulative":75515,"inIcuCurrently":null,"inIcuCumulative":null,"onVentilatorCurrently":null,"onVentilatorCumulative":null,"recovered":null,"lastUpdateEt":"2/6/2021 23:59","dateModified":"2021-02-06T23:59:00Z","checkTimeEt":"02/06 18:59","death":28161,"hospitalized":75515,"hospitalizedDischarged":null,"dateChecked":"2021-02-06T23:59:00Z","totalTestsViral":17574042,"positiveTestsViral":2280071,"negativeTestsViral":15211678,"positiveCasesViral":1434511,"deathConfirmed":null,"deathProbable":null,"totalTestEncountersViral":19849863,"totalTestsPeopleViral":10398736,"totalTestsAntibody":650372,"positiveTestsAntibody":71851,"negativeTestsAntibody":578113,"totalTestsPeopleAntibody":630838,"positiveTestsPeopleAntibody":69600,"negativeTestsPeopleAntibody":560932,"totalTestsPeopleAntigen":null,"positiveTestsPeopleAntigen":null,"totalTestsAntigen":null,"positiveTestsAntigen":null,"fips":"12","positiveIncrease":6468,"negativeIncrease":27601,"total":10406279,"totalTestResultsIncrease":89947,"posNeg":10398736,"dataQualityGrade":null,"deathIncrease":103,"hospitalizedIncrease":152,"hash":"0284926796993d9b7201d6f80475dbbe5a0dbcd5","commercialScore":0,"negativeRegularScore":0,"negativeScore":0,"positiveScore":0,"score":0,"grade":""},{"date":20210206,"state":"FL","positive":1739276,"probableCases":309121,"negative":8625391,"pending":7506,"totalTestResultsSource":"totalTestEncountersViral","totalTestResults":19759916,"hospitalizedCurrently":5377,"hospitalizedCumulative":75363,"inIcuCurrently":null,"inIcuCumulative":null,"onVentilatorCurrently":null,"onVentilatorCumulative":null,"recovered":null,"lastUpdateEt":"2/5/2021 23:59","dateModified":"2021-02-05T23:59:00Z","checkTimeEt":"02/05 18:59","death":28058,"hospitalized":75363,"hospitalizedDischarged":null,"dateChecked":"2021-02-05T23:59:00Z","totalTestsViral":17494320,"positiveTestsViral":2270480,"negativeTestsViral":15141916,"positiveCasesViral":1430155,"deathConfirmed":null,"deathProbable":null,"totalTestEncountersViral":19759916,"totalTestsPeopleViral":10364667,"totalTestsAntibody":650372,"positiveTestsAntibody":71851,"negativeTestsAntibody":578113,"totalTestsPeopleAntibody":630838,"positiveTestsPeopleAntibody":69600,"negativeTestsPeopleAntibody":560932,"totalTestsPeopleAntigen":null,"positiveTestsPeopleAntigen":null,"totalTestsAntigen":null,"positiveTestsAntigen":null,"fips":"12","positiveIncrease":7345,"negativeIncrease":28676,"total":10372173,"totalTestResultsIncrease":108034,"posNeg":10364667,"dataQualityGrade":null,"deathIncrease":145,"hospitalizedIncrease":301,"hash":"34bd6c40ca1f0b3b90413dcff2440f10e281170e","commercialScore":0,"negativeRegularScore":0,"negativeScore":0,"positiveScore":0,"score":0,"grade":""},{"date":20210205,"state":"FL","positive":1731931,"probableCases":307468,"negative":8596715,"pending":7458,"totalTestResultsSource":"totalTestEncountersViral","totalTestResults":19651882,"hospitalizedCurrently":5428,"hospitalizedCumulative":75062,"inIcuCurrently":null,"inIcuCumulative":null,"onVentilatorCurrently":null,"onVentilatorCumulative":null,"recovered":null,"lastUpdateEt":"2/4/2021 23:59","dateModified":"2021-02-04T23:59:00Z","checkTimeEt":"02/04 18:59","death":27913,"hospitalized":75062,"hospitalizedDischarged":null,"dateChecked":"2021-02-04T23:59:00Z","totalTestsViral":17414443,"positiveTestsViral":2260188,"negativeTestsViral":15072874,"positiveCasesViral":1424463,"deathConfirmed":null,"deathProbable":null,"totalTestEncountersViral":19651882,"totalTestsPeopleViral":10328646,"totalTestsAntibody":650372,"positiveTestsAntibody":71851,"negativeTestsAntibody":578113,"totalTestsPeopleAntibody":630838,"positiveTestsPeopleAntibody":69600,"negativeTestsPeopleAntibody":560932,"totalTestsPeopleAntigen":null,"positiveTestsPeopleAntigen":null,"totalTestsAntigen":null,"positiveTestsAntigen":null,"fips":"12","positiveIncrease":11171,"negativeIncrease":44918,"total":10336104,"totalTestResultsIncrease":176996,"posNeg":10328646,"dataQualityGrade":null,"deathIncrease":215,"hospitalizedIncrease":341,"hash":"5b2315b66d696f140642c55768b62b384ee41aac","commercialScore":0,"negativeRegularScore":0,"negativeScore":0,"positiveScore":0,"score":0,"grade":""},{"date":20210204,"state":"FL","positive":1720760,"probableCases":304561,"negative":8551797,"pending":7504,"totalTestResultsSource":"totalTestEncountersViral","totalTestResults":19474886,"hospitalizedCurrently":5607,"hospitalizedCumulative":74721,"inIcuCurrently":null,"inIcuCumulative":null,"onVentilatorCurrently":null,"onVentilatorCumulative":null,"recovered":null,"lastUpdateEt":"2/3/2021 23:59","dateModified":"2021-02-03T23:59:00Z","checkTimeEt":"02/03 18:59","death":27698,"hospitalized":74721,"hospitalizedDischarged":null,"dateChecked":"2021-02-03T23:59:00Z","totalTestsViral":17291642,"positiveTestsViral":2246336,"negativeTestsViral":14964527,"positiveCasesViral":1416199,"deathConfirmed":null,"deathProbable":null,"totalTestEncountersViral":19474886,"totalTestsPeopleViral":10272557,"totalTestsAntibody":650372,"positiveTestsAntibody":71851,"negativeTestsAntibody":578113,"totalTestsPeopleAntibody":630838,"positiveTestsPeopleAntibody":69600,"negativeTestsPeopleAntibody":560932,"totalTestsPeopleAntigen":null,"positiveTestsPeopleAntigen":null,"totalTestsAntigen":null,"positiveTestsAntigen":null,"fips":"12","positiveIncrease":8434,"negativeIncrease":17814,"total":10280061,"totalTestResultsIncrease":68280,"posNeg":10272557,"dataQualityGrade":null,"deathIncrease":226,"hospitalizedIncrease":338,"hash":"ddde9b3366d568f2628c910b029a13d528393818","commercialScore":0,"negativeRegularScore":0,"negativeScore":0,"positiveScore":0,"score":0,"grade":""},{"date":20210203,"state":"FL","positive":1712326,"probableCases":302750,"negative":8533983,"pending":7411,"totalTestResultsSource":"totalTestEncountersViral","totalTestResults":19406606,"hospitalizedCurrently":5824,"hospitalizedCumulative":74383,"inIcuCurrently":null,"inIcuCumulative":null,"onVentilatorCurrently":null,"onVentilatorCumulative":null,"recovered":null,"lastUpdateEt":"2/2/2021 23:59","dateModified":"2021-02-02T23:59:00Z","checkTimeEt":"02/02 18:59","death":27472,"hospitalized":74383,"hospitalizedDischarged":null,"dateChecked":"2021-02-02T23:59:00Z","totalTestsViral":17229269,"positiveTestsViral":2235900,"negativeTestsViral":14913135,"positiveCasesViral":1409576,"deathConfirmed":null,"deathProbable":null,"totalTestEncountersViral":19406606,"totalTestsPeopleViral":10246309,"totalTestsAntibody":650372,"positiveTestsAntibody":71851,"negativeTestsAntibody":578113,"totalTestsPeopleAntibody":630838,"positiveTestsPeopleAntibody":69600,"negativeTestsPeopleAntibody":560932,"totalTestsPeopleAntigen":null,"positiveTestsPeopleAntigen":null,"totalTestsAntigen":null,"positiveTestsAntigen":null,"fips":"12","positiveIncrease":6694,"negativeIncrease":21756,"total":10253720,"totalTestResultsIncrease":79696,"posNeg":10246309,"dataQualityGrade":null,"deathIncrease":203,"hospitalizedIncrease":422,"hash":"3dadb010a6198227fa9f3e4079dbc34459fe4d72","commercialScore":0,"negativeRegularScore":0,"negativeScore":0,"positiveScore":0,"score":0,"grade":""},{"date":20210202,"state":"FL","positive":1705632,"probableCases":300617,"negative":8512227,"pending":7320,"totalTestResultsSource":"totalTestEncountersViral","totalTestResults":19326910,"hospitalizedCurrently":6020,"hospitalizedCumulative":73961,"inIcuCurrently":null,"inIcuCumulative":null,"onVentilatorCurrently":null,"onVentilatorCumulative":null,"recovered":null,"lastUpdateEt":"2/1/2021 23:59","dateModified":"2021-02-01T23:59:00Z","checkTimeEt":"02/01 18:59","death":27269,"hospitalized":73961,"hospitalizedDischarged":null,"dateChecked":"2021-02-01T23:59:00Z","totalTestsViral":17177064,"positiveTestsViral":2226645,"negativeTestsViral":14870465,"positiveCasesViral":1405015,"deathConfirmed":null,"deathProbable":null,"totalTestEncountersViral":19326910,"totalTestsPeopleViral":10217859,"totalTestsAntibody":650372,"positiveTestsAntibody":71851,"negativeTestsAntibody":578113,"totalTestsPeopleAntibody":630838,"positiveTestsPeopleAntibody":69600,"negativeTestsPeopleAntibody":560932,"totalTestsPeopleAntigen":null,"positiveTestsPeopleAntigen":null,"totalTestsAntigen":null,"positiveTestsAntigen":null,"fips":"12","positiveIncrease":10332,"negativeIncrease":31742,"total":10225179,"totalTestResultsIncrease":109904,"posNeg":10217859,"dataQualityGrade":null,"deathIncrease":140,"hospitalizedIncrease":410,"hash":"fa8f6086c43e9b384849b64537b7cb4eb202ddaf","commercialScore":0,"negativeRegularScore":0,"negativeScore":0,"positiveScore":0,"score":0,"grade":""},{"date":20210201,"state":"FL","positive":1695300,"probableCases":297288,"negative":8480485,"pending":7245,"totalTestResultsSource":"totalTestEncountersViral","totalTestResults":19217006,"hospitalizedCurrently":6142,"hospitalizedCumulative":73551,"inIcuCurrently":null,"inIcuCumulative":null,"onVentilatorCurrently":null,"onVentilatorCumulative":null,"recovered":null,"lastUpdateEt":"1/31/2021 23:59","dateModified":"2021-01-31T23:59:00Z","checkTimeEt":"01/31 18:59","death":27129,"hospitalized":73551,"hospitalizedDischarged":null,"dateChecked":"2021-01-31T23:59:00Z","totalTestsViral":17083600,"positiveTestsViral":2212703,"negativeTestsViral":14791520,"positiveCasesViral":1398012,"deathConfirmed":null,"deathProbable":null,"totalTestEncountersViral":19217006,"totalTestsPeopleViral":10175785,"totalTestsAntibody":650372,"positiveTestsAntibody":71851,"negativeTestsAntibody":578113,"totalTestsPeopleAntibody":630838,"positiveTestsPeopleAntibody":69600,"negativeTestsPeopleAntibody":560932,"totalTestsPeopleAntigen":null,"positiveTestsPeopleAntigen":null,"totalTestsAntigen":null,"positiveTestsAntigen":null,"fips":"12","positiveIncrease":5600,"negativeIncrease":19021,"total":10183030,"totalTestResultsIncrease":59496,"posNeg":10175785,"dataQualityGrade":null,"deathIncrease":214,"hospitalizedIncrease":167,"hash":"6ce466fd9ac027217a5b17c2c70896c6a7eff2e6","commercialScore":0,"negativeRegularScore":0,"negativeScore":0,"positiveScore":0,"score":0,"grade":""},{"date":20210131,"state":"FL","positive":1689700,"probableCases":295639,"negative":8461464,"pending":7237,"totalTestResultsSource":"totalTestEncountersViral","totalTestResults":19157510,"hospitalizedCurrently":6101,"hospitalizedCumulative":73384,"inIcuCurrently":null,"inIcuCumulative":null,"onVentilatorCurrently":null,"onVentilatorCumulative":null,"recovered":null,"lastUpdateEt":"1/30/2021 23:59","dateModified":"2021-01-30T23:59:00Z","checkTimeEt":"01/30 18:59","death":26915,"hospitalized":73384,"hospitalizedDischarged":null,"dateChecked":"2021-01-30T23:59:00Z","totalTestsViral":17029166,"positiveTestsViral":2204930,"negativeTestsViral":14745059,"positiveCasesViral":1394061,"deathConfirmed":null,"deathProbable":null,"totalTestEncountersViral":19157510,"totalTestsPeopleViral":10151164,"totalTestsAntibody":650372,"positiveTestsAntibody":71851,"negativeTestsAntibody":578113,"totalTestsPeopleAntibody":630838,"positiveTestsPeopleAntibody":69600,"negativeTestsPeopleAntibody":560932,"totalTestsPeopleAntigen":null,"positiveTestsPeopleAntigen":null,"totalTestsAntigen":null,"positiveTestsAntigen":null,"fips":"12","positiveIncrease":7604,"negativeIncrease":39124,"total":10158401,"totalTestResultsIncrease":129743,"posNeg":10151164,"dataQualityGrade":null,"deathIncrease":120,"hospitalizedIncrease":164,"hash":"399ea650d3ea18aab27fa9ed2a80279ae7a70499","commercialScore":0,"negativeRegularScore":0,"negativeScore":0,"positiveScore":0,"score":0,"grade":""},{"date":20210130,"state":"FL","positive":1682096,"probableCases":293501,"negative":8422340,"pending":7207,"totalTestResultsSource":"totalTestEncountersViral","totalTestResults":19027767,"hospitalizedCurrently":6153,"hospitalizedCumulative":73220,"inIcuCurrently":null,"inIcuCumulative":null,"onVentilatorCurrently":null,"onVentilatorCumulative":null,"recovered":null,"lastUpdateEt":"1/29/2021 23:59","dateModified":"2021-01-29T23:59:00Z","checkTimeEt":"01/29 18:59","death":26795,"hospitalized":73220,"hospitalizedDischarged":null,"dateChecked":"2021-01-29T23:59:00Z","totalTestsViral":16922699,"positiveTestsViral":2194399,"negativeTestsViral":14649647,"positiveCasesViral":1388595,"deathConfirmed":null,"deathProbable":null,"totalTestEncountersViral":19027767,"totalTestsPeopleViral":10104436,"totalTestsAntibody":650372,"positiveTestsAntibody":71851,"negativeTestsAntibody":578113,"totalTestsPeopleAntibody":630838,"positiveTestsPeopleAntibody":69600,"negativeTestsPeopleAntibody":560932,"totalTestsPeopleAntigen":null,"positiveTestsPeopleAntigen":null,"totalTestsAntigen":null,"positiveTestsAntigen":null,"fips":"12","positiveIncrease":14654,"negativeIncrease":63111,"total":10111643,"totalTestResultsIncrease":207768,"posNeg":10104436,"dataQualityGrade":null,"deathIncrease":110,"hospitalizedIncrease":276,"hash":"91690d7834f5d9b893c31ba763e763793dec0e3d","commercialScore":0,"negativeRegularScore":0,"negativeScore":0,"positiveScore":0,"score":0,"grade":""},{"date":20210129,"state":"FL","positive":1667442,"probableCases":288918,"negative":8359229,"pending":7139,"totalTestResultsSource":"totalTestEncountersViral","totalTestResults":18819999,"hospitalizedCurrently":6375,"hospitalizedCumulative":72944,"inIcuCurrently":null,"inIcuCumulative":null,"onVentilatorCurrently":null,"onVentilatorCumulative":null,"recovered":null,"lastUpdateEt":"1/28/2021 23:59","dateModified":"2021-01-28T23:59:00Z","checkTimeEt":"01/28 18:59","death":26685,"hospitalized":72944,"hospitalizedDischarged":null,"dateChecked":"2021-01-28T23:59:00Z","totalTestsViral":16758178,"positiveTestsViral":2174542,"negativeTestsViral":14506280,"positiveCasesViral":1378524,"deathConfirmed":null,"deathProbable":null,"totalTestEncountersViral":18819999,"totalTestsPeopleViral":10026671,"totalTestsAntibody":650372,"positiveTestsAntibody":71851,"negativeTestsAntibody":578113,"totalTestsPeopleAntibody":630838,"positiveTestsPeopleAntibody":69600,"negativeTestsPeopleAntibody":560932,"totalTestsPeopleAntigen":null,"positiveTestsPeopleAntigen":null,"totalTestsAntigen":null,"positiveTestsAntigen":null,"fips":"12","positiveIncrease":10745,"negativeIncrease":11105,"total":10033810,"totalTestResultsIncrease":54799,"posNeg":10026671,"dataQualityGrade":null,"deathIncrease":229,"hospitalizedIncrease":341,"hash":"f2baad76f92920ed4ec8e47b98ac14f337bbba52","commercialScore":0,"negativeRegularScore":0,"negativeScore":0,"positiveScore":0,"score":0,"grade":""},{"date":20210128,"state":"FL","positive":1656697,"probableCases":285522,"negative":8348124,"pending":7057,"totalTestResultsSource":"totalTestEncountersViral","totalTestResults":18765200,"hospitalizedCurrently":6565,"hospitalizedCumulative":72603,"inIcuCurrently":null,"inIcuCumulative":null,"onVentilatorCurrently":null,"onVentilatorCumulative":null,"recovered":null,"lastUpdateEt":"1/27/2021 23:59","dateModified":"2021-01-27T23:59:00Z","checkTimeEt":"01/27 18:59","death":26456,"hospitalized":72603,"hospitalizedDischarged":null,"dateChecked":"2021-01-27T23:59:00Z","totalTestsViral":16701925,"positiveTestsViral":2159694,"negativeTestsViral":14465108,"positiveCasesViral":1371175,"deathConfirmed":null,"deathProbable":null,"totalTestEncountersViral":18765200,"totalTestsPeopleViral":10004821,"totalTestsAntibody":650372,"positiveTestsAntibody":71851,"negativeTestsAntibody":578113,"totalTestsPeopleAntibody":630838,"positiveTestsPeopleAntibody":69600,"negativeTestsPeopleAntibody":560932,"totalTestsPeopleAntigen":null,"positiveTestsPeopleAntigen":null,"totalTestsAntigen":null,"positiveTestsAntigen":null,"fips":"12","positiveIncrease":11190,"negativeIncrease":36266,"total":10011878,"totalTestResultsIncrease":133418,"posNeg":10004821,"dataQualityGrade":null,"deathIncrease":207,"hospitalizedIncrease":388,"hash":"8885e46cf473574f01438f69b34f1a8a1f79ca20","commercialScore":0,"negativeRegularScore":0,"negativeScore":0,"positiveScore":0,"score":0,"grade":""},{"date":20210127,"state":"FL","positive":1645507,"probableCases":282306,"negative":8311858,"pending":6942,"totalTestResultsSource":"totalTestEncountersViral","totalTestResults":18631782,"hospitalizedCurrently":6679,"hospitalizedCumulative":72215,"inIcuCurrently":null,"inIcuCumulative":null,"onVentilatorCurrently":null,"onVentilatorCumulative":null,"recovered":null,"lastUpdateEt":"1/26/2021 23:59","dateModified":"2021-01-26T23:59:00Z","checkTimeEt":"01/26 18:59","death":26249,"hospitalized":72215,"hospitalizedDischarged":null,"dateChecked":"2021-01-26T23:59:00Z","totalTestsViral":16630531,"positiveTestsViral":2146712,"negativeTestsViral":14407095,"positiveCasesViral":1363201,"deathConfirmed":null,"deathProbable":null,"totalTestEncountersViral":18631782,"totalTestsPeopleViral":9957365,"totalTestsAntibody":650372,"positiveTestsAntibody":71851,"negativeTestsAntibody":578113,"totalTestsPeopleAntibody":630838,"positiveTestsPeopleAntibody":69600,"negativeTestsPeopleAntibody":560932,"totalTestsPeopleAntigen":null,"positiveTestsPeopleAntigen":null,"totalTestsAntigen":null,"positiveTestsAntigen":null,"fips":"12","positiveIncrease":8211,"negativeIncrease":19453,"total":9964307,"totalTestResultsIncrease":65513,"posNeg":9957365,"dataQualityGrade":null,"deathIncrease":169,"hospitalizedIncrease":363,"hash":"110cd9c7d04b5a279cf70c95c9ddf25c8bd9ed0c","commercialScore":0,"negativeRegularScore":0,"negativeScore":0,"positiveScore":0,"score":0,"grade":""},{"date":20210126,"state":"FL","positive":1637296,"probableCases":279898,"negative":8292405,"pending":6849,"totalTestResultsSource":"totalTestEncountersViral","totalTestResults":18566269,"hospitalizedCurrently":6775,"hospitalizedCumulative":71852,"inIcuCurrently":null,"inIcuCumulative":null,"onVentilatorCurrently":null,"onVentilatorCumulative":null,"recovered":null,"lastUpdateEt":"1/25/2021 23:59","dateModified":"2021-01-25T23:59:00Z","checkTimeEt":"01/25 18:59","death":26080,"hospitalized":71852,"hospitalizedDischarged":null,"dateChecked":"2021-01-25T23:59:00Z","totalTestsViral":16608418,"positiveTestsViral":2138319,"negativeTestsViral":14393554,"positiveCasesViral":1357398,"deathConfirmed":null,"deathProbable":null,"totalTestEncountersViral":18566269,"totalTestsPeopleViral":9929701,"totalTestsAntibody":650372,"positiveTestsAntibody":71851,"negativeTestsAntibody":578113,"totalTestsPeopleAntibody":630838,"positiveTestsPeopleAntibody":69600,"negativeTestsPeopleAntibody":560932,"totalTestsPeopleAntigen":null,"positiveTestsPeopleAntigen":null,"totalTestsAntigen":null,"positiveTestsAntigen":null,"fips":"12","positiveIncrease":9466,"negativeIncrease":23990,"total":9936550,"totalTestResultsIncrease":88400,"posNeg":9929701,"dataQualityGrade":null,"deathIncrease":231,"hospitalizedIncrease":465,"hash":"39dee79e926c4ff5ca1411dd3e8852db26810dc3","commercialScore":0,"negativeRegularScore":0,"negativeScore":0,"positiveScore":0,"score":0,"grade":""},{"date":20210125,"state":"FL","positive":1627830,"probableCases":277127,"negative":8268415,"pending":6747,"totalTestResultsSource":"totalTestEncountersViral","totalTestResults":18477869,"hospitalizedCurrently":6899,"hospitalizedCumulative":71387,"inIcuCurrently":null,"inIcuCumulative":null,"onVentilatorCurrently":null,"onVentilatorCumulative":null,"recovered":null,"lastUpdateEt":"1/24/2021 23:59","dateModified":"2021-01-24T23:59:00Z","checkTimeEt":"01/24 18:59","death":25849,"hospitalized":71387,"hospitalizedDischarged":null,"dateChecked":"2021-01-24T23:59:00Z","totalTestsViral":16532657,"positiveTestsViral":2125816,"negativeTestsViral":14330802,"positiveCasesViral":1350703,"deathConfirmed":null,"deathProbable":null,"totalTestEncountersViral":18477869,"totalTestsPeopleViral":9896245,"totalTestsAntibody":650372,"positiveTestsAntibody":71851,"negativeTestsAntibody":578113,"totalTestsPeopleAntibody":630838,"positiveTestsPeopleAntibody":69600,"negativeTestsPeopleAntibody":560932,"totalTestsPeopleAntigen":null,"positiveTestsPeopleAntigen":null,"totalTestsAntigen":null,"positiveTestsAntigen":null,"fips":"12","positiveIncrease":8542,"negativeIncrease":25355,"total":9902992,"totalTestResultsIncrease":80045,"posNeg":9896245,"dataQualityGrade":null,"deathIncrease":156,"hospitalizedIncrease":168,"hash":"0ecf36cfc15416642b5186710b4a8d0590be78ad","commercialScore":0,"negativeRegularScore":0,"negativeScore":0,"positiveScore":0,"score":0,"grade":""},{"date":20210124,"state":"FL","positive":1619288,"probableCases":275141,"negative":8243060,"pending":6719,"totalTestResultsSource":"totalTestEncountersViral","totalTestResults":18397824,"hospitalizedCurrently":6727,"hospitalizedCumulative":71219,"inIcuCurrently":null,"inIcuCumulative":null,"onVentilatorCurrently":null,"onVentilatorCumulative":null,"recovered":null,"lastUpdateEt":"1/23/2021 23:59","dateModified":"2021-01-23T23:59:00Z","checkTimeEt":"01/23 18:59","death":25693,"hospitalized":71219,"hospitalizedDischarged":null,"dateChecked":"2021-01-23T23:59:00Z","totalTestsViral":16456335,"positiveTestsViral":2114100,"negativeTestsViral":14266676,"positiveCasesViral":1344147,"deathConfirmed":null,"deathProbable":null,"totalTestEncountersViral":18397824,"totalTestsPeopleViral":9862348,"totalTestsAntibody":650372,"positiveTestsAntibody":71851,"negativeTestsAntibody":578113,"totalTestsPeopleAntibody":630838,"positiveTestsPeopleAntibody":69600,"negativeTestsPeopleAntibody":560932,"totalTestsPeopleAntigen":null,"positiveTestsPeopleAntigen":null,"totalTestsAntigen":null,"positiveTestsAntigen":null,"fips":"12","positiveIncrease":9335,"negativeIncrease":27674,"total":9869067,"totalTestResultsIncrease":102178,"posNeg":9862348,"dataQualityGrade":null,"deathIncrease":132,"hospitalizedIncrease":182,"hash":"e4ea9be8489b60a3e8fdff3796fc08650e7a4aa7","commercialScore":0,"negativeRegularScore":0,"negativeScore":0,"positiveScore":0,"score":0,"grade":""},{"date":20210123,"state":"FL","positive":1609953,"probableCases":273443,"negative":8215386,"pending":6663,"totalTestResultsSource":"totalTestEncountersViral","totalTestResults":18295646,"hospitalizedCurrently":6711,"hospitalizedCumulative":71037,"inIcuCurrently":null,"inIcuCumulative":null,"onVentilatorCurrently":null,"onVentilatorCumulative":null,"recovered":null,"lastUpdateEt":"1/22/2021 23:59","dateModified":"2021-01-22T23:59:00Z","checkTimeEt":"01/22 18:59","death":25561,"hospitalized":71037,"hospitalizedDischarged":null,"dateChecked":"2021-01-22T23:59:00Z","totalTestsViral":16373692,"positiveTestsViral":2101456,"negativeTestsViral":14197211,"positiveCasesViral":1336510,"deathConfirmed":null,"deathProbable":null,"totalTestEncountersViral":18295646,"totalTestsPeopleViral":9825339,"totalTestsAntibody":650372,"positiveTestsAntibody":71851,"negativeTestsAntibody":578113,"totalTestsPeopleAntibody":630838,"positiveTestsPeopleAntibody":69600,"negativeTestsPeopleAntibody":560932,"totalTestsPeopleAntigen":null,"positiveTestsPeopleAntigen":null,"totalTestsAntigen":null,"positiveTestsAntigen":null,"fips":"12","positiveIncrease":12104,"negativeIncrease":48994,"total":9832002,"totalTestResultsIncrease":169590,"posNeg":9825339,"dataQualityGrade":null,"deathIncrease":156,"hospitalizedIncrease":270,"hash":"8c68a5746a10865f402129540c4a16c5580587d0","commercialScore":0,"negativeRegularScore":0,"negativeScore":0,"positiveScore":0,"score":0,"grade":""},{"date":20210122,"state":"FL","positive":1597849,"probableCases":269149,"negative":8166392,"pending":6565,"totalTestResultsSource":"totalTestEncountersViral","totalTestResults":18126056,"hospitalizedCurrently":6904,"hospitalizedCumulative":70767,"inIcuCurrently":null,"inIcuCumulative":null,"onVentilatorCurrently":null,"onVentilatorCumulative":null,"recovered":null,"lastUpdateEt":"1/21/2021 23:59","dateModified":"2021-01-21T23:59:00Z","checkTimeEt":"01/21 18:59","death":25405,"hospitalized":70767,"hospitalizedDischarged":null,"dateChecked":"2021-01-21T23:59:00Z","totalTestsViral":16235049,"positiveTestsViral":2085129,"negativeTestsViral":14075413,"positiveCasesViral":1328700,"deathConfirmed":null,"deathProbable":null,"totalTestEncountersViral":18126056,"totalTestsPeopleViral":9764241,"totalTestsAntibody":650372,"positiveTestsAntibody":71851,"negativeTestsAntibody":578113,"totalTestsPeopleAntibody":630838,"positiveTestsPeopleAntibody":69600,"negativeTestsPeopleAntibody":560932,"totalTestsPeopleAntigen":null,"positiveTestsPeopleAntigen":null,"totalTestsAntigen":null,"positiveTestsAntigen":null,"fips":"12","positiveIncrease":13407,"negativeIncrease":22189,"total":9770806,"totalTestResultsIncrease":83831,"posNeg":9764241,"dataQualityGrade":null,"deathIncrease":277,"hospitalizedIncrease":461,"hash":"9b4265e8e64d1e9727d7f66d4bc7eb563307f89c","commercialScore":0,"negativeRegularScore":0,"negativeScore":0,"positiveScore":0,"score":0,"grade":""},{"date":20210121,"state":"FL","positive":1584442,"probableCases":265499,"negative":8144203,"pending":6461,"totalTestResultsSource":"totalTestEncountersViral","totalTestResults":18042225,"hospitalizedCurrently":7023,"hospitalizedCumulative":70306,"inIcuCurrently":null,"inIcuCumulative":null,"onVentilatorCurrently":null,"onVentilatorCumulative":null,"recovered":null,"lastUpdateEt":"1/20/2021 23:59","dateModified":"2021-01-20T23:59:00Z","checkTimeEt":"01/20 18:59","death":25128,"hospitalized":70306,"hospitalizedDischarged":null,"dateChecked":"2021-01-20T23:59:00Z","totalTestsViral":16153041,"positiveTestsViral":2066910,"negativeTestsViral":14012187,"positiveCasesViral":1318943,"deathConfirmed":null,"deathProbable":null,"totalTestEncountersViral":18042225,"totalTestsPeopleViral":9728645,"totalTestsAntibody":650372,"positiveTestsAntibody":71851,"negativeTestsAntibody":578113,"totalTestsPeopleAntibody":630838,"positiveTestsPeopleAntibody":69600,"negativeTestsPeopleAntibody":560932,"totalTestsPeopleAntigen":null,"positiveTestsPeopleAntigen":null,"totalTestsAntigen":null,"positiveTestsAntigen":null,"fips":"12","positiveIncrease":12602,"negativeIncrease":37904,"total":9735106,"totalTestResultsIncrease":131557,"posNeg":9728645,"dataQualityGrade":null,"deathIncrease":163,"hospitalizedIncrease":352,"hash":"8a10e7ae1482f217512f70ea93615521b7878443","commercialScore":0,"negativeRegularScore":0,"negativeScore":0,"positiveScore":0,"score":0,"grade":""},{"date":20210120,"state":"FL","positive":1571840,"probableCases":261722,"negative":8106299,"pending":6371,"totalTestResultsSource":"totalTestEncountersViral","totalTestResults":17910668,"hospitalizedCurrently":7141,"hospitalizedCumulative":69954,"inIcuCurrently":null,"inIcuCumulative":null,"onVentilatorCurrently":null,"onVentilatorCumulative":null,"recovered":null,"lastUpdateEt":"1/19/2021 23:59","dateModified":"2021-01-19T23:59:00Z","checkTimeEt":"01/19 18:59","death":24965,"hospitalized":69954,"hospitalizedDischarged":null,"dateChecked":"2021-01-19T23:59:00Z","totalTestsViral":16041574,"positiveTestsViral":2049979,"negativeTestsViral":13918123,"positiveCasesViral":1310118,"deathConfirmed":null,"deathProbable":null,"totalTestEncountersViral":17910668,"totalTestsPeopleViral":9678139,"totalTestsAntibody":650372,"positiveTestsAntibody":71851,"negativeTestsAntibody":578113,"totalTestsPeopleAntibody":630838,"positiveTestsPeopleAntibody":69600,"negativeTestsPeopleAntibody":560932,"totalTestsPeopleAntigen":null,"positiveTestsPeopleAntigen":null,"totalTestsAntigen":null,"positiveTestsAntigen":null,"fips":"12","positiveIncrease":11825,"negativeIncrease":26957,"total":9684510,"totalTestResultsIncrease":89293,"posNeg":9678139,"dataQualityGrade":null,"deathIncrease":145,"hospitalizedIncrease":471,"hash":"2d4406fe068cb3010bf3d05de7c5e21f0ad44f42","commercialScore":0,"negativeRegularScore":0,"negativeScore":0,"positiveScore":0,"score":0,"grade":""},{"date":20210119,"state":"FL","positive":1560015,"probableCases":257689,"negative":8079342,"pending":6277,"totalTestResultsSource":"totalTestEncountersViral","totalTestResults":17821375,"hospitalizedCurrently":7367,"hospitalizedCumulative":69483,"inIcuCurrently":null,"inIcuCumulative":null,"onVentilatorCurrently":null,"onVentilatorCumulative":null,"recovered":null,"lastUpdateEt":"1/18/2021 23:59","dateModified":"2021-01-18T23:59:00Z","checkTimeEt":"01/18 18:59","death":24820,"hospitalized":69483,"hospitalizedDischarged":null,"dateChecked":"2021-01-18T23:59:00Z","totalTestsViral":15955698,"positiveTestsViral":2034689,"negativeTestsViral":13847927,"positiveCasesViral":1302326,"deathConfirmed":null,"deathProbable":null,"totalTestEncountersViral":17821375,"totalTestsPeopleViral":9639357,"totalTestsAntibody":650372,"positiveTestsAntibody":71851,"negativeTestsAntibody":578113,"totalTestsPeopleAntibody":630838,"positiveTestsPeopleAntibody":69600,"negativeTestsPeopleAntibody":560932,"totalTestsPeopleAntigen":null,"positiveTestsPeopleAntigen":null,"totalTestsAntigen":null,"positiveTestsAntigen":null,"fips":"12","positiveIncrease":9571,"negativeIncrease":26994,"total":9645634,"totalTestResultsIncrease":92379,"posNeg":9639357,"dataQualityGrade":null,"deathIncrease":163,"hospitalizedIncrease":318,"hash":"cb1c7a8ce2746ef552d1e609965853c3f5b1fd86","commercialScore":0,"negativeRegularScore":0,"negativeScore":0,"positiveScore":0,"score":0,"grade":""},{"date":20210118,"state":"FL","positive":1550444,"probableCases":254520,"negative":8052348,"pending":6246,"totalTestResultsSource":"totalTestEncountersViral","totalTestResults":17728996,"hospitalizedCurrently":7448,"hospitalizedCumulative":69165,"inIcuCurrently":null,"inIcuCumulative":null,"onVentilatorCurrently":null,"onVentilatorCumulative":null,"recovered":null,"lastUpdateEt":"1/17/2021 23:59","dateModified":"2021-01-17T23:59:00Z","checkTimeEt":"01/17 18:59","death":24657,"hospitalized":69165,"hospitalizedDischarged":null,"dateChecked":"2021-01-17T23:59:00Z","totalTestsViral":15869264,"positiveTestsViral":2021381,"negativeTestsViral":13775503,"positiveCasesViral":1295924,"deathConfirmed":null,"deathProbable":null,"totalTestEncountersViral":17728996,"totalTestsPeopleViral":9602792,"totalTestsAntibody":650372,"positiveTestsAntibody":71851,"negativeTestsAntibody":578113,"totalTestsPeopleAntibody":630838,"positiveTestsPeopleAntibody":69600,"negativeTestsPeopleAntibody":560932,"totalTestsPeopleAntigen":null,"positiveTestsPeopleAntigen":null,"totalTestsAntigen":null,"positiveTestsAntigen":null,"fips":"12","positiveIncrease":7877,"negativeIncrease":22048,"total":9609038,"totalTestResultsIncrease":74912,"posNeg":9602792,"dataQualityGrade":null,"deathIncrease":142,"hospitalizedIncrease":178,"hash":"3fac64b501550921ab0a50fffc94effd3c8fafde","commercialScore":0,"negativeRegularScore":0,"negativeScore":0,"positiveScore":0,"score":0,"grade":""},{"date":20210117,"state":"FL","positive":1542567,"probableCases":253801,"negative":8030300,"pending":6224,"totalTestResultsSource":"totalTestEncountersViral","totalTestResults":17654084,"hospitalizedCurrently":7421,"hospitalizedCumulative":68987,"inIcuCurrently":null,"inIcuCumulative":null,"onVentilatorCurrently":null,"onVentilatorCumulative":null,"recovered":null,"lastUpdateEt":"1/16/2021 23:59","dateModified":"2021-01-16T23:59:00Z","checkTimeEt":"01/16 18:59","death":24515,"hospitalized":68987,"hospitalizedDischarged":null,"dateChecked":"2021-01-16T23:59:00Z","totalTestsViral":15800722,"positiveTestsViral":2010231,"negativeTestsViral":13718519,"positiveCasesViral":1288766,"deathConfirmed":null,"deathProbable":null,"totalTestEncountersViral":17654084,"totalTestsPeopleViral":9572867,"totalTestsAntibody":650372,"positiveTestsAntibody":71851,"negativeTestsAntibody":578113,"totalTestsPeopleAntibody":630838,"positiveTestsPeopleAntibody":69600,"negativeTestsPeopleAntibody":560932,"totalTestsPeopleAntigen":null,"positiveTestsPeopleAntigen":null,"totalTestsAntigen":null,"positiveTestsAntigen":null,"fips":"12","positiveIncrease":10737,"negativeIncrease":66648,"total":9579091,"totalTestResultsIncrease":107367,"posNeg":9572867,"dataQualityGrade":null,"deathIncrease":135,"hospitalizedIncrease":207,"hash":"13a0e89fed2bdc45229f66efbf44006ebd2c5036","commercialScore":0,"negativeRegularScore":0,"negativeScore":0,"positiveScore":0,"score":0,"grade":""},{"date":20210116,"state":"FL","positive":1531830,"probableCases":250703,"negative":7963652,"pending":6164,"totalTestResultsSource":"totalTestEncountersViral","totalTestResults":17546717,"hospitalizedCurrently":7347,"hospitalizedCumulative":68780,"inIcuCurrently":null,"inIcuCumulative":null,"onVentilatorCurrently":null,"onVentilatorCumulative":null,"recovered":null,"lastUpdateEt":"1/15/2021 23:59","dateModified":"2021-01-15T23:59:00Z","checkTimeEt":"01/15 18:59","death":24380,"hospitalized":68780,"hospitalizedDischarged":null,"dateChecked":"2021-01-15T23:59:00Z","totalTestsViral":15705531,"positiveTestsViral":1995165,"negativeTestsViral":13638884,"positiveCasesViral":1281127,"deathConfirmed":null,"deathProbable":null,"totalTestEncountersViral":17546717,"totalTestsPeopleViral":9495482,"totalTestsAntibody":650372,"positiveTestsAntibody":71851,"negativeTestsAntibody":578113,"totalTestsPeopleAntibody":630838,"positiveTestsPeopleAntibody":69600,"negativeTestsPeopleAntibody":560932,"totalTestsPeopleAntigen":null,"positiveTestsPeopleAntigen":null,"totalTestsAntigen":null,"positiveTestsAntigen":null,"fips":"12","positiveIncrease":11886,"negativeIncrease":36230,"total":9501646,"totalTestResultsIncrease":122159,"posNeg":9495482,"dataQualityGrade":null,"deathIncrease":211,"hospitalizedIncrease":336,"hash":"9539836b094e91d990b072bce1bc936c15464ca8","commercialScore":0,"negativeRegularScore":0,"negativeScore":0,"positiveScore":0,"score":0,"grade":""},{"date":20210115,"state":"FL","positive":1519944,"probableCases":248618,"negative":7927422,"pending":6103,"totalTestResultsSource":"totalTestEncountersViral","totalTestResults":17424558,"hospitalizedCurrently":7528,"hospitalizedCumulative":68444,"inIcuCurrently":null,"inIcuCumulative":null,"onVentilatorCurrently":null,"onVentilatorCumulative":null,"recovered":null,"lastUpdateEt":"1/14/2021 23:59","dateModified":"2021-01-14T23:59:00Z","checkTimeEt":"01/14 18:59","death":24169,"hospitalized":68444,"hospitalizedDischarged":null,"dateChecked":"2021-01-14T23:59:00Z","totalTestsViral":15603776,"positiveTestsViral":1978821,"negativeTestsViral":13554101,"positiveCasesViral":1271326,"deathConfirmed":null,"deathProbable":null,"totalTestEncountersViral":17424558,"totalTestsPeopleViral":9447366,"totalTestsAntibody":650372,"positiveTestsAntibody":71851,"negativeTestsAntibody":578113,"totalTestsPeopleAntibody":630838,"positiveTestsPeopleAntibody":69600,"negativeTestsPeopleAntibody":560932,"totalTestsPeopleAntigen":null,"positiveTestsPeopleAntigen":null,"totalTestsAntigen":null,"positiveTestsAntigen":null,"fips":"12","positiveIncrease":16415,"negativeIncrease":39799,"total":9453469,"totalTestResultsIncrease":141762,"posNeg":9447366,"dataQualityGrade":null,"deathIncrease":188,"hospitalizedIncrease":433,"hash":"1b160686a105ef747844e2764c549026395177f4","commercialScore":0,"negativeRegularScore":0,"negativeScore":0,"positiveScore":0,"score":0,"grade":""},{"date":20210114,"state":"FL","positive":1503529,"probableCases":244482,"negative":7887623,"pending":6022,"totalTestResultsSource":"totalTestEncountersViral","totalTestResults":17282796,"hospitalizedCurrently":7762,"hospitalizedCumulative":68011,"inIcuCurrently":null,"inIcuCumulative":null,"onVentilatorCurrently":null,"onVentilatorCumulative":null,"recovered":null,"lastUpdateEt":"1/13/2021 23:59","dateModified":"2021-01-13T23:59:00Z","checkTimeEt":"01/13 18:59","death":23981,"hospitalized":68011,"hospitalizedDischarged":null,"dateChecked":"2021-01-13T23:59:00Z","totalTestsViral":15476773,"positiveTestsViral":1956768,"negativeTestsViral":13450244,"positiveCasesViral":1259047,"deathConfirmed":null,"deathProbable":null,"totalTestEncountersViral":17282796,"totalTestsPeopleViral":9391152,"totalTestsAntibody":650372,"positiveTestsAntibody":71851,"negativeTestsAntibody":578113,"totalTestsPeopleAntibody":630838,"positiveTestsPeopleAntibody":69600,"negativeTestsPeopleAntibody":560932,"totalTestsPeopleAntigen":null,"positiveTestsPeopleAntigen":null,"totalTestsAntigen":null,"positiveTestsAntigen":null,"fips":"12","positiveIncrease":13381,"negativeIncrease":37435,"total":9397174,"totalTestResultsIncrease":134756,"posNeg":9391152,"dataQualityGrade":null,"deathIncrease":222,"hospitalizedIncrease":413,"hash":"9f53ce39aead269d5578e7d54f14de8b8fc8d91e","commercialScore":0,"negativeRegularScore":0,"negativeScore":0,"positiveScore":0,"score":0,"grade":""},{"date":20210113,"state":"FL","positive":1490148,"probableCases":240802,"negative":7850188,"pending":5957,"totalTestResultsSource":"totalTestEncountersViral","totalTestResults":17148040,"hospitalizedCurrently":7584,"hospitalizedCumulative":67598,"inIcuCurrently":null,"inIcuCumulative":null,"onVentilatorCurrently":null,"onVentilatorCumulative":null,"recovered":null,"lastUpdateEt":"1/12/2021 23:59","dateModified":"2021-01-12T23:59:00Z","checkTimeEt":"01/12 18:59","death":23759,"hospitalized":67598,"hospitalizedDischarged":null,"dateChecked":"2021-01-12T23:59:00Z","totalTestsViral":15367290,"positiveTestsViral":1938562,"negativeTestsViral":13360126,"positiveCasesViral":1249346,"deathConfirmed":null,"deathProbable":null,"totalTestEncountersViral":17148040,"totalTestsPeopleViral":9340336,"totalTestsAntibody":650372,"positiveTestsAntibody":71851,"negativeTestsAntibody":578113,"totalTestsPeopleAntibody":630838,"positiveTestsPeopleAntibody":69600,"negativeTestsPeopleAntibody":560932,"totalTestsPeopleAntigen":null,"positiveTestsPeopleAntigen":null,"totalTestsAntigen":null,"positiveTestsAntigen":null,"fips":"12","positiveIncrease":13664,"negativeIncrease":39033,"total":9346293,"totalTestResultsIncrease":116070,"posNeg":9340336,"dataQualityGrade":null,"deathIncrease":174,"hospitalizedIncrease":440,"hash":"b5a077d0e761c9d3ec6ba3ef0b4a6a3436c38cd5","commercialScore":0,"negativeRegularScore":0,"negativeScore":0,"positiveScore":0,"score":0,"grade":""},{"date":20210112,"state":"FL","positive":1476484,"probableCases":236534,"negative":7811155,"pending":5835,"totalTestResultsSource":"totalTestEncountersViral","totalTestResults":17031970,"hospitalizedCurrently":7720,"hospitalizedCumulative":67158,"inIcuCurrently":null,"inIcuCumulative":null,"onVentilatorCurrently":null,"onVentilatorCumulative":null,"recovered":null,"lastUpdateEt":"1/11/2021 23:59","dateModified":"2021-01-11T23:59:00Z","checkTimeEt":"01/11 18:59","death":23585,"hospitalized":67158,"hospitalizedDischarged":null,"dateChecked":"2021-01-11T23:59:00Z","totalTestsViral":15261374,"positiveTestsViral":1920618,"negativeTestsViral":13272560,"positiveCasesViral":1239950,"deathConfirmed":null,"deathProbable":null,"totalTestEncountersViral":17031970,"totalTestsPeopleViral":9287639,"totalTestsAntibody":650372,"positiveTestsAntibody":71851,"negativeTestsAntibody":578113,"totalTestsPeopleAntibody":630838,"positiveTestsPeopleAntibody":69600,"negativeTestsPeopleAntibody":560932,"totalTestsPeopleAntigen":null,"positiveTestsPeopleAntigen":null,"totalTestsAntigen":null,"positiveTestsAntigen":null,"fips":"12","positiveIncrease":14526,"negativeIncrease":40252,"total":9293474,"totalTestResultsIncrease":117059,"posNeg":9287639,"dataQualityGrade":null,"deathIncrease":161,"hospitalizedIncrease":420,"hash":"79ea0a838b3789e477f52c19a8ac3add292a7c93","commercialScore":0,"negativeRegularScore":0,"negativeScore":0,"positiveScore":0,"score":0,"grade":""},{"date":20210111,"state":"FL","positive":1461958,"probableCases":232188,"negative":7770903,"pending":5740,"totalTestResultsSource":"totalTestEncountersViral","totalTestResults":16914911,"hospitalizedCurrently":7650,"hospitalizedCumulative":66738,"inIcuCurrently":null,"inIcuCumulative":null,"onVentilatorCurrently":null,"onVentilatorCumulative":null,"recovered":null,"lastUpdateEt":"1/10/2021 23:59","dateModified":"2021-01-10T23:59:00Z","checkTimeEt":"01/10 18:59","death":23424,"hospitalized":66738,"hospitalizedDischarged":null,"dateChecked":"2021-01-10T23:59:00Z","totalTestsViral":15148365,"positiveTestsViral":1901127,"negativeTestsViral":13179694,"positiveCasesViral":1229770,"deathConfirmed":null,"deathProbable":null,"totalTestEncountersViral":16914911,"totalTestsPeopleViral":9232861,"totalTestsAntibody":650372,"positiveTestsAntibody":71851,"negativeTestsAntibody":578113,"totalTestsPeopleAntibody":630838,"positiveTestsPeopleAntibody":69600,"negativeTestsPeopleAntibody":560932,"totalTestsPeopleAntigen":null,"positiveTestsPeopleAntigen":null,"totalTestsAntigen":null,"positiveTestsAntigen":null,"fips":"12","positiveIncrease":11338,"negativeIncrease":26775,"total":9238601,"totalTestResultsIncrease":96946,"posNeg":9232861,"dataQualityGrade":null,"deathIncrease":163,"hospitalizedIncrease":205,"hash":"249899e9c4e40d5c0a57e71b0f92906843217eb4","commercialScore":0,"negativeRegularScore":0,"negativeScore":0,"positiveScore":0,"score":0,"grade":""},{"date":20210110,"state":"FL","positive":1450620,"probableCases":229136,"negative":7744128,"pending":5689,"totalTestResultsSource":"totalTestEncountersViral","totalTestResults":16817965,"hospitalizedCurrently":7494,"hospitalizedCumulative":66533,"inIcuCurrently":null,"inIcuCumulative":null,"onVentilatorCurrently":null,"onVentilatorCumulative":null,"recovered":null,"lastUpdateEt":"1/9/2021 23:59","dateModified":"2021-01-09T23:59:00Z","checkTimeEt":"01/09 18:59","death":23261,"hospitalized":66533,"hospitalizedDischarged":null,"dateChecked":"2021-01-09T23:59:00Z","totalTestsViral":15054500,"positiveTestsViral":1885337,"negativeTestsViral":13101989,"positiveCasesViral":1221484,"deathConfirmed":null,"deathProbable":null,"totalTestEncountersViral":16817965,"totalTestsPeopleViral":9194748,"totalTestsAntibody":650372,"positiveTestsAntibody":71851,"negativeTestsAntibody":578113,"totalTestsPeopleAntibody":630838,"positiveTestsPeopleAntibody":69600,"negativeTestsPeopleAntibody":560932,"totalTestsPeopleAntigen":null,"positiveTestsPeopleAntigen":null,"totalTestsAntigen":null,"positiveTestsAntigen":null,"fips":"12","positiveIncrease":12041,"negativeIncrease":35722,"total":9200437,"totalTestResultsIncrease":102271,"posNeg":9194748,"dataQualityGrade":null,"deathIncrease":111,"hospitalizedIncrease":201,"hash":"be8bd5175ad03c75c57eeb268ca50c926e5edbfc","commercialScore":0,"negativeRegularScore":0,"negativeScore":0,"positiveScore":0,"score":0,"grade":""},{"date":20210109,"state":"FL","positive":1438579,"probableCases":226335,"negative":7708406,"pending":5635,"totalTestResultsSource":"totalTestEncountersViral","totalTestResults":16715694,"hospitalizedCurrently":7455,"hospitalizedCumulative":66332,"inIcuCurrently":null,"inIcuCumulative":null,"onVentilatorCurrently":null,"onVentilatorCumulative":null,"recovered":null,"lastUpdateEt":"1/8/2021 23:59","dateModified":"2021-01-08T23:59:00Z","checkTimeEt":"01/08 18:59","death":23150,"hospitalized":66332,"hospitalizedDischarged":null,"dateChecked":"2021-01-08T23:59:00Z","totalTestsViral":14959521,"positiveTestsViral":1868967,"negativeTestsViral":13023880,"positiveCasesViral":1212244,"deathConfirmed":null,"deathProbable":null,"totalTestEncountersViral":16715694,"totalTestsPeopleViral":9146985,"totalTestsAntibody":650372,"positiveTestsAntibody":71851,"negativeTestsAntibody":578113,"totalTestsPeopleAntibody":630838,"positiveTestsPeopleAntibody":69600,"negativeTestsPeopleAntibody":560932,"totalTestsPeopleAntigen":null,"positiveTestsPeopleAntigen":null,"totalTestsAntigen":null,"positiveTestsAntigen":null,"fips":"12","positiveIncrease":15069,"negativeIncrease":31803,"total":9152620,"totalTestResultsIncrease":122817,"posNeg":9146985,"dataQualityGrade":null,"deathIncrease":139,"hospitalizedIncrease":346,"hash":"7082a5b36e7b9b41286da3c44f0c553a6eedc2da","commercialScore":0,"negativeRegularScore":0,"negativeScore":0,"positiveScore":0,"score":0,"grade":""},{"date":20210108,"state":"FL","positive":1423510,"probableCases":221468,"negative":7676603,"pending":5538,"totalTestResultsSource":"totalTestEncountersViral","totalTestResults":16592877,"hospitalizedCurrently":7407,"hospitalizedCumulative":65986,"inIcuCurrently":null,"inIcuCumulative":null,"onVentilatorCurrently":null,"onVentilatorCumulative":null,"recovered":null,"lastUpdateEt":"1/7/2021 23:59","dateModified":"2021-01-07T23:59:00Z","checkTimeEt":"01/07 18:59","death":23011,"hospitalized":65986,"hospitalizedDischarged":null,"dateChecked":"2021-01-07T23:59:00Z","totalTestsViral":14852370,"positiveTestsViral":1849493,"negativeTestsViral":12936919,"positiveCasesViral":1202042,"deathConfirmed":null,"deathProbable":null,"totalTestEncountersViral":16592877,"totalTestsPeopleViral":9100113,"totalTestsAntibody":650372,"positiveTestsAntibody":71851,"negativeTestsAntibody":578113,"totalTestsPeopleAntibody":630838,"positiveTestsPeopleAntibody":69600,"negativeTestsPeopleAntibody":560932,"totalTestsPeopleAntigen":null,"positiveTestsPeopleAntigen":null,"totalTestsAntigen":null,"positiveTestsAntigen":null,"fips":"12","positiveIncrease":19136,"negativeIncrease":42110,"total":9105651,"totalTestResultsIncrease":141599,"posNeg":9100113,"dataQualityGrade":null,"deathIncrease":194,"hospitalizedIncrease":364,"hash":"54bed2a40687efe3ba6209898e318ec7c375ef25","commercialScore":0,"negativeRegularScore":0,"negativeScore":0,"positiveScore":0,"score":0,"grade":""},{"date":20210107,"state":"FL","positive":1404374,"probableCases":216755,"negative":7634493,"pending":5394,"totalTestResultsSource":"totalTestEncountersViral","totalTestResults":16451278,"hospitalizedCurrently":7327,"hospitalizedCumulative":65622,"inIcuCurrently":null,"inIcuCumulative":null,"onVentilatorCurrently":null,"onVentilatorCumulative":null,"recovered":null,"lastUpdateEt":"1/6/2021 23:59","dateModified":"2021-01-06T23:59:00Z","checkTimeEt":"01/06 18:59","death":22817,"hospitalized":65622,"hospitalizedDischarged":null,"dateChecked":"2021-01-06T23:59:00Z","totalTestsViral":14722693,"positiveTestsViral":1824592,"negativeTestsViral":12832829,"positiveCasesViral":1187619,"deathConfirmed":null,"deathProbable":null,"totalTestEncountersViral":16451278,"totalTestsPeopleViral":9038867,"totalTestsAntibody":650372,"positiveTestsAntibody":71851,"negativeTestsAntibody":578113,"totalTestsPeopleAntibody":630838,"positiveTestsPeopleAntibody":69600,"negativeTestsPeopleAntibody":560932,"totalTestsPeopleAntigen":null,"positiveTestsPeopleAntigen":null,"totalTestsAntigen":null,"positiveTestsAntigen":null,"fips":"12","positiveIncrease":19334,"negativeIncrease":42130,"total":9044261,"totalTestResultsIncrease":140840,"posNeg":9038867,"dataQualityGrade":null,"deathIncrease":170,"hospitalizedIncrease":390,"hash":"c6ee1d2a705377c64b5992244b226e8424bf4df9","commercialScore":0,"negativeRegularScore":0,"negativeScore":0,"positiveScore":0,"score":0,"grade":""},{"date":20210106,"state":"FL","positive":1385040,"probableCases":210630,"negative":7592363,"pending":5264,"totalTestResultsSource":"totalTestEncountersViral","totalTestResults":16310438,"hospitalizedCurrently":7303,"hospitalizedCumulative":65232,"inIcuCurrently":null,"inIcuCumulative":null,"onVentilatorCurrently":null,"onVentilatorCumulative":null,"recovered":null,"lastUpdateEt":"1/5/2021 23:59","dateModified":"2021-01-05T23:59:00Z","checkTimeEt":"01/05 18:59","death":22647,"hospitalized":65232,"hospitalizedDischarged":null,"dateChecked":"2021-01-05T23:59:00Z","totalTestsViral":14598971,"positiveTestsViral":1800408,"negativeTestsViral":12733963,"positiveCasesViral":1174410,"deathConfirmed":null,"deathProbable":null,"totalTestEncountersViral":16310438,"totalTestsPeopleViral":8977403,"totalTestsAntibody":650372,"positiveTestsAntibody":71851,"negativeTestsAntibody":578113,"totalTestsPeopleAntibody":630838,"positiveTestsPeopleAntibody":69600,"negativeTestsPeopleAntibody":560932,"totalTestsPeopleAntigen":null,"positiveTestsPeopleAntigen":null,"totalTestsAntigen":null,"positiveTestsAntigen":null,"fips":"12","positiveIncrease":17262,"negativeIncrease":38374,"total":8982667,"totalTestResultsIncrease":114362,"posNeg":8977403,"dataQualityGrade":null,"deathIncrease":132,"hospitalizedIncrease":449,"hash":"dfcc7f79c3aaf6eb643cb683d7d0e651963c8c39","commercialScore":0,"negativeRegularScore":0,"negativeScore":0,"positiveScore":0,"score":0,"grade":""},{"date":20210105,"state":"FL","positive":1367778,"probableCases":203932,"negative":7553989,"pending":5132,"totalTestResultsSource":"totalTestEncountersViral","totalTestResults":16196076,"hospitalizedCurrently":7345,"hospitalizedCumulative":64783,"inIcuCurrently":null,"inIcuCumulative":null,"onVentilatorCurrently":null,"onVentilatorCumulative":null,"recovered":null,"lastUpdateEt":"1/4/2021 23:59","dateModified":"2021-01-04T23:59:00Z","checkTimeEt":"01/04 18:59","death":22515,"hospitalized":64783,"hospitalizedDischarged":null,"dateChecked":"2021-01-04T23:59:00Z","totalTestsViral":14488819,"positiveTestsViral":1778813,"negativeTestsViral":12645924,"positiveCasesViral":1163846,"deathConfirmed":null,"deathProbable":null,"totalTestEncountersViral":16196076,"totalTestsPeopleViral":8921767,"totalTestsAntibody":650372,"positiveTestsAntibody":71851,"negativeTestsAntibody":578113,"totalTestsPeopleAntibody":630838,"positiveTestsPeopleAntibody":69600,"negativeTestsPeopleAntibody":560932,"totalTestsPeopleAntigen":null,"positiveTestsPeopleAntigen":null,"totalTestsAntigen":null,"positiveTestsAntigen":null,"fips":"12","positiveIncrease":15556,"negativeIncrease":33771,"total":8926899,"totalTestResultsIncrease":100188,"posNeg":8921767,"dataQualityGrade":null,"deathIncrease":100,"hospitalizedIncrease":386,"hash":"0f41be306022f8405259dddae3757f7b0594e697","commercialScore":0,"negativeRegularScore":0,"negativeScore":0,"positiveScore":0,"score":0,"grade":""},{"date":20210104,"state":"FL","positive":1352222,"probableCases":197637,"negative":7520218,"pending":4990,"totalTestResultsSource":"totalTestEncountersViral","totalTestResults":16095888,"hospitalizedCurrently":7238,"hospitalizedCumulative":64397,"inIcuCurrently":null,"inIcuCumulative":null,"onVentilatorCurrently":null,"onVentilatorCumulative":null,"recovered":null,"lastUpdateEt":"1/3/2021 23:59","dateModified":"2021-01-03T23:59:00Z","checkTimeEt":"01/03 18:59","death":22415,"hospitalized":64397,"hospitalizedDischarged":null,"dateChecked":"2021-01-03T23:59:00Z","totalTestsViral":14397053,"positiveTestsViral":1760357,"negativeTestsViral":12572955,"positiveCasesViral":1154585,"deathConfirmed":null,"deathProbable":null,"totalTestEncountersViral":16095888,"totalTestsPeopleViral":8872440,"totalTestsAntibody":650372,"positiveTestsAntibody":71851,"negativeTestsAntibody":578113,"totalTestsPeopleAntibody":630838,"positiveTestsPeopleAntibody":69600,"negativeTestsPeopleAntibody":560932,"totalTestsPeopleAntigen":null,"positiveTestsPeopleAntigen":null,"totalTestsAntigen":null,"positiveTestsAntigen":null,"fips":"12","positiveIncrease":10935,"negativeIncrease":22720,"total":8877430,"totalTestResultsIncrease":75287,"posNeg":8872440,"dataQualityGrade":null,"deathIncrease":105,"hospitalizedIncrease":181,"hash":"ad35900dfcb96374c254160879ffc7008f196637","commercialScore":0,"negativeRegularScore":0,"negativeScore":0,"positiveScore":0,"score":0,"grade":""},{"date":20210103,"state":"FL","positive":1341287,"probableCases":193737,"negative":7497498,"pending":4934,"totalTestResultsSource":"totalTestEncountersViral","totalTestResults":16020601,"hospitalizedCurrently":6969,"hospitalizedCumulative":64216,"inIcuCurrently":null,"inIcuCumulative":null,"onVentilatorCurrently":null,"onVentilatorCumulative":null,"recovered":null,"lastUpdateEt":"1/2/2021 23:59","dateModified":"2021-01-02T23:59:00Z","checkTimeEt":"01/02 18:59","death":22310,"hospitalized":64216,"hospitalizedDischarged":null,"dateChecked":"2021-01-02T23:59:00Z","totalTestsViral":14325426,"positiveTestsViral":1746256,"negativeTestsViral":12515766,"positiveCasesViral":1147550,"deathConfirmed":null,"deathProbable":null,"totalTestEncountersViral":16020601,"totalTestsPeopleViral":8838785,"totalTestsAntibody":650372,"positiveTestsAntibody":71851,"negativeTestsAntibody":578113,"totalTestsPeopleAntibody":630838,"positiveTestsPeopleAntibody":69600,"negativeTestsPeopleAntibody":560932,"totalTestsPeopleAntigen":null,"positiveTestsPeopleAntigen":null,"totalTestsAntigen":null,"positiveTestsAntigen":null,"fips":"12","positiveIncrease":10228,"negativeIncrease":24021,"total":8843719,"totalTestResultsIncrease":69851,"posNeg":8838785,"dataQualityGrade":null,"deathIncrease":100,"hospitalizedIncrease":187,"hash":"5c1f7efafa87ea875870e76ddd1847d9a3b8e48b","commercialScore":0,"negativeRegularScore":0,"negativeScore":0,"positiveScore":0,"score":0,"grade":""},{"date":20210102,"state":"FL","positive":1331059,"probableCases":189849,"negative":7473477,"pending":4881,"totalTestResultsSource":"totalTestEncountersViral","totalTestResults":15950750,"hospitalizedCurrently":6701,"hospitalizedCumulative":64029,"inIcuCurrently":null,"inIcuCumulative":null,"onVentilatorCurrently":null,"onVentilatorCumulative":null,"recovered":null,"lastUpdateEt":"1/1/2021 23:59","dateModified":"2021-01-01T23:59:00Z","checkTimeEt":"01/01 18:59","death":22210,"hospitalized":64029,"hospitalizedDischarged":null,"dateChecked":"2021-01-01T23:59:00Z","totalTestsViral":14258872,"positiveTestsViral":1732821,"negativeTestsViral":12462940,"positiveCasesViral":1141210,"deathConfirmed":null,"deathProbable":null,"totalTestEncountersViral":15950750,"totalTestsPeopleViral":8804536,"totalTestsAntibody":650372,"positiveTestsAntibody":71851,"negativeTestsAntibody":578113,"totalTestsPeopleAntibody":630838,"positiveTestsPeopleAntibody":69600,"negativeTestsPeopleAntibody":560932,"totalTestsPeopleAntigen":null,"positiveTestsPeopleAntigen":null,"totalTestsAntigen":null,"positiveTestsAntigen":null,"fips":"12","positiveIncrease":30531,"negativeIncrease":68413,"total":8809417,"totalTestResultsIncrease":247151,"posNeg":8804536,"dataQualityGrade":null,"deathIncrease":220,"hospitalizedIncrease":288,"hash":"9882b7e1d60d1fe8fbe5a4f1e4308bccb9659539","commercialScore":0,"negativeRegularScore":0,"negativeScore":0,"positiveScore":0,"score":0,"grade":""},{"date":20210101,"state":"FL","positive":1300528,"probableCases":182976,"negative":7405064,"pending":7010,"totalTestResultsSource":"totalTestEncountersViral","totalTestResults":15703599,"hospitalizedCurrently":6454,"hospitalizedCumulative":63741,"inIcuCurrently":null,"inIcuCumulative":null,"onVentilatorCurrently":null,"onVentilatorCumulative":null,"recovered":null,"lastUpdateEt":"1/1/2021 00:00","dateModified":"2021-01-01T00:00:00Z","checkTimeEt":"12/31 19:00","death":21990,"hospitalized":63741,"hospitalizedDischarged":null,"dateChecked":"2021-01-01T00:00:00Z","totalTestsViral":14041159,"positiveTestsViral":1692583,"negativeTestsViral":12286661,"positiveCasesViral":1117552,"deathConfirmed":null,"deathProbable":null,"totalTestEncountersViral":15703599,"totalTestsPeopleViral":8705592,"totalTestsAntibody":650372,"positiveTestsAntibody":71851,"negativeTestsAntibody":578113,"totalTestsPeopleAntibody":630838,"positiveTestsPeopleAntibody":69600,"negativeTestsPeopleAntibody":560932,"totalTestsPeopleAntigen":null,"positiveTestsPeopleAntigen":null,"totalTestsAntigen":null,"positiveTestsAntigen":null,"fips":"12","positiveIncrease":0,"negativeIncrease":0,"total":8712602,"totalTestResultsIncrease":0,"posNeg":8705592,"dataQualityGrade":null,"deathIncrease":0,"hospitalizedIncrease":0,"hash":"1276e7b59e47f37c2cd1c6ee845894e3dcf36056","commercialScore":0,"negativeRegularScore":0,"negativeScore":0,"positiveScore":0,"score":0,"grade":""},{"date":20201231,"state":"FL","positive":1300528,"probableCases":182976,"negative":7405064,"pending":7010,"totalTestResultsSource":"totalTestEncountersViral","totalTestResults":15703599,"hospitalizedCurrently":6363,"hospitalizedCumulative":63741,"inIcuCurrently":null,"inIcuCumulative":null,"onVentilatorCurrently":null,"onVentilatorCumulative":null,"recovered":null,"lastUpdateEt":"12/30/2020 23:59","dateModified":"2020-12-30T23:59:00Z","checkTimeEt":"12/30 18:59","death":21990,"hospitalized":63741,"hospitalizedDischarged":null,"dateChecked":"2020-12-30T23:59:00Z","totalTestsViral":14041159,"positiveTestsViral":1692583,"negativeTestsViral":12286661,"positiveCasesViral":1117552,"deathConfirmed":null,"deathProbable":null,"totalTestEncountersViral":15703599,"totalTestsPeopleViral":8705592,"totalTestsAntibody":650372,"positiveTestsAntibody":71851,"negativeTestsAntibody":578113,"totalTestsPeopleAntibody":630838,"positiveTestsPeopleAntibody":69600,"negativeTestsPeopleAntibody":560932,"totalTestsPeopleAntigen":null,"positiveTestsPeopleAntigen":null,"totalTestsAntigen":null,"positiveTestsAntigen":null,"fips":"12","positiveIncrease":16827,"negativeIncrease":44106,"total":8712602,"totalTestResultsIncrease":119229,"posNeg":8705592,"dataQualityGrade":null,"deathIncrease":133,"hospitalizedIncrease":366,"hash":"bb9e9c455a1b78a00ff04055021eb05a43793810","commercialScore":0,"negativeRegularScore":0,"negativeScore":0,"positiveScore":0,"score":0,"grade":""},{"date":20201230,"state":"FL","positive":1283701,"probableCases":176913,"negative":7360958,"pending":6956,"totalTestResultsSource":"totalTestEncountersViral","totalTestResults":15584370,"hospitalizedCurrently":6298,"hospitalizedCumulative":63375,"inIcuCurrently":null,"inIcuCumulative":null,"onVentilatorCurrently":null,"onVentilatorCumulative":null,"recovered":null,"lastUpdateEt":"12/29/2020 23:59","dateModified":"2020-12-29T23:59:00Z","checkTimeEt":"12/29 18:59","death":21857,"hospitalized":63375,"hospitalizedDischarged":null,"dateChecked":"2020-12-29T23:59:00Z","totalTestsViral":13927475,"positiveTestsViral":1671699,"negativeTestsViral":12194345,"positiveCasesViral":1106788,"deathConfirmed":null,"deathProbable":null,"totalTestEncountersViral":15584370,"totalTestsPeopleViral":8644659,"totalTestsAntibody":650372,"positiveTestsAntibody":71851,"negativeTestsAntibody":578113,"totalTestsPeopleAntibody":630838,"positiveTestsPeopleAntibody":69600,"negativeTestsPeopleAntibody":560932,"totalTestsPeopleAntigen":null,"positiveTestsPeopleAntigen":null,"totalTestsAntigen":null,"positiveTestsAntigen":null,"fips":"12","positiveIncrease":13638,"negativeIncrease":28033,"total":8651615,"totalTestResultsIncrease":140593,"posNeg":8644659,"dataQualityGrade":null,"deathIncrease":139,"hospitalizedIncrease":376,"hash":"3e88553a69e7c14e9f054354bcad9a5a40dfb6f3","commercialScore":0,"negativeRegularScore":0,"negativeScore":0,"positiveScore":0,"score":0,"grade":""},{"date":20201229,"state":"FL","positive":1270063,"probableCases":171264,"negative":7332925,"pending":6925,"totalTestResultsSource":"totalTestEncountersViral","totalTestResults":15443777,"hospitalizedCurrently":6280,"hospitalizedCumulative":62999,"inIcuCurrently":null,"inIcuCumulative":null,"onVentilatorCurrently":null,"onVentilatorCumulative":null,"recovered":null,"lastUpdateEt":"12/28/2020 23:59","dateModified":"2020-12-28T23:59:00Z","checkTimeEt":"12/28 18:59","death":21718,"hospitalized":62999,"hospitalizedDischarged":null,"dateChecked":"2020-12-28T23:59:00Z","totalTestsVira