[{"date":20210307,"state":"KS","positive":295861,"probableCases":null,"negative":974686,"pending":null,"totalTestResultsSource":"posNeg","totalTestResults":1270547,"hospitalizedCurrently":235,"hospitalizedCumulative":9387,"inIcuCurrently":50,"inIcuCumulative":2554,"onVentilatorCurrently":22,"onVentilatorCumulative":411,"recovered":null,"lastUpdateEt":"3/5/2021 10:00","dateModified":"2021-03-05T10:00:00Z","checkTimeEt":"03/05 05:00","death":4812,"hospitalized":9387,"hospitalizedDischarged":6473,"dateChecked":"2021-03-05T10:00:00Z","totalTestsViral":2525259,"positiveTestsViral":null,"negativeTestsViral":null,"positiveCasesViral":null,"deathConfirmed":null,"deathProbable":null,"totalTestEncountersViral":null,"totalTestsPeopleViral":1270547,"totalTestsAntibody":null,"positiveTestsAntibody":null,"negativeTestsAntibody":null,"totalTestsPeopleAntibody":null,"positiveTestsPeopleAntibody":null,"negativeTestsPeopleAntibody":null,"totalTestsPeopleAntigen":null,"positiveTestsPeopleAntigen":null,"totalTestsAntigen":602322,"positiveTestsAntigen":null,"fips":"20","positiveIncrease":0,"negativeIncrease":0,"total":1270547,"totalTestResultsIncrease":0,"posNeg":1270547,"dataQualityGrade":null,"deathIncrease":0,"hospitalizedIncrease":0,"hash":"71bcb3a00a03aa1b0c50376fdc9f22e1e9b5156b","commercialScore":0,"negativeRegularScore":0,"negativeScore":0,"positiveScore":0,"score":0,"grade":""},{"date":20210306,"state":"KS","positive":295861,"probableCases":null,"negative":974686,"pending":null,"totalTestResultsSource":"posNeg","totalTestResults":1270547,"hospitalizedCurrently":235,"hospitalizedCumulative":9387,"inIcuCurrently":50,"inIcuCumulative":2554,"onVentilatorCurrently":22,"onVentilatorCumulative":411,"recovered":null,"lastUpdateEt":"3/5/2021 10:00","dateModified":"2021-03-05T10:00:00Z","checkTimeEt":"03/05 05:00","death":4812,"hospitalized":9387,"hospitalizedDischarged":6473,"dateChecked":"2021-03-05T10:00:00Z","totalTestsViral":2525259,"positiveTestsViral":null,"negativeTestsViral":null,"positiveCasesViral":null,"deathConfirmed":null,"deathProbable":null,"totalTestEncountersViral":null,"totalTestsPeopleViral":1270547,"totalTestsAntibody":null,"positiveTestsAntibody":null,"negativeTestsAntibody":null,"totalTestsPeopleAntibody":null,"positiveTestsPeopleAntibody":null,"negativeTestsPeopleAntibody":null,"totalTestsPeopleAntigen":null,"positiveTestsPeopleAntigen":null,"totalTestsAntigen":602322,"positiveTestsAntigen":null,"fips":"20","positiveIncrease":0,"negativeIncrease":0,"total":1270547,"totalTestResultsIncrease":0,"posNeg":1270547,"dataQualityGrade":null,"deathIncrease":0,"hospitalizedIncrease":0,"hash":"33649b9a59196e11fd27d8c0b340131b5830cb0d","commercialScore":0,"negativeRegularScore":0,"negativeScore":0,"positiveScore":0,"score":0,"grade":""},{"date":20210305,"state":"KS","positive":295861,"probableCases":null,"negative":974686,"pending":null,"totalTestResultsSource":"posNeg","totalTestResults":1270547,"hospitalizedCurrently":235,"hospitalizedCumulative":9387,"inIcuCurrently":50,"inIcuCumulative":2554,"onVentilatorCurrently":22,"onVentilatorCumulative":411,"recovered":null,"lastUpdateEt":"3/5/2021 10:00","dateModified":"2021-03-05T10:00:00Z","checkTimeEt":"03/05 05:00","death":4812,"hospitalized":9387,"hospitalizedDischarged":6473,"dateChecked":"2021-03-05T10:00:00Z","totalTestsViral":2525259,"positiveTestsViral":null,"negativeTestsViral":null,"positiveCasesViral":null,"deathConfirmed":null,"deathProbable":null,"totalTestEncountersViral":null,"totalTestsPeopleViral":1270547,"totalTestsAntibody":null,"positiveTestsAntibody":null,"negativeTestsAntibody":null,"totalTestsPeopleAntibody":null,"positiveTestsPeopleAntibody":null,"negativeTestsPeopleAntibody":null,"totalTestsPeopleAntigen":null,"positiveTestsPeopleAntigen":null,"totalTestsAntigen":602322,"positiveTestsAntigen":null,"fips":"20","positiveIncrease":752,"negativeIncrease":5035,"total":1270547,"totalTestResultsIncrease":5787,"posNeg":1270547,"dataQualityGrade":null,"deathIncrease":-4,"hospitalizedIncrease":32,"hash":"f52a797d36b8f3b1adc4228e895e7c7b33defe41","commercialScore":0,"negativeRegularScore":0,"negativeScore":0,"positiveScore":0,"score":0,"grade":""},{"date":20210304,"state":"KS","positive":295109,"probableCases":null,"negative":969651,"pending":null,"totalTestResultsSource":"posNeg","totalTestResults":1264760,"hospitalizedCurrently":203,"hospitalizedCumulative":9355,"inIcuCurrently":59,"inIcuCumulative":2541,"onVentilatorCurrently":23,"onVentilatorCumulative":411,"recovered":null,"lastUpdateEt":"3/3/2021 10:00","dateModified":"2021-03-03T10:00:00Z","checkTimeEt":"03/03 05:00","death":4816,"hospitalized":9355,"hospitalizedDischarged":6431,"dateChecked":"2021-03-03T10:00:00Z","totalTestsViral":2504238,"positiveTestsViral":null,"negativeTestsViral":null,"positiveCasesViral":null,"deathConfirmed":null,"deathProbable":null,"totalTestEncountersViral":null,"totalTestsPeopleViral":1264760,"totalTestsAntibody":null,"positiveTestsAntibody":null,"negativeTestsAntibody":null,"totalTestsPeopleAntibody":null,"positiveTestsPeopleAntibody":null,"negativeTestsPeopleAntibody":null,"totalTestsPeopleAntigen":null,"positiveTestsPeopleAntigen":null,"totalTestsAntigen":594470,"positiveTestsAntigen":null,"fips":"20","positiveIncrease":0,"negativeIncrease":0,"total":1264760,"totalTestResultsIncrease":0,"posNeg":1264760,"dataQualityGrade":null,"deathIncrease":0,"hospitalizedIncrease":0,"hash":"c2d318368625fb1a7c4f5ac56262441f47473ce0","commercialScore":0,"negativeRegularScore":0,"negativeScore":0,"positiveScore":0,"score":0,"grade":""},{"date":20210303,"state":"KS","positive":295109,"probableCases":null,"negative":969651,"pending":null,"totalTestResultsSource":"posNeg","totalTestResults":1264760,"hospitalizedCurrently":203,"hospitalizedCumulative":9355,"inIcuCurrently":59,"inIcuCumulative":2541,"onVentilatorCurrently":23,"onVentilatorCumulative":411,"recovered":null,"lastUpdateEt":"3/3/2021 10:00","dateModified":"2021-03-03T10:00:00Z","checkTimeEt":"03/03 05:00","death":4816,"hospitalized":9355,"hospitalizedDischarged":6431,"dateChecked":"2021-03-03T10:00:00Z","totalTestsViral":2504238,"positiveTestsViral":null,"negativeTestsViral":null,"positiveCasesViral":null,"deathConfirmed":null,"deathProbable":null,"totalTestEncountersViral":null,"totalTestsPeopleViral":1264760,"totalTestsAntibody":null,"positiveTestsAntibody":null,"negativeTestsAntibody":null,"totalTestsPeopleAntibody":null,"positiveTestsPeopleAntibody":null,"negativeTestsPeopleAntibody":null,"totalTestsPeopleAntigen":null,"positiveTestsPeopleAntigen":null,"totalTestsAntigen":594470,"positiveTestsAntigen":null,"fips":"20","positiveIncrease":807,"negativeIncrease":4848,"total":1264760,"totalTestResultsIncrease":5655,"posNeg":1264760,"dataQualityGrade":null,"deathIncrease":73,"hospitalizedIncrease":65,"hash":"d7eeb092af172d1a9324696c91ce6f0b148ef93d","commercialScore":0,"negativeRegularScore":0,"negativeScore":0,"positiveScore":0,"score":0,"grade":""},{"date":20210302,"state":"KS","positive":294302,"probableCases":null,"negative":964803,"pending":null,"totalTestResultsSource":"posNeg","totalTestResults":1259105,"hospitalizedCurrently":165,"hospitalizedCumulative":9290,"inIcuCurrently":43,"inIcuCumulative":2521,"onVentilatorCurrently":16,"onVentilatorCumulative":411,"recovered":null,"lastUpdateEt":"3/1/2021 10:00","dateModified":"2021-03-01T10:00:00Z","checkTimeEt":"03/01 05:00","death":4743,"hospitalized":9290,"hospitalizedDischarged":6387,"dateChecked":"2021-03-01T10:00:00Z","totalTestsViral":2485181,"positiveTestsViral":null,"negativeTestsViral":null,"positiveCasesViral":null,"deathConfirmed":null,"deathProbable":null,"totalTestEncountersViral":null,"totalTestsPeopleViral":1259105,"totalTestsAntibody":null,"positiveTestsAntibody":null,"negativeTestsAntibody":null,"totalTestsPeopleAntibody":null,"positiveTestsPeopleAntibody":null,"negativeTestsPeopleAntibody":null,"totalTestsPeopleAntigen":null,"positiveTestsPeopleAntigen":null,"totalTestsAntigen":586346,"positiveTestsAntigen":null,"fips":"20","positiveIncrease":0,"negativeIncrease":0,"total":1259105,"totalTestResultsIncrease":0,"posNeg":1259105,"dataQualityGrade":null,"deathIncrease":0,"hospitalizedIncrease":0,"hash":"ee3dcb48123a34ab6cc4fda05f30ec0c7f04d07b","commercialScore":0,"negativeRegularScore":0,"negativeScore":0,"positiveScore":0,"score":0,"grade":""},{"date":20210301,"state":"KS","positive":294302,"probableCases":null,"negative":964803,"pending":null,"totalTestResultsSource":"posNeg","totalTestResults":1259105,"hospitalizedCurrently":165,"hospitalizedCumulative":9290,"inIcuCurrently":43,"inIcuCumulative":2521,"onVentilatorCurrently":16,"onVentilatorCumulative":411,"recovered":null,"lastUpdateEt":"3/1/2021 10:00","dateModified":"2021-03-01T10:00:00Z","checkTimeEt":"03/01 05:00","death":4743,"hospitalized":9290,"hospitalizedDischarged":6387,"dateChecked":"2021-03-01T10:00:00Z","totalTestsViral":2485181,"positiveTestsViral":null,"negativeTestsViral":null,"positiveCasesViral":null,"deathConfirmed":null,"deathProbable":null,"totalTestEncountersViral":null,"totalTestsPeopleViral":1259105,"totalTestsAntibody":null,"positiveTestsAntibody":null,"negativeTestsAntibody":null,"totalTestsPeopleAntibody":null,"positiveTestsPeopleAntibody":null,"negativeTestsPeopleAntibody":null,"totalTestsPeopleAntigen":null,"positiveTestsPeopleAntigen":null,"totalTestsAntigen":586346,"positiveTestsAntigen":null,"fips":"20","positiveIncrease":639,"negativeIncrease":4003,"total":1259105,"totalTestResultsIncrease":4642,"posNeg":1259105,"dataQualityGrade":null,"deathIncrease":8,"hospitalizedIncrease":41,"hash":"99faacaf6d4b4e754fffc633c0870f44b51283f8","commercialScore":0,"negativeRegularScore":0,"negativeScore":0,"positiveScore":0,"score":0,"grade":""},{"date":20210228,"state":"KS","positive":293663,"probableCases":null,"negative":960800,"pending":null,"totalTestResultsSource":"posNeg","totalTestResults":1254463,"hospitalizedCurrently":258,"hospitalizedCumulative":9249,"inIcuCurrently":63,"inIcuCumulative":2510,"onVentilatorCurrently":29,"onVentilatorCumulative":411,"recovered":null,"lastUpdateEt":"2/26/2021 10:00","dateModified":"2021-02-26T10:00:00Z","checkTimeEt":"02/26 05:00","death":4735,"hospitalized":9249,"hospitalizedDischarged":6343,"dateChecked":"2021-02-26T10:00:00Z","totalTestsViral":2468690,"positiveTestsViral":null,"negativeTestsViral":null,"positiveCasesViral":null,"deathConfirmed":null,"deathProbable":null,"totalTestEncountersViral":null,"totalTestsPeopleViral":1254463,"totalTestsAntibody":null,"positiveTestsAntibody":null,"negativeTestsAntibody":null,"totalTestsPeopleAntibody":null,"positiveTestsPeopleAntibody":null,"negativeTestsPeopleAntibody":null,"totalTestsPeopleAntigen":null,"positiveTestsPeopleAntigen":null,"totalTestsAntigen":580453,"positiveTestsAntigen":null,"fips":"20","positiveIncrease":0,"negativeIncrease":0,"total":1254463,"totalTestResultsIncrease":0,"posNeg":1254463,"dataQualityGrade":null,"deathIncrease":0,"hospitalizedIncrease":0,"hash":"610cbb40109a5de680c79232b35b88a3ead81c66","commercialScore":0,"negativeRegularScore":0,"negativeScore":0,"positiveScore":0,"score":0,"grade":""},{"date":20210227,"state":"KS","positive":293663,"probableCases":null,"negative":960800,"pending":null,"totalTestResultsSource":"posNeg","totalTestResults":1254463,"hospitalizedCurrently":258,"hospitalizedCumulative":9249,"inIcuCurrently":63,"inIcuCumulative":2510,"onVentilatorCurrently":29,"onVentilatorCumulative":411,"recovered":null,"lastUpdateEt":"2/26/2021 10:00","dateModified":"2021-02-26T10:00:00Z","checkTimeEt":"02/26 05:00","death":4735,"hospitalized":9249,"hospitalizedDischarged":6343,"dateChecked":"2021-02-26T10:00:00Z","totalTestsViral":2468690,"positiveTestsViral":null,"negativeTestsViral":null,"positiveCasesViral":null,"deathConfirmed":null,"deathProbable":null,"totalTestEncountersViral":null,"totalTestsPeopleViral":1254463,"totalTestsAntibody":null,"positiveTestsAntibody":null,"negativeTestsAntibody":null,"totalTestsPeopleAntibody":null,"positiveTestsPeopleAntibody":null,"negativeTestsPeopleAntibody":null,"totalTestsPeopleAntigen":null,"positiveTestsPeopleAntigen":null,"totalTestsAntigen":580453,"positiveTestsAntigen":null,"fips":"20","positiveIncrease":0,"negativeIncrease":0,"total":1254463,"totalTestResultsIncrease":0,"posNeg":1254463,"dataQualityGrade":null,"deathIncrease":0,"hospitalizedIncrease":0,"hash":"da84a730f15e829258f0238ca7a645682b87d261","commercialScore":0,"negativeRegularScore":0,"negativeScore":0,"positiveScore":0,"score":0,"grade":""},{"date":20210226,"state":"KS","positive":293663,"probableCases":null,"negative":960800,"pending":null,"totalTestResultsSource":"posNeg","totalTestResults":1254463,"hospitalizedCurrently":258,"hospitalizedCumulative":9249,"inIcuCurrently":63,"inIcuCumulative":2510,"onVentilatorCurrently":29,"onVentilatorCumulative":411,"recovered":null,"lastUpdateEt":"2/26/2021 10:00","dateModified":"2021-02-26T10:00:00Z","checkTimeEt":"02/26 05:00","death":4735,"hospitalized":9249,"hospitalizedDischarged":6343,"dateChecked":"2021-02-26T10:00:00Z","totalTestsViral":2468690,"positiveTestsViral":null,"negativeTestsViral":null,"positiveCasesViral":null,"deathConfirmed":null,"deathProbable":null,"totalTestEncountersViral":null,"totalTestsPeopleViral":1254463,"totalTestsAntibody":null,"positiveTestsAntibody":null,"negativeTestsAntibody":null,"totalTestsPeopleAntibody":null,"positiveTestsPeopleAntibody":null,"negativeTestsPeopleAntibody":null,"totalTestsPeopleAntigen":null,"positiveTestsPeopleAntigen":null,"totalTestsAntigen":580453,"positiveTestsAntigen":null,"fips":"20","positiveIncrease":826,"negativeIncrease":4869,"total":1254463,"totalTestResultsIncrease":5695,"posNeg":1254463,"dataQualityGrade":null,"deathIncrease":11,"hospitalizedIncrease":60,"hash":"3e5383781d11077dfb60415e87af11c03f748fd0","commercialScore":0,"negativeRegularScore":0,"negativeScore":0,"positiveScore":0,"score":0,"grade":""},{"date":20210225,"state":"KS","positive":292837,"probableCases":null,"negative":955931,"pending":null,"totalTestResultsSource":"posNeg","totalTestResults":1248768,"hospitalizedCurrently":214,"hospitalizedCumulative":9189,"inIcuCurrently":52,"inIcuCumulative":2482,"onVentilatorCurrently":22,"onVentilatorCumulative":411,"recovered":null,"lastUpdateEt":"2/24/2021 10:00","dateModified":"2021-02-24T10:00:00Z","checkTimeEt":"02/24 05:00","death":4724,"hospitalized":9189,"hospitalizedDischarged":6297,"dateChecked":"2021-02-24T10:00:00Z","totalTestsViral":2438740,"positiveTestsViral":null,"negativeTestsViral":null,"positiveCasesViral":null,"deathConfirmed":null,"deathProbable":null,"totalTestEncountersViral":null,"totalTestsPeopleViral":1248768,"totalTestsAntibody":null,"positiveTestsAntibody":null,"negativeTestsAntibody":null,"totalTestsPeopleAntibody":null,"positiveTestsPeopleAntibody":null,"negativeTestsPeopleAntibody":null,"totalTestsPeopleAntigen":null,"positiveTestsPeopleAntigen":null,"totalTestsAntigen":573408,"positiveTestsAntigen":null,"fips":"20","positiveIncrease":0,"negativeIncrease":0,"total":1248768,"totalTestResultsIncrease":0,"posNeg":1248768,"dataQualityGrade":null,"deathIncrease":0,"hospitalizedIncrease":0,"hash":"202ff3da248cd0208820727b6db209587c016b9f","commercialScore":0,"negativeRegularScore":0,"negativeScore":0,"positiveScore":0,"score":0,"grade":""},{"date":20210224,"state":"KS","positive":292837,"probableCases":null,"negative":955931,"pending":null,"totalTestResultsSource":"posNeg","totalTestResults":1248768,"hospitalizedCurrently":214,"hospitalizedCumulative":9189,"inIcuCurrently":52,"inIcuCumulative":2482,"onVentilatorCurrently":22,"onVentilatorCumulative":411,"recovered":null,"lastUpdateEt":"2/24/2021 10:00","dateModified":"2021-02-24T10:00:00Z","checkTimeEt":"02/24 05:00","death":4724,"hospitalized":9189,"hospitalizedDischarged":6297,"dateChecked":"2021-02-24T10:00:00Z","totalTestsViral":2438740,"positiveTestsViral":null,"negativeTestsViral":null,"positiveCasesViral":null,"deathConfirmed":null,"deathProbable":null,"totalTestEncountersViral":null,"totalTestsPeopleViral":1248768,"totalTestsAntibody":null,"positiveTestsAntibody":null,"negativeTestsAntibody":null,"totalTestsPeopleAntibody":null,"positiveTestsPeopleAntibody":null,"negativeTestsPeopleAntibody":null,"totalTestsPeopleAntigen":null,"positiveTestsPeopleAntigen":null,"totalTestsAntigen":573408,"positiveTestsAntigen":null,"fips":"20","positiveIncrease":1122,"negativeIncrease":4147,"total":1248768,"totalTestResultsIncrease":5269,"posNeg":1248768,"dataQualityGrade":null,"deathIncrease":81,"hospitalizedIncrease":86,"hash":"1749c2c3dfcdfd2b807da558e2835e8e078e804a","commercialScore":0,"negativeRegularScore":0,"negativeScore":0,"positiveScore":0,"score":0,"grade":""},{"date":20210223,"state":"KS","positive":291715,"probableCases":null,"negative":951784,"pending":null,"totalTestResultsSource":"posNeg","totalTestResults":1243499,"hospitalizedCurrently":214,"hospitalizedCumulative":9103,"inIcuCurrently":52,"inIcuCumulative":2466,"onVentilatorCurrently":22,"onVentilatorCumulative":411,"recovered":null,"lastUpdateEt":"2/22/2021 10:00","dateModified":"2021-02-22T10:00:00Z","checkTimeEt":"02/22 05:00","death":4643,"hospitalized":9103,"hospitalizedDischarged":6235,"dateChecked":"2021-02-22T10:00:00Z","totalTestsViral":2418896,"positiveTestsViral":null,"negativeTestsViral":null,"positiveCasesViral":null,"deathConfirmed":null,"deathProbable":null,"totalTestEncountersViral":null,"totalTestsPeopleViral":1243499,"totalTestsAntibody":null,"positiveTestsAntibody":null,"negativeTestsAntibody":null,"totalTestsPeopleAntibody":null,"positiveTestsPeopleAntibody":null,"negativeTestsPeopleAntibody":null,"totalTestsPeopleAntigen":null,"positiveTestsPeopleAntigen":null,"totalTestsAntigen":563612,"positiveTestsAntigen":null,"fips":"20","positiveIncrease":0,"negativeIncrease":0,"total":1243499,"totalTestResultsIncrease":0,"posNeg":1243499,"dataQualityGrade":null,"deathIncrease":0,"hospitalizedIncrease":0,"hash":"42fca6554e03fc3c73c7ba9e014f167eefbc8dbc","commercialScore":0,"negativeRegularScore":0,"negativeScore":0,"positiveScore":0,"score":0,"grade":""},{"date":20210222,"state":"KS","positive":291715,"probableCases":null,"negative":951784,"pending":null,"totalTestResultsSource":"posNeg","totalTestResults":1243499,"hospitalizedCurrently":214,"hospitalizedCumulative":9103,"inIcuCurrently":52,"inIcuCumulative":2466,"onVentilatorCurrently":22,"onVentilatorCumulative":411,"recovered":null,"lastUpdateEt":"2/22/2021 10:00","dateModified":"2021-02-22T10:00:00Z","checkTimeEt":"02/22 05:00","death":4643,"hospitalized":9103,"hospitalizedDischarged":6235,"dateChecked":"2021-02-22T10:00:00Z","totalTestsViral":2418896,"positiveTestsViral":null,"negativeTestsViral":null,"positiveCasesViral":null,"deathConfirmed":null,"deathProbable":null,"totalTestEncountersViral":null,"totalTestsPeopleViral":1243499,"totalTestsAntibody":null,"positiveTestsAntibody":null,"negativeTestsAntibody":null,"totalTestsPeopleAntibody":null,"positiveTestsPeopleAntibody":null,"negativeTestsPeopleAntibody":null,"totalTestsPeopleAntigen":null,"positiveTestsPeopleAntigen":null,"totalTestsAntigen":563612,"positiveTestsAntigen":null,"fips":"20","positiveIncrease":883,"negativeIncrease":4193,"total":1243499,"totalTestResultsIncrease":5076,"posNeg":1243499,"dataQualityGrade":null,"deathIncrease":29,"hospitalizedIncrease":32,"hash":"cefa7d405c85d247868631806a45e5d6025a73fc","commercialScore":0,"negativeRegularScore":0,"negativeScore":0,"positiveScore":0,"score":0,"grade":""},{"date":20210221,"state":"KS","positive":290832,"probableCases":null,"negative":947591,"pending":null,"totalTestResultsSource":"posNeg","totalTestResults":1238423,"hospitalizedCurrently":290,"hospitalizedCumulative":9071,"inIcuCurrently":82,"inIcuCumulative":2457,"onVentilatorCurrently":34,"onVentilatorCumulative":411,"recovered":null,"lastUpdateEt":"2/19/2021 10:00","dateModified":"2021-02-19T10:00:00Z","checkTimeEt":"02/19 05:00","death":4614,"hospitalized":9071,"hospitalizedDischarged":6206,"dateChecked":"2021-02-19T10:00:00Z","totalTestsViral":2403075,"positiveTestsViral":null,"negativeTestsViral":null,"positiveCasesViral":null,"deathConfirmed":null,"deathProbable":null,"totalTestEncountersViral":null,"totalTestsPeopleViral":1238423,"totalTestsAntibody":null,"positiveTestsAntibody":null,"negativeTestsAntibody":null,"totalTestsPeopleAntibody":null,"positiveTestsPeopleAntibody":null,"negativeTestsPeopleAntibody":null,"totalTestsPeopleAntigen":null,"positiveTestsPeopleAntigen":null,"totalTestsAntigen":558292,"positiveTestsAntigen":null,"fips":"20","positiveIncrease":0,"negativeIncrease":0,"total":1238423,"totalTestResultsIncrease":0,"posNeg":1238423,"dataQualityGrade":null,"deathIncrease":0,"hospitalizedIncrease":0,"hash":"974a92002590ec5b416c44dd36a2554c7c0428f8","commercialScore":0,"negativeRegularScore":0,"negativeScore":0,"positiveScore":0,"score":0,"grade":""},{"date":20210220,"state":"KS","positive":290832,"probableCases":null,"negative":947591,"pending":null,"totalTestResultsSource":"posNeg","totalTestResults":1238423,"hospitalizedCurrently":290,"hospitalizedCumulative":9071,"inIcuCurrently":82,"inIcuCumulative":2457,"onVentilatorCurrently":34,"onVentilatorCumulative":411,"recovered":null,"lastUpdateEt":"2/19/2021 10:00","dateModified":"2021-02-19T10:00:00Z","checkTimeEt":"02/19 05:00","death":4614,"hospitalized":9071,"hospitalizedDischarged":6206,"dateChecked":"2021-02-19T10:00:00Z","totalTestsViral":2403075,"positiveTestsViral":null,"negativeTestsViral":null,"positiveCasesViral":null,"deathConfirmed":null,"deathProbable":null,"totalTestEncountersViral":null,"totalTestsPeopleViral":1238423,"totalTestsAntibody":null,"positiveTestsAntibody":null,"negativeTestsAntibody":null,"totalTestsPeopleAntibody":null,"positiveTestsPeopleAntibody":null,"negativeTestsPeopleAntibody":null,"totalTestsPeopleAntigen":null,"positiveTestsPeopleAntigen":null,"totalTestsAntigen":558292,"positiveTestsAntigen":null,"fips":"20","positiveIncrease":0,"negativeIncrease":0,"total":1238423,"totalTestResultsIncrease":0,"posNeg":1238423,"dataQualityGrade":null,"deathIncrease":0,"hospitalizedIncrease":0,"hash":"9d13c7ec73367a873da744dead74b46bd794e2f1","commercialScore":0,"negativeRegularScore":0,"negativeScore":0,"positiveScore":0,"score":0,"grade":""},{"date":20210219,"state":"KS","positive":290832,"probableCases":null,"negative":947591,"pending":null,"totalTestResultsSource":"posNeg","totalTestResults":1238423,"hospitalizedCurrently":290,"hospitalizedCumulative":9071,"inIcuCurrently":82,"inIcuCumulative":2457,"onVentilatorCurrently":34,"onVentilatorCumulative":411,"recovered":null,"lastUpdateEt":"2/19/2021 10:00","dateModified":"2021-02-19T10:00:00Z","checkTimeEt":"02/19 05:00","death":4614,"hospitalized":9071,"hospitalizedDischarged":6206,"dateChecked":"2021-02-19T10:00:00Z","totalTestsViral":2403075,"positiveTestsViral":null,"negativeTestsViral":null,"positiveCasesViral":null,"deathConfirmed":null,"deathProbable":null,"totalTestEncountersViral":null,"totalTestsPeopleViral":1238423,"totalTestsAntibody":null,"positiveTestsAntibody":null,"negativeTestsAntibody":null,"totalTestsPeopleAntibody":null,"positiveTestsPeopleAntibody":null,"negativeTestsPeopleAntibody":null,"totalTestsPeopleAntigen":null,"positiveTestsPeopleAntigen":null,"totalTestsAntigen":558292,"positiveTestsAntigen":null,"fips":"20","positiveIncrease":2115,"negativeIncrease":7010,"total":1238423,"totalTestResultsIncrease":9125,"posNeg":1238423,"dataQualityGrade":null,"deathIncrease":93,"hospitalizedIncrease":69,"hash":"d7d69993075063a9cbfa68921cec69cc4d75f991","commercialScore":0,"negativeRegularScore":0,"negativeScore":0,"positiveScore":0,"score":0,"grade":""},{"date":20210218,"state":"KS","positive":288717,"probableCases":null,"negative":940581,"pending":null,"totalTestResultsSource":"posNeg","totalTestResults":1229298,"hospitalizedCurrently":300,"hospitalizedCumulative":9002,"inIcuCurrently":68,"inIcuCumulative":2432,"onVentilatorCurrently":34,"onVentilatorCumulative":411,"recovered":null,"lastUpdateEt":"2/17/2021 10:00","dateModified":"2021-02-17T10:00:00Z","checkTimeEt":"02/17 05:00","death":4521,"hospitalized":9002,"hospitalizedDischarged":6137,"dateChecked":"2021-02-17T10:00:00Z","totalTestsViral":2382523,"positiveTestsViral":null,"negativeTestsViral":null,"positiveCasesViral":null,"deathConfirmed":null,"deathProbable":null,"totalTestEncountersViral":null,"totalTestsPeopleViral":1229298,"totalTestsAntibody":null,"positiveTestsAntibody":null,"negativeTestsAntibody":null,"totalTestsPeopleAntibody":null,"positiveTestsPeopleAntibody":null,"negativeTestsPeopleAntibody":null,"totalTestsPeopleAntigen":null,"positiveTestsPeopleAntigen":null,"totalTestsAntigen":543223,"positiveTestsAntigen":null,"fips":"20","positiveIncrease":0,"negativeIncrease":0,"total":1229298,"totalTestResultsIncrease":0,"posNeg":1229298,"dataQualityGrade":null,"deathIncrease":0,"hospitalizedIncrease":0,"hash":"28cf4d09e2eb0ce19cd7dccf929daf1eb6d7e96c","commercialScore":0,"negativeRegularScore":0,"negativeScore":0,"positiveScore":0,"score":0,"grade":""},{"date":20210217,"state":"KS","positive":288717,"probableCases":null,"negative":940581,"pending":null,"totalTestResultsSource":"posNeg","totalTestResults":1229298,"hospitalizedCurrently":300,"hospitalizedCumulative":9002,"inIcuCurrently":68,"inIcuCumulative":2432,"onVentilatorCurrently":34,"onVentilatorCumulative":411,"recovered":null,"lastUpdateEt":"2/17/2021 10:00","dateModified":"2021-02-17T10:00:00Z","checkTimeEt":"02/17 05:00","death":4521,"hospitalized":9002,"hospitalizedDischarged":6137,"dateChecked":"2021-02-17T10:00:00Z","totalTestsViral":2382523,"positiveTestsViral":null,"negativeTestsViral":null,"positiveCasesViral":null,"deathConfirmed":null,"deathProbable":null,"totalTestEncountersViral":null,"totalTestsPeopleViral":1229298,"totalTestsAntibody":null,"positiveTestsAntibody":null,"negativeTestsAntibody":null,"totalTestsPeopleAntibody":null,"positiveTestsPeopleAntibody":null,"negativeTestsPeopleAntibody":null,"totalTestsPeopleAntigen":null,"positiveTestsPeopleAntigen":null,"totalTestsAntigen":543223,"positiveTestsAntigen":null,"fips":"20","positiveIncrease":1267,"negativeIncrease":3799,"total":1229298,"totalTestResultsIncrease":5066,"posNeg":1229298,"dataQualityGrade":null,"deathIncrease":115,"hospitalizedIncrease":79,"hash":"312b9605d1fcc9f3f1a52439eb76ae6978df1eb2","commercialScore":0,"negativeRegularScore":0,"negativeScore":0,"positiveScore":0,"score":0,"grade":""},{"date":20210216,"state":"KS","positive":287450,"probableCases":null,"negative":936782,"pending":null,"totalTestResultsSource":"posNeg","totalTestResults":1224232,"hospitalizedCurrently":279,"hospitalizedCumulative":8923,"inIcuCurrently":77,"inIcuCumulative":2421,"onVentilatorCurrently":38,"onVentilatorCumulative":411,"recovered":null,"lastUpdateEt":"2/15/2021 10:00","dateModified":"2021-02-15T10:00:00Z","checkTimeEt":"02/15 05:00","death":4406,"hospitalized":8923,"hospitalizedDischarged":6087,"dateChecked":"2021-02-15T10:00:00Z","totalTestsViral":2364665,"positiveTestsViral":null,"negativeTestsViral":null,"positiveCasesViral":null,"deathConfirmed":null,"deathProbable":null,"totalTestEncountersViral":null,"totalTestsPeopleViral":1224232,"totalTestsAntibody":null,"positiveTestsAntibody":null,"negativeTestsAntibody":null,"totalTestsPeopleAntibody":null,"positiveTestsPeopleAntibody":null,"negativeTestsPeopleAntibody":null,"totalTestsPeopleAntigen":null,"positiveTestsPeopleAntigen":null,"totalTestsAntigen":534602,"positiveTestsAntigen":null,"fips":"20","positiveIncrease":0,"negativeIncrease":0,"total":1224232,"totalTestResultsIncrease":0,"posNeg":1224232,"dataQualityGrade":null,"deathIncrease":0,"hospitalizedIncrease":0,"hash":"4ec5e5283abda2a790afb3f172b3b66ec0d4bd27","commercialScore":0,"negativeRegularScore":0,"negativeScore":0,"positiveScore":0,"score":0,"grade":""},{"date":20210215,"state":"KS","positive":287450,"probableCases":null,"negative":936782,"pending":null,"totalTestResultsSource":"posNeg","totalTestResults":1224232,"hospitalizedCurrently":279,"hospitalizedCumulative":8923,"inIcuCurrently":77,"inIcuCumulative":2421,"onVentilatorCurrently":38,"onVentilatorCumulative":411,"recovered":null,"lastUpdateEt":"2/15/2021 10:00","dateModified":"2021-02-15T10:00:00Z","checkTimeEt":"02/15 05:00","death":4406,"hospitalized":8923,"hospitalizedDischarged":6087,"dateChecked":"2021-02-15T10:00:00Z","totalTestsViral":2364665,"positiveTestsViral":null,"negativeTestsViral":null,"positiveCasesViral":null,"deathConfirmed":null,"deathProbable":null,"totalTestEncountersViral":null,"totalTestsPeopleViral":1224232,"totalTestsAntibody":null,"positiveTestsAntibody":null,"negativeTestsAntibody":null,"totalTestsPeopleAntibody":null,"positiveTestsPeopleAntibody":null,"negativeTestsPeopleAntibody":null,"totalTestsPeopleAntigen":null,"positiveTestsPeopleAntigen":null,"totalTestsAntigen":534602,"positiveTestsAntigen":null,"fips":"20","positiveIncrease":1348,"negativeIncrease":5295,"total":1224232,"totalTestResultsIncrease":6643,"posNeg":1224232,"dataQualityGrade":null,"deathIncrease":42,"hospitalizedIncrease":36,"hash":"cc9316b27efd8efacde2503e00feee6cc6002ad2","commercialScore":0,"negativeRegularScore":0,"negativeScore":0,"positiveScore":0,"score":0,"grade":""},{"date":20210214,"state":"KS","positive":286102,"probableCases":null,"negative":931487,"pending":null,"totalTestResultsSource":"posNeg","totalTestResults":1217589,"hospitalizedCurrently":348,"hospitalizedCumulative":8887,"inIcuCurrently":87,"inIcuCumulative":2413,"onVentilatorCurrently":42,"onVentilatorCumulative":411,"recovered":null,"lastUpdateEt":"2/12/2021 10:00","dateModified":"2021-02-12T10:00:00Z","checkTimeEt":"02/12 05:00","death":4364,"hospitalized":8887,"hospitalizedDischarged":6057,"dateChecked":"2021-02-12T10:00:00Z","totalTestsViral":2346453,"positiveTestsViral":null,"negativeTestsViral":null,"positiveCasesViral":null,"deathConfirmed":null,"deathProbable":null,"totalTestEncountersViral":null,"totalTestsPeopleViral":1217589,"totalTestsAntibody":null,"positiveTestsAntibody":null,"negativeTestsAntibody":null,"totalTestsPeopleAntibody":null,"positiveTestsPeopleAntibody":null,"negativeTestsPeopleAntibody":null,"totalTestsPeopleAntigen":null,"positiveTestsPeopleAntigen":null,"totalTestsAntigen":527485,"positiveTestsAntigen":null,"fips":"20","positiveIncrease":0,"negativeIncrease":0,"total":1217589,"totalTestResultsIncrease":0,"posNeg":1217589,"dataQualityGrade":null,"deathIncrease":0,"hospitalizedIncrease":0,"hash":"1d95fc510bde744da2c1cbd4adffe7692fa072c1","commercialScore":0,"negativeRegularScore":0,"negativeScore":0,"positiveScore":0,"score":0,"grade":""},{"date":20210213,"state":"KS","positive":286102,"probableCases":null,"negative":931487,"pending":null,"totalTestResultsSource":"posNeg","totalTestResults":1217589,"hospitalizedCurrently":348,"hospitalizedCumulative":8887,"inIcuCurrently":87,"inIcuCumulative":2413,"onVentilatorCurrently":42,"onVentilatorCumulative":411,"recovered":null,"lastUpdateEt":"2/12/2021 10:00","dateModified":"2021-02-12T10:00:00Z","checkTimeEt":"02/12 05:00","death":4364,"hospitalized":8887,"hospitalizedDischarged":6057,"dateChecked":"2021-02-12T10:00:00Z","totalTestsViral":2346453,"positiveTestsViral":null,"negativeTestsViral":null,"positiveCasesViral":null,"deathConfirmed":null,"deathProbable":null,"totalTestEncountersViral":null,"totalTestsPeopleViral":1217589,"totalTestsAntibody":null,"positiveTestsAntibody":null,"negativeTestsAntibody":null,"totalTestsPeopleAntibody":null,"positiveTestsPeopleAntibody":null,"negativeTestsPeopleAntibody":null,"totalTestsPeopleAntigen":null,"positiveTestsPeopleAntigen":null,"totalTestsAntigen":527485,"positiveTestsAntigen":null,"fips":"20","positiveIncrease":0,"negativeIncrease":0,"total":1217589,"totalTestResultsIncrease":0,"posNeg":1217589,"dataQualityGrade":null,"deathIncrease":0,"hospitalizedIncrease":0,"hash":"321c920bdd168b5f950da7d4700ecaf428c54cc7","commercialScore":0,"negativeRegularScore":0,"negativeScore":0,"positiveScore":0,"score":0,"grade":""},{"date":20210212,"state":"KS","positive":286102,"probableCases":null,"negative":931487,"pending":null,"totalTestResultsSource":"posNeg","totalTestResults":1217589,"hospitalizedCurrently":348,"hospitalizedCumulative":8887,"inIcuCurrently":87,"inIcuCumulative":2413,"onVentilatorCurrently":42,"onVentilatorCumulative":411,"recovered":null,"lastUpdateEt":"2/12/2021 10:00","dateModified":"2021-02-12T10:00:00Z","checkTimeEt":"02/12 05:00","death":4364,"hospitalized":8887,"hospitalizedDischarged":6057,"dateChecked":"2021-02-12T10:00:00Z","totalTestsViral":2346453,"positiveTestsViral":null,"negativeTestsViral":null,"positiveCasesViral":null,"deathConfirmed":null,"deathProbable":null,"totalTestEncountersViral":null,"totalTestsPeopleViral":1217589,"totalTestsAntibody":null,"positiveTestsAntibody":null,"negativeTestsAntibody":null,"totalTestsPeopleAntibody":null,"positiveTestsPeopleAntibody":null,"negativeTestsPeopleAntibody":null,"totalTestsPeopleAntigen":null,"positiveTestsPeopleAntigen":null,"totalTestsAntigen":527485,"positiveTestsAntigen":null,"fips":"20","positiveIncrease":1208,"negativeIncrease":4888,"total":1217589,"totalTestResultsIncrease":6096,"posNeg":1217589,"dataQualityGrade":null,"deathIncrease":61,"hospitalizedIncrease":47,"hash":"7ca565c577aa1f49a3bc89439feeab3f15258fc6","commercialScore":0,"negativeRegularScore":0,"negativeScore":0,"positiveScore":0,"score":0,"grade":""},{"date":20210211,"state":"KS","positive":284894,"probableCases":null,"negative":926599,"pending":null,"totalTestResultsSource":"posNeg","totalTestResults":1211493,"hospitalizedCurrently":377,"hospitalizedCumulative":8840,"inIcuCurrently":98,"inIcuCumulative":2401,"onVentilatorCurrently":41,"onVentilatorCumulative":411,"recovered":null,"lastUpdateEt":"2/10/2021 10:00","dateModified":"2021-02-10T10:00:00Z","checkTimeEt":"02/10 05:00","death":4303,"hospitalized":8840,"hospitalizedDischarged":6018,"dateChecked":"2021-02-10T10:00:00Z","totalTestsViral":2325356,"positiveTestsViral":null,"negativeTestsViral":null,"positiveCasesViral":null,"deathConfirmed":null,"deathProbable":null,"totalTestEncountersViral":null,"totalTestsPeopleViral":1211493,"totalTestsAntibody":null,"positiveTestsAntibody":null,"negativeTestsAntibody":null,"totalTestsPeopleAntibody":null,"positiveTestsPeopleAntibody":null,"negativeTestsPeopleAntibody":null,"totalTestsPeopleAntigen":null,"positiveTestsPeopleAntigen":null,"totalTestsAntigen":null,"positiveTestsAntigen":null,"fips":"20","positiveIncrease":0,"negativeIncrease":0,"total":1211493,"totalTestResultsIncrease":0,"posNeg":1211493,"dataQualityGrade":null,"deathIncrease":0,"hospitalizedIncrease":0,"hash":"5298f971709352eb975be2b25bbcab9650493a33","commercialScore":0,"negativeRegularScore":0,"negativeScore":0,"positiveScore":0,"score":0,"grade":""},{"date":20210210,"state":"KS","positive":284894,"probableCases":null,"negative":926599,"pending":null,"totalTestResultsSource":"posNeg","totalTestResults":1211493,"hospitalizedCurrently":377,"hospitalizedCumulative":8840,"inIcuCurrently":98,"inIcuCumulative":2401,"onVentilatorCurrently":41,"onVentilatorCumulative":411,"recovered":null,"lastUpdateEt":"2/10/2021 10:00","dateModified":"2021-02-10T10:00:00Z","checkTimeEt":"02/10 05:00","death":4303,"hospitalized":8840,"hospitalizedDischarged":6018,"dateChecked":"2021-02-10T10:00:00Z","totalTestsViral":2325356,"positiveTestsViral":null,"negativeTestsViral":null,"positiveCasesViral":null,"deathConfirmed":null,"deathProbable":null,"totalTestEncountersViral":null,"totalTestsPeopleViral":1211493,"totalTestsAntibody":null,"positiveTestsAntibody":null,"negativeTestsAntibody":null,"totalTestsPeopleAntibody":null,"positiveTestsPeopleAntibody":null,"negativeTestsPeopleAntibody":null,"totalTestsPeopleAntigen":null,"positiveTestsPeopleAntigen":null,"totalTestsAntigen":null,"positiveTestsAntigen":null,"fips":"20","positiveIncrease":1934,"negativeIncrease":5800,"total":1211493,"totalTestResultsIncrease":7734,"posNeg":1211493,"dataQualityGrade":null,"deathIncrease":106,"hospitalizedIncrease":91,"hash":"4dc5738de39d163dfdb072d68e6f46a9b3e1b947","commercialScore":0,"negativeRegularScore":0,"negativeScore":0,"positiveScore":0,"score":0,"grade":""},{"date":20210209,"state":"KS","positive":282960,"probableCases":null,"negative":920799,"pending":null,"totalTestResultsSource":"posNeg","totalTestResults":1203759,"hospitalizedCurrently":319,"hospitalizedCumulative":8749,"inIcuCurrently":93,"inIcuCumulative":2373,"onVentilatorCurrently":39,"onVentilatorCumulative":411,"recovered":null,"lastUpdateEt":"2/8/2021 10:00","dateModified":"2021-02-08T10:00:00Z","checkTimeEt":"02/08 05:00","death":4197,"hospitalized":8749,"hospitalizedDischarged":5954,"dateChecked":"2021-02-08T10:00:00Z","totalTestsViral":2301447,"positiveTestsViral":null,"negativeTestsViral":null,"positiveCasesViral":null,"deathConfirmed":null,"deathProbable":null,"totalTestEncountersViral":null,"totalTestsPeopleViral":1203759,"totalTestsAntibody":null,"positiveTestsAntibody":null,"negativeTestsAntibody":null,"totalTestsPeopleAntibody":null,"positiveTestsPeopleAntibody":null,"negativeTestsPeopleAntibody":null,"totalTestsPeopleAntigen":null,"positiveTestsPeopleAntigen":null,"totalTestsAntigen":null,"positiveTestsAntigen":null,"fips":"20","positiveIncrease":0,"negativeIncrease":0,"total":1203759,"totalTestResultsIncrease":0,"posNeg":1203759,"dataQualityGrade":null,"deathIncrease":0,"hospitalizedIncrease":0,"hash":"1632cfba4b9a1bfab6d1d933e4e30954d97a0337","commercialScore":0,"negativeRegularScore":0,"negativeScore":0,"positiveScore":0,"score":0,"grade":""},{"date":20210208,"state":"KS","positive":282960,"probableCases":null,"negative":920799,"pending":null,"totalTestResultsSource":"posNeg","totalTestResults":1203759,"hospitalizedCurrently":319,"hospitalizedCumulative":8749,"inIcuCurrently":93,"inIcuCumulative":2373,"onVentilatorCurrently":39,"onVentilatorCumulative":411,"recovered":null,"lastUpdateEt":"2/8/2021 10:00","dateModified":"2021-02-08T10:00:00Z","checkTimeEt":"02/08 05:00","death":4197,"hospitalized":8749,"hospitalizedDischarged":5954,"dateChecked":"2021-02-08T10:00:00Z","totalTestsViral":2301447,"positiveTestsViral":null,"negativeTestsViral":null,"positiveCasesViral":null,"deathConfirmed":null,"deathProbable":null,"totalTestEncountersViral":null,"totalTestsPeopleViral":1203759,"totalTestsAntibody":null,"positiveTestsAntibody":null,"negativeTestsAntibody":null,"totalTestsPeopleAntibody":null,"positiveTestsPeopleAntibody":null,"negativeTestsPeopleAntibody":null,"totalTestsPeopleAntigen":null,"positiveTestsPeopleAntigen":null,"totalTestsAntigen":null,"positiveTestsAntigen":null,"fips":"20","positiveIncrease":1398,"negativeIncrease":5308,"total":1203759,"totalTestResultsIncrease":6706,"posNeg":1203759,"dataQualityGrade":null,"deathIncrease":96,"hospitalizedIncrease":69,"hash":"fd4d36446a5dd8a3eb7adb3fda2d2871072c6889","commercialScore":0,"negativeRegularScore":0,"negativeScore":0,"positiveScore":0,"score":0,"grade":""},{"date":20210207,"state":"KS","positive":281562,"probableCases":null,"negative":915491,"pending":null,"totalTestResultsSource":"posNeg","totalTestResults":1197053,"hospitalizedCurrently":526,"hospitalizedCumulative":8680,"inIcuCurrently":129,"inIcuCumulative":2361,"onVentilatorCurrently":52,"onVentilatorCumulative":411,"recovered":null,"lastUpdateEt":"2/5/2021 10:00","dateModified":"2021-02-05T10:00:00Z","checkTimeEt":"02/05 05:00","death":4101,"hospitalized":8680,"hospitalizedDischarged":5912,"dateChecked":"2021-02-05T10:00:00Z","totalTestsViral":2282959,"positiveTestsViral":null,"negativeTestsViral":null,"positiveCasesViral":null,"deathConfirmed":null,"deathProbable":null,"totalTestEncountersViral":null,"totalTestsPeopleViral":1197053,"totalTestsAntibody":null,"positiveTestsAntibody":null,"negativeTestsAntibody":null,"totalTestsPeopleAntibody":null,"positiveTestsPeopleAntibody":null,"negativeTestsPeopleAntibody":null,"totalTestsPeopleAntigen":null,"positiveTestsPeopleAntigen":null,"totalTestsAntigen":null,"positiveTestsAntigen":null,"fips":"20","positiveIncrease":0,"negativeIncrease":0,"total":1197053,"totalTestResultsIncrease":0,"posNeg":1197053,"dataQualityGrade":null,"deathIncrease":0,"hospitalizedIncrease":0,"hash":"b67ec15a3db34221afab9b3e1bd57c5637ff2fa6","commercialScore":0,"negativeRegularScore":0,"negativeScore":0,"positiveScore":0,"score":0,"grade":""},{"date":20210206,"state":"KS","positive":281562,"probableCases":null,"negative":915491,"pending":null,"totalTestResultsSource":"posNeg","totalTestResults":1197053,"hospitalizedCurrently":526,"hospitalizedCumulative":8680,"inIcuCurrently":129,"inIcuCumulative":2361,"onVentilatorCurrently":52,"onVentilatorCumulative":411,"recovered":null,"lastUpdateEt":"2/5/2021 10:00","dateModified":"2021-02-05T10:00:00Z","checkTimeEt":"02/05 05:00","death":4101,"hospitalized":8680,"hospitalizedDischarged":5912,"dateChecked":"2021-02-05T10:00:00Z","totalTestsViral":2282959,"positiveTestsViral":null,"negativeTestsViral":null,"positiveCasesViral":null,"deathConfirmed":null,"deathProbable":null,"totalTestEncountersViral":null,"totalTestsPeopleViral":1197053,"totalTestsAntibody":null,"positiveTestsAntibody":null,"negativeTestsAntibody":null,"totalTestsPeopleAntibody":null,"positiveTestsPeopleAntibody":null,"negativeTestsPeopleAntibody":null,"totalTestsPeopleAntigen":null,"positiveTestsPeopleAntigen":null,"totalTestsAntigen":null,"positiveTestsAntigen":null,"fips":"20","positiveIncrease":0,"negativeIncrease":0,"total":1197053,"totalTestResultsIncrease":0,"posNeg":1197053,"dataQualityGrade":null,"deathIncrease":0,"hospitalizedIncrease":0,"hash":"ac2286d19077669732d6c5b91cf785bdd1ae6422","commercialScore":0,"negativeRegularScore":0,"negativeScore":0,"positiveScore":0,"score":0,"grade":""},{"date":20210205,"state":"KS","positive":281562,"probableCases":null,"negative":915491,"pending":null,"totalTestResultsSource":"posNeg","totalTestResults":1197053,"hospitalizedCurrently":526,"hospitalizedCumulative":8680,"inIcuCurrently":129,"inIcuCumulative":2361,"onVentilatorCurrently":52,"onVentilatorCumulative":411,"recovered":null,"lastUpdateEt":"2/5/2021 10:00","dateModified":"2021-02-05T10:00:00Z","checkTimeEt":"02/05 05:00","death":4101,"hospitalized":8680,"hospitalizedDischarged":5912,"dateChecked":"2021-02-05T10:00:00Z","totalTestsViral":2282959,"positiveTestsViral":null,"negativeTestsViral":null,"positiveCasesViral":null,"deathConfirmed":null,"deathProbable":null,"totalTestEncountersViral":null,"totalTestsPeopleViral":1197053,"totalTestsAntibody":null,"positiveTestsAntibody":null,"negativeTestsAntibody":null,"totalTestsPeopleAntibody":null,"positiveTestsPeopleAntibody":null,"negativeTestsPeopleAntibody":null,"totalTestsPeopleAntigen":null,"positiveTestsPeopleAntigen":null,"totalTestsAntigen":null,"positiveTestsAntigen":null,"fips":"20","positiveIncrease":2647,"negativeIncrease":7557,"total":1197053,"totalTestResultsIncrease":10204,"posNeg":1197053,"dataQualityGrade":null,"deathIncrease":206,"hospitalizedIncrease":102,"hash":"f47e6df48d7560bd921c474b7acf40fdf5ae08cc","commercialScore":0,"negativeRegularScore":0,"negativeScore":0,"positiveScore":0,"score":0,"grade":""},{"date":20210204,"state":"KS","positive":278915,"probableCases":null,"negative":907934,"pending":null,"totalTestResultsSource":"posNeg","totalTestResults":1186849,"hospitalizedCurrently":526,"hospitalizedCumulative":8578,"inIcuCurrently":129,"inIcuCumulative":2333,"onVentilatorCurrently":52,"onVentilatorCumulative":411,"recovered":null,"lastUpdateEt":"2/3/2021 10:00","dateModified":"2021-02-03T10:00:00Z","checkTimeEt":"02/03 05:00","death":3895,"hospitalized":8578,"hospitalizedDischarged":5810,"dateChecked":"2021-02-03T10:00:00Z","totalTestsViral":2248082,"positiveTestsViral":null,"negativeTestsViral":null,"positiveCasesViral":null,"deathConfirmed":null,"deathProbable":null,"totalTestEncountersViral":null,"totalTestsPeopleViral":1186849,"totalTestsAntibody":null,"positiveTestsAntibody":null,"negativeTestsAntibody":null,"totalTestsPeopleAntibody":null,"positiveTestsPeopleAntibody":null,"negativeTestsPeopleAntibody":null,"totalTestsPeopleAntigen":null,"positiveTestsPeopleAntigen":null,"totalTestsAntigen":null,"positiveTestsAntigen":null,"fips":"20","positiveIncrease":0,"negativeIncrease":0,"total":1186849,"totalTestResultsIncrease":0,"posNeg":1186849,"dataQualityGrade":null,"deathIncrease":0,"hospitalizedIncrease":0,"hash":"8abd30dfda03e579801ea48614674b3cbebcb1e4","commercialScore":0,"negativeRegularScore":0,"negativeScore":0,"positiveScore":0,"score":0,"grade":""},{"date":20210203,"state":"KS","positive":278915,"probableCases":null,"negative":907934,"pending":null,"totalTestResultsSource":"posNeg","totalTestResults":1186849,"hospitalizedCurrently":526,"hospitalizedCumulative":8578,"inIcuCurrently":129,"inIcuCumulative":2333,"onVentilatorCurrently":52,"onVentilatorCumulative":411,"recovered":null,"lastUpdateEt":"2/3/2021 10:00","dateModified":"2021-02-03T10:00:00Z","checkTimeEt":"02/03 05:00","death":3895,"hospitalized":8578,"hospitalizedDischarged":5810,"dateChecked":"2021-02-03T10:00:00Z","totalTestsViral":2248082,"positiveTestsViral":null,"negativeTestsViral":null,"positiveCasesViral":null,"deathConfirmed":null,"deathProbable":null,"totalTestEncountersViral":null,"totalTestsPeopleViral":1186849,"totalTestsAntibody":null,"positiveTestsAntibody":null,"negativeTestsAntibody":null,"totalTestsPeopleAntibody":null,"positiveTestsPeopleAntibody":null,"negativeTestsPeopleAntibody":null,"totalTestsPeopleAntigen":null,"positiveTestsPeopleAntigen":null,"totalTestsAntigen":null,"positiveTestsAntigen":null,"fips":"20","positiveIncrease":2247,"negativeIncrease":6985,"total":1186849,"totalTestResultsIncrease":9232,"posNeg":1186849,"dataQualityGrade":null,"deathIncrease":86,"hospitalizedIncrease":89,"hash":"c382a670d9a3159a0e31f96910f9e326f5cc3dd6","commercialScore":0,"negativeRegularScore":0,"negativeScore":0,"positiveScore":0,"score":0,"grade":""},{"date":20210202,"state":"KS","positive":276668,"probableCases":null,"negative":900949,"pending":null,"totalTestResultsSource":"posNeg","totalTestResults":1177617,"hospitalizedCurrently":381,"hospitalizedCumulative":8489,"inIcuCurrently":97,"inIcuCumulative":2311,"onVentilatorCurrently":48,"onVentilatorCumulative":412,"recovered":null,"lastUpdateEt":"2/1/2021 10:00","dateModified":"2021-02-01T10:00:00Z","checkTimeEt":"02/01 05:00","death":3809,"hospitalized":8489,"hospitalizedDischarged":5715,"dateChecked":"2021-02-01T10:00:00Z","totalTestsViral":2221814,"positiveTestsViral":null,"negativeTestsViral":null,"positiveCasesViral":null,"deathConfirmed":null,"deathProbable":null,"totalTestEncountersViral":null,"totalTestsPeopleViral":1177617,"totalTestsAntibody":null,"positiveTestsAntibody":null,"negativeTestsAntibody":null,"totalTestsPeopleAntibody":null,"positiveTestsPeopleAntibody":null,"negativeTestsPeopleAntibody":null,"totalTestsPeopleAntigen":null,"positiveTestsPeopleAntigen":null,"totalTestsAntigen":null,"positiveTestsAntigen":null,"fips":"20","positiveIncrease":0,"negativeIncrease":0,"total":1177617,"totalTestResultsIncrease":0,"posNeg":1177617,"dataQualityGrade":null,"deathIncrease":0,"hospitalizedIncrease":0,"hash":"33a832e74eb1df1107a37eba5c63369af6159f9e","commercialScore":0,"negativeRegularScore":0,"negativeScore":0,"positiveScore":0,"score":0,"grade":""},{"date":20210201,"state":"KS","positive":276668,"probableCases":null,"negative":900949,"pending":null,"totalTestResultsSource":"posNeg","totalTestResults":1177617,"hospitalizedCurrently":381,"hospitalizedCumulative":8489,"inIcuCurrently":97,"inIcuCumulative":2311,"onVentilatorCurrently":48,"onVentilatorCumulative":412,"recovered":null,"lastUpdateEt":"2/1/2021 10:00","dateModified":"2021-02-01T10:00:00Z","checkTimeEt":"02/01 05:00","death":3809,"hospitalized":8489,"hospitalizedDischarged":5715,"dateChecked":"2021-02-01T10:00:00Z","totalTestsViral":2221814,"positiveTestsViral":null,"negativeTestsViral":null,"positiveCasesViral":null,"deathConfirmed":null,"deathProbable":null,"totalTestEncountersViral":null,"totalTestsPeopleViral":1177617,"totalTestsAntibody":null,"positiveTestsAntibody":null,"negativeTestsAntibody":null,"totalTestsPeopleAntibody":null,"positiveTestsPeopleAntibody":null,"negativeTestsPeopleAntibody":null,"totalTestsPeopleAntigen":null,"positiveTestsPeopleAntigen":null,"totalTestsAntigen":null,"positiveTestsAntigen":null,"fips":"20","positiveIncrease":1983,"negativeIncrease":6911,"total":1177617,"totalTestResultsIncrease":8894,"posNeg":1177617,"dataQualityGrade":null,"deathIncrease":30,"hospitalizedIncrease":72,"hash":"88fb4b3de4e2d13d0f5aa8b4a4e3e8c24af88a92","commercialScore":0,"negativeRegularScore":0,"negativeScore":0,"positiveScore":0,"score":0,"grade":""},{"date":20210131,"state":"KS","positive":274685,"probableCases":null,"negative":894038,"pending":null,"totalTestResultsSource":"posNeg","totalTestResults":1168723,"hospitalizedCurrently":550,"hospitalizedCumulative":8417,"inIcuCurrently":145,"inIcuCumulative":2290,"onVentilatorCurrently":65,"onVentilatorCumulative":412,"recovered":null,"lastUpdateEt":"1/29/2021 10:00","dateModified":"2021-01-29T10:00:00Z","checkTimeEt":"01/29 05:00","death":3779,"hospitalized":8417,"hospitalizedDischarged":5647,"dateChecked":"2021-01-29T10:00:00Z","totalTestsViral":2194854,"positiveTestsViral":null,"negativeTestsViral":null,"positiveCasesViral":null,"deathConfirmed":null,"deathProbable":null,"totalTestEncountersViral":null,"totalTestsPeopleViral":1168723,"totalTestsAntibody":null,"positiveTestsAntibody":null,"negativeTestsAntibody":null,"totalTestsPeopleAntibody":null,"positiveTestsPeopleAntibody":null,"negativeTestsPeopleAntibody":null,"totalTestsPeopleAntigen":null,"positiveTestsPeopleAntigen":null,"totalTestsAntigen":null,"positiveTestsAntigen":null,"fips":"20","positiveIncrease":0,"negativeIncrease":0,"total":1168723,"totalTestResultsIncrease":0,"posNeg":1168723,"dataQualityGrade":null,"deathIncrease":0,"hospitalizedIncrease":0,"hash":"db7128b36dd9cda8825601ed0444a1a481b9a896","commercialScore":0,"negativeRegularScore":0,"negativeScore":0,"positiveScore":0,"score":0,"grade":""},{"date":20210130,"state":"KS","positive":274685,"probableCases":null,"negative":894038,"pending":null,"totalTestResultsSource":"posNeg","totalTestResults":1168723,"hospitalizedCurrently":550,"hospitalizedCumulative":8417,"inIcuCurrently":145,"inIcuCumulative":2290,"onVentilatorCurrently":65,"onVentilatorCumulative":412,"recovered":null,"lastUpdateEt":"1/29/2021 10:00","dateModified":"2021-01-29T10:00:00Z","checkTimeEt":"01/29 05:00","death":3779,"hospitalized":8417,"hospitalizedDischarged":5647,"dateChecked":"2021-01-29T10:00:00Z","totalTestsViral":2194854,"positiveTestsViral":null,"negativeTestsViral":null,"positiveCasesViral":null,"deathConfirmed":null,"deathProbable":null,"totalTestEncountersViral":null,"totalTestsPeopleViral":1168723,"totalTestsAntibody":null,"positiveTestsAntibody":null,"negativeTestsAntibody":null,"totalTestsPeopleAntibody":null,"positiveTestsPeopleAntibody":null,"negativeTestsPeopleAntibody":null,"totalTestsPeopleAntigen":null,"positiveTestsPeopleAntigen":null,"totalTestsAntigen":null,"positiveTestsAntigen":null,"fips":"20","positiveIncrease":0,"negativeIncrease":0,"total":1168723,"totalTestResultsIncrease":0,"posNeg":1168723,"dataQualityGrade":null,"deathIncrease":0,"hospitalizedIncrease":0,"hash":"c6d9635ad03ff8c9e3f0d624d6a2fd76e69037b6","commercialScore":0,"negativeRegularScore":0,"negativeScore":0,"positiveScore":0,"score":0,"grade":""},{"date":20210129,"state":"KS","positive":274685,"probableCases":null,"negative":894038,"pending":null,"totalTestResultsSource":"posNeg","totalTestResults":1168723,"hospitalizedCurrently":550,"hospitalizedCumulative":8417,"inIcuCurrently":145,"inIcuCumulative":2290,"onVentilatorCurrently":65,"onVentilatorCumulative":412,"recovered":null,"lastUpdateEt":"1/29/2021 10:00","dateModified":"2021-01-29T10:00:00Z","checkTimeEt":"01/29 05:00","death":3779,"hospitalized":8417,"hospitalizedDischarged":5647,"dateChecked":"2021-01-29T10:00:00Z","totalTestsViral":2194854,"positiveTestsViral":null,"negativeTestsViral":null,"positiveCasesViral":null,"deathConfirmed":null,"deathProbable":null,"totalTestEncountersViral":null,"totalTestsPeopleViral":1168723,"totalTestsAntibody":null,"positiveTestsAntibody":null,"negativeTestsAntibody":null,"totalTestsPeopleAntibody":null,"positiveTestsPeopleAntibody":null,"negativeTestsPeopleAntibody":null,"totalTestsPeopleAntigen":null,"positiveTestsPeopleAntigen":null,"totalTestsAntigen":null,"positiveTestsAntigen":null,"fips":"20","positiveIncrease":2168,"negativeIncrease":6779,"total":1168723,"totalTestResultsIncrease":8947,"posNeg":1168723,"dataQualityGrade":null,"deathIncrease":61,"hospitalizedIncrease":149,"hash":"fd144ba0bec97b5d1400062b16e49cca8f7ae20c","commercialScore":0,"negativeRegularScore":0,"negativeScore":0,"positiveScore":0,"score":0,"grade":""},{"date":20210128,"state":"KS","positive":272517,"probableCases":null,"negative":887259,"pending":null,"totalTestResultsSource":"posNeg","totalTestResults":1159776,"hospitalizedCurrently":649,"hospitalizedCumulative":8268,"inIcuCurrently":165,"inIcuCumulative":2259,"onVentilatorCurrently":74,"onVentilatorCumulative":412,"recovered":null,"lastUpdateEt":"1/27/2021 10:00","dateModified":"2021-01-27T10:00:00Z","checkTimeEt":"01/27 05:00","death":3718,"hospitalized":8268,"hospitalizedDischarged":5544,"dateChecked":"2021-01-27T10:00:00Z","totalTestsViral":2164543,"positiveTestsViral":null,"negativeTestsViral":null,"positiveCasesViral":null,"deathConfirmed":null,"deathProbable":null,"totalTestEncountersViral":null,"totalTestsPeopleViral":1159776,"totalTestsAntibody":null,"positiveTestsAntibody":null,"negativeTestsAntibody":null,"totalTestsPeopleAntibody":null,"positiveTestsPeopleAntibody":null,"negativeTestsPeopleAntibody":null,"totalTestsPeopleAntigen":null,"positiveTestsPeopleAntigen":null,"totalTestsAntigen":null,"positiveTestsAntigen":null,"fips":"20","positiveIncrease":0,"negativeIncrease":0,"total":1159776,"totalTestResultsIncrease":0,"posNeg":1159776,"dataQualityGrade":null,"deathIncrease":0,"hospitalizedIncrease":0,"hash":"6ba539229ec54b6fc16920b2c6a31d8ba1548cca","commercialScore":0,"negativeRegularScore":0,"negativeScore":0,"positiveScore":0,"score":0,"grade":""},{"date":20210127,"state":"KS","positive":272517,"probableCases":null,"negative":887259,"pending":null,"totalTestResultsSource":"posNeg","totalTestResults":1159776,"hospitalizedCurrently":649,"hospitalizedCumulative":8268,"inIcuCurrently":165,"inIcuCumulative":2259,"onVentilatorCurrently":74,"onVentilatorCumulative":412,"recovered":null,"lastUpdateEt":"1/27/2021 10:00","dateModified":"2021-01-27T10:00:00Z","checkTimeEt":"01/27 05:00","death":3718,"hospitalized":8268,"hospitalizedDischarged":5544,"dateChecked":"2021-01-27T10:00:00Z","totalTestsViral":2164543,"positiveTestsViral":null,"negativeTestsViral":null,"positiveCasesViral":null,"deathConfirmed":null,"deathProbable":null,"totalTestEncountersViral":null,"totalTestsPeopleViral":1159776,"totalTestsAntibody":null,"positiveTestsAntibody":null,"negativeTestsAntibody":null,"totalTestsPeopleAntibody":null,"positiveTestsPeopleAntibody":null,"negativeTestsPeopleAntibody":null,"totalTestsPeopleAntigen":null,"positiveTestsPeopleAntigen":null,"totalTestsAntigen":null,"positiveTestsAntigen":null,"fips":"20","positiveIncrease":3262,"negativeIncrease":8877,"total":1159776,"totalTestResultsIncrease":12139,"posNeg":1159776,"dataQualityGrade":null,"deathIncrease":96,"hospitalizedIncrease":151,"hash":"9c3cf00e279d5221679578b2d47c2c745e86fbb7","commercialScore":0,"negativeRegularScore":0,"negativeScore":0,"positiveScore":0,"score":0,"grade":""},{"date":20210126,"state":"KS","positive":269255,"probableCases":null,"negative":878382,"pending":null,"totalTestResultsSource":"posNeg","totalTestResults":1147637,"hospitalizedCurrently":708,"hospitalizedCumulative":8117,"inIcuCurrently":182,"inIcuCumulative":2210,"onVentilatorCurrently":66,"onVentilatorCumulative":412,"recovered":null,"lastUpdateEt":"1/25/2021 10:00","dateModified":"2021-01-25T10:00:00Z","checkTimeEt":"01/25 05:00","death":3622,"hospitalized":8117,"hospitalizedDischarged":5432,"dateChecked":"2021-01-25T10:00:00Z","totalTestsViral":null,"positiveTestsViral":null,"negativeTestsViral":null,"positiveCasesViral":null,"deathConfirmed":null,"deathProbable":null,"totalTestEncountersViral":null,"totalTestsPeopleViral":1147637,"totalTestsAntibody":null,"positiveTestsAntibody":null,"negativeTestsAntibody":null,"totalTestsPeopleAntibody":null,"positiveTestsPeopleAntibody":null,"negativeTestsPeopleAntibody":null,"totalTestsPeopleAntigen":null,"positiveTestsPeopleAntigen":null,"totalTestsAntigen":null,"positiveTestsAntigen":null,"fips":"20","positiveIncrease":0,"negativeIncrease":0,"total":1147637,"totalTestResultsIncrease":0,"posNeg":1147637,"dataQualityGrade":null,"deathIncrease":0,"hospitalizedIncrease":0,"hash":"b5607bcff168efa0b1b4341b186f4e72d55aee48","commercialScore":0,"negativeRegularScore":0,"negativeScore":0,"positiveScore":0,"score":0,"grade":""},{"date":20210125,"state":"KS","positive":269255,"probableCases":null,"negative":878382,"pending":null,"totalTestResultsSource":"posNeg","totalTestResults":1147637,"hospitalizedCurrently":708,"hospitalizedCumulative":8117,"inIcuCurrently":182,"inIcuCumulative":2210,"onVentilatorCurrently":66,"onVentilatorCumulative":412,"recovered":null,"lastUpdateEt":"1/25/2021 10:00","dateModified":"2021-01-25T10:00:00Z","checkTimeEt":"01/25 05:00","death":3622,"hospitalized":8117,"hospitalizedDischarged":5432,"dateChecked":"2021-01-25T10:00:00Z","totalTestsViral":null,"positiveTestsViral":null,"negativeTestsViral":null,"positiveCasesViral":null,"deathConfirmed":null,"deathProbable":null,"totalTestEncountersViral":null,"totalTestsPeopleViral":1147637,"totalTestsAntibody":null,"positiveTestsAntibody":null,"negativeTestsAntibody":null,"totalTestsPeopleAntibody":null,"positiveTestsPeopleAntibody":null,"negativeTestsPeopleAntibody":null,"totalTestsPeopleAntigen":null,"positiveTestsPeopleAntigen":null,"totalTestsAntigen":null,"positiveTestsAntigen":null,"fips":"20","positiveIncrease":2602,"negativeIncrease":7624,"total":1147637,"totalTestResultsIncrease":10226,"posNeg":1147637,"dataQualityGrade":null,"deathIncrease":24,"hospitalizedIncrease":76,"hash":"19df3a941179961f55dc1bee69eb4e558f277427","commercialScore":0,"negativeRegularScore":0,"negativeScore":0,"positiveScore":0,"score":0,"grade":""},{"date":20210124,"state":"KS","positive":266653,"probableCases":null,"negative":870758,"pending":null,"totalTestResultsSource":"posNeg","totalTestResults":1137411,"hospitalizedCurrently":708,"hospitalizedCumulative":8041,"inIcuCurrently":182,"inIcuCumulative":2181,"onVentilatorCurrently":66,"onVentilatorCumulative":412,"recovered":null,"lastUpdateEt":"1/22/2021 10:00","dateModified":"2021-01-22T10:00:00Z","checkTimeEt":"01/22 05:00","death":3598,"hospitalized":8041,"hospitalizedDischarged":5384,"dateChecked":"2021-01-22T10:00:00Z","totalTestsViral":null,"positiveTestsViral":null,"negativeTestsViral":null,"positiveCasesViral":null,"deathConfirmed":null,"deathProbable":null,"totalTestEncountersViral":null,"totalTestsPeopleViral":1137411,"totalTestsAntibody":null,"positiveTestsAntibody":null,"negativeTestsAntibody":null,"totalTestsPeopleAntibody":null,"positiveTestsPeopleAntibody":null,"negativeTestsPeopleAntibody":null,"totalTestsPeopleAntigen":null,"positiveTestsPeopleAntigen":null,"totalTestsAntigen":null,"positiveTestsAntigen":null,"fips":"20","positiveIncrease":0,"negativeIncrease":0,"total":1137411,"totalTestResultsIncrease":0,"posNeg":1137411,"dataQualityGrade":null,"deathIncrease":0,"hospitalizedIncrease":0,"hash":"aa27dcd61d4e66dddcc2b0857e05e4f714f0d34c","commercialScore":0,"negativeRegularScore":0,"negativeScore":0,"positiveScore":0,"score":0,"grade":""},{"date":20210123,"state":"KS","positive":266653,"probableCases":null,"negative":870758,"pending":null,"totalTestResultsSource":"posNeg","totalTestResults":1137411,"hospitalizedCurrently":708,"hospitalizedCumulative":8041,"inIcuCurrently":182,"inIcuCumulative":2181,"onVentilatorCurrently":66,"onVentilatorCumulative":412,"recovered":null,"lastUpdateEt":"1/22/2021 10:00","dateModified":"2021-01-22T10:00:00Z","checkTimeEt":"01/22 05:00","death":3598,"hospitalized":8041,"hospitalizedDischarged":5384,"dateChecked":"2021-01-22T10:00:00Z","totalTestsViral":null,"positiveTestsViral":null,"negativeTestsViral":null,"positiveCasesViral":null,"deathConfirmed":null,"deathProbable":null,"totalTestEncountersViral":null,"totalTestsPeopleViral":1137411,"totalTestsAntibody":null,"positiveTestsAntibody":null,"negativeTestsAntibody":null,"totalTestsPeopleAntibody":null,"positiveTestsPeopleAntibody":null,"negativeTestsPeopleAntibody":null,"totalTestsPeopleAntigen":null,"positiveTestsPeopleAntigen":null,"totalTestsAntigen":null,"positiveTestsAntigen":null,"fips":"20","positiveIncrease":0,"negativeIncrease":0,"total":1137411,"totalTestResultsIncrease":0,"posNeg":1137411,"dataQualityGrade":null,"deathIncrease":0,"hospitalizedIncrease":0,"hash":"64771d7070076a4ff7ec00b95b180a3c126c6240","commercialScore":0,"negativeRegularScore":0,"negativeScore":0,"positiveScore":0,"score":0,"grade":""},{"date":20210122,"state":"KS","positive":266653,"probableCases":null,"negative":870758,"pending":null,"totalTestResultsSource":"posNeg","totalTestResults":1137411,"hospitalizedCurrently":708,"hospitalizedCumulative":8041,"inIcuCurrently":182,"inIcuCumulative":2181,"onVentilatorCurrently":66,"onVentilatorCumulative":412,"recovered":null,"lastUpdateEt":"1/22/2021 10:00","dateModified":"2021-01-22T10:00:00Z","checkTimeEt":"01/22 05:00","death":3598,"hospitalized":8041,"hospitalizedDischarged":5384,"dateChecked":"2021-01-22T10:00:00Z","totalTestsViral":null,"positiveTestsViral":null,"negativeTestsViral":null,"positiveCasesViral":null,"deathConfirmed":null,"deathProbable":null,"totalTestEncountersViral":null,"totalTestsPeopleViral":1137411,"totalTestsAntibody":null,"positiveTestsAntibody":null,"negativeTestsAntibody":null,"totalTestsPeopleAntibody":null,"positiveTestsPeopleAntibody":null,"negativeTestsPeopleAntibody":null,"totalTestsPeopleAntigen":null,"positiveTestsPeopleAntigen":null,"totalTestsAntigen":null,"positiveTestsAntigen":null,"fips":"20","positiveIncrease":3241,"negativeIncrease":8465,"total":1137411,"totalTestResultsIncrease":11706,"posNeg":1137411,"dataQualityGrade":null,"deathIncrease":23,"hospitalizedIncrease":111,"hash":"6ac8c689075962981d2e08643c7fe4f3f43172b5","commercialScore":0,"negativeRegularScore":0,"negativeScore":0,"positiveScore":0,"score":0,"grade":""},{"date":20210121,"state":"KS","positive":263412,"probableCases":null,"negative":862293,"pending":null,"totalTestResultsSource":"posNeg","totalTestResults":1125705,"hospitalizedCurrently":708,"hospitalizedCumulative":7930,"inIcuCurrently":182,"inIcuCumulative":2141,"onVentilatorCurrently":66,"onVentilatorCumulative":413,"recovered":null,"lastUpdateEt":"1/20/2021 10:00","dateModified":"2021-01-20T10:00:00Z","checkTimeEt":"01/20 05:00","death":3575,"hospitalized":7930,"hospitalizedDischarged":5302,"dateChecked":"2021-01-20T10:00:00Z","totalTestsViral":null,"positiveTestsViral":null,"negativeTestsViral":null,"positiveCasesViral":null,"deathConfirmed":null,"deathProbable":null,"totalTestEncountersViral":null,"totalTestsPeopleViral":1125705,"totalTestsAntibody":null,"positiveTestsAntibody":null,"negativeTestsAntibody":null,"totalTestsPeopleAntibody":null,"positiveTestsPeopleAntibody":null,"negativeTestsPeopleAntibody":null,"totalTestsPeopleAntigen":null,"positiveTestsPeopleAntigen":null,"totalTestsAntigen":null,"positiveTestsAntigen":null,"fips":"20","positiveIncrease":0,"negativeIncrease":0,"total":1125705,"totalTestResultsIncrease":0,"posNeg":1125705,"dataQualityGrade":null,"deathIncrease":0,"hospitalizedIncrease":0,"hash":"fed821e2b1968c9275c89256bb23643b103fa34e","commercialScore":0,"negativeRegularScore":0,"negativeScore":0,"positiveScore":0,"score":0,"grade":""},{"date":20210120,"state":"KS","positive":263412,"probableCases":null,"negative":862293,"pending":null,"totalTestResultsSource":"posNeg","totalTestResults":1125705,"hospitalizedCurrently":708,"hospitalizedCumulative":7930,"inIcuCurrently":182,"inIcuCumulative":2141,"onVentilatorCurrently":66,"onVentilatorCumulative":413,"recovered":null,"lastUpdateEt":"1/20/2021 10:00","dateModified":"2021-01-20T10:00:00Z","checkTimeEt":"01/20 05:00","death":3575,"hospitalized":7930,"hospitalizedDischarged":5302,"dateChecked":"2021-01-20T10:00:00Z","totalTestsViral":null,"positiveTestsViral":null,"negativeTestsViral":null,"positiveCasesViral":null,"deathConfirmed":null,"deathProbable":null,"totalTestEncountersViral":null,"totalTestsPeopleViral":1125705,"totalTestsAntibody":null,"positiveTestsAntibody":null,"negativeTestsAntibody":null,"totalTestsPeopleAntibody":null,"positiveTestsPeopleAntibody":null,"negativeTestsPeopleAntibody":null,"totalTestsPeopleAntigen":null,"positiveTestsPeopleAntigen":null,"totalTestsAntigen":null,"positiveTestsAntigen":null,"fips":"20","positiveIncrease":3590,"negativeIncrease":8349,"total":1125705,"totalTestResultsIncrease":11939,"posNeg":1125705,"dataQualityGrade":null,"deathIncrease":50,"hospitalizedIncrease":123,"hash":"0864674f21790ac0a4c394dbe6a1718d5e19a31a","commercialScore":0,"negativeRegularScore":0,"negativeScore":0,"positiveScore":0,"score":0,"grade":""},{"date":20210119,"state":"KS","positive":259822,"probableCases":null,"negative":853944,"pending":null,"totalTestResultsSource":"posNeg","totalTestResults":1113766,"hospitalizedCurrently":599,"hospitalizedCumulative":7807,"inIcuCurrently":168,"inIcuCumulative":2098,"onVentilatorCurrently":61,"onVentilatorCumulative":413,"recovered":null,"lastUpdateEt":"1/18/2021 10:00","dateModified":"2021-01-18T10:00:00Z","checkTimeEt":"01/18 05:00","death":3525,"hospitalized":7807,"hospitalizedDischarged":5215,"dateChecked":"2021-01-18T10:00:00Z","totalTestsViral":null,"positiveTestsViral":null,"negativeTestsViral":null,"positiveCasesViral":null,"deathConfirmed":null,"deathProbable":null,"totalTestEncountersViral":null,"totalTestsPeopleViral":1113766,"totalTestsAntibody":null,"positiveTestsAntibody":null,"negativeTestsAntibody":null,"totalTestsPeopleAntibody":null,"positiveTestsPeopleAntibody":null,"negativeTestsPeopleAntibody":null,"totalTestsPeopleAntigen":null,"positiveTestsPeopleAntigen":null,"totalTestsAntigen":null,"positiveTestsAntigen":null,"fips":"20","positiveIncrease":0,"negativeIncrease":0,"total":1113766,"totalTestResultsIncrease":0,"posNeg":1113766,"dataQualityGrade":null,"deathIncrease":0,"hospitalizedIncrease":0,"hash":"300bc082ec2c3cba1fe0899a5cec12cc67aa56e2","commercialScore":0,"negativeRegularScore":0,"negativeScore":0,"positiveScore":0,"score":0,"grade":""},{"date":20210118,"state":"KS","positive":259822,"probableCases":null,"negative":853944,"pending":null,"totalTestResultsSource":"posNeg","totalTestResults":1113766,"hospitalizedCurrently":599,"hospitalizedCumulative":7807,"inIcuCurrently":168,"inIcuCumulative":2098,"onVentilatorCurrently":61,"onVentilatorCumulative":413,"recovered":null,"lastUpdateEt":"1/18/2021 10:00","dateModified":"2021-01-18T10:00:00Z","checkTimeEt":"01/18 05:00","death":3525,"hospitalized":7807,"hospitalizedDischarged":5215,"dateChecked":"2021-01-18T10:00:00Z","totalTestsViral":null,"positiveTestsViral":null,"negativeTestsViral":null,"positiveCasesViral":null,"deathConfirmed":null,"deathProbable":null,"totalTestEncountersViral":null,"totalTestsPeopleViral":1113766,"totalTestsAntibody":null,"positiveTestsAntibody":null,"negativeTestsAntibody":null,"totalTestsPeopleAntibody":null,"positiveTestsPeopleAntibody":null,"negativeTestsPeopleAntibody":null,"totalTestsPeopleAntigen":null,"positiveTestsPeopleAntigen":null,"totalTestsAntigen":null,"positiveTestsAntigen":null,"fips":"20","positiveIncrease":3688,"negativeIncrease":9713,"total":1113766,"totalTestResultsIncrease":13401,"posNeg":1113766,"dataQualityGrade":null,"deathIncrease":23,"hospitalizedIncrease":94,"hash":"315b852ba68f7abc6b882b1d74dbf759da9c401d","commercialScore":0,"negativeRegularScore":0,"negativeScore":0,"positiveScore":0,"score":0,"grade":""},{"date":20210117,"state":"KS","positive":256134,"probableCases":null,"negative":844231,"pending":null,"totalTestResultsSource":"posNeg","totalTestResults":1100365,"hospitalizedCurrently":776,"hospitalizedCumulative":7713,"inIcuCurrently":201,"inIcuCumulative":2068,"onVentilatorCurrently":67,"onVentilatorCumulative":413,"recovered":null,"lastUpdateEt":"1/15/2021 10:00","dateModified":"2021-01-15T10:00:00Z","checkTimeEt":"01/15 05:00","death":3502,"hospitalized":7713,"hospitalizedDischarged":5138,"dateChecked":"2021-01-15T10:00:00Z","totalTestsViral":null,"positiveTestsViral":null,"negativeTestsViral":null,"positiveCasesViral":null,"deathConfirmed":null,"deathProbable":null,"totalTestEncountersViral":null,"totalTestsPeopleViral":1100365,"totalTestsAntibody":null,"positiveTestsAntibody":null,"negativeTestsAntibody":null,"totalTestsPeopleAntibody":null,"positiveTestsPeopleAntibody":null,"negativeTestsPeopleAntibody":null,"totalTestsPeopleAntigen":null,"positiveTestsPeopleAntigen":null,"totalTestsAntigen":null,"positiveTestsAntigen":null,"fips":"20","positiveIncrease":0,"negativeIncrease":0,"total":1100365,"totalTestResultsIncrease":0,"posNeg":1100365,"dataQualityGrade":null,"deathIncrease":0,"hospitalizedIncrease":0,"hash":"b1bcb12495df6bb5badb59423769e5ae5acbd123","commercialScore":0,"negativeRegularScore":0,"negativeScore":0,"positiveScore":0,"score":0,"grade":""},{"date":20210116,"state":"KS","positive":256134,"probableCases":null,"negative":844231,"pending":null,"totalTestResultsSource":"posNeg","totalTestResults":1100365,"hospitalizedCurrently":776,"hospitalizedCumulative":7713,"inIcuCurrently":201,"inIcuCumulative":2068,"onVentilatorCurrently":67,"onVentilatorCumulative":413,"recovered":null,"lastUpdateEt":"1/15/2021 10:00","dateModified":"2021-01-15T10:00:00Z","checkTimeEt":"01/15 05:00","death":3502,"hospitalized":7713,"hospitalizedDischarged":5138,"dateChecked":"2021-01-15T10:00:00Z","totalTestsViral":null,"positiveTestsViral":null,"negativeTestsViral":null,"positiveCasesViral":null,"deathConfirmed":null,"deathProbable":null,"totalTestEncountersViral":null,"totalTestsPeopleViral":1100365,"totalTestsAntibody":null,"positiveTestsAntibody":null,"negativeTestsAntibody":null,"totalTestsPeopleAntibody":null,"positiveTestsPeopleAntibody":null,"negativeTestsPeopleAntibody":null,"totalTestsPeopleAntigen":null,"positiveTestsPeopleAntigen":null,"totalTestsAntigen":null,"positiveTestsAntigen":null,"fips":"20","positiveIncrease":0,"negativeIncrease":0,"total":1100365,"totalTestResultsIncrease":0,"posNeg":1100365,"dataQualityGrade":null,"deathIncrease":0,"hospitalizedIncrease":0,"hash":"cf929128e3fc6920345817e81fb61d43295b58f3","commercialScore":0,"negativeRegularScore":0,"negativeScore":0,"positiveScore":0,"score":0,"grade":""},{"date":20210115,"state":"KS","positive":256134,"probableCases":null,"negative":844231,"pending":null,"totalTestResultsSource":"posNeg","totalTestResults":1100365,"hospitalizedCurrently":776,"hospitalizedCumulative":7713,"inIcuCurrently":201,"inIcuCumulative":2068,"onVentilatorCurrently":67,"onVentilatorCumulative":413,"recovered":null,"lastUpdateEt":"1/15/2021 10:00","dateModified":"2021-01-15T10:00:00Z","checkTimeEt":"01/15 05:00","death":3502,"hospitalized":7713,"hospitalizedDischarged":5138,"dateChecked":"2021-01-15T10:00:00Z","totalTestsViral":null,"positiveTestsViral":null,"negativeTestsViral":null,"positiveCasesViral":null,"deathConfirmed":null,"deathProbable":null,"totalTestEncountersViral":null,"totalTestsPeopleViral":1100365,"totalTestsAntibody":null,"positiveTestsAntibody":null,"negativeTestsAntibody":null,"totalTestsPeopleAntibody":null,"positiveTestsPeopleAntibody":null,"negativeTestsPeopleAntibody":null,"totalTestsPeopleAntigen":null,"positiveTestsPeopleAntigen":null,"totalTestsAntigen":null,"positiveTestsAntigen":null,"fips":"20","positiveIncrease":4093,"negativeIncrease":12340,"total":1100365,"totalTestResultsIncrease":16433,"posNeg":1100365,"dataQualityGrade":null,"deathIncrease":147,"hospitalizedIncrease":173,"hash":"e7986b72abd11ad4b812d5a283e54b19b3aef4b3","commercialScore":0,"negativeRegularScore":0,"negativeScore":0,"positiveScore":0,"score":0,"grade":""},{"date":20210114,"state":"KS","positive":252041,"probableCases":null,"negative":831891,"pending":null,"totalTestResultsSource":"posNeg","totalTestResults":1083932,"hospitalizedCurrently":892,"hospitalizedCumulative":7540,"inIcuCurrently":217,"inIcuCumulative":2027,"onVentilatorCurrently":65,"onVentilatorCumulative":413,"recovered":null,"lastUpdateEt":"1/13/2021 00:00","dateModified":"2021-01-13T00:00:00Z","checkTimeEt":"01/12 19:00","death":3355,"hospitalized":7540,"hospitalizedDischarged":5026,"dateChecked":"2021-01-13T00:00:00Z","totalTestsViral":null,"positiveTestsViral":null,"negativeTestsViral":null,"positiveCasesViral":null,"deathConfirmed":null,"deathProbable":null,"totalTestEncountersViral":null,"totalTestsPeopleViral":1083932,"totalTestsAntibody":null,"positiveTestsAntibody":null,"negativeTestsAntibody":null,"totalTestsPeopleAntibody":null,"positiveTestsPeopleAntibody":null,"negativeTestsPeopleAntibody":null,"totalTestsPeopleAntigen":null,"positiveTestsPeopleAntigen":null,"totalTestsAntigen":null,"positiveTestsAntigen":null,"fips":"20","positiveIncrease":0,"negativeIncrease":0,"total":1083932,"totalTestResultsIncrease":0,"posNeg":1083932,"dataQualityGrade":null,"deathIncrease":0,"hospitalizedIncrease":0,"hash":"4b6869514393eb2819df06c67522cc8f58ea79cc","commercialScore":0,"negativeRegularScore":0,"negativeScore":0,"positiveScore":0,"score":0,"grade":""},{"date":20210113,"state":"KS","positive":252041,"probableCases":null,"negative":831891,"pending":null,"totalTestResultsSource":"posNeg","totalTestResults":1083932,"hospitalizedCurrently":892,"hospitalizedCumulative":7540,"inIcuCurrently":217,"inIcuCumulative":2027,"onVentilatorCurrently":65,"onVentilatorCumulative":413,"recovered":null,"lastUpdateEt":"1/13/2021 00:00","dateModified":"2021-01-13T00:00:00Z","checkTimeEt":"01/12 19:00","death":3355,"hospitalized":7540,"hospitalizedDischarged":5026,"dateChecked":"2021-01-13T00:00:00Z","totalTestsViral":null,"positiveTestsViral":null,"negativeTestsViral":null,"positiveCasesViral":null,"deathConfirmed":null,"deathProbable":null,"totalTestEncountersViral":null,"totalTestsPeopleViral":1083932,"totalTestsAntibody":null,"positiveTestsAntibody":null,"negativeTestsAntibody":null,"totalTestsPeopleAntibody":null,"positiveTestsPeopleAntibody":null,"negativeTestsPeopleAntibody":null,"totalTestsPeopleAntigen":null,"positiveTestsPeopleAntigen":null,"totalTestsAntigen":null,"positiveTestsAntigen":null,"fips":"20","positiveIncrease":4539,"negativeIncrease":12877,"total":1083932,"totalTestResultsIncrease":17416,"posNeg":1083932,"dataQualityGrade":null,"deathIncrease":100,"hospitalizedIncrease":189,"hash":"3b7f94a3bec7030a17ce6595d1c4bb614eab13cd","commercialScore":0,"negativeRegularScore":0,"negativeScore":0,"positiveScore":0,"score":0,"grade":""},{"date":20210112,"state":"KS","positive":247502,"probableCases":null,"negative":819014,"pending":null,"totalTestResultsSource":"posNeg","totalTestResults":1066516,"hospitalizedCurrently":590,"hospitalizedCumulative":7351,"inIcuCurrently":156,"inIcuCumulative":1981,"onVentilatorCurrently":48,"onVentilatorCumulative":413,"recovered":null,"lastUpdateEt":"1/11/2021 10:00","dateModified":"2021-01-11T10:00:00Z","checkTimeEt":"01/11 05:00","death":3255,"hospitalized":7351,"hospitalizedDischarged":4896,"dateChecked":"2021-01-11T10:00:00Z","totalTestsViral":null,"positiveTestsViral":null,"negativeTestsViral":null,"positiveCasesViral":null,"deathConfirmed":null,"deathProbable":null,"totalTestEncountersViral":null,"totalTestsPeopleViral":1066516,"totalTestsAntibody":null,"positiveTestsAntibody":null,"negativeTestsAntibody":null,"totalTestsPeopleAntibody":null,"positiveTestsPeopleAntibody":null,"negativeTestsPeopleAntibody":null,"totalTestsPeopleAntigen":null,"positiveTestsPeopleAntigen":null,"totalTestsAntigen":null,"positiveTestsAntigen":null,"fips":"20","positiveIncrease":0,"negativeIncrease":0,"total":1066516,"totalTestResultsIncrease":0,"posNeg":1066516,"dataQualityGrade":null,"deathIncrease":0,"hospitalizedIncrease":0,"hash":"a06e6cee9d6fe3f03e23f2a85e5affd7eb588bb1","commercialScore":0,"negativeRegularScore":0,"negativeScore":0,"positiveScore":0,"score":0,"grade":""},{"date":20210111,"state":"KS","positive":247502,"probableCases":null,"negative":819014,"pending":null,"totalTestResultsSource":"posNeg","totalTestResults":1066516,"hospitalizedCurrently":590,"hospitalizedCumulative":7351,"inIcuCurrently":156,"inIcuCumulative":1981,"onVentilatorCurrently":48,"onVentilatorCumulative":413,"recovered":null,"lastUpdateEt":"1/11/2021 10:00","dateModified":"2021-01-11T10:00:00Z","checkTimeEt":"01/11 05:00","death":3255,"hospitalized":7351,"hospitalizedDischarged":4896,"dateChecked":"2021-01-11T10:00:00Z","totalTestsViral":null,"positiveTestsViral":null,"negativeTestsViral":null,"positiveCasesViral":null,"deathConfirmed":null,"deathProbable":null,"totalTestEncountersViral":null,"totalTestsPeopleViral":1066516,"totalTestsAntibody":null,"positiveTestsAntibody":null,"negativeTestsAntibody":null,"totalTestsPeopleAntibody":null,"positiveTestsPeopleAntibody":null,"negativeTestsPeopleAntibody":null,"totalTestsPeopleAntigen":null,"positiveTestsPeopleAntigen":null,"totalTestsAntigen":null,"positiveTestsAntigen":null,"fips":"20","positiveIncrease":5180,"negativeIncrease":10129,"total":1066516,"totalTestResultsIncrease":15309,"posNeg":1066516,"dataQualityGrade":null,"deathIncrease":107,"hospitalizedIncrease":94,"hash":"126e83cb6a7595a7bbfc530a85b9549ffced6c43","commercialScore":0,"negativeRegularScore":0,"negativeScore":0,"positiveScore":0,"score":0,"grade":""},{"date":20210110,"state":"KS","positive":242322,"probableCases":null,"negative":808885,"pending":null,"totalTestResultsSource":"posNeg","totalTestResults":1051207,"hospitalizedCurrently":869,"hospitalizedCumulative":7257,"inIcuCurrently":221,"inIcuCumulative":1955,"onVentilatorCurrently":61,"onVentilatorCumulative":413,"recovered":null,"lastUpdateEt":"1/8/2021 10:00","dateModified":"2021-01-08T10:00:00Z","checkTimeEt":"01/08 05:00","death":3148,"hospitalized":7257,"hospitalizedDischarged":4838,"dateChecked":"2021-01-08T10:00:00Z","totalTestsViral":null,"positiveTestsViral":null,"negativeTestsViral":null,"positiveCasesViral":null,"deathConfirmed":null,"deathProbable":null,"totalTestEncountersViral":null,"totalTestsPeopleViral":1051207,"totalTestsAntibody":null,"positiveTestsAntibody":null,"negativeTestsAntibody":null,"totalTestsPeopleAntibody":null,"positiveTestsPeopleAntibody":null,"negativeTestsPeopleAntibody":null,"totalTestsPeopleAntigen":null,"positiveTestsPeopleAntigen":null,"totalTestsAntigen":null,"positiveTestsAntigen":null,"fips":"20","positiveIncrease":0,"negativeIncrease":0,"total":1051207,"totalTestResultsIncrease":0,"posNeg":1051207,"dataQualityGrade":null,"deathIncrease":0,"hospitalizedIncrease":0,"hash":"20eacdc7a3743043d1b3c29641a85fa3091b0170","commercialScore":0,"negativeRegularScore":0,"negativeScore":0,"positiveScore":0,"score":0,"grade":""},{"date":20210109,"state":"KS","positive":242322,"probableCases":null,"negative":808885,"pending":null,"totalTestResultsSource":"posNeg","totalTestResults":1051207,"hospitalizedCurrently":869,"hospitalizedCumulative":7257,"inIcuCurrently":221,"inIcuCumulative":1955,"onVentilatorCurrently":61,"onVentilatorCumulative":413,"recovered":null,"lastUpdateEt":"1/8/2021 10:00","dateModified":"2021-01-08T10:00:00Z","checkTimeEt":"01/08 05:00","death":3148,"hospitalized":7257,"hospitalizedDischarged":4838,"dateChecked":"2021-01-08T10:00:00Z","totalTestsViral":null,"positiveTestsViral":null,"negativeTestsViral":null,"positiveCasesViral":null,"deathConfirmed":null,"deathProbable":null,"totalTestEncountersViral":null,"totalTestsPeopleViral":1051207,"totalTestsAntibody":null,"positiveTestsAntibody":null,"negativeTestsAntibody":null,"totalTestsPeopleAntibody":null,"positiveTestsPeopleAntibody":null,"negativeTestsPeopleAntibody":null,"totalTestsPeopleAntigen":null,"positiveTestsPeopleAntigen":null,"totalTestsAntigen":null,"positiveTestsAntigen":null,"fips":"20","positiveIncrease":0,"negativeIncrease":0,"total":1051207,"totalTestResultsIncrease":0,"posNeg":1051207,"dataQualityGrade":null,"deathIncrease":0,"hospitalizedIncrease":0,"hash":"e54bd845abe5589e3bcdae6415c3f762e2a062b4","commercialScore":0,"negativeRegularScore":0,"negativeScore":0,"positiveScore":0,"score":0,"grade":""},{"date":20210108,"state":"KS","positive":242322,"probableCases":null,"negative":808885,"pending":null,"totalTestResultsSource":"posNeg","totalTestResults":1051207,"hospitalizedCurrently":869,"hospitalizedCumulative":7257,"inIcuCurrently":221,"inIcuCumulative":1955,"onVentilatorCurrently":61,"onVentilatorCumulative":413,"recovered":null,"lastUpdateEt":"1/8/2021 10:00","dateModified":"2021-01-08T10:00:00Z","checkTimeEt":"01/08 05:00","death":3148,"hospitalized":7257,"hospitalizedDischarged":4838,"dateChecked":"2021-01-08T10:00:00Z","totalTestsViral":null,"positiveTestsViral":null,"negativeTestsViral":null,"positiveCasesViral":null,"deathConfirmed":null,"deathProbable":null,"totalTestEncountersViral":null,"totalTestsPeopleViral":1051207,"totalTestsAntibody":null,"positiveTestsAntibody":null,"negativeTestsAntibody":null,"totalTestsPeopleAntibody":null,"positiveTestsPeopleAntibody":null,"negativeTestsPeopleAntibody":null,"totalTestsPeopleAntigen":null,"positiveTestsPeopleAntigen":null,"totalTestsAntigen":null,"positiveTestsAntigen":null,"fips":"20","positiveIncrease":5504,"negativeIncrease":8184,"total":1051207,"totalTestResultsIncrease":13688,"posNeg":1051207,"dataQualityGrade":null,"deathIncrease":121,"hospitalizedIncrease":144,"hash":"dedf4ca19f619262827b20ababe412faf642ca77","commercialScore":0,"negativeRegularScore":0,"negativeScore":0,"positiveScore":0,"score":0,"grade":""},{"date":20210107,"state":"KS","positive":236818,"probableCases":null,"negative":800701,"pending":null,"totalTestResultsSource":"posNeg","totalTestResults":1037519,"hospitalizedCurrently":838,"hospitalizedCumulative":7113,"inIcuCurrently":206,"inIcuCumulative":1928,"onVentilatorCurrently":70,"onVentilatorCumulative":413,"recovered":null,"lastUpdateEt":"1/6/2021 10:00","dateModified":"2021-01-06T10:00:00Z","checkTimeEt":"01/06 05:00","death":3027,"hospitalized":7113,"hospitalizedDischarged":4745,"dateChecked":"2021-01-06T10:00:00Z","totalTestsViral":null,"positiveTestsViral":null,"negativeTestsViral":null,"positiveCasesViral":null,"deathConfirmed":null,"deathProbable":null,"totalTestEncountersViral":null,"totalTestsPeopleViral":1037519,"totalTestsAntibody":null,"positiveTestsAntibody":null,"negativeTestsAntibody":null,"totalTestsPeopleAntibody":null,"positiveTestsPeopleAntibody":null,"negativeTestsPeopleAntibody":null,"totalTestsPeopleAntigen":null,"positiveTestsPeopleAntigen":null,"totalTestsAntigen":null,"positiveTestsAntigen":null,"fips":"20","positiveIncrease":0,"negativeIncrease":0,"total":1037519,"totalTestResultsIncrease":0,"posNeg":1037519,"dataQualityGrade":null,"deathIncrease":0,"hospitalizedIncrease":0,"hash":"1abb242dcf0a6590d28e347176b66ab32d447f6a","commercialScore":0,"negativeRegularScore":0,"negativeScore":0,"positiveScore":0,"score":0,"grade":""},{"date":20210106,"state":"KS","positive":236818,"probableCases":null,"negative":800701,"pending":null,"totalTestResultsSource":"posNeg","totalTestResults":1037519,"hospitalizedCurrently":838,"hospitalizedCumulative":7113,"inIcuCurrently":206,"inIcuCumulative":1928,"onVentilatorCurrently":70,"onVentilatorCumulative":413,"recovered":null,"lastUpdateEt":"1/6/2021 10:00","dateModified":"2021-01-06T10:00:00Z","checkTimeEt":"01/06 05:00","death":3027,"hospitalized":7113,"hospitalizedDischarged":4745,"dateChecked":"2021-01-06T10:00:00Z","totalTestsViral":null,"positiveTestsViral":null,"negativeTestsViral":null,"positiveCasesViral":null,"deathConfirmed":null,"deathProbable":null,"totalTestEncountersViral":null,"totalTestsPeopleViral":1037519,"totalTestsAntibody":null,"positiveTestsAntibody":null,"negativeTestsAntibody":null,"totalTestsPeopleAntibody":null,"positiveTestsPeopleAntibody":null,"negativeTestsPeopleAntibody":null,"totalTestsPeopleAntigen":null,"positiveTestsPeopleAntigen":null,"totalTestsAntigen":null,"positiveTestsAntigen":null,"fips":"20","positiveIncrease":5501,"negativeIncrease":7889,"total":1037519,"totalTestResultsIncrease":13390,"posNeg":1037519,"dataQualityGrade":null,"deathIncrease":130,"hospitalizedIncrease":158,"hash":"17ac4f7775b887a473d8785c94e4b8937194b130","commercialScore":0,"negativeRegularScore":0,"negativeScore":0,"positiveScore":0,"score":0,"grade":""},{"date":20210105,"state":"KS","positive":231317,"probableCases":null,"negative":792812,"pending":null,"totalTestResultsSource":"posNeg","totalTestResults":1024129,"hospitalizedCurrently":662,"hospitalizedCumulative":6955,"inIcuCurrently":180,"inIcuCumulative":1876,"onVentilatorCurrently":65,"onVentilatorCumulative":412,"recovered":null,"lastUpdateEt":"1/4/2021 10:00","dateModified":"2021-01-04T10:00:00Z","checkTimeEt":"01/04 05:00","death":2897,"hospitalized":6955,"hospitalizedDischarged":4643,"dateChecked":"2021-01-04T10:00:00Z","totalTestsViral":null,"positiveTestsViral":null,"negativeTestsViral":null,"positiveCasesViral":null,"deathConfirmed":null,"deathProbable":null,"totalTestEncountersViral":null,"totalTestsPeopleViral":1024129,"totalTestsAntibody":null,"positiveTestsAntibody":null,"negativeTestsAntibody":null,"totalTestsPeopleAntibody":null,"positiveTestsPeopleAntibody":null,"negativeTestsPeopleAntibody":null,"totalTestsPeopleAntigen":null,"positiveTestsPeopleAntigen":null,"totalTestsAntigen":null,"positiveTestsAntigen":null,"fips":"20","positiveIncrease":0,"negativeIncrease":0,"total":1024129,"totalTestResultsIncrease":0,"posNeg":1024129,"dataQualityGrade":null,"deathIncrease":0,"hospitalizedIncrease":0,"hash":"49fb097dcc55bfc53f15a7aab856df7f16a0364b","commercialScore":0,"negativeRegularScore":0,"negativeScore":0,"positiveScore":0,"score":0,"grade":""},{"date":20210104,"state":"KS","positive":231317,"probableCases":null,"negative":792812,"pending":null,"totalTestResultsSource":"posNeg","totalTestResults":1024129,"hospitalizedCurrently":662,"hospitalizedCumulative":6955,"inIcuCurrently":180,"inIcuCumulative":1876,"onVentilatorCurrently":65,"onVentilatorCumulative":412,"recovered":null,"lastUpdateEt":"1/4/2021 10:00","dateModified":"2021-01-04T10:00:00Z","checkTimeEt":"01/04 05:00","death":2897,"hospitalized":6955,"hospitalizedDischarged":4643,"dateChecked":"2021-01-04T10:00:00Z","totalTestsViral":null,"positiveTestsViral":null,"negativeTestsViral":null,"positiveCasesViral":null,"deathConfirmed":null,"deathProbable":null,"totalTestEncountersViral":null,"totalTestsPeopleViral":1024129,"totalTestsAntibody":null,"positiveTestsAntibody":null,"negativeTestsAntibody":null,"totalTestsPeopleAntibody":null,"positiveTestsPeopleAntibody":null,"negativeTestsPeopleAntibody":null,"totalTestsPeopleAntigen":null,"positiveTestsPeopleAntigen":null,"totalTestsAntigen":null,"positiveTestsAntigen":null,"fips":"20","positiveIncrease":3572,"negativeIncrease":8051,"total":1024129,"totalTestResultsIncrease":11623,"posNeg":1024129,"dataQualityGrade":null,"deathIncrease":18,"hospitalizedIncrease":52,"hash":"dd36e4493074de4e14578e047c71d61be4aec96b","commercialScore":0,"negativeRegularScore":0,"negativeScore":0,"positiveScore":0,"score":0,"grade":""},{"date":20210103,"state":"KS","positive":227745,"probableCases":null,"negative":784761,"pending":null,"totalTestResultsSource":"posNeg","totalTestResults":1012506,"hospitalizedCurrently":825,"hospitalizedCumulative":6903,"inIcuCurrently":221,"inIcuCumulative":1862,"onVentilatorCurrently":97,"onVentilatorCumulative":412,"recovered":null,"lastUpdateEt":"1/1/2021 10:00","dateModified":"2021-01-01T10:00:00Z","checkTimeEt":"01/01 05:00","death":2879,"hospitalized":6903,"hospitalizedDischarged":4612,"dateChecked":"2021-01-01T10:00:00Z","totalTestsViral":null,"positiveTestsViral":null,"negativeTestsViral":null,"positiveCasesViral":null,"deathConfirmed":null,"deathProbable":null,"totalTestEncountersViral":null,"totalTestsPeopleViral":1012506,"totalTestsAntibody":null,"positiveTestsAntibody":null,"negativeTestsAntibody":null,"totalTestsPeopleAntibody":null,"positiveTestsPeopleAntibody":null,"negativeTestsPeopleAntibody":null,"totalTestsPeopleAntigen":null,"positiveTestsPeopleAntigen":null,"totalTestsAntigen":null,"positiveTestsAntigen":null,"fips":"20","positiveIncrease":0,"negativeIncrease":0,"total":1012506,"totalTestResultsIncrease":0,"posNeg":1012506,"dataQualityGrade":null,"deathIncrease":0,"hospitalizedIncrease":0,"hash":"7e7e9a5c160a243817c6475b1d43f1ecad3f2f84","commercialScore":0,"negativeRegularScore":0,"negativeScore":0,"positiveScore":0,"score":0,"grade":""},{"date":20210102,"state":"KS","positive":227745,"probableCases":null,"negative":784761,"pending":null,"totalTestResultsSource":"posNeg","totalTestResults":1012506,"hospitalizedCurrently":825,"hospitalizedCumulative":6903,"inIcuCurrently":221,"inIcuCumulative":1862,"onVentilatorCurrently":97,"onVentilatorCumulative":412,"recovered":null,"lastUpdateEt":"1/1/2021 10:00","dateModified":"2021-01-01T10:00:00Z","checkTimeEt":"01/01 05:00","death":2879,"hospitalized":6903,"hospitalizedDischarged":4612,"dateChecked":"2021-01-01T10:00:00Z","totalTestsViral":null,"positiveTestsViral":null,"negativeTestsViral":null,"positiveCasesViral":null,"deathConfirmed":null,"deathProbable":null,"totalTestEncountersViral":null,"totalTestsPeopleViral":1012506,"totalTestsAntibody":null,"positiveTestsAntibody":null,"negativeTestsAntibody":null,"totalTestsPeopleAntibody":null,"positiveTestsPeopleAntibody":null,"negativeTestsPeopleAntibody":null,"totalTestsPeopleAntigen":null,"positiveTestsPeopleAntigen":null,"totalTestsAntigen":null,"positiveTestsAntigen":null,"fips":"20","positiveIncrease":0,"negativeIncrease":0,"total":1012506,"totalTestResultsIncrease":0,"posNeg":1012506,"dataQualityGrade":null,"deathIncrease":0,"hospitalizedIncrease":0,"hash":"cafbaf8373be157c4a01b0b0555f552590e142d4","commercialScore":0,"negativeRegularScore":0,"negativeScore":0,"positiveScore":0,"score":0,"grade":""},{"date":20210101,"state":"KS","positive":227745,"probableCases":null,"negative":784761,"pending":null,"totalTestResultsSource":"posNeg","totalTestResults":1012506,"hospitalizedCurrently":825,"hospitalizedCumulative":6903,"inIcuCurrently":221,"inIcuCumulative":1862,"onVentilatorCurrently":97,"onVentilatorCumulative":412,"recovered":null,"lastUpdateEt":"1/1/2021 10:00","dateModified":"2021-01-01T10:00:00Z","checkTimeEt":"01/01 05:00","death":2879,"hospitalized":6903,"hospitalizedDischarged":4612,"dateChecked":"2021-01-01T10:00:00Z","totalTestsViral":null,"positiveTestsViral":null,"negativeTestsViral":null,"positiveCasesViral":null,"deathConfirmed":null,"deathProbable":null,"totalTestEncountersViral":null,"totalTestsPeopleViral":1012506,"totalTestsAntibody":null,"positiveTestsAntibody":null,"negativeTestsAntibody":null,"totalTestsPeopleAntibody":null,"positiveTestsPeopleAntibody":null,"negativeTestsPeopleAntibody":null,"totalTestsPeopleAntigen":null,"positiveTestsPeopleAntigen":null,"totalTestsAntigen":null,"positiveTestsAntigen":null,"fips":"20","positiveIncrease":5312,"negativeIncrease":5962,"total":1012506,"totalTestResultsIncrease":11274,"posNeg":1012506,"dataQualityGrade":null,"deathIncrease":138,"hospitalizedIncrease":143,"hash":"6f8a121ad77d9841ddfe9d65bbc2620b48084714","commercialScore":0,"negativeRegularScore":0,"negativeScore":0,"positiveScore":0,"score":0,"grade":""},{"date":20201231,"state":"KS","positive":222433,"probableCases":null,"negative":778799,"pending":null,"totalTestResultsSource":"posNeg","totalTestResults":1001232,"hospitalizedCurrently":767,"hospitalizedCumulative":6760,"inIcuCurrently":234,"inIcuCumulative":1823,"onVentilatorCurrently":99,"onVentilatorCumulative":412,"recovered":null,"lastUpdateEt":"12/30/2020 10:00","dateModified":"2020-12-30T10:00:00Z","checkTimeEt":"12/30 05:00","death":2741,"hospitalized":6760,"hospitalizedDischarged":4517,"dateChecked":"2020-12-30T10:00:00Z","totalTestsViral":null,"positiveTestsViral":null,"negativeTestsViral":null,"positiveCasesViral":null,"deathConfirmed":null,"deathProbable":null,"totalTestEncountersViral":null,"totalTestsPeopleViral":1001232,"totalTestsAntibody":null,"positiveTestsAntibody":null,"negativeTestsAntibody":null,"totalTestsPeopleAntibody":null,"positiveTestsPeopleAntibody":null,"negativeTestsPeopleAntibody":null,"totalTestsPeopleAntigen":null,"positiveTestsPeopleAntigen":null,"totalTestsAntigen":null,"positiveTestsAntigen":null,"fips":"20","positiveIncrease":0,"negativeIncrease":0,"total":1001232,"totalTestResultsIncrease":0,"posNeg":1001232,"dataQualityGrade":null,"deathIncrease":0,"hospitalizedIncrease":0,"hash":"645d0417b989e110c9661da5a609cad77f4f187d","commercialScore":0,"negativeRegularScore":0,"negativeScore":0,"positiveScore":0,"score":0,"grade":""},{"date":20201230,"state":"KS","positive":222433,"probableCases":null,"negative":778799,"pending":null,"totalTestResultsSource":"posNeg","totalTestResults":1001232,"hospitalizedCurrently":767,"hospitalizedCumulative":6760,"inIcuCurrently":234,"inIcuCumulative":1823,"onVentilatorCurrently":99,"onVentilatorCumulative":412,"recovered":null,"lastUpdateEt":"12/30/2020 10:00","dateModified":"2020-12-30T10:00:00Z","checkTimeEt":"12/30 05:00","death":2741,"hospitalized":6760,"hospitalizedDischarged":4517,"dateChecked":"2020-12-30T10:00:00Z","totalTestsViral":null,"positiveTestsViral":null,"negativeTestsViral":null,"positiveCasesViral":null,"deathConfirmed":null,"deathProbable":null,"totalTestEncountersViral":null,"totalTestsPeopleViral":1001232,"totalTestsAntibody":null,"positiveTestsAntibody":null,"negativeTestsAntibody":null,"totalTestsPeopleAntibody":null,"positiveTestsPeopleAntibody":null,"negativeTestsPeopleAntibody":null,"totalTestsPeopleAntigen":null,"positiveTestsPeopleAntigen":null,"totalTestsAntigen":null,"positiveTestsAntigen":null,"fips":"20","positiveIncrease":6371,"negativeIncrease":9048,"total":1001232,"totalTestResultsIncrease":15419,"posNeg":1001232,"dataQualityGrade":null,"deathIncrease":193,"hospitalizedIncrease":192,"hash":"05ee9f1f967b1fcea63334cefa1ef2fd0ff7a1f2","commercialScore":0,"negativeRegularScore":0,"negativeScore":0,"positiveScore":0,"score":0,"grade":""},{"date":20201229,"state":"KS","positive":216062,"probableCases":null,"negative":769751,"pending":null,"totalTestResultsSource":"posNeg","totalTestResults":985813,"hospitalizedCurrently":554,"hospitalizedCumulative":6568,"inIcuCurrently":117,"inIcuCumulative":1762,"onVentilatorCurrently":68,"onVentilatorCumulative":411,"recovered":null,"lastUpdateEt":"12/28/2020 10:00","dateModified":"2020-12-28T10:00:00Z","checkTimeEt":"12/28 05:00","death":2548,"hospitalized":6568,"hospitalizedDischarged":4374,"dateChecked":"2020-12-28T10:00:00Z","totalTestsViral":null,"positiveTestsViral":null,"negativeTestsViral":null,"positiveCasesViral":null,"deathConfirmed":null,"deathProbable":null,"totalTestEncountersViral":null,"totalTestsPeopleViral":985813,"totalTestsAntibody":null,"positiveTestsAntibody":null,"negativeTestsAntibody":null,"totalTestsPeopleAntibody":null,"positiveTestsPeopleAntibody":null,"negativeTestsPeopleAntibody":null,"totalTestsPeopleAntigen":null,"positiveTestsPeopleAntigen":null,"totalTestsAntigen":null,"positiveTestsAntigen":null,"fips":"20","positiveIncrease":0,"negativeIncrease":0,"total":985813,"totalTestResultsIncrease":0,"posNeg":985813,"dataQualityGrade":null,"deathIncrease":0,"hospitalizedIncrease":0,"hash":"3c060d95f1b5a66929db25759e49329d3470b8a0","commercialScore":0,"negativeRegularScore":0,"negativeScore":0,"positiveScore":0,"score":0,"grade":""},{"date":20201228,"state":"KS","positive":216062,"probableCases":null,"negative":769751,"pending":null,"totalTestResultsSource":"posNeg","totalTestResults":985813,"hospitalizedCurrently":554,"hospitalizedCumulative":6568,"inIcuCurrently":117,"inIcuCumulative":1762,"onVentilatorCurrently":68,"onVentilatorCumulative":411,"recovered":null,"lastUpdateEt":"12/28/2020 10:00","dateModified":"2020-12-28T10:00:00Z","checkTimeEt":"12/28 05:00","death":2548,"hospitalized":6568,"hospitalizedDischarged":4374,"dateChecked":"2020-12-28T10:00:00Z","totalTestsViral":null,"positiveTestsViral":null,"negativeTestsViral":null,"positiveCasesViral":null,"deathConfirmed":null,"deathProbable":null,"totalTestEncountersViral":null,"totalTestsPeopleViral":985813,"totalTestsAntibody":null,"positiveTestsAntibody":null,"negativeTestsAntibody":null,"totalTestsPeopleAntibody":null,"positiveTestsPeopleAntibody":null,"negativeTestsPeopleAntibody":null,"totalTestsPeopleAntigen":null,"positiveTestsPeopleAntigen":null,"totalTestsAntigen":null,"positiveTestsAntigen":null,"fips":"20","positiveIncrease":6373,"negativeIncrease":17236,"total":985813,"totalTestResultsIncrease":23609,"posNeg":985813,"dataQualityGrade":null,"deathIncrease":41,"hospitalizedIncrease":144,"hash":"928f3a755419e5896456c80defe3f1abf5f3b51e","commercialScore":0,"negativeRegularScore":0,"negativeScore":0,"positiveScore":0,"score":0,"grade":""},{"date":20201227,"state":"KS","positive":209689,"probableCases":null,"negative":752515,"pending":null,"totalTestResultsSource":"posNeg","totalTestResults":962204,"hospitalizedCurrently":1014,"hospitalizedCumulative":6424,"inIcuCurrently":255,"inIcuCumulative":1722,"onVentilatorCurrently":119,"onVentilatorCumulative":411,"recovered":null,"lastUpdateEt":"12/23/2020 10:00","dateModified":"2020-12-23T10:00:00Z","checkTimeEt":"12/23 05:00","death":2507,"hospitalized":6424,"hospitalizedDischarged":4286,"dateChecked":"2020-12-23T10:00:00Z","totalTestsViral":null,"positiveTestsViral":null,"negativeTestsViral":null,"positiveCasesViral":null,"deathConfirmed":null,"deathProbable":null,"totalTestEncountersViral":null,"totalTestsPeopleViral":962204,"totalTestsAntibody":null,"positiveTestsAntibody":null,"negativeTestsAntibody":null,"totalTestsPeopleAntibody":null,"positiveTestsPeopleAntibody":null,"negativeTestsPeopleAntibody":null,"totalTestsPeopleAntigen":null,"positiveTestsPeopleAntigen":null,"totalTestsAntigen":null,"positiveTestsAntigen":null,"fips":"20","positiveIncrease":0,"negativeIncrease":0,"total":962204,"totalTestResultsIncrease":0,"posNeg":962204,"dataQualityGrade":null,"deathIncrease":0,"hospitalizedIncrease":0,"hash":"6f86b8a46adedaf6eaefa967038a3ea0df062b2a","commercialScore":0,"negativeRegularScore":0,"negativeScore":0,"positiveScore":0,"score":0,"grade":""},{"date":20201226,"state":"KS","positive":209689,"probableCases":null,"negative":752515,"pending":null,"totalTestResultsSource":"posNeg","totalTestResults":962204,"hospitalizedCurrently":1014,"hospitalizedCumulative":6424,"inIcuCurrently":255,"inIcuCumulative":1722,"onVentilatorCurrently":119,"onVentilatorCumulative":411,"recovered":null,"lastUpdateEt":"12/23/2020 10:00","dateModified":"2020-12-23T10:00:00Z","checkTimeEt":"12/23 05:00","death":2507,"hospitalized":6424,"hospitalizedDischarged":4286,"dateChecked":"2020-12-23T10:00:00Z","totalTestsViral":null,"positiveTestsViral":null,"negativeTestsViral":null,"positiveCasesViral":null,"deathConfirmed":null,"deathProbable":null,"totalTestEncountersViral":null,"totalTestsPeopleViral":962204,"totalTestsAntibody":null,"positiveTestsAntibody":null,"negativeTestsAntibody":null,"totalTestsPeopleAntibody":null,"positiveTestsPeopleAntibody":null,"negativeTestsPeopleAntibody":null,"totalTestsPeopleAntigen":null,"positiveTestsPeopleAntigen":null,"totalTestsAntigen":null,"positiveTestsAntigen":null,"fips":"20","positiveIncrease":0,"negativeIncrease":0,"total":962204,"totalTestResultsIncrease":0,"posNeg":962204,"dataQualityGrade":null,"dea