[{"date":20210307,"state":"MP","positive":145,"probableCases":null,"negative":17429,"pending":null,"totalTestResultsSource":"posNeg","totalTestResults":17574,"hospitalizedCurrently":null,"hospitalizedCumulative":4,"inIcuCurrently":null,"inIcuCumulative":null,"onVentilatorCurrently":null,"onVentilatorCumulative":null,"recovered":29,"lastUpdateEt":"3/8/2021 00:00","dateModified":"2021-03-08T00:00:00Z","checkTimeEt":"03/07 19:00","death":2,"hospitalized":4,"hospitalizedDischarged":null,"dateChecked":"2021-03-08T00:00:00Z","totalTestsViral":26131,"positiveTestsViral":null,"negativeTestsViral":null,"positiveCasesViral":145,"deathConfirmed":2,"deathProbable":null,"totalTestEncountersViral":null,"totalTestsPeopleViral":17542,"totalTestsAntibody":null,"positiveTestsAntibody":null,"negativeTestsAntibody":null,"totalTestsPeopleAntibody":null,"positiveTestsPeopleAntibody":null,"negativeTestsPeopleAntibody":null,"totalTestsPeopleAntigen":null,"positiveTestsPeopleAntigen":null,"totalTestsAntigen":null,"positiveTestsAntigen":null,"fips":"69","positiveIncrease":1,"negativeIncrease":0,"total":17574,"totalTestResultsIncrease":1,"posNeg":17574,"dataQualityGrade":null,"deathIncrease":0,"hospitalizedIncrease":0,"hash":"604ee9ce4dee663fe99123a19a712d867f8a0406","commercialScore":0,"negativeRegularScore":0,"negativeScore":0,"positiveScore":0,"score":0,"grade":""},{"date":20210306,"state":"MP","positive":144,"probableCases":null,"negative":17429,"pending":null,"totalTestResultsSource":"posNeg","totalTestResults":17573,"hospitalizedCurrently":null,"hospitalizedCumulative":4,"inIcuCurrently":null,"inIcuCumulative":null,"onVentilatorCurrently":null,"onVentilatorCumulative":null,"recovered":29,"lastUpdateEt":"3/3/2021 00:00","dateModified":"2021-03-03T00:00:00Z","checkTimeEt":"03/02 19:00","death":2,"hospitalized":4,"hospitalizedDischarged":null,"dateChecked":"2021-03-03T00:00:00Z","totalTestsViral":26131,"positiveTestsViral":null,"negativeTestsViral":null,"positiveCasesViral":144,"deathConfirmed":2,"deathProbable":null,"totalTestEncountersViral":null,"totalTestsPeopleViral":17542,"totalTestsAntibody":null,"positiveTestsAntibody":null,"negativeTestsAntibody":null,"totalTestsPeopleAntibody":null,"positiveTestsPeopleAntibody":null,"negativeTestsPeopleAntibody":null,"totalTestsPeopleAntigen":null,"positiveTestsPeopleAntigen":null,"totalTestsAntigen":null,"positiveTestsAntigen":null,"fips":"69","positiveIncrease":0,"negativeIncrease":0,"total":17573,"totalTestResultsIncrease":0,"posNeg":17573,"dataQualityGrade":null,"deathIncrease":0,"hospitalizedIncrease":0,"hash":"35a376584a8c67c08b116525925c782f9e1fa747","commercialScore":0,"negativeRegularScore":0,"negativeScore":0,"positiveScore":0,"score":0,"grade":""},{"date":20210305,"state":"MP","positive":144,"probableCases":null,"negative":17429,"pending":null,"totalTestResultsSource":"posNeg","totalTestResults":17573,"hospitalizedCurrently":null,"hospitalizedCumulative":4,"inIcuCurrently":null,"inIcuCumulative":null,"onVentilatorCurrently":null,"onVentilatorCumulative":null,"recovered":29,"lastUpdateEt":"3/3/2021 00:00","dateModified":"2021-03-03T00:00:00Z","checkTimeEt":"03/02 19:00","death":2,"hospitalized":4,"hospitalizedDischarged":null,"dateChecked":"2021-03-03T00:00:00Z","totalTestsViral":26131,"positiveTestsViral":null,"negativeTestsViral":null,"positiveCasesViral":144,"deathConfirmed":2,"deathProbable":null,"totalTestEncountersViral":null,"totalTestsPeopleViral":17542,"totalTestsAntibody":null,"positiveTestsAntibody":null,"negativeTestsAntibody":null,"totalTestsPeopleAntibody":null,"positiveTestsPeopleAntibody":null,"negativeTestsPeopleAntibody":null,"totalTestsPeopleAntigen":null,"positiveTestsPeopleAntigen":null,"totalTestsAntigen":null,"positiveTestsAntigen":null,"fips":"69","positiveIncrease":0,"negativeIncrease":0,"total":17573,"totalTestResultsIncrease":0,"posNeg":17573,"dataQualityGrade":null,"deathIncrease":0,"hospitalizedIncrease":0,"hash":"2b74789c72ad3070c1c9f9401c579ffc388de1ee","commercialScore":0,"negativeRegularScore":0,"negativeScore":0,"positiveScore":0,"score":0,"grade":""},{"date":20210304,"state":"MP","positive":144,"probableCases":null,"negative":17429,"pending":null,"totalTestResultsSource":"posNeg","totalTestResults":17573,"hospitalizedCurrently":null,"hospitalizedCumulative":4,"inIcuCurrently":null,"inIcuCumulative":null,"onVentilatorCurrently":null,"onVentilatorCumulative":null,"recovered":29,"lastUpdateEt":"3/3/2021 00:00","dateModified":"2021-03-03T00:00:00Z","checkTimeEt":"03/02 19:00","death":2,"hospitalized":4,"hospitalizedDischarged":null,"dateChecked":"2021-03-03T00:00:00Z","totalTestsViral":26131,"positiveTestsViral":null,"negativeTestsViral":null,"positiveCasesViral":144,"deathConfirmed":2,"deathProbable":null,"totalTestEncountersViral":null,"totalTestsPeopleViral":17542,"totalTestsAntibody":null,"positiveTestsAntibody":null,"negativeTestsAntibody":null,"totalTestsPeopleAntibody":null,"positiveTestsPeopleAntibody":null,"negativeTestsPeopleAntibody":null,"totalTestsPeopleAntigen":null,"positiveTestsPeopleAntigen":null,"totalTestsAntigen":null,"positiveTestsAntigen":null,"fips":"69","positiveIncrease":0,"negativeIncrease":0,"total":17573,"totalTestResultsIncrease":0,"posNeg":17573,"dataQualityGrade":null,"deathIncrease":0,"hospitalizedIncrease":0,"hash":"9d749a95bffcf4e26bfa634ea7f83efdc512f98f","commercialScore":0,"negativeRegularScore":0,"negativeScore":0,"positiveScore":0,"score":0,"grade":""},{"date":20210303,"state":"MP","positive":144,"probableCases":null,"negative":17429,"pending":null,"totalTestResultsSource":"posNeg","totalTestResults":17573,"hospitalizedCurrently":null,"hospitalizedCumulative":4,"inIcuCurrently":null,"inIcuCumulative":null,"onVentilatorCurrently":null,"onVentilatorCumulative":null,"recovered":29,"lastUpdateEt":"3/3/2021 00:00","dateModified":"2021-03-03T00:00:00Z","checkTimeEt":"03/02 19:00","death":2,"hospitalized":4,"hospitalizedDischarged":null,"dateChecked":"2021-03-03T00:00:00Z","totalTestsViral":26131,"positiveTestsViral":null,"negativeTestsViral":null,"positiveCasesViral":144,"deathConfirmed":2,"deathProbable":null,"totalTestEncountersViral":null,"totalTestsPeopleViral":17542,"totalTestsAntibody":null,"positiveTestsAntibody":null,"negativeTestsAntibody":null,"totalTestsPeopleAntibody":null,"positiveTestsPeopleAntibody":null,"negativeTestsPeopleAntibody":null,"totalTestsPeopleAntigen":null,"positiveTestsPeopleAntigen":null,"totalTestsAntigen":null,"positiveTestsAntigen":null,"fips":"69","positiveIncrease":1,"negativeIncrease":0,"total":17573,"totalTestResultsIncrease":1,"posNeg":17573,"dataQualityGrade":null,"deathIncrease":0,"hospitalizedIncrease":0,"hash":"dd15b5eaff34af39bf74805c624674bd345fa12c","commercialScore":0,"negativeRegularScore":0,"negativeScore":0,"positiveScore":0,"score":0,"grade":""},{"date":20210302,"state":"MP","positive":143,"probableCases":null,"negative":17429,"pending":null,"totalTestResultsSource":"posNeg","totalTestResults":17572,"hospitalizedCurrently":null,"hospitalizedCumulative":4,"inIcuCurrently":null,"inIcuCumulative":null,"onVentilatorCurrently":null,"onVentilatorCumulative":null,"recovered":29,"lastUpdateEt":"2/20/2021 00:00","dateModified":"2021-02-20T00:00:00Z","checkTimeEt":"02/19 19:00","death":2,"hospitalized":4,"hospitalizedDischarged":null,"dateChecked":"2021-02-20T00:00:00Z","totalTestsViral":26131,"positiveTestsViral":null,"negativeTestsViral":null,"positiveCasesViral":143,"deathConfirmed":2,"deathProbable":null,"totalTestEncountersViral":null,"totalTestsPeopleViral":17542,"totalTestsAntibody":null,"positiveTestsAntibody":null,"negativeTestsAntibody":null,"totalTestsPeopleAntibody":null,"positiveTestsPeopleAntibody":null,"negativeTestsPeopleAntibody":null,"totalTestsPeopleAntigen":null,"positiveTestsPeopleAntigen":null,"totalTestsAntigen":null,"positiveTestsAntigen":null,"fips":"69","positiveIncrease":0,"negativeIncrease":0,"total":17572,"totalTestResultsIncrease":0,"posNeg":17572,"dataQualityGrade":null,"deathIncrease":0,"hospitalizedIncrease":0,"hash":"f8a108a632943cfc7b48ce54f0253f9690146a90","commercialScore":0,"negativeRegularScore":0,"negativeScore":0,"positiveScore":0,"score":0,"grade":""},{"date":20210301,"state":"MP","positive":143,"probableCases":null,"negative":17429,"pending":null,"totalTestResultsSource":"posNeg","totalTestResults":17572,"hospitalizedCurrently":null,"hospitalizedCumulative":4,"inIcuCurrently":null,"inIcuCumulative":null,"onVentilatorCurrently":null,"onVentilatorCumulative":null,"recovered":29,"lastUpdateEt":"2/20/2021 00:00","dateModified":"2021-02-20T00:00:00Z","checkTimeEt":"02/19 19:00","death":2,"hospitalized":4,"hospitalizedDischarged":null,"dateChecked":"2021-02-20T00:00:00Z","totalTestsViral":26131,"positiveTestsViral":null,"negativeTestsViral":null,"positiveCasesViral":143,"deathConfirmed":2,"deathProbable":null,"totalTestEncountersViral":null,"totalTestsPeopleViral":17542,"totalTestsAntibody":null,"positiveTestsAntibody":null,"negativeTestsAntibody":null,"totalTestsPeopleAntibody":null,"positiveTestsPeopleAntibody":null,"negativeTestsPeopleAntibody":null,"totalTestsPeopleAntigen":null,"positiveTestsPeopleAntigen":null,"totalTestsAntigen":null,"positiveTestsAntigen":null,"fips":"69","positiveIncrease":0,"negativeIncrease":0,"total":17572,"totalTestResultsIncrease":0,"posNeg":17572,"dataQualityGrade":null,"deathIncrease":0,"hospitalizedIncrease":0,"hash":"d872c5d79663615a2733838c052596f7c5a3fdfa","commercialScore":0,"negativeRegularScore":0,"negativeScore":0,"positiveScore":0,"score":0,"grade":""},{"date":20210228,"state":"MP","positive":143,"probableCases":null,"negative":17429,"pending":null,"totalTestResultsSource":"posNeg","totalTestResults":17572,"hospitalizedCurrently":null,"hospitalizedCumulative":4,"inIcuCurrently":null,"inIcuCumulative":null,"onVentilatorCurrently":null,"onVentilatorCumulative":null,"recovered":29,"lastUpdateEt":"2/20/2021 00:00","dateModified":"2021-02-20T00:00:00Z","checkTimeEt":"02/19 19:00","death":2,"hospitalized":4,"hospitalizedDischarged":null,"dateChecked":"2021-02-20T00:00:00Z","totalTestsViral":26131,"positiveTestsViral":null,"negativeTestsViral":null,"positiveCasesViral":143,"deathConfirmed":2,"deathProbable":null,"totalTestEncountersViral":null,"totalTestsPeopleViral":17542,"totalTestsAntibody":null,"positiveTestsAntibody":null,"negativeTestsAntibody":null,"totalTestsPeopleAntibody":null,"positiveTestsPeopleAntibody":null,"negativeTestsPeopleAntibody":null,"totalTestsPeopleAntigen":null,"positiveTestsPeopleAntigen":null,"totalTestsAntigen":null,"positiveTestsAntigen":null,"fips":"69","positiveIncrease":0,"negativeIncrease":0,"total":17572,"totalTestResultsIncrease":0,"posNeg":17572,"dataQualityGrade":null,"deathIncrease":0,"hospitalizedIncrease":0,"hash":"82f9fa69343312618cc0dd8e3347a1b93d7a449c","commercialScore":0,"negativeRegularScore":0,"negativeScore":0,"positiveScore":0,"score":0,"grade":""},{"date":20210227,"state":"MP","positive":143,"probableCases":null,"negative":17429,"pending":null,"totalTestResultsSource":"posNeg","totalTestResults":17572,"hospitalizedCurrently":null,"hospitalizedCumulative":4,"inIcuCurrently":null,"inIcuCumulative":null,"onVentilatorCurrently":null,"onVentilatorCumulative":null,"recovered":29,"lastUpdateEt":"2/20/2021 00:00","dateModified":"2021-02-20T00:00:00Z","checkTimeEt":"02/19 19:00","death":2,"hospitalized":4,"hospitalizedDischarged":null,"dateChecked":"2021-02-20T00:00:00Z","totalTestsViral":26131,"positiveTestsViral":null,"negativeTestsViral":null,"positiveCasesViral":143,"deathConfirmed":2,"deathProbable":null,"totalTestEncountersViral":null,"totalTestsPeopleViral":17542,"totalTestsAntibody":null,"positiveTestsAntibody":null,"negativeTestsAntibody":null,"totalTestsPeopleAntibody":null,"positiveTestsPeopleAntibody":null,"negativeTestsPeopleAntibody":null,"totalTestsPeopleAntigen":null,"positiveTestsPeopleAntigen":null,"totalTestsAntigen":null,"positiveTestsAntigen":null,"fips":"69","positiveIncrease":0,"negativeIncrease":0,"total":17572,"totalTestResultsIncrease":0,"posNeg":17572,"dataQualityGrade":null,"deathIncrease":0,"hospitalizedIncrease":0,"hash":"baa13cc25d2aa451f4807db48598c304725ced4b","commercialScore":0,"negativeRegularScore":0,"negativeScore":0,"positiveScore":0,"score":0,"grade":""},{"date":20210226,"state":"MP","positive":143,"probableCases":null,"negative":17429,"pending":null,"totalTestResultsSource":"posNeg","totalTestResults":17572,"hospitalizedCurrently":null,"hospitalizedCumulative":4,"inIcuCurrently":null,"inIcuCumulative":null,"onVentilatorCurrently":null,"onVentilatorCumulative":null,"recovered":29,"lastUpdateEt":"2/20/2021 00:00","dateModified":"2021-02-20T00:00:00Z","checkTimeEt":"02/19 19:00","death":2,"hospitalized":4,"hospitalizedDischarged":null,"dateChecked":"2021-02-20T00:00:00Z","totalTestsViral":26131,"positiveTestsViral":null,"negativeTestsViral":null,"positiveCasesViral":143,"deathConfirmed":2,"deathProbable":null,"totalTestEncountersViral":null,"totalTestsPeopleViral":17542,"totalTestsAntibody":null,"positiveTestsAntibody":null,"negativeTestsAntibody":null,"totalTestsPeopleAntibody":null,"positiveTestsPeopleAntibody":null,"negativeTestsPeopleAntibody":null,"totalTestsPeopleAntigen":null,"positiveTestsPeopleAntigen":null,"totalTestsAntigen":null,"positiveTestsAntigen":null,"fips":"69","positiveIncrease":0,"negativeIncrease":0,"total":17572,"totalTestResultsIncrease":0,"posNeg":17572,"dataQualityGrade":null,"deathIncrease":0,"hospitalizedIncrease":0,"hash":"eb863a285dbb872a9cadf6606b627f92123ea2a1","commercialScore":0,"negativeRegularScore":0,"negativeScore":0,"positiveScore":0,"score":0,"grade":""},{"date":20210225,"state":"MP","positive":143,"probableCases":null,"negative":17429,"pending":null,"totalTestResultsSource":"posNeg","totalTestResults":17572,"hospitalizedCurrently":null,"hospitalizedCumulative":4,"inIcuCurrently":null,"inIcuCumulative":null,"onVentilatorCurrently":null,"onVentilatorCumulative":null,"recovered":29,"lastUpdateEt":"2/20/2021 00:00","dateModified":"2021-02-20T00:00:00Z","checkTimeEt":"02/19 19:00","death":2,"hospitalized":4,"hospitalizedDischarged":null,"dateChecked":"2021-02-20T00:00:00Z","totalTestsViral":26131,"positiveTestsViral":null,"negativeTestsViral":null,"positiveCasesViral":143,"deathConfirmed":2,"deathProbable":null,"totalTestEncountersViral":null,"totalTestsPeopleViral":17542,"totalTestsAntibody":null,"positiveTestsAntibody":null,"negativeTestsAntibody":null,"totalTestsPeopleAntibody":null,"positiveTestsPeopleAntibody":null,"negativeTestsPeopleAntibody":null,"totalTestsPeopleAntigen":null,"positiveTestsPeopleAntigen":null,"totalTestsAntigen":null,"positiveTestsAntigen":null,"fips":"69","positiveIncrease":0,"negativeIncrease":0,"total":17572,"totalTestResultsIncrease":0,"posNeg":17572,"dataQualityGrade":null,"deathIncrease":0,"hospitalizedIncrease":0,"hash":"c9a40f38df48d2100532c88258ded70ba0ec8e73","commercialScore":0,"negativeRegularScore":0,"negativeScore":0,"positiveScore":0,"score":0,"grade":""},{"date":20210224,"state":"MP","positive":143,"probableCases":null,"negative":17429,"pending":null,"totalTestResultsSource":"posNeg","totalTestResults":17572,"hospitalizedCurrently":null,"hospitalizedCumulative":4,"inIcuCurrently":null,"inIcuCumulative":null,"onVentilatorCurrently":null,"onVentilatorCumulative":null,"recovered":29,"lastUpdateEt":"2/20/2021 00:00","dateModified":"2021-02-20T00:00:00Z","checkTimeEt":"02/19 19:00","death":2,"hospitalized":4,"hospitalizedDischarged":null,"dateChecked":"2021-02-20T00:00:00Z","totalTestsViral":26131,"positiveTestsViral":null,"negativeTestsViral":null,"positiveCasesViral":143,"deathConfirmed":2,"deathProbable":null,"totalTestEncountersViral":null,"totalTestsPeopleViral":17542,"totalTestsAntibody":null,"positiveTestsAntibody":null,"negativeTestsAntibody":null,"totalTestsPeopleAntibody":null,"positiveTestsPeopleAntibody":null,"negativeTestsPeopleAntibody":null,"totalTestsPeopleAntigen":null,"positiveTestsPeopleAntigen":null,"totalTestsAntigen":null,"positiveTestsAntigen":null,"fips":"69","positiveIncrease":0,"negativeIncrease":0,"total":17572,"totalTestResultsIncrease":0,"posNeg":17572,"dataQualityGrade":null,"deathIncrease":0,"hospitalizedIncrease":0,"hash":"bdb0e6e48bcfa36faac569a4c80fd92ace3b2365","commercialScore":0,"negativeRegularScore":0,"negativeScore":0,"positiveScore":0,"score":0,"grade":""},{"date":20210223,"state":"MP","positive":143,"probableCases":null,"negative":17429,"pending":null,"totalTestResultsSource":"posNeg","totalTestResults":17572,"hospitalizedCurrently":null,"hospitalizedCumulative":4,"inIcuCurrently":null,"inIcuCumulative":null,"onVentilatorCurrently":null,"onVentilatorCumulative":null,"recovered":29,"lastUpdateEt":"2/20/2021 00:00","dateModified":"2021-02-20T00:00:00Z","checkTimeEt":"02/19 19:00","death":2,"hospitalized":4,"hospitalizedDischarged":null,"dateChecked":"2021-02-20T00:00:00Z","totalTestsViral":26131,"positiveTestsViral":null,"negativeTestsViral":null,"positiveCasesViral":143,"deathConfirmed":2,"deathProbable":null,"totalTestEncountersViral":null,"totalTestsPeopleViral":17542,"totalTestsAntibody":null,"positiveTestsAntibody":null,"negativeTestsAntibody":null,"totalTestsPeopleAntibody":null,"positiveTestsPeopleAntibody":null,"negativeTestsPeopleAntibody":null,"totalTestsPeopleAntigen":null,"positiveTestsPeopleAntigen":null,"totalTestsAntigen":null,"positiveTestsAntigen":null,"fips":"69","positiveIncrease":0,"negativeIncrease":0,"total":17572,"totalTestResultsIncrease":0,"posNeg":17572,"dataQualityGrade":null,"deathIncrease":0,"hospitalizedIncrease":0,"hash":"7b10e316d590640e0fda58c466d868db22876c20","commercialScore":0,"negativeRegularScore":0,"negativeScore":0,"positiveScore":0,"score":0,"grade":""},{"date":20210222,"state":"MP","positive":143,"probableCases":null,"negative":17429,"pending":null,"totalTestResultsSource":"posNeg","totalTestResults":17572,"hospitalizedCurrently":null,"hospitalizedCumulative":4,"inIcuCurrently":null,"inIcuCumulative":null,"onVentilatorCurrently":null,"onVentilatorCumulative":null,"recovered":29,"lastUpdateEt":"2/20/2021 00:00","dateModified":"2021-02-20T00:00:00Z","checkTimeEt":"02/19 19:00","death":2,"hospitalized":4,"hospitalizedDischarged":null,"dateChecked":"2021-02-20T00:00:00Z","totalTestsViral":26131,"positiveTestsViral":null,"negativeTestsViral":null,"positiveCasesViral":143,"deathConfirmed":2,"deathProbable":null,"totalTestEncountersViral":null,"totalTestsPeopleViral":17542,"totalTestsAntibody":null,"positiveTestsAntibody":null,"negativeTestsAntibody":null,"totalTestsPeopleAntibody":null,"positiveTestsPeopleAntibody":null,"negativeTestsPeopleAntibody":null,"totalTestsPeopleAntigen":null,"positiveTestsPeopleAntigen":null,"totalTestsAntigen":null,"positiveTestsAntigen":null,"fips":"69","positiveIncrease":0,"negativeIncrease":0,"total":17572,"totalTestResultsIncrease":0,"posNeg":17572,"dataQualityGrade":null,"deathIncrease":0,"hospitalizedIncrease":0,"hash":"756dce2a0cb9795e9b5f5ca1711867be8940a098","commercialScore":0,"negativeRegularScore":0,"negativeScore":0,"positiveScore":0,"score":0,"grade":""},{"date":20210221,"state":"MP","positive":143,"probableCases":null,"negative":17429,"pending":null,"totalTestResultsSource":"posNeg","totalTestResults":17572,"hospitalizedCurrently":null,"hospitalizedCumulative":4,"inIcuCurrently":null,"inIcuCumulative":null,"onVentilatorCurrently":null,"onVentilatorCumulative":null,"recovered":29,"lastUpdateEt":"2/20/2021 00:00","dateModified":"2021-02-20T00:00:00Z","checkTimeEt":"02/19 19:00","death":2,"hospitalized":4,"hospitalizedDischarged":null,"dateChecked":"2021-02-20T00:00:00Z","totalTestsViral":26131,"positiveTestsViral":null,"negativeTestsViral":null,"positiveCasesViral":143,"deathConfirmed":2,"deathProbable":null,"totalTestEncountersViral":null,"totalTestsPeopleViral":17542,"totalTestsAntibody":null,"positiveTestsAntibody":null,"negativeTestsAntibody":null,"totalTestsPeopleAntibody":null,"positiveTestsPeopleAntibody":null,"negativeTestsPeopleAntibody":null,"totalTestsPeopleAntigen":null,"positiveTestsPeopleAntigen":null,"totalTestsAntigen":null,"positiveTestsAntigen":null,"fips":"69","positiveIncrease":8,"negativeIncrease":0,"total":17572,"totalTestResultsIncrease":8,"posNeg":17572,"dataQualityGrade":null,"deathIncrease":0,"hospitalizedIncrease":0,"hash":"e7e05c8db2dffe2ebc6d3a9f1e77896c18743012","commercialScore":0,"negativeRegularScore":0,"negativeScore":0,"positiveScore":0,"score":0,"grade":""},{"date":20210220,"state":"MP","positive":135,"probableCases":null,"negative":17429,"pending":null,"totalTestResultsSource":"posNeg","totalTestResults":17564,"hospitalizedCurrently":null,"hospitalizedCumulative":4,"inIcuCurrently":null,"inIcuCumulative":null,"onVentilatorCurrently":null,"onVentilatorCumulative":null,"recovered":29,"lastUpdateEt":"2/16/2021 00:00","dateModified":"2021-02-16T00:00:00Z","checkTimeEt":"02/15 19:00","death":2,"hospitalized":4,"hospitalizedDischarged":null,"dateChecked":"2021-02-16T00:00:00Z","totalTestsViral":26131,"positiveTestsViral":null,"negativeTestsViral":null,"positiveCasesViral":135,"deathConfirmed":2,"deathProbable":null,"totalTestEncountersViral":null,"totalTestsPeopleViral":17542,"totalTestsAntibody":null,"positiveTestsAntibody":null,"negativeTestsAntibody":null,"totalTestsPeopleAntibody":null,"positiveTestsPeopleAntibody":null,"negativeTestsPeopleAntibody":null,"totalTestsPeopleAntigen":null,"positiveTestsPeopleAntigen":null,"totalTestsAntigen":null,"positiveTestsAntigen":null,"fips":"69","positiveIncrease":0,"negativeIncrease":0,"total":17564,"totalTestResultsIncrease":0,"posNeg":17564,"dataQualityGrade":null,"deathIncrease":0,"hospitalizedIncrease":0,"hash":"e0a53bc72ffa2f0b63cd4baf2207fe36b9a1fcc6","commercialScore":0,"negativeRegularScore":0,"negativeScore":0,"positiveScore":0,"score":0,"grade":""},{"date":20210219,"state":"MP","positive":135,"probableCases":null,"negative":17429,"pending":null,"totalTestResultsSource":"posNeg","totalTestResults":17564,"hospitalizedCurrently":null,"hospitalizedCumulative":4,"inIcuCurrently":null,"inIcuCumulative":null,"onVentilatorCurrently":null,"onVentilatorCumulative":null,"recovered":29,"lastUpdateEt":"2/16/2021 00:00","dateModified":"2021-02-16T00:00:00Z","checkTimeEt":"02/15 19:00","death":2,"hospitalized":4,"hospitalizedDischarged":null,"dateChecked":"2021-02-16T00:00:00Z","totalTestsViral":26131,"positiveTestsViral":null,"negativeTestsViral":null,"positiveCasesViral":135,"deathConfirmed":2,"deathProbable":null,"totalTestEncountersViral":null,"totalTestsPeopleViral":17542,"totalTestsAntibody":null,"positiveTestsAntibody":null,"negativeTestsAntibody":null,"totalTestsPeopleAntibody":null,"positiveTestsPeopleAntibody":null,"negativeTestsPeopleAntibody":null,"totalTestsPeopleAntigen":null,"positiveTestsPeopleAntigen":null,"totalTestsAntigen":null,"positiveTestsAntigen":null,"fips":"69","positiveIncrease":0,"negativeIncrease":0,"total":17564,"totalTestResultsIncrease":0,"posNeg":17564,"dataQualityGrade":null,"deathIncrease":0,"hospitalizedIncrease":0,"hash":"c4c87e681c249692528bc80a54020c9f99716e21","commercialScore":0,"negativeRegularScore":0,"negativeScore":0,"positiveScore":0,"score":0,"grade":""},{"date":20210218,"state":"MP","positive":135,"probableCases":null,"negative":17429,"pending":null,"totalTestResultsSource":"posNeg","totalTestResults":17564,"hospitalizedCurrently":null,"hospitalizedCumulative":4,"inIcuCurrently":null,"inIcuCumulative":null,"onVentilatorCurrently":null,"onVentilatorCumulative":null,"recovered":29,"lastUpdateEt":"2/16/2021 00:00","dateModified":"2021-02-16T00:00:00Z","checkTimeEt":"02/15 19:00","death":2,"hospitalized":4,"hospitalizedDischarged":null,"dateChecked":"2021-02-16T00:00:00Z","totalTestsViral":26131,"positiveTestsViral":null,"negativeTestsViral":null,"positiveCasesViral":135,"deathConfirmed":2,"deathProbable":null,"totalTestEncountersViral":null,"totalTestsPeopleViral":17542,"totalTestsAntibody":null,"positiveTestsAntibody":null,"negativeTestsAntibody":null,"totalTestsPeopleAntibody":null,"positiveTestsPeopleAntibody":null,"negativeTestsPeopleAntibody":null,"totalTestsPeopleAntigen":null,"positiveTestsPeopleAntigen":null,"totalTestsAntigen":null,"positiveTestsAntigen":null,"fips":"69","positiveIncrease":0,"negativeIncrease":0,"total":17564,"totalTestResultsIncrease":0,"posNeg":17564,"dataQualityGrade":null,"deathIncrease":0,"hospitalizedIncrease":0,"hash":"64312b4e4fa8c2f1bd057203e2d6884973ff0c04","commercialScore":0,"negativeRegularScore":0,"negativeScore":0,"positiveScore":0,"score":0,"grade":""},{"date":20210217,"state":"MP","positive":135,"probableCases":null,"negative":17429,"pending":null,"totalTestResultsSource":"posNeg","totalTestResults":17564,"hospitalizedCurrently":null,"hospitalizedCumulative":4,"inIcuCurrently":null,"inIcuCumulative":null,"onVentilatorCurrently":null,"onVentilatorCumulative":null,"recovered":29,"lastUpdateEt":"2/16/2021 00:00","dateModified":"2021-02-16T00:00:00Z","checkTimeEt":"02/15 19:00","death":2,"hospitalized":4,"hospitalizedDischarged":null,"dateChecked":"2021-02-16T00:00:00Z","totalTestsViral":26131,"positiveTestsViral":null,"negativeTestsViral":null,"positiveCasesViral":135,"deathConfirmed":2,"deathProbable":null,"totalTestEncountersViral":null,"totalTestsPeopleViral":17542,"totalTestsAntibody":null,"positiveTestsAntibody":null,"negativeTestsAntibody":null,"totalTestsPeopleAntibody":null,"positiveTestsPeopleAntibody":null,"negativeTestsPeopleAntibody":null,"totalTestsPeopleAntigen":null,"positiveTestsPeopleAntigen":null,"totalTestsAntigen":null,"positiveTestsAntigen":null,"fips":"69","positiveIncrease":1,"negativeIncrease":0,"total":17564,"totalTestResultsIncrease":1,"posNeg":17564,"dataQualityGrade":null,"deathIncrease":0,"hospitalizedIncrease":0,"hash":"4fa52bdf55cc5433bc3c997f6f0d143fbd56de5b","commercialScore":0,"negativeRegularScore":0,"negativeScore":0,"positiveScore":0,"score":0,"grade":""},{"date":20210216,"state":"MP","positive":134,"probableCases":null,"negative":17429,"pending":null,"totalTestResultsSource":"posNeg","totalTestResults":17563,"hospitalizedCurrently":null,"hospitalizedCumulative":4,"inIcuCurrently":null,"inIcuCumulative":null,"onVentilatorCurrently":null,"onVentilatorCumulative":null,"recovered":29,"lastUpdateEt":"2/12/2021 00:00","dateModified":"2021-02-12T00:00:00Z","checkTimeEt":"02/11 19:00","death":2,"hospitalized":4,"hospitalizedDischarged":null,"dateChecked":"2021-02-12T00:00:00Z","totalTestsViral":26131,"positiveTestsViral":null,"negativeTestsViral":null,"positiveCasesViral":134,"deathConfirmed":2,"deathProbable":null,"totalTestEncountersViral":null,"totalTestsPeopleViral":17542,"totalTestsAntibody":null,"positiveTestsAntibody":null,"negativeTestsAntibody":null,"totalTestsPeopleAntibody":null,"positiveTestsPeopleAntibody":null,"negativeTestsPeopleAntibody":null,"totalTestsPeopleAntigen":null,"positiveTestsPeopleAntigen":null,"totalTestsAntigen":null,"positiveTestsAntigen":null,"fips":"69","positiveIncrease":0,"negativeIncrease":0,"total":17563,"totalTestResultsIncrease":0,"posNeg":17563,"dataQualityGrade":null,"deathIncrease":0,"hospitalizedIncrease":0,"hash":"84367ce47d2df42c908f89de1516262341ec463d","commercialScore":0,"negativeRegularScore":0,"negativeScore":0,"positiveScore":0,"score":0,"grade":""},{"date":20210215,"state":"MP","positive":134,"probableCases":null,"negative":17429,"pending":null,"totalTestResultsSource":"posNeg","totalTestResults":17563,"hospitalizedCurrently":null,"hospitalizedCumulative":4,"inIcuCurrently":null,"inIcuCumulative":null,"onVentilatorCurrently":null,"onVentilatorCumulative":null,"recovered":29,"lastUpdateEt":"2/12/2021 00:00","dateModified":"2021-02-12T00:00:00Z","checkTimeEt":"02/11 19:00","death":2,"hospitalized":4,"hospitalizedDischarged":null,"dateChecked":"2021-02-12T00:00:00Z","totalTestsViral":26131,"positiveTestsViral":null,"negativeTestsViral":null,"positiveCasesViral":134,"deathConfirmed":2,"deathProbable":null,"totalTestEncountersViral":null,"totalTestsPeopleViral":17542,"totalTestsAntibody":null,"positiveTestsAntibody":null,"negativeTestsAntibody":null,"totalTestsPeopleAntibody":null,"positiveTestsPeopleAntibody":null,"negativeTestsPeopleAntibody":null,"totalTestsPeopleAntigen":null,"positiveTestsPeopleAntigen":null,"totalTestsAntigen":null,"positiveTestsAntigen":null,"fips":"69","positiveIncrease":0,"negativeIncrease":0,"total":17563,"totalTestResultsIncrease":0,"posNeg":17563,"dataQualityGrade":null,"deathIncrease":0,"hospitalizedIncrease":0,"hash":"70e4d339589ba2d6c1e1159ceff9615a9618ad1e","commercialScore":0,"negativeRegularScore":0,"negativeScore":0,"positiveScore":0,"score":0,"grade":""},{"date":20210214,"state":"MP","positive":134,"probableCases":null,"negative":17429,"pending":null,"totalTestResultsSource":"posNeg","totalTestResults":17563,"hospitalizedCurrently":null,"hospitalizedCumulative":4,"inIcuCurrently":null,"inIcuCumulative":null,"onVentilatorCurrently":null,"onVentilatorCumulative":null,"recovered":29,"lastUpdateEt":"2/12/2021 00:00","dateModified":"2021-02-12T00:00:00Z","checkTimeEt":"02/11 19:00","death":2,"hospitalized":4,"hospitalizedDischarged":null,"dateChecked":"2021-02-12T00:00:00Z","totalTestsViral":26131,"positiveTestsViral":null,"negativeTestsViral":null,"positiveCasesViral":134,"deathConfirmed":2,"deathProbable":null,"totalTestEncountersViral":null,"totalTestsPeopleViral":17542,"totalTestsAntibody":null,"positiveTestsAntibody":null,"negativeTestsAntibody":null,"totalTestsPeopleAntibody":null,"positiveTestsPeopleAntibody":null,"negativeTestsPeopleAntibody":null,"totalTestsPeopleAntigen":null,"positiveTestsPeopleAntigen":null,"totalTestsAntigen":null,"positiveTestsAntigen":null,"fips":"69","positiveIncrease":0,"negativeIncrease":0,"total":17563,"totalTestResultsIncrease":0,"posNeg":17563,"dataQualityGrade":null,"deathIncrease":0,"hospitalizedIncrease":0,"hash":"ea4cf4fa095c0d54f759605726e8bd52e145ad30","commercialScore":0,"negativeRegularScore":0,"negativeScore":0,"positiveScore":0,"score":0,"grade":""},{"date":20210213,"state":"MP","positive":134,"probableCases":null,"negative":17429,"pending":null,"totalTestResultsSource":"posNeg","totalTestResults":17563,"hospitalizedCurrently":null,"hospitalizedCumulative":4,"inIcuCurrently":null,"inIcuCumulative":null,"onVentilatorCurrently":null,"onVentilatorCumulative":null,"recovered":29,"lastUpdateEt":"2/12/2021 00:00","dateModified":"2021-02-12T00:00:00Z","checkTimeEt":"02/11 19:00","death":2,"hospitalized":4,"hospitalizedDischarged":null,"dateChecked":"2021-02-12T00:00:00Z","totalTestsViral":26131,"positiveTestsViral":null,"negativeTestsViral":null,"positiveCasesViral":134,"deathConfirmed":2,"deathProbable":null,"totalTestEncountersViral":null,"totalTestsPeopleViral":17542,"totalTestsAntibody":null,"positiveTestsAntibody":null,"negativeTestsAntibody":null,"totalTestsPeopleAntibody":null,"positiveTestsPeopleAntibody":null,"negativeTestsPeopleAntibody":null,"totalTestsPeopleAntigen":null,"positiveTestsPeopleAntigen":null,"totalTestsAntigen":null,"positiveTestsAntigen":null,"fips":"69","positiveIncrease":0,"negativeIncrease":0,"total":17563,"totalTestResultsIncrease":0,"posNeg":17563,"dataQualityGrade":null,"deathIncrease":0,"hospitalizedIncrease":0,"hash":"94ea01c4876efee27016d917491a0d3ed7367c3e","commercialScore":0,"negativeRegularScore":0,"negativeScore":0,"positiveScore":0,"score":0,"grade":""},{"date":20210212,"state":"MP","positive":134,"probableCases":null,"negative":17429,"pending":null,"totalTestResultsSource":"posNeg","totalTestResults":17563,"hospitalizedCurrently":null,"hospitalizedCumulative":4,"inIcuCurrently":null,"inIcuCumulative":null,"onVentilatorCurrently":null,"onVentilatorCumulative":null,"recovered":29,"lastUpdateEt":"2/12/2021 00:00","dateModified":"2021-02-12T00:00:00Z","checkTimeEt":"02/11 19:00","death":2,"hospitalized":4,"hospitalizedDischarged":null,"dateChecked":"2021-02-12T00:00:00Z","totalTestsViral":26131,"positiveTestsViral":null,"negativeTestsViral":null,"positiveCasesViral":134,"deathConfirmed":2,"deathProbable":null,"totalTestEncountersViral":null,"totalTestsPeopleViral":17542,"totalTestsAntibody":null,"positiveTestsAntibody":null,"negativeTestsAntibody":null,"totalTestsPeopleAntibody":null,"positiveTestsPeopleAntibody":null,"negativeTestsPeopleAntibody":null,"totalTestsPeopleAntigen":null,"positiveTestsPeopleAntigen":null,"totalTestsAntigen":null,"positiveTestsAntigen":null,"fips":"69","positiveIncrease":1,"negativeIncrease":0,"total":17563,"totalTestResultsIncrease":1,"posNeg":17563,"dataQualityGrade":null,"deathIncrease":0,"hospitalizedIncrease":0,"hash":"bc3da4903cf1d799aaa70b06f4cf1bed2fd00255","commercialScore":0,"negativeRegularScore":0,"negativeScore":0,"positiveScore":0,"score":0,"grade":""},{"date":20210211,"state":"MP","positive":133,"probableCases":null,"negative":17429,"pending":null,"totalTestResultsSource":"posNeg","totalTestResults":17562,"hospitalizedCurrently":null,"hospitalizedCumulative":4,"inIcuCurrently":null,"inIcuCumulative":null,"onVentilatorCurrently":null,"onVentilatorCumulative":null,"recovered":29,"lastUpdateEt":"2/1/2021 00:00","dateModified":"2021-02-01T00:00:00Z","checkTimeEt":"01/31 19:00","death":2,"hospitalized":4,"hospitalizedDischarged":null,"dateChecked":"2021-02-01T00:00:00Z","totalTestsViral":26131,"positiveTestsViral":null,"negativeTestsViral":null,"positiveCasesViral":133,"deathConfirmed":2,"deathProbable":null,"totalTestEncountersViral":null,"totalTestsPeopleViral":17542,"totalTestsAntibody":null,"positiveTestsAntibody":null,"negativeTestsAntibody":null,"totalTestsPeopleAntibody":null,"positiveTestsPeopleAntibody":null,"negativeTestsPeopleAntibody":null,"totalTestsPeopleAntigen":null,"positiveTestsPeopleAntigen":null,"totalTestsAntigen":null,"positiveTestsAntigen":null,"fips":"69","positiveIncrease":0,"negativeIncrease":0,"total":17562,"totalTestResultsIncrease":0,"posNeg":17562,"dataQualityGrade":null,"deathIncrease":0,"hospitalizedIncrease":0,"hash":"e0b9833814d45a590521ee210d22cf1dda73f2ee","commercialScore":0,"negativeRegularScore":0,"negativeScore":0,"positiveScore":0,"score":0,"grade":""},{"date":20210210,"state":"MP","positive":133,"probableCases":null,"negative":17429,"pending":null,"totalTestResultsSource":"posNeg","totalTestResults":17562,"hospitalizedCurrently":null,"hospitalizedCumulative":4,"inIcuCurrently":null,"inIcuCumulative":null,"onVentilatorCurrently":null,"onVentilatorCumulative":null,"recovered":29,"lastUpdateEt":"2/1/2021 00:00","dateModified":"2021-02-01T00:00:00Z","checkTimeEt":"01/31 19:00","death":2,"hospitalized":4,"hospitalizedDischarged":null,"dateChecked":"2021-02-01T00:00:00Z","totalTestsViral":26131,"positiveTestsViral":null,"negativeTestsViral":null,"positiveCasesViral":133,"deathConfirmed":2,"deathProbable":null,"totalTestEncountersViral":null,"totalTestsPeopleViral":17542,"totalTestsAntibody":null,"positiveTestsAntibody":null,"negativeTestsAntibody":null,"totalTestsPeopleAntibody":null,"positiveTestsPeopleAntibody":null,"negativeTestsPeopleAntibody":null,"totalTestsPeopleAntigen":null,"positiveTestsPeopleAntigen":null,"totalTestsAntigen":null,"positiveTestsAntigen":null,"fips":"69","positiveIncrease":0,"negativeIncrease":0,"total":17562,"totalTestResultsIncrease":0,"posNeg":17562,"dataQualityGrade":null,"deathIncrease":0,"hospitalizedIncrease":0,"hash":"97ab788debf31fa33bab98b7c8a82fae5fa74bad","commercialScore":0,"negativeRegularScore":0,"negativeScore":0,"positiveScore":0,"score":0,"grade":""},{"date":20210209,"state":"MP","positive":133,"probableCases":null,"negative":17429,"pending":null,"totalTestResultsSource":"posNeg","totalTestResults":17562,"hospitalizedCurrently":null,"hospitalizedCumulative":4,"inIcuCurrently":null,"inIcuCumulative":null,"onVentilatorCurrently":null,"onVentilatorCumulative":null,"recovered":29,"lastUpdateEt":"2/1/2021 00:00","dateModified":"2021-02-01T00:00:00Z","checkTimeEt":"01/31 19:00","death":2,"hospitalized":4,"hospitalizedDischarged":null,"dateChecked":"2021-02-01T00:00:00Z","totalTestsViral":26131,"positiveTestsViral":null,"negativeTestsViral":null,"positiveCasesViral":133,"deathConfirmed":2,"deathProbable":null,"totalTestEncountersViral":null,"totalTestsPeopleViral":17542,"totalTestsAntibody":null,"positiveTestsAntibody":null,"negativeTestsAntibody":null,"totalTestsPeopleAntibody":null,"positiveTestsPeopleAntibody":null,"negativeTestsPeopleAntibody":null,"totalTestsPeopleAntigen":null,"positiveTestsPeopleAntigen":null,"totalTestsAntigen":null,"positiveTestsAntigen":null,"fips":"69","positiveIncrease":0,"negativeIncrease":0,"total":17562,"totalTestResultsIncrease":0,"posNeg":17562,"dataQualityGrade":null,"deathIncrease":0,"hospitalizedIncrease":0,"hash":"ef328a3656c88a44648dba45ccfb2e74f09bcd5d","commercialScore":0,"negativeRegularScore":0,"negativeScore":0,"positiveScore":0,"score":0,"grade":""},{"date":20210208,"state":"MP","positive":133,"probableCases":null,"negative":17429,"pending":null,"totalTestResultsSource":"posNeg","totalTestResults":17562,"hospitalizedCurrently":null,"hospitalizedCumulative":4,"inIcuCurrently":null,"inIcuCumulative":null,"onVentilatorCurrently":null,"onVentilatorCumulative":null,"recovered":29,"lastUpdateEt":"2/1/2021 00:00","dateModified":"2021-02-01T00:00:00Z","checkTimeEt":"01/31 19:00","death":2,"hospitalized":4,"hospitalizedDischarged":null,"dateChecked":"2021-02-01T00:00:00Z","totalTestsViral":26131,"positiveTestsViral":null,"negativeTestsViral":null,"positiveCasesViral":133,"deathConfirmed":2,"deathProbable":null,"totalTestEncountersViral":null,"totalTestsPeopleViral":17542,"totalTestsAntibody":null,"positiveTestsAntibody":null,"negativeTestsAntibody":null,"totalTestsPeopleAntibody":null,"positiveTestsPeopleAntibody":null,"negativeTestsPeopleAntibody":null,"totalTestsPeopleAntigen":null,"positiveTestsPeopleAntigen":null,"totalTestsAntigen":null,"positiveTestsAntigen":null,"fips":"69","positiveIncrease":0,"negativeIncrease":0,"total":17562,"totalTestResultsIncrease":0,"posNeg":17562,"dataQualityGrade":null,"deathIncrease":0,"hospitalizedIncrease":0,"hash":"cfc665f0cbc09de2a9ea4e00d81b32e52f66dd86","commercialScore":0,"negativeRegularScore":0,"negativeScore":0,"positiveScore":0,"score":0,"grade":""},{"date":20210207,"state":"MP","positive":133,"probableCases":null,"negative":17429,"pending":null,"totalTestResultsSource":"posNeg","totalTestResults":17562,"hospitalizedCurrently":null,"hospitalizedCumulative":4,"inIcuCurrently":null,"inIcuCumulative":null,"onVentilatorCurrently":null,"onVentilatorCumulative":null,"recovered":29,"lastUpdateEt":"2/1/2021 00:00","dateModified":"2021-02-01T00:00:00Z","checkTimeEt":"01/31 19:00","death":2,"hospitalized":4,"hospitalizedDischarged":null,"dateChecked":"2021-02-01T00:00:00Z","totalTestsViral":26131,"positiveTestsViral":null,"negativeTestsViral":null,"positiveCasesViral":133,"deathConfirmed":2,"deathProbable":null,"totalTestEncountersViral":null,"totalTestsPeopleViral":17542,"totalTestsAntibody":null,"positiveTestsAntibody":null,"negativeTestsAntibody":null,"totalTestsPeopleAntibody":null,"positiveTestsPeopleAntibody":null,"negativeTestsPeopleAntibody":null,"totalTestsPeopleAntigen":null,"positiveTestsPeopleAntigen":null,"totalTestsAntigen":null,"positiveTestsAntigen":null,"fips":"69","positiveIncrease":0,"negativeIncrease":0,"total":17562,"totalTestResultsIncrease":0,"posNeg":17562,"dataQualityGrade":null,"deathIncrease":0,"hospitalizedIncrease":0,"hash":"244ad784bb703c93b2f949c42373bf049b11bcfa","commercialScore":0,"negativeRegularScore":0,"negativeScore":0,"positiveScore":0,"score":0,"grade":""},{"date":20210206,"state":"MP","positive":133,"probableCases":null,"negative":17429,"pending":null,"totalTestResultsSource":"posNeg","totalTestResults":17562,"hospitalizedCurrently":null,"hospitalizedCumulative":4,"inIcuCurrently":null,"inIcuCumulative":null,"onVentilatorCurrently":null,"onVentilatorCumulative":null,"recovered":29,"lastUpdateEt":"2/1/2021 00:00","dateModified":"2021-02-01T00:00:00Z","checkTimeEt":"01/31 19:00","death":2,"hospitalized":4,"hospitalizedDischarged":null,"dateChecked":"2021-02-01T00:00:00Z","totalTestsViral":26131,"positiveTestsViral":null,"negativeTestsViral":null,"positiveCasesViral":133,"deathConfirmed":2,"deathProbable":null,"totalTestEncountersViral":null,"totalTestsPeopleViral":17542,"totalTestsAntibody":null,"positiveTestsAntibody":null,"negativeTestsAntibody":null,"totalTestsPeopleAntibody":null,"positiveTestsPeopleAntibody":null,"negativeTestsPeopleAntibody":null,"totalTestsPeopleAntigen":null,"positiveTestsPeopleAntigen":null,"totalTestsAntigen":null,"positiveTestsAntigen":null,"fips":"69","positiveIncrease":0,"negativeIncrease":0,"total":17562,"totalTestResultsIncrease":0,"posNeg":17562,"dataQualityGrade":null,"deathIncrease":0,"hospitalizedIncrease":0,"hash":"64d5919ca1bd67ad5b82f1d1098c667b19cdde5b","commercialScore":0,"negativeRegularScore":0,"negativeScore":0,"positiveScore":0,"score":0,"grade":""},{"date":20210205,"state":"MP","positive":133,"probableCases":null,"negative":17429,"pending":null,"totalTestResultsSource":"posNeg","totalTestResults":17562,"hospitalizedCurrently":null,"hospitalizedCumulative":4,"inIcuCurrently":null,"inIcuCumulative":null,"onVentilatorCurrently":null,"onVentilatorCumulative":null,"recovered":29,"lastUpdateEt":"2/1/2021 00:00","dateModified":"2021-02-01T00:00:00Z","checkTimeEt":"01/31 19:00","death":2,"hospitalized":4,"hospitalizedDischarged":null,"dateChecked":"2021-02-01T00:00:00Z","totalTestsViral":26131,"positiveTestsViral":null,"negativeTestsViral":null,"positiveCasesViral":133,"deathConfirmed":2,"deathProbable":null,"totalTestEncountersViral":null,"totalTestsPeopleViral":17542,"totalTestsAntibody":null,"positiveTestsAntibody":null,"negativeTestsAntibody":null,"totalTestsPeopleAntibody":null,"positiveTestsPeopleAntibody":null,"negativeTestsPeopleAntibody":null,"totalTestsPeopleAntigen":null,"positiveTestsPeopleAntigen":null,"totalTestsAntigen":null,"positiveTestsAntigen":null,"fips":"69","positiveIncrease":0,"negativeIncrease":0,"total":17562,"totalTestResultsIncrease":0,"posNeg":17562,"dataQualityGrade":null,"deathIncrease":0,"hospitalizedIncrease":0,"hash":"54160f58e6feafbb48a8f64a649c495ce6417886","commercialScore":0,"negativeRegularScore":0,"negativeScore":0,"positiveScore":0,"score":0,"grade":""},{"date":20210204,"state":"MP","positive":133,"probableCases":null,"negative":17429,"pending":null,"totalTestResultsSource":"posNeg","totalTestResults":17562,"hospitalizedCurrently":null,"hospitalizedCumulative":4,"inIcuCurrently":null,"inIcuCumulative":null,"onVentilatorCurrently":null,"onVentilatorCumulative":null,"recovered":29,"lastUpdateEt":"2/1/2021 00:00","dateModified":"2021-02-01T00:00:00Z","checkTimeEt":"01/31 19:00","death":2,"hospitalized":4,"hospitalizedDischarged":null,"dateChecked":"2021-02-01T00:00:00Z","totalTestsViral":26131,"positiveTestsViral":null,"negativeTestsViral":null,"positiveCasesViral":133,"deathConfirmed":2,"deathProbable":null,"totalTestEncountersViral":null,"totalTestsPeopleViral":17542,"totalTestsAntibody":null,"positiveTestsAntibody":null,"negativeTestsAntibody":null,"totalTestsPeopleAntibody":null,"positiveTestsPeopleAntibody":null,"negativeTestsPeopleAntibody":null,"totalTestsPeopleAntigen":null,"positiveTestsPeopleAntigen":null,"totalTestsAntigen":null,"positiveTestsAntigen":null,"fips":"69","positiveIncrease":0,"negativeIncrease":0,"total":17562,"totalTestResultsIncrease":0,"posNeg":17562,"dataQualityGrade":null,"deathIncrease":0,"hospitalizedIncrease":0,"hash":"a5bb3a52cbb145a43cc4c473341b3f28bbbe53b2","commercialScore":0,"negativeRegularScore":0,"negativeScore":0,"positiveScore":0,"score":0,"grade":""},{"date":20210203,"state":"MP","positive":133,"probableCases":null,"negative":17429,"pending":null,"totalTestResultsSource":"posNeg","totalTestResults":17562,"hospitalizedCurrently":null,"hospitalizedCumulative":4,"inIcuCurrently":null,"inIcuCumulative":null,"onVentilatorCurrently":null,"onVentilatorCumulative":null,"recovered":29,"lastUpdateEt":"2/1/2021 00:00","dateModified":"2021-02-01T00:00:00Z","checkTimeEt":"01/31 19:00","death":2,"hospitalized":4,"hospitalizedDischarged":null,"dateChecked":"2021-02-01T00:00:00Z","totalTestsViral":26131,"positiveTestsViral":null,"negativeTestsViral":null,"positiveCasesViral":133,"deathConfirmed":2,"deathProbable":null,"totalTestEncountersViral":null,"totalTestsPeopleViral":17542,"totalTestsAntibody":null,"positiveTestsAntibody":null,"negativeTestsAntibody":null,"totalTestsPeopleAntibody":null,"positiveTestsPeopleAntibody":null,"negativeTestsPeopleAntibody":null,"totalTestsPeopleAntigen":null,"positiveTestsPeopleAntigen":null,"totalTestsAntigen":null,"positiveTestsAntigen":null,"fips":"69","positiveIncrease":0,"negativeIncrease":0,"total":17562,"totalTestResultsIncrease":0,"posNeg":17562,"dataQualityGrade":null,"deathIncrease":0,"hospitalizedIncrease":0,"hash":"33904eff8d5fe1ddf07a54d3fbbceeff152ac2f5","commercialScore":0,"negativeRegularScore":0,"negativeScore":0,"positiveScore":0,"score":0,"grade":""},{"date":20210202,"state":"MP","positive":133,"probableCases":null,"negative":17429,"pending":null,"totalTestResultsSource":"posNeg","totalTestResults":17562,"hospitalizedCurrently":null,"hospitalizedCumulative":4,"inIcuCurrently":null,"inIcuCumulative":null,"onVentilatorCurrently":null,"onVentilatorCumulative":null,"recovered":29,"lastUpdateEt":"2/1/2021 00:00","dateModified":"2021-02-01T00:00:00Z","checkTimeEt":"01/31 19:00","death":2,"hospitalized":4,"hospitalizedDischarged":null,"dateChecked":"2021-02-01T00:00:00Z","totalTestsViral":26131,"positiveTestsViral":null,"negativeTestsViral":null,"positiveCasesViral":133,"deathConfirmed":2,"deathProbable":null,"totalTestEncountersViral":null,"totalTestsPeopleViral":17542,"totalTestsAntibody":null,"positiveTestsAntibody":null,"negativeTestsAntibody":null,"totalTestsPeopleAntibody":null,"positiveTestsPeopleAntibody":null,"negativeTestsPeopleAntibody":null,"totalTestsPeopleAntigen":null,"positiveTestsPeopleAntigen":null,"totalTestsAntigen":null,"positiveTestsAntigen":null,"fips":"69","positiveIncrease":1,"negativeIncrease":0,"total":17562,"totalTestResultsIncrease":1,"posNeg":17562,"dataQualityGrade":null,"deathIncrease":0,"hospitalizedIncrease":0,"hash":"b00d0ab144c09f3bb1abccd33b06d9dc2343634b","commercialScore":0,"negativeRegularScore":0,"negativeScore":0,"positiveScore":0,"score":0,"grade":""},{"date":20210201,"state":"MP","positive":132,"probableCases":null,"negative":17429,"pending":null,"totalTestResultsSource":"posNeg","totalTestResults":17561,"hospitalizedCurrently":null,"hospitalizedCumulative":4,"inIcuCurrently":null,"inIcuCumulative":null,"onVentilatorCurrently":null,"onVentilatorCumulative":null,"recovered":29,"lastUpdateEt":"1/29/2021 00:00","dateModified":"2021-01-29T00:00:00Z","checkTimeEt":"01/28 19:00","death":2,"hospitalized":4,"hospitalizedDischarged":null,"dateChecked":"2021-01-29T00:00:00Z","totalTestsViral":26131,"positiveTestsViral":null,"negativeTestsViral":null,"positiveCasesViral":132,"deathConfirmed":2,"deathProbable":null,"totalTestEncountersViral":null,"totalTestsPeopleViral":17542,"totalTestsAntibody":null,"positiveTestsAntibody":null,"negativeTestsAntibody":null,"totalTestsPeopleAntibody":null,"positiveTestsPeopleAntibody":null,"negativeTestsPeopleAntibody":null,"totalTestsPeopleAntigen":null,"positiveTestsPeopleAntigen":null,"totalTestsAntigen":null,"positiveTestsAntigen":null,"fips":"69","positiveIncrease":0,"negativeIncrease":0,"total":17561,"totalTestResultsIncrease":0,"posNeg":17561,"dataQualityGrade":null,"deathIncrease":0,"hospitalizedIncrease":0,"hash":"46dc1cf50d1ba5b19076cb0ea5ed65a452d2c97b","commercialScore":0,"negativeRegularScore":0,"negativeScore":0,"positiveScore":0,"score":0,"grade":""},{"date":20210131,"state":"MP","positive":132,"probableCases":null,"negative":17429,"pending":null,"totalTestResultsSource":"posNeg","totalTestResults":17561,"hospitalizedCurrently":null,"hospitalizedCumulative":4,"inIcuCurrently":null,"inIcuCumulative":null,"onVentilatorCurrently":null,"onVentilatorCumulative":null,"recovered":29,"lastUpdateEt":"1/29/2021 00:00","dateModified":"2021-01-29T00:00:00Z","checkTimeEt":"01/28 19:00","death":2,"hospitalized":4,"hospitalizedDischarged":null,"dateChecked":"2021-01-29T00:00:00Z","totalTestsViral":26131,"positiveTestsViral":null,"negativeTestsViral":null,"positiveCasesViral":132,"deathConfirmed":2,"deathProbable":null,"totalTestEncountersViral":null,"totalTestsPeopleViral":17542,"totalTestsAntibody":null,"positiveTestsAntibody":null,"negativeTestsAntibody":null,"totalTestsPeopleAntibody":null,"positiveTestsPeopleAntibody":null,"negativeTestsPeopleAntibody":null,"totalTestsPeopleAntigen":null,"positiveTestsPeopleAntigen":null,"totalTestsAntigen":null,"positiveTestsAntigen":null,"fips":"69","positiveIncrease":0,"negativeIncrease":0,"total":17561,"totalTestResultsIncrease":0,"posNeg":17561,"dataQualityGrade":null,"deathIncrease":0,"hospitalizedIncrease":0,"hash":"444e4560de1c00ca7982ef883f4e45ee56b22d80","commercialScore":0,"negativeRegularScore":0,"negativeScore":0,"positiveScore":0,"score":0,"grade":""},{"date":20210130,"state":"MP","positive":132,"probableCases":null,"negative":17429,"pending":null,"totalTestResultsSource":"posNeg","totalTestResults":17561,"hospitalizedCurrently":null,"hospitalizedCumulative":4,"inIcuCurrently":null,"inIcuCumulative":null,"onVentilatorCurrently":null,"onVentilatorCumulative":null,"recovered":29,"lastUpdateEt":"1/29/2021 00:00","dateModified":"2021-01-29T00:00:00Z","checkTimeEt":"01/28 19:00","death":2,"hospitalized":4,"hospitalizedDischarged":null,"dateChecked":"2021-01-29T00:00:00Z","totalTestsViral":26131,"positiveTestsViral":null,"negativeTestsViral":null,"positiveCasesViral":132,"deathConfirmed":2,"deathProbable":null,"totalTestEncountersViral":null,"totalTestsPeopleViral":17542,"totalTestsAntibody":null,"positiveTestsAntibody":null,"negativeTestsAntibody":null,"totalTestsPeopleAntibody":null,"positiveTestsPeopleAntibody":null,"negativeTestsPeopleAntibody":null,"totalTestsPeopleAntigen":null,"positiveTestsPeopleAntigen":null,"totalTestsAntigen":null,"positiveTestsAntigen":null,"fips":"69","positiveIncrease":0,"negativeIncrease":0,"total":17561,"totalTestResultsIncrease":0,"posNeg":17561,"dataQualityGrade":null,"deathIncrease":0,"hospitalizedIncrease":0,"hash":"f9e9e2bc1cca2d7a06ee50e94d4a4ce1dda4a3fb","commercialScore":0,"negativeRegularScore":0,"negativeScore":0,"positiveScore":0,"score":0,"grade":""},{"date":20210129,"state":"MP","positive":132,"probableCases":null,"negative":17429,"pending":null,"totalTestResultsSource":"posNeg","totalTestResults":17561,"hospitalizedCurrently":null,"hospitalizedCumulative":4,"inIcuCurrently":null,"inIcuCumulative":null,"onVentilatorCurrently":null,"onVentilatorCumulative":null,"recovered":29,"lastUpdateEt":"1/29/2021 00:00","dateModified":"2021-01-29T00:00:00Z","checkTimeEt":"01/28 19:00","death":2,"hospitalized":4,"hospitalizedDischarged":null,"dateChecked":"2021-01-29T00:00:00Z","totalTestsViral":26131,"positiveTestsViral":null,"negativeTestsViral":null,"positiveCasesViral":132,"deathConfirmed":2,"deathProbable":null,"totalTestEncountersViral":null,"totalTestsPeopleViral":17542,"totalTestsAntibody":null,"positiveTestsAntibody":null,"negativeTestsAntibody":null,"totalTestsPeopleAntibody":null,"positiveTestsPeopleAntibody":null,"negativeTestsPeopleAntibody":null,"totalTestsPeopleAntigen":null,"positiveTestsPeopleAntigen":null,"totalTestsAntigen":null,"positiveTestsAntigen":null,"fips":"69","positiveIncrease":0,"negativeIncrease":0,"total":17561,"totalTestResultsIncrease":0,"posNeg":17561,"dataQualityGrade":null,"deathIncrease":0,"hospitalizedIncrease":0,"hash":"c96f332d4ba685ff230548ee6e3c09e354cb34b1","commercialScore":0,"negativeRegularScore":0,"negativeScore":0,"positiveScore":0,"score":0,"grade":""},{"date":20210128,"state":"MP","positive":132,"probableCases":null,"negative":17429,"pending":null,"totalTestResultsSource":"posNeg","totalTestResults":17561,"hospitalizedCurrently":null,"hospitalizedCumulative":4,"inIcuCurrently":null,"inIcuCumulative":null,"onVentilatorCurrently":null,"onVentilatorCumulative":null,"recovered":29,"lastUpdateEt":"1/23/2021 00:00","dateModified":"2021-01-23T00:00:00Z","checkTimeEt":"01/22 19:00","death":2,"hospitalized":4,"hospitalizedDischarged":null,"dateChecked":"2021-01-23T00:00:00Z","totalTestsViral":26131,"positiveTestsViral":null,"negativeTestsViral":null,"positiveCasesViral":132,"deathConfirmed":2,"deathProbable":null,"totalTestEncountersViral":null,"totalTestsPeopleViral":17542,"totalTestsAntibody":null,"positiveTestsAntibody":null,"negativeTestsAntibody":null,"totalTestsPeopleAntibody":null,"positiveTestsPeopleAntibody":null,"negativeTestsPeopleAntibody":null,"totalTestsPeopleAntigen":null,"positiveTestsPeopleAntigen":null,"totalTestsAntigen":null,"positiveTestsAntigen":null,"fips":"69","positiveIncrease":0,"negativeIncrease":0,"total":17561,"totalTestResultsIncrease":0,"posNeg":17561,"dataQualityGrade":null,"deathIncrease":0,"hospitalizedIncrease":0,"hash":"e048e74f7359640c43cb89b0470d2c9acbd9cefc","commercialScore":0,"negativeRegularScore":0,"negativeScore":0,"positiveScore":0,"score":0,"grade":""},{"date":20210127,"state":"MP","positive":132,"probableCases":null,"negative":17429,"pending":null,"totalTestResultsSource":"posNeg","totalTestResults":17561,"hospitalizedCurrently":null,"hospitalizedCumulative":4,"inIcuCurrently":null,"inIcuCumulative":null,"onVentilatorCurrently":null,"onVentilatorCumulative":null,"recovered":29,"lastUpdateEt":"1/23/2021 00:00","dateModified":"2021-01-23T00:00:00Z","checkTimeEt":"01/22 19:00","death":2,"hospitalized":4,"hospitalizedDischarged":null,"dateChecked":"2021-01-23T00:00:00Z","totalTestsViral":26131,"positiveTestsViral":null,"negativeTestsViral":null,"positiveCasesViral":132,"deathConfirmed":2,"deathProbable":null,"totalTestEncountersViral":null,"totalTestsPeopleViral":17542,"totalTestsAntibody":null,"positiveTestsAntibody":null,"negativeTestsAntibody":null,"totalTestsPeopleAntibody":null,"positiveTestsPeopleAntibody":null,"negativeTestsPeopleAntibody":null,"totalTestsPeopleAntigen":null,"positiveTestsPeopleAntigen":null,"totalTestsAntigen":null,"positiveTestsAntigen":null,"fips":"69","positiveIncrease":0,"negativeIncrease":0,"total":17561,"totalTestResultsIncrease":0,"posNeg":17561,"dataQualityGrade":null,"deathIncrease":0,"hospitalizedIncrease":0,"hash":"f03085f369e103399240eb28c7a92dc49570c69b","commercialScore":0,"negativeRegularScore":0,"negativeScore":0,"positiveScore":0,"score":0,"grade":""},{"date":20210126,"state":"MP","positive":132,"probableCases":null,"negative":17429,"pending":null,"totalTestResultsSource":"posNeg","totalTestResults":17561,"hospitalizedCurrently":null,"hospitalizedCumulative":4,"inIcuCurrently":null,"inIcuCumulative":null,"onVentilatorCurrently":null,"onVentilatorCumulative":null,"recovered":29,"lastUpdateEt":"1/23/2021 00:00","dateModified":"2021-01-23T00:00:00Z","checkTimeEt":"01/22 19:00","death":2,"hospitalized":4,"hospitalizedDischarged":null,"dateChecked":"2021-01-23T00:00:00Z","totalTestsViral":26131,"positiveTestsViral":null,"negativeTestsViral":null,"positiveCasesViral":132,"deathConfirmed":2,"deathProbable":null,"totalTestEncountersViral":null,"totalTestsPeopleViral":17542,"totalTestsAntibody":null,"positiveTestsAntibody":null,"negativeTestsAntibody":null,"totalTestsPeopleAntibody":null,"positiveTestsPeopleAntibody":null,"negativeTestsPeopleAntibody":null,"totalTestsPeopleAntigen":null,"positiveTestsPeopleAntigen":null,"totalTestsAntigen":null,"positiveTestsAntigen":null,"fips":"69","positiveIncrease":0,"negativeIncrease":0,"total":17561,"totalTestResultsIncrease":0,"posNeg":17561,"dataQualityGrade":null,"deathIncrease":0,"hospitalizedIncrease":0,"hash":"ca7f562c37cdb57feb9bd82f78b91b0a1c0b62e3","commercialScore":0,"negativeRegularScore":0,"negativeScore":0,"positiveScore":0,"score":0,"grade":""},{"date":20210125,"state":"MP","positive":132,"probableCases":null,"negative":17429,"pending":null,"totalTestResultsSource":"posNeg","totalTestResults":17561,"hospitalizedCurrently":null,"hospitalizedCumulative":4,"inIcuCurrently":null,"inIcuCumulative":null,"onVentilatorCurrently":null,"onVentilatorCumulative":null,"recovered":29,"lastUpdateEt":"1/23/2021 00:00","dateModified":"2021-01-23T00:00:00Z","checkTimeEt":"01/22 19:00","death":2,"hospitalized":4,"hospitalizedDischarged":null,"dateChecked":"2021-01-23T00:00:00Z","totalTestsViral":26131,"positiveTestsViral":null,"negativeTestsViral":null,"positiveCasesViral":132,"deathConfirmed":2,"deathProbable":null,"totalTestEncountersViral":null,"totalTestsPeopleViral":17542,"totalTestsAntibody":null,"positiveTestsAntibody":null,"negativeTestsAntibody":null,"totalTestsPeopleAntibody":null,"positiveTestsPeopleAntibody":null,"negativeTestsPeopleAntibody":null,"totalTestsPeopleAntigen":null,"positiveTestsPeopleAntigen":null,"totalTestsAntigen":null,"positiveTestsAntigen":null,"fips":"69","positiveIncrease":3,"negativeIncrease":0,"total":17561,"totalTestResultsIncrease":3,"posNeg":17561,"dataQualityGrade":null,"deathIncrease":0,"hospitalizedIncrease":0,"hash":"a319ad61a485d0fe0c7fa5fd797f540b08469e1e","commercialScore":0,"negativeRegularScore":0,"negativeScore":0,"positiveScore":0,"score":0,"grade":""},{"date":20210124,"state":"MP","positive":129,"probableCases":null,"negative":17429,"pending":null,"totalTestResultsSource":"posNeg","totalTestResults":17558,"hospitalizedCurrently":null,"hospitalizedCumulative":4,"inIcuCurrently":null,"inIcuCumulative":null,"onVentilatorCurrently":null,"onVentilatorCumulative":null,"recovered":29,"lastUpdateEt":"1/21/2021 00:00","dateModified":"2021-01-21T00:00:00Z","checkTimeEt":"01/20 19:00","death":2,"hospitalized":4,"hospitalizedDischarged":null,"dateChecked":"2021-01-21T00:00:00Z","totalTestsViral":26131,"positiveTestsViral":null,"negativeTestsViral":null,"positiveCasesViral":129,"deathConfirmed":2,"deathProbable":null,"totalTestEncountersViral":null,"totalTestsPeopleViral":17542,"totalTestsAntibody":null,"positiveTestsAntibody":null,"negativeTestsAntibody":null,"totalTestsPeopleAntibody":null,"positiveTestsPeopleAntibody":null,"negativeTestsPeopleAntibody":null,"totalTestsPeopleAntigen":null,"positiveTestsPeopleAntigen":null,"totalTestsAntigen":null,"positiveTestsAntigen":null,"fips":"69","positiveIncrease":0,"negativeIncrease":0,"total":17558,"totalTestResultsIncrease":0,"posNeg":17558,"dataQualityGrade":null,"deathIncrease":0,"hospitalizedIncrease":0,"hash":"b18c5b43f7683633eb93b22108113f82d352755d","commercialScore":0,"negativeRegularScore":0,"negativeScore":0,"positiveScore":0,"score":0,"grade":""},{"date":20210123,"state":"MP","positive":129,"probableCases":null,"negative":17429,"pending":null,"totalTestResultsSource":"posNeg","totalTestResults":17558,"hospitalizedCurrently":null,"hospitalizedCumulative":4,"inIcuCurrently":null,"inIcuCumulative":null,"onVentilatorCurrently":null,"onVentilatorCumulative":null,"recovered":29,"lastUpdateEt":"1/21/2021 00:00","dateModified":"2021-01-21T00:00:00Z","checkTimeEt":"01/20 19:00","death":2,"hospitalized":4,"hospitalizedDischarged":null,"dateChecked":"2021-01-21T00:00:00Z","totalTestsViral":26131,"positiveTestsViral":null,"negativeTestsViral":null,"positiveCasesViral":129,"deathConfirmed":2,"deathProbable":null,"totalTestEncountersViral":null,"totalTestsPeopleViral":17542,"totalTestsAntibody":null,"positiveTestsAntibody":null,"negativeTestsAntibody":null,"totalTestsPeopleAntibody":null,"positiveTestsPeopleAntibody":null,"negativeTestsPeopleAntibody":null,"totalTestsPeopleAntigen":null,"positiveTestsPeopleAntigen":null,"totalTestsAntigen":null,"positiveTestsAntigen":null,"fips":"69","positiveIncrease":0,"negativeIncrease":0,"total":17558,"totalTestResultsIncrease":0,"posNeg":17558,"dataQualityGrade":null,"deathIncrease":0,"hospitalizedIncrease":0,"hash":"59ee13c0b96f96d4d6e135b3e2b71275ce99f357","commercialScore":0,"negativeRegularScore":0,"negativeScore":0,"positiveScore":0,"score":0,"grade":""},{"date":20210122,"state":"MP","positive":129,"probableCases":null,"negative":17429,"pending":null,"totalTestResultsSource":"posNeg","totalTestResults":17558,"hospitalizedCurrently":null,"hospitalizedCumulative":4,"inIcuCurrently":null,"inIcuCumulative":null,"onVentilatorCurrently":null,"onVentilatorCumulative":null,"recovered":29,"lastUpdateEt":"1/21/2021 00:00","dateModified":"2021-01-21T00:00:00Z","checkTimeEt":"01/20 19:00","death":2,"hospitalized":4,"hospitalizedDischarged":null,"dateChecked":"2021-01-21T00:00:00Z","totalTestsViral":26131,"positiveTestsViral":null,"negativeTestsViral":null,"positiveCasesViral":129,"deathConfirmed":2,"deathProbable":null,"totalTestEncountersViral":null,"totalTestsPeopleViral":17542,"totalTestsAntibody":null,"positiveTestsAntibody":null,"negativeTestsAntibody":null,"totalTestsPeopleAntibody":null,"positiveTestsPeopleAntibody":null,"negativeTestsPeopleAntibody":null,"totalTestsPeopleAntigen":null,"positiveTestsPeopleAntigen":null,"totalTestsAntigen":null,"positiveTestsAntigen":null,"fips":"69","positiveIncrease":0,"negativeIncrease":0,"total":17558,"totalTestResultsIncrease":0,"posNeg":17558,"dataQualityGrade":null,"deathIncrease":0,"hospitalizedIncrease":0,"hash":"c5af7412266ac6b5d0d1236e21465d8f8c6e09bf","commercialScore":0,"negativeRegularScore":0,"negativeScore":0,"positiveScore":0,"score":0,"grade":""},{"date":20210121,"state":"MP","positive":129,"probableCases":null,"negative":17429,"pending":null,"totalTestResultsSource":"posNeg","totalTestResults":17558,"hospitalizedCurrently":null,"hospitalizedCumulative":4,"inIcuCurrently":null,"inIcuCumulative":null,"onVentilatorCurrently":null,"onVentilatorCumulative":null,"recovered":29,"lastUpdateEt":"1/21/2021 00:00","dateModified":"2021-01-21T00:00:00Z","checkTimeEt":"01/20 19:00","death":2,"hospitalized":4,"hospitalizedDischarged":null,"dateChecked":"2021-01-21T00:00:00Z","totalTestsViral":26131,"positiveTestsViral":null,"negativeTestsViral":null,"positiveCasesViral":129,"deathConfirmed":2,"deathProbable":null,"totalTestEncountersViral":null,"totalTestsPeopleViral":17542,"totalTestsAntibody":null,"positiveTestsAntibody":null,"negativeTestsAntibody":null,"totalTestsPeopleAntibody":null,"positiveTestsPeopleAntibody":null,"negativeTestsPeopleAntibody":null,"totalTestsPeopleAntigen":null,"positiveTestsPeopleAntigen":null,"totalTestsAntigen":null,"positiveTestsAntigen":null,"fips":"69","positiveIncrease":0,"negativeIncrease":0,"total":17558,"totalTestResultsIncrease":0,"posNeg":17558,"dataQualityGrade":null,"deathIncrease":0,"hospitalizedIncrease":0,"hash":"a64586b48c995cf702e89c1407ff275a8afa8da2","commercialScore":0,"negativeRegularScore":0,"negativeScore":0,"positiveScore":0,"score":0,"grade":""},{"date":20210120,"state":"MP","positive":129,"probableCases":null,"negative":17429,"pending":null,"totalTestResultsSource":"posNeg","totalTestResults":17558,"hospitalizedCurrently":null,"hospitalizedCumulative":4,"inIcuCurrently":null,"inIcuCumulative":null,"onVentilatorCurrently":null,"onVentilatorCumulative":null,"recovered":29,"lastUpdateEt":"1/16/2021 00:00","dateModified":"2021-01-16T00:00:00Z","checkTimeEt":"01/15 19:00","death":2,"hospitalized":4,"hospitalizedDischarged":null,"dateChecked":"2021-01-16T00:00:00Z","totalTestsViral":26131,"positiveTestsViral":null,"negativeTestsViral":null,"positiveCasesViral":129,"deathConfirmed":2,"deathProbable":null,"totalTestEncountersViral":null,"totalTestsPeopleViral":17542,"totalTestsAntibody":null,"positiveTestsAntibody":null,"negativeTestsAntibody":null,"totalTestsPeopleAntibody":null,"positiveTestsPeopleAntibody":null,"negativeTestsPeopleAntibody":null,"totalTestsPeopleAntigen":null,"positiveTestsPeopleAntigen":null,"totalTestsAntigen":null,"positiveTestsAntigen":null,"fips":"69","positiveIncrease":0,"negativeIncrease":0,"total":17558,"totalTestResultsIncrease":0,"posNeg":17558,"dataQualityGrade":null,"deathIncrease":0,"hospitalizedIncrease":0,"hash":"389449e5782cdb59deb4103d3a21afb8ebf2eca3","commercialScore":0,"negativeRegularScore":0,"negativeScore":0,"positiveScore":0,"score":0,"grade":""},{"date":20210119,"state":"MP","positive":129,"probableCases":null,"negative":17429,"pending":null,"totalTestResultsSource":"posNeg","totalTestResults":17558,"hospitalizedCurrently":null,"hospitalizedCumulative":4,"inIcuCurrently":null,"inIcuCumulative":null,"onVentilatorCurrently":null,"onVentilatorCumulative":null,"recovered":29,"lastUpdateEt":"1/16/2021 00:00","dateModified":"2021-01-16T00:00:00Z","checkTimeEt":"01/15 19:00","death":2,"hospitalized":4,"hospitalizedDischarged":null,"dateChecked":"2021-01-16T00:00:00Z","totalTestsViral":26131,"positiveTestsViral":null,"negativeTestsViral":null,"positiveCasesViral":129,"deathConfirmed":2,"deathProbable":null,"totalTestEncountersViral":null,"totalTestsPeopleViral":17542,"totalTestsAntibody":null,"positiveTestsAntibody":null,"negativeTestsAntibody":null,"totalTestsPeopleAntibody":null,"positiveTestsPeopleAntibody":null,"negativeTestsPeopleAntibody":null,"totalTestsPeopleAntigen":null,"positiveTestsPeopleAntigen":null,"totalTestsAntigen":null,"positiveTestsAntigen":null,"fips":"69","positiveIncrease":1,"negativeIncrease":0,"total":17558,"totalTestResultsIncrease":1,"posNeg":17558,"dataQualityGrade":null,"deathIncrease":0,"hospitalizedIncrease":0,"hash":"38f14ace8fd7d75d1f8269537125d1627776c463","commercialScore":0,"negativeRegularScore":0,"negativeScore":0,"positiveScore":0,"score":0,"grade":""},{"date":20210118,"state":"MP","positive":128,"probableCases":null,"negative":17429,"pending":null,"totalTestResultsSource":"posNeg","totalTestResults":17557,"hospitalizedCurrently":null,"hospitalizedCumulative":4,"inIcuCurrently":null,"inIcuCumulative":null,"onVentilatorCurrently":null,"onVentilatorCumulative":null,"recovered":29,"lastUpdateEt":"1/14/2021 00:00","dateModified":"2021-01-14T00:00:00Z","checkTimeEt":"01/13 19:00","death":2,"hospitalized":4,"hospitalizedDischarged":null,"dateChecked":"2021-01-14T00:00:00Z","totalTestsViral":26131,"positiveTestsViral":null,"negativeTestsViral":null,"positiveCasesViral":128,"deathConfirmed":2,"deathProbable":null,"totalTestEncountersViral":null,"totalTestsPeopleViral":17542,"totalTestsAntibody":null,"positiveTestsAntibody":null,"negativeTestsAntibody":null,"totalTestsPeopleAntibody":null,"positiveTestsPeopleAntibody":null,"negativeTestsPeopleAntibody":null,"totalTestsPeopleAntigen":null,"positiveTestsPeopleAntigen":null,"totalTestsAntigen":null,"positiveTestsAntigen":null,"fips":"69","positiveIncrease":0,"negativeIncrease":0,"total":17557,"totalTestResultsIncrease":0,"posNeg":17557,"dataQualityGrade":null,"deathIncrease":0,"hospitalizedIncrease":0,"hash":"ed5c1761b62499bd4991194dc320f24eaf9388c9","commercialScore":0,"negativeRegularScore":0,"negativeScore":0,"positiveScore":0,"score":0,"grade":""},{"date":20210117,"state":"MP","positive":128,"probableCases":null,"negative":17429,"pending":null,"totalTestResultsSource":"posNeg","totalTestResults":17557,"hospitalizedCurrently":null,"hospitalizedCumulative":4,"inIcuCurrently":null,"inIcuCumulative":null,"onVentilatorCurrently":null,"onVentilatorCumulative":null,"recovered":29,"lastUpdateEt":"1/14/2021 00:00","dateModified":"2021-01-14T00:00:00Z","checkTimeEt":"01/13 19:00","death":2,"hospitalized":4,"hospitalizedDischarged":null,"dateChecked":"2021-01-14T00:00:00Z","totalTestsViral":26131,"positiveTestsViral":null,"negativeTestsViral":null,"positiveCasesViral":128,"deathConfirmed":2,"deathProbable":null,"totalTestEncountersViral":null,"totalTestsPeopleViral":17542,"totalTestsAntibody":null,"positiveTestsAntibody":null,"negativeTestsAntibody":null,"totalTestsPeopleAntibody":null,"positiveTestsPeopleAntibody":null,"negativeTestsPeopleAntibody":null,"totalTestsPeopleAntigen":null,"positiveTestsPeopleAntigen":null,"totalTestsAntigen":null,"positiveTestsAntigen":null,"fips":"69","positiveIncrease":0,"negativeIncrease":0,"total":17557,"totalTestResultsIncrease":0,"posNeg":17557,"dataQualityGrade":null,"deathIncrease":0,"hospitalizedIncrease":0,"hash":"a0e2cad7e084d552add1812e5cfb77a674bcb7ff","commercialScore":0,"negativeRegularScore":0,"negativeScore":0,"positiveScore":0,"score":0,"grade":""},{"date":20210116,"state":"MP","positive":128,"probableCases":null,"negative":17429,"pending":null,"totalTestResultsSource":"posNeg","totalTestResults":17557,"hospitalizedCurrently":null,"hospitalizedCumulative":4,"inIcuCurrently":null,"inIcuCumulative":null,"onVentilatorCurrently":null,"onVentilatorCumulative":null,"recovered":29,"lastUpdateEt":"1/14/2021 00:00","dateModified":"2021-01-14T00:00:00Z","checkTimeEt":"01/13 19:00","death":2,"hospitalized":4,"hospitalizedDischarged":null,"dateChecked":"2021-01-14T00:00:00Z","totalTestsViral":26131,"positiveTestsViral":null,"negativeTestsViral":null,"positiveCasesViral":128,"deathConfirmed":2,"deathProbable":null,"totalTestEncountersViral":null,"totalTestsPeopleViral":17542,"totalTestsAntibody":null,"positiveTestsAntibody":null,"negativeTestsAntibody":null,"totalTestsPeopleAntibody":null,"positiveTestsPeopleAntibody":null,"negativeTestsPeopleAntibody":null,"totalTestsPeopleAntigen":null,"positiveTestsPeopleAntigen":null,"totalTestsAntigen":null,"positiveTestsAntigen":null,"fips":"69","positiveIncrease":0,"negativeIncrease":0,"total":17557,"totalTestResultsIncrease":0,"posNeg":17557,"dataQualityGrade":null,"deathIncrease":0,"hospitalizedIncrease":0,"hash":"356c4ab157251cae394eac84d7d5c682b4d94796","commercialScore":0,"negativeRegularScore":0,"negativeScore":0,"positiveScore":0,"score":0,"grade":""},{"date":20210115,"state":"MP","positive":128,"probableCases":null,"negative":17429,"pending":null,"totalTestResultsSource":"posNeg","totalTestResults":17557,"hospitalizedCurrently":null,"hospitalizedCumulative":4,"inIcuCurrently":null,"inIcuCumulative":null,"onVentilatorCurrently":null,"onVentilatorCumulative":null,"recovered":29,"lastUpdateEt":"1/14/2021 00:00","dateModified":"2021-01-14T00:00:00Z","checkTimeEt":"01/13 19:00","death":2,"hospitalized":4,"hospitalizedDischarged":null,"dateChecked":"2021-01-14T00:00:00Z","totalTestsViral":26131,"positiveTestsViral":null,"negativeTestsViral":null,"positiveCasesViral":128,"deathConfirmed":2,"deathProbable":null,"totalTestEncountersViral":null,"totalTestsPeopleViral":17542,"totalTestsAntibody":null,"positiveTestsAntibody":null,"negativeTestsAntibody":null,"totalTestsPeopleAntibody":null,"positiveTestsPeopleAntibody":null,"negativeTestsPeopleAntibody":null,"totalTestsPeopleAntigen":null,"positiveTestsPeopleAntigen":null,"totalTestsAntigen":null,"positiveTestsAntigen":null,"fips":"69","positiveIncrease":0,"negativeIncrease":0,"total":17557,"totalTestResultsIncrease":0,"posNeg":17557,"dataQualityGrade":null,"deathIncrease":0,"hospitalizedIncrease":0,"hash":"38ff9e3f99a21a6ccaee4c2fc40bfef8b32d7e13","commercialScore":0,"negativeRegularScore":0,"negativeScore":0,"positiveScore":0,"score":0,"grade":""},{"date":20210114,"state":"MP","positive":128,"probableCases":null,"negative":17429,"pending":null,"totalTestResultsSource":"posNeg","totalTestResults":17557,"hospitalizedCurrently":null,"hospitalizedCumulative":4,"inIcuCurrently":null,"inIcuCumulative":null,"onVentilatorCurrently":null,"onVentilatorCumulative":null,"recovered":29,"lastUpdateEt":"1/11/2021 00:00","dateModified":"2021-01-11T00:00:00Z","checkTimeEt":"01/10 19:00","death":2,"hospitalized":4,"hospitalizedDischarged":null,"dateChecked":"2021-01-11T00:00:00Z","totalTestsViral":26131,"positiveTestsViral":null,"negativeTestsViral":null,"positiveCasesViral":128,"deathConfirmed":2,"deathProbable":null,"totalTestEncountersViral":null,"totalTestsPeopleViral":17542,"totalTestsAntibody":null,"positiveTestsAntibody":null,"negativeTestsAntibody":null,"totalTestsPeopleAntibody":null,"positiveTestsPeopleAntibody":null,"negativeTestsPeopleAntibody":null,"totalTestsPeopleAntigen":null,"positiveTestsPeopleAntigen":null,"totalTestsAntigen":null,"positiveTestsAntigen":null,"fips":"69","positiveIncrease":0,"negativeIncrease":0,"total":17557,"totalTestResultsIncrease":0,"posNeg":17557,"dataQualityGrade":null,"deathIncrease":0,"hospitalizedIncrease":0,"hash":"e4c33dc2ed22e49a9c44b60632f2a97018b9a7b6","commercialScore":0,"negativeRegularScore":0,"negativeScore":0,"positiveScore":0,"score":0,"grade":""},{"date":20210113,"state":"MP","positive":128,"probableCases":null,"negative":17429,"pending":null,"totalTestResultsSource":"posNeg","totalTestResults":17557,"hospitalizedCurrently":null,"hospitalizedCumulative":4,"inIcuCurrently":null,"inIcuCumulative":null,"onVentilatorCurrently":null,"onVentilatorCumulative":null,"recovered":29,"lastUpdateEt":"1/11/2021 00:00","dateModified":"2021-01-11T00:00:00Z","checkTimeEt":"01/10 19:00","death":2,"hospitalized":4,"hospitalizedDischarged":null,"dateChecked":"2021-01-11T00:00:00Z","totalTestsViral":26131,"positiveTestsViral":null,"negativeTestsViral":null,"positiveCasesViral":128,"deathConfirmed":2,"deathProbable":null,"totalTestEncountersViral":null,"totalTestsPeopleViral":17542,"totalTestsAntibody":null,"positiveTestsAntibody":null,"negativeTestsAntibody":null,"totalTestsPeopleAntibody":null,"positiveTestsPeopleAntibody":null,"negativeTestsPeopleAntibody":null,"totalTestsPeopleAntigen":null,"positiveTestsPeopleAntigen":null,"totalTestsAntigen":null,"positiveTestsAntigen":null,"fips":"69","positiveIncrease":0,"negativeIncrease":0,"total":17557,"totalTestResultsIncrease":0,"posNeg":17557,"dataQualityGrade":null,"deathIncrease":0,"hospitalizedIncrease":0,"hash":"871ff92b136bfcef272963e06c162a1d132d4808","commercialScore":0,"negativeRegularScore":0,"negativeScore":0,"positiveScore":0,"score":0,"grade":""},{"date":20210112,"state":"MP","positive":128,"probableCases":null,"negative":17429,"pending":null,"totalTestResultsSource":"posNeg","totalTestResults":17557,"hospitalizedCurrently":null,"hospitalizedCumulative":4,"inIcuCurrently":null,"inIcuCumulative":null,"onVentilatorCurrently":null,"onVentilatorCumulative":null,"recovered":29,"lastUpdateEt":"1/11/2021 00:00","dateModified":"2021-01-11T00:00:00Z","checkTimeEt":"01/10 19:00","death":2,"hospitalized":4,"hospitalizedDischarged":null,"dateChecked":"2021-01-11T00:00:00Z","totalTestsViral":26131,"positiveTestsViral":null,"negativeTestsViral":null,"positiveCasesViral":128,"deathConfirmed":2,"deathProbable":null,"totalTestEncountersViral":null,"totalTestsPeopleViral":17542,"totalTestsAntibody":null,"positiveTestsAntibody":null,"negativeTestsAntibody":null,"totalTestsPeopleAntibody":null,"positiveTestsPeopleAntibody":null,"negativeTestsPeopleAntibody":null,"totalTestsPeopleAntigen":null,"positiveTestsPeopleAntigen":null,"totalTestsAntigen":null,"positiveTestsAntigen":null,"fips":"69","positiveIncrease":3,"negativeIncrease":0,"total":17557,"totalTestResultsIncrease":3,"posNeg":17557,"dataQualityGrade":null,"deathIncrease":0,"hospitalizedIncrease":0,"hash":"086150fc65ef52745bead797f69a27c3624d7b70","commercialScore":0,"negativeRegularScore":0,"negativeScore":0,"positiveScore":0,"score":0,"grade":""},{"date":20210111,"state":"MP","positive":125,"probableCases":null,"negative":17429,"pending":null,"totalTestResultsSource":"posNeg","totalTestResults":17554,"hospitalizedCurrently":null,"hospitalizedCumulative":4,"inIcuCurrently":null,"inIcuCumulative":null,"onVentilatorCurrently":null,"onVentilatorCumulative":null,"recovered":29,"lastUpdateEt":"1/6/2021 00:00","dateModified":"2021-01-06T00:00:00Z","checkTimeEt":"01/05 19:00","death":2,"hospitalized":4,"hospitalizedDischarged":null,"dateChecked":"2021-01-06T00:00:00Z","totalTestsViral":26131,"positiveTestsViral":null,"negativeTestsViral":null,"positiveCasesViral":125,"deathConfirmed":2,"deathProbable":null,"totalTestEncountersViral":null,"totalTestsPeopleViral":17542,"totalTestsAntibody":null,"positiveTestsAntibody":null,"negativeTestsAntibody":null,"totalTestsPeopleAntibody":null,"positiveTestsPeopleAntibody":null,"negativeTestsPeopleAntibody":null,"totalTestsPeopleAntigen":null,"positiveTestsPeopleAntigen":null,"totalTestsAntigen":null,"positiveTestsAntigen":null,"fips":"69","positiveIncrease":0,"negativeIncrease":0,"total":17554,"totalTestResultsIncrease":0,"posNeg":17554,"dataQualityGrade":null,"deathIncrease":0,"hospitalizedIncrease":0,"hash":"e898047d40f4729329169946bdc3444f4f28d1ae","commercialScore":0,"negativeRegularScore":0,"negativeScore":0,"positiveScore":0,"score":0,"grade":""},{"date":20210110,"state":"MP","positive":125,"probableCases":null,"negative":17429,"pending":null,"totalTestResultsSource":"posNeg","totalTestResults":17554,"hospitalizedCurrently":null,"hospitalizedCumulative":4,"inIcuCurrently":null,"inIcuCumulative":null,"onVentilatorCurrently":null,"onVentilatorCumulative":null,"recovered":29,"lastUpdateEt":"1/6/2021 00:00","dateModified":"2021-01-06T00:00:00Z","checkTimeEt":"01/05 19:00","death":2,"hospitalized":4,"hospitalizedDischarged":null,"dateChecked":"2021-01-06T00:00:00Z","totalTestsViral":26131,"positiveTestsViral":null,"negativeTestsViral":null,"positiveCasesViral":125,"deathConfirmed":2,"deathProbable":null,"totalTestEncountersViral":null,"totalTestsPeopleViral":17542,"totalTestsAntibody":null,"positiveTestsAntibody":null,"negativeTestsAntibody":null,"totalTestsPeopleAntibody":null,"positiveTestsPeopleAntibody":null,"negativeTestsPeopleAntibody":null,"totalTestsPeopleAntigen":null,"positiveTestsPeopleAntigen":null,"totalTestsAntigen":null,"positiveTestsAntigen":null,"fips":"69","positiveIncrease":0,"negativeIncrease":0,"total":17554,"totalTestResultsIncrease":0,"posNeg":17554,"dataQualityGrade":null,"deathIncrease":0,"hospitalizedIncrease":0,"hash":"f1c0718f0040fd5da47593e69a0d21821a918e9c","commercialScore":0,"negativeRegularScore":0,"negativeScore":0,"positiveScore":0,"score":0,"grade":""},{"date":20210109,"state":"MP","positive":125,"probableCases":null,"negative":17429,"pending":null,"totalTestResultsSource":"posNeg","totalTestResults":17554,"hospitalizedCurrently":null,"hospitalizedCumulative":4,"inIcuCurrently":null,"inIcuCumulative":null,"onVentilatorCurrently":null,"onVentilatorCumulative":null,"recovered":29,"lastUpdateEt":"1/6/2021 00:00","dateModified":"2021-01-06T00:00:00Z","checkTimeEt":"01/05 19:00","death":2,"hospitalized":4,"hospitalizedDischarged":null,"dateChecked":"2021-01-06T00:00:00Z","totalTestsViral":26131,"positiveTestsViral":null,"negativeTestsViral":null,"positiveCasesViral":125,"deathConfirmed":2,"deathProbable":null,"totalTestEncountersViral":null,"totalTestsPeopleViral":17542,"totalTestsAntibody":null,"positiveTestsAntibody":null,"negativeTestsAntibody":null,"totalTestsPeopleAntibody":null,"positiveTestsPeopleAntibody":null,"negativeTestsPeopleAntibody":null,"totalTestsPeopleAntigen":null,"positiveTestsPeopleAntigen":null,"totalTestsAntigen":null,"positiveTestsAntigen":null,"fips":"69","positiveIncrease":0,"negativeIncrease":0,"total":17554,"totalTestResultsIncrease":0,"posNeg":17554,"dataQualityGrade":null,"deathIncrease":0,"hospitalizedIncrease":0,"hash":"10cbb706282798b11d5174ed0d96c3a58450c9f7","commercialScore":0,"negativeRegularScore":0,"negativeScore":0,"positiveScore":0,"score":0,"grade":""},{"date":20210108,"state":"MP","positive":125,"probableCases":null,"negative":17429,"pending":null,"totalTestResultsSource":"posNeg","totalTestResults":17554,"hospitalizedCurrently":null,"hospitalizedCumulative":4,"inIcuCurrently":null,"inIcuCumulative":null,"onVentilatorCurrently":null,"onVentilatorCumulative":null,"recovered":29,"lastUpdateEt":"1/6/2021 00:00","dateModified":"2021-01-06T00:00:00Z","checkTimeEt":"01/05 19:00","death":2,"hospitalized":4,"hospitalizedDischarged":null,"dateChecked":"2021-01-06T00:00:00Z","totalTestsViral":26131,"positiveTestsViral":null,"negativeTestsViral":null,"positiveCasesViral":125,"deathConfirmed":2,"deathProbable":null,"totalTestEncountersViral":null,"totalTestsPeopleViral":17542,"totalTestsAntibody":null,"positiveTestsAntibody":null,"negativeTestsAntibody":null,"totalTestsPeopleAntibody":null,"positiveTestsPeopleAntibody":null,"negativeTestsPeopleAntibody":null,"totalTestsPeopleAntigen":null,"positiveTestsPeopleAntigen":null,"totalTestsAntigen":null,"positiveTestsAntigen":null,"fips":"69","positiveIncrease":0,"negativeIncrease":0,"total":17554,"totalTestResultsIncrease":0,"posNeg":17554,"dataQualityGrade":null,"deathIncrease":0,"hospitalizedIncrease":0,"hash":"f55b75f5baf536c1e9296b39c63a47b92a2f28f2","commercialScore":0,"negativeRegularScore":0,"negativeScore":0,"positiveScore":0,"score":0,"grade":""},{"date":20210107,"state":"MP","positive":125,"probableCases":null,"negative":17429,"pending":null,"totalTestResultsSource":"posNeg","totalTestResults":17554,"hospitalizedCurrently":null,"hospitalizedCumulative":4,"inIcuCurrently":null,"inIcuCumulative":null,"onVentilatorCurrently":null,"onVentilatorCumulative":null,"recovered":29,"lastUpdateEt":"1/6/2021 00:00","dateModified":"2021-01-06T00:00:00Z","checkTimeEt":"01/05 19:00","death":2,"hospitalized":4,"hospitalizedDischarged":null,"dateChecked":"2021-01-06T00:00:00Z","totalTestsViral":26131,"positiveTestsViral":null,"negativeTestsViral":null,"positiveCasesViral":125,"deathConfirmed":2,"deathProbable":null,"totalTestEncountersViral":null,"totalTestsPeopleViral":17542,"totalTestsAntibody":null,"positiveTestsAntibody":null,"negativeTestsAntibody":null,"totalTestsPeopleAntibody":null,"positiveTestsPeopleAntibody":null,"negativeTestsPeopleAntibody":null,"totalTestsPeopleAntigen":null,"positiveTestsPeopleAntigen":null,"totalTestsAntigen":null,"positiveTestsAntigen":null,"fips":"69","positiveIncrease":1,"negativeIncrease":0,"total":17554,"totalTestResultsIncrease":1,"posNeg":17554,"dataQualityGrade":null,"deathIncrease":0,"hospitalizedIncrease":0,"hash":"0772c373fd18974efd7731f00aca632905df4114","commercialScore":0,"negativeRegularScore":0,"negativeScore":0,"positiveScore":0,"score":0,"grade":""},{"date":20210106,"state":"MP","positive":124,"probableCases":null,"negative":17429,"pending":null,"totalTestResultsSource":"posNeg","totalTestResults":17553,"hospitalizedCurrently":null,"hospitalizedCumulative":4,"inIcuCurrently":null,"inIcuCumulative":null,"onVentilatorCurrently":null,"onVentilatorCumulative":null,"recovered":29,"lastUpdateEt":"1/3/2021 00:00","dateModified":"2021-01-03T00:00:00Z","checkTimeEt":"01/02 19:00","death":2,"hospitalized":4,"hospitalizedDischarged":null,"dateChecked":"2021-01-03T00:00:00Z","totalTestsViral":26131,"positiveTestsViral":null,"negativeTestsViral":null,"positiveCasesViral":124,"deathConfirmed":2,"deathProbable":null,"totalTestEncountersViral":null,"totalTestsPeopleViral":17542,"totalTestsAntibody":null,"positiveTestsAntibody":null,"negativeTestsAntibody":null,"totalTestsPeopleAntibody":null,"positiveTestsPeopleAntibody":null,"negativeTestsPeopleAntibody":null,"totalTestsPeopleAntigen":null,"positiveTestsPeopleAntigen":null,"totalTestsAntigen":null,"positiveTestsAntigen":null,"fips":"69","positiveIncrease":2,"negativeIncrease":0,"total":17553,"totalTestResultsIncrease":2,"posNeg":17553,"dataQualityGrade":null,"deathIncrease":0,"hospitalizedIncrease":0,"hash":"3c3d4066794e074f748886a846e6c6e39dc561f0","commercialScore":0,"negativeRegularScore":0,"negativeScore":0,"positiveScore":0,"score":0,"grade":""},{"date":20210105,"state":"MP","positive":122,"probableCases":null,"negative":17429,"pending":null,"totalTestResultsSource":"posNeg","totalTestResults":17551,"hospitalizedCurrently":null,"hospitalizedCumulative":4,"inIcuCurrently":null,"inIcuCumulative":null,"onVentilatorCurrently":null,"onVentilatorCumulative":null,"recovered":29,"lastUpdateEt":"12/30/2020 00:00","dateModified":"2020-12-30T00:00:00Z","checkTimeEt":"12/29 19:00","death":2,"hospitalized":4,"hospitalizedDischarged":null,"dateChecked":"2020-12-30T00:00:00Z","totalTestsViral":26131,"positiveTestsViral":null,"negativeTestsViral":null,"positiveCasesViral":122,"deathConfirmed":2,"deathProbable":null,"totalTestEncountersViral":null,"totalTestsPeopleViral":17542,"totalTestsAntibody":null,"positiveTestsAntibody":null,"negativeTestsAntibody":null,"totalTestsPeopleAntibody":null,"positiveTestsPeopleAntibody":null,"negativeTestsPeopleAntibody":null,"totalTestsPeopleAntigen":null,"positiveTestsPeopleAntigen":null,"totalTestsAntigen":null,"positiveTestsAntigen":null,"fips":"69","positiveIncrease":0,"negativeIncrease":0,"total":17551,"totalTestResultsIncrease":0,"posNeg":17551,"dataQualityGrade":null,"deathIncrease":0,"hospitalizedIncrease":0,"hash":"8e34dd6ebff13be239c398bd64635e9b3fd888b2","commercialScore":0,"negativeRegularScore":0,"negativeScore":0,"positiveScore":0,"score":0,"grade":""},{"date":20210104,"state":"MP","positive":122,"probableCases":null,"negative":17429,"pending":null,"totalTestResultsSource":"posNeg","totalTestResults":17551,"hospitalizedCurrently":null,"hospitalizedCumulative":4,"inIcuCurrently":null,"inIcuCumulative":null,"onVentilatorCurrently":null,"onVentilatorCumulative":null,"recovered":29,"lastUpdateEt":"12/30/2020 00:00","dateModified":"2020-12-30T00:00:00Z","checkTimeEt":"12/29 19:00","death":2,"hospitalized":4,"hospitalizedDischarged":null,"dateChecked":"2020-12-30T00:00:00Z","totalTestsViral":26131,"positiveTestsViral":null,"negativeTestsViral":null,"positiveCasesViral":122,"deathConfirmed":2,"deathProbable":null,"totalTestEncountersViral":null,"totalTestsPeopleViral":17542,"totalTestsAntibody":null,"positiveTestsAntibody":null,"negativeTestsAntibody":null,"totalTestsPeopleAntibody":null,"positiveTestsPeopleAntibody":null,"negativeTestsPeopleAntibody":null,"totalTestsPeopleAntigen":null,"positiveTestsPeopleAntigen":null,"totalTestsAntigen":null,"positiveTestsAntigen":null,"fips":"69","positiveIncrease":0,"negativeIncrease":0,"total":17551,"totalTestResultsIncrease":0,"posNeg":17551,"dataQualityGrade":null,"deathIncrease":0,"hospitalizedIncrease":0,"hash":"ae15e70ff1e6e4de3ad4bc896861ca5122e12b0f","commercialScore":0,"negativeRegularScore":0,"negativeScore":0,"positiveScore":0,"score":0,"grade":""},{"date":20210103,"state":"MP","positive":122,"probableCases":null,"negative":17429,"pending":null,"totalTestResultsSource":"posNeg","totalTestResults":17551,"hospitalizedCurrently":null,"hospitalizedCumulative":4,"inIcuCurrently":null,"inIcuCumulative":null,"onVentilatorCurrently":null,"onVentilatorCumulative":null,"recovered":29,"lastUpdateEt":"12/30/2020 00:00","dateModified":"2020-12-30T00:00:00Z","checkTimeEt":"12/29 19:00","death":2,"hospitalized":4,"hospitalizedDischarged":null,"dateChecked":"2020-12-30T00:00:00Z","totalTestsViral":26131,"positiveTestsViral":null,"negativeTestsViral":null,"positiveCasesViral":122,"deathConfirmed":2,"deathProbable":null,"totalTestEncountersViral":null,"totalTestsPeopleViral":17542,"totalTestsAntibody":null,"positiveTestsAntibody":null,"negativeTestsAntibody":null,"totalTestsPeopleAntibody":null,"positiveTestsPeopleAntibody":null,"negativeTestsPeopleAntibody":null,"totalTestsPeopleAntigen":null,"positiveTestsPeopleAntigen":null,"totalTestsAntigen":null,"positiveTestsAntigen":null,"fips":"69","positiveIncrease":0,"negativeIncrease":0,"total":17551,"totalTestResultsIncrease":0,"posNeg":17551,"dataQualityGrade":null,"deathIncrease":0,"hospitalizedIncrease":0,"hash":"85374e6867bfd68928338fd8d9ebd7b690c1bf45","commercialScore":0,"negativeRegularScore":0,"negativeScore":0,"positiveScore":0,"score":0,"grade":""},{"date":20210102,"state":"MP","positive":122,"probableCases":null,"negative":17429,"pending":null,"totalTestResultsSource":"posNeg","totalTestResults":17551,"hospitalizedCurrently":null,"hospitalizedCumulative":4,"inIcuCurrently":null,"inIcuCumulative":null,"onVentilatorCurrently":null,"onVentilatorCumulative":null,"recovered":29,"lastUpdateEt":"12/30/2020 00:00","dateModified":"2020-12-30T00:00:00Z","checkTimeEt":"12/29 19:00","death":2,"hospitalized":4,"hospitalizedDischarged":null,"dateChecked":"2020-12-30T00:00:00Z","totalTestsViral":26131,"positiveTestsViral":null,"negativeTestsViral":null,"positiveCasesViral":122,"deathConfirmed":2,"deathProbable":null,"totalTestEncountersViral":null,"totalTestsPeopleViral":17542,"totalTestsAntibody":null,"positiveTestsAntibody":null,"negativeTestsAntibody":null,"totalTestsPeopleAntibody":null,"positiveTestsPeopleAntibody":null,"negativeTestsPeopleAntibody":null,"totalTestsPeopleAntigen":null,"positiveTestsPeopleAntigen":null,"totalTestsAntigen":null,"positiveTestsAntigen":null,"fips":"69","positiveIncrease":0,"negativeIncrease":0,"total":17551,"totalTestResultsIncrease":0,"posNeg":17551,"dataQualityGrade":null,"deathIncrease":0,"hospitalizedIncrease":0,"hash":"21ff4c3d2012c4edd9d8bef32bb96c501117c93e","commercialScore":0,"negativeRegularScore":0,"negativeScore":0,"positiveScore":0,"score":0,"grade":""},{"date":20210101,"state":"MP","positive":122,"probableCases":null,"negative":17429,"pending":null,"totalTestResultsSource":"posNeg","totalTestResults":17551,"hospitalizedCurrently":null,"hospitalizedCumulative":4,"inIcuCurrently":null,"inIcuCumulative":null,"onVentilatorCurrently":null,"onVentilatorCumulative":null,"recovered":29,"lastUpdateEt":"12/30/2020 00:00","dateModified":"2020-12-30T00:00:00Z","checkTimeEt":"12/29 19:00","death":2,"hospitalized":4,"hospitalizedDischarged":null,"dateChecked":"2020-12-30T00:00:00Z","totalTestsViral":26131,"positiveTestsViral":null,"negativeTestsViral":null,"positiveCasesViral":122,"deathConfirmed":2,"deathProbable":null,"totalTestEncountersViral":null,"totalTestsPeopleViral":17542,"totalTestsAntibody":null,"positiveTestsAntibody":null,"negativeTestsAntibody":null,"totalTestsPeopleAntibody":null,"positiveTestsPeopleAntibody":null,"negativeTestsPeopleAntibody":null,"totalTestsPeopleAntigen":null,"positiveTestsPeopleAntigen":null,"totalTestsAntigen":null,"positiveTestsAntigen":null,"fips":"69","positiveIncrease":0,"negativeIncrease":0,"total":17551,"totalTestResultsIncrease":0,"posNeg":17551,"dataQualityGrade":null,"deathIncrease":0,"hospitalizedIncrease":0,"hash":"3c0393e26aa6464a4ef8068c236ebf0a16b3ba7e","commercialScore":0,"negativeRegularScore":0,"negativeScore":0,"positiveScore":0,"score":0,"grade":""},{"date":20201231,"state":"MP","positive":122,"probableCases":null,"negative":17429,"pending":null,"totalTestResultsSource":"posNeg","totalTestResults":17551,"hospitalizedCurrently":null,"hospitalizedCumulative":4,"inIcuCurrently":null,"inIcuCumulative":null,"onVentilatorCurrently":null,"onVentilatorCumulative":null,"recovered":29,"lastUpdateEt":"12/30/2020 00:00","dateModified":"2020-12-30T00:00:00Z","checkTimeEt":"12/29 19:00","death":2,"hospitalized":4,"hospitalizedDischarged":null,"dateChecked":"2020-12-30T00:00:00Z","totalTestsViral":26131,"positiveTestsViral":null,"negativeTestsViral":null,"positiveCasesViral":122,"deathConfirmed":2,"deathProbable":null,"totalTestEncountersViral":null,"totalTestsPeopleViral":17542,"totalTestsAntibody":null,"positiveTestsAntibody":null,"negativeTestsAntibody":null,"totalTestsPeopleAntibody":null,"positiveTestsPeopleAntibody":null,"negativeTestsPeopleAntibody":null,"totalTestsPeopleAntigen":null,"positiveTestsPeopleAntigen":null,"totalTestsAntigen":null,"positiveTestsAntigen":null,"fips":"69","positiveIncrease":0,"negativeIncrease":0,"total":17551,"totalTestResultsIncrease":0,"posNeg":17551,"dataQualityGrade":null,"deathIncrease":0,"hospitalizedIncrease":0,"hash":"245317210f4d8e71b7ab01432e67c5bd8f14973b","commercialScore":0,"negativeRegularScore":0,"negativeScore":0,"positiveScore":0,"score":0,"grade":""},{"date":20201230,"state":"MP","positive":122,"probableCases":null,"negative":17429,"pending":null,"totalTestResultsSource":"posNeg","totalTestResults":17551,"hospitalizedCurrently":null,"hospitalizedCumulative":4,"inIcuCurrently":null,"inIcuCumulative":null,"onVentilatorCurrently":null,"onVentilatorCumulative":null,"recovered":29,"lastUpdateEt":"12/30/2020 00:00","dateModified":"2020-12-30T00:00:00Z","checkTimeEt":"12/29 19:00","death":2,"hospitalized":4,"hospitalizedDischarged":null,"dateChecked":"2020-12-30T00:00:00Z","totalTestsViral":26131,"positiveTestsViral":null,"negativeTestsViral":null,"positiveCasesViral":122,"deathConfirmed":2,"deathProbable":null,"totalTestEncountersViral":null,"totalTestsPeopleViral":17542,"totalTestsAntibody":null,"positiveTestsAntibody":null,"negativeTestsAntibody":null,"totalTestsPeopleAntibody":null,"positiveTestsPeopleAntibody":null,"negativeTestsPeopleAntibody":null,"totalTestsPeopleAntigen":null,"positiveTestsPeopleAntigen":null,"totalTestsAntigen":null,"positiveTestsAntigen":null,"fips":"69","positiveIncrease":0,"negativeIncrease":0,"total":17551,"totalTestResultsIncrease":0,"posNeg":17551,"dataQualityGrade":null,"deathIncrease":0,"hospitalizedIncrease":0,"hash":"75266855b4db3b46de8ce14af79e332770ce4b4a","commercialScore":0,"negativeRegularScore":0,"negativeScore":0,"positiveScore":0,"score":0,"grade":""},{"date":20201229,"state":"MP","positive":122,"probableCases":null,"negative":17429,"pending":null,"totalTestResultsSource":"posNeg","totalTestResults":17551,"hospitalizedCurrently":null,"hospitalizedCumulative":4,"inIcuCurrently":null,"inIcuCumulative":null,"onVentilatorCurrently":null,"onVentilatorCumulative":null,"recovered":29,"lastUpdateEt":"12/28/2020 00:00","dateModified":"2020-12-28T00:00:00Z","checkTimeEt":"12/27 19:00","death":2,"hospitalized":4,"hospitalizedDischarged":null,"dateChecked":"2020-12-28T00:00:00Z","totalTestsViral":26131,"positiveTestsViral":null,"negativeTestsViral":null,"positiveCasesViral":122,"deathConfirmed":2,"deathProbable":null,"totalTestEncountersViral":null,"totalTestsPeopleViral":17542,"totalTestsAntibody":null,"positiveTestsAntibody":null,"negativeTestsAntibody":null,"totalTestsPeopleAntibody":null,"positiveTestsPeopleAntibody":null,"negativeTestsPeopleAntibody":null,"totalTestsPeopleAntigen":null,"positiveTestsPeopleAntigen":null,"totalTestsAntigen":null,"positiveTestsAntigen":null,"fips":"69","positiveIncrease":0,"negativeIncrease":0,"total":17551,"totalTestResultsIncrease":0,"posNeg":17551,"dataQualityGrade":null,"deathIncrease":0,"hospitalizedIncrease":0,"hash":"479ecc54c1f021fc7bd02b4d361311022fee74d1","commercialScore":0,"negativeRegularScore":0,"negativeScore":0,"positiveScore":0,"score":0,"grade":""},{"date":20201228,"state":"MP","positive":122,"probableCases":null,"negative":17429,"pending":null,"totalTestResultsSource":"posNeg","totalTestResults":17551,"hospitalizedCurrently":null,"hospitalizedCumulative":4,"inIcuCurrently":null,"inIcuCumulative":null,"onVentilatorCurrently":null,"onVentilatorCumulative":null,"recovered":29,"lastUpdateEt":"12/27/2020 00:00","dateModified":"2020-12-27T00:00:00Z","checkTimeEt":"12/26 19:00","death":2,"hospitalized":4,"hospitalizedDischarged":null,"dateChecked":"2020-12-27T00:00:00Z","totalTestsViral":26131,"positiveTestsViral":null,"negativeTestsViral":null,"positiveCasesViral":122,"deathConfirmed":2,"deathProbable":null,"totalTestEncountersViral":null,"totalTestsPeopleViral":17542,"totalTestsAntibody":null,"positiveTestsAntibody":null,"negativeTestsAntibody":null,"totalTestsPeopleAntibody":null,"positiveTestsPeopleAntibody":null,"negativeTestsPeopleAntibody":null,"totalTestsPeopleAntigen":null,"positiveTestsPeopleAntigen":null,"totalTestsAntigen":null,"positiveTestsAntigen":null,"fips":"69","positiveIncrease":0,"negativeIncrease":0,"total":17551,"totalTestResultsIncrease":0,"posNeg":17551,"dataQualityGrade":null,"deathIncrease":0,"hospitalizedIncrease":0,"hash":"55e5c54f903917cb0c73c1733e57a644329d83ed","commercialScore":0,"negativeRegularScore":0,"negativeScore":0,"positiveScore":0,"score":0,"grade":""},{"date":20201227,"state":"MP","positive":122,"probableCases":null,"negative":17429,"pending":null,"totalTestResultsSource":"posNeg","totalTestResults":17551,"hospitalizedCurrently":null,"hospitalizedCumulative":4,"inIcuCurrently":null,"inIcuCumulative":null,"onVentilatorCurrently":null,"onVentilatorCumulative":null,"recovered":29,"lastUpdateEt":"12/25/2020 00:00","dateModified":"2020-12-25T00:00:00Z","checkTimeEt":"12/24 19:00","death":2,"hospitalized":4,"hospitalizedDischarged":null,"dateChecked":"2020-12-25T00:00:00Z","totalTestsViral":26131,"positiveTestsViral":null,"negativeTestsViral":null,"positiveCasesViral":122,"deathConfirmed":2,"deathProbable":null,"totalTestEncountersViral":null,"totalTestsPeopleViral":17542,"totalTestsAntibody":null,"positiveTestsAntibody":null,"negativeTestsAntibody":null,"totalTestsPeopleAntibody":null,"positiveTestsPeopleAntibody":null,"negativeTestsPeopleAntibody":null,"totalTestsPeopleAntigen":null,"positiveTestsPeopleAntigen":null,"totalTestsAntigen":null,"positiveTestsAntigen":null,"fips":"69","positiveIncrease":0,"negativeIncrease":0,"total":17551,"totalTestResultsIncrease":0,"posNeg":17551,"dataQualityGrade":null,"deathIncrease":0,"hospitalizedIncrease":0,"hash":"e8b02cb8696dc0e437e182e074f2a6da19b08e25","commercialScore":0,"negativeRegularScore":0,"negativeScore":0,"positiveScore":0,"score":0,"grade":""},{"date":20201226,"state":"MP","positive":122,"probableCases":null,"negative":17429,"pending":null,"totalTestResultsSource":"posNeg","totalTestResults":17551,"hospitalizedCurrently":null,"hospitalizedCumulative":4,"inIcuCurrently":null,"inIcuCumulative":null,"onVentilatorCurrently":null,"onVentilatorCumulative":null,"recovered":29,"lastUpdateEt":"12/25/2020 00:00","dateModified":"2020-12-25T00:00:00Z","checkTimeEt":"12/24 19:00","death":2,"hospitalized":4,"hospitalizedDischarged":null,"dateChecked":"2020-12-25T00:00:00Z","totalTestsViral":26131,"positiveTestsViral":null,"negativeTestsViral":null,"positiveCasesViral":122,"deathConfirmed":2,"deathProbable":null,"totalTestEncountersViral":null,"totalTestsPeopleViral":17542,"totalTestsAntibody":null,"positiveTestsAntibody":null,"negativeTestsAntibody":null,"totalTestsPeopleAntibody":null,"positiveTestsPeopleAntibody":null,"negativeTestsPeopleAntibody":null,"totalTestsPeopleAntigen":null,"positiveTestsPeopleAntigen":null,"totalTestsAntigen":null,"positiveTestsAntigen":null,"fips":"69","positiveIncrease":4,"negativeIncrease":0,"total":17551,"totalTestResultsIncrease":4,"posNeg":17551,"dataQualityGrade":null,"deathIncrease":0,"hospitalizedIncrease":0,"hash":"43255baa220dfd6670e76be1a19e2499726996bb","commercialScore":0,"negativeRegularScore":0,"negativeScore":0,"positiveScore":0,"score":0,"grade":""},{"date":20201225,"state":"MP","positive":118,"probableCases":null,"negative":17429,"pending":null,"totalTestResultsSource":"posNeg","totalTestResults":17547,"hospitalizedCurrently":null,"hospitalizedCumulative":4,"inIcuCurrently":null,"inIcuCumulative":null,"onVentilatorCurrently":null,"onVentilatorCumulative":null,"recovered":29,"lastUpdateEt":"12/23/2020 00:00","dateModified":"2020-12-23T00:00:00Z","checkTimeEt":"12/22 19:00","death":2,"hospitalized":4,"hospitalizedDischarged":null,"dateChecked":"2020-12-23T00:00:00Z","totalTestsViral":26131,"positiveTestsViral":null,"negativeTestsViral":null,"positiveCasesViral":118,"deathConfirmed":2,"deathProbable":null,"totalTestEncountersViral":null,"totalTestsPeopleViral":17542,"totalTestsAntibody":null,"positiveTestsAntibody":null,"negativeTestsAntibody":null,"totalTestsPeopleAntibody":null,"positiveTestsPeopleAntibody":null,"negativeTestsPeopleAntibody":null,"totalTestsPeopleAntigen":null,"positiveTestsPeopleAntigen":null,"totalTestsAntigen":null,"positiveTestsAntigen":null,"fips":"69","positiveIncrease":0,"negativeIncrease":0,"total":17547,"totalTestResultsIncrease":0,"posNeg":17547,"dataQualityGrade":null,"deathIncrease":0,"hospitalizedIncrease":0,"hash":"72bb0ef688d9fcde457cbf1ef9bbc73aaa507c0b","commercialScore":0,"negativeRegularScore":0,"negativeScore":0,"positiveScore":0,"score":0,"grade":""},{"date":20201224,"state":"MP","positive":118,"probableCases":null,"negative":17429,"pending":null,"totalTestResultsSource":"posNeg","totalTestResults":17547,"hospitalizedCurrently":null,"hospitalizedCumulative":4,"inIcuCurrently":null,"inIcuCumulative":null,"onVentilatorCurrently":null,"onVentilatorCumulative":null,"recovered":29,"lastUpdateEt":"12/23/2020 00:00","dateModified":"2020-12-23T00:00:00Z","checkTimeEt":"12/22 19:00","dea